projects/hipblaslt/library/src/amd_detail/rocblaslt/src/Tensile/Logic/asm_full/aquavanjaram/gfx942/GridBased/aquavanjaram942_Cijk_Alik_Bljk_CB.yaml
- {MinimumRequiredVersion: 5.0.0}
- aquavanjaram942
- gfx942
- [Device 0049, Device 0050]
    SolutionIndex: 0
    SolutionNameMin: Cijk_Alik_Bljk_CB_UserArgs_MT128x128x4_MI32x32x2x1_SN_FL0_GLS0_LBSPP0_LPA1_LPB1_MIAV0_NTC3_ONLL2_PGR2_PLR1_SU0_SUS0_TLDS0_UMLDSA0_UMLDSB0_WGM12
    SolutionIndex: 1
    SolutionNameMin: Cijk_Alik_Bljk_CB_UserArgs_MT128x128x4_MI32x32x2x1_SN_FL0_GLS0_LBSPP128_LPA2_LPB2_MIAV0_NTC3_ONLL2_PGR2_PLR3_SU0_SUS0_TLDS1_UMLDSA1_UMLDSB1_WGM48
    SolutionIndex: 2
    SolutionNameMin: Cijk_Alik_Bljk_CB_UserArgs_MT128x128x4_MI32x32x2x1_SN_FL1_GLS0_LBSPP0_LPA1_LPB1_MIAV1_NTC2_ONLL2_PGR1_PLR1_SU32_SUS256_TLDS0_UMLDSA0_UMLDSB0_WGM54
    SolutionIndex: 3
    SolutionNameMin: Cijk_Alik_Bljk_CB_UserArgs_MT128x128x4_MI32x32x2x1_SN_FL0_GLS0_LBSPP0_LPA1_LPB1_MIAV1_NTC2_ONLL0_PGR1_PLR1_SU0_SUS0_TLDS0_UMLDSA0_UMLDSB0_WGM60
    SolutionIndex: 4
    SolutionNameMin: Cijk_Alik_Bljk_CB_UserArgs_MT128x128x4_MI32x32x2x1_SN_FL1_GLS0_LBSPP0_LPA1_LPB1_MIAV1_NTC3_ONLL1_PGR1_PLR1_SU32_SUS256_TLDS0_UMLDSA0_UMLDSB0_WGM48
    SolutionIndex: 5
    SolutionNameMin: Cijk_Alik_Bljk_CB_UserArgs_MT128x128x4_MI32x32x2x1_SN_FL1_GLS0_LBSPP0_LPA1_LPB1_MIAV1_NTC3_ONLL2_PGR1_PLR1_SU32_SUS256_TLDS0_UMLDSA0_UMLDSB0_WGM60
    SolutionIndex: 6
    SolutionNameMin: Cijk_Alik_Bljk_CB_UserArgs_MT128x128x4_MI32x32x2x1_SN_FL0_GLS1_LBSPP0_LPA1_LPB1_MIAV1_NTC2_ONLL2_PGR2_PLR3_SU0_SUS0_TLDS0_UMLDSA0_UMLDSB0_WGM12
    SolutionIndex: 7
    SolutionNameMin: Cijk_Alik_Bljk_CB_UserArgs_MT16x16x64_MI16x16x4x1_SN_1LDSB0_GLVWA2_GLVWB2_GSU10_GSUAMB_LBSPPA512_LBSPPB512_LPA2_LPB2_LRVW1_NLCA1_NLCB1_PLR9_WG16_4_2
    SolutionIndex: 8
    SolutionNameMin: Cijk_Alik_Bljk_CB_UserArgs_MT16x16x64_MI16x16x4x1_SN_AMAS0_GLVWA1_GLVWB2_GSU3_LBSPPA512_LBSPPB512_LPA4_LPB4_LRVW2_NLCA1_NLCB1_PLR5_SVW1_TT1_16_VW1_WG16_4_4
    SolutionIndex: 9
    SolutionNameMin: Cijk_Alik_Bljk_CB_UserArgs_MT64x16x32_MI16x16x4x1_SN_AMAS0_GLVWA2_GLVWB1_GSU10_GSUAMB_LBSPPA256_LBSPPB256_LPA2_LPB1_LRVW1_NLCA1_NLCB1_PLR9_SVW1_TT1_16_VW1_WG64_4_1
    SolutionIndex: 10
    SolutionNameMin: Cijk_Alik_Bljk_CB_UserArgs_MT16x16x64_MI16x16x4x1_SN_AMAS0_GLVWA2_GLVWB1_GSU1_GSUASB_LBSPPA512_LBSPPB512_LPA4_LPB4_LRVW2_NLCA1_NLCB1_PLR9_SVW1_TT1_16_VW1_WG16_4_2
    SolutionIndex: 11
    SolutionNameMin: Cijk_Alik_Bljk_CB_UserArgs_MT128x16x32_MI16x16x4x1_SN_AMAS3_GLVWA1_GLVWB2_GSU8_GSUAMB_LBSPPA512_LBSPPB256_LPA4_LPB4_LRVW2_NLCA1_NLCB1_PLR9_SVW2_TT2_16_VW2_WG64_4_1
    SolutionIndex: 12
    SolutionNameMin: Cijk_Alik_Bljk_CB_UserArgs_MT64x16x32_MI16x16x4x1_SN_AMAS0_GLVWA1_GLVWB2_GSU3_GSUAMB_LBSPPA256_LBSPPB256_LPA1_LPB2_LRVW1_NLCA1_NLCB1_PLR9_SVW1_TT1_16_VW1_WG64_4_1
    SolutionIndex: 13
    SolutionNameMin: Cijk_Alik_Bljk_CB_UserArgs_MT32x16x32_MI16x16x4x1_SN_AMAS3_GLVWA2_GLVWB2_GSU1_GSUASB_LBSPPA512_LBSPPB256_LPA2_LPB2_LRVW1_NLCA1_NLCB1_PLR1_SVW2_TT2_16_VW2_WG16_4_4
    SolutionIndex: 14
    SolutionNameMin: Cijk_Alik_Bljk_CB_UserArgs_MT256x16x16_MI16x16x4x1_SN_AMAS3_GLVWA2_GLVWB1_GSU14_GSUAMB_LBSPPA256_LBSPPB128_LPA4_LPB4_LRVW2_NLCA1_NLCB1_PLR5_SVW2_TT4_16_VW2_WG64_4_1
    SolutionIndex: 15
    SolutionNameMin: Cijk_Alik_Bljk_CB_UserArgs_MT64x16x32_MI16x16x4x1_SN_AMAS0_GLVWA2_GLVWB2_GSU1_GSUASB_LBSPPA256_LBSPPB256_LPA4_LPB4_LRVW2_NTA0_PLR9_SVW1_TT1_16_VW1_WG64_4_1
    SolutionIndex: 16
    SolutionNameMin: Cijk_Alik_Bljk_CB_UserArgs_MT256x16x16_MI16x16x4x1_SN_AMAS3_GLVWA2_GLVWB1_GSU7_GSUAMB_LBSPPA256_LBSPPB128_LPA4_LPB4_LRVW2_NTA4_PLR5_SVW2_TT4_16_VW2_WG64_4_1
    SolutionIndex: 17
    SolutionNameMin: Cijk_Alik_Bljk_CB_UserArgs_MT64x16x32_MI16x16x4x1_SN_AMAS0_GLVWA2_GLVWB2_GSU1_GSUASB_LBSPPA256_LBSPPB256_LPA4_LPB4_LRVW2_NTA0_PLR5_SVW1_TT2_16_VW1_WG32_4_2
    SolutionIndex: 18
    SolutionNameMin: Cijk_Alik_Bljk_CB_UserArgs_MT64x16x32_MI16x16x4x1_SN_AMAS0_GLVWA1_GLVWB1_GSU1_GSUASB_LBSPPA256_LBSPPB256_LPA1_LPB1_LRVW1_NTA0_PLR9_SVW1_TT1_16_VW1_WG64_4_1
    SolutionIndex: 19
    SolutionNameMin: Cijk_Alik_Bljk_CB_UserArgs_MT32x16x16_MI16x16x4x1_SN_AMAS0_GLVWA1_GLVWB1_GSU1_GSUASB_LBSPPA128_LBSPPB128_LPA1_LPB1_LRVW1_NTA0_PLR1_SVW1_TT1_16_VW1_WG32_4_2
    SolutionIndex: 20
    SolutionNameMin: Cijk_Alik_Bljk_CB_UserArgs_MT128x16x32_MI16x16x4x1_SN_AMAS3_GLVWA1_GLVWB2_GSU1_GSUASB_LBSPPA512_LBSPPB256_LPA4_LPB4_LRVW2_NTA4_PLR5_SVW2_TT4_16_VW2_WG32_4_2
    SolutionIndex: 21
    SolutionNameMin: Cijk_Alik_Bljk_CB_UserArgs_MT384x16x16_MI16x16x4x1_SN_AMAS3_GLVWA2_GLVWB1_GSU5_GSUAMB_LBSPPA256_LBSPPB128_LPA4_LPB4_LRVW2_NTA4_PLR5_SVW2_TT6_16_VW2_WG64_4_1
    SolutionIndex: 22
    SolutionNameMin: Cijk_Alik_Bljk_CB_UserArgs_MT16x16x16_MI16x16x4x1_SN_1LDSB1_AMAS0_GLVWA1_GLVWB1_GSU3_LBSPPA128_LBSPPB128_LPA1_LPB1_LRVW1_NLCA1_NLCB1_PLR1_SVW1_TT1_16_VW1_WG16_4_4
    SolutionIndex: 23
    SolutionNameMin: Cijk_Alik_Bljk_CB_UserArgs_MT32x16x32_MI16x16x4x1_SN_1LDSB1_AMAS0_GLVWA1_GLVWB2_GSU11_LBSPPA256_LBSPPB256_LPA1_LPB2_LRVW1_NLCA1_NLCB1_PLR5_SVW1_TT1_16_VW1_WG32_4_2
    SolutionIndex: 24
    SolutionNameMin: Cijk_Alik_Bljk_CB_UserArgs_MT32x32x32_MI16x16x4x1_SN_AMAS0_GLVWA2_GLVWB2_GSU12_GSUAMB_LBSPPA256_LBSPPB256_LPA4_LPB4_LRVW2_NLCA1_NLCB1_PLR9_SVW1_TT1_16_VW1_WG32_8_1
    SolutionIndex: 25
    SolutionNameMin: Cijk_Alik_Bljk_CB_UserArgs_MT32x32x32_MI16x16x4x1_SN_AMAS0_GLVWA2_GLVWB1_GSU4_GSUAMB_LBSPPA256_LBSPPB256_LPA4_LPB4_LRVW2_NLCA1_NLCB1_PLR5_SVW1_TT1_32_VW1_WG32_4_2
    SolutionIndex: 26
    SolutionNameMin: Cijk_Alik_Bljk_CB_UserArgs_MT32x32x32_MI16x16x4x1_SN_AMAS0_GLVWA1_GLVWB2_GSU7_GSUAMB_LBSPPA256_LBSPPB256_LPA4_LPB4_LRVW2_NLCA1_NLCB1_PLR9_SVW1_TT1_16_VW1_WG32_8_1
    SolutionIndex: 27
    SolutionNameMin: Cijk_Alik_Bljk_CB_UserArgs_MT32x32x32_MI16x16x4x1_SN_AMAS0_GLVWA2_GLVWB2_GSU7_GSUAMB_LBSPPA256_LBSPPB256_LPA2_LPB2_LRVW1_NLCA1_NLCB1_PLR9_SVW1_TT1_16_VW1_WG32_8_1
    SolutionIndex: 28
    SolutionNameMin: Cijk_Alik_Bljk_CB_UserArgs_MT64x32x16_MI16x16x4x1_SN_AMAS0_GLVWA2_GLVWB2_GSU7_GSUAMB_LBSPPA128_LBSPPB128_LPA4_LPB4_LRVW2_NLCA1_NLCB1_PLR5_SVW1_TT2_16_VW1_WG32_8_1
    SolutionIndex: 29
    SolutionNameMin: Cijk_Alik_Bljk_CB_UserArgs_MT16x32x32_MI16x16x4x1_SN_AMAS0_GLVWA1_GLVWB2_GSU1_GSUASB_LBSPPA256_LBSPPB256_LPA1_LPB2_LRVW1_NLCA1_NLCB1_PLR1_SVW1_TT1_16_VW1_WG16_8_2
    SolutionIndex: 30
    SolutionNameMin: Cijk_Alik_Bljk_CB_UserArgs_MT128x32x16_MI16x16x4x1_SN_AMAS3_GLVWA2_GLVWB2_GSU9_GSUAMB_LBSPPA256_LBSPPB128_LPA2_LPB2_LRVW1_NLCA1_NLCB1_PLR1_SVW2_TT2_32_VW2_WG64_4_1
    SolutionIndex: 31
    SolutionNameMin: Cijk_Alik_Bljk_CB_UserArgs_MT64x32x32_MI16x16x4x1_SN_AMAS0_GLVWA1_GLVWB1_GSU7_GSUAMB_LBSPPA256_LBSPPB256_LPA4_LPB4_LRVW2_NLCA1_NLCB1_PLR9_SVW1_TT1_32_VW1_WG64_4_1
    SolutionIndex: 32
    SolutionNameMin: Cijk_Alik_Bljk_CB_UserArgs_MT64x16x32_MI16x16x4x1_SN_AMAS0_GLVWA1_GLVWB1_GSU1_GSUASB_LBSPPA256_LBSPPB256_LPA1_LPB1_LRVW1_MIAV1_NTA0_PLR9_SVW1_TT1_16_VW1_WG64_4_1
    SolutionIndex: 33
    SolutionNameMin: Cijk_Alik_Bljk_CB_UserArgs_MT192x32x16_MI16x16x4x1_SN_AMAS0_GLVWA2_GLVWB2_GSU7_GSUAMB_LBSPPA128_LBSPPB128_LPA2_LPB2_LRVW1_MIAV1_NTA4_PLR1_SVW1_TT3_32_VW1_WG64_4_1
    SolutionIndex: 34
    SolutionNameMin: Cijk_Alik_Bljk_CB_UserArgs_MT64x32x16_MI16x16x4x1_SN_AMAS0_GLVWA1_GLVWB2_GSU1_GSUASB_LBSPPA128_LBSPPB128_LPA4_LPB4_LRVW2_MIAV1_NTA0_PLR5_SVW1_TT1_32_VW1_WG64_4_1
    SolutionIndex: 35
    SolutionNameMin: Cijk_Alik_Bljk_CB_UserArgs_MT160x32x32_MI16x16x4x1_SN_AMAS0_GLVWA1_GLVWB1_GSU4_GSUAMB_LBSPPA256_LBSPPB256_LPA4_LPB4_LRVW2_MIAV1_NTA0_PLR9_SVW1_TT5_16_VW1_WG32_8_1
    SolutionIndex: 36
    SolutionNameMin: Cijk_Alik_Bljk_CB_UserArgs_MT320x32x16_MI16x16x4x1_SN_AMAS0_GLVWA2_GLVWB1_GSU8_GSUAMB_LBSPPA128_LBSPPB128_LPA4_LPB4_LRVW2_MIAV1_NTA4_PLR5_SVW1_TT5_32_VW1_WG64_4_1
    SolutionIndex: 37
    SolutionNameMin: Cijk_Alik_Bljk_CB_UserArgs_MT64x32x16_MI16x16x4x1_SN_AMAS0_GLVWA2_GLVWB2_GSU1_GSUASB_LBSPPA128_LBSPPB128_LPA4_LPB4_LRVW2_MIAV1_NTA4_PLR5_SVW1_TT1_32_VW1_WG64_4_1
    SolutionIndex: 38
    SolutionNameMin: Cijk_Alik_Bljk_CB_UserArgs_MT192x32x16_MI16x16x4x1_SN_AMAS0_GLVWA2_GLVWB1_GSU7_GSUAMB_LBSPPA128_LBSPPB128_LPA2_LPB1_LRVW1_MIAV1_NTA4_PLR1_SVW1_TT3_32_VW1_WG64_4_1
    SolutionIndex: 39
    SolutionNameMin: Cijk_Alik_Bljk_CB_UserArgs_MT32x32x32_MI16x16x4x1_SN_AMAS0_GLVWA2_GLVWB2_GSU1_GSUASB_LBSPPA256_LBSPPB256_LPA4_LPB4_LRVW2_MIAV1_NTA0_PLR9_SVW1_TT1_16_VW1_WG32_8_1
    SolutionIndex: 40
    SolutionNameMin: Cijk_Alik_Bljk_CB_UserArgs_MT384x32x16_MI16x16x4x1_SN_AMAS0_GLVWA1_GLVWB1_GSU5_GSUAMB_LBSPPA128_LBSPPB128_LPA1_LPB1_LRVW1_MIAV0_NTA4_PLR5_SVW1_TT6_32_VW1_WG64_4_1
    SolutionIndex: 41
    SolutionNameMin: Cijk_Alik_Bljk_CB_UserArgs_MT384x32x16_MI16x16x4x1_SN_AMAS3_GLVWA2_GLVWB2_GSU5_GSUAMB_LBSPPA256_LBSPPB128_LPA4_LPB4_LRVW2_MIAV0_NTA4_PLR5_SVW2_TT6_32_VW2_WG64_4_1
    SolutionIndex: 42
    SolutionNameMin: Cijk_Alik_Bljk_CB_UserArgs_MT16x16x64_MI16x16x4x1_SN_1LDSB1_GLVWA1_GLVWB1_GSU12_GSUAMB_LBSPPA512_LBSPPB512_LPA4_LPB4_LRVW2_NLCA1_NLCB1_PLR5_TT1_16_WG16_4_4
    SolutionIndex: 43
    SolutionNameMin: Cijk_Alik_Bljk_CB_UserArgs_MT32x64x16_MI16x16x4x1_SN_AMAS3_GLVWA1_GLVWB2_GSU11_GSUAMB_LBSPPA256_LBSPPB128_LPA1_LPB2_LRVW1_NLCA1_NLCB1_PLR5_SVW2_TT2_16_VW2_WG16_16_1
    SolutionIndex: 44
    SolutionNameMin: Cijk_Alik_Bljk_CB_UserArgs_MT16x16x64_MI16x16x4x1_SN_AMAS0_GLVWA2_GLVWB2_GSU1_GSUASB_LBSPPA512_LBSPPB512_LPA2_LPB2_LRVW1_NLCA1_NLCB1_PLR9_SVW1_TT1_16_VW1_WG16_4_2
    SolutionIndex: 45
    SolutionNameMin: Cijk_Alik_Bljk_CB_UserArgs_MT32x64x16_MI16x16x4x1_SN_AMAS0_GLVWA2_GLVWB1_GSU9_GSUAMB_LBSPPA128_LBSPPB128_LPA2_LPB1_LRVW1_NLCA1_NLCB1_PLR5_SVW1_TT2_16_VW1_WG16_16_1
    SolutionIndex: 46
    SolutionNameMin: Cijk_Alik_Bljk_CB_UserArgs_MT64x64x32_MI16x16x4x1_SN_AMAS0_GLVWA2_GLVWB2_GSU13_GSUAMB_LBSPPA256_LBSPPB256_LPA4_LPB4_LRVW2_NLCA1_NLCB1_PLR9_SVW1_TT1_64_VW1_WG64_4_1
    SolutionIndex: 47
    SolutionNameMin: Cijk_Alik_Bljk_CB_UserArgs_MT16x32x32_MI16x16x4x1_SN_AMAS0_GLVWA2_GLVWB2_GSU1_GSUASB_LBSPPA256_LBSPPB256_LPA2_LPB2_LRVW1_NLCA1_NLCB1_PLR5_SVW1_TT1_16_VW1_WG16_8_2
    SolutionIndex: 48
    SolutionNameMin: Cijk_Alik_Bljk_CB_UserArgs_MT64x64x32_MI16x16x4x1_SN_AMAS0_GLVWA2_GLVWB1_GSU9_GSUAMB_LBSPPA256_LBSPPB256_LPA4_LPB4_LRVW2_NLCA1_NLCB1_PLR9_SVW1_TT1_64_VW1_WG64_4_1
    SolutionIndex: 49
    SolutionNameMin: Cijk_Alik_Bljk_CB_UserArgs_MT64x64x16_MI16x16x4x1_SN_AMAS0_GLVWA2_GLVWB2_GSU7_GSUAMB_LBSPPA128_LBSPPB128_LPA4_LPB4_LRVW2_MIAV1_PLR5_SVW1_TT1_64_VW1_WG64_4_1
    SolutionIndex: 50
    SolutionNameMin: Cijk_Alik_Bljk_CB_UserArgs_MT64x32x32_MI16x16x4x1_SN_AMAS3_GLVWA1_GLVWB1_GSU1_GSUASB_LBSPPA512_LBSPPB256_LPA4_LPB4_LRVW2_MIAV1_PLR5_SVW2_TT2_32_VW2_WG32_4_2
    SolutionIndex: 51
    SolutionNameMin: Cijk_Alik_Bljk_CB_UserArgs_MT96x64x32_MI16x16x4x1_SN_AMAS0_GLVWA1_GLVWB2_GSU7_GSUAMB_LBSPPA256_LBSPPB256_LPA4_LPB4_LRVW2_MIAV1_PLR9_SVW1_TT3_32_VW1_WG32_8_1
    SolutionIndex: 52
    SolutionNameMin: Cijk_Alik_Bljk_CB_UserArgs_MT96x64x16_MI16x16x4x1_SN_AMAS0_GLVWA2_GLVWB1_GSU5_GSUAMB_LBSPPA128_LBSPPB128_LPA4_LPB4_LRVW2_MIAV1_PLR5_SVW1_TT3_32_VW1_WG32_8_1
    SolutionIndex: 53
    SolutionNameMin: Cijk_Alik_Bljk_CB_UserArgs_MT64x64x16_MI16x16x4x1_SN_AMAS0_GLVWA2_GLVWB2_GSU7_GSUAMB_LBSPPA128_LBSPPB128_LPA2_LPB2_LRVW1_MIAV1_PLR1_SVW1_TT1_64_VW1_WG64_4_1
    SolutionIndex: 54
    SolutionNameMin: Cijk_Alik_Bljk_CB_UserArgs_MT64x32x32_MI16x16x4x1_SN_AMAS0_GLVWA2_GLVWB2_GSU1_GSUASB_LBSPPA256_LBSPPB256_LPA4_LPB4_LRVW2_MIAV1_NTA4_PLR9_SVW1_TT1_32_VW1_WG64_4_1
    SolutionIndex: 55
    SolutionNameMin: Cijk_Alik_Bljk_CB_UserArgs_MT64x32x16_MI16x16x4x1_SN_AMAS0_GLVWA1_GLVWB1_GSU1_GSUASB_LBSPPA128_LBSPPB128_LPA1_LPB1_LRVW1_MIAV1_NTA0_PLR5_SVW1_TT1_32_VW1_WG64_4_1
    SolutionIndex: 56
    SolutionNameMin: Cijk_Alik_Bljk_CB_UserArgs_MT64x64x32_MI16x16x4x1_SN_AMAS0_GLVWA2_GLVWB2_GSU2_GSUAMB_LBSPPA256_LBSPPB256_LPA2_LPB2_LRVW1_MIAV1_NTA4_PLR1_SVW1_TT1_64_VW1_WG64_4_1
    SolutionIndex: 57
    SolutionNameMin: Cijk_Alik_Bljk_CB_UserArgs_MT64x64x32_MI16x16x4x1_SN_AMAS0_GLVWA2_GLVWB2_GSU1_GSUASB_LBSPPA256_LBSPPB256_LPA4_LPB4_LRVW2_MIAV1_NTA0_PLR9_SVW1_TT2_32_VW1_WG32_8_1
    SolutionIndex: 58
    SolutionNameMin: Cijk_Alik_Bljk_CB_UserArgs_MT80x64x32_MI16x16x4x1_SN_AMAS0_GLVWA2_GLVWB2_GSU2_GSUAMB_LBSPPA256_LBSPPB256_LPA2_LPB2_LRVW1_MIAV1_NTA0_PLR1_SVW1_TT5_16_VW1_WG16_16_1
    SolutionIndex: 59
    SolutionNameMin: Cijk_Alik_Bljk_CB_UserArgs_MT288x64x16_MI16x16x4x1_SN_AMAS0_GLVWA1_GLVWB2_GSU7_GSUAMB_LBSPPA128_LBSPPB128_LPA1_LPB2_LRVW1_MIAV0_NTA4_PLR1_SVW1_TT9_32_VW1_WG32_8_1
    SolutionIndex: 60
    SolutionNameMin: Cijk_Alik_Bljk_CB_UserArgs_MT64x64x32_MI16x16x4x1_SN_AMAS0_GLVWA2_GLVWB2_GSU1_GSUASB_LBSPPA256_LBSPPB256_LPA2_LPB2_LRVW1_MIAV1_NTA0_PLR1_SVW1_TT1_64_VW1_WG64_4_1
    SolutionIndex: 61
    SolutionNameMin: Cijk_Alik_Bljk_CB_UserArgs_MT64x64x32_MI16x16x4x1_SN_AMAS3_GLVWA2_GLVWB1_GSU1_GSUASB_LBSPPA512_LBSPPB256_LPA4_LPB4_LRVW2_MIAV1_NTA4_PLR9_SVW2_TT2_32_VW2_WG32_8_1
    SolutionIndex: 62
    SolutionNameMin: Cijk_Alik_Bljk_CB_UserArgs_MT112x64x32_MI16x16x4x1_SN_AMAS0_GLVWA2_GLVWB2_GSU2_GSUAMB_LBSPPA256_LBSPPB256_LPA4_LPB4_LRVW2_MIAV1_NTA4_PLR9_SVW1_TT7_16_VW1_WG16_16_1
    SolutionIndex: 63
    SolutionNameMin: Cijk_Alik_Bljk_CB_UserArgs_MT80x64x16_MI16x16x4x1_SN_AMAS0_GLVWA1_GLVWB2_GSU1_GSUASB_LBSPPA128_LBSPPB128_LPA1_LPB2_LRVW1_MIAV1_NTA0_PLR1_SVW1_TT5_16_VW1_WG16_16_1
    SolutionIndex: 64
    SolutionNameMin: Cijk_Alik_Bljk_CB_UserArgs_MT80x64x16_MI16x16x4x1_SN_AMAS0_GLVWA1_GLVWB2_GSU1_GSUASB_LBSPPA128_LBSPPB128_LPA1_LPB2_LRVW1_MIAV1_NTA0_PLR5_SVW1_TT5_16_VW1_WG16_16_1
    SolutionIndex: 65
    SolutionNameMin: Cijk_Alik_Bljk_CB_UserArgs_MT48x64x32_MI16x16x4x1_SN_AMAS0_GLVWA2_GLVWB2_GSU2_GSUAMB_LBSPPA256_LBSPPB256_LPA4_LPB4_LRVW2_MIAV1_NTA0_PLR9_SVW1_TT3_16_VW1_WG16_16_1
    SolutionIndex: 66
    SolutionNameMin: Cijk_Alik_Bljk_CB_UserArgs_MT16x16x64_MI16x16x4x1_SN_1LDSB0_AMAS0_GLVWA2_GLVWB1_GSU4_LBSPPA512_LBSPPB512_LPA2_LPB1_LRVW1_NLCA1_NLCB1_PLR1_SVW1_TT1_16_VW1_WG16_4_4
    SolutionIndex: 67
    SolutionNameMin: Cijk_Alik_Bljk_CB_UserArgs_MT16x48x32_MI16x16x4x1_SN_1LDSB0_AMAS0_GLVWA1_GLVWB1_GSU4_LBSPPA256_LBSPPB256_LPA1_LPB1_LRVW1_NLCA1_NLCB1_PLR1_SVW1_TT1_48_VW1_WG16_4_4
    SolutionIndex: 68
    SolutionNameMin: Cijk_Alik_Bljk_CB_UserArgs_MT32x128x16_MI16x16x4x1_SN_AMAS3_GLVWA2_GLVWB2_GSU13_GSUAMB_LBSPPA256_LBSPPB128_LPA2_LPB2_LRVW1_NLCA1_NLCB1_PLR1_SVW2_TT2_32_VW2_WG16_16_1
    SolutionIndex: 69
    SolutionNameMin: Cijk_Alik_Bljk_CB_UserArgs_MT32x32x32_MI16x16x4x1_SN_AMAS0_GLVWA1_GLVWB2_GSU1_GSUASB_LBSPPA256_LBSPPB256_LPA4_LPB4_LRVW2_MIAV1_PLR5_SVW1_TT2_16_VW1_WG16_8_2
    SolutionIndex: 70
    SolutionNameMin: Cijk_Alik_Bljk_CB_UserArgs_MT32x16x32_MI16x16x4x1_SN_AMAS0_GLVWA2_GLVWB2_GSU1_GSUASB_LBSPPA256_LBSPPB256_LPA2_LPB2_LRVW1_MIAV1_PLR5_SVW1_TT1_16_VW1_WG32_4_2
    SolutionIndex: 71
    SolutionNameMin: Cijk_Alik_Bljk_CB_UserArgs_MT64x64x16_MI16x16x4x1_SN_AMAS0_GLVWA1_GLVWB2_GSU9_GSUAMB_LBSPPA128_LBSPPB128_LPA4_LPB4_LRVW2_MIAV1_PLR5_SVW1_TT1_64_VW1_WG64_4_1
    SolutionIndex: 72
    SolutionNameMin: Cijk_Alik_Bljk_CB_UserArgs_MT32x32x32_MI16x16x4x1_SN_AMAS0_GLVWA1_GLVWB1_GSU1_GSUASB_LBSPPA256_LBSPPB256_LPA1_LPB1_LRVW1_MIAV1_PLR5_SVW1_TT2_16_VW1_WG16_8_2
    SolutionIndex: 73
    SolutionNameMin: Cijk_Alik_Bljk_CB_UserArgs_MT32x128x16_MI16x16x4x1_SN_AMAS0_GLVWA2_GLVWB1_GSU7_GSUAMB_LBSPPA128_LBSPPB128_LPA2_LPB1_LRVW1_MIAV1_PLR5_SVW1_TT1_64_VW1_WG32_8_1
    SolutionIndex: 74
    SolutionNameMin: Cijk_Alik_Bljk_CB_UserArgs_MT48x128x32_MI16x16x4x1_SN_AMAS0_GLVWA2_GLVWB2_GSU7_GSUAMB_LBSPPA256_LBSPPB256_LPA4_LPB4_LRVW2_MIAV1_PLR9_SVW1_TT3_32_VW1_WG16_16_1
    SolutionIndex: 75
    SolutionNameMin: Cijk_Alik_Bljk_CB_UserArgs_MT48x128x32_MI16x16x4x1_SN_AMAS0_GLVWA1_GLVWB2_GSU5_GSUAMB_LBSPPA256_LBSPPB256_LPA1_LPB2_LRVW1_MIAV1_PLR9_SVW1_TT3_32_VW1_WG16_16_1
    SolutionIndex: 76
    SolutionNameMin: Cijk_Alik_Bljk_CB_UserArgs_MT48x128x16_MI16x16x4x1_SN_AMAS0_GLVWA1_GLVWB1_GSU5_GSUAMB_LBSPPA128_LBSPPB128_LPA4_LPB4_LRVW2_MIAV1_PLR5_SVW1_TT3_32_VW1_WG16_16_1
    SolutionIndex: 77
    SolutionNameMin: Cijk_Alik_Bljk_CB_UserArgs_MT32x64x32_MI16x16x4x1_SN_AMAS0_GLVWA2_GLVWB2_GSU1_GSUASB_LBSPPA256_LBSPPB256_LPA2_LPB2_LRVW1_MIAV1_PLR9_SVW1_TT2_16_VW1_WG16_16_1
    SolutionIndex: 78
    SolutionNameMin: Cijk_Alik_Bljk_CB_UserArgs_MT32x64x32_MI16x16x4x1_SN_AMAS0_GLVWA1_GLVWB2_GSU1_GSUASB_LBSPPA256_LBSPPB256_LPA4_LPB4_LRVW2_MIAV1_PLR5_SVW1_TT1_64_VW1_WG32_4_2
    SolutionIndex: 79
    SolutionNameMin: Cijk_Alik_Bljk_CB_UserArgs_MT64x64x32_MI16x16x4x1_SN_AMAS0_GLVWA2_GLVWB2_GSU2_GSUAMB_LBSPPA256_LBSPPB256_LPA2_LPB2_LRVW1_MIAV1_PLR1_SVW1_TT1_64_VW1_WG64_4_1
    SolutionIndex: 80
    SolutionNameMin: Cijk_Alik_Bljk_CB_UserArgs_MT32x128x16_MI16x16x4x1_SN_AMAS3_GLVWA2_GLVWB2_GSU1_GSUASB_LBSPPA256_LBSPPB128_LPA2_LPB2_LRVW1_MIAV1_PLR1_SVW2_TT2_64_VW2_WG16_8_2
    SolutionIndex: 81
    SolutionNameMin: Cijk_Alik_Bljk_CB_UserArgs_MT96x64x16_MI16x16x4x1_SN_AMAS0_GLVWA1_GLVWB1_GSU5_GSUAMB_LBSPPA128_LBSPPB128_LPA4_LPB4_LRVW2_MIAV1_PLR5_SVW1_TT3_32_VW1_WG32_8_1
    SolutionIndex: 82
    SolutionNameMin: Cijk_Alik_Bljk_CB_UserArgs_MT48x128x16_MI16x16x4x1_SN_AMAS0_GLVWA1_GLVWB2_GSU5_GSUAMB_LBSPPA128_LBSPPB128_LPA4_LPB4_LRVW2_MIAV1_PLR5_SVW1_TT3_32_VW1_WG16_16_1
    SolutionIndex: 83
    SolutionNameMin: Cijk_Alik_Bljk_CB_UserArgs_MT64x64x8_MI16x16x4x1_SN_AMAS0_GLVWA1_GLVWB1_GSU1_GSUASB_LBSPPA128_LBSPPB128_LPA1_LPB1_LRVW1_MIAV1_NTA4_PLR1_SVW1_TT1_64_VW1_WG64_4_1
    SolutionIndex: 84
    SolutionNameMin: Cijk_Alik_Bljk_CB_UserArgs_MT64x64x32_MI16x16x4x1_SN_AMAS0_GLVWA2_GLVWB1_GSU1_GSUASB_LBSPPA256_LBSPPB256_LPA4_LPB4_LRVW2_MIAV1_NTA0_PLR9_SVW1_TT1_64_VW1_WG64_4_1
    SolutionIndex: 85
    SolutionNameMin: Cijk_Alik_Bljk_CB_UserArgs_MT112x64x32_MI16x16x4x1_SN_AMAS0_GLVWA2_GLVWB2_GSU2_GSUAMB_LBSPPA256_LBSPPB256_LPA2_LPB2_LRVW1_MIAV1_NTA0_PLR1_SVW1_TT7_16_VW1_WG16_16_1
    SolutionIndex: 86
    SolutionNameMin: Cijk_Alik_Bljk_CB_UserArgs_MT80x64x16_MI16x16x4x1_SN_AMAS0_GLVWA1_GLVWB1_GSU1_GSUASB_LBSPPA128_LBSPPB128_LPA1_LPB1_LRVW1_MIAV1_NTA0_PLR1_SVW1_TT5_16_VW1_WG16_16_1
    SolutionIndex: 87
    SolutionNameMin: Cijk_Alik_Bljk_CB_UserArgs_MT48x128x32_MI16x16x4x1_SN_AMAS0_GLVWA2_GLVWB2_GSU1_GSUASB_LBSPPA256_LBSPPB256_LPA2_LPB2_LRVW1_MIAV1_NTA0_PLR1_SVW1_TT3_32_VW1_WG16_16_1
    SolutionIndex: 88
    SolutionNameMin: Cijk_Alik_Bljk_CB_UserArgs_MT80x128x32_MI16x16x4x1_SN_AMAS0_GLVWA1_GLVWB2_GSU2_GSUAMB_LBSPPA256_LBSPPB256_LPA1_LPB2_LRVW1_MIAV1_NTA4_PLR1_SVW1_TT5_32_VW1_WG16_16_1
    SolutionIndex: 89
    SolutionNameMin: Cijk_Alik_Bljk_CB_UserArgs_MT112x64x16_MI16x16x4x1_SN_AMAS0_GLVWA1_GLVWB2_GSU1_GSUASB_LBSPPA128_LBSPPB128_LPA4_LPB4_LRVW2_MIAV1_NTA0_PLR5_SVW1_TT7_16_VW1_WG16_16_1
    SolutionIndex: 90
    SolutionNameMin: Cijk_Alik_Bljk_CB_UserArgs_MT112x128x32_MI16x16x4x1_SN_AMAS0_GLVWA1_GLVWB2_GSU2_GSUAMB_LBSPPA256_LBSPPB256_LPA1_LPB2_LRVW1_MIAV0_NTA4_PLR1_SVW1_TT7_32_VW1_WG16_16_1
    SolutionIndex: 91
    SolutionNameMin: Cijk_Alik_Bljk_CB_UserArgs_MT80x128x16_MI16x16x4x1_SN_AMAS0_GLVWA1_GLVWB1_GSU1_GSUASB_LBSPPA128_LBSPPB128_LPA1_LPB1_LRVW1_MIAV1_NTA0_PLR1_SVW1_TT5_32_VW1_WG16_16_1
    SolutionIndex: 92
    SolutionNameMin: Cijk_Alik_Bljk_CB_UserArgs_MT80x128x16_MI16x16x4x1_SN_AMAS0_GLVWA1_GLVWB1_GSU1_GSUASB_LBSPPA128_LBSPPB128_LPA1_LPB1_LRVW1_MIAV1_NTA0_PLR5_SVW1_TT5_32_VW1_WG16_16_1
    SolutionIndex: 93
    SolutionNameMin: Cijk_Alik_Bljk_CB_UserArgs_MT144x64x16_MI16x16x4x1_SN_AMAS0_GLVWA1_GLVWB2_GSU1_GSUASB_LBSPPA128_LBSPPB128_LPA1_LPB2_LRVW1_MIAV1_NTA4_PLR1_SVW1_TT9_16_VW1_WG16_16_1
    SolutionIndex: 94
    SolutionNameMin: Cijk_Alik_Bljk_CB_UserArgs_MT16x16x64_MI16x16x4x1_SN_1LDSB0_AMAS0_GLVWA2_GLVWB2_GSU3_LBSPPA512_LBSPPB512_LPA4_LPB4_LRVW2_NLCA1_NLCB1_PLR5_SVW1_TT1_16_VW1_WG16_4_4
    SolutionIndex: 95
    SolutionNameMin: Cijk_Alik_Bljk_CB_UserArgs_MT32x32x32_MI16x16x4x1_SN_1LDSB1_AMAS0_GLVWA2_GLVWB1_GSU10_GSUAMB_LBSPPA256_LBSPPB256_LPA2_LPB1_LRVW1_NLCA1_NLCB1_PLR9_SVW1_TT1_16_VW1_WG32_8_1
    SolutionIndex: 96
    SolutionNameMin: Cijk_Alik_Bljk_CB_UserArgs_MT64x32x16_MI16x16x4x1_SN_1LDSB1_AMAS3_GLVWA2_GLVWB1_GSU10_GSUAMB_LBSPPA256_LBSPPB128_LPA4_LPB4_LRVW2_NLCA1_NLCB1_PLR5_SVW2_TT2_16_VW2_WG32_8_1
    SolutionIndex: 97
    SolutionNameMin: Cijk_Alik_Bljk_CB_UserArgs_MT128x32x16_MI16x16x4x1_SN_1LDSB1_AMAS3_GLVWA2_GLVWB2_GSU13_GSUAMB_LBSPPA256_LBSPPB128_LPA4_LPB4_LRVW2_NLCA1_NLCB1_PLR5_SVW2_TT2_32_VW2_WG64_4_1
    SolutionIndex: 98
    SolutionNameMin: Cijk_Alik_Bljk_CB_UserArgs_MT32x32x32_MI16x16x4x1_SN_AMAS3_GLVWA2_GLVWB2_GSU1_GSUASB_LBSPPA512_LBSPPB256_LPA2_LPB2_LRVW1_MIAV1_PLR5_SVW2_TT2_16_VW2_WG16_8_2
    SolutionIndex: 99
    SolutionNameMin: Cijk_Alik_Bljk_CB_UserArgs_MT32x128x32_MI16x16x4x1_SN_AMAS0_GLVWA2_GLVWB2_GSU7_GSUAMB_LBSPPA256_LBSPPB256_LPA4_LPB4_LRVW2_MIAV1_PLR9_SVW1_TT1_64_VW1_WG32_8_1
    SolutionIndex: 100
    SolutionNameMin: Cijk_Alik_Bljk_CB_UserArgs_MT48x128x16_MI16x16x4x1_SN_AMAS0_GLVWA1_GLVWB1_GSU7_GSUAMB_LBSPPA128_LBSPPB128_LPA1_LPB1_LRVW1_MIAV1_PLR5_SVW1_TT3_32_VW1_WG16_16_1
    SolutionIndex: 101
    SolutionNameMin: Cijk_Alik_Bljk_CB_UserArgs_MT64x128x16_MI16x16x4x1_SN_AMAS0_GLVWA1_GLVWB2_GSU7_GSUAMB_LBSPPA128_LBSPPB128_LPA1_LPB2_LRVW1_MIAV1_PLR5_SVW1_TT1_128_VW1_WG64_4_1
    SolutionIndex: 102
    SolutionNameMin: Cijk_Alik_Bljk_CB_UserArgs_MT64x128x16_MI16x16x4x1_SN_AMAS0_GLVWA1_GLVWB1_GSU7_GSUAMB_LBSPPA128_LBSPPB128_LPA1_LPB1_LRVW1_MIAV1_PLR1_SVW1_TT1_128_VW1_WG64_4_1
    SolutionIndex: 103
    SolutionNameMin: Cijk_Alik_Bljk_CB_UserArgs_MT32x64x16_MI16x16x4x1_SN_AMAS3_GLVWA1_GLVWB2_GSU1_GSUASB_LBSPPA256_LBSPPB128_LPA1_LPB2_LRVW1_MIAV1_PLR1_SVW2_TT2_32_VW2_WG16_8_2
    SolutionIndex: 104
    SolutionNameMin: Cijk_Alik_Bljk_CB_UserArgs_MT48x128x16_MI16x16x4x1_SN_AMAS0_GLVWA1_GLVWB2_GSU7_GSUAMB_LBSPPA128_LBSPPB128_LPA4_LPB4_LRVW2_MIAV1_PLR5_SVW1_TT3_32_VW1_WG16_16_1
    SolutionIndex: 105
    SolutionNameMin: Cijk_Alik_Bljk_CB_UserArgs_MT32x128x16_MI16x16x4x1_SN_AMAS3_GLVWA1_GLVWB2_GSU1_GSUASB_LBSPPA256_LBSPPB128_LPA1_LPB2_LRVW1_MIAV1_PLR5_SVW2_TT2_32_VW2_WG16_16_1
    SolutionIndex: 106
    SolutionNameMin: Cijk_Alik_Bljk_CB_UserArgs_MT96x256x16_MI16x16x4x1_SN_AMAS0_GLVWA2_GLVWB1_GSU9_GSUAMB_LBSPPA128_LBSPPB128_LPA4_LPB4_LRVW2_MIAV0_PLR5_SVW1_TT3_128_VW1_WG32_8_1
    SolutionIndex: 107
    SolutionNameMin: Cijk_Alik_Bljk_CB_UserArgs_MT128x32x8_MI16x16x4x1_SN_AMAS0_GLVWA1_GLVWB1_GSU1_GSUASB_LBSPPA128_LBSPPB128_LPA1_LPB1_LRVW1_MIAV1_PLR1_SVW1_TT2_32_VW1_WG64_4_1
    SolutionIndex: 108
    SolutionNameMin: Cijk_Alik_Bljk_CB_UserArgs_MT64x64x32_MI16x16x4x1_SN_AMAS0_GLVWA2_GLVWB2_GSU1_GSUASB_LBSPPA256_LBSPPB256_LPA4_LPB4_LRVW2_MIAV1_PLR9_SVW1_TT1_64_VW1_WG64_4_1
    SolutionIndex: 109
    SolutionNameMin: Cijk_Alik_Bljk_CB_UserArgs_MT128x64x32_MI16x16x4x1_SN_AMAS3_GLVWA2_GLVWB2_GSU2_GSUAMB_LBSPPA512_LBSPPB256_LPA4_LPB4_LRVW2_MIAV1_PLR9_SVW2_TT2_64_VW2_WG64_4_1
    SolutionIndex: 110
    SolutionNameMin: Cijk_Alik_Bljk_CB_UserArgs_MT64x32x8_MI16x16x4x1_SN_AMAS0_GLVWA1_GLVWB1_GSU1_GSUASB_LBSPPA128_LBSPPB128_LPA1_LPB1_LRVW1_MIAV1_PLR1_SVW1_TT1_32_VW1_WG64_4_1
    SolutionIndex: 111
    SolutionNameMin: Cijk_Alik_Bljk_CB_UserArgs_MT80x64x32_MI16x16x4x1_SN_AMAS0_GLVWA1_GLVWB2_GSU1_GSUASB_LBSPPA256_LBSPPB256_LPA4_LPB4_LRVW2_MIAV1_PLR9_SVW1_TT5_16_VW1_WG16_16_1
    SolutionIndex: 112
    SolutionNameMin: Cijk_Alik_Bljk_CB_UserArgs_MT160x64x16_MI16x16x4x1_SN_AMAS0_GLVWA1_GLVWB2_GSU2_GSUAMB_LBSPPA128_LBSPPB128_LPA1_LPB2_LRVW1_MIAV1_PLR1_SVW1_TT5_32_VW1_WG32_8_1
    SolutionIndex: 113
    SolutionNameMin: Cijk_Alik_Bljk_CB_UserArgs_MT112x64x32_MI16x16x4x1_SN_AMAS0_GLVWA1_GLVWB2_GSU1_GSUASB_LBSPPA256_LBSPPB256_LPA4_LPB4_LRVW2_MIAV1_NTA0_NTC0_NTD0_PLR9_SVW1_TT7_16_VW1_WG16_16_1
    SolutionIndex: 114
    SolutionNameMin: Cijk_Alik_Bljk_CB_UserArgs_MT112x128x32_MI16x16x4x1_SN_AMAS0_GLVWA1_GLVWB2_GSU2_GSUAMB_LBSPPA256_LBSPPB256_LPA1_LPB2_LRVW1_MIAV0_NTA0_NTC0_NTD0_PLR1_SVW1_TT7_32_VW1_WG16_16_1
    SolutionIndex: 115
    SolutionNameMin: Cijk_Alik_Bljk_CB_UserArgs_MT80x128x32_MI16x16x4x1_SN_AMAS0_GLVWA2_GLVWB1_GSU1_GSUASB_LBSPPA256_LBSPPB256_LPA2_LPB1_LRVW1_MIAV1_NTA0_NTC3_NTD3_PLR9_SVW1_TT5_32_VW1_WG16_16_1
    SolutionIndex: 116
    SolutionNameMin: Cijk_Alik_Bljk_CB_UserArgs_MT80x128x32_MI16x16x4x1_SN_AMAS0_GLVWA2_GLVWB1_GSU1_GSUASB_LBSPPA256_LBSPPB256_LPA4_LPB4_LRVW2_MIAV1_NTA0_NTC0_NTD0_PLR9_SVW1_TT5_32_VW1_WG16_16_1
    SolutionIndex: 117
    SolutionNameMin: Cijk_Alik_Bljk_CB_UserArgs_MT80x128x32_MI16x16x4x1_SN_AMAS0_GLVWA1_GLVWB2_GSU1_GSUASB_LBSPPA256_LBSPPB256_LPA1_LPB2_LRVW1_MIAV1_NTA0_NTC0_NTD0_PLR1_SVW1_TT5_32_VW1_WG16_16_1
    SolutionIndex: 118
    SolutionNameMin: Cijk_Alik_Bljk_CB_UserArgs_MT112x128x32_MI16x16x4x1_SN_AMAS0_GLVWA1_GLVWB2_GSU1_GSUASB_LBSPPA256_LBSPPB256_LPA1_LPB2_LRVW1_MIAV0_NTA0_NTC0_NTD0_PLR1_SVW1_TT7_32_VW1_WG16_16_1
    SolutionIndex: 119
    SolutionNameMin: Cijk_Alik_Bljk_CB_UserArgs_MT224x64x16_MI16x16x4x1_SN_AMAS0_GLVWA2_GLVWB1_GSU1_GSUASB_LBSPPA128_LBSPPB128_LPA2_LPB1_LRVW1_MIAV0_NTA0_NTC0_NTD0_PLR1_SVW1_TT7_32_VW1_WG32_8_1
    SolutionIndex: 120
    SolutionNameMin: Cijk_Alik_Bljk_CB_UserArgs_MT80x128x16_MI16x16x4x1_SN_AMAS0_GLVWA1_GLVWB1_GSU1_GSUASB_LBSPPA128_LBSPPB128_LPA1_LPB1_LRVW1_MIAV1_NTA0_NTC0_NTD0_PLR1_SVW1_TT5_32_VW1_WG16_16_1
    SolutionIndex: 121
    SolutionNameMin: Cijk_Alik_Bljk_CB_UserArgs_MT96x64x16_MI16x16x4x1_SN_AMAS0_GLVWA2_GLVWB2_GSU1_GSUASB_LBSPPA128_LBSPPB128_LPA2_LPB2_LRVW1_MIAV1_NTA0_NTC3_NTD3_PLR5_SVW1_TT3_32_VW1_WG32_8_1
    SolutionIndex: 122
    SolutionNameMin: Cijk_Alik_Bljk_CB_UserArgs_MT80x256x16_MI16x16x4x1_SN_AMAS0_GLVWA1_GLVWB2_GSU1_GSUASB_LBSPPA128_LBSPPB128_LPA1_LPB2_LRVW1_MIAV0_NTA4_NTC3_NTD3_PLR1_SVW1_TT5_64_VW1_WG16_16_1
    SolutionIndex: 123
    SolutionNameMin: Cijk_Alik_Bljk_CB_UserArgs_MT16x16x32_MI16x16x4x1_SN_GLVWA2_GLVWB2_GSU4_LBSPPA256_LBSPPB256_LPA4_LPB4_LRVW2_NLCA1_NLCB1_PLR5_TT1_16_WG16_4_2
    SolutionIndex: 124
    SolutionNameMin: Cijk_Alik_Bljk_CB_UserArgs_MT32x32x32_MI16x16x4x1_SN_AMAS0_GLVWA2_GLVWB2_GSU12_GSUAMB_LBSPPA256_LBSPPB256_LPA2_LPB2_LRVW1_NLCA1_NLCB1_PLR9_SVW1_TT1_16_VW1_WG32_8_1
    SolutionIndex: 125
    SolutionNameMin: Cijk_Alik_Bljk_CB_UserArgs_MT64x32x16_MI16x16x4x1_SN_AMAS0_GLVWA2_GLVWB1_GSU11_GSUAMB_LBSPPA128_LBSPPB128_LPA4_LPB4_LRVW2_NLCA1_NLCB1_PLR5_SVW1_TT1_32_VW1_WG64_4_1
    SolutionIndex: 126
    SolutionNameMin: Cijk_Alik_Bljk_CB_UserArgs_MT64x64x32_MI16x16x4x1_SN_AMAS0_GLVWA2_GLVWB1_GSU8_GSUAMB_LBSPPA256_LBSPPB256_LPA4_LPB4_LRVW2_NLCA1_NLCB1_PLR5_SVW1_TT4_32_VW1_WG16_8_2
    SolutionIndex: 127
    SolutionNameMin: Cijk_Alik_Bljk_CB_UserArgs_MT128x32x32_MI16x16x4x1_SN_AMAS3_GLVWA2_GLVWB2_GSU14_GSUAMB_LBSPPA512_LBSPPB256_LPA4_LPB4_LRVW2_NLCA1_NLCB1_PLR9_SVW2_TT2_32_VW2_WG64_4_1
    SolutionIndex: 128
    SolutionNameMin: Cijk_Alik_Bljk_CB_UserArgs_MT64x16x32_MI16x16x4x1_SN_AMAS3_GLVWA1_GLVWB2_GSU1_GSUASB_LBSPPA512_LBSPPB256_LPA1_LPB2_LRVW1_MIAV1_PLR5_SVW2_TT2_16_VW2_WG32_4_2
    SolutionIndex: 129
    SolutionNameMin: Cijk_Alik_Bljk_CB_UserArgs_MT64x16x32_MI16x16x4x1_SN_AMAS0_GLVWA2_GLVWB2_GSU1_GSUASB_LBSPPA256_LBSPPB256_LPA4_LPB4_LRVW2_MIAV1_PLR5_SVW1_TT2_16_VW1_WG32_4_2
    SolutionIndex: 130
    SolutionNameMin: Cijk_Alik_Bljk_CB_UserArgs_MT64x48x32_MI16x16x4x1_SN_AMAS0_GLVWA1_GLVWB2_GSU5_GSUAMB_LBSPPA256_LBSPPB256_LPA4_LPB4_LRVW2_MIAV1_PLR9_SVW1_TT1_48_VW1_WG64_4_1
    SolutionIndex: 131
    SolutionNameMin: Cijk_Alik_Bljk_CB_UserArgs_MT32x64x32_MI16x16x4x1_SN_AMAS3_GLVWA1_GLVWB2_GSU1_GSUASB_LBSPPA512_LBSPPB256_LPA4_LPB4_LRVW2_MIAV1_PLR5_SVW2_TT2_32_VW2_WG16_8_2
    SolutionIndex: 132
    SolutionNameMin: Cijk_Alik_Bljk_CB_UserArgs_MT128x64x16_MI16x16x4x1_SN_AMAS3_GLVWA2_GLVWB2_GSU7_GSUAMB_LBSPPA256_LBSPPB128_LPA2_LPB2_LRVW1_MIAV1_PLR1_SVW2_TT4_32_VW2_WG32_8_1
    SolutionIndex: 133
    SolutionNameMin: Cijk_Alik_Bljk_CB_UserArgs_MT128x64x32_MI16x16x4x1_SN_AMAS3_GLVWA2_GLVWB1_GSU7_GSUAMB_LBSPPA512_LBSPPB256_LPA2_LPB1_LRVW1_MIAV1_PLR1_SVW2_TT4_32_VW2_WG32_8_1
    SolutionIndex: 134
    SolutionNameMin: Cijk_Alik_Bljk_CB_UserArgs_MT64x48x32_MI16x16x4x1_SN_AMAS0_GLVWA2_GLVWB2_GSU1_GSUASB_LBSPPA256_LBSPPB256_LPA4_LPB4_LRVW2_MIAV1_PLR5_SVW1_TT2_48_VW1_WG32_4_2
    SolutionIndex: 135
    SolutionNameMin: Cijk_Alik_Bljk_CB_UserArgs_MT32x64x32_MI16x16x4x1_SN_AMAS0_GLVWA2_GLVWB2_GSU1_GSUASB_LBSPPA256_LBSPPB256_LPA4_LPB4_LRVW2_MIAV1_PLR9_SVW1_TT1_32_VW1_WG32_8_1
    SolutionIndex: 136
    SolutionNameMin: Cijk_Alik_Bljk_CB_UserArgs_MT64x176x16_MI16x16x4x1_SN_AMAS0_GLVWA1_GLVWB1_GSU6_GSUAMB_LBSPPA128_LBSPPB128_LPA1_LPB1_LRVW1_MIAV0_PLR1_SVW1_TT1_176_VW1_WG64_4_1
    SolutionIndex: 137
    SolutionNameMin: Cijk_Alik_Bljk_CB_UserArgs_MT64x80x16_MI16x16x4x1_SN_AMAS0_GLVWA1_GLVWB1_GSU2_GSUAMB_LBSPPA128_LBSPPB128_LPA1_LPB1_LRVW1_MIAV1_PLR1_SVW1_TT1_80_VW1_WG64_4_1
    SolutionIndex: 138
    SolutionNameMin: Cijk_Alik_Bljk_CB_UserArgs_MT64x80x32_MI16x16x4x1_SN_AMAS0_GLVWA2_GLVWB2_GSU2_GSUAMB_LBSPPA256_LBSPPB256_LPA4_LPB4_LRVW2_MIAV1_PLR9_SVW1_TT1_80_VW1_WG64_4_1
    SolutionIndex: 139
    SolutionNameMin: Cijk_Alik_Bljk_CB_UserArgs_MT64x32x16_MI16x16x4x1_SN_AMAS0_GLVWA1_GLVWB1_GSU1_GSUASB_LBSPPA128_LBSPPB128_LPA1_LPB1_LRVW1_MIAV1_PLR5_SVW1_TT1_32_VW1_WG64_4_1
    SolutionIndex: 140
    SolutionNameMin: Cijk_Alik_Bljk_CB_UserArgs_MT64x176x16_MI16x16x4x1_SN_AMAS0_GLVWA1_GLVWB1_GSU6_GSUAMB_LBSPPA128_LBSPPB128_LPA1_LPB1_LRVW1_MIAV0_PLR5_SVW1_TT1_176_VW1_WG64_4_1
    SolutionIndex: 141
    SolutionNameMin: Cijk_Alik_Bljk_CB_UserArgs_MT80x64x32_MI16x16x4x1_SN_AMAS0_GLVWA2_GLVWB2_GSU1_GSUASB_LBSPPA256_LBSPPB256_LPA2_LPB2_LRVW1_MIAV1_NTC3_NTD3_PLR9_SVW1_TT5_16_VW1_WG16_16_1_WGM1
    SolutionIndex: 142
    SolutionNameMin: Cijk_Alik_Bljk_CB_UserArgs_MT64x80x32_MI16x16x4x1_SN_AMAS0_GLVWA1_GLVWB2_GSU1_GSUASB_LBSPPA256_LBSPPB256_LPA4_LPB4_LRVW2_MIAV1_NTC0_NTD0_PLR9_SVW1_TT1_80_VW1_WG64_4_1_WGM1
    SolutionIndex: 143
    SolutionNameMin: Cijk_Alik_Bljk_CB_UserArgs_MT64x80x32_MI16x16x4x1_SN_AMAS0_GLVWA2_GLVWB2_GSU1_GSUASB_LBSPPA256_LBSPPB256_LPA2_LPB2_LRVW1_MIAV1_NTC0_NTD0_PLR1_SVW1_TT1_80_VW1_WG64_4_1_WGM1
    SolutionIndex: 144
    SolutionNameMin: Cijk_Alik_Bljk_CB_UserArgs_MT128x80x32_MI16x16x4x1_SN_AMAS0_GLVWA2_GLVWB2_GSU1_GSUASB_LBSPPA256_LBSPPB256_LPA4_LPB4_LRVW2_MIAV1_NTC3_NTD3_PLR9_SVW1_TT2_80_VW1_WG64_4_1_WGM1
    SolutionIndex: 145
    SolutionNameMin: Cijk_Alik_Bljk_CB_UserArgs_MT112x64x32_MI16x16x4x1_SN_AMAS0_GLVWA1_GLVWB2_GSU1_GSUASB_LBSPPA256_LBSPPB256_LPA1_LPB2_LRVW1_MIAV1_NTC3_NTD3_PLR9_SVW1_TT7_16_VW1_WG16_16_1_WGM1
    SolutionIndex: 146
    SolutionNameMin: Cijk_Alik_Bljk_CB_UserArgs_MT112x64x32_MI16x16x4x1_SN_AMAS0_GLVWA2_GLVWB2_GSU1_GSUASB_LBSPPA256_LBSPPB256_LPA4_LPB4_LRVW2_MIAV1_NTC3_NTD3_PLR9_SVW1_TT7_16_VW1_WG16_16_1_WGMn12
    SolutionIndex: 147
    SolutionNameMin: Cijk_Alik_Bljk_CB_UserArgs_MT80x128x32_MI16x16x4x1_SN_AMAS0_GLVWA2_GLVWB1_GSU1_GSUASB_LBSPPA256_LBSPPB256_LPA4_LPB4_LRVW2_MIAV1_NTC3_NTD3_PLR9_SVW1_TT5_32_VW1_WG16_16_1_WGM1
    SolutionIndex: 148
    SolutionNameMin: Cijk_Alik_Bljk_CB_UserArgs_MT128x80x16_MI16x16x4x1_SN_AMAS0_GLVWA1_GLVWB1_GSU1_GSUASB_LBSPPA128_LBSPPB128_LPA4_LPB4_LRVW2_MIAV1_NTC3_NTD3_PLR5_SVW1_TT2_80_VW1_WG64_4_1_WGMn12
    SolutionIndex: 149
    SolutionNameMin: Cijk_Alik_Bljk_CB_UserArgs_MT128x80x32_MI16x16x4x1_SN_AMAS0_GLVWA2_GLVWB2_GSU1_GSUASB_LBSPPA256_LBSPPB256_LPA2_LPB2_LRVW1_MIAV1_NTC3_NTD3_PLR1_SVW1_TT2_80_VW1_WG64_4_1_WGM1
    SolutionIndex: 150
    SolutionNameMin: Cijk_Alik_Bljk_CB_UserArgs_MT160x128x16_MI16x16x4x1_SN_AMAS0_GLVWA2_GLVWB1_GSU1_GSUASB_LBSPPA128_LBSPPB128_LPA2_LPB1_LRVW1_NTC3_NTD3_PLR5_SVW1_TT5_64_VW1_WG32_8_1
    SolutionIndex: 151
    SolutionNameMin: Cijk_Alik_Bljk_CB_UserArgs_MT112x128x16_MI16x16x4x1_SN_AMAS0_GLVWA1_GLVWB2_GSU1_GSUASB_LBSPPA128_LBSPPB128_LPA1_LPB2_LRVW1_NTC3_NTD3_PLR5_SVW1_TT7_32_VW1_WG16_16_1
    SolutionIndex: 152
    SolutionNameMin: Cijk_Alik_Bljk_CB_UserArgs_MT112x128x32_MI16x16x4x1_SN_AMAS0_GLVWA1_GLVWB2_GSU1_GSUASB_LBSPPA256_LBSPPB256_LPA1_LPB2_LRVW1_NTC3_NTD3_PLR1_SVW1_TT7_32_VW1_WG16_16_1
    SolutionIndex: 153
    SolutionNameMin: Cijk_Alik_Bljk_CB_UserArgs_MT160x128x16_MI16x16x4x1_SN_AMAS0_GLVWA1_GLVWB1_GSU1_GSUASB_LBSPPA128_LBSPPB128_LPA1_LPB1_LRVW1_NTC0_NTD0_PLR1_SVW1_TT10_32_VW1_WG16_16_1
    SolutionIndex: 154
    SolutionNameMin: Cijk_Alik_Bljk_CB_UserArgs_MT160x128x16_MI16x16x4x1_SN_AMAS0_GLVWA2_GLVWB2_GSU1_GSUASB_LBSPPA128_LBSPPB128_LPA2_LPB2_LRVW1_NTC3_NTD3_PLR1_SVW1_TT5_64_VW1_WG32_8_1
    SolutionIndex: 155
    SolutionNameMin: Cijk_Alik_Bljk_CB_UserArgs_MT160x128x16_MI16x16x4x1_SN_AMAS0_GLVWA2_GLVWB1_GSU1_GSUASB_LBSPPA128_LBSPPB128_LPA4_LPB4_LRVW2_NTC3_NTD3_PLR5_SVW1_TT5_64_VW1_WG32_8_1
    SolutionIndex: 156
    SolutionNameMin: Cijk_Alik_Bljk_CB_UserArgs_MT256x128x16_MI16x16x4x1_SN_AMAS0_GLVWA1_GLVWB1_GSU1_GSUASB_LBSPPA128_LBSPPB128_LPA4_LPB4_LRVW2_NTC0_NTD0_PLR5_SVW1_TT8_64_VW1_WG32_8_1
    SolutionIndex: 157
    SolutionNameMin: Cijk_Alik_Bljk_CB_UserArgs_MT224x128x16_MI16x16x4x1_SN_AMAS0_GLVWA1_GLVWB1_GSU1_GSUASB_LBSPPA128_LBSPPB128_LPA1_LPB1_LRVW1_NTC3_NTD3_PLR1_SVW1_TT7_64_VW1_WG32_8_1
    SolutionIndex: 158
    SolutionNameMin: Cijk_Alik_Bljk_CB_UserArgs_MT224x128x16_MI16x16x4x1_SN_AMAS0_GLVWA2_GLVWB1_GSU1_GSUASB_LBSPPA128_LBSPPB128_LPA2_LPB1_LRVW1_NTC3_NTD3_PLR1_SVW1_TT7_64_VW1_WG32_8_1
    SolutionIndex: 159
    SolutionNameMin: Cijk_Alik_Bljk_CB_UserArgs_MT160x128x16_MI16x16x4x1_SN_AMAS0_GLVWA2_GLVWB1_GSU1_GSUASB_LBSPPA128_LBSPPB128_LPA2_LPB1_LRVW1_NTC0_NTD0_PLR1_SVW1_TT5_64_VW1_WG32_8_1
    SolutionIndex: 160
    SolutionNameMin: Cijk_Alik_Bljk_CB_UserArgs_MT160x128x16_MI16x16x4x1_SN_AMAS0_GLVWA2_GLVWB2_GSU1_GSUASB_LBSPPA128_LBSPPB128_LPA4_LPB4_LRVW2_NTC3_NTD3_PLR5_SVW1_TT5_64_VW1_WG32_8_1
    SolutionIndex: 161
    SolutionNameMin: Cijk_Alik_Bljk_CB_UserArgs_MT160x128x16_MI16x16x4x1_SN_AMAS0_GLVWA2_GLVWB1_GSU1_GSUASB_LBSPPA128_LBSPPB128_LPA2_LPB1_LRVW1_NTC3_NTD3_PLR1_SVW1_TT5_64_VW1_WG32_8_1
    SolutionIndex: 162
    SolutionNameMin: Cijk_Alik_Bljk_CB_UserArgs_MT32x64x32_MI16x16x4x1_SN_AMAS0_GLVWA2_GLVWB1_GSU14_GSUAMB_LBSPPA256_LBSPPB256_LPA4_LPB4_LRVW2_NLCA1_NLCB1_PLR9_SVW1_TT2_16_VW1_WG16_16_1
    SolutionIndex: 163
    SolutionNameMin: Cijk_Alik_Bljk_CB_UserArgs_MT32x64x16_MI16x16x4x1_SN_AMAS3_GLVWA2_GLVWB2_GSU14_GSUAMB_LBSPPA256_LBSPPB128_LPA2_LPB2_LRVW1_NLCA1_NLCB1_PLR5_SVW2_TT2_16_VW2_WG16_16_1
    SolutionIndex: 164
    SolutionNameMin: Cijk_Alik_Bljk_CB_UserArgs_MT64x48x16_MI16x16x4x1_SN_AMAS0_GLVWA2_GLVWB1_GSU13_GSUAMB_LBSPPA128_LBSPPB128_LPA2_LPB1_LRVW1_NLCA1_NLCB1_PLR1_SVW1_TT1_48_VW1_WG64_4_1
    SolutionIndex: 165
    SolutionNameMin: Cijk_Alik_Bljk_CB_UserArgs_MT64x64x16_MI16x16x4x1_SN_AMAS0_GLVWA2_GLVWB2_GSU13_GSUAMB_LBSPPA128_LBSPPB128_LPA2_LPB2_LRVW1_NLCA1_NLCB1_PLR1_SVW1_TT1_64_VW1_WG64_4_1
    SolutionIndex: 166
    SolutionNameMin: Cijk_Alik_Bljk_CB_UserArgs_MT32x16x32_MI16x16x4x1_SN_AMAS0_GLVWA2_GLVWB2_GSU1_GSUASB_LBSPPA256_LBSPPB256_LPA2_LPB2_LRVW1_NLCA1_NLCB1_PLR1_SVW1_TT2_16_VW1_WG16_4_4
    SolutionIndex: 167
    SolutionNameMin: Cijk_Alik_Bljk_CB_UserArgs_MT64x48x16_MI16x16x4x1_SN_AMAS3_GLVWA1_GLVWB1_GSU7_GSUAMB_LBSPPA256_LBSPPB128_LPA1_LPB1_LRVW1_NLCA1_NLCB1_PLR3_SVW2_TT2_48_VW2_WG32_4_2
    SolutionIndex: 168
    SolutionNameMin: Cijk_Alik_Bljk_CB_UserArgs_MT64x64x16_MI16x16x4x1_SN_AMAS0_GLVWA2_GLVWB1_GSU9_GSUAMB_LBSPPA128_LBSPPB128_LPA4_LPB4_LRVW2_MIAV1_PLR5_SVW1_TT1_64_VW1_WG64_4_1
    SolutionIndex: 169
    SolutionNameMin: Cijk_Alik_Bljk_CB_UserArgs_MT64x16x32_MI16x16x4x1_SN_AMAS3_GLVWA2_GLVWB2_GSU1_GSUASB_LBSPPA512_LBSPPB256_LPA4_LPB4_LRVW2_MIAV1_PLR5_SVW2_TT2_16_VW2_WG32_4_2
    SolutionIndex: 170
    SolutionNameMin: Cijk_Alik_Bljk_CB_UserArgs_MT64x64x16_MI16x16x4x1_SN_AMAS0_GLVWA2_GLVWB1_GSU7_GSUAMB_LBSPPA128_LBSPPB128_LPA2_LPB1_LRVW1_MIAV1_PLR1_SVW1_TT1_64_VW1_WG64_4_1
    SolutionIndex: 171
    SolutionNameMin: Cijk_Alik_Bljk_CB_UserArgs_MT128x48x32_MI16x16x4x1_SN_AMAS0_GLVWA1_GLVWB2_GSU7_GSUAMB_LBSPPA256_LBSPPB256_LPA4_LPB4_LRVW2_MIAV1_PLR9_SVW1_TT2_48_VW1_WG64_4_1
    SolutionIndex: 172
    SolutionNameMin: Cijk_Alik_Bljk_CB_UserArgs_MT32x48x32_MI16x16x4x1_SN_AMAS0_GLVWA2_GLVWB1_GSU1_GSUASB_LBSPPA256_LBSPPB256_LPA4_LPB4_LRVW2_MIAV1_PLR5_SVW1_TT1_48_VW1_WG32_4_2
    SolutionIndex: 173
    SolutionNameMin: Cijk_Alik_Bljk_CB_UserArgs_MT128x48x16_MI16x16x4x1_SN_AMAS0_GLVWA2_GLVWB1_GSU7_GSUAMB_LBSPPA128_LBSPPB128_LPA4_LPB4_LRVW2_MIAV1_PLR5_SVW1_TT2_48_VW1_WG64_4_1
    SolutionIndex: 174
    SolutionNameMin: Cijk_Alik_Bljk_CB_UserArgs_MT64x32x16_MI16x16x4x1_SN_AMAS3_GLVWA1_GLVWB1_GSU1_GSUASB_LBSPPA256_LBSPPB128_LPA1_LPB1_LRVW1_MIAV1_PLR1_SVW2_TT4_16_VW2_WG16_8_2
    SolutionIndex: 175
    SolutionNameMin: Cijk_Alik_Bljk_CB_UserArgs_MT128x64x16_MI16x16x4x1_SN_AMAS0_GLVWA2_GLVWB1_GSU7_GSUAMB_LBSPPA128_LBSPPB128_LPA2_LPB1_LRVW1_MIAV1_PLR1_SVW1_TT2_64_VW1_WG64_4_1
    SolutionIndex: 176
    SolutionNameMin: Cijk_Alik_Bljk_CB_UserArgs_MT128x64x32_MI16x16x4x1_SN_AMAS0_GLVWA2_GLVWB2_GSU7_GSUAMB_LBSPPA256_LBSPPB256_LPA2_LPB2_LRVW1_MIAV1_PLR1_SVW1_TT2_64_VW1_WG64_4_1
    SolutionIndex: 177
    SolutionNameMin: Cijk_Alik_Bljk_CB_UserArgs_MT32x64x16_MI16x16x4x1_SN_AMAS3_GLVWA1_GLVWB2_GSU1_GSUASB_LBSPPA256_LBSPPB128_LPA1_LPB2_LRVW1_MIAV1_PLR3_SVW2_TT2_32_VW2_WG16_8_2
    SolutionIndex: 178
    SolutionNameMin: Cijk_Alik_Bljk_CB_UserArgs_MT128x48x16_MI16x16x4x1_SN_AMAS3_GLVWA2_GLVWB1_GSU7_GSUAMB_LBSPPA256_LBSPPB128_LPA2_LPB1_LRVW1_MIAV1_PLR1_SVW2_TT2_48_VW2_WG64_4_1
    SolutionIndex: 179
    SolutionNameMin: Cijk_Alik_Bljk_CB_UserArgs_MT128x112x32_MI16x16x4x1_SN_AMAS3_GLVWA1_GLVWB2_GSU7_GSUAMB_LBSPPA512_LBSPPB256_LPA1_LPB2_LRVW1_MIAV0_PLR1_SVW2_TT2_112_VW2_WG64_4_1
    SolutionIndex: 180
    SolutionNameMin: Cijk_Alik_Bljk_CB_UserArgs_MT32x96x16_MI16x16x4x1_SN_AMAS0_GLVWA1_GLVWB2_GSU1_GSUASB_LBSPPA128_LBSPPB128_LPA1_LPB2_LRVW1_MIAV1_PLR3_SVW1_TT1_96_VW1_WG32_4_2
    SolutionIndex: 181
    SolutionNameMin: Cijk_Alik_Bljk_CB_UserArgs_MT64x80x16_MI16x16x4x1_SN_AMAS0_GLVWA2_GLVWB1_GSU2_GSUAMB_LBSPPA128_LBSPPB128_LPA2_LPB1_LRVW1_MIAV1_PLR1_SVW1_TT1_80_VW1_WG64_4_1
    SolutionIndex: 182
    SolutionNameMin: Cijk_Alik_Bljk_CB_UserArgs_MT64x80x32_MI16x16x4x1_SN_AMAS0_GLVWA1_GLVWB2_GSU2_GSUAMB_LBSPPA256_LBSPPB256_LPA1_LPB2_LRVW1_MIAV1_PLR1_SVW1_TT1_80_VW1_WG64_4_1
    SolutionIndex: 183
    SolutionNameMin: Cijk_Alik_Bljk_CB_UserArgs_MT32x64x32_MI16x16x4x1_SN_AMAS3_GLVWA2_GLVWB2_GSU1_GSUASB_LBSPPA512_LBSPPB256_LPA4_LPB4_LRVW2_MIAV1_PLR9_SVW2_TT2_16_VW2_WG16_16_1
    SolutionIndex: 184
    SolutionNameMin: Cijk_Alik_Bljk_CB_UserArgs_MT64x112x32_MI16x16x4x1_SN_AMAS0_GLVWA1_GLVWB2_GSU2_GSUAMB_LBSPPA256_LBSPPB256_LPA4_LPB4_LRVW2_MIAV1_PLR9_SVW1_TT1_112_VW1_WG64_4_1
    SolutionIndex: 185
    SolutionNameMin: Cijk_Alik_Bljk_CB_UserArgs_MT128x32x32_MI16x16x4x1_SN_AMAS3_GLVWA2_GLVWB1_GSU1_GSUASB_LBSPPA512_LBSPPB256_LPA2_LPB1_LRVW1_MIAV1_PLR9_SVW2_TT2_32_VW2_WG64_4_1
    SolutionIndex: 186
    SolutionNameMin: Cijk_Alik_Bljk_CB_UserArgs_MT128x256x16_MI16x16x4x1_SN_AMAS0_GLVWA1_GLVWB2_GSU11_GSUAMB_LBSPPA128_LBSPPB128_LPA1_LPB2_LRVW1_MIAV0_PLR1_SVW1_TT4_128_VW1_WG32_8_1
    SolutionIndex: 187
    SolutionNameMin: Cijk_Alik_Bljk_CB_UserArgs_MT64x112x32_MI16x16x4x1_SN_AMAS0_GLVWA2_GLVWB2_GSU2_GSUAMB_LBSPPA256_LBSPPB256_LPA4_LPB4_LRVW2_MIAV1_PLR9_SVW1_TT1_112_VW1_WG64_4_1
    SolutionIndex: 188
    SolutionNameMin: Cijk_Alik_Bljk_CB_UserArgs_MT128x48x32_MI16x16x4x1_SN_AMAS0_GLVWA2_GLVWB2_GSU1_GSUASB_LBSPPA256_LBSPPB256_LPA2_LPB2_LRVW1_MIAV1_PLR1_SVW1_TT2_48_VW1_WG64_4_1
    SolutionIndex: 189
    SolutionNameMin: Cijk_Alik_Bljk_CB_UserArgs_MT64x96x32_MI16x16x4x1_SN_AMAS0_GLVWA2_GLVWB2_GSU1_GSUASB_LBSPPA256_LBSPPB256_LPA2_LPB2_LRVW1_MIAV1_PLR9_SVW1_TT1_96_VW1_WG64_4_1
    SolutionIndex: 190
    SolutionNameMin: Cijk_Alik_Bljk_CB_UserArgs_MT128x48x32_MI16x16x4x1_SN_AMAS0_GLVWA1_GLVWB2_GSU1_GSUASB_LBSPPA256_LBSPPB256_LPA1_LPB2_LRVW1_MIAV1_PLR1_SVW1_TT2_48_VW1_WG64_4_1
    SolutionIndex: 191
    SolutionNameMin: Cijk_Alik_Bljk_CB_UserArgs_MT64x80x32_MI16x16x4x1_SN_AMAS0_GLVWA2_GLVWB1_GSU1_GSUASB_LBSPPA256_LBSPPB256_LPA2_LPB1_LRVW1_MIAV1_PLR9_SVW1_TT1_80_VW1_WG64_4_1
    SolutionIndex: 192
    SolutionNameMin: Cijk_Alik_Bljk_CB_UserArgs_MT64x64x16_MI16x16x4x1_SN_AMAS0_GLVWA2_GLVWB2_GSU1_GSUASB_LBSPPA128_LBSPPB128_LPA2_LPB2_LRVW1_MIAV1_PLR1_SVW1_TT1_64_VW1_WG64_4_1
    SolutionIndex: 193
    SolutionNameMin: Cijk_Alik_Bljk_CB_UserArgs_MT128x96x32_MI16x16x4x1_SN_AMAS0_GLVWA2_GLVWB2_GSU3_GSUAMB_LBSPPA256_LBSPPB256_LPA2_LPB2_LRVW1_MIAV0_PLR1_SVW1_TT2_96_VW1_WG64_4_1
    SolutionIndex: 194
    SolutionNameMin: Cijk_Alik_Bljk_CB_UserArgs_MT128x48x32_MI16x16x4x1_SN_AMAS3_GLVWA2_GLVWB1_GSU1_GSUASB_LBSPPA512_LBSPPB256_LPA4_LPB4_LRVW2_MIAV1_PLR9_SVW2_TT2_48_VW2_WG64_4_1
    SolutionIndex: 195
    SolutionNameMin: Cijk_Alik_Bljk_CB_UserArgs_MT64x96x32_MI16x16x4x1_SN_AMAS0_GLVWA1_GLVWB2_GSU1_GSUASB_LBSPPA256_LBSPPB256_LPA4_LPB4_LRVW2_MIAV1_PLR9_SVW1_TT1_96_VW1_WG64_4_1
    SolutionIndex: 196
    SolutionNameMin: Cijk_Alik_Bljk_CB_UserArgs_MT64x80x32_MI16x16x4x1_SN_AMAS0_GLVWA1_GLVWB2_GSU1_GSUASB_LBSPPA256_LBSPPB256_LPA1_LPB2_LRVW1_MIAV1_PLR1_SVW1_TT1_80_VW1_WG64_4_1
    SolutionIndex: 197
    SolutionNameMin: Cijk_Alik_Bljk_CB_UserArgs_MT64x160x16_MI16x16x4x1_SN_AMAS0_GLVWA2_GLVWB2_GSU1_GSUASB_LBSPPA128_LBSPPB128_LPA4_LPB4_LRVW2_MIAV1_PLR5_SVW1_TT1_160_VW1_WG64_4_1
    SolutionIndex: 198
    SolutionNameMin: Cijk_Alik_Bljk_CB_UserArgs_MT64x64x16_MI16x16x4x1_SN_AMAS0_GLVWA2_GLVWB1_GSU1_GSUASB_LBSPPA128_LBSPPB128_LPA2_LPB1_LRVW1_MIAV1_PLR5_SVW1_TT1_64_VW1_WG64_4_1
    SolutionIndex: 199
    SolutionNameMin: Cijk_Alik_Bljk_CB_UserArgs_MT64x80x16_MI16x16x4x1_SN_AMAS0_GLVWA2_GLVWB1_GSU2_GSUAMB_LBSPPA128_LBSPPB128_LPA4_LPB4_LRVW2_MIAV1_PLR5_SVW1_TT1_80_VW1_WG64_4_1
    SolutionIndex: 200
    SolutionNameMin: Cijk_Alik_Bljk_CB_UserArgs_MT128x48x32_MI16x16x4x1_SN_AMAS3_GLVWA2_GLVWB1_GSU1_GSUASB_LBSPPA512_LBSPPB256_LPA2_LPB1_LRVW1_MIAV1_PLR9_SVW2_TT2_48_VW2_WG64_4_1
    SolutionIndex: 201
    SolutionNameMin: Cijk_Alik_Bljk_CB_UserArgs_MT128x48x32_MI16x16x4x1_SN_AMAS3_GLVWA2_GLVWB2_GSU1_GSUASB_LBSPPA512_LBSPPB256_LPA4_LPB4_LRVW2_MIAV1_PLR9_SVW2_TT2_48_VW2_WG64_4_1
    SolutionIndex: 202
    SolutionNameMin: Cijk_Alik_Bljk_CB_UserArgs_MT128x80x32_MI16x16x4x1_SN_AMAS0_GLVWA2_GLVWB2_GSU1_GSUASB_LBSPPA256_LBSPPB256_LPA4_LPB4_LRVW2_MIAV1_PLR9_SVW1_TT2_80_VW1_WG64_4_1
    SolutionIndex: 203
    SolutionNameMin: Cijk_Alik_Bljk_CB_UserArgs_MT64x112x16_MI16x16x4x1_SN_AMAS0_GLVWA1_GLVWB1_GSU1_GSUASB_LBSPPA128_LBSPPB128_LPA4_LPB4_LRVW2_MIAV1_PLR5_SVW1_TT1_112_VW1_WG64_4_1
    SolutionIndex: 204
    SolutionNameMin: Cijk_Alik_Bljk_CB_UserArgs_MT64x112x16_MI16x16x4x1_SN_AMAS0_GLVWA2_GLVWB1_GSU1_GSUASB_LBSPPA128_LBSPPB128_LPA2_LPB1_LRVW1_MIAV1_PLR1_SVW1_TT1_112_VW1_WG64_4_1
    SolutionIndex: 205
    SolutionNameMin: Cijk_Alik_Bljk_CB_UserArgs_MT64x176x16_MI16x16x4x1_SN_AMAS0_GLVWA1_GLVWB1_GSU1_GSUASB_LBSPPA128_LBSPPB128_LPA1_LPB1_LRVW1_MIAV0_PLR1_SVW1_TT1_176_VW1_WG64_4_1
    SolutionIndex: 206
    SolutionNameMin: Cijk_Alik_Bljk_CB_UserArgs_MT128x256x16_MI16x16x4x1_SN_AMAS3_GLVWA2_GLVWB1_GSU3_GSUAMB_LBSPPA256_LBSPPB128_LPA2_LPB1_LRVW1_MIAV0_PLR1_SVW2_TT2_256_VW2_WG64_4_1
    SolutionIndex: 207
    SolutionNameMin: Cijk_Alik_Bljk_CB_UserArgs_MT64x112x16_MI16x16x4x1_SN_AMAS0_GLVWA1_GLVWB1_GSU1_GSUASB_LBSPPA128_LBSPPB128_LPA1_LPB1_LRVW1_MIAV1_NTC0_NTD0_PLR1_SVW1_TT1_112_VW1_WG64_4_1_WGM1
    SolutionIndex: 208
    SolutionNameMin: Cijk_Alik_Bljk_CB_UserArgs_MT64x112x32_MI16x16x4x1_SN_AMAS0_GLVWA2_GLVWB1_GSU1_GSUASB_LBSPPA256_LBSPPB256_LPA2_LPB1_LRVW1_MIAV1_NTC3_NTD3_PLR1_SVW1_TT1_112_VW1_WG64_4_1_WGMn12
    SolutionIndex: 209
    SolutionNameMin: Cijk_Alik_Bljk_CB_UserArgs_MT64x112x32_MI16x16x4x1_SN_AMAS0_GLVWA2_GLVWB1_GSU1_GSUASB_LBSPPA256_LBSPPB256_LPA4_LPB4_LRVW2_MIAV1_NTC3_NTD3_PLR9_SVW1_TT1_112_VW1_WG64_4_1_WGMn12
    SolutionIndex: 210
    SolutionNameMin: Cijk_Alik_Bljk_CB_UserArgs_MT64x96x32_MI16x16x4x1_SN_AMAS0_GLVWA2_GLVWB2_GSU1_GSUASB_LBSPPA256_LBSPPB256_LPA4_LPB4_LRVW2_MIAV1_NTC3_NTD3_PLR9_SVW1_TT1_96_VW1_WG64_4_1_WGMn12
    SolutionIndex: 211
    SolutionNameMin: Cijk_Alik_Bljk_CB_UserArgs_MT64x96x16_MI16x16x4x1_SN_AMAS0_GLVWA1_GLVWB2_GSU1_GSUASB_LBSPPA128_LBSPPB128_LPA1_LPB2_LRVW1_MIAV1_NTC3_NTD3_PLR1_SVW1_TT1_96_VW1_WG64_4_1_WGM1
    SolutionIndex: 212
    SolutionNameMin: Cijk_Alik_Bljk_CB_UserArgs_MT128x256x16_MI16x16x4x1_SN_AMAS0_GLVWA1_GLVWB2_GSU3_GSUAMB_LBSPPA128_LBSPPB128_LPA4_LPB4_LRVW2_MIAV0_NTC3_NTD3_PLR5_SVW1_TT4_128_VW1_WG32_8_1_WGMn12
    SolutionIndex: 213
    SolutionNameMin: Cijk_Alik_Bljk_CB_UserArgs_MT64x112x32_MI16x16x4x1_SN_AMAS0_GLVWA2_GLVWB2_GSU1_GSUASB_LBSPPA256_LBSPPB256_LPA2_LPB2_LRVW1_MIAV1_NTC0_NTD0_PLR9_SVW1_TT1_112_VW1_WG64_4_1_WGM1
    SolutionIndex: 214
    SolutionNameMin: Cijk_Alik_Bljk_CB_UserArgs_MT64x112x16_MI16x16x4x1_SN_AMAS0_GLVWA2_GLVWB1_GSU1_GSUASB_LBSPPA128_LBSPPB128_LPA4_LPB4_LRVW2_MIAV1_NTC3_NTD3_PLR5_SVW1_TT1_112_VW1_WG64_4_1_WGMn12
    SolutionIndex: 215
    SolutionNameMin: Cijk_Alik_Bljk_CB_UserArgs_MT128x80x32_MI16x16x4x1_SN_AMAS0_GLVWA2_GLVWB2_GSU1_GSUASB_LBSPPA256_LBSPPB256_LPA4_LPB4_LRVW2_MIAV1_NTC3_NTD3_PLR9_SVW1_TT2_80_VW1_WG64_4_1_WGMn12
    SolutionIndex: 216
    SolutionNameMin: Cijk_Alik_Bljk_CB_UserArgs_MT64x160x8_MI16x16x4x1_SN_AMAS0_GLVWA2_GLVWB1_GSU1_GSUASB_LBSPPA128_LBSPPB128_LPA2_LPB1_LRVW1_MIAV1_NTC3_NTD3_PLR3_SVW1_TT1_160_VW1_WG64_4_1_WGMn12
    SolutionIndex: 217
    SolutionNameMin: Cijk_Alik_Bljk_CB_UserArgs_MT128x80x32_MI16x16x4x1_SN_AMAS3_GLVWA2_GLVWB2_GSU1_GSUASB_LBSPPA512_LBSPPB256_LPA2_LPB2_LRVW1_MIAV1_NTC3_NTD3_PLR1_SVW2_TT2_80_VW2_WG64_4_1_WGM1
    SolutionIndex: 218
    SolutionNameMin: Cijk_Alik_Bljk_CB_UserArgs_MT160x96x16_MI16x16x4x1_SN_AMAS0_GLVWA2_GLVWB1_GSU1_GSUASB_LBSPPA128_LBSPPB128_LPA4_LPB4_LRVW2_MIAV0_NTC0_NTD0_PLR5_SVW1_TT5_48_VW1_WG32_8_1_WGM1
    SolutionIndex: 219
    SolutionNameMin: Cijk_Alik_Bljk_CB_UserArgs_MT112x64x16_MI16x16x4x1_SN_AMAS0_GLVWA1_GLVWB2_GSU1_GSUASB_LBSPPA128_LBSPPB128_LPA4_LPB4_LRVW2_MIAV1_NTC0_NTD0_PLR5_SVW1_TT7_16_VW1_WG16_16_1_WGMn12
    SolutionIndex: 220
    SolutionNameMin: Cijk_Alik_Bljk_CB_UserArgs_MT224x64x16_MI16x16x4x1_SN_AMAS0_GLVWA2_GLVWB2_GSU1_GSUASB_LBSPPA128_LBSPPB128_LPA4_LPB4_LRVW2_MIAV0_NTC3_NTD3_PLR5_SVW1_TT7_32_VW1_WG32_8_1_WGMn12
    SolutionIndex: 221
    SolutionNameMin: Cijk_Alik_Bljk_CB_UserArgs_MT64x160x16_MI16x16x4x1_SN_AMAS0_GLVWA2_GLVWB1_GSU1_GSUASB_LBSPPA128_LBSPPB128_LPA2_LPB1_LRVW1_MIAV1_NTC0_NTD0_PLR1_SVW1_TT1_160_VW1_WG64_4_1_WGM1
    SolutionIndex: 222
    SolutionNameMin: Cijk_Alik_Bljk_CB_UserArgs_MT128x80x16_MI16x16x4x1_SN_AMAS0_GLVWA2_GLVWB1_GSU1_GSUASB_LBSPPA128_LBSPPB128_LPA2_LPB1_LRVW1_MIAV1_NTC3_NTD3_PLR1_SVW1_TT2_80_VW1_WG64_4_1_WGMn12
    SolutionIndex: 223
    SolutionNameMin: Cijk_Alik_Bljk_CB_UserArgs_MT160x128x16_MI16x16x4x1_SN_AMAS0_GLVWA1_GLVWB2_GSU1_GSUASB_LBSPPA128_LBSPPB128_LPA1_LPB2_LRVW1_MIAV0_NTC0_NTD0_PLR1_SVW1_TT5_64_VW1_WG32_8_1_WGMn12
    SolutionIndex: 224
    SolutionNameMin: Cijk_Alik_Bljk_CB_UserArgs_MT64x112x16_MI16x16x4x1_SN_AMAS0_GLVWA2_GLVWB1_GSU1_GSUASB_LBSPPA128_LBSPPB128_LPA4_LPB4_LRVW2_MIAV1_NTC0_NTD0_PLR5_SVW1_TT1_112_VW1_WG64_4_1_WGMn12
    SolutionIndex: 225
    SolutionNameMin: Cijk_Alik_Bljk_CB_UserArgs_MT64x112x16_MI16x16x4x1_SN_AMAS0_GLVWA2_GLVWB1_GSU1_GSUASB_LBSPPA128_LBSPPB128_LPA4_LPB4_LRVW2_MIAV1_NTC0_NTD0_PLR5_SVW1_TT1_112_VW1_WG64_4_1_WGM1
    SolutionIndex: 226
    SolutionNameMin: Cijk_Alik_Bljk_CB_UserArgs_MT128x176x16_MI16x16x4x1_SN_AMAS0_GLVWA1_GLVWB1_GSU1_GSUASB_LBSPPA128_LBSPPB128_LPA1_LPB1_LRVW1_MIAV0_NTC3_NTD3_PLR5_SVW1_TT2_176_VW1_WG64_4_1_WGM1
    SolutionIndex: 227
    SolutionNameMin: Cijk_Alik_Bljk_CB_UserArgs_MT64x112x32_MI16x16x4x1_SN_AMAS0_GLVWA1_GLVWB2_GSU1_GSUASB_LBSPPA256_LBSPPB256_LPA4_LPB4_LRVW2_MIAV1_NTC0_NTD0_PLR9_SVW1_TT1_112_VW1_WG64_4_1_WGMn12
    SolutionIndex: 228
    SolutionNameMin: Cijk_Alik_Bljk_CB_UserArgs_MT64x112x32_MI16x16x4x1_SN_AMAS0_GLVWA2_GLVWB2_GSU1_GSUASB_LBSPPA256_LBSPPB256_LPA4_LPB4_LRVW2_MIAV1_NTC3_NTD3_PLR9_SVW1_TT1_112_VW1_WG64_4_1_WGMn12
    SolutionIndex: 229
    SolutionNameMin: Cijk_Alik_Bljk_CB_UserArgs_MT64x112x16_MI16x16x4x1_SN_AMAS0_GLVWA2_GLVWB1_GSU1_GSUASB_LBSPPA128_LBSPPB128_LPA2_LPB1_LRVW1_MIAV1_NTC3_NTD3_PLR1_SVW1_TT1_112_VW1_WG64_4_1_WGM1
    SolutionIndex: 230
    SolutionNameMin: Cijk_Alik_Bljk_CB_UserArgs_MT224x96x16_MI16x16x4x1_SN_AMAS0_GLVWA2_GLVWB1_LBSPPA128_LPA2_LPB1_LRVW1_PLR5_SVW1_TT7_48_VW1_WG32_8_1
    SolutionIndex: 231
    SolutionNameMin: Cijk_Alik_Bljk_CB_UserArgs_MT192x112x16_MI16x16x4x1_SN_AMAS0_GLVWA1_GLVWB1_LBSPPA128_LPA1_LPB1_LRVW1_PLR5_SVW1_TT3_112_VW1_WG64_4_1
    SolutionIndex: 232
    SolutionNameMin: Cijk_Alik_Bljk_CB_UserArgs_MT192x112x16_MI16x16x4x1_SN_AMAS0_GLVWA2_GLVWB1_LBSPPA128_LPA2_LPB1_LRVW1_PLR1_SVW1_TT3_112_VW1_WG64_4_1
    SolutionIndex: 233
    SolutionNameMin: Cijk_Alik_Bljk_CB_UserArgs_MT256x128x16_MI16x16x4x1_SN_AMAS3_GLVWA2_GLVWB2_LBSPPA256_LPA4_LPB4_LRVW2_PLR5_SVW2_TT4_128_VW2_WG64_4_1
    SolutionIndex: 234
    SolutionNameMin: Cijk_Alik_Bljk_CB_UserArgs_MT224x128x16_MI16x16x4x1_SN_AMAS0_GLVWA2_GLVWB2_LBSPPA128_LPA2_LPB2_LRVW1_PLR1_SVW1_TT7_64_VW1_WG32_8_1
    SolutionIndex: 235
    SolutionNameMin: Cijk_Alik_Bljk_CB_UserArgs_MT224x128x16_MI16x16x4x1_SN_AMAS0_GLVWA1_GLVWB2_LBSPPA128_LPA1_LPB2_LRVW1_PLR1_SVW1_TT7_64_VW1_WG32_8_1
    SolutionIndex: 236
    SolutionNameMin: Cijk_Alik_Bljk_CB_UserArgs_MT192x112x16_MI16x16x4x1_SN_AMAS0_GLVWA1_GLVWB1_LBSPPA128_LPA1_LPB1_LRVW1_PLR1_SVW1_TT3_112_VW1_WG64_4_1
    SolutionIndex: 237
    SolutionNameMin: Cijk_Alik_Bljk_CB_UserArgs_MT192x112x16_MI16x16x4x1_SN_AMAS0_GLVWA2_GLVWB1_LBSPPA128_LPA4_LPB4_LRVW2_PLR5_SVW1_TT3_112_VW1_WG64_4_1
    SolutionIndex: 238
    SolutionNameMin: Cijk_Alik_Bljk_CB_UserArgs_MT160x128x8_MI16x16x4x1_SN_AMAS0_GLVWA1_GLVWB2_LBSPPA128_LPA1_LPB2_LRVW1_PLR1_SVW1_TT5_64_VW1_WG32_8_1
    SolutionIndex: 239
    SolutionNameMin: Cijk_Alik_Bljk_CB_UserArgs_MT224x128x16_MI16x16x4x1_SN_AMAS0_GLVWA1_GLVWB2_LBSPPA128_LPA1_LPB2_LRVW1_PLR5_SVW1_TT7_64_VW1_WG32_8_1
    SolutionIndex: 240
    SolutionNameMin: Cijk_Alik_Bljk_CB_UserArgs_MT224x128x16_MI16x16x4x1_SN_AMAS0_GLVWA2_GLVWB2_LBSPPA128_LPA4_LPB4_LRVW2_PLR5_SVW1_TT7_64_VW1_WG32_8_1
    SolutionIndex: 241
    SolutionNameMin: Cijk_Alik_Bljk_CB_UserArgs_MT256x128x8_MI16x16x4x1_SN_AMAS3_GLVWA2_GLVWB1_LBSPPA128_LPA2_LPB1_LRVW1_PLR3_SVW2_TT4_128_VW2_WG64_4_1
    SolutionIndex: 242
    SolutionNameMin: Cijk_Alik_Bljk_CB_UserArgs_MT224x128x16_MI16x16x4x1_SN_AMAS0_GLVWA2_GLVWB1_LBSPPA128_LPA2_LPB1_LRVW1_PLR1_SVW1_TT7_64_VW1_WG32_8_1
    SolutionIndex: 243
    SolutionNameMin: Cijk_Alik_Bljk_CB_UserArgs_MT160x128x8_MI16x16x4x1_SN_AMAS0_GLVWA1_GLVWB1_LBSPPA128_LPA1_LPB1_LRVW1_PLR1_SVW1_TT5_64_VW1_WG32_8_1
    SolutionIndex: 244
    SolutionNameMin: Cijk_Alik_Bljk_CB_UserArgs_MT160x128x16_MI16x16x4x1_SN_AMAS0_GLVWA1_GLVWB2_LBSPPA128_LPA1_LPB2_LRVW1_PLR1_SVW1_TT5_64_VW1_WG32_8_1
    SolutionIndex: 245
    SolutionNameMin: Cijk_Alik_Bljk_CB_UserArgs_MT160x128x16_MI16x16x4x1_SN_AMAS0_GLVWA2_GLVWB1_LBSPPA128_LPA4_LPB4_LRVW2_PLR5_SVW1_TT5_64_VW1_WG32_8_1
    SolutionIndex: 246
    SolutionNameMin: Cijk_Alik_Bljk_CB_UserArgs_MT224x96x8_MI16x16x4x1_SN_AMAS0_GLVWA1_GLVWB1_LBSPPA128_LPA1_LPB1_LRVW1_PLR1_SVW1_TT7_48_VW1_WG32_8_1
    SolutionIndex: 247
    SolutionNameMin: Cijk_Alik_Bljk_CB_UserArgs_MT160x128x8_MI16x16x4x1_SN_AMAS0_GLVWA1_GLVWB1_LBSPPA128_LPA1_LPB1_LRVW1_PLR1_SVW1_TT10_32_VW1_WG16_16_1
    SolutionIndex: 248
    SolutionNameMin: Cijk_Alik_Bljk_CB_UserArgs_MT16x128x32_MI16x16x4x1_SN_GLVWA1_GLVWB2_GSU6_GSUAMB_LBSPPA256_LBSPPB256_LPA4_LPB4_LRVW2_NLCA1_NLCB1_PLR5_TT1_64_WG16_8_2
    SolutionIndex: 249
    SolutionNameMin: Cijk_Alik_Bljk_CB_UserArgs_MT16x32x32_MI16x16x4x1_SN_GLVWA2_GLVWB2_GSU1_GSUASB_LBSPPA256_LBSPPB256_LPA4_LPB4_LRVW2_NLCA1_NLCB1_PLR5_TT1_16_WG16_8_2
    SolutionIndex: 250
    SolutionNameMin: Cijk_Alik_Bljk_CB_UserArgs_MT32x16x32_MI16x16x4x1_SN_AMAS0_GLVWA2_GLVWB2_GSU1_GSUASB_LBSPPA256_LBSPPB256_LPA4_LPB4_LRVW2_NLCA1_NLCB1_PLR5_SVW1_TT1_16_VW1_WG32_4_2
    SolutionIndex: 251
    SolutionNameMin: Cijk_Alik_Bljk_CB_UserArgs_MT32x64x16_MI16x16x4x1_SN_AMAS0_GLVWA2_GLVWB1_GSU7_GSUAMB_LBSPPA128_LBSPPB128_LPA2_LPB1_LRVW1_NLCA1_NLCB1_PLR5_SVW1_TT1_32_VW1_WG32_8_1
    SolutionIndex: 252
    SolutionNameMin: Cijk_Alik_Bljk_CB_UserArgs_MT32x16x32_MI16x16x4x1_SN_AMAS0_GLVWA2_GLVWB2_GSU1_GSUASB_LBSPPA256_LBSPPB256_LPA2_LPB2_LRVW1_NLCA1_NLCB1_PLR5_SVW1_TT1_16_VW1_WG32_4_2
    SolutionIndex: 253
    SolutionNameMin: Cijk_Alik_Bljk_CB_UserArgs_MT32x32x32_MI16x16x4x1_SN_AMAS3_GLVWA1_GLVWB1_GSU1_GSUASB_LBSPPA512_LBSPPB256_LPA1_LPB1_LRVW1_NLCA1_NLCB1_PLR1_SVW2_TT2_32_VW2_WG16_4_4
    SolutionIndex: 254
    SolutionNameMin: Cijk_Alik_Bljk_CB_UserArgs_MT32x96x16_MI16x16x4x1_SN_AMAS0_GLVWA1_GLVWB1_GSU7_GSUAMB_LBSPPA128_LBSPPB128_LPA4_LPB4_LRVW2_NLCA1_NLCB1_PLR5_SVW1_TT1_48_VW1_WG32_8_1
    SolutionIndex: 255
    SolutionNameMin: Cijk_Alik_Bljk_CB_UserArgs_MT32x128x16_MI16x16x4x1_SN_AMAS0_GLVWA2_GLVWB2_GSU7_GSUAMB_LBSPPA128_LBSPPB128_LPA4_LPB4_LRVW2_NLCA1_NLCB1_PLR5_SVW1_TT1_64_VW1_WG32_8_1
    SolutionIndex: 256
    SolutionNameMin: Cijk_Alik_Bljk_CB_UserArgs_MT32x32x32_MI16x16x4x1_SN_AMAS0_GLVWA1_GLVWB2_GSU1_GSUASB_LBSPPA256_LBSPPB256_LPA4_LPB4_LRVW2_MIAV1_PLR9_SVW1_TT1_16_VW1_WG32_8_1
    SolutionIndex: 257
    SolutionNameMin: Cijk_Alik_Bljk_CB_UserArgs_MT64x16x32_MI16x16x4x1_SN_AMAS0_GLVWA2_GLVWB2_GSU1_GSUASB_LBSPPA256_LBSPPB256_LPA4_LPB4_LRVW2_MIAV1_PLR5_SVW1_TT2_16_VW1_WG32_4_2
    SolutionIndex: 258
    SolutionNameMin: Cijk_Alik_Bljk_CB_UserArgs_MT64x64x32_MI16x16x4x1_SN_AMAS0_GLVWA2_GLVWB2_GSU7_GSUAMB_LBSPPA256_LBSPPB256_LPA2_LPB2_LRVW1_MIAV1_PLR1_SVW1_TT1_64_VW1_WG64_4_1
    SolutionIndex: 259
    SolutionNameMin: Cijk_Alik_Bljk_CB_UserArgs_MT32x48x32_MI16x16x4x1_SN_AMAS0_GLVWA2_GLVWB1_GSU1_GSUASB_LBSPPA256_LBSPPB256_LPA4_LPB4_LRVW2_MIAV1_PLR5_SVW1_TT1_48_VW1_WG32_4_2
    SolutionIndex: 260
    SolutionNameMin: Cijk_Alik_Bljk_CB_UserArgs_MT64x16x32_MI16x16x4x1_SN_AMAS0_GLVWA2_GLVWB2_GSU1_GSUASB_LBSPPA256_LBSPPB256_LPA2_LPB2_LRVW1_MIAV1_PLR5_SVW1_TT2_16_VW1_WG32_4_2
    SolutionIndex: 261
    SolutionNameMin: Cijk_Alik_Bljk_CB_UserArgs_MT64x96x32_MI16x16x4x1_SN_AMAS3_GLVWA2_GLVWB1_GSU7_GSUAMB_LBSPPA512_LBSPPB256_LPA2_LPB1_LRVW1_MIAV1_PLR1_SVW2_TT2_48_VW2_WG32_8_1
    SolutionIndex: 262
    SolutionNameMin: Cijk_Alik_Bljk_CB_UserArgs_MT64x96x32_MI16x16x4x1_SN_AMAS0_GLVWA2_GLVWB1_GSU5_GSUAMB_LBSPPA256_LBSPPB256_LPA2_LPB1_LRVW1_MIAV1_PLR9_SVW1_TT1_96_VW1_WG64_4_1
    SolutionIndex: 263
    SolutionNameMin: Cijk_Alik_Bljk_CB_UserArgs_MT64x64x16_MI16x16x4x1_SN_AMAS0_GLVWA2_GLVWB2_GSU7_GSUAMB_LBSPPA128_LBSPPB128_LPA4_LPB4_LRVW2_MIAV1_PLR5_SVW1_TT1_64_VW1_WG64_4_1
    SolutionIndex: 264
    SolutionNameMin: Cijk_Alik_Bljk_CB_UserArgs_MT64x96x16_MI16x16x4x1_SN_AMAS0_GLVWA1_GLVWB1_GSU5_GSUAMB_LBSPPA128_LBSPPB128_LPA1_LPB1_LRVW1_MIAV1_PLR5_SVW1_TT2_48_VW1_WG32_8_1
    SolutionIndex: 265
    SolutionNameMin: Cijk_Alik_Bljk_CB_UserArgs_MT128x48x32_MI16x16x4x1_SN_AMAS0_GLVWA1_GLVWB2_GSU5_GSUAMB_LBSPPA256_LBSPPB256_LPA4_LPB4_LRVW2_MIAV1_PLR9_SVW1_TT2_48_VW1_WG64_4_1
    SolutionIndex: 266
    SolutionNameMin: Cijk_Alik_Bljk_CB_UserArgs_MT64x32x32_MI16x16x4x1_SN_AMAS0_GLVWA2_GLVWB2_GSU1_GSUASB_LBSPPA256_LBSPPB256_LPA4_LPB4_LRVW2_MIAV1_PLR9_SVW1_TT1_32_VW1_WG64_4_1
    SolutionIndex: 267
    SolutionNameMin: Cijk_Alik_Bljk_CB_UserArgs_MT64x176x16_MI16x16x4x1_SN_AMAS0_GLVWA1_GLVWB1_GSU6_GSUAMB_LBSPPA128_LBSPPB128_LPA1_LPB1_LRVW1_MIAV0_PLR1_SVW1_TT1_176_VW1_WG64_4_1
    SolutionIndex: 268
    SolutionNameMin: Cijk_Alik_Bljk_CB_UserArgs_MT64x48x32_MI16x16x4x1_SN_AMAS3_GLVWA2_GLVWB1_GSU1_GSUASB_LBSPPA512_LBSPPB256_LPA2_LPB1_LRVW1_MIAV1_PLR5_SVW2_TT2_48_VW2_WG32_4_2
    SolutionIndex: 269
    SolutionNameMin: Cijk_Alik_Bljk_CB_UserArgs_MT32x80x32_MI16x16x4x1_SN_AMAS0_GLVWA2_GLVWB2_GSU1_GSUASB_LBSPPA256_LBSPPB256_LPA2_LPB2_LRVW1_MIAV1_PLR1_SVW1_TT1_80_VW1_WG32_4_2
    SolutionIndex: 270
    SolutionNameMin: Cijk_Alik_Bljk_CB_UserArgs_MT128x48x16_MI16x16x4x1_SN_AMAS0_GLVWA2_GLVWB1_GSU5_GSUAMB_LBSPPA128_LBSPPB128_LPA2_LPB1_LRVW1_MIAV1_PLR1_SVW1_TT2_48_VW1_WG64_4_1
    SolutionIndex: 271
    SolutionNameMin: Cijk_Alik_Bljk_CB_UserArgs_MT128x32x32_MI16x16x4x1_SN_AMAS3_GLVWA2_GLVWB1_GSU1_GSUASB_LBSPPA512_LBSPPB256_LPA2_LPB1_LRVW1_MIAV1_PLR9_SVW2_TT2_32_VW2_WG64_4_1
    SolutionIndex: 272
    SolutionNameMin: Cijk_Alik_Bljk_CB_UserArgs_MT64x48x32_MI16x16x4x1_SN_AMAS0_GLVWA2_GLVWB2_GSU1_GSUASB_LBSPPA256_LBSPPB256_LPA4_LPB4_LRVW2_MIAV1_PLR9_SVW1_TT1_48_VW1_WG64_4_1
    SolutionIndex: 273
    SolutionNameMin: Cijk_Alik_Bljk_CB_UserArgs_MT64x80x16_MI16x16x4x1_SN_AMAS0_GLVWA2_GLVWB1_GSU2_GSUAMB_LBSPPA128_LBSPPB128_LPA2_LPB1_LRVW1_MIAV1_PLR1_SVW1_TT1_80_VW1_WG64_4_1
    SolutionIndex: 274
    SolutionNameMin: Cijk_Alik_Bljk_CB_UserArgs_MT128x32x8_MI16x16x4x1_SN_AMAS0_GLVWA1_GLVWB1_GSU1_GSUASB_LBSPPA128_LBSPPB128_LPA1_LPB1_LRVW1_MIAV1_PLR1_SVW1_TT2_32_VW1_WG64_4_1
    SolutionIndex: 275
    SolutionNameMin: Cijk_Alik_Bljk_CB_UserArgs_MT64x112x32_MI16x16x4x1_SN_AMAS0_GLVWA1_GLVWB2_GSU2_GSUAMB_LBSPPA256_LBSPPB256_LPA4_LPB4_LRVW2_MIAV1_PLR9_SVW1_TT1_112_VW1_WG64_4_1
    SolutionIndex: 276
    SolutionNameMin: Cijk_Alik_Bljk_CB_UserArgs_MT64x112x16_MI16x16x4x1_SN_AMAS0_GLVWA1_GLVWB1_GSU2_GSUAMB_LBSPPA128_LBSPPB128_LPA1_LPB1_LRVW1_MIAV1_PLR5_SVW1_TT1_112_VW1_WG64_4_1
    SolutionIndex: 277
    SolutionNameMin: Cijk_Alik_Bljk_CB_UserArgs_MT64x80x16_MI16x16x4x1_SN_AMAS0_GLVWA1_GLVWB1_GSU1_GSUASB_LBSPPA128_LBSPPB128_LPA1_LPB1_LRVW1_MIAV1_PLR1_SVW1_TT1_80_VW1_WG64_4_1
    SolutionIndex: 278
    SolutionNameMin: Cijk_Alik_Bljk_CB_UserArgs_MT64x80x32_MI16x16x4x1_SN_AMAS0_GLVWA1_GLVWB1_GSU1_GSUASB_LBSPPA256_LBSPPB256_LPA4_LPB4_LRVW2_MIAV1_PLR9_SVW1_TT1_80_VW1_WG64_4_1
    SolutionIndex: 279
    SolutionNameMin: Cijk_Alik_Bljk_CB_UserArgs_MT128x48x32_MI16x16x4x1_SN_AMAS0_GLVWA2_GLVWB2_GSU1_GSUASB_LBSPPA256_LBSPPB256_LPA4_LPB4_LRVW2_MIAV1_NTC3_NTD3_PLR9_SVW1_TT2_48_VW1_WG64_4_1_WGM12
    SolutionIndex: 280
    SolutionNameMin: Cijk_Alik_Bljk_CB_UserArgs_MT64x80x32_MI16x16x4x1_SN_AMAS0_GLVWA2_GLVWB2_GSU1_GSUASB_LBSPPA256_LBSPPB256_LPA4_LPB4_LRVW2_MIAV1_NTC3_NTD3_PLR9_SVW1_TT1_80_VW1_WG64_4_1_WGM12
    SolutionIndex: 281
    SolutionNameMin: Cijk_Alik_Bljk_CB_UserArgs_MT64x80x32_MI16x16x4x1_SN_AMAS0_GLVWA1_GLVWB2_GSU1_GSUASB_LBSPPA256_LBSPPB256_LPA4_LPB4_LRVW2_MIAV1_NTC3_NTD3_PLR9_SVW1_TT1_80_VW1_WG64_4_1_WGM12
    SolutionIndex: 282
    SolutionNameMin: Cijk_Alik_Bljk_CB_UserArgs_MT80x128x32_MI16x16x4x1_SN_AMAS0_GLVWA1_GLVWB2_GSU1_GSUASB_LBSPPA256_LBSPPB256_LPA4_LPB4_LRVW2_MIAV1_NTC3_NTD3_PLR9_SVW1_TT5_32_VW1_WG16_16_1_WGM12
    SolutionIndex: 283
    SolutionNameMin: Cijk_Alik_Bljk_CB_UserArgs_MT64x112x16_MI16x16x4x1_SN_AMAS0_GLVWA2_GLVWB1_GSU1_GSUASB_LBSPPA128_LBSPPB128_LPA2_LPB1_LRVW1_MIAV1_NTC3_NTD3_PLR1_SVW1_TT1_112_VW1_WG64_4_1_WGM12
    SolutionIndex: 284
    SolutionNameMin: Cijk_Alik_Bljk_CB_UserArgs_MT64x112x32_MI16x16x4x1_SN_AMAS0_GLVWA1_GLVWB2_GSU1_GSUASB_LBSPPA256_LBSPPB256_LPA4_LPB4_LRVW2_MIAV1_NTC0_NTD0_PLR9_SVW1_TT1_112_VW1_WG64_4_1_WGM12
    SolutionIndex: 285
    SolutionNameMin: Cijk_Alik_Bljk_CB_UserArgs_MT128x80x32_MI16x16x4x1_SN_AMAS3_GLVWA1_GLVWB2_GSU1_GSUASB_LBSPPA512_LBSPPB256_LPA4_LPB4_LRVW2_MIAV1_NTC3_NTD3_PLR9_SVW2_TT2_80_VW2_WG64_4_1_WGM12
    SolutionIndex: 286
    SolutionNameMin: Cijk_Alik_Bljk_CB_UserArgs_MT128x80x16_MI16x16x4x1_SN_AMAS0_GLVWA1_GLVWB1_GSU1_GSUASB_LBSPPA128_LBSPPB128_LPA1_LPB1_LRVW1_MIAV1_NTC0_NTD0_PLR1_SVW1_TT2_80_VW1_WG64_4_1_WGM12
    SolutionIndex: 287
    SolutionNameMin: Cijk_Alik_Bljk_CB_UserArgs_MT128x80x32_MI16x16x4x1_SN_AMAS3_GLVWA1_GLVWB1_GSU1_GSUASB_LBSPPA512_LBSPPB256_LPA1_LPB1_LRVW1_MIAV1_NTC3_NTD3_PLR1_SVW2_TT2_80_VW2_WG64_4_1_WGM12
    SolutionIndex: 288
    SolutionNameMin: Cijk_Alik_Bljk_CB_UserArgs_MT128x80x32_MI16x16x4x1_SN_AMAS0_GLVWA2_GLVWB2_GSU1_GSUASB_LBSPPA256_LBSPPB256_LPA2_LPB2_LRVW1_MIAV1_NTC3_NTD3_PLR1_SVW1_TT2_80_VW1_WG64_4_1_WGM12
    SolutionIndex: 289
    SolutionNameMin: Cijk_Alik_Bljk_CB_UserArgs_MT64x112x32_MI16x16x4x1_SN_AMAS0_GLVWA2_GLVWB2_GSU1_GSUASB_LBSPPA256_LBSPPB256_LPA2_LPB2_LRVW1_MIAV1_NTC3_NTD3_PLR1_SVW1_TT1_112_VW1_WG64_4_1_WGM1
    SolutionIndex: 290
    SolutionNameMin: Cijk_Alik_Bljk_CB_UserArgs_MT64x112x32_MI16x16x4x1_SN_AMAS0_GLVWA2_GLVWB2_GSU1_GSUASB_LBSPPA256_LBSPPB256_LPA4_LPB4_LRVW2_MIAV1_NTC3_NTD3_PLR9_SVW1_TT1_112_VW1_WG64_4_1_WGM12
    SolutionIndex: 291
    SolutionNameMin: Cijk_Alik_Bljk_CB_UserArgs_MT128x80x32_MI16x16x4x1_SN_AMAS0_GLVWA1_GLVWB2_GSU1_GSUASB_LBSPPA256_LBSPPB256_LPA4_LPB4_LRVW2_MIAV1_NTC3_NTD3_PLR9_SVW1_TT2_80_VW1_WG64_4_1_WGM12
    SolutionIndex: 292
    SolutionNameMin: Cijk_Alik_Bljk_CB_UserArgs_MT128x80x32_MI16x16x4x1_SN_AMAS0_GLVWA1_GLVWB2_GSU1_GSUASB_LBSPPA256_LBSPPB256_LPA1_LPB2_LRVW1_MIAV1_NTC3_NTD3_PLR1_SVW1_TT2_80_VW1_WG64_4_1_WGM12
    SolutionIndex: 293
    SolutionNameMin: Cijk_Alik_Bljk_CB_UserArgs_MT128x80x32_MI16x16x4x1_SN_AMAS3_GLVWA2_GLVWB1_GSU1_GSUASB_LBSPPA512_LBSPPB256_LPA4_LPB4_LRVW2_MIAV1_NTC3_NTD3_PLR9_SVW2_TT2_80_VW2_WG64_4_1_WGM12
    SolutionIndex: 294
    SolutionNameMin: Cijk_Alik_Bljk_CB_UserArgs_MT128x112x32_MI16x16x4x1_SN_AMAS3_GLVWA2_GLVWB2_GSU1_GSUASB_LBSPPA0_LBSPPB256_LPA0_LPB4_LRVW2_MIAV0_NTC0_NTD0_PLR9_SVW2_TT2_112_VW2_WG64_4_1_WGM1
    SolutionIndex: 295
    SolutionNameMin: Cijk_Alik_Bljk_CB_UserArgs_MT64x112x16_MI16x16x4x1_SN_AMAS0_GLVWA2_GLVWB1_GSU1_GSUASB_LBSPPA128_LBSPPB128_LPA2_LPB1_LRVW1_MIAV1_NTC3_NTD3_PLR5_SVW1_TT1_112_VW1_WG64_4_1_WGM12
    SolutionIndex: 296
    SolutionNameMin: Cijk_Alik_Bljk_CB_UserArgs_MT128x112x32_MI16x16x4x1_SN_AMAS0_GLVWA2_GLVWB2_GSU1_GSUASB_LBSPPA256_LBSPPB256_LPA2_LPB2_LRVW1_MIAV0_NTC3_NTD3_PLR1_SVW1_TT2_112_VW1_WG64_4_1_WGM12
    SolutionIndex: 297
    SolutionNameMin: Cijk_Alik_Bljk_CB_UserArgs_MT128x112x32_MI16x16x4x1_SN_AMAS0_GLVWA2_GLVWB1_GSU1_GSUASB_LBSPPA256_LBSPPB256_LPA2_LPB1_LRVW1_MIAV0_NTC3_NTD3_PLR1_SVW1_TT2_112_VW1_WG64_4_1_WGM1
    SolutionIndex: 298
    SolutionNameMin: Cijk_Alik_Bljk_CB_UserArgs_MT32x352x16_MI16x16x4x1_SN_AMAS0_GLVWA2_GLVWB1_GSU1_GSUASB_LBSPPA128_LBSPPB128_LPA4_LPB4_LRVW2_MIAV0_NTC3_NTD3_PLR5_SVW1_TT1_176_VW1_WG32_8_1_WGM12
    SolutionIndex: 299
    SolutionNameMin: Cijk_Alik_Bljk_CB_UserArgs_MT64x176x16_MI16x16x4x1_SN_AMAS0_GLVWA2_GLVWB1_GSU1_GSUASB_LBSPPA128_LBSPPB128_LPA4_LPB4_LRVW2_MIAV0_NTC3_NTD3_PLR5_SVW1_TT1_176_VW1_WG64_4_1_WGM12
    SolutionIndex: 300
    SolutionNameMin: Cijk_Alik_Bljk_CB_UserArgs_MT96x160x16_MI16x16x4x1_SN_AMAS0_GLVWA1_GLVWB2_GSU1_GSUASB_LBSPPA128_LBSPPB128_LPA1_LPB2_LRVW1_MIAV0_NTC0_NTD0_PLR1_SVW1_TT3_80_VW1_WG32_8_1_WGM12
    SolutionIndex: 301
    SolutionNameMin: Cijk_Alik_Bljk_CB_UserArgs_MT64x112x16_MI16x16x4x1_SN_AMAS0_GLVWA1_GLVWB1_GSU1_GSUASB_LBSPPA128_LBSPPB128_LPA1_LPB1_LRVW1_MIAV1_NTC3_NTD3_PLR1_SVW1_TT1_112_VW1_WG64_4_1_WGM12
    SolutionIndex: 302
    SolutionNameMin: Cijk_Alik_Bljk_CB_UserArgs_MT128x112x32_MI16x16x4x1_SN_AMAS3_GLVWA2_GLVWB1_GSU1_GSUASB_LBSPPA512_LBSPPB256_LPA2_LPB1_LRVW1_MIAV0_NTC3_NTD3_PLR1_SVW2_TT2_112_VW2_WG64_4_1_WGM12
    SolutionIndex: 303
    SolutionNameMin: Cijk_Alik_Bljk_CB_UserArgs_MT64x112x32_MI16x16x4x1_SN_AMAS0_GLVWA1_GLVWB2_GSU1_GSUASB_LBSPPA256_LBSPPB256_LPA4_LPB4_LRVW2_MIAV1_NTC0_NTD0_PLR9_SVW1_TT1_112_VW1_WG64_4_1_WGM1
    SolutionIndex: 304
    SolutionNameMin: Cijk_Alik_Bljk_CB_UserArgs_MT64x112x16_MI16x16x4x1_SN_AMAS0_GLVWA2_GLVWB1_GSU1_GSUASB_LBSPPA128_LBSPPB128_LPA2_LPB1_LRVW1_MIAV1_NTC3_NTD3_PLR5_SVW1_TT1_112_VW1_WG64_4_1_WGM1
    SolutionIndex: 305
    SolutionNameMin: Cijk_Alik_Bljk_CB_UserArgs_MT64x112x32_MI16x16x4x1_SN_AMAS0_GLVWA2_GLVWB2_GSU1_GSUASB_LBSPPA256_LBSPPB256_LPA4_LPB4_LRVW2_MIAV1_NTC0_NTD0_PLR9_SVW1_TT1_112_VW1_WG64_4_1_WGM1
    SolutionIndex: 306
    SolutionNameMin: Cijk_Alik_Bljk_CB_UserArgs_MT128x112x32_MI16x16x4x1_SN_AMAS0_GLVWA1_GLVWB1_GSU1_GSUASB_LBSPPA0_LBSPPB256_LPA0_LPB4_LRVW2_MIAV0_NTC0_NTD0_PLR9_SVW1_TT2_112_VW1_WG64_4_1_WGM12
    SolutionIndex: 307
    SolutionNameMin: Cijk_Alik_Bljk_CB_UserArgs_MT64x112x16_MI16x16x4x1_SN_AMAS0_GLVWA1_GLVWB1_GSU1_GSUASB_LBSPPA128_LBSPPB128_LPA1_LPB1_LRVW1_MIAV1_NTC0_NTD0_PLR1_SVW1_TT1_112_VW1_WG64_4_1_WGM12
    SolutionIndex: 308
    SolutionNameMin: Cijk_Alik_Bljk_CB_UserArgs_MT64x160x16_MI16x16x4x1_SN_AMAS0_GLVWA2_GLVWB2_GSU1_GSUASB_LBSPPA128_LBSPPB128_LPA2_LPB2_LRVW1_MIAV1_NTC3_NTD3_PLR1_SVW1_TT2_80_VW1_WG32_8_1_WGM12
    SolutionIndex: 309
    SolutionNameMin: Cijk_Alik_Bljk_CB_UserArgs_MT64x160x16_MI16x16x4x1_SN_AMAS3_GLVWA1_GLVWB1_GSU1_GSUASB_LBSPPA256_LBSPPB128_LPA1_LPB1_LRVW1_MIAV1_NTC3_NTD3_PLR1_SVW2_TT2_80_VW2_WG32_8_1_WGM12
    SolutionIndex: 310
    SolutionNameMin: Cijk_Alik_Bljk_CB_UserArgs_MT128x160x16_MI16x16x4x1_SN_AMAS0_GLVWA2_GLVWB1_GSU1_GSUASB_LBSPPA128_LBSPPB128_LPA2_LPB1_LRVW1_MIAV0_NTC0_NTD0_PLR1_SVW1_TT2_160_VW1_WG64_4_1_WGM12
    SolutionIndex: 311
    SolutionNameMin: Cijk_Alik_Bljk_CB_UserArgs_MT128x112x16_MI16x16x4x1_SN_AMAS3_GLVWA1_GLVWB1_GSU1_GSUASB_LBSPPA256_LBSPPB128_LPA1_LPB1_LRVW1_MIAV0_NTC0_NTD0_PLR1_SVW2_TT2_112_VW2_WG64_4_1_WGM12
    SolutionIndex: 312
    SolutionNameMin: Cijk_Alik_Bljk_CB_UserArgs_MT128x112x16_MI16x16x4x1_SN_AMAS3_GLVWA2_GLVWB1_GSU1_GSUASB_LBSPPA256_LBSPPB128_LPA2_LPB1_LRVW1_MIAV0_NTC0_NTD0_PLR1_SVW2_TT2_112_VW2_WG64_4_1_WGM1
    SolutionIndex: 313
    SolutionNameMin: Cijk_Alik_Bljk_CB_UserArgs_MT160x128x16_MI16x16x4x1_SN_AMAS0_GLVWA2_GLVWB1_LBSPPA128_LPA2_LPB1_LRVW1_PLR1_SVW1_TT5_64_VW1_WG32_8_1_WGM12
    SolutionIndex: 314
    SolutionNameMin: Cijk_Alik_Bljk_CB_UserArgs_MT256x80x16_MI16x16x4x1_SN_AMAS0_GLVWA2_GLVWB1_LBSPPA128_LPA2_LPB1_LRVW1_PLR5_SVW1_TT4_80_VW1_WG64_4_1_WGM12
    SolutionIndex: 315
    SolutionNameMin: Cijk_Alik_Bljk_CB_UserArgs_MT128x160x16_MI16x16x4x1_SN_AMAS0_GLVWA2_GLVWB2_LBSPPA128_LPA4_LPB4_LRVW2_PLR5_SVW1_TT2_160_VW1_WG64_4_1_WGM12
    SolutionIndex: 316
    SolutionNameMin: Cijk_Alik_Bljk_CB_UserArgs_MT256x112x16_MI16x16x4x1_SN_AMAS3_GLVWA2_GLVWB1_LBSPPA256_LPA2_LPB1_LRVW1_PLR1_SVW2_TT4_112_VW2_WG64_4_1_WGM1
    SolutionIndex: 317
    SolutionNameMin: Cijk_Alik_Bljk_CB_UserArgs_MT256x112x16_MI16x16x4x1_SN_AMAS0_GLVWA2_GLVWB1_LBSPPA128_LPA2_LPB1_LRVW1_PLR1_SVW1_TT4_112_VW1_WG64_4_1_WGM12
    SolutionIndex: 318
    SolutionNameMin: Cijk_Alik_Bljk_CB_UserArgs_MT128x160x8_MI16x16x4x1_SN_AMAS0_GLVWA2_GLVWB1_LBSPPA128_LPA2_LPB1_LRVW1_PLR3_SVW1_TT4_80_VW1_WG32_8_1_WGM12
    SolutionIndex: 319
    SolutionNameMin: Cijk_Alik_Bljk_CB_UserArgs_MT128x160x16_MI16x16x4x1_SN_AMAS3_GLVWA2_GLVWB2_LBSPPA256_LPA4_LPB4_LRVW2_PLR5_SVW2_TT2_160_VW2_WG64_4_1_WGM12
    SolutionIndex: 320
    SolutionNameMin: Cijk_Alik_Bljk_CB_UserArgs_MT256x128x16_MI16x16x4x1_SN_AMAS3_GLVWA1_GLVWB1_LBSPPA256_LPA1_LPB1_LRVW1_PLR1_SVW2_TT4_128_VW2_WG64_4_1_WGM12
    SolutionIndex: 321
    SolutionNameMin: Cijk_Alik_Bljk_CB_UserArgs_MT256x112x16_MI16x16x4x1_SN_AMAS0_GLVWA2_GLVWB1_LBSPPA128_LPA4_LPB4_LRVW2_PLR5_SVW1_TT4_112_VW1_WG64_4_1_WGM12
    SolutionIndex: 322
    SolutionNameMin: Cijk_Alik_Bljk_CB_UserArgs_MT192x112x16_MI16x16x4x1_SN_AMAS0_GLVWA1_GLVWB1_LBSPPA128_LPA1_LPB1_LRVW1_PLR5_SVW1_TT3_112_VW1_WG64_4_1_WGM1
    SolutionIndex: 323
    SolutionNameMin: Cijk_Alik_Bljk_CB_UserArgs_MT192x112x16_MI16x16x4x1_SN_AMAS0_GLVWA2_GLVWB1_LBSPPA128_LPA2_LPB1_LRVW1_PLR1_SVW1_TT3_112_VW1_WG64_4_1_WGM12
    SolutionIndex: 324
    SolutionNameMin: Cijk_Alik_Bljk_CB_UserArgs_MT256x112x16_MI16x16x4x1_SN_AMAS0_GLVWA1_GLVWB1_LBSPPA128_LPA4_LPB4_LRVW2_PLR5_SVW1_TT4_112_VW1_WG64_4_1_WGM1
    SolutionIndex: 325
    SolutionNameMin: Cijk_Alik_Bljk_CB_UserArgs_MT256x112x16_MI16x16x4x1_SN_AMAS3_GLVWA2_GLVWB1_LBSPPA256_LPA2_LPB1_LRVW1_PLR1_SVW2_TT4_112_VW2_WG64_4_1_WGM12
    SolutionIndex: 326
    SolutionNameMin: Cijk_Alik_Bljk_CB_UserArgs_MT128x160x8_MI16x16x4x1_SN_AMAS0_GLVWA1_GLVWB1_LBSPPA128_LPA1_LPB1_LRVW1_PLR3_SVW1_TT4_80_VW1_WG32_8_1_WGM12
    SolutionIndex: 327
    SolutionNameMin: Cijk_Alik_Bljk_CB_UserArgs_MT128x160x8_MI16x16x4x1_SN_AMAS3_GLVWA1_GLVWB1_LBSPPA128_LPA1_LPB1_LRVW1_PLR1_SVW2_TT2_160_VW2_WG64_4_1_WGM12
    SolutionIndex: 328
    SolutionNameMin: Cijk_Alik_Bljk_CB_UserArgs_MT128x160x8_MI16x16x4x1_SN_AMAS3_GLVWA2_GLVWB1_LBSPPA128_LPA2_LPB1_LRVW1_PLR3_SVW2_TT2_160_VW2_WG64_4_1_WGM1
    SolutionIndex: 329
    SolutionNameMin: Cijk_Alik_Bljk_CB_UserArgs_MT256x112x16_MI16x16x4x1_SN_AMAS3_GLVWA1_GLVWB1_LBSPPA256_LPA4_LPB4_LRVW2_PLR5_SVW2_TT4_112_VW2_WG64_4_1_WGM12
    SolutionIndex: 330
    SolutionNameMin: Cijk_Alik_Bljk_CB_UserArgs_MT256x112x16_MI16x16x4x1_SN_AMAS0_GLVWA1_GLVWB1_LBSPPA128_LPA1_LPB1_LRVW1_PLR1_SVW1_TT4_112_VW1_WG64_4_1_WGM1
    SolutionIndex: 331
    SolutionNameMin: Cijk_Alik_Bljk_CB_UserArgs_MT128x160x8_MI16x16x4x1_SN_AMAS3_GLVWA1_GLVWB1_LBSPPA128_LPA1_LPB1_LRVW1_PLR3_SVW2_TT2_160_VW2_WG64_4_1_WGM12
    SolutionIndex: 332
    SolutionNameMin: Cijk_Alik_Bljk_CB_UserArgs_MT128x112x16_MI16x16x4x1_SN_AMAS3_GLVWA2_GLVWB1_LBSPPA256_LBSPPB128_LPA2_LPB1_LRVW1_PLR1_SVW2_TT2_112_VW2_WG64_4_1
    SolutionIndex: 333
    SolutionNameMin: Cijk_Alik_Bljk_CB_UserArgs_MT128x112x16_MI16x16x4x1_SN_AMAS3_GLVWA2_GLVWB1_LBSPPA256_LBSPPB128_LPA2_LPB1_LRVW1_PLR5_SVW2_TT2_112_VW2_WG64_4_1
    SolutionIndex: 334
    SolutionNameMin: Cijk_Alik_Bljk_CB_UserArgs_MT256x112x16_MI16x16x4x1_SN_AMAS3_GLVWA2_GLVWB1_LBSPPA256_LBSPPB128_LPA4_LPB4_LRVW2_PLR5_SVW2_TT4_112_VW2_WG64_4_1
    SolutionIndex: 335
    SolutionNameMin: Cijk_Alik_Bljk_CB_UserArgs_MT144x128x16_MI16x16x4x1_SN_AMAS0_GLVWA1_GLVWB2_LBSPPA128_LBSPPB128_LPA1_LPB2_LRVW1_PLR1_SVW1_TT9_32_VW1_WG16_16_1
    SolutionIndex: 336
    SolutionNameMin: Cijk_Alik_Bljk_CB_UserArgs_MT128x112x16_MI16x16x4x1_SN_AMAS3_GLVWA1_GLVWB1_LBSPPA256_LBSPPB128_LPA1_LPB1_LRVW1_PLR1_SVW2_TT2_112_VW2_WG64_4_1
    SolutionIndex: 337
    SolutionNameMin: Cijk_Alik_Bljk_CB_UserArgs_MT128x128x16_MI16x16x4x1_SN_AMAS3_GLVWA2_GLVWB1_LBSPPA256_LBSPPB128_LPA4_LPB4_LRVW2_PLR5_SVW2_TT2_128_VW2_WG64_4_1
    SolutionIndex: 338
    SolutionNameMin: Cijk_Alik_Bljk_CB_UserArgs_MT256x96x16_MI16x16x4x1_SN_AMAS3_GLVWA2_GLVWB2_LBSPPA256_LBSPPB128_LPA4_LPB4_LRVW2_PLR5_SVW2_TT4_96_VW2_WG64_4_1
    SolutionIndex: 339
    SolutionNameMin: Cijk_Alik_Bljk_CB_UserArgs_MT128x128x16_MI16x16x4x1_SN_AMAS3_GLVWA2_GLVWB2_LBSPPA256_LBSPPB128_LPA4_LPB4_LRVW2_PLR5_SVW2_TT2_128_VW2_WG64_4_1
    SolutionIndex: 340
    SolutionNameMin: Cijk_Alik_Bljk_CB_UserArgs_MT16x384x16_MI16x16x4x1_SN_GLVWA1_GLVWB2_GSU14_GSUAMB_LBSPPA128_LBSPPB128_LPA4_LPB4_LRVW2_NTB4_PLR5_TT1_96_WG16_16_1
    SolutionIndex: 341
    SolutionNameMin: Cijk_Alik_Bljk_CB_UserArgs_MT16x256x16_MI16x16x4x1_SN_GLVWA1_GLVWB2_GSU7_GSUAMB_LBSPPA128_LBSPPB128_LPA4_LPB4_LRVW2_NTB4_PLR5_TT1_64_WG16_16_1
    SolutionIndex: 342
    SolutionNameMin: Cijk_Alik_Bljk_CB_UserArgs_MT16x448x16_MI16x16x4x1_SN_GLVWA1_GLVWB1_GSU8_GSUAMB_LBSPPA128_LBSPPB128_LPA1_LPB1_LRVW1_NTB4_PLR5_TT1_112_WG16_16_1
    SolutionIndex: 343
    SolutionNameMin: Cijk_Alik_Bljk_CB_UserArgs_MT32x32x32_MI16x16x4x1_SN_AMAS0_GLVWA2_GLVWB1_GSU1_GSUASB_LBSPPA256_LBSPPB256_LPA4_LPB4_LRVW2_MIAV1_NTB0_PLR9_SVW1_TT1_16_VW1_WG32_8_1
    SolutionIndex: 344
    SolutionNameMin: Cijk_Alik_Bljk_CB_UserArgs_MT32x48x32_MI16x16x4x1_SN_AMAS0_GLVWA2_GLVWB1_GSU1_GSUASB_LBSPPA256_LBSPPB256_LPA4_LPB4_LRVW2_MIAV1_NTB0_PLR5_SVW1_TT1_48_VW1_WG32_4_2
    SolutionIndex: 345
    SolutionNameMin: Cijk_Alik_Bljk_CB_UserArgs_MT32x192x32_MI16x16x4x1_SN_AMAS0_GLVWA1_GLVWB1_GSU7_GSUAMB_LBSPPA256_LBSPPB256_LPA4_LPB4_LRVW2_MIAV1_NTB4_PLR9_SVW1_TT2_48_VW1_WG16_16_1
    SolutionIndex: 346
    SolutionNameMin: Cijk_Alik_Bljk_CB_UserArgs_MT32x48x32_MI16x16x4x1_SN_AMAS0_GLVWA2_GLVWB2_GSU1_GSUASB_LBSPPA256_LBSPPB256_LPA2_LPB2_LRVW1_MIAV1_NTB0_PLR1_SVW1_TT1_48_VW1_WG32_4_2
    SolutionIndex: 347
    SolutionNameMin: Cijk_Alik_Bljk_CB_UserArgs_MT32x192x32_MI16x16x4x1_SN_AMAS0_GLVWA1_GLVWB2_GSU5_GSUAMB_LBSPPA256_LBSPPB256_LPA4_LPB4_LRVW2_MIAV1_NTB4_PLR9_SVW1_TT2_48_VW1_WG16_16_1
    SolutionIndex: 348
    SolutionNameMin: Cijk_Alik_Bljk_CB_UserArgs_MT32x32x16_MI16x16x4x1_SN_AMAS0_GLVWA1_GLVWB2_GSU1_GSUASB_LBSPPA128_LBSPPB128_LPA1_LPB2_LRVW1_MIAV1_NTB0_PLR5_SVW1_TT1_16_VW1_WG32_8_1
    SolutionIndex: 349
    SolutionNameMin: Cijk_Alik_Bljk_CB_UserArgs_MT32x64x16_MI16x16x4x1_SN_AMAS0_GLVWA2_GLVWB1_GSU1_GSUASB_LBSPPA128_LBSPPB128_LPA2_LPB1_LRVW1_MIAV1_NTB0_PLR5_SVW1_TT1_32_VW1_WG32_8_1
    SolutionIndex: 350
    SolutionNameMin: Cijk_Alik_Bljk_CB_UserArgs_MT64x240x16_MI16x16x4x1_SN_AMAS0_GLVWA2_GLVWB1_GSU8_GSUAMB_LBSPPA128_LBSPPB128_LPA2_LPB1_LRVW1_MIAV0_NTB4_PLR5_SVW1_TT1_240_VW1_WG64_4_1
    SolutionIndex: 351
    SolutionNameMin: Cijk_Alik_Bljk_CB_UserArgs_MT32x80x32_MI16x16x4x1_SN_AMAS0_GLVWA2_GLVWB1_GSU1_GSUASB_LBSPPA256_LBSPPB256_LPA2_LPB1_LRVW1_MIAV1_NTB0_PLR5_SVW1_TT1_80_VW1_WG32_4_2
    SolutionIndex: 352
    SolutionNameMin: Cijk_Alik_Bljk_CB_UserArgs_MT64x160x16_MI16x16x4x1_SN_AMAS0_GLVWA1_GLVWB2_GSU4_GSUAMB_LBSPPA128_LBSPPB128_LPA1_LPB2_LRVW1_MIAV1_NTB0_PLR5_SVW1_TT2_80_VW1_WG32_8_1
    SolutionIndex: 353
    SolutionNameMin: Cijk_Alik_Bljk_CB_UserArgs_MT64x80x32_MI16x16x4x1_SN_AMAS0_GLVWA2_GLVWB2_GSU2_GSUAMB_LBSPPA256_LBSPPB256_LPA4_LPB4_LRVW2_MIAV1_NTB4_PLR9_SVW1_TT1_80_VW1_WG64_4_1
    SolutionIndex: 354
    SolutionNameMin: Cijk_Alik_Bljk_CB_UserArgs_MT64x112x32_MI16x16x4x1_SN_AMAS0_GLVWA1_GLVWB1_GSU2_GSUAMB_LBSPPA256_LBSPPB256_LPA4_LPB4_LRVW2_MIAV1_NTB0_PLR9_SVW1_TT1_112_VW1_WG64_4_1
    SolutionIndex: 355
    SolutionNameMin: Cijk_Alik_Bljk_CB_UserArgs_MT64x112x32_MI16x16x4x1_SN_AMAS0_GLVWA2_GLVWB2_GSU2_GSUAMB_LBSPPA256_LBSPPB256_LPA4_LPB4_LRVW2_MIAV1_NTB4_PLR9_SVW1_TT1_112_VW1_WG64_4_1
    SolutionIndex: 356
    SolutionNameMin: Cijk_Alik_Bljk_CB_UserArgs_MT128x32x8_MI16x16x4x1_SN_AMAS0_GLVWA1_GLVWB1_GSU1_GSUASB_LBSPPA128_LBSPPB128_LPA1_LPB1_LRVW1_MIAV1_NTB0_PLR1_SVW1_TT2_32_VW1_WG64_4_1
    SolutionIndex: 357
    SolutionNameMin: Cijk_Alik_Bljk_CB_UserArgs_MT64x112x16_MI16x16x4x1_SN_AMAS0_GLVWA2_GLVWB1_GSU2_GSUAMB_LBSPPA128_LBSPPB128_LPA2_LPB1_LRVW1_MIAV1_NTB0_PLR1_SVW1_TT1_112_VW1_WG64_4_1
    SolutionIndex: 358
    SolutionNameMin: Cijk_Alik_Bljk_CB_UserArgs_MT64x112x16_MI16x16x4x1_SN_AMAS0_GLVWA1_GLVWB1_GSU2_GSUAMB_LBSPPA128_LBSPPB128_LPA1_LPB1_LRVW1_MIAV1_NTB0_PLR5_SVW1_TT1_112_VW1_WG64_4_1
    SolutionIndex: 359
    SolutionNameMin: Cijk_Alik_Bljk_CB_UserArgs_MT64x80x16_MI16x16x4x1_SN_AMAS0_GLVWA1_GLVWB1_GSU1_GSUASB_LBSPPA128_LBSPPB128_LPA1_LPB1_LRVW1_MIAV1_NTB0_PLR1_SVW1_TT1_80_VW1_WG64_4_1
    SolutionIndex: 360
    SolutionNameMin: Cijk_Alik_Bljk_CB_UserArgs_MT128x48x32_MI16x16x4x1_SN_AMAS3_GLVWA2_GLVWB1_GSU1_GSUASB_LBSPPA512_LBSPPB256_LPA2_LPB1_LRVW1_MIAV1_NTB0_PLR9_SVW2_TT2_48_VW2_WG64_4_1
    SolutionIndex: 361
    SolutionNameMin: Cijk_Alik_Bljk_CB_UserArgs_MT64x144x16_MI16x16x4x1_SN_AMAS0_GLVWA1_GLVWB1_GSU2_GSUAMB_LBSPPA128_LBSPPB128_LPA1_LPB1_LRVW1_MIAV1_NTB0_PLR1_SVW1_TT1_144_VW1_WG64_4_1
    SolutionIndex: 362
    SolutionNameMin: Cijk_Alik_Bljk_CB_UserArgs_MT64x112x16_MI16x16x4x1_SN_AMAS0_GLVWA1_GLVWB1_GSU1_GSUASB_LBSPPA128_LBSPPB128_LPA1_LPB1_LRVW1_MIAV1_NTB0_PLR1_SVW1_TT1_112_VW1_WG64_4_1
    SolutionIndex: 363
    SolutionNameMin: Cijk_Alik_Bljk_CB_UserArgs_MT64x112x32_MI16x16x4x1_SN_AMAS0_GLVWA2_GLVWB1_GSU1_GSUASB_LBSPPA256_LBSPPB256_LPA2_LPB1_LRVW1_MIAV1_NTB0_PLR1_SVW1_TT1_112_VW1_WG64_4_1
    SolutionIndex: 364
    SolutionNameMin: Cijk_Alik_Bljk_CB_UserArgs_MT128x112x16_MI16x16x4x1_SN_AMAS3_GLVWA1_GLVWB1_GSU2_GSUAMB_LBSPPA256_LBSPPB128_LPA4_LPB4_LRVW2_MIAV0_NTB4_PLR5_SVW2_TT2_112_VW2_WG64_4_1
    SolutionIndex: 365
    SolutionNameMin: Cijk_Alik_Bljk_CB_UserArgs_MT128x80x32_MI16x16x4x1_SN_AMAS0_GLVWA1_GLVWB1_GSU1_GSUASB_LBSPPA256_LBSPPB256_LPA4_LPB4_LRVW2_MIAV1_NTB0_NTC3_NTD3_PLR9_SVW1_TT2_80_VW1_WG64_4_1
    SolutionIndex: 366
    SolutionNameMin: Cijk_Alik_Bljk_CB_UserArgs_MT64x112x16_MI16x16x4x1_SN_AMAS0_GLVWA2_GLVWB1_GSU1_GSUASB_LBSPPA128_LBSPPB128_LPA2_LPB1_LRVW1_MIAV1_NTB0_NTC3_NTD3_PLR1_SVW1_TT1_112_VW1_WG64_4_1
    SolutionIndex: 367
    SolutionNameMin: Cijk_Alik_Bljk_CB_UserArgs_MT64x112x16_MI16x16x4x1_SN_AMAS0_GLVWA2_GLVWB1_GSU1_GSUASB_LBSPPA128_LBSPPB128_LPA2_LPB1_LRVW1_MIAV1_NTB0_NTC0_NTD0_PLR1_SVW1_TT1_112_VW1_WG64_4_1
    SolutionIndex: 368
    SolutionNameMin: Cijk_Alik_Bljk_CB_UserArgs_MT128x80x32_MI16x16x4x1_SN_AMAS0_GLVWA2_GLVWB2_GSU1_GSUASB_LBSPPA256_LBSPPB256_LPA2_LPB2_LRVW1_MIAV1_NTB0_NTC3_NTD3_PLR1_SVW1_TT2_80_VW1_WG64_4_1
    SolutionIndex: 369
    SolutionNameMin: Cijk_Alik_Bljk_CB_UserArgs_MT128x80x32_MI16x16x4x1_SN_AMAS0_GLVWA2_GLVWB2_GSU1_GSUASB_LBSPPA256_LBSPPB256_LPA4_LPB4_LRVW2_MIAV1_NTB0_NTC0_NTD0_PLR9_SVW1_TT2_80_VW1_WG64_4_1
    SolutionIndex: 370
    SolutionNameMin: Cijk_Alik_Bljk_CB_UserArgs_MT128x112x32_MI16x16x4x1_SN_AMAS0_GLVWA2_GLVWB1_GSU1_GSUASB_LBSPPA256_LBSPPB256_LPA2_LPB1_LRVW1_MIAV0_NTB0_NTC3_NTD3_PLR1_SVW1_TT2_112_VW1_WG64_4_1
    SolutionIndex: 371
    SolutionNameMin: Cijk_Alik_Bljk_CB_UserArgs_MT128x112x16_MI16x16x4x1_SN_AMAS3_GLVWA1_GLVWB1_GSU1_GSUASB_LBSPPA256_LBSPPB128_LPA1_LPB1_LRVW1_MIAV0_NTB0_NTC0_NTD0_PLR5_SVW2_TT2_112_VW2_WG64_4_1
    SolutionIndex: 372
    SolutionNameMin: Cijk_Alik_Bljk_CB_UserArgs_MT128x112x32_MI16x16x4x1_SN_AMAS3_GLVWA2_GLVWB1_GSU1_GSUASB_LBSPPA512_LBSPPB256_LPA2_LPB1_LRVW1_MIAV0_NTB0_NTC3_NTD3_PLR1_SVW2_TT2_112_VW2_WG64_4_1
    SolutionIndex: 373
    SolutionNameMin: Cijk_Alik_Bljk_CB_UserArgs_MT128x112x16_MI16x16x4x1_SN_AMAS0_GLVWA2_GLVWB1_GSU1_GSUASB_LBSPPA128_LBSPPB128_LPA2_LPB1_LRVW1_NTC0_NTD0_PLR5_SVW1_TT2_112_VW1_WG64_4_1
    SolutionIndex: 374
    SolutionNameMin: Cijk_Alik_Bljk_CB_UserArgs_MT128x112x16_MI16x16x4x1_SN_AMAS0_GLVWA2_GLVWB1_GSU1_GSUASB_LBSPPA128_LBSPPB128_LPA2_LPB1_LRVW1_NTC3_NTD3_PLR1_SVW1_TT2_112_VW1_WG64_4_1
    SolutionIndex: 375
    SolutionNameMin: Cijk_Alik_Bljk_CB_UserArgs_MT128x112x32_MI16x16x4x1_SN_AMAS0_GLVWA1_GLVWB1_GSU1_GSUASB_LBSPPA256_LBSPPB256_LPA1_LPB1_LRVW1_NTC0_NTD0_PLR1_SVW1_TT2_112_VW1_WG64_4_1
    SolutionIndex: 376
    SolutionNameMin: Cijk_Alik_Bljk_CB_UserArgs_MT256x80x16_MI16x16x4x1_SN_AMAS3_GLVWA2_GLVWB1_GSU1_GSUASB_LBSPPA256_LBSPPB128_LPA2_LPB1_LRVW1_NTC0_NTD0_PLR5_SVW2_TT4_80_VW2_WG64_4_1
    SolutionIndex: 377
    SolutionNameMin: Cijk_Alik_Bljk_CB_UserArgs_MT128x160x16_MI16x16x4x1_SN_AMAS0_GLVWA1_GLVWB2_GSU1_GSUASB_LBSPPA128_LBSPPB128_LPA1_LPB2_LRVW1_NTC0_NTD0_PLR1_SVW1_TT4_80_VW1_WG32_8_1
    SolutionIndex: 378
    SolutionNameMin: Cijk_Alik_Bljk_CB_UserArgs_MT256x80x16_MI16x16x4x1_SN_AMAS0_GLVWA1_GLVWB1_GSU1_GSUASB_LBSPPA128_LBSPPB128_LPA1_LPB1_LRVW1_NTC0_NTD0_PLR1_SVW1_TT4_80_VW1_WG64_4_1
    SolutionIndex: 379
    SolutionNameMin: Cijk_Alik_Bljk_CB_UserArgs_MT128x112x32_MI16x16x4x1_SN_AMAS0_GLVWA2_GLVWB2_GSU1_GSUASB_LBSPPA0_LBSPPB256_LPA0_LPB4_LRVW2_NTC3_NTD3_PLR9_SVW1_TT2_112_VW1_WG64_4_1
    SolutionIndex: 380
    SolutionNameMin: Cijk_Alik_Bljk_CB_UserArgs_MT128x112x16_MI16x16x4x1_SN_AMAS0_GLVWA1_GLVWB1_GSU1_GSUASB_LBSPPA128_LBSPPB128_LPA1_LPB1_LRVW1_NTC3_NTD3_PLR1_SVW1_TT2_112_VW1_WG64_4_1
    SolutionIndex: 381
    SolutionNameMin: Cijk_Alik_Bljk_CB_UserArgs_MT256x112x16_MI16x16x4x1_SN_AMAS3_GLVWA1_GLVWB1_GSU1_GSUASB_LBSPPA256_LBSPPB128_LPA1_LPB1_LRVW1_NTC3_NTD3_PLR1_SVW2_TT4_112_VW2_WG64_4_1
    SolutionIndex: 382
    SolutionNameMin: Cijk_Alik_Bljk_CB_UserArgs_MT128x208x16_MI16x16x4x1_SN_AMAS0_GLVWA1_GLVWB1_LBSPPA128_LPA1_LPB1_LRVW1_PLR5_SVW1_TT2_208_VW1_WG64_4_1
    SolutionIndex: 383
    SolutionNameMin: Cijk_Alik_Bljk_CB_UserArgs_MT96x224x16_MI16x16x4x1_SN_AMAS0_GLVWA2_GLVWB1_LBSPPA128_LPA2_LPB1_LRVW1_PLR5_SVW1_TT3_112_VW1_WG32_8_1
    SolutionIndex: 384
    SolutionNameMin: Cijk_Alik_Bljk_CB_UserArgs_MT192x112x16_MI16x16x4x1_SN_AMAS0_GLVWA1_GLVWB1_LBSPPA128_LPA1_LPB1_LRVW1_PLR1_SVW1_TT3_112_VW1_WG64_4_1
    SolutionIndex: 385
    SolutionNameMin: Cijk_Alik_Bljk_CB_UserArgs_MT256x128x16_MI16x16x4x1_SN_AMAS3_GLVWA1_GLVWB2_LBSPPA256_LPA1_LPB2_LRVW1_PLR5_SVW2_TT4_128_VW2_WG64_4_1
    SolutionIndex: 386
    SolutionNameMin: Cijk_Alik_Bljk_CB_UserArgs_MT256x112x16_MI16x16x4x1_SN_AMAS0_GLVWA2_GLVWB1_LBSPPA128_LPA4_LPB4_LRVW2_PLR5_SVW1_TT4_112_VW1_WG64_4_1
    SolutionIndex: 387
    SolutionNameMin: Cijk_Alik_Bljk_CB_UserArgs_MT256x112x16_MI16x16x4x1_SN_AMAS0_GLVWA1_GLVWB1_LBSPPA128_LPA1_LPB1_LRVW1_PLR1_SVW1_TT4_112_VW1_WG64_4_1
    SolutionIndex: 388
    SolutionNameMin: Cijk_Alik_Bljk_CB_UserArgs_MT96x224x8_MI16x16x4x1_SN_AMAS0_GLVWA1_GLVWB1_LBSPPA128_LPA1_LPB1_LRVW1_PLR3_SVW1_TT3_112_VW1_WG32_8_1
    SolutionIndex: 389
    SolutionNameMin: Cijk_Alik_Bljk_CB_UserArgs_MT192x112x16_MI16x16x4x1_SN_AMAS0_GLVWA2_GLVWB1_LBSPPA128_LPA4_LPB4_LRVW2_PLR5_SVW1_TT3_112_VW1_WG64_4_1
    SolutionIndex: 390
    SolutionNameMin: Cijk_Alik_Bljk_CB_UserArgs_MT192x112x16_MI16x16x4x1_SN_AMAS0_GLVWA2_GLVWB1_LBSPPA128_LPA2_LPB1_LRVW1_PLR1_SVW1_TT3_112_VW1_WG64_4_1
    SolutionIndex: 391
    SolutionNameMin: Cijk_Alik_Bljk_CB_UserArgs_MT256x128x8_MI16x16x4x1_SN_AMAS3_GLVWA1_GLVWB1_LBSPPA128_LPA1_LPB1_LRVW1_PLR3_SVW2_TT4_128_VW2_WG64_4_1
    SolutionIndex: 392
    SolutionNameMin: Cijk_Alik_Bljk_CB_UserArgs_MT128x224x16_MI16x16x4x1_SN_AMAS3_GLVWA1_GLVWB2_LBSPPA256_LPA4_LPB4_LRVW2_PLR5_SVW2_TT2_224_VW2_WG64_4_1
    SolutionIndex: 393
    SolutionNameMin: Cijk_Alik_Bljk_CB_UserArgs_MT128x160x8_MI16x16x4x1_SN_AMAS0_GLVWA2_GLVWB1_LBSPPA128_LPA2_LPB1_LRVW1_PLR1_SVW1_TT2_160_VW1_WG64_4_1
    SolutionIndex: 394
    SolutionNameMin: Cijk_Alik_Bljk_CB_UserArgs_MT128x160x16_MI16x16x4x1_SN_AMAS3_GLVWA2_GLVWB1_LBSPPA256_LPA2_LPB1_LRVW1_PLR5_SVW2_TT2_160_VW2_WG64_4_1
    SolutionIndex: 395
    SolutionNameMin: Cijk_Alik_Bljk_CB_UserArgs_MT128x160x16_MI16x16x4x1_SN_AMAS0_GLVWA2_GLVWB2_LBSPPA128_LPA4_LPB4_LRVW2_PLR5_SVW1_TT2_160_VW1_WG64_4_1
    SolutionIndex: 396
    SolutionNameMin: Cijk_Alik_Bljk_CB_UserArgs_MT128x160x8_MI16x16x4x1_SN_AMAS0_GLVWA2_GLVWB1_LBSPPA128_LPA2_LPB1_LRVW1_PLR3_SVW1_TT2_160_VW1_WG64_4_1
    SolutionIndex: 397
    SolutionNameMin: Cijk_Alik_Bljk_CB_UserArgs_MT128x224x16_MI16x16x4x1_SN_AMAS0_GLVWA2_GLVWB2_LBSPPA128_LPA4_LPB4_LRVW2_PLR5_SVW1_TT2_224_VW1_WG64_4_1
    SolutionIndex: 398
    SolutionNameMin: Cijk_Alik_Bljk_CB_UserArgs_MT256x112x16_MI16x16x4x1_SN_AMAS3_GLVWA2_GLVWB1_LBSPPA256_LPA4_LPB4_LRVW2_PLR5_SVW2_TT4_112_VW2_WG64_4_1
    SolutionIndex: 399
    SolutionNameMin: Cijk_Alik_Bljk_CB_UserArgs_MT96x224x8_MI16x16x4x1_SN_AMAS0_GLVWA1_GLVWB1_LBSPPA128_LPA1_LPB1_LRVW1_PLR1_SVW1_TT3_112_VW1_WG32_8_1
    SolutionIndex: 400
    SolutionNameMin: Cijk_Alik_Bljk_CB_UserArgs_MT128x224x16_MI16x16x4x1_SN_AMAS0_GLVWA1_GLVWB1_LBSPPA128_LPA1_LPB1_LRVW1_PLR5_SVW1_TT2_224_VW1_WG64_4_1
    SolutionIndex: 401
    SolutionNameMin: Cijk_Alik_Bljk_CB_UserArgs_MT256x112x16_MI16x16x4x1_SN_AMAS0_GLVWA1_GLVWB1_LBSPPA128_LPA4_LPB4_LRVW2_PLR5_SVW1_TT4_112_VW1_WG64_4_1
    SolutionIndex: 402
    SolutionNameMin: Cijk_Alik_Bljk_CB_UserArgs_MT256x112x16_MI16x16x4x1_SN_AMAS3_GLVWA1_GLVWB1_LBSPPA256_LPA1_LPB1_LRVW1_PLR1_SVW2_TT4_112_VW2_WG64_4_1
    SolutionIndex: 403
    SolutionNameMin: Cijk_Alik_Bljk_CB_UserArgs_MT128x112x16_MI16x16x4x1_SN_AMAS3_GLVWA1_GLVWB1_LBSPPA256_LBSPPB128_LPA1_LPB1_LRVW1_MIAV0_PLR1_SVW2_TT2_112_VW2_WG64_4_1
    SolutionIndex: 404
    SolutionNameMin: Cijk_Alik_Bljk_CB_UserArgs_MT128x112x16_MI16x16x4x1_SN_AMAS0_GLVWA1_GLVWB1_LBSPPA128_LBSPPB128_LPA1_LPB1_LRVW1_MIAV0_PLR1_SVW1_TT2_112_VW1_WG64_4_1
    SolutionIndex: 405
    SolutionNameMin: Cijk_Alik_Bljk_CB_UserArgs_MT112x256x16_MI16x16x4x1_SN_AMAS0_GLVWA1_GLVWB2_LBSPPA128_LBSPPB128_LPA4_LPB4_LRVW2_MIAV0_PLR5_SVW1_TT7_64_VW1_WG16_16_1
    SolutionIndex: 406
    SolutionNameMin: Cijk_Alik_Bljk_CB_UserArgs_MT96x96x16_MI16x16x4x1_SN_AMAS0_GLVWA2_GLVWB2_LBSPPA128_LBSPPB128_LPA2_LPB2_LRVW1_MIAV1_PLR1_SVW1_TT3_48_VW1_WG32_8_1
    SolutionIndex: 407
    SolutionNameMin: Cijk_Alik_Bljk_CB_UserArgs_MT128x96x16_MI16x16x4x1_SN_AMAS3_GLVWA2_GLVWB1_LBSPPA256_LBSPPB128_LPA2_LPB1_LRVW1_MIAV0_PLR1_SVW2_TT2_96_VW2_WG64_4_1
    SolutionIndex: 408
    SolutionNameMin: Cijk_Alik_Bljk_CB_UserArgs_MT128x144x16_MI16x16x4x1_SN_AMAS3_GLVWA2_GLVWB1_LBSPPA256_LBSPPB128_LPA4_LPB4_LRVW2_MIAV0_PLR5_SVW2_TT2_144_VW2_WG64_4_1
    SolutionIndex: 409
    SolutionNameMin: Cijk_Alik_Bljk_CB_UserArgs_MT96x128x16_MI16x16x4x1_SN_AMAS0_GLVWA2_GLVWB2_LBSPPA128_LBSPPB128_LPA2_LPB2_LRVW1_MIAV0_PLR1_SVW1_TT3_64_VW1_WG32_8_1
    SolutionIndex: 410
    SolutionNameMin: Cijk_Alik_Bljk_CB_UserArgs_MT128x96x16_MI16x16x4x1_SN_AMAS3_GLVWA1_GLVWB2_LBSPPA256_LBSPPB128_LPA1_LPB2_LRVW1_MIAV0_PLR1_SVW2_TT2_96_VW2_WG64_4_1
    SolutionIndex: 411
    SolutionNameMin: Cijk_Alik_Bljk_CB_UserArgs_MT96x96x16_MI16x16x4x1_SN_AMAS0_GLVWA2_GLVWB1_LBSPPA128_LBSPPB128_LPA4_LPB4_LRVW2_MIAV1_PLR5_SVW1_TT3_48_VW1_WG32_8_1
    SolutionIndex: 412
    SolutionNameMin: Cijk_Alik_Bljk_CB_UserArgs_MT160x128x8_MI16x16x4x1_SN_AMAS3_GLVWA1_GLVWB1_LBSPPA128_LBSPPB128_LPA1_LPB1_LRVW1_MIAV0_PLR3_SVW2_TT10_32_VW2_WG16_16_1
    SolutionIndex: 413
    SolutionNameMin: Cijk_Alik_Bljk_CB_UserArgs_MT128x128x8_MI16x16x4x1_SN_AMAS3_GLVWA1_GLVWB1_LBSPPA128_LBSPPB128_LPA1_LPB1_LRVW1_MIAV0_PLR3_SVW2_TT2_128_VW2_WG64_4_1
    SolutionIndex: 414
    SolutionNameMin: Cijk_Alik_Bljk_CB_UserArgs_MT112x128x16_MI16x16x4x1_SN_AMAS0_GLVWA1_GLVWB1_LBSPPA128_LBSPPB128_LPA1_LPB1_LRVW1_MIAV0_PLR5_SVW1_TT7_32_VW1_WG16_16_1
    SolutionIndex: 415
    SolutionNameMin: Cijk_Alik_Bljk_CB_UserArgs_MT192x128x16_MI16x16x4x1_SN_AMAS3_GLVWA2_GLVWB2_LBSPPA256_LBSPPB128_LPA4_LPB4_LRVW2_MIAV0_PLR5_SVW2_TT6_64_VW2_WG32_8_1
    SolutionIndex: 416
    SolutionNameMin: Cijk_Alik_Bljk_CB_UserArgs_MT256x128x16_MI16x16x4x1_SN_AMAS3_GLVWA2_GLVWB2_LBSPPA256_LBSPPB128_LPA4_LPB4_LRVW2_MIAV0_PLR5_SVW2_TT4_128_VW2_WG64_4_1
    SolutionIndex: 417
    SolutionNameMin: Cijk_Alik_Bljk_CB_UserArgs_MT192x128x16_MI16x16x4x1_SN_AMAS0_GLVWA2_GLVWB2_LBSPPA128_LBSPPB128_LPA4_LPB4_LRVW2_MIAV0_PLR5_SVW1_TT3_128_VW1_WG64_4_1
    SolutionIndex: 418
    SolutionNameMin: Cijk_Alik_Bljk_CB_UserArgs_MT192x96x8_MI16x16x4x1_SN_AMAS3_GLVWA1_GLVWB1_LBSPPA128_LBSPPB128_LPA1_LPB1_LRVW1_MIAV0_PLR1_SVW2_TT6_48_VW2_WG32_8_1
    SolutionIndex: 419
    SolutionNameMin: Cijk_Alik_Bljk_CB_UserArgs_MT128x128x8_MI16x16x4x1_SN_AMAS0_GLVWA2_GLVWB1_LBSPPA128_LBSPPB128_LPA2_LPB1_LRVW1_MIAV0_PLR1_SVW1_TT4_64_VW1_WG32_8_1
    SolutionIndex: 420
    SolutionNameMin: Cijk_Alik_Bljk_CB_UserArgs_MT16x96x32_MI16x16x4x1_SN_GLVWA2_GLVWB2_GSU1_GSUASB_LBSPPA256_LBSPPB256_LPA4_LPB4_LRVW2_NTB0_NTC0_NTD0_PLR5_TT1_48_WG16_8_2
    SolutionIndex: 421
    SolutionNameMin: Cijk_Alik_Bljk_CB_UserArgs_MT16x96x32_MI16x16x4x1_SN_GLVWA2_GLVWB2_GSU1_GSUASB_LBSPPA256_LBSPPB256_LPA4_LPB4_LRVW2_NTB4_NTC3_NTD3_PLR5_TT1_48_WG16_8_2
    SolutionIndex: 422
    SolutionNameMin: Cijk_Alik_Bljk_CB_UserArgs_MT32x96x16_MI16x16x4x1_SN_AMAS0_GLVWA2_GLVWB1_GSU1_GSUASB_LBSPPA128_LBSPPB128_LPA2_LPB1_LRVW1_MIAV1_NTB0_NTC3_NTD3_PLR3_SVW1_TT1_96_VW1_WG32_4_2
    SolutionIndex: 423
    SolutionNameMin: Cijk_Alik_Bljk_CB_UserArgs_MT32x96x32_MI16x16x4x1_SN_AMAS3_GLVWA2_GLVWB2_GSU1_GSUASB_LBSPPA512_LBSPPB256_LPA2_LPB2_LRVW1_MIAV1_NTB4_NTC3_NTD3_PLR1_SVW2_TT2_48_VW2_WG16_8_2
    SolutionIndex: 424
    SolutionNameMin: Cijk_Alik_Bljk_CB_UserArgs_MT32x288x16_MI16x16x4x1_SN_AMAS0_GLVWA1_GLVWB1_GSU4_GSUAMB_LBSPPA128_LBSPPB128_LPA1_LPB1_LRVW1_MIAV1_NTB4_NTC0_NTD0_PLR5_SVW1_TT1_144_VW1_WG32_8_1
    SolutionIndex: 425
    SolutionNameMin: Cijk_Alik_Bljk_CB_UserArgs_MT64x80x32_MI16x16x4x1_SN_AMAS0_GLVWA2_GLVWB2_GSU1_GSUASB_LBSPPA256_LBSPPB256_LPA2_LPB2_LRVW1_MIAV1_NTB0_NTC0_NTD0_PLR9_SVW1_TT1_80_VW1_WG64_4_1
    SolutionIndex: 426
    SolutionNameMin: Cijk_Alik_Bljk_CB_UserArgs_MT64x80x16_MI16x16x4x1_SN_AMAS0_GLVWA1_GLVWB1_GSU1_GSUASB_LBSPPA128_LBSPPB128_LPA4_LPB4_LRVW2_MIAV1_NTB0_NTC3_NTD3_PLR5_SVW1_TT1_80_VW1_WG64_4_1
    SolutionIndex: 427
    SolutionNameMin: Cijk_Alik_Bljk_CB_UserArgs_MT64x144x16_MI16x16x4x1_SN_AMAS0_GLVWA1_GLVWB1_GSU2_GSUAMB_LBSPPA128_LBSPPB128_LPA1_LPB1_LRVW1_MIAV1_NTB4_NTC0_NTD0_PLR5_SVW1_TT1_144_VW1_WG64_4_1
    SolutionIndex: 428
    SolutionNameMin: Cijk_Alik_Bljk_CB_UserArgs_MT64x144x16_MI16x16x4x1_SN_AMAS0_GLVWA1_GLVWB1_GSU1_GSUASB_LBSPPA128_LBSPPB128_LPA1_LPB1_LRVW1_MIAV1_NTB0_NTC3_NTD3_PLR1_SVW1_TT1_144_VW1_WG64_4_1
    SolutionIndex: 429
    SolutionNameMin: Cijk_Alik_Bljk_CB_UserArgs_MT64x144x16_MI16x16x4x1_SN_AMAS0_GLVWA2_GLVWB1_GSU1_GSUASB_LBSPPA128_LBSPPB128_LPA2_LPB1_LRVW1_MIAV1_NTB0_NTC3_NTD3_PLR1_SVW1_TT1_144_VW1_WG64_4_1
    SolutionIndex: 430
    SolutionNameMin: Cijk_Alik_Bljk_CB_UserArgs_MT128x160x16_MI16x16x4x1_SN_AMAS0_GLVWA2_GLVWB2_LBSPPA128_LBSPPB128_LPA2_LPB2_LRVW1_NTB0_PLR5_SVW1_TT4_80_VW1_WG32_8_1
    SolutionIndex: 431
    SolutionNameMin: Cijk_Alik_Bljk_CB_UserArgs_MT128x144x16_MI16x16x4x1_SN_AMAS0_GLVWA2_GLVWB1_LBSPPA128_LBSPPB128_LPA2_LPB1_LRVW1_NTB0_PLR1_SVW1_TT2_144_VW1_WG64_4_1
    SolutionIndex: 432
    SolutionNameMin: Cijk_Alik_Bljk_CB_UserArgs_MT128x144x16_MI16x16x4x1_SN_AMAS3_GLVWA2_GLVWB1_LBSPPA256_LBSPPB128_LPA2_LPB1_LRVW1_NTB0_PLR1_SVW2_TT2_144_VW2_WG64_4_1
    SolutionIndex: 433
    SolutionNameMin: Cijk_Alik_Bljk_CB_UserArgs_MT128x96x8_MI16x16x4x1_SN_AMAS0_GLVWA1_GLVWB1_LBSPPA128_LBSPPB128_LPA1_LPB1_LRVW1_MIAV0_PLR3_SVW1_TT2_96_VW1_WG64_4_1
    SolutionIndex: 434
    SolutionNameMin: Cijk_Alik_Bljk_CB_UserArgs_MT128x96x16_MI16x16x4x1_SN_AMAS0_GLVWA2_GLVWB1_LBSPPA128_LBSPPB128_LPA2_LPB1_LRVW1_MIAV0_PLR1_SVW1_TT2_96_VW1_WG64_4_1
    SolutionIndex: 435
    SolutionNameMin: Cijk_Alik_Bljk_CB_UserArgs_MT128x144x16_MI16x16x4x1_SN_AMAS3_GLVWA2_GLVWB1_LBSPPA256_LBSPPB128_LPA2_LPB1_LRVW1_MIAV0_PLR1_SVW2_TT2_144_VW2_WG64_4_1
    SolutionIndex: 436
    SolutionNameMin: Cijk_Alik_Bljk_CB_UserArgs_MT128x144x16_MI16x16x4x1_SN_AMAS3_GLVWA1_GLVWB1_LBSPPA256_LBSPPB128_LPA4_LPB4_LRVW2_MIAV0_PLR5_SVW2_TT2_144_VW2_WG64_4_1
    SolutionIndex: 437
    SolutionNameMin: Cijk_Alik_Bljk_CB_UserArgs_MT128x128x16_MI16x16x4x1_SN_AMAS3_GLVWA1_GLVWB2_LBSPPA256_LBSPPB128_LPA1_LPB2_LRVW1_MIAV0_PLR1_SVW2_TT2_128_VW2_WG64_4_1
    SolutionIndex: 438
    SolutionNameMin: Cijk_Alik_Bljk_CB_UserArgs_MT128x96x8_MI16x16x4x1_SN_AMAS0_GLVWA2_GLVWB1_LBSPPA128_LBSPPB128_LPA2_LPB1_LRVW1_MIAV0_PLR1_SVW1_TT4_48_VW1_WG32_8_1
    SolutionIndex: 439
    SolutionNameMin: Cijk_Alik_Bljk_CB_UserArgs_MT128x128x8_MI16x16x4x1_SN_AMAS3_GLVWA2_GLVWB1_LBSPPA128_LBSPPB128_LPA2_LPB1_LRVW1_MIAV0_PLR1_SVW2_TT4_64_VW2_WG32_8_1
    SolutionIndex: 440
    SolutionNameMin: Cijk_Alik_Bljk_CB_UserArgs_MT128x96x16_MI16x16x4x1_SN_AMAS3_GLVWA2_GLVWB2_LBSPPA256_LBSPPB128_LPA2_LPB2_LRVW1_MIAV0_PLR1_SVW2_TT4_48_VW2_WG32_8_1
- - - [4864, 3072, 1, 4096]
    - [2, 98.131]
  - - [7296, 4096, 1, 4096]
    - [5, 98.311]
  - - [7296, 4608, 1, 4096]
    - [3, 98.365]
  - - [7296, 4608, 1, 8192]
    - [1, 98.588]
  - - [9728, 6144, 1, 4096]
    - [4, 98.434]
  - - [9728, 6144, 1, 8192]
    - [0, 98.657]
  - - [16384, 16384, 1, 4096]
    - [6, 98.361]
  - - [16, 16, 1, 4096]
    - [7, 0.0]
  - - [512, 16, 1, 1024]
    - [8, 0.0]
  - - [1024, 16, 1, 16384]
    - [9, 0.0]
  - - [2048, 16, 1, 1024]
    - [10, 0.0]
  - - [2048, 16, 1, 16384]
    - [11, 0.0]
  - - [3072, 16, 1, 16384]
    - [12, 0.0]
  - - [4096, 16, 1, 4096]
    - [13, 0.0]
  - - [4096, 16, 1, 16384]
    - [14, 0.0]
  - - [8192, 16, 1, 1024]
    - [15, 0.0]
  - - [8192, 16, 1, 16384]
    - [16, 0.0]
  - - [12288, 16, 1, 1024]
    - [17, 0.0]
  - - [12288, 16, 1, 16384]
    - [18, 0.0]
  - - [16384, 16, 1, 1024]
    - [19, 0.0]
  - - [16384, 16, 1, 4096]
    - [20, 0.0]
  - - [16384, 16, 1, 16384]
    - [21, 0.0]
  - - [128, 32, 1, 1024]
    - [22, 0.0]
  - - [128, 32, 1, 4096]
    - [23, 0.0]
  - - [512, 32, 1, 16384]
    - [24, 0.0]
  - - [768, 32, 1, 4096]
    - [25, 0.0]
  - - [768, 32, 1, 16384]
    - [26, 0.0]
  - - [1024, 32, 1, 16384]
    - [27, 0.0]
  - - [2048, 32, 1, 16384]
    - [28, 0.0]
  - - [3072, 32, 1, 4096]
    - [29, 0.0]
  - - [3072, 32, 1, 16384]
    - [30, 0.0]
  - - [4096, 32, 1, 16384]
    - [31, 0.0]
  - - [6144, 32, 1, 1024]
    - [32, 0.0]
  - - [6144, 32, 1, 16384]
    - [33, 0.0]
  - - [8192, 32, 1, 1024]
    - [34, 0.0]
  - - [8192, 32, 1, 4096]
    - [35, 0.0]
  - - [8192, 32, 1, 16384]
    - [36, 0.0]
  - - [12288, 32, 1, 1024]
    - [34, 0.0]
  - - [12288, 32, 1, 4096]
    - [37, 0.0]
  - - [12288, 32, 1, 16384]
    - [38, 0.0]
  - - [16384, 32, 1, 1024]
    - [39, 0.0]
  - - [16384, 32, 1, 4096]
    - [40, 0.0]
  - - [16384, 32, 1, 16384]
    - [41, 0.0]
  - - [16, 64, 1, 4096]
    - [42, 0.0]
  - - [512, 64, 1, 16384]
    - [43, 0.0]
  - - [768, 64, 1, 1024]
    - [44, 0.0]
  - - [768, 64, 1, 16384]
    - [45, 0.0]
  - - [1024, 64, 1, 16384]
    - [46, 0.0]
  - - [1536, 64, 1, 1024]
    - [47, 0.0]
  - - [1536, 64, 1, 16384]
    - [48, 0.0]
  - - [2048, 64, 1, 16384]
    - [49, 0.0]
  - - [3072, 64, 1, 1024]
    - [50, 0.0]
  - - [3072, 64, 1, 16384]
    - [51, 0.0]
  - - [4096, 64, 1, 4096]
    - [52, 0.0]
  - - [4096, 64, 1, 16384]
    - [53, 0.0]
  - - [6144, 64, 1, 1024]
    - [54, 0.0]
  - - [6144, 64, 1, 4096]
    - [55, 0.0]
  - - [6144, 64, 1, 16384]
    - [56, 0.0]
  - - [8192, 64, 1, 1024]
    - [57, 0.0]
  - - [8192, 64, 1, 4096]
    - [58, 0.0]
  - - [8192, 64, 1, 16384]
    - [59, 0.0]
  - - [12288, 64, 1, 1024]
    - [60, 0.0]
  - - [12288, 64, 1, 4096]
    - [61, 0.0]
  - - [12288, 64, 1, 16384]
    - [62, 0.0]
  - - [16384, 64, 1, 256]
    - [63, 0.0]
  - - [16384, 64, 1, 1024]
    - [64, 0.0]
  - - [16384, 64, 1, 4096]
    - [65, 0.0]
  - - [32, 128, 1, 1024]
    - [66, 0.0]
  - - [64, 128, 1, 1024]
    - [67, 0.0]
  - - [512, 128, 1, 16384]
    - [68, 0.0]
  - - [768, 128, 1, 1024]
    - [69, 0.0]
  - - [768, 128, 1, 4096]
    - [70, 0.0]
  - - [768, 128, 1, 16384]
    - [71, 0.0]
  - - [1024, 128, 1, 4096]
    - [72, 0.0]
  - - [1024, 128, 1, 16384]
    - [73, 0.0]
  - - [1536, 128, 1, 16384]
    - [74, 0.0]
  - - [2048, 128, 1, 4096]
    - [75, 0.0]
  - - [2048, 128, 1, 16384]
    - [76, 0.0]
  - - [3072, 128, 1, 1024]
    - [77, 0.0]
  - - [3072, 128, 1, 4096]
    - [78, 0.0]
  - - [3072, 128, 1, 16384]
    - [79, 0.0]
  - - [4096, 128, 1, 1024]
    - [80, 0.0]
  - - [4096, 128, 1, 4096]
    - [81, 0.0]
  - - [4096, 128, 1, 16384]
    - [82, 0.0]
  - - [6144, 128, 1, 1024]
    - [83, 0.0]
  - - [6144, 128, 1, 4096]
    - [84, 0.0]
  - - [6144, 128, 1, 16384]
    - [85, 0.0]
  - - [8192, 128, 1, 256]
    - [86, 0.0]
  - - [8192, 128, 1, 1024]
    - [87, 0.0]
  - - [8192, 128, 1, 4096]
    - [88, 0.0]
  - - [12288, 128, 1, 256]
    - [83, 0.0]
  - - [12288, 128, 1, 1024]
    - [89, 0.0]
  - - [12288, 128, 1, 4096]
    - [90, 0.0]
  - - [16384, 128, 1, 256]
    - [91, 0.0]
  - - [16384, 128, 1, 1024]
    - [92, 0.0]
  - - [16384, 128, 1, 4096]
    - [93, 0.0]
  - - [32, 256, 1, 4096]
    - [94, 0.0]
  - - [64, 256, 1, 16384]
    - [95, 0.0]
  - - [128, 256, 1, 16384]
    - [96, 0.0]
  - - [256, 256, 1, 16384]
    - [97, 0.0]
  - - [512, 256, 1, 1024]
    - [98, 0.0]
  - - [512, 256, 1, 16384]
    - [99, 0.0]
  - - [768, 256, 1, 16384]
    - [100, 0.0]
  - - [1024, 256, 1, 4096]
    - [101, 0.0]
  - - [1024, 256, 1, 16384]
    - [102, 0.0]
  - - [1536, 256, 1, 4096]
    - [103, 0.0]
  - - [1536, 256, 1, 16384]
    - [104, 0.0]
  - - [2048, 256, 1, 1024]
    - [105, 0.0]
  - - [2048, 256, 1, 16384]
    - [106, 0.0]
  - - [3072, 256, 1, 1024]
    - [107, 0.0]
  - - [3072, 256, 1, 4096]
    - [108, 0.0]
  - - [3072, 256, 1, 16384]
    - [109, 0.0]
  - - [4096, 256, 1, 256]
    - [110, 0.0]
  - - [4096, 256, 1, 1024]
    - [111, 0.0]
  - - [4096, 256, 1, 4096]
    - [112, 0.0]
  - - [6144, 256, 1, 1024]
    - [113, 0.0]
  - - [6144, 256, 1, 4096]
    - [114, 0.0]
  - - [8192, 256, 1, 256]
    - [115, 0.0]
  - - [8192, 256, 1, 1024]
    - [116, 0.0]
  - - [8192, 256, 1, 4096]
    - [117, 0.0]
  - - [12288, 256, 1, 256]
    - [118, 0.0]
  - - [12288, 256, 1, 1024]
    - [119, 0.0]
  - - [12288, 256, 1, 4096]
    - [118, 0.0]
  - - [16384, 256, 1, 256]
    - [120, 0.0]
  - - [16384, 256, 1, 1024]
    - [121, 0.0]
  - - [16384, 256, 1, 4096]
    - [122, 0.0]
  - - [16, 512, 1, 1024]
    - [123, 0.0]
  - - [32, 512, 1, 16384]
    - [124, 0.0]
  - - [64, 512, 1, 16384]
    - [125, 0.0]
  - - [128, 512, 1, 4096]
    - [126, 0.0]
  - - [128, 512, 1, 16384]
    - [127, 0.0]
  - - [256, 512, 1, 1024]
    - [128, 0.0]
  - - [256, 512, 1, 4096]
    - [129, 0.0]
  - - [256, 512, 1, 16384]
    - [130, 0.0]
  - - [512, 512, 1, 1024]
    - [131, 0.0]
  - - [512, 512, 1, 4096]
    - [132, 0.0]
  - - [512, 512, 1, 16384]
    - [133, 0.0]
  - - [768, 512, 1, 1024]
    - [134, 0.0]
  - - [768, 512, 1, 4096]
    - [135, 0.0]
  - - [768, 512, 1, 16384]
    - [136, 0.0]
  - - [1024, 512, 1, 4096]
    - [137, 0.0]
  - - [1024, 512, 1, 16384]
    - [138, 0.0]
  - - [1536, 512, 1, 4096]
    - [139, 0.0]
  - - [1536, 512, 1, 16384]
    - [140, 0.0]
  - - [2048, 512, 1, 256]
    - [141, 0.0]
  - - [2048, 512, 1, 1024]
    - [142, 0.0]
  - - [2048, 512, 1, 4096]
    - [143, 0.0]
  - - [3072, 512, 1, 256]
    - [144, 0.0]
  - - [3072, 512, 1, 1024]
    - [145, 0.0]
  - - [3072, 512, 1, 4096]
    - [146, 0.0]
  - - [4096, 512, 1, 256]
    - [147, 0.0]
  - - [4096, 512, 1, 1024]
    - [148, 0.0]
  - - [4096, 512, 1, 4096]
    - [149, 0.0]
  - - [6144, 512, 1, 256]
    - [150, 0.0]
  - - [6144, 512, 1, 1024]
    - [151, 0.0]
  - - [6144, 512, 1, 4096]
    - [152, 0.0]
  - - [8192, 512, 1, 256]
    - [153, 0.0]
  - - [8192, 512, 1, 1024]
    - [154, 0.0]
  - - [8192, 512, 1, 4096]
    - [155, 0.0]
  - - [12288, 512, 1, 256]
    - [156, 0.0]
  - - [12288, 512, 1, 1024]
    - [157, 0.0]
  - - [12288, 512, 1, 4096]
    - [158, 0.0]
  - - [16384, 512, 1, 256]
    - [159, 0.0]
  - - [16384, 512, 1, 1024]
    - [160, 0.0]
  - - [16384, 512, 1, 4096]
    - [161, 0.0]
  - - [32, 768, 1, 16384]
    - [162, 0.0]
  - - [32, 1024, 1, 16384]
    - [163, 0.0]
  - - [64, 768, 1, 16384]
    - [164, 0.0]
  - - [64, 1024, 1, 16384]
    - [165, 0.0]
  - - [64, 1536, 1, 1024]
    - [166, 0.0]
  - - [64, 1536, 1, 16384]
    - [167, 0.0]
  - - [128, 768, 1, 16384]
    - [168, 0.0]
  - - [128, 1024, 1, 1024]
    - [169, 0.0]
  - - [128, 1024, 1, 16384]
    - [170, 0.0]
  - - [128, 1536, 1, 4096]
    - [169, 0.0]
  - - [128, 1536, 1, 16384]
    - [171, 0.0]
  - - [256, 768, 1, 1024]
    - [172, 0.0]
  - - [256, 768, 1, 4096]
    - [173, 0.0]
  - - [256, 768, 1, 16384]
    - [173, 0.0]
  - - [256, 1024, 1, 1024]
    - [174, 0.0]
  - - [256, 1024, 1, 4096]
    - [175, 0.0]
  - - [256, 1024, 1, 16384]
    - [176, 0.0]
  - - [256, 1536, 1, 4096]
    - [177, 0.0]
  - - [256, 1536, 1, 16384]
    - [178, 0.0]
  - - [512, 768, 1, 4096]
    - [139, 0.0]
  - - [512, 768, 1, 16384]
    - [179, 0.0]
  - - [512, 1024, 1, 1024]
    - [180, 0.0]
  - - [512, 1024, 1, 4096]
    - [181, 0.0]
  - - [512, 1024, 1, 16384]
    - [182, 0.0]
  - - [512, 1536, 1, 1024]
    - [183, 0.0]
  - - [512, 1536, 1, 16384]
    - [184, 0.0]
  - - [768, 768, 1, 1024]
    - [185, 0.0]
  - - [768, 768, 1, 16384]
    - [186, 0.0]
  - - [1024, 768, 1, 1024]
    - [142, 0.0]
  - - [1024, 768, 1, 4096]
    - [187, 0.0]
  - - [1024, 768, 1, 16384]
    - [187, 0.0]
  - - [1536, 768, 1, 256]
    - [188, 0.0]
  - - [1536, 768, 1, 1024]
    - [189, 0.0]
  - - [1536, 768, 1, 4096]
    - [190, 0.0]
  - - [768, 1024, 1, 1024]
    - [191, 0.0]
  - - [768, 1024, 1, 4096]
    - [192, 0.0]
  - - [768, 1024, 1, 16384]
    - [193, 0.0]
  - - [1024, 1024, 1, 256]
    - [194, 0.0]
  - - [1024, 1024, 1, 1024]
    - [195, 0.0]
  - - [1024, 1024, 1, 4096]
    - [196, 0.0]
  - - [1536, 1024, 1, 256]
    - [197, 0.0]
  - - [1536, 1024, 1, 1024]
    - [198, 0.0]
  - - [1536, 1024, 1, 4096]
    - [199, 0.0]
  - - [768, 1536, 1, 256]
    - [200, 0.0]
  - - [768, 1536, 1, 1024]
    - [189, 0.0]
  - - [768, 1536, 1, 4096]
    - [201, 0.0]
  - - [1024, 1536, 1, 256]
    - [202, 0.0]
  - - [1024, 1536, 1, 1024]
    - [203, 0.0]
  - - [1024, 1536, 1, 4096]
    - [204, 0.0]
  - - [1536, 1536, 1, 256]
    - [195, 0.0]
  - - [1536, 1536, 1, 1024]
    - [205, 0.0]
  - - [1536, 1536, 1, 4096]
    - [206, 0.0]
  - - [2048, 768, 1, 256]
    - [207, 0.0]
  - - [2048, 768, 1, 1024]
    - [208, 0.0]
  - - [2048, 768, 1, 4096]
    - [209, 0.0]
  - - [3072, 768, 1, 256]
    - [210, 0.0]
  - - [3072, 768, 1, 1024]
    - [211, 0.0]
  - - [3072, 768, 1, 4096]
    - [212, 0.0]
  - - [4096, 768, 1, 256]
    - [213, 0.0]
  - - [4096, 768, 1, 1024]
    - [214, 0.0]
  - - [4096, 768, 1, 4096]
    - [204, 0.0]
  - - [2048, 1024, 1, 256]
    - [215, 0.0]
  - - [2048, 1024, 1, 1024]
    - [216, 0.0]
  - - [2048, 1024, 1, 4096]
    - [217, 0.0]
  - - [3072, 1024, 1, 256]
    - [218, 0.0]
  - - [3072, 1024, 1, 1024]
    - [219, 0.0]
  - - [3072, 1024, 1, 4096]
    - [220, 0.0]
  - - [4096, 1024, 1, 256]
    - [221, 0.0]
  - - [4096, 1024, 1, 1024]
    - [222, 0.0]
  - - [4096, 1024, 1, 4096]
    - [223, 0.0]
  - - [2048, 1536, 1, 256]
    - [213, 0.0]
  - - [2048, 1536, 1, 1024]
    - [224, 0.0]
  - - [2048, 1536, 1, 4096]
    - [225, 0.0]
  - - [3072, 1536, 1, 256]
    - [226, 0.0]
  - - [3072, 1536, 1, 1024]
    - [227, 0.0]
  - - [3072, 1536, 1, 4096]
    - [228, 0.0]
  - - [4096, 1536, 1, 256]
    - [229, 0.0]
  - - [4096, 1536, 1, 1024]
    - [204, 0.0]
  - - [4096, 1536, 1, 4096]
    - [204, 0.0]
  - - [6144, 768, 1, 256]
    - [230, 0.0]
  - - [6144, 768, 1, 1024]
    - [231, 0.0]
  - - [6144, 768, 1, 4096]
    - [232, 0.0]
  - - [8192, 768, 1, 256]
    - [233, 0.0]
  - - [8192, 768, 1, 1024]
    - [234, 0.0]
  - - [8192, 768, 1, 4096]
    - [235, 0.0]
  - - [12288, 768, 1, 256]
    - [236, 0.0]
  - - [12288, 768, 1, 1024]
    - [237, 0.0]
  - - [12288, 768, 1, 4096]
    - [232, 0.0]
  - - [16384, 768, 1, 256]
    - [238, 0.0]
  - - [16384, 768, 1, 1024]
    - [239, 0.0]
  - - [16384, 768, 1, 4096]
    - [240, 0.0]
  - - [6144, 1024, 1, 256]
    - [241, 0.0]
  - - [6144, 1024, 1, 1024]
    - [242, 0.0]
  - - [6144, 1024, 1, 4096]
    - [240, 0.0]
  - - [8192, 1024, 1, 256]
    - [243, 0.0]
  - - [8192, 1024, 1, 1024]
    - [244, 0.0]
  - - [8192, 1024, 1, 4096]
    - [245, 0.0]
  - - [12288, 1024, 1, 256]
    - [233, 0.0]
  - - [12288, 1024, 1, 1024]
    - [242, 0.0]
  - - [12288, 1024, 1, 4096]
    - [240, 0.0]
  - - [16384, 1024, 1, 1024]
    - [243, 0.0]
  - - [6144, 1536, 1, 256]
    - [246, 0.0]
  - - [6144, 1536, 1, 1024]
    - [232, 0.0]
  - - [6144, 1536, 1, 4096]
    - [237, 0.0]
  - - [8192, 1536, 1, 256]
    - [247, 0.0]
  - - [8192, 1536, 1, 1024]
    - [235, 0.0]
  - - [8192, 1536, 1, 4096]
    - [242, 0.0]
  - - [12288, 1536, 1, 1024]
    - [237, 0.0]
  - - [16384, 1536, 1, 1024]
    - [235, 0.0]
  - - [16, 3072, 1, 16384]
    - [248, 0.0]
  - - [16, 4096, 1, 1024]
    - [249, 0.0]
  - - [32, 2048, 1, 4096]
    - [250, 0.0]
  - - [32, 2048, 1, 16384]
    - [251, 0.0]
  - - [32, 3072, 1, 1024]
    - [252, 0.0]
  - - [32, 3072, 1, 4096]
    - [253, 0.0]
  - - [32, 3072, 1, 16384]
    - [254, 0.0]
  - - [32, 4096, 1, 16384]
    - [255, 0.0]
  - - [64, 2048, 1, 1024]
    - [256, 0.0]
  - - [64, 2048, 1, 4096]
    - [257, 0.0]
  - - [64, 2048, 1, 16384]
    - [258, 0.0]
  - - [64, 3072, 1, 1024]
    - [259, 0.0]
  - - [64, 3072, 1, 4096]
    - [260, 0.0]
  - - [64, 3072, 1, 16384]
    - [261, 0.0]
  - - [64, 4096, 1, 4096]
    - [262, 0.0]
  - - [64, 4096, 1, 16384]
    - [263, 0.0]
  - - [128, 2048, 1, 4096]
    - [264, 0.0]
  - - [128, 2048, 1, 16384]
    - [265, 0.0]
  - - [128, 3072, 1, 4096]
    - [266, 0.0]
  - - [128, 3072, 1, 16384]
    - [267, 0.0]
  - - [128, 4096, 1, 1024]
    - [268, 0.0]
  - - [128, 4096, 1, 4096]
    - [269, 0.0]
  - - [128, 4096, 1, 16384]
    - [270, 0.0]
  - - [256, 2048, 1, 1024]
    - [271, 0.0]
  - - [256, 2048, 1, 4096]
    - [272, 0.0]
  - - [256, 2048, 1, 16384]
    - [273, 0.0]
  - - [256, 3072, 1, 1024]
    - [274, 0.0]
  - - [256, 3072, 1, 4096]
    - [275, 0.0]
  - - [256, 3072, 1, 16384]
    - [276, 0.0]
  - - [256, 4096, 1, 256]
    - [277, 0.0]
  - - [256, 4096, 1, 1024]
    - [277, 0.0]
  - - [256, 4096, 1, 4096]
    - [278, 0.0]
  - - [512, 2048, 1, 256]
    - [279, 0.0]
  - - [512, 2048, 1, 1024]
    - [280, 0.0]
  - - [512, 2048, 1, 4096]
    - [281, 0.0]
  - - [512, 3072, 1, 256]
    - [282, 0.0]
  - - [512, 3072, 1, 1024]
    - [283, 0.0]
  - - [512, 3072, 1, 4096]
    - [284, 0.0]
  - - [512, 4096, 1, 256]
    - [285, 0.0]
  - - [512, 4096, 1, 1024]
    - [286, 0.0]
  - - [512, 4096, 1, 4096]
    - [287, 0.0]
  - - [768, 2048, 1, 256]
    - [288, 0.0]
  - - [768, 2048, 1, 1024]
    - [289, 0.0]
  - - [768, 2048, 1, 4096]
    - [290, 0.0]
  - - [1024, 2048, 1, 256]
    - [291, 0.0]
  - - [1024, 2048, 1, 1024]
    - [292, 0.0]
  - - [1024, 2048, 1, 4096]
    - [293, 0.0]
  - - [1536, 2048, 1, 256]
    - [294, 0.0]
  - - [1536, 2048, 1, 1024]
    - [295, 0.0]
  - - [1536, 2048, 1, 4096]
    - [296, 0.0]
  - - [768, 3072, 1, 256]
    - [297, 0.0]
  - - [768, 3072, 1, 1024]
    - [298, 0.0]
  - - [768, 3072, 1, 4096]
    - [299, 0.0]
  - - [1024, 3072, 1, 256]
    - [300, 0.0]
  - - [1024, 3072, 1, 1024]
    - [301, 0.0]
  - - [1024, 3072, 1, 4096]
    - [302, 0.0]
  - - [1536, 3072, 1, 256]
    - [303, 0.0]
  - - [1536, 3072, 1, 1024]
    - [304, 0.0]
  - - [1536, 3072, 1, 4096]
    - [305, 0.0]
  - - [768, 4096, 1, 256]
    - [306, 0.0]
  - - [768, 4096, 1, 1024]
    - [307, 0.0]
  - - [768, 4096, 1, 4096]
    - [302, 0.0]
  - - [1024, 4096, 1, 256]
    - [308, 0.0]
  - - [1024, 4096, 1, 1024]
    - [309, 0.0]
  - - [1024, 4096, 1, 4096]
    - [310, 0.0]
  - - [1536, 4096, 1, 256]
    - [311, 0.0]
  - - [1536, 4096, 1, 1024]
    - [311, 0.0]
  - - [1536, 4096, 1, 4096]
    - [312, 0.0]
  - - [2048, 2048, 1, 256]
    - [313, 0.0]
  - - [2048, 2048, 1, 1024]
    - [314, 0.0]
  - - [2048, 2048, 1, 4096]
    - [315, 0.0]
  - - [3072, 2048, 1, 256]
    - [316, 0.0]
  - - [3072, 2048, 1, 1024]
    - [317, 0.0]
  - - [3072, 2048, 1, 4096]
    - [316, 0.0]
  - - [4096, 2048, 1, 256]
    - [318, 0.0]
  - - [4096, 2048, 1, 1024]
    - [318, 0.0]
  - - [4096, 2048, 1, 4096]
    - [319, 0.0]
  - - [2048, 3072, 1, 256]
    - [320, 0.0]
  - - [2048, 3072, 1, 1024]
    - [317, 0.0]
  - - [2048, 3072, 1, 4096]
    - [321, 0.0]
  - - [3072, 3072, 1, 256]
    - [322, 0.0]
  - - [3072, 3072, 1, 1024]
    - [323, 0.0]
  - - [3072, 3072, 1, 4096]
    - [323, 0.0]
  - - [4096, 3072, 1, 256]
    - [324, 0.0]
  - - [4096, 3072, 1, 1024]
    - [325, 0.0]
  - - [4096, 3072, 1, 4096]
    - [325, 0.0]
  - - [2048, 4096, 1, 256]
    - [326, 0.0]
  - - [2048, 4096, 1, 1024]
    - [327, 0.0]
  - - [2048, 4096, 1, 4096]
    - [319, 0.0]
  - - [3072, 4096, 1, 256]
    - [328, 0.0]
  - - [3072, 4096, 1, 1024]
    - [329, 0.0]
  - - [3072, 4096, 1, 4096]
    - [330, 0.0]
  - - [4096, 4096, 1, 1024]
    - [331, 0.0]
  - - [6144, 2048, 1, 256]
    - [332, 0.0]
  - - [6144, 2048, 1, 1024]
    - [333, 0.0]
  - - [6144, 2048, 1, 4096]
    - [334, 0.0]
  - - [8192, 2048, 1, 1024]
    - [335, 0.0]
  - - [12288, 2048, 1, 1024]
    - [336, 0.0]
  - - [16384, 2048, 1, 1024]
    - [337, 0.0]
  - - [6144, 3072, 1, 1024]
    - [336, 0.0]
  - - [8192, 3072, 1, 1024]
    - [332, 0.0]
  - - [12288, 3072, 1, 1024]
    - [332, 0.0]
  - - [16384, 3072, 1, 1024]
    - [338, 0.0]
  - - [6144, 4096, 1, 1024]
    - [336, 0.0]
  - - [8192, 4096, 1, 1024]
    - [339, 0.0]
  - - [12288, 4096, 1, 1024]
    - [233, 0.0]
  - - [16384, 4096, 1, 1024]
    - [233, 0.0]
  - - [16, 6144, 1, 16384]
    - [340, 0.0]
  - - [16, 8192, 1, 16384]
    - [341, 0.0]
  - - [16, 12288, 1, 16384]
    - [342, 0.0]
  - - [32, 6144, 1, 1024]
    - [343, 0.0]
  - - [32, 6144, 1, 4096]
    - [344, 0.0]
  - - [32, 6144, 1, 16384]
    - [345, 0.0]
  - - [32, 8192, 1, 1024]
    - [346, 0.0]
  - - [32, 8192, 1, 16384]
    - [347, 0.0]
  - - [32, 12288, 1, 1024]
    - [348, 0.0]
  - - [64, 6144, 1, 1024]
    - [349, 0.0]
  - - [64, 6144, 1, 16384]
    - [350, 0.0]
  - - [64, 8192, 1, 1024]
    - [351, 0.0]
  - - [64, 8192, 1, 4096]
    - [352, 0.0]
  - - [64, 8192, 1, 16384]
    - [353, 0.0]
  - - [64, 12288, 1, 4096]
    - [354, 0.0]
  - - [64, 12288, 1, 16384]
    - [355, 0.0]
  - - [128, 6144, 1, 1024]
    - [356, 0.0]
  - - [128, 6144, 1, 4096]
    - [357, 0.0]
  - - [128, 6144, 1, 16384]
    - [358, 0.0]
  - - [128, 8192, 1, 256]
    - [359, 0.0]
  - - [128, 8192, 1, 1024]
    - [360, 0.0]
  - - [128, 8192, 1, 4096]
    - [361, 0.0]
  - - [128, 12288, 1, 256]
    - [362, 0.0]
  - - [128, 12288, 1, 1024]
    - [363, 0.0]
  - - [128, 12288, 1, 4096]
    - [364, 0.0]
  - - [256, 6144, 1, 256]
    - [365, 0.0]
  - - [256, 6144, 1, 1024]
    - [366, 0.0]
  - - [256, 6144, 1, 4096]
    - [367, 0.0]
  - - [256, 8192, 1, 256]
    - [368, 0.0]
  - - [256, 8192, 1, 1024]
    - [369, 0.0]
  - - [256, 8192, 1, 4096]
    - [368, 0.0]
  - - [256, 12288, 1, 256]
    - [370, 0.0]
  - - [256, 12288, 1, 1024]
    - [371, 0.0]
  - - [256, 12288, 1, 4096]
    - [372, 0.0]
  - - [512, 6144, 1, 256]
    - [373, 0.0]
  - - [512, 6144, 1, 1024]
    - [374, 0.0]
  - - [512, 6144, 1, 4096]
    - [375, 0.0]
  - - [512, 8192, 1, 256]
    - [376, 0.0]
  - - [512, 8192, 1, 1024]
    - [377, 0.0]
  - - [512, 8192, 1, 4096]
    - [378, 0.0]
  - - [512, 12288, 1, 256]
    - [379, 0.0]
  - - [512, 12288, 1, 1024]
    - [380, 0.0]
  - - [512, 12288, 1, 4096]
    - [381, 0.0]
  - - [768, 6144, 1, 256]
    - [382, 0.0]
  - - [768, 6144, 1, 1024]
    - [383, 0.0]
  - - [768, 6144, 1, 4096]
    - [384, 0.0]
  - - [1024, 6144, 1, 256]
    - [385, 0.0]
  - - [1024, 6144, 1, 1024]
    - [386, 0.0]
  - - [1024, 6144, 1, 4096]
    - [387, 0.0]
  - - [1536, 6144, 1, 256]
    - [388, 0.0]
  - - [1536, 6144, 1, 1024]
    - [389, 0.0]
  - - [1536, 6144, 1, 4096]
    - [390, 0.0]
  - - [768, 8192, 1, 256]
    - [391, 0.0]
  - - [768, 8192, 1, 1024]
    - [392, 0.0]
  - - [768, 8192, 1, 4096]
    - [392, 0.0]
  - - [1024, 8192, 1, 256]
    - [393, 0.0]
  - - [1024, 8192, 1, 1024]
    - [394, 0.0]
  - - [1024, 8192, 1, 4096]
    - [395, 0.0]
  - - [1536, 8192, 1, 256]
    - [396, 0.0]
  - - [1536, 8192, 1, 1024]
    - [397, 0.0]
  - - [1536, 8192, 1, 4096]
    - [398, 0.0]
  - - [768, 12288, 1, 256]
    - [399, 0.0]
  - - [768, 12288, 1, 1024]
    - [390, 0.0]
  - - [768, 12288, 1, 4096]
    - [384, 0.0]
  - - [1024, 12288, 1, 256]
    - [400, 0.0]
  - - [1024, 12288, 1, 1024]
    - [401, 0.0]
  - - [1024, 12288, 1, 4096]
    - [402, 0.0]
  - - [1536, 12288, 1, 1024]
    - [398, 0.0]
  - - [2048, 6144, 1, 256]
    - [403, 0.0]
  - - [2048, 6144, 1, 1024]
    - [404, 0.0]
  - - [2048, 6144, 1, 4096]
    - [405, 0.0]
  - - [3072, 6144, 1, 1024]
    - [406, 0.0]
  - - [4096, 6144, 1, 1024]
    - [407, 0.0]
  - - [2048, 8192, 1, 1024]
    - [408, 0.0]
  - - [3072, 8192, 1, 1024]
    - [409, 0.0]
  - - [4096, 8192, 1, 1024]
    - [408, 0.0]
  - - [2048, 12288, 1, 1024]
    - [410, 0.0]
  - - [3072, 12288, 1, 1024]
    - [406, 0.0]
  - - [4096, 12288, 1, 1024]
    - [410, 0.0]
  - - [6144, 6144, 1, 1024]
    - [411, 0.0]
  - - [8192, 6144, 1, 1024]
    - [412, 0.0]
  - - [12288, 6144, 1, 1024]
    - [413, 0.0]
  - - [16384, 6144, 1, 1024]
    - [414, 0.0]
  - - [6144, 8192, 1, 1024]
    - [415, 0.0]
  - - [8192, 8192, 1, 1024]
    - [416, 0.0]
  - - [12288, 8192, 1, 1024]
    - [417, 0.0]
  - - [16384, 8192, 1, 1024]
    - [416, 0.0]
  - - [6144, 12288, 1, 1024]
    - [418, 0.0]
  - - [8192, 12288, 1, 1024]
    - [419, 0.0]
  - - [16, 16384, 1, 1024]
    - [420, 0.0]
  - - [16, 16384, 1, 16384]
    - [421, 0.0]
  - - [32, 16384, 1, 1024]
    - [422, 0.0]
  - - [32, 16384, 1, 4096]
    - [423, 0.0]
  - - [32, 16384, 1, 16384]
    - [424, 0.0]
  - - [64, 16384, 1, 256]
    - [425, 0.0]
  - - [64, 16384, 1, 1024]
    - [426, 0.0]
  - - [64, 16384, 1, 4096]
    - [427, 0.0]
  - - [128, 16384, 1, 256]
    - [428, 0.0]
  - - [128, 16384, 1, 4096]
    - [429, 0.0]
  - - [256, 16384, 1, 256]
    - [430, 0.0]
  - - [256, 16384, 1, 1024]
    - [431, 0.0]
  - - [256, 16384, 1, 4096]
    - [432, 0.0]
  - - [512, 16384, 1, 256]
    - [433, 0.0]
  - - [512, 16384, 1, 1024]
    - [434, 0.0]
  - - [512, 16384, 1, 4096]
    - [435, 0.0]
  - - [768, 16384, 1, 256]
    - [403, 0.0]
  - - [768, 16384, 1, 1024]
    - [436, 0.0]
  - - [768, 16384, 1, 4096]
    - [435, 0.0]
  - - [1024, 16384, 1, 1024]
    - [410, 0.0]
  - - [1536, 16384, 1, 1024]
    - [434, 0.0]
  - - [2048, 16384, 1, 1024]
    - [437, 0.0]
  - - [3072, 16384, 1, 1024]
    - [438, 0.0]
  - - [4096, 16384, 1, 1024]
    - [439, 0.0]
  - - [6144, 16384, 1, 1024]
    - [440, 0.0]
  - - [8192, 16384, 1, 1024]
    - [440, 0.0]
- null
- null
- DeviceEfficiency
- GridBased
