projects/hipblaslt/library/src/amd_detail/rocblaslt/src/Tensile/Logic/asm_full/aquavanjaram/gfx942/Equality/aquavanjaram942_Cijk_Ailk_Bjlk_CB.yaml
- {MinimumRequiredVersion: 4.37.0}
- aquavanjaram942
- gfx942
- [Device 0049, Device 0050]
    SolutionIndex: 0
    SolutionNameMin: Cijk_Ailk_Bjlk_CB_MT128x128x4_MI32x32x2x1_SN_1LDSB0_MIAV0_ONLL2_PGR2_PLR1_SU0_SUS0_TT1_128_WG128_2_1_WGM24
# - - - [4864, 3072, 1, 4096]
#     - [4, 97.902]
- - - [7296, 4096, 1, 4096]
    - [0, 98.352]
  # - - [7296, 4608, 1, 4096]
  #   - [3, 98.345]
  # - - [7296, 4608, 1, 8192]
  #   - [3, 98.523]
  # - - [9728, 6144, 1, 4096]
  #   - [2, 98.482]
  # - - [9728, 6144, 1, 8192]
  #   - [1, 98.6]
  # - - [16384, 16384, 1, 4096]
  #   - [0, 98.468]
  # - - [960, 1024, 1, 1024]
  #   - [5, 93.853]
  # - - [1, 1, 1, 1024]
  #   - [6, 0.0]
  # - - [1, 1, 1, 4096]
  #   - [7, 0.0]
  # - - [1, 1, 1, 16384]
  #   - [8, 0.0]
  # - - [16, 1, 1, 1024]
  #   - [9, 0.0]
  # - - [16, 1, 1, 4096]
  #   - [10, 0.0]
  # - - [16, 1, 1, 16384]
  #   - [11, 0.0]
  # - - [32, 1, 1, 1024]
  #   - [12, 0.0]
  # - - [32, 1, 1, 4096]
  #   - [13, 0.0]
  # - - [32, 1, 1, 16384]
  #   - [14, 0.0]
  # - - [64, 1, 1, 1024]
  #   - [15, 0.0]
  # - - [64, 1, 1, 4096]
  #   - [16, 0.0]
  # - - [64, 1, 1, 16384]
  #   - [17, 0.0]
  # - - [128, 1, 1, 4096]
  #   - [18, 0.0]
  # - - [128, 1, 1, 16384]
  #   - [19, 0.0]
  # - - [256, 1, 1, 1024]
  #   - [20, 0.0]
  # - - [256, 1, 1, 4096]
  #   - [21, 0.0]
  # - - [256, 1, 1, 16384]
  #   - [22, 0.0]
  # - - [512, 1, 1, 1024]
  #   - [23, 0.0]
  # - - [512, 1, 1, 4096]
  #   - [24, 0.0]
  # - - [512, 1, 1, 16384]
  #   - [25, 0.0]
  # - - [768, 1, 1, 1024]
  #   - [26, 0.0]
  # - - [768, 1, 1, 4096]
  #   - [27, 0.0]
  # - - [768, 1, 1, 16384]
  #   - [28, 0.0]
  # - - [1024, 1, 1, 1024]
  #   - [26, 0.0]
  # - - [1024, 1, 1, 4096]
  #   - [29, 0.0]
  # - - [1024, 1, 1, 16384]
  #   - [30, 0.0]
  # - - [1536, 1, 1, 1024]
  #   - [26, 0.0]
  # - - [1536, 1, 1, 4096]
  #   - [29, 0.0]
  # - - [1536, 1, 1, 16384]
  #   - [31, 0.0]
  # - - [2048, 1, 1, 1024]
  #   - [32, 0.0]
  # - - [2048, 1, 1, 4096]
  #   - [33, 0.0]
  # - - [2048, 1, 1, 16384]
  #   - [34, 0.0]
  # - - [3072, 1, 1, 1024]
  #   - [35, 0.0]
  # - - [3072, 1, 1, 4096]
  #   - [36, 0.0]
  # - - [3072, 1, 1, 16384]
  #   - [37, 0.0]
  # - - [4096, 1, 1, 1024]
  #   - [38, 0.0]
  # - - [4096, 1, 1, 4096]
  #   - [36, 0.0]
  # - - [4096, 1, 1, 16384]
  #   - [39, 0.0]
  # - - [6144, 1, 1, 1024]
  #   - [40, 0.0]
  # - - [6144, 1, 1, 4096]
  #   - [41, 0.0]
  # - - [6144, 1, 1, 16384]
  #   - [42, 0.0]
  # - - [8192, 1, 1, 1024]
  #   - [43, 0.0]
  # - - [8192, 1, 1, 4096]
  #   - [41, 0.0]
  # - - [8192, 1, 1, 16384]
  #   - [44, 0.0]
  # - - [12288, 1, 1, 1024]
  #   - [43, 0.0]
  # - - [12288, 1, 1, 4096]
  #   - [45, 0.0]
  # - - [12288, 1, 1, 16384]
  #   - [46, 0.0]
  # - - [16384, 1, 1, 1024]
  #   - [47, 0.0]
  # - - [16384, 1, 1, 4096]
  #   - [48, 0.0]
  # - - [16384, 1, 1, 16384]
  #   - [49, 0.0]
  # - - [1, 16, 1, 1024]
  #   - [50, 0.0]
  # - - [1, 16, 1, 4096]
  #   - [51, 0.0]
  # - - [1, 16, 1, 16384]
  #   - [52, 0.0]
  # - - [16, 16, 1, 1024]
  #   - [53, 0.0]
  # - - [16, 16, 1, 4096]
  #   - [54, 0.0]
  # - - [16, 16, 1, 16384]
  #   - [55, 0.0]
  # - - [32, 16, 1, 1024]
  #   - [56, 0.0]
  # - - [32, 16, 1, 4096]
  #   - [57, 0.0]
  # - - [32, 16, 1, 16384]
  #   - [58, 0.0]
  # - - [64, 16, 1, 1024]
  #   - [59, 0.0]
  # - - [64, 16, 1, 4096]
  #   - [60, 0.0]
  # - - [64, 16, 1, 16384]
  #   - [61, 0.0]
  # - - [128, 16, 1, 1024]
  #   - [62, 0.0]
  # - - [128, 16, 1, 4096]
  #   - [63, 0.0]
  # - - [128, 16, 1, 16384]
  #   - [64, 0.0]
  # - - [256, 16, 1, 1024]
  #   - [65, 0.0]
  # - - [256, 16, 1, 4096]
  #   - [66, 0.0]
  # - - [256, 16, 1, 16384]
  #   - [67, 0.0]
  # - - [512, 16, 1, 1024]
  #   - [68, 0.0]
  # - - [512, 16, 1, 4096]
  #   - [69, 0.0]
  # - - [512, 16, 1, 16384]
  #   - [70, 0.0]
  # - - [768, 16, 1, 1024]
  #   - [71, 0.0]
  # - - [768, 16, 1, 4096]
  #   - [71, 0.0]
  # - - [768, 16, 1, 16384]
  #   - [72, 0.0]
  # - - [1024, 16, 1, 1024]
  #   - [71, 0.0]
  # - - [1024, 16, 1, 4096]
  #   - [71, 0.0]
  # - - [1024, 16, 1, 16384]
  #   - [73, 0.0]
  # - - [1536, 16, 1, 1024]
  #   - [71, 0.0]
  # - - [1536, 16, 1, 4096]
  #   - [71, 0.0]
  # - - [1536, 16, 1, 16384]
  #   - [74, 0.0]
  # - - [2048, 16, 1, 1024]
  #   - [75, 0.0]
  # - - [2048, 16, 1, 4096]
  #   - [76, 0.0]
  # - - [2048, 16, 1, 16384]
  #   - [77, 0.0]
  # - - [3072, 16, 1, 1024]
  #   - [75, 0.0]
  # - - [3072, 16, 1, 4096]
  #   - [78, 0.0]
  # - - [3072, 16, 1, 16384]
  #   - [79, 0.0]
  # - - [4096, 16, 1, 1024]
  #   - [75, 0.0]
  # - - [4096, 16, 1, 4096]
  #   - [80, 0.0]
  # - - [4096, 16, 1, 16384]
  #   - [81, 0.0]
  # - - [6144, 16, 1, 1024]
  #   - [82, 0.0]
  # - - [6144, 16, 1, 4096]
  #   - [83, 0.0]
  # - - [6144, 16, 1, 16384]
  #   - [84, 0.0]
  # - - [8192, 16, 1, 1024]
  #   - [85, 0.0]
  # - - [8192, 16, 1, 4096]
  #   - [86, 0.0]
  # - - [8192, 16, 1, 16384]
  #   - [87, 0.0]
  # - - [12288, 16, 1, 1024]
  #   - [88, 0.0]
  # - - [12288, 16, 1, 4096]
  #   - [89, 0.0]
  # - - [12288, 16, 1, 16384]
  #   - [90, 0.0]
  # - - [16384, 16, 1, 1024]
  #   - [91, 0.0]
  # - - [16384, 16, 1, 4096]
  #   - [92, 0.0]
  # - - [16384, 16, 1, 16384]
  #   - [93, 0.0]
  # - - [1, 32, 1, 1024]
  #   - [94, 0.0]
  # - - [1, 32, 1, 4096]
  #   - [95, 0.0]
  # - - [1, 32, 1, 16384]
  #   - [96, 0.0]
  # - - [16, 32, 1, 1024]
  #   - [97, 0.0]
  # - - [16, 32, 1, 4096]
  #   - [98, 0.0]
  # - - [16, 32, 1, 16384]
  #   - [99, 0.0]
  # - - [32, 32, 1, 1024]
  #   - [100, 0.0]
  # - - [32, 32, 1, 4096]
  #   - [101, 0.0]
  # - - [32, 32, 1, 16384]
  #   - [102, 0.0]
  # - - [64, 32, 1, 1024]
  #   - [103, 0.0]
  # - - [64, 32, 1, 4096]
  #   - [104, 0.0]
  # - - [64, 32, 1, 16384]
  #   - [105, 0.0]
  # - - [128, 32, 1, 1024]
  #   - [106, 0.0]
  # - - [128, 32, 1, 4096]
  #   - [107, 0.0]
  # - - [128, 32, 1, 16384]
  #   - [108, 0.0]
  # - - [256, 32, 1, 1024]
  #   - [109, 0.0]
  # - - [256, 32, 1, 4096]
  #   - [110, 0.0]
  # - - [256, 32, 1, 16384]
  #   - [111, 0.0]
  # - - [512, 32, 1, 1024]
  #   - [112, 0.0]
  # - - [512, 32, 1, 4096]
  #   - [113, 0.0]
  # - - [512, 32, 1, 16384]
  #   - [114, 0.0]
  # - - [768, 32, 1, 1024]
  #   - [115, 0.0]
  # - - [768, 32, 1, 4096]
  #   - [116, 0.0]
  # - - [768, 32, 1, 16384]
  #   - [117, 0.0]
  # - - [1024, 32, 1, 1024]
  #   - [115, 0.0]
  # - - [1024, 32, 1, 4096]
  #   - [118, 0.0]
  # - - [1024, 32, 1, 16384]
  #   - [119, 0.0]
  # - - [1536, 32, 1, 1024]
  #   - [120, 0.0]
  # - - [1536, 32, 1, 4096]
  #   - [121, 0.0]
  # - - [1536, 32, 1, 16384]
  #   - [122, 0.0]
  # - - [2048, 32, 1, 1024]
  #   - [123, 0.0]
  # - - [2048, 32, 1, 4096]
  #   - [124, 0.0]
  # - - [2048, 32, 1, 16384]
  #   - [125, 0.0]
  # - - [3072, 32, 1, 1024]
  #   - [126, 0.0]
  # - - [3072, 32, 1, 4096]
  #   - [127, 0.0]
  # - - [3072, 32, 1, 16384]
  #   - [128, 0.0]
  # - - [4096, 32, 1, 1024]
  #   - [129, 0.0]
  # - - [4096, 32, 1, 4096]
  #   - [127, 0.0]
  # - - [4096, 32, 1, 16384]
  #   - [130, 0.0]
  # - - [6144, 32, 1, 1024]
  #   - [131, 0.0]
  # - - [6144, 32, 1, 4096]
  #   - [132, 0.0]
  # - - [6144, 32, 1, 16384]
  #   - [133, 0.0]
  # - - [8192, 32, 1, 1024]
  #   - [134, 0.0]
  # - - [8192, 32, 1, 4096]
  #   - [135, 0.0]
  # - - [8192, 32, 1, 16384]
  #   - [136, 0.0]
  # - - [12288, 32, 1, 1024]
  #   - [137, 0.0]
  # - - [12288, 32, 1, 4096]
  #   - [138, 0.0]
  # - - [12288, 32, 1, 16384]
  #   - [139, 0.0]
  # - - [16384, 32, 1, 1024]
  #   - [140, 0.0]
  # - - [16384, 32, 1, 4096]
  #   - [141, 0.0]
  # - - [16384, 32, 1, 16384]
  #   - [142, 0.0]
  # - - [1, 64, 1, 1024]
  #   - [143, 0.0]
  # - - [1, 64, 1, 4096]
  #   - [144, 0.0]
  # - - [1, 64, 1, 16384]
  #   - [145, 0.0]
  # - - [16, 64, 1, 1024]
  #   - [146, 0.0]
  # - - [16, 64, 1, 4096]
  #   - [147, 0.0]
  # - - [16, 64, 1, 16384]
  #   - [148, 0.0]
  # - - [32, 64, 1, 1024]
  #   - [149, 0.0]
  # - - [32, 64, 1, 4096]
  #   - [150, 0.0]
  # - - [32, 64, 1, 16384]
  #   - [151, 0.0]
  # - - [64, 64, 1, 1024]
  #   - [152, 0.0]
  # - - [64, 64, 1, 4096]
  #   - [153, 0.0]
  # - - [64, 64, 1, 16384]
  #   - [154, 0.0]
  # - - [128, 64, 1, 1024]
  #   - [155, 0.0]
  # - - [128, 64, 1, 4096]
  #   - [156, 0.0]
  # - - [128, 64, 1, 16384]
  #   - [157, 0.0]
  # - - [256, 64, 1, 1024]
  #   - [158, 0.0]
  # - - [256, 64, 1, 4096]
  #   - [159, 0.0]
  # - - [256, 64, 1, 16384]
  #   - [160, 0.0]
  # - - [512, 64, 1, 1024]
  #   - [161, 0.0]
  # - - [512, 64, 1, 4096]
  #   - [162, 0.0]
  # - - [512, 64, 1, 16384]
  #   - [163, 0.0]
  # - - [768, 64, 1, 1024]
  #   - [164, 0.0]
  # - - [768, 64, 1, 4096]
  #   - [165, 0.0]
  # - - [768, 64, 1, 16384]
  #   - [166, 0.0]
  # - - [1024, 64, 1, 1024]
  #   - [167, 0.0]
  # - - [1024, 64, 1, 4096]
  #   - [167, 0.0]
  # - - [1024, 64, 1, 16384]
  #   - [168, 0.0]
  # - - [1536, 64, 1, 1024]
  #   - [169, 0.0]
  # - - [1536, 64, 1, 4096]
  #   - [165, 0.0]
  # - - [1536, 64, 1, 16384]
  #   - [170, 0.0]
  # - - [2048, 64, 1, 1024]
  #   - [171, 0.0]
  # - - [2048, 64, 1, 4096]
  #   - [172, 0.0]
  # - - [2048, 64, 1, 16384]
  #   - [173, 0.0]
  # - - [3072, 64, 1, 1024]
  #   - [174, 0.0]
  # - - [3072, 64, 1, 4096]
  #   - [175, 0.0]
  # - - [3072, 64, 1, 16384]
  #   - [176, 0.0]
  # - - [4096, 64, 1, 1024]
  #   - [177, 0.0]
  # - - [4096, 64, 1, 4096]
  #   - [178, 0.0]
  # - - [4096, 64, 1, 16384]
  #   - [179, 0.0]
  # - - [6144, 64, 1, 1024]
  #   - [180, 0.0]
  # - - [6144, 64, 1, 4096]
  #   - [181, 0.0]
  # - - [6144, 64, 1, 16384]
  #   - [182, 0.0]
  # - - [8192, 64, 1, 1024]
  #   - [183, 0.0]
  # - - [8192, 64, 1, 4096]
  #   - [184, 0.0]
  # - - [8192, 64, 1, 16384]
  #   - [185, 0.0]
  # - - [12288, 64, 1, 1024]
  #   - [186, 0.0]
  # - - [12288, 64, 1, 4096]
  #   - [187, 0.0]
  # - - [12288, 64, 1, 16384]
  #   - [188, 0.0]
  # - - [16384, 64, 1, 256]
  #   - [189, 0.0]
  # - - [16384, 64, 1, 1024]
  #   - [190, 0.0]
  # - - [16384, 64, 1, 4096]
  #   - [191, 0.0]
  # - - [1, 128, 1, 4096]
  #   - [192, 0.0]
  # - - [1, 128, 1, 16384]
  #   - [193, 0.0]
  # - - [16, 128, 1, 1024]
  #   - [194, 0.0]
  # - - [16, 128, 1, 4096]
  #   - [195, 0.0]
  # - - [16, 128, 1, 16384]
  #   - [196, 0.0]
  # - - [32, 128, 1, 1024]
  #   - [197, 0.0]
  # - - [32, 128, 1, 4096]
  #   - [198, 0.0]
  # - - [32, 128, 1, 16384]
  #   - [199, 0.0]
  # - - [64, 128, 1, 1024]
  #   - [200, 0.0]
  # - - [64, 128, 1, 4096]
  #   - [201, 0.0]
  # - - [64, 128, 1, 16384]
  #   - [202, 0.0]
  # - - [128, 128, 1, 1024]
  #   - [203, 0.0]
  # - - [128, 128, 1, 4096]
  #   - [204, 0.0]
  # - - [128, 128, 1, 16384]
  #   - [205, 0.0]
  # - - [256, 128, 1, 1024]
  #   - [206, 0.0]
  # - - [256, 128, 1, 4096]
  #   - [207, 0.0]
  # - - [256, 128, 1, 16384]
  #   - [208, 0.0]
  # - - [512, 128, 1, 1024]
  #   - [209, 0.0]
  # - - [512, 128, 1, 4096]
  #   - [210, 0.0]
  # - - [512, 128, 1, 16384]
  #   - [211, 0.0]
  # - - [768, 128, 1, 1024]
  #   - [212, 0.0]
  # - - [768, 128, 1, 4096]
  #   - [213, 0.0]
  # - - [768, 128, 1, 16384]
  #   - [214, 0.0]
  # - - [1024, 128, 1, 1024]
  #   - [215, 0.0]
  # - - [1024, 128, 1, 4096]
  #   - [216, 0.0]
  # - - [1024, 128, 1, 16384]
  #   - [217, 0.0]
  # - - [1536, 128, 1, 1024]
  #   - [218, 0.0]
  # - - [1536, 128, 1, 4096]
  #   - [219, 0.0]
  # - - [1536, 128, 1, 16384]
  #   - [220, 0.0]
  # - - [2048, 128, 1, 1024]
  #   - [221, 0.0]
  # - - [2048, 128, 1, 4096]
  #   - [222, 0.0]
  # - - [2048, 128, 1, 16384]
  #   - [222, 0.0]
  # - - [3072, 128, 1, 1024]
  #   - [223, 0.0]
  # - - [3072, 128, 1, 4096]
  #   - [224, 0.0]
  # - - [3072, 128, 1, 16384]
  #   - [225, 0.0]
  # - - [4096, 128, 1, 1024]
  #   - [226, 0.0]
  # - - [4096, 128, 1, 4096]
  #   - [227, 0.0]
  # - - [4096, 128, 1, 16384]
  #   - [227, 0.0]
  # - - [6144, 128, 1, 1024]
  #   - [228, 0.0]
  # - - [6144, 128, 1, 4096]
  #   - [229, 0.0]
  # - - [6144, 128, 1, 16384]
  #   - [230, 0.0]
  # - - [8192, 128, 1, 256]
  #   - [231, 0.0]
  # - - [8192, 128, 1, 1024]
  #   - [232, 0.0]
  # - - [8192, 128, 1, 4096]
  #   - [233, 0.0]
  # - - [12288, 128, 1, 256]
  #   - [234, 0.0]
  # - - [12288, 128, 1, 1024]
  #   - [235, 0.0]
  # - - [12288, 128, 1, 4096]
  #   - [236, 0.0]
  # - - [16384, 128, 1, 256]
  #   - [228, 0.0]
  # - - [16384, 128, 1, 1024]
  #   - [237, 0.0]
  # - - [16384, 128, 1, 4096]
  #   - [238, 0.0]
  # - - [1, 256, 1, 1024]
  #   - [239, 0.0]
  # - - [1, 256, 1, 4096]
  #   - [240, 0.0]
  # - - [1, 256, 1, 16384]
  #   - [241, 0.0]
  # - - [16, 256, 1, 1024]
  #   - [242, 0.0]
  # - - [16, 256, 1, 4096]
  #   - [243, 0.0]
  # - - [16, 256, 1, 16384]
  #   - [244, 0.0]
  # - - [32, 256, 1, 1024]
  #   - [245, 0.0]
  # - - [32, 256, 1, 4096]
  #   - [246, 0.0]
  # - - [32, 256, 1, 16384]
  #   - [247, 0.0]
  # - - [64, 256, 1, 1024]
  #   - [248, 0.0]
  # - - [64, 256, 1, 4096]
  #   - [249, 0.0]
  # - - [64, 256, 1, 16384]
  #   - [250, 0.0]
  # - - [128, 256, 1, 1024]
  #   - [251, 0.0]
  # - - [128, 256, 1, 4096]
  #   - [252, 0.0]
  # - - [128, 256, 1, 16384]
  #   - [253, 0.0]
  # - - [256, 256, 1, 1024]
  #   - [254, 0.0]
  # - - [256, 256, 1, 4096]
  #   - [255, 0.0]
  # - - [256, 256, 1, 16384]
  #   - [256, 0.0]
  # - - [512, 256, 1, 1024]
  #   - [257, 0.0]
  # - - [512, 256, 1, 4096]
  #   - [258, 0.0]
  # - - [512, 256, 1, 16384]
  #   - [259, 0.0]
  # - - [768, 256, 1, 1024]
  #   - [260, 0.0]
  # - - [768, 256, 1, 4096]
  #   - [261, 0.0]
  # - - [768, 256, 1, 16384]
  #   - [262, 0.0]
  # - - [1024, 256, 1, 1024]
  #   - [263, 0.0]
  # - - [1024, 256, 1, 4096]
  #   - [264, 0.0]
  # - - [1024, 256, 1, 16384]
  #   - [265, 0.0]
  # - - [1536, 256, 1, 1024]
  #   - [266, 0.0]
  # - - [1536, 256, 1, 4096]
  #   - [267, 0.0]
  # - - [1536, 256, 1, 16384]
  #   - [268, 0.0]
  # - - [2048, 256, 1, 1024]
  #   - [269, 0.0]
  # - - [2048, 256, 1, 4096]
  #   - [270, 0.0]
  # - - [2048, 256, 1, 16384]
  #   - [271, 0.0]
  # - - [3072, 256, 1, 1024]
  #   - [272, 0.0]
  # - - [3072, 256, 1, 4096]
  #   - [273, 0.0]
  # - - [3072, 256, 1, 16384]
  #   - [274, 0.0]
  # - - [4096, 256, 1, 256]
  #   - [275, 0.0]
  # - - [4096, 256, 1, 1024]
  #   - [276, 0.0]
  # - - [4096, 256, 1, 4096]
  #   - [277, 0.0]
  # - - [6144, 256, 1, 256]
  #   - [278, 0.0]
  # - - [6144, 256, 1, 1024]
  #   - [279, 0.0]
  # - - [6144, 256, 1, 4096]
  #   - [280, 0.0]
  # - - [8192, 256, 1, 256]
  #   - [281, 0.0]
  # - - [8192, 256, 1, 1024]
  #   - [282, 0.0]
  # - - [8192, 256, 1, 4096]
  #   - [283, 0.0]
  # - - [12288, 256, 1, 256]
  #   - [284, 0.0]
  # - - [12288, 256, 1, 1024]
  #   - [285, 0.0]
  # - - [12288, 256, 1, 4096]
  #   - [285, 0.0]
  # - - [16384, 256, 1, 256]
  #   - [286, 0.0]
  # - - [16384, 256, 1, 1024]
  #   - [287, 0.0]
  # - - [16384, 256, 1, 4096]
  #   - [288, 0.0]
  # - - [1, 512, 1, 1024]
  #   - [289, 0.0]
  # - - [1, 512, 1, 4096]
  #   - [290, 0.0]
  # - - [1, 512, 1, 16384]
  #   - [291, 0.0]
  # - - [16, 512, 1, 1024]
  #   - [292, 0.0]
  # - - [16, 512, 1, 4096]
  #   - [293, 0.0]
  # - - [16, 512, 1, 16384]
  #   - [294, 0.0]
  # - - [32, 512, 1, 1024]
  #   - [295, 0.0]
  # - - [32, 512, 1, 4096]
  #   - [296, 0.0]
  # - - [32, 512, 1, 16384]
  #   - [297, 0.0]
  # - - [64, 512, 1, 1024]
  #   - [298, 0.0]
  # - - [64, 512, 1, 4096]
  #   - [298, 0.0]
  # - - [64, 512, 1, 16384]
  #   - [299, 0.0]
  # - - [128, 512, 1, 1024]
  #   - [300, 0.0]
  # - - [128, 512, 1, 4096]
  #   - [301, 0.0]
  # - - [128, 512, 1, 16384]
  #   - [302, 0.0]
  # - - [256, 512, 1, 1024]
  #   - [303, 0.0]
  # - - [256, 512, 1, 4096]
  #   - [304, 0.0]
  # - - [256, 512, 1, 16384]
  #   - [305, 0.0]
  # - - [512, 512, 1, 1024]
  #   - [306, 0.0]
  # - - [512, 512, 1, 4096]
  #   - [307, 0.0]
  # - - [512, 512, 1, 16384]
  #   - [308, 0.0]
  # - - [768, 512, 1, 1024]
  #   - [309, 0.0]
  # - - [768, 512, 1, 4096]
  #   - [310, 0.0]
  # - - [768, 512, 1, 16384]
  #   - [311, 0.0]
  # - - [1024, 512, 1, 1024]
  #   - [312, 0.0]
  # - - [1024, 512, 1, 4096]
  #   - [313, 0.0]
  # - - [1024, 512, 1, 16384]
  #   - [314, 0.0]
  # - - [1536, 512, 1, 1024]
  #   - [315, 0.0]
  # - - [1536, 512, 1, 4096]
  #   - [316, 0.0]
  # - - [1536, 512, 1, 16384]
  #   - [311, 0.0]
  # - - [2048, 512, 1, 256]
  #   - [317, 0.0]
  # - - [2048, 512, 1, 1024]
  #   - [318, 0.0]
  # - - [2048, 512, 1, 4096]
  #   - [319, 0.0]
  # - - [3072, 512, 1, 256]
  #   - [320, 0.0]
  # - - [3072, 512, 1, 1024]
  #   - [321, 0.0]
  # - - [3072, 512, 1, 4096]
  #   - [322, 0.0]
  # - - [4096, 512, 1, 256]
  #   - [323, 0.0]
  # - - [4096, 512, 1, 1024]
  #   - [324, 0.0]
  # - - [4096, 512, 1, 4096]
  #   - [325, 0.0]
  # - - [6144, 512, 1, 256]
  #   - [326, 0.0]
  # - - [6144, 512, 1, 1024]
  #   - [327, 0.0]
  # - - [6144, 512, 1, 4096]
  #   - [328, 0.0]
  # - - [8192, 512, 1, 256]
  #   - [329, 0.0]
  # - - [8192, 512, 1, 1024]
  #   - [330, 0.0]
  # - - [8192, 512, 1, 4096]
  #   - [331, 0.0]
  # - - [12288, 512, 1, 256]
  #   - [332, 0.0]
  # - - [12288, 512, 1, 1024]
  #   - [333, 0.0]
  # - - [12288, 512, 1, 4096]
  #   - [333, 0.0]
  # - - [16384, 512, 1, 256]
  #   - [334, 0.0]
  # - - [16384, 512, 1, 1024]
  #   - [335, 0.0]
  # - - [16384, 512, 1, 4096]
  #   - [335, 0.0]
  # - - [1, 768, 1, 1024]
  #   - [336, 0.0]
  # - - [1, 768, 1, 4096]
  #   - [337, 0.0]
  # - - [1, 768, 1, 16384]
  #   - [338, 0.0]
  # - - [1, 1024, 1, 1024]
  #   - [339, 0.0]
  # - - [1, 1024, 1, 4096]
  #   - [340, 0.0]
  # - - [1, 1024, 1, 16384]
  #   - [337, 0.0]
  # - - [1, 1536, 1, 1024]
  #   - [341, 0.0]
  # - - [1, 1536, 1, 4096]
  #   - [339, 0.0]
  # - - [1, 1536, 1, 16384]
  #   - [342, 0.0]
  # - - [16, 768, 1, 1024]
  #   - [343, 0.0]
  # - - [16, 768, 1, 4096]
  #   - [343, 0.0]
  # - - [16, 768, 1, 16384]
  #   - [344, 0.0]
  # - - [16, 1024, 1, 1024]
  #   - [343, 0.0]
  # - - [16, 1024, 1, 4096]
  #   - [345, 0.0]
  # - - [16, 1024, 1, 16384]
  #   - [346, 0.0]
  # - - [16, 1536, 1, 1024]
  #   - [343, 0.0]
  # - - [16, 1536, 1, 4096]
  #   - [343, 0.0]
  # - - [16, 1536, 1, 16384]
  #   - [347, 0.0]
  # - - [32, 768, 1, 1024]
  #   - [348, 0.0]
  # - - [32, 768, 1, 4096]
  #   - [349, 0.0]
  # - - [32, 768, 1, 16384]
  #   - [350, 0.0]
  # - - [32, 1024, 1, 1024]
  #   - [348, 0.0]
  # - - [32, 1024, 1, 4096]
  #   - [351, 0.0]
  # - - [32, 1024, 1, 16384]
  #   - [352, 0.0]
  # - - [32, 1536, 1, 1024]
  #   - [353, 0.0]
  # - - [32, 1536, 1, 4096]
  #   - [354, 0.0]
  # - - [32, 1536, 1, 16384]
  #   - [355, 0.0]
  # - - [64, 768, 1, 1024]
  #   - [298, 0.0]
  # - - [64, 768, 1, 4096]
  #   - [298, 0.0]
  # - - [64, 768, 1, 16384]
  #   - [356, 0.0]
  # - - [64, 1024, 1, 1024]
  #   - [298, 0.0]
  # - - [64, 1024, 1, 4096]
  #   - [357, 0.0]
  # - - [64, 1024, 1, 16384]
  #   - [358, 0.0]
  # - - [64, 1536, 1, 1024]
  #   - [359, 0.0]
  # - - [64, 1536, 1, 4096]
  #   - [360, 0.0]
  # - - [64, 1536, 1, 16384]
  #   - [361, 0.0]
  # - - [128, 768, 1, 1024]
  #   - [362, 0.0]
  # - - [128, 768, 1, 4096]
  #   - [363, 0.0]
  # - - [128, 768, 1, 16384]
  #   - [364, 0.0]
  # - - [128, 1024, 1, 1024]
  #   - [365, 0.0]
  # - - [128, 1024, 1, 4096]
  #   - [366, 0.0]
  # - - [128, 1024, 1, 16384]
  #   - [367, 0.0]
  # - - [128, 1536, 1, 1024]
  #   - [368, 0.0]
  # - - [128, 1536, 1, 4096]
  #   - [369, 0.0]
  # - - [128, 1536, 1, 16384]
  #   - [370, 0.0]
  # - - [256, 768, 1, 1024]
  #   - [371, 0.0]
  # - - [256, 768, 1, 4096]
  #   - [372, 0.0]
  # - - [256, 768, 1, 16384]
  #   - [373, 0.0]
  # - - [256, 1024, 1, 1024]
  #   - [374, 0.0]
  # - - [256, 1024, 1, 4096]
  #   - [375, 0.0]
  # - - [256, 1024, 1, 16384]
  #   - [376, 0.0]
  # - - [256, 1536, 1, 1024]
  #   - [377, 0.0]
  # - - [256, 1536, 1, 4096]
  #   - [378, 0.0]
  # - - [256, 1536, 1, 16384]
  #   - [372, 0.0]
  # - - [512, 768, 1, 1024]
  #   - [312, 0.0]
  # - - [512, 768, 1, 4096]
  #   - [379, 0.0]
  # - - [512, 768, 1, 16384]
  #   - [380, 0.0]
  # - - [512, 1024, 1, 1024]
  #   - [381, 0.0]
  # - - [512, 1024, 1, 4096]
  #   - [382, 0.0]
  # - - [512, 1024, 1, 16384]
  #   - [383, 0.0]
  # - - [512, 1536, 1, 1024]
  #   - [384, 0.0]
  # - - [512, 1536, 1, 4096]
  #   - [385, 0.0]
  # - - [512, 1536, 1, 16384]
  #   - [386, 0.0]
  # - - [768, 768, 1, 1024]
  #   - [387, 0.0]
  # - - [768, 768, 1, 4096]
  #   - [388, 0.0]
  # - - [768, 768, 1, 16384]
  #   - [389, 0.0]
  # - - [1024, 768, 1, 1024]
  #   - [390, 0.0]
  # - - [1024, 768, 1, 4096]
  #   - [320, 0.0]
  # - - [1024, 768, 1, 16384]
  #   - [386, 0.0]
  # - - [1536, 768, 1, 256]
  #   - [391, 0.0]
  # - - [1536, 768, 1, 1024]
  #   - [392, 0.0]
  # - - [1536, 768, 1, 4096]
  #   - [393, 0.0]
  # - - [768, 1024, 1, 1024]
  #   - [394, 0.0]
  # - - [768, 1024, 1, 4096]
  #   - [395, 0.0]
  # - - [768, 1024, 1, 16384]
  #   - [396, 0.0]
  # - - [1024, 1024, 1, 256]
  #   - [397, 0.0]
  # - - [1024, 1024, 1, 1024]
  #   - [398, 0.0]
  # - - [1024, 1024, 1, 4096]
  #   - [399, 0.0]
  # - - [1536, 1024, 1, 256]
  #   - [397, 0.0]
  # - - [1536, 1024, 1, 1024]
  #   - [400, 0.0]
  # - - [1536, 1024, 1, 4096]
  #   - [401, 0.0]
  # - - [768, 1536, 1, 256]
  #   - [391, 0.0]
  # - - [768, 1536, 1, 1024]
  #   - [402, 0.0]
  # - - [768, 1536, 1, 4096]
  #   - [403, 0.0]
  # - - [1024, 1536, 1, 256]
  #   - [397, 0.0]
  # - - [1024, 1536, 1, 1024]
  #   - [404, 0.0]
  # - - [1024, 1536, 1, 4096]
  #   - [405, 0.0]
  # - - [1536, 1536, 1, 256]
  #   - [406, 0.0]
  # - - [1536, 1536, 1, 1024]
  #   - [392, 0.0]
  # - - [1536, 1536, 1, 4096]
  #   - [407, 0.0]
  # - - [2048, 768, 1, 256]
  #   - [405, 0.0]
  # - - [2048, 768, 1, 1024]
  #   - [408, 0.0]
  # - - [2048, 768, 1, 4096]
  #   - [317, 0.0]
  # - - [3072, 768, 1, 256]
  #   - [409, 0.0]
  # - - [3072, 768, 1, 1024]
  #   - [410, 0.0]
  # - - [3072, 768, 1, 4096]
  #   - [411, 0.0]
  # - - [4096, 768, 1, 256]
  #   - [412, 0.0]
  # - - [4096, 768, 1, 1024]
  #   - [413, 0.0]
  # - - [4096, 768, 1, 4096]
  #   - [414, 0.0]
  # - - [2048, 1024, 1, 256]
  #   - [415, 0.0]
  # - - [2048, 1024, 1, 1024]
  #   - [416, 0.0]
  # - - [2048, 1024, 1, 4096]
  #   - [417, 0.0]
  # - - [3072, 1024, 1, 256]
  #   - [412, 0.0]
  # - - [3072, 1024, 1, 1024]
  #   - [418, 0.0]
  # - - [3072, 1024, 1, 4096]
  #   - [419, 0.0]
  # - - [4096, 1024, 1, 256]
  #   - [420, 0.0]
  # - - [4096, 1024, 1, 1024]
  #   - [421, 0.0]
  # - - [4096, 1024, 1, 4096]
  #   - [422, 0.0]
  # - - [2048, 1536, 1, 256]
  #   - [423, 0.0]
  # - - [2048, 1536, 1, 1024]
  #   - [414, 0.0]
  # - - [2048, 1536, 1, 4096]
  #   - [408, 0.0]
  # - - [3072, 1536, 1, 256]
  #   - [424, 0.0]
  # - - [3072, 1536, 1, 1024]
  #   - [425, 0.0]
  # - - [3072, 1536, 1, 4096]
  #   - [426, 0.0]
  # - - [4096, 1536, 1, 256]
  #   - [427, 0.0]
  # - - [4096, 1536, 1, 1024]
  #   - [428, 0.0]
  # - - [4096, 1536, 1, 4096]
  #   - [405, 0.0]
  # - - [6144, 768, 1, 256]
  #   - [429, 0.0]
  # - - [6144, 768, 1, 1024]
  #   - [430, 0.0]
  # - - [6144, 768, 1, 4096]
  #   - [430, 0.0]
  # - - [8192, 768, 1, 256]
  #   - [431, 0.0]
  # - - [8192, 768, 1, 1024]
  #   - [432, 0.0]
  # - - [8192, 768, 1, 4096]
  #   - [432, 0.0]
  # - - [12288, 768, 1, 256]
  #   - [433, 0.0]
  # - - [12288, 768, 1, 1024]
  #   - [430, 0.0]
  # - - [12288, 768, 1, 4096]
  #   - [430, 0.0]
  # - - [16384, 768, 1, 256]
  #   - [434, 0.0]
  # - - [16384, 768, 1, 1024]
  #   - [432, 0.0]
  # - - [16384, 768, 1, 4096]
  #   - [435, 0.0]
  # - - [6144, 1024, 1, 256]
  #   - [436, 0.0]
  # - - [6144, 1024, 1, 1024]
  #   - [432, 0.0]
  # - - [6144, 1024, 1, 4096]
  #   - [435, 0.0]
  # - - [8192, 1024, 1, 256]
  #   - [437, 0.0]
  # - - [8192, 1024, 1, 1024]
  #   - [438, 0.0]
  # - - [8192, 1024, 1, 4096]
  #   - [438, 0.0]
  # - - [12288, 1024, 1, 256]
  #   - [436, 0.0]
  # - - [12288, 1024, 1, 1024]
  #   - [432, 0.0]
  # - - [12288, 1024, 1, 4096]
  #   - [439, 0.0]
  # - - [16384, 1024, 1, 1024]
  #   - [440, 0.0]
  # - - [6144, 1536, 1, 256]
  #   - [433, 0.0]
  # - - [6144, 1536, 1, 1024]
  #   - [430, 0.0]
  # - - [6144, 1536, 1, 4096]
  #   - [430, 0.0]
  # - - [8192, 1536, 1, 256]
  #   - [441, 0.0]
  # - - [8192, 1536, 1, 1024]
  #   - [432, 0.0]
  # - - [8192, 1536, 1, 4096]
  #   - [435, 0.0]
  # - - [12288, 1536, 1, 1024]
  #   - [435, 0.0]
  # - - [16384, 1536, 1, 1024]
  #   - [435, 0.0]
  # - - [1, 2048, 1, 1024]
  #   - [442, 0.0]
  # - - [1, 2048, 1, 4096]
  #   - [442, 0.0]
  # - - [1, 2048, 1, 16384]
  #   - [443, 0.0]
  # - - [1, 3072, 1, 1024]
  #   - [444, 0.0]
  # - - [1, 3072, 1, 4096]
  #   - [445, 0.0]
  # - - [1, 3072, 1, 16384]
  #   - [446, 0.0]
  # - - [1, 4096, 1, 1024]
  #   - [447, 0.0]
  # - - [1, 4096, 1, 4096]
  #   - [448, 0.0]
  # - - [1, 4096, 1, 16384]
  #   - [449, 0.0]
  # - - [16, 2048, 1, 1024]
  #   - [450, 0.0]
  # - - [16, 2048, 1, 4096]
  #   - [451, 0.0]
  # - - [16, 2048, 1, 16384]
  #   - [452, 0.0]
  # - - [16, 3072, 1, 1024]
  #   - [453, 0.0]
  # - - [16, 3072, 1, 4096]
  #   - [454, 0.0]
  # - - [16, 3072, 1, 16384]
  #   - [455, 0.0]
  # - - [16, 4096, 1, 1024]
  #   - [454, 0.0]
  # - - [16, 4096, 1, 4096]
  #   - [456, 0.0]
  # - - [16, 4096, 1, 16384]
  #   - [457, 0.0]
  # - - [32, 2048, 1, 1024]
  #   - [458, 0.0]
  # - - [32, 2048, 1, 4096]
  #   - [459, 0.0]
  # - - [32, 2048, 1, 16384]
  #   - [460, 0.0]
  # - - [32, 3072, 1, 1024]
  #   - [461, 0.0]
  # - - [32, 3072, 1, 4096]
  #   - [462, 0.0]
  # - - [32, 3072, 1, 16384]
  #   - [463, 0.0]
  # - - [32, 4096, 1, 1024]
  #   - [464, 0.0]
  # - - [32, 4096, 1, 4096]
  #   - [465, 0.0]
  # - - [32, 4096, 1, 16384]
  #   - [466, 0.0]
  # - - [64, 2048, 1, 1024]
  #   - [467, 0.0]
  # - - [64, 2048, 1, 4096]
  #   - [468, 0.0]
  # - - [64, 2048, 1, 16384]
  #   - [469, 0.0]
  # - - [64, 3072, 1, 1024]
  #   - [470, 0.0]
  # - - [64, 3072, 1, 4096]
  #   - [471, 0.0]
  # - - [64, 3072, 1, 16384]
  #   - [472, 0.0]
  # - - [64, 4096, 1, 1024]
  #   - [473, 0.0]
  # - - [64, 4096, 1, 4096]
  #   - [474, 0.0]
  # - - [64, 4096, 1, 16384]
  #   - [475, 0.0]
  # - - [128, 2048, 1, 1024]
  #   - [476, 0.0]
  # - - [128, 2048, 1, 4096]
  #   - [477, 0.0]
  # - - [128, 2048, 1, 16384]
  #   - [478, 0.0]
  # - - [128, 3072, 1, 1024]
  #   - [479, 0.0]
  # - - [128, 3072, 1, 4096]
  #   - [480, 0.0]
  # - - [128, 3072, 1, 16384]
  #   - [481, 0.0]
  # - - [128, 4096, 1, 1024]
  #   - [482, 0.0]
  # - - [128, 4096, 1, 4096]
  #   - [483, 0.0]
  # - - [128, 4096, 1, 16384]
  #   - [484, 0.0]
  # - - [256, 2048, 1, 1024]
  #   - [485, 0.0]
  # - - [256, 2048, 1, 4096]
  #   - [486, 0.0]
  # - - [256, 2048, 1, 16384]
  #   - [486, 0.0]
  # - - [256, 3072, 1, 1024]
  #   - [487, 0.0]
  # - - [256, 3072, 1, 4096]
  #   - [488, 0.0]
  # - - [256, 3072, 1, 16384]
  #   - [489, 0.0]
  # - - [256, 4096, 1, 256]
  #   - [490, 0.0]
  # - - [256, 4096, 1, 1024]
  #   - [491, 0.0]
  # - - [256, 4096, 1, 4096]
  #   - [492, 0.0]
  # - - [512, 2048, 1, 256]
  #   - [493, 0.0]
  # - - [512, 2048, 1, 1024]
  #   - [494, 0.0]
  # - - [512, 2048, 1, 4096]
  #   - [495, 0.0]
  # - - [512, 3072, 1, 256]
  #   - [496, 0.0]
  # - - [512, 3072, 1, 1024]
  #   - [497, 0.0]
  # - - [512, 3072, 1, 4096]
  #   - [498, 0.0]
  # - - [512, 4096, 1, 256]
  #   - [499, 0.0]
  # - - [512, 4096, 1, 1024]
  #   - [500, 0.0]
  # - - [512, 4096, 1, 4096]
  #   - [499, 0.0]
  # - - [768, 2048, 1, 256]
  #   - [501, 0.0]
  # - - [768, 2048, 1, 1024]
  #   - [498, 0.0]
  # - - [768, 2048, 1, 4096]
  #   - [497, 0.0]
  # - - [1024, 2048, 1, 256]
  #   - [502, 0.0]
  # - - [1024, 2048, 1, 1024]
  #   - [503, 0.0]
  # - - [1024, 2048, 1, 4096]
  #   - [499, 0.0]
  # - - [1536, 2048, 1, 256]
  #   - [504, 0.0]
  # - - [1536, 2048, 1, 1024]
  #   - [505, 0.0]
  # - - [1536, 2048, 1, 4096]
  #   - [506, 0.0]
  # - - [768, 3072, 1, 256]
  #   - [507, 0.0]
  # - - [768, 3072, 1, 1024]
  #   - [508, 0.0]
  # - - [768, 3072, 1, 4096]
  #   - [508, 0.0]
  # - - [1024, 3072, 1, 256]
  #   - [509, 0.0]
  # - - [1024, 3072, 1, 1024]
  #   - [510, 0.0]
  # - - [1024, 3072, 1, 4096]
  #   - [510, 0.0]
  # - - [1536, 3072, 1, 256]
  #   - [511, 0.0]
  # - - [1536, 3072, 1, 1024]
  #   - [512, 0.0]
  # - - [1536, 3072, 1, 4096]
  #   - [513, 0.0]
  # - - [768, 4096, 1, 256]
  #   - [514, 0.0]
  # - - [768, 4096, 1, 1024]
  #   - [515, 0.0]
  # - - [768, 4096, 1, 4096]
  #   - [515, 0.0]
  # - - [1024, 4096, 1, 256]
  #   - [516, 0.0]
  # - - [1024, 4096, 1, 1024]
  #   - [499, 0.0]
  # - - [1024, 4096, 1, 4096]
  #   - [517, 0.0]
  # - - [1536, 4096, 1, 256]
  #   - [510, 0.0]
  # - - [1536, 4096, 1, 1024]
  #   - [518, 0.0]
  # - - [1536, 4096, 1, 4096]
  #   - [519, 0.0]
  # - - [2048, 2048, 1, 256]
  #   - [520, 0.0]
  # - - [2048, 2048, 1, 1024]
  #   - [521, 0.0]
  # - - [2048, 2048, 1, 4096]
  #   - [522, 0.0]
  # - - [3072, 2048, 1, 256]
  #   - [523, 0.0]
  # - - [3072, 2048, 1, 1024]
  #   - [524, 0.0]
  # - - [3072, 2048, 1, 4096]
  #   - [525, 0.0]
  # - - [4096, 2048, 1, 256]
  #   - [526, 0.0]
  # - - [4096, 2048, 1, 1024]
  #   - [527, 0.0]
  # - - [4096, 2048, 1, 4096]
  #   - [528, 0.0]
  # - - [2048, 3072, 1, 256]
  #   - [529, 0.0]
  # - - [2048, 3072, 1, 1024]
  #   - [530, 0.0]
  # - - [2048, 3072, 1, 4096]
  #   - [531, 0.0]
  # - - [3072, 3072, 1, 256]
  #   - [525, 0.0]
  # - - [3072, 3072, 1, 1024]
  #   - [524, 0.0]
  # - - [3072, 3072, 1, 4096]
  #   - [532, 0.0]
  # - - [4096, 3072, 1, 256]
  #   - [528, 0.0]
  # - - [4096, 3072, 1, 1024]
  #   - [531, 0.0]
  # - - [4096, 3072, 1, 4096]
  #   - [530, 0.0]
  # - - [2048, 4096, 1, 256]
  #   - [521, 0.0]
  # - - [2048, 4096, 1, 1024]
  #   - [533, 0.0]
  # - - [2048, 4096, 1, 4096]
  #   - [528, 0.0]
  # - - [3072, 4096, 1, 256]
  #   - [534, 0.0]
  # - - [3072, 4096, 1, 1024]
  #   - [530, 0.0]
  # - - [3072, 4096, 1, 4096]
  #   - [531, 0.0]
  # - - [4096, 4096, 1, 1024]
  #   - [535, 0.0]
  # - - [6144, 2048, 1, 256]
  #   - [432, 0.0]
  # - - [6144, 2048, 1, 1024]
  #   - [536, 0.0]
  # - - [6144, 2048, 1, 4096]
  #   - [536, 0.0]
  # - - [8192, 2048, 1, 1024]
  #   - [536, 0.0]
  # - - [12288, 2048, 1, 1024]
  #   - [536, 0.0]
  # - - [16384, 2048, 1, 1024]
  #   - [537, 0.0]
  # - - [6144, 3072, 1, 1024]
  #   - [536, 0.0]
  # - - [8192, 3072, 1, 1024]
  #   - [536, 0.0]
  # - - [12288, 3072, 1, 1024]
  #   - [538, 0.0]
  # - - [16384, 3072, 1, 1024]
  #   - [539, 0.0]
  # - - [6144, 4096, 1, 1024]
  #   - [536, 0.0]
  # - - [8192, 4096, 1, 1024]
  #   - [540, 0.0]
  # - - [12288, 4096, 1, 1024]
  #   - [541, 0.0]
  # - - [16384, 4096, 1, 1024]
  #   - [537, 0.0]
  # - - [1, 6144, 1, 1024]
  #   - [542, 0.0]
  # - - [1, 6144, 1, 4096]
  #   - [543, 0.0]
  # - - [1, 6144, 1, 16384]
  #   - [544, 0.0]
  # - - [1, 8192, 1, 1024]
  #   - [542, 0.0]
  # - - [1, 8192, 1, 4096]
  #   - [542, 0.0]
  # - - [1, 8192, 1, 16384]
  #   - [545, 0.0]
  # - - [1, 12288, 1, 1024]
  #   - [546, 0.0]
  # - - [1, 12288, 1, 4096]
  #   - [547, 0.0]
  # - - [1, 12288, 1, 16384]
  #   - [548, 0.0]
  # - - [16, 6144, 1, 1024]
  #   - [549, 0.0]
  # - - [16, 6144, 1, 4096]
  #   - [550, 0.0]
  # - - [16, 6144, 1, 16384]
  #   - [551, 0.0]
  # - - [16, 8192, 1, 1024]
  #   - [552, 0.0]
  # - - [16, 8192, 1, 4096]
  #   - [553, 0.0]
  # - - [16, 8192, 1, 16384]
  #   - [554, 0.0]
  # - - [16, 12288, 1, 1024]
  #   - [555, 0.0]
  # - - [16, 12288, 1, 4096]
  #   - [556, 0.0]
  # - - [16, 12288, 1, 16384]
  #   - [555, 0.0]
  # - - [32, 6144, 1, 1024]
  #   - [557, 0.0]
  # - - [32, 6144, 1, 4096]
  #   - [558, 0.0]
  # - - [32, 6144, 1, 16384]
  #   - [559, 0.0]
  # - - [32, 8192, 1, 1024]
  #   - [560, 0.0]
  # - - [32, 8192, 1, 4096]
  #   - [561, 0.0]
  # - - [32, 8192, 1, 16384]
  #   - [562, 0.0]
  # - - [32, 12288, 1, 1024]
  #   - [563, 0.0]
  # - - [32, 12288, 1, 4096]
  #   - [564, 0.0]
  # - - [32, 12288, 1, 16384]
  #   - [565, 0.0]
  # - - [64, 6144, 1, 1024]
  #   - [566, 0.0]
  # - - [64, 6144, 1, 4096]
  #   - [567, 0.0]
  # - - [64, 6144, 1, 16384]
  #   - [568, 0.0]
  # - - [64, 8192, 1, 1024]
  #   - [569, 0.0]
  # - - [64, 8192, 1, 4096]
  #   - [569, 0.0]
  # - - [64, 8192, 1, 16384]
  #   - [570, 0.0]
  # - - [64, 12288, 1, 1024]
  #   - [571, 0.0]
  # - - [64, 12288, 1, 4096]
  #   - [572, 0.0]
  # - - [64, 12288, 1, 16384]
  #   - [572, 0.0]
  # - - [128, 6144, 1, 1024]
  #   - [573, 0.0]
  # - - [128, 6144, 1, 4096]
  #   - [574, 0.0]
  # - - [128, 6144, 1, 16384]
  #   - [575, 0.0]
  # - - [128, 8192, 1, 256]
  #   - [576, 0.0]
  # - - [128, 8192, 1, 1024]
  #   - [577, 0.0]
  # - - [128, 8192, 1, 4096]
  #   - [578, 0.0]
  # - - [128, 12288, 1, 256]
  #   - [579, 0.0]
  # - - [128, 12288, 1, 1024]
  #   - [580, 0.0]
  # - - [128, 12288, 1, 4096]
  #   - [581, 0.0]
  # - - [256, 6144, 1, 256]
  #   - [582, 0.0]
  # - - [256, 6144, 1, 1024]
  #   - [583, 0.0]
  # - - [256, 6144, 1, 4096]
  #   - [583, 0.0]
  # - - [256, 8192, 1, 256]
  #   - [584, 0.0]
  # - - [256, 8192, 1, 1024]
  #   - [585, 0.0]
  # - - [256, 8192, 1, 4096]
  #   - [586, 0.0]
  # - - [256, 12288, 1, 256]
  #   - [587, 0.0]
  # - - [256, 12288, 1, 1024]
  #   - [588, 0.0]
  # - - [256, 12288, 1, 4096]
  #   - [589, 0.0]
  # - - [512, 6144, 1, 256]
  #   - [590, 0.0]
  # - - [512, 6144, 1, 1024]
  #   - [591, 0.0]
  # - - [512, 6144, 1, 4096]
  #   - [592, 0.0]
  # - - [512, 8192, 1, 256]
  #   - [593, 0.0]
  # - - [512, 8192, 1, 1024]
  #   - [594, 0.0]
  # - - [512, 8192, 1, 4096]
  #   - [595, 0.0]
  # - - [512, 12288, 1, 256]
  #   - [596, 0.0]
  # - - [512, 12288, 1, 1024]
  #   - [592, 0.0]
  # - - [512, 12288, 1, 4096]
  #   - [597, 0.0]
  # - - [768, 6144, 1, 256]
  #   - [598, 0.0]
  # - - [768, 6144, 1, 1024]
  #   - [599, 0.0]
  # - - [768, 6144, 1, 4096]
  #   - [600, 0.0]
  # - - [1024, 6144, 1, 256]
  #   - [601, 0.0]
  # - - [1024, 6144, 1, 1024]
  #   - [602, 0.0]
  # - - [1024, 6144, 1, 4096]
  #   - [603, 0.0]
  # - - [1536, 6144, 1, 256]
  #   - [600, 0.0]
  # - - [1536, 6144, 1, 1024]
  #   - [600, 0.0]
  # - - [1536, 6144, 1, 4096]
  #   - [599, 0.0]
  # - - [768, 8192, 1, 256]
  #   - [604, 0.0]
  # - - [768, 8192, 1, 1024]
  #   - [605, 0.0]
  # - - [768, 8192, 1, 4096]
  #   - [606, 0.0]
  # - - [1024, 8192, 1, 256]
  #   - [607, 0.0]
  # - - [1024, 8192, 1, 1024]
  #   - [608, 0.0]
  # - - [1024, 8192, 1, 4096]
  #   - [608, 0.0]
  # - - [1536, 8192, 1, 256]
  #   - [609, 0.0]
  # - - [1536, 8192, 1, 1024]
  #   - [610, 0.0]
  # - - [1536, 8192, 1, 4096]
  #   - [603, 0.0]
  # - - [768, 12288, 1, 256]
  #   - [611, 0.0]
  # - - [768, 12288, 1, 1024]
  #   - [600, 0.0]
  # - - [768, 12288, 1, 4096]
  #   - [599, 0.0]
  # - - [1024, 12288, 1, 256]
  #   - [610, 0.0]
  # - - [1024, 12288, 1, 1024]
  #   - [606, 0.0]
  # - - [1024, 12288, 1, 4096]
  #   - [612, 0.0]
  # - - [1536, 12288, 1, 1024]
  #   - [610, 0.0]
  # - - [2048, 6144, 1, 256]
  #   - [613, 0.0]
  # - - [2048, 6144, 1, 1024]
  #   - [606, 0.0]
  # - - [2048, 6144, 1, 4096]
  #   - [606, 0.0]
  # - - [3072, 6144, 1, 1024]
  #   - [606, 0.0]
  # - - [4096, 6144, 1, 1024]
  #   - [614, 0.0]
  # - - [2048, 8192, 1, 1024]
  #   - [615, 0.0]
  # - - [3072, 8192, 1, 1024]
  #   - [616, 0.0]
  # - - [4096, 8192, 1, 1024]
  #   - [599, 0.0]
  # - - [2048, 12288, 1, 1024]
  #   - [616, 0.0]
  # - - [3072, 12288, 1, 1024]
  #   - [617, 0.0]
  # - - [4096, 12288, 1, 1024]
  #   - [618, 0.0]
  # - - [6144, 6144, 1, 1024]
  #   - [619, 0.0]
  # - - [8192, 6144, 1, 1024]
  #   - [620, 0.0]
  # - - [12288, 6144, 1, 1024]
  #   - [621, 0.0]
  # - - [16384, 6144, 1, 1024]
  #   - [622, 0.0]
  # - - [6144, 8192, 1, 1024]
  #   - [623, 0.0]
  # - - [8192, 8192, 1, 1024]
  #   - [624, 0.0]
  # - - [12288, 8192, 1, 1024]
  #   - [625, 0.0]
  # - - [16384, 8192, 1, 1024]
  #   - [624, 0.0]
  # - - [6144, 12288, 1, 1024]
  #   - [621, 0.0]
  # - - [8192, 12288, 1, 1024]
  #   - [619, 0.0]
  # - - [1, 16384, 1, 1024]
  #   - [626, 0.0]
  # - - [1, 16384, 1, 4096]
  #   - [627, 0.0]
  # - - [1, 16384, 1, 16384]
  #   - [628, 0.0]
  # - - [16, 16384, 1, 1024]
  #   - [629, 0.0]
  # - - [16, 16384, 1, 4096]
  #   - [629, 0.0]
  # - - [16, 16384, 1, 16384]
  #   - [630, 0.0]
  # - - [32, 16384, 1, 1024]
  #   - [631, 0.0]
  # - - [32, 16384, 1, 4096]
  #   - [632, 0.0]
  # - - [32, 16384, 1, 16384]
  #   - [633, 0.0]
  # - - [64, 16384, 1, 256]
  #   - [634, 0.0]
  # - - [64, 16384, 1, 1024]
  #   - [635, 0.0]
  # - - [64, 16384, 1, 4096]
  #   - [636, 0.0]
  # - - [128, 16384, 1, 256]
  #   - [637, 0.0]
  # - - [128, 16384, 1, 1024]
  #   - [638, 0.0]
  # - - [128, 16384, 1, 4096]
  #   - [639, 0.0]
  # - - [256, 16384, 1, 256]
  #   - [640, 0.0]
  # - - [256, 16384, 1, 1024]
  #   - [641, 0.0]
  # - - [256, 16384, 1, 4096]
  #   - [642, 0.0]
  # - - [512, 16384, 1, 256]
  #   - [643, 0.0]
  # - - [512, 16384, 1, 1024]
  #   - [644, 0.0]
  # - - [512, 16384, 1, 4096]
  #   - [645, 0.0]
  # - - [768, 16384, 1, 256]
  #   - [646, 0.0]
  # - - [768, 16384, 1, 1024]
  #   - [645, 0.0]
  # - - [768, 16384, 1, 4096]
  #   - [647, 0.0]
  # - - [1024, 16384, 1, 1024]
  #   - [648, 0.0]
  # - - [1536, 16384, 1, 1024]
  #   - [649, 0.0]
  # - - [2048, 16384, 1, 1024]
  #   - [650, 0.0]
  # - - [3072, 16384, 1, 1024]
  #   - [651, 0.0]
  # - - [4096, 16384, 1, 1024]
  #   - [652, 0.0]
  # - - [6144, 16384, 1, 1024]
  #   - [649, 0.0]
  # - - [8192, 16384, 1, 1024]
  #   - [649, 0.0]
- null
- null
- DeviceEfficiency
- GridBased