projects/hipblaslt/library/src/amd_detail/rocblaslt/src/Tensile/Logic/asm_full/gfx1150/Equality/Tensile_Cijk_Alik_Bljk_BBS_BH_HAS_SAV_UserArgs.yaml
- {MinimumRequiredVersion: 5.0.0}
- Tensile
- gfx1150
- [Device 150e]
    SolutionIndex: 0
    SolutionNameMin: Cijk_Alik_Bljk_BBS_BH_HA_S_SAV_UserArgs_MT64x16x32_MI16x16x1_SN_LDSB1_AFC1_AG0_AFEM1_AFEM1_ASEM1_CLR0_CADS0_DTLA0_DTLB0_DTVA0_DTVB0_DTVSM0_DPLB0_EPS0_ELFLR0_EMLLn1_FDSI0_GRPM1_GRVWA8_GRVWB8_GSU1_GSUAMB_GSUC0_GSUWGMRR0_GLS0_ISA1150_IU1_K1_LDSTI0_LBSPPA256_LBSPPB128_LBSPPM0_LPA8_LPB8_LPM0_LRVW16_LWPMn1_MIAV1_MIWT2_1_MO40_MGRIPM1_NTn1_NTA0_NTB0_NTC0_NTD0_NTM0_NEPBS0_NLCA1_NLCB1_ONLL1_PGR1_PLR1_PKA0_SGROB0_SIA3_SS1_SU32_SUM0_SUS256_SPO0_SRVW0_SSO0_SVW1_SK0_SKFTR0_SKXCCM0_SGRO0_TIN0_TLDS1_TLDSMn1_ULSGRO0_USL1_UIOFGRO0_UPLRP0_USFGROn1_VSn1_VWA1_VWB1_WSGRA0_WSGRB0_WS32_WG32_2_1_WGM8_WGMXCC1_WGMXCCGn1
    SolutionIndex: 1
    SolutionNameMin: Cijk_Alik_Bljk_BBS_BH_HA_S_SAV_UserArgs_MT16x16x64_MI16x16x1_SN_LDSB0_AFC1_AG0_AFEM1_AFEM1_ASEM1_CLR0_CADS0_DTLA0_DTLB0_DTVA0_DTVB0_DTVSM0_DPLB0_EPS0_ELFLR0_EMLLn1_FDSI0_GRPM1_GRVWA8_GRVWB8_GSU1_GSUAMB_GSUC0_GSUWGMRR0_GLS0_ISA1150_IU1_K1_LDSTI0_LBSPPA128_LBSPPB128_LBSPPM0_LPA8_LPB8_LPM0_LRVW16_LWPMn1_MIAV1_MIWT1_1_MO40_MGRIPM1_NTn1_NTA0_NTB0_NTC0_NTD0_NTM0_NEPBS0_NLCA1_NLCB1_ONLL1_PGR2_PLR1_PKA0_SGROB0_SIA1_SS1_SU32_SUM0_SUS256_SPO0_SRVW0_SSO0_SVW1_SK0_SKFTR0_SKXCCM0_SGRO0_TIN0_TLDS1_TLDSMn1_ULSGRO0_USL1_UIOFGRO0_UPLRP0_USFGROn1_VSn1_VWA1_VWB1_WSGRA0_WSGRB0_WS32_WG16_2_1_WGM8_WGMXCC1_WGMXCCGn1
    SolutionIndex: 2
    SolutionNameMin: Cijk_Alik_Bljk_BBS_BH_HA_S_SAV_UserArgs_MT32x16x64_MI16x16x1_SN_LDSB0_AFC1_AG0_AFEM1_AFEM1_ASEM1_CLR0_CADS0_DTLA0_DTLB0_DTVA0_DTVB0_DTVSM0_DPLB0_EPS0_ELFLR0_EMLLn1_FDSI0_GRPM1_GRVWA8_GRVWB8_GSU1_GSUAMB_GSUC0_GSUWGMRR0_GLS0_ISA1150_IU1_K1_LDSTI0_LBSPPA128_LBSPPB128_LBSPPM0_LPA8_LPB8_LPM0_LRVW16_LWPMn1_MIAV1_MIWT1_1_MO40_MGRIPM1_NTn1_NTA0_NTB0_NTC0_NTD0_NTM0_NEPBS0_NLCA1_NLCB1_ONLL1_PGR1_PLR1_PKA0_SGROB0_SIA1_SS1_SU32_SUM0_SUS256_SPO0_SRVW0_SSO0_SVW1_SK0_SKFTR0_SKXCCM0_SGRO0_TIN0_TLDS1_TLDSMn1_ULSGRO0_USL1_UIOFGRO0_UPLRP0_USFGROn1_VSn1_VWA1_VWB1_WSGRA0_WSGRB0_WS32_WG32_2_1_WGM8_WGMXCC1_WGMXCCGn1
    SolutionIndex: 3
    SolutionNameMin: Cijk_Alik_Bljk_BBS_BH_HA_S_SAV_UserArgs_MT32x16x64_MI16x16x1_SN_LDSB0_AFC1_AG0_AFEM1_AFEM1_ASEM1_CLR0_CADS0_DTLA0_DTLB0_DTVA0_DTVB0_DTVSM0_DPLB0_EPS0_ELFLR0_EMLLn1_FDSI0_GRPM1_GRVWA8_GRVWB8_GSU1_GSUAMB_GSUC0_GSUWGMRR0_GLS0_ISA1150_IU1_K1_LDSTI0_LBSPPA128_LBSPPB128_LBSPPM0_LPA8_LPB8_LPM0_LRVW16_LWPMn1_MIAV1_MIWT1_1_MO40_MGRIPM1_NTn1_NTA0_NTB0_NTC0_NTD0_NTM0_NEPBS0_NLCA1_NLCB1_ONLL1_PGR2_PLR1_PKA0_SGROB0_SIA1_SS1_SU32_SUM0_SUS256_SPO0_SRVW0_SSO0_SVW1_SK0_SKFTR0_SKXCCM0_SGRO0_TIN0_TLDS1_TLDSMn1_ULSGRO0_USL1_UIOFGRO0_UPLRP0_USFGROn1_VSn1_VWA1_VWB1_WSGRA0_WSGRB0_WS32_WG32_2_1_WGM8_WGMXCC1_WGMXCCGn1
    SolutionIndex: 4
    SolutionNameMin: Cijk_Alik_Bljk_BBS_BH_HA_S_SAV_UserArgs_MT32x16x64_MI16x16x1_SN_LDSB0_AFC1_AG0_AFEM1_AFEM1_ASEM1_CLR0_CADS0_DTLA0_DTLB0_DTVA0_DTVB0_DTVSM0_DPLB0_EPS0_ELFLR0_EMLLn1_FDSI0_GRPM1_GRVWA8_GRVWB8_GSU1_GSUAMB_GSUC0_GSUWGMRR0_GLS0_ISA1150_IU1_K1_LDSTI0_LBSPPA256_LBSPPB128_LBSPPM0_LPA8_LPB8_LPM0_LRVW16_LWPMn1_MIAV1_MIWT1_1_MO40_MGRIPM1_NTn1_NTA0_NTB0_NTC0_NTD0_NTM0_NEPBS0_NLCA1_NLCB1_ONLL1_PGR1_PLR1_PKA0_SGROB0_SIA3_SS1_SU32_SUM0_SUS256_SPO0_SRVW0_SSO0_SVW1_SK0_SKFTR0_SKXCCM0_SGRO0_TIN0_TLDS1_TLDSMn1_ULSGRO0_USL1_UIOFGRO0_UPLRP0_USFGROn1_VSn1_VWA1_VWB1_WSGRA0_WSGRB0_WS32_WG32_2_1_WGM8_WGMXCC1_WGMXCCGn1
    SolutionIndex: 5
    SolutionNameMin: Cijk_Alik_Bljk_BBS_BH_HA_S_SAV_UserArgs_MT64x16x64_MI16x16x1_SN_LDSB0_AFC1_AG0_AFEM1_AFEM1_ASEM1_CLR0_CADS0_DTLA0_DTLB0_DTVA0_DTVB0_DTVSM0_DPLB0_EPS0_ELFLR0_EMLLn1_FDSI0_GRPM1_GRVWA8_GRVWB8_GSU1_GSUAMB_GSUC0_GSUWGMRR0_GLS0_ISA1150_IU1_K1_LDSTI0_LBSPPA256_LBSPPB256_LBSPPM0_LPA8_LPB8_LPM0_LRVW16_LWPMn1_MIAV1_MIWT2_1_MO40_MGRIPM1_NTn1_NTA0_NTB0_NTC0_NTD0_NTM0_NEPBS0_NLCA1_NLCB1_ONLL1_PGR2_PLR1_PKA0_SGROB0_SIA1_SS1_SU32_SUM0_SUS256_SPO0_SRVW0_SSO0_SVW1_SK0_SKFTR0_SKXCCM0_SGRO0_TIN0_TLDS1_TLDSMn1_ULSGRO0_USL1_UIOFGRO0_UPLRP0_USFGROn1_VSn1_VWA1_VWB1_WSGRA0_WSGRB0_WS32_WG32_2_1_WGM8_WGMXCC1_WGMXCCGn1
    SolutionIndex: 6
    SolutionNameMin: Cijk_Alik_Bljk_BBS_BH_HA_S_SAV_UserArgs_MT64x16x64_MI16x16x1_SN_LDSB0_AFC1_AG0_AFEM1_AFEM1_ASEM1_CLR0_CADS0_DTLA0_DTLB0_DTVA0_DTVB0_DTVSM0_DPLB0_EPS0_ELFLR0_EMLLn1_FDSI0_GRPM1_GRVWA8_GRVWB8_GSU1_GSUAMB_GSUC0_GSUWGMRR0_GLS0_ISA1150_IU1_K1_LDSTI0_LBSPPA128_LBSPPB256_LBSPPM0_LPA8_LPB8_LPM0_LRVW16_LWPMn1_MIAV1_MIWT2_1_MO40_MGRIPM1_NTn1_NTA0_NTB0_NTC0_NTD0_NTM0_NEPBS0_NLCA1_NLCB1_ONLL1_PGR2_PLR1_PKA0_SGROB0_SIA3_SS1_SU32_SUM0_SUS256_SPO0_SRVW0_SSO0_SVW1_SK0_SKFTR0_SKXCCM0_SGRO0_TIN0_TLDS1_TLDSMn1_ULSGRO0_USL1_UIOFGRO0_UPLRP0_USFGROn1_VSn1_VWA1_VWB1_WSGRA0_WSGRB0_WS32_WG32_2_1_WGM8_WGMXCC1_WGMXCCGn1
    SolutionIndex: 7
    SolutionNameMin: Cijk_Alik_Bljk_BBS_BH_HA_S_SAV_UserArgs_MT16x16x128_MI16x16x1_SN_LDSB0_AFC1_AG0_AFEM1_AFEM1_ASEM1_CLR0_CADS0_DTLA0_DTLB0_DTVA0_DTVB0_DTVSM0_DPLB0_EPS0_ELFLR0_EMLLn1_FDSI0_GRPM1_GRVWA8_GRVWB8_GSU1_GSUAMB_GSUC0_GSUWGMRR0_GLS0_ISA1150_IU1_K1_LDSTI0_LBSPPA256_LBSPPB256_LBSPPM0_LPA8_LPB8_LPM0_LRVW16_LWPMn1_MIAV1_MIWT1_1_MO40_MGRIPM1_NTn1_NTA0_NTB0_NTC0_NTD0_NTM0_NEPBS0_NLCA1_NLCB1_ONLL1_PGR1_PLR1_PKA0_SGROB0_SIA1_SS1_SU32_SUM0_SUS256_SPO0_SRVW0_SSO0_SVW1_SK0_SKFTR0_SKXCCM0_SGRO0_TIN0_TLDS1_TLDSMn1_ULSGRO0_USL1_UIOFGRO0_UPLRP0_USFGROn1_VSn1_VWA1_VWB1_WSGRA0_WSGRB0_WS32_WG16_2_1_WGM8_WGMXCC1_WGMXCCGn1
    SolutionIndex: 8
    SolutionNameMin: Cijk_Alik_Bljk_BBS_BH_HA_S_SAV_UserArgs_MT16x16x128_MI16x16x1_SN_LDSB0_AFC1_AG0_AFEM1_AFEM1_ASEM1_CLR0_CADS0_DTLA0_DTLB0_DTVA0_DTVB0_DTVSM0_DPLB0_EPS0_ELFLR0_EMLLn1_FDSI0_GRPM1_GRVWA8_GRVWB8_GSU1_GSUAMB_GSUC0_GSUWGMRR0_GLS0_ISA1150_IU1_K1_LDSTI0_LBSPPA256_LBSPPB256_LBSPPM0_LPA8_LPB8_LPM0_LRVW16_LWPMn1_MIAV1_MIWT1_1_MO40_MGRIPM1_NTn1_NTA0_NTB0_NTC0_NTD0_NTM0_NEPBS0_NLCA1_NLCB1_ONLL1_PGR1_PLR1_PKA0_SGROB0_SIA3_SS1_SU32_SUM0_SUS256_SPO0_SRVW0_SSO0_SVW1_SK0_SKFTR0_SKXCCM0_SGRO0_TIN0_TLDS1_TLDSMn1_ULSGRO0_USL1_UIOFGRO0_UPLRP0_USFGROn1_VSn1_VWA1_VWB1_WSGRA0_WSGRB0_WS32_WG16_2_1_WGM8_WGMXCC1_WGMXCCGn1
    SolutionIndex: 9
    SolutionNameMin: Cijk_Alik_Bljk_BBS_BH_HA_S_SAV_UserArgs_MT32x16x128_MI16x16x1_SN_LDSB0_AFC1_AG0_AFEM1_AFEM1_ASEM1_CLR0_CADS0_DTLA0_DTLB0_DTVA0_DTVB0_DTVSM0_DPLB0_EPS0_ELFLR0_EMLLn1_FDSI0_GRPM1_GRVWA8_GRVWB8_GSU1_GSUAMB_GSUC0_GSUWGMRR0_GLS0_ISA1150_IU1_K1_LDSTI0_LBSPPA256_LBSPPB256_LBSPPM0_LPA8_LPB8_LPM0_LRVW16_LWPMn1_MIAV1_MIWT1_1_MO40_MGRIPM1_NTn1_NTA0_NTB0_NTC0_NTD0_NTM0_NEPBS0_NLCA1_NLCB1_ONLL1_PGR2_PLR1_PKA0_SGROB0_SIA1_SS1_SU32_SUM0_SUS256_SPO0_SRVW0_SSO0_SVW1_SK0_SKFTR0_SKXCCM0_SGRO0_TIN0_TLDS1_TLDSMn1_ULSGRO0_USL1_UIOFGRO0_UPLRP0_USFGROn1_VSn1_VWA1_VWB1_WSGRA0_WSGRB0_WS32_WG32_2_1_WGM8_WGMXCC1_WGMXCCGn1
    SolutionIndex: 10
    SolutionNameMin: Cijk_Alik_Bljk_BBS_BH_HA_S_SAV_UserArgs_MT32x16x128_MI16x16x1_SN_LDSB0_AFC1_AG0_AFEM1_AFEM1_ASEM1_CLR0_CADS0_DTLA0_DTLB0_DTVA0_DTVB0_DTVSM0_DPLB0_EPS0_ELFLR0_EMLLn1_FDSI0_GRPM1_GRVWA8_GRVWB8_GSU1_GSUAMB_GSUC0_GSUWGMRR0_GLS0_ISA1150_IU1_K1_LDSTI0_LBSPPA256_LBSPPB256_LBSPPM0_LPA8_LPB8_LPM0_LRVW16_LWPMn1_MIAV1_MIWT1_1_MO40_MGRIPM1_NTn1_NTA0_NTB0_NTC0_NTD0_NTM0_NEPBS0_NLCA1_NLCB1_ONLL1_PGR1_PLR1_PKA0_SGROB0_SIA3_SS1_SU32_SUM0_SUS256_SPO0_SRVW0_SSO0_SVW1_SK0_SKFTR0_SKXCCM0_SGRO0_TIN0_TLDS1_TLDSMn1_ULSGRO0_USL1_UIOFGRO0_UPLRP0_USFGROn1_VSn1_VWA1_VWB1_WSGRA0_WSGRB0_WS32_WG32_2_1_WGM8_WGMXCC1_WGMXCCGn1
    SolutionIndex: 11
    SolutionNameMin: Cijk_Alik_Bljk_BBS_BH_HA_S_SAV_UserArgs_MT128x64x64_MI16x16x1_SN_LDSB0_AFC1_AG0_AFEM1_AFEM1_ASEM1_CLR0_CADS0_DTLA0_DTLB0_DTVA0_DTVB0_DTVSM0_DPLB0_EPS0_ELFLR0_EMLLn1_FDSI0_GRPM1_GRVWA8_GRVWB8_GSU1_GSUAMB_GSUC0_GSUWGMRR0_GLS0_ISA1150_IU1_K1_LDSTI0_LBSPPA128_LBSPPB128_LBSPPM0_LPA8_LPB8_LPM0_LRVW16_LWPMn1_MIAV1_MIWT4_2_MO40_MGRIPM1_NTn1_NTA0_NTB0_NTC0_NTD0_NTM0_NEPBS0_NLCA1_NLCB1_ONLL1_PGR2_PLR0_PKA0_SGROB0_SIA1_SS1_SU0_SUM0_SUS0_SPO0_SRVW0_SSO0_SVW1_SK0_SKFTR0_SKXCCM0_SGRO0_TIN0_TLDS1_TLDSMn1_ULSGRO0_USL1_UIOFGRO0_UPLRP0_USFGROn1_VSn1_VWA1_VWB1_WSGRA0_WSGRB0_WS32_WG32_4_1_WGM8_WGMXCC1_WGMXCCGn1
- - - [4096, 11, 1, 1024]
    - [0, 0.3]
  - - [2048, 11, 1, 1024]
    - [5, 0.3]
  - - [1024, 11, 1, 2048]
    - [3, 0.31]
  - - [1024, 11, 1, 4096]
    - [4, 0.31]
  - - [827, 11, 1, 256]
    - [10, 0.33]
  - - [256, 11, 1, 1024]
    - [8, 0.36]
  - - [4096, 15, 1, 1024]
    - [0, 0.41]
  - - [2048, 15, 1, 1024]
    - [6, 0.4]
  - - [1024, 15, 1, 4096]
    - [1, 0.42]
  - - [1024, 15, 1, 2048]
    - [2, 0.41]
  - - [983, 15, 1, 256]
    - [9, 0.51]
  - - [256, 16, 1, 1024]
    - [7, 0.53]
  - - [2048, 816, 1, 16384]
    - [11, 2.98]
  - - [2048, 968, 1, 16384]
    - [11, 3.07]
- null
- null
- DeviceEfficiency
- GridBased
