projects/hipblaslt/library/src/amd_detail/rocblaslt/src/Tensile/Logic/asm_full/gfx950/GridBased/aquavanjaram_Cijk_Alik_Bljk___F_4_S_S___M_X_A_3_2___M_X_B_3_2___BH_Bias_S_HA_S_SAV_UserArgs.yaml
- {MinimumRequiredVersion: 5.0.0}
- aquavanjaram
- gfx950
- [Device 0049]
    SolutionIndex: 0
    SolutionNameMin: Cijk_Alik_Bljk___F_4_S_S___M_X_A_3_2___M_X_B_3_2___BH_Bias_S_HA_S_SAV_UserArgs_MT16x16x128_MI16x16x1_SN_LDSB0_AFC1_AG0_AFEM1_AFEM1_ASEM32_CLR0_CADS0_DTLA0_DTLB0_DTVA0_DTVB0_EPS1_ELFLR0_EMLLn1_FDSI1_GRPM1_GRVWA32_GRVWB32_GSU1_GSUAMB_GSUC0_GSUWGMRR0_GLS0_ISA950_IU1_K1_LDSTI0_LBSPPA128_LBSPPB128_LBSPPM0_LPA64_LPB64_LPM0_LRVW32_LWPMn1_MIAV0_MIWT1_1_MO40_NTn1_NTA0_NTB0_NTC0_NTD0_NTM0_NEPBS0_NLCA1_NLCB1_ONLL0_PGR1_PLR1_PKA0_SIA1_SS1_SU32_SUM0_SUS256_SPO0_SRVW0_SSO0_SVW1_SK0_SKFTR0_SKXCCM0_SGRO0_TIN0_TLDS1_ULSGRO0_USL1_UIOFGRO0_USFGRO0_VSn1_VWA1_VWB1_WSGRA0_WSGRB0_WS64_WG16_4_1_WGM8_WGMXCC1_WGMXCCGn1
    SolutionIndex: 1
    SolutionNameMin: Cijk_Alik_Bljk___F_4_S_S___M_X_A_3_2___M_X_B_3_2___BH_Bias_S_HA_S_SAV_UserArgs_MT16x16x128_MI16x16x1_SN_LDSB0_AFC1_AG0_AFEM1_AFEM1_ASEM32_CLR0_CADS0_DTLA0_DTLB0_DTVA0_DTVB0_EPS0_ELFLR0_EMLLn1_FDSI1_GRPM1_GRVWA32_GRVWB32_GSU1_GSUAMB_GSUC0_GSUWGMRR0_GLS0_ISA950_IU1_K1_LDSTI0_LBSPPA128_LBSPPB128_LBSPPM0_LPA64_LPB64_LPM0_LRVW32_LWPMn1_MIAV0_MIWT1_1_MO40_NTn1_NTA0_NTB0_NTC0_NTD0_NTM0_NEPBS0_NLCA1_NLCB1_ONLL0_PGR2_PLR1_PKA0_SIA3_SS1_SU32_SUM0_SUS256_SPO0_SRVW0_SSO0_SVW1_SK0_SKFTR0_SKXCCM0_SGRO0_TIN0_TLDS1_ULSGRO0_USL1_UIOFGRO0_USFGRO0_VSn1_VWA1_VWB1_WSGRA0_WSGRB0_WS64_WG16_4_1_WGM8_WGMXCC1_WGMXCCGn1
    SolutionIndex: 2
    SolutionNameMin: Cijk_Alik_Bljk___F_4_S_S___M_X_A_3_2___M_X_B_3_2___BH_Bias_S_HA_S_SAV_UserArgs_MT16x16x128_MI16x16x1_SN_LDSB0_AFC1_AG0_AFEM1_AFEM1_ASEM32_CLR0_CADS0_DTLA0_DTLB0_DTVA0_DTVB0_EPS1_ELFLR0_EMLLn1_FDSI1_GRPM1_GRVWA32_GRVWB32_GSU1_GSUAMB_GSUC0_GSUWGMRR0_GLS0_ISA950_IU1_K1_LDSTI0_LBSPPA128_LBSPPB128_LBSPPM0_LPA64_LPB64_LPM0_LRVW32_LWPMn1_MIAV0_MIWT1_1_MO40_NTn1_NTA0_NTB0_NTC0_NTD0_NTM0_NEPBS0_NLCA1_NLCB1_ONLL0_PGR1_PLR0_PKA0_SIA1_SS1_SU32_SUM0_SUS256_SPO0_SRVW0_SSO0_SVW1_SK0_SKFTR0_SKXCCM0_SGRO0_TIN0_TLDS1_ULSGRO0_USL1_UIOFGRO0_USFGRO1_VSn1_VWA1_VWB1_WSGRA0_WSGRB0_WS64_WG16_4_1_WGM8_WGMXCC1_WGMXCCGn1
    SolutionIndex: 3
    SolutionNameMin: Cijk_Alik_Bljk___F_4_S_S___M_X_A_3_2___M_X_B_3_2___BH_Bias_S_HA_S_SAV_UserArgs_MT16x16x128_MI16x16x1_SN_LDSB0_AFC1_AG0_AFEM1_AFEM1_ASEM32_CLR0_CADS0_DTLA0_DTLB0_DTVA0_DTVB0_EPS0_ELFLR0_EMLLn1_FDSI1_GRPM1_GRVWA32_GRVWB32_GSU1_GSUAMB_GSUC0_GSUWGMRR0_GLS0_ISA950_IU1_K1_LDSTI0_LBSPPA128_LBSPPB128_LBSPPM0_LPA64_LPB64_LPM0_LRVW32_LWPMn1_MIAV0_MIWT1_1_MO40_NTn1_NTA0_NTB0_NTC0_NTD0_NTM0_NEPBS0_NLCA1_NLCB1_ONLL0_PGR2_PLR0_PKA0_SIA3_SS1_SU32_SUM0_SUS256_SPO0_SRVW0_SSO0_SVW1_SK0_SKFTR0_SKXCCM0_SGRO0_TIN0_TLDS1_ULSGRO0_USL1_UIOFGRO0_USFGRO1_VSn1_VWA1_VWB1_WSGRA0_WSGRB0_WS64_WG16_4_1_WGM8_WGMXCC1_WGMXCCGn1
    SolutionIndex: 4
    SolutionNameMin: Cijk_Alik_Bljk___F_4_S_S___M_X_A_3_2___M_X_B_3_2___BH_Bias_S_HA_S_SAV_UserArgs_MT16x16x128_MI16x16x1_SN_LDSB0_AFC1_AG0_AFEM1_AFEM1_ASEM32_CLR0_CADS0_DTLA0_DTLB0_DTVA0_DTVB0_EPS0_ELFLR0_EMLLn1_FDSI1_GRPM1_GRVWA32_GRVWB32_GSU1_GSUAMB_GSUC0_GSUWGMRR0_GLS0_ISA950_IU1_K1_LDSTI0_LBSPPA128_LBSPPB128_LBSPPM0_LPA64_LPB64_LPM0_LRVW32_LWPMn1_MIAV0_MIWT1_1_MO40_NTn1_NTA0_NTB0_NTC0_NTD0_NTM0_NEPBS0_NLCA1_NLCB1_ONLL0_PGR2_PLR0_PKA1_SIA1_SS1_SU32_SUM0_SUS256_SPO0_SRVW0_SSO0_SVW1_SK0_SKFTR0_SKXCCM0_SGRO0_TIN0_TLDS1_ULSGRO0_USL1_UIOFGRO0_USFGRO0_VSn1_VWA1_VWB1_WSGRA0_WSGRB0_WS64_WG16_4_1_WGM8_WGMXCC1_WGMXCCGn1
    SolutionIndex: 5
    SolutionNameMin: Cijk_Alik_Bljk___F_4_S_S___M_X_A_3_2___M_X_B_3_2___BH_Bias_S_HA_S_SAV_UserArgs_MT16x16x128_MI16x16x1_SN_LDSB0_AFC1_AG0_AFEM1_AFEM1_ASEM32_CLR0_CADS0_DTLA0_DTLB0_DTVA0_DTVB0_EPS1_ELFLR0_EMLLn1_FDSI1_GRPM1_GRVWA32_GRVWB32_GSU1_GSUAMB_GSUC0_GSUWGMRR0_GLS0_ISA950_IU1_K1_LDSTI0_LBSPPA128_LBSPPB128_LBSPPM0_LPA64_LPB64_LPM0_LRVW32_LWPMn1_MIAV0_MIWT1_1_MO40_NTn1_NTA0_NTB0_NTC0_NTD0_NTM0_NEPBS0_NLCA1_NLCB1_ONLL0_PGR1_PLR0_PKA1_SIA1_SS1_SU32_SUM0_SUS256_SPO0_SRVW0_SSO0_SVW1_SK0_SKFTR0_SKXCCM0_SGRO0_TIN0_TLDS1_ULSGRO0_USL1_UIOFGRO0_USFGRO0_VSn1_VWA1_VWB1_WSGRA0_WSGRB0_WS64_WG16_4_1_WGM8_WGMXCC1_WGMXCCGn1
    SolutionIndex: 6
    SolutionNameMin: Cijk_Alik_Bljk___F_4_S_S___M_X_A_3_2___M_X_B_3_2___BH_Bias_S_HA_S_SAV_UserArgs_MT16x16x128_MI16x16x1_SN_LDSB0_AFC1_AG0_AFEM1_AFEM1_ASEM32_CLR0_CADS0_DTLA0_DTLB0_DTVA0_DTVB0_EPS1_ELFLR0_EMLLn1_FDSI1_GRPM1_GRVWA32_GRVWB32_GSU1_GSUAMB_GSUC0_GSUWGMRR0_GLS0_ISA950_IU1_K1_LDSTI0_LBSPPA128_LBSPPB128_LBSPPM0_LPA64_LPB64_LPM0_LRVW32_LWPMn1_MIAV0_MIWT1_1_MO40_NTn1_NTA0_NTB0_NTC0_NTD0_NTM0_NEPBS0_NLCA1_NLCB1_ONLL0_PGR1_PLR1_PKA1_SIA1_SS1_SU32_SUM0_SUS256_SPO0_SRVW0_SSO0_SVW1_SK0_SKFTR0_SKXCCM0_SGRO0_TIN0_TLDS1_ULSGRO0_USL1_UIOFGRO0_USFGRO0_VSn1_VWA1_VWB1_WSGRA0_WSGRB0_WS64_WG16_4_1_WGM8_WGMXCC1_WGMXCCGn1
    SolutionIndex: 7
    SolutionNameMin: Cijk_Alik_Bljk___F_4_S_S___M_X_A_3_2___M_X_B_3_2___BH_Bias_S_HA_S_SAV_UserArgs_MT16x16x128_MI16x16x1_SN_LDSB0_AFC1_AG0_AFEM1_AFEM1_ASEM32_CLR1_CADS0_DTLA0_DTLB0_DTVA0_DTVB0_EPS1_ELFLR0_EMLLn1_FDSI1_GRPM1_GRVWA32_GRVWB32_GSU1_GSUAMB_GSUC0_GSUWGMRR0_GLS0_ISA950_IU1_K1_LDSTI0_LBSPPA128_LBSPPB128_LBSPPM0_LPA64_LPB64_LPM0_LRVW32_LWPMn1_MIAV0_MIWT1_1_MO40_NTn1_NTA0_NTB0_NTC0_NTD0_NTM0_NEPBS0_NLCA1_NLCB1_ONLL0_PGR1_PLR0_PKA1_SIA1_SS1_SU32_SUM0_SUS256_SPO0_SRVW0_SSO0_SVW1_SK0_SKFTR0_SKXCCM0_SGRO0_TIN0_TLDS1_ULSGRO0_USL1_UIOFGRO0_USFGRO0_VSn1_VWA1_VWB1_WSGRA0_WSGRB0_WS64_WG16_4_1_WGM8_WGMXCC1_WGMXCCGn1
    SolutionIndex: 8
    SolutionNameMin: Cijk_Alik_Bljk___F_4_S_S___M_X_A_3_2___M_X_B_3_2___BH_Bias_S_HA_S_SAV_UserArgs_MT16x16x128_MI16x16x1_SN_LDSB0_AFC1_AG0_AFEM1_AFEM1_ASEM32_CLR0_CADS0_DTLA0_DTLB0_DTVA0_DTVB0_EPS0_ELFLR0_EMLLn1_FDSI1_GRPM1_GRVWA32_GRVWB32_GSU1_GSUAMB_GSUC0_GSUWGMRR0_GLS0_ISA950_IU1_K1_LDSTI0_LBSPPA128_LBSPPB128_LBSPPM0_LPA64_LPB64_LPM0_LRVW32_LWPMn1_MIAV0_MIWT1_1_MO40_NTn1_NTA0_NTB0_NTC0_NTD0_NTM0_NEPBS0_NLCA1_NLCB1_ONLL0_PGR2_PLR0_PKA1_SIA3_SS1_SU32_SUM0_SUS256_SPO0_SRVW0_SSO0_SVW1_SK0_SKFTR0_SKXCCM0_SGRO0_TIN0_TLDS1_ULSGRO0_USL1_UIOFGRO0_USFGRO0_VSn1_VWA1_VWB1_WSGRA0_WSGRB0_WS64_WG16_4_1_WGM8_WGMXCC1_WGMXCCGn1
    SolutionIndex: 9
    SolutionNameMin: Cijk_Alik_Bljk___F_4_S_S___M_X_A_3_2___M_X_B_3_2___BH_Bias_S_HA_S_SAV_UserArgs_MT16x16x128_MI16x16x1_SN_LDSB0_AFC1_AG0_AFEM1_AFEM1_ASEM32_CLR0_CADS0_DTLA0_DTLB0_DTVA0_DTVB0_EPS0_ELFLR0_EMLLn1_FDSI1_GRPM1_GRVWA32_GRVWB32_GSU1_GSUAMB_GSUC0_GSUWGMRR0_GLS0_ISA950_IU1_K1_LDSTI0_LBSPPA128_LBSPPB128_LBSPPM0_LPA64_LPB64_LPM0_LRVW32_LWPMn1_MIAV0_MIWT1_1_MO40_NTn1_NTA0_NTB0_NTC0_NTD0_NTM0_NEPBS0_NLCA1_NLCB1_ONLL0_PGR2_PLR1_PKA1_SIA3_SS1_SU32_SUM0_SUS256_SPO0_SRVW0_SSO0_SVW1_SK0_SKFTR0_SKXCCM0_SGRO0_TIN0_TLDS1_ULSGRO0_USL1_UIOFGRO0_USFGRO0_VSn1_VWA1_VWB1_WSGRA0_WSGRB0_WS64_WG16_4_1_WGM8_WGMXCC1_WGMXCCGn1
    SolutionIndex: 10
    SolutionNameMin: Cijk_Alik_Bljk___F_4_S_S___M_X_A_3_2___M_X_B_3_2___BH_Bias_S_HA_S_SAV_UserArgs_MT16x16x128_MI16x16x1_SN_LDSB0_AFC1_AG0_AFEM1_AFEM1_ASEM32_CLR1_CADS0_DTLA0_DTLB0_DTVA0_DTVB0_EPS0_ELFLR0_EMLLn1_FDSI1_GRPM1_GRVWA32_GRVWB32_GSU1_GSUAMB_GSUC0_GSUWGMRR0_GLS0_ISA950_IU1_K1_LDSTI0_LBSPPA128_LBSPPB128_LBSPPM0_LPA64_LPB64_LPM0_LRVW32_LWPMn1_MIAV0_MIWT1_1_MO40_NTn1_NTA0_NTB0_NTC0_NTD0_NTM0_NEPBS0_NLCA1_NLCB1_ONLL0_PGR1_PLR0_PKA1_SIA3_SS1_SU32_SUM0_SUS256_SPO0_SRVW0_SSO0_SVW1_SK0_SKFTR0_SKXCCM0_SGRO0_TIN0_TLDS1_ULSGRO0_USL1_UIOFGRO0_USFGRO0_VSn1_VWA1_VWB1_WSGRA0_WSGRB0_WS64_WG16_4_1_WGM8_WGMXCC1_WGMXCCGn1
    SolutionIndex: 11
    SolutionNameMin: Cijk_Alik_Bljk___F_4_S_S___M_X_A_3_2___M_X_B_3_2___BH_Bias_S_HA_S_SAV_UserArgs_MT16x16x128_MI16x16x1_SN_LDSB0_AFC1_AG0_AFEM1_AFEM1_ASEM32_CLR1_CADS0_DTLA0_DTLB0_DTVA0_DTVB0_EPS0_ELFLR0_EMLLn1_FDSI1_GRPM1_GRVWA32_GRVWB32_GSU1_GSUAMB_GSUC0_GSUWGMRR0_GLS0_ISA950_IU1_K1_LDSTI0_LBSPPA128_LBSPPB128_LBSPPM0_LPA64_LPB64_LPM0_LRVW32_LWPMn1_MIAV0_MIWT1_1_MO40_NTn1_NTA0_NTB0_NTC0_NTD0_NTM0_NEPBS0_NLCA1_NLCB1_ONLL0_PGR2_PLR0_PKA1_SIA3_SS1_SU32_SUM0_SUS256_SPO0_SRVW0_SSO0_SVW1_SK0_SKFTR0_SKXCCM0_SGRO0_TIN0_TLDS1_ULSGRO0_USL1_UIOFGRO0_USFGRO0_VSn1_VWA1_VWB1_WSGRA0_WSGRB0_WS64_WG16_4_1_WGM8_WGMXCC1_WGMXCCGn1
    SolutionIndex: 12
    SolutionNameMin: Cijk_Alik_Bljk___F_4_S_S___M_X_A_3_2___M_X_B_3_2___BH_Bias_S_HA_S_SAV_UserArgs_MT16x16x128_MI16x16x1_SN_LDSB0_AFC1_AG0_AFEM1_AFEM1_ASEM32_CLR0_CADS0_DTLA0_DTLB0_DTVA0_DTVB0_EPS1_ELFLR0_EMLLn1_FDSI1_GRPM1_GRVWA32_GRVWB32_GSU1_GSUAMB_GSUC0_GSUWGMRR0_GLS0_ISA950_IU1_K1_LDSTI0_LBSPPA128_LBSPPB128_LBSPPM0_LPA64_LPB64_LPM0_LRVW32_LWPMn1_MIAV0_MIWT1_1_MO40_NTn1_NTA0_NTB0_NTC0_NTD0_NTM0_NEPBS0_NLCA1_NLCB1_ONLL0_PGR1_PLR0_PKA1_SIA3_SS1_SU32_SUM0_SUS256_SPO0_SRVW0_SSO0_SVW1_SK0_SKFTR0_SKXCCM0_SGRO0_TIN0_TLDS1_ULSGRO0_USL1_UIOFGRO0_USFGRO0_VSn1_VWA1_VWB1_WSGRA0_WSGRB0_WS64_WG16_4_1_WGM8_WGMXCC1_WGMXCCGn1
    SolutionIndex: 13
    SolutionNameMin: Cijk_Alik_Bljk___F_4_S_S___M_X_A_3_2___M_X_B_3_2___BH_Bias_S_HA_S_SAV_UserArgs_MT16x16x128_MI16x16x1_SN_LDSB0_AFC1_AG0_AFEM1_AFEM1_ASEM32_CLR0_CADS0_DTLA0_DTLB0_DTVA0_DTVB0_EPS1_ELFLR0_EMLLn1_FDSI1_GRPM1_GRVWA32_GRVWB32_GSU1_GSUAMB_GSUC0_GSUWGMRR0_GLS0_ISA950_IU1_K1_LDSTI0_LBSPPA128_LBSPPB128_LBSPPM0_LPA64_LPB64_LPM0_LRVW32_LWPMn1_MIAV0_MIWT1_1_MO40_NTn1_NTA0_NTB0_NTC0_NTD0_NTM0_NEPBS0_NLCA1_NLCB1_ONLL0_PGR1_PLR1_PKA1_SIA3_SS1_SU32_SUM0_SUS256_SPO0_SRVW0_SSO0_SVW1_SK0_SKFTR0_SKXCCM0_SGRO0_TIN0_TLDS1_ULSGRO0_USL1_UIOFGRO0_USFGRO0_VSn1_VWA1_VWB1_WSGRA0_WSGRB0_WS64_WG16_4_1_WGM8_WGMXCC1_WGMXCCGn1
    SolutionIndex: 14
    SolutionNameMin: Cijk_Alik_Bljk___F_4_S_S___M_X_A_3_2___M_X_B_3_2___BH_Bias_S_HA_S_SAV_UserArgs_MT16x16x128_MI16x16x1_SN_LDSB0_AFC1_AG0_AFEM1_AFEM1_ASEM32_CLR1_CADS0_DTLA0_DTLB0_DTVA0_DTVB0_EPS1_ELFLR0_EMLLn1_FDSI1_GRPM1_GRVWA32_GRVWB32_GSU1_GSUAMB_GSUC0_GSUWGMRR0_GLS0_ISA950_IU1_K1_LDSTI0_LBSPPA128_LBSPPB128_LBSPPM0_LPA64_LPB64_LPM0_LRVW32_LWPMn1_MIAV0_MIWT1_1_MO40_NTn1_NTA0_NTB0_NTC0_NTD0_NTM0_NEPBS0_NLCA1_NLCB1_ONLL0_PGR1_PLR0_PKA1_SIA3_SS1_SU32_SUM0_SUS256_SPO0_SRVW0_SSO0_SVW1_SK0_SKFTR0_SKXCCM0_SGRO0_TIN0_TLDS1_ULSGRO0_USL1_UIOFGRO0_USFGRO0_VSn1_VWA1_VWB1_WSGRA0_WSGRB0_WS64_WG16_4_1_WGM8_WGMXCC1_WGMXCCGn1
    SolutionIndex: 15
    SolutionNameMin: Cijk_Alik_Bljk___F_4_S_S___M_X_A_3_2___M_X_B_3_2___BH_Bias_S_HA_S_SAV_UserArgs_MT16x16x128_MI16x16x1_SN_LDSB0_AFC1_AG0_AFEM1_AFEM1_ASEM32_CLR0_CADS0_DTLA0_DTLB0_DTVA0_DTVB0_EPS0_ELFLR0_EMLLn1_FDSI1_GRPM1_GRVWA32_GRVWB32_GSU1_GSUAMB_GSUC0_GSUWGMRR0_GLS0_ISA950_IU1_K1_LDSTI0_LBSPPA128_LBSPPB128_LBSPPM0_LPA64_LPB64_LPM0_LRVW32_LWPMn1_MIAV0_MIWT1_1_MO40_NTn1_NTA0_NTB0_NTC0_NTD0_NTM0_NEPBS0_NLCA1_NLCB1_ONLL0_PGR2_PLR0_PKA1_SIA1_SS1_SU32_SUM0_SUS256_SPO0_SRVW0_SSO0_SVW1_SK0_SKFTR0_SKXCCM0_SGRO0_TIN0_TLDS1_ULSGRO0_USL1_UIOFGRO0_USFGRO1_VSn1_VWA1_VWB1_WSGRA0_WSGRB0_WS64_WG16_4_1_WGM8_WGMXCC1_WGMXCCGn1
    SolutionIndex: 16
    SolutionNameMin: Cijk_Alik_Bljk___F_4_S_S___M_X_A_3_2___M_X_B_3_2___BH_Bias_S_HA_S_SAV_UserArgs_MT16x16x128_MI16x16x1_SN_LDSB0_AFC1_AG0_AFEM1_AFEM1_ASEM32_CLR0_CADS0_DTLA0_DTLB0_DTVA0_DTVB0_EPS0_ELFLR0_EMLLn1_FDSI1_GRPM1_GRVWA32_GRVWB32_GSU1_GSUAMB_GSUC0_GSUWGMRR0_GLS0_ISA950_IU1_K1_LDSTI0_LBSPPA128_LBSPPB128_LBSPPM0_LPA64_LPB64_LPM0_LRVW32_LWPMn1_MIAV0_MIWT1_1_MO40_NTn1_NTA0_NTB0_NTC0_NTD0_NTM0_NEPBS0_NLCA1_NLCB1_ONLL0_PGR1_PLR1_PKA1_SIA1_SS1_SU32_SUM0_SUS256_SPO0_SRVW0_SSO0_SVW1_SK0_SKFTR0_SKXCCM0_SGRO0_TIN0_TLDS1_ULSGRO0_USL1_UIOFGRO0_USFGRO1_VSn1_VWA1_VWB1_WSGRA0_WSGRB0_WS64_WG16_4_1_WGM8_WGMXCC1_WGMXCCGn1
    SolutionIndex: 17
    SolutionNameMin: Cijk_Alik_Bljk___F_4_S_S___M_X_A_3_2___M_X_B_3_2___BH_Bias_S_HA_S_SAV_UserArgs_MT16x16x128_MI16x16x1_SN_LDSB0_AFC1_AG0_AFEM1_AFEM1_ASEM32_CLR0_CADS0_DTLA0_DTLB0_DTVA0_DTVB0_EPS0_ELFLR0_EMLLn1_FDSI1_GRPM1_GRVWA32_GRVWB32_GSU1_GSUAMB_GSUC0_GSUWGMRR0_GLS0_ISA950_IU1_K1_LDSTI0_LBSPPA128_LBSPPB128_LBSPPM0_LPA64_LPB64_LPM0_LRVW32_LWPMn1_MIAV0_MIWT1_1_MO40_NTn1_NTA0_NTB0_NTC0_NTD0_NTM0_NEPBS0_NLCA1_NLCB1_ONLL0_PGR2_PLR1_PKA1_SIA1_SS1_SU32_SUM0_SUS256_SPO0_SRVW0_SSO0_SVW1_SK0_SKFTR0_SKXCCM0_SGRO0_TIN0_TLDS1_ULSGRO0_USL1_UIOFGRO0_USFGRO1_VSn1_VWA1_VWB1_WSGRA0_WSGRB0_WS64_WG16_4_1_WGM8_WGMXCC1_WGMXCCGn1
    SolutionIndex: 18
    SolutionNameMin: Cijk_Alik_Bljk___F_4_S_S___M_X_A_3_2___M_X_B_3_2___BH_Bias_S_HA_S_SAV_UserArgs_MT16x16x128_MI16x16x1_SN_LDSB0_AFC1_AG0_AFEM1_AFEM1_ASEM32_CLR1_CADS0_DTLA0_DTLB0_DTVA0_DTVB0_EPS0_ELFLR0_EMLLn1_FDSI1_GRPM1_GRVWA32_GRVWB32_GSU1_GSUAMB_GSUC0_GSUWGMRR0_GLS0_ISA950_IU1_K1_LDSTI0_LBSPPA128_LBSPPB128_LBSPPM0_LPA64_LPB64_LPM0_LRVW32_LWPMn1_MIAV0_MIWT1_1_MO40_NTn1_NTA0_NTB0_NTC0_NTD0_NTM0_NEPBS0_NLCA1_NLCB1_ONLL0_PGR0_PLR0_PKA1_SIA1_SS1_SU32_SUM0_SUS256_SPO0_SRVW0_SSO0_SVW1_SK0_SKFTR0_SKXCCM0_SGRO0_TIN0_TLDS1_ULSGRO0_USL1_UIOFGRO0_USFGRO1_VSn1_VWA1_VWB1_WSGRA0_WSGRB0_WS64_WG16_4_1_WGM8_WGMXCC1_WGMXCCGn1
    SolutionIndex: 19
    SolutionNameMin: Cijk_Alik_Bljk___F_4_S_S___M_X_A_3_2___M_X_B_3_2___BH_Bias_S_HA_S_SAV_UserArgs_MT16x16x128_MI16x16x1_SN_LDSB0_AFC1_AG0_AFEM1_AFEM1_ASEM32_CLR1_CADS0_DTLA0_DTLB0_DTVA0_DTVB0_EPS0_ELFLR0_EMLLn1_FDSI1_GRPM1_GRVWA32_GRVWB32_GSU1_GSUAMB_GSUC0_GSUWGMRR0_GLS0_ISA950_IU1_K1_LDSTI0_LBSPPA128_LBSPPB128_LBSPPM0_LPA64_LPB64_LPM0_LRVW32_LWPMn1_MIAV0_MIWT1_1_MO40_NTn1_NTA0_NTB0_NTC0_NTD0_NTM0_NEPBS0_NLCA1_NLCB1_ONLL0_PGR1_PLR0_PKA1_SIA1_SS1_SU32_SUM0_SUS256_SPO0_SRVW0_SSO0_SVW1_SK0_SKFTR0_SKXCCM0_SGRO0_TIN0_TLDS1_ULSGRO0_USL1_UIOFGRO0_USFGRO1_VSn1_VWA1_VWB1_WSGRA0_WSGRB0_WS64_WG16_4_1_WGM8_WGMXCC1_WGMXCCGn1
    SolutionIndex: 20
    SolutionNameMin: Cijk_Alik_Bljk___F_4_S_S___M_X_A_3_2___M_X_B_3_2___BH_Bias_S_HA_S_SAV_UserArgs_MT16x16x128_MI16x16x1_SN_LDSB0_AFC1_AG0_AFEM1_AFEM1_ASEM32_CLR1_CADS0_DTLA0_DTLB0_DTVA0_DTVB0_EPS0_ELFLR0_EMLLn1_FDSI1_GRPM1_GRVWA32_GRVWB32_GSU1_GSUAMB_GSUC0_GSUWGMRR0_GLS0_ISA950_IU1_K1_LDSTI0_LBSPPA128_LBSPPB128_LBSPPM0_LPA64_LPB64_LPM0_LRVW32_LWPMn1_MIAV0_MIWT1_1_MO40_NTn1_NTA0_NTB0_NTC0_NTD0_NTM0_NEPBS0_NLCA1_NLCB1_ONLL0_PGR2_PLR0_PKA1_SIA1_SS1_SU32_SUM0_SUS256_SPO0_SRVW0_SSO0_SVW1_SK0_SKFTR0_SKXCCM0_SGRO0_TIN0_TLDS1_ULSGRO0_USL1_UIOFGRO0_USFGRO1_VSn1_VWA1_VWB1_WSGRA0_WSGRB0_WS64_WG16_4_1_WGM8_WGMXCC1_WGMXCCGn1
    SolutionIndex: 21
    SolutionNameMin: Cijk_Alik_Bljk___F_4_S_S___M_X_A_3_2___M_X_B_3_2___BH_Bias_S_HA_S_SAV_UserArgs_MT16x16x128_MI16x16x1_SN_LDSB0_AFC1_AG0_AFEM1_AFEM1_ASEM32_CLR0_CADS0_DTLA0_DTLB0_DTVA0_DTVB0_EPS1_ELFLR0_EMLLn1_FDSI1_GRPM1_GRVWA32_GRVWB32_GSU1_GSUAMB_GSUC0_GSUWGMRR0_GLS0_ISA950_IU1_K1_LDSTI0_LBSPPA128_LBSPPB128_LBSPPM0_LPA64_LPB64_LPM0_LRVW32_LWPMn1_MIAV0_MIWT1_1_MO40_NTn1_NTA0_NTB0_NTC0_NTD0_NTM0_NEPBS0_NLCA1_NLCB1_ONLL0_PGR1_PLR0_PKA1_SIA1_SS1_SU32_SUM0_SUS256_SPO0_SRVW0_SSO0_SVW1_SK0_SKFTR0_SKXCCM0_SGRO0_TIN0_TLDS1_ULSGRO0_USL1_UIOFGRO0_USFGRO1_VSn1_VWA1_VWB1_WSGRA0_WSGRB0_WS64_WG16_4_1_WGM8_WGMXCC1_WGMXCCGn1
    SolutionIndex: 22
    SolutionNameMin: Cijk_Alik_Bljk___F_4_S_S___M_X_A_3_2___M_X_B_3_2___BH_Bias_S_HA_S_SAV_UserArgs_MT16x16x128_MI16x16x1_SN_LDSB0_AFC1_AG0_AFEM1_AFEM1_ASEM32_CLR0_CADS0_DTLA0_DTLB0_DTVA0_DTVB0_EPS1_ELFLR0_EMLLn1_FDSI1_GRPM1_GRVWA32_GRVWB32_GSU1_GSUAMB_GSUC0_GSUWGMRR0_GLS0_ISA950_IU1_K1_LDSTI0_LBSPPA128_LBSPPB128_LBSPPM0_LPA64_LPB64_LPM0_LRVW32_LWPMn1_MIAV0_MIWT1_1_MO40_NTn1_NTA0_NTB0_NTC0_NTD0_NTM0_NEPBS0_NLCA1_NLCB1_ONLL0_PGR1_PLR1_PKA1_SIA1_SS1_SU32_SUM0_SUS256_SPO0_SRVW0_SSO0_SVW1_SK0_SKFTR0_SKXCCM0_SGRO0_TIN0_TLDS1_ULSGRO0_USL1_UIOFGRO0_USFGRO1_VSn1_VWA1_VWB1_WSGRA0_WSGRB0_WS64_WG16_4_1_WGM8_WGMXCC1_WGMXCCGn1
    SolutionIndex: 23
    SolutionNameMin: Cijk_Alik_Bljk___F_4_S_S___M_X_A_3_2___M_X_B_3_2___BH_Bias_S_HA_S_SAV_UserArgs_MT16x16x128_MI16x16x1_SN_LDSB0_AFC1_AG0_AFEM1_AFEM1_ASEM32_CLR1_CADS0_DTLA0_DTLB0_DTVA0_DTVB0_EPS1_ELFLR0_EMLLn1_FDSI1_GRPM1_GRVWA32_GRVWB32_GSU1_GSUAMB_GSUC0_GSUWGMRR0_GLS0_ISA950_IU1_K1_LDSTI0_LBSPPA128_LBSPPB128_LBSPPM0_LPA64_LPB64_LPM0_LRVW32_LWPMn1_MIAV0_MIWT1_1_MO40_NTn1_NTA0_NTB0_NTC0_NTD0_NTM0_NEPBS0_NLCA1_NLCB1_ONLL0_PGR1_PLR0_PKA1_SIA1_SS1_SU32_SUM0_SUS256_SPO0_SRVW0_SSO0_SVW1_SK0_SKFTR0_SKXCCM0_SGRO0_TIN0_TLDS1_ULSGRO0_USL1_UIOFGRO0_USFGRO1_VSn1_VWA1_VWB1_WSGRA0_WSGRB0_WS64_WG16_4_1_WGM8_WGMXCC1_WGMXCCGn1
    SolutionIndex: 24
    SolutionNameMin: Cijk_Alik_Bljk___F_4_S_S___M_X_A_3_2___M_X_B_3_2___BH_Bias_S_HA_S_SAV_UserArgs_MT16x16x128_MI16x16x1_SN_LDSB1_AFC1_AG0_AFEM1_AFEM1_ASEM32_CLR0_CADS0_DTLA0_DTLB0_DTVA0_DTVB0_EPS1_ELFLR0_EMLLn1_FDSI1_GRPM1_GRVWA32_GRVWB32_GSU1_GSUAMB_GSUC0_GSUWGMRR0_GLS0_ISA950_IU1_K1_LDSTI0_LBSPPA128_LBSPPB128_LBSPPM0_LPA64_LPB64_LPM0_LRVW32_LWPMn1_MIAV0_MIWT1_1_MO40_NTn1_NTA0_NTB0_NTC0_NTD0_NTM0_NEPBS0_NLCA1_NLCB1_ONLL0_PGR1_PLR1_PKA1_SIA2_SS1_SU32_SUM0_SUS256_SPO0_SRVW0_SSO0_SVW1_SK0_SKFTR0_SKXCCM0_SGRO0_TIN0_TLDS1_ULSGRO0_USL1_UIOFGRO0_USFGRO1_VSn1_VWA1_VWB1_WSGRA0_WSGRB0_WS64_WG16_4_1_WGM8_WGMXCC1_WGMXCCGn1
    SolutionIndex: 25
    SolutionNameMin: Cijk_Alik_Bljk___F_4_S_S___M_X_A_3_2___M_X_B_3_2___BH_Bias_S_HA_S_SAV_UserArgs_MT16x16x128_MI16x16x1_SN_LDSB1_AFC1_AG0_AFEM1_AFEM1_ASEM32_CLR0_CADS0_DTLA0_DTLB0_DTVA0_DTVB0_EPS0_ELFLR0_EMLLn1_FDSI1_GRPM1_GRVWA32_GRVWB32_GSU1_GSUAMB_GSUC0_GSUWGMRR0_GLS0_ISA950_IU1_K1_LDSTI0_LBSPPA128_LBSPPB128_LBSPPM0_LPA64_LPB64_LPM0_LRVW32_LWPMn1_MIAV0_MIWT1_1_MO40_NTn1_NTA0_NTB0_NTC0_NTD0_NTM0_NEPBS0_NLCA1_NLCB1_ONLL0_PGR2_PLR1_PKA1_SIA2_SS1_SU32_SUM0_SUS256_SPO0_SRVW0_SSO0_SVW1_SK0_SKFTR0_SKXCCM0_SGRO0_TIN0_TLDS1_ULSGRO0_USL1_UIOFGRO0_USFGRO1_VSn1_VWA1_VWB1_WSGRA0_WSGRB0_WS64_WG16_4_1_WGM8_WGMXCC1_WGMXCCGn1
    SolutionIndex: 26
    SolutionNameMin: Cijk_Alik_Bljk___F_4_S_S___M_X_A_3_2___M_X_B_3_2___BH_Bias_S_HA_S_SAV_UserArgs_MT16x16x128_MI16x16x1_SN_LDSB1_AFC1_AG0_AFEM1_AFEM1_ASEM32_CLR1_CADS0_DTLA0_DTLB0_DTVA0_DTVB0_EPS0_ELFLR0_EMLLn1_FDSI1_GRPM1_GRVWA32_GRVWB32_GSU1_GSUAMB_GSUC0_GSUWGMRR0_GLS0_ISA950_IU1_K1_LDSTI0_LBSPPA128_LBSPPB128_LBSPPM0_LPA64_LPB64_LPM0_LRVW32_LWPMn1_MIAV0_MIWT1_1_MO40_NTn1_NTA0_NTB0_NTC0_NTD0_NTM0_NEPBS0_NLCA1_NLCB1_ONLL0_PGR2_PLR1_PKA1_SIA2_SS1_SU32_SUM0_SUS256_SPO0_SRVW0_SSO0_SVW1_SK0_SKFTR0_SKXCCM0_SGRO0_TIN0_TLDS1_ULSGRO0_USL1_UIOFGRO0_USFGRO1_VSn1_VWA1_VWB1_WSGRA0_WSGRB0_WS64_WG16_4_1_WGM8_WGMXCC1_WGMXCCGn1
    SolutionIndex: 27
    SolutionNameMin: Cijk_Alik_Bljk___F_4_S_S___M_X_A_3_2___M_X_B_3_2___BH_Bias_S_HA_S_SAV_UserArgs_MT16x16x128_MI16x16x1_SN_LDSB0_AFC1_AG0_AFEM1_AFEM1_ASEM32_CLR0_CADS0_DTLA0_DTLB0_DTVA0_DTVB0_EPS0_ELFLR0_EMLLn1_FDSI1_GRPM1_GRVWA32_GRVWB32_GSU1_GSUAMB_GSUC0_GSUWGMRR0_GLS0_ISA950_IU1_K1_LDSTI0_LBSPPA128_LBSPPB128_LBSPPM0_LPA64_LPB64_LPM0_LRVW32_LWPMn1_MIAV0_MIWT1_1_MO40_NTn1_NTA0_NTB0_NTC0_NTD0_NTM0_NEPBS0_NLCA1_NLCB1_ONLL0_PGR2_PLR0_PKA1_SIA3_SS1_SU32_SUM0_SUS256_SPO0_SRVW0_SSO0_SVW1_SK0_SKFTR0_SKXCCM0_SGRO0_TIN0_TLDS1_ULSGRO0_USL1_UIOFGRO0_USFGRO1_VSn1_VWA1_VWB1_WSGRA0_WSGRB0_WS64_WG16_4_1_WGM8_WGMXCC1_WGMXCCGn1
    SolutionIndex: 28
    SolutionNameMin: Cijk_Alik_Bljk___F_4_S_S___M_X_A_3_2___M_X_B_3_2___BH_Bias_S_HA_S_SAV_UserArgs_MT16x16x128_MI16x16x1_SN_LDSB0_AFC1_AG0_AFEM1_AFEM1_ASEM32_CLR0_CADS0_DTLA0_DTLB0_DTVA0_DTVB0_EPS0_ELFLR0_EMLLn1_FDSI1_GRPM1_GRVWA32_GRVWB32_GSU1_GSUAMB_GSUC0_GSUWGMRR0_GLS0_ISA950_IU1_K1_LDSTI0_LBSPPA128_LBSPPB128_LBSPPM0_LPA64_LPB64_LPM0_LRVW32_LWPMn1_MIAV0_MIWT1_1_MO40_NTn1_NTA0_NTB0_NTC0_NTD0_NTM0_NEPBS0_NLCA1_NLCB1_ONLL0_PGR1_PLR1_PKA1_SIA3_SS1_SU32_SUM0_SUS256_SPO0_SRVW0_SSO0_SVW1_SK0_SKFTR0_SKXCCM0_SGRO0_TIN0_TLDS1_ULSGRO0_USL1_UIOFGRO0_USFGRO1_VSn1_VWA1_VWB1_WSGRA0_WSGRB0_WS64_WG16_4_1_WGM8_WGMXCC1_WGMXCCGn1
    SolutionIndex: 29
    SolutionNameMin: Cijk_Alik_Bljk___F_4_S_S___M_X_A_3_2___M_X_B_3_2___BH_Bias_S_HA_S_SAV_UserArgs_MT16x16x128_MI16x16x1_SN_LDSB0_AFC1_AG0_AFEM1_AFEM1_ASEM32_CLR0_CADS0_DTLA0_DTLB0_DTVA0_DTVB0_EPS0_ELFLR0_EMLLn1_FDSI1_GRPM1_GRVWA32_GRVWB32_GSU1_GSUAMB_GSUC0_GSUWGMRR0_GLS0_ISA950_IU1_K1_LDSTI0_LBSPPA128_LBSPPB128_LBSPPM0_LPA64_LPB64_LPM0_LRVW32_LWPMn1_MIAV0_MIWT1_1_MO40_NTn1_NTA0_NTB0_NTC0_NTD0_NTM0_NEPBS0_NLCA1_NLCB1_ONLL0_PGR2_PLR1_PKA1_SIA3_SS1_SU32_SUM0_SUS256_SPO0_SRVW0_SSO0_SVW1_SK0_SKFTR0_SKXCCM0_SGRO0_TIN0_TLDS1_ULSGRO0_USL1_UIOFGRO0_USFGRO1_VSn1_VWA1_VWB1_WSGRA0_WSGRB0_WS64_WG16_4_1_WGM8_WGMXCC1_WGMXCCGn1
    SolutionIndex: 30
    SolutionNameMin: Cijk_Alik_Bljk___F_4_S_S___M_X_A_3_2___M_X_B_3_2___BH_Bias_S_HA_S_SAV_UserArgs_MT16x16x128_MI16x16x1_SN_LDSB0_AFC1_AG0_AFEM1_AFEM1_ASEM32_CLR1_CADS0_DTLA0_DTLB0_DTVA0_DTVB0_EPS0_ELFLR0_EMLLn1_FDSI1_GRPM1_GRVWA32_GRVWB32_GSU1_GSUAMB_GSUC0_GSUWGMRR0_GLS0_ISA950_IU1_K1_LDSTI0_LBSPPA128_LBSPPB128_LBSPPM0_LPA64_LPB64_LPM0_LRVW32_LWPMn1_MIAV0_MIWT1_1_MO40_NTn1_NTA0_NTB0_NTC0_NTD0_NTM0_NEPBS0_NLCA1_NLCB1_ONLL0_PGR2_PLR0_PKA1_SIA3_SS1_SU32_SUM0_SUS256_SPO0_SRVW0_SSO0_SVW1_SK0_SKFTR0_SKXCCM0_SGRO0_TIN0_TLDS1_ULSGRO0_USL1_UIOFGRO0_USFGRO1_VSn1_VWA1_VWB1_WSGRA0_WSGRB0_WS64_WG16_4_1_WGM8_WGMXCC1_WGMXCCGn1
    SolutionIndex: 31
    SolutionNameMin: Cijk_Alik_Bljk___F_4_S_S___M_X_A_3_2___M_X_B_3_2___BH_Bias_S_HA_S_SAV_UserArgs_MT16x16x128_MI16x16x1_SN_LDSB0_AFC1_AG0_AFEM1_AFEM1_ASEM32_CLR0_CADS0_DTLA0_DTLB0_DTVA0_DTVB0_EPS1_ELFLR0_EMLLn1_FDSI1_GRPM1_GRVWA32_GRVWB32_GSU1_GSUAMB_GSUC0_GSUWGMRR0_GLS0_ISA950_IU1_K1_LDSTI0_LBSPPA128_LBSPPB128_LBSPPM0_LPA64_LPB64_LPM0_LRVW32_LWPMn1_MIAV0_MIWT1_1_MO40_NTn1_NTA0_NTB0_NTC0_NTD0_NTM0_NEPBS0_NLCA1_NLCB1_ONLL0_PGR1_PLR0_PKA1_SIA3_SS1_SU32_SUM0_SUS256_SPO0_SRVW0_SSO0_SVW1_SK0_SKFTR0_SKXCCM0_SGRO0_TIN0_TLDS1_ULSGRO0_USL1_UIOFGRO0_USFGRO1_VSn1_VWA1_VWB1_WSGRA0_WSGRB0_WS64_WG16_4_1_WGM8_WGMXCC1_WGMXCCGn1
    SolutionIndex: 32
    SolutionNameMin: Cijk_Alik_Bljk___F_4_S_S___M_X_A_3_2___M_X_B_3_2___BH_Bias_S_HA_S_SAV_UserArgs_MT16x16x128_MI16x16x1_SN_LDSB0_AFC1_AG0_AFEM1_AFEM1_ASEM32_CLR0_CADS0_DTLA0_DTLB0_DTVA0_DTVB0_EPS1_ELFLR0_EMLLn1_FDSI1_GRPM1_GRVWA32_GRVWB32_GSU1_GSUAMB_GSUC0_GSUWGMRR0_GLS0_ISA950_IU1_K1_LDSTI0_LBSPPA128_LBSPPB128_LBSPPM0_LPA64_LPB64_LPM0_LRVW32_LWPMn1_MIAV0_MIWT1_1_MO40_NTn1_NTA0_NTB0_NTC0_NTD0_NTM0_NEPBS0_NLCA1_NLCB1_ONLL0_PGR1_PLR1_PKA1_SIA3_SS1_SU32_SUM0_SUS256_SPO0_SRVW0_SSO0_SVW1_SK0_SKFTR0_SKXCCM0_SGRO0_TIN0_TLDS1_ULSGRO0_USL1_UIOFGRO0_USFGRO1_VSn1_VWA1_VWB1_WSGRA0_WSGRB0_WS64_WG16_4_1_WGM8_WGMXCC1_WGMXCCGn1
    SolutionIndex: 33
    SolutionNameMin: Cijk_Alik_Bljk___F_4_S_S___M_X_A_3_2___M_X_B_3_2___BH_Bias_S_HA_S_SAV_UserArgs_MT16x16x128_MI16x16x1_SN_LDSB0_AFC1_AG0_AFEM1_AFEM1_ASEM32_CLR1_CADS0_DTLA0_DTLB0_DTVA0_DTVB0_EPS1_ELFLR0_EMLLn1_FDSI1_GRPM1_GRVWA32_GRVWB32_GSU1_GSUAMB_GSUC0_GSUWGMRR0_GLS0_ISA950_IU1_K1_LDSTI0_LBSPPA128_LBSPPB128_LBSPPM0_LPA64_LPB64_LPM0_LRVW32_LWPMn1_MIAV0_MIWT1_1_MO40_NTn1_NTA0_NTB0_NTC0_NTD0_NTM0_NEPBS0_NLCA1_NLCB1_ONLL0_PGR1_PLR0_PKA1_SIA3_SS1_SU32_SUM0_SUS256_SPO0_SRVW0_SSO0_SVW1_SK0_SKFTR0_SKXCCM0_SGRO0_TIN0_TLDS1_ULSGRO0_USL1_UIOFGRO0_USFGRO1_VSn1_VWA1_VWB1_WSGRA0_WSGRB0_WS64_WG16_4_1_WGM8_WGMXCC1_WGMXCCGn1
    SolutionIndex: 34
    SolutionNameMin: Cijk_Alik_Bljk___F_4_S_S___M_X_A_3_2___M_X_B_3_2___BH_Bias_S_HA_S_SAV_UserArgs_MT16x16x128_MI16x16x1_SN_LDSB0_AFC1_AG0_AFEM1_AFEM1_ASEM32_CLR1_CADS0_DTLA0_DTLB0_DTVA0_DTVB0_EPS1_ELFLR0_EMLLn1_FDSI0_GRPM1_GRVWA32_GRVWB32_GSU1_GSUAMB_GSUC0_GSUWGMRR0_GLS0_ISA950_IU1_K1_LDSTI0_LBSPPA128_LBSPPB128_LBSPPM0_LPA64_LPB64_LPM0_LRVW32_LWPMn1_MIAV0_MIWT1_1_MO40_NTn1_NTA0_NTB0_NTC0_NTD0_NTM0_NEPBS0_NLCA1_NLCB1_ONLL0_PGR1_PLR0_PKA0_SIA3_SS1_SU32_SUM0_SUS256_SPO0_SRVW0_SSO0_SVW1_SK0_SKFTR0_SKXCCM0_SGRO0_TIN0_TLDS1_ULSGRO0_USL1_UIOFGRO0_USFGRO0_VSn1_VWA1_VWB1_WSGRA0_WSGRB0_WS64_WG16_4_1_WGM8_WGMXCC1_WGMXCCGn1
    SolutionIndex: 35
    SolutionNameMin: Cijk_Alik_Bljk___F_4_S_S___M_X_A_3_2___M_X_B_3_2___BH_Bias_S_HA_S_SAV_UserArgs_MT16x16x128_MI16x16x1_SN_LDSB0_AFC1_AG0_AFEM1_AFEM1_ASEM32_CLR0_CADS0_DTLA0_DTLB0_DTVA0_DTVB0_EPS0_ELFLR0_EMLLn1_FDSI0_GRPM1_GRVWA32_GRVWB32_GSU1_GSUAMB_GSUC0_GSUWGMRR0_GLS0_ISA950_IU1_K1_LDSTI0_LBSPPA128_LBSPPB128_LBSPPM0_LPA64_LPB64_LPM0_LRVW32_LWPMn1_MIAV0_MIWT1_1_MO40_NTn1_NTA0_NTB0_NTC0_NTD0_NTM0_NEPBS0_NLCA1_NLCB1_ONLL0_PGR2_PLR1_PKA0_SIA1_SS1_SU32_SUM0_SUS256_SPO0_SRVW0_SSO0_SVW1_SK0_SKFTR0_SKXCCM0_SGRO0_TIN0_TLDS1_ULSGRO0_USL1_UIOFGRO0_USFGRO1_VSn1_VWA1_VWB1_WSGRA0_WSGRB0_WS64_WG16_4_1_WGM8_WGMXCC1_WGMXCCGn1
    SolutionIndex: 36
    SolutionNameMin: Cijk_Alik_Bljk___F_4_S_S___M_X_A_3_2___M_X_B_3_2___BH_Bias_S_HA_S_SAV_UserArgs_MT16x16x128_MI16x16x1_SN_LDSB0_AFC1_AG0_AFEM1_AFEM1_ASEM32_CLR0_CADS0_DTLA0_DTLB0_DTVA0_DTVB0_EPS1_ELFLR0_EMLLn1_FDSI0_GRPM1_GRVWA32_GRVWB32_GSU1_GSUAMB_GSUC0_GSUWGMRR0_GLS0_ISA950_IU1_K1_LDSTI0_LBSPPA128_LBSPPB128_LBSPPM0_LPA64_LPB64_LPM0_LRVW32_LWPMn1_MIAV0_MIWT1_1_MO40_NTn1_NTA0_NTB0_NTC0_NTD0_NTM0_NEPBS0_NLCA1_NLCB1_ONLL0_PGR1_PLR0_PKA0_SIA3_SS1_SU32_SUM0_SUS256_SPO0_SRVW0_SSO0_SVW1_SK0_SKFTR0_SKXCCM0_SGRO0_TIN0_TLDS1_ULSGRO0_USL1_UIOFGRO0_USFGRO1_VSn1_VWA1_VWB1_WSGRA0_WSGRB0_WS64_WG16_4_1_WGM8_WGMXCC1_WGMXCCGn1
    SolutionIndex: 37
    SolutionNameMin: Cijk_Alik_Bljk___F_4_S_S___M_X_A_3_2___M_X_B_3_2___BH_Bias_S_HA_S_SAV_UserArgs_MT16x16x128_MI16x16x1_SN_LDSB0_AFC1_AG0_AFEM1_AFEM1_ASEM32_CLR0_CADS0_DTLA0_DTLB0_DTVA0_DTVB0_EPS0_ELFLR0_EMLLn1_FDSI0_GRPM1_GRVWA32_GRVWB32_GSU1_GSUAMB_GSUC0_GSUWGMRR0_GLS0_ISA950_IU1_K1_LDSTI0_LBSPPA128_LBSPPB128_LBSPPM0_LPA64_LPB64_LPM0_LRVW32_LWPMn1_MIAV0_MIWT1_1_MO40_NTn1_NTA0_NTB0_NTC0_NTD0_NTM0_NEPBS0_NLCA1_NLCB1_ONLL0_PGR1_PLR1_PKA1_SIA1_SS1_SU32_SUM0_SUS256_SPO0_SRVW0_SSO0_SVW1_SK0_SKFTR0_SKXCCM0_SGRO0_TIN0_TLDS1_ULSGRO0_USL1_UIOFGRO0_USFGRO0_VSn1_VWA1_VWB1_WSGRA0_WSGRB0_WS64_WG16_4_1_WGM8_WGMXCC1_WGMXCCGn1
    SolutionIndex: 38
    SolutionNameMin: Cijk_Alik_Bljk___F_4_S_S___M_X_A_3_2___M_X_B_3_2___BH_Bias_S_HA_S_SAV_UserArgs_MT16x16x128_MI16x16x1_SN_LDSB0_AFC1_AG0_AFEM1_AFEM1_ASEM32_CLR0_CADS0_DTLA0_DTLB0_DTVA0_DTVB0_EPS0_ELFLR0_EMLLn1_FDSI0_GRPM1_GRVWA32_GRVWB32_GSU1_GSUAMB_GSUC0_GSUWGMRR0_GLS0_ISA950_IU1_K1_LDSTI0_LBSPPA128_LBSPPB128_LBSPPM0_LPA64_LPB64_LPM0_LRVW32_LWPMn1_MIAV0_MIWT1_1_MO40_NTn1_NTA0_NTB0_NTC0_NTD0_NTM0_NEPBS0_NLCA1_NLCB1_ONLL0_PGR2_PLR1_PKA1_SIA1_SS1_SU32_SUM0_SUS256_SPO0_SRVW0_SSO0_SVW1_SK0_SKFTR0_SKXCCM0_SGRO0_TIN0_TLDS1_ULSGRO0_USL1_UIOFGRO0_USFGRO0_VSn1_VWA1_VWB1_WSGRA0_WSGRB0_WS64_WG16_4_1_WGM8_WGMXCC1_WGMXCCGn1
    SolutionIndex: 39
    SolutionNameMin: Cijk_Alik_Bljk___F_4_S_S___M_X_A_3_2___M_X_B_3_2___BH_Bias_S_HA_S_SAV_UserArgs_MT16x16x128_MI16x16x1_SN_LDSB0_AFC1_AG0_AFEM1_AFEM1_ASEM32_CLR1_CADS0_DTLA0_DTLB0_DTVA0_DTVB0_EPS0_ELFLR0_EMLLn1_FDSI0_GRPM1_GRVWA32_GRVWB32_GSU1_GSUAMB_GSUC0_GSUWGMRR0_GLS0_ISA950_IU1_K1_LDSTI0_LBSPPA128_LBSPPB128_LBSPPM0_LPA64_LPB64_LPM0_LRVW32_LWPMn1_MIAV0_MIWT1_1_MO40_NTn1_NTA0_NTB0_NTC0_NTD0_NTM0_NEPBS0_NLCA1_NLCB1_ONLL0_PGR2_PLR0_PKA1_SIA1_SS1_SU32_SUM0_SUS256_SPO0_SRVW0_SSO0_SVW1_SK0_SKFTR0_SKXCCM0_SGRO0_TIN0_TLDS1_ULSGRO0_USL1_UIOFGRO0_USFGRO0_VSn1_VWA1_VWB1_WSGRA0_WSGRB0_WS64_WG16_4_1_WGM8_WGMXCC1_WGMXCCGn1
    SolutionIndex: 40
    SolutionNameMin: Cijk_Alik_Bljk___F_4_S_S___M_X_A_3_2___M_X_B_3_2___BH_Bias_S_HA_S_SAV_UserArgs_MT16x16x128_MI16x16x1_SN_LDSB0_AFC1_AG0_AFEM1_AFEM1_ASEM32_CLR0_CADS0_DTLA0_DTLB0_DTVA0_DTVB0_EPS1_ELFLR0_EMLLn1_FDSI0_GRPM1_GRVWA32_GRVWB32_GSU1_GSUAMB_GSUC0_GSUWGMRR0_GLS0_ISA950_IU1_K1_LDSTI0_LBSPPA128_LBSPPB128_LBSPPM0_LPA64_LPB64_LPM0_LRVW32_LWPMn1_MIAV0_MIWT1_1_MO40_NTn1_NTA0_NTB0_NTC0_NTD0_NTM0_NEPBS0_NLCA1_NLCB1_ONLL0_PGR1_PLR0_PKA1_SIA1_SS1_SU32_SUM0_SUS256_SPO0_SRVW0_SSO0_SVW1_SK0_SKFTR0_SKXCCM0_SGRO0_TIN0_TLDS1_ULSGRO0_USL1_UIOFGRO0_USFGRO0_VSn1_VWA1_VWB1_WSGRA0_WSGRB0_WS64_WG16_4_1_WGM8_WGMXCC1_WGMXCCGn1
    SolutionIndex: 41
    SolutionNameMin: Cijk_Alik_Bljk___F_4_S_S___M_X_A_3_2___M_X_B_3_2___BH_Bias_S_HA_S_SAV_UserArgs_MT16x16x128_MI16x16x1_SN_LDSB0_AFC1_AG0_AFEM1_AFEM1_ASEM32_CLR0_CADS0_DTLA0_DTLB0_DTVA0_DTVB0_EPS1_ELFLR0_EMLLn1_FDSI0_GRPM1_GRVWA32_GRVWB32_GSU1_GSUAMB_GSUC0_GSUWGMRR0_GLS0_ISA950_IU1_K1_LDSTI0_LBSPPA128_LBSPPB128_LBSPPM0_LPA64_LPB64_LPM0_LRVW32_LWPMn1_MIAV0_MIWT1_1_MO40_NTn1_NTA0_NTB0_NTC0_NTD0_NTM0_NEPBS0_NLCA1_NLCB1_ONLL0_PGR1_PLR1_PKA1_SIA1_SS1_SU32_SUM0_SUS256_SPO0_SRVW0_SSO0_SVW1_SK0_SKFTR0_SKXCCM0_SGRO0_TIN0_TLDS1_ULSGRO0_USL1_UIOFGRO0_USFGRO0_VSn1_VWA1_VWB1_WSGRA0_WSGRB0_WS64_WG16_4_1_WGM8_WGMXCC1_WGMXCCGn1
    SolutionIndex: 42
    SolutionNameMin: Cijk_Alik_Bljk___F_4_S_S___M_X_A_3_2___M_X_B_3_2___BH_Bias_S_HA_S_SAV_UserArgs_MT16x16x128_MI16x16x1_SN_LDSB0_AFC1_AG0_AFEM1_AFEM1_ASEM32_CLR1_CADS0_DTLA0_DTLB0_DTVA0_DTVB0_EPS1_ELFLR0_EMLLn1_FDSI0_GRPM1_GRVWA32_GRVWB32_GSU1_GSUAMB_GSUC0_GSUWGMRR0_GLS0_ISA950_IU1_K1_LDSTI0_LBSPPA128_LBSPPB128_LBSPPM0_LPA64_LPB64_LPM0_LRVW32_LWPMn1_MIAV0_MIWT1_1_MO40_NTn1_NTA0_NTB0_NTC0_NTD0_NTM0_NEPBS0_NLCA1_NLCB1_ONLL0_PGR1_PLR0_PKA1_SIA1_SS1_SU32_SUM0_SUS256_SPO0_SRVW0_SSO0_SVW1_SK0_SKFTR0_SKXCCM0_SGRO0_TIN0_TLDS1_ULSGRO0_USL1_UIOFGRO0_USFGRO0_VSn1_VWA1_VWB1_WSGRA0_WSGRB0_WS64_WG16_4_1_WGM8_WGMXCC1_WGMXCCGn1
    SolutionIndex: 43
    SolutionNameMin: Cijk_Alik_Bljk___F_4_S_S___M_X_A_3_2___M_X_B_3_2___BH_Bias_S_HA_S_SAV_UserArgs_MT16x16x128_MI16x16x1_SN_LDSB0_AFC1_AG0_AFEM1_AFEM1_ASEM32_CLR0_CADS0_DTLA0_DTLB0_DTVA0_DTVB0_EPS0_ELFLR0_EMLLn1_FDSI0_GRPM1_GRVWA32_GRVWB32_GSU1_GSUAMB_GSUC0_GSUWGMRR0_GLS0_ISA950_IU1_K1_LDSTI0_LBSPPA128_LBSPPB128_LBSPPM0_LPA64_LPB64_LPM0_LRVW32_LWPMn1_MIAV0_MIWT1_1_MO40_NTn1_NTA0_NTB0_NTC0_NTD0_NTM0_NEPBS0_NLCA1_NLCB1_ONLL0_PGR2_PLR0_PKA1_SIA3_SS1_SU32_SUM0_SUS256_SPO0_SRVW0_SSO0_SVW1_SK0_SKFTR0_SKXCCM0_SGRO0_TIN0_TLDS1_ULSGRO0_USL1_UIOFGRO0_USFGRO0_VSn1_VWA1_VWB1_WSGRA0_WSGRB0_WS64_WG16_4_1_WGM8_WGMXCC1_WGMXCCGn1
    SolutionIndex: 44
    SolutionNameMin: Cijk_Alik_Bljk___F_4_S_S___M_X_A_3_2___M_X_B_3_2___BH_Bias_S_HA_S_SAV_UserArgs_MT16x16x128_MI16x16x1_SN_LDSB0_AFC1_AG0_AFEM1_AFEM1_ASEM32_CLR0_CADS0_DTLA0_DTLB0_DTVA0_DTVB0_EPS0_ELFLR0_EMLLn1_FDSI0_GRPM1_GRVWA32_GRVWB32_GSU1_GSUAMB_GSUC0_GSUWGMRR0_GLS0_ISA950_IU1_K1_LDSTI0_LBSPPA128_LBSPPB128_LBSPPM0_LPA64_LPB64_LPM0_LRVW32_LWPMn1_MIAV0_MIWT1_1_MO40_NTn1_NTA0_NTB0_NTC0_NTD0_NTM0_NEPBS0_NLCA1_NLCB1_ONLL0_PGR1_PLR1_PKA1_SIA3_SS1_SU32_SUM0_SUS256_SPO0_SRVW0_SSO0_SVW1_SK0_SKFTR0_SKXCCM0_SGRO0_TIN0_TLDS1_ULSGRO0_USL1_UIOFGRO0_USFGRO0_VSn1_VWA1_VWB1_WSGRA0_WSGRB0_WS64_WG16_4_1_WGM8_WGMXCC1_WGMXCCGn1
    SolutionIndex: 45
    SolutionNameMin: Cijk_Alik_Bljk___F_4_S_S___M_X_A_3_2___M_X_B_3_2___BH_Bias_S_HA_S_SAV_UserArgs_MT16x16x128_MI16x16x1_SN_LDSB0_AFC1_AG0_AFEM1_AFEM1_ASEM32_CLR1_CADS0_DTLA0_DTLB0_DTVA0_DTVB0_EPS0_ELFLR0_EMLLn1_FDSI0_GRPM1_GRVWA32_GRVWB32_GSU1_GSUAMB_GSUC0_GSUWGMRR0_GLS0_ISA950_IU1_K1_LDSTI0_LBSPPA128_LBSPPB128_LBSPPM0_LPA64_LPB64_LPM0_LRVW32_LWPMn1_MIAV0_MIWT1_1_MO40_NTn1_NTA0_NTB0_NTC0_NTD0_NTM0_NEPBS0_NLCA1_NLCB1_ONLL0_PGR2_PLR0_PKA1_SIA3_SS1_SU32_SUM0_SUS256_SPO0_SRVW0_SSO0_SVW1_SK0_SKFTR0_SKXCCM0_SGRO0_TIN0_TLDS1_ULSGRO0_USL1_UIOFGRO0_USFGRO0_VSn1_VWA1_VWB1_WSGRA0_WSGRB0_WS64_WG16_4_1_WGM8_WGMXCC1_WGMXCCGn1
    SolutionIndex: 46
    SolutionNameMin: Cijk_Alik_Bljk___F_4_S_S___M_X_A_3_2___M_X_B_3_2___BH_Bias_S_HA_S_SAV_UserArgs_MT16x16x128_MI16x16x1_SN_LDSB0_AFC1_AG0_AFEM1_AFEM1_ASEM32_CLR0_CADS0_DTLA0_DTLB0_DTVA0_DTVB0_EPS1_ELFLR0_EMLLn1_FDSI0_GRPM1_GRVWA32_GRVWB32_GSU1_GSUAMB_GSUC0_GSUWGMRR0_GLS0_ISA950_IU1_K1_LDSTI0_LBSPPA128_LBSPPB128_LBSPPM0_LPA64_LPB64_LPM0_LRVW32_LWPMn1_MIAV0_MIWT1_1_MO40_NTn1_NTA0_NTB0_NTC0_NTD0_NTM0_NEPBS0_NLCA1_NLCB1_ONLL0_PGR1_PLR0_PKA1_SIA3_SS1_SU32_SUM0_SUS256_SPO0_SRVW0_SSO0_SVW1_SK0_SKFTR0_SKXCCM0_SGRO0_TIN0_TLDS1_ULSGRO0_USL1_UIOFGRO0_USFGRO0_VSn1_VWA1_VWB1_WSGRA0_WSGRB0_WS64_WG16_4_1_WGM8_WGMXCC1_WGMXCCGn1
    SolutionIndex: 47
    SolutionNameMin: Cijk_Alik_Bljk___F_4_S_S___M_X_A_3_2___M_X_B_3_2___BH_Bias_S_HA_S_SAV_UserArgs_MT16x16x128_MI16x16x1_SN_LDSB0_AFC1_AG0_AFEM1_AFEM1_ASEM32_CLR0_CADS0_DTLA0_DTLB0_DTVA0_DTVB0_EPS1_ELFLR0_EMLLn1_FDSI0_GRPM1_GRVWA32_GRVWB32_GSU1_GSUAMB_GSUC0_GSUWGMRR0_GLS0_ISA950_IU1_K1_LDSTI0_LBSPPA128_LBSPPB128_LBSPPM0_LPA64_LPB64_LPM0_LRVW32_LWPMn1_MIAV0_MIWT1_1_MO40_NTn1_NTA0_NTB0_NTC0_NTD0_NTM0_NEPBS0_NLCA1_NLCB1_ONLL0_PGR1_PLR1_PKA1_SIA3_SS1_SU32_SUM0_SUS256_SPO0_SRVW0_SSO0_SVW1_SK0_SKFTR0_SKXCCM0_SGRO0_TIN0_TLDS1_ULSGRO0_USL1_UIOFGRO0_USFGRO0_VSn1_VWA1_VWB1_WSGRA0_WSGRB0_WS64_WG16_4_1_WGM8_WGMXCC1_WGMXCCGn1
    SolutionIndex: 48
    SolutionNameMin: Cijk_Alik_Bljk___F_4_S_S___M_X_A_3_2___M_X_B_3_2___BH_Bias_S_HA_S_SAV_UserArgs_MT16x16x128_MI16x16x1_SN_LDSB0_AFC1_AG0_AFEM1_AFEM1_ASEM32_CLR1_CADS0_DTLA0_DTLB0_DTVA0_DTVB0_EPS1_ELFLR0_EMLLn1_FDSI0_GRPM1_GRVWA32_GRVWB32_GSU1_GSUAMB_GSUC0_GSUWGMRR0_GLS0_ISA950_IU1_K1_LDSTI0_LBSPPA128_LBSPPB128_LBSPPM0_LPA64_LPB64_LPM0_LRVW32_LWPMn1_MIAV0_MIWT1_1_MO40_NTn1_NTA0_NTB0_NTC0_NTD0_NTM0_NEPBS0_NLCA1_NLCB1_ONLL0_PGR1_PLR0_PKA1_SIA3_SS1_SU32_SUM0_SUS256_SPO0_SRVW0_SSO0_SVW1_SK0_SKFTR0_SKXCCM0_SGRO0_TIN0_TLDS1_ULSGRO0_USL1_UIOFGRO0_USFGRO0_VSn1_VWA1_VWB1_WSGRA0_WSGRB0_WS64_WG16_4_1_WGM8_WGMXCC1_WGMXCCGn1
    SolutionIndex: 49
    SolutionNameMin: Cijk_Alik_Bljk___F_4_S_S___M_X_A_3_2___M_X_B_3_2___BH_Bias_S_HA_S_SAV_UserArgs_MT16x16x128_MI16x16x1_SN_LDSB0_AFC1_AG0_AFEM1_AFEM1_ASEM32_CLR0_CADS0_DTLA0_DTLB0_DTVA0_DTVB0_EPS0_ELFLR0_EMLLn1_FDSI0_GRPM1_GRVWA32_GRVWB32_GSU1_GSUAMB_GSUC0_GSUWGMRR0_GLS0_ISA950_IU1_K1_LDSTI0_LBSPPA128_LBSPPB128_LBSPPM0_LPA64_LPB64_LPM0_LRVW32_LWPMn1_MIAV0_MIWT1_1_MO40_NTn1_NTA0_NTB0_NTC0_NTD0_NTM0_NEPBS0_NLCA1_NLCB1_ONLL0_PGR2_PLR0_PKA1_SIA1_SS1_SU32_SUM0_SUS256_SPO0_SRVW0_SSO0_SVW1_SK0_SKFTR0_SKXCCM0_SGRO0_TIN0_TLDS1_ULSGRO0_USL1_UIOFGRO0_USFGRO1_VSn1_VWA1_VWB1_WSGRA0_WSGRB0_WS64_WG16_4_1_WGM8_WGMXCC1_WGMXCCGn1
    SolutionIndex: 50
    SolutionNameMin: Cijk_Alik_Bljk___F_4_S_S___M_X_A_3_2___M_X_B_3_2___BH_Bias_S_HA_S_SAV_UserArgs_MT16x16x128_MI16x16x1_SN_LDSB0_AFC1_AG0_AFEM1_AFEM1_ASEM32_CLR0_CADS0_DTLA0_DTLB0_DTVA0_DTVB0_EPS0_ELFLR0_EMLLn1_FDSI0_GRPM1_GRVWA32_GRVWB32_GSU1_GSUAMB_GSUC0_GSUWGMRR0_GLS0_ISA950_IU1_K1_LDSTI0_LBSPPA128_LBSPPB128_LBSPPM0_LPA64_LPB64_LPM0_LRVW32_LWPMn1_MIAV0_MIWT1_1_MO40_NTn1_NTA0_NTB0_NTC0_NTD0_NTM0_NEPBS0_NLCA1_NLCB1_ONLL0_PGR2_PLR1_PKA1_SIA1_SS1_SU32_SUM0_SUS256_SPO0_SRVW0_SSO0_SVW1_SK0_SKFTR0_SKXCCM0_SGRO0_TIN0_TLDS1_ULSGRO0_USL1_UIOFGRO0_USFGRO1_VSn1_VWA1_VWB1_WSGRA0_WSGRB0_WS64_WG16_4_1_WGM8_WGMXCC1_WGMXCCGn1
    SolutionIndex: 51
    SolutionNameMin: Cijk_Alik_Bljk___F_4_S_S___M_X_A_3_2___M_X_B_3_2___BH_Bias_S_HA_S_SAV_UserArgs_MT16x16x128_MI16x16x1_SN_LDSB0_AFC1_AG0_AFEM1_AFEM1_ASEM32_CLR1_CADS0_DTLA0_DTLB0_DTVA0_DTVB0_EPS0_ELFLR0_EMLLn1_FDSI0_GRPM1_GRVWA32_GRVWB32_GSU1_GSUAMB_GSUC0_GSUWGMRR0_GLS0_ISA950_IU1_K1_LDSTI0_LBSPPA128_LBSPPB128_LBSPPM0_LPA64_LPB64_LPM0_LRVW32_LWPMn1_MIAV0_MIWT1_1_MO40_NTn1_NTA0_NTB0_NTC0_NTD0_NTM0_NEPBS0_NLCA1_NLCB1_ONLL0_PGR1_PLR0_PKA1_SIA1_SS1_SU32_SUM0_SUS256_SPO0_SRVW0_SSO0_SVW1_SK0_SKFTR0_SKXCCM0_SGRO0_TIN0_TLDS1_ULSGRO0_USL1_UIOFGRO0_USFGRO1_VSn1_VWA1_VWB1_WSGRA0_WSGRB0_WS64_WG16_4_1_WGM8_WGMXCC1_WGMXCCGn1
    SolutionIndex: 52
    SolutionNameMin: Cijk_Alik_Bljk___F_4_S_S___M_X_A_3_2___M_X_B_3_2___BH_Bias_S_HA_S_SAV_UserArgs_MT16x16x128_MI16x16x1_SN_LDSB0_AFC1_AG0_AFEM1_AFEM1_ASEM32_CLR1_CADS0_DTLA0_DTLB0_DTVA0_DTVB0_EPS0_ELFLR0_EMLLn1_FDSI0_GRPM1_GRVWA32_GRVWB32_GSU1_GSUAMB_GSUC0_GSUWGMRR0_GLS0_ISA950_IU1_K1_LDSTI0_LBSPPA128_LBSPPB128_LBSPPM0_LPA64_LPB64_LPM0_LRVW32_LWPMn1_MIAV0_MIWT1_1_MO40_NTn1_NTA0_NTB0_NTC0_NTD0_NTM0_NEPBS0_NLCA1_NLCB1_ONLL0_PGR2_PLR0_PKA1_SIA1_SS1_SU32_SUM0_SUS256_SPO0_SRVW0_SSO0_SVW1_SK0_SKFTR0_SKXCCM0_SGRO0_TIN0_TLDS1_ULSGRO0_USL1_UIOFGRO0_USFGRO1_VSn1_VWA1_VWB1_WSGRA0_WSGRB0_WS64_WG16_4_1_WGM8_WGMXCC1_WGMXCCGn1
    SolutionIndex: 53
    SolutionNameMin: Cijk_Alik_Bljk___F_4_S_S___M_X_A_3_2___M_X_B_3_2___BH_Bias_S_HA_S_SAV_UserArgs_MT16x16x128_MI16x16x1_SN_LDSB0_AFC1_AG0_AFEM1_AFEM1_ASEM32_CLR0_CADS0_DTLA0_DTLB0_DTVA0_DTVB0_EPS1_ELFLR0_EMLLn1_FDSI0_GRPM1_GRVWA32_GRVWB32_GSU1_GSUAMB_GSUC0_GSUWGMRR0_GLS0_ISA950_IU1_K1_LDSTI0_LBSPPA128_LBSPPB128_LBSPPM0_LPA64_LPB64_LPM0_LRVW32_LWPMn1_MIAV0_MIWT1_1_MO40_NTn1_NTA0_NTB0_NTC0_NTD0_NTM0_NEPBS0_NLCA1_NLCB1_ONLL0_PGR1_PLR0_PKA1_SIA1_SS1_SU32_SUM0_SUS256_SPO0_SRVW0_SSO0_SVW1_SK0_SKFTR0_SKXCCM0_SGRO0_TIN0_TLDS1_ULSGRO0_USL1_UIOFGRO0_USFGRO1_VSn1_VWA1_VWB1_WSGRA0_WSGRB0_WS64_WG16_4_1_WGM8_WGMXCC1_WGMXCCGn1
    SolutionIndex: 54
    SolutionNameMin: Cijk_Alik_Bljk___F_4_S_S___M_X_A_3_2___M_X_B_3_2___BH_Bias_S_HA_S_SAV_UserArgs_MT16x16x128_MI16x16x1_SN_LDSB0_AFC1_AG0_AFEM1_AFEM1_ASEM32_CLR0_CADS0_DTLA0_DTLB0_DTVA0_DTVB0_EPS1_ELFLR0_EMLLn1_FDSI0_GRPM1_GRVWA32_GRVWB32_GSU1_GSUAMB_GSUC0_GSUWGMRR0_GLS0_ISA950_IU1_K1_LDSTI0_LBSPPA128_LBSPPB128_LBSPPM0_LPA64_LPB64_LPM0_LRVW32_LWPMn1_MIAV0_MIWT1_1_MO40_NTn1_NTA0_NTB0_NTC0_NTD0_NTM0_NEPBS0_NLCA1_NLCB1_ONLL0_PGR1_PLR1_PKA1_SIA1_SS1_SU32_SUM0_SUS256_SPO0_SRVW0_SSO0_SVW1_SK0_SKFTR0_SKXCCM0_SGRO0_TIN0_TLDS1_ULSGRO0_USL1_UIOFGRO0_USFGRO1_VSn1_VWA1_VWB1_WSGRA0_WSGRB0_WS64_WG16_4_1_WGM8_WGMXCC1_WGMXCCGn1
    SolutionIndex: 55
    SolutionNameMin: Cijk_Alik_Bljk___F_4_S_S___M_X_A_3_2___M_X_B_3_2___BH_Bias_S_HA_S_SAV_UserArgs_MT16x16x128_MI16x16x1_SN_LDSB0_AFC1_AG0_AFEM1_AFEM1_ASEM32_CLR1_CADS0_DTLA0_DTLB0_DTVA0_DTVB0_EPS1_ELFLR0_EMLLn1_FDSI0_GRPM1_GRVWA32_GRVWB32_GSU1_GSUAMB_GSUC0_GSUWGMRR0_GLS0_ISA950_IU1_K1_LDSTI0_LBSPPA128_LBSPPB128_LBSPPM0_LPA64_LPB64_LPM0_LRVW32_LWPMn1_MIAV0_MIWT1_1_MO40_NTn1_NTA0_NTB0_NTC0_NTD0_NTM0_NEPBS0_NLCA1_NLCB1_ONLL0_PGR1_PLR0_PKA1_SIA1_SS1_SU32_SUM0_SUS256_SPO0_SRVW0_SSO0_SVW1_SK0_SKFTR0_SKXCCM0_SGRO0_TIN0_TLDS1_ULSGRO0_USL1_UIOFGRO0_USFGRO1_VSn1_VWA1_VWB1_WSGRA0_WSGRB0_WS64_WG16_4_1_WGM8_WGMXCC1_WGMXCCGn1
    SolutionIndex: 56
    SolutionNameMin: Cijk_Alik_Bljk___F_4_S_S___M_X_A_3_2___M_X_B_3_2___BH_Bias_S_HA_S_SAV_UserArgs_MT16x16x128_MI16x16x1_SN_LDSB1_AFC1_AG0_AFEM1_AFEM1_ASEM32_CLR1_CADS0_DTLA0_DTLB0_DTVA0_DTVB0_EPS0_ELFLR0_EMLLn1_FDSI0_GRPM1_GRVWA32_GRVWB32_GSU1_GSUAMB_GSUC0_GSUWGMRR0_GLS0_ISA950_IU1_K1_LDSTI0_LBSPPA128_LBSPPB128_LBSPPM0_LPA64_LPB64_LPM0_LRVW32_LWPMn1_MIAV0_MIWT1_1_MO40_NTn1_NTA0_NTB0_NTC0_NTD0_NTM0_NEPBS0_NLCA1_NLCB1_ONLL0_PGR2_PLR1_PKA1_SIA2_SS1_SU32_SUM0_SUS256_SPO0_SRVW0_SSO0_SVW1_SK0_SKFTR0_SKXCCM0_SGRO0_TIN0_TLDS1_ULSGRO0_USL1_UIOFGRO0_USFGRO1_VSn1_VWA1_VWB1_WSGRA0_WSGRB0_WS64_WG16_4_1_WGM8_WGMXCC1_WGMXCCGn1
    SolutionIndex: 57
    SolutionNameMin: Cijk_Alik_Bljk___F_4_S_S___M_X_A_3_2___M_X_B_3_2___BH_Bias_S_HA_S_SAV_UserArgs_MT16x16x128_MI16x16x1_SN_LDSB0_AFC1_AG0_AFEM1_AFEM1_ASEM32_CLR0_CADS0_DTLA0_DTLB0_DTVA0_DTVB0_EPS0_ELFLR0_EMLLn1_FDSI0_GRPM1_GRVWA32_GRVWB32_GSU1_GSUAMB_GSUC0_GSUWGMRR0_GLS0_ISA950_IU1_K1_LDSTI0_LBSPPA128_LBSPPB128_LBSPPM0_LPA64_LPB64_LPM0_LRVW32_LWPMn1_MIAV0_MIWT1_1_MO40_NTn1_NTA0_NTB0_NTC0_NTD0_NTM0_NEPBS0_NLCA1_NLCB1_ONLL0_PGR2_PLR1_PKA1_SIA3_SS1_SU32_SUM0_SUS256_SPO0_SRVW0_SSO0_SVW1_SK0_SKFTR0_SKXCCM0_SGRO0_TIN0_TLDS1_ULSGRO0_USL1_UIOFGRO0_USFGRO1_VSn1_VWA1_VWB1_WSGRA0_WSGRB0_WS64_WG16_4_1_WGM8_WGMXCC1_WGMXCCGn1
    SolutionIndex: 58
    SolutionNameMin: Cijk_Alik_Bljk___F_4_S_S___M_X_A_3_2___M_X_B_3_2___BH_Bias_S_HA_S_SAV_UserArgs_MT16x16x128_MI16x16x1_SN_LDSB0_AFC1_AG0_AFEM1_AFEM1_ASEM32_CLR0_CADS0_DTLA0_DTLB0_DTVA0_DTVB0_EPS1_ELFLR0_EMLLn1_FDSI0_GRPM1_GRVWA32_GRVWB32_GSU1_GSUAMB_GSUC0_GSUWGMRR0_GLS0_ISA950_IU1_K1_LDSTI0_LBSPPA128_LBSPPB128_LBSPPM0_LPA64_LPB64_LPM0_LRVW32_LWPMn1_MIAV0_MIWT1_1_MO40_NTn1_NTA0_NTB0_NTC0_NTD0_NTM0_NEPBS0_NLCA1_NLCB1_ONLL0_PGR1_PLR0_PKA1_SIA3_SS1_SU32_SUM0_SUS256_SPO0_SRVW0_SSO0_SVW1_SK0_SKFTR0_SKXCCM0_SGRO0_TIN0_TLDS1_ULSGRO0_USL1_UIOFGRO0_USFGRO1_VSn1_VWA1_VWB1_WSGRA0_WSGRB0_WS64_WG16_4_1_WGM8_WGMXCC1_WGMXCCGn1
    SolutionIndex: 59
    SolutionNameMin: Cijk_Alik_Bljk___F_4_S_S___M_X_A_3_2___M_X_B_3_2___BH_Bias_S_HA_S_SAV_UserArgs_MT16x16x128_MI16x16x1_SN_LDSB0_AFC1_AG0_AFEM1_AFEM1_ASEM32_CLR0_CADS0_DTLA0_DTLB0_DTVA0_DTVB0_EPS1_ELFLR0_EMLLn1_FDSI0_GRPM1_GRVWA32_GRVWB32_GSU1_GSUAMB_GSUC0_GSUWGMRR0_GLS0_ISA950_IU1_K1_LDSTI0_LBSPPA128_LBSPPB128_LBSPPM0_LPA64_LPB64_LPM0_LRVW32_LWPMn1_MIAV0_MIWT1_1_MO40_NTn1_NTA0_NTB0_NTC0_NTD0_NTM0_NEPBS0_NLCA1_NLCB1_ONLL0_PGR1_PLR1_PKA1_SIA3_SS1_SU32_SUM0_SUS256_SPO0_SRVW0_SSO0_SVW1_SK0_SKFTR0_SKXCCM0_SGRO0_TIN0_TLDS1_ULSGRO0_USL1_UIOFGRO0_USFGRO1_VSn1_VWA1_VWB1_WSGRA0_WSGRB0_WS64_WG16_4_1_WGM8_WGMXCC1_WGMXCCGn1
    SolutionIndex: 60
    SolutionNameMin: Cijk_Alik_Bljk___F_4_S_S___M_X_A_3_2___M_X_B_3_2___BH_Bias_S_HA_S_SAV_UserArgs_MT16x16x128_MI16x16x1_SN_LDSB0_AFC1_AG0_AFEM1_AFEM1_ASEM32_CLR1_CADS0_DTLA0_DTLB0_DTVA0_DTVB0_EPS1_ELFLR0_EMLLn1_FDSI0_GRPM1_GRVWA32_GRVWB32_GSU1_GSUAMB_GSUC0_GSUWGMRR0_GLS0_ISA950_IU1_K1_LDSTI0_LBSPPA128_LBSPPB128_LBSPPM0_LPA64_LPB64_LPM0_LRVW32_LWPMn1_MIAV0_MIWT1_1_MO40_NTn1_NTA0_NTB0_NTC0_NTD0_NTM0_NEPBS0_NLCA1_NLCB1_ONLL0_PGR1_PLR0_PKA1_SIA3_SS1_SU32_SUM0_SUS256_SPO0_SRVW0_SSO0_SVW1_SK0_SKFTR0_SKXCCM0_SGRO0_TIN0_TLDS1_ULSGRO0_USL1_UIOFGRO0_USFGRO1_VSn1_VWA1_VWB1_WSGRA0_WSGRB0_WS64_WG16_4_1_WGM8_WGMXCC1_WGMXCCGn1
- - - [128, 128, 1, 1024, 128, 128, 1024, 1024]
    - [43, 4.26]
  - - [128, 128, 1, 1152, 128, 128, 1152, 1152]
    - [42, 4.64]
  - - [128, 128, 1, 1280, 128, 128, 1280, 1280]
    - [12, 5.04]
  - - [129, 128, 1, 1024, 129, 129, 1024, 1024]
    - [30, 4.27]
  - - [130, 128, 1, 1024, 130, 130, 1024, 1024]
    - [55, 4.3]
  - - [131, 128, 1, 1024, 131, 131, 1024, 1024]
    - [49, 4.34]
  - - [132, 128, 1, 1024, 132, 132, 1024, 1024]
    - [21, 4.37]
  - - [133, 128, 1, 1024, 133, 133, 1024, 1024]
    - [21, 4.35]
  - - [134, 128, 1, 1024, 134, 134, 1024, 1024]
    - [54, 4.41]
  - - [135, 128, 1, 1024, 135, 135, 1024, 1024]
    - [47, 4.49]
  - - [136, 128, 1, 1024, 136, 136, 1024, 1024]
    - [47, 4.45]
  - - [137, 128, 1, 1024, 137, 137, 1024, 1024]
    - [21, 4.53]
  - - [138, 128, 1, 1024, 138, 138, 1024, 1024]
    - [5, 4.52]
  - - [139, 128, 1, 1024, 139, 139, 1024, 1024]
    - [55, 4.6]
  - - [140, 128, 1, 1024, 140, 140, 1024, 1024]
    - [53, 4.63]
  - - [141, 128, 1, 1024, 141, 141, 1024, 1024]
    - [21, 4.64]
  - - [142, 128, 1, 1024, 142, 142, 1024, 1024]
    - [48, 4.65]
  - - [143, 128, 1, 1024, 143, 143, 1024, 1024]
    - [47, 4.68]
  - - [144, 128, 1, 1024, 144, 144, 1024, 1024]
    - [42, 4.82]
  - - [145, 128, 1, 1024, 145, 145, 1024, 1024]
    - [42, 4.88]
  - - [146, 128, 1, 1024, 146, 146, 1024, 1024]
    - [49, 4.89]
  - - [147, 128, 1, 1024, 147, 147, 1024, 1024]
    - [49, 4.84]
  - - [148, 128, 1, 1024, 148, 148, 1024, 1024]
    - [47, 4.9]
  - - [149, 128, 1, 1024, 149, 149, 1024, 1024]
    - [54, 4.96]
  - - [150, 128, 1, 1024, 150, 150, 1024, 1024]
    - [21, 4.94]
  - - [151, 128, 1, 1024, 151, 151, 1024, 1024]
    - [47, 5.0]
  - - [152, 128, 1, 1024, 152, 152, 1024, 1024]
    - [45, 5.0]
  - - [153, 128, 1, 1024, 153, 153, 1024, 1024]
    - [20, 5.04]
  - - [154, 128, 1, 1024, 154, 154, 1024, 1024]
    - [49, 5.1]
  - - [155, 128, 1, 1024, 155, 155, 1024, 1024]
    - [0, 5.1]
  - - [156, 128, 1, 1024, 156, 156, 1024, 1024]
    - [42, 5.16]
  - - [157, 128, 1, 1024, 157, 157, 1024, 1024]
    - [54, 5.2]
  - - [158, 128, 1, 1024, 158, 158, 1024, 1024]
    - [42, 5.23]
  - - [159, 128, 1, 1024, 159, 159, 1024, 1024]
    - [54, 5.26]
  - - [160, 128, 1, 1024, 160, 160, 1024, 1024]
    - [54, 5.36]
  - - [161, 128, 1, 1024, 161, 161, 1024, 1024]
    - [42, 5.39]
  - - [162, 128, 1, 1024, 162, 162, 1024, 1024]
    - [47, 5.33]
  - - [163, 128, 1, 1024, 163, 163, 1024, 1024]
    - [21, 5.4]
  - - [164, 128, 1, 1024, 164, 164, 1024, 1024]
    - [21, 5.46]
  - - [165, 128, 1, 1024, 165, 165, 1024, 1024]
    - [2, 5.46]
  - - [166, 128, 1, 1024, 166, 166, 1024, 1024]
    - [21, 5.49]
  - - [167, 128, 1, 1024, 167, 167, 1024, 1024]
    - [42, 5.53]
  - - [168, 128, 1, 1024, 168, 168, 1024, 1024]
    - [2, 5.56]
  - - [169, 128, 1, 1024, 169, 169, 1024, 1024]
    - [54, 5.62]
  - - [170, 128, 1, 1024, 170, 170, 1024, 1024]
    - [21, 5.63]
  - - [171, 128, 1, 1024, 171, 171, 1024, 1024]
    - [42, 5.72]
  - - [172, 128, 1, 1024, 172, 172, 1024, 1024]
    - [42, 5.72]
  - - [173, 128, 1, 1024, 173, 173, 1024, 1024]
    - [53, 5.73]
  - - [174, 128, 1, 1024, 174, 174, 1024, 1024]
    - [37, 5.7]
  - - [175, 128, 1, 1024, 175, 175, 1024, 1024]
    - [49, 5.76]
  - - [176, 128, 1, 1024, 176, 176, 1024, 1024]
    - [31, 5.83]
  - - [177, 128, 1, 1024, 177, 177, 1024, 1024]
    - [42, 5.89]
  - - [178, 128, 1, 1024, 178, 178, 1024, 1024]
    - [0, 5.86]
  - - [179, 128, 1, 1024, 179, 179, 1024, 1024]
    - [54, 5.89]
  - - [180, 128, 1, 1024, 180, 180, 1024, 1024]
    - [54, 5.92]
  - - [181, 128, 1, 1024, 181, 181, 1024, 1024]
    - [54, 5.99]
  - - [182, 128, 1, 1024, 182, 182, 1024, 1024]
    - [42, 6.02]
  - - [183, 128, 1, 1024, 183, 183, 1024, 1024]
    - [33, 6.02]
  - - [184, 128, 1, 1024, 184, 184, 1024, 1024]
    - [21, 6.06]
  - - [185, 128, 1, 1024, 185, 185, 1024, 1024]
    - [21, 6.16]
  - - [186, 128, 1, 1024, 186, 186, 1024, 1024]
    - [6, 6.16]
  - - [187, 128, 1, 1024, 187, 187, 1024, 1024]
    - [49, 6.16]
  - - [188, 128, 1, 1024, 188, 188, 1024, 1024]
    - [42, 6.26]
  - - [189, 128, 1, 1024, 189, 189, 1024, 1024]
    - [2, 6.22]
  - - [190, 128, 1, 1024, 190, 190, 1024, 1024]
    - [42, 6.36]
  - - [191, 128, 1, 1024, 191, 191, 1024, 1024]
    - [2, 6.29]
  - - [192, 128, 1, 1024, 192, 192, 1024, 1024]
    - [46, 6.39]
  - - [193, 128, 1, 1024, 193, 193, 1024, 1024]
    - [42, 6.42]
  - - [194, 128, 1, 1024, 194, 194, 1024, 1024]
    - [57, 6.42]
  - - [195, 128, 1, 1024, 195, 195, 1024, 1024]
    - [42, 6.49]
  - - [196, 128, 1, 1024, 196, 196, 1024, 1024]
    - [54, 6.49]
  - - [197, 128, 1, 1024, 197, 197, 1024, 1024]
    - [50, 6.56]
  - - [198, 128, 1, 1024, 198, 198, 1024, 1024]
    - [53, 6.52]
  - - [199, 128, 1, 1024, 199, 199, 1024, 1024]
    - [42, 6.59]
  - - [200, 128, 1, 1024, 200, 200, 1024, 1024]
    - [33, 6.58]
  - - [201, 128, 1, 1024, 201, 201, 1024, 1024]
    - [21, 6.62]
  - - [202, 128, 1, 1024, 202, 202, 1024, 1024]
    - [42, 6.72]
  - - [203, 128, 1, 1024, 203, 203, 1024, 1024]
    - [54, 6.72]
  - - [204, 128, 1, 1024, 204, 204, 1024, 1024]
    - [42, 6.71]
  - - [205, 128, 1, 1024, 205, 205, 1024, 1024]
    - [39, 6.75]
  - - [206, 128, 1, 1024, 206, 206, 1024, 1024]
    - [55, 6.82]
  - - [207, 128, 1, 1024, 207, 207, 1024, 1024]
    - [4, 6.85]
  - - [208, 128, 1, 1024, 208, 208, 1024, 1024]
    - [42, 6.96]
  - - [209, 128, 1, 1024, 209, 209, 1024, 1024]
    - [21, 6.88]
  - - [210, 128, 1, 1024, 210, 210, 1024, 1024]
    - [21, 6.95]
  - - [211, 128, 1, 1024, 211, 211, 1024, 1024]
    - [20, 6.91]
  - - [212, 128, 1, 1024, 212, 212, 1024, 1024]
    - [54, 7.02]
  - - [213, 128, 1, 1024, 213, 213, 1024, 1024]
    - [49, 7.05]
  - - [214, 128, 1, 1024, 214, 214, 1024, 1024]
    - [48, 7.08]
  - - [215, 128, 1, 1024, 215, 215, 1024, 1024]
    - [6, 7.08]
  - - [216, 128, 1, 1024, 216, 216, 1024, 1024]
    - [39, 7.11]
  - - [217, 128, 1, 1024, 217, 217, 1024, 1024]
    - [54, 7.22]
  - - [218, 128, 1, 1024, 218, 218, 1024, 1024]
    - [42, 7.18]
  - - [219, 128, 1, 1024, 219, 219, 1024, 1024]
    - [54, 7.33]
  - - [220, 128, 1, 1024, 220, 220, 1024, 1024]
    - [4, 7.2]
  - - [221, 128, 1, 1024, 221, 221, 1024, 1024]
    - [54, 7.4]
  - - [222, 128, 1, 1024, 222, 222, 1024, 1024]
    - [4, 7.31]
  - - [223, 128, 1, 1024, 223, 223, 1024, 1024]
    - [37, 7.42]
  - - [224, 128, 1, 1024, 224, 224, 1024, 1024]
    - [42, 7.46]
  - - [225, 128, 1, 1024, 225, 225, 1024, 1024]
    - [54, 7.45]
  - - [226, 128, 1, 1024, 226, 226, 1024, 1024]
    - [21, 7.44]
  - - [227, 128, 1, 1024, 227, 227, 1024, 1024]
    - [54, 7.51]
  - - [228, 128, 1, 1024, 228, 228, 1024, 1024]
    - [57, 7.59]
  - - [229, 128, 1, 1024, 229, 229, 1024, 1024]
    - [47, 7.62]
  - - [230, 128, 1, 1024, 230, 230, 1024, 1024]
    - [54, 7.66]
  - - [231, 128, 1, 1024, 231, 231, 1024, 1024]
    - [42, 7.69]
  - - [232, 128, 1, 1024, 232, 232, 1024, 1024]
    - [54, 7.68]
  - - [233, 128, 1, 1024, 233, 233, 1024, 1024]
    - [42, 7.67]
  - - [234, 128, 1, 1024, 234, 234, 1024, 1024]
    - [54, 7.79]
  - - [235, 128, 1, 1024, 235, 235, 1024, 1024]
    - [54, 7.78]
  - - [236, 128, 1, 1024, 236, 236, 1024, 1024]
    - [46, 7.77]
  - - [237, 128, 1, 1024, 237, 237, 1024, 1024]
    - [7, 7.76]
  - - [238, 128, 1, 1024, 238, 238, 1024, 1024]
    - [54, 7.83]
  - - [239, 128, 1, 1024, 239, 239, 1024, 1024]
    - [54, 7.95]
  - - [240, 128, 1, 1024, 240, 240, 1024, 1024]
    - [54, 7.99]
  - - [241, 128, 1, 1024, 241, 241, 1024, 1024]
    - [57, 8.02]
  - - [242, 128, 1, 1024, 242, 242, 1024, 1024]
    - [21, 7.97]
  - - [243, 128, 1, 1024, 243, 243, 1024, 1024]
    - [31, 8.09]
  - - [244, 128, 1, 1024, 244, 244, 1024, 1024]
    - [55, 8.12]
  - - [245, 128, 1, 1024, 245, 245, 1024, 1024]
    - [42, 8.15]
  - - [246, 128, 1, 1024, 246, 246, 1024, 1024]
    - [42, 8.1]
  - - [247, 128, 1, 1024, 247, 247, 1024, 1024]
    - [54, 8.31]
  - - [248, 128, 1, 1024, 248, 248, 1024, 1024]
    - [3, 8.12]
  - - [249, 128, 1, 1024, 249, 249, 1024, 1024]
    - [0, 8.2]
  - - [250, 128, 1, 1024, 250, 250, 1024, 1024]
    - [2, 8.23]
  - - [251, 128, 1, 1024, 251, 251, 1024, 1024]
    - [6, 8.31]
  - - [252, 128, 1, 1024, 252, 252, 1024, 1024]
    - [42, 8.29]
  - - [253, 128, 1, 1024, 253, 253, 1024, 1024]
    - [31, 8.33]
  - - [254, 128, 1, 1024, 254, 254, 1024, 1024]
    - [2, 8.41]
  - - [255, 128, 1, 1024, 255, 255, 1024, 1024]
    - [38, 8.39]
  - - [256, 128, 1, 1024, 256, 256, 1024, 1024]
    - [54, 8.57]
  - - [128, 129, 1, 1024, 128, 128, 1024, 1024]
    - [58, 4.32]
  - - [128, 130, 1, 1024, 128, 128, 1024, 1024]
    - [44, 4.48]
  - - [128, 131, 1, 1024, 128, 128, 1024, 1024]
    - [12, 4.38]
  - - [128, 132, 1, 1024, 128, 128, 1024, 1024]
    - [54, 4.44]
  - - [128, 133, 1, 1024, 128, 128, 1024, 1024]
    - [36, 4.45]
  - - [128, 134, 1, 1024, 128, 128, 1024, 1024]
    - [31, 4.49]
  - - [128, 135, 1, 1024, 128, 128, 1024, 1024]
    - [15, 4.47]
  - - [128, 136, 1, 1024, 128, 128, 1024, 1024]
    - [56, 4.58]
  - - [128, 137, 1, 1024, 128, 128, 1024, 1024]
    - [17, 4.59]
  - - [128, 138, 1, 1024, 128, 128, 1024, 1024]
    - [58, 4.59]
  - - [128, 139, 1, 1024, 128, 128, 1024, 1024]
    - [54, 4.65]
  - - [128, 140, 1, 1024, 128, 128, 1024, 1024]
    - [6, 4.66]
  - - [128, 141, 1, 1024, 128, 128, 1024, 1024]
    - [1, 4.67]
  - - [128, 142, 1, 1024, 128, 128, 1024, 1024]
    - [12, 4.73]
  - - [128, 143, 1, 1024, 128, 128, 1024, 1024]
    - [49, 4.79]
  - - [128, 144, 1, 1024, 128, 128, 1024, 1024]
    - [21, 4.82]
  - - [128, 145, 1, 1024, 128, 128, 1024, 1024]
    - [54, 4.88]
  - - [128, 146, 1, 1024, 128, 128, 1024, 1024]
    - [51, 4.91]
  - - [128, 147, 1, 1024, 128, 128, 1024, 1024]
    - [12, 4.98]
  - - [128, 148, 1, 1024, 128, 128, 1024, 1024]
    - [40, 4.95]
  - - [128, 149, 1, 1024, 128, 128, 1024, 1024]
    - [12, 5.02]
  - - [128, 150, 1, 1024, 128, 128, 1024, 1024]
    - [48, 4.99]
  - - [128, 151, 1, 1024, 128, 128, 1024, 1024]
    - [54, 5.11]
  - - [128, 152, 1, 1024, 128, 128, 1024, 1024]
    - [54, 5.12]
  - - [128, 153, 1, 1024, 128, 128, 1024, 1024]
    - [38, 5.24]
  - - [128, 154, 1, 1024, 128, 128, 1024, 1024]
    - [17, 5.15]
  - - [128, 155, 1, 1024, 128, 128, 1024, 1024]
    - [12, 5.22]
  - - [128, 156, 1, 1024, 128, 128, 1024, 1024]
    - [12, 5.22]
  - - [128, 157, 1, 1024, 128, 128, 1024, 1024]
    - [43, 5.23]
  - - [128, 158, 1, 1024, 128, 128, 1024, 1024]
    - [58, 5.29]
  - - [128, 159, 1, 1024, 128, 128, 1024, 1024]
    - [11, 5.32]
  - - [128, 160, 1, 1024, 128, 128, 1024, 1024]
    - [10, 5.39]
  - - [128, 161, 1, 1024, 128, 128, 1024, 1024]
    - [57, 5.39]
  - - [128, 162, 1, 1024, 128, 128, 1024, 1024]
    - [46, 5.42]
  - - [128, 163, 1, 1024, 128, 128, 1024, 1024]
    - [40, 5.46]
  - - [128, 164, 1, 1024, 128, 128, 1024, 1024]
    - [60, 5.68]
  - - [128, 165, 1, 1024, 128, 128, 1024, 1024]
    - [12, 5.49]
  - - [128, 166, 1, 1024, 128, 128, 1024, 1024]
    - [8, 5.53]
  - - [128, 167, 1, 1024, 128, 128, 1024, 1024]
    - [9, 5.56]
  - - [128, 168, 1, 1024, 128, 128, 1024, 1024]
    - [43, 5.59]
  - - [128, 169, 1, 1024, 128, 128, 1024, 1024]
    - [54, 5.62]
  - - [128, 170, 1, 1024, 128, 128, 1024, 1024]
    - [8, 5.63]
  - - [128, 171, 1, 1024, 128, 128, 1024, 1024]
    - [54, 5.76]
  - - [128, 172, 1, 1024, 128, 128, 1024, 1024]
    - [24, 5.76]
  - - [128, 173, 1, 1024, 128, 128, 1024, 1024]
    - [53, 5.76]
  - - [128, 174, 1, 1024, 128, 128, 1024, 1024]
    - [55, 5.79]
  - - [128, 175, 1, 1024, 128, 128, 1024, 1024]
    - [6, 5.82]
  - - [128, 176, 1, 1024, 128, 128, 1024, 1024]
    - [12, 5.86]
  - - [128, 177, 1, 1024, 128, 128, 1024, 1024]
    - [34, 5.89]
  - - [128, 178, 1, 1024, 128, 128, 1024, 1024]
    - [59, 6.09]
  - - [128, 179, 1, 1024, 128, 128, 1024, 1024]
    - [42, 6.06]
  - - [128, 180, 1, 1024, 128, 128, 1024, 1024]
    - [13, 5.96]
  - - [128, 181, 1, 1024, 128, 128, 1024, 1024]
    - [12, 6.09]
  - - [128, 182, 1, 1024, 128, 128, 1024, 1024]
    - [56, 6.16]
  - - [128, 183, 1, 1024, 128, 128, 1024, 1024]
    - [42, 6.16]
  - - [128, 184, 1, 1024, 128, 128, 1024, 1024]
    - [12, 6.16]
  - - [128, 185, 1, 1024, 128, 128, 1024, 1024]
    - [41, 6.23]
  - - [128, 186, 1, 1024, 128, 128, 1024, 1024]
    - [54, 6.19]
  - - [128, 187, 1, 1024, 128, 128, 1024, 1024]
    - [46, 6.37]
  - - [128, 188, 1, 1024, 128, 128, 1024, 1024]
    - [16, 6.26]
  - - [128, 189, 1, 1024, 128, 128, 1024, 1024]
    - [60, 6.33]
  - - [128, 190, 1, 1024, 128, 128, 1024, 1024]
    - [28, 6.4]
  - - [128, 191, 1, 1024, 128, 128, 1024, 1024]
    - [39, 6.36]
  - - [128, 192, 1, 1024, 128, 128, 1024, 1024]
    - [13, 6.43]
  - - [128, 193, 1, 1024, 128, 128, 1024, 1024]
    - [33, 6.46]
  - - [128, 194, 1, 1024, 128, 128, 1024, 1024]
    - [23, 6.57]
  - - [128, 195, 1, 1024, 128, 128, 1024, 1024]
    - [21, 6.53]
  - - [128, 196, 1, 1024, 128, 128, 1024, 1024]
    - [47, 6.56]
  - - [128, 197, 1, 1024, 128, 128, 1024, 1024]
    - [46, 6.59]
  - - [128, 198, 1, 1024, 128, 128, 1024, 1024]
    - [60, 6.63]
  - - [128, 199, 1, 1024, 128, 128, 1024, 1024]
    - [33, 6.62]
  - - [128, 200, 1, 1024, 128, 128, 1024, 1024]
    - [12, 6.73]
  - - [128, 201, 1, 1024, 128, 128, 1024, 1024]
    - [57, 6.77]
  - - [128, 202, 1, 1024, 128, 128, 1024, 1024]
    - [8, 6.69]
  - - [128, 203, 1, 1024, 128, 128, 1024, 1024]
    - [21, 6.79]
  - - [128, 204, 1, 1024, 128, 128, 1024, 1024]
    - [29, 6.79]
  - - [128, 205, 1, 1024, 128, 128, 1024, 1024]
    - [21, 6.79]
  - - [128, 206, 1, 1024, 128, 128, 1024, 1024]
    - [47, 6.89]
  - - [128, 207, 1, 1024, 128, 128, 1024, 1024]
    - [6, 6.89]
  - - [128, 208, 1, 1024, 128, 128, 1024, 1024]
    - [32, 6.96]
  - - [128, 209, 1, 1024, 128, 128, 1024, 1024]
    - [33, 7.03]
  - - [128, 210, 1, 1024, 128, 128, 1024, 1024]
    - [35, 6.99]
  - - [128, 211, 1, 1024, 128, 128, 1024, 1024]
    - [54, 7.1]
  - - [128, 212, 1, 1024, 128, 128, 1024, 1024]
    - [42, 7.1]
  - - [128, 213, 1, 1024, 128, 128, 1024, 1024]
    - [21, 7.17]
  - - [128, 214, 1, 1024, 128, 128, 1024, 1024]
    - [20, 7.12]
  - - [128, 215, 1, 1024, 128, 128, 1024, 1024]
    - [42, 7.49]
  - - [128, 216, 1, 1024, 128, 128, 1024, 1024]
    - [58, 7.19]
  - - [128, 217, 1, 1024, 128, 128, 1024, 1024]
    - [58, 7.3]
  - - [128, 218, 1, 1024, 128, 128, 1024, 1024]
    - [49, 7.3]
  - - [128, 219, 1, 1024, 128, 128, 1024, 1024]
    - [14, 7.33]
  - - [128, 220, 1, 1024, 128, 128, 1024, 1024]
    - [21, 7.36]
  - - [128, 221, 1, 1024, 128, 128, 1024, 1024]
    - [58, 7.48]
  - - [128, 222, 1, 1024, 128, 128, 1024, 1024]
    - [54, 7.51]
  - - [128, 223, 1, 1024, 128, 128, 1024, 1024]
    - [58, 7.46]
  - - [128, 224, 1, 1024, 128, 128, 1024, 1024]
    - [58, 7.58]
  - - [128, 225, 1, 1024, 128, 128, 1024, 1024]
    - [58, 7.62]
  - - [128, 226, 1, 1024, 128, 128, 1024, 1024]
    - [34, 7.52]
  - - [128, 227, 1, 1024, 128, 128, 1024, 1024]
    - [31, 7.51]
  - - [128, 228, 1, 1024, 128, 128, 1024, 1024]
    - [57, 7.63]
  - - [128, 229, 1, 1024, 128, 128, 1024, 1024]
    - [54, 7.71]
  - - [128, 230, 1, 1024, 128, 128, 1024, 1024]
    - [55, 7.7]
  - - [128, 231, 1, 1024, 128, 128, 1024, 1024]
    - [52, 7.65]
  - - [128, 232, 1, 1024, 128, 128, 1024, 1024]
    - [55, 7.81]
  - - [128, 233, 1, 1024, 128, 128, 1024, 1024]
    - [54, 7.8]
  - - [128, 234, 1, 1024, 128, 128, 1024, 1024]
    - [47, 7.88]
  - - [128, 235, 1, 1024, 128, 128, 1024, 1024]
    - [7, 7.96]
  - - [128, 236, 1, 1024, 128, 128, 1024, 1024]
    - [22, 7.86]
  - - [128, 237, 1, 1024, 128, 128, 1024, 1024]
    - [21, 7.89]
  - - [128, 238, 1, 1024, 128, 128, 1024, 1024]
    - [39, 7.92]
  - - [128, 239, 1, 1024, 128, 128, 1024, 1024]
    - [58, 8.04]
  - - [128, 240, 1, 1024, 128, 128, 1024, 1024]
    - [17, 8.03]
  - - [128, 241, 1, 1024, 128, 128, 1024, 1024]
    - [49, 8.02]
  - - [128, 242, 1, 1024, 128, 128, 1024, 1024]
    - [24, 8.24]
  - - [128, 243, 1, 1024, 128, 128, 1024, 1024]
    - [50, 8.37]
  - - [128, 244, 1, 1024, 128, 128, 1024, 1024]
    - [59, 8.17]
  - - [128, 245, 1, 1024, 128, 128, 1024, 1024]
    - [37, 8.2]
  - - [128, 246, 1, 1024, 128, 128, 1024, 1024]
    - [49, 8.23]
  - - [128, 247, 1, 1024, 128, 128, 1024, 1024]
    - [21, 8.27]
  - - [128, 248, 1, 1024, 128, 128, 1024, 1024]
    - [12, 8.3]
  - - [128, 249, 1, 1024, 128, 128, 1024, 1024]
    - [4, 8.29]
  - - [128, 250, 1, 1024, 128, 128, 1024, 1024]
    - [12, 8.27]
  - - [128, 251, 1, 1024, 128, 128, 1024, 1024]
    - [26, 8.59]
  - - [128, 252, 1, 1024, 128, 128, 1024, 1024]
    - [27, 8.39]
  - - [128, 253, 1, 1024, 128, 128, 1024, 1024]
    - [12, 8.42]
  - - [128, 254, 1, 1024, 128, 128, 1024, 1024]
    - [54, 8.5]
  - - [128, 255, 1, 1024, 128, 128, 1024, 1024]
    - [17, 8.49]
  - - [128, 256, 1, 1024, 128, 128, 1024, 1024]
    - [58, 8.67]
  - - [32, 16, 1, 1024, 32, 32, 1024, 1024]
    - [19, 0.14]
  - - [256, 256, 1, 128, 256, 256, 128, 128]
    - [25, 2.58]
  - - [1025, 513, 1, 2048, 1025, 1025, 2048, 2048]
    - [24, 149.69]
  - - [1044, 532, 1, 2048, 1044, 1044, 2048, 2048]
    - [41, 155.27]
  - - [127, 127, 1, 640, 127, 127, 640, 640]
    - [14, 2.78]
  - - [128, 128, 1, 128, 128, 128, 128, 128]
    - [18, 0.63]
  - - [129, 129, 1, 640, 129, 129, 640, 640]
    - [13, 2.88]
  - - [128, 128, 1, 512, 128, 128, 512, 512]
    - [23, 2.33]
- null
- null
- DeviceEfficiency
- GridBased
