projects/hipblaslt/library/src/amd_detail/rocblaslt/src/Tensile/Logic/asm_full/gfx950/GridBased/gfx950_Cijk_Alik_Bjlk_S_MX_B_Bias_HA_S_SAV_UserArgs.yaml
- {MinimumRequiredVersion: 5.0.0}
- gfx950
- gfx950
- [Device 75a0]
    SolutionIndex: 2
    SolutionNameMin: Cijk_Alik_Bjlk_S_MX_B_Bias_HA_S_SAV_UserArgs_MT64x256x64_MI16x16x1_SN_LDSB1_AFC0_AFEM1_AFEM1_ASEM1_CLR1_CADS0_DTLA0_DTLB0_DTVA0_DTVB0_EPS0_FDSI1_GRPM1_GRVWA4_GRVWB4_GSUn1_GSUAMBSK_GSUC1_GSUWGMRR1_GLS0_ISA950_IU1_K1_LDSTI0_LBSPPA1024_LBSPPB4096_LBSPPM0_LPA8_LPB0_LPM0_LRVW4_LWPMn1_MIAV0_MIWT4_4_MO40_NTn1_NTA0_NTB0_NTC0_NTD4_NTM0_NEPBS8_NLCA1_NLCB1_ONLL1_PGR2_PLR1_PKA1_SIA3_SS1_SU16_SUM0_SUS256_SPO0_SRVW0_SSO0_SVW4_SK0_SKFTR0_SKXCCM0_TLDS1_ULSGRO0_USL1_UIOFGRO0_USFGROn1_VSn1_VWA4_VWB4_WSGRA0_WSGRB0_WS64_WG16_16_1_WGM1_WGMXCC8_WGMXCCGn1
    SolutionIndex: 4
    SolutionNameMin: Cijk_Alik_Bjlk_S_MX_B_Bias_HA_S_SAV_UserArgs_MT80x192x64_MI16x16x1_SN_LDSB1_AFC0_AFEM1_AFEM1_ASEM1_CLR1_CADS0_DTLA0_DTLB0_DTVA0_DTVB0_EPS0_FDSI1_GRPM1_GRVWA4_GRVWB4_GSUn1_GSUAMBSK_GSUC1_GSUWGMRR1_GLS0_ISA950_IU1_K1_LDSTI0_LBSPPA256_LBSPPB3072_LBSPPM0_LPA8_LPB16_LPM0_LRVW4_LWPMn1_MIAV0_MIWT5_3_MO40_NTn1_NTA0_NTB0_NTC0_NTD4_NTM0_NEPBS5_NLCA1_NLCB3_ONLL1_PGR2_PLR1_PKA1_SIA3_SS1_SU16_SUM0_SUS256_SPO0_SRVW0_SSO0_SVW1_SK0_SKFTR0_SKXCCM0_TLDS1_ULSGRO0_USL1_UIOFGRO0_USFGROn1_VSn1_VWA1_VWB1_WSGRA0_WSGRB0_WS64_WG16_16_1_WGM1_WGMXCC8_WGMXCCGn1
    SolutionIndex: 5
    SolutionNameMin: Cijk_Alik_Bjlk_S_MX_B_Bias_HA_S_SAV_UserArgs_MT96x192x64_MI16x16x1_SN_LDSB1_AFC0_AFEM1_AFEM1_ASEM1_CLR1_CADS0_DTLA0_DTLB0_DTVA0_DTVB0_EPS0_FDSI1_GRPM1_GRVWA4_GRVWB4_GSUn1_GSUAMBSK_GSUC1_GSUWGMRR1_GLS0_ISA950_IU1_K1_LDSTI0_LBSPPA512_LBSPPB3072_LBSPPM0_LPA8_LPB16_LPM0_LRVW4_LWPMn1_MIAV0_MIWT6_3_MO40_NTn1_NTA0_NTB0_NTC0_NTD4_NTM0_NEPBS6_NLCA1_NLCB3_ONLL1_PGR2_PLR1_PKA1_SIA3_SS1_SU16_SUM0_SUS256_SPO0_SRVW0_SSO0_SVW2_SK0_SKFTR0_SKXCCM0_TLDS1_ULSGRO0_USL1_UIOFGRO0_USFGROn1_VSn1_VWA2_VWB1_WSGRA0_WSGRB0_WS64_WG16_16_1_WGM1_WGMXCC8_WGMXCCGn1
    SolutionIndex: 6
    SolutionNameMin: Cijk_Alik_Bjlk_S_MX_B_Bias_HA_S_SAV_UserArgs_MT64x160x64_MI16x16x1_SN_LDSB1_AFC0_AFEM1_AFEM1_ASEM1_CLR1_CADS0_DTLA0_DTLB0_DTVA0_DTVB0_EPS0_FDSI1_GRPM1_GRVWA4_GRVWB4_GSUn1_GSUAMBSK_GSUC1_GSUWGMRR1_GLS0_ISA950_IU1_K1_LDSTI0_LBSPPA512_LBSPPB2560_LBSPPM0_LPA8_LPB16_LPM0_LRVW4_LWPMn1_MIAV0_MIWT2_5_MO40_NTn1_NTA0_NTB0_NTC0_NTD4_NTM0_NEPBS8_NLCA1_NLCB5_ONLL1_PGR2_PLR1_PKA1_SIA3_SS1_SU16_SUM0_SUS256_SPO0_SRVW0_SSO0_SVW2_SK0_SKFTR0_SKXCCM0_TLDS1_ULSGRO0_USL1_UIOFGRO0_USFGROn1_VSn1_VWA2_VWB1_WSGRA0_WSGRB0_WS64_WG32_8_1_WGM1_WGMXCC8_WGMXCCGn1
    SolutionIndex: 7
    SolutionNameMin: Cijk_Alik_Bjlk_S_MX_B_Bias_HA_S_SAV_UserArgs_MT32x16x128_MI16x16x1_SN_LDSB1_AFC0_AFEM1_AFEM1_ASEM1_CLR1_CADS0_DTLA0_DTLB0_DTVA0_DTVB0_EPS0_FDSI1_GRPM1_GRVWA4_GRVWB4_GSUn1_GSUAMBSK_GSUC1_GSUWGMRR1_GLS0_ISA950_IU1_K1_LDSTI0_LBSPPA512_LBSPPB256_LBSPPM0_LPA8_LPB16_LPM0_LRVW4_LWPMn1_MIAV0_MIWT1_1_MO40_NTn1_NTA0_NTB0_NTC0_NTD4_NTM0_NEPBS8_NLCA1_NLCB1_ONLL1_PGR2_PLR1_PKA1_SIA3_SS1_SU16_SUM0_SUS512_SPO0_SRVW0_SSO0_SVW1_SK0_SKFTR0_SKXCCM0_TLDS1_ULSGRO0_USL1_UIOFGRO0_USFGROn1_VSn1_VWA1_VWB1_WSGRA0_WSGRB0_WS64_WG32_4_1_WGM1_WGMXCC8_WGMXCCGn1
    SolutionIndex: 9
    SolutionNameMin: Cijk_Alik_Bjlk_S_MX_B_Bias_HA_S_SAV_UserArgs_MT32x64x128_MI16x16x1_SN_LDSB1_AFC0_AFEM1_AFEM1_ASEM1_CLR1_CADS0_DTLA0_DTLB0_DTVA0_DTVB0_EPS0_FDSI1_GRPM1_GRVWA4_GRVWB4_GSUn1_GSUAMBSK_GSUC1_GSUWGMRR1_GLS0_ISA950_IU1_K1_LDSTI0_LBSPPA1024_LBSPPB1024_LBSPPM0_LPA8_LPB16_LPM0_LRVW4_LWPMn1_MIAV0_MIWT2_1_MO40_NTn1_NTA0_NTB0_NTC0_NTD4_NTM0_NEPBS8_NLCA1_NLCB1_ONLL1_PGR2_PLR1_PKA1_SIA3_SS1_SU16_SUM0_SUS512_SPO0_SRVW0_SSO0_SVW2_SK0_SKFTR0_SKXCCM0_TLDS1_ULSGRO0_USL1_UIOFGRO0_USFGROn1_VSn1_VWA2_VWB1_WSGRA0_WSGRB0_WS64_WG16_16_1_WGM1_WGMXCC8_WGMXCCGn1
    SolutionIndex: 10
    SolutionNameMin: Cijk_Alik_Bjlk_S_MX_B_Bias_HA_S_SAV_UserArgs_MT64x96x128_MI16x16x1_SN_LDSB1_AFC0_AFEM1_AFEM1_ASEM1_CLR1_CADS0_DTLA0_DTLB0_DTVA0_DTVB0_EPS0_FDSI1_GRPM1_GRVWA4_GRVWB4_GSUn1_GSUAMBSK_GSUC1_GSUWGMRR1_GLS0_ISA950_IU1_K1_LDSTI0_LBSPPA2048_LBSPPB1536_LBSPPM0_LPA8_LPB16_LPM0_LRVW4_LWPMn1_MIAV0_MIWT4_3_MO40_NTn1_NTA0_NTB0_NTC0_NTD4_NTM0_NEPBS8_NLCA1_NLCB3_ONLL1_PGR2_PLR1_PKA1_SIA3_SS1_SU16_SUM0_SUS512_SPO0_SRVW0_SSO0_SVW4_SK0_SKFTR0_SKXCCM0_TLDS1_ULSGRO0_USL1_UIOFGRO0_USFGROn1_VSn1_VWA4_VWB1_WSGRA0_WSGRB0_WS64_WG16_8_2_WGM1_WGMXCC8_WGMXCCGn1
    SolutionIndex: 11
    SolutionNameMin: Cijk_Alik_Bjlk_S_MX_B_Bias_HA_S_SAV_UserArgs_MT16x16x256_MI16x16x1_SN_LDSB1_AFC0_AFEM1_AFEM1_ASEM1_CLR1_CADS0_DTLA0_DTLB0_DTVA0_DTVB0_EPS0_FDSI1_GRPM1_GRVWA4_GRVWB4_GSUn1_GSUAMBSK_GSUC1_GSUWGMRR1_GLS0_ISA950_IU1_K1_LDSTI0_LBSPPA1024_LBSPPB256_LBSPPM0_LPA8_LPB16_LPM0_LRVW4_LWPMn1_MIAV0_MIWT1_1_MO40_NTn1_NTA0_NTB0_NTC0_NTD4_NTM0_NEPBS8_NLCA1_NLCB1_ONLL1_PGR2_PLR1_PKA1_SIA3_SS1_SU16_SUM0_SUS1024_SPO0_SRVW0_SSO0_SVW1_SK0_SKFTR0_SKXCCM0_TLDS1_ULSGRO0_USL1_UIOFGRO0_USFGROn1_VSn1_VWA1_VWB1_WSGRA0_WSGRB0_WS64_WG16_4_4_WGM1_WGMXCC8_WGMXCCGn1
    SolutionIndex: 14
    SolutionNameMin: Cijk_Alik_Bjlk_S_MX_B_Bias_HA_S_SAV_UserArgs_MT32x16x256_MI16x16x1_SN_LDSB1_AFC0_AFEM1_AFEM1_ASEM1_CLR1_CADS0_DTLA0_DTLB0_DTVA0_DTVB0_EPS0_FDSI1_GRPM1_GRVWA4_GRVWB4_GSUn1_GSUAMBSK_GSUC1_GSUWGMRR1_GLS0_ISA950_IU1_K1_LDSTI0_LBSPPA2048_LBSPPB256_LBSPPM0_LPA8_LPB16_LPM0_LRVW4_LWPMn1_MIAV0_MIWT2_1_MO40_NTn1_NTA0_NTB0_NTC0_NTD4_NTM0_NEPBS8_NLCA1_NLCB1_ONLL1_PGR2_PLR1_PKA1_SIA3_SS1_SU16_SUM0_SUS1024_SPO0_SRVW0_SSO0_SVW2_SK0_SKFTR0_SKXCCM0_TLDS1_ULSGRO0_USL1_UIOFGRO0_USFGROn1_VSn1_VWA2_VWB1_WSGRA0_WSGRB0_WS64_WG16_4_4_WGM1_WGMXCC8_WGMXCCGn1
    SolutionIndex: 15
    SolutionNameMin: Cijk_Alik_Bjlk_S_MX_B_Bias_HA_S_SAV_UserArgs_MT32x32x256_MI16x16x1_SN_LDSB1_AFC0_AFEM1_AFEM1_ASEM1_CLR1_CADS0_DTLA0_DTLB0_DTVA0_DTVB0_EPS0_FDSI1_GRPM1_GRVWA4_GRVWB4_GSUn1_GSUAMBSK_GSUC1_GSUWGMRR1_GLS0_ISA950_IU1_K1_LDSTI0_LBSPPA2048_LBSPPB512_LBSPPM0_LPA8_LPB0_LPM0_LRVW4_LWPMn1_MIAV0_MIWT2_2_MO40_NTn1_NTA0_NTB0_NTC0_NTD4_NTM0_NEPBS8_NLCA1_NLCB1_ONLL1_PGR2_PLR1_PKA1_SIA3_SS1_SU16_SUM0_SUS1024_SPO0_SRVW0_SSO0_SVW2_SK0_SKFTR0_SKXCCM0_TLDS1_ULSGRO0_USL1_UIOFGRO0_USFGROn1_VSn1_VWA2_VWB2_WSGRA0_WSGRB0_WS64_WG16_4_4_WGM1_WGMXCC8_WGMXCCGn1
    SolutionIndex: 16
    SolutionNameMin: Cijk_Alik_Bjlk_S_MX_B_Bias_HA_S_SAV_UserArgs_MT32x48x256_MI16x16x1_SN_LDSB1_AFC0_AFEM1_AFEM1_ASEM1_CLR1_CADS0_DTLA0_DTLB0_DTVA0_DTVB0_EPS0_FDSI1_GRPM1_GRVWA4_GRVWB4_GSUn1_GSUAMBSK_GSUC1_GSUWGMRR1_GLS0_ISA950_IU1_K1_LDSTI0_LBSPPA2048_LBSPPB768_LBSPPM0_LPA8_LPB16_LPM0_LRVW4_LWPMn1_MIAV0_MIWT2_3_MO40_NTn1_NTA0_NTB0_NTC0_NTD4_NTM0_NEPBS8_NLCA1_NLCB3_ONLL1_PGR2_PLR1_PKA1_SIA3_SS1_SU16_SUM0_SUS1024_SPO0_SRVW0_SSO0_SVW2_SK0_SKFTR0_SKXCCM0_TLDS1_ULSGRO0_USL1_UIOFGRO0_USFGROn1_VSn1_VWA2_VWB1_WSGRA0_WSGRB0_WS64_WG16_4_4_WGM1_WGMXCC8_WGMXCCGn1
    SolutionIndex: 18
    SolutionNameMin: Cijk_Alik_Bjlk_S_MX_B_Bias_HA_S_SAV_UserArgs_MT64x32x256_MI16x16x1_SN_LDSB1_AFC0_AFEM1_AFEM1_ASEM1_CLR1_CADS0_DTLA0_DTLB0_DTVA0_DTVB0_EPS0_FDSI1_GRPM1_GRVWA4_GRVWB4_GSUn1_GSUAMBSK_GSUC1_GSUWGMRR1_GLS0_ISA950_IU1_K1_LDSTI0_LBSPPA4096_LBSPPB512_LBSPPM0_LPA8_LPB0_LPM0_LRVW4_LWPMn1_MIAV0_MIWT4_2_MO40_NTn1_NTA0_NTB0_NTC0_NTD4_NTM0_NEPBS8_NLCA1_NLCB1_ONLL1_PGR2_PLR1_PKA1_SIA3_SS1_SU16_SUM0_SUS1024_SPO0_SRVW0_SSO0_SVW4_SK0_SKFTR0_SKXCCM0_TLDS1_ULSGRO0_USL1_UIOFGRO0_USFGROn1_VSn1_VWA4_VWB2_WSGRA0_WSGRB0_WS64_WG16_4_4_WGM1_WGMXCC8_WGMXCCGn1
    SolutionIndex: 21
    SolutionNameMin: Cijk_Alik_Bjlk_S_MX_B_Bias_HA_S_SAV_UserArgs_MT16x16x512_MI16x16x1_SN_LDSB1_AFC0_AFEM1_AFEM1_ASEM1_CLR1_CADS0_DTLA0_DTLB0_DTVA0_DTVB0_EPS0_FDSI1_GRPM1_GRVWA4_GRVWB4_GSUn1_GSUAMBSK_GSUC1_GSUWGMRR1_GLS0_ISA950_IU1_K1_LDSTI0_LBSPPA2048_LBSPPB256_LBSPPM0_LPA8_LPB16_LPM0_LRVW4_LWPMn1_MIAV0_MIWT1_1_MO40_NTn1_NTA0_NTB0_NTC0_NTD4_NTM0_NEPBS8_NLCA1_NLCB1_ONLL1_PGR2_PLR1_PKA1_SIA3_SS1_SU16_SUM0_SUS2048_SPO0_SRVW0_SSO0_SVW1_SK0_SKFTR0_SKXCCM0_TLDS1_ULSGRO0_USL1_UIOFGRO0_USFGROn1_VSn1_VWA1_VWB1_WSGRA0_WSGRB0_WS64_WG16_4_4_WGM1_WGMXCC8_WGMXCCGn1
    SolutionIndex: 23
    SolutionNameMin: Cijk_Alik_Bjlk_S_MX_B_Bias_HA_S_SAV_UserArgs_MT96x192x32_MI16x16x1_SN_LDSB1_AFC0_AFEM1_AFEM1_ASEM1_CLR0_CADS0_DTLA0_DTLB0_DTVA0_DTVB0_EPS0_FDSI1_GRPM1_GRVWA4_GRVWB4_GSUn1_GSUAMBSK_GSUC1_GSUWGMRR1_GLS0_ISA950_IU1_K1_LDSTI0_LBSPPA256_LBSPPB3072_LBSPPM0_LPA8_LPB16_LPM0_LRVW4_LWPMn1_MIAV0_MIWT6_3_MO40_NTn1_NTA0_NTB0_NTC0_NTD4_NTM0_NEPBS6_NLCA1_NLCB3_ONLL1_PGR2_PLR0_PKA1_SIA3_SS1_SU16_SUM0_SUS128_SPO0_SRVW0_SSO0_SVW2_SK0_SKFTR0_SKXCCM0_TLDS1_ULSGRO0_USL1_UIOFGRO0_USFGROn1_VSn1_VWA2_VWB1_WSGRA0_WSGRB0_WS64_WG16_16_1_WGM1_WGMXCC8_WGMXCCGn1
    SolutionIndex: 24
    SolutionNameMin: Cijk_Alik_Bjlk_S_MX_B_Bias_HA_S_SAV_UserArgs_MT96x256x32_MI16x16x1_SN_LDSB1_AFC0_AFEM1_AFEM1_ASEM1_CLR0_CADS0_DTLA0_DTLB0_DTVA0_DTVB0_EPS0_FDSI1_GRPM1_GRVWA4_GRVWB4_GSUn1_GSUAMBSK_GSUC1_GSUWGMRR1_GLS0_ISA950_IU1_K1_LDSTI0_LBSPPA256_LBSPPB4096_LBSPPM0_LPA8_LPB0_LPM0_LRVW4_LWPMn1_MIAV0_MIWT6_4_MO40_NTn1_NTA0_NTB0_NTC0_NTD4_NTM0_NEPBS6_NLCA1_NLCB1_ONLL1_PGR2_PLR0_PKA1_SIA3_SS1_SU16_SUM0_SUS128_SPO0_SRVW0_SSO0_SVW2_SK0_SKFTR0_SKXCCM0_TLDS1_ULSGRO0_USL1_UIOFGRO0_USFGROn1_VSn1_VWA2_VWB4_WSGRA0_WSGRB0_WS64_WG16_16_1_WGM1_WGMXCC8_WGMXCCGn1
    SolutionIndex: 25
    SolutionNameMin: Cijk_Alik_Bjlk_S_MX_B_Bias_HA_S_SAV_UserArgs_MT96x320x32_MI16x16x1_SN_LDSB1_AFC0_AFEM1_AFEM1_ASEM1_CLR0_CADS0_DTLA0_DTLB0_DTVA0_DTVB0_EPS0_FDSI1_GRPM1_GRVWA4_GRVWB4_GSUn1_GSUAMBSK_GSUC1_GSUWGMRR1_GLS0_ISA950_IU1_K1_LDSTI0_LBSPPA256_LBSPPB5120_LBSPPM0_LPA8_LPB16_LPM0_LRVW4_LWPMn1_MIAV0_MIWT6_5_MO40_NTn1_NTA0_NTB0_NTC0_NTD4_NTM0_NEPBS6_NLCA1_NLCB5_ONLL1_PGR2_PLR0_PKA1_SIA3_SS1_SU16_SUM0_SUS128_SPO0_SRVW0_SSO0_SVW2_SK0_SKFTR0_SKXCCM0_TLDS1_ULSGRO0_USL1_UIOFGRO0_USFGROn1_VSn1_VWA2_VWB1_WSGRA0_WSGRB0_WS64_WG16_16_1_WGM1_WGMXCC8_WGMXCCGn1
    SolutionIndex: 26
    SolutionNameMin: Cijk_Alik_Bjlk_S_MX_B_Bias_HA_S_SAV_UserArgs_MT128x160x64_MI16x16x1_SN_LDSB1_AFC0_AFEM1_AFEM1_ASEM1_CLR1_CADS0_DTLA0_DTLB0_DTVA0_DTVB0_EPS0_FDSI1_GRPM1_GRVWA4_GRVWB4_GSUn1_GSUAMBSK_GSUC1_GSUWGMRR1_GLS0_ISA950_IU1_K1_LDSTI0_LBSPPA1024_LBSPPB2560_LBSPPM0_LPA8_LPB16_LPM0_LRVW4_LWPMn1_MIAV0_MIWT4_5_MO40_NTn1_NTA0_NTB0_NTC0_NTD4_NTM0_NEPBS8_NLCA1_NLCB5_ONLL1_PGR2_PLR1_PKA1_SIA3_SS1_SU16_SUM0_SUS256_SPO0_SRVW0_SSO0_SVW4_SK0_SKFTR0_SKXCCM0_TLDS1_ULSGRO0_USL1_UIOFGRO0_USFGROn1_VSn1_VWA4_VWB1_WSGRA0_WSGRB0_WS64_WG32_8_1_WGM8_WGMXCC8_WGMXCCGn1
    SolutionIndex: 27
    SolutionNameMin: Cijk_Alik_Bjlk_S_MX_B_Bias_HA_S_SAV_UserArgs_MT128x128x64_MI16x16x1_SN_LDSB1_AFC0_AFEM1_AFEM1_ASEM1_CLR1_CADS0_DTLA0_DTLB0_DTVA0_DTVB0_EPS0_FDSI1_GRPM1_GRVWA4_GRVWB4_GSUn1_GSUAMBSK_GSUC1_GSUWGMRR1_GLS0_ISA950_IU1_K1_LDSTI0_LBSPPA1024_LBSPPB2048_LBSPPM0_LPA8_LPB0_LPM0_LRVW4_LWPMn1_MIAV0_MIWT4_4_MO40_NTn1_NTA0_NTB0_NTC0_NTD4_NTM0_NEPBS8_NLCA1_NLCB1_ONLL1_PGR2_PLR1_PKA1_SIA3_SS1_SU16_SUM0_SUS256_SPO0_SRVW0_SSO0_SVW4_SK0_SKFTR0_SKXCCM0_TLDS1_ULSGRO0_USL1_UIOFGRO0_USFGROn1_VSn1_VWA4_VWB4_WSGRA0_WSGRB0_WS64_WG32_8_1_WGM8_WGMXCC8_WGMXCCGn1
    SolutionIndex: 28
    SolutionNameMin: Cijk_Alik_Bjlk_S_MX_B_Bias_HA_S_SAV_UserArgs_MT144x256x32_MI16x16x1_SN_LDSB0_AFC0_AFEM1_AFEM1_ASEM1_CLR0_CADS0_DTLA0_DTLB0_DTVA0_DTVB0_EPS0_FDSI1_GRPM1_GRVWA2_GRVWB4_GSUn1_GSUAMBSK_GSUC1_GSUWGMRR1_GLS0_ISA950_IU1_K1_LDSTI0_LBSPPA128_LBSPPB4096_LBSPPM0_LPA8_LPB0_LPM0_LRVW4_LWPMn1_MIAV0_MIWT9_4_MO40_NTn1_NTA0_NTB0_NTC0_NTD4_NTM0_NEPBS9_NLCA1_NLCB1_ONLL1_PGR2_PLR0_PKA1_SIA3_SS1_SU16_SUM0_SUS128_SPO0_SRVW0_SSO0_SVW1_SK0_SKFTR0_SKXCCM0_TLDS1_ULSGRO0_USL1_UIOFGRO0_USFGROn1_VSn1_VWA1_VWB4_WSGRA0_WSGRB0_WS64_WG16_16_1_WGM1_WGMXCC8_WGMXCCGn1
    SolutionIndex: 29
    SolutionNameMin: Cijk_Alik_Bjlk_S_MX_B_Bias_HA_S_SAV_UserArgs_MT144x256x32_MI16x16x1_SN_LDSB0_AFC0_AFEM1_AFEM1_ASEM1_CLR0_CADS0_DTLA0_DTLB0_DTVA0_DTVB0_EPS0_FDSI1_GRPM1_GRVWA2_GRVWB4_GSUn1_GSUAMBSK_GSUC1_GSUWGMRR1_GLS0_ISA950_IU1_K1_LDSTI0_LBSPPA128_LBSPPB4096_LBSPPM0_LPA8_LPB0_LPM0_LRVW4_LWPMn1_MIAV0_MIWT9_4_MO40_NTn1_NTA0_NTB0_NTC0_NTD4_NTM0_NEPBS9_NLCA1_NLCB1_ONLL1_PGR2_PLR0_PKA1_SIA3_SS1_SU16_SUM0_SUS128_SPO0_SRVW0_SSO0_SVW1_SK0_SKFTR0_SKXCCM0_TLDS1_ULSGRO0_USL1_UIOFGRO0_USFGROn1_VSn1_VWA1_VWB4_WSGRA0_WSGRB0_WS64_WG16_16_1_WGM4_WGMXCC8_WGMXCCGn1
    SolutionIndex: 30
    SolutionNameMin: Cijk_Alik_Bjlk_S_MX_B_Bias_HA_S_SAV_UserArgs_MT144x256x32_MI16x16x1_SN_LDSB0_AFC0_AFEM1_AFEM1_ASEM1_CLR0_CADS0_DTLA0_DTLB0_DTVA0_DTVB0_EPS0_FDSI1_GRPM1_GRVWA2_GRVWB4_GSUn1_GSUAMBSK_GSUC1_GSUWGMRR1_GLS0_ISA950_IU1_K1_LDSTI0_LBSPPA128_LBSPPB4096_LBSPPM0_LPA8_LPB0_LPM0_LRVW4_LWPMn1_MIAV0_MIWT9_4_MO40_NTn1_NTA0_NTB0_NTC0_NTD4_NTM0_NEPBS9_NLCA1_NLCB1_ONLL1_PGR2_PLR0_PKA1_SIA3_SS1_SU16_SUM0_SUS128_SPO0_SRVW0_SSO0_SVW1_SK0_SKFTR0_SKXCCM0_TLDS1_ULSGRO0_USL1_UIOFGRO0_USFGROn1_VSn1_VWA1_VWB4_WSGRA0_WSGRB0_WS64_WG16_16_1_WGM8_WGMXCC8_WGMXCCGn1
    SolutionIndex: 31
    SolutionNameMin: Cijk_Alik_Bjlk_S_MX_B_Bias_HA_S_SAV_UserArgs_MT160x128x32_MI16x16x1_SN_LDSB1_AFC0_AFEM1_AFEM1_ASEM1_CLR0_CADS0_DTLA0_DTLB0_DTVA0_DTVB0_EPS0_FDSI1_GRPM1_GRVWA4_GRVWB4_GSUn1_GSUAMBSK_GSUC1_GSUWGMRR1_GLS0_ISA950_IU1_K1_LDSTI0_LBSPPA256_LBSPPB2048_LBSPPM0_LPA8_LPB0_LPM0_LRVW4_LWPMn1_MIAV0_MIWT10_2_MO40_NTn1_NTA0_NTB0_NTC0_NTD4_NTM0_NEPBS10_NLCA1_NLCB1_ONLL1_PGR2_PLR0_PKA1_SIA3_SS1_SU16_SUM0_SUS128_SPO0_SRVW0_SSO0_SVW2_SK0_SKFTR0_SKXCCM0_TLDS1_ULSGRO0_USL1_UIOFGRO0_USFGROn1_VSn1_VWA2_VWB2_WSGRA0_WSGRB0_WS64_WG16_16_1_WGM1_WGMXCC8_WGMXCCGn1
    SolutionIndex: 32
    SolutionNameMin: Cijk_Alik_Bjlk_S_MX_B_Bias_HA_S_SAV_UserArgs_MT160x256x32_MI16x16x1_SN_LDSB0_AFC0_AFEM1_AFEM1_ASEM1_CLR0_CADS0_DTLA0_DTLB0_DTVA0_DTVB0_EPS0_FDSI1_GRPM1_GRVWA4_GRVWB4_GSUn1_GSUAMBSK_GSUC1_GSUWGMRR1_GLS0_ISA950_IU1_K1_LDSTI0_LBSPPA256_LBSPPB4096_LBSPPM0_LPA8_LPB0_LPM0_LRVW4_LWPMn1_MIAV0_MIWT10_4_MO40_NTn1_NTA0_NTB0_NTC0_NTD4_NTM0_NEPBS10_NLCA1_NLCB1_ONLL1_PGR2_PLR0_PKA1_SIA3_SS1_SU16_SUM0_SUS128_SPO0_SRVW0_SSO0_SVW2_SK0_SKFTR0_SKXCCM0_TLDS1_ULSGRO0_USL1_UIOFGRO0_USFGROn1_VSn1_VWA2_VWB4_WSGRA0_WSGRB0_WS64_WG16_16_1_WGM1_WGMXCC8_WGMXCCGn1
    SolutionIndex: 33
    SolutionNameMin: Cijk_Alik_Bjlk_S_MX_B_Bias_HA_S_SAV_UserArgs_MT160x192x32_MI16x16x1_SN_LDSB1_AFC0_AFEM1_AFEM1_ASEM1_CLR0_CADS0_DTLA0_DTLB0_DTVA0_DTVB0_EPS0_FDSI1_GRPM1_GRVWA4_GRVWB4_GSUn1_GSUAMBSK_GSUC1_GSUWGMRR1_GLS0_ISA950_IU1_K1_LDSTI0_LBSPPA256_LBSPPB3072_LBSPPM0_LPA8_LPB16_LPM0_LRVW4_LWPMn1_MIAV0_MIWT10_3_MO40_NTn1_NTA0_NTB0_NTC0_NTD4_NTM0_NEPBS10_NLCA1_NLCB3_ONLL1_PGR2_PLR0_PKA1_SIA3_SS1_SU16_SUM0_SUS128_SPO0_SRVW0_SSO0_SVW2_SK0_SKFTR0_SKXCCM0_TLDS1_ULSGRO0_USL1_UIOFGRO0_USFGROn1_VSn1_VWA2_VWB1_WSGRA0_WSGRB0_WS64_WG16_16_1_WGM1_WGMXCC8_WGMXCCGn1
    SolutionIndex: 34
    SolutionNameMin: Cijk_Alik_Bjlk_S_MX_B_Bias_HA_S_SAV_UserArgs_MT32x16x512_MI16x16x1_SN_LDSB1_AFC0_AFEM1_AFEM1_ASEM1_CLR1_CADS0_DTLA0_DTLB0_DTVA0_DTVB0_EPS0_FDSI1_GRPM1_GRVWA4_GRVWB4_GSUn1_GSUAMBSK_GSUC1_GSUWGMRR1_GLS0_ISA950_IU1_K1_LDSTI0_LBSPPA4096_LBSPPB256_LBSPPM0_LPA8_LPB16_LPM0_LRVW4_LWPMn1_MIAV0_MIWT2_1_MO40_NTn1_NTA0_NTB0_NTC0_NTD4_NTM0_NEPBS8_NLCA1_NLCB1_ONLL1_PGR2_PLR1_PKA1_SIA3_SS1_SU16_SUM0_SUS2048_SPO0_SRVW0_SSO0_SVW2_SK0_SKFTR0_SKXCCM0_TLDS1_ULSGRO0_USL1_UIOFGRO0_USFGROn1_VSn1_VWA2_VWB1_WSGRA0_WSGRB0_WS64_WG16_4_4_WGM4_WGMXCC8_WGMXCCGn1
    SolutionIndex: 36
    SolutionNameMin: Cijk_Alik_Bjlk_S_MX_B_Bias_HA_S_SAV_UserArgs_MT208x320x32_MI16x16x1_SN_LDSB1_AFC0_AFEM1_AFEM1_ASEM1_CLR0_CADS0_DTLA0_DTLB0_DTVA0_DTVB0_EPS0_FDSI1_GRPM1_GRVWA2_GRVWB4_GSUn1_GSUAMBSK_GSUC1_GSUWGMRR1_GLS0_ISA950_IU1_K1_LDSTI0_LBSPPA128_LBSPPB5120_LBSPPM0_LPA8_LPB16_LPM0_LRVW4_LWPMn1_MIAV0_MIWT13_5_MO40_NTn1_NTA0_NTB0_NTC0_NTD4_NTM0_NEPBS13_NLCA1_NLCB5_ONLL1_PGR2_PLR0_PKA1_SIA3_SS1_SU16_SUM0_SUS128_SPO0_SRVW0_SSO0_SVW1_SK0_SKFTR0_SKXCCM0_TLDS1_ULSGRO0_USL1_UIOFGRO0_USFGROn1_VSn1_VWA1_VWB1_WSGRA0_WSGRB0_WS64_WG16_16_1_WGM1_WGMXCC8_WGMXCCGn1
    SolutionIndex: 37
    SolutionNameMin: Cijk_Alik_Bjlk_S_MX_B_Bias_HA_S_SAV_UserArgs_MT224x256x32_MI16x16x1_SN_LDSB0_AFC0_AFEM1_AFEM1_ASEM1_CLR0_CADS0_DTLA0_DTLB0_DTVA0_DTVB0_EPS0_FDSI1_GRPM1_GRVWA4_GRVWB4_GSUn1_GSUAMBSK_GSUC1_GSUWGMRR1_GLS0_ISA950_IU1_K1_LDSTI0_LBSPPA256_LBSPPB4096_LBSPPM0_LPA8_LPB0_LPM0_LRVW4_LWPMn1_MIAV0_MIWT14_4_MO40_NTn1_NTA0_NTB0_NTC0_NTD4_NTM0_NEPBS14_NLCA1_NLCB1_ONLL1_PGR2_PLR0_PKA1_SIA3_SS1_SU16_SUM0_SUS128_SPO0_SRVW0_SSO0_SVW2_SK0_SKFTR0_SKXCCM0_TLDS1_ULSGRO0_USL1_UIOFGRO0_USFGROn1_VSn1_VWA2_VWB4_WSGRA0_WSGRB0_WS64_WG16_16_1_WGM4_WGMXCC8_WGMXCCGn1
    SolutionIndex: 38
    SolutionNameMin: Cijk_Alik_Bjlk_S_MX_B_Bias_HA_S_SAV_UserArgs_MT224x256x32_MI16x16x1_SN_LDSB0_AFC0_AFEM1_AFEM1_ASEM1_CLR0_CADS0_DTLA0_DTLB0_DTVA0_DTVB0_EPS0_FDSI1_GRPM1_GRVWA4_GRVWB4_GSUn1_GSUAMBSK_GSUC1_GSUWGMRR1_GLS0_ISA950_IU1_K1_LDSTI0_LBSPPA256_LBSPPB4096_LBSPPM0_LPA8_LPB0_LPM0_LRVW4_LWPMn1_MIAV0_MIWT14_4_MO40_NTn1_NTA0_NTB0_NTC0_NTD4_NTM0_NEPBS14_NLCA1_NLCB1_ONLL1_PGR2_PLR0_PKA1_SIA3_SS1_SU16_SUM0_SUS128_SPO0_SRVW0_SSO0_SVW2_SK0_SKFTR0_SKXCCM0_TLDS1_ULSGRO0_USL1_UIOFGRO0_USFGROn1_VSn1_VWA2_VWB4_WSGRA0_WSGRB0_WS64_WG16_16_1_WGM1_WGMXCC8_WGMXCCGn1
    SolutionIndex: 39
    SolutionNameMin: Cijk_Alik_Bjlk_S_MX_B_Bias_HA_S_SAV_UserArgs_MT160x256x32_MI16x16x1_SN_LDSB0_AFC0_AFEM1_AFEM1_ASEM1_CLR0_CADS0_DTLA0_DTLB0_DTVA0_DTVB0_EPS0_FDSI1_GRPM1_GRVWA4_GRVWB4_GSUn1_GSUAMBSK_GSUC1_GSUWGMRR1_GLS0_ISA950_IU1_K1_LDSTI0_LBSPPA256_LBSPPB4096_LBSPPM0_LPA8_LPB0_LPM0_LRVW4_LWPMn1_MIAV0_MIWT10_4_MO40_NTn1_NTA0_NTB0_NTC0_NTD4_NTM0_NEPBS10_NLCA1_NLCB1_ONLL1_PGR2_PLR0_PKA1_SIA3_SS1_SU16_SUM0_SUS128_SPO0_SRVW0_SSO0_SVW2_SK0_SKFTR0_SKXCCM0_TLDS1_ULSGRO0_USL1_UIOFGRO0_USFGROn1_VSn1_VWA2_VWB4_WSGRA0_WSGRB0_WS64_WG16_16_1_WGM4_WGMXCC8_WGMXCCGn1
    SolutionIndex: 40
    SolutionNameMin: Cijk_Alik_Bjlk_S_MX_B_Bias_HA_S_SAV_UserArgs_MT160x256x32_MI16x16x1_SN_LDSB0_AFC0_AFEM1_AFEM1_ASEM1_CLR0_CADS0_DTLA0_DTLB0_DTVA0_DTVB0_EPS0_FDSI1_GRPM1_GRVWA4_GRVWB4_GSUn1_GSUAMBSK_GSUC1_GSUWGMRR1_GLS0_ISA950_IU1_K1_LDSTI0_LBSPPA256_LBSPPB4096_LBSPPM0_LPA8_LPB0_LPM0_LRVW4_LWPMn1_MIAV0_MIWT10_4_MO40_NTn1_NTA0_NTB0_NTC0_NTD4_NTM0_NEPBS10_NLCA1_NLCB1_ONLL1_PGR2_PLR0_PKA1_SIA3_SS1_SU16_SUM0_SUS128_SPO0_SRVW0_SSO0_SVW2_SK0_SKFTR0_SKXCCM0_TLDS1_ULSGRO0_USL1_UIOFGRO0_USFGROn1_VSn1_VWA2_VWB4_WSGRA0_WSGRB0_WS64_WG16_16_1_WGM8_WGMXCC8_WGMXCCGn1
    SolutionIndex: 41
    SolutionNameMin: Cijk_Alik_Bjlk_S_MX_B_Bias_HA_S_SAV_UserArgs_MT256x144x32_MI16x16x1_SN_LDSB0_AFC0_AFEM1_AFEM1_ASEM1_CLR0_CADS0_DTLA0_DTLB0_DTVA0_DTVB0_EPS0_FDSI1_GRPM1_GRVWA4_GRVWB2_GSUn1_GSUAMBSK_GSUC1_GSUWGMRR1_GLS0_ISA950_IU1_K1_LDSTI0_LBSPPA512_LBSPPB2304_LBSPPM0_LPA8_LPB16_LPM0_LRVW4_LWPMn1_MIAV0_MIWT4_9_MO40_NTn1_NTA0_NTB0_NTC0_NTD4_NTM0_NEPBS8_NLCA1_NLCB9_ONLL1_PGR2_PLR0_PKA1_SIA3_SS1_SU16_SUM0_SUS128_SPO0_SRVW0_SSO0_SVW4_SK0_SKFTR0_SKXCCM0_TLDS1_ULSGRO0_USL1_UIOFGRO0_USFGROn1_VSn1_VWA4_VWB1_WSGRA0_WSGRB0_WS64_WG64_4_1_WGM8_WGMXCC8_WGMXCCGn1
    SolutionIndex: 42
    SolutionNameMin: Cijk_Alik_Bjlk_S_MX_B_Bias_HA_S_SAV_UserArgs_MT192x320x32_MI16x16x1_SN_LDSB1_AFC0_AFEM1_AFEM1_ASEM1_CLR0_CADS0_DTLA0_DTLB0_DTVA0_DTVB0_EPS0_FDSI1_GRPM1_GRVWA4_GRVWB4_GSUn1_GSUAMBSK_GSUC1_GSUWGMRR1_GLS0_ISA950_IU1_K1_LDSTI0_LBSPPA256_LBSPPB5120_LBSPPM0_LPA8_LPB0_LPM0_LRVW4_LWPMn1_MIAV0_MIWT6_10_MO40_NTn1_NTA0_NTB0_NTC0_NTD4_NTM0_NEPBS6_NLCA1_NLCB5_ONLL1_PGR2_PLR0_PKA1_SIA3_SS1_SU16_SUM0_SUS128_SPO0_SRVW0_SSO0_SVW2_SK0_SKFTR0_SKXCCM0_TLDS1_ULSGRO0_USL1_UIOFGRO0_USFGROn1_VSn1_VWA2_VWB2_WSGRA0_WSGRB0_WS64_WG32_8_1_WGM1_WGMXCC8_WGMXCCGn1
    SolutionIndex: 43
    SolutionNameMin: Cijk_Alik_Bjlk_S_MX_B_Bias_HA_S_SAV_UserArgs_MT192x320x32_MI16x16x1_SN_LDSB1_AFC0_AFEM1_AFEM1_ASEM1_CLR0_CADS0_DTLA0_DTLB0_DTVA0_DTVB0_EPS0_FDSI1_GRPM1_GRVWA4_GRVWB4_GSUn1_GSUAMBSK_GSUC1_GSUWGMRR1_GLS0_ISA950_IU1_K1_LDSTI0_LBSPPA256_LBSPPB5120_LBSPPM0_LPA8_LPB0_LPM0_LRVW4_LWPMn1_MIAV0_MIWT6_10_MO40_NTn1_NTA0_NTB0_NTC0_NTD4_NTM0_NEPBS6_NLCA1_NLCB5_ONLL1_PGR2_PLR0_PKA1_SIA3_SS1_SU16_SUM0_SUS128_SPO0_SRVW0_SSO0_SVW2_SK0_SKFTR0_SKXCCM0_TLDS1_ULSGRO0_USL1_UIOFGRO0_USFGROn1_VSn1_VWA2_VWB2_WSGRA0_WSGRB0_WS64_WG32_8_1_WGM4_WGMXCC8_WGMXCCGn1
    SolutionIndex: 44
    SolutionNameMin: Cijk_Alik_Bjlk_S_MX_B_Bias_HA_S_SAV_UserArgs_MT224x256x32_MI16x16x1_SN_LDSB0_AFC0_AFEM1_AFEM1_ASEM1_CLR0_CADS0_DTLA0_DTLB0_DTVA0_DTVB0_EPS0_FDSI1_GRPM1_GRVWA4_GRVWB4_GSUn1_GSUAMBSK_GSUC1_GSUWGMRR1_GLS0_ISA950_IU1_K1_LDSTI0_LBSPPA256_LBSPPB4096_LBSPPM0_LPA8_LPB0_LPM0_LRVW4_LWPMn1_MIAV0_MIWT14_4_MO40_NTn1_NTA0_NTB0_NTC0_NTD4_NTM0_NEPBS14_NLCA1_NLCB1_ONLL1_PGR2_PLR0_PKA1_SIA3_SS1_SU16_SUM0_SUS128_SPO0_SRVW0_SSO0_SVW2_SK0_SKFTR0_SKXCCM0_TLDS1_ULSGRO0_USL1_UIOFGRO0_USFGROn1_VSn1_VWA2_VWB4_WSGRA0_WSGRB0_WS64_WG16_16_1_WGM8_WGMXCC8_WGMXCCGn1
    SolutionIndex: 45
    SolutionNameMin: Cijk_Alik_Bjlk_S_MX_B_Bias_HA_S_SAV_UserArgs_MT256x160x32_MI16x16x1_SN_LDSB0_AFC0_AFEM1_AFEM1_ASEM1_CLR0_CADS0_DTLA0_DTLB0_DTVA0_DTVB0_EPS0_FDSI1_GRPM1_GRVWA4_GRVWB4_GSUn1_GSUAMBSK_GSUC1_GSUWGMRR1_GLS0_ISA950_IU1_K1_LDSTI0_LBSPPA512_LBSPPB2560_LBSPPM0_LPA8_LPB0_LPM0_LRVW4_LWPMn1_MIAV0_MIWT4_10_MO40_NTn1_NTA0_NTB0_NTC0_NTD4_NTM0_NEPBS8_NLCA1_NLCB5_ONLL1_PGR2_PLR0_PKA1_SIA3_SS1_SU16_SUM0_SUS128_SPO0_SRVW0_SSO0_SVW4_SK0_SKFTR0_SKXCCM0_TLDS1_ULSGRO0_USL1_UIOFGRO0_USFGROn1_VSn1_VWA4_VWB2_WSGRA0_WSGRB0_WS64_WG64_4_1_WGM1_WGMXCC8_WGMXCCGn1
    SolutionIndex: 46
    SolutionNameMin: Cijk_Alik_Bjlk_S_MX_B_Bias_HA_S_SAV_UserArgs_MT256x224x32_MI16x16x1_SN_LDSB0_AFC0_AFEM1_AFEM1_ASEM1_CLR0_CADS0_DTLA0_DTLB0_DTVA0_DTVB0_EPS0_FDSI1_GRPM1_GRVWA4_GRVWB4_GSUn1_GSUAMBSK_GSUC1_GSUWGMRR1_GLS0_ISA950_IU1_K1_LDSTI0_LBSPPA512_LBSPPB3584_LBSPPM0_LPA8_LPB0_LPM0_LRVW4_LWPMn1_MIAV0_MIWT4_14_MO40_NTn1_NTA0_NTB0_NTC0_NTD4_NTM0_NEPBS8_NLCA1_NLCB7_ONLL1_PGR2_PLR0_PKA1_SIA3_SS1_SU16_SUM0_SUS128_SPO0_SRVW0_SSO0_SVW4_SK0_SKFTR0_SKXCCM0_TLDS1_ULSGRO0_USL1_UIOFGRO0_USFGROn1_VSn1_VWA4_VWB2_WSGRA0_WSGRB0_WS64_WG64_4_1_WGM1_WGMXCC8_WGMXCCGn1
    SolutionIndex: 47
    SolutionNameMin: Cijk_Alik_Bjlk_S_MX_B_Bias_HA_S_SAV_UserArgs_MT256x224x32_MI16x16x1_SN_LDSB0_AFC0_AFEM1_AFEM1_ASEM1_CLR0_CADS0_DTLA0_DTLB0_DTVA0_DTVB0_EPS0_FDSI1_GRPM1_GRVWA4_GRVWB4_GSUn1_GSUAMBSK_GSUC1_GSUWGMRR1_GLS0_ISA950_IU1_K1_LDSTI0_LBSPPA512_LBSPPB3584_LBSPPM0_LPA8_LPB0_LPM0_LRVW4_LWPMn1_MIAV0_MIWT4_14_MO40_NTn1_NTA0_NTB0_NTC0_NTD4_NTM0_NEPBS8_NLCA1_NLCB7_ONLL1_PGR2_PLR0_PKA1_SIA3_SS1_SU16_SUM0_SUS128_SPO0_SRVW0_SSO0_SVW4_SK0_SKFTR0_SKXCCM0_TLDS1_ULSGRO0_USL1_UIOFGRO0_USFGROn1_VSn1_VWA4_VWB2_WSGRA0_WSGRB0_WS64_WG64_4_1_WGM4_WGMXCC8_WGMXCCGn1
    SolutionIndex: 48
    SolutionNameMin: Cijk_Alik_Bjlk_S_MX_B_Bias_HA_S_SAV_UserArgs_MT128x192x32_MI16x16x1_SN_LDSB1_AFC0_AFEM1_AFEM1_ASEM1_CLR0_CADS0_DTLA0_DTLB0_DTVA0_DTVB0_EPS0_FDSI1_GRPM1_GRVWA4_GRVWB4_GSUn1_GSUAMBSK_GSUC1_GSUWGMRR1_GLS0_ISA950_IU1_K1_LDSTI0_LBSPPA512_LBSPPB3072_LBSPPM0_LPA8_LPB0_LPM0_LRVW4_LWPMn1_MIAV0_MIWT4_6_MO40_NTn1_NTA0_NTB0_NTC0_NTD4_NTM0_NEPBS8_NLCA1_NLCB3_ONLL1_PGR2_PLR0_PKA1_SIA3_SS1_SU16_SUM0_SUS128_SPO0_SRVW0_SSO0_SVW4_SK0_SKFTR0_SKXCCM0_TLDS1_ULSGRO0_USL1_UIOFGRO0_USFGROn1_VSn1_VWA4_VWB2_WSGRA0_WSGRB0_WS64_WG32_8_1_WGM1_WGMXCC8_WGMXCCGn1
    SolutionIndex: 49
    SolutionNameMin: Cijk_Alik_Bjlk_S_MX_B_Bias_HA_S_SAV_UserArgs_MT256x160x32_MI16x16x1_SN_LDSB0_AFC0_AFEM1_AFEM1_ASEM1_CLR0_CADS0_DTLA0_DTLB0_DTVA0_DTVB0_EPS0_FDSI1_GRPM1_GRVWA4_GRVWB4_GSUn1_GSUAMBSK_GSUC1_GSUWGMRR1_GLS0_ISA950_IU1_K1_LDSTI0_LBSPPA512_LBSPPB2560_LBSPPM0_LPA8_LPB0_LPM0_LRVW4_LWPMn1_MIAV0_MIWT4_10_MO40_NTn1_NTA0_NTB0_NTC0_NTD4_NTM0_NEPBS8_NLCA1_NLCB5_ONLL1_PGR2_PLR0_PKA1_SIA3_SS1_SU16_SUM0_SUS128_SPO0_SRVW0_SSO0_SVW4_SK0_SKFTR0_SKXCCM0_TLDS1_ULSGRO0_USL1_UIOFGRO0_USFGROn1_VSn1_VWA4_VWB2_WSGRA0_WSGRB0_WS64_WG64_4_1_WGM4_WGMXCC8_WGMXCCGn1
    SolutionIndex: 50
    SolutionNameMin: Cijk_Alik_Bjlk_S_MX_B_Bias_HA_S_SAV_UserArgs_MT256x144x32_MI16x16x1_SN_LDSB0_AFC0_AFEM1_AFEM1_ASEM1_CLR0_CADS0_DTLA0_DTLB0_DTVA0_DTVB0_EPS0_FDSI1_GRPM1_GRVWA4_GRVWB2_GSUn1_GSUAMBSK_GSUC1_GSUWGMRR1_GLS0_ISA950_IU1_K1_LDSTI0_LBSPPA512_LBSPPB2304_LBSPPM0_LPA8_LPB16_LPM0_LRVW4_LWPMn1_MIAV0_MIWT4_9_MO40_NTn1_NTA0_NTB0_NTC0_NTD4_NTM0_NEPBS8_NLCA1_NLCB9_ONLL1_PGR2_PLR0_PKA1_SIA3_SS1_SU16_SUM0_SUS128_SPO0_SRVW0_SSO0_SVW4_SK0_SKFTR0_SKXCCM0_TLDS1_ULSGRO0_USL1_UIOFGRO0_USFGROn1_VSn1_VWA4_VWB1_WSGRA0_WSGRB0_WS64_WG64_4_1_WGM4_WGMXCC8_WGMXCCGn1
    SolutionIndex: 52
    SolutionNameMin: Cijk_Alik_Bjlk_S_MX_B_Bias_HA_S_SAV_UserArgs_MT256x160x32_MI16x16x1_SN_LDSB0_AFC0_AFEM1_AFEM1_ASEM1_CLR0_CADS0_DTLA0_DTLB0_DTVA0_DTVB0_EPS0_FDSI1_GRPM1_GRVWA4_GRVWB4_GSUn1_GSUAMBSK_GSUC1_GSUWGMRR1_GLS0_ISA950_IU1_K1_LDSTI0_LBSPPA512_LBSPPB2560_LBSPPM0_LPA8_LPB0_LPM0_LRVW4_LWPMn1_MIAV0_MIWT4_10_MO40_NTn1_NTA0_NTB0_NTC0_NTD4_NTM0_NEPBS8_NLCA1_NLCB5_ONLL1_PGR2_PLR0_PKA1_SIA3_SS1_SU16_SUM0_SUS128_SPO0_SRVW0_SSO0_SVW4_SK0_SKFTR0_SKXCCM0_TLDS1_ULSGRO0_USL1_UIOFGRO0_USFGROn1_VSn1_VWA4_VWB2_WSGRA0_WSGRB0_WS64_WG64_4_1_WGM8_WGMXCC8_WGMXCCGn1
    SolutionIndex: 53
    SolutionNameMin: Cijk_Alik_Bjlk_S_MX_B_Bias_HA_S_SAV_UserArgs_MT256x224x32_MI16x16x1_SN_LDSB0_AFC0_AFEM1_AFEM1_ASEM1_CLR0_CADS0_DTLA0_DTLB0_DTVA0_DTVB0_EPS0_FDSI1_GRPM1_GRVWA4_GRVWB4_GSUn1_GSUAMBSK_GSUC1_GSUWGMRR1_GLS0_ISA950_IU1_K1_LDSTI0_LBSPPA512_LBSPPB3584_LBSPPM0_LPA8_LPB0_LPM0_LRVW4_LWPMn1_MIAV0_MIWT4_14_MO40_NTn1_NTA0_NTB0_NTC0_NTD4_NTM0_NEPBS8_NLCA1_NLCB7_ONLL1_PGR2_PLR0_PKA1_SIA3_SS1_SU16_SUM0_SUS128_SPO0_SRVW0_SSO0_SVW4_SK0_SKFTR0_SKXCCM0_TLDS1_ULSGRO0_USL1_UIOFGRO0_USFGROn1_VSn1_VWA4_VWB2_WSGRA0_WSGRB0_WS64_WG64_4_1_WGM8_WGMXCC8_WGMXCCGn1
    SolutionIndex: 54
    SolutionNameMin: Cijk_Alik_Bjlk_S_MX_B_Bias_HA_S_SAV_UserArgs_MT192x192x32_MI16x16x1_SN_LDSB0_AFC0_AFEM1_AFEM1_ASEM1_CLR0_CADS0_DTLA0_DTLB0_DTVA0_DTVB0_EPS0_FDSI1_GRPM1_GRVWA4_GRVWB4_GSUn1_GSUAMBSK_GSUC1_GSUWGMRR1_GLS0_ISA950_IU1_K1_LDSTI0_LBSPPA512_LBSPPB3072_LBSPPM0_LPA8_LPB16_LPM0_LRVW4_LWPMn1_MIAV0_MIWT12_3_MO40_NTn1_NTA0_NTB0_NTC0_NTD4_NTM0_NEPBS12_NLCA1_NLCB3_ONLL1_PGR2_PLR0_PKA1_SIA3_SS1_SU16_SUM0_SUS128_SPO0_SRVW0_SSO0_SVW4_SK0_SKFTR0_SKXCCM0_TLDS1_ULSGRO0_USL1_UIOFGRO0_USFGROn1_VSn1_VWA4_VWB1_WSGRA0_WSGRB0_WS64_WG16_16_1_WGM4_WGMXCC8_WGMXCCGn1
    SolutionIndex: 56
    SolutionNameMin: Cijk_Alik_Bjlk_S_MX_B_Bias_HA_S_SAV_UserArgs_MT128x160x64_MI16x16x1_SN_LDSB1_AFC0_AFEM1_AFEM1_ASEM1_CLR1_CADS0_DTLA0_DTLB0_DTVA0_DTVB0_EPS0_FDSI1_GRPM1_GRVWA4_GRVWB4_GSUn1_GSUAMBSK_GSUC1_GSUWGMRR1_GLS0_ISA950_IU1_K1_LDSTI0_LBSPPA1024_LBSPPB2560_LBSPPM0_LPA8_LPB16_LPM0_LRVW4_LWPMn1_MIAV0_MIWT4_5_MO40_NTn1_NTA0_NTB0_NTC0_NTD4_NTM0_NEPBS8_NLCA1_NLCB5_ONLL1_PGR2_PLR1_PKA1_SIA3_SS1_SU16_SUM0_SUS256_SPO0_SRVW0_SSO0_SVW4_SK0_SKFTR0_SKXCCM0_TLDS1_ULSGRO0_USL1_UIOFGRO0_USFGROn1_VSn1_VWA4_VWB1_WSGRA0_WSGRB0_WS64_WG32_8_1_WGM4_WGMXCC8_WGMXCCGn1
    SolutionIndex: 57
    SolutionNameMin: Cijk_Alik_Bjlk_S_MX_B_Bias_HA_S_SAV_UserArgs_MT96x32x128_MI16x16x1_SN_LDSB1_AFC0_AFEM1_AFEM1_ASEM1_CLR1_CADS0_DTLA0_DTLB0_DTVA0_DTVB0_EPS0_FDSI1_GRPM1_GRVWA4_GRVWB4_GSUn1_GSUAMBSK_GSUC1_GSUWGMRR1_GLS0_ISA950_IU1_K1_LDSTI0_LBSPPA512_LBSPPB512_LBSPPM0_LPA8_LPB16_LPM0_LRVW4_LWPMn1_MIAV0_MIWT3_1_MO40_NTn1_NTA0_NTB0_NTC0_NTD4_NTM0_NEPBS6_NLCA1_NLCB1_ONLL1_PGR2_PLR1_PKA1_SIA3_SS1_SU16_SUM0_SUS512_SPO0_SRVW0_SSO0_SVW1_SK0_SKFTR0_SKXCCM0_TLDS1_ULSGRO0_USL1_UIOFGRO0_USFGROn1_VSn1_VWA1_VWB1_WSGRA0_WSGRB0_WS64_WG32_8_1_WGM1_WGMXCC8_WGMXCCGn1
    SolutionIndex: 58
    SolutionNameMin: Cijk_Alik_Bjlk_S_MX_B_Bias_HA_S_SAV_UserArgs_MT128x160x64_MI16x16x1_SN_LDSB1_AFC0_AFEM1_AFEM1_ASEM1_CLR1_CADS0_DTLA0_DTLB0_DTVA0_DTVB0_EPS0_FDSI1_GRPM1_GRVWA4_GRVWB4_GSUn1_GSUAMBSK_GSUC1_GSUWGMRR1_GLS0_ISA950_IU1_K1_LDSTI0_LBSPPA1024_LBSPPB2560_LBSPPM0_LPA8_LPB16_LPM0_LRVW4_LWPMn1_MIAV0_MIWT4_5_MO40_NTn1_NTA0_NTB0_NTC0_NTD4_NTM0_NEPBS8_NLCA1_NLCB5_ONLL1_PGR2_PLR1_PKA1_SIA3_SS1_SU16_SUM0_SUS256_SPO0_SRVW0_SSO0_SVW4_SK0_SKFTR0_SKXCCM0_TLDS1_ULSGRO0_USL1_UIOFGRO0_USFGROn1_VSn1_VWA4_VWB1_WSGRA0_WSGRB0_WS64_WG32_8_1_WGM1_WGMXCC8_WGMXCCGn1
    SolutionIndex: 60
    SolutionNameMin: Cijk_Alik_Bjlk_S_MX_B_Bias_HA_S_SAV_UserArgs_MT256x48x64_MI16x16x1_SN_LDSB1_AFC0_AFEM1_AFEM1_ASEM1_CLR1_CADS0_DTLA0_DTLB0_DTVA0_DTVB0_EPS0_FDSI1_GRPM1_GRVWA4_GRVWB4_GSUn1_GSUAMBSK_GSUC1_GSUWGMRR1_GLS0_ISA950_IU1_K1_LDSTI0_LBSPPA1024_LBSPPB768_LBSPPM0_LPA8_LPB16_LPM0_LRVW4_LWPMn1_MIAV0_MIWT4_3_MO40_NTn1_NTA0_NTB0_NTC0_NTD4_NTM0_NEPBS8_NLCA1_NLCB3_ONLL1_PGR2_PLR1_PKA1_SIA3_SS1_SU16_SUM0_SUS256_SPO0_SRVW0_SSO0_SVW4_SK0_SKFTR0_SKXCCM0_TLDS1_ULSGRO0_USL1_UIOFGRO0_USFGROn1_VSn1_VWA4_VWB1_WSGRA0_WSGRB0_WS64_WG64_4_1_WGM1_WGMXCC8_WGMXCCGn1
    SolutionIndex: 61
    SolutionNameMin: Cijk_Alik_Bjlk_S_MX_B_Bias_HA_S_SAV_UserArgs_MT16x96x128_MI16x16x1_SN_LDSB1_AFC0_AFEM1_AFEM1_ASEM1_CLR1_CADS0_DTLA0_DTLB0_DTVA0_DTVB0_EPS0_FDSI1_GRPM1_GRVWA4_GRVWB4_GSUn1_GSUAMBSK_GSUC1_GSUWGMRR1_GLS0_ISA950_IU1_K1_LDSTI0_LBSPPA512_LBSPPB1536_LBSPPM0_LPA8_LPB16_LPM0_LRVW4_LWPMn1_MIAV0_MIWT1_3_MO40_NTn1_NTA0_NTB0_NTC0_NTD4_NTM0_NEPBS8_NLCA1_NLCB3_ONLL1_PGR2_PLR1_PKA1_SIA3_SS1_SU16_SUM0_SUS512_SPO0_SRVW0_SSO0_SVW1_SK0_SKFTR0_SKXCCM0_TLDS1_ULSGRO0_USL1_UIOFGRO0_USFGROn1_VSn1_VWA1_VWB1_WSGRA0_WSGRB0_WS64_WG16_8_2_WGM1_WGMXCC8_WGMXCCGn1
    SolutionIndex: 64
    SolutionNameMin: Cijk_Alik_Bjlk_S_MX_B_Bias_HA_S_SAV_UserArgs_MT32x128x64_MI16x16x1_SN_LDSB1_AFC0_AFEM1_AFEM1_ASEM1_CLR1_CADS0_DTLA0_DTLB0_DTVA0_DTVB0_EPS0_FDSI1_GRPM1_GRVWA4_GRVWB4_GSUn1_GSUAMBSK_GSUC1_GSUWGMRR1_GLS0_ISA950_IU1_K1_LDSTI0_LBSPPA512_LBSPPB2048_LBSPPM0_LPA8_LPB0_LPM0_LRVW4_LWPMn1_MIAV0_MIWT2_2_MO40_NTn1_NTA0_NTB0_NTC0_NTD4_NTM0_NEPBS8_NLCA1_NLCB1_ONLL1_PGR2_PLR1_PKA1_SIA3_SS1_SU16_SUM0_SUS256_SPO0_SRVW0_SSO0_SVW2_SK0_SKFTR0_SKXCCM0_TLDS1_ULSGRO0_USL1_UIOFGRO0_USFGROn1_VSn1_VWA2_VWB2_WSGRA0_WSGRB0_WS64_WG16_16_1_WGM1_WGMXCC8_WGMXCCGn1
    SolutionIndex: 66
    SolutionNameMin: Cijk_Alik_Bjlk_S_MX_B_Bias_HA_S_SAV_UserArgs_MT48x64x128_MI16x16x1_SN_LDSB1_AFC0_AFEM1_AFEM1_ASEM1_CLR1_CADS0_DTLA0_DTLB0_DTVA0_DTVB0_EPS0_FDSI1_GRPM1_GRVWA4_GRVWB4_GSUn1_GSUAMBSK_GSUC1_GSUWGMRR1_GLS0_ISA950_IU1_K1_LDSTI0_LBSPPA512_LBSPPB1024_LBSPPM0_LPA8_LPB16_LPM0_LRVW4_LWPMn1_MIAV0_MIWT3_1_MO40_NTn1_NTA0_NTB0_NTC0_NTD4_NTM0_NEPBS6_NLCA1_NLCB1_ONLL1_PGR2_PLR1_PKA1_SIA3_SS1_SU16_SUM0_SUS512_SPO0_SRVW0_SSO0_SVW1_SK0_SKFTR0_SKXCCM0_TLDS1_ULSGRO0_USL1_UIOFGRO0_USFGROn1_VSn1_VWA1_VWB1_WSGRA0_WSGRB0_WS64_WG16_16_1_WGM1_WGMXCC8_WGMXCCGn1
    SolutionIndex: 67
    SolutionNameMin: Cijk_Alik_Bjlk_S_MX_B_Bias_HA_S_SAV_UserArgs_MT48x64x64_MI16x16x1_SN_LDSB1_AFC0_AFEM1_AFEM1_ASEM1_CLR1_CADS0_DTLA0_DTLB0_DTVA0_DTVB0_EPS0_FDSI1_GRPM1_GRVWA4_GRVWB4_GSUn1_GSUAMBSK_GSUC1_GSUWGMRR1_GLS0_ISA950_IU1_K1_LDSTI0_LBSPPA256_LBSPPB1024_LBSPPM0_LPA8_LPB16_LPM0_LRVW4_LWPMn1_MIAV0_MIWT3_1_MO40_NTn1_NTA0_NTB0_NTC0_NTD4_NTM0_NEPBS6_NLCA1_NLCB1_ONLL1_PGR2_PLR1_PKA1_SIA3_SS1_SU16_SUM0_SUS256_SPO0_SRVW0_SSO0_SVW1_SK0_SKFTR0_SKXCCM0_TLDS1_ULSGRO0_USL1_UIOFGRO0_USFGROn1_VSn1_VWA1_VWB1_WSGRA0_WSGRB0_WS64_WG16_16_1_WGM1_WGMXCC8_WGMXCCGn1
    SolutionIndex: 68
    SolutionNameMin: Cijk_Alik_Bjlk_S_MX_B_Bias_HA_S_SAV_UserArgs_MT48x192x64_MI16x16x1_SN_LDSB1_AFC0_AFEM1_AFEM1_ASEM1_CLR1_CADS0_DTLA0_DTLB0_DTVA0_DTVB0_EPS0_FDSI1_GRPM1_GRVWA4_GRVWB4_GSUn1_GSUAMBSK_GSUC1_GSUWGMRR1_GLS0_ISA950_IU1_K1_LDSTI0_LBSPPA256_LBSPPB3072_LBSPPM0_LPA8_LPB16_LPM0_LRVW4_LWPMn1_MIAV0_MIWT3_3_MO40_NTn1_NTA0_NTB0_NTC0_NTD4_NTM0_NEPBS6_NLCA1_NLCB3_ONLL1_PGR2_PLR1_PKA1_SIA3_SS1_SU16_SUM0_SUS256_SPO0_SRVW0_SSO0_SVW1_SK0_SKFTR0_SKXCCM0_TLDS1_ULSGRO0_USL1_UIOFGRO0_USFGROn1_VSn1_VWA1_VWB1_WSGRA0_WSGRB0_WS64_WG16_16_1_WGM1_WGMXCC8_WGMXCCGn1
    SolutionIndex: 69
    SolutionNameMin: Cijk_Alik_Bjlk_S_MX_B_Bias_HA_S_SAV_UserArgs_MT48x128x64_MI16x16x1_SN_LDSB1_AFC0_AFEM1_AFEM1_ASEM1_CLR1_CADS0_DTLA0_DTLB0_DTVA0_DTVB0_EPS0_FDSI1_GRPM1_GRVWA4_GRVWB4_GSUn1_GSUAMBSK_GSUC1_GSUWGMRR1_GLS0_ISA950_IU1_K1_LDSTI0_LBSPPA256_LBSPPB2048_LBSPPM0_LPA8_LPB0_LPM0_LRVW4_LWPMn1_MIAV0_MIWT3_2_MO40_NTn1_NTA0_NTB0_NTC0_NTD4_NTM0_NEPBS6_NLCA1_NLCB1_ONLL1_PGR2_PLR1_PKA1_SIA3_SS1_SU16_SUM0_SUS256_SPO0_SRVW0_SSO0_SVW1_SK0_SKFTR0_SKXCCM0_TLDS1_ULSGRO0_USL1_UIOFGRO0_USFGROn1_VSn1_VWA1_VWB2_WSGRA0_WSGRB0_WS64_WG16_16_1_WGM1_WGMXCC8_WGMXCCGn1
    SolutionIndex: 70
    SolutionNameMin: Cijk_Alik_Bjlk_S_MX_B_Bias_HA_S_SAV_UserArgs_MT64x32x128_MI16x16x1_SN_LDSB1_AFC0_AFEM1_AFEM1_ASEM1_CLR1_CADS0_DTLA0_DTLB0_DTVA0_DTVB0_EPS0_FDSI1_GRPM1_GRVWA4_GRVWB4_GSUn1_GSUAMBSK_GSUC1_GSUWGMRR1_GLS0_ISA950_IU1_K1_LDSTI0_LBSPPA1024_LBSPPB512_LBSPPM0_LPA8_LPB16_LPM0_LRVW4_LWPMn1_MIAV0_MIWT2_1_MO40_NTn1_NTA0_NTB0_NTC0_NTD4_NTM0_NEPBS8_NLCA1_NLCB1_ONLL1_PGR2_PLR1_PKA1_SIA3_SS1_SU16_SUM0_SUS512_SPO0_SRVW0_SSO0_SVW2_SK0_SKFTR0_SKXCCM0_TLDS1_ULSGRO0_USL1_UIOFGRO0_USFGROn1_VSn1_VWA2_VWB1_WSGRA0_WSGRB0_WS64_WG32_8_1_WGM1_WGMXCC8_WGMXCCGn1
    SolutionIndex: 71
    SolutionNameMin: Cijk_Alik_Bjlk_S_MX_B_Bias_HA_S_SAV_UserArgs_MT64x64x128_MI16x16x1_SN_LDSB1_AFC0_AFEM1_AFEM1_ASEM1_CLR1_CADS0_DTLA0_DTLB0_DTVA0_DTVB0_EPS0_FDSI1_GRPM1_GRVWA4_GRVWB4_GSUn1_GSUAMBSK_GSUC1_GSUWGMRR1_GLS0_ISA950_IU1_K1_LDSTI0_LBSPPA1024_LBSPPB1024_LBSPPM0_LPA8_LPB0_LPM0_LRVW4_LWPMn1_MIAV0_MIWT2_2_MO40_NTn1_NTA0_NTB0_NTC0_NTD4_NTM0_NEPBS8_NLCA1_NLCB1_ONLL1_PGR2_PLR1_PKA1_SIA3_SS1_SU16_SUM0_SUS512_SPO0_SRVW0_SSO0_SVW2_SK0_SKFTR0_SKXCCM0_TLDS1_ULSGRO0_USL1_UIOFGRO0_USFGROn1_VSn1_VWA2_VWB2_WSGRA0_WSGRB0_WS64_WG32_8_1_WGM1_WGMXCC8_WGMXCCGn1
    SolutionIndex: 72
    SolutionNameMin: Cijk_Alik_Bjlk_S_MX_B_Bias_HA_S_SAV_UserArgs_MT64x128x64_MI16x16x1_SN_LDSB1_AFC0_AFEM1_AFEM1_ASEM1_CLR1_CADS0_DTLA0_DTLB0_DTVA0_DTVB0_EPS0_FDSI1_GRPM1_GRVWA4_GRVWB4_GSUn1_GSUAMBSK_GSUC1_GSUWGMRR1_GLS0_ISA950_IU1_K1_LDSTI0_LBSPPA1024_LBSPPB2048_LBSPPM0_LPA8_LPB0_LPM0_LRVW4_LWPMn1_MIAV0_MIWT4_2_MO40_NTn1_NTA0_NTB0_NTC0_NTD4_NTM0_NEPBS8_NLCA1_NLCB1_ONLL1_PGR2_PLR1_PKA1_SIA3_SS1_SU16_SUM0_SUS256_SPO0_SRVW0_SSO0_SVW4_SK0_SKFTR0_SKXCCM0_TLDS1_ULSGRO0_USL1_UIOFGRO0_USFGROn1_VSn1_VWA4_VWB2_WSGRA0_WSGRB0_WS64_WG16_16_1_WGM1_WGMXCC8_WGMXCCGn1
    SolutionIndex: 73
    SolutionNameMin: Cijk_Alik_Bjlk_S_MX_B_Bias_HA_S_SAV_UserArgs_MT96x128x64_MI16x16x1_SN_LDSB1_AFC0_AFEM1_AFEM1_ASEM1_CLR1_CADS0_DTLA0_DTLB0_DTVA0_DTVB0_EPS0_FDSI1_GRPM1_GRVWA4_GRVWB4_GSUn1_GSUAMBSK_GSUC1_GSUWGMRR1_GLS0_ISA950_IU1_K1_LDSTI0_LBSPPA512_LBSPPB2048_LBSPPM0_LPA8_LPB0_LPM0_LRVW4_LWPMn1_MIAV0_MIWT6_2_MO40_NTn1_NTA0_NTB0_NTC0_NTD4_NTM0_NEPBS6_NLCA1_NLCB1_ONLL1_PGR2_PLR1_PKA1_SIA3_SS1_SU16_SUM0_SUS256_SPO0_SRVW0_SSO0_SVW2_SK0_SKFTR0_SKXCCM0_TLDS1_ULSGRO0_USL1_UIOFGRO0_USFGROn1_VSn1_VWA2_VWB2_WSGRA0_WSGRB0_WS64_WG16_16_1_WGM1_WGMXCC8_WGMXCCGn1
    SolutionIndex: 75
    SolutionNameMin: Cijk_Alik_Bjlk_S_MX_B_Bias_HA_S_SAV_UserArgs_MT128x96x64_MI16x16x1_SN_LDSB1_AFC0_AFEM1_AFEM1_ASEM1_CLR1_CADS0_DTLA0_DTLB0_DTVA0_DTVB0_EPS0_FDSI1_GRPM1_GRVWA4_GRVWB4_GSUn1_GSUAMBSK_GSUC1_GSUWGMRR1_GLS0_ISA950_IU1_K1_LDSTI0_LBSPPA1024_LBSPPB1536_LBSPPM0_LPA8_LPB16_LPM0_LRVW4_LWPMn1_MIAV0_MIWT4_3_MO40_NTn1_NTA0_NTB0_NTC0_NTD4_NTM0_NEPBS8_NLCA1_NLCB3_ONLL1_PGR2_PLR1_PKA1_SIA3_SS1_SU16_SUM0_SUS256_SPO0_SRVW0_SSO0_SVW4_SK0_SKFTR0_SKXCCM0_TLDS1_ULSGRO0_USL1_UIOFGRO0_USFGROn1_VSn1_VWA4_VWB1_WSGRA0_WSGRB0_WS64_WG32_8_1_WGM1_WGMXCC8_WGMXCCGn1
    SolutionIndex: 76
    SolutionNameMin: Cijk_Alik_Bjlk_S_MX_B_Bias_HA_S_SAV_UserArgs_MT128x128x64_MI16x16x1_SN_LDSB1_AFC0_AFEM1_AFEM1_ASEM1_CLR1_CADS0_DTLA0_DTLB0_DTVA0_DTVB0_EPS0_FDSI1_GRPM1_GRVWA4_GRVWB4_GSUn1_GSUAMBSK_GSUC1_GSUWGMRR1_GLS0_ISA950_IU1_K1_LDSTI0_LBSPPA1024_LBSPPB2048_LBSPPM0_LPA8_LPB0_LPM0_LRVW4_LWPMn1_MIAV0_MIWT4_4_MO40_NTn1_NTA0_NTB0_NTC0_NTD4_NTM0_NEPBS8_NLCA1_NLCB1_ONLL1_PGR2_PLR1_PKA1_SIA3_SS1_SU16_SUM0_SUS256_SPO0_SRVW0_SSO0_SVW4_SK0_SKFTR0_SKXCCM0_TLDS1_ULSGRO0_USL1_UIOFGRO0_USFGROn1_VSn1_VWA4_VWB4_WSGRA0_WSGRB0_WS64_WG32_8_1_WGM1_WGMXCC8_WGMXCCGn1
    SolutionIndex: 77
    SolutionNameMin: Cijk_Alik_Bjlk_S_MX_B_Bias_HA_S_SAV_UserArgs_MT128x64x64_MI16x16x1_SN_LDSB1_AFC0_AFEM1_AFEM1_ASEM1_CLR1_CADS0_DTLA0_DTLB0_DTVA0_DTVB0_EPS0_FDSI1_GRPM1_GRVWA4_GRVWB4_GSUn1_GSUAMBSK_GSUC1_GSUWGMRR1_GLS0_ISA950_IU1_K1_LDSTI0_LBSPPA1024_LBSPPB1024_LBSPPM0_LPA8_LPB0_LPM0_LRVW4_LWPMn1_MIAV0_MIWT4_2_MO40_NTn1_NTA0_NTB0_NTC0_NTD4_NTM0_NEPBS8_NLCA1_NLCB1_ONLL1_PGR2_PLR1_PKA1_SIA3_SS1_SU16_SUM0_SUS256_SPO0_SRVW0_SSO0_SVW4_SK0_SKFTR0_SKXCCM0_TLDS1_ULSGRO0_USL1_UIOFGRO0_USFGROn1_VSn1_VWA4_VWB2_WSGRA0_WSGRB0_WS64_WG32_8_1_WGM1_WGMXCC8_WGMXCCGn1
    SolutionIndex: 78
    SolutionNameMin: Cijk_Alik_Bjlk_S_MX_B_Bias_HA_S_SAV_UserArgs_MT128x256x32_MI16x16x1_SN_LDSB1_AFC0_AFEM1_AFEM1_ASEM1_CLR0_CADS0_DTLA0_DTLB0_DTVA0_DTVB0_EPS0_FDSI1_GRPM1_GRVWA4_GRVWB4_GSUn1_GSUAMBSK_GSUC1_GSUWGMRR1_GLS0_ISA950_IU1_K1_LDSTI0_LBSPPA512_LBSPPB4096_LBSPPM0_LPA8_LPB0_LPM0_LRVW4_LWPMn1_MIAV0_MIWT8_4_MO40_NTn1_NTA0_NTB0_NTC0_NTD4_NTM0_NEPBS8_NLCA1_NLCB1_ONLL1_PGR2_PLR0_PKA1_SIA3_SS1_SU16_SUM0_SUS128_SPO0_SRVW0_SSO0_SVW4_SK0_SKFTR0_SKXCCM0_TLDS1_ULSGRO0_USL1_UIOFGRO0_USFGROn1_VSn1_VWA4_VWB4_WSGRA0_WSGRB0_WS64_WG16_16_1_WGM1_WGMXCC8_WGMXCCGn1
    SolutionIndex: 79
    SolutionNameMin: Cijk_Alik_Bjlk_S_MX_B_Bias_HA_S_SAV_UserArgs_MT128x256x32_MI16x16x1_SN_LDSB1_AFC0_AFEM1_AFEM1_ASEM1_CLR0_CADS0_DTLA0_DTLB0_DTVA0_DTVB0_EPS0_FDSI1_GRPM1_GRVWA4_GRVWB4_GSUn1_GSUAMBSK_GSUC1_GSUWGMRR1_GLS0_ISA950_IU1_K1_LDSTI0_LBSPPA512_LBSPPB4096_LBSPPM0_LPA8_LPB0_LPM0_LRVW4_LWPMn1_MIAV0_MIWT8_4_MO40_NTn1_NTA0_NTB0_NTC0_NTD4_NTM0_NEPBS8_NLCA1_NLCB1_ONLL1_PGR2_PLR0_PKA1_SIA3_SS1_SU16_SUM0_SUS128_SPO0_SRVW0_SSO0_SVW4_SK0_SKFTR0_SKXCCM0_TLDS1_ULSGRO0_USL1_UIOFGRO0_USFGROn1_VSn1_VWA4_VWB4_WSGRA0_WSGRB0_WS64_WG16_16_1_WGM4_WGMXCC8_WGMXCCGn1
    SolutionIndex: 80
    SolutionNameMin: Cijk_Alik_Bjlk_S_MX_B_Bias_HA_S_SAV_UserArgs_MT64x16x128_MI16x16x1_SN_LDSB1_AFC0_AFEM1_AFEM1_ASEM1_CLR1_CADS0_DTLA0_DTLB0_DTVA0_DTVB0_EPS0_FDSI1_GRPM1_GRVWA4_GRVWB4_GSUn1_GSUAMBSK_GSUC1_GSUWGMRR1_GLS0_ISA950_IU1_K1_LDSTI0_LBSPPA512_LBSPPB256_LBSPPM0_LPA8_LPB16_LPM0_LRVW4_LWPMn1_MIAV0_MIWT1_1_MO40_NTn1_NTA0_NTB0_NTC0_NTD4_NTM0_NEPBS8_NLCA1_NLCB1_ONLL1_PGR2_PLR1_PKA1_SIA3_SS1_SU16_SUM0_SUS512_SPO0_SRVW0_SSO0_SVW1_SK0_SKFTR0_SKXCCM0_TLDS1_ULSGRO0_USL1_UIOFGRO0_USFGROn1_VSn1_VWA1_VWB1_WSGRA0_WSGRB0_WS64_WG64_4_1_WGM1_WGMXCC8_WGMXCCGn1
    SolutionIndex: 81
    SolutionNameMin: Cijk_Alik_Bjlk_S_MX_B_Bias_HA_S_SAV_UserArgs_MT192x96x64_MI16x16x1_SN_LDSB1_AFC0_AFEM1_AFEM1_ASEM1_CLR1_CADS0_DTLA0_DTLB0_DTVA0_DTVB0_EPS0_FDSI1_GRPM1_GRVWA4_GRVWB4_GSUn1_GSUAMBSK_GSUC1_GSUWGMRR1_GLS0_ISA950_IU1_K1_LDSTI0_LBSPPA256_LBSPPB1536_LBSPPM0_LPA8_LPB0_LPM0_LRVW4_LWPMn1_MIAV0_MIWT3_6_MO40_NTn1_NTA0_NTB0_NTC0_NTD4_NTM0_NEPBS6_NLCA1_NLCB3_ONLL1_PGR2_PLR1_PKA1_SIA3_SS1_SU16_SUM0_SUS256_SPO0_SRVW0_SSO0_SVW1_SK0_SKFTR0_SKXCCM0_TLDS1_ULSGRO0_USL1_UIOFGRO0_USFGROn1_VSn1_VWA1_VWB2_WSGRA0_WSGRB0_WS64_WG64_4_1_WGM1_WGMXCC8_WGMXCCGn1
    SolutionIndex: 82
    SolutionNameMin: Cijk_Alik_Bjlk_S_MX_B_Bias_HA_S_SAV_UserArgs_MT128x112x64_MI16x16x1_SN_LDSB1_AFC0_AFEM1_AFEM1_ASEM1_CLR1_CADS0_DTLA0_DTLB0_DTVA0_DTVB0_EPS0_FDSI1_GRPM1_GRVWA4_GRVWB4_GSUn1_GSUAMBSK_GSUC1_GSUWGMRR1_GLS0_ISA950_IU1_K1_LDSTI0_LBSPPA512_LBSPPB1792_LBSPPM0_LPA8_LPB16_LPM0_LRVW4_LWPMn1_MIAV0_MIWT2_7_MO40_NTn1_NTA0_NTB0_NTC0_NTD4_NTM0_NEPBS8_NLCA1_NLCB7_ONLL1_PGR2_PLR1_PKA1_SIA3_SS1_SU16_SUM0_SUS256_SPO0_SRVW0_SSO0_SVW2_SK0_SKFTR0_SKXCCM0_TLDS1_ULSGRO0_USL1_UIOFGRO0_USFGROn1_VSn1_VWA2_VWB1_WSGRA0_WSGRB0_WS64_WG64_4_1_WGM1_WGMXCC8_WGMXCCGn1
    SolutionIndex: 84
    SolutionNameMin: Cijk_Alik_Bjlk_S_MX_B_Bias_HA_S_SAV_UserArgs_MT128x96x64_MI16x16x1_SN_LDSB1_AFC0_AFEM1_AFEM1_ASEM1_CLR1_CADS0_DTLA0_DTLB0_DTVA0_DTVB0_EPS0_FDSI1_GRPM1_GRVWA4_GRVWB4_GSUn1_GSUAMBSK_GSUC1_GSUWGMRR1_GLS0_ISA950_IU1_K1_LDSTI0_LBSPPA1024_LBSPPB1536_LBSPPM0_LPA8_LPB16_LPM0_LRVW4_LWPMn1_MIAV0_MIWT4_3_MO40_NTn1_NTA0_NTB0_NTC0_NTD4_NTM0_NEPBS8_NLCA1_NLCB3_ONLL1_PGR2_PLR1_PKA1_SIA3_SS1_SU16_SUM0_SUS256_SPO0_SRVW0_SSO0_SVW4_SK0_SKFTR0_SKXCCM0_TLDS1_ULSGRO0_USL1_UIOFGRO0_USFGROn1_VSn1_VWA4_VWB1_WSGRA0_WSGRB0_WS64_WG32_8_1_WGM8_WGMXCC8_WGMXCCGn1
    SolutionIndex: 85
    SolutionNameMin: Cijk_Alik_Bjlk_S_MX_B_Bias_HA_S_SAV_UserArgs_MT256x128x32_MI16x16x1_SN_LDSB1_AFC0_AFEM1_AFEM1_ASEM1_CLR0_CADS0_DTLA0_DTLB0_DTVA0_DTVB0_EPS0_FDSI1_GRPM1_GRVWA4_GRVWB4_GSUn1_GSUAMBSK_GSUC1_GSUWGMRR1_GLS0_ISA950_IU1_K1_LDSTI0_LBSPPA512_LBSPPB2048_LBSPPM0_LPA8_LPB0_LPM0_LRVW4_LWPMn1_MIAV0_MIWT8_4_MO40_NTn1_NTA0_NTB0_NTC0_NTD4_NTM0_NEPBS8_NLCA1_NLCB1_ONLL1_PGR2_PLR0_PKA1_SIA3_SS1_SU16_SUM0_SUS128_SPO0_SRVW0_SSO0_SVW4_SK0_SKFTR0_SKXCCM0_TLDS1_ULSGRO0_USL1_UIOFGRO0_USFGROn1_VSn1_VWA4_VWB4_WSGRA0_WSGRB0_WS64_WG32_8_1_WGM1_WGMXCC8_WGMXCCGn1
    SolutionIndex: 86
    SolutionNameMin: Cijk_Alik_Bjlk_S_MX_B_Bias_HA_S_SAV_UserArgs_MT128x256x32_MI16x16x1_SN_LDSB1_AFC0_AFEM1_AFEM1_ASEM1_CLR0_CADS0_DTLA0_DTLB0_DTVA0_DTVB0_EPS0_FDSI1_GRPM1_GRVWA4_GRVWB4_GSUn1_GSUAMBSK_GSUC1_GSUWGMRR1_GLS0_ISA950_IU1_K1_LDSTI0_LBSPPA512_LBSPPB4096_LBSPPM0_LPA8_LPB0_LPM0_LRVW4_LWPMn1_MIAV0_MIWT8_4_MO40_NTn1_NTA0_NTB0_NTC0_NTD4_NTM0_NEPBS8_NLCA1_NLCB1_ONLL1_PGR2_PLR0_PKA1_SIA3_SS1_SU16_SUM0_SUS128_SPO0_SRVW0_SSO0_SVW4_SK0_SKFTR0_SKXCCM0_TLDS1_ULSGRO0_USL1_UIOFGRO0_USFGROn1_VSn1_VWA4_VWB4_WSGRA0_WSGRB0_WS64_WG16_16_1_WGM8_WGMXCC8_WGMXCCGn1
    SolutionIndex: 87
    SolutionNameMin: Cijk_Alik_Bjlk_S_MX_B_Bias_HA_S_SAV_UserArgs_MT128x96x64_MI16x16x1_SN_LDSB1_AFC0_AFEM1_AFEM1_ASEM1_CLR1_CADS0_DTLA0_DTLB0_DTVA0_DTVB0_EPS0_FDSI1_GRPM1_GRVWA4_GRVWB4_GSUn1_GSUAMBSK_GSUC1_GSUWGMRR1_GLS0_ISA950_IU1_K1_LDSTI0_LBSPPA1024_LBSPPB1536_LBSPPM0_LPA8_LPB16_LPM0_LRVW4_LWPMn1_MIAV0_MIWT4_3_MO40_NTn1_NTA0_NTB0_NTC0_NTD4_NTM0_NEPBS8_NLCA1_NLCB3_ONLL1_PGR2_PLR1_PKA1_SIA3_SS1_SU16_SUM0_SUS256_SPO0_SRVW0_SSO0_SVW4_SK0_SKFTR0_SKXCCM0_TLDS1_ULSGRO0_USL1_UIOFGRO0_USFGROn1_VSn1_VWA4_VWB1_WSGRA0_WSGRB0_WS64_WG32_8_1_WGM4_WGMXCC8_WGMXCCGn1
    SolutionIndex: 89
    SolutionNameMin: Cijk_Alik_Bjlk_S_MX_B_Bias_HA_S_SAV_UserArgs_MT128x16x64_MI16x16x1_SN_LDSB1_AFC0_AFEM1_AFEM1_ASEM1_CLR1_CADS0_DTLA0_DTLB0_DTVA0_DTVB0_EPS0_FDSI1_GRPM1_GRVWA4_GRVWB4_GSUn1_GSUAMBSK_GSUC1_GSUWGMRR1_GLS0_ISA950_IU1_K1_LDSTI0_LBSPPA512_LBSPPB256_LBSPPM0_LPA8_LPB16_LPM0_LRVW4_LWPMn1_MIAV0_MIWT2_1_MO40_NTn1_NTA0_NTB0_NTC0_NTD4_NTM0_NEPBS8_NLCA1_NLCB1_ONLL1_PGR2_PLR1_PKA1_SIA3_SS1_SU16_SUM0_SUS256_SPO0_SRVW0_SSO0_SVW2_SK0_SKFTR0_SKXCCM0_TLDS1_ULSGRO0_USL1_UIOFGRO0_USFGROn1_VSn1_VWA2_VWB1_WSGRA0_WSGRB0_WS64_WG64_4_1_WGM1_WGMXCC8_WGMXCCGn1
    SolutionIndex: 91
    SolutionNameMin: Cijk_Alik_Bjlk_S_MX_B_Bias_HA_S_SAV_UserArgs_MT128x64x64_MI16x16x1_SN_LDSB1_AFC0_AFEM1_AFEM1_ASEM1_CLR1_CADS0_DTLA0_DTLB0_DTVA0_DTVB0_EPS0_FDSI1_GRPM1_GRVWA4_GRVWB4_GSUn1_GSUAMBSK_GSUC1_GSUWGMRR1_GLS0_ISA950_IU1_K1_LDSTI0_LBSPPA1024_LBSPPB1024_LBSPPM0_LPA8_LPB0_LPM0_LRVW4_LWPMn1_MIAV0_MIWT4_2_MO40_NTn1_NTA0_NTB0_NTC0_NTD4_NTM0_NEPBS8_NLCA1_NLCB1_ONLL1_PGR2_PLR1_PKA1_SIA3_SS1_SU16_SUM0_SUS256_SPO0_SRVW0_SSO0_SVW4_SK0_SKFTR0_SKXCCM0_TLDS1_ULSGRO0_USL1_UIOFGRO0_USFGROn1_VSn1_VWA4_VWB2_WSGRA0_WSGRB0_WS64_WG32_8_1_WGM8_WGMXCC8_WGMXCCGn1
    SolutionIndex: 92
    SolutionNameMin: Cijk_Alik_Bjlk_S_MX_B_Bias_HA_S_SAV_UserArgs_MT256x128x32_MI16x16x1_SN_LDSB1_AFC0_AFEM1_AFEM1_ASEM1_CLR0_CADS0_DTLA0_DTLB0_DTVA0_DTVB0_EPS0_FDSI1_GRPM1_GRVWA4_GRVWB4_GSUn1_GSUAMBSK_GSUC1_GSUWGMRR1_GLS0_ISA950_IU1_K1_LDSTI0_LBSPPA512_LBSPPB2048_LBSPPM0_LPA8_LPB0_LPM0_LRVW4_LWPMn1_MIAV0_MIWT8_4_MO40_NTn1_NTA0_NTB0_NTC0_NTD4_NTM0_NEPBS8_NLCA1_NLCB1_ONLL1_PGR2_PLR0_PKA1_SIA3_SS1_SU16_SUM0_SUS128_SPO0_SRVW0_SSO0_SVW4_SK0_SKFTR0_SKXCCM0_TLDS1_ULSGRO0_USL1_UIOFGRO0_USFGROn1_VSn1_VWA4_VWB4_WSGRA0_WSGRB0_WS64_WG32_8_1_WGM4_WGMXCC8_WGMXCCGn1
    SolutionIndex: 93
    SolutionNameMin: Cijk_Alik_Bjlk_S_MX_B_Bias_HA_S_SAV_UserArgs_MT256x128x32_MI16x16x1_SN_LDSB1_AFC0_AFEM1_AFEM1_ASEM1_CLR0_CADS0_DTLA0_DTLB0_DTVA0_DTVB0_EPS0_FDSI1_GRPM1_GRVWA4_GRVWB4_GSUn1_GSUAMBSK_GSUC1_GSUWGMRR1_GLS0_ISA950_IU1_K1_LDSTI0_LBSPPA512_LBSPPB2048_LBSPPM0_LPA8_LPB0_LPM0_LRVW4_LWPMn1_MIAV0_MIWT8_4_MO40_NTn1_NTA0_NTB0_NTC0_NTD4_NTM0_NEPBS8_NLCA1_NLCB1_ONLL1_PGR2_PLR0_PKA1_SIA3_SS1_SU16_SUM0_SUS128_SPO0_SRVW0_SSO0_SVW4_SK0_SKFTR0_SKXCCM0_TLDS1_ULSGRO0_USL1_UIOFGRO0_USFGROn1_VSn1_VWA4_VWB4_WSGRA0_WSGRB0_WS64_WG32_8_1_WGM8_WGMXCC8_WGMXCCGn1
    SolutionIndex: 94
    SolutionNameMin: Cijk_Alik_Bjlk_S_MX_B_Bias_HA_S_SAV_UserArgs_MT128x192x32_MI16x16x1_SN_LDSB1_AFC0_AFEM1_AFEM1_ASEM1_CLR0_CADS0_DTLA0_DTLB0_DTVA0_DTVB0_EPS0_FDSI1_GRPM1_GRVWA4_GRVWB4_GSUn1_GSUAMBSK_GSUC1_GSUWGMRR1_GLS0_ISA950_IU1_K1_LDSTI0_LBSPPA512_LBSPPB3072_LBSPPM0_LPA8_LPB0_LPM0_LRVW4_LWPMn1_MIAV0_MIWT4_6_MO40_NTn1_NTA0_NTB0_NTC0_NTD4_NTM0_NEPBS8_NLCA1_NLCB3_ONLL1_PGR2_PLR0_PKA1_SIA3_SS1_SU16_SUM0_SUS128_SPO0_SRVW0_SSO0_SVW4_SK0_SKFTR0_SKXCCM0_TLDS1_ULSGRO0_USL1_UIOFGRO0_USFGROn1_VSn1_VWA4_VWB2_WSGRA0_WSGRB0_WS64_WG32_8_1_WGM8_WGMXCC8_WGMXCCGn1
    SolutionIndex: 95
    SolutionNameMin: Cijk_Alik_Bjlk_S_MX_B_Bias_HA_S_SAV_UserArgs_MT128x192x32_MI16x16x1_SN_LDSB1_AFC0_AFEM1_AFEM1_ASEM1_CLR0_CADS0_DTLA0_DTLB0_DTVA0_DTVB0_EPS0_FDSI1_GRPM1_GRVWA4_GRVWB4_GSUn1_GSUAMBSK_GSUC1_GSUWGMRR1_GLS0_ISA950_IU1_K1_LDSTI0_LBSPPA512_LBSPPB3072_LBSPPM0_LPA8_LPB0_LPM0_LRVW4_LWPMn1_MIAV0_MIWT4_6_MO40_NTn1_NTA0_NTB0_NTC0_NTD4_NTM0_NEPBS8_NLCA1_NLCB3_ONLL1_PGR2_PLR0_PKA1_SIA3_SS1_SU16_SUM0_SUS128_SPO0_SRVW0_SSO0_SVW4_SK0_SKFTR0_SKXCCM0_TLDS1_ULSGRO0_USL1_UIOFGRO0_USFGROn1_VSn1_VWA4_VWB2_WSGRA0_WSGRB0_WS64_WG32_8_1_WGM4_WGMXCC8_WGMXCCGn1
    SolutionIndex: 97
    SolutionNameMin: Cijk_Alik_Bjlk_S_MX_B_Bias_HA_S_SAV_UserArgs_MT128x48x64_MI16x16x1_SN_LDSB1_AFC0_AFEM1_AFEM1_ASEM1_CLR1_CADS0_DTLA0_DTLB0_DTVA0_DTVB0_EPS0_FDSI1_GRPM1_GRVWA4_GRVWB4_GSUn1_GSUAMBSK_GSUC1_GSUWGMRR1_GLS0_ISA950_IU1_K1_LDSTI0_LBSPPA512_LBSPPB768_LBSPPM0_LPA8_LPB16_LPM0_LRVW4_LWPMn1_MIAV0_MIWT2_3_MO40_NTn1_NTA0_NTB0_NTC0_NTD4_NTM0_NEPBS8_NLCA1_NLCB3_ONLL1_PGR2_PLR1_PKA1_SIA3_SS1_SU16_SUM0_SUS256_SPO0_SRVW0_SSO0_SVW2_SK0_SKFTR0_SKXCCM0_TLDS1_ULSGRO0_USL1_UIOFGRO0_USFGROn1_VSn1_VWA2_VWB1_WSGRA0_WSGRB0_WS64_WG64_4_1_WGM1_WGMXCC8_WGMXCCGn1
- - - [4352, 256, 1, 2432, 4352, 4352, 2432, 256]
    - [27, 56.93]
  - - [6656, 1920, 1, 4608, 6656, 6656, 4608, 1920]
    - [38, 114.52]
  - - [3328, 5120, 1, 1664, 3328, 3328, 1664, 5120]
    - [36, 128.09]
  - - [2432, 3968, 1, 4608, 2432, 2432, 4608, 3968]
    - [32, 112.92]
  - - [5248, 3712, 1, 3328, 5248, 5248, 3328, 3712]
    - [32, 112.76]
  - - [4352, 6144, 1, 2432, 4352, 4352, 2432, 6144]
    - [37, 123.88]
  - - [7168, 6656, 1, 1152, 7168, 7168, 1152, 6656]
    - [36, 120.63]
  - - [5760, 1792, 1, 4224, 5760, 5760, 4224, 1792]
    - [32, 118.17]
  - - [4480, 7680, 1, 2560, 4480, 4480, 2560, 7680]
    - [30, 103.56]
  - - [6272, 7168, 1, 1280, 6272, 6272, 1280, 7168]
    - [42, 117.53]
  - - [2176, 1536, 1, 512, 2176, 2176, 512, 1536]
    - [27, 58.91]
  - - [7680, 4992, 1, 7296, 7680, 7680, 7296, 4992]
    - [37, 121.85]
  - - [7168, 5760, 1, 7808, 7168, 7168, 7808, 5760]
    - [37, 127.67]
  - - [1792, 2816, 1, 128, 1792, 1792, 128, 2816]
    - [26, 43.34]
  - - [2048, 1280, 1, 6016, 2048, 2048, 6016, 1280]
    - [56, 104.61]
  - - [6400, 7296, 1, 1280, 6400, 6400, 1280, 7296]
    - [36, 119.33]
  - - [4992, 1792, 1, 1792, 4992, 4992, 1792, 1792]
    - [29, 102.62]
  - - [7808, 1664, 1, 2560, 7808, 7808, 2560, 1664]
    - [37, 116.59]
  - - [3584, 5504, 1, 3200, 3584, 3584, 3200, 5504]
    - [39, 115.95]
  - - [3840, 6400, 1, 3712, 3840, 3840, 3712, 6400]
    - [44, 118.76]
  - - [2432, 7808, 1, 512, 2432, 2432, 512, 7808]
    - [49, 93.69]
  - - [7936, 2304, 1, 6784, 7936, 7936, 6784, 2304]
    - [28, 106.39]
  - - [1280, 256, 1, 2304, 1280, 1280, 2304, 256]
    - [71, 32.81]
  - - [3584, 640, 1, 4736, 3584, 3584, 4736, 640]
    - [56, 93.87]
  - - [5888, 4096, 1, 2304, 5888, 5888, 2304, 4096]
    - [38, 114.31]
  - - [5248, 3328, 1, 4096, 5248, 5248, 4096, 3328]
    - [28, 103.02]
  - - [6400, 6272, 1, 3072, 6400, 6400, 3072, 6272]
    - [37, 125.39]
  - - [7936, 1792, 1, 1792, 7936, 7936, 1792, 1792]
    - [38, 117.12]
  - - [7680, 1664, 1, 1280, 7680, 7680, 1280, 1664]
    - [37, 109.1]
  - - [6784, 896, 1, 2048, 6784, 6784, 2048, 896]
    - [25, 92.7]
  - - [7936, 1408, 1, 6144, 7936, 7936, 6144, 1408]
    - [38, 107.33]
  - - [4352, 7296, 1, 1408, 4352, 4352, 1408, 7296]
    - [36, 123.93]
  - - [6912, 5888, 1, 256, 6912, 6912, 256, 5888]
    - [47, 85.64]
  - - [2176, 2048, 1, 6528, 2176, 2176, 6528, 2048]
    - [37, 109.86]
  - - [2432, 7296, 1, 5504, 2432, 2432, 5504, 7296]
    - [28, 105.98]
  - - [6528, 3328, 1, 6912, 6528, 6528, 6912, 3328]
    - [25, 107.77]
  - - [1536, 1792, 1, 640, 1536, 1536, 640, 1792]
    - [84, 68.96]
  - - [2304, 7936, 1, 896, 2304, 2304, 896, 7936]
    - [40, 103.57]
  - - [6016, 5504, 1, 4992, 6016, 6016, 4992, 5504]
    - [27, 92.33]
  - - [7936, 5888, 1, 2432, 7936, 7936, 2432, 5888]
    - [36, 126.12]
  - - [5888, 6656, 1, 3840, 5888, 5888, 3840, 6656]
    - [38, 121.55]
  - - [1280, 5760, 1, 1024, 1280, 1280, 1024, 5760]
    - [25, 97.88]
  - - [2432, 3200, 1, 2688, 2432, 2432, 2688, 3200]
    - [78, 101.31]
  - - [5888, 5760, 1, 7680, 5888, 5888, 7680, 5760]
    - [29, 102.35]
  - - [7296, 1920, 1, 6272, 7296, 7296, 6272, 1920]
    - [43, 125.37]
  - - [4864, 7808, 1, 7424, 4864, 4864, 7424, 7808]
    - [37, 121.7]
  - - [4736, 4864, 1, 4992, 4736, 4736, 4992, 4864]
    - [38, 114.45]
  - - [6400, 7424, 1, 4480, 6400, 6400, 4480, 7424]
    - [36, 128.87]
  - - [7424, 7808, 1, 6400, 7424, 7424, 6400, 7808]
    - [46, 124.54]
  - - [4480, 3456, 1, 1024, 4480, 4480, 1024, 3456]
    - [36, 115.12]
  - - [4096, 768, 1, 5888, 4096, 4096, 5888, 768]
    - [39, 98.51]
  - - [3712, 5248, 1, 1920, 3712, 3712, 1920, 5248]
    - [39, 112.0]
  - - [4608, 7808, 1, 3712, 4608, 4608, 3712, 7808]
    - [30, 107.8]
  - - [7168, 7040, 1, 5504, 7168, 7168, 5504, 7040]
    - [39, 122.28]
  - - [6784, 4352, 1, 2560, 6784, 6784, 2560, 4352]
    - [43, 121.46]
  - - [512, 5248, 1, 6528, 512, 512, 6528, 5248]
    - [93, 93.22]
  - - [4736, 128, 1, 5376, 4736, 4736, 5376, 128]
    - [27, 57.95]
  - - [2560, 6400, 1, 7680, 2560, 2560, 7680, 6400]
    - [85, 106.15]
  - - [3200, 5376, 1, 1152, 3200, 3200, 1152, 5376]
    - [28, 97.47]
  - - [3840, 4992, 1, 6912, 3840, 3840, 6912, 4992]
    - [32, 115.17]
  - - [7296, 3712, 1, 4864, 7296, 7296, 4864, 3712]
    - [38, 121.01]
  - - [4736, 3584, 1, 7936, 4736, 4736, 7936, 3584]
    - [29, 106.52]
  - - [896, 3456, 1, 4864, 896, 896, 4864, 3456]
    - [87, 92.63]
  - - [5248, 1792, 1, 2304, 5248, 5248, 2304, 1792]
    - [39, 112.02]
  - - [8064, 768, 1, 2944, 8064, 8064, 2944, 768]
    - [24, 90.81]
  - - [1024, 6144, 1, 384, 1024, 1024, 384, 6144]
    - [48, 78.48]
  - - [7296, 7168, 1, 5120, 7296, 7296, 5120, 7168]
    - [44, 123.64]
  - - [6656, 6272, 1, 1920, 6656, 6656, 1920, 6272]
    - [37, 124.56]
  - - [4480, 3072, 1, 6528, 4480, 4480, 6528, 3072]
    - [37, 127.18]
  - - [1920, 5760, 1, 5248, 1920, 1920, 5248, 5760]
    - [44, 109.84]
  - - [2944, 5376, 1, 1664, 2944, 2944, 1664, 5376]
    - [36, 123.08]
  - - [768, 1152, 1, 1408, 768, 768, 1408, 1152]
    - [91, 46.17]
  - - [7040, 4864, 1, 4352, 7040, 7040, 4352, 4864]
    - [28, 103.08]
  - - [4608, 6016, 1, 1920, 4608, 4608, 1920, 6016]
    - [38, 119.69]
  - - [3712, 4608, 1, 4096, 3712, 3712, 4096, 4608]
    - [28, 104.44]
  - - [5120, 7168, 1, 4352, 5120, 5120, 4352, 7168]
    - [30, 108.89]
  - - [5888, 4480, 1, 5888, 5888, 5888, 5888, 4480]
    - [37, 123.08]
  - - [384, 8064, 1, 5120, 384, 384, 5120, 8064]
    - [24, 85.56]
  - - [1408, 1152, 1, 2304, 1408, 1408, 2304, 1152]
    - [76, 62.99]
  - - [4992, 2944, 1, 7168, 4992, 4992, 7168, 2944]
    - [36, 122.91]
  - - [4352, 512, 1, 6912, 4352, 4352, 6912, 512]
    - [44, 91.96]
  - - [5760, 1280, 1, 5376, 5760, 5760, 5376, 1280]
    - [25, 107.34]
  - - [3584, 2688, 1, 5504, 3584, 3584, 5504, 2688]
    - [32, 111.65]
  - - [4864, 2816, 1, 4864, 4864, 4864, 4864, 2816]
    - [44, 125.26]
  - - [6912, 6400, 1, 2560, 6912, 6912, 2560, 6400]
    - [42, 125.09]
  - - [6784, 2048, 1, 512, 6784, 6784, 512, 2048]
    - [44, 102.74]
  - - [5120, 3712, 1, 2432, 5120, 5120, 2432, 3712]
    - [32, 109.92]
  - - [5376, 5504, 1, 4480, 5376, 5376, 4480, 5504]
    - [43, 126.53]
  - - [4864, 1920, 1, 5888, 4864, 4864, 5888, 1920]
    - [39, 111.67]
  - - [2176, 256, 1, 384, 2176, 2176, 384, 256]
    - [66, 17.84]
  - - [384, 2560, 1, 2304, 384, 384, 2304, 2560]
    - [75, 64.68]
  - - [128, 5504, 1, 4608, 128, 128, 4608, 5504]
    - [10, 60.4]
  - - [896, 3328, 1, 640, 896, 896, 640, 3328]
    - [84, 71.92]
  - - [4096, 7424, 1, 3072, 4096, 4096, 3072, 7424]
    - [40, 118.37]
  - - [2176, 3200, 1, 3968, 2176, 2176, 3968, 3200]
    - [25, 105.84]
  - - [7936, 384, 1, 768, 7936, 7936, 768, 384]
    - [75, 72.01]
  - - [1920, 1920, 1, 5376, 1920, 1920, 5376, 1920]
    - [25, 102.45]
  - - [2176, 1536, 1, 128, 2176, 2176, 128, 1536]
    - [27, 30.99]
  - - [4864, 5248, 1, 4992, 4864, 4864, 4992, 5248]
    - [37, 122.57]
  - - [2944, 1152, 1, 128, 2944, 2944, 128, 1152]
    - [27, 31.04]
  - - [6784, 3584, 1, 5888, 6784, 6784, 5888, 3584]
    - [38, 116.9]
  - - [5504, 4864, 1, 7680, 5504, 5504, 7680, 4864]
    - [38, 122.5]
  - - [6656, 3072, 1, 4480, 6656, 6656, 4480, 3072]
    - [32, 117.78]
  - - [7296, 6784, 1, 2688, 7296, 7296, 2688, 6784]
    - [39, 118.98]
  - - [7296, 7936, 1, 3968, 7296, 7296, 3968, 7936]
    - [38, 126.74]
  - - [6784, 2688, 1, 3456, 6784, 6784, 3456, 2688]
    - [40, 111.01]
  - - [4736, 1792, 1, 1280, 4736, 4736, 1280, 1792]
    - [39, 101.17]
  - - [2816, 128, 1, 7168, 2816, 2816, 7168, 128]
    - [73, 53.89]
  - - [3712, 6656, 1, 7936, 3712, 3712, 7936, 6656]
    - [44, 119.72]
  - - [3840, 4736, 1, 7552, 3840, 3840, 7552, 4736]
    - [39, 114.85]
  - - [1920, 4736, 1, 3456, 1920, 1920, 3456, 4736]
    - [32, 111.3]
  - - [3584, 6272, 1, 1664, 3584, 3584, 1664, 6272]
    - [25, 106.79]
  - - [3712, 5376, 1, 6016, 3712, 3712, 6016, 5376]
    - [39, 120.37]
  - - [5248, 5760, 1, 7552, 5248, 5248, 7552, 5760]
    - [43, 128.96]
  - - [1536, 2176, 1, 2176, 1536, 1536, 2176, 2176]
    - [4, 84.22]
  - - [6144, 2176, 1, 5376, 6144, 6144, 5376, 2176]
    - [38, 117.97]
  - - [2432, 1664, 1, 6784, 2432, 2432, 6784, 1664]
    - [27, 89.32]
  - - [384, 128, 1, 2048, 384, 384, 2048, 128]
    - [14, 7.76]
  - - [7296, 4096, 1, 256, 7296, 7296, 256, 4096]
    - [52, 81.49]
  - - [1280, 1920, 1, 3456, 1280, 1280, 3456, 1920]
    - [56, 92.74]
  - - [6272, 3968, 1, 6912, 6272, 6272, 6912, 3968]
    - [37, 120.8]
  - - [1408, 4352, 1, 6784, 1408, 1408, 6784, 4352]
    - [24, 93.64]
  - - [3968, 256, 1, 128, 3968, 3968, 128, 256]
    - [71, 14.69]
  - - [7424, 1152, 1, 4608, 7424, 7424, 4608, 1152]
    - [32, 102.7]
  - - [6400, 6272, 1, 640, 6400, 6400, 640, 6272]
    - [37, 105.84]
  - - [256, 6656, 1, 384, 256, 256, 384, 6656]
    - [72, 42.39]
  - - [2176, 3584, 1, 3968, 2176, 2176, 3968, 3584]
    - [78, 102.42]
  - - [1280, 6016, 1, 3712, 1280, 1280, 3712, 6016]
    - [33, 110.42]
  - - [6784, 5248, 1, 4992, 6784, 6784, 4992, 5248]
    - [29, 106.32]
  - - [1408, 6272, 1, 7936, 1408, 1408, 7936, 6272]
    - [30, 104.24]
  - - [640, 512, 1, 6144, 640, 640, 6144, 512]
    - [10, 56.54]
  - - [1536, 6272, 1, 7168, 1536, 1536, 7168, 6272]
    - [32, 113.64]
  - - [1664, 6528, 1, 8064, 1664, 1664, 8064, 6528]
    - [37, 109.69]
  - - [7936, 2688, 1, 7552, 7936, 7936, 7552, 2688]
    - [25, 103.56]
  - - [6144, 7296, 1, 512, 6144, 6144, 512, 7296]
    - [42, 106.06]
  - - [4992, 1664, 1, 5376, 4992, 4992, 5376, 1664]
    - [76, 86.95]
  - - [1024, 7168, 1, 2304, 1024, 1024, 2304, 7168]
    - [25, 104.93]
  - - [6528, 7040, 1, 7808, 6528, 6528, 7808, 7040]
    - [43, 129.82]
  - - [4736, 5760, 1, 768, 4736, 4736, 768, 5760]
    - [44, 109.36]
  - - [1664, 3712, 1, 5248, 1664, 1664, 5248, 3712]
    - [75, 92.76]
  - - [7040, 4608, 1, 5376, 7040, 7040, 5376, 4608]
    - [36, 130.13]
  - - [6400, 1920, 1, 6656, 6400, 6400, 6656, 1920]
    - [37, 117.52]
  - - [640, 3072, 1, 4480, 640, 640, 4480, 3072]
    - [76, 79.82]
  - - [7168, 3584, 1, 6016, 7168, 7168, 6016, 3584]
    - [37, 124.35]
  - - [2304, 4224, 1, 3584, 2304, 2304, 3584, 4224]
    - [32, 111.32]
  - - [6912, 768, 1, 1024, 6912, 6912, 1024, 768]
    - [24, 78.53]
  - - [6016, 1792, 1, 896, 6016, 6016, 896, 1792]
    - [44, 98.14]
  - - [2176, 128, 1, 3840, 2176, 2176, 3840, 128]
    - [91, 39.98]
  - - [3584, 1280, 1, 1024, 3584, 3584, 1024, 1280]
    - [26, 91.09]
  - - [4736, 7680, 1, 2816, 4736, 4736, 2816, 7680]
    - [28, 105.47]
  - - [3968, 4864, 1, 4608, 3968, 3968, 4608, 4864]
    - [39, 116.47]
  - - [7040, 3328, 1, 3200, 7040, 7040, 3200, 3328]
    - [44, 115.05]
  - - [4480, 640, 1, 7936, 4480, 4480, 7936, 640]
    - [39, 92.52]
  - - [5248, 5888, 1, 3072, 5248, 5248, 3072, 5888]
    - [40, 119.22]
  - - [7680, 4096, 1, 2048, 7680, 7680, 2048, 4096]
    - [40, 119.17]
  - - [5504, 4992, 1, 4352, 5504, 5504, 4352, 4992]
    - [38, 122.56]
  - - [384, 256, 1, 1664, 384, 384, 1664, 256]
    - [15, 11.11]
  - - [3072, 2688, 1, 1920, 3072, 3072, 1920, 2688]
    - [85, 102.23]
  - - [5888, 6272, 1, 7424, 5888, 5888, 7424, 6272]
    - [37, 118.03]
  - - [4736, 1664, 1, 6912, 4736, 4736, 6912, 1664]
    - [93, 102.53]
  - - [2304, 384, 1, 1280, 2304, 2304, 1280, 384]
    - [77, 43.55]
  - - [3584, 2560, 1, 7168, 3584, 3584, 7168, 2560]
    - [30, 108.56]
  - - [1408, 2048, 1, 7168, 1408, 1408, 7168, 2048]
    - [39, 98.67]
  - - [4224, 4736, 1, 384, 4224, 4224, 384, 4736]
    - [45, 87.62]
  - - [6912, 7680, 1, 3072, 6912, 6912, 3072, 7680]
    - [38, 120.38]
  - - [768, 1152, 1, 640, 768, 768, 640, 1152]
    - [71, 32.78]
  - - [2560, 768, 1, 7936, 2560, 2560, 7936, 768]
    - [39, 97.29]
  - - [6912, 3584, 1, 4608, 6912, 6912, 4608, 3584]
    - [38, 117.73]
  - - [1152, 896, 1, 1280, 1152, 1152, 1280, 896]
    - [72, 50.45]
  - - [5248, 7936, 1, 3712, 5248, 5248, 3712, 7936]
    - [37, 126.89]
  - - [3840, 2048, 1, 1024, 3840, 3840, 1024, 2048]
    - [92, 95.96]
  - - [640, 1664, 1, 4608, 640, 640, 4608, 1664]
    - [5, 73.65]
  - - [4352, 4096, 1, 1152, 4352, 4352, 1152, 4096]
    - [28, 97.78]
  - - [256, 5376, 1, 2176, 256, 256, 2176, 5376]
    - [10, 66.63]
  - - [6144, 3840, 1, 5632, 6144, 6144, 5632, 3840]
    - [25, 115.33]
  - - [6528, 7552, 1, 6144, 6528, 6528, 6144, 7552]
    - [36, 133.18]
  - - [3456, 2688, 1, 2944, 3456, 3456, 2944, 2688]
    - [32, 106.6]
  - - [5376, 4992, 1, 8064, 5376, 5376, 8064, 4992]
    - [37, 124.77]
  - - [512, 4480, 1, 6656, 512, 512, 6656, 4480]
    - [58, 95.13]
  - - [3712, 3456, 1, 128, 3712, 3712, 128, 3456]
    - [47, 48.07]
  - - [7424, 2048, 1, 1920, 7424, 7424, 1920, 2048]
    - [36, 115.19]
  - - [2304, 1536, 1, 3328, 2304, 2304, 3328, 1536]
    - [4, 90.39]
  - - [6784, 2560, 1, 7424, 6784, 6784, 7424, 2560]
    - [28, 103.09]
  - - [5888, 4352, 1, 768, 5888, 5888, 768, 4352]
    - [38, 106.09]
  - - [512, 4736, 1, 1536, 512, 512, 1536, 4736]
    - [26, 75.45]
  - - [5888, 6272, 1, 1408, 5888, 5888, 1408, 6272]
    - [38, 111.04]
  - - [4480, 1920, 1, 7168, 4480, 4480, 7168, 1920]
    - [28, 100.17]
  - - [7680, 6144, 1, 3328, 7680, 7680, 3328, 6144]
    - [36, 126.24]
  - - [2432, 4608, 1, 3712, 2432, 2432, 3712, 4608]
    - [38, 112.02]
  - - [256, 384, 1, 7296, 256, 256, 7296, 384]
    - [18, 30.56]
  - - [3712, 5376, 1, 6656, 3712, 3712, 6656, 5376]
    - [39, 118.83]
  - - [7040, 4352, 1, 4224, 7040, 7040, 4224, 4352]
    - [40, 120.41]
  - - [1536, 5120, 1, 1792, 1536, 1536, 1792, 5120]
    - [25, 109.65]
  - - [896, 3072, 1, 3968, 896, 896, 3968, 3072]
    - [78, 89.0]
  - - [2560, 2688, 1, 3584, 2560, 2560, 3584, 2688]
    - [25, 100.22]
  - - [128, 2048, 1, 5632, 128, 128, 5632, 2048]
    - [18, 43.57]
  - - [384, 5888, 1, 6784, 384, 384, 6784, 5888]
    - [5, 93.47]
  - - [7424, 896, 1, 8064, 7424, 7424, 8064, 896]
    - [25, 99.52]
  - - [6016, 4352, 1, 5632, 6016, 6016, 5632, 4352]
    - [37, 123.49]
  - - [2688, 2176, 1, 3712, 2688, 2688, 3712, 2176]
    - [24, 90.21]
  - - [4224, 6144, 1, 3712, 4224, 4224, 3712, 6144]
    - [37, 121.91]
  - - [7424, 384, 1, 1536, 7424, 7424, 1536, 384]
    - [87, 79.6]
  - - [3712, 4736, 1, 3072, 3712, 3712, 3072, 4736]
    - [30, 105.03]
  - - [896, 1536, 1, 7040, 896, 896, 7040, 1536]
    - [27, 80.34]
  - - [6144, 1920, 1, 7296, 6144, 6144, 7296, 1920]
    - [44, 114.68]
  - - [3456, 2176, 1, 2176, 3456, 3456, 2176, 2176]
    - [25, 105.29]
  - - [5888, 896, 1, 5632, 5888, 5888, 5632, 896]
    - [24, 80.86]
  - - [5888, 6784, 1, 1792, 5888, 5888, 1792, 6784]
    - [38, 115.54]
  - - [384, 2432, 1, 4224, 384, 384, 4224, 2432]
    - [84, 69.61]
  - - [2816, 3584, 1, 1664, 2816, 2816, 1664, 3584]
    - [39, 112.49]
  - - [2432, 5376, 1, 1664, 2432, 2432, 1664, 5376]
    - [37, 114.3]
  - - [4608, 7936, 1, 2176, 4608, 4608, 2176, 7936]
    - [44, 116.81]
  - - [6656, 3584, 1, 384, 6656, 6656, 384, 3584]
    - [93, 83.28]
  - - [7808, 6528, 1, 640, 7808, 7808, 640, 6528]
    - [40, 102.31]
  - - [7296, 6784, 1, 4096, 7296, 7296, 4096, 6784]
    - [39, 117.98]
  - - [2688, 384, 1, 3072, 2688, 2688, 3072, 384]
    - [27, 65.01]
  - - [3200, 4736, 1, 6272, 3200, 3200, 6272, 4736]
    - [42, 124.39]
  - - [7168, 7424, 1, 5888, 7168, 7168, 5888, 7424]
    - [44, 127.14]
  - - [4992, 768, 1, 5888, 4992, 4992, 5888, 768]
    - [4, 96.03]
  - - [6400, 256, 1, 1152, 6400, 6400, 1152, 256]
    - [76, 51.36]
  - - [4992, 768, 1, 7808, 4992, 4992, 7808, 768]
    - [4, 96.88]
  - - [4736, 4736, 1, 5120, 4736, 4736, 5120, 4736]
    - [25, 110.81]
  - - [5504, 2816, 1, 128, 5504, 5504, 128, 2816]
    - [36, 51.71]
  - - [4736, 640, 1, 6016, 4736, 4736, 6016, 640]
    - [49, 94.41]
  - - [2048, 1152, 1, 5376, 2048, 2048, 5376, 1152]
    - [26, 92.99]
  - - [5760, 3712, 1, 6016, 5760, 5760, 6016, 3712]
    - [25, 106.73]
  - - [640, 2048, 1, 4736, 640, 640, 4736, 2048]
    - [76, 75.09]
  - - [6016, 3328, 1, 1408, 6016, 6016, 1408, 3328]
    - [39, 111.49]
  - - [2688, 6912, 1, 4224, 2688, 2688, 4224, 6912]
    - [32, 111.42]
  - - [6272, 4736, 1, 2944, 6272, 6272, 2944, 4736]
    - [43, 124.58]
  - - [3456, 4352, 1, 1664, 3456, 3456, 1664, 4352]
    - [43, 119.68]
  - - [3584, 3840, 1, 4096, 3584, 3584, 4096, 3840]
    - [38, 124.5]
  - - [1792, 5120, 1, 3584, 1792, 1792, 3584, 5120]
    - [32, 107.66]
  - - [4352, 1408, 1, 4224, 4352, 4352, 4224, 1408]
    - [84, 91.98]
  - - [2176, 896, 1, 7552, 2176, 2176, 7552, 896]
    - [27, 82.69]
  - - [128, 640, 1, 1920, 128, 128, 1920, 640]
    - [9, 11.86]
  - - [4864, 512, 1, 6784, 4864, 4864, 6784, 512]
    - [40, 97.25]
  - - [7552, 4736, 1, 128, 7552, 7552, 128, 4736]
    - [54, 57.3]
  - - [1536, 3328, 1, 6144, 1536, 1536, 6144, 3328]
    - [45, 110.27]
  - - [6528, 2432, 1, 1920, 6528, 6528, 1920, 2432]
    - [36, 119.2]
  - - [6272, 4352, 1, 7040, 6272, 6272, 7040, 4352]
    - [38, 124.06]
  - - [6400, 128, 1, 768, 6400, 6400, 768, 128]
    - [71, 30.81]
  - - [1280, 1408, 1, 5632, 1280, 1280, 5632, 1408]
    - [27, 78.18]
  - - [3840, 4608, 1, 6784, 3840, 3840, 6784, 4608]
    - [28, 105.03]
  - - [5760, 3584, 1, 7936, 5760, 5760, 7936, 3584]
    - [40, 121.67]
  - - [640, 3840, 1, 4992, 640, 640, 4992, 3840]
    - [56, 96.12]
  - - [6144, 6272, 1, 5632, 6144, 6144, 5632, 6272]
    - [37, 121.25]
  - - [1920, 640, 1, 1152, 1920, 1920, 1152, 640]
    - [10, 51.67]
  - - [8064, 1408, 1, 4480, 8064, 8064, 4480, 1408]
    - [37, 110.21]
  - - [3968, 2176, 1, 6400, 3968, 3968, 6400, 2176]
    - [30, 102.45]
  - - [4864, 7936, 1, 3072, 4864, 4864, 3072, 7936]
    - [38, 119.55]
  - - [4736, 7168, 1, 5120, 4736, 4736, 5120, 7168]
    - [29, 102.75]
  - - [3200, 6784, 1, 1408, 3200, 3200, 1408, 6784]
    - [25, 101.43]
  - - [7808, 256, 1, 6016, 7808, 7808, 6016, 256]
    - [76, 74.77]
  - - [5248, 1664, 1, 7168, 5248, 5248, 7168, 1664]
    - [39, 106.96]
  - - [7808, 4608, 1, 5120, 7808, 7808, 5120, 4608]
    - [28, 105.56]
  - - [384, 7040, 1, 4864, 384, 384, 4864, 7040]
    - [86, 85.0]
  - - [128, 4224, 1, 4224, 128, 128, 4224, 4224]
    - [76, 50.33]
  - - [4736, 3840, 1, 768, 4736, 4736, 768, 3840]
    - [40, 102.64]
  - - [1024, 1536, 1, 4224, 1024, 1024, 4224, 1536]
    - [84, 83.42]
  - - [4352, 2560, 1, 128, 4352, 4352, 128, 2560]
    - [47, 51.44]
  - - [896, 2176, 1, 3712, 896, 896, 3712, 2176]
    - [76, 77.87]
  - - [1792, 3840, 1, 1024, 1792, 1792, 1024, 3840]
    - [25, 94.83]
  - - [2688, 3456, 1, 4608, 2688, 2688, 4608, 3456]
    - [39, 110.59]
  - - [4992, 3328, 1, 2432, 4992, 4992, 2432, 3328]
    - [79, 106.62]
  - - [2944, 896, 1, 1152, 2944, 2944, 1152, 896]
    - [75, 71.7]
  - - [1920, 2944, 1, 2560, 1920, 1920, 2560, 2944]
    - [24, 87.65]
  - - [4096, 3200, 1, 1408, 4096, 4096, 1408, 3200]
    - [37, 111.93]
  - - [3328, 2560, 1, 1792, 3328, 3328, 1792, 2560]
    - [28, 97.54]
  - - [3072, 2688, 1, 768, 3072, 3072, 768, 2688]
    - [85, 93.92]
  - - [2176, 2816, 1, 2304, 2176, 2176, 2304, 2816]
    - [24, 91.02]
  - - [3328, 1536, 1, 2944, 3328, 3328, 2944, 1536]
    - [40, 100.19]
  - - [3584, 2304, 1, 2688, 3584, 3584, 2688, 2304]
    - [85, 101.24]
  - - [2432, 1536, 1, 4736, 2432, 2432, 4736, 1536]
    - [4, 94.48]
  - - [1792, 2304, 1, 2944, 1792, 1792, 2944, 2304]
    - [76, 86.02]
  - - [4736, 3712, 1, 1152, 4736, 4736, 1152, 3712]
    - [28, 96.03]
  - - [3968, 2944, 1, 3712, 3968, 3968, 3712, 2944]
    - [37, 112.49]
  - - [3712, 1792, 1, 3584, 3712, 3712, 3584, 1792]
    - [25, 99.75]
  - - [4992, 1280, 1, 512, 4992, 4992, 512, 1280]
    - [78, 72.16]
  - - [3200, 4224, 1, 1152, 3200, 3200, 1152, 4224]
    - [37, 112.51]
  - - [3200, 768, 1, 3584, 3200, 3200, 3584, 768]
    - [56, 90.92]
  - - [1280, 3840, 1, 4480, 1280, 1280, 4480, 3840]
    - [40, 104.6]
  - - [3456, 1664, 1, 3968, 3456, 3456, 3968, 1664]
    - [24, 86.89]
  - - [3456, 2304, 1, 3072, 3456, 3456, 3072, 2304]
    - [79, 103.52]
  - - [2432, 3200, 1, 3328, 2432, 2432, 3328, 3200]
    - [79, 101.66]
  - - [1792, 384, 1, 3968, 1792, 1792, 3968, 384]
    - [27, 58.9]
  - - [2432, 4480, 1, 4352, 2432, 2432, 4352, 4480]
    - [38, 109.17]
  - - [1536, 128, 1, 1408, 1536, 1536, 1408, 128]
    - [15, 15.58]
  - - [4608, 2176, 1, 4352, 4608, 4608, 4352, 2176]
    - [52, 116.29]
  - - [768, 384, 1, 4096, 768, 768, 4096, 384]
    - [10, 46.34]
  - - [3840, 4992, 1, 1024, 3840, 3840, 1024, 4992]
    - [32, 107.36]
  - - [1152, 4736, 1, 2304, 1152, 1152, 2304, 4736]
    - [24, 86.15]
  - - [2944, 4736, 1, 1664, 2944, 2944, 1664, 4736]
    - [42, 113.89]
  - - [4864, 4480, 1, 4864, 4864, 4864, 4864, 4480]
    - [25, 109.47]
  - - [2688, 4608, 1, 3456, 2688, 2688, 3456, 4608]
    - [44, 118.46]
  - - [3072, 128, 1, 1536, 3072, 3072, 1536, 128]
    - [18, 26.51]
  - - [3200, 1920, 1, 1408, 3200, 3200, 1408, 1920]
    - [95, 93.81]
  - - [768, 4352, 1, 2304, 768, 768, 2304, 4352]
    - [4, 84.92]
  - - [384, 1024, 1, 2688, 384, 384, 2688, 1024]
    - [10, 43.56]
  - - [2816, 4352, 1, 2560, 2816, 2816, 2560, 4352]
    - [44, 115.18]
  - - [2944, 4352, 1, 1152, 2944, 2944, 1152, 4352]
    - [37, 109.6]
  - - [2432, 2944, 1, 768, 2432, 2432, 768, 2944]
    - [33, 91.62]
  - - [2176, 3840, 1, 4224, 2176, 2176, 4224, 3840]
    - [79, 106.23]
  - - [384, 3968, 1, 2560, 384, 384, 2560, 3968]
    - [10, 72.84]
  - - [4864, 4736, 1, 1792, 4864, 4864, 1792, 4736]
    - [25, 107.67]
  - - [4992, 3072, 1, 384, 4992, 4992, 384, 3072]
    - [33, 82.57]
  - - [1152, 256, 1, 4992, 1152, 1152, 4992, 256]
    - [91, 45.06]
  - - [2816, 3200, 1, 2560, 2816, 2816, 2560, 3200]
    - [39, 106.9]
  - - [1280, 4352, 1, 3072, 1280, 1280, 3072, 4352]
    - [24, 86.8]
  - - [640, 3328, 1, 2688, 640, 640, 2688, 3328]
    - [5, 76.94]
  - - [1024, 2176, 1, 640, 1024, 1024, 640, 2176]
    - [84, 59.03]
  - - [1408, 1664, 1, 3072, 1408, 1408, 3072, 1664]
    - [56, 86.24]
  - - [2048, 4352, 1, 3072, 2048, 2048, 3072, 4352]
    - [29, 101.52]
  - - [128, 4992, 1, 4992, 128, 128, 4992, 4992]
    - [76, 57.67]
  - - [2688, 256, 1, 2560, 2688, 2688, 2560, 256]
    - [10, 51.75]
  - - [3968, 128, 1, 1408, 3968, 3968, 1408, 128]
    - [64, 34.62]
  - - [1280, 2560, 1, 1792, 1280, 1280, 1792, 2560]
    - [4, 82.35]
  - - [2560, 1408, 1, 4608, 2560, 2560, 4608, 1408]
    - [4, 90.48]
  - - [3840, 256, 1, 4352, 3840, 3840, 4352, 256]
    - [76, 65.9]
  - - [3712, 3584, 1, 2944, 3712, 3712, 2944, 3584]
    - [38, 117.33]
  - - [896, 384, 1, 1536, 896, 896, 1536, 384]
    - [16, 24.64]
  - - [2944, 2304, 1, 4352, 2944, 2944, 4352, 2304]
    - [25, 98.93]
  - - [256, 2688, 1, 3072, 256, 256, 3072, 2688]
    - [10, 59.73]
  - - [1792, 1280, 1, 2816, 1792, 1792, 2816, 1280]
    - [58, 85.82]
  - - [1408, 1536, 1, 3200, 1408, 1408, 3200, 1536]
    - [5, 83.56]
  - - [4736, 1920, 1, 1152, 4736, 4736, 1152, 1920]
    - [32, 98.0]
  - - [2176, 768, 1, 1408, 2176, 2176, 1408, 768]
    - [27, 55.12]
  - - [1408, 4352, 1, 3840, 1408, 1408, 3840, 4352]
    - [24, 91.51]
  - - [4480, 1920, 1, 4736, 4480, 4480, 4736, 1920]
    - [28, 98.61]
  - - [1664, 4096, 1, 4352, 1664, 1664, 4352, 4096]
    - [25, 103.18]
  - - [3328, 3968, 1, 2432, 3328, 3328, 2432, 3968]
    - [38, 117.55]
  - - [512, 2560, 1, 4224, 512, 512, 4224, 2560]
    - [27, 73.06]
  - - [3328, 4864, 1, 1408, 3328, 3328, 1408, 4864]
    - [36, 122.26]
  - - [4992, 1664, 1, 4608, 4992, 4992, 4608, 1664]
    - [76, 86.66]
  - - [3072, 4864, 1, 3328, 3072, 3072, 3328, 4864]
    - [43, 123.69]
  - - [1792, 1664, 1, 3712, 1792, 1792, 3712, 1664]
    - [75, 87.56]
  - - [4352, 3968, 1, 4352, 4352, 4352, 4352, 3968]
    - [28, 100.85]
  - - [2048, 4864, 1, 1280, 2048, 2048, 1280, 4864]
    - [32, 106.1]
  - - [3712, 1536, 1, 1152, 3712, 3712, 1152, 1536]
    - [24, 82.56]
  - - [1536, 1536, 1, 2432, 1536, 1536, 2432, 1536]
    - [5, 84.89]
  - - [4608, 1664, 1, 1536, 4608, 4608, 1536, 1664]
    - [85, 95.16]
  - - [4224, 3072, 1, 768, 4224, 4224, 768, 3072]
    - [38, 104.15]
  - - [128, 1408, 1, 4480, 128, 128, 4480, 1408]
    - [10, 35.64]
  - - [4480, 1536, 1, 1152, 4480, 4480, 1152, 1536]
    - [25, 94.81]
  - - [4992, 1408, 1, 2304, 4992, 4992, 2304, 1408]
    - [33, 94.77]
  - - [3584, 512, 1, 1792, 3584, 3584, 1792, 512]
    - [27, 64.96]
  - - [2432, 4480, 1, 2176, 2432, 2432, 2176, 4480]
    - [38, 106.03]
  - - [2432, 896, 1, 2944, 2432, 2432, 2944, 896]
    - [56, 81.96]
  - - [2304, 3968, 1, 1792, 2304, 2304, 1792, 3968]
    - [30, 100.52]
  - - [896, 3968, 1, 1664, 896, 896, 1664, 3968]
    - [4, 84.33]
  - - [2176, 4480, 1, 1280, 2176, 2176, 1280, 4480]
    - [40, 104.71]
  - - [128, 2816, 1, 4224, 128, 128, 4224, 2816]
    - [10, 49.45]
  - - [2560, 3072, 1, 4992, 2560, 2560, 4992, 3072]
    - [33, 110.36]
  - - [1152, 3072, 1, 1152, 1152, 1152, 1152, 3072]
    - [4, 82.01]
  - - [4992, 2816, 1, 3328, 4992, 4992, 3328, 2816]
    - [38, 120.99]
  - - [3840, 2176, 1, 4224, 3840, 3840, 4224, 2176]
    - [93, 105.5]
  - - [128, 3968, 1, 4736, 128, 128, 4736, 3968]
    - [10, 57.13]
  - - [768, 256, 1, 1152, 768, 768, 1152, 256]
    - [15, 14.15]
  - - [4608, 1024, 1, 2304, 4608, 4608, 2304, 1024]
    - [26, 97.3]
  - - [2176, 2432, 1, 3328, 2176, 2176, 3328, 2432]
    - [24, 83.68]
  - - [768, 1024, 1, 3328, 768, 768, 3328, 1024]
    - [73, 63.92]
  - - [1536, 3200, 1, 3840, 1536, 1536, 3840, 3200]
    - [26, 105.11]
  - - [4480, 1280, 1, 3968, 4480, 4480, 3968, 1280]
    - [24, 87.86]
  - - [1792, 1280, 1, 768, 1792, 1792, 768, 1280]
    - [84, 63.58]
  - - [3968, 1408, 1, 1536, 3968, 3968, 1536, 1408]
    - [24, 80.81]
  - - [4992, 2432, 1, 4736, 4992, 4992, 4736, 2432]
    - [38, 110.46]
  - - [2688, 1536, 1, 3328, 2688, 2688, 3328, 1536]
    - [27, 87.19]
  - - [4992, 3840, 1, 512, 4992, 4992, 512, 3840]
    - [45, 91.75]
  - - [2048, 1152, 1, 1152, 2048, 2048, 1152, 1152]
    - [84, 71.78]
  - - [2048, 4608, 1, 256, 2048, 2048, 256, 4608]
    - [49, 75.46]
  - - [2432, 2048, 1, 4224, 2432, 2432, 4224, 2048]
    - [26, 106.34]
  - - [1792, 3200, 1, 4992, 1792, 1792, 4992, 3200]
    - [24, 89.33]
  - - [2432, 1408, 1, 2816, 2432, 2432, 2816, 1408]
    - [4, 84.39]
  - - [1152, 3584, 1, 1152, 1152, 1152, 1152, 3584]
    - [27, 81.52]
  - - [4096, 2688, 1, 2944, 4096, 4096, 2944, 2688]
    - [38, 104.54]
  - - [3712, 4480, 1, 640, 3712, 3712, 640, 4480]
    - [36, 108.57]
  - - [2944, 2944, 1, 640, 2944, 2944, 640, 2944]
    - [32, 90.6]
  - - [4992, 3712, 1, 896, 4992, 4992, 896, 3712]
    - [39, 102.39]
  - - [1536, 4352, 1, 896, 1536, 1536, 896, 4352]
    - [25, 93.92]
  - - [1152, 3840, 1, 4352, 1152, 1152, 4352, 3840]
    - [5, 101.56]
  - - [4352, 256, 1, 3072, 4352, 4352, 3072, 256]
    - [27, 61.87]
  - - [1664, 4608, 1, 2304, 1664, 1664, 2304, 4608]
    - [79, 100.07]
  - - [1792, 4096, 1, 2944, 1792, 1792, 2944, 4096]
    - [25, 104.68]
  - - [384, 2048, 1, 4608, 384, 384, 4608, 2048]
    - [73, 67.95]
  - - [2304, 3456, 1, 1280, 2304, 2304, 1280, 3456]
    - [85, 97.78]
  - - [2816, 1920, 1, 3584, 2816, 2816, 3584, 1920]
    - [24, 83.86]
  - - [1536, 3456, 1, 2176, 1536, 1536, 2176, 3456]
    - [24, 84.26]
  - - [2432, 4864, 1, 4096, 2432, 2432, 4096, 4864]
    - [44, 114.92]
  - - [1024, 1920, 1, 3712, 1024, 1024, 3712, 1920]
    - [76, 78.45]
  - - [2816, 2944, 1, 3200, 2816, 2816, 3200, 2944]
    - [85, 102.91]
  - - [1280, 640, 1, 4096, 1280, 1280, 4096, 640]
    - [27, 64.0]
  - - [384, 3328, 1, 1024, 384, 384, 1024, 3328]
    - [10, 56.29]
  - - [4352, 2688, 1, 2432, 4352, 4352, 2432, 2688]
    - [38, 106.96]
  - - [384, 3072, 1, 1664, 384, 384, 1664, 3072]
    - [10, 59.99]
  - - [2560, 1920, 1, 1024, 2560, 2560, 1024, 1920]
    - [26, 93.67]
  - - [896, 4224, 1, 256, 896, 896, 256, 4224]
    - [27, 49.72]
  - - [3072, 3072, 1, 1280, 3072, 3072, 1280, 3072]
    - [39, 105.36]
  - - [1920, 4608, 1, 1408, 1920, 1920, 1408, 4608]
    - [39, 104.8]
  - - [1792, 2048, 1, 4480, 1792, 1792, 4480, 2048]
    - [44, 102.26]
  - - [4480, 256, 1, 3712, 4480, 4480, 3712, 256]
    - [27, 64.3]
  - - [384, 4864, 1, 4992, 384, 384, 4992, 4864]
    - [76, 74.7]
  - - [1920, 1024, 1, 2304, 1920, 1920, 2304, 1024]
    - [76, 72.09]
  - - [3584, 1664, 1, 1920, 3584, 3584, 1920, 1664]
    - [94, 92.11]
  - - [768, 768, 1, 2176, 768, 768, 2176, 768]
    - [87, 47.54]
  - - [640, 3200, 1, 640, 640, 640, 640, 3200]
    - [77, 58.14]
  - - [896, 2688, 1, 1152, 896, 896, 1152, 2688]
    - [84, 72.29]
  - - [896, 2816, 1, 2304, 896, 896, 2304, 2816]
    - [26, 85.36]
  - - [4352, 2688, 1, 3456, 4352, 4352, 3456, 2688]
    - [38, 108.66]
  - - [3072, 512, 1, 1920, 3072, 3072, 1920, 512]
    - [73, 65.54]
  - - [2816, 2560, 1, 2304, 2816, 2816, 2304, 2560]
    - [25, 104.31]
  - - [3712, 768, 1, 768, 3712, 3712, 768, 768]
    - [75, 69.96]
  - - [3840, 4736, 1, 1664, 3840, 3840, 1664, 4736]
    - [40, 108.37]
  - - [3456, 4352, 1, 3712, 3456, 3456, 3712, 4352]
    - [43, 125.55]
  - - [128, 2944, 1, 4352, 128, 128, 4352, 2944]
    - [10, 51.8]
  - - [3712, 3072, 1, 1152, 3712, 3712, 1152, 3072]
    - [38, 103.46]
  - - [1024, 1280, 1, 3200, 1024, 1024, 3200, 1280]
    - [76, 69.79]
  - - [1792, 256, 1, 768, 1792, 1792, 768, 256]
    - [18, 21.47]
  - - [1920, 3712, 1, 1280, 1920, 1920, 1280, 3712]
    - [25, 101.29]
  - - [896, 2816, 1, 1920, 896, 896, 1920, 2816]
    - [26, 81.2]
  - - [2304, 3712, 1, 4224, 2304, 2304, 4224, 3712]
    - [30, 102.79]
  - - [2048, 2048, 1, 128, 2048, 2048, 128, 2048]
    - [27, 36.64]
  - - [1920, 3968, 1, 896, 1920, 1920, 896, 3968]
    - [33, 98.56]
  - - [3072, 3712, 1, 3072, 3072, 3072, 3072, 3712]
    - [37, 109.71]
  - - [3456, 3200, 1, 2688, 3456, 3456, 2688, 3200]
    - [44, 107.64]
  - - [1664, 4736, 1, 384, 1664, 1664, 384, 4736]
    - [79, 78.28]
  - - [4864, 2688, 1, 768, 4864, 4864, 768, 2688]
    - [44, 105.15]
  - - [3584, 128, 1, 2816, 3584, 3584, 2816, 128]
    - [77, 43.77]
  - - [2176, 3456, 1, 2304, 2176, 2176, 2304, 3456]
    - [25, 104.93]
  - - [2176, 1920, 1, 512, 2176, 2176, 512, 1920]
    - [76, 70.77]
  - - [3200, 1024, 1, 1152, 3200, 3200, 1152, 1024]
    - [4, 74.99]
  - - [3328, 4608, 1, 1792, 3328, 3328, 1792, 4608]
    - [36, 121.35]
  - - [2944, 4864, 1, 3712, 2944, 2944, 3712, 4864]
    - [42, 117.8]
  - - [1408, 256, 1, 1664, 1408, 1408, 1664, 256]
    - [67, 29.02]
  - - [896, 2048, 1, 4608, 896, 896, 4608, 2048]
    - [76, 77.11]
  - - [4736, 256, 1, 2048, 4736, 4736, 2048, 256]
    - [10, 57.41]
  - - [3840, 1408, 1, 4096, 3840, 3840, 4096, 1408]
    - [24, 83.47]
  - - [4608, 768, 1, 3584, 4608, 4608, 3584, 768]
    - [4, 89.82]
  - - [512, 3200, 1, 3456, 512, 512, 3456, 3200]
    - [56, 82.25]
  - - [2688, 1536, 1, 2560, 2688, 2688, 2560, 1536]
    - [27, 85.83]
  - - [2048, 384, 1, 3584, 2048, 2048, 3584, 384]
    - [10, 61.0]
  - - [1024, 4736, 1, 3712, 1024, 1024, 3712, 4736]
    - [26, 102.44]
  - - [4224, 2688, 1, 1792, 4224, 4224, 1792, 2688]
    - [38, 103.51]
  - - [1792, 2560, 1, 1792, 1792, 1792, 1792, 2560]
    - [26, 97.11]
  - - [3968, 3840, 1, 1664, 3968, 3968, 1664, 3840]
    - [43, 119.64]
  - - [2432, 3328, 1, 768, 2432, 2432, 768, 3328]
    - [78, 94.05]
  - - [4608, 4224, 1, 2304, 4608, 4608, 2304, 4224]
    - [39, 111.99]
  - - [128, 2944, 1, 2816, 128, 128, 2816, 2944]
    - [10, 44.19]
  - - [4224, 2816, 1, 4096, 4224, 4224, 4096, 2816]
    - [44, 116.12]
  - - [1920, 4864, 1, 2688, 1920, 1920, 2688, 4864]
    - [40, 111.97]
  - - [4096, 768, 1, 2432, 4096, 4096, 2432, 768]
    - [75, 85.11]
  - - [640, 768, 1, 3072, 640, 640, 3072, 768]
    - [10, 54.66]
  - - [3584, 4480, 1, 3456, 3584, 3584, 3456, 4480]
    - [36, 127.49]
  - - [896, 1792, 1, 2816, 896, 896, 2816, 1792]
    - [56, 75.3]
  - - [128, 4352, 1, 768, 128, 128, 768, 4352]
    - [10, 25.3]
  - - [4352, 4736, 1, 896, 4352, 4352, 896, 4736]
    - [49, 108.07]
  - - [3584, 3200, 1, 512, 3584, 3584, 512, 3200]
    - [47, 91.42]
  - - [4736, 512, 1, 2176, 4736, 4736, 2176, 512]
    - [84, 72.8]
  - - [4480, 4096, 1, 2816, 4480, 4480, 2816, 4096]
    - [28, 103.14]
  - - [2816, 2304, 1, 4992, 2816, 2816, 4992, 2304]
    - [25, 98.49]
  - - [512, 1024, 1, 4480, 512, 512, 4480, 1024]
    - [27, 52.06]
  - - [512, 1152, 1, 768, 512, 512, 768, 1152]
    - [10, 26.42]
  - - [1664, 4224, 1, 4608, 1664, 1664, 4608, 4224]
    - [25, 104.52]
  - - [4864, 4736, 1, 896, 4864, 4864, 896, 4736]
    - [25, 103.1]
  - - [1664, 2688, 1, 3584, 1664, 1664, 3584, 2688]
    - [5, 99.22]
  - - [2816, 3584, 1, 2432, 2816, 2816, 2432, 3584]
    - [39, 113.22]
  - - [2560, 3712, 1, 2560, 2560, 2560, 2560, 3712]
    - [32, 109.84]
  - - [1920, 4864, 1, 1408, 1920, 1920, 1408, 4864]
    - [40, 106.7]
  - - [2816, 1792, 1, 2560, 2816, 2816, 2560, 1792]
    - [40, 95.91]
  - - [3200, 4736, 1, 2560, 3200, 3200, 2560, 4736]
    - [42, 121.83]
  - - [512, 1152, 1, 3712, 512, 512, 3712, 1152]
    - [84, 61.06]
  - - [2816, 3072, 1, 3328, 2816, 2816, 3328, 3072]
    - [30, 103.64]
  - - [1536, 1664, 1, 768, 1536, 1536, 768, 1664]
    - [84, 68.27]
  - - [3584, 1152, 1, 4352, 3584, 3584, 4352, 1152]
    - [27, 87.56]
  - - [3456, 1920, 1, 2432, 3456, 3456, 2432, 1920]
    - [25, 100.49]
  - - [1920, 1408, 1, 2432, 1920, 1920, 2432, 1408]
    - [84, 81.43]
  - - [2304, 1408, 1, 4864, 2304, 2304, 4864, 1408]
    - [52, 97.32]
  - - [384, 4096, 1, 768, 384, 384, 768, 4096]
    - [69, 52.28]
  - - [768, 3840, 1, 2304, 768, 768, 2304, 3840]
    - [84, 84.8]
  - - [3712, 4352, 1, 2560, 3712, 3712, 2560, 4352]
    - [36, 125.35]
  - - [3584, 3840, 1, 3328, 3584, 3584, 3328, 3840]
    - [38, 123.16]
  - - [3200, 512, 1, 256, 3200, 3200, 256, 512]
    - [77, 31.98]
  - - [2688, 3200, 1, 640, 2688, 2688, 640, 3200]
    - [39, 89.87]
  - - [2432, 4352, 1, 4864, 2432, 2432, 4864, 4352]
    - [44, 109.39]
  - - [2944, 2432, 1, 2432, 2944, 2944, 2432, 2432]
    - [25, 102.61]
  - - [3328, 2304, 1, 1408, 3328, 3328, 1408, 2304]
    - [33, 99.54]
  - - [1280, 4736, 1, 3328, 1280, 1280, 3328, 4736]
    - [48, 96.5]
  - - [1152, 2688, 1, 640, 1152, 1152, 640, 2688]
    - [84, 72.23]
  - - [2176, 2432, 1, 4992, 2176, 2176, 4992, 2432]
    - [24, 84.95]
  - - [4096, 3456, 1, 3072, 4096, 4096, 3072, 3456]
    - [53, 120.46]
  - - [3968, 4992, 1, 4480, 3968, 3968, 4480, 4992]
    - [39, 116.41]
  - - [4224, 2816, 1, 640, 4224, 4224, 640, 2816]
    - [44, 97.63]
  - - [1792, 1536, 1, 2816, 1792, 1792, 2816, 1536]
    - [75, 83.11]
  - - [1024, 2048, 1, 4224, 1024, 1024, 4224, 2048]
    - [76, 80.97]
  - - [3968, 1024, 1, 3968, 3968, 3968, 3968, 1024]
    - [76, 83.9]
  - - [1024, 1024, 1, 896, 1024, 1024, 896, 1024]
    - [71, 41.83]
  - - [512, 4736, 1, 4096, 512, 512, 4096, 4736]
    - [56, 91.81]
  - - [512, 768, 1, 768, 512, 512, 768, 768]
    - [16, 22.7]
  - - [1280, 2304, 1, 1664, 1280, 1280, 1664, 2304]
    - [84, 83.41]
  - - [3328, 3328, 1, 1280, 3328, 3328, 1280, 3328]
    - [37, 104.03]
  - - [384, 4992, 1, 4096, 384, 384, 4096, 4992]
    - [76, 76.52]
  - - [640, 3200, 1, 1152, 640, 640, 1152, 3200]
    - [91, 63.24]
  - - [640, 4736, 1, 2816, 640, 640, 2816, 4736]
    - [75, 87.39]
  - - [3072, 2944, 1, 2304, 3072, 3072, 2304, 2944]
    - [32, 104.87]
  - - [1664, 4224, 1, 3456, 1664, 1664, 3456, 4224]
    - [25, 101.66]
  - - [128, 2432, 1, 896, 128, 128, 896, 2432]
    - [16, 16.61]
  - - [2176, 1792, 1, 1280, 2176, 2176, 1280, 1792]
    - [27, 80.45]
  - - [1664, 2816, 1, 2688, 1664, 1664, 2688, 2816]
    - [58, 100.07]
  - - [128, 4608, 1, 768, 128, 128, 768, 4608]
    - [10, 26.8]
  - - [1280, 2432, 1, 256, 1280, 1280, 256, 2432]
    - [60, 49.52]
  - - [1536, 4864, 1, 3968, 1536, 1536, 3968, 4864]
    - [25, 108.68]
  - - [3456, 2048, 1, 2560, 3456, 3456, 2560, 2048]
    - [25, 101.28]
  - - [1024, 1152, 1, 4352, 1024, 1024, 4352, 1152]
    - [58, 77.29]
  - - [2560, 2176, 1, 1920, 2560, 2560, 1920, 2176]
    - [24, 83.62]
  - - [4480, 4992, 1, 2944, 4480, 4480, 2944, 4992]
    - [25, 108.27]
  - - [640, 4608, 1, 2560, 640, 640, 2560, 4608]
    - [75, 86.08]
  - - [4224, 3200, 1, 4608, 4224, 4224, 4608, 3200]
    - [38, 119.8]
  - - [768, 384, 1, 4736, 768, 768, 4736, 384]
    - [10, 49.29]
  - - [1024, 2304, 1, 2816, 1024, 1024, 2816, 2304]
    - [58, 85.86]
  - - [3456, 4224, 1, 3200, 3456, 3456, 3200, 4224]
    - [43, 121.6]
  - - [4736, 1536, 1, 4864, 4736, 4736, 4864, 1536]
    - [25, 105.04]
  - - [3328, 3328, 1, 1408, 3328, 3328, 1408, 3328]
    - [38, 104.46]
  - - [1664, 2048, 1, 3072, 1664, 1664, 3072, 2048]
    - [4, 87.08]
  - - [2560, 128, 1, 4224, 2560, 2560, 4224, 128]
    - [77, 45.12]
  - - [896, 1792, 1, 896, 896, 896, 896, 1792]
    - [91, 51.82]
  - - [3456, 1024, 1, 1408, 3456, 3456, 1408, 1024]
    - [76, 75.05]
  - - [1920, 2176, 1, 3968, 1920, 1920, 3968, 2176]
    - [27, 88.56]
  - - [4480, 768, 1, 384, 4480, 4480, 384, 768]
    - [27, 55.17]
  - - [2432, 384, 1, 2176, 2432, 2432, 2176, 384]
    - [84, 59.87]
  - - [2432, 1792, 1, 3456, 2432, 2432, 3456, 1792]
    - [81, 87.6]
  - - [4992, 4096, 1, 256, 4992, 4992, 256, 4096]
    - [40, 80.69]
  - - [3328, 1408, 1, 4608, 3328, 3328, 4608, 1408]
    - [26, 102.56]
  - - [4352, 2816, 1, 1664, 4352, 4352, 1664, 2816]
    - [38, 108.46]
  - - [2048, 896, 1, 3968, 2048, 2048, 3968, 896]
    - [27, 76.32]
  - - [1664, 896, 1, 2176, 1664, 1664, 2176, 896]
    - [73, 67.14]
  - - [640, 512, 1, 1792, 640, 640, 1792, 512]
    - [16, 25.9]
  - - [4864, 2688, 1, 2304, 4864, 4864, 2304, 2688]
    - [44, 117.7]
  - - [3072, 3840, 1, 2560, 3072, 3072, 2560, 3840]
    - [37, 112.76]
  - - [2176, 4480, 1, 2048, 2176, 2176, 2048, 4480]
    - [32, 108.48]
  - - [4992, 4736, 1, 3456, 4992, 4992, 3456, 4736]
    - [38, 111.4]
  - - [3584, 768, 1, 3328, 3584, 3584, 3328, 768]
    - [84, 84.12]
  - - [1792, 4992, 1, 2304, 1792, 1792, 2304, 4992]
    - [40, 104.93]
  - - [2816, 2944, 1, 3456, 2816, 2816, 3456, 2944]
    - [85, 102.94]
  - - [2688, 4224, 1, 128, 2688, 2688, 128, 4224]
    - [53, 44.77]
  - - [3584, 4864, 1, 1024, 3584, 3584, 1024, 4864]
    - [40, 101.56]
  - - [1664, 384, 1, 2816, 1664, 1664, 2816, 384]
    - [10, 52.6]
  - - [3200, 4608, 1, 2560, 3200, 3200, 2560, 4608]
    - [43, 118.61]
  - - [1024, 1792, 1, 1280, 1024, 1024, 1280, 1792]
    - [76, 58.0]
  - - [1152, 256, 1, 896, 1152, 1152, 896, 256]
    - [16, 15.7]
  - - [3968, 128, 1, 1792, 3968, 3968, 1792, 128]
    - [71, 35.66]
  - - [512, 1152, 1, 1792, 512, 512, 1792, 1152]
    - [10, 43.8]
  - - [3968, 2304, 1, 256, 3968, 3968, 256, 2304]
    - [41, 72.02]
  - - [1280, 1536, 1, 4608, 1280, 1280, 4608, 1536]
    - [27, 80.43]
  - - [3968, 1792, 1, 4992, 3968, 3968, 4992, 1792]
    - [25, 103.42]
  - - [768, 4736, 1, 1280, 768, 768, 1280, 4736]
    - [4, 82.58]
  - - [3328, 4608, 1, 1024, 3328, 3328, 1024, 4608]
    - [36, 112.83]
  - - [4096, 3584, 1, 3072, 4096, 4096, 3072, 3584]
    - [53, 124.7]
  - - [1408, 2688, 1, 3840, 1408, 1408, 3840, 2688]
    - [4, 94.81]
  - - [1920, 1920, 1, 1536, 1920, 1920, 1536, 1920]
    - [4, 87.77]
  - - [4352, 3328, 1, 2048, 4352, 4352, 2048, 3328]
    - [46, 119.45]
  - - [2816, 256, 1, 2688, 2816, 2816, 2688, 256]
    - [73, 52.57]
  - - [2048, 4608, 1, 1792, 2048, 2048, 1792, 4608]
    - [32, 107.93]
  - - [1536, 3072, 1, 1792, 1536, 1536, 1792, 3072]
    - [5, 100.68]
  - - [640, 2304, 1, 4352, 640, 640, 4352, 2304]
    - [5, 79.1]
  - - [2944, 4096, 1, 2944, 2944, 2944, 2944, 4096]
    - [38, 112.63]
  - - [640, 2176, 1, 1024, 640, 640, 1024, 2176]
    - [10, 59.43]
  - - [384, 1792, 1, 4096, 384, 384, 4096, 1792]
    - [10, 63.97]
  - - [2176, 640, 1, 1664, 2176, 2176, 1664, 640]
    - [10, 60.59]
  - - [3712, 1792, 1, 3328, 3712, 3712, 3328, 1792]
    - [25, 98.09]
  - - [1664, 2816, 1, 1408, 1664, 1664, 1408, 2816]
    - [56, 94.05]
  - - [4096, 1664, 1, 4608, 4096, 4096, 4608, 1664]
    - [33, 98.6]
  - - [512, 2816, 1, 4224, 512, 512, 4224, 2816]
    - [75, 78.14]
  - - [2432, 2688, 1, 3968, 2432, 2432, 3968, 2688]
    - [25, 98.41]
  - - [2048, 256, 1, 4224, 2048, 2048, 4224, 256]
    - [27, 47.96]
  - - [1920, 1536, 1, 384, 1920, 1920, 384, 1536]
    - [84, 61.6]
  - - [2176, 2432, 1, 4352, 2176, 2176, 4352, 2432]
    - [24, 84.6]
  - - [896, 4608, 1, 256, 896, 896, 256, 4608]
    - [27, 53.38]
  - - [2560, 4480, 1, 896, 2560, 2560, 896, 4480]
    - [38, 99.86]
  - - [128, 2816, 1, 4736, 128, 128, 4736, 2816]
    - [10, 50.5]
  - - [4864, 1920, 1, 3840, 4864, 4864, 3840, 1920]
    - [39, 109.71]
  - - [512, 640, 1, 1280, 512, 512, 1280, 640]
    - [16, 23.48]
  - - [5120, 640, 1, 384, 5120, 5120, 384, 640]
    - [76, 52.81]
  - - [3712, 768, 1, 2560, 3712, 3712, 2560, 768]
    - [75, 81.27]
  - - [1408, 1920, 1, 1536, 1408, 1408, 1536, 1920]
    - [84, 78.6]
  - - [2688, 3712, 1, 3456, 2688, 2688, 3456, 3712]
    - [39, 114.14]
  - - [1152, 4736, 1, 1280, 1152, 1152, 1280, 4736]
    - [24, 82.56]
  - - [2432, 896, 1, 1024, 2432, 2432, 1024, 896]
    - [68, 61.47]
  - - [2432, 1024, 1, 896, 2432, 2432, 896, 1024]
    - [75, 68.72]
  - - [4224, 4224, 1, 4608, 4224, 4224, 4608, 4224]
    - [29, 104.33]
  - - [2176, 3840, 1, 1536, 2176, 2176, 1536, 3840]
    - [79, 102.86]
  - - [3456, 640, 1, 2688, 3456, 3456, 2688, 640]
    - [81, 70.23]
  - - [384, 1792, 1, 1152, 384, 384, 1152, 1792]
    - [10, 38.7]
  - - [4480, 1792, 1, 4480, 4480, 4480, 4480, 1792]
    - [79, 104.93]
  - - [2944, 1408, 1, 1152, 2944, 2944, 1152, 1408]
    - [27, 82.23]
  - - [1920, 4608, 1, 3072, 1920, 1920, 3072, 4608]
    - [30, 101.43]
  - - [3456, 3328, 1, 4352, 3456, 3456, 4352, 3328]
    - [38, 111.34]
  - - [2944, 3968, 1, 1280, 2944, 2944, 1280, 3968]
    - [38, 105.29]
  - - [1280, 1152, 1, 3328, 1280, 1280, 3328, 1152]
    - [10, 73.27]
  - - [4608, 3968, 1, 1152, 4608, 4608, 1152, 3968]
    - [30, 99.99]
  - - [1536, 4608, 1, 1536, 1536, 1536, 1536, 4608]
    - [25, 102.06]
  - - [4992, 2048, 1, 896, 4992, 4992, 896, 2048]
    - [32, 103.03]
  - - [3968, 3328, 1, 3456, 3968, 3968, 3456, 3328]
    - [38, 118.09]
  - - [1024, 4480, 1, 4480, 1024, 1024, 4480, 4480]
    - [26, 100.39]
  - - [2048, 4736, 1, 2560, 2048, 2048, 2560, 4736]
    - [32, 109.84]
  - - [2688, 4864, 1, 4096, 2688, 2688, 4096, 4864]
    - [38, 120.41]
  - - [2432, 3584, 1, 4736, 2432, 2432, 4736, 3584]
    - [30, 105.75]
  - - [1664, 2944, 1, 1792, 1664, 1664, 1792, 2944]
    - [26, 98.98]
  - - [4480, 4480, 1, 3328, 4480, 4480, 3328, 4480]
    - [39, 117.05]
  - - [2816, 1408, 1, 2304, 2816, 2816, 2304, 1408]
    - [27, 84.5]
  - - [640, 3584, 1, 1280, 640, 640, 1280, 3584]
    - [26, 69.78]
  - - [3328, 1024, 1, 4224, 3328, 3328, 4224, 1024]
    - [32, 94.76]
  - - [1536, 3200, 1, 1536, 1536, 1536, 1536, 3200]
    - [26, 99.44]
  - - [1920, 2560, 1, 2944, 1920, 1920, 2944, 2560]
    - [58, 104.84]
  - - [3456, 3456, 1, 2560, 3456, 3456, 2560, 3456]
    - [38, 109.79]
  - - [128, 1536, 1, 4224, 128, 128, 4224, 1536]
    - [10, 33.63]
  - - [4992, 3328, 1, 2176, 4992, 4992, 2176, 3328]
    - [79, 106.42]
  - - [4096, 1024, 1, 256, 4096, 4096, 256, 1024]
    - [76, 53.17]
  - - [1408, 4352, 1, 3584, 1408, 1408, 3584, 4352]
    - [24, 92.98]
  - - [1408, 128, 1, 3328, 1408, 1408, 3328, 128]
    - [67, 28.06]
  - - [768, 3328, 1, 512, 768, 768, 512, 3328]
    - [84, 61.04]
  - - [4992, 2816, 1, 1152, 4992, 4992, 1152, 2816]
    - [44, 118.05]
  - - [384, 3840, 1, 2176, 384, 384, 2176, 3840]
    - [10, 70.36]
  - - [3584, 4736, 1, 4224, 3584, 3584, 4224, 4736]
    - [30, 101.76]
  - - [512, 2688, 1, 3328, 512, 512, 3328, 2688]
    - [76, 71.37]
  - - [4096, 2560, 1, 1664, 4096, 4096, 1664, 2560]
    - [49, 114.87]
  - - [2816, 128, 1, 4992, 2816, 2816, 4992, 128]
    - [73, 47.12]
  - - [3968, 2304, 1, 1536, 3968, 3968, 1536, 2304]
    - [39, 106.06]
  - - [768, 384, 1, 4992, 768, 768, 4992, 384]
    - [10, 51.82]
  - - [2176, 2048, 1, 1920, 2176, 2176, 1920, 2048]
    - [5, 93.67]
  - - [4864, 3584, 1, 4864, 4864, 4864, 4864, 3584]
    - [29, 107.28]
  - - [4096, 3968, 1, 4864, 4096, 4096, 4864, 3968]
    - [85, 103.28]
  - - [1792, 2560, 1, 3456, 1792, 1792, 3456, 2560]
    - [26, 101.02]
  - - [3328, 3200, 1, 1536, 3328, 3328, 1536, 3200]
    - [37, 102.36]
  - - [2816, 3072, 1, 1664, 2816, 2816, 1664, 3072]
    - [30, 99.3]
  - - [896, 128, 1, 1664, 896, 896, 1664, 128]
    - [15, 12.16]
  - - [512, 2304, 1, 640, 512, 512, 640, 2304]
    - [10, 43.71]
  - - [2688, 768, 1, 3072, 2688, 2688, 3072, 768]
    - [76, 75.59]
  - - [3968, 1152, 1, 384, 3968, 3968, 384, 1152]
    - [26, 71.64]
  - - [1664, 768, 1, 4352, 1664, 1664, 4352, 768]
    - [27, 73.08]
  - - [4864, 1152, 1, 1408, 4864, 4864, 1408, 1152]
    - [24, 80.72]
  - - [3328, 3456, 1, 2560, 3328, 3328, 2560, 3456]
    - [44, 109.74]
  - - [3584, 1792, 1, 3072, 3584, 3584, 3072, 1792]
    - [37, 103.36]
  - - [128, 1792, 1, 2304, 128, 128, 2304, 1792]
    - [10, 26.36]
  - - [3328, 2688, 1, 4096, 3328, 3328, 4096, 2688]
    - [39, 109.58]
  - - [384, 768, 1, 2560, 384, 384, 2560, 768]
    - [10, 34.49]
  - - [3456, 3840, 1, 4864, 3456, 3456, 4864, 3840]
    - [38, 119.89]
  - - [1664, 4864, 1, 3456, 1664, 1664, 3456, 4864]
    - [86, 101.78]
  - - [1152, 3200, 1, 3072, 1152, 1152, 3072, 3200]
    - [4, 91.15]
  - - [1536, 2432, 1, 768, 1536, 1536, 768, 2432]
    - [27, 72.66]
  - - [384, 1536, 1, 256, 384, 384, 256, 1536]
    - [66, 15.58]
  - - [3328, 2048, 1, 4736, 3328, 3328, 4736, 2048]
    - [25, 102.35]
  - - [1536, 2304, 1, 512, 1536, 1536, 512, 2304]
    - [76, 62.57]
  - - [4224, 4992, 1, 512, 4224, 4224, 512, 4992]
    - [79, 81.62]
  - - [128, 128, 1, 1408, 128, 128, 1408, 128]
    - [11, 2.0]
  - - [1664, 3200, 1, 768, 1664, 1664, 768, 3200]
    - [24, 74.0]
  - - [512, 2176, 1, 1920, 512, 512, 1920, 2176]
    - [10, 58.58]
  - - [1280, 3584, 1, 384, 1280, 1280, 384, 3584]
    - [26, 73.45]
  - - [1024, 256, 1, 2048, 1024, 1024, 2048, 256]
    - [18, 26.96]
  - - [3712, 4096, 1, 640, 3712, 3712, 640, 4096]
    - [36, 104.17]
  - - [4864, 4736, 1, 4864, 4864, 4864, 4864, 4736]
    - [25, 112.54]
  - - [3584, 2432, 1, 3328, 3584, 3584, 3328, 2432]
    - [29, 100.52]
  - - [2432, 4096, 1, 3072, 2432, 2432, 3072, 4096]
    - [32, 112.72]
  - - [4608, 1280, 1, 2432, 4608, 4608, 2432, 1280]
    - [24, 89.28]
  - - [3712, 4992, 1, 3200, 3712, 3712, 3200, 4992]
    - [39, 112.87]
  - - [512, 1152, 1, 384, 512, 512, 384, 1152]
    - [66, 19.09]
  - - [2304, 3840, 1, 4736, 2304, 2304, 4736, 3840]
    - [29, 106.59]
  - - [3584, 3712, 1, 768, 3584, 3584, 768, 3712]
    - [44, 107.73]
  - - [1792, 1408, 1, 3584, 1792, 1792, 3584, 1408]
    - [56, 93.77]
  - - [3072, 4480, 1, 2688, 3072, 3072, 2688, 4480]
    - [38, 118.86]
  - - [2304, 128, 1, 4992, 2304, 2304, 4992, 128]
    - [91, 43.69]
  - - [4352, 2688, 1, 1536, 4352, 4352, 1536, 2688]
    - [37, 106.65]
  - - [768, 384, 1, 2304, 768, 768, 2304, 384]
    - [10, 33.06]
  - - [3584, 1280, 1, 4864, 3584, 3584, 4864, 1280]
    - [44, 106.65]
  - - [128, 4480, 1, 4480, 128, 128, 4480, 4480]
    - [27, 54.02]
  - - [4352, 2816, 1, 2688, 4352, 4352, 2688, 2816]
    - [38, 112.4]
  - - [512, 2560, 1, 3584, 512, 512, 3584, 2560]
    - [26, 80.12]
  - - [3328, 1024, 1, 768, 3328, 3328, 768, 1024]
    - [76, 67.52]
  - - [1536, 3712, 1, 2176, 1536, 1536, 2176, 3712]
    - [24, 88.03]
  - - [1152, 3840, 1, 4736, 1152, 1152, 4736, 3840]
    - [5, 102.02]
  - - [4352, 512, 1, 3328, 4352, 4352, 3328, 512]
    - [39, 78.77]
  - - [4096, 2176, 1, 3328, 4096, 4096, 3328, 2176]
    - [32, 103.34]
  - - [3072, 3968, 1, 4480, 3072, 3072, 4480, 3968]
    - [44, 117.02]
  - - [3968, 3584, 1, 1280, 3968, 3968, 1280, 3584]
    - [38, 116.92]
  - - [256, 4352, 1, 640, 256, 256, 640, 4352]
    - [10, 40.96]
  - - [384, 1408, 1, 3584, 384, 384, 3584, 1408]
    - [27, 48.35]
  - - [3328, 4352, 1, 4096, 3328, 3328, 4096, 4352]
    - [44, 128.57]
  - - [640, 3840, 1, 1024, 640, 640, 1024, 3840]
    - [75, 72.94]
  - - [1536, 2944, 1, 640, 1536, 1536, 640, 2944]
    - [5, 84.46]
  - - [768, 3584, 1, 1408, 768, 768, 1408, 3584]
    - [87, 77.95]
  - - [3072, 3200, 1, 3072, 3072, 3072, 3072, 3200]
    - [45, 113.55]
  - - [384, 3456, 1, 1152, 384, 384, 1152, 3456]
    - [10, 60.41]
  - - [3968, 4224, 1, 3712, 3968, 3968, 3712, 4224]
    - [27, 90.74]
  - - [2944, 3840, 1, 1664, 2944, 2944, 1664, 3840]
    - [38, 107.42]
  - - [384, 2432, 1, 1024, 384, 384, 1024, 2432]
    - [71, 41.01]
  - - [512, 4352, 1, 384, 512, 512, 384, 4352]
    - [68, 48.57]
  - - [2176, 2432, 1, 4224, 2176, 2176, 4224, 2432]
    - [24, 84.73]
  - - [2688, 2176, 1, 4352, 2688, 2688, 4352, 2176]
    - [24, 88.43]
  - - [896, 3328, 1, 3328, 896, 896, 3328, 3328]
    - [87, 87.81]
  - - [4096, 1280, 1, 3712, 4096, 4096, 3712, 1280]
    - [58, 106.67]
  - - [4224, 4864, 1, 3200, 4224, 4224, 3200, 4864]
    - [26, 109.53]
  - - [2944, 2176, 1, 896, 2944, 2944, 896, 2176]
    - [25, 89.47]
  - - [4352, 256, 1, 4608, 4352, 4352, 4608, 256]
    - [27, 66.79]
  - - [4096, 2944, 1, 3840, 4096, 4096, 3840, 2944]
    - [37, 114.21]
  - - [384, 2048, 1, 1664, 384, 384, 1664, 2048]
    - [69, 45.0]
  - - [3584, 1280, 1, 1280, 3584, 3584, 1280, 1280]
    - [26, 93.12]
  - - [3840, 4096, 1, 3200, 3840, 3840, 3200, 4096]
    - [36, 124.84]
  - - [1280, 2432, 1, 3712, 1280, 1280, 3712, 2432]
    - [39, 89.8]
  - - [4608, 4352, 1, 1664, 4608, 4608, 1664, 4352]
    - [32, 113.03]
  - - [256, 3968, 1, 3456, 256, 256, 3456, 3968]
    - [84, 69.0]
  - - [1024, 3584, 1, 4352, 1024, 1024, 4352, 3584]
    - [4, 93.37]
  - - [768, 128, 1, 3328, 768, 768, 3328, 128]
    - [67, 17.82]
  - - [1152, 640, 1, 4480, 1152, 1152, 4480, 640]
    - [56, 66.6]
  - - [3584, 3968, 1, 256, 3584, 3584, 256, 3968]
    - [53, 82.22]
  - - [3072, 640, 1, 2816, 3072, 3072, 2816, 640]
    - [76, 73.03]
  - - [2816, 1024, 1, 1664, 2816, 2816, 1664, 1024]
    - [84, 81.57]
  - - [128, 3584, 1, 3072, 128, 128, 3072, 3584]
    - [10, 49.99]
  - - [1536, 1536, 1, 384, 1536, 1536, 384, 1536]
    - [75, 52.48]
  - - [1792, 1280, 1, 4736, 1792, 1792, 4736, 1280]
    - [56, 93.03]
  - - [1664, 3712, 1, 896, 1664, 1664, 896, 3712]
    - [25, 88.29]
  - - [512, 3200, 1, 1152, 512, 512, 1152, 3200]
    - [76, 51.37]
  - - [1408, 768, 1, 1408, 1408, 1408, 1408, 768]
    - [10, 49.8]
  - - [3072, 2432, 1, 4864, 3072, 3072, 4864, 2432]
    - [25, 108.32]
  - - [3840, 2560, 1, 768, 3840, 3840, 768, 2560]
    - [40, 104.57]
  - - [3072, 4992, 1, 4608, 3072, 3072, 4608, 4992]
    - [43, 128.66]
  - - [3072, 4992, 1, 3200, 3072, 3072, 3200, 4992]
    - [43, 127.79]
  - - [2944, 3456, 1, 2048, 2944, 2944, 2048, 3456]
    - [58, 104.22]
  - - [2560, 4992, 1, 4096, 2560, 2560, 4096, 4992]
    - [44, 116.45]
  - - [3328, 1664, 1, 4480, 3328, 3328, 4480, 1664]
    - [24, 84.81]
  - - [384, 4352, 1, 1024, 384, 384, 1024, 4352]
    - [76, 49.99]
  - - [1152, 2304, 1, 1792, 1152, 1152, 1792, 2304]
    - [75, 79.83]
  - - [4096, 4224, 1, 896, 4096, 4096, 896, 4224]
    - [32, 98.23]
  - - [4480, 4480, 1, 896, 4480, 4480, 896, 4480]
    - [40, 108.75]
  - - [2176, 896, 1, 4352, 2176, 2176, 4352, 896]
    - [76, 77.3]
  - - [384, 4736, 1, 896, 384, 384, 896, 4736]
    - [77, 58.55]
  - - [1792, 2304, 1, 1024, 1792, 1792, 1024, 2304]
    - [27, 81.07]
  - - [4864, 1408, 1, 1408, 4864, 4864, 1408, 1408]
    - [25, 93.97]
  - - [3328, 2304, 1, 512, 3328, 3328, 512, 2304]
    - [93, 82.89]
  - - [2048, 256, 1, 768, 2048, 2048, 768, 256]
    - [18, 23.04]
  - - [4224, 4608, 1, 3456, 4224, 4224, 3456, 4608]
    - [39, 116.92]
  - - [4096, 3200, 1, 3072, 4096, 4096, 3072, 3200]
    - [44, 116.69]
  - - [1152, 512, 1, 384, 1152, 1152, 384, 512]
    - [66, 19.09]
  - - [640, 1664, 1, 2944, 640, 640, 2944, 1664]
    - [5, 63.54]
  - - [1408, 1408, 1, 1792, 1408, 1408, 1792, 1408]
    - [27, 68.37]
  - - [1152, 3200, 1, 512, 1152, 1152, 512, 3200]
    - [27, 63.93]
  - - [1664, 3584, 1, 1664, 1664, 1664, 1664, 3584]
    - [24, 87.98]
  - - [3712, 4480, 1, 2304, 3712, 3712, 2304, 4480]
    - [36, 128.05]
  - - [1920, 384, 1, 1792, 1920, 1920, 1792, 384]
    - [10, 48.64]
  - - [1536, 1664, 1, 3840, 1536, 1536, 3840, 1664]
    - [93, 85.15]
  - - [2304, 3584, 1, 2688, 2304, 2304, 2688, 3584]
    - [85, 101.95]
  - - [1920, 2688, 1, 4736, 1920, 1920, 4736, 2688]
    - [56, 109.14]
  - - [512, 768, 1, 3200, 512, 512, 3200, 768]
    - [10, 48.67]
  - - [1408, 1920, 1, 3712, 1408, 1408, 3712, 1920]
    - [84, 84.18]
  - - [3456, 3968, 1, 3072, 3456, 3456, 3072, 3968]
    - [38, 118.98]
  - - [5120, 3200, 1, 128, 5120, 5120, 128, 3200]
    - [93, 53.46]
  - - [4096, 3712, 1, 2944, 4096, 4096, 2944, 3712]
    - [36, 123.7]
  - - [2688, 4736, 1, 3968, 2688, 2688, 3968, 4736]
    - [44, 120.25]
  - - [3072, 4608, 1, 1792, 3072, 3072, 1792, 4608]
    - [37, 119.48]
  - - [4992, 4096, 1, 2688, 4992, 4992, 2688, 4096]
    - [39, 118.06]
  - - [2688, 3456, 1, 2048, 2688, 2688, 2048, 3456]
    - [32, 105.54]
  - - [2688, 3584, 1, 3456, 2688, 2688, 3456, 3584]
    - [32, 111.63]
  - - [1920, 3968, 1, 512, 1920, 1920, 512, 3968]
    - [79, 83.4]
  - - [3840, 128, 1, 1152, 3840, 3840, 1152, 128]
    - [64, 30.44]
  - - [4096, 2944, 1, 1920, 4096, 4096, 1920, 2944]
    - [37, 109.0]
  - - [2048, 5120, 1, 4352, 2048, 2048, 4352, 5120]
    - [45, 119.94]
  - - [896, 2304, 1, 128, 896, 896, 128, 2304]
    - [72, 26.11]
  - - [2432, 2944, 1, 4608, 2432, 2432, 4608, 2944]
    - [33, 102.92]
  - - [3968, 3072, 1, 3200, 3968, 3968, 3200, 3072]
    - [38, 114.16]
  - - [3200, 1664, 1, 2944, 3200, 3200, 2944, 1664]
    - [24, 82.6]
  - - [256, 896, 1, 4224, 256, 256, 4224, 896]
    - [10, 40.95]
  - - [3072, 3200, 1, 4992, 3072, 3072, 4992, 3200]
    - [45, 115.11]
  - - [4224, 384, 1, 4352, 4224, 4224, 4352, 384]
    - [27, 69.96]
  - - [3840, 1792, 1, 3712, 3840, 3840, 3712, 1792]
    - [25, 102.66]
  - - [1664, 1152, 1, 4224, 1664, 1664, 4224, 1152]
    - [27, 78.27]
  - - [2048, 4352, 1, 4224, 2048, 2048, 4224, 4352]
    - [30, 103.72]
  - - [4992, 3456, 1, 128, 4992, 4992, 128, 3456]
    - [50, 51.65]
  - - [4864, 1536, 1, 2688, 4864, 4864, 2688, 1536]
    - [25, 104.58]
  - - [2816, 768, 1, 512, 2816, 2816, 512, 768]
    - [68, 52.57]
  - - [4480, 512, 1, 3584, 4480, 4480, 3584, 512]
    - [39, 85.0]
  - - [3072, 3328, 1, 1792, 3072, 3072, 1792, 3328]
    - [52, 113.21]
  - - [4352, 1408, 1, 512, 4352, 4352, 512, 1408]
    - [84, 74.74]
  - - [384, 3968, 1, 2688, 384, 384, 2688, 3968]
    - [10, 73.48]
  - - [1792, 4480, 1, 4480, 1792, 1792, 4480, 4480]
    - [93, 102.39]
  - - [4096, 896, 1, 4224, 4096, 4096, 4224, 896]
    - [76, 79.09]
  - - [512, 4736, 1, 4352, 512, 512, 4352, 4736]
    - [56, 92.68]
  - - [3456, 1920, 1, 3968, 3456, 3456, 3968, 1920]
    - [25, 101.87]
  - - [256, 2944, 1, 2560, 256, 256, 2560, 2944]
    - [10, 59.33]
  - - [3456, 4736, 1, 3072, 3456, 3456, 3072, 4736]
    - [36, 128.37]
  - - [3840, 128, 1, 4864, 3840, 3840, 4864, 128]
    - [91, 52.41]
  - - [1792, 4352, 1, 256, 1792, 1792, 256, 4352]
    - [79, 67.39]
  - - [4096, 1408, 1, 1664, 4096, 4096, 1664, 1408]
    - [95, 89.22]
  - - [4864, 3712, 1, 4352, 4864, 4864, 4352, 3712]
    - [29, 106.04]
  - - [4736, 3584, 1, 2944, 4736, 4736, 2944, 3584]
    - [29, 104.12]
  - - [4608, 4736, 1, 896, 4608, 4608, 896, 4736]
    - [25, 101.07]
  - - [3200, 128, 1, 4992, 3200, 3200, 4992, 128]
    - [91, 50.87]
  - - [2688, 1152, 1, 3456, 2688, 2688, 3456, 1152]
    - [75, 88.95]
  - - [2432, 896, 1, 256, 2432, 2432, 256, 896]
    - [68, 38.67]
  - - [4352, 4480, 1, 2816, 4352, 4352, 2816, 4480]
    - [39, 113.3]
  - - [256, 128, 1, 2432, 256, 256, 2432, 128]
    - [11, 6.59]
  - - [4352, 896, 1, 512, 4352, 4352, 512, 896]
    - [27, 67.07]
  - - [1024, 384, 1, 3712, 1024, 1024, 3712, 384]
    - [10, 51.14]
  - - [512, 3200, 1, 2816, 512, 512, 2816, 3200]
    - [56, 77.7]
  - - [1664, 4736, 1, 896, 1664, 1664, 896, 4736]
    - [86, 93.53]
  - - [640, 2176, 1, 4608, 640, 640, 4608, 2176]
    - [76, 77.16]
  - - [3328, 3968, 1, 1792, 3328, 3328, 1792, 3968]
    - [37, 117.23]
  - - [3328, 4480, 1, 1280, 3328, 3328, 1280, 4480]
    - [43, 117.09]
  - - [3072, 1152, 1, 4736, 3072, 3072, 4736, 1152]
    - [4, 91.27]
  - - [4480, 896, 1, 384, 4480, 4480, 384, 896]
    - [76, 61.45]
  - - [256, 256, 1, 2304, 256, 256, 2304, 256]
    - [15, 11.75]
  - - [2560, 2432, 1, 4864, 2560, 2560, 4864, 2432]
    - [25, 98.29]
  - - [1280, 896, 1, 1536, 1280, 1280, 1536, 896]
    - [10, 55.39]
  - - [4992, 768, 1, 4480, 4992, 4992, 4480, 768]
    - [4, 95.03]
  - - [256, 1664, 1, 4992, 256, 256, 4992, 1664]
    - [10, 57.09]
  - - [4352, 3328, 1, 1664, 4352, 4352, 1664, 3328]
    - [46, 119.69]
  - - [4864, 3456, 1, 2944, 4864, 4864, 2944, 3456]
    - [28, 97.71]
  - - [3456, 1536, 1, 640, 3456, 3456, 640, 1536]
    - [24, 73.21]
  - - [1792, 4864, 1, 4864, 1792, 1792, 4864, 4864]
    - [28, 102.27]
  - - [4096, 1152, 1, 256, 4096, 4096, 256, 1152]
    - [26, 61.54]
  - - [4992, 1024, 1, 3200, 4992, 4992, 3200, 1024]
    - [39, 100.79]
  - - [4352, 1664, 1, 768, 4352, 4352, 768, 1664]
    - [33, 89.15]
  - - [2176, 1280, 1, 2816, 2176, 2176, 2816, 1280]
    - [75, 81.98]
  - - [2304, 2176, 1, 2176, 2304, 2304, 2176, 2176]
    - [26, 102.46]
  - - [128, 2176, 1, 896, 128, 128, 896, 2176]
    - [16, 15.02]
  - - [4096, 3200, 1, 4480, 4096, 4096, 4480, 3200]
    - [44, 121.25]
  - - [4608, 768, 1, 256, 4608, 4608, 256, 768]
    - [76, 46.68]
  - - [2048, 4992, 1, 3968, 2048, 2048, 3968, 4992]
    - [45, 118.35]
  - - [128, 1536, 1, 1024, 128, 128, 1024, 1536]
    - [15, 16.12]
  - - [4992, 3584, 1, 1280, 4992, 4992, 1280, 3584]
    - [28, 99.28]
  - - [4736, 768, 1, 2688, 4736, 4736, 2688, 768]
    - [4, 90.01]
  - - [1152, 4736, 1, 768, 1152, 1152, 768, 4736]
    - [24, 77.68]
  - - [1280, 2944, 1, 3072, 1280, 1280, 3072, 2944]
    - [4, 93.83]
  - - [4992, 4608, 1, 2176, 4992, 4992, 2176, 4608]
    - [44, 111.46]
  - - [1920, 896, 1, 2432, 1920, 1920, 2432, 896]
    - [76, 67.22]
  - - [256, 4736, 1, 3712, 256, 256, 3712, 4736]
    - [56, 73.17]
  - - [3968, 2432, 1, 3840, 3968, 3968, 3840, 2432]
    - [32, 109.61]
  - - [1024, 3328, 1, 4480, 1024, 1024, 4480, 3328]
    - [52, 97.69]
  - - [1280, 3584, 1, 4096, 1280, 1280, 4096, 3584]
    - [56, 99.9]
  - - [2048, 1792, 1, 3840, 2048, 2048, 3840, 1792]
    - [76, 81.96]
  - - [3840, 4864, 1, 2560, 3840, 3840, 2560, 4864]
    - [40, 113.61]
  - - [512, 1280, 1, 2944, 512, 512, 2944, 1280]
    - [10, 55.84]
  - - [4608, 768, 1, 512, 4608, 4608, 512, 768]
    - [76, 62.34]
  - - [2432, 2432, 1, 3072, 2432, 2432, 3072, 2432]
    - [94, 95.11]
  - - [3328, 2816, 1, 1664, 3328, 3328, 1664, 2816]
    - [39, 107.43]
  - - [1152, 3456, 1, 3712, 1152, 1152, 3712, 3456]
    - [27, 85.13]
  - - [2944, 1792, 1, 2176, 2944, 2944, 2176, 1792]
    - [24, 82.51]
  - - [4096, 896, 1, 2688, 4096, 4096, 2688, 896]
    - [76, 77.87]
  - - [128, 4352, 1, 3328, 128, 128, 3328, 4352]
    - [84, 51.48]
  - - [1536, 4096, 1, 4736, 1536, 1536, 4736, 4096]
    - [24, 95.15]
  - - [3584, 1408, 1, 128, 3584, 3584, 128, 1408]
    - [26, 43.41]
  - - [3456, 2688, 1, 2048, 3456, 3456, 2048, 2688]
    - [32, 105.88]
  - - [4480, 1792, 1, 4352, 4480, 4480, 4352, 1792]
    - [79, 103.45]
  - - [1152, 1152, 1, 512, 1152, 1152, 512, 1152]
    - [10, 43.55]
  - - [1536, 1152, 1, 512, 1536, 1536, 512, 1152]
    - [77, 48.05]
  - - [3840, 256, 1, 3712, 3840, 3840, 3712, 256]
    - [27, 64.38]
  - - [4224, 4864, 1, 1408, 4224, 4224, 1408, 4864]
    - [26, 103.46]
  - - [2432, 2816, 1, 3840, 2432, 2432, 3840, 2816]
    - [25, 102.96]
  - - [896, 128, 1, 128, 896, 896, 128, 128]
    - [7, 2.57]
  - - [4736, 2816, 1, 4352, 4736, 4736, 4352, 2816]
    - [38, 118.87]
  - - [1024, 128, 1, 1792, 1024, 1024, 1792, 128]
    - [89, 15.43]
  - - [4992, 4480, 1, 4224, 4992, 4992, 4224, 4480]
    - [25, 110.8]
  - - [2688, 896, 1, 1792, 2688, 2688, 1792, 896]
    - [26, 77.48]
  - - [2432, 1536, 1, 640, 2432, 2432, 640, 1536]
    - [27, 68.91]
  - - [4864, 3968, 1, 3840, 4864, 4864, 3840, 3968]
    - [39, 116.0]
  - - [2304, 3712, 1, 4992, 2304, 2304, 4992, 3712]
    - [30, 103.22]
  - - [2944, 384, 1, 256, 2944, 2944, 256, 384]
    - [10, 24.6]
  - - [1152, 4864, 1, 2176, 1152, 1152, 2176, 4864]
    - [24, 88.12]
  - - [4480, 3456, 1, 2176, 4480, 4480, 2176, 3456]
    - [36, 120.67]
  - - [2304, 4608, 1, 4480, 2304, 2304, 4480, 4608]
    - [37, 108.39]
  - - [3712, 3328, 1, 512, 3712, 3712, 512, 3328]
    - [47, 88.95]
  - - [1920, 1664, 1, 3712, 1920, 1920, 3712, 1664]
    - [40, 91.18]
  - - [128, 128, 1, 1152, 128, 128, 1152, 128]
    - [7, 2.02]
  - - [4224, 2304, 1, 4736, 4224, 4224, 4736, 2304]
    - [32, 112.44]
  - - [1280, 2432, 1, 2048, 1280, 1280, 2048, 2432]
    - [60, 79.25]
  - - [1792, 3200, 1, 4608, 1792, 1792, 4608, 3200]
    - [24, 88.69]
  - - [3584, 2560, 1, 3200, 3584, 3584, 3200, 2560]
    - [29, 104.99]
  - - [2048, 4992, 1, 1792, 2048, 2048, 1792, 4992]
    - [45, 114.14]
  - - [3200, 1792, 1, 2304, 3200, 3200, 2304, 1792]
    - [24, 86.65]
  - - [2816, 640, 1, 4992, 2816, 2816, 4992, 640]
    - [27, 76.75]
  - - [2048, 2816, 1, 4352, 2048, 2048, 4352, 2816]
    - [24, 89.42]
  - - [2688, 3200, 1, 512, 2688, 2688, 512, 3200]
    - [45, 84.3]
  - - [2304, 3840, 1, 1792, 2304, 2304, 1792, 3840]
    - [30, 101.52]
  - - [4992, 2944, 1, 640, 4992, 4992, 640, 2944]
    - [36, 101.5]
  - - [4480, 2304, 1, 256, 4480, 4480, 256, 2304]
    - [32, 79.23]
  - - [128, 4352, 1, 896, 128, 128, 896, 4352]
    - [97, 25.95]
  - - [4096, 768, 1, 128, 4096, 4096, 128, 768]
    - [75, 33.39]
  - - [2432, 4096, 1, 3840, 2432, 2432, 3840, 4096]
    - [32, 114.25]
  - - [3968, 512, 1, 512, 3968, 3968, 512, 512]
    - [77, 50.55]
  - - [4992, 2432, 1, 256, 4992, 4992, 256, 2432]
    - [47, 67.33]
  - - [1664, 896, 1, 4864, 1664, 1664, 4864, 896]
    - [73, 75.48]
  - - [3072, 1664, 1, 3456, 3072, 3072, 3456, 1664]
    - [24, 82.49]
  - - [4608, 3328, 1, 256, 4608, 4608, 256, 3328]
    - [36, 75.03]
  - - [2432, 2304, 1, 896, 2432, 2432, 896, 2304]
    - [24, 79.89]
  - - [768, 3328, 1, 3328, 768, 768, 3328, 3328]
    - [26, 92.79]
  - - [3584, 4736, 1, 128, 3584, 3584, 128, 4736]
    - [50, 54.71]
  - - [768, 1792, 1, 256, 768, 768, 256, 1792]
    - [10, 29.97]
  - - [2688, 3840, 1, 1664, 2688, 2688, 1664, 3840]
    - [32, 111.46]
  - - [1408, 384, 1, 4736, 1408, 1408, 4736, 384]
    - [27, 53.96]
  - - [3968, 384, 1, 384, 3968, 3968, 384, 384]
    - [10, 39.92]
  - - [4608, 2944, 1, 3968, 4608, 4608, 3968, 2944]
    - [38, 119.03]
  - - [1920, 2688, 1, 128, 1920, 1920, 128, 2688]
    - [58, 43.66]
  - - [4096, 3584, 1, 1280, 4096, 4096, 1280, 3584]
    - [47, 117.97]
  - - [3456, 1152, 1, 4864, 3456, 3456, 4864, 1152]
    - [27, 86.29]
  - - [256, 4992, 1, 1792, 256, 256, 1792, 4992]
    - [10, 62.87]
  - - [1152, 512, 1, 128, 1152, 1152, 128, 512]
    - [57, 9.57]
  - - [1408, 4224, 1, 896, 1408, 1408, 896, 4224]
    - [24, 82.44]
  - - [4224, 2688, 1, 2816, 4224, 4224, 2816, 2688]
    - [38, 105.9]
  - - [3840, 1408, 1, 2304, 3840, 3840, 2304, 1408]
    - [24, 83.32]
  - - [2816, 5120, 1, 2560, 2816, 2816, 2560, 5120]
    - [53, 121.94]
  - - [3328, 2304, 1, 4224, 3328, 3328, 4224, 2304]
    - [33, 106.27]
  - - [2560, 1408, 1, 4224, 2560, 2560, 4224, 1408]
    - [4, 90.4]
  - - [640, 4864, 1, 3968, 640, 640, 3968, 4864]
    - [84, 90.56]
  - - [640, 640, 1, 1408, 640, 640, 1408, 640]
    - [18, 26.05]
  - - [4352, 3200, 1, 640, 4352, 4352, 640, 3200]
    - [46, 103.07]
  - - [384, 4224, 1, 768, 384, 384, 768, 4224]
    - [72, 52.13]
  - - [4224, 1920, 1, 2432, 4224, 4224, 2432, 1920]
    - [93, 101.96]
  - - [384, 1280, 1, 640, 384, 384, 640, 1280]
    - [18, 20.17]
  - - [4992, 4352, 1, 1792, 4992, 4992, 1792, 4352]
    - [25, 104.56]
  - - [4352, 384, 1, 4608, 4352, 4352, 4608, 384]
    - [92, 77.68]
  - - [1536, 2944, 1, 1024, 1536, 1536, 1024, 2944]
    - [5, 91.36]
  - - [4992, 3456, 1, 640, 4992, 4992, 640, 3456]
    - [39, 95.36]
  - - [4736, 2304, 1, 512, 4736, 4736, 512, 2304]
    - [46, 81.56]
  - - [4608, 1408, 1, 4224, 4608, 4608, 4224, 1408]
    - [25, 96.71]
  - - [3840, 3584, 1, 1152, 3840, 3840, 1152, 3584]
    - [37, 112.6]
  - - [4864, 3328, 1, 896, 4864, 4864, 896, 3328]
    - [85, 96.32]
  - - [4736, 256, 1, 2432, 4736, 4736, 2432, 256]
    - [10, 57.69]
  - - [640, 3328, 1, 1920, 640, 640, 1920, 3328]
    - [5, 71.71]
  - - [3072, 384, 1, 4224, 3072, 3072, 4224, 384]
    - [5, 75.22]
  - - [256, 4352, 1, 2688, 256, 256, 2688, 4352]
    - [76, 60.34]
  - - [640, 4608, 1, 4864, 640, 640, 4864, 4608]
    - [24, 83.05]
  - - [3072, 2944, 1, 3200, 3072, 3072, 3200, 2944]
    - [32, 105.23]
  - - [3968, 2304, 1, 4224, 3968, 3968, 4224, 2304]
    - [28, 104.38]
  - - [3456, 896, 1, 1408, 3456, 3456, 1408, 896]
    - [73, 78.84]
  - - [1536, 1920, 1, 4480, 1536, 1536, 4480, 1920]
    - [24, 83.74]
  - - [2176, 2048, 1, 3456, 2176, 2176, 3456, 2048]
    - [5, 98.27]
  - - [4480, 1920, 1, 4352, 4480, 4480, 4352, 1920]
    - [28, 98.79]
  - - [4992, 2688, 1, 256, 4992, 4992, 256, 2688]
    - [47, 72.38]
  - - [4992, 1920, 1, 1664, 4992, 4992, 1664, 1920]
    - [40, 105.96]
  - - [4992, 896, 1, 384, 4992, 4992, 384, 896]
    - [26, 72.32]
  - - [3200, 4864, 1, 3584, 3200, 3200, 3584, 4864]
    - [36, 124.15]
  - - [3840, 3456, 1, 4864, 3840, 3840, 4864, 3456]
    - [38, 118.42]
  - - [3072, 3968, 1, 1536, 3072, 3072, 1536, 3968]
    - [38, 110.92]
  - - [4736, 2432, 1, 3072, 4736, 4736, 3072, 2432]
    - [44, 109.49]
  - - [768, 640, 1, 1152, 768, 768, 1152, 640]
    - [18, 27.63]
  - - [3456, 4992, 1, 1152, 3456, 3456, 1152, 4992]
    - [28, 97.5]
  - - [1664, 4736, 1, 1536, 1664, 1664, 1536, 4736]
    - [86, 98.13]
  - - [2176, 3584, 1, 2560, 2176, 2176, 2560, 3584]
    - [78, 101.56]
  - - [3328, 1664, 1, 1664, 3328, 3328, 1664, 1664]
    - [24, 82.27]
  - - [640, 4608, 1, 2176, 640, 640, 2176, 4608]
    - [75, 85.3]
  - - [4864, 4096, 1, 2432, 4864, 4864, 2432, 4096]
    - [39, 116.83]
  - - [4736, 3200, 1, 512, 4736, 4736, 512, 3200]
    - [42, 99.07]
  - - [1024, 4480, 1, 2944, 1024, 1024, 2944, 4480]
    - [26, 98.97]
  - - [2176, 3840, 1, 4736, 2176, 2176, 4736, 3840]
    - [86, 105.22]
  - - [1024, 256, 1, 2304, 1024, 1024, 2304, 256]
    - [15, 25.4]
  - - [3584, 3968, 1, 2560, 3584, 3584, 2560, 3968]
    - [44, 125.05]
  - - [2304, 896, 1, 2304, 2304, 2304, 2304, 896]
    - [27, 74.33]
  - - [2176, 3968, 1, 3200, 2176, 2176, 3200, 3968]
    - [30, 101.62]
  - - [1152, 384, 1, 4864, 1152, 1152, 4864, 384]
    - [84, 58.77]
  - - [3968, 1536, 1, 2432, 3968, 3968, 2432, 1536]
    - [24, 90.5]
  - - [1280, 2176, 1, 3840, 1280, 1280, 3840, 2176]
    - [85, 89.19]
  - - [2176, 4224, 1, 640, 2176, 2176, 640, 4224]
    - [40, 95.81]
  - - [1280, 1792, 1, 5120, 1280, 1280, 5120, 1792]
    - [26, 91.33]
  - - [3712, 2688, 1, 640, 3712, 3712, 640, 2688]
    - [45, 93.84]
  - - [2816, 2432, 1, 4992, 2816, 2816, 4992, 2432]
    - [25, 104.14]
  - - [4480, 3328, 1, 1280, 4480, 4480, 1280, 3328]
    - [36, 114.04]
  - - [3072, 4224, 1, 1664, 3072, 3072, 1664, 4224]
    - [37, 114.79]
  - - [512, 1024, 1, 1792, 512, 512, 1792, 1024]
    - [18, 39.3]
  - - [2176, 3072, 1, 896, 2176, 2176, 896, 3072]
    - [25, 93.05]
  - - [1920, 1792, 1, 4096, 1920, 1920, 4096, 1792]
    - [39, 98.67]
  - - [2560, 4608, 1, 3712, 2560, 2560, 3712, 4608]
    - [38, 112.97]
  - - [1280, 2816, 1, 1792, 1280, 1280, 1792, 2816]
    - [4, 87.65]
  - - [2304, 2944, 1, 1664, 2304, 2304, 1664, 2944]
    - [25, 97.37]
  - - [1792, 2176, 1, 4992, 1792, 1792, 4992, 2176]
    - [27, 85.39]
  - - [1280, 768, 1, 128, 1280, 1280, 128, 768]
    - [71, 14.76]
  - - [1920, 1664, 1, 768, 1920, 1920, 768, 1664]
    - [27, 63.21]
  - - [3840, 256, 1, 3072, 3840, 3840, 3072, 256]
    - [76, 61.15]
  - - [1792, 4352, 1, 384, 1792, 1792, 384, 4352]
    - [85, 77.24]
  - - [1280, 1664, 1, 2560, 1280, 1280, 2560, 1664]
    - [5, 77.46]
  - - [1536, 4992, 1, 640, 1536, 1536, 640, 4992]
    - [25, 97.39]
  - - [4608, 4864, 1, 768, 4608, 4608, 768, 4864]
    - [25, 99.69]
  - - [2176, 256, 1, 2048, 2176, 2176, 2048, 256]
    - [10, 42.59]
  - - [1664, 1920, 1, 4352, 1664, 1664, 4352, 1920]
    - [49, 91.59]
  - - [3328, 1792, 1, 2048, 3328, 3328, 2048, 1792]
    - [24, 88.89]
  - - [4992, 3712, 1, 512, 4992, 4992, 512, 3712]
    - [52, 91.9]
  - - [4480, 640, 1, 3840, 4480, 4480, 3840, 640]
    - [75, 81.45]
  - - [3456, 2560, 1, 3456, 3456, 3456, 3456, 2560]
    - [29, 106.25]
  - - [2944, 2048, 1, 2688, 2944, 2944, 2688, 2048]
    - [24, 91.08]
  - - [2560, 2048, 1, 384, 2560, 2560, 384, 2048]
    - [95, 67.37]
  - - [2944, 2688, 1, 640, 2944, 2944, 640, 2688]
    - [85, 83.83]
  - - [256, 3200, 1, 4864, 256, 256, 4864, 3200]
    - [76, 64.34]
  - - [640, 512, 1, 2048, 640, 640, 2048, 512]
    - [10, 31.27]
  - - [4096, 1408, 1, 1920, 4096, 4096, 1920, 1408]
    - [95, 91.96]
  - - [4864, 2304, 1, 512, 4864, 4864, 512, 2304]
    - [47, 90.19]
  - - [3584, 768, 1, 3968, 3584, 3584, 3968, 768]
    - [93, 87.84]
  - - [768, 4096, 1, 3968, 768, 768, 3968, 4096]
    - [24, 87.01]
  - - [896, 128, 1, 384, 896, 896, 384, 128]
    - [7, 5.62]
  - - [1152, 4864, 1, 3840, 1152, 1152, 3840, 4864]
    - [24, 89.83]
  - - [2944, 4096, 1, 3840, 2944, 2944, 3840, 4096]
    - [38, 114.03]
  - - [1152, 2304, 1, 640, 1152, 1152, 640, 2304]
    - [84, 67.7]
  - - [4096, 1792, 1, 1792, 4096, 4096, 1792, 1792]
    - [79, 96.48]
  - - [640, 4224, 1, 4736, 640, 640, 4736, 4224]
    - [86, 88.23]
  - - [1152, 1408, 1, 896, 1152, 1152, 896, 1408]
    - [77, 53.07]
  - - [4608, 896, 1, 4224, 4608, 4608, 4224, 896]
    - [76, 83.64]
  - - [128, 4608, 1, 384, 128, 128, 384, 4608]
    - [66, 19.09]
  - - [1024, 2944, 1, 1792, 1024, 1024, 1792, 2944]
    - [84, 85.6]
  - - [2688, 512, 1, 2688, 2688, 2688, 2688, 512]
    - [27, 69.39]
  - - [1664, 3328, 1, 896, 1664, 1664, 896, 3328]
    - [24, 78.97]
  - - [256, 3328, 1, 3968, 256, 256, 3968, 3328]
    - [58, 66.42]
  - - [3584, 2560, 1, 1280, 3584, 3584, 1280, 2560]
    - [32, 101.8]
  - - [768, 896, 1, 384, 768, 768, 384, 896]
    - [66, 22.12]
  - - [1792, 2432, 1, 768, 1792, 1792, 768, 2432]
    - [5, 83.7]
  - - [2304, 2304, 1, 3968, 2304, 2304, 3968, 2304]
    - [24, 86.24]
  - - [3456, 128, 1, 4352, 3456, 3456, 4352, 128]
    - [73, 50.29]
  - - [2176, 2048, 1, 1536, 2176, 2176, 1536, 2048]
    - [5, 92.8]
  - - [2304, 1152, 1, 2048, 2304, 2304, 2048, 1152]
    - [75, 79.27]
  - - [1664, 4480, 1, 640, 1664, 1664, 640, 4480]
    - [25, 95.04]
  - - [2816, 4480, 1, 3840, 2816, 2816, 3840, 4480]
    - [38, 115.26]
  - - [256, 384, 1, 4992, 256, 256, 4992, 384]
    - [18, 25.24]
  - - [1152, 2304, 1, 768, 1152, 1152, 768, 2304]
    - [75, 72.02]
  - - [3712, 2560, 1, 4992, 3712, 3712, 4992, 2560]
    - [32, 111.09]
  - - [3328, 1280, 1, 4480, 3328, 3328, 4480, 1280]
    - [5, 95.7]
  - - [2304, 3712, 1, 4864, 2304, 2304, 4864, 3712]
    - [30, 103.77]
  - - [896, 384, 1, 3200, 896, 896, 3200, 384]
    - [10, 43.14]
  - - [2944, 1536, 1, 256, 2944, 2944, 256, 1536]
    - [26, 60.11]
  - - [768, 1792, 1, 768, 768, 768, 768, 1792]
    - [10, 53.07]
  - - [2304, 4480, 1, 3840, 2304, 2304, 3840, 4480]
    - [49, 118.68]
  - - [4608, 2176, 1, 128, 4608, 4608, 128, 2176]
    - [45, 54.82]
  - - [128, 1024, 1, 1152, 128, 128, 1152, 1024]
    - [14, 11.83]
  - - [2560, 256, 1, 4736, 2560, 2560, 4736, 256]
    - [27, 60.5]
  - - [2944, 1280, 1, 1664, 2944, 2944, 1664, 1280]
    - [76, 79.92]
  - - [768, 768, 1, 512, 768, 768, 512, 768]
    - [66, 22.1]
  - - [4352, 512, 1, 1920, 4352, 4352, 1920, 512]
    - [75, 66.24]
  - - [1664, 640, 1, 256, 1664, 1664, 256, 640]
    - [10, 23.12]
  - - [3840, 4096, 1, 3840, 3840, 3840, 3840, 4096]
    - [36, 128.57]
  - - [1664, 4224, 1, 1152, 1664, 1664, 1152, 4224]
    - [25, 94.11]
  - - [384, 1792, 1, 2048, 384, 384, 2048, 1792]
    - [10, 53.35]
  - - [1536, 4224, 1, 384, 1536, 1536, 384, 4224]
    - [85, 66.98]
  - - [1664, 1792, 1, 3328, 1664, 1664, 3328, 1792]
    - [75, 87.79]
  - - [2560, 1280, 1, 2560, 2560, 2560, 2560, 1280]
    - [4, 84.49]
  - - [2944, 256, 1, 3584, 2944, 2944, 3584, 256]
    - [73, 60.09]
  - - [1920, 256, 1, 1280, 1920, 1920, 1280, 256]
    - [18, 27.87]
  - - [1792, 4480, 1, 4224, 1792, 1792, 4224, 4480]
    - [93, 102.78]
  - - [1280, 3712, 1, 4224, 1280, 1280, 4224, 3712]
    - [26, 101.77]
  - - [768, 1280, 1, 128, 768, 768, 128, 1280]
    - [71, 15.12]
  - - [4224, 2944, 1, 1792, 4224, 4224, 1792, 2944]
    - [44, 112.44]
  - - [3328, 1152, 1, 4352, 3328, 3328, 4352, 1152]
    - [4, 95.58]
  - - [2944, 1024, 1, 3328, 2944, 2944, 3328, 1024]
    - [75, 86.45]
  - - [256, 2048, 1, 512, 256, 256, 512, 2048]
    - [18, 23.14]
  - - [2560, 3840, 1, 1408, 2560, 2560, 1408, 3840]
    - [40, 111.46]
  - - [3584, 768, 1, 3840, 3584, 3584, 3840, 768]
    - [93, 88.12]
  - - [2176, 3072, 1, 4992, 2176, 2176, 4992, 3072]
    - [25, 103.34]
  - - [256, 1152, 1, 256, 256, 256, 256, 1152]
    - [16, 9.27]
  - - [2176, 2816, 1, 1792, 2176, 2176, 1792, 2816]
    - [24, 90.13]
  - - [4864, 1792, 1, 2048, 4864, 4864, 2048, 1792]
    - [30, 101.47]
  - - [4736, 640, 1, 2688, 4736, 4736, 2688, 640]
    - [73, 80.03]
  - - [3456, 1920, 1, 512, 3456, 3456, 512, 1920]
    - [92, 67.43]
  - - [1536, 4864, 1, 1664, 1536, 1536, 1664, 4864]
    - [25, 105.96]
  - - [512, 2048, 1, 4736, 512, 512, 4736, 2048]
    - [76, 72.21]
  - - [1152, 4224, 1, 4992, 1152, 1152, 4992, 4224]
    - [26, 103.92]
  - - [1408, 2944, 1, 2304, 1408, 1408, 2304, 2944]
    - [27, 85.79]
  - - [2432, 3328, 1, 4864, 2432, 2432, 4864, 3328]
    - [86, 105.33]
  - - [1280, 3840, 1, 1920, 1280, 1280, 1920, 3840]
    - [58, 101.89]
  - - [1024, 3840, 1, 3968, 1024, 1024, 3968, 3840]
    - [27, 85.08]
  - - [3200, 896, 1, 4864, 3200, 3200, 4864, 896]
    - [87, 86.37]
  - - [1280, 1280, 1, 2048, 1280, 1280, 2048, 1280]
    - [76, 61.61]
  - - [1792, 2560, 1, 2176, 1792, 1792, 2176, 2560]
    - [26, 99.3]
  - - [4736, 3712, 1, 1280, 4736, 4736, 1280, 3712]
    - [28, 97.32]
  - - [4736, 384, 1, 2560, 4736, 4736, 2560, 384]
    - [27, 69.4]
  - - [1024, 1280, 1, 3584, 1024, 1024, 3584, 1280]
    - [26, 81.4]
  - - [4608, 3712, 1, 640, 4608, 4608, 640, 3712]
    - [39, 93.67]
  - - [1664, 1536, 1, 4736, 1664, 1664, 4736, 1536]
    - [78, 88.15]
  - - [4864, 1280, 1, 512, 4864, 4864, 512, 1280]
    - [24, 76.77]
  - - [2048, 896, 1, 128, 2048, 2048, 128, 896]
    - [77, 22.98]
  - - [1024, 2176, 1, 1152, 1024, 1024, 1152, 2176]
    - [75, 69.76]
  - - [2816, 1152, 1, 3712, 2816, 2816, 3712, 1152]
    - [4, 85.78]
  - - [1664, 2560, 1, 4864, 1664, 1664, 4864, 2560]
    - [5, 96.87]
  - - [4224, 640, 1, 2176, 4224, 4224, 2176, 640]
    - [84, 79.67]
  - - [3456, 1152, 1, 4608, 3456, 3456, 4608, 1152]
    - [27, 85.96]
  - - [4608, 1664, 1, 1664, 4608, 4608, 1664, 1664]
    - [85, 95.95]
  - - [2816, 3328, 1, 1024, 2816, 2816, 1024, 3328]
    - [39, 104.72]
  - - [3840, 4736, 1, 4352, 3840, 3840, 4352, 4736]
    - [40, 113.07]
  - - [4096, 896, 1, 3200, 4096, 4096, 3200, 896]
    - [76, 78.77]
  - - [2560, 3584, 1, 1024, 2560, 2560, 1024, 3584]
    - [32, 104.77]
  - - [3840, 4480, 1, 4736, 3840, 3840, 4736, 4480]
    - [28, 102.03]
  - - [4736, 640, 1, 384, 4736, 4736, 384, 640]
    - [73, 56.51]
  - - [2176, 3712, 1, 3200, 2176, 2176, 3200, 3712]
    - [78, 101.7]
  - - [2304, 2304, 1, 1280, 2304, 2304, 1280, 2304]
    - [24, 80.81]
  - - [2816, 512, 1, 512, 2816, 2816, 512, 512]
    - [97, 40.39]
  - - [3584, 1664, 1, 4224, 3584, 3584, 4224, 1664]
    - [94, 95.18]
  - - [2944, 1792, 1, 1408, 2944, 2944, 1408, 1792]
    - [24, 79.75]
  - - [2944, 2176, 1, 4864, 2944, 2944, 4864, 2176]
    - [25, 100.25]
  - - [4608, 3584, 1, 4608, 4608, 4608, 4608, 3584]
    - [85, 104.47]
  - - [2304, 2688, 1, 4480, 2304, 2304, 4480, 2688]
    - [48, 98.89]
  - - [1024, 1536, 1, 896, 1024, 1024, 896, 1536]
    - [10, 61.2]
  - - [1024, 4096, 1, 640, 1024, 1024, 640, 4096]
    - [76, 76.33]
  - - [4352, 2560, 1, 2816, 4352, 4352, 2816, 2560]
    - [38, 106.79]
  - - [3328, 4352, 1, 3712, 3328, 3328, 3712, 4352]
    - [44, 128.25]
  - - [1792, 1664, 1, 1152, 1792, 1792, 1152, 1664]
    - [84, 79.52]
  - - [4352, 1280, 1, 3328, 4352, 4352, 3328, 1280]
    - [24, 87.18]
  - - [3968, 3968, 1, 768, 3968, 3968, 768, 3968]
    - [78, 92.84]
  - - [3584, 2688, 1, 4992, 3584, 3584, 4992, 2688]
    - [32, 110.9]
  - - [2688, 2944, 1, 640, 2688, 2688, 640, 2944]
    - [79, 89.55]
  - - [1152, 4480, 1, 3712, 1152, 1152, 3712, 4480]
    - [26, 107.8]
  - - [1152, 4608, 1, 2560, 1152, 1152, 2560, 4608]
    - [24, 85.68]
  - - [2048, 3584, 1, 640, 2048, 2048, 640, 3584]
    - [33, 89.87]
  - - [1408, 1408, 1, 4096, 1408, 1408, 4096, 1408]
    - [76, 79.9]
  - - [1280, 3456, 1, 4352, 1280, 1280, 4352, 3456]
    - [5, 99.77]
  - - [1024, 4864, 1, 4352, 1024, 1024, 4352, 4864]
    - [26, 105.22]
  - - [384, 512, 1, 3456, 384, 384, 3456, 512]
    - [10, 30.74]
  - - [4096, 2688, 1, 3584, 4096, 4096, 3584, 2688]
    - [44, 108.37]
  - - [1152, 2944, 1, 5120, 1152, 1152, 5120, 2944]
    - [25, 94.91]
  - - [1792, 1024, 1, 2176, 1792, 1792, 2176, 1024]
    - [27, 68.66]
  - - [2432, 4992, 1, 128, 2432, 2432, 128, 4992]
    - [46, 44.64]
  - - [2304, 1664, 1, 4224, 2304, 2304, 4224, 1664]
    - [27, 85.16]
  - - [3072, 3456, 1, 1792, 3072, 3072, 1792, 3456]
    - [38, 102.94]
  - - [1536, 4352, 1, 4608, 1536, 1536, 4608, 4352]
    - [25, 104.64]
  - - [3072, 2304, 1, 2304, 3072, 3072, 2304, 2304]
    - [25, 100.63]
  - - [1408, 4736, 1, 2560, 1408, 1408, 2560, 4736]
    - [25, 99.73]
  - - [640, 2176, 1, 640, 640, 640, 640, 2176]
    - [10, 49.79]
  - - [896, 1792, 1, 3456, 896, 896, 3456, 1792]
    - [56, 80.26]
  - - [128, 768, 1, 1920, 128, 128, 1920, 768]
    - [9, 14.16]
  - - [2560, 512, 1, 4608, 2560, 2560, 4608, 512]
    - [76, 73.81]
  - - [3456, 3584, 1, 4992, 3456, 3456, 4992, 3584]
    - [38, 117.23]
  - - [128, 3072, 1, 3584, 128, 128, 3584, 3072]
    - [10, 51.32]
  - - [3200, 3968, 1, 2560, 3200, 3200, 2560, 3968]
    - [38, 113.42]
  - - [4992, 1024, 1, 256, 4992, 4992, 256, 1024]
    - [95, 55.97]
  - - [384, 1792, 1, 4480, 384, 384, 4480, 1792]
    - [76, 61.07]
  - - [2688, 3072, 1, 1024, 2688, 2688, 1024, 3072]
    - [86, 98.79]
  - - [4352, 2560, 1, 1664, 4352, 4352, 1664, 2560]
    - [38, 105.85]
  - - [4992, 3328, 1, 896, 4992, 4992, 896, 3328]
    - [79, 99.77]
  - - [640, 3712, 1, 1280, 640, 640, 1280, 3712]
    - [26, 71.03]
  - - [512, 1280, 1, 2432, 512, 512, 2432, 1280]
    - [10, 52.73]
  - - [1792, 2304, 1, 1152, 1792, 1792, 1152, 2304]
    - [76, 82.68]
  - - [3712, 3712, 1, 384, 3712, 3712, 384, 3712]
    - [46, 84.79]
  - - [1536, 768, 1, 3712, 1536, 1536, 3712, 768]
    - [5, 76.65]
  - - [2304, 1152, 1, 3968, 2304, 2304, 3968, 1152]
    - [93, 86.63]
  - - [2432, 2304, 1, 2944, 2432, 2432, 2944, 2304]
    - [24, 87.12]
  - - [2304, 3200, 1, 3328, 2304, 2304, 3328, 3200]
    - [25, 109.24]
  - - [3968, 1280, 1, 4608, 3968, 3968, 4608, 1280]
    - [40, 106.04]
  - - [3072, 1792, 1, 3712, 3072, 3072, 3712, 1792]
    - [24, 87.62]
  - - [3456, 896, 1, 5120, 3456, 3456, 5120, 896]
    - [52, 91.58]
  - - [4736, 2688, 1, 2944, 4736, 4736, 2944, 2688]
    - [37, 114.98]
  - - [2176, 1664, 1, 3328, 2176, 2176, 3328, 1664]
    - [4, 89.9]
  - - [3072, 1920, 1, 896, 3072, 3072, 896, 1920]
    - [24, 83.25]
  - - [128, 2304, 1, 1792, 128, 128, 1792, 2304]
    - [16, 23.68]
  - - [3328, 3584, 1, 4864, 3328, 3328, 4864, 3584]
    - [38, 115.64]
  - - [1792, 3200, 1, 768, 1792, 1792, 768, 3200]
    - [24, 78.22]
  - - [3200, 1920, 1, 128, 3200, 3200, 128, 1920]
    - [48, 47.24]
  - - [3200, 4864, 1, 1920, 3200, 3200, 1920, 4864]
    - [36, 121.32]
  - - [3328, 1024, 1, 1536, 3328, 3328, 1536, 1024]
    - [4, 79.68]
  - - [1152, 3200, 1, 2432, 1152, 1152, 2432, 3200]
    - [4, 89.68]
  - - [3200, 1152, 1, 4736, 3200, 3200, 4736, 1152]
    - [4, 94.2]
  - - [640, 2560, 1, 3584, 640, 640, 3584, 2560]
    - [56, 83.07]
  - - [128, 1152, 1, 3328, 128, 128, 3328, 1152]
    - [71, 24.39]
  - - [640, 1792, 1, 2816, 640, 640, 2816, 1792]
    - [26, 69.45]
  - - [128, 3328, 1, 768, 128, 128, 768, 3328]
    - [18, 23.2]
  - - [4224, 640, 1, 2048, 4224, 4224, 2048, 640]
    - [84, 79.27]
  - - [1152, 3200, 1, 768, 1152, 1152, 768, 3200]
    - [27, 71.54]
  - - [768, 512, 1, 640, 768, 768, 640, 512]
    - [67, 17.72]
  - - [1920, 640, 1, 1024, 1920, 1920, 1024, 640]
    - [10, 50.04]
  - - [1792, 3456, 1, 3456, 1792, 1792, 3456, 3456]
    - [48, 98.17]
  - - [4992, 4480, 1, 4864, 4992, 4992, 4864, 4480]
    - [25, 111.54]
  - - [4096, 3968, 1, 3200, 4096, 4096, 3200, 3968]
    - [78, 101.16]
  - - [2944, 384, 1, 1024, 2944, 2944, 1024, 384]
    - [10, 48.05]
  - - [1280, 3968, 1, 896, 1280, 1280, 896, 3968]
    - [58, 94.73]
  - - [1408, 768, 1, 4224, 1408, 1408, 4224, 768]
    - [5, 74.22]
  - - [2944, 4096, 1, 4096, 2944, 2944, 4096, 4096]
    - [38, 114.19]
  - - [512, 4736, 1, 3200, 512, 512, 3200, 4736]
    - [26, 88.63]
  - - [2304, 2560, 1, 3968, 2304, 2304, 3968, 2560]
    - [24, 90.9]
  - - [4864, 1280, 1, 3968, 4864, 4864, 3968, 1280]
    - [24, 92.35]
  - - [1152, 3840, 1, 4608, 1152, 1152, 4608, 3840]
    - [5, 102.08]
  - - [1792, 2688, 1, 1408, 1792, 1792, 1408, 2688]
    - [58, 97.69]
  - - [896, 2176, 1, 4352, 896, 896, 4352, 2176]
    - [76, 79.71]
  - - [768, 4096, 1, 4608, 768, 768, 4608, 4096]
    - [24, 88.45]
  - - [512, 2560, 1, 3072, 512, 512, 3072, 2560]
    - [56, 78.01]
  - - [3456, 4608, 1, 2176, 3456, 3456, 2176, 4608]
    - [36, 124.43]
  - - [128, 1152, 1, 4480, 128, 128, 4480, 1152]
    - [71, 29.54]
  - - [128, 896, 1, 3584, 128, 128, 3584, 896]
    - [15, 21.49]
  - - [1408, 2944, 1, 3840, 1408, 1408, 3840, 2944]
    - [27, 87.94]
  - - [3072, 768, 1, 1152, 3072, 3072, 1152, 768]
    - [5, 67.9]
  - - [1408, 2176, 1, 3968, 1408, 1408, 3968, 2176]
    - [75, 90.52]
  - - [1024, 2304, 1, 384, 1024, 1024, 384, 2304]
    - [84, 51.88]
  - - [3968, 4224, 1, 640, 3968, 3968, 640, 4224]
    - [27, 80.8]
  - - [896, 1792, 1, 3968, 896, 896, 3968, 1792]
    - [26, 82.12]
  - - [3584, 2944, 1, 3328, 3584, 3584, 3328, 2944]
    - [38, 106.14]
  - - [3712, 640, 1, 2560, 3712, 3712, 2560, 640]
    - [26, 85.53]
  - - [128, 4096, 1, 896, 128, 128, 896, 4096]
    - [18, 25.94]
  - - [2176, 2944, 1, 1280, 2176, 2176, 1280, 2944]
    - [25, 91.22]
  - - [3840, 2432, 1, 1792, 3840, 3840, 1792, 2432]
    - [32, 107.26]
  - - [3968, 2304, 1, 2432, 3968, 3968, 2432, 2304]
    - [28, 101.9]
  - - [2816, 640, 1, 1408, 2816, 2816, 1408, 640]
    - [76, 58.95]
  - - [4736, 4864, 1, 3456, 4736, 4736, 3456, 4864]
    - [38, 111.3]
  - - [3456, 4224, 1, 512, 3456, 3456, 512, 4224]
    - [43, 101.07]
  - - [1792, 3328, 1, 3456, 1792, 1792, 3456, 3328]
    - [24, 91.4]
  - - [1408, 3840, 1, 1792, 1408, 1408, 1792, 3840]
    - [24, 83.28]
  - - [128, 3328, 1, 1536, 128, 128, 1536, 3328]
    - [18, 33.24]
  - - [256, 1792, 1, 1536, 256, 256, 1536, 1792]
    - [18, 35.2]
  - - [256, 3328, 1, 256, 256, 256, 256, 3328]
    - [71, 20.48]
  - - [3712, 2432, 1, 2176, 3712, 3712, 2176, 2432]
    - [40, 106.08]
  - - [896, 1536, 1, 256, 896, 896, 256, 1536]
    - [10, 29.9]
  - - [2048, 128, 1, 4096, 2048, 2048, 4096, 128]
    - [91, 39.56]
  - - [3712, 384, 1, 2304, 3712, 3712, 2304, 384]
    - [10, 66.58]
  - - [896, 512, 1, 640, 896, 896, 640, 512]
    - [70, 21.53]
  - - [640, 3584, 1, 640, 640, 640, 640, 3584]
    - [84, 60.53]
  - - [768, 2048, 1, 1920, 768, 768, 1920, 2048]
    - [73, 69.87]
  - - [2944, 3328, 1, 2816, 2944, 2944, 2816, 3328]
    - [32, 111.2]
  - - [256, 4992, 1, 3328, 256, 256, 3328, 4992]
    - [26, 74.75]
  - - [4096, 3072, 1, 2560, 4096, 4096, 2560, 3072]
    - [38, 114.3]
  - - [2560, 4224, 1, 1920, 2560, 2560, 1920, 4224]
    - [44, 105.46]
  - - [4992, 768, 1, 384, 4992, 4992, 384, 768]
    - [27, 60.3]
  - - [256, 1280, 1, 3456, 256, 256, 3456, 1280]
    - [10, 45.72]
  - - [384, 2944, 1, 1664, 384, 384, 1664, 2944]
    - [10, 58.2]
  - - [3456, 3968, 1, 256, 3456, 3456, 256, 3968]
    - [46, 72.58]
  - - [3968, 1920, 1, 2048, 3968, 3968, 2048, 1920]
    - [25, 105.61]
  - - [3456, 2560, 1, 1408, 3456, 3456, 1408, 2560]
    - [32, 101.5]
  - - [3328, 1152, 1, 5120, 3328, 3328, 5120, 1152]
    - [4, 96.38]
  - - [1024, 2688, 1, 2944, 1024, 1024, 2944, 2688]
    - [75, 83.93]
  - - [2688, 768, 1, 4480, 2688, 2688, 4480, 768]
    - [76, 78.7]
  - - [256, 4992, 1, 2304, 256, 256, 2304, 4992]
    - [76, 63.08]
  - - [3840, 1664, 1, 4864, 3840, 3840, 4864, 1664]
    - [25, 96.16]
  - - [256, 4352, 1, 4992, 256, 256, 4992, 4352]
    - [58, 75.29]
  - - [3200, 3328, 1, 2048, 3200, 3200, 2048, 3328]
    - [44, 105.64]
  - - [3456, 2048, 1, 2048, 3456, 3456, 2048, 2048]
    - [25, 100.24]
  - - [1152, 896, 1, 3456, 1152, 1152, 3456, 896]
    - [27, 66.2]
  - - [256, 2688, 1, 4864, 256, 256, 4864, 2688]
    - [27, 61.58]
  - - [3584, 4352, 1, 4736, 3584, 3584, 4736, 4352]
    - [36, 126.53]
  - - [1152, 896, 1, 256, 1152, 1152, 256, 896]
    - [71, 23.92]
  - - [3456, 1792, 1, 3840, 3456, 3456, 3840, 1792]
    - [24, 91.3]
  - - [896, 2816, 1, 4608, 896, 896, 4608, 2816]
    - [26, 95.81]
  - - [3584, 2816, 1, 3072, 3584, 3584, 3072, 2816]
    - [32, 113.58]
  - - [3200, 3328, 1, 3840, 3200, 3200, 3840, 3328]
    - [44, 109.59]
  - - [512, 256, 1, 4224, 512, 512, 4224, 256]
    - [18, 25.19]
  - - [1280, 3328, 1, 4480, 1280, 1280, 4480, 3328]
    - [5, 96.88]
  - - [1792, 4096, 1, 2688, 1792, 1792, 2688, 4096]
    - [25, 104.8]
  - - [4096, 2432, 1, 4992, 4096, 4096, 4992, 2432]
    - [45, 114.36]
  - - [512, 2304, 1, 2688, 512, 512, 2688, 2304]
    - [76, 63.2]
  - - [4864, 4096, 1, 3584, 4864, 4864, 3584, 4096]
    - [39, 117.57]
  - - [256, 4608, 1, 3456, 256, 256, 3456, 4608]
    - [76, 65.92]
  - - [4224, 3968, 1, 4224, 4224, 4224, 4224, 3968]
    - [27, 91.38]
  - - [2816, 4480, 1, 1408, 2816, 2816, 1408, 4480]
    - [38, 109.11]
  - - [2048, 4480, 1, 128, 2048, 2048, 128, 4480]
    - [52, 53.21]
  - - [1792, 2688, 1, 1024, 1792, 1792, 1024, 2688]
    - [58, 93.47]
  - - [1152, 640, 1, 1024, 1152, 1152, 1024, 640]
    - [10, 38.11]
  - - [2944, 3840, 1, 4736, 2944, 2944, 4736, 3840]
    - [38, 110.8]
  - - [1152, 4864, 1, 3328, 1152, 1152, 3328, 4864]
    - [24, 89.62]
  - - [3968, 2048, 1, 3456, 3968, 3968, 3456, 2048]
    - [86, 102.33]
  - - [2816, 4352, 1, 4224, 2816, 2816, 4224, 4352]
    - [44, 118.06]
  - - [3072, 1280, 1, 4864, 3072, 3072, 4864, 1280]
    - [25, 100.8]
  - - [128, 4864, 1, 3328, 128, 128, 3328, 4864]
    - [10, 53.78]
  - - [3968, 3200, 1, 2048, 3968, 3968, 2048, 3200]
    - [37, 114.08]
  - - [2816, 640, 1, 1152, 2816, 2816, 1152, 640]
    - [27, 54.1]
  - - [1664, 2304, 1, 3072, 1664, 1664, 3072, 2304]
    - [4, 94.92]
  - - [256, 3072, 1, 3584, 256, 256, 3584, 3072]
    - [10, 65.23]
  - - [3840, 512, 1, 3968, 3840, 3840, 3968, 512]
    - [76, 74.24]
  - - [1408, 896, 1, 3712, 1408, 1408, 3712, 896]
    - [27, 70.26]
  - - [896, 2304, 1, 2944, 896, 896, 2944, 2304]
    - [27, 77.69]
  - - [1664, 2944, 1, 512, 1664, 1664, 512, 2944]
    - [26, 82.94]
  - - [1536, 3328, 1, 512, 1536, 1536, 512, 3328]
    - [26, 85.68]
  - - [2688, 1920, 1, 1792, 2688, 2688, 1792, 1920]
    - [58, 103.53]
  - - [1920, 1792, 1, 3968, 1920, 1920, 3968, 1792]
    - [39, 97.6]
  - - [3712, 2048, 1, 1280, 3712, 3712, 1280, 2048]
    - [86, 96.01]
  - - [640, 2176, 1, 3968, 640, 640, 3968, 2176]
    - [27, 74.66]
  - - [3712, 4096, 1, 1920, 3712, 3712, 1920, 4096]
    - [36, 121.82]
  - - [1408, 896, 1, 4736, 1408, 1408, 4736, 896]
    - [27, 73.97]
  - - [2944, 896, 1, 640, 2944, 2944, 640, 896]
    - [84, 65.77]
  - - [2048, 4608, 1, 2304, 2048, 2048, 2304, 4608]
    - [32, 110.64]
  - - [3200, 2176, 1, 1920, 3200, 3200, 1920, 2176]
    - [25, 99.79]
  - - [3200, 3968, 1, 2432, 3200, 3200, 2432, 3968]
    - [38, 114.4]
  - - [1664, 3840, 1, 1920, 1664, 1664, 1920, 3840]
    - [25, 97.83]
  - - [896, 3712, 1, 3840, 896, 896, 3840, 3712]
    - [44, 93.64]
  - - [2560, 1280, 1, 2816, 2560, 2560, 2816, 1280]
    - [4, 83.85]
  - - [1408, 1152, 1, 1920, 1408, 1408, 1920, 1152]
    - [27, 59.77]
  - - [1664, 2048, 1, 2176, 1664, 1664, 2176, 2048]
    - [4, 85.39]
  - - [2816, 3456, 1, 3840, 2816, 2816, 3840, 3456]
    - [39, 112.77]
  - - [128, 3200, 1, 512, 128, 128, 512, 3200]
    - [18, 17.73]
  - - [2944, 4608, 1, 1152, 2944, 2944, 1152, 4608]
    - [37, 113.38]
  - - [1920, 1664, 1, 3584, 1920, 1920, 3584, 1664]
    - [40, 90.88]
  - - [384, 1280, 1, 2304, 384, 384, 2304, 1280]
    - [10, 47.73]
  - - [2944, 896, 1, 1280, 2944, 2944, 1280, 896]
    - [84, 74.11]
  - - [640, 1152, 1, 2304, 640, 640, 2304, 1152]
    - [10, 58.52]
  - - [4352, 1280, 1, 4864, 4352, 4352, 4864, 1280]
    - [24, 88.2]
  - - [4480, 1024, 1, 1408, 4480, 4480, 1408, 1024]
    - [58, 89.83]
  - - [3712, 128, 1, 2176, 3712, 3712, 2176, 128]
    - [91, 40.76]
  - - [256, 2560, 1, 2304, 256, 256, 2304, 2560]
    - [10, 53.92]
  - - [3200, 2176, 1, 4608, 3200, 3200, 4608, 2176]
    - [25, 103.19]
  - - [3584, 128, 1, 1792, 3584, 3584, 1792, 128]
    - [71, 33.03]
  - - [1792, 2944, 1, 2816, 1792, 1792, 2816, 2944]
    - [24, 83.89]
  - - [4096, 128, 1, 2048, 4096, 4096, 2048, 128]
    - [71, 37.94]
  - - [4096, 4352, 1, 1792, 4096, 4096, 1792, 4352]
    - [30, 103.33]
  - - [1024, 1152, 1, 640, 1024, 1024, 640, 1152]
    - [10, 43.11]
  - - [3840, 1152, 1, 2688, 3840, 3840, 2688, 1152]
    - [5, 98.3]
  - - [3328, 4480, 1, 4736, 3328, 3328, 4736, 4480]
    - [43, 125.75]
  - - [128, 1664, 1, 4736, 128, 128, 4736, 1664]
    - [10, 40.89]
  - - [1280, 3712, 1, 768, 1280, 1280, 768, 3712]
    - [56, 87.84]
  - - [256, 512, 1, 3456, 256, 256, 3456, 512]
    - [15, 22.92]
  - - [896, 3840, 1, 1792, 896, 896, 1792, 3840]
    - [4, 84.0]
  - - [768, 640, 1, 512, 768, 768, 512, 640]
    - [18, 20.86]
  - - [4096, 384, 1, 2816, 4096, 4096, 2816, 384]
    - [10, 70.47]
  - - [2944, 2560, 1, 3328, 2944, 2944, 3328, 2560]
    - [25, 107.81]
  - - [1152, 3456, 1, 3072, 1152, 1152, 3072, 3456]
    - [27, 84.61]
  - - [1792, 896, 1, 3712, 1792, 1792, 3712, 896]
    - [26, 80.56]
  - - [3328, 640, 1, 128, 3328, 3328, 128, 640]
    - [6, 25.28]
  - - [256, 3712, 1, 4480, 256, 256, 4480, 3712]
    - [58, 71.73]
  - - [1408, 2048, 1, 4736, 1408, 1408, 4736, 2048]
    - [24, 83.59]
  - - [640, 4992, 1, 4736, 640, 640, 4736, 4992]
    - [32, 95.42]
  - - [1664, 2688, 1, 4096, 1664, 1664, 4096, 2688]
    - [5, 100.28]
  - - [1408, 4736, 1, 384, 1408, 1408, 384, 4736]
    - [79, 69.18]
  - - [1792, 256, 1, 3584, 1792, 1792, 3584, 256]
    - [10, 50.03]
  - - [3072, 4224, 1, 768, 3072, 3072, 768, 4224]
    - [44, 106.15]
  - - [2432, 4736, 1, 2304, 2432, 2432, 2304, 4736]
    - [37, 111.67]
  - - [2176, 1664, 1, 2560, 2176, 2176, 2560, 1664]
    - [4, 88.48]
  - - [2176, 4736, 1, 4096, 2176, 2176, 4096, 4736]
    - [58, 109.79]
  - - [2176, 128, 1, 1152, 2176, 2176, 1152, 128]
    - [71, 19.35]
  - - [1408, 3712, 1, 3200, 1408, 1408, 3200, 3712]
    - [24, 83.86]
  - - [3072, 256, 1, 1280, 3072, 3072, 1280, 256]
    - [73, 38.7]
  - - [4224, 128, 1, 1280, 4224, 4224, 1280, 128]
    - [73, 27.26]
  - - [2816, 2432, 1, 4864, 2816, 2816, 4864, 2432]
    - [25, 101.97]
  - - [4608, 896, 1, 1792, 4608, 4608, 1792, 896]
    - [76, 81.38]
  - - [3968, 896, 1, 2560, 3968, 3968, 2560, 896]
    - [4, 86.69]
  - - [1920, 1408, 1, 3456, 1920, 1920, 3456, 1408]
    - [75, 82.47]
  - - [4096, 1152, 1, 1920, 4096, 4096, 1920, 1152]
    - [26, 96.08]
  - - [3840, 128, 1, 2304, 3840, 3840, 2304, 128]
    - [72, 44.55]
  - - [1024, 1920, 1, 4352, 1024, 1024, 4352, 1920]
    - [76, 80.41]
  - - [3200, 128, 1, 3328, 3200, 3200, 3328, 128]
    - [91, 45.36]
  - - [1792, 2176, 1, 3840, 1792, 1792, 3840, 2176]
    - [27, 85.16]
  - - [2560, 4608, 1, 3840, 2560, 2560, 3840, 4608]
    - [38, 113.2]
  - - [3328, 4864, 1, 512, 3328, 3328, 512, 4864]
    - [36, 99.98]
  - - [2304, 4864, 1, 2048, 2304, 2304, 2048, 4864]
    - [38, 107.78]
  - - [3200, 3584, 1, 3584, 3200, 3200, 3584, 3584]
    - [37, 111.81]
  - - [3712, 4736, 1, 3200, 3712, 3712, 3200, 4736]
    - [28, 101.5]
  - - [4480, 1152, 1, 1920, 4480, 4480, 1920, 1152]
    - [31, 84.0]
  - - [2432, 2432, 1, 2816, 2432, 2432, 2816, 2432]
    - [48, 94.18]
  - - [1024, 3968, 1, 2816, 1024, 1024, 2816, 3968]
    - [76, 85.59]
  - - [128, 4224, 1, 1664, 128, 128, 1664, 4224]
    - [10, 38.86]
  - - [3456, 1408, 1, 4224, 3456, 3456, 4224, 1408]
    - [56, 104.9]
  - - [2688, 1152, 1, 3200, 2688, 2688, 3200, 1152]
    - [84, 91.2]
  - - [3072, 2304, 1, 128, 3072, 3072, 128, 2304]
    - [78, 45.97]
  - - [1280, 4480, 1, 2944, 1280, 1280, 2944, 4480]
    - [24, 88.09]
  - - [4352, 4480, 1, 3328, 4352, 4352, 3328, 4480]
    - [39, 114.39]
  - - [1152, 1408, 1, 4352, 1152, 1152, 4352, 1408]
    - [56, 85.92]
  - - [1664, 1152, 1, 512, 1664, 1664, 512, 1152]
    - [77, 51.43]
  - - [2304, 2048, 1, 1920, 2304, 2304, 1920, 2048]
    - [58, 98.43]
  - - [1408, 384, 1, 4224, 1408, 1408, 4224, 384]
    - [27, 49.88]
  - - [4480, 128, 1, 2560, 4480, 4480, 2560, 128]
    - [73, 45.53]
  - - [4480, 1280, 1, 4992, 4480, 4480, 4992, 1280]
    - [24, 89.5]
  - - [2944, 3328, 1, 4480, 2944, 2944, 4480, 3328]
    - [32, 113.56]
  - - [3584, 2432, 1, 1920, 3584, 3584, 1920, 2432]
    - [29, 99.96]
  - - [2688, 3584, 1, 3584, 2688, 2688, 3584, 3584]
    - [32, 112.49]
  - - [128, 896, 1, 2432, 128, 128, 2432, 896]
    - [15, 17.04]
  - - [3712, 4096, 1, 3712, 3712, 3712, 3712, 4096]
    - [36, 126.5]
  - - [1024, 1152, 1, 2816, 1024, 1024, 2816, 1152]
    - [26, 69.98]
  - - [4480, 2304, 1, 2304, 4480, 4480, 2304, 2304]
    - [32, 115.15]
  - - [4096, 2944, 1, 128, 4096, 4096, 128, 2944]
    - [53, 54.43]
  - - [1280, 2816, 1, 4864, 1280, 1280, 4864, 2816]
    - [25, 97.18]
  - - [3328, 2816, 1, 3200, 3328, 3328, 3200, 2816]
    - [39, 113.23]
  - - [4736, 4736, 1, 2944, 4736, 4736, 2944, 4736]
    - [25, 108.78]
  - - [3072, 3072, 1, 1536, 3072, 3072, 1536, 3072]
    - [39, 107.21]
  - - [1024, 1920, 1, 128, 1024, 1024, 128, 1920]
    - [77, 25.53]
  - - [2560, 1408, 1, 2432, 2560, 2560, 2432, 1408]
    - [4, 87.81]
  - - [3456, 2944, 1, 3712, 3456, 3456, 3712, 2944]
    - [38, 104.04]
  - - [384, 2304, 1, 896, 384, 384, 896, 2304]
    - [71, 36.98]
  - - [768, 4480, 1, 1408, 768, 768, 1408, 4480]
    - [4, 81.67]
  - - [768, 3584, 1, 1152, 768, 768, 1152, 3584]
    - [87, 75.8]
  - - [4224, 4352, 1, 4736, 4224, 4224, 4736, 4352]
    - [28, 106.36]
  - - [256, 1920, 1, 4736, 256, 256, 4736, 1920]
    - [10, 60.35]
  - - [3200, 2176, 1, 1536, 3200, 3200, 1536, 2176]
    - [25, 98.38]
  - - [2944, 4992, 1, 4352, 2944, 2944, 4352, 4992]
    - [43, 125.16]
  - - [896, 896, 1, 2304, 896, 896, 2304, 896]
    - [75, 56.5]
  - - [896, 896, 1, 1664, 896, 896, 1664, 896]
    - [77, 45.11]
  - - [128, 128, 1, 1536, 128, 128, 1536, 128]
    - [11, 2.46]
  - - [2816, 3072, 1, 3840, 2816, 2816, 3840, 3072]
    - [30, 104.96]
  - - [3200, 1024, 1, 2688, 3200, 3200, 2688, 1024]
    - [40, 90.74]
  - - [4608, 1408, 1, 3200, 4608, 4608, 3200, 1408]
    - [25, 96.2]
  - - [4224, 1536, 1, 4352, 4224, 4224, 4352, 1536]
    - [38, 106.28]
  - - [4352, 128, 1, 3840, 4352, 4352, 3840, 128]
    - [73, 52.21]
  - - [1792, 3328, 1, 128, 1792, 1792, 128, 3328]
    - [48, 45.33]
  - - [4096, 4480, 1, 4224, 4096, 4096, 4224, 4480]
    - [40, 113.16]
  - - [4480, 384, 1, 2816, 4480, 4480, 2816, 384]
    - [27, 68.67]
  - - [384, 4864, 1, 4352, 384, 384, 4352, 4864]
    - [76, 75.98]
  - - [896, 2816, 1, 1792, 896, 896, 1792, 2816]
    - [26, 80.25]
  - - [4352, 1920, 1, 384, 4352, 4352, 384, 1920]
    - [93, 81.09]
  - - [4480, 2560, 1, 256, 4480, 4480, 256, 2560]
    - [46, 63.84]
  - - [3712, 2944, 1, 128, 3712, 3712, 128, 2944]
    - [53, 42.62]
  - - [2816, 1024, 1, 2048, 2816, 2816, 2048, 1024]
    - [84, 83.72]
  - - [3968, 2304, 1, 2560, 3968, 3968, 2560, 2304]
    - [28, 101.31]
  - - [2944, 1664, 1, 4352, 2944, 2944, 4352, 1664]
    - [56, 104.91]
  - - [1536, 3200, 1, 4992, 1536, 1536, 4992, 3200]
    - [26, 106.48]
  - - [256, 3712, 1, 1024, 256, 256, 1024, 3712]
    - [71, 42.3]
  - - [4608, 2816, 1, 3840, 4608, 4608, 3840, 2816]
    - [38, 116.97]
  - - [1664, 1024, 1, 1792, 1664, 1664, 1792, 1024]
    - [27, 60.97]
  - - [768, 512, 1, 2432, 768, 768, 2432, 512]
    - [91, 38.45]
  - - [3200, 512, 1, 896, 3200, 3200, 896, 512]
    - [77, 51.55]
  - - [3584, 4608, 1, 2944, 3584, 3584, 2944, 4608]
    - [78, 103.25]
  - - [2816, 4352, 1, 4352, 2816, 2816, 4352, 4352]
    - [44, 117.82]
  - - [1152, 4096, 1, 4224, 1152, 1152, 4224, 4096]
    - [58, 103.19]
  - - [3200, 2816, 1, 2176, 3200, 3200, 2176, 2816]
    - [30, 103.53]
  - - [1536, 2688, 1, 896, 1536, 1536, 896, 2688]
    - [76, 80.14]
  - - [4992, 3968, 1, 128, 4992, 4992, 128, 3968]
    - [49, 54.04]
  - - [3584, 4224, 1, 896, 3584, 3584, 896, 4224]
    - [36, 110.78]
  - - [640, 256, 1, 3968, 640, 640, 3968, 256]
    - [10, 28.0]
  - - [3584, 4096, 1, 4864, 3584, 3584, 4864, 4096]
    - [38, 130.53]
  - - [2304, 512, 1, 3072, 2304, 2304, 3072, 512]
    - [76, 65.09]
  - - [4224, 128, 1, 4096, 4224, 4224, 4096, 128]
    - [73, 52.94]
  - - [640, 1536, 1, 1280, 640, 640, 1280, 1536]
    - [77, 47.73]
  - - [384, 1920, 1, 896, 384, 384, 896, 1920]
    - [97, 33.21]
  - - [4352, 2688, 1, 2560, 4352, 4352, 2560, 2688]
    - [38, 107.43]
  - - [2560, 2944, 1, 640, 2560, 2560, 640, 2944]
    - [33, 94.91]
  - - [4992, 2688, 1, 640, 4992, 4992, 640, 2688]
    - [44, 103.41]
  - - [2176, 2944, 1, 2944, 2176, 2176, 2944, 2944]
    - [25, 95.97]
  - - [4736, 1280, 1, 2432, 4736, 4736, 2432, 1280]
    - [24, 90.59]
  - - [128, 3072, 1, 2688, 128, 128, 2688, 3072]
    - [10, 43.79]
  - - [3968, 1664, 1, 1536, 3968, 3968, 1536, 1664]
    - [25, 91.37]
  - - [3968, 1920, 1, 3456, 3968, 3968, 3456, 1920]
    - [25, 108.28]
  - - [5120, 2432, 1, 1152, 5120, 5120, 1152, 2432]
    - [37, 109.26]
  - - [3072, 4864, 1, 1152, 3072, 3072, 1152, 4864]
    - [42, 118.23]
  - - [2816, 4736, 1, 3712, 2816, 2816, 3712, 4736]
    - [44, 119.7]
  - - [2944, 4224, 1, 768, 2944, 2944, 768, 4224]
    - [44, 103.67]
  - - [3328, 2048, 1, 4608, 3328, 3328, 4608, 2048]
    - [25, 100.46]
  - - [4096, 2816, 1, 4992, 4096, 4096, 4992, 2816]
    - [38, 111.67]
  - - [4608, 512, 1, 1664, 4608, 4608, 1664, 512]
    - [87, 70.99]
  - - [2944, 2688, 1, 3072, 2944, 2944, 3072, 2688]
    - [85, 100.51]
  - - [4608, 2048, 1, 640, 4608, 4608, 640, 2048]
    - [39, 98.49]
  - - [2816, 2048, 1, 4096, 2816, 2816, 4096, 2048]
    - [24, 89.6]
  - - [4352, 384, 1, 2048, 4352, 4352, 2048, 384]
    - [76, 62.03]
  - - [1152, 4992, 1, 128, 1152, 1152, 128, 4992]
    - [48, 44.86]
  - - [768, 1536, 1, 1536, 768, 768, 1536, 1536]
    - [10, 58.67]
  - - [3840, 4096, 1, 4480, 3840, 3840, 4480, 4096]
    - [36, 127.22]
  - - [3712, 4352, 1, 1152, 3712, 3712, 1152, 4352]
    - [36, 118.89]
  - - [2176, 2048, 1, 4096, 2176, 2176, 4096, 2048]
    - [5, 99.41]
  - - [1536, 2816, 1, 512, 1536, 1536, 512, 2816]
    - [56, 78.33]
  - - [384, 4096, 1, 1280, 384, 384, 1280, 4096]
    - [73, 60.3]
  - - [3456, 1024, 1, 4352, 3456, 3456, 4352, 1024]
    - [37, 98.59]
  - - [768, 3584, 1, 3072, 768, 768, 3072, 3584]
    - [87, 83.34]
  - - [3200, 512, 1, 2048, 3200, 3200, 2048, 512]
    - [27, 61.5]
  - - [4480, 3200, 1, 256, 4480, 4480, 256, 3200]
    - [43, 76.79]
  - - [2944, 2176, 1, 4096, 2944, 2944, 4096, 2176]
    - [25, 99.52]
  - - [3840, 2944, 1, 256, 3840, 3840, 256, 2944]
    - [46, 74.04]
  - - [2560, 2560, 1, 3200, 2560, 2560, 3200, 2560]
    - [25, 100.64]
  - - [2944, 768, 1, 1152, 2944, 2944, 1152, 768]
    - [5, 63.71]
  - - [2944, 1280, 1, 3072, 2944, 2944, 3072, 1280]
    - [76, 81.28]
  - - [2304, 2432, 1, 4480, 2304, 2304, 4480, 2432]
    - [24, 88.47]
  - - [4096, 4736, 1, 2816, 4096, 4096, 2816, 4736]
    - [39, 113.83]
  - - [4608, 3968, 1, 1408, 4608, 4608, 1408, 3968]
    - [30, 102.35]
  - - [4864, 3200, 1, 3328, 4864, 4864, 3328, 3200]
    - [36, 124.89]
  - - [1920, 4736, 1, 3200, 1920, 1920, 3200, 4736]
    - [32, 110.99]
  - - [3968, 1664, 1, 2816, 3968, 3968, 2816, 1664]
    - [25, 96.52]
  - - [768, 2304, 1, 4480, 768, 768, 4480, 2304]
    - [27, 75.38]
  - - [3328, 2688, 1, 1920, 3328, 3328, 1920, 2688]
    - [32, 102.72]
  - - [512, 2432, 1, 768, 512, 512, 768, 2432]
    - [10, 49.25]
  - - [2688, 2048, 1, 4480, 2688, 2688, 4480, 2048]
    - [24, 88.71]
  - - [1408, 2944, 1, 1408, 1408, 1408, 1408, 2944]
    - [76, 84.56]
  - - [768, 1024, 1, 3840, 768, 768, 3840, 1024]
    - [73, 67.14]
  - - [640, 1536, 1, 384, 640, 640, 384, 1536]
    - [71, 29.7]
  - - [2688, 1664, 1, 1664, 2688, 2688, 1664, 1664]
    - [5, 94.67]
  - - [3072, 4096, 1, 1792, 3072, 3072, 1792, 4096]
    - [37, 114.32]
  - - [4608, 3584, 1, 2048, 4608, 4608, 2048, 3584]
    - [93, 103.63]
  - - [3840, 2048, 1, 2048, 3840, 3840, 2048, 2048]
    - [92, 101.23]
  - - [3200, 640, 1, 3072, 3200, 3200, 3072, 640]
    - [76, 74.23]
  - - [2688, 4864, 1, 3456, 2688, 2688, 3456, 4864]
    - [38, 122.57]
  - - [1536, 3584, 1, 1280, 1536, 1536, 1280, 3584]
    - [24, 83.71]
  - - [128, 1024, 1, 896, 128, 128, 896, 1024]
    - [14, 10.24]
  - - [3584, 1024, 1, 1024, 3584, 3584, 1024, 1024]
    - [76, 74.28]
  - - [2816, 1280, 1, 1408, 2816, 2816, 1408, 1280]
    - [4, 82.63]
  - - [4864, 2688, 1, 1024, 4864, 4864, 1024, 2688]
    - [44, 110.61]
  - - [896, 1920, 1, 3584, 896, 896, 3584, 1920]
    - [58, 86.03]
  - - [4352, 512, 1, 768, 4352, 4352, 768, 512]
    - [84, 61.78]
  - - [1280, 3328, 1, 1536, 1280, 1280, 1536, 3328]
    - [5, 90.24]
  - - [4864, 3072, 1, 4864, 4864, 4864, 4864, 3072]
    - [36, 122.5]
  - - [1536, 2560, 1, 4736, 1536, 1536, 4736, 2560]
    - [25, 102.34]
  - - [4736, 3712, 1, 3840, 4736, 4736, 3840, 3712]
    - [28, 102.15]
  - - [2944, 2432, 1, 4864, 2944, 2944, 4864, 2432]
    - [25, 104.67]
  - - [3328, 1792, 1, 2688, 3328, 3328, 2688, 1792]
    - [24, 89.25]
  - - [3584, 2176, 1, 2048, 3584, 3584, 2048, 2176]
    - [85, 97.99]
  - - [640, 512, 1, 2432, 640, 640, 2432, 512]
    - [10, 35.92]
  - - [3584, 2432, 1, 3072, 3584, 3584, 3072, 2432]
    - [29, 103.39]
  - - [512, 1792, 1, 4992, 512, 512, 4992, 1792]
    - [76, 67.98]
  - - [4608, 4480, 1, 2560, 4608, 4608, 2560, 4480]
    - [52, 118.78]
  - - [3968, 2048, 1, 3072, 3968, 3968, 3072, 2048]
    - [78, 100.85]
  - - [3840, 2176, 1, 3200, 3840, 3840, 3200, 2176]
    - [93, 103.96]
  - - [2816, 2304, 1, 4736, 2816, 2816, 4736, 2304]
    - [25, 99.2]
  - - [4224, 4736, 1, 2944, 4224, 4224, 2944, 4736]
    - [52, 115.4]
  - - [2048, 1536, 1, 2048, 2048, 2048, 2048, 1536]
    - [84, 89.38]
  - - [2048, 3200, 1, 384, 2048, 2048, 384, 3200]
    - [92, 67.44]
  - - [4992, 3584, 1, 640, 4992, 4992, 640, 3584]
    - [40, 99.26]
  - - [1152, 4096, 1, 4096, 1152, 1152, 4096, 4096]
    - [58, 103.13]
  - - [1536, 2688, 1, 3968, 1536, 1536, 3968, 2688]
    - [27, 88.1]
  - - [3072, 3200, 1, 1536, 3072, 3072, 1536, 3200]
    - [52, 111.99]
  - - [2304, 896, 1, 896, 2304, 2304, 896, 896]
    - [77, 60.38]
  - - [1024, 384, 1, 2560, 1024, 1024, 2560, 384]
    - [10, 44.12]
  - - [3968, 3968, 1, 2560, 3968, 3968, 2560, 3968]
    - [78, 98.03]
  - - [384, 4736, 1, 2688, 384, 384, 2688, 4736]
    - [76, 70.47]
  - - [3712, 128, 1, 1664, 3712, 3712, 1664, 128]
    - [64, 35.28]
  - - [256, 4480, 1, 4224, 256, 256, 4224, 4480]
    - [26, 74.32]
  - - [1024, 4736, 1, 640, 1024, 1024, 640, 4736]
    - [26, 87.03]
  - - [4480, 2048, 1, 896, 4480, 4480, 896, 2048]
    - [39, 105.07]
  - - [128, 2816, 1, 2688, 128, 128, 2688, 2816]
    - [10, 41.34]
  - - [2688, 4864, 1, 4608, 2688, 2688, 4608, 4864]
    - [38, 123.71]
  - - [2048, 3968, 1, 4224, 2048, 2048, 4224, 3968]
    - [85, 103.3]
  - - [768, 1152, 1, 4608, 768, 768, 4608, 1152]
    - [5, 72.7]
  - - [512, 1792, 1, 1152, 512, 512, 1152, 1792]
    - [72, 43.65]
  - - [256, 4736, 1, 3328, 256, 256, 3328, 4736]
    - [58, 73.81]
  - - [3456, 1536, 1, 1664, 3456, 3456, 1664, 1536]
    - [24, 82.84]
  - - [2816, 1152, 1, 1024, 2816, 2816, 1024, 1152]
    - [4, 78.57]
  - - [4608, 4736, 1, 3328, 4608, 4608, 3328, 4736]
    - [25, 109.93]
  - - [4352, 1152, 1, 1792, 4352, 4352, 1792, 1152]
    - [31, 81.83]
  - - [2304, 768, 1, 4608, 2304, 2304, 4608, 768]
    - [27, 76.03]
  - - [1792, 4480, 1, 2560, 1792, 1792, 2560, 4480]
    - [93, 102.72]
  - - [2944, 4480, 1, 1024, 2944, 2944, 1024, 4480]
    - [37, 108.67]
  - - [1536, 1664, 1, 2176, 1536, 1536, 2176, 1664]
    - [84, 78.42]
  - - [256, 3840, 1, 4992, 256, 256, 4992, 3840]
    - [76, 68.91]
  - - [2560, 4352, 1, 4224, 2560, 2560, 4224, 4352]
    - [44, 110.51]
  - - [1408, 4224, 1, 2560, 1408, 1408, 2560, 4224]
    - [24, 89.84]
  - - [2560, 640, 1, 4352, 2560, 2560, 4352, 640]
    - [26, 86.76]
  - - [2048, 1024, 1, 2432, 2048, 2048, 2432, 1024]
    - [76, 75.97]
  - - [3968, 1024, 1, 640, 3968, 3968, 640, 1024]
    - [76, 72.51]
  - - [3840, 3072, 1, 1408, 3840, 3840, 1408, 3072]
    - [38, 108.12]
  - - [4864, 384, 1, 2944, 4864, 4864, 2944, 384]
    - [76, 69.57]
  - - [1664, 1408, 1, 256, 1664, 1664, 256, 1408]
    - [75, 42.33]
  - - [4992, 2560, 1, 2560, 4992, 4992, 2560, 2560]
    - [38, 115.18]
  - - [2304, 1920, 1, 2560, 2304, 2304, 2560, 1920]
    - [5, 98.64]
  - - [2304, 1408, 1, 3328, 2304, 2304, 3328, 1408]
    - [52, 91.29]
  - - [2432, 128, 1, 2048, 2432, 2432, 2048, 128]
    - [16, 25.34]
  - - [2816, 3968, 1, 384, 2816, 2816, 384, 3968]
    - [53, 84.29]
  - - [640, 2304, 1, 2688, 640, 640, 2688, 2304]
    - [10, 73.36]
  - - [4480, 2048, 1, 1536, 4480, 4480, 1536, 2048]
    - [40, 107.31]
  - - [3584, 3072, 1, 2816, 3584, 3584, 2816, 3072]
    - [37, 111.71]
  - - [4480, 2688, 1, 3968, 4480, 4480, 3968, 2688]
    - [38, 114.42]
  - - [2304, 4096, 1, 1920, 2304, 2304, 1920, 4096]
    - [29, 106.26]
  - - [256, 4480, 1, 640, 256, 256, 640, 4480]
    - [10, 42.56]
  - - [512, 1152, 1, 2816, 512, 512, 2816, 1152]
    - [10, 53.71]
  - - [896, 4480, 1, 2304, 896, 896, 2304, 4480]
    - [27, 83.59]
  - - [2304, 3200, 1, 2816, 2304, 2304, 2816, 3200]
    - [25, 108.55]
  - - [384, 256, 1, 128, 384, 384, 128, 256]
    - [7, 2.32]
  - - [1664, 4224, 1, 3840, 1664, 1664, 3840, 4224]
    - [25, 104.75]
  - - [3968, 4608, 1, 1536, 3968, 3968, 1536, 4608]
    - [28, 100.13]
  - - [1408, 2688, 1, 3712, 1408, 1408, 3712, 2688]
    - [4, 94.88]
  - - [384, 2176, 1, 2432, 384, 384, 2432, 2176]
    - [27, 51.83]
  - - [2176, 3328, 1, 3456, 2176, 2176, 3456, 3328]
    - [25, 105.88]
  - - [3968, 2560, 1, 1920, 3968, 3968, 1920, 2560]
    - [39, 115.39]
  - - [768, 4224, 1, 3712, 768, 768, 3712, 4224]
    - [32, 90.26]
  - - [1536, 2432, 1, 3968, 1536, 1536, 3968, 2432]
    - [27, 84.38]
  - - [2688, 2560, 1, 640, 2688, 2688, 640, 2560]
    - [25, 93.83]
  - - [2816, 896, 1, 3072, 2816, 2816, 3072, 896]
    - [31, 77.45]
  - - [3456, 128, 1, 4480, 3456, 3456, 4480, 128]
    - [73, 51.08]
  - - [384, 3968, 1, 4224, 384, 384, 4224, 3968]
    - [5, 82.28]
  - - [1024, 128, 1, 1920, 1024, 1024, 1920, 128]
    - [15, 15.52]
  - - [3840, 1792, 1, 3584, 3840, 3840, 3584, 1792]
    - [25, 102.91]
  - - [2048, 640, 1, 512, 2048, 2048, 512, 640]
    - [10, 40.26]
  - - [3072, 2432, 1, 4608, 3072, 3072, 4608, 2432]
    - [25, 108.55]
  - - [1280, 4224, 1, 3840, 1280, 1280, 3840, 4224]
    - [24, 85.54]
  - - [4992, 3456, 1, 3584, 4992, 4992, 3584, 3456]
    - [29, 103.07]
  - - [3328, 2304, 1, 1664, 3328, 3328, 1664, 2304]
    - [33, 102.98]
  - - [896, 2688, 1, 2048, 896, 896, 2048, 2688]
    - [56, 81.63]
  - - [1664, 640, 1, 1408, 1664, 1664, 1408, 640]
    - [10, 49.61]
  - - [1536, 512, 1, 3328, 1536, 1536, 3328, 512]
    - [73, 63.59]
  - - [4736, 896, 1, 256, 4736, 4736, 256, 896]
    - [5, 54.63]
  - - [768, 3328, 1, 3200, 768, 768, 3200, 3328]
    - [56, 92.47]
  - - [1280, 2944, 1, 256, 1280, 1280, 256, 2944]
    - [27, 49.41]
  - - [4736, 4480, 1, 640, 4736, 4736, 640, 4480]
    - [25, 93.93]
  - - [2688, 1536, 1, 2816, 2688, 2688, 2816, 1536]
    - [27, 87.38]
  - - [512, 1152, 1, 3968, 512, 512, 3968, 1152]
    - [76, 53.9]
  - - [4736, 1152, 1, 4096, 4736, 4736, 4096, 1152]
    - [24, 83.3]
  - - [3456, 3584, 1, 1280, 3456, 3456, 1280, 3584]
    - [44, 111.16]
  - - [3968, 1920, 1, 256, 3968, 3968, 256, 1920]
    - [93, 58.02]
  - - [2176, 2304, 1, 4736, 2176, 2176, 4736, 2304]
    - [32, 105.93]
  - - [3584, 1152, 1, 1152, 3584, 3584, 1152, 1152]
    - [76, 78.78]
  - - [2304, 4480, 1, 4736, 2304, 2304, 4736, 4480]
    - [49, 119.86]
  - - [256, 768, 1, 2944, 256, 256, 2944, 768]
    - [16, 25.61]
  - - [4736, 2944, 1, 2944, 4736, 4736, 2944, 2944]
    - [43, 119.01]
  - - [1536, 2560, 1, 4608, 1536, 1536, 4608, 2560]
    - [25, 104.56]
  - - [2560, 1664, 1, 4224, 2560, 2560, 4224, 1664]
    - [5, 96.28]
  - - [4608, 2688, 1, 640, 4608, 4608, 640, 2688]
    - [38, 96.49]
  - - [1152, 4992, 1, 4736, 1152, 1152, 4736, 4992]
    - [24, 90.69]
  - - [896, 256, 1, 640, 896, 896, 640, 256]
    - [89, 11.76]
  - - [1280, 4736, 1, 4608, 1280, 1280, 4608, 4736]
    - [48, 96.95]
  - - [2048, 3584, 1, 1152, 2048, 2048, 1152, 3584]
    - [33, 98.85]
  - - [4864, 3584, 1, 4608, 4864, 4864, 4608, 3584]
    - [29, 105.93]
  - - [3328, 3072, 1, 2048, 3328, 3328, 2048, 3072]
    - [32, 112.52]
  - - [4608, 3328, 1, 4224, 4608, 4608, 4224, 3328]
    - [36, 123.33]
  - - [3712, 1024, 1, 1664, 3712, 3712, 1664, 1024]
    - [76, 77.96]
  - - [2816, 2816, 1, 1408, 2816, 2816, 1408, 2816]
    - [85, 98.31]
  - - [3072, 4096, 1, 1408, 3072, 3072, 1408, 4096]
    - [37, 115.07]
  - - [4096, 1024, 1, 1792, 4096, 4096, 1792, 1024]
    - [27, 86.95]
  - - [1664, 4864, 1, 1792, 1664, 1664, 1792, 4864]
    - [86, 101.6]
  - - [1152, 4096, 1, 4608, 1152, 1152, 4608, 4096]
    - [58, 103.66]
  - - [3328, 1280, 1, 1280, 3328, 3328, 1280, 1280]
    - [5, 86.41]
  - - [384, 4480, 1, 4608, 384, 384, 4608, 4480]
    - [56, 89.31]
  - - [4224, 4096, 1, 256, 4224, 4224, 256, 4096]
    - [50, 71.32]
  - - [2560, 4480, 1, 4608, 2560, 2560, 4608, 4480]
    - [44, 111.7]
  - - [4352, 4480, 1, 4608, 4352, 4352, 4608, 4480]
    - [39, 115.73]
  - - [1408, 3072, 1, 3712, 1408, 1408, 3712, 3072]
    - [5, 98.84]
  - - [896, 4096, 1, 128, 896, 896, 128, 4096]
    - [76, 33.43]
  - - [2304, 256, 1, 3200, 2304, 2304, 3200, 256]
    - [73, 53.51]
  - - [3712, 2432, 1, 3200, 3712, 3712, 3200, 2432]
    - [40, 108.13]
  - - [128, 4608, 1, 4224, 128, 128, 4224, 4608]
    - [2, 51.65]
  - - [4352, 3456, 1, 3840, 4352, 4352, 3840, 3456]
    - [43, 125.07]
  - - [3072, 768, 1, 4736, 3072, 3072, 4736, 768]
    - [5, 93.8]
  - - [768, 3712, 1, 1664, 768, 768, 1664, 3712]
    - [87, 81.18]
  - - [1280, 4992, 1, 4480, 1280, 1280, 4480, 4992]
    - [25, 99.8]
  - - [2176, 128, 1, 3712, 2176, 2176, 3712, 128]
    - [91, 38.16]
  - - [2304, 2560, 1, 3072, 2304, 2304, 3072, 2560]
    - [24, 90.51]
  - - [4096, 4736, 1, 1536, 4096, 4096, 1536, 4736]
    - [39, 110.13]
  - - [4096, 4224, 1, 3840, 4096, 4096, 3840, 4224]
    - [28, 100.47]
  - - [4352, 3712, 1, 3328, 4352, 4352, 3328, 3712]
    - [36, 127.36]
  - - [1408, 3456, 1, 3584, 1408, 1408, 3584, 3456]
    - [56, 103.82]
  - - [3968, 1152, 1, 3712, 3968, 3968, 3712, 1152]
    - [5, 100.63]
  - - [3840, 512, 1, 3712, 3840, 3840, 3712, 512]
    - [76, 74.14]
  - - [128, 4608, 1, 512, 128, 128, 512, 4608]
    - [66, 22.33]
  - - [1024, 128, 1, 3200, 1024, 1024, 3200, 128]
    - [18, 20.56]
  - - [768, 256, 1, 4096, 768, 768, 4096, 256]
    - [18, 29.99]
  - - [2944, 4608, 1, 2560, 2944, 2944, 2560, 4608]
    - [38, 120.39]
  - - [2176, 2560, 1, 3200, 2176, 2176, 3200, 2560]
    - [24, 88.05]
  - - [2048, 4480, 1, 2816, 2048, 2048, 2816, 4480]
    - [39, 110.43]
  - - [2816, 2048, 1, 3456, 2816, 2816, 3456, 2048]
    - [24, 89.3]
  - - [1280, 1280, 1, 2944, 1280, 1280, 2944, 1280]
    - [56, 80.63]
  - - [4992, 4480, 1, 3328, 4992, 4992, 3328, 4480]
    - [25, 110.6]
  - - [2304, 2176, 1, 4992, 2304, 2304, 4992, 2176]
    - [56, 107.47]
  - - [3712, 2176, 1, 1792, 3712, 3712, 1792, 2176]
    - [93, 100.52]
  - - [2176, 1920, 1, 2560, 2176, 2176, 2560, 1920]
    - [27, 87.21]
  - - [512, 1792, 1, 1280, 512, 512, 1280, 1792]
    - [72, 45.75]
  - - [4096, 2688, 1, 384, 4096, 4096, 384, 2688]
    - [46, 84.19]
  - - [1152, 4224, 1, 5120, 1152, 1152, 5120, 4224]
    - [26, 104.39]
  - - [1920, 896, 1, 2176, 1920, 1920, 2176, 896]
    - [27, 65.22]
  - - [896, 2688, 1, 3712, 896, 896, 3712, 2688]
    - [56, 91.29]
  - - [256, 3200, 1, 3968, 256, 256, 3968, 3200]
    - [76, 61.93]
  - - [1536, 3712, 1, 3968, 1536, 1536, 3968, 3712]
    - [24, 89.97]
  - - [1920, 2304, 1, 3712, 1920, 1920, 3712, 2304]
    - [5, 101.4]
  - - [2176, 3200, 1, 4224, 2176, 2176, 4224, 3200]
    - [25, 105.91]
  - - [3456, 896, 1, 384, 3456, 3456, 384, 896]
    - [73, 59.17]
  - - [3584, 1792, 1, 3712, 3584, 3584, 3712, 1792]
    - [37, 106.83]
  - - [3328, 384, 1, 3328, 3328, 3328, 3328, 384]
    - [27, 67.96]
  - - [3328, 3200, 1, 2048, 3328, 3328, 2048, 3200]
    - [37, 105.5]
  - - [3456, 1664, 1, 1920, 3456, 3456, 1920, 1664]
    - [24, 86.24]
  - - [3712, 3456, 1, 1024, 3712, 3712, 1024, 3456]
    - [37, 108.86]
  - - [2688, 2560, 1, 4352, 2688, 2688, 4352, 2560]
    - [25, 105.47]
  - - [512, 2304, 1, 1792, 512, 512, 1792, 2304]
    - [10, 61.13]
  - - [1536, 1920, 1, 3840, 1536, 1536, 3840, 1920]
    - [75, 88.99]
  - - [2560, 3200, 1, 1920, 2560, 2560, 1920, 3200]
    - [93, 102.97]
  - - [2304, 2816, 1, 2432, 2304, 2304, 2432, 2816]
    - [25, 99.03]
  - - [1408, 256, 1, 3968, 1408, 1408, 3968, 256]
    - [73, 41.38]
  - - [2816, 2688, 1, 3840, 2816, 2816, 3840, 2688]
    - [33, 105.24]
  - - [2048, 3072, 1, 2432, 2048, 2048, 2432, 3072]
    - [95, 98.92]
  - - [2688, 4352, 1, 384, 2688, 2688, 384, 4352]
    - [53, 77.78]
  - - [3712, 2944, 1, 1024, 3712, 3712, 1024, 2944]
    - [38, 98.79]
  - - [2944, 4736, 1, 256, 2944, 2944, 256, 4736]
    - [43, 73.8]
  - - [3072, 3328, 1, 1280, 3072, 3072, 1280, 3328]
    - [52, 112.46]
  - - [1792, 2432, 1, 3712, 1792, 1792, 3712, 2432]
    - [5, 98.42]
  - - [2816, 2688, 1, 3968, 2816, 2816, 3968, 2688]
    - [33, 105.4]
  - - [4736, 256, 1, 1664, 4736, 4736, 1664, 256]
    - [10, 55.46]
  - - [3328, 1024, 1, 3584, 3328, 3328, 3584, 1024]
    - [40, 95.41]
  - - [1920, 3584, 1, 3200, 1920, 1920, 3200, 3584]
    - [25, 103.61]
  - - [1152, 2688, 1, 1536, 1152, 1152, 1536, 2688]
    - [84, 85.12]
  - - [2048, 3200, 1, 2688, 2048, 2048, 2688, 3200]
    - [25, 99.47]
  - - [3456, 3840, 1, 2176, 3456, 3456, 2176, 3840]
    - [38, 117.94]
  - - [640, 1920, 1, 2432, 640, 640, 2432, 1920]
    - [10, 66.76]
  - - [3712, 896, 1, 2816, 3712, 3712, 2816, 896]
    - [4, 83.7]
  - - [1152, 1408, 1, 1408, 1152, 1152, 1408, 1408]
    - [76, 54.17]
  - - [1792, 4736, 1, 4224, 1792, 1792, 4224, 4736]
    - [30, 102.18]
  - - [4608, 1536, 1, 4608, 4608, 4608, 4608, 1536]
    - [25, 104.14]
  - - [4864, 2048, 1, 768, 4864, 4864, 768, 2048]
    - [40, 105.28]
  - - [4864, 2304, 1, 3456, 4864, 4864, 3456, 2304]
    - [38, 108.74]
  - - [1280, 768, 1, 896, 1280, 1280, 896, 768]
    - [71, 38.75]
  - - [1536, 3456, 1, 4992, 1536, 1536, 4992, 3456]
    - [24, 87.31]
  - - [3584, 2304, 1, 896, 3584, 3584, 896, 2304]
    - [85, 96.15]
  - - [3712, 1792, 1, 1536, 3712, 3712, 1536, 1792]
    - [25, 95.14]
  - - [3968, 4992, 1, 1792, 3968, 3968, 1792, 4992]
    - [39, 115.11]
  - - [1920, 2432, 1, 256, 1920, 1920, 256, 2432]
    - [56, 60.97]
  - - [2432, 3328, 1, 3584, 2432, 2432, 3584, 3328]
    - [78, 105.37]
  - - [4864, 4992, 1, 3712, 4864, 4864, 3712, 4992]
    - [44, 117.76]
  - - [3456, 3840, 1, 2432, 3456, 3456, 2432, 3840]
    - [38, 118.33]
  - - [3456, 768, 1, 2432, 3456, 3456, 2432, 768]
    - [75, 79.07]
  - - [768, 512, 1, 4736, 768, 768, 4736, 512]
    - [73, 49.72]
  - - [1792, 4352, 1, 2048, 1792, 1792, 2048, 4352]
    - [93, 100.58]
  - - [3072, 640, 1, 4608, 3072, 3072, 4608, 640]
    - [27, 80.38]
  - - [1792, 3328, 1, 1280, 1792, 1792, 1280, 3328]
    - [24, 86.75]
  - - [2560, 4992, 1, 4608, 2560, 2560, 4608, 4992]
    - [44, 119.57]
  - - [4992, 1152, 1, 2176, 4992, 4992, 2176, 1152]
    - [95, 94.81]
  - - [640, 640, 1, 4096, 640, 640, 4096, 640]
    - [77, 52.13]
  - - [2560, 1024, 1, 4736, 2560, 2560, 4736, 1024]
    - [40, 97.38]
  - - [3840, 4608, 1, 2688, 3840, 3840, 2688, 4608]
    - [28, 101.67]
  - - [1536, 2688, 1, 2176, 1536, 1536, 2176, 2688]
    - [76, 85.17]
  - - [512, 2048, 1, 2048, 512, 512, 2048, 2048]
    - [27, 56.07]
  - - [4992, 512, 1, 896, 4992, 4992, 896, 512]
    - [75, 65.23]
  - - [4096, 4864, 1, 1792, 4096, 4096, 1792, 4864]
    - [39, 116.39]
  - - [384, 2048, 1, 640, 384, 384, 640, 2048]
    - [66, 32.56]
  - - [3584, 2432, 1, 2560, 3584, 3584, 2560, 2432]
    - [30, 101.85]
  - - [4736, 4480, 1, 3840, 4736, 4736, 3840, 4480]
    - [25, 108.97]
  - - [1408, 640, 1, 3328, 1408, 1408, 3328, 640]
    - [27, 60.97]
  - - [3968, 4992, 1, 1920, 3968, 3968, 1920, 4992]
    - [39, 115.48]
  - - [3840, 1792, 1, 1792, 3840, 3840, 1792, 1792]
    - [25, 100.07]
  - - [3968, 1408, 1, 4608, 3968, 3968, 4608, 1408]
    - [24, 85.45]
  - - [3840, 4864, 1, 1280, 3840, 3840, 1280, 4864]
    - [40, 109.37]
  - - [4096, 2176, 1, 1536, 4096, 4096, 1536, 2176]
    - [32, 99.74]
  - - [2688, 4608, 1, 4480, 2688, 2688, 4480, 4608]
    - [44, 120.3]
  - - [512, 3456, 1, 3712, 512, 512, 3712, 3456]
    - [76, 73.78]
  - - [256, 1024, 1, 4224, 256, 256, 4224, 1024]
    - [10, 44.7]
  - - [128, 2560, 1, 128, 128, 128, 128, 2560]
    - [70, 6.0]
  - - [3072, 768, 1, 3584, 3072, 3072, 3584, 768]
    - [5, 90.66]
  - - [1536, 1664, 1, 2944, 1536, 1536, 2944, 1664]
    - [84, 79.94]
  - - [512, 256, 1, 4480, 512, 512, 4480, 256]
    - [18, 26.77]
  - - [2176, 1280, 1, 384, 2176, 2176, 384, 1280]
    - [75, 57.52]
  - - [2688, 256, 1, 3456, 2688, 2688, 3456, 256]
    - [76, 56.49]
  - - [4992, 1408, 1, 1664, 4992, 4992, 1664, 1408]
    - [33, 93.62]
  - - [1664, 1152, 1, 3072, 1664, 1664, 3072, 1152]
    - [76, 75.58]
  - - [1792, 2432, 1, 3968, 1792, 1792, 3968, 2432]
    - [5, 98.58]
  - - [128, 4736, 1, 1664, 128, 128, 1664, 4736]
    - [10, 42.89]
  - - [3072, 1792, 1, 2176, 3072, 3072, 2176, 1792]
    - [24, 86.43]
  - - [2816, 3328, 1, 1152, 2816, 2816, 1152, 3328]
    - [39, 105.67]
  - - [1152, 384, 1, 1536, 1152, 1152, 1536, 384]
    - [18, 30.21]
  - - [4608, 2432, 1, 2048, 4608, 4608, 2048, 2432]
    - [38, 103.48]
  - - [2432, 3328, 1, 1408, 2432, 2432, 1408, 3328]
    - [78, 100.44]
  - - [3328, 4736, 1, 128, 3328, 3328, 128, 4736]
    - [36, 50.36]
  - - [3072, 1152, 1, 3456, 3072, 3072, 3456, 1152]
    - [4, 90.33]
  - - [2176, 768, 1, 1536, 2176, 2176, 1536, 768]
    - [76, 57.04]
  - - [1280, 1920, 1, 2432, 1280, 1280, 2432, 1920]
    - [26, 86.6]
  - - [4352, 2688, 1, 2304, 4352, 4352, 2304, 2688]
    - [38, 106.35]
  - - [4224, 4864, 1, 3456, 4224, 4224, 3456, 4864]
    - [26, 110.22]
  - - [3584, 1920, 1, 4608, 3584, 3584, 4608, 1920]
    - [25, 104.88]
  - - [4736, 256, 1, 4608, 4736, 4736, 4608, 256]
    - [76, 68.36]
  - - [256, 4224, 1, 2048, 256, 256, 2048, 4224]
    - [10, 58.69]
  - - [1152, 4992, 1, 3712, 1152, 1152, 3712, 4992]
    - [24, 90.84]
  - - [1536, 640, 1, 1280, 1536, 1536, 1280, 640]
    - [72, 47.89]
  - - [1024, 256, 1, 1536, 1024, 1024, 1536, 256]
    - [18, 22.92]
  - - [2688, 1152, 1, 4352, 2688, 2688, 4352, 1152]
    - [84, 92.71]
  - - [3584, 896, 1, 4096, 3584, 3584, 4096, 896]
    - [52, 92.12]
  - - [3328, 4864, 1, 4864, 3328, 3328, 4864, 4864]
    - [36, 130.8]
  - - [4352, 4352, 1, 1024, 4352, 4352, 1024, 4352]
    - [32, 102.94]
  - - [640, 1792, 1, 512, 640, 640, 512, 1792]
    - [10, 38.12]
  - - [768, 1920, 1, 3072, 768, 768, 3072, 1920]
    - [10, 74.03]
  - - [3840, 4096, 1, 2560, 3840, 3840, 2560, 4096]
    - [36, 126.27]
  - - [1280, 3328, 1, 2816, 1280, 1280, 2816, 3328]
    - [5, 94.27]
  - - [3328, 1024, 1, 1408, 3328, 3328, 1408, 1024]
    - [4, 78.69]
  - - [3840, 3200, 1, 2688, 3840, 3840, 2688, 3200]
    - [44, 113.84]
  - - [4992, 3200, 1, 1920, 4992, 4992, 1920, 3200]
    - [36, 125.75]
  - - [1024, 512, 1, 4736, 1024, 1024, 4736, 512]
    - [76, 51.87]
  - - [1152, 1920, 1, 4480, 1152, 1152, 4480, 1920]
    - [5, 91.45]
  - - [2816, 2048, 1, 4480, 2816, 2816, 4480, 2048]
    - [24, 89.72]
  - - [640, 3840, 1, 4224, 640, 640, 4224, 3840]
    - [56, 93.99]
  - - [1152, 3200, 1, 4352, 1152, 1152, 4352, 3200]
    - [4, 93.28]
  - - [3200, 1536, 1, 256, 3200, 3200, 256, 1536]
    - [26, 63.46]
  - - [1664, 4224, 1, 1920, 1664, 1664, 1920, 4224]
    - [25, 99.75]
  - - [512, 4992, 1, 768, 512, 512, 768, 4992]
    - [87, 69.73]
  - - [2944, 1152, 1, 3712, 2944, 2944, 3712, 1152]
    - [4, 88.59]
  - - [4096, 2048, 1, 2560, 4096, 4096, 2560, 2048]
    - [93, 103.88]
  - - [3456, 384, 1, 2816, 3456, 3456, 2816, 384]
    - [27, 67.28]
  - - [896, 1664, 1, 4992, 896, 896, 4992, 1664]
    - [84, 81.7]
  - - [2944, 1152, 1, 4096, 2944, 2944, 4096, 1152]
    - [4, 90.38]
  - - [4224, 768, 1, 3584, 4224, 4224, 3584, 768]
    - [39, 92.9]
  - - [3200, 128, 1, 4352, 3200, 3200, 4352, 128]
    - [91, 49.38]
  - - [4736, 3328, 1, 2688, 4736, 4736, 2688, 3328]
    - [36, 124.98]
  - - [1152, 2432, 1, 128, 1152, 1152, 128, 2432]
    - [84, 31.63]
  - - [4224, 3840, 1, 4864, 4224, 4224, 4864, 3840]
    - [36, 132.26]
  - - [4736, 3328, 1, 2176, 4736, 4736, 2176, 3328]
    - [36, 121.04]
  - - [1664, 4352, 1, 4480, 1664, 1664, 4480, 4352]
    - [25, 105.79]
  - - [3584, 2560, 1, 640, 3584, 3584, 640, 2560]
    - [32, 95.08]
  - - [128, 2432, 1, 128, 128, 128, 128, 2432]
    - [70, 5.59]
  - - [2944, 2304, 1, 2560, 2944, 2944, 2560, 2304]
    - [25, 98.74]
  - - [4480, 2560, 1, 4992, 4480, 4480, 4992, 2560]
    - [38, 113.97]
  - - [3840, 768, 1, 4608, 3840, 3840, 4608, 768]
    - [24, 83.83]
  - - [3584, 384, 1, 3456, 3584, 3584, 3456, 384]
    - [27, 72.67]
  - - [2688, 768, 1, 384, 2688, 2688, 384, 768]
    - [91, 48.83]
  - - [1920, 4096, 1, 1280, 1920, 1920, 1280, 4096]
    - [78, 98.71]
  - - [1024, 1536, 1, 3840, 1024, 1024, 3840, 1536]
    - [84, 82.51]
  - - [4864, 640, 1, 2048, 4864, 4864, 2048, 640]
    - [73, 79.84]
  - - [640, 3712, 1, 512, 640, 640, 512, 3712]
    - [84, 57.66]
  - - [640, 4864, 1, 2432, 640, 640, 2432, 4864]
    - [84, 88.02]
  - - [1152, 1920, 1, 4992, 1152, 1152, 4992, 1920]
    - [5, 92.72]
  - - [4736, 1408, 1, 2688, 4736, 4736, 2688, 1408]
    - [25, 95.91]
  - - [2304, 2048, 1, 768, 2304, 2304, 768, 2048]
    - [58, 89.7]
  - - [2304, 4864, 1, 4352, 2304, 2304, 4352, 4864]
    - [38, 110.51]
  - - [128, 4608, 1, 3200, 128, 128, 3200, 4608]
    - [84, 54.88]
  - - [4352, 4096, 1, 3584, 4352, 4352, 3584, 4096]
    - [28, 103.42]
  - - [4864, 1920, 1, 1536, 4864, 4864, 1536, 1920]
    - [39, 106.14]
  - - [2816, 3200, 1, 128, 2816, 2816, 128, 3200]
    - [23, 56.53]
  - - [4736, 4352, 1, 2944, 4736, 4736, 2944, 4352]
    - [40, 118.88]
  - - [3072, 3840, 1, 1920, 3072, 3072, 1920, 3840]
    - [38, 111.54]
  - - [1280, 2816, 1, 2944, 1280, 1280, 2944, 2816]
    - [4, 91.43]
  - - [4608, 3840, 1, 2048, 4608, 4608, 2048, 3840]
    - [28, 103.24]
  - - [3200, 256, 1, 3456, 3200, 3200, 3456, 256]
    - [27, 60.01]
  - - [256, 2048, 1, 3584, 256, 256, 3584, 2048]
    - [18, 47.47]
  - - [128, 512, 1, 2304, 128, 128, 2304, 512]
    - [15, 11.74]
  - - [896, 4608, 1, 1408, 896, 896, 1408, 4608]
    - [76, 84.21]
  - - [3840, 1536, 1, 2688, 3840, 3840, 2688, 1536]
    - [24, 90.0]
  - - [1920, 768, 1, 2176, 1920, 1920, 2176, 768]
    - [10, 64.9]
  - - [384, 3968, 1, 256, 384, 384, 256, 3968]
    - [10, 33.03]
  - - [3072, 4096, 1, 3456, 3072, 3072, 3456, 4096]
    - [38, 117.14]
  - - [3712, 3840, 1, 384, 3712, 3712, 384, 3840]
    - [44, 91.76]
  - - [4224, 4608, 1, 1664, 4224, 4224, 1664, 4608]
    - [39, 114.36]
  - - [2816, 1280, 1, 2816, 2816, 2816, 2816, 1280]
    - [4, 88.35]
  - - [3840, 4736, 1, 128, 3840, 3840, 128, 4736]
    - [41, 58.26]
  - - [3840, 2560, 1, 4736, 3840, 3840, 4736, 2560]
    - [39, 116.84]
  - - [128, 1792, 1, 1408, 128, 128, 1408, 1792]
    - [15, 19.13]
  - - [3072, 3712, 1, 256, 3072, 3072, 256, 3712]
    - [47, 74.17]
  - - [128, 896, 1, 2304, 128, 128, 2304, 896]
    - [16, 17.24]
  - - [4608, 4992, 1, 3328, 4608, 4608, 3328, 4992]
    - [25, 113.34]
  - - [2816, 4736, 1, 1920, 2816, 2816, 1920, 4736]
    - [44, 116.97]
  - - [3968, 4480, 1, 640, 3968, 3968, 640, 4480]
    - [39, 96.93]
  - - [512, 384, 1, 3072, 512, 512, 3072, 384]
    - [16, 26.66]
  - - [1536, 256, 1, 1664, 1536, 1536, 1664, 256]
    - [67, 31.29]
  - - [3456, 4480, 1, 4480, 3456, 3456, 4480, 4480]
    - [42, 129.45]
  - - [896, 1408, 1, 1536, 896, 896, 1536, 1408]
    - [10, 60.59]
  - - [384, 1152, 1, 1408, 384, 384, 1408, 1152]
    - [18, 28.38]
  - - [384, 1152, 1, 2048, 384, 384, 2048, 1152]
    - [18, 37.21]
  - - [2816, 4864, 1, 256, 2816, 2816, 256, 4864]
    - [53, 81.73]
  - - [384, 1920, 1, 2432, 384, 384, 2432, 1920]
    - [10, 58.62]
  - - [4992, 3968, 1, 4864, 4992, 4992, 4864, 3968]
    - [39, 117.34]
  - - [4096, 768, 1, 5120, 4096, 4096, 5120, 768]
    - [75, 88.51]
  - - [1152, 128, 1, 128, 1152, 1152, 128, 128]
    - [80, 2.94]
  - - [2816, 4224, 1, 896, 2816, 2816, 896, 4224]
    - [38, 101.75]
  - - [4480, 4352, 1, 3840, 4480, 4480, 3840, 4352]
    - [39, 117.12]
  - - [3584, 896, 1, 512, 3584, 3584, 512, 896]
    - [76, 57.3]
  - - [3200, 4480, 1, 128, 3200, 3200, 128, 4480]
    - [42, 50.11]
  - - [256, 4992, 1, 256, 256, 256, 256, 4992]
    - [10, 27.69]
  - - [4096, 1920, 1, 4608, 4096, 4096, 4608, 1920]
    - [85, 99.86]
  - - [1664, 4352, 1, 896, 1664, 1664, 896, 4352]
    - [25, 94.73]
  - - [1792, 3968, 1, 3712, 1792, 1792, 3712, 3968]
    - [25, 103.87]
  - - [1536, 3328, 1, 2560, 1536, 1536, 2560, 3328]
    - [26, 106.13]
  - - [4096, 3456, 1, 1920, 4096, 4096, 1920, 3456]
    - [53, 118.12]
  - - [2688, 4352, 1, 2560, 2688, 2688, 2560, 4352]
    - [38, 112.58]
  - - [4352, 2048, 1, 512, 4352, 4352, 512, 2048]
    - [52, 92.06]
  - - [1408, 1664, 1, 4352, 1408, 1408, 4352, 1664]
    - [26, 91.37]
  - - [3840, 640, 1, 2688, 3840, 3840, 2688, 640]
    - [26, 88.21]
  - - [128, 1920, 1, 768, 128, 128, 768, 1920]
    - [15, 17.21]
  - - [1536, 4992, 1, 3584, 1536, 1536, 3584, 4992]
    - [25, 111.72]
  - - [3072, 4864, 1, 2944, 3072, 3072, 2944, 4864]
    - [43, 123.18]
  - - [3328, 2560, 1, 4736, 3328, 3328, 4736, 2560]
    - [30, 103.23]
  - - [3072, 3072, 1, 2048, 3072, 3072, 2048, 3072]
    - [39, 110.27]
  - - [3712, 1152, 1, 1792, 3712, 3712, 1792, 1152]
    - [5, 93.03]
  - - [640, 640, 1, 4864, 640, 640, 4864, 640]
    - [75, 55.93]
  - - [3584, 640, 1, 3456, 3584, 3584, 3456, 640]
    - [58, 86.35]
  - - [3968, 1664, 1, 2944, 3968, 3968, 2944, 1664]
    - [25, 96.8]
  - - [4352, 4736, 1, 1792, 4352, 4352, 1792, 4736]
    - [45, 114.73]
  - - [3840, 2432, 1, 2048, 3840, 3840, 2048, 2432]
    - [32, 106.5]
  - - [512, 2048, 1, 3712, 512, 512, 3712, 2048]
    - [76, 68.06]
  - - [3584, 3968, 1, 2048, 3584, 3584, 2048, 3968]
    - [44, 123.34]
  - - [3328, 4608, 1, 2432, 3328, 3328, 2432, 4608]
    - [36, 123.0]
  - - [3072, 3840, 1, 2048, 3072, 3072, 2048, 3840]
    - [38, 111.77]
  - - [4096, 1664, 1, 4224, 4096, 4096, 4224, 1664]
    - [33, 98.82]
  - - [2304, 4992, 1, 4608, 2304, 2304, 4608, 4992]
    - [37, 111.59]
  - - [1664, 2944, 1, 4736, 1664, 1664, 4736, 2944]
    - [56, 105.71]
  - - [4480, 1408, 1, 2560, 4480, 4480, 2560, 1408]
    - [25, 94.15]
  - - [512, 768, 1, 896, 512, 512, 896, 768]
    - [16, 20.88]
  - - [4224, 768, 1, 4608, 4224, 4224, 4608, 768]
    - [32, 93.02]
  - - [768, 4864, 1, 2688, 768, 768, 2688, 4864]
    - [27, 80.88]
  - - [512, 1792, 1, 4224, 512, 512, 4224, 1792]
    - [84, 70.57]
  - - [3584, 1792, 1, 1920, 3584, 3584, 1920, 1792]
    - [25, 94.34]
  - - [3840, 2688, 1, 2816, 3840, 3840, 2816, 2688]
    - [52, 116.8]
  - - [640, 4224, 1, 384, 640, 640, 384, 4224]
    - [84, 57.62]
  - - [1408, 512, 1, 2944, 1408, 1408, 2944, 512]
    - [73, 55.59]
  - - [4992, 3456, 1, 3712, 4992, 4992, 3712, 3456]
    - [29, 103.31]
  - - [2176, 4864, 1, 2304, 2176, 2176, 2304, 4864]
    - [38, 105.97]
  - - [4736, 2560, 1, 3968, 4736, 4736, 3968, 2560]
    - [38, 113.72]
  - - [4224, 384, 1, 2304, 4224, 4224, 2304, 384]
    - [76, 62.51]
  - - [2048, 4352, 1, 2816, 2048, 2048, 2816, 4352]
    - [30, 101.4]
  - - [2048, 3968, 1, 2176, 2048, 2048, 2176, 3968]
    - [93, 103.59]
  - - [3328, 2688, 1, 1408, 3328, 3328, 1408, 2688]
    - [32, 100.96]
  - - [3072, 1536, 1, 384, 3072, 3072, 384, 1536]
    - [56, 73.8]
  - - [896, 2304, 1, 1664, 896, 896, 1664, 2304]
    - [27, 68.56]
  - - [4224, 1920, 1, 3840, 4224, 4224, 3840, 1920]
    - [93, 102.72]
  - - [2304, 4992, 1, 2816, 2304, 2304, 2816, 4992]
    - [37, 109.82]
  - - [3584, 2560, 1, 3840, 3584, 3584, 3840, 2560]
    - [30, 106.81]
  - - [4224, 896, 1, 896, 4224, 4224, 896, 896]
    - [76, 73.58]
  - - [2176, 3456, 1, 4864, 2176, 2176, 4864, 3456]
    - [25, 109.16]
  - - [4736, 3200, 1, 3200, 4736, 4736, 3200, 3200]
    - [43, 125.21]
  - - [256, 384, 1, 256, 256, 256, 256, 384]
    - [14, 3.83]
  - - [896, 4736, 1, 256, 896, 896, 256, 4736]
    - [5, 55.69]
  - - [256, 1024, 1, 4480, 256, 256, 4480, 1024]
    - [10, 47.07]
  - - [640, 384, 1, 3968, 640, 640, 3968, 384]
    - [18, 34.97]
  - - [3456, 2816, 1, 3328, 3456, 3456, 3328, 2816]
    - [32, 113.89]
  - - [4224, 1024, 1, 2816, 4224, 4224, 2816, 1024]
    - [81, 85.19]
  - - [4480, 3456, 1, 3072, 4480, 4480, 3072, 3456]
    - [36, 126.71]
  - - [1536, 1408, 1, 1792, 1536, 1536, 1792, 1408]
    - [5, 73.37]
  - - [2176, 640, 1, 4096, 2176, 2176, 4096, 640]
    - [27, 75.39]
  - - [768, 3840, 1, 3328, 768, 768, 3328, 3840]
    - [84, 87.53]
  - - [2688, 3328, 1, 1280, 2688, 2688, 1280, 3328]
    - [32, 100.94]
  - - [1536, 4608, 1, 768, 1536, 1536, 768, 4608]
    - [25, 95.33]
  - - [1664, 1792, 1, 1664, 1664, 1664, 1664, 1792]
    - [75, 83.46]
  - - [3200, 2560, 1, 4224, 3200, 3200, 4224, 2560]
    - [79, 106.21]
  - - [3712, 1280, 1, 3328, 3712, 3712, 3328, 1280]
    - [26, 102.7]
  - - [1664, 2944, 1, 4352, 1664, 1664, 4352, 2944]
    - [56, 105.41]
  - - [1408, 1024, 1, 3328, 1408, 1408, 3328, 1024]
    - [10, 71.94]
  - - [1664, 4352, 1, 1664, 1664, 1664, 1664, 4352]
    - [25, 101.17]
  - - [3584, 3584, 1, 256, 3584, 3584, 256, 3584]
    - [47, 79.47]
  - - [4864, 2304, 1, 4224, 4864, 4864, 4224, 2304]
    - [38, 108.91]
  - - [4864, 4864, 1, 3840, 4864, 4864, 3840, 4864]
    - [37, 116.52]
  - - [384, 1280, 1, 1920, 384, 384, 1920, 1280]
    - [10, 42.68]
  - - [4224, 4352, 1, 4224, 4224, 4224, 4224, 4352]
    - [30, 106.2]
  - - [4352, 2816, 1, 1408, 4352, 4352, 1408, 2816]
    - [38, 106.68]
  - - [1280, 640, 1, 1152, 1280, 1280, 1152, 640]
    - [91, 38.06]
  - - [1920, 1792, 1, 1152, 1920, 1920, 1152, 1792]
    - [4, 79.92]
  - - [3456, 1024, 1, 4992, 3456, 3456, 4992, 1024]
    - [37, 101.64]
  - - [512, 2176, 1, 2560, 512, 512, 2560, 2176]
    - [58, 68.17]
  - - [1280, 2816, 1, 4608, 1280, 1280, 4608, 2816]
    - [4, 93.53]
  - - [768, 384, 1, 768, 768, 768, 768, 384]
    - [16, 17.45]
  - - [3968, 2816, 1, 4096, 3968, 3968, 4096, 2816]
    - [37, 114.17]
  - - [1024, 3200, 1, 2176, 1024, 1024, 2176, 3200]
    - [4, 84.17]
  - - [640, 4224, 1, 3328, 640, 640, 3328, 4224]
    - [84, 83.52]
  - - [3968, 1024, 1, 3584, 3968, 3968, 3584, 1024]
    - [27, 86.32]
  - - [2688, 1152, 1, 3712, 2688, 2688, 3712, 1152]
    - [84, 91.97]
  - - [3712, 4480, 1, 1152, 3712, 3712, 1152, 4480]
    - [36, 121.65]
  - - [3328, 4608, 1, 1920, 3328, 3328, 1920, 4608]
    - [36, 122.69]
  - - [2176, 384, 1, 3584, 2176, 2176, 3584, 384]
    - [27, 60.07]
  - - [2432, 384, 1, 3584, 2432, 2432, 3584, 384]
    - [76, 63.7]
  - - [1408, 1920, 1, 128, 1408, 1408, 128, 1920]
    - [84, 30.97]
  - - [384, 2688, 1, 640, 384, 384, 640, 2688]
    - [71, 38.74]
  - - [4736, 128, 1, 3328, 4736, 4736, 3328, 128]
    - [73, 51.77]
  - - [4736, 2176, 1, 1792, 4736, 4736, 1792, 2176]
    - [37, 102.33]
  - - [3200, 2560, 1, 3328, 3200, 3200, 3328, 2560]
    - [79, 105.34]
  - - [3968, 3584, 1, 2432, 3968, 3968, 2432, 3584]
    - [37, 122.49]
  - - [2432, 2176, 1, 2432, 2432, 2432, 2432, 2176]
    - [24, 82.8]
  - - [128, 4736, 1, 2304, 128, 128, 2304, 4736]
    - [10, 49.23]
  - - [1408, 2688, 1, 1664, 1408, 1408, 1664, 2688]
    - [4, 88.98]
  - - [256, 3968, 1, 1152, 256, 256, 1152, 3968]
    - [71, 46.3]
  - - [2688, 768, 1, 3712, 2688, 2688, 3712, 768]
    - [76, 77.53]
  - - [640, 2816, 1, 768, 640, 640, 768, 2816]
    - [72, 56.43]
  - - [640, 4608, 1, 1280, 640, 640, 1280, 4608]
    - [84, 80.41]
  - - [1024, 1792, 1, 1792, 1024, 1024, 1792, 1792]
    - [27, 65.24]
  - - [384, 4480, 1, 1280, 384, 384, 1280, 4480]
    - [27, 55.34]
  - - [1408, 4352, 1, 2688, 1408, 1408, 2688, 4352]
    - [24, 92.25]
  - - [1536, 640, 1, 4992, 1536, 1536, 4992, 640]
    - [27, 71.12]
  - - [4096, 896, 1, 384, 4096, 4096, 384, 896]
    - [27, 58.6]
  - - [4864, 384, 1, 1280, 4864, 4864, 1280, 384]
    - [27, 58.89]
  - - [1408, 1280, 1, 3968, 1408, 1408, 3968, 1280]
    - [76, 75.83]
  - - [3328, 1280, 1, 1664, 3328, 3328, 1664, 1280]
    - [5, 89.17]
  - - [2048, 1024, 1, 3968, 2048, 2048, 3968, 1024]
    - [76, 81.16]
  - - [4224, 1536, 1, 3584, 4224, 4224, 3584, 1536]
    - [38, 103.73]
  - - [1152, 896, 1, 4352, 1152, 1152, 4352, 896]
    - [76, 72.22]
  - - [3456, 4864, 1, 2304, 3456, 3456, 2304, 4864]
    - [29, 102.71]
  - - [3584, 4736, 1, 3712, 3584, 3584, 3712, 4736]
    - [30, 103.48]
  - - [2048, 3456, 1, 2944, 2048, 2048, 2944, 3456]
    - [25, 103.24]
  - - [768, 2688, 1, 1024, 768, 768, 1024, 2688]
    - [77, 65.28]
  - - [4480, 2560, 1, 1664, 4480, 4480, 1664, 2560]
    - [38, 110.08]
  - - [4736, 4096, 1, 1024, 4736, 4736, 1024, 4096]
    - [40, 107.41]
  - - [4224, 4352, 1, 4608, 4224, 4224, 4608, 4352]
    - [28, 106.7]
  - - [384, 3584, 1, 2688, 384, 384, 2688, 3584]
    - [27, 68.44]
  - - [3200, 4608, 1, 2688, 3200, 3200, 2688, 4608]
    - [43, 118.95]
  - - [2432, 4096, 1, 1920, 2432, 2432, 1920, 4096]
    - [32, 110.73]
  - - [640, 1920, 1, 256, 640, 640, 256, 1920]
    - [10, 27.13]
  - - [512, 128, 1, 640, 512, 512, 640, 128]
    - [11, 4.56]
  - - [3840, 2816, 1, 2304, 3840, 3840, 2304, 2816]
    - [37, 108.46]
  - - [1024, 2048, 1, 1792, 1024, 1024, 1792, 2048]
    - [27, 71.34]
  - - [1152, 2560, 1, 4736, 1152, 1152, 4736, 2560]
    - [24, 85.94]
  - - [3072, 4352, 1, 1024, 3072, 3072, 1024, 4352]
    - [37, 110.58]
  - - [4224, 1920, 1, 2048, 4224, 4224, 2048, 1920]
    - [93, 101.23]
  - - [2176, 2176, 1, 384, 2176, 2176, 384, 2176]
    - [56, 74.38]
  - - [3456, 896, 1, 896, 3456, 3456, 896, 896]
    - [73, 74.13]
  - - [3840, 2944, 1, 4608, 3840, 3840, 4608, 2944]
    - [38, 109.7]
  - - [4992, 2816, 1, 3456, 4992, 4992, 3456, 2816]
    - [38, 122.18]
  - - [1920, 2560, 1, 768, 1920, 1920, 768, 2560]
    - [58, 92.03]
  - - [3456, 3328, 1, 2816, 3456, 3456, 2816, 3328]
    - [38, 112.32]
  - - [768, 4480, 1, 2176, 768, 768, 2176, 4480]
    - [4, 85.43]
  - - [1024, 2688, 1, 4608, 1024, 1024, 4608, 2688]
    - [85, 91.83]
  - - [3712, 3584, 1, 3072, 3712, 3712, 3072, 3584]
    - [38, 118.46]
  - - [4224, 1792, 1, 4864, 4224, 4224, 4864, 1792]
    - [78, 100.34]
  - - [4480, 2560, 1, 3712, 4480, 4480, 3712, 2560]
    - [38, 112.88]
  - - [896, 2048, 1, 512, 896, 896, 512, 2048]
    - [77, 50.21]
  - - [1280, 1920, 1, 3584, 1280, 1280, 3584, 1920]
    - [56, 93.26]
  - - [4480, 2816, 1, 1536, 4480, 4480, 1536, 2816]
    - [37, 114.63]
  - - [4352, 2560, 1, 1024, 4352, 4352, 1024, 2560]
    - [38, 100.63]
  - - [3072, 2048, 1, 4224, 3072, 3072, 4224, 2048]
    - [24, 93.34]
  - - [640, 2944, 1, 768, 640, 640, 768, 2944]
    - [91, 57.05]
  - - [2688, 4352, 1, 1664, 2688, 2688, 1664, 4352]
    - [38, 110.69]
  - - [4352, 2944, 1, 4864, 4352, 4352, 4864, 2944]
    - [44, 118.69]
  - - [4864, 1792, 1, 2816, 4864, 4864, 2816, 1792]
    - [30, 103.91]
  - - [1280, 384, 1, 5120, 1280, 1280, 5120, 384]
    - [27, 53.57]
  - - [256, 2688, 1, 896, 256, 256, 896, 2688]
    - [97, 31.48]
  - - [4608, 2048, 1, 2816, 4608, 4608, 2816, 2048]
    - [28, 105.94]
  - - [4480, 2048, 1, 2432, 4480, 4480, 2432, 2048]
    - [30, 103.89]
  - - [2560, 128, 1, 1280, 2560, 2560, 1280, 128]
    - [16, 22.69]
  - - [2176, 3456, 1, 4992, 2176, 2176, 4992, 3456]
    - [25, 109.69]
  - - [1792, 1408, 1, 1920, 1792, 1792, 1920, 1408]
    - [56, 82.21]
  - - [3584, 4480, 1, 2944, 3584, 3584, 2944, 4480]
    - [36, 127.3]
  - - [640, 512, 1, 896, 640, 640, 896, 512]
    - [16, 17.61]
  - - [1408, 256, 1, 3072, 1408, 1408, 3072, 256]
    - [73, 33.46]
  - - [2304, 2560, 1, 384, 2304, 2304, 384, 2560]
    - [95, 73.92]
  - - [3584, 2176, 1, 896, 3584, 3584, 896, 2176]
    - [85, 92.86]
  - - [1152, 1280, 1, 4736, 1152, 1152, 4736, 1280]
    - [5, 82.89]
  - - [2176, 4480, 1, 512, 2176, 2176, 512, 4480]
    - [45, 89.78]
  - - [2304, 4224, 1, 1408, 2304, 2304, 1408, 4224]
    - [32, 104.92]
  - - [3584, 512, 1, 4352, 3584, 3584, 4352, 512]
    - [76, 74.3]
  - - [1024, 1920, 1, 3584, 1024, 1024, 3584, 1920]
    - [76, 78.61]
  - - [1536, 896, 1, 2560, 1536, 1536, 2560, 896]
    - [10, 66.77]
  - - [2560, 2816, 1, 4608, 2560, 2560, 4608, 2816]
    - [25, 105.84]
  - - [4992, 4224, 1, 1280, 4992, 4992, 1280, 4224]
    - [25, 101.72]
  - - [3840, 2048, 1, 2944, 3840, 3840, 2944, 2048]
    - [78, 101.84]
  - - [896, 256, 1, 3072, 896, 896, 3072, 256]
    - [18, 29.59]
  - - [2304, 3328, 1, 4480, 2304, 2304, 4480, 3328]
    - [79, 103.54]
  - - [2304, 3072, 1, 3968, 2304, 2304, 3968, 3072]
    - [25, 105.13]
  - - [1792, 896, 1, 4096, 1792, 1792, 4096, 896]
    - [26, 82.7]
  - - [640, 3200, 1, 896, 640, 640, 896, 3200]
    - [91, 61.95]
  - - [896, 2560, 1, 1024, 896, 896, 1024, 2560]
    - [84, 68.91]
  - - [1536, 4224, 1, 128, 1536, 1536, 128, 4224]
    - [93, 42.67]
  - - [1920, 4608, 1, 3456, 1920, 1920, 3456, 4608]
    - [30, 102.79]
  - - [2688, 4096, 1, 2048, 2688, 2688, 2048, 4096]
    - [38, 110.79]
  - - [3072, 2432, 1, 3200, 3072, 3072, 3200, 2432]
    - [25, 107.46]
  - - [128, 4992, 1, 4736, 128, 128, 4736, 4992]
    - [76, 56.73]
  - - [640, 1920, 1, 128, 640, 640, 128, 1920]
    - [97, 18.18]
  - - [2048, 896, 1, 4608, 2048, 2048, 4608, 896]
    - [76, 76.72]
  - - [1536, 3712, 1, 4608, 1536, 1536, 4608, 3712]
    - [24, 90.6]
  - - [2816, 3968, 1, 2176, 2816, 2816, 2176, 3968]
    - [44, 109.63]
  - - [3456, 4480, 1, 4992, 3456, 3456, 4992, 4480]
    - [42, 130.08]
  - - [3584, 4224, 1, 4864, 3584, 3584, 4864, 4224]
    - [36, 123.13]
  - - [4096, 3584, 1, 128, 4096, 4096, 128, 3584]
    - [53, 60.73]
  - - [3584, 4224, 1, 256, 3584, 3584, 256, 4224]
    - [33, 73.15]
  - - [640, 4352, 1, 2304, 640, 640, 2304, 4352]
    - [87, 83.05]
  - - [3584, 2816, 1, 2176, 3584, 3584, 2176, 2816]
    - [32, 111.51]
  - - [2688, 4480, 1, 2816, 2688, 2688, 2816, 4480]
    - [38, 115.41]
  - - [384, 384, 1, 3456, 384, 384, 3456, 384]
    - [10, 22.95]
  - - [896, 1280, 1, 2304, 896, 896, 2304, 1280]
    - [76, 58.85]
  - - [3712, 256, 1, 1152, 3712, 3712, 1152, 256]
    - [77, 43.44]
  - - [3968, 3072, 1, 3072, 3968, 3968, 3072, 3072]
    - [38, 114.78]
  - - [768, 3072, 1, 1408, 768, 768, 1408, 3072]
    - [5, 74.63]
  - - [4224, 4480, 1, 1664, 4224, 4224, 1664, 4480]
    - [39, 109.31]
  - - [4096, 4864, 1, 512, 4096, 4096, 512, 4864]
    - [49, 96.57]
  - - [3072, 4992, 1, 4224, 3072, 3072, 4224, 4992]
    - [43, 129.7]
  - - [128, 640, 1, 3840, 128, 128, 3840, 640]
    - [15, 19.56]
  - - [4352, 4608, 1, 4224, 4352, 4352, 4224, 4608]
    - [39, 118.31]
  - - [1152, 2560, 1, 1920, 1152, 1152, 1920, 2560]
    - [84, 84.56]
  - - [3456, 3456, 1, 896, 3456, 3456, 896, 3456]
    - [38, 102.21]
  - - [4224, 4480, 1, 4480, 4224, 4224, 4480, 4480]
    - [39, 113.85]
  - - [4992, 896, 1, 4736, 4992, 4992, 4736, 896]
    - [58, 96.51]
  - - [3456, 1664, 1, 1024, 3456, 3456, 1024, 1664]
    - [24, 82.05]
  - - [1152, 1792, 1, 2176, 1152, 1152, 2176, 1792]
    - [76, 73.62]
  - - [512, 3584, 1, 3840, 512, 512, 3840, 3584]
    - [76, 75.79]
  - - [3584, 4096, 1, 3584, 3584, 3584, 3584, 4096]
    - [38, 129.46]
  - - [4736, 4736, 1, 2688, 4736, 4736, 2688, 4736]
    - [25, 108.81]
  - - [128, 2432, 1, 3712, 128, 128, 3712, 2432]
    - [10, 44.2]
  - - [4480, 4992, 1, 384, 4480, 4480, 384, 4992]
    - [78, 80.62]
  - - [4096, 3200, 1, 4608, 4096, 4096, 4608, 3200]
    - [44, 119.22]
  - - [640, 896, 1, 1024, 640, 640, 1024, 896]
    - [10, 30.87]
  - - [128, 512, 1, 512, 128, 128, 512, 512]
    - [21, 4.46]
  - - [2176, 256, 1, 1664, 2176, 2176, 1664, 256]
    - [10, 37.36]
  - - [384, 384, 1, 4736, 384, 384, 4736, 384]
    - [10, 30.91]
  - - [1408, 3072, 1, 4736, 1408, 1408, 4736, 3072]
    - [5, 100.22]
  - - [4736, 2304, 1, 1920, 4736, 4736, 1920, 2304]
    - [44, 107.61]
  - - [256, 1536, 1, 4864, 256, 256, 4864, 1536]
    - [10, 58.69]
  - - [1536, 3584, 1, 2560, 1536, 1536, 2560, 3584]
    - [24, 88.36]
  - - [128, 1920, 1, 512, 128, 128, 512, 1920]
    - [15, 13.32]
  - - [4224, 1536, 1, 640, 4224, 4224, 640, 1536]
    - [25, 88.26]
  - - [1152, 3968, 1, 4352, 1152, 1152, 4352, 3968]
    - [5, 104.01]
  - - [3584, 256, 1, 2688, 3584, 3584, 2688, 256]
    - [84, 60.91]
  - - [768, 1024, 1, 1152, 768, 768, 1152, 1024]
    - [69, 36.42]
  - - [1408, 2560, 1, 4864, 1408, 1408, 4864, 2560]
    - [25, 98.26]
  - - [1152, 640, 1, 1792, 1152, 1152, 1792, 640]
    - [10, 50.97]
  - - [2688, 128, 1, 1792, 2688, 2688, 1792, 128]
    - [16, 26.33]
  - - [4864, 5120, 1, 1792, 4864, 4864, 1792, 5120]
    - [44, 117.43]
  - - [4608, 640, 1, 768, 4608, 4608, 768, 640]
    - [84, 74.3]
  - - [2176, 2432, 1, 2560, 2176, 2176, 2560, 2432]
    - [24, 83.44]
  - - [512, 3840, 1, 4224, 512, 512, 4224, 3840]
    - [76, 79.23]
  - - [3200, 2304, 1, 1792, 3200, 3200, 1792, 2304]
    - [33, 103.16]
  - - [3072, 1920, 1, 3072, 3072, 3072, 3072, 1920]
    - [24, 89.4]
  - - [512, 2816, 1, 3072, 512, 512, 3072, 2816]
    - [10, 72.11]
  - - [4352, 1792, 1, 3072, 4352, 4352, 3072, 1792]
    - [92, 100.94]
  - - [3584, 2816, 1, 2304, 3584, 3584, 2304, 2816]
    - [32, 111.64]
  - - [768, 640, 1, 4352, 768, 768, 4352, 640]
    - [10, 58.87]
  - - [3072, 4480, 1, 4096, 3072, 3072, 4096, 4480]
    - [38, 122.03]
  - - [2688, 3200, 1, 1536, 2688, 2688, 1536, 3200]
    - [29, 97.9]
  - - [128, 2688, 1, 4096, 128, 128, 4096, 2688]
    - [10, 50.49]
  - - [1152, 4608, 1, 4096, 1152, 1152, 4096, 4608]
    - [24, 87.31]
  - - [3712, 1792, 1, 2816, 3712, 3712, 2816, 1792]
    - [25, 99.56]
  - - [4736, 3200, 1, 384, 4736, 4736, 384, 3200]
    - [42, 90.66]
  - - [2432, 3840, 1, 2176, 2432, 2432, 2176, 3840]
    - [29, 106.38]
  - - [3712, 2176, 1, 4224, 3712, 3712, 4224, 2176]
    - [93, 102.11]
  - - [3328, 3712, 1, 3328, 3328, 3328, 3328, 3712]
    - [38, 115.35]
  - - [1280, 2304, 1, 4864, 1280, 1280, 4864, 2304]
    - [24, 84.33]
  - - [4480, 768, 1, 3968, 4480, 4480, 3968, 768]
    - [39, 97.83]
  - - [1152, 3968, 1, 2944, 1152, 1152, 2944, 3968]
    - [5, 101.96]
  - - [896, 1152, 1, 4352, 896, 896, 4352, 1152]
    - [27, 72.11]
  - - [384, 768, 1, 2432, 384, 384, 2432, 768]
    - [10, 33.76]
  - - [1152, 3840, 1, 4864, 1152, 1152, 4864, 3840]
    - [5, 102.7]
  - - [896, 256, 1, 1280, 896, 896, 1280, 256]
    - [15, 19.19]
  - - [896, 1536, 1, 3584, 896, 896, 3584, 1536]
    - [27, 73.55]
  - - [640, 2048, 1, 3584, 640, 640, 3584, 2048]
    - [27, 71.19]
  - - [4352, 128, 1, 1536, 4352, 4352, 1536, 128]
    - [77, 37.55]
  - - [3968, 3328, 1, 2944, 3968, 3968, 2944, 3328]
    - [38, 119.86]
  - - [512, 3584, 1, 1920, 512, 512, 1920, 3584]
    - [76, 66.7]
  - - [3968, 1920, 1, 384, 3968, 3968, 384, 1920]
    - [85, 69.01]
  - - [4480, 1152, 1, 3072, 4480, 4480, 3072, 1152]
    - [31, 87.62]
  - - [3712, 4736, 1, 1152, 3712, 3712, 1152, 4736]
    - [40, 104.11]
  - - [3968, 3968, 1, 4480, 3968, 3968, 4480, 3968]
    - [86, 102.04]
  - - [4864, 640, 1, 1152, 4864, 4864, 1152, 640]
    - [73, 74.82]
  - - [3200, 2048, 1, 1152, 3200, 3200, 1152, 2048]
    - [25, 90.73]
  - - [1408, 4352, 1, 1792, 1408, 1408, 1792, 4352]
    - [24, 90.29]
  - - [4352, 4608, 1, 2688, 4352, 4352, 2688, 4608]
    - [39, 116.21]
  - - [3072, 2432, 1, 3584, 3072, 3072, 3584, 2432]
    - [25, 107.96]
  - - [3584, 3072, 1, 3328, 3584, 3584, 3328, 3072]
    - [38, 111.11]
  - - [4352, 384, 1, 768, 4352, 4352, 768, 384]
    - [77, 49.99]
  - - [768, 3584, 1, 3456, 768, 768, 3456, 3584]
    - [93, 86.78]
  - - [3712, 1024, 1, 4480, 3712, 3712, 4480, 1024]
    - [76, 82.08]
  - - [640, 3712, 1, 896, 640, 640, 896, 3712]
    - [75, 69.43]
  - - [2304, 2816, 1, 4992, 2304, 2304, 4992, 2816]
    - [25, 102.36]
  - - [3072, 2048, 1, 3840, 3072, 3072, 3840, 2048]
    - [24, 93.54]
  - - [2176, 4480, 1, 3712, 2176, 2176, 3712, 4480]
    - [40, 114.94]
  - - [2048, 4608, 1, 4224, 2048, 2048, 4224, 4608]
    - [32, 114.04]
  - - [1024, 2304, 1, 4096, 1024, 1024, 4096, 2304]
    - [58, 92.24]
  - - [5120, 256, 1, 3456, 5120, 5120, 3456, 256]
    - [27, 69.52]
  - - [1536, 768, 1, 2944, 1536, 1536, 2944, 768]
    - [5, 70.99]
  - - [128, 1536, 1, 2816, 128, 128, 2816, 1536]
    - [16, 24.91]
  - - [128, 3200, 1, 896, 128, 128, 896, 3200]
    - [18, 20.46]
  - - [1664, 3840, 1, 3840, 1664, 1664, 3840, 3840]
    - [25, 100.21]
  - - [3968, 4608, 1, 4480, 3968, 3968, 4480, 4608]
    - [28, 106.69]
  - - [3968, 3456, 1, 2688, 3968, 3968, 2688, 3456]
    - [38, 118.53]
  - - [1024, 256, 1, 4096, 1024, 1024, 4096, 256]
    - [18, 37.65]
  - - [3456, 3200, 1, 4480, 3456, 3456, 4480, 3200]
    - [37, 110.08]
  - - [1408, 1408, 1, 2176, 1408, 1408, 2176, 1408]
    - [27, 72.02]
  - - [4864, 4352, 1, 2688, 4864, 4864, 2688, 4352]
    - [25, 107.23]
  - - [4992, 4736, 1, 1408, 4992, 4992, 1408, 4736]
    - [38, 108.69]
  - - [3072, 3072, 1, 896, 3072, 3072, 896, 3072]
    - [39, 102.53]
  - - [512, 128, 1, 3456, 512, 512, 3456, 128]
    - [15, 14.55]
  - - [2816, 2816, 1, 4096, 2816, 2816, 4096, 2816]
    - [85, 103.89]
  - - [3584, 256, 1, 3584, 3584, 3584, 3584, 256]
    - [27, 62.54]
  - - [640, 1408, 1, 1536, 640, 640, 1536, 1408]
    - [84, 51.54]
  - - [4352, 1664, 1, 1024, 4352, 4352, 1024, 1664]
    - [33, 92.02]
  - - [2176, 1536, 1, 1664, 2176, 2176, 1664, 1536]
    - [4, 82.97]
  - - [3328, 1920, 1, 4736, 3328, 3328, 4736, 1920]
    - [25, 100.61]
  - - [4480, 3840, 1, 4096, 4480, 4480, 4096, 3840]
    - [28, 101.26]
  - - [2432, 896, 1, 1920, 2432, 2432, 1920, 896]
    - [26, 77.3]
  - - [4736, 2304, 1, 1408, 4736, 4736, 1408, 2304]
    - [44, 104.74]
  - - [1792, 2560, 1, 1408, 1792, 1792, 1408, 2560]
    - [26, 95.03]
  - - [2560, 3968, 1, 4224, 2560, 2560, 4224, 3968]
    - [32, 117.8]
  - - [3840, 128, 1, 4992, 3840, 3840, 4992, 128]
    - [73, 55.03]
  - - [1280, 3968, 1, 1664, 1280, 1280, 1664, 3968]
    - [26, 101.22]
  - - [4352, 3584, 1, 2048, 4352, 4352, 2048, 3584]
    - [36, 119.55]
  - - [3456, 640, 1, 3712, 3456, 3456, 3712, 640]
    - [81, 76.0]
  - - [4736, 4224, 1, 3072, 4736, 4736, 3072, 4224]
    - [39, 116.52]
  - - [3072, 2176, 1, 256, 3072, 3072, 256, 2176]
    - [85, 60.18]
  - - [4352, 1536, 1, 896, 4352, 4352, 896, 1536]
    - [25, 90.7]
  - - [2432, 4352, 1, 3840, 2432, 2432, 3840, 4352]
    - [44, 109.83]
  - - [4864, 3200, 1, 1408, 4864, 4864, 1408, 3200]
    - [36, 118.85]
  - - [1920, 4096, 1, 3456, 1920, 1920, 3456, 4096]
    - [78, 103.76]
  - - [1408, 2304, 1, 3200, 1408, 1408, 3200, 2304]
    - [40, 90.3]
  - - [2304, 2688, 1, 896, 2304, 2304, 896, 2688]
    - [48, 92.05]
  - - [1024, 2304, 1, 2048, 1024, 1024, 2048, 2304]
    - [56, 80.49]
  - - [2304, 640, 1, 4352, 2304, 2304, 4352, 640]
    - [84, 78.92]
  - - [2944, 384, 1, 3200, 2944, 2944, 3200, 384]
    - [5, 68.02]
  - - [1536, 4736, 1, 384, 1536, 1536, 384, 4736]
    - [85, 73.62]
  - - [2176, 1536, 1, 2560, 2176, 2176, 2560, 1536]
    - [4, 86.7]
  - - [2304, 4864, 1, 2304, 2304, 2304, 2304, 4864]
    - [38, 109.36]
  - - [2176, 1280, 1, 128, 2176, 2176, 128, 1280]
    - [84, 31.63]
  - - [4096, 3712, 1, 3200, 4096, 4096, 3200, 3712]
    - [36, 125.04]
  - - [4608, 4352, 1, 1792, 4608, 4608, 1792, 4352]
    - [32, 111.43]
  - - [128, 4992, 1, 2688, 128, 128, 2688, 4992]
    - [10, 51.89]
  - - [1152, 128, 1, 2688, 1152, 1152, 2688, 128]
    - [71, 20.65]
  - - [768, 2816, 1, 2688, 768, 768, 2688, 2816]
    - [5, 81.94]
  - - [3328, 640, 1, 3584, 3328, 3328, 3584, 640]
    - [81, 72.42]
  - - [4224, 2816, 1, 4992, 4224, 4224, 4992, 2816]
    - [44, 117.79]
  - - [2432, 3328, 1, 1152, 2432, 2432, 1152, 3328]
    - [78, 98.72]
  - - [3584, 1280, 1, 4224, 3584, 3584, 4224, 1280]
    - [26, 101.94]
  - - [3840, 3200, 1, 768, 3840, 3840, 768, 3200]
    - [38, 101.56]
  - - [2176, 2944, 1, 4480, 2176, 2176, 4480, 2944]
    - [25, 99.33]
  - - [1664, 3072, 1, 1792, 1664, 1664, 1792, 3072]
    - [24, 79.58]
  - - [3200, 4480, 1, 256, 3200, 3200, 256, 4480]
    - [43, 71.66]
  - - [4736, 3712, 1, 3584, 4736, 4736, 3584, 3712]
    - [28, 101.88]
  - - [1408, 896, 1, 2816, 1408, 1408, 2816, 896]
    - [27, 65.88]
  - - [2944, 2176, 1, 1792, 2944, 2944, 1792, 2176]
    - [25, 95.49]
  - - [4864, 4480, 1, 4096, 4864, 4864, 4096, 4480]
    - [25, 109.05]
  - - [4736, 1024, 1, 2304, 4736, 4736, 2304, 1024]
    - [40, 95.0]
  - - [3584, 4352, 1, 3328, 3584, 3584, 3328, 4352]
    - [36, 127.11]
  - - [2816, 2816, 1, 640, 2816, 2816, 640, 2816]
    - [78, 90.44]
  - - [640, 4736, 1, 4992, 640, 640, 4992, 4736]
    - [40, 92.92]
  - - [512, 2432, 1, 2688, 512, 512, 2688, 2432]
    - [27, 65.37]
  - - [3968, 384, 1, 2944, 3968, 3968, 2944, 384]
    - [10, 70.14]
  - - [4096, 4992, 1, 3200, 4096, 4096, 3200, 4992]
    - [52, 119.62]
  - - [3968, 1792, 1, 3328, 3968, 3968, 3328, 1792]
    - [25, 102.39]
  - - [768, 3200, 1, 4736, 768, 768, 4736, 3200]
    - [56, 96.07]
  - - [3328, 2816, 1, 2560, 3328, 3328, 2560, 2816]
    - [39, 111.94]
  - - [1280, 640, 1, 3712, 1280, 1280, 3712, 640]
    - [27, 62.14]
  - - [1152, 2816, 1, 4864, 1152, 1152, 4864, 2816]
    - [25, 92.72]
  - - [3712, 2944, 1, 2688, 3712, 3712, 2688, 2944]
    - [38, 105.13]
  - - [640, 4608, 1, 2944, 640, 640, 2944, 4608]
    - [84, 86.65]
  - - [4736, 512, 1, 1664, 4736, 4736, 1664, 512]
    - [84, 71.83]
  - - [1152, 3712, 1, 2176, 1152, 1152, 2176, 3712]
    - [5, 95.79]
  - - [3072, 256, 1, 3584, 3072, 3072, 3584, 256]
    - [73, 62.1]
  - - [3712, 4992, 1, 2944, 3712, 3712, 2944, 4992]
    - [39, 112.58]
  - - [2816, 4608, 1, 3200, 2816, 2816, 3200, 4608]
    - [44, 119.99]
  - - [1536, 512, 1, 4736, 1536, 1536, 4736, 512]
    - [27, 65.29]
  - - [4352, 2304, 1, 2560, 4352, 4352, 2560, 2304]
    - [32, 111.81]
  - - [4224, 2432, 1, 1664, 4224, 4224, 1664, 2432]
    - [37, 101.71]
  - - [256, 640, 1, 2432, 256, 256, 2432, 640]
    - [16, 19.75]
  - - [2048, 5120, 1, 3840, 2048, 2048, 3840, 5120]
    - [45, 120.1]
  - - [2816, 2688, 1, 256, 2816, 2816, 256, 2688]
    - [93, 65.32]
  - - [768, 512, 1, 1024, 768, 768, 1024, 512]
    - [18, 24.75]
  - - [768, 1280, 1, 2432, 768, 768, 2432, 1280]
    - [75, 64.06]
  - - [2176, 1536, 1, 896, 2176, 2176, 896, 1536]
    - [4, 77.81]
  - - [1920, 3840, 1, 640, 1920, 1920, 640, 3840]
    - [25, 97.62]
  - - [2560, 1792, 1, 4992, 2560, 2560, 4992, 1792]
    - [37, 102.23]
  - - [3456, 3968, 1, 2560, 3456, 3456, 2560, 3968]
    - [38, 120.5]
  - - [256, 2944, 1, 4352, 256, 256, 4352, 2944]
    - [10, 66.64]
  - - [4736, 1664, 1, 3072, 4736, 4736, 3072, 1664]
    - [93, 101.66]
  - - [1792, 1536, 1, 512, 1792, 1792, 512, 1536]
    - [84, 64.84]
  - - [384, 128, 1, 3584, 384, 384, 3584, 128]
    - [15, 12.12]
  - - [4864, 3456, 1, 640, 4864, 4864, 640, 3456]
    - [32, 91.43]
  - - [4352, 2432, 1, 768, 4352, 4352, 768, 2432]
    - [37, 92.13]
  - - [2944, 2560, 1, 256, 2944, 2944, 256, 2560]
    - [79, 65.89]
  - - [2688, 512, 1, 1024, 2688, 2688, 1024, 512]
    - [10, 53.72]
  - - [4224, 1920, 1, 256, 4224, 4224, 256, 1920]
    - [93, 60.94]
  - - [2176, 4224, 1, 1920, 2176, 2176, 1920, 4224]
    - [32, 106.35]
  - - [1408, 1536, 1, 1920, 1408, 1408, 1920, 1536]
    - [5, 76.29]
  - - [4608, 256, 1, 768, 4608, 4608, 768, 256]
    - [10, 44.05]
  - - [1920, 1024, 1, 3840, 1920, 1920, 3840, 1024]
    - [76, 79.03]
  - - [4608, 2688, 1, 3328, 4608, 4608, 3328, 2688]
    - [44, 116.68]
  - - [4736, 128, 1, 2688, 4736, 4736, 2688, 128]
    - [72, 48.94]
  - - [768, 1152, 1, 1920, 768, 768, 1920, 1152]
    - [84, 56.64]
  - - [1280, 4224, 1, 2048, 1280, 1280, 2048, 4224]
    - [24, 83.54]
  - - [2048, 4608, 1, 1920, 2048, 2048, 1920, 4608]
    - [32, 109.23]
  - - [2688, 128, 1, 2432, 2688, 2688, 2432, 128]
    - [91, 35.7]
  - - [2688, 4736, 1, 2944, 2688, 2688, 2944, 4736]
    - [44, 119.92]
  - - [2944, 4352, 1, 4352, 2944, 2944, 4352, 4352]
    - [38, 117.05]
  - - [1664, 3968, 1, 1408, 1664, 1664, 1408, 3968]
    - [25, 94.53]
  - - [768, 4224, 1, 4608, 768, 768, 4608, 4224]
    - [32, 93.96]
  - - [1408, 3712, 1, 3712, 1408, 1408, 3712, 3712]
    - [24, 84.29]
  - - [4224, 2048, 1, 2048, 4224, 4224, 2048, 2048]
    - [30, 101.04]
  - - [640, 2944, 1, 1152, 640, 640, 1152, 2944]
    - [76, 57.01]
  - - [4352, 896, 1, 1024, 4352, 4352, 1024, 896]
    - [27, 78.49]
  - - [4992, 1792, 1, 1152, 4992, 4992, 1152, 1792]
    - [39, 103.05]
  - - [2560, 256, 1, 3200, 2560, 2560, 3200, 256]
    - [10, 52.73]
  - - [3968, 1024, 1, 2944, 3968, 3968, 2944, 1024]
    - [27, 86.2]
  - - [3840, 1024, 1, 256, 3840, 3840, 256, 1024]
    - [76, 50.95]
  - - [1536, 1152, 1, 1920, 1536, 1536, 1920, 1152]
    - [76, 64.89]
  - - [3712, 4608, 1, 2048, 3712, 3712, 2048, 4608]
    - [28, 100.86]
  - - [2560, 2688, 1, 3456, 2560, 2560, 3456, 2688]
    - [25, 101.45]
  - - [3968, 2688, 1, 4096, 3968, 3968, 4096, 2688]
    - [38, 105.75]
  - - [4736, 2944, 1, 3456, 4736, 4736, 3456, 2944]
    - [43, 116.84]
  - - [2944, 4736, 1, 2176, 2944, 2944, 2176, 4736]
    - [42, 117.04]
  - - [3840, 3328, 1, 4096, 3840, 3840, 4096, 3328]
    - [38, 117.14]
  - - [2944, 2688, 1, 4096, 2944, 2944, 4096, 2688]
    - [85, 101.71]
  - - [3072, 4992, 1, 1664, 3072, 3072, 1664, 4992]
    - [43, 123.12]
  - - [3328, 2944, 1, 3072, 3328, 3328, 3072, 2944]
    - [32, 111.03]
  - - [4480, 1280, 1, 1664, 4480, 4480, 1664, 1280]
    - [24, 85.82]
  - - [2304, 1792, 1, 3200, 2304, 2304, 3200, 1792]
    - [76, 85.96]
  - - [1536, 1280, 1, 640, 1536, 1536, 640, 1280]
    - [77, 55.89]
  - - [384, 896, 1, 256, 384, 384, 256, 896]
    - [16, 10.63]
  - - [2688, 1408, 1, 2432, 2688, 2688, 2432, 1408]
    - [76, 81.06]
  - - [4096, 1024, 1, 3584, 4096, 4096, 3584, 1024]
    - [27, 88.23]
  - - [256, 3840, 1, 3968, 256, 256, 3968, 3840]
    - [27, 65.23]
  - - [4096, 512, 1, 384, 4096, 4096, 384, 512]
    - [72, 48.69]
  - - [128, 3584, 1, 1024, 128, 128, 1024, 3584]
    - [18, 29.3]
  - - [4736, 3712, 1, 4352, 4736, 4736, 4352, 3712]
    - [28, 102.11]
  - - [1152, 4224, 1, 2048, 1152, 1152, 2048, 4224]
    - [26, 99.62]
  - - [2048, 1024, 1, 3072, 2048, 2048, 3072, 1024]
    - [76, 78.86]
  - - [4864, 4480, 1, 2944, 4864, 4864, 2944, 4480]
    - [25, 109.99]
  - - [3328, 1664, 1, 3456, 3328, 3328, 3456, 1664]
    - [24, 84.63]
  - - [3840, 1792, 1, 1536, 3840, 3840, 1536, 1792]
    - [25, 97.83]
  - - [256, 2176, 1, 256, 256, 256, 256, 2176]
    - [66, 14.37]
  - - [768, 3456, 1, 896, 768, 768, 896, 3456]
    - [87, 73.44]
  - - [4480, 3712, 1, 1024, 4480, 4480, 1024, 3712]
    - [27, 85.14]
  - - [256, 3968, 1, 4224, 256, 256, 4224, 3968]
    - [75, 72.64]
  - - [1024, 3968, 1, 2560, 1024, 1024, 2560, 3968]
    - [27, 84.86]
  - - [2816, 256, 1, 256, 2816, 2816, 256, 256]
    - [66, 18.12]
  - - [1920, 2304, 1, 1920, 1920, 1920, 1920, 2304]
    - [5, 97.86]
  - - [2048, 3584, 1, 3328, 2048, 2048, 3328, 3584]
    - [33, 104.68]
  - - [3840, 2688, 1, 384, 3840, 3840, 384, 2688]
    - [45, 89.87]
  - - [1664, 3840, 1, 256, 1664, 1664, 256, 3840]
    - [79, 58.05]
  - - [384, 2432, 1, 768, 384, 384, 768, 2432]
    - [71, 37.21]
  - - [4864, 1152, 1, 4480, 4864, 4864, 4480, 1152]
    - [24, 84.99]
  - - [3072, 2176, 1, 2560, 3072, 3072, 2560, 2176]
    - [25, 100.75]
  - - [640, 4736, 1, 4224, 640, 640, 4224, 4736]
    - [75, 89.96]
  - - [2048, 4608, 1, 896, 2048, 2048, 896, 4608]
    - [32, 102.78]
  - - [4096, 2048, 1, 4992, 4096, 4096, 4992, 2048]
    - [93, 106.48]
  - - [256, 2688, 1, 3200, 256, 256, 3200, 2688]
    - [10, 59.49]
  - - [128, 2688, 1, 384, 128, 128, 384, 2688]
    - [61, 12.83]
  - - [3200, 4480, 1, 3200, 3200, 3200, 3200, 4480]
    - [43, 122.5]
  - - [4608, 2560, 1, 1792, 4608, 4608, 1792, 2560]
    - [38, 107.68]
  - - [1152, 896, 1, 1664, 1152, 1152, 1664, 896]
    - [77, 54.33]
  - - [3328, 1152, 1, 1024, 3328, 3328, 1024, 1152]
    - [4, 84.06]
  - - [384, 2176, 1, 3200, 384, 384, 3200, 2176]
    - [76, 60.21]
  - - [3584, 1024, 1, 2304, 3584, 3584, 2304, 1024]
    - [27, 82.21]
  - - [256, 1792, 1, 4736, 256, 256, 4736, 1792]
    - [10, 58.05]
  - - [4480, 3456, 1, 896, 4480, 4480, 896, 3456]
    - [36, 113.82]
  - - [2432, 1920, 1, 512, 2432, 2432, 512, 1920]
    - [26, 81.98]
  - - [1152, 4736, 1, 4224, 1152, 1152, 4224, 4736]
    - [24, 88.27]
  - - [2176, 640, 1, 4736, 2176, 2176, 4736, 640]
    - [27, 77.57]
  - - [1408, 4480, 1, 1792, 1408, 1408, 1792, 4480]
    - [25, 97.34]
  - - [512, 256, 1, 2176, 512, 512, 2176, 256]
    - [15, 16.94]
  - - [2944, 768, 1, 3200, 2944, 2944, 3200, 768]
    - [5, 84.86]
  - - [4864, 3968, 1, 2304, 4864, 4864, 2304, 3968]
    - [39, 112.33]
  - - [2688, 2048, 1, 1920, 2688, 2688, 1920, 2048]
    - [24, 86.06]
  - - [3200, 4096, 1, 3072, 3200, 3200, 3072, 4096]
    - [37, 121.47]
  - - [2816, 2816, 1, 2816, 2816, 2816, 2816, 2816]
    - [85, 99.73]
  - - [3968, 3072, 1, 1408, 3968, 3968, 1408, 3072]
    - [38, 110.16]
  - - [2176, 1664, 1, 3072, 2176, 2176, 3072, 1664]
    - [4, 89.79]
  - - [3328, 384, 1, 4096, 3328, 3328, 4096, 384]
    - [27, 71.14]
  - - [1408, 4480, 1, 3200, 1408, 1408, 3200, 4480]
    - [25, 98.8]
  - - [1280, 3968, 1, 1792, 1280, 1280, 1792, 3968]
    - [26, 102.04]
  - - [4480, 2304, 1, 4992, 4480, 4480, 4992, 2304]
    - [32, 118.8]
  - - [4608, 1408, 1, 3584, 4608, 4608, 3584, 1408]
    - [25, 96.59]
  - - [2304, 3072, 1, 3200, 2304, 2304, 3200, 3072]
    - [25, 104.53]
  - - [640, 4608, 1, 384, 640, 640, 384, 4608]
    - [84, 60.84]
  - - [3072, 2048, 1, 1408, 3072, 3072, 1408, 2048]
    - [24, 91.15]
  - - [4736, 2304, 1, 3456, 4736, 4736, 3456, 2304]
    - [44, 109.69]
  - - [128, 2816, 1, 3456, 128, 128, 3456, 2816]
    - [10, 47.72]
  - - [1280, 1152, 1, 4224, 1280, 1280, 4224, 1152]
    - [5, 80.76]
  - - [256, 4864, 1, 4608, 256, 256, 4608, 4864]
    - [26, 80.14]
  - - [1408, 256, 1, 1280, 1408, 1408, 1280, 256]
    - [18, 23.06]
  - - [3072, 256, 1, 4608, 3072, 3072, 4608, 256]
    - [73, 65.43]
  - - [2048, 2304, 1, 384, 2048, 2048, 384, 2304]
    - [26, 74.26]
  - - [3712, 512, 1, 1152, 3712, 3712, 1152, 512]
    - [76, 57.07]
  - - [1408, 2816, 1, 2560, 1408, 1408, 2560, 2816]
    - [27, 85.44]
  - - [3840, 3584, 1, 1536, 3840, 3840, 1536, 3584]
    - [37, 118.09]
  - - [1408, 1152, 1, 2816, 1408, 1408, 2816, 1152]
    - [27, 65.61]
  - - [1536, 3456, 1, 1024, 1536, 1536, 1024, 3456]
    - [24, 79.34]
  - - [128, 3584, 1, 2048, 128, 128, 2048, 3584]
    - [18, 39.71]
  - - [2560, 2560, 1, 1280, 2560, 2560, 1280, 2560]
    - [25, 96.12]
  - - [1536, 3328, 1, 3200, 1536, 1536, 3200, 3328]
    - [56, 107.26]
  - - [1152, 896, 1, 2432, 1152, 1152, 2432, 896]
    - [73, 63.23]
  - - [768, 4608, 1, 3712, 768, 768, 3712, 4608]
    - [4, 91.09]
  - - [1664, 3200, 1, 384, 1664, 1664, 384, 3200]
    - [95, 68.35]
  - - [3200, 128, 1, 4736, 3200, 3200, 4736, 128]
    - [91, 50.88]
  - - [4480, 3968, 1, 1024, 4480, 4480, 1024, 3968]
    - [30, 96.7]
  - - [1536, 512, 1, 1408, 1536, 1536, 1408, 512]
    - [69, 41.13]
  - - [2048, 4096, 1, 256, 2048, 2048, 256, 4096]
    - [79, 71.6]
  - - [1664, 4352, 1, 1536, 1664, 1664, 1536, 4352]
    - [25, 100.87]
  - - [2048, 4992, 1, 4864, 2048, 2048, 4864, 4992]
    - [45, 119.6]
  - - [2944, 4352, 1, 2560, 2944, 2944, 2560, 4352]
    - [38, 114.67]
  - - [4992, 768, 1, 3968, 4992, 4992, 3968, 768]
    - [4, 95.11]
  - - [4992, 1152, 1, 2688, 4992, 4992, 2688, 1152]
    - [95, 94.46]
  - - [4736, 2944, 1, 1408, 4736, 4736, 1408, 2944]
    - [43, 112.93]
  - - [896, 1152, 1, 2176, 896, 896, 2176, 1152]
    - [87, 63.13]
  - - [2304, 128, 1, 1792, 2304, 2304, 1792, 128]
    - [16, 23.3]
  - - [1920, 3328, 1, 896, 1920, 1920, 896, 3328]
    - [25, 93.15]
  - - [896, 2816, 1, 1024, 896, 896, 1024, 2816]
    - [84, 72.81]
  - - [4224, 2432, 1, 4992, 4224, 4224, 4992, 2432]
    - [44, 107.5]
  - - [1024, 3840, 1, 768, 1024, 1024, 768, 3840]
    - [76, 76.06]
  - - [4992, 2944, 1, 2560, 4992, 4992, 2560, 2944]
    - [36, 118.06]
  - - [1664, 2432, 1, 2432, 1664, 1664, 2432, 2432]
    - [76, 84.72]
  - - [4736, 1280, 1, 4608, 4736, 4736, 4608, 1280]
    - [24, 91.09]
  - - [4352, 2304, 1, 128, 4352, 4352, 128, 2304]
    - [45, 55.16]
  - - [3968, 1280, 1, 1536, 3968, 3968, 1536, 1280]
    - [26, 101.01]
  - - [1792, 1152, 1, 3456, 1792, 1792, 3456, 1152]
    - [27, 80.14]
  - - [2304, 1408, 1, 4736, 2304, 2304, 4736, 1408]
    - [52, 97.02]
  - - [768, 4224, 1, 3840, 768, 768, 3840, 4224]
    - [32, 91.19]
  - - [4736, 768, 1, 3456, 4736, 4736, 3456, 768]
    - [4, 91.65]
  - - [3328, 4352, 1, 2688, 3328, 3328, 2688, 4352]
    - [44, 126.45]
  - - [128, 1536, 1, 2304, 128, 128, 2304, 1536]
    - [16, 22.73]
  - - [1280, 4608, 1, 2048, 1280, 1280, 2048, 4608]
    - [24, 88.76]
  - - [2944, 3328, 1, 3584, 2944, 2944, 3584, 3328]
    - [32, 112.89]
  - - [4864, 768, 1, 4480, 4864, 4864, 4480, 768]
    - [4, 94.39]
  - - [3968, 4608, 1, 4736, 3968, 3968, 4736, 4608]
    - [28, 106.49]
  - - [2048, 4480, 1, 3328, 2048, 2048, 3328, 4480]
    - [39, 111.45]
  - - [256, 768, 1, 640, 256, 256, 640, 768]
    - [15, 10.47]
  - - [4096, 4736, 1, 3200, 4096, 4096, 3200, 4736]
    - [39, 116.9]
  - - [2944, 1152, 1, 1024, 2944, 2944, 1024, 1152]
    - [4, 80.58]
  - - [1920, 3456, 1, 3072, 1920, 1920, 3072, 3456]
    - [25, 101.71]
  - - [3584, 3584, 1, 1536, 3584, 3584, 1536, 3584]
    - [37, 116.18]
  - - [4992, 4224, 1, 4224, 4992, 4992, 4224, 4224]
    - [25, 105.17]
  - - [2048, 640, 1, 1408, 2048, 2048, 1408, 640]
    - [10, 57.26]
  - - [4864, 384, 1, 1024, 4864, 4864, 1024, 384]
    - [77, 56.23]
  - - [4864, 1408, 1, 384, 4864, 4864, 384, 1408]
    - [85, 70.55]
  - - [512, 4736, 1, 1024, 512, 512, 1024, 4736]
    - [84, 70.84]
  - - [2688, 1920, 1, 2304, 2688, 2688, 2304, 1920]
    - [58, 105.91]
  - - [1152, 512, 1, 4608, 1152, 1152, 4608, 512]
    - [27, 56.44]
  - - [2432, 2176, 1, 2816, 2432, 2432, 2816, 2176]
    - [24, 83.28]
  - - [4352, 512, 1, 3840, 4352, 4352, 3840, 512]
    - [39, 82.47]
  - - [4096, 4352, 1, 2048, 4096, 4096, 2048, 4352]
    - [30, 104.79]
  - - [2432, 1152, 1, 1792, 2432, 2432, 1792, 1152]
    - [84, 82.37]
  - - [512, 1920, 1, 640, 512, 512, 640, 1920]
    - [71, 36.62]
  - - [2688, 1792, 1, 4864, 2688, 2688, 4864, 1792]
    - [37, 110.15]
  - - [128, 768, 1, 1280, 128, 128, 1280, 768]
    - [14, 10.71]
  - - [2816, 1024, 1, 4864, 2816, 2816, 4864, 1024]
    - [24, 82.89]
  - - [1664, 1408, 1, 4224, 1664, 1664, 4224, 1408]
    - [26, 91.84]
  - - [4096, 4352, 1, 384, 4096, 4096, 384, 4352]
    - [50, 89.29]
  - - [3840, 4864, 1, 1920, 3840, 3840, 1920, 4864]
    - [40, 112.93]
  - - [2176, 4736, 1, 3840, 2176, 2176, 3840, 4736]
    - [58, 109.82]
  - - [768, 1408, 1, 2816, 768, 768, 2816, 1408]
    - [5, 65.83]
  - - [1408, 2048, 1, 2816, 1408, 1408, 2816, 2048]
    - [75, 85.55]
  - - [256, 3072, 1, 2560, 256, 256, 2560, 3072]
    - [10, 61.15]
  - - [2560, 4992, 1, 2560, 2560, 2560, 2560, 4992]
    - [44, 116.2]
  - - [2944, 2688, 1, 3200, 2944, 2944, 3200, 2688]
    - [85, 100.73]
  - - [4480, 3968, 1, 4864, 4480, 4480, 4864, 3968]
    - [28, 103.77]
  - - [3968, 3072, 1, 2176, 3968, 3968, 2176, 3072]
    - [38, 111.51]
  - - [1152, 4864, 1, 2944, 1152, 1152, 2944, 4864]
    - [24, 89.44]
  - - [4352, 1664, 1, 4480, 4352, 4352, 4480, 1664]
    - [33, 100.64]
  - - [128, 3712, 1, 4608, 128, 128, 4608, 3712]
    - [10, 56.41]
  - - [896, 2432, 1, 2944, 896, 896, 2944, 2432]
    - [56, 83.74]
  - - [640, 1280, 1, 2560, 640, 640, 2560, 1280]
    - [76, 53.78]
  - - [3328, 2432, 1, 128, 3328, 3328, 128, 2432]
    - [93, 49.03]
  - - [896, 512, 1, 3328, 896, 896, 3328, 512]
    - [10, 51.74]
  - - [4864, 1024, 1, 4608, 4864, 4864, 4608, 1024]
    - [40, 104.95]
  - - [3328, 3328, 1, 4736, 3328, 3328, 4736, 3328]
    - [38, 112.15]
  - - [1792, 1024, 1, 4096, 1792, 1792, 4096, 1024]
    - [76, 76.65]
  - - [384, 3072, 1, 2176, 384, 384, 2176, 3072]
    - [5, 62.66]
  - - [3328, 3456, 1, 4992, 3328, 3328, 4992, 3456]
    - [44, 114.11]
  - - [2432, 1792, 1, 4480, 2432, 2432, 4480, 1792]
    - [81, 89.19]
  - - [2560, 2432, 1, 4096, 2560, 2560, 4096, 2432]
    - [25, 97.08]
  - - [2816, 2560, 1, 2816, 2816, 2816, 2816, 2560]
    - [25, 105.95]
  - - [3200, 4608, 1, 4096, 3200, 3200, 4096, 4608]
    - [43, 121.68]
  - - [3072, 2176, 1, 4864, 3072, 3072, 4864, 2176]
    - [25, 103.82]
  - - [640, 1280, 1, 4864, 640, 640, 4864, 1280]
    - [76, 66.45]
  - - [1536, 2560, 1, 3840, 1536, 1536, 3840, 2560]
    - [76, 85.61]
  - - [896, 1920, 1, 2432, 896, 896, 2432, 1920]
    - [58, 78.86]
  - - [128, 4096, 1, 3328, 128, 128, 3328, 4096]
    - [18, 45.65]
  - - [1024, 256, 1, 1408, 1024, 1024, 1408, 256]
    - [15, 19.61]
  - - [2688, 1664, 1, 3712, 2688, 2688, 3712, 1664]
    - [5, 100.22]
  - - [2944, 3200, 1, 2688, 2944, 2944, 2688, 3200]
    - [40, 110.39]
  - - [1152, 1920, 1, 4224, 1152, 1152, 4224, 1920]
    - [5, 91.53]
  - - [1920, 3456, 1, 3968, 1920, 1920, 3968, 3456]
    - [25, 103.79]
  - - [4096, 2048, 1, 384, 4096, 4096, 384, 2048]
    - [93, 81.65]
  - - [3200, 512, 1, 4608, 3200, 3200, 4608, 512]
    - [40, 81.06]
  - - [2560, 768, 1, 1408, 2560, 2560, 1408, 768]
    - [76, 62.75]
  - - [896, 2432, 1, 1152, 896, 896, 1152, 2432]
    - [68, 64.33]
  - - [3072, 1536, 1, 4992, 3072, 3072, 4992, 1536]
    - [5, 105.58]
  - - [768, 2816, 1, 2816, 768, 768, 2816, 2816]
    - [5, 82.49]
  - - [1536, 128, 1, 4992, 1536, 1536, 4992, 128]
    - [91, 36.44]
  - - [640, 384, 1, 1152, 640, 640, 1152, 384]
    - [15, 17.85]
  - - [896, 256, 1, 4608, 896, 896, 4608, 256]
    - [10, 42.76]
  - - [2176, 896, 1, 4864, 2176, 2176, 4864, 896]
    - [27, 80.84]
  - - [128, 1920, 1, 1280, 128, 128, 1280, 1920]
    - [15, 22.39]
  - - [3328, 3456, 1, 4864, 3328, 3328, 4864, 3456]
    - [44, 113.8]
  - - [256, 1408, 1, 1408, 256, 256, 1408, 1408]
    - [16, 23.44]
  - - [2944, 4608, 1, 1536, 2944, 2944, 1536, 4608]
    - [37, 117.64]
  - - [4096, 1536, 1, 256, 4096, 4096, 256, 1536]
    - [95, 66.85]
  - - [4992, 3328, 1, 2688, 4992, 4992, 2688, 3328]
    - [78, 103.12]
  - - [4480, 2176, 1, 256, 4480, 4480, 256, 2176]
    - [49, 68.38]
  - - [512, 4096, 1, 4864, 512, 512, 4864, 4096]
    - [76, 81.2]
  - - [3456, 1280, 1, 4864, 3456, 3456, 4864, 1280]
    - [5, 99.42]
  - - [4608, 4224, 1, 3712, 4608, 4608, 3712, 4224]
    - [39, 115.39]
  - - [2944, 2560, 1, 3968, 2944, 2944, 3968, 2560]
    - [25, 108.43]
  - - [1408, 3456, 1, 768, 1408, 1408, 768, 3456]
    - [26, 90.41]
  - - [768, 4480, 1, 4352, 768, 768, 4352, 4480]
    - [49, 97.83]
  - - [3968, 3712, 1, 4352, 3968, 3968, 4352, 3712]
    - [43, 123.39]
  - - [1280, 1792, 1, 4480, 1280, 1280, 4480, 1792]
    - [58, 91.02]
  - - [1536, 1792, 1, 512, 1536, 1536, 512, 1792]
    - [84, 64.33]
  - - [4992, 3712, 1, 2048, 4992, 4992, 2048, 3712]
    - [39, 110.84]
  - - [768, 2304, 1, 512, 768, 768, 512, 2304]
    - [72, 49.15]
  - - [512, 1792, 1, 3712, 512, 512, 3712, 1792]
    - [76, 62.48]
  - - [1280, 2688, 1, 4096, 1280, 1280, 4096, 2688]
    - [45, 96.85]
  - - [4480, 1024, 1, 2304, 4480, 4480, 2304, 1024]
    - [26, 96.08]
  - - [4608, 4864, 1, 1664, 4608, 4608, 1664, 4864]
    - [25, 105.63]
  - - [3584, 2304, 1, 3200, 3584, 3584, 3200, 2304]
    - [85, 102.28]
  - - [1024, 4608, 1, 3712, 1024, 1024, 3712, 4608]
    - [26, 101.63]
  - - [2176, 4992, 1, 2176, 2176, 2176, 2176, 4992]
    - [37, 106.8]
  - - [128, 4480, 1, 3072, 128, 128, 3072, 4480]
    - [10, 51.03]
  - - [4864, 4224, 1, 768, 4864, 4864, 768, 4224]
    - [27, 81.5]
  - - [3712, 3200, 1, 1920, 3712, 3712, 1920, 3200]
    - [44, 111.23]
  - - [2048, 4864, 1, 4864, 2048, 2048, 4864, 4864]
    - [32, 115.92]
  - - [4608, 2816, 1, 3712, 4608, 4608, 3712, 2816]
    - [38, 116.76]
  - - [2944, 1280, 1, 1408, 2944, 2944, 1408, 1280]
    - [76, 78.92]
  - - [4096, 4864, 1, 3712, 4096, 4096, 3712, 4864]
    - [39, 117.85]
  - - [1152, 2048, 1, 640, 1152, 1152, 640, 2048]
    - [84, 62.03]
  - - [3072, 1792, 1, 2048, 3072, 3072, 2048, 1792]
    - [24, 86.28]
  - - [768, 1664, 1, 2176, 768, 768, 2176, 1664]
    - [10, 67.07]
  - - [640, 2304, 1, 4736, 640, 640, 4736, 2304]
    - [5, 81.06]
  - - [4352, 1792, 1, 4224, 4352, 4352, 4224, 1792]
    - [92, 101.03]
  - - [4864, 1024, 1, 1024, 4864, 4864, 1024, 1024]
    - [31, 76.68]
  - - [3328, 3072, 1, 640, 3328, 3328, 640, 3072]
    - [32, 99.89]
  - - [2304, 2560, 1, 2944, 2304, 2304, 2944, 2560]
    - [24, 91.65]
  - - [2816, 768, 1, 640, 2816, 2816, 640, 768]
    - [68, 55.98]
  - - [3712, 896, 1, 1408, 3712, 3712, 1408, 896]
    - [4, 78.97]
  - - [4480, 1792, 1, 2944, 4480, 4480, 2944, 1792]
    - [79, 104.54]
  - - [256, 384, 1, 2176, 256, 256, 2176, 384]
    - [15, 13.14]
  - - [2944, 2816, 1, 2176, 2944, 2944, 2176, 2816]
    - [86, 104.96]
  - - [4352, 4864, 1, 1408, 4352, 4352, 1408, 4864]
    - [25, 102.7]
  - - [4608, 2176, 1, 2176, 4608, 4608, 2176, 2176]
    - [52, 113.27]
  - - [2176, 3584, 1, 4352, 2176, 2176, 4352, 3584]
    - [78, 102.69]
  - - [768, 4608, 1, 2688, 768, 768, 2688, 4608]
    - [4, 89.95]
  - - [3200, 3200, 1, 640, 3200, 3200, 640, 3200]
    - [26, 92.15]
  - - [2816, 1664, 1, 2816, 2816, 2816, 2816, 1664]
    - [26, 99.84]
  - - [3456, 2944, 1, 2048, 3456, 3456, 2048, 2944]
    - [38, 101.05]
  - - [1408, 1280, 1, 2432, 1408, 1408, 2432, 1280]
    - [76, 69.85]
  - - [1536, 2304, 1, 2816, 1536, 1536, 2816, 2304]
    - [4, 90.52]
  - - [128, 2560, 1, 3328, 128, 128, 3328, 2560]
    - [10, 43.79]
  - - [1792, 2304, 1, 4736, 1792, 1792, 4736, 2304]
    - [27, 88.47]
  - - [2432, 3840, 1, 4224, 2432, 2432, 4224, 3840]
    - [28, 108.06]
  - - [4864, 4736, 1, 1920, 4864, 4864, 1920, 4736]
    - [25, 108.24]
  - - [768, 384, 1, 640, 768, 768, 640, 384]
    - [16, 13.25]
  - - [1664, 4224, 1, 512, 1664, 1664, 512, 4224]
    - [79, 77.72]
  - - [3456, 1792, 1, 4736, 3456, 3456, 4736, 1792]
    - [24, 92.88]
  - - [4864, 3072, 1, 4992, 4864, 4864, 4992, 3072]
    - [36, 122.89]
  - - [256, 4992, 1, 2432, 256, 256, 2432, 4992]
    - [10, 65.37]
  - - [896, 1536, 1, 3072, 896, 896, 3072, 1536]
    - [76, 72.35]
  - - [1536, 2688, 1, 4480, 1536, 1536, 4480, 2688]
    - [27, 88.96]
  - - [5120, 2688, 1, 1408, 5120, 5120, 1408, 2688]
    - [37, 116.63]
  - - [3072, 4864, 1, 4864, 3072, 3072, 4864, 4864]
    - [42, 123.58]
  - - [4864, 4480, 1, 2176, 4864, 4864, 2176, 4480]
    - [25, 106.67]
  - - [1664, 512, 1, 2944, 1664, 1664, 2944, 512]
    - [27, 54.16]
  - - [1536, 3584, 1, 2176, 1536, 1536, 2176, 3584]
    - [24, 87.48]
  - - [2432, 1280, 1, 4224, 2432, 2432, 4224, 1280]
    - [40, 95.02]
  - - [2304, 896, 1, 1024, 2304, 2304, 1024, 896]
    - [77, 61.94]
  - - [3456, 2816, 1, 640, 3456, 3456, 640, 2816]
    - [40, 100.43]
  - - [768, 2048, 1, 3840, 768, 768, 3840, 2048]
    - [73, 77.7]
  - - [2176, 256, 1, 3584, 2176, 2176, 3584, 256]
    - [76, 50.14]
  - - [2048, 128, 1, 3968, 2048, 2048, 3968, 128]
    - [77, 39.65]
  - - [3840, 2432, 1, 512, 3840, 3840, 512, 2432]
    - [45, 93.5]
  - - [1664, 768, 1, 2688, 1664, 1664, 2688, 768]
    - [27, 66.87]
  - - [4864, 1152, 1, 4352, 4864, 4864, 4352, 1152]
    - [24, 85.04]
  - - [1152, 2176, 1, 1024, 1152, 1152, 1024, 2176]
    - [87, 72.79]
  - - [2048, 4608, 1, 3200, 2048, 2048, 3200, 4608]
    - [32, 112.58]
  - - [4480, 2432, 1, 1408, 4480, 4480, 1408, 2432]
    - [44, 104.52]
  - - [384, 3584, 1, 1792, 384, 384, 1792, 3584]
    - [10, 65.5]
  - - [2560, 4992, 1, 512, 2560, 2560, 512, 4992]
    - [46, 98.66]
  - - [4352, 896, 1, 128, 4352, 4352, 128, 896]
    - [76, 33.27]
  - - [2944, 2560, 1, 4864, 2944, 2944, 4864, 2560]
    - [25, 111.32]
  - - [1408, 4224, 1, 3840, 1408, 1408, 3840, 4224]
    - [24, 91.09]
  - - [640, 4352, 1, 640, 640, 640, 640, 4352]
    - [84, 68.51]
  - - [1792, 2432, 1, 640, 1792, 1792, 640, 2432]
    - [5, 81.44]
  - - [1664, 3840, 1, 2688, 1664, 1664, 2688, 3840]
    - [25, 98.42]
  - - [384, 1920, 1, 2048, 384, 384, 2048, 1920]
    - [10, 56.26]
  - - [3968, 2688, 1, 3200, 3968, 3968, 3200, 2688]
    - [38, 105.57]
  - - [2304, 256, 1, 3968, 2304, 2304, 3968, 256]
    - [27, 53.97]
  - - [2560, 3584, 1, 640, 2560, 2560, 640, 3584]
    - [32, 99.6]
  - - [1280, 512, 1, 3840, 1280, 1280, 3840, 512]
    - [76, 56.3]
  - - [2304, 1920, 1, 384, 2304, 2304, 384, 1920]
    - [26, 71.93]
  - - [3456, 3712, 1, 3072, 3456, 3456, 3072, 3712]
    - [38, 114.96]
  - - [1280, 4480, 1, 1280, 1280, 1280, 1280, 4480]
    - [24, 83.57]
  - - [2176, 3328, 1, 4736, 2176, 2176, 4736, 3328]
    - [25, 105.67]
  - - [3968, 640, 1, 3584, 3968, 3968, 3584, 640]
    - [56, 94.29]
  - - [1280, 2560, 1, 4736, 1280, 1280, 4736, 2560]
    - [39, 97.85]
  - - [2048, 768, 1, 512, 2048, 2048, 512, 768]
    - [10, 47.32]
  - - [2048, 3456, 1, 3968, 2048, 2048, 3968, 3456]
    - [25, 105.14]
  - - [3712, 4352, 1, 768, 3712, 3712, 768, 4352]
    - [36, 112.06]
  - - [4736, 4992, 1, 4864, 4736, 4736, 4864, 4992]
    - [44, 116.41]
  - - [4608, 3584, 1, 256, 4608, 4608, 256, 3584]
    - [93, 73.48]
  - - [4864, 2432, 1, 3712, 4864, 4864, 3712, 2432]
    - [44, 113.0]
  - - [3584, 3840, 1, 3840, 3584, 3584, 3840, 3840]
    - [38, 126.32]
  - - [1280, 4864, 1, 1792, 1280, 1280, 1792, 4864]
    - [75, 88.27]
  - - [2816, 3840, 1, 4864, 2816, 2816, 4864, 3840]
    - [37, 110.98]
  - - [3840, 1280, 1, 128, 3840, 3840, 128, 1280]
    - [58, 41.82]
  - - [768, 2816, 1, 4224, 768, 768, 4224, 2816]
    - [5, 88.12]
  - - [4096, 512, 1, 1664, 4096, 4096, 1664, 512]
    - [76, 67.53]
  - - [4224, 896, 1, 2688, 4224, 4224, 2688, 896]
    - [27, 82.76]
  - - [1280, 4096, 1, 1408, 1280, 1280, 1408, 4096]
    - [31, 86.09]
  - - [4096, 384, 1, 2944, 4096, 4096, 2944, 384]
    - [10, 70.18]
  - - [1280, 1280, 1, 4608, 1280, 1280, 4608, 1280]
    - [26, 89.15]
  - - [4480, 4096, 1, 4608, 4480, 4480, 4608, 4096]
    - [28, 105.8]
  - - [2176, 4480, 1, 3200, 2176, 2176, 3200, 4480]
    - [40, 112.38]
  - - [1152, 3584, 1, 768, 1152, 1152, 768, 3584]
    - [76, 78.14]
  - - [3200, 640, 1, 1792, 3200, 3200, 1792, 640]
    - [76, 68.22]
  - - [2560, 1920, 1, 4480, 2560, 2560, 4480, 1920]
    - [56, 106.87]
  - - [640, 4352, 1, 1280, 640, 640, 1280, 4352]
    - [87, 77.84]
  - - [4224, 1152, 1, 1664, 4224, 4224, 1664, 1152]
    - [31, 80.17]
  - - [128, 1536, 1, 4864, 128, 128, 4864, 1536]
    - [10, 40.87]
  - - [2304, 2688, 1, 3968, 2304, 2304, 3968, 2688]
    - [48, 98.9]
  - - [3712, 1664, 1, 896, 3712, 3712, 896, 1664]
    - [25, 85.72]
  - - [4864, 768, 1, 2688, 4864, 4864, 2688, 768]
    - [4, 91.63]
  - - [4608, 4992, 1, 1792, 4608, 4608, 1792, 4992]
    - [25, 110.64]
  - - [3968, 128, 1, 384, 3968, 3968, 384, 128]
    - [9, 18.32]
  - - [1408, 3200, 1, 2944, 1408, 1408, 2944, 3200]
    - [5, 98.61]
  - - [4864, 3584, 1, 896, 4864, 4864, 896, 3584]
    - [40, 102.81]
  - - [4736, 2432, 1, 2560, 4736, 4736, 2560, 2432]
    - [44, 109.53]
  - - [4352, 1536, 1, 2944, 4352, 4352, 2944, 1536]
    - [25, 100.55]
  - - [2816, 4992, 1, 2688, 2816, 2816, 2688, 4992]
    - [53, 120.43]
  - - [2048, 4736, 1, 2048, 2048, 2048, 2048, 4736]
    - [32, 110.72]
  - - [3968, 512, 1, 3072, 3968, 3968, 3072, 512]
    - [27, 77.54]
  - - [512, 128, 1, 1408, 512, 512, 1408, 128]
    - [11, 7.66]
  - - [640, 128, 1, 3840, 640, 640, 3840, 128]
    - [15, 18.81]
  - - [1664, 1536, 1, 1664, 1664, 1664, 1664, 1536]
    - [84, 78.42]
  - - [3328, 1280, 1, 4608, 3328, 3328, 4608, 1280]
    - [5, 96.08]
  - - [3072, 3840, 1, 1664, 3072, 3072, 1664, 3840]
    - [38, 110.73]
  - - [3840, 3712, 1, 896, 3840, 3840, 896, 3712]
    - [46, 112.05]
  - - [384, 1152, 1, 1664, 384, 384, 1664, 1152]
    - [18, 30.68]
  - - [384, 2944, 1, 2688, 384, 384, 2688, 2944]
    - [5, 65.63]
  - - [640, 512, 1, 3200, 640, 640, 3200, 512]
    - [10, 41.51]
  - - [4736, 1920, 1, 384, 4736, 4736, 384, 1920]
    - [52, 82.9]
  - - [1152, 3712, 1, 2944, 1152, 1152, 2944, 3712]
    - [5, 97.13]
  - - [4096, 2304, 1, 1536, 4096, 4096, 1536, 2304]
    - [40, 107.85]
  - - [2304, 1280, 1, 2048, 2304, 2304, 2048, 1280]
    - [84, 84.45]
  - - [2176, 3584, 1, 3328, 2176, 2176, 3328, 3584]
    - [78, 102.47]
  - - [2944, 768, 1, 3328, 2944, 2944, 3328, 768]
    - [5, 85.27]
  - - [4352, 2816, 1, 4224, 4352, 4352, 4224, 2816]
    - [38, 115.5]
  - - [4608, 3072, 1, 640, 4608, 4608, 640, 3072]
    - [44, 107.54]
  - - [896, 3712, 1, 384, 896, 896, 384, 3712]
    - [76, 53.31]
  - - [128, 1792, 1, 2048, 128, 128, 2048, 1792]
    - [18, 25.37]
  - - [384, 4480, 1, 2048, 384, 384, 2048, 4480]
    - [76, 64.33]
  - - [640, 4608, 1, 2048, 640, 640, 2048, 4608]
    - [84, 84.29]
  - - [128, 4352, 1, 3584, 128, 128, 3584, 4352]
    - [76, 49.66]
  - - [3584, 4352, 1, 2048, 3584, 3584, 2048, 4352]
    - [36, 123.06]
  - - [3712, 3712, 1, 4352, 3712, 3712, 4352, 3712]
    - [38, 121.59]
  - - [4224, 1536, 1, 2048, 4224, 4224, 2048, 1536]
    - [38, 94.9]
  - - [1152, 4736, 1, 4736, 1152, 1152, 4736, 4736]
    - [24, 88.63]
  - - [4096, 2432, 1, 2560, 4096, 4096, 2560, 2432]
    - [52, 114.29]
  - - [3328, 3072, 1, 256, 3328, 3328, 256, 3072]
    - [32, 73.46]
  - - [1664, 1024, 1, 2560, 1664, 1664, 2560, 1024]
    - [76, 67.38]
  - - [2048, 4224, 1, 1664, 2048, 2048, 1664, 4224]
    - [32, 100.57]
  - - [1536, 4608, 1, 3072, 1536, 1536, 3072, 4608]
    - [25, 106.62]
  - - [3968, 1408, 1, 2176, 3968, 3968, 2176, 1408]
    - [24, 83.89]
  - - [1792, 3456, 1, 4992, 1792, 1792, 4992, 3456]
    - [38, 107.89]
  - - [3200, 2432, 1, 3712, 3200, 3200, 3712, 2432]
    - [93, 101.8]
  - - [2432, 3712, 1, 4480, 2432, 2432, 4480, 3712]
    - [28, 104.07]
  - - [3072, 4992, 1, 3072, 3072, 3072, 3072, 4992]
    - [43, 126.33]
  - - [4480, 4736, 1, 3584, 4480, 4480, 3584, 4736]
    - [25, 108.02]
  - - [2944, 3456, 1, 3840, 2944, 2944, 3840, 3456]
    - [58, 107.69]
  - - [512, 3200, 1, 128, 512, 512, 128, 3200]
    - [77, 22.07]
  - - [2304, 4480, 1, 3072, 2304, 2304, 3072, 4480]
    - [49, 118.03]
  - - [4736, 128, 1, 256, 4736, 4736, 256, 128]
    - [66, 15.29]
  - - [1536, 1792, 1, 128, 1536, 1536, 128, 1792]
    - [84, 31.36]
  - - [768, 4096, 1, 4736, 768, 768, 4736, 4096]
    - [24, 88.95]
  - - [1024, 4224, 1, 2304, 1024, 1024, 2304, 4224]
    - [5, 95.96]
  - - [4864, 3584, 1, 4096, 4864, 4864, 4096, 3584]
    - [29, 105.15]
  - - [1536, 3712, 1, 3456, 1536, 1536, 3456, 3712]
    - [24, 89.59]
  - - [4096, 2304, 1, 1408, 4096, 4096, 1408, 2304]
    - [39, 107.01]
  - - [3840, 1792, 1, 1920, 3840, 3840, 1920, 1792]
    - [25, 100.2]
  - - [1280, 3200, 1, 3328, 1280, 1280, 3328, 3200]
    - [27, 86.36]
  - - [768, 4224, 1, 4096, 768, 768, 4096, 4224]
    - [32, 90.43]
  - - [1152, 1664, 1, 3712, 1152, 1152, 3712, 1664]
    - [76, 77.75]
  - - [1152, 3328, 1, 1664, 1152, 1152, 1664, 3328]
    - [76, 82.46]
  - - [1024, 512, 1, 3968, 1024, 1024, 3968, 512]
    - [27, 48.95]
  - - [4352, 2816, 1, 128, 4352, 4352, 128, 2816]
    - [46, 55.17]
  - - [2432, 1792, 1, 768, 2432, 2432, 768, 1792]
    - [81, 77.48]
  - - [640, 1664, 1, 2048, 640, 640, 2048, 1664]
    - [5, 53.86]
  - - [1536, 2560, 1, 384, 1536, 1536, 384, 2560]
    - [76, 61.11]
  - - [4864, 2560, 1, 128, 4864, 4864, 128, 2560]
    - [46, 55.71]
  - - [2944, 4736, 1, 2816, 2944, 2944, 2816, 4736]
    - [42, 116.48]
  - - [4352, 2816, 1, 4864, 4352, 4352, 4864, 2816]
    - [38, 115.65]
  - - [512, 1664, 1, 1664, 512, 512, 1664, 1664]
    - [72, 48.75]
  - - [384, 1024, 1, 2048, 384, 384, 2048, 1024]
    - [18, 33.54]
  - - [512, 2304, 1, 1024, 512, 512, 1024, 2304]
    - [10, 52.84]
  - - [4608, 3328, 1, 4992, 4608, 4608, 4992, 3328]
    - [36, 123.98]
  - - [1152, 512, 1, 1536, 1152, 1152, 1536, 512]
    - [10, 39.93]
  - - [768, 256, 1, 4224, 768, 768, 4224, 256]
    - [10, 36.06]
  - - [384, 4864, 1, 2688, 384, 384, 2688, 4864]
    - [76, 71.53]
  - - [128, 1408, 1, 1152, 128, 128, 1152, 1408]
    - [15, 13.61]
  - - [2048, 2688, 1, 2048, 2048, 2048, 2048, 2688]
    - [24, 84.42]
  - - [512, 1792, 1, 1792, 512, 512, 1792, 1792]
    - [76, 45.62]
  - - [4352, 2176, 1, 3456, 4352, 4352, 3456, 2176]
    - [32, 107.73]
  - - [3456, 896, 1, 128, 3456, 3456, 128, 896]
    - [73, 31.63]
  - - [3712, 2304, 1, 768, 3712, 3712, 768, 2304]
    - [39, 96.36]
  - - [2560, 4096, 1, 1920, 2560, 2560, 1920, 4096]
    - [40, 116.73]
  - - [3200, 4992, 1, 2432, 3200, 3200, 2432, 4992]
    - [36, 125.46]
  - - [3840, 4864, 1, 1536, 3840, 3840, 1536, 4864]
    - [40, 111.08]
  - - [2560, 2560, 1, 1920, 2560, 2560, 1920, 2560]
    - [25, 97.46]
  - - [2176, 3072, 1, 256, 2176, 2176, 256, 3072]
    - [79, 60.36]
  - - [1152, 1920, 1, 3200, 1152, 1152, 3200, 1920]
    - [5, 87.06]
  - - [4480, 4352, 1, 128, 4480, 4480, 128, 4352]
    - [49, 54.45]
  - - [1792, 1024, 1, 2560, 1792, 1792, 2560, 1024]
    - [27, 71.52]
  - - [3456, 3072, 1, 3072, 3456, 3456, 3072, 3072]
    - [38, 106.43]
  - - [4480, 4608, 1, 2432, 4480, 4480, 2432, 4608]
    - [40, 118.55]
  - - [4736, 384, 1, 2944, 4736, 4736, 2944, 384]
    - [27, 71.58]
  - - [384, 1024, 1, 1024, 384, 384, 1024, 1024]
    - [18, 25.21]
  - - [4352, 4864, 1, 1920, 4352, 4352, 1920, 4864]
    - [25, 101.88]
  - - [4224, 4864, 1, 2816, 4224, 4224, 2816, 4864]
    - [26, 109.45]
  - - [1792, 1408, 1, 4224, 1792, 1792, 4224, 1408]
    - [56, 95.77]
  - - [3968, 1280, 1, 896, 3968, 3968, 896, 1280]
    - [58, 92.96]
  - - [128, 1792, 1, 2944, 128, 128, 2944, 1792]
    - [18, 30.05]
  - - [3712, 3200, 1, 3712, 3712, 3712, 3712, 3200]
    - [38, 111.98]
  - - [3584, 4224, 1, 1664, 3584, 3584, 1664, 4224]
    - [36, 118.5]
  - - [896, 3968, 1, 3712, 896, 896, 3712, 3968]
    - [4, 90.43]
  - - [3200, 4224, 1, 3200, 3200, 3200, 3200, 4224]
    - [38, 118.42]
  - - [3456, 3200, 1, 1024, 3456, 3456, 1024, 3200]
    - [37, 100.67]
  - - [512, 3200, 1, 1408, 512, 512, 1408, 3200]
    - [27, 55.08]
  - - [4352, 2816, 1, 2048, 4352, 4352, 2048, 2816]
    - [38, 111.24]
  - - [4736, 128, 1, 1024, 4736, 4736, 1024, 128]
    - [97, 29.38]
  - - [768, 4352, 1, 128, 768, 768, 128, 4352]
    - [27, 30.94]
  - - [4352, 384, 1, 4352, 4352, 4352, 4352, 384]
    - [27, 71.78]
  - - [4096, 1664, 1, 512, 4096, 4096, 512, 1664]
    - [93, 75.53]
  - - [4864, 3840, 1, 2048, 4864, 4864, 2048, 3840]
    - [28, 103.87]
  - - [384, 1152, 1, 2816, 384, 384, 2816, 1152]
    - [10, 48.23]
  - - [4736, 4992, 1, 4224, 4736, 4736, 4224, 4992]
    - [44, 116.26]
  - - [1536, 1152, 1, 4352, 1536, 1536, 4352, 1152]
    - [76, 75.56]
  - - [128, 2432, 1, 1664, 128, 128, 1664, 2432]
    - [16, 22.54]
  - - [2944, 384, 1, 4992, 2944, 2944, 4992, 384]
    - [5, 75.89]
  - - [1152, 2560, 1, 768, 1152, 1152, 768, 2560]
    - [87, 74.27]
  - - [2432, 3840, 1, 4480, 2432, 2432, 4480, 3840]
    - [28, 107.69]
  - - [512, 1536, 1, 4352, 512, 512, 4352, 1536]
    - [10, 70.05]
  - - [1920, 3584, 1, 2688, 1920, 1920, 2688, 3584]
    - [25, 103.25]
  - - [3968, 384, 1, 3200, 3968, 3968, 3200, 384]
    - [10, 69.74]
  - - [2048, 4224, 1, 4864, 2048, 2048, 4864, 4224]
    - [30, 101.1]
  - - [2560, 4224, 1, 768, 2560, 2560, 768, 4224]
    - [44, 94.72]
  - - [3072, 4736, 1, 2944, 3072, 3072, 2944, 4736]
    - [43, 122.77]
  - - [640, 3584, 1, 768, 640, 640, 768, 3584]
    - [84, 64.04]
  - - [2944, 1280, 1, 1536, 2944, 2944, 1536, 1280]
    - [76, 79.59]
  - - [2048, 4864, 1, 256, 2048, 2048, 256, 4864]
    - [49, 77.53]
  - - [4992, 2688, 1, 2816, 4992, 4992, 2816, 2688]
    - [38, 115.99]
  - - [2304, 4992, 1, 1408, 2304, 2304, 1408, 4992]
    - [37, 105.86]
  - - [3584, 2944, 1, 2048, 3584, 3584, 2048, 2944]
    - [38, 105.97]
  - - [2048, 256, 1, 2944, 2048, 2048, 2944, 256]
    - [91, 50.75]
  - - [4096, 3968, 1, 3328, 4096, 4096, 3328, 3968]
    - [78, 101.65]
  - - [1152, 2432, 1, 4992, 1152, 1152, 4992, 2432]
    - [24, 82.96]
  - - [512, 512, 1, 3840, 512, 512, 3840, 512]
    - [10, 42.13]
  - - [1536, 5120, 1, 4224, 1536, 1536, 4224, 5120]
    - [25, 113.5]
  - - [2688, 4480, 1, 256, 2688, 2688, 256, 4480]
    - [53, 66.43]
  - - [384, 128, 1, 4352, 384, 384, 4352, 128]
    - [15, 14.38]
  - - [896, 4480, 1, 1792, 896, 896, 1792, 4480]
    - [76, 84.86]
  - - [3072, 3328, 1, 2816, 3072, 3072, 2816, 3328]
    - [45, 116.26]
  - - [3328, 3840, 1, 4480, 3328, 3328, 4480, 3840]
    - [38, 120.44]
  - - [2432, 1280, 1, 1664, 2432, 2432, 1664, 1280]
    - [4, 78.56]
  - - [1024, 3968, 1, 1408, 1024, 1024, 1408, 3968]
    - [76, 83.98]
  - - [1152, 2816, 1, 4096, 1152, 1152, 4096, 2816]
    - [4, 86.07]
  - - [4608, 2944, 1, 1408, 4608, 4608, 1408, 2944]
    - [38, 111.41]
  - - [1920, 384, 1, 4608, 1920, 1920, 4608, 384]
    - [10, 63.2]
  - - [1792, 1152, 1, 4224, 1792, 1792, 4224, 1152]
    - [27, 82.05]
  - - [4736, 2048, 1, 1152, 4736, 4736, 1152, 2048]
    - [40, 107.66]
  - - [384, 1536, 1, 4864, 384, 384, 4864, 1536]
    - [76, 58.99]
  - - [1664, 640, 1, 3200, 1664, 1664, 3200, 640]
    - [56, 70.83]
  - - [2944, 2176, 1, 384, 2944, 2944, 384, 2176]
    - [93, 61.82]
  - - [2432, 3584, 1, 128, 2432, 2432, 128, 3584]
    - [23, 56.19]
  - - [4352, 384, 1, 128, 4352, 4352, 128, 384]
    - [77, 20.79]
  - - [3072, 256, 1, 1152, 3072, 3072, 1152, 256]
    - [69, 37.92]
  - - [1152, 4736, 1, 3328, 1152, 1152, 3328, 4736]
    - [24, 88.02]
  - - [1664, 1408, 1, 3840, 1664, 1664, 3840, 1408]
    - [26, 90.74]
  - - [3584, 2304, 1, 256, 3584, 3584, 256, 2304]
    - [78, 70.41]
  - - [3840, 4992, 1, 4864, 3840, 3840, 4864, 4992]
    - [39, 116.31]
  - - [2816, 2176, 1, 1792, 2816, 2816, 1792, 2176]
    - [84, 87.65]
  - - [4608, 1536, 1, 3200, 4608, 4608, 3200, 1536]
    - [25, 102.54]
  - - [1536, 3712, 1, 4992, 1536, 1536, 4992, 3712]
    - [24, 90.95]
  - - [1024, 2816, 1, 3968, 1024, 1024, 3968, 2816]
    - [75, 87.42]
  - - [1408, 1024, 1, 2944, 1408, 1408, 2944, 1024]
    - [10, 71.31]
  - - [640, 4608, 1, 3968, 640, 640, 3968, 4608]
    - [84, 88.25]
  - - [512, 2560, 1, 2816, 512, 512, 2816, 2560]
    - [56, 76.78]
  - - [3968, 3968, 1, 4224, 3968, 3968, 4224, 3968]
    - [86, 102.16]
  - - [4352, 3840, 1, 4096, 4352, 4352, 4096, 3840]
    - [36, 133.27]
  - - [4736, 2432, 1, 1536, 4736, 4736, 1536, 2432]
    - [38, 103.85]
  - - [2560, 2176, 1, 4864, 2560, 2560, 4864, 2176]
    - [24, 87.32]
  - - [1280, 1536, 1, 3200, 1280, 1280, 3200, 1536]
    - [76, 77.45]
  - - [256, 3200, 1, 4608, 256, 256, 4608, 3200]
    - [76, 64.69]
  - - [256, 3840, 1, 4864, 256, 256, 4864, 3840]
    - [76, 69.62]
  - - [2176, 4736, 1, 4864, 2176, 2176, 4864, 4736]
    - [58, 110.64]
  - - [4608, 4224, 1, 128, 4608, 4608, 128, 4224]
    - [52, 58.55]
  - - [4096, 3456, 1, 3584, 4096, 4096, 3584, 3456]
    - [53, 121.88]
  - - [512, 4096, 1, 1152, 512, 512, 1152, 4096]
    - [72, 65.97]
  - - [2048, 3328, 1, 1792, 2048, 2048, 1792, 3328]
    - [25, 96.47]
  - - [512, 2432, 1, 1792, 512, 512, 1792, 2432]
    - [10, 63.06]
  - - [2048, 1280, 1, 2432, 2048, 2048, 2432, 1280]
    - [58, 90.11]
  - - [4224, 3968, 1, 384, 4224, 4224, 384, 3968]
    - [76, 69.78]
  - - [2816, 3456, 1, 4224, 2816, 2816, 4224, 3456]
    - [32, 112.51]
  - - [1792, 1024, 1, 3072, 1792, 1792, 3072, 1024]
    - [76, 73.74]
  - - [2176, 4096, 1, 128, 2176, 2176, 128, 4096]
    - [23, 56.31]
  - - [1152, 1024, 1, 3712, 1152, 1152, 3712, 1024]
    - [58, 74.82]
  - - [3712, 4864, 1, 3328, 3712, 3712, 3328, 4864]
    - [29, 106.95]
  - - [1536, 2816, 1, 3200, 1536, 1536, 3200, 2816]
    - [5, 98.58]
  - - [384, 4864, 1, 4736, 384, 384, 4736, 4864]
    - [76, 76.68]
  - - [4480, 3456, 1, 2944, 4480, 4480, 2944, 3456]
    - [36, 123.81]
  - - [4736, 3456, 1, 1664, 4736, 4736, 1664, 3456]
    - [36, 124.49]
  - - [4224, 4608, 1, 3712, 4224, 4224, 3712, 4608]
    - [39, 116.06]
  - - [3712, 1024, 1, 4608, 3712, 3712, 4608, 1024]
    - [76, 81.89]
  - - [4992, 1920, 1, 4992, 4992, 4992, 4992, 1920]
    - [32, 109.42]
  - - [768, 3840, 1, 2816, 768, 768, 2816, 3840]
    - [84, 86.8]
  - - [3840, 3456, 1, 1408, 3840, 3840, 1408, 3456]
    - [37, 113.73]
  - - [4480, 2176, 1, 2176, 4480, 4480, 2176, 2176]
    - [32, 109.24]
  - - [3712, 1920, 1, 896, 3712, 3712, 896, 1920]
    - [25, 96.75]
  - - [3456, 1408, 1, 3072, 3456, 3456, 3072, 1408]
    - [26, 103.35]
  - - [2688, 128, 1, 4224, 2688, 2688, 4224, 128]
    - [77, 46.17]
  - - [4096, 256, 1, 3200, 4096, 4096, 3200, 256]
    - [27, 63.88]
  - - [2048, 128, 1, 1664, 2048, 2048, 1664, 128]
    - [15, 21.75]
  - - [4992, 1152, 1, 4736, 4992, 4992, 4736, 1152]
    - [95, 95.73]
  - - [2944, 1024, 1, 4992, 2944, 2944, 4992, 1024]
    - [24, 85.17]
  - - [1664, 384, 1, 512, 1664, 1664, 512, 384]
    - [66, 23.06]
  - - [4096, 2816, 1, 4864, 4096, 4096, 4864, 2816]
    - [38, 112.46]
  - - [4736, 3968, 1, 256, 4736, 4736, 256, 3968]
    - [49, 75.53]
  - - [4480, 2432, 1, 768, 4480, 4480, 768, 2432]
    - [44, 99.44]
  - - [256, 2816, 1, 2048, 256, 256, 2048, 2816]
    - [10, 54.89]
  - - [1408, 2816, 1, 1792, 1408, 1408, 1792, 2816]
    - [27, 84.55]
  - - [3584, 3712, 1, 1408, 3584, 3584, 1408, 3712]
    - [37, 116.98]
  - - [2688, 4736, 1, 4864, 2688, 2688, 4864, 4736]
    - [44, 121.35]
  - - [2048, 2304, 1, 2304, 2048, 2048, 2304, 2304]
    - [26, 99.15]
  - - [4864, 4736, 1, 4352, 4864, 4864, 4352, 4736]
    - [25, 112.17]
  - - [512, 4352, 1, 3072, 512, 512, 3072, 4352]
    - [56, 83.72]
  - - [1280, 3200, 1, 2944, 1280, 1280, 2944, 3200]
    - [27, 86.47]
  - - [4096, 384, 1, 896, 4096, 4096, 896, 384]
    - [10, 57.13]
  - - [3456, 2304, 1, 1024, 3456, 3456, 1024, 2304]
    - [79, 97.21]
  - - [256, 2816, 1, 4736, 256, 256, 4736, 2816]
    - [10, 64.47]
  - - [3200, 2048, 1, 384, 3200, 3200, 384, 2048]
    - [78, 68.64]
  - - [2432, 3072, 1, 2944, 2432, 2432, 2944, 3072]
    - [33, 105.19]
  - - [3200, 1152, 1, 1280, 3200, 3200, 1280, 1152]
    - [4, 85.53]
  - - [4352, 4480, 1, 4480, 4352, 4352, 4480, 4480]
    - [39, 115.59]
  - - [2688, 1024, 1, 2560, 2688, 2688, 2560, 1024]
    - [84, 83.09]
  - - [2688, 3584, 1, 2560, 2688, 2688, 2560, 3584]
    - [32, 112.6]
  - - [3328, 3584, 1, 2688, 3328, 3328, 2688, 3584]
    - [38, 112.46]
  - - [128, 3840, 1, 4992, 128, 128, 4992, 3840]
    - [10, 58.37]
  - - [4864, 2304, 1, 1408, 4864, 4864, 1408, 2304]
    - [38, 103.8]
  - - [4224, 3584, 1, 3968, 4224, 4224, 3968, 3584]
    - [36, 122.02]
  - - [2048, 128, 1, 896, 2048, 2048, 896, 128]
    - [15, 15.72]
  - - [2688, 5120, 1, 2048, 2688, 2688, 2048, 5120]
    - [37, 123.89]
  - - [4864, 1408, 1, 2304, 4864, 4864, 2304, 1408]
    - [25, 97.91]
  - - [3072, 1408, 1, 3968, 3072, 3072, 3968, 1408]
    - [5, 96.25]
  - - [4736, 896, 1, 2944, 4736, 4736, 2944, 896]
    - [5, 92.91]
  - - [1920, 384, 1, 3840, 1920, 1920, 3840, 384]
    - [10, 60.62]
  - - [512, 1920, 1, 3200, 512, 512, 3200, 1920]
    - [84, 69.79]
  - - [4096, 2816, 1, 3584, 4096, 4096, 3584, 2816]
    - [38, 109.8]
  - - [4864, 4992, 1, 1536, 4864, 4864, 1536, 4992]
    - [44, 114.8]
  - - [1792, 2048, 1, 4224, 1792, 1792, 4224, 2048]
    - [44, 102.32]
  - - [1152, 256, 1, 1152, 1152, 1152, 1152, 256]
    - [71, 20.64]
  - - [640, 768, 1, 2944, 640, 640, 2944, 768]
    - [10, 53.16]
  - - [3968, 2560, 1, 3328, 3968, 3968, 3328, 2560]
    - [39, 119.11]
  - - [4864, 4352, 1, 2944, 4864, 4864, 2944, 4352]
    - [25, 107.06]
  - - [640, 2944, 1, 3584, 640, 640, 3584, 2944]
    - [76, 76.26]
  - - [3968, 512, 1, 4096, 3968, 3968, 4096, 512]
    - [76, 76.02]
  - - [4608, 2944, 1, 3840, 4608, 4608, 3840, 2944]
    - [38, 119.16]
  - - [3840, 3328, 1, 4608, 3840, 3840, 4608, 3328]
    - [38, 117.41]
  - - [3456, 4352, 1, 2176, 3456, 3456, 2176, 4352]
    - [43, 123.71]
  - - [4736, 128, 1, 1536, 4736, 4736, 1536, 128]
    - [77, 39.57]
  - - [3328, 768, 1, 4736, 3328, 3328, 4736, 768]
    - [32, 92.74]
  - - [4480, 3200, 1, 2816, 4480, 4480, 2816, 3200]
    - [43, 121.21]
  - - [1280, 1152, 1, 3200, 1280, 1280, 3200, 1152]
    - [10, 73.29]
  - - [3200, 4096, 1, 384, 3200, 3200, 384, 4096]
    - [46, 83.06]
  - - [2560, 1792, 1, 2688, 2560, 2560, 2688, 1792]
    - [58, 97.14]
  - - [4864, 1408, 1, 640, 4864, 4864, 640, 1408]
    - [25, 86.17]
  - - [3072, 768, 1, 3968, 3072, 3072, 3968, 768]
    - [5, 91.35]
  - - [3200, 3072, 1, 4608, 3200, 3200, 4608, 3072]
    - [39, 119.21]
  - - [4736, 3072, 1, 4736, 4736, 4736, 4736, 3072]
    - [42, 120.79]
  - - [3328, 2816, 1, 1536, 3328, 3328, 1536, 2816]
    - [39, 107.34]
  - - [768, 1792, 1, 2048, 768, 768, 2048, 1792]
    - [10, 69.0]
  - - [4352, 2432, 1, 2944, 4352, 4352, 2944, 2432]
    - [37, 106.35]
  - - [1792, 4864, 1, 128, 1792, 1792, 128, 4864]
    - [23, 55.73]
  - - [2304, 384, 1, 3456, 2304, 2304, 3456, 384]
    - [5, 65.2]
  - - [1280, 3200, 1, 512, 1280, 1280, 512, 3200]
    - [27, 69.98]
  - - [2432, 1152, 1, 4992, 2432, 2432, 4992, 1152]
    - [84, 87.79]
  - - [2688, 4864, 1, 1024, 2688, 2688, 1024, 4864]
    - [38, 112.89]
  - - [1408, 512, 1, 1408, 1408, 1408, 1408, 512]
    - [97, 40.42]
  - - [3200, 1408, 1, 4352, 3200, 3200, 4352, 1408]
    - [81, 90.21]
  - - [1536, 1664, 1, 3200, 1536, 1536, 3200, 1664]
    - [84, 80.81]
  - - [3584, 3072, 1, 1536, 3584, 3584, 1536, 3072]
    - [37, 109.54]
  - - [2816, 4480, 1, 4736, 2816, 2816, 4736, 4480]
    - [38, 117.47]
  - - [3968, 3840, 1, 4864, 3968, 3968, 4864, 3840]
    - [43, 127.77]
  - - [3200, 4736, 1, 2304, 3200, 3200, 2304, 4736]
    - [42, 119.72]
  - - [256, 3200, 1, 2048, 256, 256, 2048, 3200]
    - [82, 49.89]
  - - [2944, 2944, 1, 896, 2944, 2944, 896, 2944]
    - [32, 97.19]
  - - [3328, 1664, 1, 640, 3328, 3328, 640, 1664]
    - [24, 73.08]
  - - [4608, 3840, 1, 3328, 4608, 4608, 3328, 3840]
    - [28, 102.94]
  - - [1152, 2944, 1, 3456, 1152, 1152, 3456, 2944]
    - [4, 87.55]
  - - [1280, 1664, 1, 1664, 1280, 1280, 1664, 1664]
    - [5, 70.73]
  - - [2048, 3456, 1, 1152, 2048, 2048, 1152, 3456]
    - [25, 97.66]
  - - [1152, 384, 1, 4224, 1152, 1152, 4224, 384]
    - [10, 55.56]
  - - [3584, 3072, 1, 3584, 3584, 3584, 3584, 3072]
    - [37, 112.56]
  - - [1920, 3456, 1, 3200, 1920, 1920, 3200, 3456]
    - [25, 103.49]
  - - [1152, 768, 1, 512, 1152, 1152, 512, 768]
    - [71, 29.66]
  - - [2432, 4096, 1, 4352, 2432, 2432, 4352, 4096]
    - [32, 114.77]
  - - [2304, 4608, 1, 1408, 2304, 2304, 1408, 4608]
    - [37, 102.55]
  - - [2304, 2560, 1, 640, 2304, 2304, 640, 2560]
    - [24, 80.51]
  - - [3840, 1664, 1, 384, 3840, 3840, 384, 1664]
    - [85, 66.5]
  - - [4224, 3840, 1, 2944, 4224, 4224, 2944, 3840]
    - [36, 127.85]
  - - [3584, 2304, 1, 3584, 3584, 3584, 3584, 2304]
    - [85, 102.22]
  - - [1280, 1152, 1, 640, 1280, 1280, 640, 1152]
    - [10, 51.85]
  - - [1920, 3712, 1, 2048, 1920, 1920, 2048, 3712]
    - [25, 104.88]
  - - [4864, 2304, 1, 3840, 4864, 4864, 3840, 2304]
    - [38, 108.55]
  - - [2944, 4864, 1, 1152, 2944, 2944, 1152, 4864]
    - [42, 111.46]
  - - [2688, 4992, 1, 128, 2688, 2688, 128, 4992]
    - [46, 47.32]
  - - [1408, 2432, 1, 1664, 1408, 1408, 1664, 2432]
    - [4, 83.6]
  - - [4608, 2944, 1, 3712, 4608, 4608, 3712, 2944]
    - [38, 118.57]
  - - [896, 2560, 1, 3456, 896, 896, 3456, 2560]
    - [56, 89.44]
  - - [3072, 896, 1, 1664, 3072, 3072, 1664, 896]
    - [87, 78.65]
  - - [2304, 640, 1, 512, 2304, 2304, 512, 640]
    - [10, 44.2]
  - - [1920, 256, 1, 768, 1920, 1920, 768, 256]
    - [18, 22.33]
  - - [4992, 3584, 1, 3584, 4992, 4992, 3584, 3584]
    - [28, 102.92]
  - - [4992, 2304, 1, 3200, 4992, 4992, 3200, 2304]
    - [44, 111.2]
  - - [2176, 128, 1, 640, 2176, 2176, 640, 128]
    - [16, 12.56]
  - - [2944, 512, 1, 2048, 2944, 2944, 2048, 512]
    - [73, 65.66]
  - - [2560, 896, 1, 3712, 2560, 2560, 3712, 896]
    - [56, 88.06]
  - - [2944, 4352, 1, 4992, 2944, 2944, 4992, 4352]
    - [38, 117.67]
  - - [2688, 2176, 1, 3072, 2688, 2688, 3072, 2176]
    - [24, 88.85]
  - - [3968, 3328, 1, 4864, 3968, 3968, 4864, 3328]
    - [38, 120.16]
  - - [384, 3456, 1, 4224, 384, 384, 4224, 3456]
    - [76, 73.94]
  - - [1536, 1536, 1, 4224, 1536, 1536, 4224, 1536]
    - [5, 94.49]
  - - [4224, 2688, 1, 3712, 4224, 4224, 3712, 2688]
    - [38, 109.0]
  - - [256, 1792, 1, 1664, 256, 256, 1664, 1792]
    - [18, 32.29]
  - - [1792, 4352, 1, 2176, 1792, 1792, 2176, 4352]
    - [93, 100.53]
  - - [640, 4992, 1, 640, 640, 640, 640, 4992]
    - [27, 60.72]
  - - [4096, 4224, 1, 2816, 4096, 4096, 2816, 4224]
    - [30, 102.61]
  - - [768, 2688, 1, 3840, 768, 768, 3840, 2688]
    - [76, 79.87]
  - - [3200, 1024, 1, 3328, 3200, 3200, 3328, 1024]
    - [40, 94.47]
  - - [2176, 1536, 1, 4608, 2176, 2176, 4608, 1536]
    - [39, 97.92]
  - - [4224, 3200, 1, 128, 4224, 4224, 128, 3200]
    - [46, 48.04]
  - - [2048, 3712, 1, 4608, 2048, 2048, 4608, 3712]
    - [92, 100.95]
  - - [128, 640, 1, 1792, 128, 128, 1792, 640]
    - [15, 9.78]
  - - [1792, 768, 1, 128, 1792, 1792, 128, 768]
    - [97, 18.96]
  - - [3328, 3968, 1, 1664, 3328, 3328, 1664, 3968]
    - [37, 116.85]
  - - [4352, 3200, 1, 1024, 4352, 4352, 1024, 3200]
    - [47, 112.44]
  - - [4096, 3712, 1, 1408, 4096, 4096, 1408, 3712]
    - [36, 116.78]
  - - [3200, 1024, 1, 1792, 3200, 3200, 1792, 1024]
    - [4, 79.5]
  - - [3968, 2432, 1, 4992, 3968, 3968, 4992, 2432]
    - [32, 111.31]
  - - [3968, 3584, 1, 3200, 3968, 3968, 3200, 3584]
    - [37, 124.76]
  - - [4992, 896, 1, 4864, 4992, 4992, 4864, 896]
    - [32, 92.04]
  - - [2944, 4608, 1, 4992, 2944, 2944, 4992, 4608]
    - [38, 121.8]
  - - [3712, 3584, 1, 3200, 3712, 3712, 3200, 3584]
    - [38, 118.46]
  - - [1280, 1536, 1, 2176, 1280, 1280, 2176, 1536]
    - [27, 71.67]
  - - [1664, 4480, 1, 512, 1664, 1664, 512, 4480]
    - [78, 82.22]
  - - [3328, 512, 1, 3584, 3328, 3328, 3584, 512]
    - [27, 71.63]
  - - [1408, 4352, 1, 3712, 1408, 1408, 3712, 4352]
    - [24, 91.59]
  - - [128, 768, 1, 2048, 128, 128, 2048, 768]
    - [15, 13.49]
  - - [4864, 896, 1, 4736, 4864, 4864, 4736, 896]
    - [5, 96.83]
  - - [2432, 4352, 1, 384, 2432, 2432, 384, 4352]
    - [53, 71.93]
  - - [2176, 1792, 1, 4992, 2176, 2176, 4992, 1792]
    - [27, 86.28]
  - - [3584, 2432, 1, 3584, 3584, 3584, 3584, 2432]
    - [30, 101.07]
  - - [768, 1792, 1, 4480, 768, 768, 4480, 1792]
    - [76, 76.45]
  - - [3712, 3712, 1, 1280, 3712, 3712, 1280, 3712]
    - [38, 112.56]
  - - [256, 256, 1, 2560, 256, 256, 2560, 256]
    - [14, 11.8]
  - - [256, 1280, 1, 3328, 256, 256, 3328, 1280]
    - [10, 44.14]
  - - [1408, 4736, 1, 3200, 1408, 1408, 3200, 4736]
    - [25, 101.75]
  - - [3840, 4736, 1, 1024, 3840, 3840, 1024, 4736]
    - [40, 107.1]
  - - [2432, 2560, 1, 1792, 2432, 2432, 1792, 2560]
    - [25, 95.32]
  - - [4224, 1792, 1, 128, 4224, 4224, 128, 1792]
    - [78, 47.95]
  - - [3328, 256, 1, 4992, 3328, 3328, 4992, 256]
    - [27, 63.74]
  - - [2304, 2432, 1, 3712, 2304, 2304, 3712, 2432]
    - [24, 88.0]
  - - [4992, 768, 1, 2432, 4992, 4992, 2432, 768]
    - [4, 92.37]
  - - [3968, 2688, 1, 3072, 3968, 3968, 3072, 2688]
    - [38, 103.97]
  - - [1792, 3968, 1, 640, 1792, 1792, 640, 3968]
    - [25, 90.73]
  - - [4480, 1152, 1, 3840, 4480, 4480, 3840, 1152]
    - [31, 87.51]
  - - [2176, 4992, 1, 3328, 2176, 2176, 3328, 4992]
    - [37, 108.71]
  - - [4096, 2816, 1, 1280, 4096, 4096, 1280, 2816]
    - [38, 105.3]
  - - [3968, 2688, 1, 4864, 3968, 3968, 4864, 2688]
    - [38, 106.44]
  - - [896, 2304, 1, 3584, 896, 896, 3584, 2304]
    - [27, 80.0]
  - - [3456, 896, 1, 2944, 3456, 3456, 2944, 896]
    - [73, 82.92]
  - - [1920, 2944, 1, 2304, 1920, 1920, 2304, 2944]
    - [24, 88.04]
  - - [4736, 2688, 1, 1408, 4736, 4736, 1408, 2688]
    - [37, 109.84]
  - - [640, 256, 1, 128, 640, 640, 128, 256]
    - [80, 3.39]
  - - [2432, 2176, 1, 1024, 2432, 2432, 1024, 2176]
    - [24, 76.53]
  - - [256, 896, 1, 384, 256, 256, 384, 896]
    - [80, 9.96]
  - - [2176, 4736, 1, 4352, 2176, 2176, 4352, 4736]
    - [58, 110.16]
  - - [3456, 3584, 1, 640, 3456, 3456, 640, 3584]
    - [38, 98.27]
  - - [4992, 2688, 1, 384, 4992, 4992, 384, 2688]
    - [46, 84.88]
  - - [2176, 4224, 1, 4864, 2176, 2176, 4864, 4224]
    - [39, 110.79]
  - - [640, 1920, 1, 1536, 640, 640, 1536, 1920]
    - [10, 60.54]
  - - [3456, 4224, 1, 2688, 3456, 3456, 2688, 4224]
    - [43, 121.64]
  - - [3072, 4864, 1, 3072, 3072, 3072, 3072, 4864]
    - [43, 124.47]
  - - [4992, 4352, 1, 3456, 4992, 4992, 3456, 4352]
    - [25, 109.82]
  - - [4608, 640, 1, 1280, 4608, 4608, 1280, 640]
    - [87, 79.11]
  - - [1408, 384, 1, 1536, 1408, 1408, 1536, 384]
    - [10, 35.74]
  - - [3584, 896, 1, 1152, 3584, 3584, 1152, 896]
    - [4, 75.7]
  - - [1280, 3712, 1, 3328, 1280, 1280, 3328, 3712]
    - [26, 101.28]
  - - [1408, 1792, 1, 2816, 1408, 1408, 2816, 1792]
    - [39, 80.61]
  - - [3072, 3200, 1, 3840, 3072, 3072, 3840, 3200]
    - [45, 114.47]
  - - [3200, 4096, 1, 1408, 3200, 3200, 1408, 4096]
    - [37, 115.7]
  - - [4224, 640, 1, 1280, 4224, 4224, 1280, 640]
    - [84, 74.89]
  - - [4736, 1536, 1, 4480, 4736, 4736, 4480, 1536]
    - [25, 107.05]
  - - [4736, 1024, 1, 128, 4736, 4736, 128, 1024]
    - [95, 37.58]
  - - [1152, 1536, 1, 2432, 1152, 1152, 2432, 1536]
    - [27, 68.72]
  - - [4096, 4992, 1, 384, 4096, 4096, 384, 4992]
    - [45, 92.22]
  - - [3584, 2176, 1, 640, 3584, 3584, 640, 2176]
    - [93, 88.4]
  - - [3968, 128, 1, 3584, 3968, 3968, 3584, 128]
    - [77, 48.87]
  - - [3712, 4864, 1, 4352, 3712, 3712, 4352, 4864]
    - [29, 107.19]
  - - [2816, 896, 1, 2432, 2816, 2816, 2432, 896]
    - [87, 77.83]
  - - [3456, 512, 1, 2432, 3456, 3456, 2432, 512]
    - [76, 67.3]
  - - [1280, 3584, 1, 512, 1280, 1280, 512, 3584]
    - [26, 80.33]
  - - [1664, 1024, 1, 2688, 1664, 1664, 2688, 1024]
    - [76, 68.27]
  - - [3328, 768, 1, 1408, 3328, 3328, 1408, 768]
    - [87, 76.3]
  - - [4480, 640, 1, 512, 4480, 4480, 512, 640]
    - [84, 65.35]
  - - [2816, 3584, 1, 1280, 2816, 2816, 1280, 3584]
    - [39, 108.58]
  - - [2048, 4992, 1, 3840, 2048, 2048, 3840, 4992]
    - [45, 118.35]
  - - [128, 1024, 1, 1536, 128, 128, 1536, 1024]
    - [15, 14.99]
  - - [4736, 1024, 1, 2048, 4736, 4736, 2048, 1024]
    - [40, 92.45]
  - - [1152, 1664, 1, 1792, 1152, 1152, 1792, 1664]
    - [27, 67.2]
  - - [2432, 2432, 1, 3328, 2432, 2432, 3328, 2432]
    - [94, 95.7]
  - - [128, 2048, 1, 896, 128, 128, 896, 2048]
    - [15, 17.06]
  - - [2688, 2432, 1, 1536, 2688, 2688, 1536, 2432]
    - [25, 96.58]
  - - [3968, 1280, 1, 3456, 3968, 3968, 3456, 1280]
    - [26, 107.24]
  - - [384, 2944, 1, 3328, 384, 384, 3328, 2944]
    - [5, 70.97]
  - - [4864, 640, 1, 1792, 4864, 4864, 1792, 640]
    - [73, 78.94]
  - - [4736, 256, 1, 3840, 4736, 4736, 3840, 256]
    - [27, 68.07]
  - - [1280, 1920, 1, 1024, 1280, 1280, 1024, 1920]
    - [75, 73.14]
  - - [3968, 896, 1, 1408, 3968, 3968, 1408, 896]
    - [4, 81.71]
  - - [1664, 2304, 1, 2432, 1664, 1664, 2432, 2304]
    - [4, 93.39]
  - - [2304, 512, 1, 4608, 2304, 2304, 4608, 512]
    - [27, 71.1]
  - - [1024, 1664, 1, 1152, 1024, 1024, 1152, 1664]
    - [76, 52.38]
  - - [1920, 512, 1, 3712, 1920, 1920, 3712, 512]
    - [27, 65.56]
  - - [4608, 384, 1, 2816, 4608, 4608, 2816, 384]
    - [27, 69.88]
  - - [1664, 3584, 1, 2432, 1664, 1664, 2432, 3584]
    - [24, 90.31]
  - - [2304, 3456, 1, 2560, 2304, 2304, 2560, 3456]
    - [93, 102.59]
  - - [1280, 1920, 1, 2048, 1280, 1280, 2048, 1920]
    - [26, 83.62]
  - - [1152, 2176, 1, 4864, 1152, 1152, 4864, 2176]
    - [58, 97.24]
  - - [2944, 256, 1, 1664, 2944, 2944, 1664, 256]
    - [69, 43.61]
  - - [640, 640, 1, 768, 640, 640, 768, 640]
    - [18, 22.28]
  - - [4096, 2304, 1, 512, 4096, 4096, 512, 2304]
    - [52, 94.52]
  - - [128, 1792, 1, 4096, 128, 128, 4096, 1792]
    - [18, 36.5]
  - - [4096, 768, 1, 4480, 4096, 4096, 4480, 768]
    - [75, 88.2]
  - - [128, 3840, 1, 384, 128, 128, 384, 3840]
    - [9, 17.97]
  - - [3200, 1920, 1, 2816, 3200, 3200, 2816, 1920]
    - [48, 96.33]
  - - [2816, 2304, 1, 896, 2816, 2816, 896, 2304]
    - [25, 89.78]
  - - [2432, 1536, 1, 1280, 2432, 2432, 1280, 1536]
    - [4, 85.43]
  - - [3328, 1152, 1, 3200, 3328, 3328, 3200, 1152]
    - [4, 94.38]
  - - [512, 256, 1, 1536, 512, 512, 1536, 256]
    - [15, 14.6]
  - - [4224, 3200, 1, 1536, 4224, 4224, 1536, 3200]
    - [37, 116.02]
  - - [3712, 3072, 1, 1536, 3712, 3712, 1536, 3072]
    - [38, 106.79]
  - - [1408, 1792, 1, 3584, 1408, 1408, 3584, 1792]
    - [40, 87.56]
  - - [2816, 256, 1, 1664, 2816, 2816, 1664, 256]
    - [69, 42.25]
  - - [4224, 1792, 1, 1792, 4224, 4224, 1792, 1792]
    - [78, 96.56]
  - - [4992, 3712, 1, 2176, 4992, 4992, 2176, 3712]
    - [39, 111.17]
  - - [384, 2560, 1, 256, 384, 384, 256, 2560]
    - [71, 23.84]
  - - [1920, 640, 1, 4352, 1920, 1920, 4352, 640]
    - [26, 82.93]
  - - [3328, 1408, 1, 2688, 3328, 3328, 2688, 1408]
    - [26, 100.18]
  - - [4352, 3840, 1, 3712, 4352, 4352, 3712, 3840]
    - [36, 132.48]
  - - [128, 1280, 1, 3456, 128, 128, 3456, 1280]
    - [10, 26.25]
  - - [4224, 2176, 1, 256, 4224, 4224, 256, 2176]
    - [52, 66.51]
  - - [1024, 2560, 1, 3840, 1024, 1024, 3840, 2560]
    - [26, 97.57]
  - - [1408, 1152, 1, 1152, 1408, 1408, 1152, 1152]
    - [76, 49.58]
  - - [4480, 3456, 1, 256, 4480, 4480, 256, 3456]
    - [33, 76.85]
  - - [896, 128, 1, 1408, 896, 896, 1408, 128]
    - [34, 10.36]
  - - [640, 2304, 1, 1664, 640, 640, 1664, 2304]
    - [10, 68.32]
  - - [2688, 1024, 1, 2176, 2688, 2688, 2176, 1024]
    - [75, 79.99]
  - - [4608, 2560, 1, 2816, 4608, 4608, 2816, 2560]
    - [37, 114.45]
  - - [4352, 1024, 1, 1920, 4352, 4352, 1920, 1024]
    - [81, 83.87]
  - - [2432, 3584, 1, 2944, 2432, 2432, 2944, 3584]
    - [30, 104.4]
  - - [3200, 4736, 1, 4352, 3200, 3200, 4352, 4736]
    - [42, 125.34]
  - - [2048, 896, 1, 1408, 2048, 2048, 1408, 896]
    - [76, 59.77]
  - - [4224, 1024, 1, 2304, 4224, 4224, 2304, 1024]
    - [81, 84.21]
  - - [4224, 1280, 1, 2560, 4224, 4224, 2560, 1280]
    - [24, 86.03]
  - - [3840, 3968, 1, 2176, 3840, 3840, 2176, 3968]
    - [36, 121.67]
  - - [4608, 1920, 1, 4224, 4608, 4608, 4224, 1920]
    - [28, 101.34]
  - - [3840, 1920, 1, 1664, 3840, 3840, 1664, 1920]
    - [25, 103.89]
  - - [4864, 2944, 1, 3968, 4864, 4864, 3968, 2944]
    - [36, 117.35]
  - - [1920, 2816, 1, 128, 1920, 1920, 128, 2816]
    - [48, 41.95]
  - - [1152, 2816, 1, 3072, 1152, 1152, 3072, 2816]
    - [4, 84.74]
  - - [4096, 2944, 1, 1280, 4096, 4096, 1280, 2944]
    - [37, 108.76]
  - - [4608, 2816, 1, 2560, 4608, 4608, 2560, 2816]
    - [38, 114.72]
  - - [1024, 1920, 1, 2176, 1024, 1024, 2176, 1920]
    - [76, 71.95]
  - - [1024, 4992, 1, 4096, 1024, 1024, 4096, 4992]
    - [58, 109.28]
  - - [3200, 3328, 1, 128, 3200, 3200, 128, 3328]
    - [46, 41.22]
  - - [896, 3968, 1, 2304, 896, 896, 2304, 3968]
    - [4, 87.44]
  - - [2176, 3968, 1, 2304, 2176, 2176, 2304, 3968]
    - [29, 100.91]
  - - [1024, 1664, 1, 256, 1024, 1024, 256, 1664]
    - [77, 33.89]
  - - [4352, 2048, 1, 640, 4352, 4352, 640, 2048]
    - [39, 96.21]
  - - [3328, 1792, 1, 3968, 3328, 3328, 3968, 1792]
    - [24, 90.14]
  - - [2688, 1792, 1, 4096, 2688, 2688, 4096, 1792]
    - [58, 102.05]
  - - [3072, 2176, 1, 2304, 3072, 3072, 2304, 2176]
    - [25, 100.44]
  - - [3456, 4352, 1, 4736, 3456, 3456, 4736, 4352]
    - [43, 126.77]
  - - [4096, 3584, 1, 4608, 4096, 4096, 4608, 3584]
    - [53, 126.82]
  - - [3072, 256, 1, 1536, 3072, 3072, 1536, 256]
    - [73, 43.9]
  - - [2944, 1152, 1, 2432, 2944, 2944, 2432, 1152]
    - [4, 87.52]
  - - [2304, 4224, 1, 4352, 2304, 2304, 4352, 4224]
    - [32, 112.32]
  - - [3968, 2688, 1, 2304, 3968, 3968, 2304, 2688]
    - [44, 105.72]
  - - [3200, 1792, 1, 2944, 3200, 3200, 2944, 1792]
    - [24, 88.26]
  - - [1664, 4736, 1, 3840, 1664, 1664, 3840, 4736]
    - [86, 102.64]
  - - [1408, 4608, 1, 3712, 1408, 1408, 3712, 4608]
    - [25, 99.95]
  - - [4864, 4224, 1, 256, 4864, 4864, 256, 4224]
    - [27, 62.95]
  - - [3200, 3200, 1, 3456, 3200, 3200, 3456, 3200]
    - [58, 107.97]
  - - [4608, 1536, 1, 1280, 4608, 4608, 1280, 1536]
    - [25, 97.64]
  - - [4096, 4224, 1, 4864, 4096, 4096, 4864, 4224]
    - [28, 101.19]
  - - [3840, 2560, 1, 2688, 3840, 3840, 2688, 2560]
    - [39, 116.37]
  - - [4864, 3328, 1, 1920, 4864, 4864, 1920, 3328]
    - [85, 99.61]
  - - [768, 256, 1, 3968, 768, 768, 3968, 256]
    - [10, 33.97]
  - - [4224, 3840, 1, 3328, 4224, 4224, 3328, 3840]
    - [36, 128.9]
  - - [256, 3328, 1, 1280, 256, 256, 1280, 3328]
    - [72, 43.24]
  - - [1152, 2304, 1, 2816, 1152, 1152, 2816, 2304]
    - [75, 83.37]
  - - [1792, 3072, 1, 2688, 1792, 1792, 2688, 3072]
    - [24, 86.94]
  - - [768, 3712, 1, 2432, 768, 768, 2432, 3712]
    - [75, 84.31]
  - - [3328, 3840, 1, 4352, 3328, 3328, 4352, 3840]
    - [38, 120.06]
  - - [1408, 640, 1, 1664, 1408, 1408, 1664, 640]
    - [91, 49.69]
  - - [1152, 2304, 1, 4608, 1152, 1152, 4608, 2304]
    - [79, 90.38]
  - - [768, 3712, 1, 4096, 768, 768, 4096, 3712]
    - [24, 82.02]
  - - [3584, 4480, 1, 4736, 3584, 3584, 4736, 4480]
    - [36, 130.11]
  - - [256, 1792, 1, 2688, 256, 256, 2688, 1792]
    - [10, 50.29]
  - - [640, 384, 1, 4096, 640, 640, 4096, 384]
    - [18, 37.26]
  - - [384, 4352, 1, 1536, 384, 384, 1536, 4352]
    - [76, 57.74]
  - - [1920, 256, 1, 2560, 1920, 1920, 2560, 256]
    - [72, 46.69]
  - - [1152, 4608, 1, 3840, 1152, 1152, 3840, 4608]
    - [24, 87.11]
  - - [256, 2176, 1, 3200, 256, 256, 3200, 2176]
    - [75, 56.31]
  - - [4352, 4864, 1, 256, 4352, 4352, 256, 4864]
    - [78, 68.61]
  - - [4224, 4736, 1, 3584, 4224, 4224, 3584, 4736]
    - [52, 116.5]
  - - [1152, 4992, 1, 1408, 1152, 1152, 1408, 4992]
    - [24, 86.69]
  - - [3328, 3584, 1, 1280, 3328, 3328, 1280, 3584]
    - [38, 108.76]
  - - [3456, 2560, 1, 2560, 3456, 3456, 2560, 2560]
    - [30, 104.53]
  - - [3200, 1408, 1, 2048, 3200, 3200, 2048, 1408]
    - [81, 86.19]
  - - [768, 2688, 1, 2432, 768, 768, 2432, 2688]
    - [76, 75.47]
  - - [4864, 2944, 1, 4608, 4864, 4864, 4608, 2944]
    - [36, 120.82]
  - - [2432, 4864, 1, 4736, 2432, 2432, 4736, 4864]
    - [44, 116.08]
  - - [4992, 3456, 1, 384, 4992, 4992, 384, 3456]
    - [50, 85.22]
  - - [4352, 4992, 1, 384, 4352, 4352, 384, 4992]
    - [79, 78.2]
  - - [4352, 1920, 1, 3072, 4352, 4352, 3072, 1920]
    - [93, 106.88]
  - - [4224, 768, 1, 2304, 4224, 4224, 2304, 768]
    - [4, 84.74]
  - - [3712, 3328, 1, 4096, 3712, 3712, 4096, 3328]
    - [44, 118.18]
  - - [4992, 3712, 1, 1664, 4992, 4992, 1664, 3712]
    - [39, 109.04]
  - - [1152, 3968, 1, 128, 1152, 1152, 128, 3968]
    - [26, 40.26]
  - - [1280, 4480, 1, 4096, 1280, 1280, 4096, 4480]
    - [24, 89.21]
  - - [4736, 3072, 1, 3584, 4736, 4736, 3584, 3072]
    - [42, 119.82]
  - - [2048, 2816, 1, 1408, 2048, 2048, 1408, 2816]
    - [24, 85.41]
  - - [384, 4352, 1, 1664, 384, 384, 1664, 4352]
    - [76, 59.15]
  - - [384, 4224, 1, 384, 384, 384, 384, 4224]
    - [72, 40.52]
  - - [2816, 384, 1, 256, 2816, 2816, 256, 384]
    - [10, 23.56]
  - - [2176, 2560, 1, 1024, 2176, 2176, 1024, 2560]
    - [24, 80.65]
  - - [3328, 3584, 1, 1792, 3328, 3328, 1792, 3584]
    - [38, 112.11]
  - - [3712, 4608, 1, 3200, 3712, 3712, 3200, 4608]
    - [28, 102.98]
  - - [256, 1920, 1, 384, 256, 256, 384, 1920]
    - [70, 18.18]
  - - [3072, 1408, 1, 1024, 3072, 3072, 1024, 1408]
    - [5, 86.57]
  - - [128, 4352, 1, 512, 128, 128, 512, 4352]
    - [66, 20.9]
  - - [3840, 640, 1, 1152, 3840, 3840, 1152, 640]
    - [84, 72.78]
  - - [640, 1792, 1, 1280, 640, 640, 1280, 1792]
    - [10, 54.75]
  - - [2944, 3712, 1, 1792, 2944, 2944, 1792, 3712]
    - [38, 105.05]
  - - [1024, 2944, 1, 1536, 1024, 1024, 1536, 2944]
    - [84, 83.96]
  - - [2944, 1920, 1, 2176, 2944, 2944, 2176, 1920]
    - [24, 85.34]
  - - [1408, 1280, 1, 3328, 1408, 1408, 3328, 1280]
    - [76, 74.0]
  - - [384, 2048, 1, 2432, 384, 384, 2432, 2048]
    - [73, 55.9]
  - - [640, 2304, 1, 128, 640, 640, 128, 2304]
    - [97, 21.28]
  - - [4864, 2560, 1, 4608, 4864, 4864, 4608, 2560]
    - [38, 117.4]
  - - [3456, 3328, 1, 3328, 3456, 3456, 3328, 3328]
    - [38, 110.38]
