projects/hipblaslt/library/src/amd_detail/rocblaslt/src/Tensile/Logic/asm_full/gfx1201/StreamK/gfx1201_Cijk_Alik_Bljk_HHS_BH_Bias_HA_S_SAV_UserArgs.yaml
- {MinimumRequiredVersion: 4.33.0}
- gfx1201
- gfx1201
- [Device 73f0]
    SolutionIndex: 0
    SolutionNameMin: Cijk_Alik_Bljk_HHS_BH_Bias_HA_S_SAV_UserArgs_MT128x128x32_MI16x16x1_SN_LDSB0_AFC1_AFEM1_AFEM1_ASEM1_CLR1_CADS0_DTVA1_DTVB0_EPS0_FDSI0_GRPM1_GRVWA8_GRVWB8_GSU0_GSUAMB_GSUC0_GSUWGMRR0_GLS0_ISA1201_IU1_K1_LBSPPA0_LBSPPB128_LBSPPM0_LPA0_LPB16_LPM0_LRVW8_LWPMn1_MIAV1_MIWT2_8_MO40_NTn1_NTA0_NTB0_NTC0_NTD0_NTM0_NEPBS0_NLCA2_NLCB1_ONLL1_PGR2_PLR1_PKA0_SIA3_SS0_SU32_SUM0_SUS256_SPO0_SRVW0_SSO0_SVW8_SK3_SKXCCM0_TLDS1_ULSGRO0_USL1_UIOFGRO0_USFGROn1_VSn1_VWA1_VWB1_WSGRA0_WSGRB0_WS32_WG64_2_1_WGM8_WGMXCC1_WGMXCCGn1
    SolutionIndex: 1
    SolutionNameMin: Cijk_Alik_Bljk_HHS_BH_Bias_HA_S_SAV_UserArgs_MT128x128x32_MI16x16x1_SN_LDSB0_AFC1_AFEM1_AFEM1_ASEM1_CLR1_CADS0_DTVA1_DTVB0_EPS0_FDSI0_GRPM1_GRVWA8_GRVWB8_GSU0_GSUAMB_GSUC0_GSUWGMRR0_GLS0_ISA1201_IU1_K1_LBSPPA0_LBSPPB128_LBSPPM0_LPA0_LPB16_LPM0_LRVW8_LWPMn1_MIAV1_MIWT2_8_MO40_NTn1_NTA0_NTB0_NTC0_NTD0_NTM0_NEPBS0_NLCA2_NLCB1_ONLL1_PGR2_PLR1_PKA0_SIA3_SS0_SU32_SUM0_SUS256_SPO0_SRVW0_SSO0_SVW8_SK3_SKXCCM0_TLDS1_ULSGRO0_USL1_UIOFGRO0_USFGRO0_VSn1_VWA1_VWB1_WSGRA0_WSGRB0_WS32_WG64_2_1_WGM8_WGMXCC1_WGMXCCGn1
    SolutionIndex: 2
    SolutionNameMin: Cijk_Alik_Bljk_HHS_BH_Bias_HA_S_SAV_UserArgs_MT128x112x32_MI16x16x1_SN_LDSB0_AFC1_AFEM1_AFEM1_ASEM1_CLR1_CADS0_DTVA1_DTVB0_EPS0_FDSI0_GRPM1_GRVWA8_GRVWB4_GSU0_GSUAMB_GSUC0_GSUWGMRR0_GLS0_ISA1201_IU1_K1_LBSPPA0_LBSPPB128_LBSPPM0_LPA0_LPB16_LPM0_LRVW8_LWPMn1_MIAV1_MIWT2_7_MO40_NTn1_NTA0_NTB0_NTC0_NTD0_NTM0_NEPBS0_NLCA2_NLCB1_ONLL1_PGR2_PLR1_PKA0_SIA3_SS0_SU32_SUM0_SUS256_SPO0_SRVW0_SSO0_SVW8_SK3_SKXCCM0_TLDS1_ULSGRO0_USL1_UIOFGRO0_USFGRO0_VSn1_VWA1_VWB1_WSGRA0_WSGRB0_WS32_WG64_2_1_WGM8_WGMXCC1_WGMXCCGn1
    SolutionIndex: 3
    SolutionNameMin: Cijk_Alik_Bljk_HHS_BH_Bias_HA_S_SAV_UserArgs_MT128x16x32_MI16x16x1_SN_LDSB0_AFC1_AFEM1_AFEM1_ASEM1_CLR1_CADS0_DTVA0_DTVB0_EPS0_FDSI0_GRPM1_GRVWA8_GRVWB4_GSU0_GSUAMB_GSUC0_GSUWGMRR0_GLS0_ISA1201_IU1_K1_LBSPPA128_LBSPPB128_LBSPPM0_LPA16_LPB16_LPM0_LRVW8_LWPMn1_MIAV1_MIWT2_1_MO40_NTn1_NTA0_NTB0_NTC0_NTD0_NTM0_NEPBS0_NLCA1_NLCB1_ONLL1_PGR2_PLR1_PKA0_SIA3_SS0_SU32_SUM0_SUS256_SPO0_SRVW0_SSO0_SVW8_SK3_SKXCCM0_TLDS1_ULSGRO0_USL1_UIOFGRO0_USFGROn1_VSn1_VWA1_VWB1_WSGRA0_WSGRB0_WS32_WG64_2_1_WGM8_WGMXCC1_WGMXCCGn1
    SolutionIndex: 4
    SolutionNameMin: Cijk_Alik_Bljk_HHS_BH_Bias_HA_S_SAV_UserArgs_MT128x16x32_MI16x16x1_SN_LDSB0_AFC1_AFEM1_AFEM1_ASEM1_CLR1_CADS0_DTVA0_DTVB0_EPS0_FDSI0_GRPM1_GRVWA8_GRVWB4_GSU0_GSUAMB_GSUC0_GSUWGMRR0_GLS0_ISA1201_IU1_K1_LBSPPA128_LBSPPB128_LBSPPM0_LPA16_LPB16_LPM0_LRVW8_LWPMn1_MIAV1_MIWT2_1_MO40_NTn1_NTA0_NTB0_NTC0_NTD0_NTM0_NEPBS0_NLCA1_NLCB1_ONLL1_PGR2_PLR1_PKA0_SIA3_SS0_SU32_SUM0_SUS256_SPO0_SRVW0_SSO0_SVW8_SK3_SKXCCM0_TLDS1_ULSGRO0_USL1_UIOFGRO0_USFGRO0_VSn1_VWA1_VWB1_WSGRA0_WSGRB0_WS32_WG64_2_1_WGM8_WGMXCC1_WGMXCCGn1
    SolutionIndex: 5
    SolutionNameMin: Cijk_Alik_Bljk_HHS_BH_Bias_HA_S_SAV_UserArgs_MT192x80x32_MI16x16x1_SN_LDSB0_AFC1_AFEM1_AFEM1_ASEM1_CLR1_CADS0_DTVA1_DTVB0_EPS0_FDSI0_GRPM1_GRVWA8_GRVWB4_GSU0_GSUAMB_GSUC0_GSUWGMRR0_GLS0_ISA1201_IU1_K1_LBSPPA0_LBSPPB128_LBSPPM0_LPA0_LPB16_LPM0_LRVW8_LWPMn1_MIAV1_MIWT3_5_MO40_NTn1_NTA0_NTB0_NTC0_NTD0_NTM0_NEPBS0_NLCA2_NLCB1_ONLL1_PGR2_PLR1_PKA0_SIA3_SS0_SU32_SUM0_SUS256_SPO0_SRVW0_SSO0_SVW8_SK3_SKXCCM0_TLDS1_ULSGRO0_USL1_UIOFGRO0_USFGRO0_VSn1_VWA1_VWB1_WSGRA0_WSGRB0_WS32_WG64_2_1_WGM8_WGMXCC1_WGMXCCGn1
    SolutionIndex: 6
    SolutionNameMin: Cijk_Alik_Bljk_HHS_BH_Bias_HA_S_SAV_UserArgs_MT256x64x32_MI16x16x1_SN_LDSB1_AFC1_AFEM1_AFEM1_ASEM1_CLR1_CADS0_DTVA0_DTVB0_EPS0_FDSI0_GRPM1_GRVWA8_GRVWB8_GSU0_GSUAMB_GSUC0_GSUWGMRR0_GLS0_ISA1201_IU1_K1_LBSPPA128_LBSPPB128_LBSPPM0_LPA16_LPB16_LPM0_LRVW8_LWPMn1_MIAV1_MIWT4_4_MO40_NTn1_NTA0_NTB0_NTC0_NTD0_NTM0_NEPBS0_NLCA1_NLCB1_ONLL1_PGR2_PLR1_PKA0_SIA3_SS0_SU32_SUM0_SUS256_SPO0_SRVW0_SSO0_SVW8_SK3_SKXCCM0_TLDS1_ULSGRO0_USL1_UIOFGRO0_USFGROn1_VSn1_VWA1_VWB1_WSGRA0_WSGRB0_WS32_WG64_2_1_WGM8_WGMXCC1_WGMXCCGn1
    SolutionIndex: 7
    SolutionNameMin: Cijk_Alik_Bljk_HHS_BH_Bias_HA_S_SAV_UserArgs_MT64x256x32_MI16x16x1_SN_LDSB0_AFC1_AFEM1_AFEM1_ASEM1_CLR1_CADS0_DTVA0_DTVB1_EPS0_FDSI0_GRPM1_GRVWA8_GRVWB8_GSU0_GSUAMB_GSUC0_GSUWGMRR0_GLS0_ISA1201_IU1_K1_LBSPPA128_LBSPPB0_LBSPPM0_LPA16_LPB0_LPM0_LRVW8_LWPMn1_MIAV1_MIWT4_4_MO40_NTn1_NTA0_NTB0_NTC0_NTD0_NTM0_NEPBS0_NLCA1_NLCB2_ONLL1_PGR2_PLR1_PKA0_SIA3_SS0_SU32_SUM0_SUS256_SPO0_SRVW0_SSO0_SVW8_SK3_SKXCCM0_TLDS1_ULSGRO0_USL1_UIOFGRO0_USFGRO0_VSn1_VWA1_VWB1_WSGRA0_WSGRB0_WS32_WG16_8_1_WGM8_WGMXCC1_WGMXCCGn1
    SolutionIndex: 8
    SolutionNameMin: Cijk_Alik_Bljk_HHS_BH_Bias_HA_S_SAV_UserArgs_MT80x192x32_MI16x16x1_SN_LDSB1_AFC1_AFEM1_AFEM1_ASEM1_CLR1_CADS0_DTVA0_DTVB0_EPS0_FDSI0_GRPM1_GRVWA4_GRVWB8_GSU0_GSUAMB_GSUC0_GSUWGMRR0_GLS0_ISA1201_IU1_K1_LBSPPA128_LBSPPB128_LBSPPM0_LPA16_LPB16_LPM0_LRVW8_LWPMn1_MIAV1_MIWT5_3_MO40_NTn1_NTA0_NTB0_NTC0_NTD0_NTM0_NEPBS0_NLCA1_NLCB1_ONLL1_PGR2_PLR1_PKA0_SIA3_SS0_SU32_SUM0_SUS256_SPO0_SRVW0_SSO0_SVW8_SK3_SKXCCM0_TLDS1_ULSGRO0_USL1_UIOFGRO0_USFGRO0_VSn1_VWA1_VWB1_WSGRA0_WSGRB0_WS32_WG16_8_1_WGM8_WGMXCC1_WGMXCCGn1
    SolutionIndex: 9
    SolutionNameMin: Cijk_Alik_Bljk_HHS_BH_Bias_HA_S_SAV_UserArgs_MT80x192x32_MI16x16x1_SN_LDSB0_AFC1_AFEM1_AFEM1_ASEM1_CLR1_CADS0_DTVA0_DTVB1_EPS0_FDSI0_GRPM1_GRVWA4_GRVWB8_GSU0_GSUAMB_GSUC0_GSUWGMRR0_GLS0_ISA1201_IU1_K1_LBSPPA128_LBSPPB0_LBSPPM0_LPA16_LPB0_LPM0_LRVW8_LWPMn1_MIAV1_MIWT5_3_MO40_NTn1_NTA0_NTB0_NTC0_NTD0_NTM0_NEPBS0_NLCA1_NLCB2_ONLL1_PGR2_PLR1_PKA0_SIA3_SS0_SU32_SUM0_SUS256_SPO0_SRVW0_SSO0_SVW8_SK3_SKXCCM0_TLDS1_ULSGRO0_USL1_UIOFGRO0_USFGRO0_VSn1_VWA1_VWB1_WSGRA0_WSGRB0_WS32_WG16_8_1_WGM8_WGMXCC1_WGMXCCGn1
    SolutionIndex: 10
    SolutionNameMin: Cijk_Alik_Bljk_HHS_BH_Bias_HA_S_SAV_UserArgs_MT80x128x32_MI16x16x1_SN_LDSB1_AFC1_AFEM1_AFEM1_ASEM1_CLR1_CADS0_DTVA0_DTVB0_EPS0_FDSI0_GRPM1_GRVWA4_GRVWB8_GSU0_GSUAMB_GSUC0_GSUWGMRR0_GLS0_ISA1201_IU1_K1_LBSPPA128_LBSPPB128_LBSPPM0_LPA16_LPB16_LPM0_LRVW8_LWPMn1_MIAV1_MIWT5_2_MO40_NTn1_NTA0_NTB0_NTC0_NTD0_NTM0_NEPBS0_NLCA1_NLCB1_ONLL1_PGR2_PLR1_PKA0_SIA3_SS0_SU32_SUM0_SUS256_SPO0_SRVW0_SSO0_SVW8_SK3_SKXCCM0_TLDS1_ULSGRO0_USL1_UIOFGRO0_USFGROn1_VSn1_VWA1_VWB1_WSGRA0_WSGRB0_WS32_WG16_8_1_WGM8_WGMXCC1_WGMXCCGn1
    SolutionIndex: 11
    SolutionNameMin: Cijk_Alik_Bljk_HHS_BH_Bias_HA_S_SAV_UserArgs_MT112x128x32_MI16x16x1_SN_LDSB0_AFC1_AFEM1_AFEM1_ASEM1_CLR1_CADS0_DTVA0_DTVB1_EPS0_FDSI0_GRPM1_GRVWA4_GRVWB8_GSU0_GSUAMB_GSUC0_GSUWGMRR0_GLS0_ISA1201_IU1_K1_LBSPPA128_LBSPPB0_LBSPPM0_LPA16_LPB0_LPM0_LRVW8_LWPMn1_MIAV1_MIWT7_2_MO40_NTn1_NTA0_NTB0_NTC0_NTD0_NTM0_NEPBS0_NLCA1_NLCB2_ONLL1_PGR2_PLR1_PKA0_SIA3_SS0_SU32_SUM0_SUS256_SPO0_SRVW0_SSO0_SVW8_SK3_SKXCCM0_TLDS1_ULSGRO0_USL1_UIOFGRO0_USFGRO0_VSn1_VWA1_VWB1_WSGRA0_WSGRB0_WS32_WG16_8_1_WGM8_WGMXCC1_WGMXCCGn1
    SolutionIndex: 12
    SolutionNameMin: Cijk_Alik_Bljk_HHS_BH_Bias_HA_S_SAV_UserArgs_MT128x128x32_MI16x16x1_SN_LDSB0_AFC1_AFEM1_AFEM1_ASEM1_CLR1_CADS0_DTVA0_DTVB1_EPS0_FDSI0_GRPM1_GRVWA8_GRVWB8_GSU0_GSUAMB_GSUC0_GSUWGMRR0_GLS0_ISA1201_IU1_K1_LBSPPA128_LBSPPB0_LBSPPM0_LPA16_LPB0_LPM0_LRVW8_LWPMn1_MIAV1_MIWT8_2_MO40_NTn1_NTA0_NTB0_NTC0_NTD0_NTM0_NEPBS0_NLCA1_NLCB2_ONLL1_PGR2_PLR1_PKA0_SIA3_SS0_SU32_SUM0_SUS256_SPO0_SRVW0_SSO0_SVW8_SK3_SKXCCM0_TLDS1_ULSGRO0_USL1_UIOFGRO0_USFGROn1_VSn1_VWA1_VWB1_WSGRA0_WSGRB0_WS32_WG16_8_1_WGM8_WGMXCC1_WGMXCCGn1
    SolutionIndex: 13
    SolutionNameMin: Cijk_Alik_Bljk_HHS_BH_Bias_HA_S_SAV_UserArgs_MT128x128x32_MI16x16x1_SN_LDSB0_AFC1_AFEM1_AFEM1_ASEM1_CLR1_CADS0_DTVA0_DTVB1_EPS0_FDSI0_GRPM1_GRVWA8_GRVWB8_GSU0_GSUAMB_GSUC0_GSUWGMRR0_GLS0_ISA1201_IU1_K1_LBSPPA128_LBSPPB0_LBSPPM0_LPA16_LPB0_LPM0_LRVW8_LWPMn1_MIAV1_MIWT8_2_MO40_NTn1_NTA0_NTB0_NTC0_NTD0_NTM0_NEPBS0_NLCA1_NLCB2_ONLL1_PGR2_PLR1_PKA0_SIA3_SS0_SU32_SUM0_SUS256_SPO0_SRVW0_SSO0_SVW8_SK3_SKXCCM0_TLDS1_ULSGRO0_USL1_UIOFGRO0_USFGRO0_VSn1_VWA1_VWB1_WSGRA0_WSGRB0_WS32_WG16_8_1_WGM8_WGMXCC1_WGMXCCGn1
    SolutionIndex: 14
    SolutionNameMin: Cijk_Alik_Bljk_HHS_BH_Bias_HA_S_SAV_UserArgs_MT96x160x32_MI16x16x1_SN_LDSB1_AFC1_AFEM1_AFEM1_ASEM1_CLR1_CADS0_DTVA0_DTVB0_EPS0_FDSI0_GRPM1_GRVWA8_GRVWB8_GSU0_GSUAMB_GSUC0_GSUWGMRR0_GLS0_ISA1201_IU1_K1_LBSPPA128_LBSPPB128_LBSPPM0_LPA16_LPB16_LPM0_LRVW8_LWPMn1_MIAV1_MIWT3_5_MO40_NTn1_NTA0_NTB0_NTC0_NTD0_NTM0_NEPBS0_NLCA1_NLCB1_ONLL1_PGR2_PLR1_PKA0_SIA3_SS0_SU32_SUM0_SUS256_SPO0_SRVW0_SSO0_SVW8_SK3_SKXCCM0_TLDS1_ULSGRO0_USL1_UIOFGRO0_USFGROn1_VSn1_VWA1_VWB1_WSGRA0_WSGRB0_WS32_WG32_4_1_WGM8_WGMXCC1_WGMXCCGn1
    SolutionIndex: 15
    SolutionNameMin: Cijk_Alik_Bljk_HHS_BH_Bias_HA_S_SAV_UserArgs_MT96x160x32_MI16x16x1_SN_LDSB1_AFC1_AFEM1_AFEM1_ASEM1_CLR1_CADS0_DTVA0_DTVB0_EPS0_FDSI0_GRPM1_GRVWA8_GRVWB8_GSU0_GSUAMB_GSUC0_GSUWGMRR0_GLS0_ISA1201_IU1_K1_LBSPPA128_LBSPPB128_LBSPPM0_LPA16_LPB16_LPM0_LRVW8_LWPMn1_MIAV1_MIWT3_5_MO40_NTn1_NTA0_NTB0_NTC0_NTD0_NTM0_NEPBS0_NLCA1_NLCB1_ONLL1_PGR2_PLR1_PKA0_SIA3_SS0_SU32_SUM0_SUS256_SPO0_SRVW0_SSO0_SVW8_SK3_SKXCCM0_TLDS1_ULSGRO0_USL1_UIOFGRO0_USFGRO0_VSn1_VWA1_VWB1_WSGRA0_WSGRB0_WS32_WG32_4_1_WGM8_WGMXCC1_WGMXCCGn1
    SolutionIndex: 16
    SolutionNameMin: Cijk_Alik_Bljk_HHS_BH_Bias_HA_S_SAV_UserArgs_MT128x128x32_MI16x16x1_SN_LDSB1_AFC1_AFEM1_AFEM1_ASEM1_CLR1_CADS0_DTVA0_DTVB0_EPS0_FDSI0_GRPM1_GRVWA8_GRVWB8_GSU0_GSUAMB_GSUC0_GSUWGMRR0_GLS0_ISA1201_IU1_K1_LBSPPA128_LBSPPB128_LBSPPM0_LPA16_LPB16_LPM0_LRVW8_LWPMn1_MIAV1_MIWT4_4_MO40_NTn1_NTA0_NTB0_NTC0_NTD0_NTM0_NEPBS0_NLCA1_NLCB1_ONLL1_PGR2_PLR1_PKA0_SIA3_SS0_SU32_SUM0_SUS256_SPO0_SRVW0_SSO0_SVW8_SK3_SKXCCM0_TLDS1_ULSGRO0_USL1_UIOFGRO0_USFGROn1_VSn1_VWA1_VWB1_WSGRA0_WSGRB0_WS32_WG32_4_1_WGM8_WGMXCC1_WGMXCCGn1
    SolutionIndex: 17
    SolutionNameMin: Cijk_Alik_Bljk_HHS_BH_Bias_HA_S_SAV_UserArgs_MT128x128x32_MI16x16x1_SN_LDSB1_AFC1_AFEM1_AFEM1_ASEM1_CLR1_CADS0_DTVA0_DTVB0_EPS0_FDSI0_GRPM1_GRVWA8_GRVWB8_GSU0_GSUAMB_GSUC0_GSUWGMRR0_GLS0_ISA1201_IU1_K1_LBSPPA128_LBSPPB128_LBSPPM0_LPA16_LPB16_LPM0_LRVW8_LWPMn1_MIAV1_MIWT4_4_MO40_NTn1_NTA0_NTB0_NTC0_NTD0_NTM0_NEPBS0_NLCA1_NLCB1_ONLL1_PGR2_PLR1_PKA0_SIA3_SS0_SU32_SUM0_SUS256_SPO0_SRVW0_SSO0_SVW8_SK3_SKXCCM0_TLDS1_ULSGRO0_USL1_UIOFGRO0_USFGRO0_VSn1_VWA1_VWB1_WSGRA0_WSGRB0_WS32_WG32_4_1_WGM8_WGMXCC1_WGMXCCGn1
    SolutionIndex: 18
    SolutionNameMin: Cijk_Alik_Bljk_HHS_BH_Bias_HA_S_SAV_UserArgs_MT128x96x32_MI16x16x1_SN_LDSB1_AFC1_AFEM1_AFEM1_ASEM1_CLR1_CADS0_DTVA0_DTVB0_EPS0_FDSI0_GRPM1_GRVWA8_GRVWB8_GSU0_GSUAMB_GSUC0_GSUWGMRR0_GLS0_ISA1201_IU1_K1_LBSPPA128_LBSPPB128_LBSPPM0_LPA16_LPB16_LPM0_LRVW8_LWPMn1_MIAV1_MIWT4_3_MO40_NTn1_NTA0_NTB0_NTC0_NTD0_NTM0_NEPBS0_NLCA1_NLCB1_ONLL1_PGR2_PLR1_PKA0_SIA3_SS0_SU32_SUM0_SUS256_SPO0_SRVW0_SSO0_SVW8_SK3_SKXCCM0_TLDS1_ULSGRO0_USL1_UIOFGRO0_USFGROn1_VSn1_VWA1_VWB1_WSGRA0_WSGRB0_WS32_WG32_4_1_WGM8_WGMXCC1_WGMXCCGn1
    SolutionIndex: 19
    SolutionNameMin: Cijk_Alik_Bljk_HHS_BH_Bias_HA_S_SAV_UserArgs_MT160x96x32_MI16x16x1_SN_LDSB1_AFC1_AFEM1_AFEM1_ASEM1_CLR1_CADS0_DTVA0_DTVB0_EPS0_FDSI0_GRPM1_GRVWA8_GRVWB8_GSU0_GSUAMB_GSUC0_GSUWGMRR0_GLS0_ISA1201_IU1_K1_LBSPPA128_LBSPPB128_LBSPPM0_LPA16_LPB16_LPM0_LRVW8_LWPMn1_MIAV1_MIWT5_3_MO40_NTn1_NTA0_NTB0_NTC0_NTD0_NTM0_NEPBS0_NLCA1_NLCB1_ONLL1_PGR2_PLR1_PKA0_SIA3_SS0_SU32_SUM0_SUS256_SPO0_SRVW0_SSO0_SVW8_SK3_SKXCCM0_TLDS1_ULSGRO0_USL1_UIOFGRO0_USFGROn1_VSn1_VWA1_VWB1_WSGRA0_WSGRB0_WS32_WG32_4_1_WGM8_WGMXCC1_WGMXCCGn1
    SolutionIndex: 20
    SolutionNameMin: Cijk_Alik_Bljk_HHS_BH_Bias_HA_S_SAV_UserArgs_MT160x96x32_MI16x16x1_SN_LDSB1_AFC1_AFEM1_AFEM1_ASEM1_CLR1_CADS0_DTVA0_DTVB0_EPS0_FDSI0_GRPM1_GRVWA8_GRVWB8_GSU0_GSUAMB_GSUC0_GSUWGMRR0_GLS0_ISA1201_IU1_K1_LBSPPA128_LBSPPB128_LBSPPM0_LPA16_LPB16_LPM0_LRVW8_LWPMn1_MIAV1_MIWT5_3_MO40_NTn1_NTA0_NTB0_NTC0_NTD0_NTM0_NEPBS0_NLCA1_NLCB1_ONLL1_PGR2_PLR1_PKA0_SIA3_SS0_SU32_SUM0_SUS256_SPO0_SRVW0_SSO0_SVW8_SK3_SKXCCM0_TLDS1_ULSGRO0_USL1_UIOFGRO0_USFGRO0_VSn1_VWA1_VWB1_WSGRA0_WSGRB0_WS32_WG32_4_1_WGM8_WGMXCC1_WGMXCCGn1
    SolutionIndex: 21
    SolutionNameMin: Cijk_Alik_Bljk_HHS_BH_Bias_HA_S_SAV_UserArgs_MT160x64x32_MI16x16x1_SN_LDSB1_AFC1_AFEM1_AFEM1_ASEM1_CLR1_CADS0_DTVA0_DTVB0_EPS0_FDSI0_GRPM1_GRVWA8_GRVWB8_GSU0_GSUAMB_GSUC0_GSUWGMRR0_GLS0_ISA1201_IU1_K1_LBSPPA128_LBSPPB128_LBSPPM0_LPA16_LPB16_LPM0_LRVW8_LWPMn1_MIAV1_MIWT5_2_MO40_NTn1_NTA0_NTB0_NTC0_NTD0_NTM0_NEPBS0_NLCA1_NLCB1_ONLL1_PGR2_PLR1_PKA0_SIA3_SS0_SU32_SUM0_SUS256_SPO0_SRVW0_SSO0_SVW8_SK3_SKXCCM0_TLDS1_ULSGRO0_USL1_UIOFGRO0_USFGRO0_VSn1_VWA1_VWB1_WSGRA0_WSGRB0_WS32_WG32_4_1_WGM8_WGMXCC1_WGMXCCGn1
    SolutionIndex: 22
    SolutionNameMin: Cijk_Alik_Bljk_HHS_BH_Bias_HA_S_SAV_UserArgs_MT128x64x64_MI16x16x1_SN_LDSB1_AFC1_AFEM1_AFEM1_ASEM1_CLR1_CADS0_DTVA0_DTVB0_EPS0_FDSI0_GRPM1_GRVWA8_GRVWB8_GSU0_GSUAMB_GSUC0_GSUWGMRR0_GLS0_ISA1201_IU1_K1_LBSPPA128_LBSPPB128_LBSPPM0_LPA16_LPB16_LPM0_LRVW8_LWPMn1_MIAV1_MIWT2_4_MO40_NTn1_NTA0_NTB0_NTC0_NTD0_NTM0_NEPBS0_NLCA1_NLCB1_ONLL1_PGR2_PLR1_PKA0_SIA3_SS0_SU32_SUM0_SUS256_SPO0_SRVW0_SSO0_SVW8_SK3_SKXCCM0_TLDS1_ULSGRO0_USL1_UIOFGRO0_USFGRO0_VSn1_VWA1_VWB1_WSGRA0_WSGRB0_WS32_WG64_2_1_WGM8_WGMXCC1_WGMXCCGn1
    SolutionIndex: 23
    SolutionNameMin: Cijk_Alik_Bljk_HHS_BH_Bias_HA_S_SAV_UserArgs_MT128x16x64_MI16x16x1_SN_LDSB1_AFC1_AFEM1_AFEM1_ASEM1_CLR1_CADS0_DTVA0_DTVB0_EPS0_FDSI0_GRPM1_GRVWA8_GRVWB8_GSU0_GSUAMB_GSUC0_GSUWGMRR0_GLS0_ISA1201_IU1_K1_LBSPPA128_LBSPPB128_LBSPPM0_LPA16_LPB16_LPM0_LRVW8_LWPMn1_MIAV1_MIWT2_1_MO40_NTn1_NTA0_NTB0_NTC0_NTD0_NTM0_NEPBS0_NLCA1_NLCB1_ONLL1_PGR2_PLR1_PKA0_SIA3_SS0_SU32_SUM0_SUS256_SPO0_SRVW0_SSO0_SVW8_SK3_SKXCCM0_TLDS1_ULSGRO0_USL1_UIOFGRO0_USFGROn1_VSn1_VWA1_VWB1_WSGRA0_WSGRB0_WS32_WG64_2_1_WGM8_WGMXCC1_WGMXCCGn1
    SolutionIndex: 24
    SolutionNameMin: Cijk_Alik_Bljk_HHS_BH_Bias_HA_S_SAV_UserArgs_MT80x64x64_MI16x16x1_SN_LDSB0_AFC1_AFEM1_AFEM1_ASEM1_CLR1_CADS0_DTVA0_DTVB1_EPS0_FDSI0_GRPM1_GRVWA8_GRVWB8_GSU0_GSUAMB_GSUC0_GSUWGMRR0_GLS0_ISA1201_IU1_K1_LBSPPA128_LBSPPB0_LBSPPM0_LPA16_LPB0_LPM0_LRVW8_LWPMn1_MIAV1_MIWT5_1_MO40_NTn1_NTA0_NTB0_NTC0_NTD0_NTM0_NEPBS0_NLCA1_NLCB4_ONLL1_PGR2_PLR1_PKA0_SIA3_SS0_SU32_SUM0_SUS256_SPO0_SRVW0_SSO0_SVW8_SK3_SKXCCM0_TLDS1_ULSGRO0_USL1_UIOFGRO0_USFGROn1_VSn1_VWA1_VWB1_WSGRA0_WSGRB0_WS32_WG16_8_1_WGM8_WGMXCC1_WGMXCCGn1
    SolutionIndex: 25
    SolutionNameMin: Cijk_Alik_Bljk_HHS_BH_Bias_HA_S_SAV_UserArgs_MT96x96x64_MI16x16x1_SN_LDSB1_AFC1_AFEM1_AFEM1_ASEM1_CLR1_CADS0_DTVA0_DTVB0_EPS0_FDSI0_GRPM1_GRVWA8_GRVWB8_GSU0_GSUAMB_GSUC0_GSUWGMRR0_GLS0_ISA1201_IU1_K1_LBSPPA128_LBSPPB128_LBSPPM0_LPA16_LPB16_LPM0_LRVW8_LWPMn1_MIAV1_MIWT3_3_MO40_NTn1_NTA0_NTB0_NTC0_NTD0_NTM0_NEPBS0_NLCA1_NLCB1_ONLL1_PGR2_PLR1_PKA0_SIA3_SS0_SU32_SUM0_SUS256_SPO0_SRVW0_SSO0_SVW8_SK3_SKXCCM0_TLDS1_ULSGRO0_USL1_UIOFGRO0_USFGRO0_VSn1_VWA1_VWB1_WSGRA0_WSGRB0_WS32_WG32_4_1_WGM8_WGMXCC1_WGMXCCGn1
    SolutionIndex: 26
    SolutionNameMin: Cijk_Alik_Bljk_HHS_BH_Bias_HA_S_SAV_UserArgs_MT96x64x64_MI16x16x1_SN_LDSB1_AFC1_AFEM1_AFEM1_ASEM1_CLR1_CADS0_DTVA0_DTVB0_EPS0_FDSI0_GRPM1_GRVWA8_GRVWB8_GSU0_GSUAMB_GSUC0_GSUWGMRR0_GLS0_ISA1201_IU1_K1_LBSPPA128_LBSPPB128_LBSPPM0_LPA16_LPB16_LPM0_LRVW8_LWPMn1_MIAV1_MIWT3_2_MO40_NTn1_NTA0_NTB0_NTC0_NTD0_NTM0_NEPBS0_NLCA1_NLCB1_ONLL1_PGR2_PLR1_PKA0_SIA3_SS0_SU32_SUM0_SUS256_SPO0_SRVW0_SSO0_SVW8_SK3_SKXCCM0_TLDS1_ULSGRO0_USL1_UIOFGRO0_USFGRO0_VSn1_VWA1_VWB1_WSGRA0_WSGRB0_WS32_WG32_4_1_WGM8_WGMXCC1_WGMXCCGn1
    SolutionIndex: 27
    SolutionNameMin: Cijk_Alik_Bljk_HHS_BH_Bias_HA_S_SAV_UserArgs_MT128x128x32_MI16x16x1_SN_LDSB0_AFC1_AFEM1_AFEM1_ASEM1_CLR1_CADS0_DTVA1_DTVB0_EPS0_FDSI0_GRPM1_GRVWA8_GRVWB8_GSU0_GSUAMB_GSUC0_GSUWGMRR0_GLS0_ISA1201_IU1_K1_LBSPPA0_LBSPPB128_LBSPPM0_LPA0_LPB16_LPM0_LRVW8_LWPMn1_MIAV1_MIWT2_8_MO40_NTn1_NTA0_NTB0_NTC0_NTD0_NTM0_NEPBS0_NLCA2_NLCB1_ONLL1_PGR2_PLR1_PKA0_SIA3_SS0_SU32_SUM0_SUS256_SPO0_SRVW0_SSO0_SVW8_SK3_SKXCCM8_TLDS1_ULSGRO0_USL1_UIOFGRO0_USFGROn1_VSn1_VWA1_VWB1_WSGRA0_WSGRB0_WS32_WG64_2_1_WGM8_WGMXCC1_WGMXCCGn1
    SolutionIndex: 28
    SolutionNameMin: Cijk_Alik_Bljk_HHS_BH_Bias_HA_S_SAV_UserArgs_MT128x128x32_MI16x16x1_SN_LDSB0_AFC1_AFEM1_AFEM1_ASEM1_CLR1_CADS0_DTVA1_DTVB0_EPS0_FDSI0_GRPM1_GRVWA8_GRVWB8_GSU0_GSUAMB_GSUC0_GSUWGMRR0_GLS0_ISA1201_IU1_K1_LBSPPA0_LBSPPB128_LBSPPM0_LPA0_LPB16_LPM0_LRVW8_LWPMn1_MIAV1_MIWT2_8_MO40_NTn1_NTA0_NTB0_NTC0_NTD0_NTM0_NEPBS0_NLCA2_NLCB1_ONLL1_PGR2_PLR1_PKA0_SIA3_SS0_SU32_SUM0_SUS256_SPO0_SRVW0_SSO0_SVW8_SK3_SKXCCM8_TLDS1_ULSGRO0_USL1_UIOFGRO0_USFGRO0_VSn1_VWA1_VWB1_WSGRA0_WSGRB0_WS32_WG64_2_1_WGM8_WGMXCC1_WGMXCCGn1
    SolutionIndex: 29
    SolutionNameMin: Cijk_Alik_Bljk_HHS_BH_Bias_HA_S_SAV_UserArgs_MT256x64x32_MI16x16x1_SN_LDSB1_AFC1_AFEM1_AFEM1_ASEM1_CLR1_CADS0_DTVA0_DTVB0_EPS0_FDSI0_GRPM1_GRVWA8_GRVWB8_GSU0_GSUAMB_GSUC0_GSUWGMRR0_GLS0_ISA1201_IU1_K1_LBSPPA128_LBSPPB128_LBSPPM0_LPA16_LPB16_LPM0_LRVW8_LWPMn1_MIAV1_MIWT4_4_MO40_NTn1_NTA0_NTB0_NTC0_NTD0_NTM0_NEPBS0_NLCA1_NLCB1_ONLL1_PGR2_PLR1_PKA0_SIA3_SS0_SU32_SUM0_SUS256_SPO0_SRVW0_SSO0_SVW8_SK3_SKXCCM8_TLDS1_ULSGRO0_USL1_UIOFGRO0_USFGROn1_VSn1_VWA1_VWB1_WSGRA0_WSGRB0_WS32_WG64_2_1_WGM8_WGMXCC1_WGMXCCGn1
    SolutionIndex: 30
    SolutionNameMin: Cijk_Alik_Bljk_HHS_BH_Bias_HA_S_SAV_UserArgs_MT256x64x32_MI16x16x1_SN_LDSB1_AFC1_AFEM1_AFEM1_ASEM1_CLR1_CADS0_DTVA0_DTVB0_EPS0_FDSI0_GRPM1_GRVWA8_GRVWB8_GSU0_GSUAMB_GSUC0_GSUWGMRR0_GLS0_ISA1201_IU1_K1_LBSPPA128_LBSPPB128_LBSPPM0_LPA16_LPB16_LPM0_LRVW8_LWPMn1_MIAV1_MIWT4_4_MO40_NTn1_NTA0_NTB0_NTC0_NTD0_NTM0_NEPBS0_NLCA1_NLCB1_ONLL1_PGR2_PLR1_PKA0_SIA3_SS0_SU32_SUM0_SUS256_SPO0_SRVW0_SSO0_SVW8_SK3_SKXCCM8_TLDS1_ULSGRO0_USL1_UIOFGRO0_USFGRO0_VSn1_VWA1_VWB1_WSGRA0_WSGRB0_WS32_WG64_2_1_WGM8_WGMXCC1_WGMXCCGn1
    SolutionIndex: 31
    SolutionNameMin: Cijk_Alik_Bljk_HHS_BH_Bias_HA_S_SAV_UserArgs_MT256x64x32_MI16x16x1_SN_LDSB0_AFC1_AFEM1_AFEM1_ASEM1_CLR1_CADS0_DTVA1_DTVB0_EPS0_FDSI0_GRPM1_GRVWA8_GRVWB8_GSU0_GSUAMB_GSUC0_GSUWGMRR0_GLS0_ISA1201_IU1_K1_LBSPPA0_LBSPPB128_LBSPPM0_LPA0_LPB16_LPM0_LRVW8_LWPMn1_MIAV1_MIWT4_4_MO40_NTn1_NTA0_NTB0_NTC0_NTD0_NTM0_NEPBS0_NLCA2_NLCB1_ONLL1_PGR2_PLR1_PKA0_SIA3_SS0_SU32_SUM0_SUS256_SPO0_SRVW0_SSO0_SVW8_SK3_SKXCCM8_TLDS1_ULSGRO0_USL1_UIOFGRO0_USFGRO0_VSn1_VWA1_VWB1_WSGRA0_WSGRB0_WS32_WG64_2_1_WGM8_WGMXCC1_WGMXCCGn1
    SolutionIndex: 32
    SolutionNameMin: Cijk_Alik_Bljk_HHS_BH_Bias_HA_S_SAV_UserArgs_MT80x192x32_MI16x16x1_SN_LDSB0_AFC1_AFEM1_AFEM1_ASEM1_CLR1_CADS0_DTVA0_DTVB1_EPS0_FDSI0_GRPM1_GRVWA4_GRVWB8_GSU0_GSUAMB_GSUC0_GSUWGMRR0_GLS0_ISA1201_IU1_K1_LBSPPA128_LBSPPB0_LBSPPM0_LPA16_LPB0_LPM0_LRVW8_LWPMn1_MIAV1_MIWT5_3_MO40_NTn1_NTA0_NTB0_NTC0_NTD0_NTM0_NEPBS0_NLCA1_NLCB2_ONLL1_PGR2_PLR1_PKA0_SIA3_SS0_SU32_SUM0_SUS256_SPO0_SRVW0_SSO0_SVW8_SK3_SKXCCM8_TLDS1_ULSGRO0_USL1_UIOFGRO0_USFGRO0_VSn1_VWA1_VWB1_WSGRA0_WSGRB0_WS32_WG16_8_1_WGM8_WGMXCC1_WGMXCCGn1
    SolutionIndex: 33
    SolutionNameMin: Cijk_Alik_Bljk_HHS_BH_Bias_HA_S_SAV_UserArgs_MT128x128x32_MI16x16x1_SN_LDSB0_AFC1_AFEM1_AFEM1_ASEM1_CLR1_CADS0_DTVA0_DTVB1_EPS0_FDSI0_GRPM1_GRVWA8_GRVWB8_GSU0_GSUAMB_GSUC0_GSUWGMRR0_GLS0_ISA1201_IU1_K1_LBSPPA128_LBSPPB0_LBSPPM0_LPA16_LPB0_LPM0_LRVW8_LWPMn1_MIAV1_MIWT8_2_MO40_NTn1_NTA0_NTB0_NTC0_NTD0_NTM0_NEPBS0_NLCA1_NLCB2_ONLL1_PGR2_PLR1_PKA0_SIA3_SS0_SU32_SUM0_SUS256_SPO0_SRVW0_SSO0_SVW8_SK3_SKXCCM8_TLDS1_ULSGRO0_USL1_UIOFGRO0_USFGROn1_VSn1_VWA1_VWB1_WSGRA0_WSGRB0_WS32_WG16_8_1_WGM8_WGMXCC1_WGMXCCGn1
    SolutionIndex: 34
    SolutionNameMin: Cijk_Alik_Bljk_HHS_BH_Bias_HA_S_SAV_UserArgs_MT128x128x32_MI16x16x1_SN_LDSB0_AFC1_AFEM1_AFEM1_ASEM1_CLR1_CADS0_DTVA0_DTVB1_EPS0_FDSI0_GRPM1_GRVWA8_GRVWB8_GSU0_GSUAMB_GSUC0_GSUWGMRR0_GLS0_ISA1201_IU1_K1_LBSPPA128_LBSPPB0_LBSPPM0_LPA16_LPB0_LPM0_LRVW8_LWPMn1_MIAV1_MIWT8_2_MO40_NTn1_NTA0_NTB0_NTC0_NTD0_NTM0_NEPBS0_NLCA1_NLCB2_ONLL1_PGR2_PLR1_PKA0_SIA3_SS0_SU32_SUM0_SUS256_SPO0_SRVW0_SSO0_SVW8_SK3_SKXCCM8_TLDS1_ULSGRO0_USL1_UIOFGRO0_USFGRO0_VSn1_VWA1_VWB1_WSGRA0_WSGRB0_WS32_WG16_8_1_WGM8_WGMXCC1_WGMXCCGn1
    SolutionIndex: 35
    SolutionNameMin: Cijk_Alik_Bljk_HHS_BH_Bias_HA_S_SAV_UserArgs_MT96x160x32_MI16x16x1_SN_LDSB1_AFC1_AFEM1_AFEM1_ASEM1_CLR1_CADS0_DTVA0_DTVB0_EPS0_FDSI0_GRPM1_GRVWA8_GRVWB8_GSU0_GSUAMB_GSUC0_GSUWGMRR0_GLS0_ISA1201_IU1_K1_LBSPPA128_LBSPPB128_LBSPPM0_LPA16_LPB16_LPM0_LRVW8_LWPMn1_MIAV1_MIWT3_5_MO40_NTn1_NTA0_NTB0_NTC0_NTD0_NTM0_NEPBS0_NLCA1_NLCB1_ONLL1_PGR2_PLR1_PKA0_SIA3_SS0_SU32_SUM0_SUS256_SPO0_SRVW0_SSO0_SVW8_SK3_SKXCCM8_TLDS1_ULSGRO0_USL1_UIOFGRO0_USFGROn1_VSn1_VWA1_VWB1_WSGRA0_WSGRB0_WS32_WG32_4_1_WGM8_WGMXCC1_WGMXCCGn1
    SolutionIndex: 36
    SolutionNameMin: Cijk_Alik_Bljk_HHS_BH_Bias_HA_S_SAV_UserArgs_MT96x160x32_MI16x16x1_SN_LDSB1_AFC1_AFEM1_AFEM1_ASEM1_CLR1_CADS0_DTVA0_DTVB0_EPS0_FDSI0_GRPM1_GRVWA8_GRVWB8_GSU0_GSUAMB_GSUC0_GSUWGMRR0_GLS0_ISA1201_IU1_K1_LBSPPA128_LBSPPB128_LBSPPM0_LPA16_LPB16_LPM0_LRVW8_LWPMn1_MIAV1_MIWT3_5_MO40_NTn1_NTA0_NTB0_NTC0_NTD0_NTM0_NEPBS0_NLCA1_NLCB1_ONLL1_PGR2_PLR1_PKA0_SIA3_SS0_SU32_SUM0_SUS256_SPO0_SRVW0_SSO0_SVW8_SK3_SKXCCM8_TLDS1_ULSGRO0_USL1_UIOFGRO0_USFGRO0_VSn1_VWA1_VWB1_WSGRA0_WSGRB0_WS32_WG32_4_1_WGM8_WGMXCC1_WGMXCCGn1
    SolutionIndex: 37
    SolutionNameMin: Cijk_Alik_Bljk_HHS_BH_Bias_HA_S_SAV_UserArgs_MT96x128x32_MI16x16x1_SN_LDSB1_AFC1_AFEM1_AFEM1_ASEM1_CLR1_CADS0_DTVA0_DTVB0_EPS0_FDSI0_GRPM1_GRVWA8_GRVWB8_GSU0_GSUAMB_GSUC0_GSUWGMRR0_GLS0_ISA1201_IU1_K1_LBSPPA128_LBSPPB128_LBSPPM0_LPA16_LPB16_LPM0_LRVW8_LWPMn1_MIAV1_MIWT3_4_MO40_NTn1_NTA0_NTB0_NTC0_NTD0_NTM0_NEPBS0_NLCA1_NLCB1_ONLL1_PGR2_PLR1_PKA0_SIA3_SS0_SU32_SUM0_SUS256_SPO0_SRVW0_SSO0_SVW8_SK3_SKXCCM8_TLDS1_ULSGRO0_USL1_UIOFGRO0_USFGROn1_VSn1_VWA1_VWB1_WSGRA0_WSGRB0_WS32_WG32_4_1_WGM8_WGMXCC1_WGMXCCGn1
    SolutionIndex: 38
    SolutionNameMin: Cijk_Alik_Bljk_HHS_BH_Bias_HA_S_SAV_UserArgs_MT128x128x32_MI16x16x1_SN_LDSB1_AFC1_AFEM1_AFEM1_ASEM1_CLR1_CADS0_DTVA0_DTVB0_EPS0_FDSI0_GRPM1_GRVWA8_GRVWB8_GSU0_GSUAMB_GSUC0_GSUWGMRR0_GLS0_ISA1201_IU1_K1_LBSPPA128_LBSPPB128_LBSPPM0_LPA16_LPB16_LPM0_LRVW8_LWPMn1_MIAV1_MIWT4_4_MO40_NTn1_NTA0_NTB0_NTC0_NTD0_NTM0_NEPBS0_NLCA1_NLCB1_ONLL1_PGR2_PLR1_PKA0_SIA3_SS0_SU32_SUM0_SUS256_SPO0_SRVW0_SSO0_SVW8_SK3_SKXCCM8_TLDS1_ULSGRO0_USL1_UIOFGRO0_USFGROn1_VSn1_VWA1_VWB1_WSGRA0_WSGRB0_WS32_WG32_4_1_WGM8_WGMXCC1_WGMXCCGn1
    SolutionIndex: 39
    SolutionNameMin: Cijk_Alik_Bljk_HHS_BH_Bias_HA_S_SAV_UserArgs_MT128x128x32_MI16x16x1_SN_LDSB1_AFC1_AFEM1_AFEM1_ASEM1_CLR1_CADS0_DTVA0_DTVB0_EPS0_FDSI0_GRPM1_GRVWA8_GRVWB8_GSU0_GSUAMB_GSUC0_GSUWGMRR0_GLS0_ISA1201_IU1_K1_LBSPPA128_LBSPPB128_LBSPPM0_LPA16_LPB16_LPM0_LRVW8_LWPMn1_MIAV1_MIWT4_4_MO40_NTn1_NTA0_NTB0_NTC0_NTD0_NTM0_NEPBS0_NLCA1_NLCB1_ONLL1_PGR2_PLR1_PKA0_SIA3_SS0_SU32_SUM0_SUS256_SPO0_SRVW0_SSO0_SVW8_SK3_SKXCCM8_TLDS1_ULSGRO0_USL1_UIOFGRO0_USFGRO0_VSn1_VWA1_VWB1_WSGRA0_WSGRB0_WS32_WG32_4_1_WGM8_WGMXCC1_WGMXCCGn1
    SolutionIndex: 40
    SolutionNameMin: Cijk_Alik_Bljk_HHS_BH_Bias_HA_S_SAV_UserArgs_MT128x96x32_MI16x16x1_SN_LDSB1_AFC1_AFEM1_AFEM1_ASEM1_CLR1_CADS0_DTVA0_DTVB0_EPS0_FDSI0_GRPM1_GRVWA8_GRVWB8_GSU0_GSUAMB_GSUC0_GSUWGMRR0_GLS0_ISA1201_IU1_K1_LBSPPA128_LBSPPB128_LBSPPM0_LPA16_LPB16_LPM0_LRVW8_LWPMn1_MIAV1_MIWT4_3_MO40_NTn1_NTA0_NTB0_NTC0_NTD0_NTM0_NEPBS0_NLCA1_NLCB1_ONLL1_PGR2_PLR1_PKA0_SIA3_SS0_SU32_SUM0_SUS256_SPO0_SRVW0_SSO0_SVW8_SK3_SKXCCM8_TLDS1_ULSGRO0_USL1_UIOFGRO0_USFGROn1_VSn1_VWA1_VWB1_WSGRA0_WSGRB0_WS32_WG32_4_1_WGM8_WGMXCC1_WGMXCCGn1
    SolutionIndex: 41
    SolutionNameMin: Cijk_Alik_Bljk_HHS_BH_Bias_HA_S_SAV_UserArgs_MT160x96x32_MI16x16x1_SN_LDSB1_AFC1_AFEM1_AFEM1_ASEM1_CLR1_CADS0_DTVA0_DTVB0_EPS0_FDSI0_GRPM1_GRVWA8_GRVWB8_GSU0_GSUAMB_GSUC0_GSUWGMRR0_GLS0_ISA1201_IU1_K1_LBSPPA128_LBSPPB128_LBSPPM0_LPA16_LPB16_LPM0_LRVW8_LWPMn1_MIAV1_MIWT5_3_MO40_NTn1_NTA0_NTB0_NTC0_NTD0_NTM0_NEPBS0_NLCA1_NLCB1_ONLL1_PGR2_PLR1_PKA0_SIA3_SS0_SU32_SUM0_SUS256_SPO0_SRVW0_SSO0_SVW8_SK3_SKXCCM8_TLDS1_ULSGRO0_USL1_UIOFGRO0_USFGROn1_VSn1_VWA1_VWB1_WSGRA0_WSGRB0_WS32_WG32_4_1_WGM8_WGMXCC1_WGMXCCGn1
    SolutionIndex: 42
    SolutionNameMin: Cijk_Alik_Bljk_HHS_BH_Bias_HA_S_SAV_UserArgs_MT160x96x32_MI16x16x1_SN_LDSB1_AFC1_AFEM1_AFEM1_ASEM1_CLR1_CADS0_DTVA0_DTVB0_EPS0_FDSI0_GRPM1_GRVWA8_GRVWB8_GSU0_GSUAMB_GSUC0_GSUWGMRR0_GLS0_ISA1201_IU1_K1_LBSPPA128_LBSPPB128_LBSPPM0_LPA16_LPB16_LPM0_LRVW8_LWPMn1_MIAV1_MIWT5_3_MO40_NTn1_NTA0_NTB0_NTC0_NTD0_NTM0_NEPBS0_NLCA1_NLCB1_ONLL1_PGR2_PLR1_PKA0_SIA3_SS0_SU32_SUM0_SUS256_SPO0_SRVW0_SSO0_SVW8_SK3_SKXCCM8_TLDS1_ULSGRO0_USL1_UIOFGRO0_USFGRO0_VSn1_VWA1_VWB1_WSGRA0_WSGRB0_WS32_WG32_4_1_WGM8_WGMXCC1_WGMXCCGn1
    SolutionIndex: 43
    SolutionNameMin: Cijk_Alik_Bljk_HHS_BH_Bias_HA_S_SAV_UserArgs_MT128x32x64_MI16x16x1_SN_LDSB1_AFC1_AFEM1_AFEM1_ASEM1_CLR1_CADS0_DTVA0_DTVB0_EPS0_FDSI0_GRPM1_GRVWA8_GRVWB8_GSU0_GSUAMB_GSUC0_GSUWGMRR0_GLS0_ISA1201_IU1_K1_LBSPPA128_LBSPPB128_LBSPPM0_LPA16_LPB16_LPM0_LRVW8_LWPMn1_MIAV1_MIWT2_2_MO40_NTn1_NTA0_NTB0_NTC0_NTD0_NTM0_NEPBS0_NLCA1_NLCB1_ONLL1_PGR2_PLR1_PKA0_SIA3_SS0_SU32_SUM0_SUS256_SPO0_SRVW0_SSO0_SVW8_SK3_SKXCCM8_TLDS1_ULSGRO0_USL1_UIOFGRO0_USFGROn1_VSn1_VWA1_VWB1_WSGRA0_WSGRB0_WS32_WG64_2_1_WGM8_WGMXCC1_WGMXCCGn1
    SolutionIndex: 44
    SolutionNameMin: Cijk_Alik_Bljk_HHS_BH_Bias_HA_S_SAV_UserArgs_MT128x16x64_MI16x16x1_SN_LDSB1_AFC1_AFEM1_AFEM1_ASEM1_CLR1_CADS0_DTVA0_DTVB0_EPS0_FDSI0_GRPM1_GRVWA8_GRVWB8_GSU0_GSUAMB_GSUC0_GSUWGMRR0_GLS0_ISA1201_IU1_K1_LBSPPA128_LBSPPB128_LBSPPM0_LPA16_LPB16_LPM0_LRVW8_LWPMn1_MIAV1_MIWT2_1_MO40_NTn1_NTA0_NTB0_NTC0_NTD0_NTM0_NEPBS0_NLCA1_NLCB1_ONLL1_PGR2_PLR1_PKA0_SIA3_SS0_SU32_SUM0_SUS256_SPO0_SRVW0_SSO0_SVW8_SK3_SKXCCM8_TLDS1_ULSGRO0_USL1_UIOFGRO0_USFGROn1_VSn1_VWA1_VWB1_WSGRA0_WSGRB0_WS32_WG64_2_1_WGM8_WGMXCC1_WGMXCCGn1
    SolutionIndex: 45
    SolutionNameMin: Cijk_Alik_Bljk_HHS_BH_Bias_HA_S_SAV_UserArgs_MT64x128x64_MI16x16x1_SN_LDSB1_AFC1_AFEM1_AFEM1_ASEM1_CLR1_CADS0_DTVA0_DTVB0_EPS0_FDSI0_GRPM1_GRVWA8_GRVWB8_GSU0_GSUAMB_GSUC0_GSUWGMRR0_GLS0_ISA1201_IU1_K1_LBSPPA128_LBSPPB128_LBSPPM0_LPA16_LPB16_LPM0_LRVW8_LWPMn1_MIAV1_MIWT4_2_MO40_NTn1_NTA0_NTB0_NTC0_NTD0_NTM0_NEPBS0_NLCA1_NLCB1_ONLL1_PGR2_PLR1_PKA0_SIA3_SS0_SU32_SUM0_SUS256_SPO0_SRVW0_SSO0_SVW8_SK3_SKXCCM8_TLDS1_ULSGRO0_USL1_UIOFGRO0_USFGRO0_VSn1_VWA1_VWB1_WSGRA0_WSGRB0_WS32_WG16_8_1_WGM8_WGMXCC1_WGMXCCGn1
    SolutionIndex: 46
    SolutionNameMin: Cijk_Alik_Bljk_HHS_BH_Bias_HA_S_SAV_UserArgs_MT96x96x64_MI16x16x1_SN_LDSB1_AFC1_AFEM1_AFEM1_ASEM1_CLR1_CADS0_DTVA0_DTVB0_EPS0_FDSI0_GRPM1_GRVWA8_GRVWB8_GSU0_GSUAMB_GSUC0_GSUWGMRR0_GLS0_ISA1201_IU1_K1_LBSPPA128_LBSPPB128_LBSPPM0_LPA16_LPB16_LPM0_LRVW8_LWPMn1_MIAV1_MIWT3_3_MO40_NTn1_NTA0_NTB0_NTC0_NTD0_NTM0_NEPBS0_NLCA1_NLCB1_ONLL1_PGR2_PLR1_PKA0_SIA3_SS0_SU32_SUM0_SUS256_SPO0_SRVW0_SSO0_SVW8_SK3_SKXCCM8_TLDS1_ULSGRO0_USL1_UIOFGRO0_USFGRO0_VSn1_VWA1_VWB1_WSGRA0_WSGRB0_WS32_WG32_4_1_WGM8_WGMXCC1_WGMXCCGn1
    SolutionIndex: 47
    SolutionNameMin: Cijk_Alik_Bljk_HHS_BH_Bias_HA_S_SAV_UserArgs_MT128x64x64_MI16x16x1_SN_LDSB1_AFC1_AFEM1_AFEM1_ASEM1_CLR1_CADS0_DTVA0_DTVB0_EPS0_FDSI0_GRPM1_GRVWA8_GRVWB8_GSU0_GSUAMB_GSUC0_GSUWGMRR0_GLS0_ISA1201_IU1_K1_LBSPPA128_LBSPPB128_LBSPPM0_LPA16_LPB16_LPM0_LRVW8_LWPMn1_MIAV1_MIWT4_2_MO40_NTn1_NTA0_NTB0_NTC0_NTD0_NTM0_NEPBS0_NLCA1_NLCB1_ONLL1_PGR2_PLR1_PKA0_SIA3_SS0_SU32_SUM0_SUS256_SPO0_SRVW0_SSO0_SVW8_SK3_SKXCCM8_TLDS1_ULSGRO0_USL1_UIOFGRO0_USFGRO0_VSn1_VWA1_VWB1_WSGRA0_WSGRB0_WS32_WG32_4_1_WGM8_WGMXCC1_WGMXCCGn1
- - - [5120, 1, 1, 3072, 5120, 5120, 3072, 3072]
    - [3, 0.31]
  - - [5120, 64, 1, 3072, 5120, 5120, 3072, 3072]
    - [21, 15.89]
  - - [5120, 128, 1, 3072, 5120, 5120, 3072, 3072]
    - [27, 23.65]
  - - [5120, 192, 1, 3072, 5120, 5120, 3072, 3072]
    - [42, 26.93]
  - - [5120, 256, 1, 3072, 5120, 5120, 3072, 3072]
    - [11, 26.55]
  - - [5120, 320, 1, 3072, 5120, 5120, 3072, 3072]
    - [31, 28.42]
  - - [5120, 384, 1, 3072, 5120, 5120, 3072, 3072]
    - [42, 30.4]
  - - [5120, 448, 1, 3072, 5120, 5120, 3072, 3072]
    - [2, 30.18]
  - - [5120, 512, 1, 3072, 5120, 5120, 3072, 3072]
    - [39, 32.43]
  - - [5120, 576, 1, 3072, 5120, 5120, 3072, 3072]
    - [19, 32.22]
  - - [5120, 640, 1, 3072, 5120, 5120, 3072, 3072]
    - [1, 33.15]
  - - [5120, 704, 1, 3072, 5120, 5120, 3072, 3072]
    - [29, 32.15]
  - - [5120, 768, 1, 3072, 5120, 5120, 3072, 3072]
    - [41, 33.18]
  - - [5120, 832, 1, 3072, 5120, 5120, 3072, 3072]
    - [29, 32.56]
  - - [5120, 896, 1, 3072, 5120, 5120, 3072, 3072]
    - [12, 34.88]
  - - [5120, 960, 1, 3072, 5120, 5120, 3072, 3072]
    - [20, 33.88]
  - - [5120, 1024, 1, 3072, 5120, 5120, 3072, 3072]
    - [12, 35.37]
  - - [5120, 1088, 1, 3072, 5120, 5120, 3072, 3072]
    - [12, 33.49]
  - - [5120, 1152, 1, 3072, 5120, 5120, 3072, 3072]
    - [33, 35.35]
  - - [5120, 1216, 1, 3072, 5120, 5120, 3072, 3072]
    - [41, 33.53]
  - - [5120, 1280, 1, 3072, 5120, 5120, 3072, 3072]
    - [0, 34.66]
  - - [5120, 1344, 1, 3072, 5120, 5120, 3072, 3072]
    - [19, 34.59]
  - - [5120, 1408, 1, 3072, 5120, 5120, 3072, 3072]
    - [33, 35.68]
  - - [5120, 1472, 1, 3072, 5120, 5120, 3072, 3072]
    - [34, 34.56]
  - - [5120, 1536, 1, 3072, 5120, 5120, 3072, 3072]
    - [27, 36.02]
  - - [5120, 1600, 1, 3072, 5120, 5120, 3072, 3072]
    - [0, 34.79]
  - - [5120, 1664, 1, 3072, 5120, 5120, 3072, 3072]
    - [0, 36.05]
  - - [5120, 1728, 1, 3072, 5120, 5120, 3072, 3072]
    - [32, 35.09]
  - - [5120, 1792, 1, 3072, 5120, 5120, 3072, 3072]
    - [28, 35.25]
  - - [5120, 1856, 1, 3072, 5120, 5120, 3072, 3072]
    - [33, 35.09]
  - - [5120, 1920, 1, 3072, 5120, 5120, 3072, 3072]
    - [1, 36.24]
  - - [5120, 1984, 1, 3072, 5120, 5120, 3072, 3072]
    - [34, 35.39]
  - - [5120, 2048, 1, 3072, 5120, 5120, 3072, 3072]
    - [33, 36.36]
  - - [5120, 2112, 1, 3072, 5120, 5120, 3072, 3072]
    - [42, 35.14]
  - - [5120, 2176, 1, 3072, 5120, 5120, 3072, 3072]
    - [33, 36.02]
  - - [5120, 2240, 1, 3072, 5120, 5120, 3072, 3072]
    - [36, 34.71]
  - - [5120, 2304, 1, 3072, 5120, 5120, 3072, 3072]
    - [13, 35.32]
  - - [5120, 2368, 1, 3072, 5120, 5120, 3072, 3072]
    - [12, 35.33]
  - - [5120, 2432, 1, 3072, 5120, 5120, 3072, 3072]
    - [33, 36.05]
  - - [5120, 2496, 1, 3072, 5120, 5120, 3072, 3072]
    - [32, 35.77]
  - - [5120, 2560, 1, 3072, 5120, 5120, 3072, 3072]
    - [13, 36.33]
  - - [5120, 2624, 1, 3072, 5120, 5120, 3072, 3072]
    - [34, 35.37]
  - - [5120, 2688, 1, 3072, 5120, 5120, 3072, 3072]
    - [34, 36.09]
  - - [5120, 2752, 1, 3072, 5120, 5120, 3072, 3072]
    - [42, 34.92]
  - - [5120, 2816, 1, 3072, 5120, 5120, 3072, 3072]
    - [34, 35.43]
  - - [5120, 2880, 1, 3072, 5120, 5120, 3072, 3072]
    - [13, 35.67]
  - - [5120, 2944, 1, 3072, 5120, 5120, 3072, 3072]
    - [12, 36.23]
  - - [5120, 3008, 1, 3072, 5120, 5120, 3072, 3072]
    - [13, 35.84]
  - - [5120, 3072, 1, 3072, 5120, 5120, 3072, 3072]
    - [33, 36.62]
  - - [5120, 3136, 1, 3072, 5120, 5120, 3072, 3072]
    - [13, 35.86]
  - - [5120, 3200, 1, 3072, 5120, 5120, 3072, 3072]
    - [34, 36.54]
  - - [5120, 3264, 1, 3072, 5120, 5120, 3072, 3072]
    - [9, 35.69]
  - - [5120, 3328, 1, 3072, 5120, 5120, 3072, 3072]
    - [20, 35.07]
  - - [5120, 3392, 1, 3072, 5120, 5120, 3072, 3072]
    - [34, 35.94]
  - - [5120, 3456, 1, 3072, 5120, 5120, 3072, 3072]
    - [33, 36.4]
  - - [5120, 3520, 1, 3072, 5120, 5120, 3072, 3072]
    - [12, 35.9]
  - - [5120, 3584, 1, 3072, 5120, 5120, 3072, 3072]
    - [13, 36.31]
  - - [5120, 3648, 1, 3072, 5120, 5120, 3072, 3072]
    - [33, 35.85]
  - - [5120, 3712, 1, 3072, 5120, 5120, 3072, 3072]
    - [13, 36.48]
  - - [5120, 3776, 1, 3072, 5120, 5120, 3072, 3072]
    - [33, 35.2]
  - - [5120, 3840, 1, 3072, 5120, 5120, 3072, 3072]
    - [13, 35.76]
  - - [5120, 3904, 1, 3072, 5120, 5120, 3072, 3072]
    - [33, 36.04]
  - - [5120, 3968, 1, 3072, 5120, 5120, 3072, 3072]
    - [33, 36.38]
  - - [5120, 4032, 1, 3072, 5120, 5120, 3072, 3072]
    - [33, 36.25]
  - - [5120, 4096, 1, 3072, 5120, 5120, 3072, 3072]
    - [13, 36.81]
  - - [3072, 1, 1, 8192, 3072, 3072, 8192, 8192]
    - [4, 0.32]
  - - [3072, 64, 1, 8192, 3072, 3072, 8192, 8192]
    - [24, 17.15]
  - - [3072, 128, 1, 8192, 3072, 3072, 8192, 8192]
    - [10, 23.33]
  - - [3072, 192, 1, 8192, 3072, 3072, 8192, 8192]
    - [8, 27.85]
  - - [3072, 256, 1, 8192, 3072, 3072, 8192, 8192]
    - [45, 26.96]
  - - [3072, 320, 1, 8192, 3072, 3072, 8192, 8192]
    - [36, 27.69]
  - - [3072, 384, 1, 8192, 3072, 3072, 8192, 8192]
    - [38, 29.93]
  - - [3072, 448, 1, 8192, 3072, 3072, 8192, 8192]
    - [25, 28.61]
  - - [3072, 512, 1, 8192, 3072, 3072, 8192, 8192]
    - [47, 29.38]
  - - [3072, 576, 1, 8192, 3072, 3072, 8192, 8192]
    - [25, 31.01]
  - - [3072, 640, 1, 8192, 3072, 3072, 8192, 8192]
    - [39, 30.86]
  - - [3072, 704, 1, 8192, 3072, 3072, 8192, 8192]
    - [46, 29.5]
  - - [3072, 768, 1, 8192, 3072, 3072, 8192, 8192]
    - [25, 31.99]
  - - [3072, 832, 1, 8192, 3072, 3072, 8192, 8192]
    - [46, 30.36]
  - - [3072, 896, 1, 8192, 3072, 3072, 8192, 8192]
    - [17, 31.08]
  - - [3072, 960, 1, 8192, 3072, 3072, 8192, 8192]
    - [25, 31.78]
  - - [3072, 1024, 1, 8192, 3072, 3072, 8192, 8192]
    - [17, 31.45]
  - - [3072, 1088, 1, 8192, 3072, 3072, 8192, 8192]
    - [46, 30.45]
  - - [3072, 1152, 1, 8192, 3072, 3072, 8192, 8192]
    - [25, 32.21]
  - - [3072, 1216, 1, 8192, 3072, 3072, 8192, 8192]
    - [25, 31.36]
  - - [3072, 1280, 1, 8192, 3072, 3072, 8192, 8192]
    - [35, 31.32]
  - - [3072, 1344, 1, 8192, 3072, 3072, 8192, 8192]
    - [25, 32.0]
  - - [3072, 1408, 1, 8192, 3072, 3072, 8192, 8192]
    - [25, 31.49]
  - - [3072, 1472, 1, 8192, 3072, 3072, 8192, 8192]
    - [46, 31.35]
  - - [3072, 1536, 1, 8192, 3072, 3072, 8192, 8192]
    - [46, 32.38]
  - - [3072, 1600, 1, 8192, 3072, 3072, 8192, 8192]
    - [46, 31.61]
  - - [3072, 1664, 1, 8192, 3072, 3072, 8192, 8192]
    - [25, 31.51]
  - - [3072, 1728, 1, 8192, 3072, 3072, 8192, 8192]
    - [46, 32.71]
  - - [3072, 1792, 1, 8192, 3072, 3072, 8192, 8192]
    - [46, 32.08]
  - - [3072, 1856, 1, 8192, 3072, 3072, 8192, 8192]
    - [25, 31.54]
  - - [3072, 1920, 1, 8192, 3072, 3072, 8192, 8192]
    - [25, 32.44]
  - - [3072, 1984, 1, 8192, 3072, 3072, 8192, 8192]
    - [46, 32.19]
  - - [3072, 2048, 1, 8192, 3072, 3072, 8192, 8192]
    - [25, 31.75]
  - - [3072, 2112, 1, 8192, 3072, 3072, 8192, 8192]
    - [46, 32.42]
  - - [3072, 2176, 1, 8192, 3072, 3072, 8192, 8192]
    - [25, 32.13]
  - - [3072, 2240, 1, 8192, 3072, 3072, 8192, 8192]
    - [25, 31.98]
  - - [3072, 2304, 1, 8192, 3072, 3072, 8192, 8192]
    - [25, 32.77]
  - - [3072, 2368, 1, 8192, 3072, 3072, 8192, 8192]
    - [46, 32.28]
  - - [3072, 2432, 1, 8192, 3072, 3072, 8192, 8192]
    - [25, 32.03]
  - - [3072, 2496, 1, 8192, 3072, 3072, 8192, 8192]
    - [25, 32.84]
  - - [3072, 2560, 1, 8192, 3072, 3072, 8192, 8192]
    - [25, 32.67]
  - - [3072, 2624, 1, 8192, 3072, 3072, 8192, 8192]
    - [25, 32.17]
  - - [3072, 2688, 1, 8192, 3072, 3072, 8192, 8192]
    - [25, 32.56]
  - - [3072, 2752, 1, 8192, 3072, 3072, 8192, 8192]
    - [46, 32.27]
  - - [3072, 2816, 1, 8192, 3072, 3072, 8192, 8192]
    - [46, 32.14]
  - - [3072, 2880, 1, 8192, 3072, 3072, 8192, 8192]
    - [46, 32.87]
  - - [3072, 2944, 1, 8192, 3072, 3072, 8192, 8192]
    - [46, 32.46]
  - - [3072, 3008, 1, 8192, 3072, 3072, 8192, 8192]
    - [25, 32.2]
  - - [3072, 3072, 1, 8192, 3072, 3072, 8192, 8192]
    - [46, 32.72]
  - - [3072, 3136, 1, 8192, 3072, 3072, 8192, 8192]
    - [46, 32.7]
  - - [3072, 3200, 1, 8192, 3072, 3072, 8192, 8192]
    - [25, 32.4]
  - - [3072, 3264, 1, 8192, 3072, 3072, 8192, 8192]
    - [46, 32.72]
  - - [3072, 3328, 1, 8192, 3072, 3072, 8192, 8192]
    - [46, 32.46]
  - - [3072, 3392, 1, 8192, 3072, 3072, 8192, 8192]
    - [46, 32.31]
  - - [3072, 3456, 1, 8192, 3072, 3072, 8192, 8192]
    - [46, 32.88]
  - - [3072, 3520, 1, 8192, 3072, 3072, 8192, 8192]
    - [25, 32.7]
  - - [3072, 3584, 1, 8192, 3072, 3072, 8192, 8192]
    - [25, 32.37]
  - - [3072, 3648, 1, 8192, 3072, 3072, 8192, 8192]
    - [46, 33.06]
  - - [3072, 3712, 1, 8192, 3072, 3072, 8192, 8192]
    - [46, 32.53]
  - - [3072, 3776, 1, 8192, 3072, 3072, 8192, 8192]
    - [46, 32.57]
  - - [3072, 3840, 1, 8192, 3072, 3072, 8192, 8192]
    - [25, 32.89]
  - - [3072, 3904, 1, 8192, 3072, 3072, 8192, 8192]
    - [46, 32.71]
  - - [3072, 3968, 1, 8192, 3072, 3072, 8192, 8192]
    - [25, 32.52]
  - - [3072, 4032, 1, 8192, 3072, 3072, 8192, 8192]
    - [25, 33.03]
  - - [3072, 4096, 1, 8192, 3072, 3072, 8192, 8192]
    - [25, 32.66]
  - - [3072, 1, 1, 3072, 3072, 3072, 3072, 3072]
    - [44, 0.21]
  - - [3072, 64, 1, 3072, 3072, 3072, 3072, 3072]
    - [26, 11.94]
  - - [3072, 128, 1, 3072, 3072, 3072, 3072, 3072]
    - [37, 18.98]
  - - [3072, 192, 1, 3072, 3072, 3072, 3072, 3072]
    - [9, 22.27]
  - - [3072, 256, 1, 3072, 3072, 3072, 3072, 3072]
    - [37, 24.25]
  - - [3072, 320, 1, 3072, 3072, 3072, 3072, 3072]
    - [15, 26.98]
  - - [3072, 384, 1, 3072, 3072, 3072, 3072, 3072]
    - [27, 28.17]
  - - [3072, 448, 1, 3072, 3072, 3072, 3072, 3072]
    - [15, 27.74]
  - - [3072, 512, 1, 3072, 3072, 3072, 3072, 3072]
    - [17, 30.12]
  - - [3072, 576, 1, 3072, 3072, 3072, 3072, 3072]
    - [18, 28.42]
  - - [3072, 640, 1, 3072, 3072, 3072, 3072, 3072]
    - [36, 31.12]
  - - [3072, 704, 1, 3072, 3072, 3072, 3072, 3072]
    - [29, 30.01]
  - - [3072, 768, 1, 3072, 3072, 3072, 3072, 3072]
    - [40, 31.64]
  - - [3072, 832, 1, 3072, 3072, 3072, 3072, 3072]
    - [30, 30.93]
  - - [3072, 896, 1, 3072, 3072, 3072, 3072, 3072]
    - [34, 32.51]
  - - [3072, 960, 1, 3072, 3072, 3072, 3072, 3072]
    - [15, 33.06]
  - - [3072, 1024, 1, 3072, 3072, 3072, 3072, 3072]
    - [33, 33.65]
  - - [3072, 1088, 1, 3072, 3072, 3072, 3072, 3072]
    - [14, 32.72]
  - - [3072, 1152, 1, 3072, 3072, 3072, 3072, 3072]
    - [33, 33.6]
  - - [3072, 1216, 1, 3072, 3072, 3072, 3072, 3072]
    - [14, 32.32]
  - - [3072, 1280, 1, 3072, 3072, 3072, 3072, 3072]
    - [15, 33.84]
  - - [3072, 1344, 1, 3072, 3072, 3072, 3072, 3072]
    - [1, 32.88]
  - - [3072, 1408, 1, 3072, 3072, 3072, 3072, 3072]
    - [1, 34.42]
  - - [3072, 1472, 1, 3072, 3072, 3072, 3072, 3072]
    - [27, 33.39]
  - - [3072, 1536, 1, 3072, 3072, 3072, 3072, 3072]
    - [0, 34.89]
  - - [3072, 1600, 1, 3072, 3072, 3072, 3072, 3072]
    - [35, 34.24]
  - - [3072, 1664, 1, 3072, 3072, 3072, 3072, 3072]
    - [0, 35.05]
  - - [3072, 1728, 1, 3072, 3072, 3072, 3072, 3072]
    - [36, 33.88]
  - - [3072, 1792, 1, 3072, 3072, 3072, 3072, 3072]
    - [0, 34.36]
  - - [3072, 1856, 1, 3072, 3072, 3072, 3072, 3072]
    - [33, 34.32]
  - - [3072, 1920, 1, 3072, 3072, 3072, 3072, 3072]
    - [1, 35.36]
  - - [3072, 1984, 1, 3072, 3072, 3072, 3072, 3072]
    - [13, 34.77]
  - - [3072, 2048, 1, 3072, 3072, 3072, 3072, 3072]
    - [34, 35.73]
  - - [3072, 2112, 1, 3072, 3072, 3072, 3072, 3072]
    - [34, 34.57]
  - - [3072, 2176, 1, 3072, 3072, 3072, 3072, 3072]
    - [12, 35.61]
  - - [3072, 2240, 1, 3072, 3072, 3072, 3072, 3072]
    - [15, 34.99]
  - - [3072, 2304, 1, 3072, 3072, 3072, 3072, 3072]
    - [13, 34.79]
  - - [3072, 2368, 1, 3072, 3072, 3072, 3072, 3072]
    - [33, 35.0]
  - - [3072, 2432, 1, 3072, 3072, 3072, 3072, 3072]
    - [33, 35.89]
  - - [3072, 2496, 1, 3072, 3072, 3072, 3072, 3072]
    - [34, 35.24]
  - - [3072, 2560, 1, 3072, 3072, 3072, 3072, 3072]
    - [13, 36.14]
  - - [3072, 2624, 1, 3072, 3072, 3072, 3072, 3072]
    - [12, 35.21]
  - - [3072, 2688, 1, 3072, 3072, 3072, 3072, 3072]
    - [33, 35.95]
  - - [3072, 2752, 1, 3072, 3072, 3072, 3072, 3072]
    - [33, 34.39]
  - - [3072, 2816, 1, 3072, 3072, 3072, 3072, 3072]
    - [27, 35.35]
  - - [3072, 2880, 1, 3072, 3072, 3072, 3072, 3072]
    - [14, 35.78]
  - - [3072, 2944, 1, 3072, 3072, 3072, 3072, 3072]
    - [27, 36.3]
  - - [3072, 3008, 1, 3072, 3072, 3072, 3072, 3072]
    - [12, 35.94]
  - - [3072, 3072, 1, 3072, 3072, 3072, 3072, 3072]
    - [12, 36.46]
  - - [3072, 3136, 1, 3072, 3072, 3072, 3072, 3072]
    - [12, 35.72]
  - - [3072, 3200, 1, 3072, 3072, 3072, 3072, 3072]
    - [27, 36.32]
  - - [3072, 3264, 1, 3072, 3072, 3072, 3072, 3072]
    - [5, 34.88]
  - - [3072, 3328, 1, 3072, 3072, 3072, 3072, 3072]
    - [15, 35.71]
  - - [3072, 3392, 1, 3072, 3072, 3072, 3072, 3072]
    - [13, 35.86]
  - - [3072, 3456, 1, 3072, 3072, 3072, 3072, 3072]
    - [28, 36.57]
  - - [3072, 3520, 1, 3072, 3072, 3072, 3072, 3072]
    - [34, 36.01]
  - - [3072, 3584, 1, 3072, 3072, 3072, 3072, 3072]
    - [0, 36.73]
  - - [3072, 3648, 1, 3072, 3072, 3072, 3072, 3072]
    - [33, 35.73]
  - - [3072, 3712, 1, 3072, 3072, 3072, 3072, 3072]
    - [0, 36.41]
  - - [3072, 3776, 1, 3072, 3072, 3072, 3072, 3072]
    - [35, 35.19]
  - - [3072, 3840, 1, 3072, 3072, 3072, 3072, 3072]
    - [14, 35.92]
  - - [3072, 3904, 1, 3072, 3072, 3072, 3072, 3072]
    - [33, 35.76]
  - - [3072, 3968, 1, 3072, 3072, 3072, 3072, 3072]
    - [13, 36.32]
  - - [3072, 4032, 1, 3072, 3072, 3072, 3072, 3072]
    - [34, 35.79]
  - - [3072, 4096, 1, 3072, 3072, 3072, 3072, 3072]
    - [12, 36.36]
  - - [16384, 1, 1, 3072, 16384, 16384, 3072, 3072]
    - [43, 0.22]
  - - [16384, 64, 1, 3072, 16384, 16384, 3072, 3072]
    - [22, 13.19]
  - - [16384, 128, 1, 3072, 16384, 16384, 3072, 3072]
    - [39, 24.97]
  - - [16384, 192, 1, 3072, 16384, 16384, 3072, 3072]
    - [29, 28.93]
  - - [16384, 256, 1, 3072, 16384, 16384, 3072, 3072]
    - [16, 31.61]
  - - [16384, 320, 1, 3072, 16384, 16384, 3072, 3072]
    - [35, 32.47]
  - - [16384, 384, 1, 3072, 16384, 16384, 3072, 3072]
    - [33, 34.43]
  - - [16384, 448, 1, 3072, 16384, 16384, 3072, 3072]
    - [6, 33.1]
  - - [16384, 512, 1, 3072, 16384, 16384, 3072, 3072]
    - [13, 34.98]
  - - [16384, 576, 1, 3072, 16384, 16384, 3072, 3072]
    - [18, 33.76]
  - - [16384, 640, 1, 3072, 16384, 16384, 3072, 3072]
    - [12, 35.61]
  - - [16384, 704, 1, 3072, 16384, 16384, 3072, 3072]
    - [13, 33.11]
  - - [16384, 768, 1, 3072, 16384, 16384, 3072, 3072]
    - [13, 36.27]
  - - [16384, 832, 1, 3072, 16384, 16384, 3072, 3072]
    - [33, 33.95]
  - - [16384, 896, 1, 3072, 16384, 16384, 3072, 3072]
    - [13, 36.24]
  - - [16384, 960, 1, 3072, 16384, 16384, 3072, 3072]
    - [14, 35.51]
  - - [16384, 1024, 1, 3072, 16384, 16384, 3072, 3072]
    - [13, 35.86]
  - - [16384, 1088, 1, 3072, 16384, 16384, 3072, 3072]
    - [14, 34.59]
  - - [16384, 1152, 1, 3072, 16384, 16384, 3072, 3072]
    - [9, 35.51]
  - - [16384, 1216, 1, 3072, 16384, 16384, 3072, 3072]
    - [7, 33.95]
  - - [16384, 1280, 1, 3072, 16384, 16384, 3072, 3072]
    - [34, 35.83]
  - - [16384, 1344, 1, 3072, 16384, 16384, 3072, 3072]
    - [9, 35.49]
  - - [16384, 1408, 1, 3072, 16384, 16384, 3072, 3072]
    - [38, 35.84]
  - - [16384, 1472, 1, 3072, 16384, 16384, 3072, 3072]
    - [17, 34.54]
  - - [16384, 1536, 1, 3072, 16384, 16384, 3072, 3072]
    - [12, 36.35]
  - - [16384, 1600, 1, 3072, 16384, 16384, 3072, 3072]
    - [34, 34.94]
  - - [16384, 1664, 1, 3072, 16384, 16384, 3072, 3072]
    - [39, 36.09]
  - - [16384, 1728, 1, 3072, 16384, 16384, 3072, 3072]
    - [13, 35.2]
  - - [16384, 1792, 1, 3072, 16384, 16384, 3072, 3072]
    - [33, 36.58]
  - - [16384, 1856, 1, 3072, 16384, 16384, 3072, 3072]
    - [33, 35.1]
  - - [16384, 1920, 1, 3072, 16384, 16384, 3072, 3072]
    - [34, 36.11]
  - - [16384, 1984, 1, 3072, 16384, 16384, 3072, 3072]
    - [34, 35.72]
  - - [16384, 2048, 1, 3072, 16384, 16384, 3072, 3072]
    - [16, 35.92]
  - - [16384, 2112, 1, 3072, 16384, 16384, 3072, 3072]
    - [32, 34.8]
  - - [16384, 2176, 1, 3072, 16384, 16384, 3072, 3072]
    - [16, 35.36]
  - - [16384, 2240, 1, 3072, 16384, 16384, 3072, 3072]
    - [15, 35.4]
  - - [16384, 2304, 1, 3072, 16384, 16384, 3072, 3072]
    - [39, 36.05]
  - - [16384, 2368, 1, 3072, 16384, 16384, 3072, 3072]
    - [16, 34.92]
  - - [16384, 2432, 1, 3072, 16384, 16384, 3072, 3072]
    - [33, 36.35]
  - - [16384, 2496, 1, 3072, 16384, 16384, 3072, 3072]
    - [39, 35.13]
  - - [16384, 2560, 1, 3072, 16384, 16384, 3072, 3072]
    - [17, 35.68]
  - - [16384, 2624, 1, 3072, 16384, 16384, 3072, 3072]
    - [38, 34.84]
  - - [16384, 2688, 1, 3072, 16384, 16384, 3072, 3072]
    - [12, 36.15]
  - - [16384, 2752, 1, 3072, 16384, 16384, 3072, 3072]
    - [39, 35.14]
  - - [16384, 2816, 1, 3072, 16384, 16384, 3072, 3072]
    - [34, 36.76]
  - - [16384, 2880, 1, 3072, 16384, 16384, 3072, 3072]
    - [32, 35.35]
  - - [16384, 2944, 1, 3072, 16384, 16384, 3072, 3072]
    - [17, 36.04]
  - - [16384, 3008, 1, 3072, 16384, 16384, 3072, 3072]
    - [33, 35.63]
  - - [16384, 3072, 1, 3072, 16384, 16384, 3072, 3072]
    - [34, 36.49]
  - - [16384, 3136, 1, 3072, 16384, 16384, 3072, 3072]
    - [34, 34.93]
  - - [16384, 3200, 1, 3072, 16384, 16384, 3072, 3072]
    - [17, 35.54]
  - - [16384, 3264, 1, 3072, 16384, 16384, 3072, 3072]
    - [17, 35.01]
  - - [16384, 3328, 1, 3072, 16384, 16384, 3072, 3072]
    - [38, 35.83]
  - - [16384, 3392, 1, 3072, 16384, 16384, 3072, 3072]
    - [16, 35.5]
  - - [16384, 3456, 1, 3072, 16384, 16384, 3072, 3072]
    - [16, 35.96]
  - - [16384, 3520, 1, 3072, 16384, 16384, 3072, 3072]
    - [17, 35.58]
  - - [16384, 3584, 1, 3072, 16384, 16384, 3072, 3072]
    - [13, 36.4]
  - - [16384, 3648, 1, 3072, 16384, 16384, 3072, 3072]
    - [16, 35.45]
  - - [16384, 3712, 1, 3072, 16384, 16384, 3072, 3072]
    - [34, 36.97]
  - - [16384, 3776, 1, 3072, 16384, 16384, 3072, 3072]
    - [17, 35.17]
  - - [16384, 3840, 1, 3072, 16384, 16384, 3072, 3072]
    - [13, 36.38]
  - - [16384, 3904, 1, 3072, 16384, 16384, 3072, 3072]
    - [16, 35.29]
  - - [16384, 3968, 1, 3072, 16384, 16384, 3072, 3072]
    - [33, 36.46]
  - - [16384, 4032, 1, 3072, 16384, 16384, 3072, 3072]
    - [17, 35.29]
  - - [16384, 4096, 1, 3072, 16384, 16384, 3072, 3072]
    - [39, 35.63]
  - - [128256, 1, 1, 3072, 128256, 128256, 3072, 3072]
    - [23, 0.26]
  - - [128256, 64, 1, 3072, 128256, 128256, 3072, 3072]
    - [47, 15.36]
  - - [128256, 128, 1, 3072, 128256, 128256, 3072, 3072]
    - [39, 28.78]
  - - [128256, 192, 1, 3072, 128256, 128256, 3072, 3072]
    - [41, 33.19]
  - - [128256, 256, 1, 3072, 128256, 128256, 3072, 3072]
    - [13, 35.79]
- null
- null
- ExperimentalStreamK
- GridBased
