projects/hipblaslt/library/src/amd_detail/rocblaslt/src/Tensile/Logic/asm_full/gfx1201/GridBased/gfx1201_Cijk_Alik_Bljk_S_B_Bias_SHB_HAS_SAB_SCD_SAV_UserArgs.yaml
- {MinimumRequiredVersion: 5.0.0}
- gfx1201
- gfx1201
- [Device 73f0]
    SolutionIndex: 0
    SolutionNameMin: Cijk_Alik_Bljk_S_B_UserArgs_MT96x32x8_SN_LDSB0_AFC0_AG0_AFEM1_AFEM1_ASEM1_CLR0_CADS0_DTLA0_DTLB0_DTVA0_DTVB0_DTVSM0_DPLB0_EPS1_ELFLR0_EMLLn1_FDSI0_GRPM1_GRVWA1_GRVWB1_GSU1_GSUAMB_GSUC0_GSUWGMRR0_GLS0_ISA1201_IU1_K1_LDSTI0_LBSPPA0_LBSPPB0_LBSPPM0_LPA4_LPB4_LPM0_LRVW1_LWPMn1_MIAV0_MO40_MGRIPM1_NTn1_NTA0_NTB0_NTC0_NTD0_NTM0_NEPBS0_NLCA1_NLCB1_ONLL1_PGR1_PLR1_PKA0_SGROB0_SIA1_SS0_SU16_SUM0_SUS256_SPO0_SRVW0_SSO0_SVW1_SK0_SKFTR0_SKXCCM0_SGRO0_TIN0_TT6_4_TLDS0_TLDSMn1_ULSGRO0_USL1_UIOFGRO0_UPLRP0_USFGROn1_VSn1_VWA1_VWB1_WSGRA0_WSGRB0_WS32_WG16_8_1_WGM1_WGMXCC1_WGMXCCGn1
    SolutionIndex: 1
    SolutionNameMin: Cijk_Alik_Bljk_S_B_UserArgs_MT64x64x8_SN_LDSB0_AFC0_AG0_AFEM1_AFEM1_ASEM1_CLR0_CADS0_DTLA0_DTLB0_DTVA0_DTVB0_DTVSM0_DPLB0_EPS1_ELFLR0_EMLLn1_FDSI0_GRPM1_GRVWA1_GRVWB1_GSU1_GSUAMB_GSUC0_GSUWGMRR0_GLS0_ISA1201_IU1_K1_LDSTI0_LBSPPA0_LBSPPB0_LBSPPM0_LPA4_LPB4_LPM0_LRVW1_LWPMn1_MIAV0_MO40_MGRIPM1_NTn1_NTA0_NTB0_NTC0_NTD0_NTM0_NEPBS0_NLCA1_NLCB1_ONLL1_PGR1_PLR1_PKA0_SGROB0_SIA1_SS0_SU16_SUM0_SUS256_SPO0_SRVW0_SSO0_SVW1_SK0_SKFTR0_SKXCCM0_SGRO0_TIN0_TT8_4_TLDS0_TLDSMn1_ULSGRO0_USL1_UIOFGRO0_UPLRP0_USFGROn1_VSn1_VWA1_VWB1_WSGRA0_WSGRB0_WS32_WG8_16_1_WGM1_WGMXCC1_WGMXCCGn1
    SolutionIndex: 2
    SolutionNameMin: Cijk_Alik_Bljk_S_B_UserArgs_MT64x64x8_SN_LDSB0_AFC0_AG0_AFEM1_AFEM1_ASEM1_CLR0_CADS0_DTLA0_DTLB0_DTVA0_DTVB0_DTVSM0_DPLB0_EPS1_ELFLR0_EMLLn1_FDSI0_GRPM1_GRVWA1_GRVWB1_GSU1_GSUAMB_GSUC0_GSUWGMRR0_GLS0_ISA1201_IU1_K1_LDSTI0_LBSPPA0_LBSPPB0_LBSPPM0_LPA4_LPB4_LPM0_LRVW1_LWPMn1_MIAV0_MO40_MGRIPM1_NTn1_NTA0_NTB0_NTC0_NTD0_NTM0_NEPBS0_NLCA1_NLCB1_ONLL1_PGR1_PLR1_PKA0_SGROB0_SIA1_SS0_SU32_SUM0_SUS256_SPO0_SRVW0_SSO0_SVW1_SK0_SKFTR0_SKXCCM0_SGRO0_TIN0_TT8_4_TLDS0_TLDSMn1_ULSGRO0_USL1_UIOFGRO0_UPLRP0_USFGROn1_VSn1_VWA1_VWB1_WSGRA0_WSGRB0_WS32_WG8_16_1_WGM1_WGMXCC1_WGMXCCGn1
    SolutionIndex: 3
    SolutionNameMin: Cijk_Alik_Bljk_S_B_UserArgs_MT64x64x8_SN_LDSB0_AFC0_AG0_AFEM1_AFEM1_ASEM1_CLR0_CADS0_DTLA0_DTLB0_DTVA0_DTVB0_DTVSM0_DPLB0_EPS1_ELFLR0_EMLLn1_FDSI0_GRPM1_GRVWA1_GRVWB1_GSU1_GSUAMB_GSUC0_GSUWGMRR0_GLS0_ISA1201_IU1_K1_LDSTI0_LBSPPA0_LBSPPB0_LBSPPM0_LPA4_LPB4_LPM0_LRVW1_LWPMn1_MIAV0_MO40_MGRIPM1_NTn1_NTA0_NTB0_NTC0_NTD0_NTM0_NEPBS0_NLCA1_NLCB1_ONLL1_PGR1_PLR1_PKA0_SGROB0_SIA1_SS0_SU64_SUM0_SUS256_SPO0_SRVW0_SSO0_SVW1_SK0_SKFTR0_SKXCCM0_SGRO0_TIN0_TT8_4_TLDS0_TLDSMn1_ULSGRO0_USL1_UIOFGRO0_UPLRP0_USFGROn1_VSn1_VWA1_VWB1_WSGRA0_WSGRB0_WS32_WG8_16_1_WGM1_WGMXCC1_WGMXCCGn1
    SolutionIndex: 4
    SolutionNameMin: Cijk_Alik_Bljk_S_B_UserArgs_MT128x32x8_SN_LDSB0_AFC0_AG0_AFEM1_AFEM1_ASEM1_CLR0_CADS0_DTLA0_DTLB0_DTVA0_DTVB0_DTVSM0_DPLB0_EPS1_ELFLR0_EMLLn1_FDSI0_GRPM1_GRVWA1_GRVWB1_GSU1_GSUAMB_GSUC0_GSUWGMRR0_GLS0_ISA1201_IU1_K1_LDSTI0_LBSPPA0_LBSPPB0_LBSPPM0_LPA4_LPB4_LPM0_LRVW1_LWPMn1_MIAV0_MO40_MGRIPM1_NTn1_NTA0_NTB0_NTC0_NTD0_NTM0_NEPBS0_NLCA1_NLCB1_ONLL1_PGR1_PLR1_PKA0_SGROB0_SIA1_SS0_SU16_SUM0_SUS256_SPO0_SRVW0_SSO0_SVW1_SK0_SKFTR0_SKXCCM0_SGRO0_TIN0_TT8_4_TLDS0_TLDSMn1_ULSGRO0_USL1_UIOFGRO0_UPLRP0_USFGROn1_VSn1_VWA1_VWB1_WSGRA0_WSGRB0_WS32_WG16_8_1_WGM1_WGMXCC1_WGMXCCGn1
    SolutionIndex: 5
    SolutionNameMin: Cijk_Alik_Bljk_S_B_UserArgs_MT128x32x8_SN_LDSB0_AFC0_AG0_AFEM1_AFEM1_ASEM1_CLR0_CADS0_DTLA0_DTLB0_DTVA0_DTVB0_DTVSM0_DPLB0_EPS1_ELFLR0_EMLLn1_FDSI0_GRPM1_GRVWA1_GRVWB1_GSU1_GSUAMB_GSUC0_GSUWGMRR0_GLS0_ISA1201_IU1_K1_LDSTI0_LBSPPA0_LBSPPB0_LBSPPM0_LPA4_LPB4_LPM0_LRVW1_LWPMn1_MIAV0_MO40_MGRIPM1_NTn1_NTA0_NTB0_NTC0_NTD0_NTM0_NEPBS0_NLCA1_NLCB1_ONLL1_PGR1_PLR1_PKA0_SGROB0_SIA1_SS0_SU32_SUM0_SUS256_SPO0_SRVW0_SSO0_SVW1_SK0_SKFTR0_SKXCCM0_SGRO0_TIN0_TT8_4_TLDS0_TLDSMn1_ULSGRO0_USL1_UIOFGRO0_UPLRP0_USFGROn1_VSn1_VWA1_VWB1_WSGRA0_WSGRB0_WS32_WG16_8_1_WGM1_WGMXCC1_WGMXCCGn1
    SolutionIndex: 6
    SolutionNameMin: Cijk_Alik_Bljk_S_B_UserArgs_MT64x64x8_SN_LDSB0_AFC0_AG0_AFEM1_AFEM1_ASEM1_CLR0_CADS0_DTLA0_DTLB0_DTVA0_DTVB0_DTVSM0_DPLB0_EPS1_ELFLR0_EMLLn1_FDSI0_GRPM1_GRVWA1_GRVWB1_GSU1_GSUAMB_GSUC0_GSUWGMRR0_GLS0_ISA1201_IU1_K1_LDSTI0_LBSPPA0_LBSPPB0_LBSPPM0_LPA4_LPB4_LPM0_LRVW1_LWPMn1_MIAV0_MO40_MGRIPM1_NTn1_NTA0_NTB0_NTC0_NTD0_NTM0_NEPBS0_NLCA1_NLCB1_ONLL1_PGR1_PLR1_PKA0_SGROB0_SIA1_SS0_SU16_SUM0_SUS256_SPO0_SRVW0_SSO0_SVW1_SK0_SKFTR0_SKXCCM0_SGRO0_TIN0_TT8_8_TLDS0_TLDSMn1_ULSGRO0_USL1_UIOFGRO0_UPLRP0_USFGROn1_VSn1_VWA1_VWB1_WSGRA0_WSGRB0_WS32_WG8_8_1_WGM1_WGMXCC1_WGMXCCGn1
    SolutionIndex: 7
    SolutionNameMin: Cijk_Alik_Bljk_S_B_UserArgs_MT128x64x8_SN_LDSB0_AFC0_AG0_AFEM1_AFEM1_ASEM1_CLR0_CADS0_DTLA0_DTLB0_DTVA0_DTVB0_DTVSM0_DPLB0_EPS1_ELFLR0_EMLLn1_FDSI0_GRPM1_GRVWA1_GRVWB1_GSU1_GSUAMB_GSUC0_GSUWGMRR0_GLS0_ISA1201_IU1_K1_LDSTI0_LBSPPA0_LBSPPB0_LBSPPM0_LPA4_LPB4_LPM0_LRVW1_LWPMn1_MIAV0_MO40_MGRIPM1_NTn1_NTA0_NTB0_NTC0_NTD0_NTM0_NEPBS0_NLCA1_NLCB1_ONLL1_PGR1_PLR1_PKA0_SGROB0_SIA1_SS0_SU16_SUM0_SUS256_SPO0_SRVW0_SSO0_SVW1_SK0_SKFTR0_SKXCCM0_SGRO0_TIN0_TT8_8_TLDS0_TLDSMn1_ULSGRO0_USL1_UIOFGRO0_UPLRP0_USFGROn1_VSn1_VWA1_VWB1_WSGRA0_WSGRB0_WS32_WG16_8_1_WGM1_WGMXCC1_WGMXCCGn1
    SolutionIndex: 8
    SolutionNameMin: Cijk_Alik_Bljk_S_B_UserArgs_MT32x16x16_SN_LDSB0_AFC0_AG0_AFEM1_AFEM1_ASEM1_CLR0_CADS0_DTLA0_DTLB0_DTVA0_DTVB0_DTVSM0_DPLB0_EPS1_ELFLR0_EMLLn1_FDSI0_GRPM1_GRVWA1_GRVWB1_GSU1_GSUAMB_GSUC0_GSUWGMRR0_GLS0_ISA1201_IU1_K1_LDSTI0_LBSPPA0_LBSPPB0_LBSPPM0_LPA4_LPB4_LPM0_LRVW1_LWPMn1_MIAV0_MO40_MGRIPM1_NTn1_NTA0_NTB0_NTC0_NTD0_NTM0_NEPBS0_NLCA1_NLCB1_ONLL1_PGR1_PLR1_PKA0_SGROB0_SIA1_SS0_SU32_SUM0_SUS256_SPO0_SRVW0_SSO0_SVW1_SK0_SKFTR0_SKXCCM0_SGRO0_TIN0_TT2_2_TLDS0_TLDSMn1_ULSGRO0_USL1_UIOFGRO0_UPLRP0_USFGROn1_VSn1_VWA1_VWB1_WSGRA0_WSGRB0_WS32_WG16_8_1_WGM1_WGMXCC1_WGMXCCGn1
    SolutionIndex: 9
    SolutionNameMin: Cijk_Alik_Bljk_S_B_UserArgs_MT64x32x16_SN_LDSB0_AFC0_AG0_AFEM1_AFEM1_ASEM1_CLR0_CADS0_DTLA0_DTLB0_DTVA0_DTVB0_DTVSM0_DPLB0_EPS1_ELFLR0_EMLLn1_FDSI0_GRPM1_GRVWA1_GRVWB1_GSU1_GSUAMB_GSUC0_GSUWGMRR0_GLS0_ISA1201_IU1_K1_LDSTI0_LBSPPA0_LBSPPB0_LBSPPM0_LPA4_LPB4_LPM0_LRVW1_LWPMn1_MIAV0_MO40_MGRIPM1_NTn1_NTA0_NTB0_NTC0_NTD0_NTM0_NEPBS0_NLCA1_NLCB1_ONLL1_PGR1_PLR1_PKA0_SGROB0_SIA1_SS0_SU16_SUM0_SUS256_SPO0_SRVW0_SSO0_SVW1_SK0_SKFTR0_SKXCCM0_SGRO0_TIN0_TT4_4_TLDS0_TLDSMn1_ULSGRO0_USL1_UIOFGRO0_UPLRP0_USFGROn1_VSn1_VWA1_VWB1_WSGRA0_WSGRB0_WS32_WG16_8_1_WGM1_WGMXCC1_WGMXCCGn1
    SolutionIndex: 10
    SolutionNameMin: Cijk_Alik_Bljk_S_B_UserArgs_MT48x16x16_SN_LDSB0_AFC0_AG0_AFEM1_AFEM1_ASEM1_CLR0_CADS0_DTLA0_DTLB0_DTVA0_DTVB0_DTVSM0_DPLB0_EPS1_ELFLR0_EMLLn1_FDSI0_GRPM1_GRVWA1_GRVWB1_GSU1_GSUAMB_GSUC0_GSUWGMRR0_GLS0_ISA1201_IU1_K1_LDSTI0_LBSPPA0_LBSPPB0_LBSPPM0_LPA4_LPB4_LPM0_LRVW1_LWPMn1_MIAV0_MO40_MGRIPM1_NTn1_NTA0_NTB0_NTC0_NTD0_NTM0_NEPBS0_NLCA1_NLCB1_ONLL1_PGR1_PLR1_PKA0_SGROB0_SIA1_SS0_SU64_SUM0_SUS256_SPO0_SRVW0_SSO0_SVW1_SK0_SKFTR0_SKXCCM0_SGRO0_TIN0_TT6_4_TLDS0_TLDSMn1_ULSGRO0_USL1_UIOFGRO0_UPLRP0_USFGROn1_VSn1_VWA1_VWB1_WSGRA0_WSGRB0_WS32_WG8_4_1_WGM1_WGMXCC1_WGMXCCGn1
    SolutionIndex: 11
    SolutionNameMin: Cijk_Alik_Bljk_S_B_UserArgs_MT64x64x16_SN_LDSB0_AFC0_AG0_AFEM1_AFEM1_ASEM1_CLR0_CADS0_DTLA0_DTLB0_DTVA0_DTVB0_DTVSM0_DPLB0_EPS1_ELFLR0_EMLLn1_FDSI0_GRPM1_GRVWA1_GRVWB1_GSU1_GSUAMB_GSUC0_GSUWGMRR0_GLS0_ISA1201_IU1_K1_LDSTI0_LBSPPA0_LBSPPB0_LBSPPM0_LPA4_LPB4_LPM0_LRVW1_LWPMn1_MIAV0_MO40_MGRIPM1_NTn1_NTA0_NTB0_NTC0_NTD0_NTM0_NEPBS0_NLCA1_NLCB1_ONLL1_PGR1_PLR1_PKA0_SGROB0_SIA1_SS0_SU16_SUM0_SUS256_SPO0_SRVW0_SSO0_SVW1_SK0_SKFTR0_SKXCCM0_SGRO0_TIN0_TT8_4_TLDS0_TLDSMn1_ULSGRO0_USL1_UIOFGRO0_UPLRP0_USFGROn1_VSn1_VWA1_VWB1_WSGRA0_WSGRB0_WS32_WG8_16_1_WGM1_WGMXCC1_WGMXCCGn1
    SolutionIndex: 12
    SolutionNameMin: Cijk_Alik_Bljk_S_B_UserArgs_MT128x64x16_SN_LDSB0_AFC0_AG0_AFEM1_AFEM1_ASEM1_CLR0_CADS0_DTLA0_DTLB0_DTVA0_DTVB0_DTVSM0_DPLB0_EPS1_ELFLR0_EMLLn1_FDSI0_GRPM1_GRVWA1_GRVWB1_GSU1_GSUAMB_GSUC0_GSUWGMRR0_GLS0_ISA1201_IU1_K1_LDSTI0_LBSPPA0_LBSPPB0_LBSPPM0_LPA4_LPB4_LPM0_LRVW1_LWPMn1_MIAV0_MO40_MGRIPM1_NTn1_NTA0_NTB0_NTC0_NTD0_NTM0_NEPBS0_NLCA1_NLCB1_ONLL1_PGR1_PLR1_PKA0_SGROB0_SIA1_SS0_SU16_SUM0_SUS256_SPO0_SRVW0_SSO0_SVW1_SK0_SKFTR0_SKXCCM0_SGRO0_TIN0_TT8_8_TLDS0_TLDSMn1_ULSGRO0_USL1_UIOFGRO0_UPLRP0_USFGROn1_VSn1_VWA1_VWB1_WSGRA0_WSGRB0_WS32_WG16_8_1_WGM1_WGMXCC1_WGMXCCGn1
    SolutionIndex: 13
    SolutionNameMin: Cijk_Alik_Bljk_S_B_UserArgs_MT32x16x32_SN_LDSB0_AFC0_AG0_AFEM1_AFEM1_ASEM1_CLR0_CADS0_DTLA0_DTLB0_DTVA0_DTVB0_DTVSM0_DPLB0_EPS1_ELFLR0_EMLLn1_FDSI0_GRPM1_GRVWA1_GRVWB1_GSU1_GSUAMB_GSUC0_GSUWGMRR0_GLS0_ISA1201_IU1_K1_LDSTI0_LBSPPA0_LBSPPB0_LBSPPM0_LPA4_LPB4_LPM0_LRVW1_LWPMn1_MIAV0_MO40_MGRIPM1_NTn1_NTA0_NTB0_NTC0_NTD0_NTM0_NEPBS0_NLCA1_NLCB1_ONLL1_PGR1_PLR1_PKA0_SGROB0_SIA1_SS0_SU32_SUM0_SUS256_SPO0_SRVW0_SSO0_SVW1_SK0_SKFTR0_SKXCCM0_SGRO0_TIN0_TT2_2_TLDS0_TLDSMn1_ULSGRO0_USL1_UIOFGRO0_UPLRP0_USFGROn1_VSn1_VWA1_VWB1_WSGRA0_WSGRB0_WS32_WG16_8_1_WGM1_WGMXCC1_WGMXCCGn1
    SolutionIndex: 14
    SolutionNameMin: Cijk_Alik_Bljk_S_B_UserArgs_MT32x16x32_SN_LDSB0_AFC0_AG0_AFEM1_AFEM1_ASEM1_CLR0_CADS0_DTLA0_DTLB0_DTVA0_DTVB0_DTVSM0_DPLB0_EPS1_ELFLR0_EMLLn1_FDSI0_GRPM1_GRVWA1_GRVWB1_GSU1_GSUAMB_GSUC0_GSUWGMRR0_GLS0_ISA1201_IU1_K1_LDSTI0_LBSPPA0_LBSPPB0_LBSPPM0_LPA4_LPB4_LPM0_LRVW1_LWPMn1_MIAV0_MO40_MGRIPM1_NTn1_NTA0_NTB0_NTC0_NTD0_NTM0_NEPBS0_NLCA1_NLCB1_ONLL1_PGR1_PLR1_PKA0_SGROB0_SIA1_SS0_SU64_SUM0_SUS256_SPO0_SRVW0_SSO0_SVW1_SK0_SKFTR0_SKXCCM0_SGRO0_TIN0_TT2_2_TLDS0_TLDSMn1_ULSGRO0_USL1_UIOFGRO0_UPLRP0_USFGROn1_VSn1_VWA1_VWB1_WSGRA0_WSGRB0_WS32_WG16_8_1_WGM1_WGMXCC1_WGMXCCGn1
    SolutionIndex: 15
    SolutionNameMin: Cijk_Alik_Bljk_S_B_UserArgs_MT24x32x32_SN_LDSB0_AFC0_AG0_AFEM1_AFEM1_ASEM1_CLR0_CADS0_DTLA0_DTLB0_DTVA0_DTVB0_DTVSM0_DPLB0_EPS1_ELFLR0_EMLLn1_FDSI0_GRPM1_GRVWA1_GRVWB1_GSU1_GSUAMB_GSUC0_GSUWGMRR0_GLS0_ISA1201_IU1_K1_LDSTI0_LBSPPA0_LBSPPB0_LBSPPM0_LPA4_LPB4_LPM0_LRVW1_LWPMn1_MIAV0_MO40_MGRIPM1_NTn1_NTA0_NTB0_NTC0_NTD0_NTM0_NEPBS0_NLCA1_NLCB1_ONLL1_PGR1_PLR1_PKA0_SGROB0_SIA1_SS0_SU16_SUM0_SUS256_SPO0_SRVW0_SSO0_SVW1_SK0_SKFTR0_SKXCCM0_SGRO0_TIN0_TT3_2_TLDS0_TLDSMn1_ULSGRO0_USL1_UIOFGRO0_UPLRP0_USFGROn1_VSn1_VWA1_VWB1_WSGRA0_WSGRB0_WS32_WG8_16_1_WGM1_WGMXCC1_WGMXCCGn1
    SolutionIndex: 16
    SolutionNameMin: Cijk_Alik_Bljk_S_B_UserArgs_MT16x32x64_SN_LDSB0_AFC0_AG0_AFEM1_AFEM1_ASEM1_CLR0_CADS0_DTLA0_DTLB0_DTVA0_DTVB0_DTVSM0_DPLB0_EPS1_ELFLR0_EMLLn1_FDSI0_GRPM1_GRVWA1_GRVWB1_GSU1_GSUAMB_GSUC0_GSUWGMRR0_GLS0_ISA1201_IU1_K1_LDSTI0_LBSPPA0_LBSPPB0_LBSPPM0_LPA4_LPB4_LPM0_LRVW1_LWPMn1_MIAV0_MO40_MGRIPM1_NTn1_NTA0_NTB0_NTC0_NTD0_NTM0_NEPBS0_NLCA1_NLCB1_ONLL1_PGR1_PLR1_PKA0_SGROB0_SIA1_SS0_SU32_SUM0_SUS256_SPO0_SRVW0_SSO0_SVW1_SK0_SKFTR0_SKXCCM0_SGRO0_TIN0_TT2_2_TLDS0_TLDSMn1_ULSGRO0_USL1_UIOFGRO0_UPLRP0_USFGROn1_VSn1_VWA1_VWB1_WSGRA0_WSGRB0_WS32_WG8_16_1_WGM1_WGMXCC1_WGMXCCGn1
    SolutionIndex: 17
    SolutionNameMin: Cijk_Alik_Bljk_S_B_UserArgs_MT16x32x64_SN_LDSB0_AFC0_AG0_AFEM1_AFEM1_ASEM1_CLR0_CADS0_DTLA0_DTLB0_DTVA0_DTVB0_DTVSM0_DPLB0_EPS1_ELFLR0_EMLLn1_FDSI0_GRPM1_GRVWA1_GRVWB1_GSU1_GSUAMB_GSUC0_GSUWGMRR0_GLS0_ISA1201_IU1_K1_LDSTI0_LBSPPA0_LBSPPB0_LBSPPM0_LPA4_LPB4_LPM0_LRVW1_LWPMn1_MIAV0_MO40_MGRIPM1_NTn1_NTA0_NTB0_NTC0_NTD0_NTM0_NEPBS0_NLCA1_NLCB1_ONLL1_PGR1_PLR1_PKA0_SGROB0_SIA1_SS0_SU64_SUM0_SUS256_SPO0_SRVW0_SSO0_SVW1_SK0_SKFTR0_SKXCCM0_SGRO0_TIN0_TT2_2_TLDS0_TLDSMn1_ULSGRO0_USL1_UIOFGRO0_UPLRP0_USFGROn1_VSn1_VWA1_VWB1_WSGRA0_WSGRB0_WS32_WG8_16_1_WGM1_WGMXCC1_WGMXCCGn1
    SolutionIndex: 18
    SolutionNameMin: Cijk_Alik_Bljk_S_B_UserArgs_MT32x16x64_SN_LDSB0_AFC0_AG0_AFEM1_AFEM1_ASEM1_CLR0_CADS0_DTLA0_DTLB0_DTVA0_DTVB0_DTVSM0_DPLB0_EPS1_ELFLR0_EMLLn1_FDSI0_GRPM1_GRVWA1_GRVWB1_GSU1_GSUAMB_GSUC0_GSUWGMRR0_GLS0_ISA1201_IU1_K1_LDSTI0_LBSPPA0_LBSPPB0_LBSPPM0_LPA4_LPB4_LPM0_LRVW1_LWPMn1_MIAV0_MO40_MGRIPM1_NTn1_NTA0_NTB0_NTC0_NTD0_NTM0_NEPBS0_NLCA1_NLCB1_ONLL1_PGR1_PLR1_PKA0_SGROB0_SIA1_SS0_SU16_SUM0_SUS256_SPO0_SRVW0_SSO0_SVW1_SK0_SKFTR0_SKXCCM0_SGRO0_TIN0_TT2_2_TLDS0_TLDSMn1_ULSGRO0_USL1_UIOFGRO0_UPLRP0_USFGROn1_VSn1_VWA1_VWB1_WSGRA0_WSGRB0_WS32_WG16_8_1_WGM1_WGMXCC1_WGMXCCGn1
    SolutionIndex: 19
    SolutionNameMin: Cijk_Alik_Bljk_S_B_UserArgs_MT32x16x64_SN_LDSB0_AFC0_AG0_AFEM1_AFEM1_ASEM1_CLR0_CADS0_DTLA0_DTLB0_DTVA0_DTVB0_DTVSM0_DPLB0_EPS1_ELFLR0_EMLLn1_FDSI0_GRPM1_GRVWA1_GRVWB1_GSU1_GSUAMB_GSUC0_GSUWGMRR0_GLS0_ISA1201_IU1_K1_LDSTI0_LBSPPA0_LBSPPB0_LBSPPM0_LPA4_LPB4_LPM0_LRVW1_LWPMn1_MIAV0_MO40_MGRIPM1_NTn1_NTA0_NTB0_NTC0_NTD0_NTM0_NEPBS0_NLCA1_NLCB1_ONLL1_PGR1_PLR1_PKA0_SGROB0_SIA1_SS0_SU32_SUM0_SUS256_SPO0_SRVW0_SSO0_SVW1_SK0_SKFTR0_SKXCCM0_SGRO0_TIN0_TT2_2_TLDS0_TLDSMn1_ULSGRO0_USL1_UIOFGRO0_UPLRP0_USFGROn1_VSn1_VWA1_VWB1_WSGRA0_WSGRB0_WS32_WG16_8_1_WGM1_WGMXCC1_WGMXCCGn1
    SolutionIndex: 20
    SolutionNameMin: Cijk_Alik_Bljk_S_B_UserArgs_MT48x16x64_SN_LDSB0_AFC0_AG0_AFEM1_AFEM1_ASEM1_CLR0_CADS0_DTLA0_DTLB0_DTVA0_DTVB0_DTVSM0_DPLB0_EPS1_ELFLR0_EMLLn1_FDSI0_GRPM1_GRVWA1_GRVWB1_GSU1_GSUAMB_GSUC0_GSUWGMRR0_GLS0_ISA1201_IU1_K1_LDSTI0_LBSPPA0_LBSPPB0_LBSPPM0_LPA4_LPB4_LPM0_LRVW1_LWPMn1_MIAV0_MO40_MGRIPM1_NTn1_NTA0_NTB0_NTC0_NTD0_NTM0_NEPBS0_NLCA1_NLCB1_ONLL1_PGR1_PLR1_PKA0_SGROB0_SIA1_SS0_SU32_SUM0_SUS256_SPO0_SRVW0_SSO0_SVW1_SK0_SKFTR0_SKXCCM0_SGRO0_TIN0_TT3_2_TLDS0_TLDSMn1_ULSGRO0_USL1_UIOFGRO0_UPLRP0_USFGROn1_VSn1_VWA1_VWB1_WSGRA0_WSGRB0_WS32_WG16_8_1_WGM1_WGMXCC1_WGMXCCGn1
    SolutionIndex: 21
    SolutionNameMin: Cijk_Alik_Bljk_S_B_UserArgs_MT16x32x8_SN_LDSB0_AFC0_AG0_AFEM1_AFEM1_ASEM1_CLR0_CADS0_DTLA0_DTLB0_DTVA0_DTVB0_DTVSM0_DPLB0_EPS1_ELFLR0_EMLLn1_FDSI0_GRPM1_GRVWA1_GRVWB1_GSU1_GSUAMB_GSUC0_GSUWGMRR0_GLS0_ISA1201_IU1_K1_LDSTI0_LBSPPA0_LBSPPB0_LBSPPM0_LPA4_LPB4_LPM0_LRVW1_LWPMn1_MIAV0_MO40_MGRIPM1_NTn1_NTA0_NTB0_NTC0_NTD0_NTM0_NEPBS0_NLCA1_NLCB1_ONLL1_PGR1_PLR1_PKA0_SGROB0_SIA1_SS0_SU16_SUM0_SUS256_SPO0_SRVW0_SSO0_SVW1_SK0_SKFTR0_SKXCCM0_SGRO0_TIN0_TT2_2_TLDS0_TLDSMn1_ULSGRO0_USL1_UIOFGRO0_UPLRP0_USFGROn1_VSn1_VWA1_VWB1_WSGRA0_WSGRB0_WS32_WG8_16_1_WGM1_WGMXCC1_WGMXCCGn1
    SolutionIndex: 22
    SolutionNameMin: Cijk_Alik_Bljk_S_B_UserArgs_MT32x16x32_SN_LDSB0_AFC0_AG0_AFEM1_AFEM1_ASEM1_CLR0_CADS0_DTLA0_DTLB0_DTVA0_DTVB0_DTVSM0_DPLB0_EPS1_ELFLR0_EMLLn1_FDSI0_GRPM1_GRVWA1_GRVWB1_GSU1_GSUAMB_GSUC0_GSUWGMRR0_GLS0_ISA1201_IU1_K1_LDSTI0_LBSPPA0_LBSPPB0_LBSPPM0_LPA4_LPB4_LPM0_LRVW1_LWPMn1_MIAV0_MO40_MGRIPM1_NTn1_NTA0_NTB0_NTC0_NTD0_NTM0_NEPBS0_NLCA1_NLCB1_ONLL1_PGR1_PLR1_PKA0_SGROB0_SIA1_SS0_SU16_SUM0_SUS256_SPO0_SRVW0_SSO0_SVW1_SK0_SKFTR0_SKXCCM0_SGRO0_TIN0_TT2_2_TLDS0_TLDSMn1_ULSGRO0_USL1_UIOFGRO0_UPLRP0_USFGROn1_VSn1_VWA1_VWB1_WSGRA0_WSGRB0_WS32_WG16_8_1_WGM1_WGMXCC1_WGMXCCGn1
    SolutionIndex: 23
    SolutionNameMin: Cijk_Alik_Bljk_S_B_UserArgs_MT16x32x32_SN_LDSB0_AFC0_AG0_AFEM1_AFEM1_ASEM1_CLR0_CADS0_DTLA0_DTLB0_DTVA0_DTVB0_DTVSM0_DPLB0_EPS1_ELFLR0_EMLLn1_FDSI0_GRPM1_GRVWA1_GRVWB1_GSU1_GSUAMB_GSUC0_GSUWGMRR0_GLS0_ISA1201_IU1_K1_LDSTI0_LBSPPA0_LBSPPB0_LBSPPM0_LPA4_LPB4_LPM0_LRVW1_LWPMn1_MIAV0_MO40_MGRIPM1_NTn1_NTA0_NTB0_NTC0_NTD0_NTM0_NEPBS0_NLCA1_NLCB1_ONLL1_PGR1_PLR1_PKA0_SGROB0_SIA1_SS0_SU32_SUM0_SUS256_SPO0_SRVW0_SSO0_SVW1_SK0_SKFTR0_SKXCCM0_SGRO0_TIN0_TT2_2_TLDS0_TLDSMn1_ULSGRO0_USL1_UIOFGRO0_UPLRP0_USFGROn1_VSn1_VWA1_VWB1_WSGRA0_WSGRB0_WS32_WG8_16_1_WGM1_WGMXCC1_WGMXCCGn1
    SolutionIndex: 24
    SolutionNameMin: Cijk_Alik_Bljk_S_B_UserArgs_MT16x32x32_SN_LDSB0_AFC0_AG0_AFEM1_AFEM1_ASEM1_CLR0_CADS0_DTLA0_DTLB0_DTVA0_DTVB0_DTVSM0_DPLB0_EPS1_ELFLR0_EMLLn1_FDSI0_GRPM1_GRVWA1_GRVWB1_GSU1_GSUAMB_GSUC0_GSUWGMRR0_GLS0_ISA1201_IU1_K1_LDSTI0_LBSPPA0_LBSPPB0_LBSPPM0_LPA4_LPB4_LPM0_LRVW1_LWPMn1_MIAV0_MO40_MGRIPM1_NTn1_NTA0_NTB0_NTC0_NTD0_NTM0_NEPBS0_NLCA1_NLCB1_ONLL1_PGR1_PLR1_PKA0_SGROB0_SIA1_SS0_SU16_SUM0_SUS256_SPO0_SRVW0_SSO0_SVW1_SK0_SKFTR0_SKXCCM0_SGRO0_TIN0_TT2_2_TLDS0_TLDSMn1_ULSGRO0_USL1_UIOFGRO0_UPLRP0_USFGROn1_VSn1_VWA1_VWB1_WSGRA0_WSGRB0_WS32_WG8_16_1_WGM1_WGMXCC1_WGMXCCGn1
    SolutionIndex: 25
    SolutionNameMin: Cijk_Alik_Bljk_S_B_UserArgs_MT32x16x16_SN_LDSB0_AFC0_AG0_AFEM1_AFEM1_ASEM1_CLR0_CADS0_DTLA0_DTLB0_DTVA0_DTVB0_DTVSM0_DPLB0_EPS1_ELFLR0_EMLLn1_FDSI0_GRPM1_GRVWA1_GRVWB1_GSU1_GSUAMB_GSUC0_GSUWGMRR0_GLS0_ISA1201_IU1_K1_LDSTI0_LBSPPA0_LBSPPB0_LBSPPM0_LPA4_LPB4_LPM0_LRVW1_LWPMn1_MIAV0_MO40_MGRIPM1_NTn1_NTA0_NTB0_NTC0_NTD0_NTM0_NEPBS0_NLCA1_NLCB1_ONLL1_PGR1_PLR1_PKA0_SGROB0_SIA1_SS0_SU16_SUM0_SUS256_SPO0_SRVW0_SSO0_SVW1_SK0_SKFTR0_SKXCCM0_SGRO0_TIN0_TT4_4_TLDS0_TLDSMn1_ULSGRO0_USL1_UIOFGRO0_UPLRP0_USFGROn1_VSn1_VWA1_VWB1_WSGRA0_WSGRB0_WS32_WG8_4_1_WGM1_WGMXCC1_WGMXCCGn1
    SolutionIndex: 26
    SolutionNameMin: Cijk_Alik_Bljk_S_B_UserArgs_MT24x8x8_SN_LDSB0_AFC0_AG0_AFEM1_AFEM1_ASEM1_CLR0_CADS0_DTLA0_DTLB0_DTVA0_DTVB0_DTVSM0_DPLB0_EPS1_ELFLR0_EMLLn1_FDSI0_GRPM1_GRVWA1_GRVWB1_GSU1_GSUAMB_GSUC0_GSUWGMRR0_GLS0_ISA1201_IU1_K1_LDSTI0_LBSPPA0_LBSPPB0_LBSPPM0_LPA4_LPB4_LPM0_LRVW1_LWPMn1_MIAV0_MO40_MGRIPM1_NTn1_NTA0_NTB0_NTC0_NTD0_NTM0_NEPBS0_NLCA1_NLCB1_ONLL1_PGR1_PLR1_PKA0_SGROB0_SIA1_SS0_SU32_SUM0_SUS256_SPO0_SRVW0_SSO0_SVW1_SK0_SKFTR0_SKXCCM0_SGRO0_TIN0_TT3_2_TLDS0_TLDSMn1_ULSGRO0_USL1_UIOFGRO0_UPLRP0_USFGROn1_VSn1_VWA1_VWB1_WSGRA0_WSGRB0_WS32_WG8_4_1_WGM1_WGMXCC1_WGMXCCGn1
    SolutionIndex: 27
    SolutionNameMin: Cijk_Alik_Bljk_S_B_UserArgs_MT16x8x16_SN_LDSB0_AFC0_AG0_AFEM1_AFEM1_ASEM1_CLR0_CADS0_DTLA0_DTLB0_DTVA0_DTVB0_DTVSM0_DPLB0_EPS1_ELFLR0_EMLLn1_FDSI0_GRPM1_GRVWA1_GRVWB1_GSU1_GSUAMB_GSUC0_GSUWGMRR0_GLS0_ISA1201_IU1_K1_LDSTI0_LBSPPA0_LBSPPB0_LBSPPM0_LPA4_LPB4_LPM0_LRVW1_LWPMn1_MIAV0_MO40_MGRIPM1_NTn1_NTA0_NTB0_NTC0_NTD0_NTM0_NEPBS0_NLCA1_NLCB1_ONLL1_PGR1_PLR1_PKA0_SGROB0_SIA1_SS0_SU16_SUM0_SUS256_SPO0_SRVW0_SSO0_SVW1_SK0_SKFTR0_SKXCCM0_SGRO0_TIN0_TT2_2_TLDS0_TLDSMn1_ULSGRO0_USL1_UIOFGRO0_UPLRP0_USFGROn1_VSn1_VWA1_VWB1_WSGRA0_WSGRB0_WS32_WG8_4_1_WGM1_WGMXCC1_WGMXCCGn1
    SolutionIndex: 28
    SolutionNameMin: Cijk_Alik_Bljk_S_B_UserArgs_MT16x8x8_SN_LDSB0_AFC0_AG0_AFEM1_AFEM1_ASEM1_CLR0_CADS0_DTLA0_DTLB0_DTVA0_DTVB0_DTVSM0_DPLB0_EPS1_ELFLR0_EMLLn1_FDSI0_GRPM1_GRVWA1_GRVWB1_GSU1_GSUAMB_GSUC0_GSUWGMRR0_GLS0_ISA1201_IU1_K1_LDSTI0_LBSPPA0_LBSPPB0_LBSPPM0_LPA4_LPB4_LPM0_LRVW1_LWPMn1_MIAV0_MO40_MGRIPM1_NTn1_NTA0_NTB0_NTC0_NTD0_NTM0_NEPBS0_NLCA1_NLCB1_ONLL1_PGR1_PLR1_PKA0_SGROB0_SIA1_SS0_SU16_SUM0_SUS256_SPO0_SRVW0_SSO0_SVW1_SK0_SKFTR0_SKXCCM0_SGRO0_TIN0_TT2_2_TLDS0_TLDSMn1_ULSGRO0_USL1_UIOFGRO0_UPLRP0_USFGROn1_VSn1_VWA1_VWB1_WSGRA0_WSGRB0_WS32_WG8_4_1_WGM1_WGMXCC1_WGMXCCGn1
    SolutionIndex: 29
    SolutionNameMin: Cijk_Alik_Bljk_S_B_UserArgs_MT32x16x16_SN_LDSB0_AFC0_AG0_AFEM1_AFEM1_ASEM1_CLR0_CADS0_DTLA0_DTLB0_DTVA0_DTVB0_DTVSM0_DPLB0_EPS1_ELFLR0_EMLLn1_FDSI0_GRPM1_GRVWA1_GRVWB1_GSU1_GSUAMB_GSUC0_GSUWGMRR0_GLS0_ISA1201_IU1_K1_LDSTI0_LBSPPA0_LBSPPB0_LBSPPM0_LPA4_LPB4_LPM0_LRVW1_LWPMn1_MIAV0_MO40_MGRIPM1_NTn1_NTA0_NTB0_NTC0_NTD0_NTM0_NEPBS0_NLCA1_NLCB1_ONLL1_PGR1_PLR1_PKA0_SGROB0_SIA1_SS0_SU16_SUM0_SUS256_SPO0_SRVW0_SSO0_SVW1_SK0_SKFTR0_SKXCCM0_SGRO0_TIN0_TT2_2_TLDS0_TLDSMn1_ULSGRO0_USL1_UIOFGRO0_UPLRP0_USFGROn1_VSn1_VWA1_VWB1_WSGRA0_WSGRB0_WS32_WG16_8_1_WGM1_WGMXCC1_WGMXCCGn1
    SolutionIndex: 30
    SolutionNameMin: Cijk_Alik_Bljk_S_B_UserArgs_MT64x32x16_SN_LDSB0_AFC0_AG0_AFEM1_AFEM1_ASEM1_CLR0_CADS0_DTLA0_DTLB0_DTVA0_DTVB0_DTVSM0_DPLB0_EPS1_ELFLR0_EMLLn1_FDSI0_GRPM1_GRVWA1_GRVWB1_GSU1_GSUAMB_GSUC0_GSUWGMRR0_GLS0_ISA1201_IU1_K1_LDSTI0_LBSPPA0_LBSPPB0_LBSPPM0_LPA4_LPB4_LPM0_LRVW1_LWPMn1_MIAV0_MO40_MGRIPM1_NTn1_NTA0_NTB0_NTC0_NTD0_NTM0_NEPBS0_NLCA1_NLCB1_ONLL1_PGR1_PLR1_PKA0_SGROB0_SIA1_SS0_SU32_SUM0_SUS256_SPO0_SRVW0_SSO0_SVW1_SK0_SKFTR0_SKXCCM0_SGRO0_TIN0_TT4_4_TLDS0_TLDSMn1_ULSGRO0_USL1_UIOFGRO0_UPLRP0_USFGROn1_VSn1_VWA1_VWB1_WSGRA0_WSGRB0_WS32_WG16_8_1_WGM1_WGMXCC1_WGMXCCGn1
    SolutionIndex: 31
    SolutionNameMin: Cijk_Alik_Bljk_S_B_UserArgs_MT48x16x16_SN_LDSB0_AFC0_AG0_AFEM1_AFEM1_ASEM1_CLR0_CADS0_DTLA0_DTLB0_DTVA0_DTVB0_DTVSM0_DPLB0_EPS1_ELFLR0_EMLLn1_FDSI0_GRPM1_GRVWA1_GRVWB1_GSU1_GSUAMB_GSUC0_GSUWGMRR0_GLS0_ISA1201_IU1_K1_LDSTI0_LBSPPA0_LBSPPB0_LBSPPM0_LPA4_LPB4_LPM0_LRVW1_LWPMn1_MIAV0_MO40_MGRIPM1_NTn1_NTA0_NTB0_NTC0_NTD0_NTM0_NEPBS0_NLCA1_NLCB1_ONLL1_PGR1_PLR1_PKA0_SGROB0_SIA1_SS0_SU16_SUM0_SUS256_SPO0_SRVW0_SSO0_SVW1_SK0_SKFTR0_SKXCCM0_SGRO0_TIN0_TT3_2_TLDS0_TLDSMn1_ULSGRO0_USL1_UIOFGRO0_UPLRP0_USFGROn1_VSn1_VWA1_VWB1_WSGRA0_WSGRB0_WS32_WG16_8_1_WGM1_WGMXCC1_WGMXCCGn1
    SolutionIndex: 32
    SolutionNameMin: Cijk_Alik_Bljk_S_B_UserArgs_MT32x64x8_SN_LDSB0_AFC0_AG0_AFEM1_AFEM1_ASEM1_CLR0_CADS0_DTLA0_DTLB0_DTVA0_DTVB0_DTVSM0_DPLB0_EPS1_ELFLR0_EMLLn1_FDSI0_GRPM1_GRVWA1_GRVWB1_GSU1_GSUAMB_GSUC0_GSUWGMRR0_GLS0_ISA1201_IU1_K1_LDSTI0_LBSPPA0_LBSPPB0_LBSPPM0_LPA4_LPB4_LPM0_LRVW1_LWPMn1_MIAV0_MO40_MGRIPM1_NTn1_NTA0_NTB0_NTC0_NTD0_NTM0_NEPBS0_NLCA1_NLCB1_ONLL1_PGR1_PLR1_PKA0_SGROB0_SIA1_SS0_SU16_SUM0_SUS256_SPO0_SRVW0_SSO0_SVW1_SK0_SKFTR0_SKXCCM0_SGRO0_TIN0_TT4_4_TLDS0_TLDSMn1_ULSGRO0_USL1_UIOFGRO0_UPLRP0_USFGROn1_VSn1_VWA1_VWB1_WSGRA0_WSGRB0_WS32_WG8_16_1_WGM1_WGMXCC1_WGMXCCGn1
    SolutionIndex: 33
    SolutionNameMin: Cijk_Alik_Bljk_S_B_UserArgs_MT16x32x16_SN_LDSB0_AFC0_AG0_AFEM1_AFEM1_ASEM1_CLR0_CADS0_DTLA0_DTLB0_DTVA0_DTVB0_DTVSM0_DPLB0_EPS1_ELFLR0_EMLLn1_FDSI0_GRPM1_GRVWA1_GRVWB1_GSU1_GSUAMB_GSUC0_GSUWGMRR0_GLS0_ISA1201_IU1_K1_LDSTI0_LBSPPA0_LBSPPB0_LBSPPM0_LPA4_LPB4_LPM0_LRVW1_LWPMn1_MIAV0_MO40_MGRIPM1_NTn1_NTA0_NTB0_NTC0_NTD0_NTM0_NEPBS0_NLCA1_NLCB1_ONLL1_PGR1_PLR1_PKA0_SGROB0_SIA1_SS0_SU16_SUM0_SUS256_SPO0_SRVW0_SSO0_SVW1_SK0_SKFTR0_SKXCCM0_SGRO0_TIN0_TT2_2_TLDS0_TLDSMn1_ULSGRO0_USL1_UIOFGRO0_UPLRP0_USFGROn1_VSn1_VWA1_VWB1_WSGRA0_WSGRB0_WS32_WG8_16_1_WGM1_WGMXCC1_WGMXCCGn1
    SolutionIndex: 34
    SolutionNameMin: Cijk_Alik_Bljk_S_B_UserArgs_MT16x8x32_SN_LDSB0_AFC0_AG0_AFEM1_AFEM1_ASEM1_CLR0_CADS0_DTLA0_DTLB0_DTVA0_DTVB0_DTVSM0_DPLB0_EPS1_ELFLR0_EMLLn1_FDSI0_GRPM1_GRVWA1_GRVWB1_GSU1_GSUAMB_GSUC0_GSUWGMRR0_GLS0_ISA1201_IU1_K1_LDSTI0_LBSPPA0_LBSPPB0_LBSPPM0_LPA4_LPB4_LPM0_LRVW1_LWPMn1_MIAV0_MO40_MGRIPM1_NTn1_NTA0_NTB0_NTC0_NTD0_NTM0_NEPBS0_NLCA1_NLCB1_ONLL1_PGR1_PLR1_PKA0_SGROB0_SIA1_SS0_SU16_SUM0_SUS256_SPO0_SRVW0_SSO0_SVW1_SK0_SKFTR0_SKXCCM0_SGRO0_TIN0_TT2_2_TLDS0_TLDSMn1_ULSGRO0_USL1_UIOFGRO0_UPLRP0_USFGROn1_VSn1_VWA1_VWB1_WSGRA0_WSGRB0_WS32_WG8_4_1_WGM1_WGMXCC1_WGMXCCGn1
    SolutionIndex: 35
    SolutionNameMin: Cijk_Alik_Bljk_S_B_UserArgs_MT16x32x8_SN_LDSB0_AFC0_AG0_AFEM1_AFEM1_ASEM1_CLR0_CADS0_DTLA0_DTLB0_DTVA0_DTVB0_DTVSM0_DPLB0_EPS1_ELFLR0_EMLLn1_FDSI0_GRPM1_GRVWA1_GRVWB1_GSU1_GSUAMB_GSUC0_GSUWGMRR0_GLS0_ISA1201_IU1_K1_LDSTI0_LBSPPA0_LBSPPB0_LBSPPM0_LPA4_LPB4_LPM0_LRVW1_LWPMn1_MIAV0_MO40_MGRIPM1_NTn1_NTA0_NTB0_NTC0_NTD0_NTM0_NEPBS0_NLCA1_NLCB1_ONLL1_PGR1_PLR1_PKA0_SGROB0_SIA1_SS0_SU32_SUM0_SUS256_SPO0_SRVW0_SSO0_SVW1_SK0_SKFTR0_SKXCCM0_SGRO0_TIN0_TT2_2_TLDS0_TLDSMn1_ULSGRO0_USL1_UIOFGRO0_UPLRP0_USFGROn1_VSn1_VWA1_VWB1_WSGRA0_WSGRB0_WS32_WG8_16_1_WGM1_WGMXCC1_WGMXCCGn1
    SolutionIndex: 36
    SolutionNameMin: Cijk_Alik_Bljk_S_B_UserArgs_MT32x16x8_SN_LDSB0_AFC0_AG0_AFEM1_AFEM1_ASEM1_CLR0_CADS0_DTLA0_DTLB0_DTVA0_DTVB0_DTVSM0_DPLB0_EPS1_ELFLR0_EMLLn1_FDSI0_GRPM1_GRVWA1_GRVWB1_GSU1_GSUAMB_GSUC0_GSUWGMRR0_GLS0_ISA1201_IU1_K1_LDSTI0_LBSPPA0_LBSPPB0_LBSPPM0_LPA4_LPB4_LPM0_LRVW1_LWPMn1_MIAV0_MO40_MGRIPM1_NTn1_NTA0_NTB0_NTC0_NTD0_NTM0_NEPBS0_NLCA1_NLCB1_ONLL1_PGR1_PLR1_PKA0_SGROB0_SIA1_SS0_SU16_SUM0_SUS256_SPO0_SRVW0_SSO0_SVW1_SK0_SKFTR0_SKXCCM0_SGRO0_TIN0_TT2_2_TLDS0_TLDSMn1_ULSGRO0_USL1_UIOFGRO0_UPLRP0_USFGROn1_VSn1_VWA1_VWB1_WSGRA0_WSGRB0_WS32_WG16_8_1_WGM1_WGMXCC1_WGMXCCGn1
    SolutionIndex: 37
    SolutionNameMin: Cijk_Alik_Bljk_S_B_UserArgs_MT16x32x16_SN_LDSB0_AFC0_AG0_AFEM1_AFEM1_ASEM1_CLR0_CADS0_DTLA0_DTLB0_DTVA0_DTVB0_DTVSM0_DPLB0_EPS1_ELFLR0_EMLLn1_FDSI0_GRPM1_GRVWA1_GRVWB1_GSU1_GSUAMB_GSUC0_GSUWGMRR0_GLS0_ISA1201_IU1_K1_LDSTI0_LBSPPA0_LBSPPB0_LBSPPM0_LPA4_LPB4_LPM0_LRVW1_LWPMn1_MIAV0_MO40_MGRIPM1_NTn1_NTA0_NTB0_NTC0_NTD0_NTM0_NEPBS0_NLCA1_NLCB1_ONLL1_PGR1_PLR1_PKA0_SGROB0_SIA1_SS0_SU32_SUM0_SUS256_SPO0_SRVW0_SSO0_SVW1_SK0_SKFTR0_SKXCCM0_SGRO0_TIN0_TT2_2_TLDS0_TLDSMn1_ULSGRO0_USL1_UIOFGRO0_UPLRP0_USFGROn1_VSn1_VWA1_VWB1_WSGRA0_WSGRB0_WS32_WG8_16_1_WGM1_WGMXCC1_WGMXCCGn1
    SolutionIndex: 38
    SolutionNameMin: Cijk_Alik_Bljk_S_B_UserArgs_MT48x16x32_SN_LDSB0_AFC0_AG0_AFEM1_AFEM1_ASEM1_CLR0_CADS0_DTLA0_DTLB0_DTVA0_DTVB0_DTVSM0_DPLB0_EPS1_ELFLR0_EMLLn1_FDSI0_GRPM1_GRVWA1_GRVWB1_GSU1_GSUAMB_GSUC0_GSUWGMRR0_GLS0_ISA1201_IU1_K1_LDSTI0_LBSPPA0_LBSPPB0_LBSPPM0_LPA4_LPB4_LPM0_LRVW1_LWPMn1_MIAV0_MO40_MGRIPM1_NTn1_NTA0_NTB0_NTC0_NTD0_NTM0_NEPBS0_NLCA1_NLCB1_ONLL1_PGR1_PLR1_PKA0_SGROB0_SIA1_SS0_SU16_SUM0_SUS256_SPO0_SRVW0_SSO0_SVW1_SK0_SKFTR0_SKXCCM0_SGRO0_TIN0_TT3_2_TLDS0_TLDSMn1_ULSGRO0_USL1_UIOFGRO0_UPLRP0_USFGROn1_VSn1_VWA1_VWB1_WSGRA0_WSGRB0_WS32_WG16_8_1_WGM1_WGMXCC1_WGMXCCGn1
    SolutionIndex: 39
    SolutionNameMin: Cijk_Alik_Bljk_S_B_UserArgs_MT64x32x8_SN_LDSB0_AFC0_AG0_AFEM1_AFEM1_ASEM1_CLR0_CADS0_DTLA0_DTLB0_DTVA0_DTVB0_DTVSM0_DPLB0_EPS1_ELFLR0_EMLLn1_FDSI0_GRPM1_GRVWA1_GRVWB1_GSU1_GSUAMB_GSUC0_GSUWGMRR0_GLS0_ISA1201_IU1_K1_LDSTI0_LBSPPA0_LBSPPB0_LBSPPM0_LPA4_LPB4_LPM0_LRVW1_LWPMn1_MIAV0_MO40_MGRIPM1_NTn1_NTA0_NTB0_NTC0_NTD0_NTM0_NEPBS0_NLCA1_NLCB1_ONLL1_PGR1_PLR1_PKA0_SGROB0_SIA1_SS0_SU32_SUM0_SUS256_SPO0_SRVW0_SSO0_SVW1_SK0_SKFTR0_SKXCCM0_SGRO0_TIN0_TT4_4_TLDS0_TLDSMn1_ULSGRO0_USL1_UIOFGRO0_UPLRP0_USFGROn1_VSn1_VWA1_VWB1_WSGRA0_WSGRB0_WS32_WG16_8_1_WGM1_WGMXCC1_WGMXCCGn1
    SolutionIndex: 40
    SolutionNameMin: Cijk_Alik_Bljk_S_B_UserArgs_MT32x16x8_SN_LDSB0_AFC0_AG0_AFEM1_AFEM1_ASEM1_CLR0_CADS0_DTLA0_DTLB0_DTVA0_DTVB0_DTVSM0_DPLB0_EPS1_ELFLR0_EMLLn1_FDSI0_GRPM1_GRVWA1_GRVWB1_GSU1_GSUAMB_GSUC0_GSUWGMRR0_GLS0_ISA1201_IU1_K1_LDSTI0_LBSPPA0_LBSPPB0_LBSPPM0_LPA4_LPB4_LPM0_LRVW1_LWPMn1_MIAV0_MO40_MGRIPM1_NTn1_NTA0_NTB0_NTC0_NTD0_NTM0_NEPBS0_NLCA1_NLCB1_ONLL1_PGR1_PLR1_PKA0_SGROB0_SIA1_SS0_SU32_SUM0_SUS256_SPO0_SRVW0_SSO0_SVW1_SK0_SKFTR0_SKXCCM0_SGRO0_TIN0_TT2_2_TLDS0_TLDSMn1_ULSGRO0_USL1_UIOFGRO0_UPLRP0_USFGROn1_VSn1_VWA1_VWB1_WSGRA0_WSGRB0_WS32_WG16_8_1_WGM1_WGMXCC1_WGMXCCGn1
    SolutionIndex: 41
    SolutionNameMin: Cijk_Alik_Bljk_S_B_UserArgs_MT16x8x8_SN_LDSB0_AFC0_AG0_AFEM1_AFEM1_ASEM1_CLR0_CADS0_DTLA0_DTLB0_DTVA0_DTVB0_DTVSM0_DPLB0_EPS1_ELFLR0_EMLLn1_FDSI0_GRPM1_GRVWA1_GRVWB1_GSU1_GSUAMB_GSUC0_GSUWGMRR0_GLS0_ISA1201_IU1_K1_LDSTI0_LBSPPA0_LBSPPB0_LBSPPM0_LPA4_LPB4_LPM0_LRVW1_LWPMn1_MIAV0_MO40_MGRIPM1_NTn1_NTA0_NTB0_NTC0_NTD0_NTM0_NEPBS0_NLCA1_NLCB1_ONLL1_PGR1_PLR1_PKA0_SGROB0_SIA1_SS0_SU32_SUM0_SUS256_SPO0_SRVW0_SSO0_SVW1_SK0_SKFTR0_SKXCCM0_SGRO0_TIN0_TT2_2_TLDS0_TLDSMn1_ULSGRO0_USL1_UIOFGRO0_UPLRP0_USFGROn1_VSn1_VWA1_VWB1_WSGRA0_WSGRB0_WS32_WG8_4_1_WGM1_WGMXCC1_WGMXCCGn1
    SolutionIndex: 42
    SolutionNameMin: Cijk_Alik_Bljk_S_B_UserArgs_MT16x8x16_SN_LDSB0_AFC0_AG0_AFEM1_AFEM1_ASEM1_CLR0_CADS0_DTLA0_DTLB0_DTVA0_DTVB0_DTVSM0_DPLB0_EPS1_ELFLR0_EMLLn1_FDSI0_GRPM1_GRVWA1_GRVWB1_GSU1_GSUAMB_GSUC0_GSUWGMRR0_GLS0_ISA1201_IU1_K1_LDSTI0_LBSPPA0_LBSPPB0_LBSPPM0_LPA4_LPB4_LPM0_LRVW1_LWPMn1_MIAV0_MO40_MGRIPM1_NTn1_NTA0_NTB0_NTC0_NTD0_NTM0_NEPBS0_NLCA1_NLCB1_ONLL1_PGR1_PLR1_PKA0_SGROB0_SIA1_SS0_SU32_SUM0_SUS256_SPO0_SRVW0_SSO0_SVW1_SK0_SKFTR0_SKXCCM0_SGRO0_TIN0_TT2_2_TLDS0_TLDSMn1_ULSGRO0_USL1_UIOFGRO0_UPLRP0_USFGROn1_VSn1_VWA1_VWB1_WSGRA0_WSGRB0_WS32_WG8_4_1_WGM1_WGMXCC1_WGMXCCGn1
    SolutionIndex: 43
    SolutionNameMin: Cijk_Alik_Bljk_S_B_UserArgs_MT24x32x32_SN_LDSB0_AFC0_AG0_AFEM1_AFEM1_ASEM1_CLR0_CADS0_DTLA0_DTLB0_DTVA0_DTVB0_DTVSM0_DPLB0_EPS1_ELFLR0_EMLLn1_FDSI0_GRPM1_GRVWA1_GRVWB1_GSU1_GSUAMB_GSUC0_GSUWGMRR0_GLS0_ISA1201_IU1_K1_LDSTI0_LBSPPA0_LBSPPB0_LBSPPM0_LPA4_LPB4_LPM0_LRVW1_LWPMn1_MIAV0_MO40_MGRIPM1_NTn1_NTA0_NTB0_NTC0_NTD0_NTM0_NEPBS0_NLCA1_NLCB1_ONLL1_PGR1_PLR1_PKA0_SGROB0_SIA1_SS0_SU32_SUM0_SUS256_SPO0_SRVW0_SSO0_SVW1_SK0_SKFTR0_SKXCCM0_SGRO0_TIN0_TT3_2_TLDS0_TLDSMn1_ULSGRO0_USL1_UIOFGRO0_UPLRP0_USFGROn1_VSn1_VWA1_VWB1_WSGRA0_WSGRB0_WS32_WG8_16_1_WGM1_WGMXCC1_WGMXCCGn1
    SolutionIndex: 44
    SolutionNameMin: Cijk_Alik_Bljk_S_B_UserArgs_MT32x64x16_SN_LDSB0_AFC0_AG0_AFEM1_AFEM1_ASEM1_CLR0_CADS0_DTLA0_DTLB0_DTVA0_DTVB0_DTVSM0_DPLB0_EPS1_ELFLR0_EMLLn1_FDSI0_GRPM1_GRVWA1_GRVWB1_GSU1_GSUAMB_GSUC0_GSUWGMRR0_GLS0_ISA1201_IU1_K1_LDSTI0_LBSPPA0_LBSPPB0_LBSPPM0_LPA4_LPB4_LPM0_LRVW1_LWPMn1_MIAV0_MO40_MGRIPM1_NTn1_NTA0_NTB0_NTC0_NTD0_NTM0_NEPBS0_NLCA1_NLCB1_ONLL1_PGR1_PLR1_PKA0_SGROB0_SIA1_SS0_SU16_SUM0_SUS256_SPO0_SRVW0_SSO0_SVW1_SK0_SKFTR0_SKXCCM0_SGRO0_TIN0_TT4_4_TLDS0_TLDSMn1_ULSGRO0_USL1_UIOFGRO0_UPLRP0_USFGROn1_VSn1_VWA1_VWB1_WSGRA0_WSGRB0_WS32_WG8_16_1_WGM1_WGMXCC1_WGMXCCGn1
    SolutionIndex: 45
    SolutionNameMin: Cijk_Alik_Bljk_S_B_UserArgs_MT24x8x8_SN_LDSB0_AFC0_AG0_AFEM1_AFEM1_ASEM1_CLR0_CADS0_DTLA0_DTLB0_DTVA0_DTVB0_DTVSM0_DPLB0_EPS1_ELFLR0_EMLLn1_FDSI0_GRPM1_GRVWA1_GRVWB1_GSU1_GSUAMB_GSUC0_GSUWGMRR0_GLS0_ISA1201_IU1_K1_LDSTI0_LBSPPA0_LBSPPB0_LBSPPM0_LPA4_LPB4_LPM0_LRVW1_LWPMn1_MIAV0_MO40_MGRIPM1_NTn1_NTA0_NTB0_NTC0_NTD0_NTM0_NEPBS0_NLCA1_NLCB1_ONLL1_PGR1_PLR1_PKA0_SGROB0_SIA1_SS0_SU16_SUM0_SUS256_SPO0_SRVW0_SSO0_SVW1_SK0_SKFTR0_SKXCCM0_SGRO0_TIN0_TT3_2_TLDS0_TLDSMn1_ULSGRO0_USL1_UIOFGRO0_UPLRP0_USFGROn1_VSn1_VWA1_VWB1_WSGRA0_WSGRB0_WS32_WG8_4_1_WGM1_WGMXCC1_WGMXCCGn1
    SolutionIndex: 46
    SolutionNameMin: Cijk_Alik_Bljk_S_B_UserArgs_MT64x32x8_SN_LDSB0_AFC0_AG0_AFEM1_AFEM1_ASEM1_CLR0_CADS0_DTLA0_DTLB0_DTVA0_DTVB0_DTVSM0_DPLB0_EPS1_ELFLR0_EMLLn1_FDSI0_GRPM1_GRVWA1_GRVWB1_GSU1_GSUAMB_GSUC0_GSUWGMRR0_GLS0_ISA1201_IU1_K1_LDSTI0_LBSPPA0_LBSPPB0_LBSPPM0_LPA4_LPB4_LPM0_LRVW1_LWPMn1_MIAV0_MO40_MGRIPM1_NTn1_NTA0_NTB0_NTC0_NTD0_NTM0_NEPBS0_NLCA1_NLCB1_ONLL1_PGR1_PLR1_PKA0_SGROB0_SIA1_SS0_SU16_SUM0_SUS256_SPO0_SRVW0_SSO0_SVW1_SK0_SKFTR0_SKXCCM0_SGRO0_TIN0_TT4_4_TLDS0_TLDSMn1_ULSGRO0_USL1_UIOFGRO0_UPLRP0_USFGROn1_VSn1_VWA1_VWB1_WSGRA0_WSGRB0_WS32_WG16_8_1_WGM1_WGMXCC1_WGMXCCGn1
    SolutionIndex: 47
    SolutionNameMin: Cijk_Alik_Bljk_S_B_UserArgs_MT24x8x16_SN_LDSB0_AFC0_AG0_AFEM1_AFEM1_ASEM1_CLR0_CADS0_DTLA0_DTLB0_DTVA0_DTVB0_DTVSM0_DPLB0_EPS1_ELFLR0_EMLLn1_FDSI0_GRPM1_GRVWA1_GRVWB1_GSU1_GSUAMB_GSUC0_GSUWGMRR0_GLS0_ISA1201_IU1_K1_LDSTI0_LBSPPA0_LBSPPB0_LBSPPM0_LPA4_LPB4_LPM0_LRVW1_LWPMn1_MIAV0_MO40_MGRIPM1_NTn1_NTA0_NTB0_NTC0_NTD0_NTM0_NEPBS0_NLCA1_NLCB1_ONLL1_PGR1_PLR1_PKA0_SGROB0_SIA1_SS0_SU32_SUM0_SUS256_SPO0_SRVW0_SSO0_SVW1_SK0_SKFTR0_SKXCCM0_SGRO0_TIN0_TT3_2_TLDS0_TLDSMn1_ULSGRO0_USL1_UIOFGRO0_UPLRP0_USFGROn1_VSn1_VWA1_VWB1_WSGRA0_WSGRB0_WS32_WG8_4_1_WGM1_WGMXCC1_WGMXCCGn1
    SolutionIndex: 48
    SolutionNameMin: Cijk_Alik_Bljk_S_B_UserArgs_MT48x16x32_SN_LDSB0_AFC0_AG0_AFEM1_AFEM1_ASEM1_CLR0_CADS0_DTLA0_DTLB0_DTVA0_DTVB0_DTVSM0_DPLB0_EPS1_ELFLR0_EMLLn1_FDSI0_GRPM1_GRVWA1_GRVWB1_GSU1_GSUAMB_GSUC0_GSUWGMRR0_GLS0_ISA1201_IU1_K1_LDSTI0_LBSPPA0_LBSPPB0_LBSPPM0_LPA4_LPB4_LPM0_LRVW1_LWPMn1_MIAV0_MO40_MGRIPM1_NTn1_NTA0_NTB0_NTC0_NTD0_NTM0_NEPBS0_NLCA1_NLCB1_ONLL1_PGR1_PLR1_PKA0_SGROB0_SIA1_SS0_SU32_SUM0_SUS256_SPO0_SRVW0_SSO0_SVW1_SK0_SKFTR0_SKXCCM0_SGRO0_TIN0_TT3_2_TLDS0_TLDSMn1_ULSGRO0_USL1_UIOFGRO0_UPLRP0_USFGROn1_VSn1_VWA1_VWB1_WSGRA0_WSGRB0_WS32_WG16_8_1_WGM1_WGMXCC1_WGMXCCGn1
    SolutionIndex: 49
    SolutionNameMin: Cijk_Alik_Bljk_S_B_UserArgs_MT16x8x32_SN_LDSB0_AFC0_AG0_AFEM1_AFEM1_ASEM1_CLR0_CADS0_DTLA0_DTLB0_DTVA0_DTVB0_DTVSM0_DPLB0_EPS1_ELFLR0_EMLLn1_FDSI0_GRPM1_GRVWA1_GRVWB1_GSU1_GSUAMB_GSUC0_GSUWGMRR0_GLS0_ISA1201_IU1_K1_LDSTI0_LBSPPA0_LBSPPB0_LBSPPM0_LPA4_LPB4_LPM0_LRVW1_LWPMn1_MIAV0_MO40_MGRIPM1_NTn1_NTA0_NTB0_NTC0_NTD0_NTM0_NEPBS0_NLCA1_NLCB1_ONLL1_PGR1_PLR1_PKA0_SGROB0_SIA1_SS0_SU32_SUM0_SUS256_SPO0_SRVW0_SSO0_SVW1_SK0_SKFTR0_SKXCCM0_SGRO0_TIN0_TT2_2_TLDS0_TLDSMn1_ULSGRO0_USL1_UIOFGRO0_UPLRP0_USFGROn1_VSn1_VWA1_VWB1_WSGRA0_WSGRB0_WS32_WG8_4_1_WGM1_WGMXCC1_WGMXCCGn1
    SolutionIndex: 50
    SolutionNameMin: Cijk_Alik_Bljk_S_B_UserArgs_MT32x16x16_SN_LDSB0_AFC0_AG0_AFEM1_AFEM1_ASEM1_CLR0_CADS0_DTLA0_DTLB0_DTVA0_DTVB0_DTVSM0_DPLB0_EPS1_ELFLR0_EMLLn1_FDSI0_GRPM1_GRVWA1_GRVWB1_GSU1_GSUAMB_GSUC0_GSUWGMRR0_GLS0_ISA1201_IU1_K1_LDSTI0_LBSPPA0_LBSPPB0_LBSPPM0_LPA4_LPB4_LPM0_LRVW1_LWPMn1_MIAV0_MO40_MGRIPM1_NTn1_NTA0_NTB0_NTC0_NTD0_NTM0_NEPBS0_NLCA1_NLCB1_ONLL1_PGR1_PLR1_PKA0_SGROB0_SIA1_SS0_SU32_SUM0_SUS256_SPO0_SRVW0_SSO0_SVW1_SK0_SKFTR0_SKXCCM0_SGRO0_TIN0_TT4_4_TLDS0_TLDSMn1_ULSGRO0_USL1_UIOFGRO0_UPLRP0_USFGROn1_VSn1_VWA1_VWB1_WSGRA0_WSGRB0_WS32_WG8_4_1_WGM1_WGMXCC1_WGMXCCGn1
    SolutionIndex: 51
    SolutionNameMin: Cijk_Alik_Bljk_S_B_UserArgs_MT32x64x8_SN_LDSB0_AFC0_AG0_AFEM1_AFEM1_ASEM1_CLR0_CADS0_DTLA0_DTLB0_DTVA0_DTVB0_DTVSM0_DPLB0_EPS1_ELFLR0_EMLLn1_FDSI0_GRPM1_GRVWA1_GRVWB1_GSU1_GSUAMB_GSUC0_GSUWGMRR0_GLS0_ISA1201_IU1_K1_LDSTI0_LBSPPA0_LBSPPB0_LBSPPM0_LPA4_LPB4_LPM0_LRVW1_LWPMn1_MIAV0_MO40_MGRIPM1_NTn1_NTA0_NTB0_NTC0_NTD0_NTM0_NEPBS0_NLCA1_NLCB1_ONLL1_PGR1_PLR1_PKA0_SGROB0_SIA1_SS0_SU32_SUM0_SUS256_SPO0_SRVW0_SSO0_SVW1_SK0_SKFTR0_SKXCCM0_SGRO0_TIN0_TT4_4_TLDS0_TLDSMn1_ULSGRO0_USL1_UIOFGRO0_UPLRP0_USFGROn1_VSn1_VWA1_VWB1_WSGRA0_WSGRB0_WS32_WG8_16_1_WGM1_WGMXCC1_WGMXCCGn1
    SolutionIndex: 52
    SolutionNameMin: Cijk_Alik_Bljk_S_B_UserArgs_MT32x16x8_SN_LDSB0_AFC0_AG0_AFEM1_AFEM1_ASEM1_CLR0_CADS0_DTLA0_DTLB0_DTVA0_DTVB0_DTVSM0_DPLB0_EPS1_ELFLR0_EMLLn1_FDSI0_GRPM1_GRVWA1_GRVWB1_GSU1_GSUAMB_GSUC0_GSUWGMRR0_GLS0_ISA1201_IU1_K1_LDSTI0_LBSPPA0_LBSPPB0_LBSPPM0_LPA4_LPB4_LPM0_LRVW1_LWPMn1_MIAV0_MO40_MGRIPM1_NTn1_NTA0_NTB0_NTC0_NTD0_NTM0_NEPBS0_NLCA1_NLCB1_ONLL1_PGR1_PLR1_PKA0_SGROB0_SIA1_SS0_SU16_SUM0_SUS256_SPO0_SRVW0_SSO0_SVW1_SK0_SKFTR0_SKXCCM0_SGRO0_TIN0_TT4_4_TLDS0_TLDSMn1_ULSGRO0_USL1_UIOFGRO0_UPLRP0_USFGROn1_VSn1_VWA1_VWB1_WSGRA0_WSGRB0_WS32_WG8_4_1_WGM1_WGMXCC1_WGMXCCGn1
    SolutionIndex: 53
    SolutionNameMin: Cijk_Alik_Bljk_S_B_UserArgs_MT64x32x32_SN_LDSB0_AFC0_AG0_AFEM1_AFEM1_ASEM1_CLR0_CADS0_DTLA0_DTLB0_DTVA0_DTVB0_DTVSM0_DPLB0_EPS1_ELFLR0_EMLLn1_FDSI0_GRPM1_GRVWA1_GRVWB1_GSU1_GSUAMB_GSUC0_GSUWGMRR0_GLS0_ISA1201_IU1_K1_LDSTI0_LBSPPA0_LBSPPB0_LBSPPM0_LPA4_LPB4_LPM0_LRVW1_LWPMn1_MIAV0_MO40_MGRIPM1_NTn1_NTA0_NTB0_NTC0_NTD0_NTM0_NEPBS0_NLCA1_NLCB1_ONLL1_PGR1_PLR1_PKA0_SGROB0_SIA1_SS0_SU16_SUM0_SUS256_SPO0_SRVW0_SSO0_SVW1_SK0_SKFTR0_SKXCCM0_SGRO0_TIN0_TT4_4_TLDS0_TLDSMn1_ULSGRO0_USL1_UIOFGRO0_UPLRP0_USFGROn1_VSn1_VWA1_VWB1_WSGRA0_WSGRB0_WS32_WG16_8_1_WGM1_WGMXCC1_WGMXCCGn1
    SolutionIndex: 54
    SolutionNameMin: Cijk_Alik_Bljk_S_B_UserArgs_MT24x8x16_SN_LDSB0_AFC0_AG0_AFEM1_AFEM1_ASEM1_CLR0_CADS0_DTLA0_DTLB0_DTVA0_DTVB0_DTVSM0_DPLB0_EPS1_ELFLR0_EMLLn1_FDSI0_GRPM1_GRVWA1_GRVWB1_GSU1_GSUAMB_GSUC0_GSUWGMRR0_GLS0_ISA1201_IU1_K1_LDSTI0_LBSPPA0_LBSPPB0_LBSPPM0_LPA4_LPB4_LPM0_LRVW1_LWPMn1_MIAV0_MO40_MGRIPM1_NTn1_NTA0_NTB0_NTC0_NTD0_NTM0_NEPBS0_NLCA1_NLCB1_ONLL1_PGR1_PLR1_PKA0_SGROB0_SIA1_SS0_SU16_SUM0_SUS256_SPO0_SRVW0_SSO0_SVW1_SK0_SKFTR0_SKXCCM0_SGRO0_TIN0_TT3_2_TLDS0_TLDSMn1_ULSGRO0_USL1_UIOFGRO0_UPLRP0_USFGROn1_VSn1_VWA1_VWB1_WSGRA0_WSGRB0_WS32_WG8_4_1_WGM1_WGMXCC1_WGMXCCGn1
    SolutionIndex: 55
    SolutionNameMin: Cijk_Alik_Bljk_S_B_UserArgs_MT24x32x16_SN_LDSB0_AFC0_AG0_AFEM1_AFEM1_ASEM1_CLR0_CADS0_DTLA0_DTLB0_DTVA0_DTVB0_DTVSM0_DPLB0_EPS1_ELFLR0_EMLLn1_FDSI0_GRPM1_GRVWA1_GRVWB1_GSU1_GSUAMB_GSUC0_GSUWGMRR0_GLS0_ISA1201_IU1_K1_LDSTI0_LBSPPA0_LBSPPB0_LBSPPM0_LPA4_LPB4_LPM0_LRVW1_LWPMn1_MIAV0_MO40_MGRIPM1_NTn1_NTA0_NTB0_NTC0_NTD0_NTM0_NEPBS0_NLCA1_NLCB1_ONLL1_PGR1_PLR1_PKA0_SGROB0_SIA1_SS0_SU32_SUM0_SUS256_SPO0_SRVW0_SSO0_SVW1_SK0_SKFTR0_SKXCCM0_SGRO0_TIN0_TT3_2_TLDS0_TLDSMn1_ULSGRO0_USL1_UIOFGRO0_UPLRP0_USFGROn1_VSn1_VWA1_VWB1_WSGRA0_WSGRB0_WS32_WG8_16_1_WGM1_WGMXCC1_WGMXCCGn1
    SolutionIndex: 56
    SolutionNameMin: Cijk_Alik_Bljk_S_B_UserArgs_MT24x32x16_SN_LDSB0_AFC0_AG0_AFEM1_AFEM1_ASEM1_CLR0_CADS0_DTLA0_DTLB0_DTVA0_DTVB0_DTVSM0_DPLB0_EPS1_ELFLR0_EMLLn1_FDSI0_GRPM1_GRVWA1_GRVWB1_GSU1_GSUAMB_GSUC0_GSUWGMRR0_GLS0_ISA1201_IU1_K1_LDSTI0_LBSPPA0_LBSPPB0_LBSPPM0_LPA4_LPB4_LPM0_LRVW1_LWPMn1_MIAV0_MO40_MGRIPM1_NTn1_NTA0_NTB0_NTC0_NTD0_NTM0_NEPBS0_NLCA1_NLCB1_ONLL1_PGR1_PLR1_PKA0_SGROB0_SIA1_SS0_SU16_SUM0_SUS256_SPO0_SRVW0_SSO0_SVW1_SK0_SKFTR0_SKXCCM0_SGRO0_TIN0_TT3_2_TLDS0_TLDSMn1_ULSGRO0_USL1_UIOFGRO0_UPLRP0_USFGROn1_VSn1_VWA1_VWB1_WSGRA0_WSGRB0_WS32_WG8_16_1_WGM1_WGMXCC1_WGMXCCGn1
    SolutionIndex: 57
    SolutionNameMin: Cijk_Alik_Bljk_S_B_UserArgs_MT32x16x8_SN_LDSB0_AFC0_AG0_AFEM1_AFEM1_ASEM1_CLR0_CADS0_DTLA0_DTLB0_DTVA0_DTVB0_DTVSM0_DPLB0_EPS1_ELFLR0_EMLLn1_FDSI0_GRPM1_GRVWA1_GRVWB1_GSU1_GSUAMB_GSUC0_GSUWGMRR0_GLS0_ISA1201_IU1_K1_LDSTI0_LBSPPA0_LBSPPB0_LBSPPM0_LPA4_LPB4_LPM0_LRVW1_LWPMn1_MIAV0_MO40_MGRIPM1_NTn1_NTA0_NTB0_NTC0_NTD0_NTM0_NEPBS0_NLCA1_NLCB1_ONLL1_PGR1_PLR1_PKA0_SGROB0_SIA1_SS0_SU32_SUM0_SUS256_SPO0_SRVW0_SSO0_SVW1_SK0_SKFTR0_SKXCCM0_SGRO0_TIN0_TT4_4_TLDS0_TLDSMn1_ULSGRO0_USL1_UIOFGRO0_UPLRP0_USFGROn1_VSn1_VWA1_VWB1_WSGRA0_WSGRB0_WS32_WG8_4_1_WGM1_WGMXCC1_WGMXCCGn1
    SolutionIndex: 58
    SolutionNameMin: Cijk_Alik_Bljk_S_B_UserArgs_MT48x16x16_SN_LDSB0_AFC0_AG0_AFEM1_AFEM1_ASEM1_CLR0_CADS0_DTLA0_DTLB0_DTVA0_DTVB0_DTVSM0_DPLB0_EPS1_ELFLR0_EMLLn1_FDSI0_GRPM1_GRVWA1_GRVWB1_GSU1_GSUAMB_GSUC0_GSUWGMRR0_GLS0_ISA1201_IU1_K1_LDSTI0_LBSPPA0_LBSPPB0_LBSPPM0_LPA4_LPB4_LPM0_LRVW1_LWPMn1_MIAV0_MO40_MGRIPM1_NTn1_NTA0_NTB0_NTC0_NTD0_NTM0_NEPBS0_NLCA1_NLCB1_ONLL1_PGR1_PLR1_PKA0_SGROB0_SIA1_SS0_SU32_SUM0_SUS256_SPO0_SRVW0_SSO0_SVW1_SK0_SKFTR0_SKXCCM0_SGRO0_TIN0_TT3_2_TLDS0_TLDSMn1_ULSGRO0_USL1_UIOFGRO0_UPLRP0_USFGROn1_VSn1_VWA1_VWB1_WSGRA0_WSGRB0_WS32_WG16_8_1_WGM1_WGMXCC1_WGMXCCGn1
    SolutionIndex: 59
    SolutionNameMin: Cijk_Alik_Bljk_S_B_UserArgs_MT32x64x16_SN_LDSB0_AFC0_AG0_AFEM1_AFEM1_ASEM1_CLR0_CADS0_DTLA0_DTLB0_DTVA0_DTVB0_DTVSM0_DPLB0_EPS1_ELFLR0_EMLLn1_FDSI0_GRPM1_GRVWA1_GRVWB1_GSU1_GSUAMB_GSUC0_GSUWGMRR0_GLS0_ISA1201_IU1_K1_LDSTI0_LBSPPA0_LBSPPB0_LBSPPM0_LPA4_LPB4_LPM0_LRVW1_LWPMn1_MIAV0_MO40_MGRIPM1_NTn1_NTA0_NTB0_NTC0_NTD0_NTM0_NEPBS0_NLCA1_NLCB1_ONLL1_PGR1_PLR1_PKA0_SGROB0_SIA1_SS0_SU32_SUM0_SUS256_SPO0_SRVW0_SSO0_SVW1_SK0_SKFTR0_SKXCCM0_SGRO0_TIN0_TT4_4_TLDS0_TLDSMn1_ULSGRO0_USL1_UIOFGRO0_UPLRP0_USFGROn1_VSn1_VWA1_VWB1_WSGRA0_WSGRB0_WS32_WG8_16_1_WGM1_WGMXCC1_WGMXCCGn1
    SolutionIndex: 60
    SolutionNameMin: Cijk_Alik_Bljk_S_B_UserArgs_MT48x16x8_SN_LDSB0_AFC0_AG0_AFEM1_AFEM1_ASEM1_CLR0_CADS0_DTLA0_DTLB0_DTVA0_DTVB0_DTVSM0_DPLB0_EPS1_ELFLR0_EMLLn1_FDSI0_GRPM1_GRVWA1_GRVWB1_GSU1_GSUAMB_GSUC0_GSUWGMRR0_GLS0_ISA1201_IU1_K1_LDSTI0_LBSPPA0_LBSPPB0_LBSPPM0_LPA4_LPB4_LPM0_LRVW1_LWPMn1_MIAV0_MO40_MGRIPM1_NTn1_NTA0_NTB0_NTC0_NTD0_NTM0_NEPBS0_NLCA1_NLCB1_ONLL1_PGR1_PLR1_PKA0_SGROB0_SIA1_SS0_SU16_SUM0_SUS256_SPO0_SRVW0_SSO0_SVW1_SK0_SKFTR0_SKXCCM0_SGRO0_TIN0_TT3_2_TLDS0_TLDSMn1_ULSGRO0_USL1_UIOFGRO0_UPLRP0_USFGROn1_VSn1_VWA1_VWB1_WSGRA0_WSGRB0_WS32_WG16_8_1_WGM1_WGMXCC1_WGMXCCGn1
    SolutionIndex: 61
    SolutionNameMin: Cijk_Alik_Bljk_S_B_UserArgs_MT24x8x32_SN_LDSB0_AFC0_AG0_AFEM1_AFEM1_ASEM1_CLR0_CADS0_DTLA0_DTLB0_DTVA0_DTVB0_DTVSM0_DPLB0_EPS1_ELFLR0_EMLLn1_FDSI0_GRPM1_GRVWA1_GRVWB1_GSU1_GSUAMB_GSUC0_GSUWGMRR0_GLS0_ISA1201_IU1_K1_LDSTI0_LBSPPA0_LBSPPB0_LBSPPM0_LPA4_LPB4_LPM0_LRVW1_LWPMn1_MIAV0_MO40_MGRIPM1_NTn1_NTA0_NTB0_NTC0_NTD0_NTM0_NEPBS0_NLCA1_NLCB1_ONLL1_PGR1_PLR1_PKA0_SGROB0_SIA1_SS0_SU16_SUM0_SUS256_SPO0_SRVW0_SSO0_SVW1_SK0_SKFTR0_SKXCCM0_SGRO0_TIN0_TT3_2_TLDS0_TLDSMn1_ULSGRO0_USL1_UIOFGRO0_UPLRP0_USFGROn1_VSn1_VWA1_VWB1_WSGRA0_WSGRB0_WS32_WG8_4_1_WGM1_WGMXCC1_WGMXCCGn1
    SolutionIndex: 62
    SolutionNameMin: Cijk_Alik_Bljk_S_B_UserArgs_MT48x16x8_SN_LDSB0_AFC0_AG0_AFEM1_AFEM1_ASEM1_CLR0_CADS0_DTLA0_DTLB0_DTVA0_DTVB0_DTVSM0_DPLB0_EPS1_ELFLR0_EMLLn1_FDSI0_GRPM1_GRVWA1_GRVWB1_GSU1_GSUAMB_GSUC0_GSUWGMRR0_GLS0_ISA1201_IU1_K1_LDSTI0_LBSPPA0_LBSPPB0_LBSPPM0_LPA4_LPB4_LPM0_LRVW1_LWPMn1_MIAV0_MO40_MGRIPM1_NTn1_NTA0_NTB0_NTC0_NTD0_NTM0_NEPBS0_NLCA1_NLCB1_ONLL1_PGR1_PLR1_PKA0_SGROB0_SIA1_SS0_SU32_SUM0_SUS256_SPO0_SRVW0_SSO0_SVW1_SK0_SKFTR0_SKXCCM0_SGRO0_TIN0_TT3_2_TLDS0_TLDSMn1_ULSGRO0_USL1_UIOFGRO0_UPLRP0_USFGROn1_VSn1_VWA1_VWB1_WSGRA0_WSGRB0_WS32_WG16_8_1_WGM1_WGMXCC1_WGMXCCGn1
    SolutionIndex: 63
    SolutionNameMin: Cijk_Alik_Bljk_S_B_UserArgs_MT32x64x32_SN_LDSB0_AFC0_AG0_AFEM1_AFEM1_ASEM1_CLR0_CADS0_DTLA0_DTLB0_DTVA0_DTVB0_DTVSM0_DPLB0_EPS1_ELFLR0_EMLLn1_FDSI0_GRPM1_GRVWA1_GRVWB1_GSU1_GSUAMB_GSUC0_GSUWGMRR0_GLS0_ISA1201_IU1_K1_LDSTI0_LBSPPA0_LBSPPB0_LBSPPM0_LPA4_LPB4_LPM0_LRVW1_LWPMn1_MIAV0_MO40_MGRIPM1_NTn1_NTA0_NTB0_NTC0_NTD0_NTM0_NEPBS0_NLCA1_NLCB1_ONLL1_PGR1_PLR1_PKA0_SGROB0_SIA1_SS0_SU16_SUM0_SUS256_SPO0_SRVW0_SSO0_SVW1_SK0_SKFTR0_SKXCCM0_SGRO0_TIN0_TT4_4_TLDS0_TLDSMn1_ULSGRO0_USL1_UIOFGRO0_UPLRP0_USFGROn1_VSn1_VWA1_VWB1_WSGRA0_WSGRB0_WS32_WG8_16_1_WGM1_WGMXCC1_WGMXCCGn1
    SolutionIndex: 64
    SolutionNameMin: Cijk_Alik_Bljk_S_B_UserArgs_MT32x64x32_SN_LDSB0_AFC0_AG0_AFEM1_AFEM1_ASEM1_CLR0_CADS0_DTLA0_DTLB0_DTVA0_DTVB0_DTVSM0_DPLB0_EPS1_ELFLR0_EMLLn1_FDSI0_GRPM1_GRVWA1_GRVWB1_GSU1_GSUAMB_GSUC0_GSUWGMRR0_GLS0_ISA1201_IU1_K1_LDSTI0_LBSPPA0_LBSPPB0_LBSPPM0_LPA4_LPB4_LPM0_LRVW1_LWPMn1_MIAV0_MO40_MGRIPM1_NTn1_NTA0_NTB0_NTC0_NTD0_NTM0_NEPBS0_NLCA1_NLCB1_ONLL1_PGR1_PLR1_PKA0_SGROB0_SIA1_SS0_SU32_SUM0_SUS256_SPO0_SRVW0_SSO0_SVW1_SK0_SKFTR0_SKXCCM0_SGRO0_TIN0_TT4_4_TLDS0_TLDSMn1_ULSGRO0_USL1_UIOFGRO0_UPLRP0_USFGROn1_VSn1_VWA1_VWB1_WSGRA0_WSGRB0_WS32_WG8_16_1_WGM1_WGMXCC1_WGMXCCGn1
    SolutionIndex: 65
    SolutionNameMin: Cijk_Alik_Bljk_S_B_UserArgs_MT64x32x32_SN_LDSB0_AFC0_AG0_AFEM1_AFEM1_ASEM1_CLR0_CADS0_DTLA0_DTLB0_DTVA0_DTVB0_DTVSM0_DPLB0_EPS1_ELFLR0_EMLLn1_FDSI0_GRPM1_GRVWA1_GRVWB1_GSU1_GSUAMB_GSUC0_GSUWGMRR0_GLS0_ISA1201_IU1_K1_LDSTI0_LBSPPA0_LBSPPB0_LBSPPM0_LPA4_LPB4_LPM0_LRVW1_LWPMn1_MIAV0_MO40_MGRIPM1_NTn1_NTA0_NTB0_NTC0_NTD0_NTM0_NEPBS0_NLCA1_NLCB1_ONLL1_PGR1_PLR1_PKA0_SGROB0_SIA1_SS0_SU32_SUM0_SUS256_SPO0_SRVW0_SSO0_SVW1_SK0_SKFTR0_SKXCCM0_SGRO0_TIN0_TT4_4_TLDS0_TLDSMn1_ULSGRO0_USL1_UIOFGRO0_UPLRP0_USFGROn1_VSn1_VWA1_VWB1_WSGRA0_WSGRB0_WS32_WG16_8_1_WGM1_WGMXCC1_WGMXCCGn1
    SolutionIndex: 66
    SolutionNameMin: Cijk_Alik_Bljk_S_B_UserArgs_MT24x8x32_SN_LDSB0_AFC0_AG0_AFEM1_AFEM1_ASEM1_CLR0_CADS0_DTLA0_DTLB0_DTVA0_DTVB0_DTVSM0_DPLB0_EPS1_ELFLR0_EMLLn1_FDSI0_GRPM1_GRVWA1_GRVWB1_GSU1_GSUAMB_GSUC0_GSUWGMRR0_GLS0_ISA1201_IU1_K1_LDSTI0_LBSPPA0_LBSPPB0_LBSPPM0_LPA4_LPB4_LPM0_LRVW1_LWPMn1_MIAV0_MO40_MGRIPM1_NTn1_NTA0_NTB0_NTC0_NTD0_NTM0_NEPBS0_NLCA1_NLCB1_ONLL1_PGR1_PLR1_PKA0_SGROB0_SIA1_SS0_SU32_SUM0_SUS256_SPO0_SRVW0_SSO0_SVW1_SK0_SKFTR0_SKXCCM0_SGRO0_TIN0_TT3_2_TLDS0_TLDSMn1_ULSGRO0_USL1_UIOFGRO0_UPLRP0_USFGROn1_VSn1_VWA1_VWB1_WSGRA0_WSGRB0_WS32_WG8_4_1_WGM1_WGMXCC1_WGMXCCGn1
    SolutionIndex: 67
    SolutionNameMin: Cijk_Alik_Bljk_S_B_UserArgs_MT16x32x16_SN_LDSB0_AFC0_AG0_AFEM1_AFEM1_ASEM1_CLR0_CADS0_DTLA0_DTLB0_DTVA0_DTVB0_DTVSM0_DPLB0_EPS1_ELFLR0_EMLLn1_FDSI0_GRPM1_GRVWA1_GRVWB1_GSU1_GSUAMB_GSUC0_GSUWGMRR0_GLS0_ISA1201_IU1_K1_LDSTI0_LBSPPA0_LBSPPB0_LBSPPM0_LPA4_LPB4_LPM0_LRVW1_LWPMn1_MIAV0_MO40_MGRIPM1_NTn1_NTA0_NTB0_NTC0_NTD0_NTM0_NEPBS0_NLCA1_NLCB1_ONLL1_PGR1_PLR1_PKA0_SGROB0_SIA1_SS0_SU64_SUM0_SUS256_SPO0_SRVW0_SSO0_SVW1_SK0_SKFTR0_SKXCCM0_SGRO0_TIN0_TT2_2_TLDS0_TLDSMn1_ULSGRO0_USL1_UIOFGRO0_UPLRP0_USFGROn1_VSn1_VWA1_VWB1_WSGRA0_WSGRB0_WS32_WG8_16_1_WGM1_WGMXCC1_WGMXCCGn1
    SolutionIndex: 68
    SolutionNameMin: Cijk_Alik_Bljk_S_B_UserArgs_MT16x32x8_SN_LDSB0_AFC0_AG0_AFEM1_AFEM1_ASEM1_CLR0_CADS0_DTLA0_DTLB0_DTVA0_DTVB0_DTVSM0_DPLB0_EPS1_ELFLR0_EMLLn1_FDSI0_GRPM1_GRVWA1_GRVWB1_GSU1_GSUAMB_GSUC0_GSUWGMRR0_GLS0_ISA1201_IU1_K1_LDSTI0_LBSPPA0_LBSPPB0_LBSPPM0_LPA4_LPB4_LPM0_LRVW1_LWPMn1_MIAV0_MO40_MGRIPM1_NTn1_NTA0_NTB0_NTC0_NTD0_NTM0_NEPBS0_NLCA1_NLCB1_ONLL1_PGR1_PLR1_PKA0_SGROB0_SIA1_SS0_SU64_SUM0_SUS256_SPO0_SRVW0_SSO0_SVW1_SK0_SKFTR0_SKXCCM0_SGRO0_TIN0_TT2_2_TLDS0_TLDSMn1_ULSGRO0_USL1_UIOFGRO0_UPLRP0_USFGROn1_VSn1_VWA1_VWB1_WSGRA0_WSGRB0_WS32_WG8_16_1_WGM1_WGMXCC1_WGMXCCGn1
    SolutionIndex: 69
    SolutionNameMin: Cijk_Alik_Bljk_S_B_UserArgs_MT64x32x8_SN_LDSB0_AFC0_AG0_AFEM1_AFEM1_ASEM1_CLR0_CADS0_DTLA0_DTLB0_DTVA0_DTVB0_DTVSM0_DPLB0_EPS1_ELFLR0_EMLLn1_FDSI0_GRPM1_GRVWA1_GRVWB1_GSU1_GSUAMB_GSUC0_GSUWGMRR0_GLS0_ISA1201_IU1_K1_LDSTI0_LBSPPA0_LBSPPB0_LBSPPM0_LPA4_LPB4_LPM0_LRVW1_LWPMn1_MIAV0_MO40_MGRIPM1_NTn1_NTA0_NTB0_NTC0_NTD0_NTM0_NEPBS0_NLCA1_NLCB1_ONLL1_PGR1_PLR1_PKA0_SGROB0_SIA1_SS0_SU64_SUM0_SUS256_SPO0_SRVW0_SSO0_SVW1_SK0_SKFTR0_SKXCCM0_SGRO0_TIN0_TT4_4_TLDS0_TLDSMn1_ULSGRO0_USL1_UIOFGRO0_UPLRP0_USFGROn1_VSn1_VWA1_VWB1_WSGRA0_WSGRB0_WS32_WG16_8_1_WGM1_WGMXCC1_WGMXCCGn1
    SolutionIndex: 70
    SolutionNameMin: Cijk_Alik_Bljk_S_B_UserArgs_MT64x128x8_SN_LDSB0_AFC0_AG0_AFEM1_AFEM1_ASEM1_CLR0_CADS0_DTLA0_DTLB0_DTVA0_DTVB0_DTVSM0_DPLB0_EPS1_ELFLR0_EMLLn1_FDSI0_GRPM1_GRVWA1_GRVWB1_GSU1_GSUAMB_GSUC0_GSUWGMRR0_GLS0_ISA1201_IU1_K1_LDSTI0_LBSPPA0_LBSPPB0_LBSPPM0_LPA4_LPB4_LPM0_LRVW1_LWPMn1_MIAV0_MO40_MGRIPM1_NTn1_NTA0_NTB0_NTC0_NTD0_NTM0_NEPBS0_NLCA1_NLCB1_ONLL1_PGR1_PLR1_PKA0_SGROB0_SIA1_SS0_SU64_SUM0_SUS256_SPO0_SRVW0_SSO0_SVW1_SK0_SKFTR0_SKXCCM0_SGRO0_TIN0_TT8_8_TLDS0_TLDSMn1_ULSGRO0_USL1_UIOFGRO0_UPLRP0_USFGROn1_VSn1_VWA1_VWB1_WSGRA0_WSGRB0_WS32_WG8_16_1_WGM1_WGMXCC1_WGMXCCGn1
    SolutionIndex: 71
    SolutionNameMin: Cijk_Alik_Bljk_S_B_UserArgs_MT64x32x16_SN_LDSB0_AFC0_AG0_AFEM1_AFEM1_ASEM1_CLR0_CADS0_DTLA0_DTLB0_DTVA0_DTVB0_DTVSM0_DPLB0_EPS1_ELFLR0_EMLLn1_FDSI0_GRPM1_GRVWA1_GRVWB1_GSU1_GSUAMB_GSUC0_GSUWGMRR0_GLS0_ISA1201_IU1_K1_LDSTI0_LBSPPA0_LBSPPB0_LBSPPM0_LPA4_LPB4_LPM0_LRVW1_LWPMn1_MIAV0_MO40_MGRIPM1_NTn1_NTA0_NTB0_NTC0_NTD0_NTM0_NEPBS0_NLCA1_NLCB1_ONLL1_PGR1_PLR1_PKA0_SGROB0_SIA1_SS0_SU64_SUM0_SUS256_SPO0_SRVW0_SSO0_SVW1_SK0_SKFTR0_SKXCCM0_SGRO0_TIN0_TT4_4_TLDS0_TLDSMn1_ULSGRO0_USL1_UIOFGRO0_UPLRP0_USFGROn1_VSn1_VWA1_VWB1_WSGRA0_WSGRB0_WS32_WG16_8_1_WGM1_WGMXCC1_WGMXCCGn1
    SolutionIndex: 72
    SolutionNameMin: Cijk_Alik_Bljk_S_B_UserArgs_MT128x64x8_SN_LDSB0_AFC0_AG0_AFEM1_AFEM1_ASEM1_CLR0_CADS0_DTLA0_DTLB0_DTVA0_DTVB0_DTVSM0_DPLB0_EPS1_ELFLR0_EMLLn1_FDSI0_GRPM1_GRVWA1_GRVWB1_GSU1_GSUAMB_GSUC0_GSUWGMRR0_GLS0_ISA1201_IU1_K1_LDSTI0_LBSPPA0_LBSPPB0_LBSPPM0_LPA4_LPB4_LPM0_LRVW1_LWPMn1_MIAV0_MO40_MGRIPM1_NTn1_NTA0_NTB0_NTC0_NTD0_NTM0_NEPBS0_NLCA1_NLCB1_ONLL1_PGR1_PLR1_PKA0_SGROB0_SIA1_SS0_SU32_SUM0_SUS256_SPO0_SRVW0_SSO0_SVW1_SK0_SKFTR0_SKXCCM0_SGRO0_TIN0_TT8_8_TLDS0_TLDSMn1_ULSGRO0_USL1_UIOFGRO0_UPLRP0_USFGROn1_VSn1_VWA1_VWB1_WSGRA0_WSGRB0_WS32_WG16_8_1_WGM1_WGMXCC1_WGMXCCGn1
    SolutionIndex: 73
    SolutionNameMin: Cijk_Alik_Bljk_S_B_UserArgs_MT96x64x8_SN_LDSB0_AFC0_AG0_AFEM1_AFEM1_ASEM1_CLR0_CADS0_DTLA0_DTLB0_DTVA0_DTVB0_DTVSM0_DPLB0_EPS1_ELFLR0_EMLLn1_FDSI0_GRPM1_GRVWA1_GRVWB1_GSU1_GSUAMB_GSUC0_GSUWGMRR0_GLS0_ISA1201_IU1_K1_LDSTI0_LBSPPA0_LBSPPB0_LBSPPM0_LPA4_LPB4_LPM0_LRVW1_LWPMn1_MIAV0_MO40_MGRIPM1_NTn1_NTA0_NTB0_NTC0_NTD0_NTM0_NEPBS0_NLCA1_NLCB1_ONLL1_PGR1_PLR1_PKA0_SGROB0_SIA1_SS0_SU64_SUM0_SUS256_SPO0_SRVW0_SSO0_SVW1_SK0_SKFTR0_SKXCCM0_SGRO0_TIN0_TT6_8_TLDS0_TLDSMn1_ULSGRO0_USL1_UIOFGRO0_UPLRP0_USFGROn1_VSn1_VWA1_VWB1_WSGRA0_WSGRB0_WS32_WG16_8_1_WGM1_WGMXCC1_WGMXCCGn1
    SolutionIndex: 74
    SolutionNameMin: Cijk_Alik_Bljk_S_B_UserArgs_MT96x64x8_SN_LDSB0_AFC0_AG0_AFEM1_AFEM1_ASEM1_CLR0_CADS0_DTLA0_DTLB0_DTVA0_DTVB0_DTVSM0_DPLB0_EPS1_ELFLR0_EMLLn1_FDSI0_GRPM1_GRVWA1_GRVWB1_GSU1_GSUAMB_GSUC0_GSUWGMRR0_GLS0_ISA1201_IU1_K1_LDSTI0_LBSPPA0_LBSPPB0_LBSPPM0_LPA4_LPB4_LPM0_LRVW1_LWPMn1_MIAV0_MO40_MGRIPM1_NTn1_NTA0_NTB0_NTC0_NTD0_NTM0_NEPBS0_NLCA1_NLCB1_ONLL1_PGR1_PLR1_PKA0_SGROB0_SIA1_SS0_SU32_SUM0_SUS256_SPO0_SRVW0_SSO0_SVW1_SK0_SKFTR0_SKXCCM0_SGRO0_TIN0_TT6_8_TLDS0_TLDSMn1_ULSGRO0_USL1_UIOFGRO0_UPLRP0_USFGROn1_VSn1_VWA1_VWB1_WSGRA0_WSGRB0_WS32_WG16_8_1_WGM1_WGMXCC1_WGMXCCGn1
    SolutionIndex: 75
    SolutionNameMin: Cijk_Alik_Bljk_S_B_UserArgs_MT96x64x8_SN_LDSB0_AFC0_AG0_AFEM1_AFEM1_ASEM1_CLR0_CADS0_DTLA0_DTLB0_DTVA0_DTVB0_DTVSM0_DPLB0_EPS1_ELFLR0_EMLLn1_FDSI0_GRPM1_GRVWA1_GRVWB1_GSU1_GSUAMB_GSUC0_GSUWGMRR0_GLS0_ISA1201_IU1_K1_LDSTI0_LBSPPA0_LBSPPB0_LBSPPM0_LPA4_LPB4_LPM0_LRVW1_LWPMn1_MIAV0_MO40_MGRIPM1_NTn1_NTA0_NTB0_NTC0_NTD0_NTM0_NEPBS0_NLCA1_NLCB1_ONLL1_PGR1_PLR1_PKA0_SGROB0_SIA1_SS0_SU16_SUM0_SUS256_SPO0_SRVW0_SSO0_SVW1_SK0_SKFTR0_SKXCCM0_SGRO0_TIN0_TT6_8_TLDS0_TLDSMn1_ULSGRO0_USL1_UIOFGRO0_UPLRP0_USFGROn1_VSn1_VWA1_VWB1_WSGRA0_WSGRB0_WS32_WG16_8_1_WGM1_WGMXCC1_WGMXCCGn1
    SolutionIndex: 76
    SolutionNameMin: Cijk_Alik_Bljk_S_B_UserArgs_MT24x32x16_SN_LDSB0_AFC0_AG0_AFEM1_AFEM1_ASEM1_CLR0_CADS0_DTLA0_DTLB0_DTVA0_DTVB0_DTVSM0_DPLB0_EPS1_ELFLR0_EMLLn1_FDSI0_GRPM1_GRVWA1_GRVWB1_GSU1_GSUAMB_GSUC0_GSUWGMRR0_GLS0_ISA1201_IU1_K1_LDSTI0_LBSPPA0_LBSPPB0_LBSPPM0_LPA4_LPB4_LPM0_LRVW1_LWPMn1_MIAV0_MO40_MGRIPM1_NTn1_NTA0_NTB0_NTC0_NTD0_NTM0_NEPBS0_NLCA1_NLCB1_ONLL1_PGR1_PLR1_PKA0_SGROB0_SIA1_SS0_SU64_SUM0_SUS256_SPO0_SRVW0_SSO0_SVW1_SK0_SKFTR0_SKXCCM0_SGRO0_TIN0_TT3_2_TLDS0_TLDSMn1_ULSGRO0_USL1_UIOFGRO0_UPLRP0_USFGROn1_VSn1_VWA1_VWB1_WSGRA0_WSGRB0_WS32_WG8_16_1_WGM1_WGMXCC1_WGMXCCGn1
    SolutionIndex: 77
    SolutionNameMin: Cijk_Alik_Bljk_S_B_UserArgs_MT64x128x8_SN_LDSB0_AFC0_AG0_AFEM1_AFEM1_ASEM1_CLR0_CADS0_DTLA0_DTLB0_DTVA0_DTVB0_DTVSM0_DPLB0_EPS1_ELFLR0_EMLLn1_FDSI0_GRPM1_GRVWA1_GRVWB1_GSU1_GSUAMB_GSUC0_GSUWGMRR0_GLS0_ISA1201_IU1_K1_LDSTI0_LBSPPA0_LBSPPB0_LBSPPM0_LPA4_LPB4_LPM0_LRVW1_LWPMn1_MIAV0_MO40_MGRIPM1_NTn1_NTA0_NTB0_NTC0_NTD0_NTM0_NEPBS0_NLCA1_NLCB1_ONLL1_PGR1_PLR1_PKA0_SGROB0_SIA1_SS0_SU32_SUM0_SUS256_SPO0_SRVW0_SSO0_SVW1_SK0_SKFTR0_SKXCCM0_SGRO0_TIN0_TT8_8_TLDS0_TLDSMn1_ULSGRO0_USL1_UIOFGRO0_UPLRP0_USFGROn1_VSn1_VWA1_VWB1_WSGRA0_WSGRB0_WS32_WG8_16_1_WGM1_WGMXCC1_WGMXCCGn1
    SolutionIndex: 78
    SolutionNameMin: Cijk_Alik_Bljk_S_B_UserArgs_MT64x128x8_SN_LDSB0_AFC0_AG0_AFEM1_AFEM1_ASEM1_CLR0_CADS0_DTLA0_DTLB0_DTVA0_DTVB0_DTVSM0_DPLB0_EPS1_ELFLR0_EMLLn1_FDSI0_GRPM1_GRVWA1_GRVWB1_GSU1_GSUAMB_GSUC0_GSUWGMRR0_GLS0_ISA1201_IU1_K1_LDSTI0_LBSPPA0_LBSPPB0_LBSPPM0_LPA4_LPB4_LPM0_LRVW1_LWPMn1_MIAV0_MO40_MGRIPM1_NTn1_NTA0_NTB0_NTC0_NTD0_NTM0_NEPBS0_NLCA1_NLCB1_ONLL1_PGR1_PLR1_PKA0_SGROB0_SIA1_SS0_SU16_SUM0_SUS256_SPO0_SRVW0_SSO0_SVW1_SK0_SKFTR0_SKXCCM0_SGRO0_TIN0_TT8_8_TLDS0_TLDSMn1_ULSGRO0_USL1_UIOFGRO0_UPLRP0_USFGROn1_VSn1_VWA1_VWB1_WSGRA0_WSGRB0_WS32_WG8_16_1_WGM1_WGMXCC1_WGMXCCGn1
    SolutionIndex: 79
    SolutionNameMin: Cijk_Alik_Bljk_S_B_UserArgs_MT128x64x8_SN_LDSB0_AFC0_AG0_AFEM1_AFEM1_ASEM1_CLR0_CADS0_DTLA0_DTLB0_DTVA0_DTVB0_DTVSM0_DPLB0_EPS1_ELFLR0_EMLLn1_FDSI0_GRPM1_GRVWA1_GRVWB1_GSU1_GSUAMB_GSUC0_GSUWGMRR0_GLS0_ISA1201_IU1_K1_LDSTI0_LBSPPA0_LBSPPB0_LBSPPM0_LPA4_LPB4_LPM0_LRVW1_LWPMn1_MIAV0_MO40_MGRIPM1_NTn1_NTA0_NTB0_NTC0_NTD0_NTM0_NEPBS0_NLCA1_NLCB1_ONLL1_PGR1_PLR1_PKA0_SGROB0_SIA1_SS0_SU64_SUM0_SUS256_SPO0_SRVW0_SSO0_SVW1_SK0_SKFTR0_SKXCCM0_SGRO0_TIN0_TT8_8_TLDS0_TLDSMn1_ULSGRO0_USL1_UIOFGRO0_UPLRP0_USFGROn1_VSn1_VWA1_VWB1_WSGRA0_WSGRB0_WS32_WG16_8_1_WGM1_WGMXCC1_WGMXCCGn1
    SolutionIndex: 80
    SolutionNameMin: Cijk_Alik_Bljk_S_B_UserArgs_MT48x16x32_SN_LDSB0_AFC0_AG0_AFEM1_AFEM1_ASEM1_CLR0_CADS0_DTLA0_DTLB0_DTVA0_DTVB0_DTVSM0_DPLB0_EPS1_ELFLR0_EMLLn1_FDSI0_GRPM1_GRVWA1_GRVWB1_GSU1_GSUAMB_GSUC0_GSUWGMRR0_GLS0_ISA1201_IU1_K1_LDSTI0_LBSPPA0_LBSPPB0_LBSPPM0_LPA4_LPB4_LPM0_LRVW1_LWPMn1_MIAV0_MO40_MGRIPM1_NTn1_NTA0_NTB0_NTC0_NTD0_NTM0_NEPBS0_NLCA1_NLCB1_ONLL1_PGR1_PLR1_PKA0_SGROB0_SIA1_SS0_SU64_SUM0_SUS256_SPO0_SRVW0_SSO0_SVW1_SK0_SKFTR0_SKXCCM0_SGRO0_TIN0_TT3_2_TLDS0_TLDSMn1_ULSGRO0_USL1_UIOFGRO0_UPLRP0_USFGROn1_VSn1_VWA1_VWB1_WSGRA0_WSGRB0_WS32_WG16_8_1_WGM1_WGMXCC1_WGMXCCGn1
- - - [640, 32, 1, 64]
    - [8, 0.28]
  - - [10, 32, 1, 4096]
    - [17, 0.02]
  - - [1088, 1216, 1, 1]
    - [7, 0.21]
  - - [32, 192, 1, 256]
    - [14, 0.22]
  - - [1344, 1472, 1, 1]
    - [0, 0.24]
  - - [832, 3136, 1, 1]
    - [4, 0.26]
  - - [192, 1088, 1, 16]
    - [71, 0.73]
  - - [256, 16, 1, 1024]
    - [19, 0.22]
  - - [32, 640, 1, 256]
    - [22, 0.66]
  - - [640, 32, 1, 256]
    - [15, 0.7]
  - - [192, 448, 1, 64]
    - [9, 0.94]
  - - [2368, 2368, 1, 1]
    - [4, 0.33]
  - - [896, 448, 1, 16]
    - [12, 1.19]
  - - [3904, 1856, 1, 1]
    - [0, 0.35]
  - - [192, 704, 1, 64]
    - [10, 1.41]
  - - [192, 1856, 1, 32]
    - [0, 1.85]
  - - [64, 3392, 1, 64]
    - [2, 2.13]
  - - [512, 16, 1, 2048]
    - [18, 0.5]
  - - [1600, 832, 1, 16]
    - [5, 2.65]
  - - [2368, 320, 1, 32]
    - [1, 3.03]
  - - [192, 1984, 1, 64]
    - [11, 3.11]
  - - [960, 1600, 1, 16]
    - [0, 2.94]
  - - [1728, 448, 1, 32]
    - [1, 3.07]
  - - [320, 2624, 1, 32]
    - [1, 3.18]
  - - [16, 1024, 1, 2048]
    - [16, 0.96]
  - - [1216, 16, 1, 2048]
    - [20, 1.08]
  - - [448, 1728, 1, 64]
    - [6, 4.15]
  - - [128, 16, 1, 128]
    - [13, 0.05]
  - - [1, 8192, 1, 128]
    - [21, 0.1]
  - - [64, 32, 1, 128]
    - [13, 0.04]
  - - [1, 256, 1, 2048]
    - [22, 0.02]
  - - [1, 320, 1, 2048]
    - [23, 0.02]
  - - [128, 16, 1, 512]
    - [22, 0.09]
  - - [128, 32, 1, 128]
    - [23, 0.09]
  - - [32, 64, 1, 128]
    - [24, 0.05]
  - - [64, 16, 1, 128]
    - [13, 0.02]
  - - [64, 16, 1, 512]
    - [22, 0.05]
  - - [8192, 16, 1, 32]
    - [25, 0.75]
  - - [8192, 1, 1, 512]
    - [26, 0.23]
  - - [896, 1, 1, 512]
    - [22, 0.04]
  - - [1, 1, 1, 3072]
    - [13, 0.0]
  - - [1, 192, 1, 2048]
    - [22, 0.01]
  - - [1, 384, 1, 2048]
    - [23, 0.02]
  - - [384, 1, 1, 16]
    - [27, 0.0]
  - - [10, 2, 1, 2]
    - [28, 0.0]
  - - [2880, 32, 1, 32]
    - [9, 0.64]
  - - [832, 1, 1, 512]
    - [22, 0.04]
  - - [256, 16, 1, 128]
    - [22, 0.09]
  - - [320, 1, 1, 16]
    - [29, 0.0]
  - - [960, 1, 1, 512]
    - [22, 0.04]
  - - [16, 256, 1, 128]
    - [24, 0.09]
  - - [3072, 32, 1, 32]
    - [9, 0.68]
  - - [3136, 32, 1, 32]
    - [30, 0.7]
  - - [4096, 16, 1, 32]
    - [31, 0.46]
  - - [32, 8192, 1, 128]
    - [32, 3.24]
  - - [1, 2112, 1, 256]
    - [33, 0.06]
  - - [2624, 32, 1, 32]
    - [9, 0.58]
  - - [12, 2, 1, 2]
    - [28, 0.0]
  - - [10, 1, 1, 32]
    - [34, 0.0]
  - - [768, 1, 1, 512]
    - [13, 0.04]
  - - [1, 2048, 1, 256]
    - [24, 0.07]
  - - [1, 4096, 1, 128]
    - [35, 0.08]
  - - [1024, 1, 1, 512]
    - [22, 0.05]
  - - [8, 2, 1, 2]
    - [21, 0.0]
  - - [3392, 32, 1, 32]
    - [30, 0.72]
  - - [3904, 16, 1, 32]
    - [25, 0.43]
  - - [64, 32, 1, 512]
    - [24, 0.09]
  - - [2, 2, 1, 2]
    - [36, 0.0]
  - - [1, 2368, 1, 256]
    - [33, 0.07]
  - - [1, 8192, 1, 32]
    - [37, 0.04]
  - - [1, 1984, 1, 256]
    - [24, 0.06]
  - - [16, 640, 1, 64]
    - [37, 0.14]
  - - [1, 448, 1, 2048]
    - [13, 0.03]
  - - [14, 2, 1, 2]
    - [36, 0.0]
  - - [3648, 32, 1, 32]
    - [9, 0.77]
  - - [448, 1, 1, 16]
    - [27, 0.0]
  - - [32, 128, 1, 128]
    - [22, 0.09]
  - - [32, 128, 1, 3072]
    - [22, 0.25]
  - - [1088, 1, 1, 512]
    - [38, 0.04]
  - - [1, 2624, 1, 256]
    - [37, 0.07]
  - - [3648, 16, 1, 32]
    - [31, 0.4]
  - - [16, 576, 1, 64]
    - [23, 0.13]
  - - [16, 704, 1, 64]
    - [33, 0.16]
  - - [2368, 32, 1, 32]
    - [39, 0.53]
  - - [12, 4, 1, 2]
    - [28, 0.0]
  - - [16, 128, 1, 2048]
    - [24, 0.12]
  - - [704, 1, 1, 512]
    - [13, 0.03]
  - - [16, 2, 1, 2]
    - [40, 0.0]
  - - [3904, 32, 1, 32]
    - [9, 0.79]
  - - [1, 1856, 1, 256]
    - [24, 0.06]
  - - [32, 32, 1, 6]
    - [41, 0.0]
  - - [1, 2880, 1, 256]
    - [33, 0.08]
  - - [16, 64, 1, 64]
    - [42, 0.01]
  - - [32, 192, 1, 64]
    - [29, 0.09]
  - - [16, 768, 1, 64]
    - [23, 0.17]
  - - [1, 6, 1, 4096]
    - [24, 0.0]
  - - [1, 64, 1, 8192]
    - [13, 0.0]
  - - [4096, 32, 1, 32]
    - [39, 0.78]
  - - [16, 4096, 1, 128]
    - [21, 1.19]
  - - [16, 128, 1, 128]
    - [24, 0.05]
  - - [64, 16, 1, 256]
    - [13, 0.04]
  - - [32, 64, 1, 2048]
    - [22, 0.12]
  - - [16, 1024, 1, 128]
    - [43, 0.35]
  - - [1344, 64, 1, 32]
    - [44, 0.6]
  - - [1472, 64, 1, 32]
    - [32, 0.65]
  - - [6, 2, 1, 2]
    - [28, 0.0]
  - - [4, 4, 1, 2]
    - [41, 0.0]
  - - [16, 2, 1, 4096]
    - [22, 0.0]
  - - [128, 32, 1, 512]
    - [23, 0.18]
  - - [2, 4, 1, 4096]
    - [23, 0.0]
  - - [16, 512, 1, 64]
    - [23, 0.11]
  - - [16, 16, 1, 128]
    - [22, 0.01]
  - - [1, 16, 1, 8192]
    - [13, 0.0]
  - - [16, 32, 1, 256]
    - [24, 0.02]
  - - [32, 32, 1, 128]
    - [13, 0.02]
  - - [32, 32, 1, 512]
    - [24, 0.05]
  - - [8192, 1, 1, 1024]
    - [45, 0.25]
  - - [32, 512, 1, 1024]
    - [13, 0.87]
  - - [256, 1, 1, 16]
    - [27, 0.0]
  - - [1, 3136, 1, 256]
    - [21, 0.08]
  - - [3392, 16, 1, 32]
    - [45, 0.37]
  - - [16, 832, 1, 64]
    - [23, 0.18]
  - - [32, 128, 1, 64]
    - [13, 0.06]
  - - [32, 16, 1, 6]
    - [28, 0.0]
  - - [1536, 64, 1, 32]
    - [30, 0.68]
  - - [12, 4, 1, 4096]
    - [23, 0.0]
  - - [1, 1728, 1, 256]
    - [23, 0.05]
  - - [1, 512, 1, 2048]
    - [22, 0.03]
  - - [704, 128, 1, 32]
    - [9, 0.62]
  - - [1216, 1, 1, 512]
    - [38, 0.05]
  - - [8, 2, 1, 4096]
    - [22, 0.0]
  - - [2, 6, 1, 2]
    - [35, 0.0]
  - - [1, 12, 1, 32]
    - [34, 0.0]
  - - [12, 1, 1, 32]
    - [34, 0.0]
  - - [16, 16, 1, 2]
    - [27, 0.0]
  - - [3072, 1, 1, 128]
    - [42, 0.06]
  - - [192, 16, 1, 512]
    - [22, 0.14]
  - - [640, 128, 1, 32]
    - [46, 0.57]
  - - [8, 6, 1, 2]
    - [28, 0.0]
  - - [4, 16, 1, 2]
    - [28, 0.0]
  - - [640, 1, 1, 512]
    - [22, 0.03]
  - - [192, 32, 1, 16]
    - [42, 0.03]
  - - [1, 3392, 1, 256]
    - [37, 0.08]
  - - [16, 896, 1, 64]
    - [23, 0.2]
  - - [1, 8192, 1, 256]
    - [35, 0.12]
  - - [16, 6, 1, 4]
    - [42, 0.0]
  - - [32, 768, 1, 32]
    - [13, 0.19]
  - - [512, 1, 1, 16]
    - [28, 0.0]
  - - [10, 4, 1, 2]
    - [28, 0.0]
  - - [2112, 32, 1, 32]
    - [39, 0.47]
  - - [1600, 64, 1, 32]
    - [30, 0.71]
  - - [14, 4, 1, 2]
    - [41, 0.0]
  - - [16, 192, 1, 32]
    - [34, 0.02]
  - - [16, 32, 1, 6]
    - [28, 0.0]
  - - [32, 448, 1, 1024]
    - [22, 0.76]
  - - [64, 64, 1, 64]
    - [22, 0.06]
  - - [16, 448, 1, 64]
    - [24, 0.1]
  - - [1536, 16, 1, 128]
    - [47, 0.53]
  - - [1, 256, 1, 16]
    - [27, 0.0]
  - - [16, 960, 1, 64]
    - [23, 0.21]
  - - [1, 3648, 1, 256]
    - [21, 0.09]
  - - [128, 384, 1, 32]
    - [30, 0.34]
  - - [14, 2, 1, 4096]
    - [13, 0.0]
  - - [32, 32, 1, 2048]
    - [24, 0.06]
  - - [2048, 32, 1, 32]
    - [46, 0.45]
  - - [6, 1, 1, 32]
    - [34, 0.0]
  - - [3136, 16, 1, 32]
    - [25, 0.35]
  - - [10, 4, 1, 4096]
    - [24, 0.0]
  - - [1216, 64, 1, 32]
    - [30, 0.54]
  - - [768, 128, 1, 32]
    - [46, 0.68]
  - - [64, 512, 1, 32]
    - [29, 0.25]
  - - [384, 192, 1, 32]
    - [39, 0.51]
  - - [32, 576, 1, 1024]
    - [23, 0.88]
  - - [16, 1024, 1, 64]
    - [24, 0.23]
  - - [3072, 16, 1, 32]
    - [48, 0.34]
  - - [1, 3904, 1, 256]
    - [21, 0.1]
  - - [256, 32, 1, 16]
    - [27, 0.03]
  - - [1, 1600, 1, 256]
    - [24, 0.05]
  - - [1728, 64, 1, 32]
    - [39, 0.77]
  - - [16, 8192, 1, 128]
    - [37, 1.62]
  - - [32, 14, 1, 6]
    - [27, 0.0]
  - - [8, 6, 1, 4096]
    - [13, 0.0]
  - - [16, 256, 1, 32]
    - [34, 0.03]
  - - [128, 64, 1, 16]
    - [27, 0.03]
  - - [32, 256, 1, 64]
    - [49, 0.11]
  - - [6, 2, 1, 4096]
    - [13, 0.0]
  - - [16, 512, 1, 128]
    - [24, 0.18]
  - - [14, 16, 1, 2]
    - [28, 0.0]
  - - [4, 14, 1, 2]
    - [28, 0.0]
  - - [1984, 32, 1, 32]
    - [9, 0.44]
  - - [1, 320, 1, 16]
    - [28, 0.0]
  - - [576, 128, 1, 32]
    - [43, 0.51]
  - - [32, 832, 1, 32]
    - [22, 0.21]
  - - [1, 4096, 1, 256]
    - [21, 0.1]
  - - [32, 384, 1, 1024]
    - [24, 0.66]
  - - [32, 704, 1, 32]
    - [13, 0.17]
  - - [16, 1088, 1, 64]
    - [24, 0.23]
  - - [1344, 1, 1, 512]
    - [38, 0.06]
  - - [10, 2, 1, 4096]
    - [13, 0.0]
  - - [10, 6, 1, 32]
    - [49, 0.0]
  - - [6, 10, 1, 2]
    - [28, 0.0]
  - - [8192, 16, 1, 64]
    - [50, 1.31]
  - - [16, 384, 1, 64]
    - [23, 0.09]
  - - [256, 256, 1, 32]
    - [51, 0.46]
  - - [32, 32, 1, 256]
    - [22, 0.04]
  - - [32, 64, 1, 512]
    - [24, 0.09]
  - - [1, 576, 1, 2048]
    - [23, 0.03]
  - - [320, 192, 1, 32]
    - [50, 0.43]
  - - [64, 256, 1, 1024]
    - [22, 0.87]
  - - [6, 8, 1, 2]
    - [36, 0.0]
  - - [16, 4, 1, 2]
    - [28, 0.0]
  - - [12, 8, 1, 4]
    - [28, 0.0]
  - - [1, 128, 1, 2048]
    - [24, 0.01]
  - - [576, 1, 1, 512]
    - [22, 0.03]
  - - [1, 192, 1, 3072]
    - [13, 0.01]
  - - [1, 256, 1, 3072]
    - [24, 0.02]
  - - [1344, 1, 1, 1024]
    - [38, 0.07]
  - - [16, 1344, 1, 64]
    - [23, 0.26]
  - - [1, 10, 1, 32]
    - [34, 0.0]
  - - [16, 1536, 1, 32]
    - [23, 0.19]
  - - [384, 16, 1, 128]
    - [22, 0.14]
  - - [16, 320, 1, 512]
    - [24, 0.23]
  - - [16, 384, 1, 512]
    - [23, 0.28]
  - - [14, 4, 1, 4096]
    - [24, 0.0]
  - - [16, 1472, 1, 64]
    - [34, 0.28]
  - - [14, 32, 1, 6]
    - [28, 0.0]
  - - [2, 4, 1, 2]
    - [41, 0.0]
  - - [4, 2, 1, 2]
    - [28, 0.0]
  - - [6, 4, 1, 2]
    - [41, 0.0]
  - - [64, 64, 1, 512]
    - [24, 0.19]
  - - [1856, 64, 1, 32]
    - [9, 0.82]
  - - [32, 2048, 1, 128]
    - [52, 1.21]
  - - [1472, 1, 1, 1024]
    - [38, 0.07]
  - - [64, 576, 1, 32]
    - [49, 0.26]
  - - [576, 1, 1, 16]
    - [27, 0.0]
  - - [832, 128, 1, 32]
    - [30, 0.74]
  - - [16, 14, 1, 2]
    - [40, 0.0]
  - - [2880, 16, 1, 32]
    - [31, 0.33]
  - - [6, 10, 1, 32]
    - [34, 0.0]
  - - [16, 16, 1, 4]
    - [28, 0.0]
  - - [14, 8, 1, 4]
    - [28, 0.0]
  - - [14, 6, 1, 4]
    - [28, 0.0]
  - - [16, 1216, 1, 64]
    - [33, 0.26]
  - - [192, 256, 1, 32]
    - [31, 0.37]
  - - [32, 64, 1, 3072]
    - [22, 0.13]
  - - [6, 6, 1, 32]
    - [34, 0.0]
  - - [1856, 32, 1, 32]
    - [50, 0.41]
  - - [192, 320, 1, 32]
    - [39, 0.44]
  - - [16, 1472, 1, 32]
    - [33, 0.18]
  - - [32, 12, 1, 6]
    - [28, 0.0]
  - - [16, 2048, 1, 128]
    - [33, 0.7]
  - - [448, 192, 1, 32]
    - [39, 0.6]
  - - [1536, 1, 1, 1024]
    - [48, 0.08]
  - - [12, 16, 1, 2]
    - [36, 0.0]
  - - [1, 14, 1, 32]
    - [49, 0.0]
  - - [14, 1, 1, 32]
    - [34, 0.0]
  - - [128, 320, 1, 32]
    - [46, 0.3]
  - - [16, 256, 1, 3072]
    - [23, 0.25]
  - - [1, 1472, 1, 256]
    - [24, 0.05]
  - - [32, 10, 1, 6]
    - [41, 0.0]
  - - [16, 1600, 1, 32]
    - [24, 0.2]
  - - [16, 64, 1, 2048]
    - [23, 0.06]
  - - [16, 4096, 1, 32]
    - [33, 0.4]
  - - [32, 640, 1, 1024]
    - [24, 0.98]
  - - [10, 6, 1, 2]
    - [35, 0.0]
  - - [1088, 64, 1, 32]
    - [25, 0.48]
  - - [32, 896, 1, 32]
    - [13, 0.22]
  - - [64, 768, 1, 32]
    - [46, 0.36]
  - - [16, 1600, 1, 64]
    - [33, 0.34]
  - - [4096, 64, 1, 64]
    - [39, 2.33]
  - - [1600, 1, 1, 1024]
    - [13, 0.08]
  - - [8192, 1, 1, 32]
    - [26, 0.05]
  - - [32, 320, 1, 1024]
    - [22, 0.55]
  - - [1984, 64, 1, 32]
    - [9, 0.81]
  - - [512, 128, 1, 32]
    - [39, 0.46]
  - - [16, 320, 1, 32]
    - [28, 0.04]
  - - [32, 320, 1, 64]
    - [13, 0.14]
  - - [32, 640, 1, 32]
    - [28, 0.16]
  - - [64, 832, 1, 32]
    - [46, 0.38]
  - - [12, 2, 1, 4096]
    - [22, 0.0]
  - - [64, 448, 1, 32]
    - [22, 0.22]
  - - [1472, 1, 1, 512]
    - [38, 0.06]
  - - [16, 8, 1, 4]
    - [27, 0.0]
  - - [128, 448, 1, 32]
    - [9, 0.4]
  - - [16, 320, 1, 64]
    - [13, 0.07]
  - - [64, 32, 1, 64]
    - [8, 0.03]
  - - [64, 704, 1, 32]
    - [46, 0.33]
  - - [16, 3904, 1, 32]
    - [21, 0.43]
  - - [10, 10, 1, 4]
    - [28, 0.0]
  - - [1, 384, 1, 64]
    - [13, 0.01]
  - - [896, 128, 1, 32]
    - [46, 0.8]
  - - [16, 1728, 1, 64]
    - [33, 0.36]
  - - [14, 14, 1, 2]
    - [28, 0.0]
  - - [32, 128, 1, 16]
    - [27, 0.02]
  - - [128, 32, 1, 16]
    - [27, 0.02]
  - - [8192, 16, 1, 1]
    - [52, 0.03]
  - - [1728, 1, 1, 1024]
    - [13, 0.08]
  - - [6, 8, 1, 4096]
    - [23, 0.0]
  - - [16, 128, 1, 512]
    - [24, 0.09]
  - - [16, 3840, 1, 32]
    - [23, 0.38]
  - - [4, 12, 1, 2]
    - [28, 0.0]
  - - [8, 8, 1, 2]
    - [28, 0.0]
  - - [3904, 64, 1, 64]
    - [39, 2.26]
  - - [1216, 1, 1, 1024]
    - [48, 0.06]
  - - [1024, 64, 1, 32]
    - [53, 0.46]
  - - [32, 32, 1, 64]
    - [34, 0.01]
  - - [2112, 64, 1, 32]
    - [51, 0.8]
  - - [1, 640, 1, 2048]
    - [23, 0.04]
  - - [1728, 32, 1, 32]
    - [53, 0.38]
  - - [16, 1728, 1, 32]
    - [24, 0.21]
  - - [512, 192, 1, 32]
    - [39, 0.68]
  - - [128, 16, 1, 256]
    - [13, 0.07]
  - - [64, 192, 1, 1024]
    - [22, 0.66]
  - - [64, 16, 1, 2048]
    - [22, 0.06]
  - - [10, 16, 1, 2]
    - [35, 0.0]
  - - [2624, 16, 1, 32]
    - [38, 0.29]
  - - [192, 1, 1, 16]
    - [28, 0.0]
  - - [1, 64, 1, 1]
    - [28, 0.0]
  - - [64, 1, 1, 1]
    - [28, 0.0]
  - - [1, 192, 1, 256]
    - [24, 0.01]
  - - [8192, 1, 1, 4096]
    - [42, 0.11]
  - - [1, 1, 1, 6]
    - [28, 0.0]
  - - [1, 1, 1, 32]
    - [24, 0.0]
  - - [1, 1, 1, 128]
    - [24, 0.0]
  - - [1, 1, 1, 512]
    - [13, 0.0]
  - - [16, 8192, 1, 1]
    - [51, 0.03]
  - - [1, 8192, 1, 2048]
    - [21, 0.14]
  - - [3392, 1, 1, 2048]
    - [47, 0.17]
  - - [1, 8192, 1, 512]
    - [21, 0.14]
  - - [960, 32, 1, 1024]
    - [24, 1.49]
  - - [1, 1728, 1, 32]
    - [24, 0.01]
  - - [8192, 1, 1, 64]
    - [54, 0.08]
  - - [1344, 16, 1, 1024]
    - [38, 1.07]
  - - [320, 32, 1, 4096]
    - [23, 0.65]
  - - [1, 1600, 1, 32]
    - [24, 0.01]
  - - [3136, 1, 1, 2048]
    - [47, 0.15]
  - - [4, 4, 1, 8]
    - [26, 0.0]
  - - [1, 1536, 1, 32]
    - [24, 0.01]
  - - [64, 1728, 1, 256]
    - [46, 2.52]
  - - [1728, 64, 1, 256]
    - [39, 2.5]
  - - [1472, 16, 1, 1024]
    - [48, 1.16]
  - - [32, 320, 1, 4096]
    - [24, 0.65]
  - - [256, 256, 1, 256]
    - [55, 1.66]
  - - [3072, 1, 1, 2048]
    - [47, 0.15]
  - - [1, 1792, 1, 32]
    - [24, 0.01]
  - - [1, 1472, 1, 32]
    - [23, 0.01]
  - - [16, 1, 1, 6]
    - [29, 0.0]
  - - [64, 1856, 1, 256]
    - [39, 2.72]
  - - [1856, 64, 1, 256]
    - [39, 2.67]
  - - [1024, 32, 1, 1024]
    - [37, 1.57]
  - - [448, 1, 1, 32]
    - [34, 0.0]
  - - [6, 2, 1, 8]
    - [28, 0.0]
  - - [3648, 1, 1, 2048]
    - [47, 0.18]
  - - [32, 2880, 1, 256]
    - [52, 2.1]
  - - [2880, 32, 1, 256]
    - [52, 2.13]
  - - [2880, 16, 1, 1024]
    - [31, 2.03]
  - - [896, 32, 1, 1024]
    - [24, 1.4]
  - - [1, 256, 1, 32]
    - [34, 0.0]
  - - [16, 704, 1, 4096]
    - [23, 0.69]
  - - [1, 32, 1, 12]
    - [42, 0.0]
  - - [1, 896, 1, 32]
    - [24, 0.01]
  - - [1, 1344, 1, 32]
    - [24, 0.01]
  - - [64, 1984, 1, 256]
    - [46, 2.89]
  - - [1984, 64, 1, 256]
    - [39, 2.85]
  - - [1536, 16, 1, 1024]
    - [38, 1.22]
  - - [1, 1856, 1, 32]
    - [23, 0.01]
  - - [384, 1, 1, 32]
    - [34, 0.0]
  - - [128, 768, 1, 256]
    - [52, 2.41]
  - - [192, 32, 1, 4096]
    - [24, 0.39]
  - - [384, 16, 1, 4096]
    - [23, 0.39]
  - - [768, 128, 1, 256]
    - [52, 2.31]
  - - [192, 384, 1, 256]
    - [55, 1.87]
  - - [384, 192, 1, 256]
    - [56, 1.9]
  - - [1, 576, 1, 32]
    - [23, 0.0]
  - - [1, 1280, 1, 32]
    - [33, 0.01]
  - - [1, 2624, 1, 512]
    - [37, 0.1]
  - - [64, 2112, 1, 256]
    - [39, 2.52]
  - - [2112, 64, 1, 256]
    - [52, 2.59]
  - - [1, 832, 1, 32]
    - [21, 0.01]
  - - [1088, 32, 1, 1024]
    - [31, 1.55]
  - - [1216, 16, 1, 1024]
    - [38, 0.96]
  - - [2624, 16, 1, 1024]
    - [31, 1.85]
  - - [512, 1, 1, 32]
    - [34, 0.0]
  - - [1, 320, 1, 256]
    - [23, 0.01]
  - - [320, 16, 1, 4096]
    - [13, 0.32]
  - - [16, 640, 1, 4096]
    - [24, 0.63]
  - - [64, 1600, 1, 256]
    - [39, 2.32]
  - - [1600, 64, 1, 256]
    - [39, 2.33]
  - - [128, 832, 1, 256]
    - [32, 2.44]
  - - [832, 128, 1, 256]
    - [46, 2.43]
  - - [2880, 1, 1, 2048]
    - [47, 0.15]
  - - [3072, 32, 1, 256]
    - [57, 2.23]
  - - [1, 1216, 1, 32]
    - [24, 0.01]
  - - [1984, 1, 1, 2048]
    - [13, 0.11]
  - - [128, 704, 1, 256]
    - [52, 2.17]
  - - [704, 128, 1, 256]
    - [52, 2.18]
  - - [1, 320, 1, 1024]
    - [24, 0.02]
  - - [1, 2880, 1, 512]
    - [33, 0.1]
  - - [1, 192, 1, 32]
    - [34, 0.0]
  - - [1, 640, 1, 32]
    - [24, 0.0]
  - - [1600, 16, 1, 1024]
    - [22, 1.25]
  - - [2048, 1, 1, 2048]
    - [22, 0.11]
  - - [576, 16, 1, 4096]
    - [13, 0.58]
  - - [32, 3136, 1, 256]
    - [44, 2.16]
  - - [3136, 32, 1, 256]
    - [30, 2.25]
  - - [32, 3648, 1, 256]
    - [44, 2.5]
  - - [4096, 16, 1, 256]
    - [31, 1.63]
  - - [704, 16, 1, 4096]
    - [13, 0.71]
  - - [1, 2368, 1, 512]
    - [37, 0.08]
  - - [3904, 1, 1, 2048]
    - [47, 0.19]
  - - [32, 3904, 1, 256]
    - [51, 2.64]
  - - [2112, 1, 1, 2048]
    - [47, 0.11]
  - - [12, 2, 1, 6]
    - [28, 0.0]
  - - [6, 8, 1, 2048]
    - [13, 0.0]
  - - [192, 448, 1, 256]
    - [52, 2.08]
  - - [448, 192, 1, 256]
    - [57, 2.05]
  - - [256, 1, 1, 4096]
    - [24, 0.02]
  - - [128, 896, 1, 256]
    - [51, 2.61]
  - - [448, 16, 1, 4096]
    - [22, 0.45]
  - - [896, 128, 1, 256]
    - [39, 2.61]
  - - [64, 2368, 1, 256]
    - [46, 2.82]
  - - [2368, 64, 1, 256]
    - [39, 2.85]
  - - [1600, 1, 1, 32]
    - [34, 0.01]
  - - [16, 576, 1, 4096]
    - [23, 0.57]
  - - [832, 32, 1, 1024]
    - [24, 1.3]
  - - [320, 1, 1, 32]
    - [34, 0.0]
  - - [576, 1, 1, 32]
    - [49, 0.0]
  - - [1856, 1, 1, 2048]
    - [22, 0.1]
  - - [1, 960, 1, 32]
    - [24, 0.01]
  - - [1, 3136, 1, 512]
    - [21, 0.1]
  - - [1, 8192, 1, 16]
    - [51, 0.02]
  - - [1, 1984, 1, 32]
    - [24, 0.01]
  - - [1, 1088, 1, 32]
    - [33, 0.01]
  - - [1984, 1, 1, 32]
    - [27, 0.02]
  - - [1856, 1, 1, 32]
    - [49, 0.01]
  - - [1, 704, 1, 32]
    - [24, 0.01]
  - - [704, 1, 1, 32]
    - [49, 0.01]
  - - [832, 1, 1, 32]
    - [34, 0.01]
  - - [32, 2624, 1, 256]
    - [52, 2.02]
  - - [2624, 32, 1, 256]
    - [52, 1.97]
  - - [192, 576, 1, 256]
    - [39, 2.52]
  - - [576, 192, 1, 256]
    - [46, 2.53]
  - - [960, 1, 1, 32]
    - [34, 0.01]
  - - [128, 960, 1, 256]
    - [32, 2.8]
  - - [960, 128, 1, 256]
    - [39, 2.79]
  - - [1088, 1, 1, 32]
    - [34, 0.01]
  - - [832, 16, 1, 512]
    - [13, 0.6]
  - - [32, 8192, 1, 1]
    - [51, 0.06]
  - - [1216, 1, 1, 32]
    - [34, 0.01]
  - - [640, 16, 1, 4096]
    - [13, 0.65]
  - - [1344, 1, 1, 32]
    - [34, 0.01]
  - - [4, 10, 1, 2048]
    - [13, 0.0]
  - - [1472, 1, 1, 32]
    - [34, 0.01]
  - - [10, 2, 1, 6]
    - [28, 0.0]
  - - [256, 320, 1, 256]
    - [57, 2.04]
  - - [320, 256, 1, 256]
    - [52, 2.03]
  - - [1, 1024, 1, 32]
    - [24, 0.01]
  - - [2112, 16, 1, 1024]
    - [58, 1.5]
  - - [2368, 1, 1, 2048]
    - [47, 0.12]
  - - [2368, 16, 1, 1024]
    - [58, 1.67]
  - - [2, 14, 1, 2048]
    - [22, 0.0]
  - - [192, 16, 1, 4096]
    - [13, 0.2]
  - - [2624, 1, 1, 2048]
    - [47, 0.13]
  - - [2624, 64, 1, 256]
    - [46, 3.16]
  - - [2880, 64, 1, 256]
    - [39, 3.44]
  - - [1728, 1, 1, 32]
    - [34, 0.01]
  - - [1, 3392, 1, 512]
    - [21, 0.11]
  - - [1728, 16, 1, 1024]
    - [22, 1.35]
  - - [1, 3648, 1, 512]
    - [35, 0.11]
  - - [1856, 16, 1, 1024]
    - [22, 1.45]
  - - [14, 1, 1, 6]
    - [8, 0.0]
  - - [1, 320, 1, 32]
    - [34, 0.0]
  - - [1, 3904, 1, 512]
    - [35, 0.12]
  - - [1984, 16, 1, 1024]
    - [22, 1.53]
  - - [320, 576, 1, 256]
    - [39, 3.43]
  - - [576, 320, 1, 256]
    - [46, 3.45]
  - - [16, 3904, 1, 256]
    - [37, 1.52]
  - - [3904, 16, 1, 256]
    - [58, 1.56]
  - - [2, 2, 1, 4]
    - [41, 0.0]
  - - [32, 1, 1, 6]
    - [28, 0.0]
  - - [1, 128, 1, 32]
    - [34, 0.0]
  - - [16, 1, 1, 256]
    - [22, 0.0]
  - - [128, 1, 1, 32]
    - [34, 0.0]
  - - [192, 1, 1, 32]
    - [34, 0.0]
  - - [1, 64, 1, 128]
    - [23, 0.0]
  - - [32, 1, 1, 256]
    - [24, 0.0]
  - - [256, 1, 1, 32]
    - [34, 0.0]
  - - [1, 128, 1, 128]
    - [24, 0.0]
  - - [64, 1, 1, 256]
    - [22, 0.0]
  - - [640, 1, 1, 32]
    - [22, 0.01]
  - - [1, 768, 1, 32]
    - [24, 0.01]
  - - [768, 1, 1, 32]
    - [34, 0.01]
  - - [896, 1, 1, 32]
    - [34, 0.01]
  - - [1, 64, 1, 512]
    - [22, 0.0]
  - - [1, 128, 1, 256]
    - [22, 0.0]
  - - [64, 1, 1, 512]
    - [13, 0.0]
  - - [1024, 1, 1, 32]
    - [34, 0.01]
  - - [384, 1, 1, 128]
    - [13, 0.01]
  - - [1536, 1, 1, 32]
    - [27, 0.01]
  - - [1, 128, 1, 512]
    - [24, 0.01]
  - - [1, 256, 1, 256]
    - [24, 0.01]
  - - [1, 2048, 1, 32]
    - [24, 0.02]
  - - [128, 1, 1, 512]
    - [22, 0.01]
  - - [2048, 1, 1, 32]
    - [34, 0.02]
  - - [768, 1, 1, 128]
    - [22, 0.02]
  - - [6, 10, 1, 2048]
    - [13, 0.0]
  - - [1, 256, 1, 1024]
    - [24, 0.01]
  - - [1, 384, 1, 1024]
    - [24, 0.02]
  - - [128, 1, 1, 4096]
    - [23, 0.01]
  - - [192, 1, 1, 4096]
    - [23, 0.01]
  - - [16, 64, 1, 1024]
    - [24, 0.06]
  - - [32, 32, 1, 1024]
    - [24, 0.06]
  - - [64, 16, 1, 1024]
    - [13, 0.06]
  - - [1, 4096, 1, 512]
    - [35, 0.12]
  - - [8192, 32, 1, 16]
    - [9, 0.81]
  - - [1, 4096, 1, 2048]
    - [35, 0.14]
  - - [4096, 1, 1, 2048]
    - [47, 0.19]
  - - [16, 4096, 1, 256]
    - [35, 1.6]
  - - [256, 16, 1, 4096]
    - [13, 0.26]
  - - [128, 640, 1, 256]
    - [52, 2.0]
  - - [640, 128, 1, 256]
    - [52, 1.98]
  - - [192, 512, 1, 256]
    - [52, 2.36]
  - - [512, 192, 1, 256]
    - [52, 2.36]
  - - [32, 3392, 1, 256]
    - [59, 2.33]
  - - [3392, 32, 1, 256]
    - [30, 2.43]
  - - [3648, 32, 1, 256]
    - [30, 2.61]
  - - [3904, 32, 1, 256]
    - [9, 2.78]
  - - [16, 8192, 1, 256]
    - [35, 1.95]
  - - [32, 4096, 1, 256]
    - [51, 2.78]
  - - [128, 64, 1, 4096]
    - [22, 0.52]
  - - [128, 1024, 1, 256]
    - [46, 2.95]
  - - [256, 32, 1, 4096]
    - [22, 0.52]
  - - [512, 16, 1, 4096]
    - [23, 0.52]
  - - [1024, 128, 1, 256]
    - [9, 2.94]
  - - [4096, 32, 1, 256]
    - [9, 2.86]
  - - [8192, 16, 1, 256]
    - [57, 2.61]
  - - [576, 64, 1, 1024]
    - [56, 1.65]
  - - [1216, 32, 1, 1024]
    - [31, 1.73]
  - - [640, 64, 1, 1024]
    - [56, 1.83]
  - - [64, 2624, 1, 256]
    - [46, 3.1]
  - - [1344, 32, 1, 1024]
    - [31, 1.91]
  - - [704, 64, 1, 1024]
    - [58, 2.03]
  - - [64, 2880, 1, 256]
    - [39, 3.38]
  - - [1472, 32, 1, 1024]
    - [58, 2.08]
  - - [8192, 4096, 1, 1]
    - [52, 0.13]
  - - [64, 8192, 1, 16]
    - [9, 1.41]
  - - [64, 1472, 1, 256]
    - [52, 2.16]
  - - [1472, 64, 1, 256]
    - [57, 2.26]
  - - [1, 12, 1, 10]
    - [42, 0.0]
  - - [384, 384, 1, 256]
    - [39, 2.78]
  - - [8, 6, 1, 2048]
    - [22, 0.0]
  - - [768, 16, 1, 512]
    - [13, 0.55]
  - - [512, 32, 1, 512]
    - [22, 0.74]
  - - [192, 320, 1, 256]
    - [56, 1.57]
  - - [320, 192, 1, 256]
    - [56, 1.59]
  - - [6, 6, 1, 1]
    - [33, 0.0]
  - - [32, 32, 1, 1]
    - [28, 0.0]
  - - [256, 512, 1, 256]
    - [39, 3.1]
  - - [512, 256, 1, 256]
    - [9, 2.94]
  - - [320, 320, 1, 256]
    - [39, 2.34]
  - - [14, 2, 1, 6]
    - [28, 0.0]
  - - [1, 512, 1, 32]
    - [34, 0.0]
  - - [256, 704, 1, 256]
    - [39, 3.41]
  - - [704, 256, 1, 256]
    - [39, 3.37]
  - - [32, 1, 1, 16]
    - [42, 0.0]
  - - [1, 512, 1, 4096]
    - [13, 0.03]
  - - [16, 512, 1, 4096]
    - [22, 0.51]
  - - [32, 256, 1, 4096]
    - [13, 0.52]
  - - [64, 128, 1, 4096]
    - [23, 0.52]
  - - [384, 448, 1, 256]
    - [46, 3.23]
  - - [448, 384, 1, 256]
    - [39, 3.22]
  - - [1088, 16, 1, 1024]
    - [38, 0.86]
  - - [1, 2112, 1, 32]
    - [34, 0.01]
  - - [2112, 1, 1, 32]
    - [34, 0.02]
  - - [8, 8, 1, 2048]
    - [22, 0.0]
  - - [192, 640, 1, 256]
    - [39, 2.8]
  - - [640, 192, 1, 256]
    - [39, 2.79]
  - - [6, 12, 1, 2048]
    - [13, 0.0]
  - - [12, 6, 1, 2048]
    - [23, 0.0]
  - - [320, 448, 1, 256]
    - [46, 2.7]
  - - [448, 320, 1, 256]
    - [39, 2.69]
  - - [2, 12, 1, 2048]
    - [22, 0.0]
  - - [128, 16, 1, 32]
    - [34, 0.02]
  - - [768, 32, 1, 1024]
    - [15, 1.25]
  - - [1, 448, 1, 1024]
    - [24, 0.02]
  - - [1728, 1, 1, 2048]
    - [22, 0.09]
  - - [256, 448, 1, 256]
    - [39, 2.69]
  - - [448, 256, 1, 256]
    - [46, 2.61]
  - - [192, 704, 1, 256]
    - [39, 2.54]
  - - [704, 192, 1, 256]
    - [52, 2.59]
  - - [1, 384, 1, 256]
    - [24, 0.01]
  - - [192, 896, 1, 256]
    - [46, 3.28]
  - - [896, 192, 1, 256]
    - [39, 3.22]
  - - [256, 640, 1, 256]
    - [46, 3.08]
  - - [640, 256, 1, 256]
    - [46, 3.08]
  - - [192, 960, 1, 256]
    - [46, 3.44]
  - - [960, 192, 1, 256]
    - [39, 3.44]
  - - [1, 3904, 1, 2048]
    - [37, 0.13]
  - - [1, 14, 1, 10]
    - [35, 0.0]
  - - [10, 6, 1, 2048]
    - [24, 0.0]
  - - [320, 384, 1, 256]
    - [39, 2.8]
  - - [384, 320, 1, 256]
    - [39, 2.8]
  - - [320, 1, 1, 4096]
    - [24, 0.02]
  - - [1, 2112, 1, 512]
    - [33, 0.08]
  - - [192, 832, 1, 256]
    - [39, 3.0]
  - - [832, 192, 1, 256]
    - [39, 2.99]
  - - [3072, 8192, 1, 1]
    - [9, 0.13]
  - - [896, 16, 1, 512]
    - [22, 0.65]
  - - [320, 512, 1, 256]
    - [46, 3.09]
  - - [512, 320, 1, 256]
    - [46, 3.08]
  - - [8, 10, 1, 2048]
    - [13, 0.0]
  - - [10, 8, 1, 2048]
    - [23, 0.0]
  - - [1088, 1, 1, 256]
    - [38, 0.04]
  - - [128, 16, 1, 4096]
    - [13, 0.13]
  - - [128, 32, 1, 4096]
    - [13, 0.26]
  - - [16, 3648, 1, 256]
    - [35, 1.43]
  - - [3648, 16, 1, 256]
    - [45, 1.46]
  - - [960, 1, 1, 256]
    - [13, 0.03]
  - - [960, 16, 1, 1024]
    - [13, 0.83]
  - - [256, 384, 1, 256]
    - [52, 2.37]
  - - [384, 256, 1, 256]
    - [57, 2.34]
  - - [192, 768, 1, 256]
    - [39, 2.77]
  - - [256, 576, 1, 256]
    - [46, 2.77]
  - - [576, 256, 1, 256]
    - [46, 2.77]
  - - [768, 192, 1, 256]
    - [39, 2.77]
  - - [1, 1984, 1, 512]
    - [23, 0.08]
  - - [128, 576, 1, 256]
    - [57, 1.81]
  - - [576, 128, 1, 256]
    - [56, 1.89]
  - - [2, 14, 1, 10]
    - [28, 0.0]
  - - [4, 14, 1, 2048]
    - [13, 0.0]
  - - [6, 1, 1, 6]
    - [28, 0.0]
  - - [1, 384, 1, 32]
    - [34, 0.0]
  - - [14, 16, 1, 2048]
    - [13, 0.01]
  - - [16, 14, 1, 2048]
    - [13, 0.01]
  - - [10, 10, 1, 2048]
    - [23, 0.01]
  - - [576, 32, 1, 512]
    - [43, 0.79]
  - - [32, 2368, 1, 256]
    - [52, 1.75]
  - - [2368, 32, 1, 256]
    - [57, 1.81]
  - - [16, 2, 1, 6]
    - [28, 0.0]
  - - [256, 1, 1, 128]
    - [22, 0.01]
  - - [1024, 1, 1, 256]
    - [22, 0.04]
  - - [1, 8192, 1, 64]
    - [35, 0.08]
  - - [1, 2048, 1, 512]
    - [23, 0.08]
  - - [16, 16, 1, 8192]
    - [22, 0.02]
  - - [16, 128, 1, 1024]
    - [24, 0.11]
  - - [1024, 16, 1, 1024]
    - [13, 0.88]
  - - [8192, 1, 1, 2048]
    - [26, 0.27]
  - - [14, 4, 1, 2048]
    - [23, 0.0]
  - - [64, 1344, 1, 256]
    - [52, 1.98]
  - - [1344, 64, 1, 256]
    - [52, 2.08]
  - - [1, 16, 1, 2048]
    - [23, 0.0]
  - - [4, 8, 1, 2048]
    - [13, 0.0]
  - - [4, 16, 1, 2048]
    - [24, 0.0]
  - - [16, 4, 1, 2048]
    - [24, 0.0]
  - - [32, 4096, 1, 1]
    - [32, 0.03]
  - - [32, 64, 1, 1024]
    - [24, 0.11]
  - - [512, 64, 1, 1024]
    - [24, 1.56]
  - - [12, 14, 1, 2048]
    - [22, 0.01]
  - - [14, 12, 1, 2048]
    - [13, 0.01]
  - - [128, 320, 1, 16]
    - [9, 0.16]
  - - [1, 1856, 1, 512]
    - [24, 0.07]
  - - [704, 16, 1, 512]
    - [22, 0.51]
  - - [1600, 1, 1, 2048]
    - [22, 0.09]
  - - [2, 16, 1, 2048]
    - [22, 0.0]
  - - [8, 2, 1, 8]
    - [28, 0.0]
  - - [1, 3648, 1, 2048]
    - [37, 0.13]
  - - [704, 32, 1, 1024]
    - [15, 1.15]
  - - [1, 2304, 1, 32]
    - [27, 0.02]
  - - [1, 576, 1, 4096]
    - [24, 0.04]
  - - [64, 16, 1, 4096]
    - [13, 0.07]
  - - [960, 16, 1, 512]
    - [13, 0.69]
  - - [1, 32, 1, 16]
    - [27, 0.0]
  - - [192, 256, 1, 256]
    - [31, 1.52]
  - - [256, 192, 1, 256]
    - [8, 1.46]
  - - [14, 14, 1, 2048]
    - [13, 0.01]
  - - [896, 1, 1, 256]
    - [13, 0.03]
  - - [448, 32, 1, 512]
    - [13, 0.65]
  - - [896, 16, 1, 1024]
    - [13, 0.77]
  - - [16, 3392, 1, 256]
    - [21, 1.35]
  - - [3392, 16, 1, 256]
    - [26, 1.4]
  - - [64, 16, 1, 1]
    - [27, 0.0]
  - - [2, 2, 1, 1024]
    - [24, 0.0]
  - - [1, 6, 1, 1024]
    - [24, 0.0]
  - - [6, 1, 1, 1024]
    - [24, 0.0]
  - - [16, 16, 1, 64]
    - [24, 0.0]
  - - [16, 16, 1, 512]
    - [22, 0.01]
  - - [16, 16, 1, 2048]
    - [13, 0.02]
  - - [1, 192, 1, 1024]
    - [13, 0.01]
  - - [12, 1, 1, 6]
    - [41, 0.0]
  - - [32, 3904, 1, 1]
    - [59, 0.03]
  - - [14, 2, 1, 16]
    - [27, 0.0]
  - - [1, 448, 1, 32]
    - [34, 0.0]
  - - [640, 32, 1, 512]
    - [15, 0.88]
  - - [128, 512, 1, 256]
    - [55, 1.67]
  - - [512, 128, 1, 256]
    - [55, 1.69]
  - - [8, 12, 1, 2048]
    - [22, 0.01]
  - - [12, 8, 1, 2048]
    - [22, 0.01]
  - - [8192, 64, 1, 1]
    - [39, 0.1]
  - - [6, 4, 1, 8]
    - [35, 0.0]
  - - [4, 12, 1, 2048]
    - [22, 0.0]
  - - [1, 2368, 1, 32]
    - [34, 0.02]
  - - [2368, 1, 1, 32]
    - [27, 0.02]
  - - [64, 2880, 1, 1]
    - [46, 0.05]
  - - [2, 16, 1, 10]
    - [28, 0.0]
  - - [32, 3840, 1, 1]
    - [51, 0.03]
  - - [3136, 64, 1, 16]
    - [39, 0.7]
  - - [1536, 1, 1, 2048]
    - [38, 0.08]
  - - [1, 448, 1, 4096]
    - [22, 0.03]
  - - [16, 448, 1, 4096]
    - [23, 0.45]
  - - [6, 14, 1, 2048]
    - [22, 0.01]
  - - [14, 6, 1, 2048]
    - [22, 0.01]
  - - [2, 8, 1, 8]
    - [41, 0.0]
  - - [12, 12, 1, 2048]
    - [22, 0.01]
  - - [6, 6, 1, 2048]
    - [24, 0.0]
  - - [64, 2624, 1, 1]
    - [46, 0.04]
  - - [8192, 16, 1, 16]
    - [57, 0.45]
  - - [1, 512, 1, 1024]
    - [23, 0.03]
  - - [1, 1728, 1, 512]
    - [24, 0.07]
  - - [1, 64, 1, 16]
    - [42, 0.0]
  - - [1216, 1, 1, 256]
    - [48, 0.04]
  - - [3072, 64, 1, 16]
    - [30, 0.68]
  - - [1, 2368, 1, 1]
    - [27, 0.0]
  - - [64, 1216, 1, 256]
    - [52, 1.9]
  - - [1216, 64, 1, 256]
    - [57, 1.92]
  - - [12, 4, 1, 2048]
    - [23, 0.0]
  - - [1, 16, 1, 10]
    - [34, 0.0]
  - - [64, 3136, 1, 1]
    - [46, 0.05]
  - - [1, 3392, 1, 2048]
    - [21, 0.12]
  - - [1024, 16, 1, 512]
    - [22, 0.73]
  - - [3392, 64, 1, 16]
    - [46, 0.73]
  - - [2, 2, 1, 6]
    - [41, 0.0]
  - - [640, 16, 1, 512]
    - [22, 0.46]
  - - [320, 128, 1, 1024]
    - [56, 1.84]
  - - [32, 2112, 1, 256]
    - [57, 1.6]
  - - [2112, 32, 1, 256]
    - [55, 1.72]
  - - [1, 10, 1, 10]
    - [26, 0.0]
  - - [1, 32, 1, 10]
    - [28, 0.0]
  - - [16, 32, 1, 10]
    - [28, 0.0]
  - - [32, 16, 1, 10]
    - [27, 0.0]
  - - [128, 256, 1, 16]
    - [29, 0.13]
  - - [8, 2, 1, 6]
    - [28, 0.0]
  - - [1, 448, 1, 256]
    - [24, 0.02]
  - - [1472, 1, 1, 2048]
    - [38, 0.08]
  - - [32, 3648, 1, 1]
    - [32, 0.03]
  - - [1, 2304, 1, 1]
    - [28, 0.0]
  - - [2, 10, 1, 2048]
    - [13, 0.0]
  - - [10, 16, 1, 2048]
    - [13, 0.01]
  - - [16, 10, 1, 2048]
    - [22, 0.01]
  - - [640, 32, 1, 1024]
    - [15, 1.04]
  - - [16, 2, 1, 16]
    - [29, 0.0]
  - - [832, 1, 1, 256]
    - [13, 0.03]
  - - [832, 16, 1, 1024]
    - [13, 0.71]
  - - [2, 16, 1, 12]
    - [28, 0.0]
  - - [16, 8, 1, 10]
    - [28, 0.0]
  - - [16, 3136, 1, 256]
    - [35, 1.27]
  - - [3136, 16, 1, 256]
    - [45, 1.3]
  - - [12, 16, 1, 2048]
    - [13, 0.01]
  - - [16, 12, 1, 2048]
    - [22, 0.01]
  - - [32, 3584, 1, 1]
    - [32, 0.03]
  - - [448, 64, 1, 1024]
    - [13, 1.4]
  - - [1, 14, 1, 2048]
    - [22, 0.0]
  - - [10, 4, 1, 10]
    - [26, 0.0]
  - - [128, 448, 1, 256]
    - [55, 1.46]
  - - [448, 128, 1, 256]
    - [56, 1.5]
  - - [1, 2560, 1, 1]
    - [35, 0.0]
  - - [32, 6, 1, 32]
    - [34, 0.0]
  - - [1, 2560, 1, 32]
    - [33, 0.02]
  - - [1, 640, 1, 4096]
    - [23, 0.04]
  - - [32, 2048, 1, 256]
    - [40, 1.64]
  - - [2, 12, 1, 10]
    - [45, 0.0]
  - - [4, 6, 1, 10]
    - [41, 0.0]
  - - [64, 3392, 1, 1]
    - [46, 0.05]
  - - [8192, 128, 1, 1]
    - [9, 0.15]
  - - [6, 1, 1, 16]
    - [29, 0.0]
  - - [12, 2, 1, 16]
    - [42, 0.0]
  - - [3648, 64, 1, 16]
    - [46, 0.81]
  - - [8, 4, 1, 10]
    - [28, 0.0]
  - - [8192, 64, 1, 16]
    - [39, 1.44]
  - - [32, 704, 1, 512]
    - [13, 0.93]
  - - [704, 32, 1, 512]
    - [43, 0.96]
  - - [2880, 64, 1, 16]
    - [46, 0.64]
  - - [3072, 16, 1, 256]
    - [31, 1.47]
  - - [384, 1, 1, 4096]
    - [24, 0.02]
  - - [4, 6, 1, 8]
    - [21, 0.0]
  - - [14, 32, 1, 10]
    - [28, 0.0]
  - - [32, 14, 1, 10]
    - [41, 0.0]
  - - [192, 192, 1, 16]
    - [54, 0.15]
  - - [10, 12, 1, 2048]
    - [13, 0.01]
  - - [12, 10, 1, 2048]
    - [13, 0.01]
  - - [512, 192, 1, 16]
    - [9, 0.37]
  - - [1, 1600, 1, 512]
    - [24, 0.06]
  - - [1, 2624, 1, 32]
    - [24, 0.02]
  - - [2624, 1, 1, 32]
    - [28, 0.02]
  - - [1, 2624, 1, 1]
    - [35, 0.0]
  - - [1088, 16, 1, 512]
    - [38, 0.72]
  - - [32, 14, 1, 12]
    - [27, 0.0]
  - - [2, 14, 1, 12]
    - [28, 0.0]
  - - [32, 448, 1, 3072]
    - [24, 0.89]
  - - [32, 1984, 1, 256]
    - [40, 1.59]
  - - [1984, 32, 1, 256]
    - [56, 1.62]
  - - [1, 32, 1, 14]
    - [28, 0.0]
  - - [64, 3648, 1, 1]
    - [46, 0.06]
  - - [3904, 64, 1, 16]
    - [46, 0.87]
  - - [1, 128, 1, 1024]
    - [13, 0.01]
  - - [10, 14, 1, 2048]
    - [13, 0.01]
  - - [14, 10, 1, 2048]
    - [22, 0.01]
  - - [128, 384, 1, 16]
    - [9, 0.2]
  - - [1, 3136, 1, 2048]
    - [21, 0.11]
  - - [64, 2368, 1, 1]
    - [46, 0.04]
  - - [128, 8192, 1, 16]
    - [9, 2.18]
  - - [32, 3392, 1, 1]
    - [32, 0.03]
  - - [1344, 1, 1, 256]
    - [38, 0.04]
  - - [3072, 1, 1, 3072]
    - [54, 0.16]
  - - [4096, 1, 1, 4096]
    - [42, 0.19]
  - - [12, 32, 1, 16]
    - [29, 0.0]
  - - [32, 12, 1, 16]
    - [42, 0.0]
  - - [1024, 128, 1, 16]
    - [9, 0.49]
  - - [192, 192, 1, 256]
    - [55, 1.17]
  - - [576, 192, 1, 16]
    - [9, 0.44]
  - - [64, 16, 1, 32]
    - [34, 0.01]
  - - [4096, 64, 1, 16]
    - [46, 0.9]
  - - [64, 1088, 1, 256]
    - [57, 1.72]
  - - [1088, 64, 1, 256]
    - [56, 1.8]
  - - [6, 4, 1, 6]
    - [27, 0.0]
  - - [6, 16, 1, 2048]
    - [22, 0.01]
  - - [16, 6, 1, 2048]
    - [22, 0.01]
  - - [1, 64, 1, 4096]
    - [22, 0.0]
  - - [192, 320, 1, 16]
    - [9, 0.25]
  - - [8, 14, 1, 2048]
    - [22, 0.01]
  - - [14, 8, 1, 2048]
    - [23, 0.01]
  - - [32, 3328, 1, 1]
    - [32, 0.03]
  - - [64, 3904, 1, 1]
    - [46, 0.06]
  - - [16, 16, 1, 3072]
    - [22, 0.02]
  - - [10, 4, 1, 2048]
    - [24, 0.0]
  - - [1, 2112, 1, 1]
    - [28, 0.0]
  - - [768, 1, 1, 256]
    - [22, 0.03]
  - - [1, 576, 1, 1024]
    - [24, 0.03]
  - - [384, 32, 1, 512]
    - [13, 0.55]
  - - [64, 256, 1, 512]
    - [13, 0.73]
  - - [256, 64, 1, 512]
    - [13, 0.74]
  - - [768, 16, 1, 1024]
    - [13, 0.66]
  - - [4, 2, 1, 8]
    - [42, 0.0]
  - - [14, 2, 1, 4]
    - [28, 0.0]
  - - [1, 192, 1, 1]
    - [28, 0.0]
  - - [192, 1, 1, 1]
    - [29, 0.0]
  - - [16, 2, 1, 8]
    - [35, 0.0]
  - - [16, 64, 1, 1]
    - [33, 0.0]
  - - [64, 1, 1, 16]
    - [28, 0.0]
  - - [192, 1, 1, 512]
    - [22, 0.01]
  - - [1344, 1, 1, 2048]
    - [48, 0.07]
  - - [4, 8, 1, 10]
    - [27, 0.0]
  - - [2, 6, 1, 10]
    - [34, 0.0]
  - - [12, 32, 1, 10]
    - [28, 0.0]
  - - [32, 12, 1, 10]
    - [41, 0.0]
  - - [576, 16, 1, 512]
    - [13, 0.42]
  - - [16, 2880, 1, 256]
    - [37, 1.26]
  - - [2880, 16, 1, 256]
    - [31, 1.37]
  - - [16, 2880, 1, 1024]
    - [33, 1.84]
  - - [192, 16, 1, 32]
    - [49, 0.02]
  - - [384, 16, 1, 256]
    - [13, 0.22]
  - - [16, 192, 1, 1024]
    - [24, 0.17]
  - - [32, 640, 1, 512]
    - [13, 0.84]
  - - [256, 256, 1, 16]
    - [9, 0.26]
  - - [14, 32, 1, 12]
    - [28, 0.0]
  - - [576, 32, 1, 1024]
    - [15, 0.94]
  - - [10, 1, 1, 6]
    - [28, 0.0]
  - - [32, 10, 1, 16]
    - [27, 0.0]
  - - [320, 256, 1, 16]
    - [9, 0.32]
  - - [2, 6, 1, 8]
    - [35, 0.0]
  - - [1, 10, 1, 12]
    - [28, 0.0]
  - - [4, 4, 1, 10]
    - [35, 0.0]
  - - [448, 192, 1, 16]
    - [9, 0.34]
  - - [64, 4096, 1, 1]
    - [46, 0.06]
  - - [1, 384, 1, 4096]
    - [13, 0.02]
  - - [16, 384, 1, 4096]
    - [13, 0.39]
  - - [32, 192, 1, 4096]
    - [13, 0.39]
  - - [10, 2, 1, 8]
    - [28, 0.0]
  - - [960, 128, 1, 16]
    - [30, 0.47]
  - - [128, 384, 1, 256]
    - [37, 1.43]
  - - [384, 128, 1, 256]
    - [31, 1.55]
  - - [2624, 64, 1, 16]
    - [46, 0.62]
  - - [10, 4, 1, 6]
    - [28, 0.0]
  - - [128, 4096, 1, 16]
    - [39, 1.44]
  - - [32, 768, 1, 512]
    - [13, 1.01]
  - - [768, 32, 1, 512]
    - [15, 1.05]
  - - [12, 4, 1, 10]
    - [41, 0.0]
  - - [8, 4, 1, 8]
    - [45, 0.0]
  - - [16, 3328, 1, 1]
    - [32, 0.01]
  - - [6, 6, 1, 10]
    - [28, 0.0]
  - - [1, 2048, 1, 1]
    - [35, 0.0]
  - - [1, 2816, 1, 1]
    - [52, 0.0]
  - - [1, 2816, 1, 32]
    - [21, 0.02]
  - - [1, 704, 1, 4096]
    - [23, 0.04]
  - - [3904, 1, 1, 4096]
    - [47, 0.19]
  - - [1856, 32, 1, 64]
    - [9, 0.66]
  - - [32, 1856, 1, 256]
    - [40, 1.5]
  - - [1856, 32, 1, 256]
    - [40, 1.52]
  - - [256, 128, 1, 16]
    - [29, 0.13]
  - - [6, 1, 1, 14]
    - [28, 0.0]
  - - [16, 3392, 1, 1]
    - [32, 0.01]
  - - [128, 192, 1, 16]
    - [27, 0.1]
  - - [16, 3136, 1, 1]
    - [32, 0.01]
  - - [640, 192, 1, 16]
    - [30, 0.49]
  - - [1, 8192, 1, 4096]
    - [28, 0.09]
  - - [2880, 16, 1, 1]
    - [60, 0.01]
  - - [384, 16, 1, 64]
    - [61, 0.09]
  - - [1472, 320, 1, 64]
    - [32, 2.93]
  - - [1600, 32, 1, 1]
    - [39, 0.01]
  - - [1536, 32, 1, 1]
    - [39, 0.01]
  - - [192, 128, 1, 1]
    - [62, 0.01]
  - - [1088, 16, 1, 16]
    - [28, 0.07]
  - - [128, 192, 1, 1]
    - [28, 0.01]
  - - [3072, 16, 1, 1]
    - [62, 0.01]
  - - [8192, 1, 1, 128]
    - [45, 0.14]
  - - [192, 16, 1, 2048]
    - [13, 0.18]
  - - [3072, 32, 1, 128]
    - [57, 1.7]
  - - [32, 8192, 1, 32]
    - [52, 1.4]
  - - [128, 128, 1, 1]
    - [35, 0.0]
  - - [16, 128, 1, 4096]
    - [13, 0.13]
  - - [64, 128, 1, 2048]
    - [24, 0.49]
  - - [128, 128, 1, 2048]
    - [22, 0.98]
  - - [1600, 320, 1, 64]
    - [39, 3.2]
  - - [64, 128, 1, 1]
    - [35, 0.0]
  - - [1, 16, 1, 4096]
    - [13, 0.0]
  - - [1024, 16, 1, 16]
    - [29, 0.07]
  - - [16, 128, 1, 256]
    - [23, 0.07]
  - - [128, 32, 1, 2048]
    - [24, 0.25]
  - - [32, 256, 1, 2048]
    - [24, 0.49]
  - - [8192, 256, 1, 16]
    - [30, 2.82]
  - - [64, 192, 1, 1]
    - [29, 0.0]
  - - [1728, 32, 1, 1]
    - [39, 0.01]
  - - [1344, 320, 1, 64]
    - [32, 2.85]
  - - [1472, 32, 1, 1]
    - [39, 0.01]
  - - [128, 8192, 1, 1]
    - [9, 0.15]
  - - [3136, 16, 1, 1]
    - [52, 0.01]
  - - [448, 16, 1, 64]
    - [49, 0.1]
  - - [1, 1, 1, 2048]
    - [24, 0.0]
  - - [320, 128, 1, 64]
    - [58, 0.49]
  - - [64, 2368, 1, 32]
    - [46, 0.9]
  - - [1728, 320, 1, 64]
    - [51, 3.22]
  - - [2624, 16, 1, 1]
    - [57, 0.01]
  - - [1856, 32, 1, 1]
    - [46, 0.02]
  - - [64, 2112, 1, 32]
    - [39, 0.8]
  - - [128, 192, 1, 64]
    - [33, 0.34]
  - - [8192, 64, 1, 32]
    - [46, 2.38]
  - - [512, 64, 1, 1]
    - [52, 0.01]
  - - [960, 16, 1, 16]
    - [29, 0.07]
  - - [16, 512, 1, 16]
    - [33, 0.04]
  - - [256, 32, 1, 64]
    - [22, 0.11]
  - - [192, 64, 1, 1]
    - [45, 0.0]
  - - [64, 192, 1, 2048]
    - [23, 0.74]
  - - [1856, 320, 1, 64]
    - [51, 3.18]
  - - [448, 64, 1, 1]
    - [39, 0.01]
  - - [1984, 32, 1, 1]
    - [46, 0.02]
  - - [896, 320, 1, 32]
    - [9, 1.54]
  - - [32, 256, 1, 1]
    - [35, 0.0]
  - - [64, 2048, 1, 32]
    - [39, 0.91]
  - - [32, 2368, 1, 64]
    - [52, 0.85]
  - - [2048, 32, 1, 1]
    - [46, 0.02]
  - - [1216, 16, 1, 16]
    - [28, 0.08]
  - - [1344, 32, 1, 1]
    - [39, 0.01]
  - - [768, 384, 1, 64]
    - [46, 2.45]
  - - [64, 2624, 1, 32]
    - [46, 1.0]
  - - [1088, 320, 1, 64]
    - [46, 2.64]
  - - [16, 8192, 1, 64]
    - [35, 1.2]
  - - [2112, 32, 1, 1]
    - [39, 0.02]
  - - [1984, 320, 1, 64]
    - [32, 3.4]
  - - [3392, 16, 1, 1]
    - [52, 0.01]
  - - [8192, 1, 1, 16]
    - [45, 0.03]
  - - [16, 1, 1, 3072]
    - [24, 0.0]
  - - [32, 1, 1, 3072]
    - [24, 0.0]
  - - [1216, 320, 1, 64]
    - [46, 2.75]
  - - [1, 768, 1, 16]
    - [37, 0.0]
  - - [10, 16, 1, 6]
    - [28, 0.0]
  - - [128, 256, 1, 64]
    - [33, 0.43]
  - - [64, 8192, 1, 32]
    - [46, 2.39]
  - - [16, 320, 1, 2048]
    - [23, 0.31]
  - - [1024, 448, 1, 64]
    - [39, 3.02]
  - - [64, 1984, 1, 32]
    - [9, 0.86]
  - - [1, 832, 1, 16]
    - [33, 0.0]
  - - [832, 320, 1, 32]
    - [44, 1.41]
  - - [4, 16, 1, 6]
    - [33, 0.0]
  - - [640, 32, 1, 16]
    - [28, 0.09]
  - - [256, 128, 1, 64]
    - [33, 0.44]
  - - [14, 6, 1, 16]
    - [27, 0.0]
  - - [512, 1, 1, 1024]
    - [22, 0.03]
  - - [704, 384, 1, 32]
    - [39, 1.39]
  - - [12, 12, 1, 6]
    - [28, 0.0]
  - - [16, 4096, 1, 64]
    - [35, 0.72]
  - - [704, 384, 1, 64]
    - [39, 2.25]
  - - [32, 320, 1, 16]
    - [29, 0.04]
  - - [64, 128, 1, 32]
    - [28, 0.07]
  - - [320, 16, 1, 64]
    - [34, 0.07]
  - - [128, 128, 1, 64]
    - [23, 0.23]
  - - [1024, 320, 1, 64]
    - [46, 2.69]
  - - [32, 2624, 1, 64]
    - [52, 0.91]
  - - [2112, 320, 1, 64]
    - [32, 3.49]
  - - [896, 128, 1, 64]
    - [46, 1.24]
  - - [4, 10, 1, 4]
    - [35, 0.0]
  - - [16, 8, 1, 6]
    - [41, 0.0]
  - - [8, 16, 1, 4096]
    - [22, 0.01]
  - - [512, 16, 1, 64]
    - [49, 0.11]
  - - [640, 384, 1, 32]
    - [46, 1.33]
  - - [14, 10, 1, 4096]
    - [22, 0.01]
  - - [576, 64, 1, 1]
    - [46, 0.01]
  - - [832, 384, 1, 64]
    - [46, 2.57]
  - - [8192, 512, 1, 1]
    - [30, 0.24]
  - - [16, 448, 1, 16]
    - [27, 0.03]
  - - [896, 16, 1, 16]
    - [8, 0.06]
  - - [128, 128, 1, 32]
    - [24, 0.13]
  - - [3392, 64, 1, 1]
    - [46, 0.05]
  - - [640, 384, 1, 64]
    - [39, 2.27]
  - - [1, 14, 1, 4096]
    - [23, 0.0]
  - - [1, 896, 1, 64]
    - [23, 0.01]
  - - [6, 14, 1, 1]
    - [28, 0.0]
  - - [6, 32, 1, 6]
    - [35, 0.0]
  - - [16, 448, 1, 1]
    - [28, 0.0]
  - - [1344, 1, 1, 16]
    - [54, 0.01]
  - - [448, 1, 1, 1024]
    - [24, 0.02]
  - - [192, 192, 1, 64]
    - [45, 0.45]
  - - [512, 448, 1, 32]
    - [9, 1.24]
  - - [704, 320, 1, 64]
    - [46, 2.07]
  - - [1088, 448, 1, 64]
    - [9, 3.0]
  - - [3136, 64, 1, 1]
    - [46, 0.05]
  - - [960, 128, 1, 64]
    - [9, 1.32]
  - - [2, 12, 1, 4096]
    - [13, 0.0]
  - - [32, 6, 1, 4096]
    - [24, 0.01]
  - - [960, 320, 1, 32]
    - [32, 1.59]
  - - [2368, 32, 1, 1]
    - [9, 0.02]
  - - [2368, 16, 1, 1]
    - [52, 0.01]
  - - [32, 2112, 1, 64]
    - [52, 0.76]
  - - [3072, 64, 1, 1]
    - [46, 0.05]
  - - [192, 64, 1, 2048]
    - [24, 0.74]
  - - [384, 64, 1, 1]
    - [39, 0.01]
  - - [192, 768, 1, 32]
    - [46, 0.87]
  - - [1472, 1, 1, 16]
    - [54, 0.01]
  - - [3392, 1, 1, 512]
    - [42, 0.13]
  - - [64, 2880, 1, 32]
    - [39, 1.06]
  - - [896, 192, 1, 64]
    - [32, 1.72]
  - - [14, 16, 1, 8]
    - [28, 0.0]
  - - [64, 640, 1, 64]
    - [43, 0.49]
  - - [10, 12, 1, 4096]
    - [13, 0.01]
  - - [960, 320, 1, 64]
    - [39, 2.46]
  - - [640, 448, 1, 64]
    - [39, 2.32]
  - - [64, 704, 1, 64]
    - [33, 0.53]
  - - [576, 448, 1, 64]
    - [39, 2.34]
  - - [448, 16, 1, 1]
    - [28, 0.0]
  - - [1, 32, 1, 32]
    - [34, 0.0]
  - - [32, 1, 1, 32]
    - [34, 0.0]
  - - [128, 1024, 1, 32]
    - [53, 0.91]
  - - [16, 448, 1, 2048]
    - [23, 0.43]
  - - [14, 10, 1, 6]
    - [28, 0.0]
  - - [10, 14, 1, 4096]
    - [22, 0.01]
  - - [384, 128, 1, 64]
    - [56, 0.6]
  - - [768, 384, 1, 32]
    - [44, 1.52]
  - - [3648, 832, 1, 16]
    - [39, 3.31]
  - - [32, 320, 1, 1]
    - [29, 0.0]
  - - [1088, 16, 1, 32]
    - [28, 0.13]
  - - [384, 64, 1, 32]
    - [15, 0.19]
  - - [12, 8, 1, 6]
    - [41, 0.0]
  - - [768, 256, 1, 64]
    - [32, 1.97]
  - - [1088, 1344, 1, 32]
    - [39, 3.59]
  - - [704, 32, 1, 16]
    - [29, 0.09]
  - - [1600, 64, 1, 1]
    - [46, 0.03]
  - - [896, 384, 1, 64]
    - [39, 2.51]
  - - [14, 8, 1, 6]
    - [28, 0.0]
  - - [12, 10, 1, 4096]
    - [22, 0.01]
  - - [768, 320, 1, 32]
    - [53, 1.32]
  - - [320, 576, 1, 32]
    - [46, 1.09]
  - - [1024, 128, 1, 64]
    - [9, 1.42]
  - - [1344, 16, 1, 16]
    - [31, 0.09]
  - - [1600, 192, 1, 32]
    - [30, 1.65]
  - - [16, 3904, 1, 64]
    - [35, 0.69]
  - - [1472, 192, 1, 32]
    - [32, 1.52]
  - - [1216, 32, 1, 1]
    - [46, 0.01]
  - - [576, 448, 1, 32]
    - [46, 1.43]
  - - [32, 2048, 1, 64]
    - [52, 0.74]
  - - [960, 448, 1, 64]
    - [30, 2.82]
  - - [576, 32, 1, 16]
    - [31, 0.08]
  - - [768, 32, 1, 32]
    - [31, 0.19]
  - - [16, 384, 1, 2048]
    - [23, 0.37]
  - - [32, 192, 1, 2048]
    - [13, 0.37]
  - - [64, 8192, 1, 64]
    - [39, 3.27]
  - - [256, 64, 1, 2048]
    - [22, 0.98]
  - - [3648, 16, 1, 1]
    - [52, 0.01]
  - - [3648, 64, 1, 1]
    - [46, 0.05]
  - - [3648, 1, 1, 512]
    - [47, 0.14]
  - - [32, 2880, 1, 64]
    - [52, 0.99]
  - - [1728, 64, 1, 1]
    - [46, 0.03]
  - - [64, 384, 1, 1]
    - [46, 0.01]
  - - [896, 512, 1, 64]
    - [39, 3.05]
  - - [448, 512, 1, 32]
    - [9, 1.24]
  - - [12, 12, 1, 4096]
    - [23, 0.01]
  - - [2880, 64, 1, 1]
    - [46, 0.05]
  - - [16, 6, 1, 16]
    - [27, 0.0]
  - - [960, 1600, 1, 32]
    - [39, 3.68]
  - - [2368, 320, 1, 64]
    - [32, 3.6]
  - - [32, 384, 1, 16]
    - [29, 0.05]
  - - [64, 192, 1, 32]
    - [24, 0.1]
  - - [192, 64, 1, 64]
    - [47, 0.17]
  - - [192, 64, 1, 256]
    - [22, 0.44]
  - - [256, 640, 1, 32]
    - [46, 0.98]
  - - [1024, 384, 1, 64]
    - [46, 2.92]
  - - [6, 16, 1, 1]
    - [28, 0.0]
  - - [12, 32, 1, 1]
    - [28, 0.0]
  - - [12, 32, 1, 1024]
    - [24, 0.02]
  - - [384, 512, 1, 32]
    - [46, 1.14]
  - - [64, 1856, 1, 32]
    - [9, 0.82]
  - - [192, 832, 1, 32]
    - [57, 0.95]
  - - [16, 16, 1, 8]
    - [28, 0.0]
  - - [4, 12, 1, 4]
    - [28, 0.0]
  - - [3072, 256, 1, 16]
    - [46, 1.92]
  - - [832, 256, 1, 64]
    - [46, 1.9]
  - - [10, 14, 1, 6]
    - [27, 0.0]
  - - [16, 576, 1, 16]
    - [33, 0.04]
  - - [896, 320, 1, 64]
    - [46, 2.39]
  - - [960, 192, 1, 64]
    - [51, 1.84]
  - - [6, 12, 1, 6]
    - [28, 0.0]
  - - [640, 64, 1, 1]
    - [46, 0.01]
  - - [1, 896, 1, 16]
    - [33, 0.0]
  - - [1216, 448, 1, 64]
    - [32, 3.11]
  - - [1536, 1, 1, 16]
    - [54, 0.01]
  - - [256, 704, 1, 32]
    - [9, 1.05]
  - - [16, 6, 1, 6]
    - [28, 0.0]
  - - [832, 384, 1, 32]
    - [46, 1.66]
  - - [32, 1984, 1, 64]
    - [63, 0.72]
  - - [6, 32, 1, 32]
    - [49, 0.0]
  - - [64, 3136, 1, 32]
    - [46, 1.12]
  - - [1, 960, 1, 64]
    - [23, 0.01]
  - - [1, 704, 1, 16]
    - [33, 0.0]
  - - [704, 32, 1, 32]
    - [29, 0.18]
  - - [960, 384, 1, 64]
    - [39, 2.78]
  - - [14, 32, 1, 1]
    - [29, 0.0]
  - - [32, 14, 1, 1]
    - [27, 0.0]
  - - [64, 448, 1, 1]
    - [39, 0.01]
  - - [14, 6, 1, 1]
    - [35, 0.0]
  - - [14, 32, 1, 1024]
    - [13, 0.02]
  - - [32, 14, 1, 1024]
    - [24, 0.02]
  - - [16, 8, 1, 4096]
    - [22, 0.01]
  - - [448, 64, 1, 32]
    - [33, 0.22]
  - - [1024, 256, 1, 32]
    - [39, 1.41]
  - - [512, 512, 1, 64]
    - [46, 2.33]
  - - [832, 128, 1, 64]
    - [30, 1.15]
  - - [704, 448, 1, 64]
    - [39, 2.58]
  - - [1216, 1216, 1, 32]
    - [39, 3.61]
  - - [12, 10, 1, 6]
    - [29, 0.0]
  - - [16, 14, 1, 8]
    - [45, 0.0]
  - - [1536, 64, 1, 1]
    - [39, 0.03]
  - - [6, 2, 1, 4]
    - [41, 0.0]
  - - [1, 6, 1, 2048]
    - [24, 0.0]
  - - [128, 64, 1, 256]
    - [24, 0.29]
  - - [64, 576, 1, 64]
    - [55, 0.44]
  - - [960, 512, 1, 64]
    - [39, 3.0]
  - - [64, 768, 1, 64]
    - [35, 0.57]
  - - [1024, 320, 1, 32]
    - [30, 1.69]
  - - [832, 16, 1, 16]
    - [29, 0.06]
  - - [8, 10, 1, 6]
    - [28, 0.0]
  - - [12, 14, 1, 6]
    - [28, 0.0]
  - - [576, 384, 1, 32]
    - [30, 1.23]
  - - [8, 14, 1, 4096]
    - [13, 0.01]
  - - [768, 320, 1, 64]
    - [9, 2.17]
  - - [1, 832, 1, 64]
    - [23, 0.01]
  - - [384, 576, 1, 32]
    - [9, 1.23]
  - - [2, 14, 1, 4096]
    - [24, 0.0]
  - - [1216, 16, 1, 32]
    - [22, 0.15]
  - - [576, 16, 1, 64]
    - [8, 0.13]
  - - [640, 448, 1, 32]
    - [30, 1.52]
  - - [832, 320, 1, 64]
    - [39, 2.22]
  - - [320, 32, 1, 1]
    - [35, 0.0]
  - - [1024, 16, 1, 32]
    - [13, 0.13]
  - - [16, 8192, 1, 16]
    - [51, 0.4]
  - - [32, 320, 1, 2048]
    - [24, 0.61]
  - - [832, 192, 1, 64]
    - [32, 1.6]
  - - [2624, 64, 1, 1]
    - [46, 0.04]
  - - [320, 640, 1, 32]
    - [30, 1.15]
  - - [128, 960, 1, 32]
    - [39, 0.85]
  - - [448, 448, 1, 32]
    - [46, 1.12]
  - - [960, 1472, 1, 32]
    - [46, 3.52]
  - - [10, 10, 1, 6]
    - [28, 0.0]
  - - [2, 10, 1, 4096]
    - [22, 0.0]
  - - [896, 384, 1, 32]
    - [46, 1.72]
  - - [16, 10, 1, 4096]
    - [23, 0.01]
  - - [640, 320, 1, 64]
    - [39, 1.83]
  - - [3136, 1, 1, 512]
    - [47, 0.12]
  - - [1, 1472, 1, 2048]
    - [24, 0.08]
  - - [192, 704, 1, 32]
    - [39, 0.8]
  - - [3072, 128, 1, 32]
    - [39, 1.94]
  - - [16, 512, 1, 1]
    - [33, 0.0]
  - - [704, 320, 1, 32]
    - [39, 1.23]
  - - [3072, 960, 1, 16]
    - [39, 3.26]
  - - [576, 512, 1, 64]
    - [46, 2.35]
  - - [320, 64, 1, 1]
    - [28, 0.01]
  - - [64, 320, 1, 2048]
    - [15, 1.16]
  - - [1600, 1, 1, 16]
    - [27, 0.01]
  - - [3392, 832, 1, 16]
    - [39, 3.28]
  - - [1728, 192, 1, 32]
    - [32, 1.65]
  - - [1472, 16, 1, 16]
    - [42, 0.1]
  - - [1024, 512, 1, 64]
    - [39, 3.25]
  - - [896, 448, 1, 64]
    - [39, 2.65]
  - - [64, 3392, 1, 32]
    - [30, 1.17]
  - - [1344, 448, 1, 64]
    - [51, 3.23]
  - - [1216, 1, 1, 16]
    - [54, 0.0]
  - - [3648, 1, 1, 64]
    - [54, 0.04]
  - - [576, 1, 1, 1024]
    - [13, 0.03]
  - - [16, 3648, 1, 64]
    - [37, 0.63]
  - - [3648, 1, 1, 1024]
    - [47, 0.16]
  - - [32, 3136, 1, 64]
    - [64, 1.08]
  - - [704, 64, 1, 1]
    - [46, 0.01]
  - - [576, 384, 1, 64]
    - [46, 2.03]
  - - [768, 448, 1, 64]
    - [46, 2.62]
  - - [832, 1856, 1, 32]
    - [39, 3.68]
  - - [512, 512, 1, 32]
    - [30, 1.4]
  - - [12, 16, 1, 8]
    - [28, 0.0]
  - - [1856, 64, 1, 1]
    - [46, 0.03]
  - - [32, 1856, 1, 64]
    - [63, 0.67]
  - - [1472, 64, 1, 1]
    - [39, 0.03]
  - - [1344, 1, 1, 1]
    - [27, 0.0]
  - - [1, 1344, 1, 2048]
    - [23, 0.07]
  - - [6, 16, 1, 16]
    - [42, 0.0]
  - - [4, 14, 1, 6]
    - [28, 0.0]
  - - [2624, 32, 1, 1]
    - [39, 0.02]
  - - [3904, 16, 1, 1]
    - [52, 0.02]
  - - [3904, 1, 1, 64]
    - [54, 0.05]
  - - [3904, 64, 1, 1]
    - [46, 0.06]
  - - [3904, 1, 1, 512]
    - [47, 0.15]
  - - [3904, 1, 1, 1024]
    - [47, 0.17]
  - - [704, 256, 1, 64]
    - [46, 1.81]
  - - [960, 256, 1, 32]
    - [46, 1.33]
  - - [64, 832, 1, 64]
    - [30, 0.62]
  - - [832, 576, 1, 64]
    - [9, 2.95]
  - - [832, 512, 1, 64]
    - [39, 2.81]
  - - [1024, 128, 1, 1]
    - [46, 0.03]
  - - [1024, 192, 1, 64]
    - [30, 1.95]
  - - [3072, 1, 1, 512]
    - [42, 0.12]
  - - [1472, 1, 1, 1]
    - [54, 0.0]
  - - [1088, 32, 1, 1]
    - [46, 0.01]
  - - [768, 32, 1, 16]
    - [62, 0.1]
  - - [3904, 832, 1, 1]
    - [39, 0.25]
  - - [192, 128, 1, 64]
    - [15, 0.34]
  - - [832, 3648, 1, 16]
    - [39, 3.38]
  - - [2112, 320, 1, 1]
    - [46, 0.11]
  - - [320, 448, 1, 1]
    - [46, 0.04]
  - - [256, 128, 1, 1]
    - [46, 0.01]
  - - [128, 128, 1, 256]
    - [22, 0.59]
  - - [1344, 192, 1, 32]
    - [9, 1.43]
  - - [1344, 1088, 1, 32]
    - [51, 3.61]
  - - [896, 256, 1, 64]
    - [39, 2.04]
  - - [832, 32, 1, 32]
    - [29, 0.21]
  - - [64, 1728, 1, 32]
    - [9, 0.77]
  - - [2368, 320, 1, 1]
    - [46, 0.13]
  - - [8192, 128, 1, 32]
    - [30, 3.15]
  - - [448, 1600, 1, 16]
    - [32, 1.78]
  - - [192, 896, 1, 32]
    - [39, 1.0]
  - - [64, 512, 1, 64]
    - [8, 0.43]
  - - [1, 960, 1, 16]
    - [37, 0.0]
  - - [4096, 832, 1, 1]
    - [30, 0.23]
  - - [64, 320, 1, 1]
    - [28, 0.01]
  - - [1728, 448, 1, 1]
    - [39, 0.13]
  - - [1088, 1216, 1, 32]
    - [39, 3.41]
  - - [2112, 16, 1, 1]
    - [52, 0.01]
  - - [1, 1024, 1, 64]
    - [24, 0.01]
  - - [1088, 320, 1, 32]
    - [59, 1.74]
  - - [704, 448, 1, 32]
    - [39, 1.7]
  - - [448, 576, 1, 64]
    - [46, 2.38]
  - - [1536, 16, 1, 16]
    - [31, 0.1]
  - - [12, 6, 1, 16]
    - [27, 0.0]
  - - [2368, 320, 1, 16]
    - [9, 1.87]
  - - [768, 576, 1, 64]
    - [39, 2.92]
  - - [4096, 576, 1, 16]
    - [30, 2.94]
  - - [2368, 64, 1, 1]
    - [46, 0.04]
  - - [576, 1216, 1, 16]
    - [46, 1.79]
  - - [960, 1344, 1, 32]
    - [39, 3.46]
  - - [16, 4, 1, 12]
    - [28, 0.0]
  - - [512, 448, 1, 64]
    - [46, 2.05]
  - - [448, 1728, 1, 16]
    - [39, 1.92]
  - - [1600, 960, 1, 32]
    - [39, 3.66]
  - - [4, 14, 1, 4]
    - [28, 0.0]
  - - [768, 128, 1, 64]
    - [50, 1.06]
  - - [64, 3648, 1, 32]
    - [30, 1.29]
  - - [14, 12, 1, 6]
    - [28, 0.0]
  - - [832, 448, 1, 64]
    - [46, 2.81]
  - - [832, 448, 1, 32]
    - [46, 1.87]
  - - [64, 256, 1, 1]
    - [8, 0.0]
  - - [1472, 448, 1, 64]
    - [32, 3.36]
  - - [832, 1728, 1, 32]
    - [30, 3.5]
  - - [256, 768, 1, 32]
    - [39, 1.14]
  - - [640, 512, 1, 64]
    - [46, 2.64]
  - - [10, 12, 1, 6]
    - [28, 0.0]
  - - [16, 384, 1, 16]
    - [27, 0.03]
  - - [2, 16, 1, 4096]
    - [13, 0.0]
  - - [192, 16, 1, 64]
    - [38, 0.04]
  - - [768, 16, 1, 16]
    - [29, 0.05]
  - - [192, 32, 1, 64]
    - [13, 0.09]
  - - [960, 16, 1, 32]
    - [22, 0.12]
  - - [64, 64, 1, 256]
    - [24, 0.15]
  - - [128, 64, 1, 1024]
    - [24, 0.44]
  - - [384, 2048, 1, 16]
    - [46, 1.95]
  - - [384, 16, 1, 1]
    - [27, 0.0]
  - - [768, 64, 1, 1]
    - [39, 0.01]
  - - [16, 576, 1, 256]
    - [23, 0.33]
  - - [64, 896, 1, 64]
    - [9, 0.67]
  - - [256, 576, 1, 32]
    - [32, 0.88]
  - - [896, 576, 1, 64]
    - [30, 3.18]
  - - [3072, 896, 1, 16]
    - [39, 3.11]
  - - [10, 32, 1, 1]
    - [28, 0.0]
  - - [12, 16, 1, 6]
    - [28, 0.0]
  - - [320, 512, 1, 32]
    - [39, 0.97]
  - - [32, 6, 1, 12]
    - [42, 0.0]
  - - [32, 14, 1, 4096]
    - [24, 0.03]
  - - [14, 14, 1, 8]
    - [28, 0.0]
  - - [960, 384, 1, 32]
    - [46, 1.84]
  - - [512, 576, 1, 64]
    - [46, 2.4]
  - - [448, 576, 1, 32]
    - [30, 1.39]
  - - [768, 512, 1, 32]
    - [32, 1.96]
  - - [512, 128, 1, 64]
    - [53, 0.75]
  - - [2624, 1088, 1, 16]
    - [39, 3.25]
  - - [6, 1, 1, 4096]
    - [23, 0.0]
  - - [1, 12, 1, 4096]
    - [24, 0.0]
  - - [1, 768, 1, 64]
    - [24, 0.01]
  - - [1, 6, 1, 1]
    - [29, 0.0]
  - - [6, 1, 1, 1]
    - [28, 0.0]
  - - [1, 32, 1, 1]
    - [45, 0.0]
  - - [2, 4, 1, 4]
    - [28, 0.0]
  - - [4, 2, 1, 4]
    - [28, 0.0]
  - - [32, 1, 1, 1]
    - [33, 0.0]
  - - [6, 12, 1, 1]
    - [28, 0.0]
  - - [12, 6, 1, 1]
    - [28, 0.0]
  - - [1, 6, 1, 16]
    - [27, 0.0]
  - - [16, 6, 1, 1]
    - [33, 0.0]
  - - [2, 16, 1, 4]
    - [35, 0.0]
  - - [4, 8, 1, 4]
    - [41, 0.0]
  - - [1, 16, 1, 14]
    - [60, 0.0]
  - - [32, 12, 1, 1]
    - [41, 0.0]
  - - [10, 8, 1, 6]
    - [28, 0.0]
  - - [16, 32, 1, 1]
    - [28, 0.0]
  - - [32, 16, 1, 1]
    - [28, 0.0]
  - - [16, 10, 1, 6]
    - [28, 0.0]
  - - [1536, 1, 1, 1]
    - [45, 0.0]
  - - [6, 32, 1, 10]
    - [28, 0.0]
  - - [1, 64, 1, 32]
    - [34, 0.0]
  - - [1, 128, 1, 16]
    - [27, 0.0]
  - - [32, 64, 1, 1]
    - [28, 0.0]
  - - [64, 1, 1, 32]
    - [34, 0.0]
  - - [64, 32, 1, 1]
    - [29, 0.0]
  - - [128, 16, 1, 1]
    - [41, 0.0]
  - - [6, 32, 1, 16]
    - [27, 0.0]
  - - [1, 16, 1, 256]
    - [23, 0.0]
  - - [1, 32, 1, 128]
    - [22, 0.0]
  - - [16, 384, 1, 1]
    - [28, 0.0]
  - - [32, 192, 1, 1]
    - [28, 0.0]
  - - [1, 128, 1, 64]
    - [22, 0.0]
  - - [2, 2, 1, 2048]
    - [24, 0.0]
  - - [128, 64, 1, 1]
    - [29, 0.0]
  - - [256, 32, 1, 1]
    - [8, 0.0]
  - - [512, 16, 1, 1]
    - [8, 0.0]
  - - [1, 640, 1, 16]
    - [33, 0.0]
  - - [32, 32, 1, 10]
    - [28, 0.0]
  - - [1, 12, 1, 1024]
    - [24, 0.0]
  - - [1, 192, 1, 64]
    - [13, 0.0]
  - - [2, 6, 1, 1024]
    - [24, 0.0]
  - - [6, 2, 1, 1024]
    - [23, 0.0]
  - - [12, 1, 1, 1024]
    - [24, 0.0]
  - - [1, 32, 1, 512]
    - [22, 0.0]
  - - [1, 64, 1, 256]
    - [24, 0.0]
  - - [2, 2, 1, 4096]
    - [13, 0.0]
  - - [32, 1, 1, 512]
    - [13, 0.0]
  - - [128, 1, 1, 128]
    - [24, 0.0]
  - - [1, 256, 1, 128]
    - [13, 0.01]
  - - [16, 32, 1, 64]
    - [23, 0.01]
  - - [16, 128, 1, 16]
    - [27, 0.01]
  - - [32, 16, 1, 64]
    - [13, 0.01]
  - - [32, 64, 1, 16]
    - [27, 0.01]
  - - [64, 32, 1, 16]
    - [27, 0.01]
  - - [64, 512, 1, 1]
    - [39, 0.01]
  - - [128, 1, 1, 256]
    - [24, 0.0]
  - - [128, 16, 1, 16]
    - [27, 0.01]
  - - [128, 256, 1, 1]
    - [39, 0.01]
  - - [1024, 32, 1, 1]
    - [39, 0.01]
  - - [2048, 16, 1, 1]
    - [52, 0.01]
  - - [192, 192, 1, 1]
    - [39, 0.01]
  - - [1, 16, 1, 3072]
    - [13, 0.0]
  - - [1, 64, 1, 1024]
    - [24, 0.0]
  - - [1, 4096, 1, 16]
    - [44, 0.01]
  - - [16, 16, 1, 256]
    - [13, 0.01]
  - - [16, 32, 1, 128]
    - [24, 0.01]
  - - [32, 1, 1, 2048]
    - [23, 0.0]
  - - [32, 16, 1, 128]
    - [22, 0.01]
  - - [4096, 16, 1, 1]
    - [52, 0.02]
  - - [1, 256, 1, 512]
    - [23, 0.01]
  - - [1, 1024, 1, 128]
    - [24, 0.02]
  - - [16, 1, 1, 8192]
    - [13, 0.0]
  - - [256, 512, 1, 1]
    - [32, 0.03]
  - - [16, 640, 1, 16]
    - [33, 0.04]
  - - [64, 192, 1, 16]
    - [29, 0.05]
  - - [1536, 1, 1, 128]
    - [38, 0.03]
  - - [1, 32, 1, 8192]
    - [13, 0.0]
  - - [1, 2048, 1, 128]
    - [37, 0.04]
  - - [16, 32, 1, 512]
    - [24, 0.02]
  - - [32, 16, 1, 512]
    - [22, 0.02]
  - - [64, 1, 1, 4096]
    - [13, 0.0]
  - - [256, 64, 1, 16]
    - [29, 0.07]
  - - [512, 32, 1, 16]
    - [29, 0.07]
  - - [4096, 1, 1, 64]
    - [54, 0.05]
  - - [4096, 64, 1, 1]
    - [46, 0.06]
  - - [8192, 32, 1, 1]
    - [46, 0.06]
  - - [10, 32, 1, 1024]
    - [13, 0.02]
  - - [16, 640, 1, 32]
    - [23, 0.08]
  - - [32, 320, 1, 32]
    - [24, 0.08]
  - - [6, 16, 1, 4096]
    - [13, 0.01]
  - - [32, 12, 1, 1024]
    - [24, 0.02]
  - - [384, 1, 1, 1024]
    - [24, 0.02]
  - - [1600, 16, 1, 16]
    - [29, 0.1]
  - - [14, 8, 1, 4096]
    - [13, 0.01]
  - - [1, 128, 1, 4096]
    - [13, 0.01]
  - - [16, 32, 1, 1024]
    - [24, 0.03]
  - - [32, 16, 1, 1024]
    - [13, 0.03]
  - - [64, 8192, 1, 1]
    - [46, 0.1]
  - - [10, 16, 1, 4096]
    - [23, 0.01]
  - - [16, 2560, 1, 16]
    - [42, 0.16]
  - - [320, 32, 1, 64]
    - [8, 0.14]
  - - [320, 64, 1, 32]
    - [22, 0.16]
  - - [640, 16, 1, 64]
    - [13, 0.14]
  - - [640, 32, 1, 32]
    - [29, 0.16]
  - - [16, 192, 1, 256]
    - [23, 0.11]
  - - [1, 128, 1, 8192]
    - [22, 0.01]
  - - [16, 32, 1, 2048]
    - [23, 0.03]
  - - [32, 16, 1, 2048]
    - [13, 0.03]
  - - [128, 1, 1, 8192]
    - [24, 0.01]
  - - [128, 32, 1, 256]
    - [24, 0.14]
  - - [512, 64, 1, 32]
    - [22, 0.25]
  - - [16, 32, 1, 3072]
    - [24, 0.03]
  - - [32, 16, 1, 3072]
    - [13, 0.03]
  - - [384, 32, 1, 128]
    - [22, 0.27]
  - - [768, 16, 1, 128]
    - [22, 0.27]
  - - [1, 256, 1, 8192]
    - [24, 0.02]
  - - [32, 16, 1, 4096]
    - [22, 0.03]
  - - [4096, 1, 1, 512]
    - [47, 0.15]
  - - [8192, 1, 1, 256]
    - [26, 0.18]
  - - [8192, 256, 1, 1]
    - [30, 0.2]
  - - [16, 640, 1, 256]
    - [24, 0.36]
  - - [16, 64, 1, 3072]
    - [24, 0.06]
  - - [32, 32, 1, 3072]
    - [22, 0.06]
  - - [64, 192, 1, 256]
    - [24, 0.43]
  - - [32, 1728, 1, 64]
    - [63, 0.63]
  - - [128, 896, 1, 32]
    - [9, 0.8]
  - - [16, 32, 1, 8192]
    - [23, 0.03]
  - - [16, 8192, 1, 32]
    - [37, 0.7]
  - - [32, 16, 1, 8192]
    - [13, 0.03]
  - - [32, 4096, 1, 32]
    - [63, 0.81]
  - - [32, 8192, 1, 16]
    - [32, 0.81]
  - - [64, 128, 1, 512]
    - [22, 0.37]
  - - [64, 4096, 1, 16]
    - [46, 0.86]
  - - [128, 64, 1, 512]
    - [22, 0.37]
  - - [4096, 1, 1, 1024]
    - [47, 0.18]
  - - [512, 384, 1, 32]
    - [39, 1.14]
  - - [1536, 32, 1, 128]
    - [55, 1.01]
  - - [3072, 16, 1, 128]
    - [31, 1.02]
  - - [32, 3392, 1, 64]
    - [44, 1.17]
  - - [896, 256, 1, 32]
    - [46, 1.28]
  - - [1856, 64, 1, 64]
    - [9, 1.3]
  - - [16, 256, 1, 2048]
    - [23, 0.24]
  - - [32, 128, 1, 2048]
    - [13, 0.25]
  - - [64, 64, 1, 2048]
    - [23, 0.25]
  - - [256, 16, 1, 2048]
    - [22, 0.25]
  - - [256, 32, 1, 1024]
    - [23, 0.44]
  - - [8192, 32, 1, 32]
    - [30, 1.4]
  - - [1536, 8192, 1, 1]
    - [32, 0.31]
  - - [16, 512, 1, 2048]
    - [23, 0.49]
  - - [8192, 16, 1, 128]
    - [57, 2.01]
  - - [8192, 128, 1, 16]
    - [30, 2.17]
  - - [8192, 2048, 1, 1]
    - [46, 0.33]
  - - [256, 8192, 1, 16]
    - [30, 2.81]
  - - [8192, 64, 1, 64]
    - [39, 3.2]
  - - [64, 640, 1, 1024]
    - [56, 1.81]
  - - [6, 2, 1, 14]
    - [35, 0.0]
  - - [12, 8, 1, 16]
    - [27, 0.0]
  - - [448, 1472, 1, 16]
    - [39, 1.7]
  - - [1856, 192, 1, 32]
    - [39, 1.77]
  - - [768, 192, 1, 64]
    - [44, 1.46]
  - - [8, 12, 1, 6]
    - [28, 0.0]
  - - [576, 512, 1, 32]
    - [39, 1.59]
  - - [10, 14, 1, 32]
    - [34, 0.0]
  - - [10, 8, 1, 16]
    - [27, 0.0]
  - - [1984, 192, 1, 64]
    - [39, 2.83]
  - - [1856, 448, 1, 1]
    - [46, 0.13]
  - - [8, 2, 1, 14]
    - [28, 0.0]
  - - [576, 896, 1, 32]
    - [46, 2.32]
  - - [704, 640, 1, 64]
    - [39, 2.97]
  - - [10, 1, 1, 10]
    - [35, 0.0]
  - - [2, 4, 1, 14]
    - [28, 0.0]
  - - [448, 128, 1, 64]
    - [64, 0.66]
  - - [768, 448, 1, 32]
    - [52, 1.7]
  - - [8, 16, 1, 12]
    - [28, 0.0]
  - - [704, 640, 1, 32]
    - [39, 2.2]
  - - [6, 1, 1, 10]
    - [26, 0.0]
  - - [12, 1, 1, 10]
    - [41, 0.0]
  - - [1984, 64, 1, 1]
    - [46, 0.03]
  - - [64, 3904, 1, 16]
    - [39, 0.87]
  - - [1088, 192, 1, 64]
    - [39, 1.93]
  - - [640, 768, 1, 32]
    - [39, 2.27]
  - - [768, 640, 1, 64]
    - [39, 3.08]
  - - [64, 3904, 1, 32]
    - [63, 1.35]
  - - [2112, 1344, 1, 16]
    - [39, 3.31]
  - - [256, 576, 1, 1]
    - [39, 0.04]
  - - [704, 1024, 1, 16]
    - [9, 1.79]
  - - [1, 3904, 1, 16]
    - [59, 0.01]
  - - [1984, 64, 1, 64]
    - [30, 1.36]
  - - [16, 2624, 1, 16]
    - [37, 0.16]
  - - [256, 640, 1, 1]
    - [46, 0.04]
  - - [64, 320, 1, 64]
    - [37, 0.28]
  - - [320, 64, 1, 2048]
    - [43, 1.16]
  - - [1216, 1088, 1, 32]
    - [46, 3.41]
  - - [10, 10, 1, 4096]
    - [22, 0.01]
  - - [640, 320, 1, 32]
    - [30, 1.11]
  - - [960, 128, 1, 1]
    - [46, 0.03]
  - - [1728, 1, 1, 16]
    - [27, 0.01]
  - - [3392, 1, 1, 64]
    - [27, 0.04]
  - - [16, 3392, 1, 64]
    - [21, 0.61]
  - - [3392, 1, 1, 1024]
    - [47, 0.15]
  - - [12, 14, 1, 4096]
    - [13, 0.01]
  - - [14, 12, 1, 4096]
    - [13, 0.01]
  - - [8, 16, 1, 6]
    - [35, 0.0]
  - - [64, 704, 1, 1024]
    - [33, 1.9]
  - - [1, 1600, 1, 2048]
    - [23, 0.08]
  - - [3136, 832, 1, 16]
    - [39, 3.21]
  - - [1984, 320, 1, 1]
    - [39, 0.11]
  - - [1984, 1472, 1, 16]
    - [39, 3.33]
  - - [64, 384, 1, 64]
    - [33, 0.31]
  - - [640, 704, 1, 32]
    - [30, 2.14]
  - - [6, 8, 1, 4]
    - [28, 0.0]
  - - [16, 6, 1, 14]
    - [28, 0.0]
  - - [256, 192, 1, 64]
    - [8, 0.59]
  - - [384, 448, 1, 32]
    - [9, 1.03]
  - - [1, 1, 1, 16]
    - [33, 0.0]
  - - [2, 2, 1, 8]
    - [28, 0.0]
  - - [2, 2, 1, 16]
    - [33, 0.0]
  - - [32, 1, 1, 12]
    - [28, 0.0]
  - - [6, 14, 1, 6]
    - [28, 0.0]
  - - [1, 1, 1, 4096]
    - [22, 0.0]
  - - [1, 32, 1, 4096]
    - [23, 0.0]
  - - [1, 64, 1, 3072]
    - [23, 0.0]
  - - [1856, 16, 1, 64]
    - [13, 0.36]
  - - [640, 64, 1, 64]
    - [56, 0.5]
  - - [384, 640, 1, 32]
    - [30, 1.36]
  - - [2880, 1, 1, 512]
    - [42, 0.11]
  - - [3904, 576, 1, 16]
    - [39, 3.02]
  - - [320, 704, 1, 32]
    - [46, 1.21]
  - - [14, 6, 1, 6]
    - [28, 0.0]
  - - [128, 320, 1, 64]
    - [55, 0.5]
  - - [64, 960, 1, 64]
    - [39, 0.71]
  - - [960, 576, 1, 64]
    - [9, 3.11]
  - - [1600, 448, 1, 64]
    - [32, 3.57]
  - - [64, 448, 1, 64]
    - [22, 0.35]
  - - [1344, 16, 1, 32]
    - [31, 0.17]
  - - [704, 576, 1, 32]
    - [39, 1.97]
  - - [3648, 832, 1, 1]
    - [39, 0.25]
  - - [960, 256, 1, 64]
    - [39, 2.16]
  - - [1856, 832, 1, 32]
    - [32, 3.66]
  - - [448, 1856, 1, 16]
    - [46, 2.01]
  - - [768, 512, 1, 64]
    - [39, 2.76]
  - - [2112, 64, 1, 1]
    - [46, 0.03]
  - - [576, 960, 1, 32]
    - [46, 2.37]
  - - [192, 640, 1, 32]
    - [9, 0.84]
  - - [2624, 320, 1, 16]
    - [46, 2.03]
  - - [832, 1600, 1, 32]
    - [46, 3.44]
  - - [32, 1088, 1, 1]
    - [52, 0.01]
  - - [1, 6, 1, 14]
    - [41, 0.0]
  - - [832, 64, 1, 1]
    - [39, 0.01]
  - - [1, 1088, 1, 64]
    - [33, 0.01]
  - - [704, 512, 1, 64]
    - [39, 2.72]
  - - [1, 4096, 1, 64]
    - [23, 0.04]
  - - [4096, 64, 1, 32]
    - [39, 1.4]
  - - [32, 3904, 1, 32]
    - [59, 0.8]
  - - [1, 1024, 1, 16]
    - [33, 0.0]
  - - [1984, 16, 1, 1]
    - [57, 0.01]
  - - [1472, 960, 1, 32]
    - [51, 3.52]
  - - [3904, 3648, 1, 1]
    - [46, 0.33]
  - - [448, 640, 1, 64]
    - [46, 2.29]
  - - [832, 3392, 1, 16]
    - [39, 3.3]
  - - [1, 3840, 1, 16]
    - [44, 0.01]
  - - [960, 1216, 1, 32]
    - [39, 3.35]
  - - [32, 1216, 1, 16]
    - [32, 0.15]
  - - [192, 960, 1, 32]
    - [9, 1.08]
  - - [1856, 1600, 1, 16]
    - [39, 3.36]
  - - [384, 384, 1, 1]
    - [46, 0.04]
  - - [1344, 64, 1, 1]
    - [39, 0.02]
  - - [192, 128, 1, 32]
    - [31, 0.19]
  - - [576, 128, 1, 64]
    - [56, 0.83]
  - - [576, 320, 1, 64]
    - [39, 1.89]
  - - [1536, 512, 1, 1]
    - [39, 0.13]
  - - [32, 448, 1, 16]
    - [29, 0.06]
  - - [896, 32, 1, 32]
    - [29, 0.22]
  - - [896, 448, 1, 32]
    - [9, 1.93]
  - - [768, 576, 1, 32]
    - [46, 2.13]
  - - [64, 4096, 1, 32]
    - [9, 1.41]
  - - [1856, 192, 1, 64]
    - [46, 2.6]
  - - [3136, 4096, 1, 1]
    - [46, 0.32]
  - - [2112, 320, 1, 16]
    - [30, 1.69]
  - - [448, 512, 1, 64]
    - [39, 2.04]
  - - [3392, 3904, 1, 1]
    - [46, 0.33]
  - - [640, 192, 1, 64]
    - [30, 1.32]
  - - [832, 32, 1, 16]
    - [29, 0.11]
  - - [64, 1600, 1, 32]
    - [30, 0.71]
  - - [32, 1024, 1, 1]
    - [52, 0.01]
  - - [1984, 448, 1, 1]
    - [46, 0.14]
  - - [32, 1, 1, 10]
    - [29, 0.0]
  - - [4, 8, 1, 16]
    - [27, 0.0]
  - - [16, 4, 1, 16]
    - [42, 0.0]
  - - [256, 64, 1, 1]
    - [52, 0.0]
  - - [16, 64, 1, 32]
    - [34, 0.01]
  - - [2, 8, 1, 4096]
    - [13, 0.0]
  - - [32, 64, 1, 32]
    - [34, 0.02]
  - - [64, 1, 1, 1024]
    - [24, 0.0]
  - - [1, 64, 1, 2048]
    - [24, 0.0]
  - - [16, 128, 1, 64]
    - [37, 0.03]
  - - [32, 256, 1, 16]
    - [28, 0.03]
  - - [64, 1, 1, 2048]
    - [24, 0.0]
  - - [64, 64, 1, 32]
    - [49, 0.03]
  - - [256, 16, 1, 64]
    - [49, 0.06]
  - - [32, 64, 1, 256]
    - [22, 0.07]
  - - [128, 64, 1, 64]
    - [13, 0.11]
  - - [32, 1280, 1, 16]
    - [32, 0.17]
  - - [128, 16, 1, 1024]
    - [13, 0.11]
  - - [16, 64, 1, 4096]
    - [23, 0.07]
  - - [64, 64, 1, 1024]
    - [24, 0.22]
  - - [128, 16, 1, 2048]
    - [22, 0.12]
  - - [16, 64, 1, 8192]
    - [23, 0.07]
  - - [32, 64, 1, 4096]
    - [22, 0.13]
  - - [128, 64, 1, 2048]
    - [24, 0.49]
  - - [1024, 256, 1, 64]
    - [46, 2.3]
  - - [64, 256, 1, 2048]
    - [24, 0.98]
  - - [256, 4096, 1, 1]
    - [9, 0.15]
  - - [2880, 32, 1, 1]
    - [46, 0.02]
  - - [640, 256, 1, 64]
    - [59, 1.64]
  - - [256, 8192, 1, 1]
    - [51, 0.2]
  - - [1600, 1, 1, 1]
    - [28, 0.0]
  - - [3072, 832, 1, 16]
    - [30, 3.05]
  - - [8, 12, 1, 16]
    - [27, 0.0]
  - - [448, 1344, 1, 16]
    - [51, 1.55]
  - - [32, 3840, 1, 32]
    - [44, 0.76]
  - - [960, 32, 1, 1]
    - [52, 0.01]
  - - [576, 832, 1, 32]
    - [46, 2.21]
  - - [1984, 16, 1, 64]
    - [8, 0.4]
  - - [32, 384, 1, 1]
    - [35, 0.0]
  - - [1600, 448, 1, 1]
    - [39, 0.12]
  - - [6, 14, 1, 16]
    - [27, 0.0]
  - - [1728, 64, 1, 64]
    - [9, 1.21]
  - - [32, 3648, 1, 64]
    - [51, 1.25]
  - - [832, 512, 1, 32]
    - [39, 2.08]
  - - [832, 256, 1, 32]
    - [39, 1.18]
  - - [32, 1344, 1, 16]
    - [44, 0.17]
  - - [384, 704, 1, 64]
    - [46, 2.26]
  - - [3072, 4096, 1, 1]
    - [46, 0.32]
  - - [640, 512, 1, 32]
    - [30, 1.7]
  - - [576, 576, 1, 64]
    - [46, 2.4]
  - - [1728, 16, 1, 16]
    - [29, 0.11]
  - - [32, 1600, 1, 64]
    - [63, 0.58]
  - - [768, 960, 1, 16]
    - [9, 1.81]
  - - [1216, 192, 1, 32]
    - [30, 1.25]
  - - [10, 12, 1, 32]
    - [34, 0.0]
  - - [12, 10, 1, 32]
    - [34, 0.0]
  - - [576, 4096, 1, 16]
    - [30, 2.94]
  - - [64, 2368, 1, 16]
    - [39, 0.53]
  - - [64, 1600, 1, 64]
    - [9, 1.11]
  - - [1216, 1, 1, 1]
    - [54, 0.0]
  - - [640, 1, 1, 1024]
    - [13, 0.03]
  - - [1, 1216, 1, 2048]
    - [23, 0.06]
  - - [640, 704, 1, 64]
    - [39, 2.97]
  - - [4, 16, 1, 4]
    - [27, 0.0]
  - - [1728, 1728, 1, 16]
    - [39, 3.37]
  - - [1, 4096, 1, 3072]
    - [35, 0.16]
  - - [512, 1024, 1, 32]
    - [39, 2.34]
  - - [704, 576, 1, 64]
    - [39, 2.68]
  - - [640, 832, 1, 32]
    - [46, 2.27]
  - - [832, 640, 1, 64]
    - [46, 3.05]
  - - [64, 1024, 1, 64]
    - [39, 0.74]
  - - [1024, 576, 1, 64]
    - [46, 3.36]
  - - [1984, 192, 1, 32]
    - [46, 1.88]
  - - [6, 4, 1, 14]
    - [26, 0.0]
  - - [16, 64, 1, 16]
    - [27, 0.0]
  - - [64, 16, 1, 16]
    - [27, 0.0]
  - - [896, 16, 1, 32]
    - [29, 0.11]
  - - [576, 1344, 1, 16]
    - [9, 1.89]
  - - [1728, 448, 1, 64]
    - [51, 3.66]
  - - [16, 576, 1, 1]
    - [33, 0.0]
  - - [1088, 1, 1, 16]
    - [47, 0.0]
  - - [4096, 3392, 1, 1]
    - [9, 0.3]
  - - [320, 512, 1, 1]
    - [39, 0.04]
  - - [768, 8192, 1, 1]
    - [32, 0.29]
  - - [2624, 320, 1, 1]
    - [46, 0.13]
  - - [320, 2624, 1, 16]
    - [46, 2.01]
  - - [128, 8192, 1, 32]
    - [30, 3.18]
  - - [512, 576, 1, 32]
    - [59, 1.52]
  - - [512, 384, 1, 64]
    - [30, 1.97]
  - - [4096, 3648, 1, 1]
    - [46, 0.3]
  - - [1024, 384, 1, 32]
    - [39, 1.95]
  - - [8, 14, 1, 12]
    - [28, 0.0]
  - - [3648, 3904, 1, 1]
    - [46, 0.33]
  - - [704, 128, 1, 64]
    - [52, 0.97]
  - - [704, 704, 1, 32]
    - [46, 2.25]
  - - [704, 704, 1, 64]
    - [46, 3.09]
  - - [256, 704, 1, 1]
    - [46, 0.04]
  - - [16, 704, 1, 32]
    - [24, 0.09]
  - - [16, 2816, 1, 16]
    - [37, 0.18]
  - - [704, 16, 1, 64]
    - [22, 0.16]
  - - [16, 704, 1, 256]
    - [23, 0.4]
  - - [384, 640, 1, 64]
    - [46, 2.26]
  - - [3648, 3648, 1, 1]
    - [46, 0.33]
  - - [320, 3648, 1, 1]
    - [39, 0.17]
  - - [6, 32, 1, 12]
    - [28, 0.0]
  - - [576, 192, 1, 64]
    - [9, 1.2]
  - - [6, 6, 1, 4]
    - [27, 0.0]
  - - [896, 64, 1, 1]
    - [39, 0.02]
  - - [3392, 4096, 1, 1]
    - [46, 0.33]
  - - [704, 1088, 1, 16]
    - [39, 1.9]
  - - [32, 12, 1, 4096]
    - [22, 0.02]
  - - [10, 16, 1, 32]
    - [34, 0.0]
  - - [448, 1984, 1, 16]
    - [46, 2.07]
  - - [16, 12, 1, 8]
    - [45, 0.0]
  - - [640, 640, 1, 32]
    - [39, 1.96]
  - - [8, 12, 1, 4096]
    - [22, 0.01]
  - - [576, 1088, 1, 16]
    - [9, 1.63]
  - - [256, 832, 1, 32]
    - [44, 1.14]
  - - [6, 16, 1, 6]
    - [42, 0.0]
  - - [576, 64, 1, 64]
    - [47, 0.46]
  - - [64, 576, 1, 1024]
    - [56, 1.63]
  - - [640, 1024, 1, 16]
    - [9, 1.69]
  - - [14, 14, 1, 6]
    - [41, 0.0]
  - - [6, 16, 1, 12]
    - [34, 0.0]
  - - [832, 1472, 1, 32]
    - [39, 3.41]
  - - [1728, 192, 1, 64]
    - [46, 2.38]
  - - [4, 6, 1, 14]
    - [42, 0.0]
  - - [192, 704, 1, 1]
    - [46, 0.03]
  - - [704, 16, 1, 16]
    - [29, 0.05]
  - - [1216, 320, 1, 32]
    - [44, 1.95]
  - - [6, 10, 1, 6]
    - [41, 0.0]
  - - [32, 3648, 1, 32]
    - [59, 0.79]
  - - [2880, 320, 1, 16]
    - [46, 2.06]
  - - [448, 320, 1, 1]
    - [46, 0.04]
  - - [1728, 832, 1, 32]
    - [30, 3.49]
  - - [128, 832, 1, 32]
    - [9, 0.74]
  - - [64, 3648, 1, 16]
    - [9, 0.8]
  - - [704, 1984, 1, 32]
    - [39, 3.5]
  - - [64, 576, 1, 1]
    - [46, 0.01]
  - - [16, 2880, 1, 16]
    - [33, 0.18]
  - - [704, 512, 1, 32]
    - [51, 1.8]
  - - [1600, 1856, 1, 16]
    - [39, 3.37]
  - - [1088, 1088, 1, 32]
    - [46, 3.31]
  - - [1984, 1344, 1, 16]
    - [39, 3.25]
  - - [8, 6, 1, 12]
    - [28, 0.0]
  - - [1344, 576, 1, 1]
    - [46, 0.13]
  - - [16, 2368, 1, 16]
    - [27, 0.15]
  - - [64, 2624, 1, 16]
    - [46, 0.58]
  - - [1, 3904, 1, 64]
    - [33, 0.04]
  - - [3904, 64, 1, 32]
    - [46, 1.37]
  - - [2112, 64, 1, 64]
    - [46, 1.4]
  - - [12, 14, 1, 8]
    - [41, 0.0]
  - - [576, 768, 1, 32]
    - [46, 2.16]
  - - [704, 960, 1, 16]
    - [39, 1.75]
  - - [4, 2, 1, 12]
    - [45, 0.0]
  - - [32, 960, 1, 1]
    - [52, 0.01]
  - - [704, 192, 1, 64]
    - [46, 1.39]
  - - [640, 128, 1, 64]
    - [30, 0.92]
  - - [64, 1088, 1, 64]
    - [57, 0.79]
  - - [1088, 576, 1, 64]
    - [9, 3.25]
  - - [128, 832, 1, 16]
    - [30, 0.41]
  - - [2112, 16, 1, 64]
    - [54, 0.41]
  - - [3072, 1024, 1, 1]
    - [39, 0.23]
  - - [384, 4096, 1, 1]
    - [51, 0.19]
  - - [1, 3648, 1, 16]
    - [33, 0.01]
  - - [2624, 576, 1, 32]
    - [51, 3.63]
  - - [14, 32, 1, 2048]
    - [13, 0.03]
  - - [32, 14, 1, 2048]
    - [22, 0.03]
  - - [32, 3584, 1, 32]
    - [59, 0.72]
  - - [448, 32, 1, 2048]
    - [24, 0.86]
  - - [14, 2, 1, 12]
    - [28, 0.0]
  - - [14, 4, 1, 16]
    - [29, 0.0]
  - - [896, 32, 1, 1]
    - [46, 0.01]
  - - [448, 384, 1, 32]
    - [39, 1.01]
  - - [512, 960, 1, 32]
    - [39, 2.26]
  - - [1856, 320, 1, 1]
    - [39, 0.1]
  - - [3136, 3904, 1, 1]
    - [46, 0.33]
  - - [1344, 960, 1, 32]
    - [32, 3.45]
  - - [256, 448, 1, 1]
    - [39, 0.03]
  - - [896, 128, 1, 1]
    - [46, 0.03]
  - - [2880, 4096, 1, 1]
    - [32, 0.31]
  - - [448, 1216, 1, 16]
    - [44, 1.45]
  - - [10, 10, 1, 16]
    - [27, 0.0]
  - - [3136, 1088, 1, 1]
    - [39, 0.26]
  - - [64, 1728, 1, 64]
    - [30, 1.19]
  - - [704, 192, 1, 1]
    - [46, 0.03]
  - - [1, 384, 1, 1]
    - [8, 0.0]
  - - [1, 704, 1, 64]
    - [23, 0.01]
  - - [704, 16, 1, 256]
    - [13, 0.4]
  - - [16, 704, 1, 512]
    - [24, 0.51]
  - - [832, 896, 1, 16]
    - [46, 1.86]
  - - [10, 16, 1, 8]
    - [28, 0.0]
  - - [1856, 1472, 1, 16]
    - [39, 3.29]
  - - [576, 1024, 1, 32]
    - [46, 2.5]
  - - [768, 1024, 1, 16]
    - [46, 1.93]
  - - [3648, 576, 1, 16]
    - [39, 2.96]
  - - [1, 704, 1, 3072]
    - [24, 0.04]
  - - [32, 3904, 1, 64]
    - [44, 1.32]
  - - [1728, 16, 1, 64]
    - [22, 0.36]
  - - [640, 896, 1, 32]
    - [39, 2.5]
  - - [896, 640, 1, 64]
    - [39, 3.26]
  - - [1856, 1, 1, 16]
    - [42, 0.01]
  - - [320, 3392, 1, 1]
    - [46, 0.16]
  - - [3904, 3392, 1, 1]
    - [46, 0.33]
  - - [4096, 576, 1, 1]
    - [30, 0.21]
  - - [10, 10, 1, 1]
    - [29, 0.0]
  - - [320, 3904, 1, 1]
    - [46, 0.17]
  - - [320, 2368, 1, 16]
    - [39, 1.88]
  - - [1, 14, 1, 14]
    - [34, 0.0]
  - - [1, 1088, 1, 16]
    - [33, 0.0]
  - - [3072, 768, 1, 16]
    - [30, 2.94]
  - - [10, 6, 1, 12]
    - [28, 0.0]
  - - [64, 1472, 1, 64]
    - [52, 1.03]
  - - [1536, 256, 1, 32]
    - [39, 1.96]
  - - [512, 640, 1, 64]
    - [46, 2.64]
  - - [1856, 16, 1, 16]
    - [29, 0.12]
  - - [1600, 64, 1, 64]
    - [46, 1.11]
  - - [3392, 832, 1, 1]
    - [39, 0.24]
  - - [8, 10, 1, 16]
    - [27, 0.0]
  - - [640, 640, 1, 64]
    - [39, 2.72]
  - - [2368, 1088, 1, 16]
    - [39, 3.2]
  - - [448, 640, 1, 32]
    - [32, 1.46]
  - - [128, 768, 1, 16]
    - [9, 0.38]
  - - [4, 12, 1, 6]
    - [42, 0.0]
  - - [960, 64, 1, 1]
    - [39, 0.02]
  - - [1, 3584, 1, 3072]
    - [21, 0.14]
  - - [768, 640, 1, 32]
    - [46, 2.2]
  - - [640, 768, 1, 64]
    - [51, 3.05]
  - - [16, 704, 1, 16]
    - [33, 0.05]
  - - [14, 8, 1, 16]
    - [27, 0.0]
  - - [640, 576, 1, 64]
    - [39, 2.69]
  - - [2, 10, 1, 6]
    - [41, 0.0]
  - - [1, 640, 1, 3072]
    - [24, 0.04]
  - - [576, 3904, 1, 16]
    - [39, 3.05]
  - - [2, 14, 1, 2]
    - [41, 0.0]
  - - [14, 1, 1, 16]
    - [27, 0.0]
  - - [12, 12, 1, 8]
    - [26, 0.0]
  - - [1, 14, 1, 1024]
    - [13, 0.0]
  - - [14, 1, 1, 1024]
    - [24, 0.0]
  - - [12, 8, 1, 4096]
    - [13, 0.01]
  - - [768, 256, 1, 32]
    - [39, 1.13]
  - - [768, 896, 1, 16]
    - [46, 1.74]
  - - [14, 16, 1, 10]
    - [28, 0.0]
  - - [3136, 1, 1, 64]
    - [27, 0.04]
  - - [16, 3136, 1, 64]
    - [37, 0.56]
  - - [3136, 1, 1, 1024]
    - [47, 0.14]
  - - [1, 1728, 1, 2048]
    - [23, 0.09]
  - - [1856, 16, 1, 1]
    - [52, 0.01]
  - - [192, 1024, 1, 32]
    - [30, 1.14]
  - - [3904, 3904, 1, 1]
    - [46, 0.33]
  - - [576, 320, 1, 32]
    - [39, 1.07]
  - - [1984, 320, 1, 16]
    - [30, 1.65]
  - - [4, 4, 1, 14]
    - [28, 0.0]
  - - [32, 1472, 1, 64]
    - [29, 0.55]
  - - [6, 2, 1, 12]
    - [28, 0.0]
  - - [1, 16, 1, 16]
    - [33, 0.0]
  - - [6, 16, 1, 10]
    - [41, 0.0]
  - - [12, 12, 1, 32]
    - [34, 0.0]
  - - [16, 16, 1, 32]
    - [49, 0.0]
  - - [384, 32, 1, 1]
    - [29, 0.0]
  - - [3072, 32, 1, 1]
    - [46, 0.03]
  - - [3072, 128, 1, 1]
    - [46, 0.08]
  - - [3072, 256, 1, 1]
    - [39, 0.13]
  - - [3072, 32, 1, 16]
    - [9, 0.37]
  - - [16, 512, 1, 256]
    - [24, 0.29]
  - - [256, 512, 1, 32]
    - [9, 0.91]
  - - [192, 32, 1, 2048]
    - [24, 0.37]
  - - [32, 384, 1, 2048]
    - [23, 0.73]
  - - [1, 3328, 1, 3072]
    - [21, 0.13]
  - - [1, 3584, 1, 16]
    - [54, 0.01]
  - - [32, 1088, 1, 16]
    - [44, 0.14]
  - - [10, 12, 1, 12]
    - [28, 0.0]
  - - [704, 768, 1, 32]
    - [46, 2.36]
  - - [768, 704, 1, 64]
    - [39, 3.1]
  - - [1472, 1984, 1, 16]
    - [39, 3.34]
  - - [1, 576, 1, 16]
    - [33, 0.0]
  - - [16, 576, 1, 32]
    - [24, 0.07]
  - - [16, 2304, 1, 16]
    - [21, 0.15]
  - - [576, 32, 1, 32]
    - [60, 0.15]
  - - [960, 32, 1, 32]
    - [29, 0.24]
  - - [960, 448, 1, 32]
    - [39, 2.1]
  - - [1728, 1600, 1, 16]
    - [39, 3.23]
  - - [576, 2624, 1, 32]
    - [39, 3.64]
  - - [2880, 32, 1, 16]
    - [9, 0.35]
  - - [2880, 832, 1, 16]
    - [39, 3.11]
  - - [3072, 320, 1, 16]
    - [46, 2.21]
  - - [1600, 192, 1, 64]
    - [39, 2.44]
  - - [320, 768, 1, 32]
    - [65, 1.31]
  - - [1, 576, 1, 3072]
    - [23, 0.04]
  - - [3392, 3648, 1, 1]
    - [46, 0.33]
  - - [3648, 4096, 1, 1]
    - [46, 0.33]
  - - [1, 3072, 1, 3072]
    - [33, 0.14]
  - - [1, 832, 1, 3072]
    - [24, 0.05]
  - - [448, 448, 1, 64]
    - [39, 1.8]
  - - [576, 768, 1, 64]
    - [51, 2.93]
  - - [1088, 2624, 1, 16]
    - [39, 3.3]
  - - [6, 8, 1, 12]
    - [35, 0.0]
  - - [576, 576, 1, 32]
    - [51, 1.65]
  - - [832, 3136, 1, 16]
    - [39, 3.17]
  - - [640, 576, 1, 32]
    - [39, 1.84]
  - - [704, 1856, 1, 32]
    - [30, 3.37]
  - - [704, 64, 1, 64]
    - [55, 0.53]
  - - [384, 704, 1, 32]
    - [9, 1.45]
  - - [4, 14, 1, 12]
    - [27, 0.0]
  - - [8, 12, 1, 12]
    - [27, 0.0]
  - - [320, 4096, 1, 1]
    - [30, 0.17]
  - - [3072, 3840, 1, 1]
    - [46, 0.32]
  - - [2880, 1088, 1, 1]
    - [39, 0.25]
  - - [1600, 448, 1, 16]
    - [51, 1.78]
  - - [896, 832, 1, 16]
    - [46, 1.85]
  - - [896, 32, 1, 16]
    - [29, 0.12]
  - - [832, 1344, 1, 32]
    - [51, 3.21]
  - - [14, 4, 1, 12]
    - [41, 0.0]
  - - [320, 384, 1, 1]
    - [46, 0.03]
  - - [32, 10, 1, 1]
    - [28, 0.0]
  - - [16, 12, 1, 6]
    - [41, 0.0]
  - - [256, 768, 1, 1]
    - [46, 0.05]
  - - [384, 16, 1, 32]
    - [34, 0.05]
  - - [32, 10, 1, 1024]
    - [13, 0.02]
  - - [16, 768, 1, 32]
    - [23, 0.1]
  - - [16, 3072, 1, 16]
    - [21, 0.19]
  - - [768, 16, 1, 64]
    - [13, 0.17]
  - - [320, 32, 1, 256]
    - [22, 0.37]
  - - [16, 768, 1, 256]
    - [23, 0.43]
  - - [768, 16, 1, 256]
    - [22, 0.44]
  - - [16, 384, 1, 1024]
    - [24, 0.33]
  - - [16, 768, 1, 512]
    - [24, 0.55]
  - - [1216, 192, 1, 64]
    - [39, 2.07]
  - - [1472, 16, 1, 32]
    - [22, 0.18]
  - - [2624, 1, 1, 512]
    - [47, 0.1]
  - - [3136, 320, 1, 16]
    - [46, 2.21]
  - - [832, 576, 1, 32]
    - [39, 2.15]
  - - [576, 832, 1, 64]
    - [39, 2.99]
  - - [3072, 960, 1, 1]
    - [39, 0.23]
  - - [32, 3392, 1, 32]
    - [44, 0.68]
  - - [32, 4096, 1, 64]
    - [59, 1.41]
  - - [512, 896, 1, 32]
    - [39, 2.21]
  - - [12, 1, 1, 16]
    - [29, 0.0]
  - - [2, 12, 1, 16]
    - [27, 0.0]
  - - [16, 2, 1, 12]
    - [41, 0.0]
  - - [8, 14, 1, 6]
    - [28, 0.0]
  - - [1728, 1, 1, 1]
    - [28, 0.0]
  - - [576, 16, 1, 1]
    - [45, 0.0]
  - - [1024, 1, 1, 16]
    - [27, 0.0]
  - - [3072, 1, 1, 64]
    - [27, 0.04]
  - - [1, 192, 1, 4096]
    - [23, 0.01]
  - - [12, 16, 1, 4096]
    - [13, 0.01]
  - - [16, 12, 1, 4096]
    - [22, 0.01]
  - - [576, 64, 1, 32]
    - [56, 0.28]
  - - [1, 512, 1, 3072]
    - [22, 0.03]
  - - [1, 768, 1, 3072]
    - [24, 0.05]
  - - [3072, 1, 1, 1024]
    - [47, 0.14]
  - - [1, 3840, 1, 3072]
    - [35, 0.15]
  - - [16, 192, 1, 4096]
    - [24, 0.19]
  - - [16, 576, 1, 2048]
    - [23, 0.55]
  - - [16, 512, 1, 3072]
    - [24, 0.51]
  - - [1, 2816, 1, 3072]
    - [37, 0.13]
  - - [320, 832, 1, 64]
    - [46, 2.13]
  - - [64, 1856, 1, 64]
    - [39, 1.27]
  - - [576, 704, 1, 32]
    - [46, 1.97]
  - - [320, 448, 1, 32]
    - [46, 0.86]
  - - [64, 2112, 1, 16]
    - [52, 0.5]
  - - [4, 8, 1, 14]
    - [35, 0.0]
  - - [192, 640, 1, 1]
    - [46, 0.03]
  - - [3136, 32, 1, 1]
    - [46, 0.03]
  - - [3136, 32, 1, 16]
    - [30, 0.4]
  - - [64, 2880, 1, 16]
    - [39, 0.66]
  - - [32, 896, 1, 1]
    - [52, 0.01]
  - - [896, 512, 1, 32]
    - [46, 2.24]
  - - [384, 448, 1, 1]
    - [46, 0.04]
  - - [448, 704, 1, 64]
    - [39, 2.62]
  - - [14, 10, 1, 12]
    - [28, 0.0]
  - - [640, 960, 1, 32]
    - [46, 2.56]
  - - [960, 640, 1, 64]
    - [39, 3.28]
  - - [320, 768, 1, 64]
    - [46, 2.18]
  - - [832, 832, 1, 16]
    - [46, 1.76]
  - - [1, 832, 1, 256]
    - [24, 0.03]
  - - [64, 1472, 1, 32]
    - [53, 0.65]
  - - [1536, 128, 1, 1]
    - [39, 0.05]
  - - [6, 6, 1, 16]
    - [33, 0.0]
  - - [1024, 64, 1, 1]
    - [39, 0.02]
  - - [3072, 192, 1, 1]
    - [39, 0.11]
  - - [3072, 384, 1, 1]
    - [39, 0.17]
  - - [192, 576, 1, 32]
    - [9, 0.77]
  - - [3072, 192, 1, 16]
    - [39, 1.56]
  - - [1728, 448, 1, 16]
    - [46, 1.91]
  - - [1600, 832, 1, 32]
    - [51, 3.42]
  - - [576, 1024, 1, 16]
    - [9, 1.57]
  - - [384, 576, 1, 64]
    - [46, 1.97]
  - - [14, 6, 1, 12]
    - [41, 0.0]
  - - [576, 1472, 1, 16]
    - [39, 2.07]
  - - [832, 16, 1, 32]
    - [29, 0.1]
  - - [448, 1216, 1, 32]
    - [39, 2.33]
  - - [16, 3136, 1, 16]
    - [37, 0.18]
  - - [4096, 3904, 1, 1]
    - [46, 0.31]
  - - [1216, 64, 1, 1]
    - [46, 0.02]
  - - [960, 768, 1, 16]
    - [39, 1.84]
  - - [768, 192, 1, 1]
    - [46, 0.04]
  - - [1472, 448, 1, 1]
    - [46, 0.11]
  - - [3072, 512, 1, 1]
    - [46, 0.19]
  - - [1472, 576, 1, 1]
    - [39, 0.14]
  - - [832, 32, 1, 1]
    - [46, 0.01]
  - - [32, 3328, 1, 32]
    - [59, 0.7]
  - - [3392, 1088, 1, 1]
    - [39, 0.26]
  - - [1600, 1728, 1, 16]
    - [39, 3.29]
  - - [832, 960, 1, 16]
    - [46, 1.93]
  - - [12, 6, 1, 12]
    - [28, 0.0]
  - - [384, 768, 1, 64]
    - [46, 2.38]
  - - [64, 1216, 1, 64]
    - [52, 0.85]
  - - [1216, 576, 1, 64]
    - [51, 3.49]
  - - [4, 16, 1, 16]
    - [27, 0.0]
  - - [640, 960, 1, 16]
    - [32, 1.58]
  - - [10, 4, 1, 14]
    - [35, 0.0]
  - - [32, 1216, 1, 1]
    - [52, 0.01]
  - - [2880, 3904, 1, 1]
    - [46, 0.32]
  - - [1984, 16, 1, 16]
    - [29, 0.13]
  - - [4, 14, 1, 10]
    - [28, 0.0]
  - - [16, 14, 1, 10]
    - [41, 0.0]
  - - [128, 896, 1, 1]
    - [46, 0.03]
  - - [448, 32, 1, 16]
    - [8, 0.06]
  - - [1, 896, 1, 512]
    - [24, 0.04]
  - - [8, 2, 1, 4]
    - [28, 0.0]
  - - [2, 14, 1, 4]
    - [41, 0.0]
  - - [8, 6, 1, 4]
    - [35, 0.0]
  - - [6, 14, 1, 4096]
    - [22, 0.01]
  - - [1, 448, 1, 3072]
    - [24, 0.03]
  - - [192, 256, 1, 64]
    - [31, 0.59]
  - - [896, 256, 1, 16]
    - [9, 0.79]
  - - [16, 448, 1, 3072]
    - [23, 0.45]
  - - [32, 256, 1, 3072]
    - [23, 0.51]
  - - [3648, 3392, 1, 1]
    - [46, 0.33]
  - - [14, 1, 1, 10]
    - [35, 0.0]
  - - [3904, 576, 1, 1]
    - [39, 0.22]
  - - [2624, 4096, 1, 1]
    - [46, 0.3]
  - - [4096, 3136, 1, 1]
    - [9, 0.29]
  - - [14, 14, 1, 4096]
    - [13, 0.01]
  - - [8, 8, 1, 6]
    - [28, 0.0]
  - - [64, 640, 1, 1]
    - [46, 0.01]
  - - [32, 256, 1, 32]
    - [34, 0.07]
  - - [320, 64, 1, 16]
    - [27, 0.09]
  - - [32, 1024, 1, 16]
    - [37, 0.13]
  - - [256, 64, 1, 32]
    - [23, 0.13]
  - - [64, 256, 1, 64]
    - [24, 0.23]
  - - [64, 2048, 1, 16]
    - [9, 0.52]
  - - [512, 64, 1, 64]
    - [29, 0.45]
  - - [32, 320, 1, 512]
    - [13, 0.47]
  - - [64, 640, 1, 512]
    - [55, 1.54]
  - - [640, 64, 1, 512]
    - [58, 1.57]
  - - [64, 512, 1, 1024]
    - [23, 1.6]
  - - [2, 8, 1, 6]
    - [41, 0.0]
  - - [2, 8, 1, 12]
    - [28, 0.0]
  - - [8, 10, 1, 10]
    - [28, 0.0]
  - - [12, 8, 1, 14]
    - [41, 0.0]
  - - [576, 256, 1, 64]
    - [39, 1.53]
  - - [1344, 2112, 1, 16]
    - [39, 3.28]
  - - [14, 16, 1, 6]
    - [28, 0.0]
  - - [14, 16, 1, 16]
    - [42, 0.0]
  - - [16, 14, 1, 4096]
    - [22, 0.01]
  - - [256, 896, 1, 32]
    - [44, 1.23]
  - - [960, 1088, 1, 32]
    - [30, 3.16]
  - - [14, 6, 1, 14]
    - [27, 0.0]
  - - [320, 192, 1, 64]
    - [53, 0.7]
  - - [4096, 16, 1, 16]
    - [52, 0.25]
  - - [128, 4096, 1, 32]
    - [39, 2.4]
  - - [1216, 960, 1, 32]
    - [46, 3.33]
  - - [32, 1472, 1, 16]
    - [32, 0.18]
  - - [1, 1, 1, 10]
    - [28, 0.0]
  - - [1, 10, 1, 1]
    - [35, 0.0]
  - - [10, 1, 1, 1]
    - [28, 0.0]
  - - [1, 1, 1, 14]
    - [28, 0.0]
  - - [1, 14, 1, 1]
    - [28, 0.0]
  - - [14, 1, 1, 1]
    - [41, 0.0]
  - - [1, 16, 1, 1]
    - [35, 0.0]
  - - [16, 1, 1, 1]
    - [28, 0.0]
  - - [2, 8, 1, 2]
    - [28, 0.0]
  - - [1, 6, 1, 6]
    - [28, 0.0]
  - - [2, 2, 1, 10]
    - [28, 0.0]
  - - [2, 10, 1, 2]
    - [29, 0.0]
  - - [2, 4, 1, 6]
    - [41, 0.0]
  - - [2, 6, 1, 4]
    - [28, 0.0]
  - - [2, 12, 1, 2]
    - [33, 0.0]
  - - [4, 2, 1, 6]
    - [27, 0.0]
  - - [4, 6, 1, 2]
    - [28, 0.0]
  - - [2, 2, 1, 14]
    - [21, 0.0]
  - - [1, 6, 1, 10]
    - [28, 0.0]
  - - [6, 10, 1, 1]
    - [28, 0.0]
  - - [10, 6, 1, 1]
    - [35, 0.0]
  - - [2, 4, 1, 8]
    - [41, 0.0]
  - - [2, 16, 1, 2]
    - [42, 0.0]
  - - [4, 4, 1, 4]
    - [41, 0.0]
  - - [4, 8, 1, 2]
    - [33, 0.0]
  - - [8, 4, 1, 2]
    - [8, 0.0]
  - - [1, 6, 1, 12]
    - [28, 0.0]
  - - [1, 12, 1, 6]
    - [27, 0.0]
  - - [2, 6, 1, 6]
    - [41, 0.0]
  - - [6, 1, 1, 12]
    - [41, 0.0]
  - - [6, 2, 1, 6]
    - [41, 0.0]
  - - [6, 6, 1, 2]
    - [28, 0.0]
  - - [2, 4, 1, 10]
    - [28, 0.0]
  - - [2, 10, 1, 4]
    - [35, 0.0]
  - - [4, 2, 1, 10]
    - [35, 0.0]
  - - [4, 10, 1, 2]
    - [27, 0.0]
  - - [10, 2, 1, 4]
    - [28, 0.0]
  - - [1, 14, 1, 6]
    - [28, 0.0]
  - - [1, 16, 1, 6]
    - [28, 0.0]
  - - [2, 4, 1, 12]
    - [28, 0.0]
  - - [2, 12, 1, 4]
    - [41, 0.0]
  - - [4, 4, 1, 6]
    - [28, 0.0]
  - - [4, 6, 1, 4]
    - [41, 0.0]
  - - [6, 4, 1, 4]
    - [28, 0.0]
  - - [12, 2, 1, 4]
    - [28, 0.0]
  - - [4, 2, 1, 14]
    - [41, 0.0]
  - - [6, 2, 1, 10]
    - [28, 0.0]
  - - [10, 1, 1, 12]
    - [45, 0.0]
  - - [10, 12, 1, 1]
    - [28, 0.0]
  - - [12, 10, 1, 1]
    - [35, 0.0]
  - - [1, 128, 1, 1]
    - [35, 0.0]
  - - [2, 4, 1, 16]
    - [29, 0.0]
  - - [4, 2, 1, 16]
    - [27, 0.0]
  - - [8, 4, 1, 4]
    - [28, 0.0]
  - - [16, 2, 1, 4]
    - [28, 0.0]
  - - [128, 1, 1, 1]
    - [28, 0.0]
  - - [1, 10, 1, 14]
    - [27, 0.0]
  - - [10, 1, 1, 14]
    - [28, 0.0]
  - - [10, 14, 1, 1]
    - [27, 0.0]
  - - [14, 10, 1, 1]
    - [41, 0.0]
  - - [1, 12, 1, 12]
    - [27, 0.0]
  - - [2, 6, 1, 12]
    - [28, 0.0]
  - - [2, 12, 1, 6]
    - [28, 0.0]
  - - [4, 6, 1, 6]
    - [35, 0.0]
  - - [6, 12, 1, 2]
    - [42, 0.0]
  - - [12, 1, 1, 12]
    - [28, 0.0]
  - - [12, 6, 1, 2]
    - [28, 0.0]
  - - [12, 12, 1, 1]
    - [28, 0.0]
  - - [1, 10, 1, 16]
    - [27, 0.0]
  - - [2, 8, 1, 10]
    - [28, 0.0]
  - - [2, 10, 1, 8]
    - [41, 0.0]
  - - [8, 2, 1, 10]
    - [35, 0.0]
  - - [8, 10, 1, 2]
    - [35, 0.0]
  - - [10, 1, 1, 16]
    - [27, 0.0]
  - - [10, 4, 1, 4]
    - [41, 0.0]
  - - [10, 8, 1, 2]
    - [29, 0.0]
  - - [10, 16, 1, 1]
    - [42, 0.0]
  - - [16, 1, 1, 10]
    - [28, 0.0]
  - - [16, 10, 1, 1]
    - [28, 0.0]
  - - [1, 12, 1, 14]
    - [41, 0.0]
  - - [1, 14, 1, 12]
    - [27, 0.0]
  - - [2, 6, 1, 14]
    - [28, 0.0]
  - - [2, 14, 1, 6]
    - [27, 0.0]
  - - [6, 14, 1, 2]
    - [28, 0.0]
  - - [12, 1, 1, 14]
    - [28, 0.0]
  - - [12, 14, 1, 1]
    - [42, 0.0]
  - - [14, 1, 1, 12]
    - [28, 0.0]
  - - [14, 6, 1, 2]
    - [28, 0.0]
  - - [14, 12, 1, 1]
    - [27, 0.0]
  - - [1, 6, 1, 32]
    - [34, 0.0]
  - - [1, 12, 1, 16]
    - [28, 0.0]
  - - [1, 16, 1, 12]
    - [35, 0.0]
  - - [2, 12, 1, 8]
    - [35, 0.0]
  - - [2, 16, 1, 6]
    - [28, 0.0]
  - - [4, 4, 1, 12]
    - [28, 0.0]
  - - [4, 8, 1, 6]
    - [28, 0.0]
  - - [6, 2, 1, 16]
    - [28, 0.0]
  - - [6, 16, 1, 2]
    - [35, 0.0]
  - - [6, 32, 1, 1]
    - [35, 0.0]
  - - [8, 2, 1, 12]
    - [28, 0.0]
  - - [8, 4, 1, 6]
    - [41, 0.0]
  - - [8, 12, 1, 2]
    - [28, 0.0]
  - - [12, 2, 1, 8]
    - [41, 0.0]
  - - [12, 4, 1, 4]
    - [28, 0.0]
  - - [12, 8, 1, 2]
    - [33, 0.0]
  - - [12, 16, 1, 1]
    - [28, 0.0]
  - - [16, 6, 1, 2]
    - [35, 0.0]
  - - [32, 6, 1, 1]
    - [28, 0.0]
  - - [14, 1, 1, 14]
    - [27, 0.0]
  - - [14, 14, 1, 1]
    - [28, 0.0]
  - - [2, 10, 1, 10]
    - [28, 0.0]
  - - [10, 2, 1, 10]
    - [28, 0.0]
  - - [10, 10, 1, 2]
    - [41, 0.0]
  - - [6, 6, 1, 6]
    - [28, 0.0]
  - - [1, 14, 1, 16]
    - [28, 0.0]
  - - [2, 8, 1, 14]
    - [42, 0.0]
  - - [2, 14, 1, 8]
    - [28, 0.0]
  - - [8, 14, 1, 2]
    - [41, 0.0]
  - - [14, 2, 1, 8]
    - [62, 0.0]
  - - [14, 4, 1, 4]
    - [28, 0.0]
  - - [14, 8, 1, 2]
    - [29, 0.0]
  - - [14, 16, 1, 1]
    - [28, 0.0]
  - - [16, 1, 1, 14]
    - [27, 0.0]
  - - [16, 14, 1, 1]
    - [41, 0.0]
  - - [2, 10, 1, 12]
    - [28, 0.0]
  - - [4, 10, 1, 6]
    - [41, 0.0]
  - - [6, 4, 1, 10]
    - [35, 0.0]
  - - [6, 10, 1, 4]
    - [41, 0.0]
  - - [10, 2, 1, 12]
    - [29, 0.0]
  - - [10, 6, 1, 4]
    - [28, 0.0]
  - - [10, 12, 1, 2]
    - [41, 0.0]
  - - [12, 2, 1, 10]
    - [28, 0.0]
  - - [12, 10, 1, 2]
    - [35, 0.0]
  - - [1, 256, 1, 1]
    - [29, 0.0]
  - - [2, 8, 1, 16]
    - [42, 0.0]
  - - [2, 16, 1, 8]
    - [28, 0.0]
  - - [4, 4, 1, 16]
    - [27, 0.0]
  - - [4, 8, 1, 8]
    - [26, 0.0]
  - - [8, 2, 1, 16]
    - [27, 0.0]
  - - [8, 8, 1, 4]
    - [28, 0.0]
  - - [8, 16, 1, 2]
    - [35, 0.0]
  - - [16, 1, 1, 16]
    - [29, 0.0]
  - - [16, 4, 1, 4]
    - [27, 0.0]
  - - [16, 8, 1, 2]
    - [42, 0.0]
  - - [16, 16, 1, 1]
    - [27, 0.0]
  - - [256, 1, 1, 1]
    - [28, 0.0]
  - - [2, 10, 1, 14]
    - [60, 0.0]
  - - [10, 2, 1, 14]
    - [28, 0.0]
  - - [10, 14, 1, 2]
    - [35, 0.0]
  - - [14, 2, 1, 10]
    - [28, 0.0]
  - - [14, 10, 1, 2]
    - [41, 0.0]
  - - [2, 12, 1, 12]
    - [28, 0.0]
  - - [4, 6, 1, 12]
    - [28, 0.0]
  - - [6, 4, 1, 12]
    - [28, 0.0]
  - - [6, 6, 1, 8]
    - [35, 0.0]
  - - [6, 8, 1, 6]
    - [28, 0.0]
  - - [6, 12, 1, 4]
    - [28, 0.0]
  - - [8, 6, 1, 6]
    - [28, 0.0]
  - - [12, 2, 1, 12]
    - [28, 0.0]
  - - [12, 4, 1, 6]
    - [28, 0.0]
  - - [12, 6, 1, 4]
    - [28, 0.0]
  - - [12, 12, 1, 2]
    - [41, 0.0]
  - - [1, 320, 1, 1]
    - [28, 0.0]
  - - [2, 10, 1, 16]
    - [28, 0.0]
  - - [4, 10, 1, 8]
    - [35, 0.0]
  - - [8, 10, 1, 4]
    - [29, 0.0]
  - - [10, 2, 1, 16]
    - [28, 0.0]
  - - [10, 4, 1, 8]
    - [27, 0.0]
  - - [10, 8, 1, 4]
    - [35, 0.0]
  - - [16, 2, 1, 10]
    - [41, 0.0]
  - - [16, 10, 1, 2]
    - [28, 0.0]
  - - [320, 1, 1, 1]
    - [28, 0.0]
  - - [2, 12, 1, 14]
    - [28, 0.0]
  - - [6, 14, 1, 4]
    - [28, 0.0]
  - - [12, 2, 1, 14]
    - [28, 0.0]
  - - [12, 14, 1, 2]
    - [41, 0.0]
  - - [14, 4, 1, 6]
    - [28, 0.0]
  - - [14, 12, 1, 2]
    - [41, 0.0]
  - - [10, 6, 1, 6]
    - [28, 0.0]
  - - [4, 6, 1, 16]
    - [27, 0.0]
  - - [4, 8, 1, 12]
    - [28, 0.0]
  - - [4, 12, 1, 8]
    - [41, 0.0]
  - - [6, 4, 1, 16]
    - [42, 0.0]
  - - [6, 8, 1, 8]
    - [28, 0.0]
  - - [6, 16, 1, 4]
    - [35, 0.0]
  - - [8, 4, 1, 12]
    - [41, 0.0]
  - - [8, 6, 1, 8]
    - [41, 0.0]
  - - [8, 12, 1, 4]
    - [28, 0.0]
  - - [12, 4, 1, 8]
    - [41, 0.0]
  - - [16, 4, 1, 6]
    - [28, 0.0]
  - - [16, 12, 1, 2]
    - [35, 0.0]
  - - [384, 1, 1, 1]
    - [28, 0.0]
  - - [2, 14, 1, 14]
    - [27, 0.0]
  - - [14, 2, 1, 14]
    - [27, 0.0]
  - - [4, 10, 1, 10]
    - [35, 0.0]
  - - [6, 6, 1, 12]
    - [28, 0.0]
  - - [12, 6, 1, 6]
    - [35, 0.0]
  - - [1, 448, 1, 1]
    - [28, 0.0]
  - - [2, 14, 1, 16]
    - [28, 0.0]
  - - [2, 16, 1, 14]
    - [28, 0.0]
  - - [4, 14, 1, 8]
    - [35, 0.0]
  - - [8, 4, 1, 14]
    - [35, 0.0]
  - - [8, 14, 1, 4]
    - [28, 0.0]
  - - [14, 4, 1, 8]
    - [35, 0.0]
  - - [16, 2, 1, 14]
    - [35, 0.0]
  - - [32, 1, 1, 14]
    - [28, 0.0]
  - - [448, 1, 1, 1]
    - [28, 0.0]
  - - [4, 10, 1, 12]
    - [28, 0.0]
  - - [4, 12, 1, 10]
    - [28, 0.0]
  - - [6, 8, 1, 10]
    - [28, 0.0]
  - - [6, 10, 1, 8]
    - [41, 0.0]
  - - [8, 6, 1, 10]
    - [41, 0.0]
  - - [10, 4, 1, 12]
    - [28, 0.0]
  - - [10, 6, 1, 8]
    - [35, 0.0]
  - - [10, 12, 1, 4]
    - [28, 0.0]
  - - [12, 10, 1, 4]
    - [35, 0.0]
  - - [6, 6, 1, 14]
    - [28, 0.0]
  - - [1, 16, 1, 32]
    - [34, 0.0]
  - - [1, 512, 1, 1]
    - [28, 0.0]
  - - [2, 16, 1, 16]
    - [28, 0.0]
  - - [4, 16, 1, 8]
    - [41, 0.0]
  - - [8, 4, 1, 16]
    - [28, 0.0]
  - - [8, 8, 1, 8]
    - [45, 0.0]
  - - [8, 16, 1, 4]
    - [35, 0.0]
  - - [16, 1, 1, 32]
    - [34, 0.0]
  - - [16, 4, 1, 8]
    - [28, 0.0]
  - - [512, 1, 1, 1]
    - [41, 0.0]
  - - [4, 10, 1, 14]
    - [28, 0.0]
  - - [10, 14, 1, 4]
    - [28, 0.0]
  - - [14, 4, 1, 10]
    - [28, 0.0]
  - - [14, 10, 1, 4]
    - [28, 0.0]
  - - [1, 576, 1, 1]
    - [35, 0.0]
  - - [4, 12, 1, 12]
    - [41, 0.0]
  - - [6, 12, 1, 8]
    - [28, 0.0]
  - - [12, 4, 1, 12]
    - [28, 0.0]
  - - [12, 6, 1, 8]
    - [35, 0.0]
  - - [12, 12, 1, 4]
    - [28, 0.0]
  - - [576, 1, 1, 1]
    - [29, 0.0]
  - - [6, 10, 1, 10]
    - [28, 0.0]
  - - [10, 6, 1, 10]
    - [35, 0.0]
  - - [1, 640, 1, 1]
    - [35, 0.0]
  - - [4, 10, 1, 16]
    - [28, 0.0]
  - - [4, 16, 1, 10]
    - [28, 0.0]
  - - [8, 8, 1, 10]
    - [28, 0.0]
  - - [8, 10, 1, 8]
    - [28, 0.0]
  - - [10, 4, 1, 16]
    - [27, 0.0]
  - - [10, 8, 1, 8]
    - [62, 0.0]
  - - [10, 16, 1, 4]
    - [28, 0.0]
  - - [16, 4, 1, 10]
    - [60, 0.0]
  - - [16, 10, 1, 4]
    - [28, 0.0]
  - - [4, 12, 1, 14]
    - [26, 0.0]
  - - [6, 8, 1, 14]
    - [28, 0.0]
  - - [8, 6, 1, 14]
    - [28, 0.0]
  - - [12, 4, 1, 14]
    - [35, 0.0]
  - - [12, 14, 1, 4]
    - [28, 0.0]
  - - [14, 6, 1, 8]
    - [28, 0.0]
  - - [14, 12, 1, 4]
    - [41, 0.0]
  - - [704, 1, 1, 1]
    - [28, 0.0]
  - - [6, 10, 1, 12]
    - [28, 0.0]
  - - [6, 12, 1, 10]
    - [28, 0.0]
  - - [12, 6, 1, 10]
    - [28, 0.0]
  - - [1, 768, 1, 1]
    - [35, 0.0]
  - - [4, 12, 1, 16]
    - [27, 0.0]
  - - [4, 16, 1, 12]
    - [27, 0.0]
  - - [6, 8, 1, 16]
    - [27, 0.0]
  - - [6, 16, 1, 8]
    - [27, 0.0]
  - - [8, 6, 1, 16]
    - [28, 0.0]
  - - [8, 8, 1, 12]
    - [41, 0.0]
  - - [8, 12, 1, 8]
    - [41, 0.0]
  - - [12, 4, 1, 16]
    - [27, 0.0]
  - - [12, 8, 1, 8]
    - [35, 0.0]
  - - [12, 16, 1, 4]
    - [27, 0.0]
  - - [16, 6, 1, 8]
    - [28, 0.0]
  - - [16, 12, 1, 4]
    - [35, 0.0]
  - - [768, 1, 1, 1]
    - [60, 0.0]
  - - [4, 14, 1, 14]
    - [33, 0.0]
  - - [14, 4, 1, 14]
    - [27, 0.0]
  - - [14, 14, 1, 4]
    - [28, 0.0]
  - - [10, 8, 1, 10]
    - [28, 0.0]
  - - [10, 10, 1, 8]
    - [28, 0.0]
  - - [1, 832, 1, 1]
    - [35, 0.0]
  - - [832, 1, 1, 1]
    - [28, 0.0]
  - - [6, 14, 1, 10]
    - [41, 0.0]
  - - [10, 6, 1, 14]
    - [41, 0.0]
  - - [14, 6, 1, 10]
    - [28, 0.0]
  - - [6, 12, 1, 12]
    - [28, 0.0]
  - - [1, 896, 1, 1]
    - [35, 0.0]
  - - [4, 14, 1, 16]
    - [27, 0.0]
  - - [4, 16, 1, 14]
    - [27, 0.0]
  - - [8, 8, 1, 14]
    - [28, 0.0]
  - - [8, 14, 1, 8]
    - [62, 0.0]
  - - [14, 8, 1, 8]
    - [35, 0.0]
  - - [14, 16, 1, 4]
    - [28, 0.0]
  - - [16, 4, 1, 14]
    - [28, 0.0]
  - - [16, 14, 1, 4]
    - [28, 0.0]
  - - [896, 1, 1, 1]
    - [29, 0.0]
  - - [1, 960, 1, 1]
    - [33, 0.0]
  - - [6, 10, 1, 16]
    - [27, 0.0]
  - - [8, 10, 1, 12]
    - [28, 0.0]
  - - [8, 12, 1, 10]
    - [28, 0.0]
  - - [10, 6, 1, 16]
    - [28, 0.0]
  - - [10, 8, 1, 12]
    - [45, 0.0]
  - - [10, 12, 1, 8]
    - [28, 0.0]
  - - [12, 8, 1, 10]
    - [28, 0.0]
  - - [12, 10, 1, 8]
    - [28, 0.0]
  - - [16, 6, 1, 10]
    - [35, 0.0]
  - - [960, 1, 1, 1]
    - [29, 0.0]
  - - [10, 10, 1, 10]
    - [28, 0.0]
  - - [6, 12, 1, 14]
    - [28, 0.0]
  - - [6, 14, 1, 12]
    - [28, 0.0]
  - - [12, 6, 1, 14]
    - [28, 0.0]
  - - [1, 1024, 1, 1]
    - [28, 0.0]
  - - [8, 8, 1, 16]
    - [27, 0.0]
  - - [8, 16, 1, 8]
    - [41, 0.0]
  - - [16, 8, 1, 8]
    - [28, 0.0]
  - - [1024, 1, 1, 1]
    - [28, 0.0]
  - - [1, 1088, 1, 1]
    - [35, 0.0]
  - - [1088, 1, 1, 1]
    - [45, 0.0]
  - - [8, 10, 1, 14]
    - [42, 0.0]
  - - [8, 14, 1, 10]
    - [28, 0.0]
  - - [10, 8, 1, 14]
    - [28, 0.0]
  - - [10, 14, 1, 8]
    - [33, 0.0]
  - - [14, 8, 1, 10]
    - [62, 0.0]
  - - [14, 10, 1, 8]
    - [27, 0.0]
  - - [6, 12, 1, 16]
    - [27, 0.0]
  - - [12, 8, 1, 12]
    - [28, 0.0]
  - - [16, 6, 1, 12]
    - [35, 0.0]
  - - [32, 6, 1, 6]
    - [28, 0.0]
  - - [6, 14, 1, 14]
    - [27, 0.0]
  - - [10, 10, 1, 12]
    - [28, 0.0]
  - - [10, 12, 1, 10]
    - [41, 0.0]
  - - [12, 10, 1, 10]
    - [28, 0.0]
  - - [1, 1216, 1, 1]
    - [28, 0.0]
  - - [1, 1280, 1, 1]
    - [28, 0.0]
  - - [8, 16, 1, 10]
    - [27, 0.0]
  - - [16, 10, 1, 8]
    - [28, 0.0]
  - - [1, 1344, 1, 1]
    - [33, 0.0]
  - - [6, 16, 1, 14]
    - [28, 0.0]
  - - [8, 12, 1, 14]
    - [28, 0.0]
  - - [14, 8, 1, 12]
    - [42, 0.0]
  - - [14, 12, 1, 8]
    - [28, 0.0]
  - - [16, 14, 1, 6]
    - [28, 0.0]
  - - [10, 10, 1, 14]
    - [28, 0.0]
  - - [10, 14, 1, 10]
    - [28, 0.0]
  - - [14, 10, 1, 10]
    - [41, 0.0]
  - - [12, 10, 1, 12]
    - [28, 0.0]
  - - [12, 12, 1, 10]
    - [28, 0.0]
  - - [1, 1472, 1, 1]
    - [35, 0.0]
  - - [1, 1536, 1, 1]
    - [27, 0.0]
  - - [16, 8, 1, 12]
    - [28, 0.0]
  - - [16, 16, 1, 6]
    - [28, 0.0]
  - - [8, 14, 1, 14]
    - [42, 0.0]
  - - [14, 8, 1, 14]
    - [27, 0.0]
  - - [1, 1600, 1, 1]
    - [35, 0.0]
  - - [10, 16, 1, 10]
    - [28, 0.0]
  - - [16, 10, 1, 10]
    - [28, 0.0]
  - - [10, 12, 1, 14]
    - [28, 0.0]
  - - [10, 14, 1, 12]
    - [28, 0.0]
  - - [12, 10, 1, 14]
    - [41, 0.0]
  - - [12, 14, 1, 10]
    - [28, 0.0]
  - - [14, 12, 1, 10]
    - [28, 0.0]
  - - [1, 1728, 1, 1]
    - [35, 0.0]
  - - [12, 12, 1, 12]
    - [35, 0.0]
  - - [1, 1792, 1, 1]
    - [28, 0.0]
  - - [8, 14, 1, 16]
    - [42, 0.0]
  - - [8, 16, 1, 14]
    - [42, 0.0]
  - - [16, 8, 1, 14]
    - [28, 0.0]
  - - [1, 1856, 1, 1]
    - [28, 0.0]
  - - [1856, 1, 1, 1]
    - [28, 0.0]
  - - [10, 12, 1, 16]
    - [27, 0.0]
  - - [10, 16, 1, 12]
    - [41, 0.0]
  - - [10, 32, 1, 6]
    - [27, 0.0]
  - - [12, 10, 1, 16]
    - [27, 0.0]
  - - [12, 16, 1, 10]
    - [26, 0.0]
  - - [16, 10, 1, 12]
    - [28, 0.0]
  - - [16, 12, 1, 10]
    - [28, 0.0]
  - - [32, 6, 1, 10]
    - [35, 0.0]
  - - [10, 14, 1, 14]
    - [27, 0.0]
  - - [14, 10, 1, 14]
    - [27, 0.0]
  - - [14, 14, 1, 10]
    - [26, 0.0]
  - - [1, 1984, 1, 1]
    - [33, 0.0]
  - - [1984, 1, 1, 1]
    - [41, 0.0]
  - - [12, 12, 1, 14]
    - [35, 0.0]
  - - [12, 14, 1, 12]
    - [28, 0.0]
  - - [14, 12, 1, 12]
    - [41, 0.0]
  - - [8, 16, 1, 16]
    - [27, 0.0]
  - - [16, 8, 1, 16]
    - [42, 0.0]
  - - [16, 128, 1, 1]
    - [41, 0.0]
  - - [128, 1, 1, 16]
    - [27, 0.0]
  - - [2048, 1, 1, 1]
    - [28, 0.0]
  - - [2112, 1, 1, 1]
    - [28, 0.0]
  - - [10, 14, 1, 16]
    - [27, 0.0]
  - - [10, 16, 1, 14]
    - [28, 0.0]
  - - [14, 10, 1, 16]
    - [28, 0.0]
  - - [16, 10, 1, 14]
    - [28, 0.0]
  - - [6, 12, 1, 32]
    - [34, 0.0]
  - - [12, 6, 1, 32]
    - [34, 0.0]
  - - [12, 12, 1, 16]
    - [28, 0.0]
  - - [12, 16, 1, 12]
    - [35, 0.0]
  - - [12, 32, 1, 6]
    - [29, 0.0]
  - - [16, 12, 1, 12]
    - [27, 0.0]
  - - [14, 12, 1, 14]
    - [42, 0.0]
  - - [14, 14, 1, 12]
    - [28, 0.0]
  - - [2368, 1, 1, 1]
    - [28, 0.0]
  - - [10, 16, 1, 16]
    - [27, 0.0]
  - - [16, 10, 1, 16]
    - [28, 0.0]
  - - [16, 16, 1, 10]
    - [28, 0.0]
  - - [2624, 1, 1, 1]
    - [27, 0.0]
  - - [6, 14, 1, 32]
    - [34, 0.0]
  - - [6, 32, 1, 14]
    - [28, 0.0]
  - - [12, 14, 1, 16]
    - [27, 0.0]
  - - [12, 16, 1, 14]
    - [26, 0.0]
  - - [14, 6, 1, 32]
    - [34, 0.0]
  - - [14, 12, 1, 16]
    - [28, 0.0]
  - - [14, 16, 1, 12]
    - [28, 0.0]
  - - [16, 12, 1, 14]
    - [28, 0.0]
  - - [16, 14, 1, 12]
    - [28, 0.0]
  - - [32, 6, 1, 14]
    - [28, 0.0]
  - - [14, 14, 1, 14]
    - [27, 0.0]
  - - [1, 2880, 1, 1]
    - [21, 0.0]
  - - [2880, 1, 1, 1]
    - [42, 0.0]
  - - [1, 192, 1, 16]
    - [27, 0.0]
  - - [1, 3072, 1, 1]
    - [21, 0.0]
  - - [6, 16, 1, 32]
    - [34, 0.0]
  - - [12, 16, 1, 16]
    - [42, 0.0]
  - - [16, 6, 1, 32]
    - [34, 0.0]
  - - [16, 12, 1, 16]
    - [27, 0.0]
  - - [16, 16, 1, 12]
    - [27, 0.0]
  - - [32, 6, 1, 16]
    - [28, 0.0]
  - - [192, 16, 1, 1]
    - [28, 0.0]
  - - [1, 3136, 1, 1]
    - [32, 0.0]
  - - [14, 14, 1, 16]
    - [27, 0.0]
  - - [14, 16, 1, 14]
    - [42, 0.0]
  - - [16, 14, 1, 14]
    - [42, 0.0]
  - - [3136, 1, 1, 1]
    - [54, 0.0]
  - - [10, 10, 1, 32]
    - [34, 0.0]
  - - [10, 32, 1, 10]
    - [28, 0.0]
  - - [32, 10, 1, 10]
    - [42, 0.0]
  - - [1, 3328, 1, 1]
    - [32, 0.0]
  - - [1, 3392, 1, 1]
    - [32, 0.0]
  - - [3392, 1, 1, 1]
    - [45, 0.0]
  - - [1, 3584, 1, 1]
    - [32, 0.0]
  - - [16, 14, 1, 16]
    - [27, 0.0]
  - - [16, 16, 1, 14]
    - [28, 0.0]
  - - [1, 3648, 1, 1]
    - [32, 0.0]
  - - [3648, 1, 1, 1]
    - [54, 0.0]
  - - [1, 3840, 1, 1]
    - [32, 0.0]
  - - [10, 32, 1, 12]
    - [27, 0.0]
  - - [32, 10, 1, 12]
    - [28, 0.0]
  - - [1, 3904, 1, 1]
    - [32, 0.0]
  - - [3904, 1, 1, 1]
    - [54, 0.0]
  - - [1, 4096, 1, 1]
    - [32, 0.0]
  - - [16, 16, 1, 16]
    - [27, 0.0]
  - - [16, 256, 1, 1]
    - [28, 0.0]
  - - [32, 128, 1, 1]
    - [41, 0.0]
  - - [64, 64, 1, 1]
    - [28, 0.0]
  - - [256, 16, 1, 1]
    - [27, 0.0]
  - - [4096, 1, 1, 1]
    - [26, 0.0]
  - - [10, 32, 1, 14]
    - [27, 0.0]
  - - [14, 10, 1, 32]
    - [34, 0.0]
  - - [32, 10, 1, 14]
    - [28, 0.0]
  - - [12, 32, 1, 12]
    - [28, 0.0]
  - - [32, 12, 1, 12]
    - [28, 0.0]
  - - [10, 32, 1, 16]
    - [27, 0.0]
  - - [16, 10, 1, 32]
    - [34, 0.0]
  - - [16, 320, 1, 1]
    - [33, 0.0]
  - - [320, 16, 1, 1]
    - [28, 0.0]
  - - [12, 14, 1, 32]
    - [49, 0.0]
  - - [12, 32, 1, 14]
    - [27, 0.0]
  - - [14, 12, 1, 32]
    - [34, 0.0]
  - - [32, 12, 1, 14]
    - [42, 0.0]
  - - [1, 384, 1, 16]
    - [27, 0.0]
  - - [12, 16, 1, 32]
    - [34, 0.0]
  - - [16, 12, 1, 32]
    - [49, 0.0]
  - - [16, 32, 1, 12]
    - [42, 0.0]
  - - [32, 16, 1, 12]
    - [28, 0.0]
  - - [192, 32, 1, 1]
    - [33, 0.0]
  - - [14, 14, 1, 32]
    - [34, 0.0]
  - - [14, 32, 1, 14]
    - [27, 0.0]
  - - [32, 14, 1, 14]
    - [42, 0.0]
  - - [1, 448, 1, 16]
    - [27, 0.0]
  - - [14, 16, 1, 32]
    - [34, 0.0]
  - - [14, 32, 1, 16]
    - [27, 0.0]
  - - [16, 14, 1, 32]
    - [34, 0.0]
  - - [16, 32, 1, 14]
    - [28, 0.0]
  - - [32, 14, 1, 16]
    - [42, 0.0]
  - - [32, 16, 1, 14]
    - [27, 0.0]
  - - [1, 512, 1, 16]
    - [35, 0.0]
  - - [2, 4, 1, 1024]
    - [23, 0.0]
  - - [4, 2, 1, 1024]
    - [24, 0.0]
  - - [16, 32, 1, 16]
    - [42, 0.0]
  - - [32, 16, 1, 16]
    - [27, 0.0]
  - - [1, 10, 1, 1024]
    - [24, 0.0]
  - - [10, 1, 1, 1024]
    - [13, 0.0]
  - - [10, 32, 1, 32]
    - [34, 0.0]
  - - [16, 640, 1, 1]
    - [35, 0.0]
  - - [32, 10, 1, 32]
    - [34, 0.0]
  - - [640, 1, 1, 16]
    - [28, 0.0]
  - - [640, 16, 1, 1]
    - [29, 0.0]
  - - [16, 704, 1, 1]
    - [35, 0.0]
  - - [704, 1, 1, 16]
    - [27, 0.0]
  - - [704, 16, 1, 1]
    - [29, 0.0]
  - - [12, 32, 1, 32]
    - [34, 0.0]
  - - [16, 768, 1, 1]
    - [33, 0.0]
  - - [32, 12, 1, 32]
    - [49, 0.0]
  - - [32, 32, 1, 12]
    - [27, 0.0]
  - - [192, 1, 1, 64]
    - [27, 0.0]
  - - [768, 1, 1, 16]
    - [28, 0.0]
  - - [768, 16, 1, 1]
    - [29, 0.0]
  - - [16, 832, 1, 1]
    - [35, 0.0]
  - - [832, 1, 1, 16]
    - [27, 0.0]
  - - [832, 16, 1, 1]
    - [29, 0.0]
  - - [16, 896, 1, 1]
    - [35, 0.0]
  - - [32, 14, 1, 32]
    - [34, 0.0]
  - - [32, 448, 1, 1]
    - [29, 0.0]
  - - [448, 32, 1, 1]
    - [35, 0.0]
  - - [896, 1, 1, 16]
    - [27, 0.0]
  - - [896, 16, 1, 1]
    - [29, 0.0]
  - - [16, 960, 1, 1]
    - [35, 0.0]
  - - [960, 1, 1, 16]
    - [27, 0.0]
  - - [960, 16, 1, 1]
    - [8, 0.0]
  - - [1, 16, 1, 1024]
    - [24, 0.0]
  - - [1, 256, 1, 64]
    - [13, 0.0]
  - - [2, 4, 1, 2048]
    - [23, 0.0]
  - - [2, 8, 1, 1024]
    - [22, 0.0]
  - - [4, 4, 1, 1024]
    - [13, 0.0]
  - - [8, 2, 1, 1024]
    - [24, 0.0]
  - - [16, 1, 1, 1024]
    - [23, 0.0]
  - - [16, 32, 1, 32]
    - [34, 0.0]
  - - [16, 1024, 1, 1]
    - [35, 0.0]
  - - [32, 16, 1, 32]
    - [34, 0.0]
  - - [32, 32, 1, 16]
    - [27, 0.0]
  - - [32, 512, 1, 1]
    - [29, 0.0]
  - - [256, 1, 1, 64]
    - [22, 0.0]
  - - [512, 32, 1, 1]
    - [35, 0.0]
  - - [1088, 16, 1, 1]
    - [52, 0.0]
  - - [32, 576, 1, 1]
    - [28, 0.0]
  - - [576, 32, 1, 1]
    - [28, 0.0]
  - - [1, 1216, 1, 16]
    - [27, 0.0]
  - - [16, 1216, 1, 1]
    - [28, 0.01]
  - - [1216, 16, 1, 1]
    - [28, 0.01]
  - - [1, 10, 1, 2048]
    - [24, 0.0]
  - - [1, 320, 1, 64]
    - [13, 0.0]
  - - [1, 1280, 1, 16]
    - [27, 0.01]
  - - [2, 10, 1, 1024]
    - [13, 0.0]
  - - [10, 2, 1, 1024]
    - [24, 0.0]
  - - [16, 1280, 1, 1]
    - [28, 0.01]
  - - [32, 640, 1, 1]
    - [52, 0.01]
  - - [640, 32, 1, 1]
    - [39, 0.01]
  - - [1, 1344, 1, 16]
    - [28, 0.01]
  - - [16, 1344, 1, 1]
    - [27, 0.01]
  - - [1344, 16, 1, 1]
    - [60, 0.01]
  - - [32, 704, 1, 1]
    - [52, 0.01]
  - - [704, 32, 1, 1]
    - [28, 0.01]
  - - [1, 1472, 1, 16]
    - [33, 0.01]
  - - [16, 1472, 1, 1]
    - [27, 0.01]
  - - [1472, 16, 1, 1]
    - [52, 0.01]
  - - [1, 12, 1, 2048]
    - [23, 0.0]
  - - [1, 1536, 1, 16]
    - [33, 0.01]
  - - [2, 6, 1, 2048]
    - [24, 0.0]
  - - [6, 2, 1, 2048]
    - [23, 0.0]
  - - [16, 1536, 1, 1]
    - [28, 0.01]
  - - [32, 768, 1, 1]
    - [28, 0.01]
  - - [768, 32, 1, 1]
    - [60, 0.01]
  - - [1536, 16, 1, 1]
    - [62, 0.01]
  - - [1, 1600, 1, 16]
    - [33, 0.01]
  - - [16, 1600, 1, 1]
    - [35, 0.01]
  - - [1600, 16, 1, 1]
    - [52, 0.01]
  - - [32, 832, 1, 1]
    - [52, 0.01]
  - - [1, 1728, 1, 16]
    - [37, 0.01]
  - - [16, 1728, 1, 1]
    - [35, 0.01]
  - - [1728, 16, 1, 1]
    - [52, 0.01]
  - - [1, 448, 1, 64]
    - [22, 0.01]
  - - [1, 1792, 1, 16]
    - [33, 0.01]
  - - [16, 1792, 1, 1]
    - [35, 0.01]
  - - [1, 1856, 1, 16]
    - [37, 0.01]
  - - [16, 1856, 1, 1]
    - [35, 0.01]
  - - [16, 1984, 1, 1]
    - [33, 0.01]
  - - [1984, 1, 1, 16]
    - [29, 0.01]
  - - [1, 32, 1, 1024]
    - [24, 0.0]
  - - [1, 512, 1, 64]
    - [23, 0.01]
  - - [1, 2048, 1, 16]
    - [33, 0.01]
  - - [2, 8, 1, 2048]
    - [13, 0.0]
  - - [4, 2, 1, 4096]
    - [22, 0.0]
  - - [4, 4, 1, 2048]
    - [23, 0.0]
  - - [8, 2, 1, 2048]
    - [23, 0.0]
  - - [16, 2048, 1, 1]
    - [33, 0.01]
  - - [32, 32, 1, 32]
    - [34, 0.01]
  - - [2048, 1, 1, 16]
    - [28, 0.01]
  - - [1, 2112, 1, 16]
    - [33, 0.01]
  - - [16, 2112, 1, 1]
    - [41, 0.01]
  - - [2112, 1, 1, 16]
    - [27, 0.01]
  - - [1, 576, 1, 64]
    - [37, 0.01]
  - - [1, 2304, 1, 16]
    - [33, 0.01]
  - - [16, 2304, 1, 1]
    - [35, 0.01]
  - - [1, 2368, 1, 16]
    - [27, 0.01]
  - - [16, 2368, 1, 1]
    - [41, 0.01]
  - - [2368, 1, 1, 16]
    - [27, 0.01]
  - - [1, 10, 1, 4096]
    - [23, 0.0]
  - - [1, 640, 1, 64]
    - [23, 0.01]
  - - [1, 2560, 1, 16]
    - [21, 0.01]
  - - [10, 1, 1, 4096]
    - [24, 0.0]
  - - [10, 2, 1, 2048]
    - [24, 0.0]
  - - [16, 2560, 1, 1]
    - [27, 0.01]
  - - [32, 1280, 1, 1]
    - [32, 0.01]
  - - [128, 320, 1, 1]
    - [46, 0.01]
  - - [320, 128, 1, 1]
    - [39, 0.01]
  - - [1, 2624, 1, 16]
    - [33, 0.01]
  - - [16, 2624, 1, 1]
    - [33, 0.01]
  - - [2624, 1, 1, 16]
    - [27, 0.01]
  - - [32, 1344, 1, 1]
    - [52, 0.01]
  - - [1, 2816, 1, 16]
    - [21, 0.01]
  - - [16, 2816, 1, 1]
    - [21, 0.01]
  - - [64, 704, 1, 1]
    - [39, 0.01]
  - - [1, 2880, 1, 16]
    - [33, 0.01]
  - - [16, 2880, 1, 1]
    - [33, 0.01]
  - - [2880, 1, 1, 16]
    - [42, 0.01]
  - - [32, 1472, 1, 1]
    - [52, 0.01]
  - - [1, 3072, 1, 16]
    - [35, 0.01]
  - - [2, 6, 1, 4096]
    - [24, 0.0]
  - - [4, 6, 1, 2048]
    - [23, 0.0]
  - - [6, 4, 1, 2048]
    - [24, 0.0]
  - - [12, 1, 1, 4096]
    - [13, 0.0]
  - - [12, 2, 1, 2048]
    - [13, 0.0]
  - - [16, 192, 1, 16]
    - [27, 0.01]
  - - [16, 3072, 1, 1]
    - [33, 0.01]
  - - [32, 1536, 1, 1]
    - [52, 0.01]
  - - [64, 768, 1, 1]
    - [46, 0.01]
  - - [128, 384, 1, 1]
    - [46, 0.01]
  - - [192, 1, 1, 256]
    - [23, 0.01]
  - - [192, 16, 1, 16]
    - [27, 0.01]
  - - [192, 256, 1, 1]
    - [39, 0.01]
  - - [256, 192, 1, 1]
    - [46, 0.01]
  - - [384, 128, 1, 1]
    - [46, 0.01]
  - - [3072, 1, 1, 16]
    - [27, 0.01]
  - - [1, 3136, 1, 16]
    - [33, 0.01]
  - - [3136, 1, 1, 16]
    - [26, 0.01]
  - - [32, 1600, 1, 1]
    - [32, 0.01]
  - - [1, 3328, 1, 16]
    - [33, 0.01]
  - - [64, 832, 1, 1]
    - [39, 0.01]
  - - [832, 1, 1, 64]
    - [22, 0.01]
  - - [1, 3392, 1, 16]
    - [44, 0.01]
  - - [32, 1728, 1, 1]
    - [32, 0.01]
  - - [4, 14, 1, 1024]
    - [13, 0.0]
  - - [14, 1, 1, 4096]
    - [24, 0.0]
  - - [14, 2, 1, 2048]
    - [13, 0.0]
  - - [16, 3584, 1, 1]
    - [51, 0.01]
  - - [32, 1792, 1, 1]
    - [32, 0.01]
  - - [64, 896, 1, 1]
    - [46, 0.02]
  - - [128, 448, 1, 1]
    - [39, 0.02]
  - - [448, 128, 1, 1]
    - [46, 0.02]
  - - [896, 1, 1, 64]
    - [42, 0.01]
  - - [16, 3648, 1, 1]
    - [32, 0.01]
  - - [3648, 1, 1, 16]
    - [54, 0.01]
  - - [32, 1856, 1, 1]
    - [32, 0.02]
  - - [16, 3840, 1, 1]
    - [32, 0.02]
  - - [64, 960, 1, 1]
    - [39, 0.02]
  - - [192, 320, 1, 1]
    - [46, 0.02]
  - - [320, 192, 1, 1]
    - [46, 0.02]
  - - [960, 1, 1, 64]
    - [29, 0.01]
  - - [16, 3904, 1, 1]
    - [51, 0.02]
  - - [3904, 1, 1, 16]
    - [54, 0.02]
  - - [32, 1984, 1, 1]
    - [32, 0.02]
  - - [1, 32, 1, 2048]
    - [24, 0.0]
  - - [4, 4, 1, 4096]
    - [24, 0.0]
  - - [4, 16, 1, 1024]
    - [13, 0.0]
  - - [8, 4, 1, 2048]
    - [23, 0.0]
  - - [16, 1, 1, 4096]
    - [24, 0.0]
  - - [16, 2, 1, 2048]
    - [22, 0.0]
  - - [16, 128, 1, 32]
    - [49, 0.02]
  - - [16, 256, 1, 16]
    - [27, 0.02]
  - - [16, 4096, 1, 1]
    - [32, 0.02]
  - - [32, 2048, 1, 1]
    - [32, 0.02]
  - - [64, 16, 1, 64]
    - [22, 0.01]
  - - [64, 32, 1, 32]
    - [34, 0.02]
  - - [64, 64, 1, 16]
    - [27, 0.02]
  - - [64, 1024, 1, 1]
    - [46, 0.02]
  - - [256, 16, 1, 16]
    - [27, 0.02]
  - - [256, 256, 1, 1]
    - [46, 0.02]
  - - [512, 128, 1, 1]
    - [46, 0.02]
  - - [1024, 1, 1, 64]
    - [22, 0.01]
  - - [4096, 1, 1, 16]
    - [54, 0.02]
  - - [32, 2112, 1, 1]
    - [52, 0.02]
  - - [64, 1088, 1, 1]
    - [39, 0.02]
  - - [1088, 64, 1, 1]
    - [46, 0.02]
  - - [6, 12, 1, 1024]
    - [23, 0.0]
  - - [32, 2304, 1, 1]
    - [52, 0.02]
  - - [128, 576, 1, 1]
    - [46, 0.02]
  - - [192, 384, 1, 1]
    - [46, 0.02]
  - - [576, 128, 1, 1]
    - [46, 0.02]
  - - [32, 2368, 1, 1]
    - [52, 0.02]
  - - [1, 1216, 1, 64]
    - [33, 0.02]
  - - [64, 1216, 1, 1]
    - [46, 0.02]
  - - [8, 10, 1, 1024]
    - [23, 0.0]
  - - [16, 320, 1, 16]
    - [27, 0.02]
  - - [32, 2560, 1, 1]
    - [52, 0.02]
  - - [128, 640, 1, 1]
    - [46, 0.02]
  - - [256, 320, 1, 1]
    - [39, 0.02]
  - - [320, 1, 1, 256]
    - [13, 0.01]
  - - [320, 16, 1, 16]
    - [27, 0.02]
  - - [320, 256, 1, 1]
    - [46, 0.02]
  - - [640, 128, 1, 1]
    - [46, 0.02]
  - - [32, 2624, 1, 1]
    - [57, 0.02]
  - - [1, 1344, 1, 64]
    - [33, 0.02]
  - - [6, 14, 1, 1024]
    - [13, 0.0]
  - - [64, 1344, 1, 1]
    - [39, 0.02]
  - - [192, 448, 1, 1]
    - [46, 0.02]
  - - [448, 192, 1, 1]
    - [46, 0.02]
  - - [32, 2816, 1, 1]
    - [57, 0.02]
  - - [128, 704, 1, 1]
    - [46, 0.02]
  - - [704, 128, 1, 1]
    - [46, 0.02]
  - - [1, 2880, 1, 32]
    - [56, 0.02]
  - - [32, 2880, 1, 1]
    - [52, 0.02]
  - - [2880, 1, 1, 32]
    - [34, 0.02]
  - - [1, 1472, 1, 64]
    - [24, 0.02]
  - - [64, 1472, 1, 1]
    - [46, 0.02]
  - - [1, 192, 1, 512]
    - [13, 0.01]
  - - [1, 3072, 1, 32]
    - [37, 0.02]
  - - [4, 6, 1, 4096]
    - [22, 0.0]
  - - [6, 4, 1, 4096]
    - [24, 0.0]
  - - [6, 16, 1, 1024]
    - [24, 0.01]
  - - [8, 12, 1, 1024]
    - [24, 0.01]
  - - [12, 8, 1, 1024]
    - [24, 0.01]
  - - [32, 192, 1, 16]
    - [27, 0.03]
  - - [32, 3072, 1, 1]
    - [52, 0.02]
  - - [128, 768, 1, 1]
    - [39, 0.02]
  - - [192, 512, 1, 1]
    - [46, 0.03]
  - - [256, 384, 1, 1]
    - [39, 0.02]
  - - [384, 1, 1, 256]
    - [22, 0.01]
  - - [384, 16, 1, 16]
    - [29, 0.03]
  - - [384, 256, 1, 1]
    - [46, 0.03]
  - - [512, 192, 1, 1]
    - [46, 0.02]
  - - [768, 128, 1, 1]
    - [52, 0.03]
  - - [3072, 1, 1, 32]
    - [34, 0.02]
  - - [1, 3136, 1, 32]
    - [21, 0.02]
  - - [32, 3136, 1, 1]
    - [32, 0.03]
  - - [3136, 1, 1, 32]
    - [28, 0.02]
  - - [1, 1600, 1, 64]
    - [33, 0.02]
  - - [10, 10, 1, 1024]
    - [24, 0.01]
  - - [64, 1600, 1, 1]
    - [39, 0.03]
  - - [320, 320, 1, 1]
    - [39, 0.03]
  - - [1, 3328, 1, 32]
    - [21, 0.02]
  - - [128, 832, 1, 1]
    - [46, 0.03]
  - - [832, 128, 1, 1]
    - [46, 0.03]
  - - [1, 3392, 1, 32]
    - [21, 0.02]
  - - [3392, 1, 1, 32]
    - [34, 0.02]
  - - [3392, 32, 1, 1]
    - [46, 0.03]
  - - [1, 1728, 1, 64]
    - [24, 0.02]
  - - [64, 1728, 1, 1]
    - [46, 0.03]
  - - [192, 576, 1, 1]
    - [46, 0.03]
  - - [576, 192, 1, 1]
    - [46, 0.03]
  - - [1, 3584, 1, 32]
    - [33, 0.02]
  - - [8, 14, 1, 1024]
    - [13, 0.01]
  - - [448, 1, 1, 256]
    - [22, 0.02]
  - - [448, 16, 1, 16]
    - [27, 0.03]
  - - [448, 256, 1, 1]
    - [46, 0.03]
  - - [1, 3648, 1, 32]
    - [37, 0.02]
  - - [3648, 1, 1, 32]
    - [27, 0.03]
  - - [3648, 32, 1, 1]
    - [46, 0.03]
  - - [1, 1856, 1, 64]
    - [24, 0.02]
  - - [64, 1856, 1, 1]
    - [46, 0.03]
  - - [1856, 1, 1, 64]
    - [27, 0.02]
  - - [1, 3840, 1, 32]
    - [21, 0.03]
  - - [10, 12, 1, 1024]
    - [24, 0.01]
  - - [128, 960, 1, 1]
    - [46, 0.03]
  - - [384, 320, 1, 1]
    - [39, 0.03]
  - - [640, 192, 1, 1]
    - [46, 0.03]
  - - [1, 3904, 1, 32]
    - [21, 0.03]
  - - [3904, 1, 1, 32]
    - [28, 0.03]
  - - [3904, 32, 1, 1]
    - [46, 0.03]
  - - [1, 1984, 1, 64]
    - [37, 0.02]
  - - [64, 1984, 1, 1]
    - [46, 0.03]
  - - [1984, 1, 1, 64]
    - [42, 0.02]
  - - [1, 512, 1, 256]
    - [24, 0.02]
  - - [1, 2048, 1, 64]
    - [37, 0.03]
  - - [1, 4096, 1, 32]
    - [33, 0.03]
  - - [4, 8, 1, 4096]
    - [24, 0.0]
  - - [8, 4, 1, 4096]
    - [24, 0.0]
  - - [8, 16, 1, 1024]
    - [23, 0.01]
  - - [16, 64, 1, 128]
    - [24, 0.02]
  - - [32, 1, 1, 4096]
    - [24, 0.0]
  - - [32, 16, 1, 256]
    - [22, 0.02]
  - - [32, 64, 1, 64]
    - [22, 0.03]
  - - [32, 128, 1, 32]
    - [34, 0.03]
  - - [64, 128, 1, 16]
    - [27, 0.04]
  - - [64, 2048, 1, 1]
    - [39, 0.03]
  - - [128, 16, 1, 64]
    - [29, 0.03]
  - - [128, 32, 1, 32]
    - [34, 0.03]
  - - [128, 1024, 1, 1]
    - [46, 0.03]
  - - [256, 1, 1, 512]
    - [22, 0.01]
  - - [256, 16, 1, 32]
    - [34, 0.03]
  - - [512, 1, 1, 256]
    - [24, 0.02]
  - - [512, 16, 1, 16]
    - [42, 0.04]
  - - [512, 256, 1, 1]
    - [46, 0.03]
  - - [4096, 1, 1, 32]
    - [66, 0.03]
  - - [4096, 32, 1, 1]
    - [46, 0.03]
  - - [64, 2112, 1, 1]
    - [46, 0.03]
  - - [2112, 1, 1, 64]
    - [27, 0.03]
  - - [1, 576, 1, 256]
    - [23, 0.02]
  - - [6, 6, 1, 4096]
    - [22, 0.0]
  - - [192, 768, 1, 1]
    - [46, 0.04]
  - - [576, 1, 1, 256]
    - [13, 0.02]
  - - [576, 16, 1, 16]
    - [29, 0.04]
  - - [576, 256, 1, 1]
    - [46, 0.04]
  - - [1, 2368, 1, 64]
    - [33, 0.03]
  - - [2368, 1, 1, 64]
    - [27, 0.03]
  - - [192, 832, 1, 1]
    - [46, 0.04]
  - - [832, 192, 1, 1]
    - [46, 0.04]
  - - [1, 320, 1, 512]
    - [24, 0.01]
  - - [1, 640, 1, 256]
    - [24, 0.02]
  - - [4, 10, 1, 4096]
    - [23, 0.0]
  - - [320, 1, 1, 512]
    - [23, 0.01]
  - - [320, 16, 1, 32]
    - [34, 0.04]
  - - [320, 32, 1, 16]
    - [29, 0.04]
  - - [512, 320, 1, 1]
    - [46, 0.04]
  - - [640, 1, 1, 256]
    - [13, 0.02]
  - - [640, 16, 1, 16]
    - [29, 0.04]
  - - [640, 256, 1, 1]
    - [46, 0.04]
  - - [1, 2624, 1, 64]
    - [35, 0.03]
  - - [2624, 1, 1, 64]
    - [42, 0.03]
  - - [192, 896, 1, 1]
    - [46, 0.04]
  - - [448, 384, 1, 1]
    - [46, 0.04]
  - - [896, 192, 1, 1]
    - [46, 0.04]
  - - [1, 704, 1, 256]
    - [23, 0.02]
  - - [704, 1, 1, 256]
    - [13, 0.02]
  - - [704, 256, 1, 1]
    - [46, 0.04]
  - - [1, 2880, 1, 64]
    - [33, 0.03]
  - - [192, 960, 1, 1]
    - [39, 0.05]
  - - [320, 576, 1, 1]
    - [46, 0.05]
  - - [576, 320, 1, 1]
    - [46, 0.05]
  - - [960, 192, 1, 1]
    - [46, 0.05]
  - - [2880, 1, 1, 64]
    - [27, 0.04]
  - - [1, 384, 1, 512]
    - [13, 0.02]
  - - [1, 768, 1, 256]
    - [24, 0.03]
  - - [4, 12, 1, 4096]
    - [23, 0.0]
  - - [6, 32, 1, 1024]
    - [24, 0.01]
  - - [12, 16, 1, 1024]
    - [13, 0.01]
  - - [16, 192, 1, 64]
    - [22, 0.04]
  - - [16, 384, 1, 32]
    - [49, 0.05]
  - - [16, 768, 1, 16]
    - [33, 0.05]
  - - [32, 6, 1, 1024]
    - [24, 0.01]
  - - [32, 192, 1, 32]
    - [34, 0.05]
  - - [192, 32, 1, 32]
    - [34, 0.05]
  - - [192, 64, 1, 16]
    - [29, 0.05]
  - - [192, 1024, 1, 1]
    - [46, 0.05]
  - - [384, 1, 1, 512]
    - [13, 0.02]
  - - [384, 32, 1, 16]
    - [29, 0.05]
  - - [384, 512, 1, 1]
    - [46, 0.05]
  - - [512, 384, 1, 1]
    - [46, 0.05]
  - - [768, 256, 1, 1]
    - [46, 0.05]
  - - [1024, 192, 1, 1]
    - [46, 0.05]
  - - [1, 3136, 1, 64]
    - [21, 0.03]
  - - [14, 14, 1, 1024]
    - [13, 0.01]
  - - [448, 448, 1, 1]
    - [46, 0.05]
  - - [320, 640, 1, 1]
    - [46, 0.05]
  - - [640, 320, 1, 1]
    - [46, 0.05]
  - - [192, 1088, 1, 1]
    - [46, 0.05]
  - - [1088, 192, 1, 1]
    - [46, 0.05]
  - - [16, 832, 1, 16]
    - [33, 0.06]
  - - [256, 832, 1, 1]
    - [46, 0.05]
  - - [832, 256, 1, 1]
    - [39, 0.05]
  - - [1, 3392, 1, 64]
    - [21, 0.04]
  - - [384, 576, 1, 1]
    - [46, 0.05]
  - - [576, 384, 1, 1]
    - [39, 0.05]
  - - [320, 704, 1, 1]
    - [46, 0.05]
  - - [704, 320, 1, 1]
    - [46, 0.05]
  - - [1, 448, 1, 512]
    - [24, 0.02]
  - - [1, 896, 1, 256]
    - [24, 0.03]
  - - [4, 14, 1, 4096]
    - [13, 0.0]
  - - [14, 16, 1, 1024]
    - [24, 0.01]
  - - [16, 14, 1, 1024]
    - [13, 0.01]
  - - [16, 448, 1, 32]
    - [34, 0.06]
  - - [16, 896, 1, 16]
    - [33, 0.06]
  - - [256, 896, 1, 1]
    - [46, 0.05]
  - - [448, 1, 1, 512]
    - [13, 0.02]
  - - [448, 16, 1, 32]
    - [34, 0.06]
  - - [448, 512, 1, 1]
    - [46, 0.05]
  - - [512, 448, 1, 1]
    - [46, 0.05]
  - - [896, 256, 1, 1]
    - [46, 0.05]
  - - [1, 3648, 1, 64]
    - [37, 0.04]
  - - [192, 1216, 1, 1]
    - [46, 0.05]
  - - [1216, 192, 1, 1]
    - [39, 0.06]
  - - [1, 960, 1, 256]
    - [24, 0.03]
  - - [6, 10, 1, 4096]
    - [22, 0.0]
  - - [10, 6, 1, 4096]
    - [22, 0.0]
  - - [16, 960, 1, 16]
    - [33, 0.06]
  - - [256, 960, 1, 1]
    - [51, 0.05]
  - - [320, 768, 1, 1]
    - [46, 0.06]
  - - [384, 640, 1, 1]
    - [46, 0.06]
  - - [640, 384, 1, 1]
    - [46, 0.06]
  - - [768, 320, 1, 1]
    - [30, 0.05]
  - - [960, 256, 1, 1]
    - [46, 0.06]
  - - [192, 1344, 1, 1]
    - [39, 0.06]
  - - [448, 576, 1, 1]
    - [46, 0.06]
  - - [576, 448, 1, 1]
    - [46, 0.06]
  - - [1344, 192, 1, 1]
    - [46, 0.06]
  - - [1, 1024, 1, 256]
    - [24, 0.04]
  - - [4, 16, 1, 4096]
    - [13, 0.0]
  - - [8, 8, 1, 4096]
    - [13, 0.0]
  - - [8, 16, 1, 2048]
    - [13, 0.01]
  - - [16, 4, 1, 4096]
    - [22, 0.0]
  - - [16, 8, 1, 2048]
    - [22, 0.01]
  - - [16, 16, 1, 1024]
    - [13, 0.01]
  - - [16, 64, 1, 256]
    - [23, 0.04]
  - - [16, 256, 1, 64]
    - [49, 0.06]
  - - [16, 512, 1, 32]
    - [24, 0.07]
  - - [16, 1024, 1, 16]
    - [33, 0.07]
  - - [32, 512, 1, 16]
    - [33, 0.07]
  - - [64, 256, 1, 16]
    - [29, 0.07]
  - - [128, 32, 1, 64]
    - [23, 0.06]
  - - [128, 64, 1, 32]
    - [24, 0.07]
  - - [128, 128, 1, 16]
    - [8, 0.07]
  - - [128, 2048, 1, 1]
    - [46, 0.06]
  - - [256, 1, 1, 1024]
    - [24, 0.01]
  - - [256, 32, 1, 32]
    - [34, 0.06]
  - - [256, 1024, 1, 1]
    - [9, 0.06]
  - - [512, 1, 1, 512]
    - [22, 0.02]
  - - [512, 16, 1, 32]
    - [34, 0.06]
  - - [512, 512, 1, 1]
    - [9, 0.06]
  - - [1024, 256, 1, 1]
    - [9, 0.06]
  - - [320, 832, 1, 1]
    - [30, 0.06]
  - - [384, 704, 1, 1]
    - [46, 0.06]
  - - [704, 384, 1, 1]
    - [46, 0.06]
  - - [1, 1088, 1, 256]
    - [33, 0.04]
  - - [16, 1088, 1, 16]
    - [33, 0.07]
  - - [192, 1472, 1, 1]
    - [39, 0.06]
  - - [1472, 192, 1, 1]
    - [46, 0.06]
  - - [320, 896, 1, 1]
    - [46, 0.06]
  - - [448, 640, 1, 1]
    - [46, 0.06]
  - - [640, 448, 1, 1]
    - [39, 0.06]
  - - [896, 320, 1, 1]
    - [46, 0.06]
  - - [1, 576, 1, 512]
    - [23, 0.03]
  - - [6, 12, 1, 4096]
    - [22, 0.0]
  - - [12, 6, 1, 4096]
    - [22, 0.0]
  - - [32, 576, 1, 16]
    - [27, 0.07]
  - - [384, 768, 1, 1]
    - [46, 0.06]
  - - [512, 576, 1, 1]
    - [32, 0.06]
  - - [576, 16, 1, 32]
    - [29, 0.07]
  - - [576, 512, 1, 1]
    - [46, 0.06]
  - - [768, 384, 1, 1]
    - [57, 0.06]
  - - [192, 1600, 1, 1]
    - [39, 0.07]
  - - [320, 960, 1, 1]
    - [30, 0.07]
  - - [960, 320, 1, 1]
    - [46, 0.07]
  - - [1600, 192, 1, 1]
    - [39, 0.07]
  - - [1, 1216, 1, 256]
    - [37, 0.04]
  - - [16, 1216, 1, 16]
    - [37, 0.08]
  - - [448, 704, 1, 1]
    - [9, 0.07]
  - - [704, 448, 1, 1]
    - [46, 0.07]
  - - [384, 832, 1, 1]
    - [39, 0.07]
  - - [832, 384, 1, 1]
    - [39, 0.07]
  - - [1, 640, 1, 512]
    - [23, 0.03]
  - - [8, 10, 1, 4096]
    - [22, 0.01]
  - - [10, 8, 1, 4096]
    - [22, 0.01]
  - - [32, 640, 1, 16]
    - [27, 0.08]
  - - [64, 320, 1, 16]
    - [27, 0.08]
  - - [320, 1, 1, 1024]
    - [24, 0.02]
  - - [320, 1024, 1, 1]
    - [39, 0.07]
  - - [640, 16, 1, 32]
    - [13, 0.08]
  - - [640, 512, 1, 1]
    - [39, 0.07]
  - - [1024, 320, 1, 1]
    - [30, 0.07]
  - - [192, 1728, 1, 1]
    - [39, 0.07]
  - - [576, 576, 1, 1]
    - [39, 0.07]
  - - [1728, 192, 1, 1]
    - [9, 0.07]
  - - [1, 1344, 1, 256]
    - [37, 0.04]
  - - [14, 6, 1, 4096]
    - [24, 0.01]
  - - [16, 1344, 1, 16]
    - [27, 0.09]
  - - [384, 896, 1, 1]
    - [46, 0.07]
  - - [448, 768, 1, 1]
    - [39, 0.07]
  - - [768, 448, 1, 1]
    - [46, 0.07]
  - - [896, 384, 1, 1]
    - [46, 0.07]
  - - [320, 1088, 1, 1]
    - [39, 0.08]
  - - [1088, 320, 1, 1]
    - [39, 0.08]
  - - [192, 1856, 1, 1]
    - [39, 0.08]
  - - [1856, 192, 1, 1]
    - [39, 0.08]
  - - [1, 704, 1, 512]
    - [24, 0.03]
  - - [32, 704, 1, 16]
    - [27, 0.09]
  - - [512, 704, 1, 1]
    - [39, 0.07]
  - - [704, 16, 1, 32]
    - [29, 0.09]
  - - [704, 512, 1, 1]
    - [39, 0.08]
  - - [384, 960, 1, 1]
    - [46, 0.08]
  - - [576, 640, 1, 1]
    - [39, 0.08]
  - - [640, 576, 1, 1]
    - [39, 0.08]
  - - [960, 384, 1, 1]
    - [9, 0.08]
  - - [448, 832, 1, 1]
    - [39, 0.08]
  - - [832, 448, 1, 1]
    - [39, 0.08]
  - - [16, 1472, 1, 16]
    - [33, 0.1]
  - - [1472, 1, 1, 256]
    - [48, 0.05]
  - - [192, 1984, 1, 1]
    - [46, 0.08]
  - - [1984, 192, 1, 1]
    - [39, 0.08]
  - - [320, 1216, 1, 1]
    - [46, 0.08]
  - - [1216, 320, 1, 1]
    - [39, 0.08]
  - - [1, 128, 1, 3072]
    - [13, 0.01]
  - - [1, 768, 1, 512]
    - [24, 0.03]
  - - [6, 32, 1, 2048]
    - [13, 0.01]
  - - [16, 6, 1, 4096]
    - [23, 0.01]
  - - [16, 1536, 1, 16]
    - [33, 0.1]
  - - [32, 6, 1, 2048]
    - [24, 0.01]
  - - [32, 384, 1, 32]
    - [22, 0.1]
  - - [32, 768, 1, 16]
    - [29, 0.1]
  - - [64, 384, 1, 16]
    - [27, 0.1]
  - - [192, 64, 1, 32]
    - [22, 0.1]
  - - [192, 128, 1, 16]
    - [31, 0.1]
  - - [384, 32, 1, 32]
    - [29, 0.1]
  - - [384, 64, 1, 16]
    - [31, 0.1]
  - - [384, 1024, 1, 1]
    - [39, 0.09]
  - - [512, 768, 1, 1]
    - [46, 0.08]
  - - [768, 16, 1, 32]
    - [22, 0.1]
  - - [1024, 384, 1, 1]
    - [46, 0.08]
  - - [1536, 1, 1, 256]
    - [48, 0.05]
  - - [1536, 256, 1, 1]
    - [46, 0.08]
  - - [448, 896, 1, 1]
    - [46, 0.08]
  - - [896, 448, 1, 1]
    - [46, 0.08]
  - - [576, 704, 1, 1]
    - [46, 0.08]
  - - [704, 576, 1, 1]
    - [46, 0.08]
  - - [16, 1600, 1, 16]
    - [33, 0.11]
  - - [640, 640, 1, 1]
    - [46, 0.08]
  - - [1600, 1, 1, 256]
    - [22, 0.05]
  - - [1, 832, 1, 512]
    - [24, 0.04]
  - - [16, 832, 1, 32]
    - [24, 0.1]
  - - [32, 832, 1, 16]
    - [29, 0.11]
  - - [512, 832, 1, 1]
    - [46, 0.08]
  - - [832, 512, 1, 1]
    - [46, 0.08]
  - - [320, 1344, 1, 1]
    - [39, 0.08]
  - - [448, 960, 1, 1]
    - [46, 0.08]
  - - [960, 448, 1, 1]
    - [46, 0.08]
  - - [1344, 320, 1, 1]
    - [46, 0.09]
  - - [16, 1728, 1, 16]
    - [33, 0.11]
  - - [576, 768, 1, 1]
    - [39, 0.08]
  - - [768, 576, 1, 1]
    - [39, 0.08]
  - - [1728, 1, 1, 256]
    - [22, 0.06]
  - - [640, 704, 1, 1]
    - [39, 0.09]
  - - [704, 640, 1, 1]
    - [39, 0.09]
  - - [16, 896, 1, 32]
    - [24, 0.11]
  - - [16, 1792, 1, 16]
    - [35, 0.12]
  - - [32, 448, 1, 32]
    - [13, 0.12]
  - - [32, 896, 1, 16]
    - [33, 0.12]
  - - [64, 448, 1, 16]
    - [33, 0.12]
  - - [448, 32, 1, 32]
    - [22, 0.12]
  - - [448, 64, 1, 16]
    - [33, 0.12]
  - - [448, 1024, 1, 1]
    - [46, 0.09]
  - - [512, 896, 1, 1]
    - [46, 0.09]
  - - [896, 512, 1, 1]
    - [46, 0.09]
  - - [1024, 448, 1, 1]
    - [39, 0.09]
  - - [320, 1472, 1, 1]
    - [46, 0.09]
  - - [1472, 320, 1, 1]
    - [46, 0.09]
  - - [16, 1856, 1, 16]
    - [33, 0.12]
  - - [1856, 1, 1, 256]
    - [22, 0.06]
  - - [576, 832, 1, 1]
    - [39, 0.09]
  - - [832, 576, 1, 1]
    - [46, 0.09]
  - - [448, 1088, 1, 1]
    - [46, 0.09]
  - - [1088, 448, 1, 1]
    - [46, 0.09]
  - - [1, 960, 1, 512]
    - [23, 0.04]
  - - [16, 960, 1, 32]
    - [24, 0.12]
  - - [32, 960, 1, 16]
    - [8, 0.12]
  - - [512, 960, 1, 1]
    - [39, 0.09]
  - - [640, 768, 1, 1]
    - [39, 0.09]
  - - [768, 640, 1, 1]
    - [39, 0.09]
  - - [960, 32, 1, 16]
    - [29, 0.13]
  - - [960, 512, 1, 1]
    - [46, 0.09]
  - - [704, 704, 1, 1]
    - [46, 0.09]
  - - [16, 1984, 1, 16]
    - [33, 0.13]
  - - [1984, 1, 1, 256]
    - [27, 0.06]
  - - [320, 1600, 1, 1]
    - [46, 0.09]
  - - [1600, 320, 1, 1]
    - [46, 0.1]
  - - [576, 896, 1, 1]
    - [46, 0.1]
  - - [896, 576, 1, 1]
    - [46, 0.09]
  - - [1, 1024, 1, 512]
    - [24, 0.05]
  - - [16, 64, 1, 512]
    - [24, 0.05]
  - - [16, 1024, 1, 32]
    - [24, 0.13]
  - - [16, 2048, 1, 16]
    - [37, 0.13]
  - - [32, 512, 1, 32]
    - [22, 0.13]
  - - [64, 32, 1, 256]
    - [24, 0.07]
  - - [64, 128, 1, 64]
    - [13, 0.11]
  - - [64, 256, 1, 32]
    - [29, 0.13]
  - - [64, 512, 1, 16]
    - [33, 0.14]
  - - [128, 4096, 1, 1]
    - [46, 0.1]
  - - [256, 2048, 1, 1]
    - [46, 0.1]
  - - [512, 32, 1, 32]
    - [13, 0.13]
  - - [512, 64, 1, 16]
    - [29, 0.13]
  - - [512, 1024, 1, 1]
    - [46, 0.09]
  - - [1024, 32, 1, 16]
    - [29, 0.13]
  - - [1024, 512, 1, 1]
    - [39, 0.1]
  - - [2048, 16, 1, 16]
    - [29, 0.13]
  - - [640, 832, 1, 1]
    - [46, 0.1]
  - - [832, 640, 1, 1]
    - [39, 0.1]
  - - [16, 2112, 1, 16]
    - [33, 0.13]
  - - [704, 768, 1, 1]
    - [39, 0.1]
  - - [768, 704, 1, 1]
    - [46, 0.1]
  - - [2112, 1, 1, 256]
    - [27, 0.07]
  - - [2112, 16, 1, 16]
    - [54, 0.14]
  - - [448, 1216, 1, 1]
    - [39, 0.1]
  - - [1216, 448, 1, 1]
    - [39, 0.1]
  - - [320, 1728, 1, 1]
    - [46, 0.1]
  - - [576, 960, 1, 1]
    - [39, 0.1]
  - - [960, 576, 1, 1]
    - [46, 0.1]
  - - [1728, 320, 1, 1]
    - [46, 0.1]
  - - [1, 1088, 1, 512]
    - [33, 0.04]
  - - [16, 1088, 1, 32]
    - [24, 0.13]
  - - [1088, 32, 1, 16]
    - [9, 0.14]
  - - [640, 896, 1, 1]
    - [39, 0.1]
  - - [896, 640, 1, 1]
    - [39, 0.1]
  - - [704, 832, 1, 1]
    - [46, 0.1]
  - - [832, 704, 1, 1]
    - [39, 0.1]
  - - [32, 576, 1, 32]
    - [24, 0.14]
  - - [64, 576, 1, 16]
    - [46, 0.15]
  - - [576, 64, 1, 16]
    - [54, 0.15]
  - - [576, 1024, 1, 1]
    - [39, 0.11]
  - - [768, 768, 1, 1]
    - [39, 0.1]
  - - [1024, 576, 1, 1]
    - [46, 0.1]
  - - [448, 1344, 1, 1]
    - [46, 0.1]
  - - [1344, 448, 1, 1]
    - [46, 0.1]
  - - [2368, 1, 1, 256]
    - [54, 0.07]
  - - [2368, 16, 1, 16]
    - [28, 0.15]
  - - [640, 960, 1, 1]
    - [46, 0.11]
  - - [960, 640, 1, 1]
    - [39, 0.11]
  - - [1, 1216, 1, 512]
    - [33, 0.05]
  - - [16, 1216, 1, 32]
    - [24, 0.15]
  - - [1216, 32, 1, 16]
    - [9, 0.16]
  - - [576, 1088, 1, 1]
    - [39, 0.11]
  - - [1088, 576, 1, 1]
    - [46, 0.11]
  - - [704, 896, 1, 1]
    - [46, 0.11]
  - - [896, 704, 1, 1]
    - [46, 0.11]
  - - [320, 1984, 1, 1]
    - [39, 0.11]
  - - [768, 832, 1, 1]
    - [39, 0.11]
  - - [832, 768, 1, 1]
    - [39, 0.11]
  - - [1, 640, 1, 1024]
    - [24, 0.03]
  - - [10, 32, 1, 2048]
    - [13, 0.02]
  - - [16, 1280, 1, 32]
    - [24, 0.15]
  - - [32, 10, 1, 2048]
    - [13, 0.02]
  - - [64, 320, 1, 32]
    - [49, 0.15]
  - - [64, 640, 1, 16]
    - [46, 0.16]
  - - [320, 128, 1, 16]
    - [9, 0.17]
  - - [640, 64, 1, 16]
    - [39, 0.17]
  - - [640, 1024, 1, 1]
    - [46, 0.11]
  - - [1024, 640, 1, 1]
    - [39, 0.11]
  - - [448, 1472, 1, 1]
    - [46, 0.11]
  - - [2624, 1, 1, 256]
    - [42, 0.08]
  - - [2624, 16, 1, 16]
    - [25, 0.16]
  - - [320, 2112, 1, 1]
    - [39, 0.11]
  - - [704, 960, 1, 1]
    - [46, 0.11]
  - - [960, 704, 1, 1]
    - [39, 0.11]
  - - [1, 1344, 1, 512]
    - [33, 0.05]
  - - [16, 1344, 1, 32]
    - [24, 0.16]
  - - [768, 896, 1, 1]
    - [46, 0.11]
  - - [896, 768, 1, 1]
    - [39, 0.11]
  - - [1344, 32, 1, 16]
    - [31, 0.17]
  - - [832, 832, 1, 1]
    - [46, 0.11]
  - - [576, 1216, 1, 1]
    - [39, 0.12]
  - - [1216, 576, 1, 1]
    - [39, 0.12]
  - - [448, 1600, 1, 1]
    - [39, 0.12]
  - - [1, 704, 1, 1024]
    - [24, 0.04]
  - - [64, 704, 1, 16]
    - [9, 0.18]
  - - [704, 1, 1, 1024]
    - [13, 0.04]
  - - [704, 64, 1, 16]
    - [9, 0.18]
  - - [704, 1024, 1, 1]
    - [39, 0.12]
  - - [1024, 704, 1, 1]
    - [39, 0.12]
  - - [768, 960, 1, 1]
    - [39, 0.12]
  - - [960, 768, 1, 1]
    - [46, 0.12]
  - - [2880, 1, 1, 256]
    - [42, 0.09]
  - - [2880, 16, 1, 16]
    - [31, 0.18]
  - - [832, 896, 1, 1]
    - [46, 0.12]
  - - [896, 832, 1, 1]
    - [46, 0.12]
  - - [1, 1472, 1, 512]
    - [37, 0.06]
  - - [1472, 32, 1, 16]
    - [46, 0.19]
  - - [320, 2368, 1, 1]
    - [39, 0.13]
  - - [704, 1088, 1, 1]
    - [46, 0.13]
  - - [1088, 704, 1, 1]
    - [46, 0.13]
  - - [448, 1728, 1, 1]
    - [46, 0.13]
  - - [576, 1344, 1, 1]
    - [46, 0.13]
  - - [1, 768, 1, 1024]
    - [24, 0.04]
  - - [6, 32, 1, 4096]
    - [24, 0.01]
  - - [12, 32, 1, 2048]
    - [13, 0.02]
  - - [32, 12, 1, 2048]
    - [24, 0.02]
  - - [32, 384, 1, 64]
    - [22, 0.17]
  - - [32, 1536, 1, 16]
    - [44, 0.19]
  - - [64, 192, 1, 64]
    - [24, 0.17]
  - - [64, 384, 1, 32]
    - [22, 0.19]
  - - [64, 768, 1, 16]
    - [9, 0.2]
  - - [128, 192, 1, 32]
    - [28, 0.19]
  - - [192, 16, 1, 256]
    - [22, 0.11]
  - - [192, 256, 1, 16]
    - [60, 0.2]
  - - [256, 192, 1, 16]
    - [9, 0.2]
  - - [384, 32, 1, 64]
    - [22, 0.17]
  - - [384, 128, 1, 16]
    - [9, 0.2]
  - - [384, 2048, 1, 1]
    - [39, 0.13]
  - - [768, 1, 1, 1024]
    - [13, 0.04]
  - - [768, 64, 1, 16]
    - [58, 0.2]
  - - [768, 1024, 1, 1]
    - [46, 0.13]
  - - [1024, 768, 1, 1]
    - [46, 0.12]
  - - [1536, 1, 1, 512]
    - [38, 0.06]
  - - [1536, 16, 1, 32]
    - [31, 0.19]
  - - [1536, 32, 1, 16]
    - [60, 0.2]
  - - [3072, 1, 1, 256]
    - [27, 0.1]
  - - [3072, 16, 1, 16]
    - [31, 0.2]
  - - [832, 960, 1, 1]
    - [46, 0.13]
  - - [960, 832, 1, 1]
    - [39, 0.13]
  - - [896, 896, 1, 1]
    - [39, 0.13]
  - - [3136, 1, 1, 256]
    - [47, 0.09]
  - - [3136, 16, 1, 16]
    - [50, 0.19]
  - - [32, 1600, 1, 16]
    - [44, 0.2]
  - - [1600, 1, 1, 512]
    - [22, 0.06]
  - - [1600, 16, 1, 32]
    - [22, 0.19]
  - - [448, 1856, 1, 1]
    - [39, 0.13]
  - - [320, 2624, 1, 1]
    - [39, 0.14]
  - - [576, 1472, 1, 1]
    - [46, 0.14]
  - - [1, 832, 1, 1024]
    - [23, 0.04]
  - - [16, 3328, 1, 16]
    - [33, 0.19]
  - - [64, 832, 1, 16]
    - [9, 0.21]
  - - [832, 1, 1, 1024]
    - [13, 0.04]
  - - [832, 16, 1, 64]
    - [22, 0.18]
  - - [832, 64, 1, 16]
    - [46, 0.21]
  - - [832, 1024, 1, 1]
    - [39, 0.14]
  - - [1024, 832, 1, 1]
    - [46, 0.13]
  - - [704, 1216, 1, 1]
    - [32, 0.13]
  - - [1216, 704, 1, 1]
    - [46, 0.13]
  - - [896, 960, 1, 1]
    - [46, 0.13]
  - - [960, 896, 1, 1]
    - [51, 0.13]
  - - [16, 3392, 1, 16]
    - [33, 0.19]
  - - [3392, 1, 1, 256]
    - [47, 0.1]
  - - [3392, 16, 1, 16]
    - [52, 0.21]
  - - [32, 1728, 1, 16]
    - [44, 0.22]
  - - [1728, 1, 1, 512]
    - [13, 0.07]
  - - [1728, 16, 1, 32]
    - [22, 0.21]
  - - [1728, 32, 1, 16]
    - [9, 0.22]
  - - [448, 1984, 1, 1]
    - [46, 0.14]
  - - [832, 1088, 1, 1]
    - [39, 0.14]
  - - [1088, 832, 1, 1]
    - [39, 0.14]
  - - [1, 896, 1, 1024]
    - [23, 0.05]
  - - [14, 16, 1, 4096]
    - [22, 0.01]
  - - [16, 1792, 1, 32]
    - [24, 0.21]
  - - [16, 3584, 1, 16]
    - [33, 0.21]
  - - [32, 448, 1, 64]
    - [23, 0.2]
  - - [32, 1792, 1, 16]
    - [44, 0.23]
  - - [64, 896, 1, 16]
    - [9, 0.23]
  - - [128, 448, 1, 16]
    - [9, 0.23]
  - - [448, 32, 1, 64]
    - [29, 0.2]
  - - [448, 128, 1, 16]
    - [46, 0.23]
  - - [896, 1, 1, 1024]
    - [13, 0.05]
  - - [896, 16, 1, 64]
    - [13, 0.2]
  - - [896, 64, 1, 16]
    - [9, 0.23]
  - - [896, 1024, 1, 1]
    - [46, 0.14]
  - - [1024, 896, 1, 1]
    - [39, 0.14]
  - - [320, 2880, 1, 1]
    - [39, 0.14]
  - - [576, 1600, 1, 1]
    - [46, 0.14]
  - - [960, 960, 1, 1]
    - [46, 0.14]
  - - [1600, 576, 1, 1]
    - [46, 0.14]
  - - [2880, 320, 1, 1]
    - [39, 0.14]
  - - [16, 3648, 1, 16]
    - [33, 0.2]
  - - [3648, 1, 1, 256]
    - [47, 0.11]
  - - [3648, 16, 1, 16]
    - [50, 0.22]
  - - [704, 1344, 1, 1]
    - [39, 0.15]
  - - [1344, 704, 1, 1]
    - [46, 0.15]
  - - [16, 1856, 1, 32]
    - [24, 0.22]
  - - [32, 1856, 1, 16]
    - [44, 0.23]
  - - [1856, 1, 1, 512]
    - [22, 0.07]
  - - [1856, 16, 1, 32]
    - [13, 0.22]
  - - [1856, 32, 1, 16]
    - [9, 0.24]
  - - [1, 320, 1, 3072]
    - [23, 0.02]
  - - [1, 960, 1, 1024]
    - [24, 0.05]
  - - [16, 3840, 1, 16]
    - [33, 0.22]
  - - [32, 960, 1, 32]
    - [22, 0.23]
  - - [64, 960, 1, 16]
    - [9, 0.25]
  - - [320, 192, 1, 16]
    - [46, 0.25]
  - - [960, 1, 1, 1024]
    - [13, 0.05]
  - - [960, 16, 1, 64]
    - [22, 0.21]
  - - [960, 64, 1, 16]
    - [30, 0.25]
  - - [960, 1024, 1, 1]
    - [39, 0.15]
  - - [1024, 960, 1, 1]
    - [46, 0.15]
  - - [3072, 320, 1, 1]
    - [46, 0.15]
  - - [576, 1728, 1, 1]
    - [46, 0.15]
  - - [1728, 576, 1, 1]
    - [46, 0.15]
  - - [16, 3904, 1, 16]
    - [33, 0.22]
  - - [3904, 1, 1, 256]
    - [47, 0.11]
  - - [3904, 16, 1, 16]
    - [25, 0.24]
  - - [320, 3136, 1, 1]
    - [46, 0.15]
  - - [3136, 320, 1, 1]
    - [39, 0.15]
  - - [832, 1216, 1, 1]
    - [46, 0.15]
  - - [1216, 832, 1, 1]
    - [46, 0.15]
  - - [16, 1984, 1, 32]
    - [24, 0.23]
  - - [32, 1984, 1, 16]
    - [44, 0.25]
  - - [1984, 1, 1, 512]
    - [8, 0.08]
  - - [1984, 16, 1, 32]
    - [22, 0.24]
  - - [1984, 32, 1, 16]
    - [46, 0.25]
  - - [704, 1472, 1, 1]
    - [46, 0.16]
  - - [1472, 704, 1, 1]
    - [39, 0.16]
  - - [960, 1088, 1, 1]
    - [9, 0.15]
  - - [1088, 960, 1, 1]
    - [9, 0.15]
  - - [1, 256, 1, 4096]
    - [13, 0.02]
  - - [1, 1024, 1, 1024]
    - [23, 0.05]
  - - [16, 16, 1, 4096]
    - [22, 0.02]
  - - [16, 256, 1, 256]
    - [24, 0.14]
  - - [16, 2048, 1, 32]
    - [24, 0.25]
  - - [16, 4096, 1, 16]
    - [33, 0.25]
  - - [32, 128, 1, 256]
    - [13, 0.15]
  - - [32, 256, 1, 128]
    - [22, 0.18]
  - - [32, 512, 1, 64]
    - [13, 0.23]
  - - [32, 1024, 1, 32]
    - [22, 0.25]
  - - [32, 2048, 1, 16]
    - [44, 0.26]
  - - [64, 1024, 1, 16]
    - [9, 0.27]
  - - [128, 256, 1, 32]
    - [22, 0.25]
  - - [128, 512, 1, 16]
    - [9, 0.27]
  - - [256, 16, 1, 256]
    - [13, 0.15]
  - - [256, 32, 1, 128]
    - [22, 0.18]
  - - [256, 64, 1, 64]
    - [22, 0.23]
  - - [256, 128, 1, 32]
    - [13, 0.26]
  - - [512, 1, 1, 2048]
    - [13, 0.03]
  - - [512, 32, 1, 64]
    - [13, 0.23]
  - - [512, 128, 1, 16]
    - [9, 0.26]
  - - [1024, 1, 1, 1024]
    - [13, 0.05]
  - - [1024, 16, 1, 64]
    - [13, 0.23]
  - - [1024, 32, 1, 32]
    - [8, 0.25]
  - - [1024, 64, 1, 16]
    - [9, 0.26]
  - - [1024, 1024, 1, 1]
    - [9, 0.15]
  - - [2048, 16, 1, 32]
    - [13, 0.24]
  - - [2048, 32, 1, 16]
    - [9, 0.26]
  - - [576, 1856, 1, 1]
    - [46, 0.16]
  - - [1856, 576, 1, 1]
    - [46, 0.16]
  - - [16, 2112, 1, 32]
    - [42, 0.23]
  - - [32, 2112, 1, 16]
    - [44, 0.26]
  - - [2112, 1, 1, 512]
    - [27, 0.08]
  - - [2112, 16, 1, 32]
    - [31, 0.24]
  - - [2112, 32, 1, 16]
    - [30, 0.26]
  - - [3392, 320, 1, 1]
    - [46, 0.16]
  - - [1, 1088, 1, 1024]
    - [24, 0.05]
  - - [32, 1088, 1, 32]
    - [63, 0.24]
  - - [64, 1088, 1, 16]
    - [25, 0.27]
  - - [1088, 1, 1, 1024]
    - [48, 0.05]
  - - [1088, 16, 1, 64]
    - [42, 0.22]
  - - [1088, 32, 1, 32]
    - [54, 0.24]
  - - [1088, 64, 1, 16]
    - [9, 0.28]
  - - [832, 1344, 1, 1]
    - [46, 0.17]
  - - [1344, 832, 1, 1]
    - [39, 0.16]
  - - [704, 1600, 1, 1]
    - [46, 0.16]
  - - [1600, 704, 1, 1]
    - [46, 0.16]
  - - [576, 1984, 1, 1]
    - [39, 0.16]
  - - [1984, 576, 1, 1]
    - [39, 0.16]
  - - [960, 1216, 1, 1]
    - [39, 0.17]
  - - [1216, 960, 1, 1]
    - [39, 0.17]
  - - [3648, 320, 1, 1]
    - [39, 0.17]
  - - [1, 384, 1, 3072]
    - [13, 0.02]
  - - [16, 2304, 1, 32]
    - [37, 0.26]
  - - [32, 576, 1, 64]
    - [24, 0.24]
  - - [32, 2304, 1, 16]
    - [44, 0.29]
  - - [128, 576, 1, 16]
    - [9, 0.29]
  - - [192, 192, 1, 32]
    - [31, 0.28]
  - - [192, 384, 1, 16]
    - [9, 0.29]
  - - [384, 192, 1, 16]
    - [9, 0.3]
  - - [576, 1, 1, 2048]
    - [22, 0.03]
  - - [576, 32, 1, 64]
    - [15, 0.25]
  - - [576, 128, 1, 16]
    - [9, 0.29]
  - - [1088, 1088, 1, 1]
    - [46, 0.17]
  - - [16, 2368, 1, 32]
    - [34, 0.26]
  - - [32, 2368, 1, 16]
    - [25, 0.29]
  - - [2368, 1, 1, 512]
    - [27, 0.09]
  - - [2368, 16, 1, 32]
    - [54, 0.26]
  - - [2368, 32, 1, 16]
    - [9, 0.29]
  - - [576, 2112, 1, 1]
    - [46, 0.17]
  - - [704, 1728, 1, 1]
    - [46, 0.17]
  - - [1728, 704, 1, 1]
    - [39, 0.17]
  - - [2112, 576, 1, 1]
    - [46, 0.17]
  - - [832, 1472, 1, 1]
    - [39, 0.17]
  - - [1472, 832, 1, 1]
    - [46, 0.17]
  - - [1, 1216, 1, 1024]
    - [23, 0.06]
  - - [32, 1216, 1, 32]
    - [13, 0.27]
  - - [64, 1216, 1, 16]
    - [9, 0.3]
  - - [1216, 16, 1, 64]
    - [38, 0.26]
  - - [1216, 32, 1, 32]
    - [31, 0.28]
  - - [1216, 64, 1, 16]
    - [9, 0.31]
  - - [3904, 320, 1, 1]
    - [46, 0.18]
  - - [960, 1344, 1, 1]
    - [46, 0.18]
  - - [1344, 960, 1, 1]
    - [46, 0.18]
  - - [704, 1856, 1, 1]
    - [30, 0.17]
  - - [1856, 704, 1, 1]
    - [51, 0.17]
  - - [1, 320, 1, 4096]
    - [22, 0.02]
  - - [16, 320, 1, 256]
    - [24, 0.18]
  - - [16, 2560, 1, 32]
    - [42, 0.28]
  - - [32, 10, 1, 4096]
    - [24, 0.02]
  - - [32, 640, 1, 64]
    - [41, 0.25]
  - - [32, 1280, 1, 32]
    - [24, 0.28]
  - - [64, 640, 1, 32]
    - [9, 0.29]
  - - [128, 640, 1, 16]
    - [9, 0.32]
  - - [256, 320, 1, 16]
    - [30, 0.32]
  - - [320, 16, 1, 256]
    - [22, 0.18]
  - - [320, 64, 1, 64]
    - [33, 0.28]
  - - [320, 128, 1, 32]
    - [56, 0.3]
  - - [640, 1, 1, 2048]
    - [22, 0.04]
  - - [640, 64, 1, 32]
    - [37, 0.28]
  - - [640, 128, 1, 16]
    - [30, 0.32]
  - - [4096, 320, 1, 1]
    - [30, 0.17]
  - - [1216, 1088, 1, 1]
    - [46, 0.18]
  - - [832, 1600, 1, 1]
    - [46, 0.18]
  - - [1600, 832, 1, 1]
    - [39, 0.18]
  - - [16, 2624, 1, 32]
    - [24, 0.29]
  - - [32, 2624, 1, 16]
    - [25, 0.32]
  - - [2624, 32, 1, 16]
    - [9, 0.33]
  - - [576, 2368, 1, 1]
    - [46, 0.19]
  - - [2368, 576, 1, 1]
    - [46, 0.18]
  - - [1, 1344, 1, 1024]
    - [23, 0.06]
  - - [32, 1344, 1, 32]
    - [13, 0.3]
  - - [64, 1344, 1, 16]
    - [9, 0.33]
  - - [192, 448, 1, 16]
    - [9, 0.33]
  - - [1344, 16, 1, 64]
    - [48, 0.3]
  - - [1344, 32, 1, 32]
    - [60, 0.33]
  - - [1344, 64, 1, 16]
    - [9, 0.35]
  - - [3072, 448, 1, 1]
    - [39, 0.19]
  - - [704, 1984, 1, 1]
    - [46, 0.18]
  - - [1984, 704, 1, 1]
    - [46, 0.18]
  - - [960, 1472, 1, 1]
    - [46, 0.18]
  - - [1472, 960, 1, 1]
    - [46, 0.18]
  - - [832, 1728, 1, 1]
    - [32, 0.18]
  - - [1728, 832, 1, 1]
    - [51, 0.18]
  - - [1, 704, 1, 2048]
    - [23, 0.04]
  - - [16, 2816, 1, 32]
    - [37, 0.31]
  - - [32, 704, 1, 64]
    - [37, 0.29]
  - - [32, 2816, 1, 16]
    - [50, 0.35]
  - - [128, 704, 1, 16]
    - [9, 0.36]
  - - [704, 1, 1, 2048]
    - [13, 0.04]
  - - [704, 32, 1, 64]
    - [29, 0.29]
  - - [704, 64, 1, 32]
    - [56, 0.32]
  - - [704, 128, 1, 16]
    - [30, 0.35]
  - - [1088, 1344, 1, 1]
    - [46, 0.19]
  - - [1344, 1088, 1, 1]
    - [39, 0.19]
  - - [16, 2880, 1, 32]
    - [33, 0.32]
  - - [32, 2880, 1, 16]
    - [25, 0.35]
  - - [1216, 1216, 1, 1]
    - [46, 0.19]
  - - [1, 1472, 1, 1024]
    - [23, 0.07]
  - - [32, 1472, 1, 32]
    - [59, 0.33]
  - - [64, 1472, 1, 16]
    - [9, 0.36]
  - - [1472, 16, 1, 64]
    - [29, 0.3]
  - - [1472, 32, 1, 32]
    - [60, 0.35]
  - - [1472, 64, 1, 16]
    - [9, 0.38]
  - - [576, 2624, 1, 1]
    - [39, 0.19]
  - - [2624, 576, 1, 1]
    - [46, 0.19]
  - - [960, 1600, 1, 1]
    - [39, 0.19]
  - - [1600, 960, 1, 1]
    - [39, 0.19]
  - - [832, 1856, 1, 1]
    - [46, 0.19]
  - - [1856, 832, 1, 1]
    - [39, 0.19]
  - - [1, 768, 1, 2048]
    - [24, 0.04]
  - - [12, 32, 1, 4096]
    - [24, 0.02]
  - - [16, 192, 1, 512]
    - [24, 0.14]
  - - [16, 384, 1, 256]
    - [24, 0.21]
  - - [16, 3072, 1, 32]
    - [24, 0.34]
  - - [32, 768, 1, 64]
    - [33, 0.33]
  - - [32, 1536, 1, 32]
    - [21, 0.35]
  - - [32, 3072, 1, 16]
    - [52, 0.39]
  - - [192, 32, 1, 256]
    - [22, 0.22]
  - - [192, 512, 1, 16]
    - [30, 0.39]
  - - [256, 192, 1, 32]
    - [21, 0.35]
  - - [256, 384, 1, 16]
    - [46, 0.38]
  - - [384, 64, 1, 64]
    - [33, 0.34]
  - - [384, 128, 1, 32]
    - [31, 0.38]
  - - [384, 256, 1, 16]
    - [9, 0.39]
  - - [768, 1, 1, 2048]
    - [13, 0.05]
  - - [768, 32, 1, 64]
    - [15, 0.34]
  - - [768, 64, 1, 32]
    - [62, 0.36]
  - - [768, 128, 1, 16]
    - [9, 0.38]
  - - [768, 2048, 1, 1]
    - [51, 0.19]
  - - [1536, 16, 1, 64]
    - [48, 0.3]
  - - [1536, 32, 1, 32]
    - [15, 0.35]
  - - [1536, 64, 1, 16]
    - [9, 0.38]
  - - [1536, 1024, 1, 1]
    - [51, 0.19]
  - - [1088, 1472, 1, 1]
    - [39, 0.2]
  - - [1472, 1088, 1, 1]
    - [39, 0.2]
  - - [16, 3136, 1, 32]
    - [21, 0.32]
  - - [32, 3136, 1, 16]
    - [44, 0.38]
  - - [1216, 1344, 1, 1]
    - [32, 0.2]
  - - [1344, 1216, 1, 1]
    - [32, 0.19]
  - - [1, 1600, 1, 1024]
    - [23, 0.08]
  - - [32, 1600, 1, 32]
    - [52, 0.36]
  - - [64, 1600, 1, 16]
    - [30, 0.39]
  - - [320, 320, 1, 16]
    - [9, 0.4]
  - - [1600, 16, 1, 64]
    - [13, 0.33]
  - - [1600, 32, 1, 32]
    - [46, 0.36]
  - - [1600, 64, 1, 16]
    - [9, 0.41]
  - - [832, 1984, 1, 1]
    - [39, 0.2]
  - - [1984, 832, 1, 1]
    - [39, 0.2]
  - - [576, 2880, 1, 1]
    - [39, 0.2]
  - - [960, 1728, 1, 1]
    - [39, 0.2]
  - - [1728, 960, 1, 1]
    - [39, 0.2]
  - - [2880, 576, 1, 1]
    - [39, 0.2]
  - - [1, 832, 1, 2048]
    - [23, 0.05]
  - - [16, 3328, 1, 32]
    - [33, 0.35]
  - - [32, 832, 1, 64]
    - [29, 0.33]
  - - [32, 3328, 1, 16]
    - [59, 0.4]
  - - [832, 1, 1, 2048]
    - [13, 0.05]
  - - [832, 32, 1, 64]
    - [29, 0.35]
  - - [832, 64, 1, 32]
    - [46, 0.37]
  - - [832, 128, 1, 16]
    - [9, 0.42]
  - - [16, 3392, 1, 32]
    - [33, 0.37]
  - - [32, 3392, 1, 16]
    - [44, 0.42]
  - - [3392, 32, 1, 16]
    - [9, 0.43]
  - - [1088, 1600, 1, 1]
    - [39, 0.21]
  - - [1600, 1088, 1, 1]
    - [39, 0.2]
  - - [832, 2112, 1, 1]
    - [39, 0.2]
  - - [2112, 832, 1, 1]
    - [39, 0.2]
  - - [32, 1728, 1, 32]
    - [64, 0.38]
  - - [64, 1728, 1, 16]
    - [9, 0.43]
  - - [192, 576, 1, 16]
    - [9, 0.43]
  - - [1728, 64, 1, 16]
    - [9, 0.44]
  - - [3072, 576, 1, 1]
    - [46, 0.2]
  - - [960, 1856, 1, 1]
    - [39, 0.19]
  - - [1856, 960, 1, 1]
    - [39, 0.2]
  - - [1216, 1472, 1, 1]
    - [39, 0.2]
  - - [1472, 1216, 1, 1]
    - [51, 0.19]
  - - [576, 3136, 1, 1]
    - [39, 0.2]
  - - [1344, 1344, 1, 1]
    - [39, 0.2]
  - - [3136, 576, 1, 1]
    - [39, 0.2]
  - - [1, 896, 1, 2048]
    - [24, 0.05]
  - - [14, 32, 1, 4096]
    - [22, 0.03]
  - - [16, 448, 1, 256]
    - [23, 0.25]
  - - [16, 3584, 1, 32]
    - [33, 0.39]
  - - [32, 896, 1, 64]
    - [37, 0.38]
  - - [32, 1792, 1, 32]
    - [32, 0.4]
  - - [32, 3584, 1, 16]
    - [32, 0.44]
  - - [64, 896, 1, 32]
    - [39, 0.42]
  - - [128, 896, 1, 16]
    - [9, 0.45]
  - - [256, 448, 1, 16]
    - [46, 0.45]
  - - [448, 1, 1, 4096]
    - [23, 0.03]
  - - [448, 16, 1, 256]
    - [22, 0.25]
  - - [448, 64, 1, 64]
    - [33, 0.37]
  - - [448, 128, 1, 32]
    - [9, 0.4]
  - - [448, 256, 1, 16]
    - [9, 0.45]
  - - [896, 1, 1, 2048]
    - [22, 0.05]
  - - [896, 32, 1, 64]
    - [29, 0.36]
  - - [896, 64, 1, 32]
    - [39, 0.4]
  - - [896, 128, 1, 16]
    - [9, 0.45]
  - - [16, 3648, 1, 32]
    - [33, 0.4]
  - - [32, 3648, 1, 16]
    - [44, 0.45]
  - - [3648, 32, 1, 16]
    - [9, 0.46]
  - - [1088, 1728, 1, 1]
    - [39, 0.21]
  - - [1728, 1088, 1, 1]
    - [39, 0.2]
  - - [16, 1856, 1, 64]
    - [24, 0.36]
  - - [32, 1856, 1, 32]
    - [52, 0.41]
  - - [64, 1856, 1, 16]
    - [9, 0.46]
  - - [1856, 1, 1, 1024]
    - [13, 0.09]
  - - [1856, 64, 1, 16]
    - [30, 0.45]
  - - [960, 1984, 1, 1]
    - [51, 0.2]
  - - [1984, 960, 1, 1]
    - [39, 0.2]
  - - [1216, 1600, 1, 1]
    - [39, 0.21]
  - - [1600, 1216, 1, 1]
    - [39, 0.21]
  - - [576, 3392, 1, 1]
    - [39, 0.21]
  - - [3392, 576, 1, 1]
    - [39, 0.2]
  - - [1, 960, 1, 2048]
    - [23, 0.06]
  - - [32, 960, 1, 64]
    - [29, 0.38]
  - - [32, 3840, 1, 16]
    - [59, 0.46]
  - - [64, 960, 1, 32]
    - [46, 0.43]
  - - [128, 960, 1, 16]
    - [9, 0.48]
  - - [192, 640, 1, 16]
    - [9, 0.48]
  - - [320, 384, 1, 16]
    - [9, 0.49]
  - - [384, 320, 1, 16]
    - [9, 0.48]
  - - [960, 1, 1, 2048]
    - [13, 0.06]
  - - [960, 32, 1, 64]
    - [29, 0.38]
  - - [960, 64, 1, 32]
    - [55, 0.43]
  - - [3072, 640, 1, 1]
    - [39, 0.21]
  - - [832, 2368, 1, 1]
    - [39, 0.21]
  - - [2368, 832, 1, 1]
    - [39, 0.21]
  - - [1472, 1344, 1, 1]
    - [32, 0.2]
  - - [32, 3904, 1, 16]
    - [59, 0.45]
  - - [3904, 32, 1, 16]
    - [30, 0.47]
  - - [1088, 1856, 1, 1]
    - [39, 0.21]
  - - [1856, 1088, 1, 1]
    - [39, 0.21]
  - - [16, 1984, 1, 64]
    - [24, 0.38]
  - - [32, 1984, 1, 32]
    - [52, 0.44]
  - - [64, 1984, 1, 16]
    - [9, 0.5]
  - - [1984, 1, 1, 1024]
    - [22, 0.1]
  - - [1984, 64, 1, 16]
    - [30, 0.48]
  - - [1, 1024, 1, 2048]
    - [23, 0.06]
  - - [16, 32, 1, 4096]
    - [24, 0.03]
  - - [16, 256, 1, 512]
    - [24, 0.18]
  - - [16, 2048, 1, 64]
    - [37, 0.4]
  - - [32, 128, 1, 512]
    - [13, 0.18]
  - - [32, 256, 1, 256]
    - [13, 0.29]
  - - [32, 512, 1, 128]
    - [13, 0.36]
  - - [32, 1024, 1, 64]
    - [33, 0.44]
  - - [32, 2048, 1, 32]
    - [64, 0.46]
  - - [32, 4096, 1, 16]
    - [32, 0.5]
  - - [64, 32, 1, 1024]
    - [24, 0.11]
  - - [64, 128, 1, 256]
    - [23, 0.29]
  - - [64, 1024, 1, 32]
    - [9, 0.46]
  - - [128, 512, 1, 32]
    - [46, 0.47]
  - - [128, 1024, 1, 16]
    - [9, 0.52]
  - - [256, 16, 1, 512]
    - [22, 0.19]
  - - [256, 32, 1, 256]
    - [22, 0.29]
  - - [256, 512, 1, 16]
    - [9, 0.5]
  - - [512, 1, 1, 4096]
    - [23, 0.03]
  - - [512, 16, 1, 256]
    - [22, 0.28]
  - - [512, 256, 1, 16]
    - [9, 0.5]
  - - [1024, 1, 1, 2048]
    - [22, 0.06]
  - - [1024, 32, 1, 64]
    - [33, 0.4]
  - - [4096, 32, 1, 16]
    - [9, 0.49]
  - - [576, 3648, 1, 1]
    - [39, 0.21]
  - - [1216, 1728, 1, 1]
    - [39, 0.21]
  - - [1728, 1216, 1, 1]
    - [39, 0.21]
  - - [3648, 576, 1, 1]
    - [39, 0.21]
  - - [1344, 1600, 1, 1]
    - [39, 0.21]
  - - [1600, 1344, 1, 1]
    - [32, 0.21]
  - - [1088, 1984, 1, 1]
    - [32, 0.21]
  - - [1984, 1088, 1, 1]
    - [30, 0.2]
  - - [16, 2112, 1, 64]
    - [33, 0.39]
  - - [32, 2112, 1, 32]
    - [52, 0.47]
  - - [192, 704, 1, 16]
    - [46, 0.49]
  - - [704, 192, 1, 16]
    - [52, 0.49]
  - - [2112, 1, 1, 1024]
    - [47, 0.1]
  - - [2112, 64, 1, 16]
    - [46, 0.47]
  - - [3072, 704, 1, 1]
    - [30, 0.2]
  - - [1472, 1472, 1, 1]
    - [32, 0.21]
  - - [832, 2624, 1, 1]
    - [39, 0.22]
  - - [2624, 832, 1, 1]
    - [39, 0.22]
  - - [1, 1088, 1, 2048]
    - [23, 0.06]
  - - [32, 1088, 1, 64]
    - [28, 0.4]
  - - [64, 1088, 1, 32]
    - [50, 0.48]
  - - [1088, 1, 1, 2048]
    - [38, 0.06]
  - - [1088, 32, 1, 64]
    - [47, 0.41]
  - - [576, 3904, 1, 1]
    - [32, 0.22]
  - - [1216, 1856, 1, 1]
    - [51, 0.22]
  - - [1856, 1216, 1, 1]
    - [39, 0.22]
  - - [320, 448, 1, 16]
    - [46, 0.5]
  - - [448, 320, 1, 16]
    - [46, 0.5]
  - - [1088, 2112, 1, 1]
    - [39, 0.22]
  - - [2112, 1088, 1, 1]
    - [39, 0.22]
  - - [1344, 1728, 1, 1]
    - [39, 0.22]
  - - [1728, 1344, 1, 1]
    - [39, 0.23]
  - - [1472, 1600, 1, 1]
    - [30, 0.21]
  - - [1600, 1472, 1, 1]
    - [30, 0.21]
  - - [32, 2304, 1, 32]
    - [52, 0.51]
  - - [128, 576, 1, 32]
    - [59, 0.51]
  - - [192, 384, 1, 32]
    - [55, 0.51]
  - - [192, 768, 1, 16]
    - [52, 0.54]
  - - [256, 576, 1, 16]
    - [52, 0.53]
  - - [384, 384, 1, 16]
    - [46, 0.54]
  - - [576, 1, 1, 4096]
    - [13, 0.04]
  - - [576, 16, 1, 256]
    - [13, 0.32]
  - - [576, 256, 1, 16]
    - [39, 0.52]
  - - [576, 4096, 1, 1]
    - [30, 0.21]
  - - [768, 192, 1, 16]
    - [59, 0.51]
  - - [3072, 768, 1, 1]
    - [30, 0.2]
  - - [832, 2880, 1, 1]
    - [39, 0.23]
  - - [2880, 832, 1, 1]
    - [39, 0.23]
  - - [1216, 1984, 1, 1]
    - [39, 0.23]
  - - [1984, 1216, 1, 1]
    - [39, 0.23]
  - - [16, 2368, 1, 64]
    - [37, 0.44]
  - - [32, 2368, 1, 32]
    - [52, 0.53]
  - - [2368, 1, 1, 1024]
    - [47, 0.11]
  - - [2368, 16, 1, 64]
    - [48, 0.44]
  - - [2368, 64, 1, 16]
    - [39, 0.53]
  - - [32, 1216, 1, 64]
    - [29, 0.46]
  - - [64, 1216, 1, 32]
    - [46, 0.54]
  - - [1216, 1, 1, 2048]
    - [48, 0.07]
  - - [1216, 32, 1, 64]
    - [55, 0.46]
  - - [1344, 1856, 1, 1]
    - [32, 0.22]
  - - [1856, 1344, 1, 1]
    - [39, 0.23]
  - - [1472, 1728, 1, 1]
    - [39, 0.24]
  - - [1728, 1472, 1, 1]
    - [39, 0.24]
  - - [192, 832, 1, 16]
    - [39, 0.55]
  - - [832, 192, 1, 16]
    - [52, 0.56]
  - - [3072, 832, 1, 1]
    - [39, 0.21]
  - - [1600, 1600, 1, 1]
    - [32, 0.22]
  - - [1088, 2368, 1, 1]
    - [39, 0.23]
  - - [2368, 1088, 1, 1]
    - [39, 0.23]
  - - [3136, 832, 1, 1]
    - [39, 0.23]
  - - [32, 320, 1, 256]
    - [13, 0.36]
  - - [32, 2560, 1, 32]
    - [50, 0.57]
  - - [128, 640, 1, 32]
    - [52, 0.57]
  - - [256, 320, 1, 32]
    - [9, 0.57]
  - - [256, 640, 1, 16]
    - [39, 0.58]
  - - [320, 16, 1, 512]
    - [22, 0.23]
  - - [320, 256, 1, 32]
    - [59, 0.57]
  - - [320, 512, 1, 16]
    - [46, 0.58]
  - - [512, 320, 1, 16]
    - [46, 0.58]
  - - [640, 1, 1, 4096]
    - [13, 0.04]
  - - [640, 16, 1, 256]
    - [22, 0.36]
  - - [640, 256, 1, 16]
    - [46, 0.58]
  - - [1344, 1984, 1, 1]
    - [39, 0.24]
  - - [1984, 1344, 1, 1]
    - [39, 0.24]
  - - [1, 2624, 1, 1024]
    - [33, 0.1]
  - - [16, 2624, 1, 64]
    - [24, 0.48]
  - - [32, 2624, 1, 32]
    - [57, 0.58]
  - - [2624, 1, 1, 1024]
    - [47, 0.12]
  - - [2624, 16, 1, 64]
    - [48, 0.48]
  - - [1472, 1856, 1, 1]
    - [39, 0.23]
  - - [1856, 1472, 1, 1]
    - [39, 0.23]
  - - [1, 896, 1, 3072]
    - [23, 0.05]
  - - [32, 1344, 1, 64]
    - [8, 0.49]
  - - [64, 1344, 1, 32]
    - [25, 0.6]
  - - [192, 448, 1, 32]
    - [52, 0.6]
  - - [192, 896, 1, 16]
    - [46, 0.61]
  - - [384, 448, 1, 16]
    - [9, 0.61]
  - - [448, 384, 1, 16]
    - [9, 0.62]
  - - [896, 192, 1, 16]
    - [46, 0.62]
  - - [1344, 32, 1, 64]
    - [31, 0.53]
  - - [3072, 896, 1, 1]
    - [39, 0.23]
  - - [1600, 1728, 1, 1]
    - [32, 0.23]
  - - [1728, 1600, 1, 1]
    - [39, 0.23]
  - - [832, 3392, 1, 1]
    - [32, 0.24]
  - - [1344, 2112, 1, 1]
    - [32, 0.24]
  - - [2112, 1344, 1, 1]
    - [39, 0.24]
  - - [1088, 2624, 1, 1]
    - [39, 0.24]
  - - [2624, 1088, 1, 1]
    - [39, 0.24]
  - - [32, 2816, 1, 32]
    - [52, 0.62]
  - - [128, 704, 1, 32]
    - [39, 0.63]
  - - [256, 704, 1, 16]
    - [30, 0.63]
  - - [704, 1, 1, 4096]
    - [13, 0.04]
  - - [704, 256, 1, 16]
    - [9, 0.63]
  - - [1472, 1984, 1, 1]
    - [39, 0.24]
  - - [1984, 1472, 1, 1]
    - [39, 0.24]
  - - [1, 960, 1, 3072]
    - [23, 0.06]
  - - [1, 2880, 1, 1024]
    - [37, 0.11]
  - - [16, 2880, 1, 64]
    - [33, 0.52]
  - - [32, 2880, 1, 32]
    - [52, 0.64]
  - - [192, 960, 1, 16]
    - [46, 0.64]
  - - [320, 576, 1, 16]
    - [9, 0.65]
  - - [576, 320, 1, 16]
    - [39, 0.66]
  - - [960, 192, 1, 16]
    - [46, 0.66]
  - - [2880, 1, 1, 1024]
    - [42, 0.13]
  - - [2880, 16, 1, 64]
    - [31, 0.55]
  - - [1600, 1856, 1, 1]
    - [32, 0.24]
  - - [1856, 1600, 1, 1]
    - [39, 0.24]
  - - [1728, 1728, 1, 1]
    - [39, 0.24]
  - - [1472, 32, 1, 64]
    - [31, 0.55]
  - - [832, 3648, 1, 1]
    - [39, 0.24]
  - - [1088, 2880, 1, 1]
    - [39, 0.24]
  - - [1, 768, 1, 4096]
    - [24, 0.05]
  - - [1, 1024, 1, 3072]
    - [24, 0.06]
  - - [32, 192, 1, 512]
    - [13, 0.27]
  - - [32, 384, 1, 256]
    - [13, 0.43]
  - - [32, 3072, 1, 32]
    - [57, 0.68]
  - - [128, 384, 1, 64]
    - [8, 0.59]
  - - [128, 768, 1, 32]
    - [9, 0.68]
  - - [192, 16, 1, 1024]
    - [13, 0.16]
  - - [192, 32, 1, 512]
    - [22, 0.28]
  - - [192, 512, 1, 32]
    - [52, 0.68]
  - - [192, 1024, 1, 16]
    - [9, 0.68]
  - - [256, 384, 1, 32]
    - [52, 0.68]
  - - [256, 768, 1, 16]
    - [30, 0.68]
  - - [384, 16, 1, 512]
    - [22, 0.28]
  - - [384, 32, 1, 256]
    - [24, 0.43]
  - - [384, 256, 1, 32]
    - [39, 0.68]
  - - [384, 512, 1, 16]
    - [46, 0.7]
  - - [384, 8192, 1, 1]
    - [30, 0.22]
  - - [512, 384, 1, 16]
    - [39, 0.68]
  - - [768, 1, 1, 4096]
    - [13, 0.05]
  - - [768, 32, 1, 128]
    - [38, 0.53]
  - - [768, 64, 1, 64]
    - [55, 0.59]
  - - [768, 256, 1, 16]
    - [46, 0.68]
  - - [768, 4096, 1, 1]
    - [51, 0.24]
  - - [1024, 192, 1, 16]
    - [39, 0.68]
  - - [1536, 32, 1, 64]
    - [56, 0.59]
  - - [1536, 128, 1, 16]
    - [59, 0.68]
  - - [1536, 2048, 1, 1]
    - [51, 0.24]
  - - [3072, 16, 1, 64]
    - [48, 0.57]
  - - [1600, 1984, 1, 1]
    - [39, 0.25]
  - - [1984, 1600, 1, 1]
    - [39, 0.25]
  - - [1344, 2368, 1, 1]
    - [39, 0.25]
  - - [2368, 1344, 1, 1]
    - [39, 0.25]
  - - [1728, 1856, 1, 1]
    - [30, 0.23]
  - - [1856, 1728, 1, 1]
    - [30, 0.23]
  - - [1, 3136, 1, 1024]
    - [21, 0.11]
  - - [32, 3136, 1, 32]
    - [44, 0.66]
  - - [64, 3136, 1, 16]
    - [30, 0.7]
  - - [448, 448, 1, 16]
    - [46, 0.7]
  - - [3136, 16, 1, 64]
    - [45, 0.57]
  - - [832, 3904, 1, 1]
    - [39, 0.25]
  - - [320, 320, 1, 32]
    - [9, 0.71]
  - - [320, 640, 1, 16]
    - [9, 0.71]
  - - [640, 320, 1, 16]
    - [46, 0.71]
  - - [1600, 32, 1, 64]
    - [30, 0.59]
  - - [1088, 192, 1, 16]
    - [9, 0.73]
  - - [1600, 2112, 1, 1]
    - [39, 0.26]
  - - [2112, 1600, 1, 1]
    - [39, 0.25]
  - - [1, 832, 1, 4096]
    - [23, 0.05]
  - - [16, 832, 1, 256]
    - [24, 0.46]
  - - [256, 832, 1, 16]
    - [9, 0.74]
  - - [832, 1, 1, 4096]
    - [13, 0.05]
  - - [832, 16, 1, 256]
    - [13, 0.46]
  - - [832, 64, 1, 64]
    - [65, 0.61]
  - - [832, 256, 1, 16]
    - [46, 0.74]
  - - [832, 4096, 1, 1]
    - [30, 0.23]
  - - [1088, 3136, 1, 1]
    - [39, 0.25]
  - - [1728, 1984, 1, 1]
    - [39, 0.25]
  - - [1984, 1728, 1, 1]
    - [39, 0.25]
  - - [1856, 1856, 1, 1]
    - [39, 0.25]
  - - [1, 3392, 1, 1024]
    - [21, 0.12]
  - - [64, 3392, 1, 16]
    - [9, 0.72]
  - - [3392, 16, 1, 64]
    - [45, 0.61]
  - - [1344, 2624, 1, 1]
    - [39, 0.26]
  - - [2624, 1344, 1, 1]
    - [39, 0.25]
  - - [384, 576, 1, 16]
    - [9, 0.75]
  - - [576, 192, 1, 32]
    - [9, 0.77]
  - - [576, 384, 1, 16]
    - [30, 0.77]
  - - [1728, 32, 1, 64]
    - [39, 0.63]
  - - [320, 704, 1, 16]
    - [46, 0.78]
  - - [704, 320, 1, 16]
    - [30, 0.78]
  - - [1, 896, 1, 4096]
    - [24, 0.05]
  - - [16, 448, 1, 512]
    - [24, 0.32]
  - - [16, 896, 1, 256]
    - [23, 0.49]
  - - [32, 448, 1, 256]
    - [22, 0.51]
  - - [128, 448, 1, 64]
    - [46, 0.67]
  - - [256, 448, 1, 32]
    - [9, 0.8]
  - - [256, 896, 1, 16]
    - [46, 0.8]
  - - [448, 16, 1, 512]
    - [22, 0.33]
  - - [448, 32, 1, 256]
    - [24, 0.51]
  - - [448, 256, 1, 32]
    - [53, 0.8]
  - - [448, 512, 1, 16]
    - [59, 0.8]
  - - [512, 448, 1, 16]
    - [30, 0.8]
  - - [896, 1, 1, 4096]
    - [13, 0.06]
  - - [896, 16, 1, 256]
    - [13, 0.5]
  - - [896, 64, 1, 64]
    - [9, 0.65]
  - - [1856, 1984, 1, 1]
    - [39, 0.26]
  - - [1984, 1856, 1, 1]
    - [39, 0.26]
  - - [1088, 3392, 1, 1]
    - [39, 0.26]
  - - [1, 3648, 1, 1024]
    - [21, 0.12]
  - - [192, 1216, 1, 16]
    - [9, 0.78]
  - - [1216, 192, 1, 16]
    - [46, 0.81]
  - - [3648, 16, 1, 64]
    - [26, 0.66]
  - - [1600, 2368, 1, 1]
    - [39, 0.26]
  - - [2368, 1600, 1, 1]
    - [39, 0.26]
  - - [1, 1856, 1, 2048]
    - [24, 0.09]
  - - [1344, 2880, 1, 1]
    - [32, 0.25]
  - - [2880, 1344, 1, 1]
    - [39, 0.26]
  - - [1856, 2112, 1, 1]
    - [39, 0.26]
  - - [2112, 1856, 1, 1]
    - [39, 0.26]
  - - [1, 960, 1, 4096]
    - [24, 0.06]
  - - [1, 1280, 1, 3072]
    - [23, 0.07]
  - - [16, 960, 1, 256]
    - [23, 0.53]
  - - [192, 320, 1, 64]
    - [30, 0.7]
  - - [256, 960, 1, 16]
    - [9, 0.85]
  - - [320, 384, 1, 32]
    - [30, 0.85]
  - - [320, 768, 1, 16]
    - [46, 0.85]
  - - [384, 320, 1, 32]
    - [65, 0.85]
  - - [384, 640, 1, 16]
    - [39, 0.85]
  - - [640, 192, 1, 32]
    - [9, 0.85]
  - - [640, 384, 1, 16]
    - [30, 0.85]
  - - [768, 320, 1, 16]
    - [9, 0.85]
  - - [960, 1, 1, 4096]
    - [13, 0.06]
  - - [960, 16, 1, 256]
    - [13, 0.53]
  - - [960, 64, 1, 64]
    - [9, 0.7]
  - - [960, 128, 1, 32]
    - [9, 0.85]
  - - [960, 256, 1, 16]
    - [46, 0.85]
  - - [3072, 1280, 1, 1]
    - [39, 0.25]
  - - [1984, 1984, 1, 1]
    - [32, 0.26]
  - - [1088, 3648, 1, 1]
    - [39, 0.26]
  - - [3648, 1088, 1, 1]
    - [32, 0.26]
  - - [1, 3904, 1, 1024]
    - [21, 0.13]
  - - [3904, 16, 1, 64]
    - [25, 0.67]
  - - [1, 1984, 1, 2048]
    - [23, 0.1]
  - - [1984, 32, 1, 64]
    - [9, 0.71]
  - - [192, 1344, 1, 16]
    - [9, 0.89]
  - - [448, 576, 1, 16]
    - [9, 0.9]
  - - [576, 448, 1, 16]
    - [46, 0.9]
  - - [1344, 192, 1, 16]
    - [39, 0.9]
  - - [1, 1024, 1, 4096]
    - [24, 0.06]
  - - [1, 2048, 1, 2048]
    - [23, 0.1]
  - - [1, 4096, 1, 1024]
    - [35, 0.14]
  - - [16, 256, 1, 1024]
    - [24, 0.22]
  - - [16, 512, 1, 512]
    - [23, 0.37]
  - - [16, 1024, 1, 256]
    - [24, 0.56]
  - - [32, 32, 1, 4096]
    - [13, 0.06]
  - - [32, 128, 1, 1024]
    - [13, 0.22]
  - - [32, 256, 1, 512]
    - [22, 0.37]
  - - [32, 512, 1, 256]
    - [13, 0.57]
  - - [32, 1024, 1, 128]
    - [33, 0.69]
  - - [64, 32, 1, 2048]
    - [24, 0.12]
  - - [64, 256, 1, 256]
    - [23, 0.57]
  - - [128, 32, 1, 1024]
    - [24, 0.22]
  - - [128, 512, 1, 64]
    - [53, 0.73]
  - - [128, 2048, 1, 16]
    - [39, 0.86]
  - - [256, 32, 1, 512]
    - [22, 0.37]
  - - [256, 64, 1, 256]
    - [23, 0.57]
  - - [256, 256, 1, 64]
    - [53, 0.75]
  - - [256, 1024, 1, 16]
    - [46, 0.88]
  - - [512, 16, 1, 512]
    - [13, 0.37]
  - - [512, 32, 1, 256]
    - [13, 0.57]
  - - [512, 256, 1, 32]
    - [46, 0.91]
  - - [512, 512, 1, 16]
    - [9, 0.9]
  - - [1024, 1, 1, 4096]
    - [13, 0.06]
  - - [1024, 16, 1, 256]
    - [13, 0.57]
  - - [1024, 64, 1, 64]
    - [50, 0.74]
  - - [1024, 128, 1, 32]
    - [9, 0.89]
  - - [1024, 256, 1, 16]
    - [46, 0.9]
  - - [2048, 2048, 1, 1]
    - [51, 0.25]
  - - [4096, 16, 1, 64]
    - [26, 0.71]
  - - [1600, 2624, 1, 1]
    - [32, 0.26]
  - - [2624, 1600, 1, 1]
    - [39, 0.26]
  - - [1344, 3136, 1, 1]
    - [39, 0.26]
  - - [3136, 1344, 1, 1]
    - [39, 0.26]
  - - [1088, 3904, 1, 1]
    - [39, 0.26]
  - - [3904, 1088, 1, 1]
    - [39, 0.27]
  - - [320, 832, 1, 16]
    - [30, 0.81]
  - - [832, 320, 1, 16]
    - [46, 0.83]
  - - [1, 2112, 1, 2048]
    - [33, 0.09]
  - - [384, 704, 1, 16]
    - [30, 0.81]
  - - [704, 192, 1, 32]
    - [39, 0.81]
  - - [704, 384, 1, 16]
    - [46, 0.84]
  - - [2112, 32, 1, 64]
    - [56, 0.77]
  - - [1856, 2368, 1, 1]
    - [39, 0.27]
  - - [2368, 1856, 1, 1]
    - [39, 0.27]
  - - [1, 1088, 1, 4096]
    - [23, 0.06]
  - - [16, 1088, 1, 256]
    - [23, 0.55]
  - - [1088, 1, 1, 4096]
    - [48, 0.06]
  - - [1088, 16, 1, 256]
    - [38, 0.57]
  - - [1088, 64, 1, 64]
    - [55, 0.78]
  - - [1088, 4096, 1, 1]
    - [30, 0.24]
  - - [4096, 1088, 1, 1]
    - [30, 0.24]
  - - [2112, 2112, 1, 1]
    - [39, 0.27]
  - - [192, 1472, 1, 16]
    - [9, 0.85]
  - - [1472, 192, 1, 16]
    - [39, 0.86]
  - - [1344, 3392, 1, 1]
    - [51, 0.27]
  - - [3392, 1344, 1, 1]
    - [46, 0.27]
  - - [320, 896, 1, 16]
    - [39, 0.86]
  - - [448, 320, 1, 32]
    - [46, 0.85]
  - - [448, 640, 1, 16]
    - [9, 0.89]
  - - [640, 448, 1, 16]
    - [9, 0.92]
  - - [896, 320, 1, 16]
    - [46, 0.93]
  - - [1600, 2880, 1, 1]
    - [39, 0.27]
  - - [2880, 1600, 1, 1]
    - [39, 0.27]
  - - [16, 576, 1, 512]
    - [24, 0.41]
  - - [32, 576, 1, 256]
    - [22, 0.59]
  - - [128, 576, 1, 64]
    - [57, 0.82]
  - - [192, 384, 1, 64]
    - [58, 0.83]
  - - [384, 192, 1, 64]
    - [55, 0.84]
  - - [384, 384, 1, 32]
    - [57, 0.88]
  - - [384, 768, 1, 16]
    - [46, 0.92]
  - - [512, 576, 1, 16]
    - [30, 0.91]
  - - [576, 32, 1, 256]
    - [15, 0.63]
  - - [576, 256, 1, 32]
    - [32, 0.89]
  - - [576, 512, 1, 16]
    - [46, 0.91]
  - - [768, 192, 1, 32]
    - [51, 0.89]
  - - [768, 384, 1, 16]
    - [9, 0.92]
  - - [3072, 1536, 1, 1]
    - [39, 0.26]
  - - [1, 2368, 1, 2048]
    - [37, 0.1]
  - - [2368, 32, 1, 64]
    - [9, 0.81]
  - - [2368, 64, 1, 32]
    - [30, 0.88]
  - - [1856, 2624, 1, 1]
    - [39, 0.27]
  - - [2624, 1856, 1, 1]
    - [39, 0.27]
  - - [1344, 3648, 1, 1]
    - [39, 0.27]
  - - [3648, 1344, 1, 1]
    - [39, 0.27]
  - - [192, 1600, 1, 16]
    - [39, 0.92]
  - - [320, 960, 1, 16]
    - [46, 0.93]
  - - [960, 320, 1, 16]
    - [46, 0.96]
  - - [1600, 192, 1, 16]
    - [30, 0.96]
  - - [1, 1216, 1, 4096]
    - [23, 0.06]
  - - [16, 1216, 1, 256]
    - [23, 0.61]
  - - [1216, 16, 1, 256]
    - [38, 0.65]
  - - [1216, 64, 1, 64]
    - [39, 0.87]
  - - [2112, 2368, 1, 1]
    - [46, 0.28]
  - - [2368, 2112, 1, 1]
    - [39, 0.27]
  - - [1600, 3136, 1, 1]
    - [39, 0.27]
  - - [3136, 1600, 1, 1]
    - [39, 0.28]
  - - [448, 704, 1, 16]
    - [30, 0.94]
  - - [704, 448, 1, 16]
    - [9, 0.97]
  - - [384, 832, 1, 16]
    - [46, 0.99]
  - - [832, 192, 1, 32]
    - [39, 0.96]
  - - [832, 384, 1, 16]
    - [46, 1.0]
  - - [16, 320, 1, 1024]
    - [23, 0.27]
  - - [16, 640, 1, 512]
    - [24, 0.46]
  - - [64, 320, 1, 256]
    - [43, 0.68]
  - - [128, 640, 1, 64]
    - [52, 0.91]
  - - [256, 320, 1, 64]
    - [52, 0.92]
  - - [320, 16, 1, 1024]
    - [13, 0.27]
  - - [320, 32, 1, 512]
    - [22, 0.46]
  - - [320, 64, 1, 256]
    - [43, 0.68]
  - - [320, 256, 1, 64]
    - [57, 0.91]
  - - [320, 1024, 1, 16]
    - [30, 1.02]
  - - [512, 320, 1, 32]
    - [46, 0.98]
  - - [512, 640, 1, 16]
    - [30, 1.01]
  - - [640, 256, 1, 32]
    - [39, 0.97]
  - - [640, 512, 1, 16]
    - [39, 1.02]
  - - [1024, 320, 1, 16]
    - [46, 1.01]
  - - [1344, 3904, 1, 1]
    - [32, 0.27]
  - - [3904, 1344, 1, 1]
    - [39, 0.28]
  - - [192, 1728, 1, 16]
    - [46, 0.96]
  - - [576, 576, 1, 16]
    - [30, 0.98]
  - - [1728, 192, 1, 16]
    - [30, 0.98]
  - - [1856, 2880, 1, 1]
    - [46, 0.28]
  - - [2880, 1856, 1, 1]
    - [46, 0.28]
  - - [1, 2624, 1, 2048]
    - [37, 0.11]
  - - [2624, 32, 1, 64]
    - [52, 0.9]
  - - [2624, 64, 1, 32]
    - [39, 0.98]
  - - [1600, 3392, 1, 1]
    - [46, 0.28]
  - - [3392, 1600, 1, 1]
    - [39, 0.28]
  - - [1, 1344, 1, 4096]
    - [24, 0.07]
  - - [1, 1792, 1, 3072]
    - [24, 0.1]
  - - [16, 1344, 1, 256]
    - [33, 0.68]
  - - [64, 1344, 1, 64]
    - [52, 0.94]
  - - [384, 896, 1, 16]
    - [46, 1.01]
  - - [448, 192, 1, 64]
    - [57, 0.96]
  - - [448, 768, 1, 16]
    - [30, 1.02]
  - - [768, 448, 1, 16]
    - [9, 1.03]
  - - [896, 192, 1, 32]
    - [46, 1.02]
  - - [896, 384, 1, 16]
    - [39, 1.03]
  - - [1344, 16, 1, 256]
    - [38, 0.72]
  - - [1344, 64, 1, 64]
    - [46, 0.96]
  - - [1344, 4096, 1, 1]
    - [9, 0.26]
  - - [3072, 1792, 1, 1]
    - [39, 0.27]
  - - [4096, 1344, 1, 1]
    - [9, 0.26]
  - - [2112, 2624, 1, 1]
    - [39, 0.28]
  - - [2624, 2112, 1, 1]
    - [46, 0.28]
  - - [320, 1088, 1, 16]
    - [46, 1.0]
  - - [1088, 320, 1, 16]
    - [9, 1.02]
  - - [192, 1856, 1, 16]
    - [30, 1.04]
  - - [1856, 192, 1, 16]
    - [30, 1.05]
  - - [32, 704, 1, 256]
    - [13, 0.73]
  - - [128, 704, 1, 64]
    - [57, 1.01]
  - - [512, 704, 1, 16]
    - [30, 1.06]
  - - [704, 32, 1, 256]
    - [15, 0.77]
  - - [704, 256, 1, 32]
    - [46, 1.08]
  - - [704, 512, 1, 16]
    - [46, 1.07]
  - - [1856, 3136, 1, 1]
    - [46, 0.29]
  - - [3136, 1856, 1, 1]
    - [46, 0.29]
  - - [1600, 3648, 1, 1]
    - [46, 0.28]
  - - [3648, 1600, 1, 1]
    - [46, 0.29]
  - - [1, 2880, 1, 2048]
    - [33, 0.12]
  - - [384, 960, 1, 16]
    - [9, 1.06]
  - - [576, 640, 1, 16]
    - [30, 1.07]
  - - [640, 576, 1, 16]
    - [46, 1.07]
  - - [960, 192, 1, 32]
    - [39, 1.09]
  - - [960, 384, 1, 16]
    - [39, 1.09]
  - - [2880, 32, 1, 64]
    - [30, 1.01]
  - - [2880, 64, 1, 32]
    - [39, 1.1]
  - - [448, 832, 1, 16]
    - [46, 1.11]
  - - [832, 448, 1, 16]
    - [30, 1.1]
  - - [1, 1472, 1, 4096]
    - [24, 0.08]
  - - [16, 1472, 1, 256]
    - [24, 0.74]
  - - [1472, 1, 1, 4096]
    - [48, 0.08]
  - - [1472, 16, 1, 256]
    - [48, 0.76]
  - - [1472, 64, 1, 64]
    - [9, 1.03]
  - - [2112, 2880, 1, 1]
    - [46, 0.29]
  - - [2880, 2112, 1, 1]
    - [39, 0.29]
  - - [192, 1984, 1, 16]
    - [30, 1.09]
  - - [1984, 192, 1, 16]
    - [9, 1.1]
  - - [2368, 2624, 1, 1]
    - [46, 0.29]
  - - [2624, 2368, 1, 1]
    - [39, 0.29]
  - - [320, 1216, 1, 16]
    - [9, 1.12]
  - - [1216, 320, 1, 16]
    - [46, 1.11]
  - - [1600, 3904, 1, 1]
    - [46, 0.29]
  - - [3904, 1600, 1, 1]
    - [46, 0.29]
  - - [1, 2048, 1, 3072]
    - [24, 0.11]
  - - [16, 128, 1, 3072]
    - [23, 0.13]
  - - [16, 192, 1, 2048]
    - [24, 0.18]
  - - [32, 192, 1, 1024]
    - [24, 0.33]
  - - [32, 384, 1, 512]
    - [13, 0.55]
  - - [32, 768, 1, 256]
    - [22, 0.78]
  - - [64, 192, 1, 512]
    - [13, 0.55]
  - - [64, 384, 1, 256]
    - [37, 0.78]
  - - [128, 192, 1, 256]
    - [8, 0.8]
  - - [128, 768, 1, 64]
    - [52, 1.11]
  - - [192, 32, 1, 1024]
    - [24, 0.33]
  - - [192, 64, 1, 512]
    - [23, 0.55]
  - - [192, 128, 1, 256]
    - [15, 0.82]
  - - [192, 512, 1, 64]
    - [52, 1.07]
  - - [256, 384, 1, 64]
    - [57, 1.09]
  - - [384, 16, 1, 1024]
    - [13, 0.33]
  - - [384, 64, 1, 256]
    - [15, 0.82]
  - - [384, 256, 1, 64]
    - [52, 1.08]
  - - [384, 1024, 1, 16]
    - [30, 1.15]
  - - [512, 192, 1, 64]
    - [46, 1.07]
  - - [512, 768, 1, 16]
    - [46, 1.15]
  - - [768, 32, 1, 256]
    - [15, 0.84]
  - - [768, 512, 1, 16]
    - [39, 1.16]
  - - [1024, 192, 1, 32]
    - [46, 1.16]
  - - [1024, 384, 1, 16]
    - [46, 1.15]
  - - [1536, 1, 1, 4096]
    - [48, 0.09]
  - - [1536, 16, 1, 256]
    - [48, 0.8]
  - - [1536, 128, 1, 32]
    - [39, 1.14]
  - - [1536, 256, 1, 16]
    - [39, 1.14]
  - - [1536, 4096, 1, 1]
    - [32, 0.29]
  - - [3072, 32, 1, 64]
    - [25, 1.05]
  - - [3072, 64, 1, 32]
    - [30, 1.13]
  - - [3072, 128, 1, 16]
    - [46, 1.14]
  - - [3072, 2048, 1, 1]
    - [46, 0.28]
  - - [1856, 3392, 1, 1]
    - [46, 0.29]
  - - [3392, 1856, 1, 1]
    - [39, 0.29]
  - - [448, 896, 1, 16]
    - [9, 1.12]
  - - [3136, 32, 1, 64]
    - [46, 1.07]
  - - [3136, 64, 1, 32]
    - [59, 1.1]
  - - [576, 704, 1, 16]
    - [9, 1.17]
  - - [704, 576, 1, 16]
    - [39, 1.17]
  - - [1, 1600, 1, 4096]
    - [23, 0.08]
  - - [16, 1600, 1, 256]
    - [24, 0.81]
  - - [320, 320, 1, 64]
    - [46, 1.11]
  - - [640, 640, 1, 16]
    - [9, 1.18]
  - - [1600, 1, 1, 4096]
    - [13, 0.09]
  - - [1600, 16, 1, 256]
    - [22, 0.82]
  - - [1600, 4096, 1, 1]
    - [9, 0.27]
  - - [4096, 1600, 1, 1]
    - [9, 0.27]
  - - [2112, 3136, 1, 1]
    - [46, 0.3]
  - - [3136, 2112, 1, 1]
    - [46, 0.3]
  - - [192, 1088, 1, 32]
    - [46, 1.12]
  - - [1088, 192, 1, 32]
    - [9, 1.14]
  - - [1856, 3648, 1, 1]
    - [46, 0.3]
  - - [3648, 1856, 1, 1]
    - [46, 0.3]
  - - [16, 832, 1, 512]
    - [24, 0.58]
  - - [32, 832, 1, 256]
    - [13, 0.85]
  - - [128, 832, 1, 64]
    - [46, 1.15]
  - - [512, 832, 1, 16]
    - [9, 1.22]
  - - [832, 32, 1, 256]
    - [29, 0.87]
  - - [832, 512, 1, 16]
    - [46, 1.22]
  - - [2368, 2880, 1, 1]
    - [46, 0.3]
  - - [2880, 2368, 1, 1]
    - [46, 0.3]
  - - [320, 1344, 1, 16]
    - [9, 1.19]
  - - [448, 960, 1, 16]
    - [9, 1.2]
  - - [960, 448, 1, 16]
    - [46, 1.19]
  - - [1344, 320, 1, 16]
    - [30, 1.21]
  - - [2624, 2624, 1, 1]
    - [46, 0.3]
  - - [3392, 32, 1, 64]
    - [53, 1.15]
  - - [3392, 64, 1, 32]
    - [9, 1.17]
  - - [1, 1728, 1, 4096]
    - [23, 0.09]
  - - [1, 2304, 1, 3072]
    - [37, 0.11]
  - - [16, 1728, 1, 256]
    - [24, 0.87]
  - - [192, 576, 1, 64]
    - [46, 1.19]
  - - [576, 768, 1, 16]
    - [9, 1.26]
  - - [768, 576, 1, 16]
    - [30, 1.26]
  - - [1728, 1, 1, 4096]
    - [13, 0.1]
  - - [1728, 16, 1, 256]
    - [22, 0.88]
  - - [3072, 2304, 1, 1]
    - [46, 0.29]
  - - [2112, 3392, 1, 1]
    - [46, 0.3]
  - - [3392, 2112, 1, 1]
    - [46, 0.3]
  - - [640, 704, 1, 16]
    - [30, 1.25]
  - - [704, 640, 1, 16]
    - [30, 1.26]
  - - [1856, 3904, 1, 1]
    - [46, 0.3]
  - - [16, 448, 1, 1024]
    - [24, 0.38]
  - - [16, 896, 1, 512]
    - [24, 0.63]
  - - [32, 448, 1, 512]
    - [22, 0.64]
  - - [32, 896, 1, 256]
    - [13, 0.91]
  - - [64, 448, 1, 256]
    - [33, 0.93]
  - - [128, 896, 1, 64]
    - [9, 1.27]
  - - [256, 448, 1, 64]
    - [9, 1.26]
  - - [448, 16, 1, 1024]
    - [13, 0.38]
  - - [448, 64, 1, 256]
    - [8, 0.92]
  - - [448, 256, 1, 64]
    - [39, 1.24]
  - - [448, 1024, 1, 16]
    - [39, 1.32]
  - - [512, 896, 1, 16]
    - [9, 1.28]
  - - [896, 32, 1, 256]
    - [24, 0.92]
  - - [896, 512, 1, 16]
    - [46, 1.3]
  - - [1024, 448, 1, 16]
    - [9, 1.27]
  - - [2368, 3136, 1, 1]
    - [46, 0.3]
  - - [3136, 2368, 1, 1]
    - [46, 0.3]
  - - [192, 1216, 1, 32]
    - [9, 1.26]
  - - [3648, 32, 1, 64]
    - [39, 1.25]
  - - [3648, 64, 1, 32]
    - [46, 1.27]
  - - [320, 1472, 1, 16]
    - [46, 1.31]
  - - [1472, 320, 1, 16]
    - [9, 1.3]
  - - [2624, 2880, 1, 1]
    - [46, 0.3]
  - - [2880, 2624, 1, 1]
    - [46, 0.3]
  - - [1, 1856, 1, 4096]
    - [24, 0.09]
  - - [16, 1856, 1, 256]
    - [24, 0.94]
  - - [1856, 1, 1, 4096]
    - [13, 0.11]
  - - [1856, 16, 1, 256]
    - [13, 0.94]
  - - [1856, 4096, 1, 1]
    - [32, 0.29]
  - - [4096, 1856, 1, 1]
    - [9, 0.27]
  - - [576, 832, 1, 16]
    - [9, 1.29]
  - - [832, 576, 1, 16]
    - [30, 1.29]
  - - [2112, 3648, 1, 1]
    - [46, 0.3]
  - - [3648, 2112, 1, 1]
    - [46, 0.3]
  - - [448, 1088, 1, 16]
    - [46, 1.31]
  - - [1088, 448, 1, 16]
    - [9, 1.31]
  - - [1, 2560, 1, 3072]
    - [33, 0.12]
  - - [16, 960, 1, 512]
    - [24, 0.67]
  - - [32, 960, 1, 256]
    - [23, 0.98]
  - - [128, 960, 1, 64]
    - [9, 1.33]
  - - [192, 640, 1, 64]
    - [46, 1.35]
  - - [256, 960, 1, 32]
    - [9, 1.35]
  - - [320, 384, 1, 64]
    - [46, 1.35]
  - - [384, 320, 1, 64]
    - [46, 1.35]
  - - [512, 960, 1, 16]
    - [46, 1.35]
  - - [640, 768, 1, 16]
    - [9, 1.34]
  - - [768, 640, 1, 16]
    - [9, 1.33]
  - - [960, 32, 1, 256]
    - [24, 0.99]
  - - [960, 512, 1, 16]
    - [46, 1.35]
  - - [3072, 2560, 1, 1]
    - [46, 0.29]
  - - [704, 704, 1, 16]
    - [46, 1.33]
  - - [3904, 32, 1, 64]
    - [46, 1.34]
  - - [2368, 3392, 1, 1]
    - [46, 0.31]
  - - [3392, 2368, 1, 1]
    - [46, 0.31]
  - - [1, 1984, 1, 4096]
    - [23, 0.1]
  - - [16, 1984, 1, 256]
    - [24, 1.01]
  - - [64, 1984, 1, 64]
    - [30, 1.36]
  - - [1984, 1, 1, 4096]
    - [13, 0.11]
  - - [1984, 16, 1, 256]
    - [22, 1.01]
  - - [320, 1600, 1, 16]
    - [30, 1.39]
  - - [1600, 320, 1, 16]
    - [30, 1.38]
  - - [2624, 3136, 1, 1]
    - [46, 0.31]
  - - [3136, 2624, 1, 1]
    - [46, 0.31]
  - - [2112, 3904, 1, 1]
    - [46, 0.31]
  - - [3904, 2112, 1, 1]
    - [46, 0.31]
  - - [192, 1344, 1, 32]
    - [46, 1.38]
  - - [576, 896, 1, 16]
    - [30, 1.4]
  - - [896, 576, 1, 16]
    - [30, 1.38]
  - - [2880, 2880, 1, 1]
    - [46, 0.31]
  - - [1, 2048, 1, 4096]
    - [23, 0.1]
  - - [16, 512, 1, 1024]
    - [24, 0.44]
  - - [16, 1024, 1, 512]
    - [24, 0.72]
  - - [16, 2048, 1, 256]
    - [23, 1.04]
  - - [32, 32, 1, 8192]
    - [13, 0.07]
  - - [32, 256, 1, 1024]
    - [24, 0.44]
  - - [32, 512, 1, 512]
    - [13, 0.73]
  - - [32, 1024, 1, 256]
    - [22, 1.04]
  - - [64, 32, 1, 4096]
    - [23, 0.13]
  - - [64, 128, 1, 1024]
    - [24, 0.44]
  - - [64, 512, 1, 256]
    - [37, 1.04]
  - - [128, 128, 1, 512]
    - [13, 0.73]
  - - [128, 256, 1, 256]
    - [29, 1.05]
  - - [128, 1024, 1, 64]
    - [39, 1.41]
  - - [128, 2048, 1, 32]
    - [39, 1.44]
  - - [256, 128, 1, 256]
    - [33, 1.07]
  - - [256, 512, 1, 64]
    - [9, 1.43]
  - - [256, 1024, 1, 32]
    - [39, 1.43]
  - - [256, 2048, 1, 16]
    - [46, 1.41]
  - - [512, 16, 1, 1024]
    - [13, 0.44]
  - - [512, 64, 1, 256]
    - [33, 1.04]
  - - [512, 256, 1, 64]
    - [9, 1.41]
  - - [512, 1024, 1, 16]
    - [39, 1.43]
  - - [1024, 32, 1, 256]
    - [37, 1.04]
  - - [1024, 512, 1, 16]
    - [39, 1.4]
  - - [4096, 32, 1, 64]
    - [30, 1.38]
  - - [8192, 1024, 1, 1]
    - [9, 0.28]
  - - [320, 832, 1, 32]
    - [32, 1.36]
  - - [640, 832, 1, 16]
    - [44, 1.43]
  - - [832, 640, 1, 16]
    - [59, 1.43]
  - - [2368, 3648, 1, 1]
    - [46, 0.31]
  - - [3648, 2368, 1, 1]
    - [46, 0.31]
  - - [16, 2112, 1, 256]
    - [33, 0.93]
  - - [64, 2112, 1, 64]
    - [39, 1.35]
  - - [704, 768, 1, 16]
    - [51, 1.45]
  - - [768, 704, 1, 16]
    - [32, 1.45]
  - - [2112, 1, 1, 4096]
    - [42, 0.11]
  - - [2112, 16, 1, 256]
    - [31, 1.01]
  - - [2112, 4096, 1, 1]
    - [32, 0.29]
  - - [3072, 2816, 1, 1]
    - [46, 0.3]
  - - [4096, 2112, 1, 1]
    - [9, 0.28]
  - - [1216, 448, 1, 16]
    - [30, 1.45]
  - - [320, 1728, 1, 16]
    - [46, 1.45]
  - - [576, 960, 1, 16]
    - [9, 1.47]
  - - [960, 576, 1, 16]
    - [9, 1.47]
  - - [1728, 320, 1, 16]
    - [9, 1.48]
  - - [2624, 3392, 1, 1]
    - [46, 0.31]
  - - [3392, 2624, 1, 1]
    - [46, 0.31]
  - - [16, 1088, 1, 512]
    - [33, 0.69]
  - - [32, 1088, 1, 256]
    - [29, 0.97]
  - - [1088, 32, 1, 256]
    - [31, 1.06]
  - - [2880, 3136, 1, 1]
    - [46, 0.31]
  - - [3136, 2880, 1, 1]
    - [46, 0.31]
  - - [192, 1472, 1, 32]
    - [44, 1.46]
  - - [320, 448, 1, 64]
    - [57, 1.43]
  - - [320, 896, 1, 32]
    - [9, 1.54]
  - - [448, 320, 1, 64]
    - [39, 1.49]
  - - [640, 896, 1, 16]
    - [46, 1.53]
  - - [896, 640, 1, 16]
    - [30, 1.54]
  - - [2368, 3904, 1, 1]
    - [46, 0.31]
  - - [3904, 2368, 1, 1]
    - [46, 0.31]
  - - [704, 832, 1, 16]
    - [9, 1.56]
  - - [832, 704, 1, 16]
    - [39, 1.55]
  - - [16, 192, 1, 3072]
    - [24, 0.19]
  - - [16, 576, 1, 1024]
    - [24, 0.49]
  - - [32, 576, 1, 512]
    - [13, 0.74]
  - - [64, 576, 1, 256]
    - [56, 1.09]
  - - [192, 768, 1, 64]
    - [59, 1.47]
  - - [256, 576, 1, 64]
    - [25, 1.47]
  - - [384, 384, 1, 64]
    - [46, 1.52]
  - - [384, 768, 1, 32]
    - [46, 1.57]
  - - [576, 16, 1, 1024]
    - [13, 0.49]
  - - [576, 64, 1, 256]
    - [55, 1.14]
  - - [768, 768, 1, 16]
    - [39, 1.58]
  - - [1024, 576, 1, 16]
    - [46, 1.57]
  - - [3072, 3072, 1, 1]
    - [46, 0.3]
  - - [320, 1856, 1, 16]
    - [9, 1.54]
  - - [1856, 320, 1, 16]
    - [51, 1.55]
  - - [2624, 3648, 1, 1]
    - [46, 0.31]
  - - [3648, 2624, 1, 1]
    - [46, 0.31]
  - - [1344, 448, 1, 16]
    - [9, 1.56]
  - - [16, 2368, 1, 256]
    - [28, 1.04]
  - - [64, 2368, 1, 64]
    - [9, 1.51]
  - - [2368, 1, 1, 4096]
    - [42, 0.12]
  - - [2368, 16, 1, 256]
    - [31, 1.13]
  - - [2368, 64, 1, 64]
    - [39, 1.51]
  - - [2368, 4096, 1, 1]
    - [46, 0.3]
  - - [4096, 2368, 1, 1]
    - [9, 0.28]
  - - [2880, 3392, 1, 1]
    - [46, 0.31]
  - - [3392, 2880, 1, 1]
    - [46, 0.31]
  - - [192, 1600, 1, 32]
    - [59, 1.6]
  - - [320, 960, 1, 32]
    - [51, 1.58]
  - - [960, 640, 1, 16]
    - [39, 1.6]
  - - [3136, 3136, 1, 1]
    - [46, 0.31]
  - - [16, 1216, 1, 512]
    - [37, 0.77]
  - - [32, 1216, 1, 256]
    - [8, 1.08]
  - - [1216, 16, 1, 512]
    - [38, 0.8]
  - - [1216, 32, 1, 256]
    - [55, 1.16]
  - - [1088, 576, 1, 16]
    - [51, 1.62]
  - - [448, 704, 1, 32]
    - [59, 1.64]
  - - [704, 896, 1, 16]
    - [9, 1.63]
  - - [896, 704, 1, 16]
    - [46, 1.62]
  - - [320, 1984, 1, 16]
    - [39, 1.62]
  - - [192, 832, 1, 64]
    - [46, 1.6]
  - - [384, 832, 1, 32]
    - [30, 1.63]
  - - [768, 832, 1, 16]
    - [39, 1.65]
  - - [832, 768, 1, 16]
    - [39, 1.63]
  - - [3072, 3328, 1, 1]
    - [46, 0.31]
  - - [2624, 3904, 1, 1]
    - [46, 0.32]
  - - [3904, 2624, 1, 1]
    - [46, 0.32]
  - - [16, 640, 1, 1024]
    - [23, 0.54]
  - - [64, 320, 1, 512]
    - [15, 0.85]
  - - [64, 640, 1, 256]
    - [56, 1.22]
  - - [128, 320, 1, 256]
    - [55, 1.27]
  - - [256, 640, 1, 64]
    - [57, 1.61]
  - - [320, 16, 1, 2048]
    - [13, 0.3]
  - - [320, 32, 1, 1024]
    - [24, 0.55]
  - - [320, 64, 1, 512]
    - [43, 0.87]
  - - [320, 128, 1, 256]
    - [56, 1.24]
  - - [320, 512, 1, 64]
    - [32, 1.64]
  - - [320, 1024, 1, 32]
    - [46, 1.73]
  - - [512, 320, 1, 64]
    - [51, 1.63]
  - - [512, 640, 1, 32]
    - [46, 1.72]
  - - [640, 16, 1, 1024]
    - [13, 0.55]
  - - [640, 64, 1, 256]
    - [56, 1.24]
  - - [1024, 640, 1, 16]
    - [51, 1.7]
  - - [2880, 3648, 1, 1]
    - [46, 0.32]
  - - [3648, 2880, 1, 1]
    - [46, 0.32]
  - - [1472, 448, 1, 16]
    - [51, 1.65]
  - - [192, 1728, 1, 32]
    - [30, 1.66]
  - - [3136, 3392, 1, 1]
    - [46, 0.32]
  - - [3392, 3136, 1, 1]
    - [46, 0.32]
  - - [16, 2624, 1, 256]
    - [37, 1.14]
  - - [64, 2624, 1, 64]
    - [46, 1.67]
  - - [2624, 1, 1, 4096]
    - [42, 0.14]
  - - [2624, 16, 1, 256]
    - [31, 1.23]
  - - [2624, 64, 1, 64]
    - [46, 1.68]
  - - [4096, 2624, 1, 1]
    - [9, 0.29]
  - - [320, 2112, 1, 16]
    - [51, 1.68]
  - - [960, 704, 1, 16]
    - [32, 1.68]
  - - [16, 1344, 1, 512]
    - [37, 0.85]
  - - [32, 1344, 1, 256]
    - [29, 1.19]
  - - [192, 896, 1, 64]
    - [51, 1.72]
  - - [384, 448, 1, 64]
    - [51, 1.7]
  - - [384, 896, 1, 32]
    - [39, 1.7]
  - - [448, 384, 1, 64]
    - [59, 1.73]
  - - [448, 768, 1, 32]
    - [44, 1.72]
  - - [896, 768, 1, 16]
    - [46, 1.78]
  - - [1344, 16, 1, 512]
    - [38, 0.89]
  - - [1344, 32, 1, 256]
    - [55, 1.29]
  - - [3072, 3584, 1, 1]
    - [46, 0.31]
  - - [320, 1088, 1, 32]
    - [39, 1.74]
  - - [1216, 576, 1, 16]
    - [51, 1.73]
  - - [3904, 2880, 1, 1]
    - [46, 0.32]
  - - [3136, 3648, 1, 1]
    - [46, 0.32]
  - - [3648, 3136, 1, 1]
    - [46, 0.32]
  - - [3392, 3392, 1, 1]
    - [46, 0.32]
  - - [16, 704, 1, 1024]
    - [24, 0.6]
  - - [64, 704, 1, 256]
    - [37, 1.24]
  - - [256, 704, 1, 64]
    - [30, 1.8]
  - - [512, 704, 1, 32]
    - [57, 1.77]
  - - [704, 16, 1, 1024]
    - [13, 0.6]
  - - [704, 64, 1, 256]
    - [55, 1.37]
  - - [1024, 704, 1, 16]
    - [9, 1.77]
  - - [64, 2880, 1, 64]
    - [39, 1.82]
  - - [192, 960, 1, 64]
    - [9, 1.84]
  - - [320, 576, 1, 64]
    - [32, 1.85]
  - - [384, 960, 1, 32]
    - [44, 1.84]
  - - [576, 640, 1, 32]
    - [32, 1.84]
  - - [2880, 1, 1, 4096]
    - [42, 0.15]
  - - [2880, 64, 1, 64]
    - [46, 1.84]
  - - [4096, 2880, 1, 1]
    - [9, 0.29]
  - - [448, 832, 1, 32]
    - [46, 1.84]
  - - [16, 1472, 1, 512]
    - [37, 0.93]
  - - [32, 1472, 1, 256]
    - [29, 1.29]
  - - [1472, 16, 1, 512]
    - [48, 0.97]
  - - [1472, 32, 1, 256]
    - [55, 1.39]
  - - [192, 1984, 1, 32]
    - [30, 1.91]
  - - [3904, 3136, 1, 1]
    - [46, 0.32]
  - - [1088, 704, 1, 16]
    - [39, 1.88]
  - - [1344, 576, 1, 16]
    - [46, 1.9]
  - - [320, 1216, 1, 32]
    - [46, 1.94]
  - - [16, 768, 1, 1024]
    - [24, 0.65]
  - - [64, 384, 1, 512]
    - [24, 0.98]
  - - [64, 768, 1, 256]
    - [8, 1.35]
  - - [128, 192, 1, 512]
    - [37, 1.0]
  - - [192, 64, 1, 1024]
    - [13, 0.66]
  - - [192, 128, 1, 512]
    - [43, 1.05]
  - - [192, 1024, 1, 64]
    - [46, 1.94]
  - - [256, 768, 1, 64]
    - [9, 1.96]
  - - [384, 16, 1, 2048]
    - [13, 0.37]
  - - [384, 32, 1, 1024]
    - [23, 0.66]
  - - [384, 64, 1, 512]
    - [43, 1.06]
  - - [384, 512, 1, 64]
    - [46, 1.95]
  - - [384, 1024, 1, 32]
    - [46, 1.96]
  - - [512, 768, 1, 32]
    - [46, 1.95]
  - - [768, 64, 1, 256]
    - [58, 1.49]
  - - [1024, 768, 1, 16]
    - [46, 1.95]
  - - [1536, 16, 1, 512]
    - [48, 1.01]
  - - [1536, 32, 1, 256]
    - [56, 1.47]
  - - [1536, 512, 1, 16]
    - [46, 1.96]
  - - [3072, 1, 1, 4096]
    - [42, 0.16]
  - - [960, 832, 1, 16]
    - [46, 1.92]
  - - [1, 3136, 1, 4096]
    - [21, 0.11]
  - - [64, 3136, 1, 64]
    - [46, 1.8]
  - - [448, 896, 1, 32]
    - [46, 1.93]
  - - [896, 896, 1, 16]
    - [46, 1.95]
  - - [3136, 1, 1, 4096]
    - [42, 0.16]
  - - [3136, 64, 1, 64]
    - [46, 1.77]
  - - [16, 1600, 1, 512]
    - [24, 1.02]
  - - [32, 1600, 1, 256]
    - [29, 1.27]
  - - [320, 640, 1, 64]
    - [46, 1.83]
  - - [1600, 16, 1, 512]
    - [13, 1.03]
  - - [1600, 32, 1, 256]
    - [26, 1.32]
  - - [1856, 448, 1, 16]
    - [46, 2.02]
  - - [192, 1088, 1, 64]
    - [39, 1.86]
  - - [1472, 576, 1, 16]
    - [46, 2.04]
  - - [16, 832, 1, 1024]
    - [23, 0.71]
  - - [32, 832, 1, 512]
    - [13, 1.07]
  - - [64, 832, 1, 256]
    - [56, 1.34]
  - - [256, 832, 1, 64]
    - [9, 1.9]
  - - [512, 832, 1, 32]
    - [46, 2.03]
  - - [832, 32, 1, 512]
    - [24, 1.08]
  - - [832, 64, 1, 256]
    - [26, 1.35]
  - - [832, 1024, 1, 16]
    - [46, 2.06]
  - - [1024, 832, 1, 16]
    - [46, 2.02]
  - - [704, 1216, 1, 16]
    - [46, 1.98]
  - - [1216, 704, 1, 16]
    - [46, 1.99]
  - - [320, 1344, 1, 32]
    - [46, 2.02]
  - - [448, 960, 1, 32]
    - [46, 2.02]
  - - [896, 960, 1, 16]
    - [39, 1.98]
  - - [960, 896, 1, 16]
    - [39, 1.99]
  - - [1344, 320, 1, 32]
    - [46, 2.01]
  - - [1, 3392, 1, 4096]
    - [21, 0.12]
  - - [3392, 1, 1, 4096]
    - [42, 0.17]
  - - [3392, 64, 1, 64]
    - [32, 1.91]
  - - [16, 1728, 1, 512]
    - [23, 1.1]
  - - [32, 1728, 1, 256]
    - [21, 1.38]
  - - [1728, 16, 1, 512]
    - [22, 1.11]
  - - [1728, 32, 1, 256]
    - [55, 1.41]
  - - [1984, 448, 1, 16]
    - [39, 2.04]
  - - [320, 704, 1, 64]
    - [46, 2.0]
  - - [832, 1088, 1, 16]
    - [46, 2.09]
  - - [1088, 832, 1, 16]
    - [39, 2.08]
  - - [16, 896, 1, 1024]
    - [24, 0.76]
  - - [32, 896, 1, 512]
    - [13, 1.15]
  - - [64, 448, 1, 512]
    - [13, 1.15]
  - - [64, 896, 1, 256]
    - [56, 1.43]
  - - [256, 896, 1, 64]
    - [9, 2.03]
  - - [448, 16, 1, 2048]
    - [22, 0.43]
  - - [448, 32, 1, 1024]
    - [24, 0.77]
  - - [448, 64, 1, 512]
    - [29, 1.15]
  - - [448, 1024, 1, 32]
    - [30, 2.13]
  - - [896, 32, 1, 512]
    - [24, 1.15]
  - - [896, 64, 1, 256]
    - [55, 1.45]
  - - [896, 1024, 1, 16]
    - [39, 2.12]
  - - [1024, 448, 1, 32]
    - [39, 2.12]
  - - [1024, 896, 1, 16]
    - [39, 2.11]
  - - [320, 2880, 1, 16]
    - [46, 2.1]
  - - [576, 1600, 1, 16]
    - [46, 2.1]
  - - [960, 960, 1, 16]
    - [46, 2.08]
  - - [1600, 576, 1, 16]
    - [46, 2.08]
  - - [1, 3648, 1, 4096]
    - [21, 0.12]
  - - [64, 3648, 1, 64]
    - [46, 2.07]
  - - [192, 1216, 1, 64]
    - [39, 2.09]
  - - [3648, 1, 1, 4096]
    - [42, 0.18]
  - - [3648, 64, 1, 64]
    - [59, 2.04]
  - - [320, 1472, 1, 32]
    - [39, 2.12]
  - - [1472, 320, 1, 32]
    - [46, 2.11]
  - - [704, 1344, 1, 16]
    - [46, 2.14]
  - - [1344, 704, 1, 16]
    - [46, 2.13]
  - - [16, 1856, 1, 512]
    - [23, 1.19]
  - - [1856, 16, 1, 512]
    - [22, 1.19]
  - - [448, 1088, 1, 32]
    - [46, 2.18]
  - - [1088, 448, 1, 32]
    - [46, 2.17]
  - - [16, 320, 1, 3072]
    - [24, 0.32]
  - - [16, 960, 1, 1024]
    - [23, 0.81]
  - - [32, 960, 1, 512]
    - [23, 1.23]
  - - [64, 960, 1, 256]
    - [35, 1.53]
  - - [256, 960, 1, 64]
    - [30, 2.17]
  - - [960, 32, 1, 512]
    - [23, 1.23]
  - - [960, 64, 1, 256]
    - [55, 1.57]
  - - [960, 512, 1, 32]
    - [39, 2.21]
  - - [960, 1024, 1, 16]
    - [46, 2.21]
  - - [1024, 960, 1, 16]
    - [46, 2.19]
  - - [576, 1728, 1, 16]
    - [46, 2.18]
  - - [1728, 576, 1, 16]
    - [46, 2.19]
  - - [1, 3904, 1, 4096]
    - [33, 0.13]
  - - [64, 3904, 1, 64]
    - [46, 2.21]
  - - [3904, 4096, 1, 1]
    - [46, 0.33]
  - - [320, 3136, 1, 16]
    - [39, 2.2]
  - - [832, 1216, 1, 16]
    - [46, 2.21]
  - - [1216, 832, 1, 16]
    - [46, 2.21]
  - - [16, 1984, 1, 512]
    - [24, 1.27]
  - - [1984, 16, 1, 512]
    - [8, 1.26]
  - - [320, 1600, 1, 32]
    - [46, 2.28]
  - - [1600, 320, 1, 32]
    - [46, 2.26]
  - - [192, 1344, 1, 64]
    - [46, 2.27]
  - - [896, 576, 1, 32]
    - [39, 2.29]
  - - [1344, 192, 1, 64]
    - [39, 2.27]
  - - [704, 1472, 1, 16]
    - [46, 2.26]
  - - [1472, 704, 1, 16]
    - [46, 2.25]
  - - [960, 1088, 1, 16]
    - [9, 2.18]
  - - [1088, 960, 1, 16]
    - [30, 2.16]
  - - [1, 4096, 1, 4096]
    - [35, 0.12]
  - - [16, 256, 1, 4096]
    - [24, 0.26]
  - - [16, 1024, 1, 1024]
    - [24, 0.87]
  - - [16, 2048, 1, 512]
    - [23, 1.31]
  - - [32, 128, 1, 4096]
    - [24, 0.26]
  - - [32, 1024, 1, 512]
    - [24, 1.31]
  - - [32, 4096, 1, 128]
    - [59, 2.17]
  - - [32, 8192, 1, 64]
    - [32, 2.25]
  - - [64, 64, 1, 4096]
    - [22, 0.26]
  - - [64, 512, 1, 512]
    - [24, 1.31]
  - - [64, 1024, 1, 256]
    - [55, 1.63]
  - - [64, 4096, 1, 64]
    - [46, 2.32]
  - - [128, 16, 1, 8192]
    - [24, 0.13]
  - - [128, 128, 1, 1024]
    - [13, 0.87]
  - - [128, 256, 1, 512]
    - [22, 1.31]
  - - [256, 32, 1, 2048]
    - [13, 0.49]
  - - [256, 64, 1, 1024]
    - [23, 0.87]
  - - [256, 128, 1, 512]
    - [33, 1.31]
  - - [256, 1024, 1, 64]
    - [46, 2.3]
  - - [256, 2048, 1, 32]
    - [46, 2.32]
  - - [256, 4096, 1, 16]
    - [30, 2.17]
  - - [512, 32, 1, 1024]
    - [13, 0.87]
  - - [512, 64, 1, 512]
    - [33, 1.31]
  - - [1024, 32, 1, 512]
    - [37, 1.31]
  - - [1024, 64, 1, 256]
    - [56, 1.66]
  - - [1024, 512, 1, 32]
    - [39, 2.32]
  - - [1024, 1024, 1, 16]
    - [9, 2.16]
  - - [4096, 4096, 1, 1]
    - [46, 0.33]
  - - [8192, 32, 1, 64]
    - [46, 2.26]
  - - [832, 640, 1, 32]
    - [39, 2.26]
  - - [576, 1856, 1, 16]
    - [46, 2.27]
  - - [1856, 576, 1, 16]
    - [46, 2.27]
  - - [16, 2112, 1, 512]
    - [33, 1.21]
  - - [768, 704, 1, 32]
    - [46, 2.3]
  - - [2112, 16, 1, 512]
    - [58, 1.27]
  - - [320, 3392, 1, 16]
    - [46, 2.31]
  - - [3392, 320, 1, 16]
    - [39, 2.3]
  - - [1216, 448, 1, 32]
    - [46, 2.3]
  - - [320, 1728, 1, 32]
    - [46, 2.34]
  - - [960, 576, 1, 32]
    - [46, 2.35]
  - - [1728, 320, 1, 32]
    - [46, 2.33]
  - - [16, 1088, 1, 1024]
    - [23, 0.83]
  - - [32, 1088, 1, 512]
    - [8, 1.25]
  - - [1088, 32, 1, 512]
    - [58, 1.31]
  - - [832, 1344, 1, 16]
    - [46, 2.32]
  - - [1344, 832, 1, 16]
    - [46, 2.32]
  - - [704, 1600, 1, 16]
    - [46, 2.33]
  - - [1600, 704, 1, 16]
    - [39, 2.33]
  - - [192, 1472, 1, 64]
    - [46, 2.26]
  - - [1472, 192, 1, 64]
    - [46, 2.25]
  - - [576, 1984, 1, 16]
    - [46, 2.36]
  - - [1984, 576, 1, 16]
    - [46, 2.36]
  - - [320, 896, 1, 64]
    - [46, 2.28]
  - - [896, 640, 1, 32]
    - [46, 2.42]
  - - [320, 3648, 1, 16]
    - [46, 2.42]
  - - [960, 1216, 1, 16]
    - [46, 2.41]
  - - [1216, 960, 1, 16]
    - [46, 2.41]
  - - [3648, 320, 1, 16]
    - [46, 2.41]
  - - [704, 832, 1, 32]
    - [46, 2.46]
  - - [832, 704, 1, 32]
    - [46, 2.47]
  - - [16, 384, 1, 3072]
    - [24, 0.38]
  - - [32, 192, 1, 3072]
    - [22, 0.38]
  - - [64, 576, 1, 512]
    - [56, 1.38]
  - - [192, 192, 1, 512]
    - [56, 1.42]
  - - [576, 16, 1, 2048]
    - [13, 0.55]
  - - [576, 64, 1, 512]
    - [56, 1.41]
  - - [768, 768, 1, 32]
    - [46, 2.47]
  - - [1024, 576, 1, 32]
    - [46, 2.48]
  - - [3072, 192, 1, 32]
    - [46, 2.46]
  - - [3072, 384, 1, 16]
    - [39, 2.41]
  - - [1088, 1088, 1, 16]
    - [46, 2.39]
  - - [320, 1856, 1, 32]
    - [39, 2.4]
  - - [1856, 320, 1, 32]
    - [39, 2.39]
  - - [448, 1344, 1, 32]
    - [39, 2.42]
  - - [1344, 448, 1, 32]
    - [46, 2.41]
  - - [16, 2368, 1, 512]
    - [37, 1.34]
  - - [2368, 16, 1, 512]
    - [31, 1.42]
  - - [576, 2112, 1, 16]
    - [46, 2.44]
  - - [704, 1728, 1, 16]
    - [39, 2.43]
  - - [1728, 704, 1, 16]
    - [46, 2.44]
  - - [2112, 576, 1, 16]
    - [46, 2.44]
  - - [832, 1472, 1, 16]
    - [46, 2.45]
  - - [1472, 832, 1, 16]
    - [39, 2.44]
  - - [192, 1600, 1, 64]
    - [46, 2.44]
  - - [320, 960, 1, 64]
    - [46, 2.45]
  - - [960, 640, 1, 32]
    - [46, 2.47]
  - - [16, 1216, 1, 1024]
    - [24, 0.92]
  - - [32, 1216, 1, 512]
    - [8, 1.39]
  - - [1216, 32, 1, 512]
    - [58, 1.46]
  - - [320, 3904, 1, 16]
    - [39, 2.46]
  - - [3904, 320, 1, 16]
    - [46, 2.47]
  - - [576, 1088, 1, 32]
    - [39, 2.5]
  - - [1088, 576, 1, 32]
    - [39, 2.51]
  - - [704, 896, 1, 32]
    - [39, 2.53]
  - - [896, 704, 1, 32]
    - [39, 2.52]
  - - [320, 1984, 1, 32]
    - [39, 2.55]
  - - [1984, 320, 1, 32]
    - [46, 2.53]
  - - [384, 832, 1, 64]
    - [39, 2.54]
  - - [768, 832, 1, 32]
    - [46, 2.55]
  - - [832, 768, 1, 32]
    - [39, 2.56]
  - - [960, 1344, 1, 16]
    - [46, 2.52]
  - - [1344, 960, 1, 16]
    - [46, 2.52]
  - - [704, 1856, 1, 16]
    - [39, 2.39]
  - - [1856, 704, 1, 16]
    - [39, 2.53]
  - - [16, 320, 1, 4096]
    - [24, 0.32]
  - - [16, 640, 1, 2048]
    - [24, 0.6]
  - - [64, 320, 1, 1024]
    - [43, 1.03]
  - - [128, 320, 1, 512]
    - [56, 1.55]
  - - [320, 32, 1, 2048]
    - [23, 0.61]
  - - [320, 64, 1, 1024]
    - [15, 1.04]
  - - [320, 128, 1, 512]
    - [56, 1.57]
  - - [320, 1024, 1, 64]
    - [39, 2.59]
  - - [320, 4096, 1, 16]
    - [46, 2.45]
  - - [640, 16, 1, 2048]
    - [22, 0.61]
  - - [640, 1024, 1, 32]
    - [46, 2.61]
  - - [1024, 640, 1, 32]
    - [39, 2.62]
  - - [4096, 320, 1, 16]
    - [30, 2.32]
  - - [448, 1472, 1, 32]
    - [39, 2.55]
  - - [1472, 448, 1, 32]
    - [46, 2.53]
  - - [1088, 1216, 1, 16]
    - [39, 2.51]
  - - [1216, 1088, 1, 16]
    - [39, 2.51]
  - - [192, 1728, 1, 64]
    - [46, 2.37]
  - - [832, 1600, 1, 16]
    - [46, 2.54]
  - - [16, 2624, 1, 512]
    - [37, 1.48]
  - - [2624, 16, 1, 512]
    - [58, 1.57]
  - - [320, 2112, 1, 32]
    - [39, 2.6]
  - - [704, 960, 1, 32]
    - [39, 2.58]
  - - [960, 704, 1, 32]
    - [46, 2.58]
  - - [2112, 320, 1, 32]
    - [39, 2.56]
  - - [576, 2368, 1, 16]
    - [39, 2.55]
  - - [2368, 576, 1, 16]
    - [39, 2.57]
  - - [16, 1344, 1, 1024]
    - [23, 1.03]
  - - [32, 1344, 1, 512]
    - [8, 1.53]
  - - [384, 896, 1, 64]
    - [46, 2.44]
  - - [448, 768, 1, 64]
    - [39, 2.42]
  - - [768, 896, 1, 32]
    - [39, 2.64]
  - - [896, 768, 1, 32]
    - [46, 2.62]
  - - [1344, 32, 1, 512]
    - [56, 1.62]
  - - [3072, 448, 1, 16]
    - [39, 2.38]
  - - [832, 832, 1, 32]
    - [39, 2.65]
  - - [320, 1088, 1, 64]
    - [39, 2.46]
  - - [704, 1984, 1, 16]
    - [39, 2.56]
  - - [1984, 704, 1, 16]
    - [39, 2.54]
  - - [576, 1216, 1, 32]
    - [39, 2.69]
  - - [1216, 576, 1, 32]
    - [39, 2.68]
  - - [960, 1472, 1, 16]
    - [39, 2.55]
  - - [1472, 960, 1, 16]
    - [39, 2.56]
  - - [192, 1856, 1, 64]
    - [39, 2.51]
  - - [448, 1600, 1, 32]
    - [46, 2.73]
  - - [1600, 448, 1, 32]
    - [46, 2.74]
  - - [832, 1728, 1, 16]
    - [32, 2.46]
  - - [1728, 832, 1, 16]
    - [39, 2.54]
  - - [16, 704, 1, 2048]
    - [24, 0.66]
  - - [32, 704, 1, 1024]
    - [24, 1.07]
  - - [64, 704, 1, 512]
    - [33, 1.62]
  - - [512, 704, 1, 64]
    - [39, 2.55]
  - - [704, 16, 1, 2048]
    - [13, 0.67]
  - - [704, 64, 1, 512]
    - [58, 1.72]
  - - [704, 1024, 1, 32]
    - [39, 2.76]
  - - [1024, 704, 1, 32]
    - [39, 2.74]
  - - [1088, 1344, 1, 16]
    - [46, 2.52]
  - - [1344, 1088, 1, 16]
    - [39, 2.53]
  - - [16, 2880, 1, 512]
    - [37, 1.62]
  - - [384, 960, 1, 64]
    - [39, 2.6]
  - - [576, 640, 1, 64]
    - [39, 2.59]
  - - [768, 960, 1, 32]
    - [39, 2.62]
  - - [960, 768, 1, 32]
    - [39, 2.65]
  - - [2880, 16, 1, 512]
    - [31, 1.71]
  - - [1216, 1216, 1, 16]
    - [39, 2.57]
  - - [448, 832, 1, 64]
    - [39, 2.61]
  - - [832, 896, 1, 32]
    - [39, 2.64]
  - - [896, 832, 1, 32]
    - [39, 2.65]
  - - [16, 1472, 1, 1024]
    - [24, 1.13]
  - - [32, 1472, 1, 512]
    - [29, 1.67]
  - - [1472, 32, 1, 512]
    - [55, 1.76]
  - - [576, 2624, 1, 16]
    - [39, 2.58]
  - - [2624, 576, 1, 16]
    - [39, 2.56]
  - - [320, 2368, 1, 32]
    - [39, 2.69]
  - - [704, 1088, 1, 32]
    - [39, 2.72]
  - - [1088, 704, 1, 32]
    - [39, 2.7]
  - - [1600, 960, 1, 16]
    - [39, 2.61]
  - - [832, 1856, 1, 16]
    - [39, 2.62]
  - - [1856, 832, 1, 16]
    - [39, 2.62]
  - - [448, 1728, 1, 32]
    - [39, 2.74]
  - - [576, 1344, 1, 32]
    - [39, 2.73]
  - - [1344, 576, 1, 32]
    - [39, 2.73]
  - - [320, 1216, 1, 64]
    - [39, 2.71]
  - - [16, 768, 1, 2048]
    - [23, 0.72]
  - - [32, 768, 1, 1024]
    - [24, 1.18]
  - - [64, 384, 1, 1024]
    - [24, 1.2]
  - - [64, 768, 1, 512]
    - [37, 1.76]
  - - [128, 192, 1, 1024]
    - [24, 1.19]
  - - [128, 384, 1, 512]
    - [33, 1.76]
  - - [192, 128, 1, 1024]
    - [43, 1.24]
  - - [384, 32, 1, 2048]
    - [22, 0.73]
  - - [384, 64, 1, 1024]
    - [15, 1.25]
  - - [384, 128, 1, 512]
    - [58, 1.88]
  - - [384, 1024, 1, 64]
    - [39, 2.77]
  - - [384, 2048, 1, 32]
    - [39, 2.81]
  - - [384, 4096, 1, 16]
    - [32, 2.56]
  - - [512, 768, 1, 64]
    - [39, 2.76]
  - - [768, 16, 1, 2048]
    - [13, 0.73]
  - - [768, 64, 1, 512]
    - [31, 1.84]
  - - [768, 1024, 1, 32]
    - [39, 2.76]
  - - [768, 2048, 1, 16]
    - [32, 2.54]
  - - [1024, 768, 1, 32]
    - [39, 2.78]
  - - [1536, 32, 1, 512]
    - [56, 1.84]
  - - [1536, 512, 1, 32]
    - [39, 2.77]
  - - [1536, 1024, 1, 16]
    - [51, 2.55]
  - - [3072, 16, 1, 512]
    - [58, 1.81]
  - - [3072, 256, 1, 32]
    - [46, 2.76]
  - - [3072, 512, 1, 16]
    - [30, 2.53]
  - - [832, 960, 1, 32]
    - [46, 2.72]
  - - [960, 832, 1, 32]
    - [39, 2.72]
  - - [1088, 1472, 1, 16]
    - [39, 2.67]
  - - [1472, 1088, 1, 16]
    - [39, 2.67]
  - - [16, 3136, 1, 512]
    - [35, 1.53]
  - - [448, 896, 1, 64]
    - [39, 2.63]
  - - [896, 896, 1, 32]
    - [39, 2.74]
  - - [3136, 16, 1, 512]
    - [26, 1.62]
  - - [576, 704, 1, 64]
    - [39, 2.66]
  - - [1216, 1344, 1, 16]
    - [32, 2.61]
  - - [1344, 1216, 1, 16]
    - [51, 2.64]
  - - [16, 1600, 1, 1024]
    - [23, 1.23]
  - - [32, 1600, 1, 512]
    - [21, 1.58]
  - - [1600, 32, 1, 512]
    - [45, 1.67]
  - - [832, 1984, 1, 16]
    - [39, 2.69]
  - - [1984, 832, 1, 16]
    - [39, 2.69]
  - - [576, 2880, 1, 16]
    - [39, 2.72]
  - - [960, 1728, 1, 16]
    - [39, 2.71]
  - - [1728, 960, 1, 16]
    - [39, 2.7]
  - - [2880, 576, 1, 16]
    - [39, 2.69]
  - - [448, 1856, 1, 32]
    - [39, 2.83]
  - - [1856, 448, 1, 32]
    - [39, 2.83]
  - - [2624, 320, 1, 32]
    - [46, 2.86]
  - - [576, 1472, 1, 32]
    - [39, 2.87]
  - - [1472, 576, 1, 32]
    - [39, 2.89]
  - - [16, 832, 1, 2048]
    - [24, 0.78]
  - - [32, 832, 1, 1024]
    - [23, 1.29]
  - - [64, 832, 1, 512]
    - [56, 1.66]
  - - [512, 832, 1, 64]
    - [39, 2.8]
  - - [832, 16, 1, 2048]
    - [22, 0.79]
  - - [832, 64, 1, 512]
    - [45, 1.72]
  - - [832, 1024, 1, 32]
    - [39, 2.9]
  - - [1024, 832, 1, 32]
    - [39, 2.91]
  - - [704, 1216, 1, 32]
    - [46, 2.84]
  - - [1216, 704, 1, 32]
    - [46, 2.83]
  - - [320, 1344, 1, 64]
    - [39, 2.8]
  - - [448, 960, 1, 64]
    - [46, 2.82]
  - - [896, 960, 1, 32]
    - [39, 2.84]
  - - [960, 896, 1, 32]
    - [46, 2.85]
  - - [1088, 1600, 1, 16]
    - [39, 2.76]
  - - [1600, 1088, 1, 16]
    - [39, 2.76]
  - - [832, 2112, 1, 16]
    - [39, 2.8]
  - - [2112, 832, 1, 16]
    - [39, 2.81]
  - - [16, 576, 1, 3072]
    - [23, 0.57]
  - - [16, 1728, 1, 1024]
    - [23, 1.33]
  - - [32, 1728, 1, 512]
    - [40, 1.7]
  - - [1728, 32, 1, 512]
    - [26, 1.79]
  - - [3072, 576, 1, 16]
    - [30, 2.72]
  - - [448, 1984, 1, 32]
    - [46, 2.94]
  - - [1984, 448, 1, 32]
    - [39, 2.93]
  - - [960, 1856, 1, 16]
    - [39, 2.78]
  - - [1856, 960, 1, 16]
    - [39, 2.8]
  - - [1216, 1472, 1, 16]
    - [39, 2.81]
  - - [1472, 1216, 1, 16]
    - [39, 2.81]
  - - [576, 3136, 1, 16]
    - [39, 2.81]
  - - [1344, 1344, 1, 16]
    - [39, 2.81]
  - - [3136, 576, 1, 16]
    - [39, 2.84]
  - - [832, 1088, 1, 32]
    - [46, 2.98]
  - - [1088, 832, 1, 32]
    - [39, 2.97]
  - - [16, 896, 1, 2048]
    - [24, 0.84]
  - - [32, 448, 1, 2048]
    - [22, 0.85]
  - - [32, 896, 1, 1024]
    - [23, 1.39]
  - - [64, 448, 1, 1024]
    - [23, 1.39]
  - - [64, 896, 1, 512]
    - [21, 1.79]
  - - [128, 448, 1, 512]
    - [21, 1.79]
  - - [448, 128, 1, 512]
    - [62, 1.8]
  - - [448, 1024, 1, 64]
    - [46, 3.0]
  - - [512, 896, 1, 64]
    - [39, 3.0]
  - - [896, 16, 1, 2048]
    - [22, 0.85]
  - - [896, 64, 1, 512]
    - [62, 1.81]
  - - [896, 1024, 1, 32]
    - [46, 3.02]
  - - [1024, 896, 1, 32]
    - [46, 3.01]
  - - [320, 2880, 1, 32]
    - [39, 2.95]
  - - [576, 1600, 1, 32]
    - [39, 2.95]
  - - [960, 960, 1, 32]
    - [46, 2.95]
  - - [1600, 576, 1, 32]
    - [39, 2.95]
  - - [2880, 320, 1, 32]
    - [46, 2.94]
  - - [16, 3648, 1, 512]
    - [35, 1.77]
  - - [1088, 1728, 1, 16]
    - [39, 2.92]
  - - [1728, 1088, 1, 16]
    - [39, 2.9]
  - - [320, 1472, 1, 64]
    - [46, 2.94]
  - - [704, 1344, 1, 32]
    - [46, 3.02]
  - - [1344, 704, 1, 32]
    - [39, 3.01]
  - - [16, 1856, 1, 1024]
    - [23, 1.41]
  - - [32, 1856, 1, 512]
    - [21, 1.83]
  - - [1856, 32, 1, 512]
    - [45, 1.86]
  - - [960, 1984, 1, 16]
    - [39, 2.92]
  - - [1984, 960, 1, 16]
    - [39, 2.94]
  - - [1216, 1600, 1, 16]
    - [39, 2.95]
  - - [1600, 1216, 1, 16]
    - [39, 2.98]
  - - [448, 1088, 1, 64]
    - [46, 3.02]
  - - [576, 3392, 1, 16]
    - [39, 2.95]
  - - [3392, 576, 1, 16]
    - [39, 2.96]
  - - [16, 640, 1, 3072]
    - [23, 0.63]
  - - [16, 960, 1, 2048]
    - [23, 0.9]
  - - [32, 320, 1, 3072]
    - [22, 0.63]
  - - [32, 960, 1, 1024]
    - [24, 1.49]
  - - [64, 960, 1, 512]
    - [21, 1.91]
  - - [512, 960, 1, 64]
    - [46, 3.07]
  - - [960, 16, 1, 2048]
    - [13, 0.91]
  - - [960, 64, 1, 512]
    - [62, 1.94]
  - - [960, 1024, 1, 32]
    - [46, 3.13]
  - - [1024, 960, 1, 32]
    - [46, 3.13]
  - - [3072, 320, 1, 32]
    - [39, 3.12]
  - - [3072, 640, 1, 16]
    - [39, 2.85]
  - - [832, 2368, 1, 16]
    - [39, 2.97]
  - - [2368, 832, 1, 16]
    - [39, 2.97]
  - - [1344, 1472, 1, 16]
    - [39, 2.98]
  - - [1472, 1344, 1, 16]
    - [39, 2.97]
  - - [576, 1728, 1, 32]
    - [46, 3.11]
  - - [1728, 576, 1, 32]
    - [39, 3.09]
  - - [16, 3904, 1, 512]
    - [35, 1.89]
  - - [320, 3136, 1, 32]
    - [46, 3.12]
  - - [3136, 320, 1, 32]
    - [46, 3.11]
  - - [1088, 1856, 1, 16]
    - [39, 2.97]
  - - [1856, 1088, 1, 16]
    - [39, 2.95]
  - - [832, 1216, 1, 32]
    - [46, 3.16]
  - - [1216, 832, 1, 32]
    - [46, 3.14]
  - - [16, 1984, 1, 1024]
    - [23, 1.5]
  - - [32, 1984, 1, 512]
    - [40, 1.95]
  - - [1984, 32, 1, 512]
    - [56, 1.99]
  - - [320, 1600, 1, 64]
    - [46, 3.18]
  - - [576, 896, 1, 64]
    - [46, 3.19]
  - - [704, 1472, 1, 32]
    - [39, 3.23]
  - - [1472, 704, 1, 32]
    - [46, 3.22]
  - - [1088, 960, 1, 32]
    - [30, 3.13]
  - - [16, 256, 1, 8192]
    - [13, 0.27]
  - - [16, 2048, 1, 1024]
    - [23, 1.51]
  - - [16, 4096, 1, 512]
    - [35, 1.98]
  - - [32, 512, 1, 2048]
    - [13, 0.97]
  - - [32, 1024, 1, 1024]
    - [24, 1.58]
  - - [32, 2048, 1, 512]
    - [21, 2.0]
  - - [64, 1024, 1, 512]
    - [21, 2.03]
  - - [128, 256, 1, 1024]
    - [24, 1.59]
  - - [256, 128, 1, 1024]
    - [24, 1.58]
  - - [256, 4096, 1, 32]
    - [30, 3.15]
  - - [512, 32, 1, 2048]
    - [22, 0.97]
  - - [512, 1024, 1, 64]
    - [46, 3.26]
  - - [1024, 16, 1, 2048]
    - [13, 0.97]
  - - [1024, 64, 1, 512]
    - [56, 2.05]
  - - [1024, 1024, 1, 32]
    - [30, 3.12]
  - - [576, 3648, 1, 16]
    - [39, 2.98]
  - - [1216, 1728, 1, 16]
    - [39, 2.98]
  - - [1728, 1216, 1, 16]
    - [39, 2.99]
  - - [640, 832, 1, 64]
    - [51, 3.03]
  - - [576, 1856, 1, 32]
    - [46, 3.22]
  - - [1856, 576, 1, 32]
    - [46, 3.21]
  - - [1344, 1600, 1, 16]
    - [39, 3.0]
  - - [1600, 1344, 1, 16]
    - [39, 2.98]
  - - [1088, 1984, 1, 16]
    - [32, 2.88]
  - - [1984, 1088, 1, 16]
    - [32, 2.83]
  - - [16, 704, 1, 3072]
    - [23, 0.69]
  - - [16, 2112, 1, 1024]
    - [33, 1.38]
  - - [32, 2112, 1, 512]
    - [52, 1.92]
  - - [704, 768, 1, 64]
    - [46, 3.09]
  - - [2112, 32, 1, 512]
    - [55, 2.12]
  - - [3072, 704, 1, 16]
    - [39, 2.88]
  - - [1472, 1472, 1, 16]
    - [39, 3.03]
  - - [320, 3392, 1, 32]
    - [46, 3.27]
  - - [3392, 320, 1, 32]
    - [46, 3.26]
  - - [448, 1216, 1, 64]
    - [46, 3.1]
  - - [832, 2624, 1, 16]
    - [39, 3.02]
  - - [2624, 832, 1, 16]
    - [39, 3.0]
  - - [320, 1728, 1, 64]
    - [46, 3.15]
  - - [576, 960, 1, 64]
    - [46, 3.14]
  - - [16, 1088, 1, 2048]
    - [24, 0.92]
  - - [32, 1088, 1, 1024]
    - [29, 1.45]
  - - [64, 1088, 1, 512]
    - [52, 1.98]
  - - [1088, 16, 1, 2048]
    - [38, 0.95]
  - - [1088, 64, 1, 512]
    - [56, 2.18]
  - - [1344, 832, 1, 32]
    - [46, 3.19]
  - - [704, 1600, 1, 32]
    - [46, 3.21]
  - - [1600, 704, 1, 32]
    - [46, 3.21]
  - - [1216, 1856, 1, 16]
    - [39, 3.03]
  - - [1856, 1216, 1, 16]
    - [39, 3.04]
  - - [576, 1984, 1, 32]
    - [46, 3.25]
  - - [1984, 576, 1, 32]
    - [46, 3.24]
  - - [640, 896, 1, 64]
    - [46, 3.26]
  - - [1088, 2112, 1, 16]
    - [39, 3.07]
  - - [2112, 1088, 1, 16]
    - [39, 3.08]
  - - [1344, 1728, 1, 16]
    - [39, 3.1]
  - - [1728, 1344, 1, 16]
    - [39, 3.11]
  - - [320, 3648, 1, 32]
    - [39, 3.33]
  - - [3648, 320, 1, 32]
    - [46, 3.29]
  - - [704, 832, 1, 64]
    - [39, 3.32]
  - - [832, 704, 1, 64]
    - [39, 3.32]
  - - [1472, 1600, 1, 16]
    - [30, 2.94]
  - - [1600, 1472, 1, 16]
    - [30, 2.94]
  - - [16, 768, 1, 3072]
    - [24, 0.76]
  - - [32, 384, 1, 3072]
    - [23, 0.76]
  - - [32, 576, 1, 2048]
    - [23, 0.98]
  - - [192, 192, 1, 1024]
    - [55, 1.65]
  - - [576, 32, 1, 2048]
    - [15, 1.04]
  - - [576, 1024, 1, 64]
    - [46, 3.35]
  - - [768, 768, 1, 64]
    - [46, 3.35]
  - - [3072, 384, 1, 32]
    - [30, 3.16]
  - - [320, 1856, 1, 64]
    - [46, 3.18]
  - - [832, 2880, 1, 16]
    - [39, 3.08]
  - - [448, 1344, 1, 64]
    - [39, 3.22]
  - - [1216, 1984, 1, 16]
    - [39, 3.07]
  - - [1984, 1216, 1, 16]
    - [39, 3.07]
  - - [16, 2368, 1, 1024]
    - [33, 1.53]
  - - [32, 2368, 1, 512]
    - [57, 2.12]
  - - [2368, 32, 1, 512]
    - [52, 2.13]
  - - [576, 2112, 1, 32]
    - [46, 3.3]
  - - [704, 1728, 1, 32]
    - [39, 3.32]
  - - [1728, 704, 1, 32]
    - [39, 3.31]
  - - [2112, 576, 1, 32]
    - [39, 3.3]
  - - [1472, 832, 1, 32]
    - [39, 3.33]
  - - [640, 960, 1, 64]
    - [32, 3.28]
  - - [16, 1216, 1, 2048]
    - [23, 1.02]
  - - [32, 1216, 1, 1024]
    - [29, 1.62]
  - - [64, 1216, 1, 512]
    - [52, 2.2]
  - - [1216, 64, 1, 512]
    - [57, 2.27]
  - - [1344, 1856, 1, 16]
    - [39, 3.17]
  - - [1856, 1344, 1, 16]
    - [39, 3.16]
  - - [320, 3904, 1, 32]
    - [39, 3.34]
  - - [3904, 320, 1, 32]
    - [32, 3.34]
  - - [576, 1088, 1, 64]
    - [46, 3.35]
  - - [704, 896, 1, 64]
    - [39, 3.34]
  - - [896, 704, 1, 64]
    - [39, 3.34]
  - - [320, 1984, 1, 64]
    - [46, 3.37]
  - - [1472, 1728, 1, 16]
    - [39, 3.12]
  - - [1728, 1472, 1, 16]
    - [39, 3.12]
  - - [16, 832, 1, 3072]
    - [24, 0.82]
  - - [768, 832, 1, 64]
    - [46, 3.4]
  - - [832, 768, 1, 64]
    - [39, 3.38]
  - - [1600, 1600, 1, 16]
    - [39, 3.18]
  - - [1088, 2368, 1, 16]
    - [39, 3.2]
  - - [1856, 704, 1, 32]
    - [30, 3.35]
  - - [32, 640, 1, 2048]
    - [24, 1.09]
  - - [128, 320, 1, 1024]
    - [56, 1.81]
  - - [320, 4096, 1, 32]
    - [44, 3.34]
  - - [640, 32, 1, 2048]
    - [15, 1.15]
  - - [640, 1024, 1, 64]
    - [39, 3.45]
  - - [1024, 640, 1, 64]
    - [39, 3.5]
  - - [4096, 320, 1, 32]
    - [30, 3.34]
  - - [448, 1472, 1, 64]
    - [39, 3.29]
  - - [1344, 1984, 1, 16]
    - [39, 3.26]
  - - [16, 2624, 1, 1024]
    - [37, 1.68]
  - - [2624, 32, 1, 512]
    - [52, 2.35]
  - - [320, 2112, 1, 64]
    - [39, 3.36]
  - - [704, 960, 1, 64]
    - [39, 3.36]
  - - [960, 704, 1, 64]
    - [39, 3.36]
  - - [576, 2368, 1, 32]
    - [39, 3.46]
  - - [2368, 576, 1, 32]
    - [39, 3.49]
  - - [1472, 1856, 1, 16]
    - [39, 3.26]
  - - [16, 896, 1, 3072]
    - [23, 0.88]
  - - [16, 1344, 1, 2048]
    - [23, 1.12]
  - - [32, 1344, 1, 1024]
    - [33, 1.78]
  - - [768, 896, 1, 64]
    - [39, 3.42]
  - - [896, 768, 1, 64]
    - [39, 3.43]
  - - [1344, 16, 1, 2048]
    - [48, 1.17]
  - - [3072, 448, 1, 32]
    - [30, 3.38]
  - - [832, 832, 1, 64]
    - [39, 3.44]
  - - [1984, 704, 1, 32]
    - [32, 3.48]
  - - [576, 1216, 1, 64]
    - [39, 3.48]
  - - [448, 1600, 1, 64]
    - [39, 3.56]
  - - [32, 704, 1, 2048]
    - [24, 1.21]
  - - [704, 32, 1, 2048]
    - [15, 1.27]
  - - [704, 1024, 1, 64]
    - [39, 3.58]
  - - [1024, 704, 1, 64]
    - [39, 3.58]
  - - [16, 960, 1, 3072]
    - [24, 0.94]
  - - [768, 960, 1, 64]
    - [39, 3.5]
  - - [960, 768, 1, 64]
    - [39, 3.49]
  - - [2880, 32, 1, 512]
    - [52, 2.57]
  - - [832, 896, 1, 64]
    - [39, 3.51]
  - - [896, 832, 1, 64]
    - [39, 3.5]
  - - [16, 1472, 1, 2048]
    - [24, 1.19]
  - - [32, 1472, 1, 1024]
    - [33, 1.95]
  - - [1472, 16, 1, 2048]
    - [38, 1.28]
  - - [320, 2368, 1, 64]
    - [39, 3.58]
  - - [704, 1088, 1, 64]
    - [39, 3.6]
  - - [1088, 704, 1, 64]
    - [39, 3.61]
  - - [576, 1344, 1, 64]
    - [39, 3.62]
  - - [1344, 576, 1, 64]
    - [32, 3.64]
  - - [1, 8192, 1, 8192]
    - [56, 0.09]
  - - [16, 832, 1, 4096]
    - [24, 0.82]
  - - [16, 2560, 1, 3072]
    - [33, 1.92]
  - - [16, 3584, 1, 3072]
    - [35, 2.23]
  - - [16, 3648, 1, 4096]
    - [35, 1.98]
  - - [32, 1088, 1, 4096]
    - [67, 1.63]
  - - [64, 384, 1, 2048]
    - [23, 1.3]
  - - [64, 384, 1, 4096]
    - [24, 1.41]
  - - [64, 576, 1, 2048]
    - [55, 1.75]
  - - [64, 832, 1, 1024]
    - [68, 1.87]
  - - [64, 896, 1, 4096]
    - [56, 2.29]
  - - [64, 1984, 1, 512]
    - [69, 3.46]
  - - [64, 3648, 1, 512]
    - [3, 4.59]
  - - [64, 3904, 1, 512]
    - [3, 4.91]
  - - [64, 8192, 1, 128]
    - [70, 4.72]
  - - [128, 512, 1, 2048]
    - [55, 2.54]
  - - [128, 768, 1, 4096]
    - [39, 3.25]
  - - [128, 832, 1, 2048]
    - [46, 3.54]
  - - [128, 896, 1, 4096]
    - [71, 3.74]
  - - [128, 8192, 1, 128]
    - [72, 6.23]
  - - [128, 8192, 1, 256]
    - [72, 7.17]
  - - [192, 384, 1, 4096]
    - [55, 2.99]
  - - [192, 1472, 1, 512]
    - [73, 4.64]
  - - [256, 128, 1, 8192]
    - [24, 1.94]
  - - [256, 512, 1, 512]
    - [71, 3.55]
  - - [320, 448, 1, 2048]
    - [69, 3.68]
  - - [320, 640, 1, 2048]
    - [1, 4.93]
  - - [384, 128, 1, 1024]
    - [58, 2.12]
  - - [384, 512, 1, 2048]
    - [39, 5.07]
  - - [384, 8192, 1, 64]
    - [73, 6.95]
  - - [384, 8192, 1, 128]
    - [72, 7.81]
  - - [448, 128, 1, 2048]
    - [56, 2.23]
  - - [448, 256, 1, 1024]
    - [39, 3.49]
  - - [448, 768, 1, 512]
    - [74, 5.54]
  - - [448, 768, 1, 1024]
    - [75, 6.2]
  - - [512, 128, 1, 2048]
    - [56, 2.55]
  - - [576, 128, 1, 1024]
    - [76, 2.59]
  - - [576, 576, 1, 1024]
    - [75, 6.07]
  - - [576, 768, 1, 256]
    - [77, 4.8]
  - - [576, 1472, 1, 512]
    - [73, 6.94]
  - - [576, 3392, 1, 32]
    - [73, 4.7]
  - - [704, 640, 1, 1024]
    - [77, 5.95]
  - - [704, 1728, 1, 256]
    - [75, 6.81]
  - - [768, 1024, 1, 64]
    - [73, 4.83]
  - - [768, 1024, 1, 256]
    - [74, 6.8]
  - - [832, 64, 1, 1024]
    - [62, 1.91]
  - - [832, 320, 1, 256]
    - [73, 3.86]
  - - [832, 1984, 1, 64]
    - [75, 5.38]
  - - [832, 3648, 1, 32]
    - [75, 5.05]
  - - [832, 4096, 1, 64]
    - [78, 6.71]
  - - [896, 64, 1, 2048]
    - [21, 2.24]
  - - [896, 576, 1, 512]
    - [7, 6.33]
  - - [960, 64, 1, 4096]
    - [76, 2.5]
  - - [1024, 64, 1, 1024]
    - [76, 2.3]
  - - [1024, 128, 1, 2048]
    - [30, 4.28]
  - - [1088, 320, 1, 512]
    - [73, 5.6]
  - - [1088, 448, 1, 1024]
    - [7, 6.37]
  - - [1088, 1984, 1, 32]
    - [3, 4.53]
  - - [1088, 2880, 1, 16]
    - [79, 3.7]
  - - [1216, 704, 1, 256]
    - [73, 6.14]
  - - [1344, 1728, 1, 32]
    - [75, 4.81]
  - - [1344, 4096, 1, 16]
    - [75, 4.88]
  - - [1536, 1024, 1, 32]
    - [73, 4.71]
  - - [1728, 1984, 1, 16]
    - [75, 4.18]
  - - [1856, 3136, 1, 16]
    - [72, 4.63]
  - - [1856, 3648, 1, 16]
    - [72, 4.84]
  - - [2112, 1600, 1, 32]
    - [75, 5.53]
  - - [2624, 1856, 1, 64]
    - [75, 6.87]
  - - [2880, 576, 1, 256]
    - [75, 7.39]
  - - [2880, 1344, 1, 32]
    - [75, 5.83]
  - - [2880, 1600, 1, 32]
    - [74, 6.02]
  - - [2880, 4096, 1, 16]
    - [75, 5.43]
  - - [3072, 16, 1, 8192]
    - [80, 2.08]
  - - [3072, 3328, 1, 32]
    - [7, 6.77]
