projects/hipblaslt/library/src/amd_detail/rocblaslt/src/Tensile/Logic/asm_full/gfx950/gfx950/Equality/gfx950_Cijk_Alik_Bljk_F8B8BS_BH_BiasSB_HAS_SAB_SAV_UserArgs.yaml
- {MinimumRequiredVersion: 5.0.0}
- gfx950
- gfx950
<<<<<<< HEAD
    SolutionIndex: 0
    SolutionNameMin: Cijk_Alik_Bljk_F8B8BS_BH_Bias_HA_S_SAB_SAV_UserArgs_MT256x256x128_MI32x32x1_SN_LDSB0_AFC0_AG0_AFEM1_AFEM1_ASEM1_CLR0_CADS0_DTLA0_DTLB0_DTVA0_DTVB0_DTVSM0_DPLBn1_EPS0_ELFLR0_EMLLn1_FDSI0_GRPM1_GRVWA16_GRVWB16_GSU0_GSUAMB_GSUC0_GSUWGMRR0_GLS0_ISA950_IU1_K1_LDSTI0_LBSPPA256_LBSPPB1024_LBSPPM0_LPA16_LPB16_LPM0_LRVW16_LWPMn1_MIAV0_MIWT2_8_MO40_MGRIPMn1_NTn1_NTA0_NTB2_NTC5_NTD5_NTM0_NEPBS0_NLCA1_NLCB1_ONLL1_PGR2_PLR1_PKA1_SGROBn1_SIA3_SS1_SU0_SUM0_SUS0_SPO0_SRVW0_SSO0_SVW2_SK3_SKFTR0_SKXCCM0_SGRO0_TIN0_TLDS1_TLDSM1_ULSGRO0_USL1_UIOFGRO0_UPLRP0_USFGRO0_VSn1_VWA2_VWB8_WSGRA0_WSGRB0_WS64_WG128_2_1_WGM48_WGMXCC2_WGMXCCGn1
    SolutionIndex: 1
    SolutionNameMin: Cijk_Alik_Bljk_F8B8BS_BH_Bias_HA_S_SAB_SAV_UserArgs_MT256x256x128_MI32x32x1_SN_LDSB0_AFC0_AG0_AFEM1_AFEM1_ASEM1_CLR1_CADS0_DTLA0_DTLB0_DTVA0_DTVB0_DTVSM0_DPLBn1_EPS0_ELFLR0_EMLLn1_FDSI0_GRPM1_GRVWA16_GRVWB16_GSU0_GSUAMB_GSUC0_GSUWGMRR0_GLS0_ISA950_IU1_K1_LDSTI0_LBSPPA512_LBSPPB512_LBSPPM0_LPA16_LPB16_LPM0_LRVW16_LWPMn1_MIAV0_MIWT4_4_MO40_MGRIPMn1_NTn1_NTA3_NTB2_NTC6_NTD4_NTM0_NEPBS0_NLCA1_NLCB1_ONLL1_PGR2_PLR1_PKA1_SGROBn1_SIA3_SS1_SU0_SUM0_SUS0_SPO0_SRVW0_SSO0_SVW4_SK3_SKFTR0_SKXCCM0_SGRO0_TIN0_TLDS1_TLDSM1_ULSGRO0_USL1_UIOFGRO0_UPLRP0_USFGRO0_VSn1_VWA4_VWB4_WSGRA0_WSGRB0_WS64_WG64_4_1_WGM1_WGMXCC4_WGMXCCGn1
    SolutionIndex: 0
    SolutionNameMin: Cijk_Alik_Bjlk_S_B_Bias_HA_S_SAV_UserArgs_MT32x64x128_MI16x16x1_CMS_SN_LDSB1_AFC0_AFEM1_AFEM1_ASEM1_CLR1_CADS0_DTLA0_DTLB0_DTVA0_DTVB0_EPS0_FDSI0_GRPM1_GRVWA4_GRVWB4_GSU0_GSUAMB_GSUC0_GSUWGMRR0_GLS0_ISA950_IU1_K1_LDSTI0_LBSPPA512_LBSPPB1024_LBSPPM0_LPA8_LPB0_LPM0_LRVW4_LWPMn1_MIAV1_MIWT1_2_MO40_NTn1_NTA3_NTB2_NTC1_NTD4_NTM0_NEPBS12_NLCA1_NLCB1_ONLL1_PGR2_PLR1_PKA1_SIA3_SS1_SU8_SUM1_SUS512_SPO0_SRVW0_SSO0_SVW1_SK3_SKFTR0_SKXCCM0_TLDS1_ULSGRO0_USL1_UIOFGRO0_USFGROn1_VSn1_VWA1_VWB2_WSGRA0_WSGRB0_WS64_WG32_8_1_WGM1_WGMXCC4_WGMXCCGn1
    SolutionNameMin: Cijk_Alik_Bljk_F8B8BS_BH_Bias_HA_S_SAB_SAV_UserArgs_MT256x256x128_MI32x32x1_SN_LDSB0_AFC0_AG0_AFEM1_AFEM1_ASEM1_CLR0_CADS0_DTLA0_DTLB0_DTVA0_DTVB0_EPS0_ELFLR0_EMLLn1_FDSI0_GRPM1_GRVWA16_GRVWB16_GSU0_GSUAMB_GSUC0_GSUWGMRR0_GLS0_ISA950_IU1_K1_LDSTI0_LBSPPA256_LBSPPB1024_LBSPPM0_LPA16_LPB16_LPM0_LRVW16_LWPMn1_MIAV0_MIWT2_8_MO40_NTn1_NTA0_NTB2_NTC5_NTD5_NTM0_NEPBS0_NLCA1_NLCB1_ONLL1_PGR2_PLR1_PKA1_SIA3_SS1_SU0_SUM1_SUS0_SPO0_SRVW0_SSO0_SVW2_SK3_SKFTR0_SKXCCM0_SGRO0_TLDS1_ULSGRO0_USL1_UIOFGRO0_USFGRO0_VSn1_VWA2_VWB8_WSGRA0_WSGRB0_WS64_WG128_2_1_WGM48_WGMXCC2_WGMXCCGn1
    SolutionIndex: 2
    SolutionNameMin: Cijk_Alik_Bljk_F8B8BS_BH_Bias_HA_S_SAB_SAV_UserArgs_MT256x256x128_MI32x32x1_SN_LDSB0_AFC0_AG0_AFEM1_AFEM1_ASEM1_CLR1_CADS0_DTLA1_DTLB1_DTVA0_DTVB0_DTVSM0_DPLBn1_EPS0_ELFLR0_EMLLn1_FDSI0_GRPM1_GRVWA16_GRVWB16_GSU0_GSUAMB_GSUC0_GSUWGMRR0_GLS0_ISA950_IU1_K1_LDSTI0_LBSPPA1024_LBSPPB1024_LBSPPM0_LPA16_LPB16_LPM0_LRVW16_LWPMn1_MIAV0_MIWT8_2_MO40_MGRIPMn1_NTn1_NTA2_NTB1_NTC6_NTD4_NTM0_NEPBS0_NLCA1_NLCB1_ONLL1_PGR2_PLR1_PKA1_SGROBn1_SIA3_SS1_SU16_SUM1_SUS128_SPO1_SRVW0_SSO0_SVW8_SK3_SKFTR0_SKXCCM8_SGRO0_TIN0_TLDS2_TLDSM1_ULSGRO0_USL1_UIOFGRO0_UPLRP0_USFGRO0_VSn1_VWA8_VWB2_WSGRA0_WSGRB0_WS64_WG32_8_1_WGM48_WGMXCC16_WGMXCCGn1
    SolutionIndex: 1
    SolutionNameMin: Cijk_Alik_Bjlk_S_B_Bias_HA_S_SAV_UserArgs_MT48x64x64_MI16x16x1_CMS_SN_LDSB1_AFC0_AFEM1_AFEM1_ASEM1_CLR1_CADS0_DTLA0_DTLB0_DTVA0_DTVB0_EPS0_FDSI0_GRPM1_GRVWA4_GRVWB4_GSU0_GSUAMB_GSUC0_GSUWGMRR0_GLS0_ISA950_IU1_K1_LDSTI0_LBSPPA256_LBSPPB1024_LBSPPM0_LPA8_LPB16_LPM0_LRVW4_LWPMn1_MIAV1_MIWT3_1_MO40_NTn1_NTA1_NTB1_NTC1_NTD1_NTM0_NEPBS16_NLCA1_NLCB1_ONLL1_PGR2_PLR1_PKA1_SIA3_SS1_SU0_SUM1_SUS0_SPO0_SRVW0_SSO0_SVW1_SK3_SKFTR0_SKXCCM4_TLDS1_ULSGRO0_USL1_UIOFGRO0_USFGRO0_VSn1_VWA1_VWB1_WSGRA0_WSGRB0_WS64_WG16_16_1_WGM1_WGMXCC8_WGMXCCGn1
    SolutionNameMin: Cijk_Alik_Bljk_F8B8BS_BH_Bias_HA_S_SAB_SAV_UserArgs_MT256x256x128_MI32x32x1_SN_LDSB0_AFC0_AG0_AFEM1_AFEM1_ASEM1_CLR1_CADS0_DTLA0_DTLB0_DTVA0_DTVB0_EPS0_ELFLR0_EMLLn1_FDSI0_GRPM1_GRVWA16_GRVWB16_GSU0_GSUAMB_GSUC0_GSUWGMRR0_GLS0_ISA950_IU1_K1_LDSTI0_LBSPPA512_LBSPPB512_LBSPPM0_LPA16_LPB16_LPM0_LRVW16_LWPMn1_MIAV0_MIWT4_4_MO40_NTn1_NTA3_NTB2_NTC6_NTD4_NTM0_NEPBS0_NLCA1_NLCB1_ONLL1_PGR2_PLR1_PKA1_SIA3_SS1_SU0_SUM1_SUS0_SPO0_SRVW0_SSO0_SVW4_SK3_SKFTR0_SKXCCM0_SGRO0_TLDS1_ULSGRO0_USL1_UIOFGRO0_USFGRO0_VSn1_VWA4_VWB4_WSGRA0_WSGRB0_WS64_WG64_4_1_WGM1_WGMXCC4_WGMXCCGn1
    SolutionIndex: 2
    SolutionNameMin: Cijk_Alik_Bjlk_S_B_Bias_HA_S_SAV_UserArgs_MT48x64x64_MI16x16x1_CMS_SN_LDSB1_AFC0_AFEM1_AFEM1_ASEM1_CLR1_CADS0_DTLA0_DTLB0_DTVA0_DTVB0_EPS0_FDSI0_GRPM1_GRVWA4_GRVWB4_GSU0_GSUAMB_GSUC0_GSUWGMRR0_GLS0_ISA950_IU1_K1_LDSTI0_LBSPPA256_LBSPPB1024_LBSPPM0_LPA8_LPB16_LPM0_LRVW4_LWPMn1_MIAV0_MIWT3_1_MO40_NTn1_NTA3_NTB1_NTC1_NTD1_NTM0_NEPBS16_NLCA1_NLCB1_ONLL1_PGR2_PLR1_PKA1_SIA3_SS1_SU0_SUM1_SUS0_SPO0_SRVW0_SSO0_SVW1_SK3_SKFTR0_SKXCCM6_TLDS1_ULSGRO0_USL1_UIOFGRO0_USFGROn1_VSn1_VWA1_VWB1_WSGRA0_WSGRB0_WS64_WG16_16_1_WGM1_WGMXCC4_WGMXCCGn1
    SolutionNameMin: Cijk_Alik_Bljk_F8B8BS_BH_Bias_HA_S_SAB_SAV_UserArgs_MT256x256x128_MI32x32x1_SN_LDSB0_AFC0_AG0_AFEM1_AFEM1_ASEM1_CLR1_CADS0_DTLA1_DTLB1_DTVA0_DTVB0_EPS0_ELFLR0_EMLLn1_FDSI0_GRPM1_GRVWA16_GRVWB16_GSU0_GSUAMB_GSUC0_GSUWGMRR0_GLS0_ISA950_IU1_K1_LDSTI0_LBSPPA1024_LBSPPB1024_LBSPPM0_LPA16_LPB16_LPM0_LRVW16_LWPMn1_MIAV0_MIWT8_2_MO40_NTn1_NTA2_NTB1_NTC6_NTD4_NTM0_NEPBS0_NLCA1_NLCB1_ONLL1_PGR2_PLR1_PKA1_SIA3_SS1_SU16_SUM1_SUS128_SPO1_SRVW0_SSO0_SVW8_SK3_SKFTR0_SKXCCM8_SGRO0_TLDS2_ULSGRO0_USL1_UIOFGRO0_USFGRO0_VSn1_VWA8_VWB2_WSGRA0_WSGRB0_WS64_WG32_8_1_WGM48_WGMXCC16_WGMXCCGn1
    SolutionIndex: 3
    SolutionNameMin: Cijk_Alik_Bjlk_S_B_Bias_HA_S_SAV_UserArgs_MT32x32x128_MI16x16x1_CMS_SN_LDSB0_AFC0_AFEM1_AFEM1_ASEM1_CLR1_CADS0_DTLA0_DTLB0_DTVA0_DTVB0_EPS0_FDSI0_GRPM1_GRVWA1_GRVWB4_GSU0_GSUAMB_GSUC0_GSUWGMRR0_GLS0_ISA950_IU1_K1_LDSTI0_LBSPPA512_LBSPPB512_LBSPPM0_LPA8_LPB16_LPM0_LRVW4_LWPMn1_MIAV0_MIWT1_1_MO40_NTn1_NTA2_NTB7_NTC0_NTD2_NTM0_NEPBS16_NLCA1_NLCB1_ONLL1_PGR2_PLR1_PKA1_SIA3_SS1_SU0_SUM1_SUS0_SPO1_SRVW0_SSO0_SVW1_SK3_SKFTR0_SKXCCM0_TLDS1_ULSGRO0_USL1_UIOFGRO0_USFGRO0_VSn1_VWA1_VWB1_WSGRA0_WSGRB0_WS64_WG32_8_1_WGM16_WGMXCC1_WGMXCCGn1
    SolutionNameMin: Cijk_Alik_Bljk_F8B8BS_BH_Bias_HA_S_SAB_SAV_UserArgs_MT256x256x128_MI32x32x1_SN_LDSB0_AFC0_AG0_AFEM1_AFEM1_ASEM1_CLR0_CADS0_DTLA0_DTLB0_DTVA0_DTVB0_EPS0_ELFLR0_EMLLn1_FDSI0_GRPM1_GRVWA16_GRVWB16_GSU0_GSUAMB_GSUC0_GSUWGMRR0_GLS0_ISA950_IU1_K1_LDSTI0_LBSPPA256_LBSPPB1024_LBSPPM0_LPA16_LPB16_LPM0_LRVW16_LWPMn1_MIAV0_MIWT2_8_MO40_NTn1_NTA3_NTB0_NTC5_NTD7_NTM0_NEPBS0_NLCA1_NLCB1_ONLL1_PGR2_PLR1_PKA1_SIA3_SS1_SU8_SUM1_SUS128_SPO1_SRVW0_SSO0_SVW2_SK3_SKFTR0_SKXCCM4_SGRO0_TLDS1_ULSGRO0_USL1_UIOFGRO0_USFGRO0_VSn1_VWA2_VWB8_WSGRA0_WSGRB0_WS64_WG128_2_1_WGM8_WGMXCC16_WGMXCCGn1
    SolutionIndex: 3
    SolutionNameMin: Cijk_Alik_Bljk_F8B8BS_BH_Bias_HA_S_SAB_SAV_UserArgs_MT256x256x128_MI32x32x1_SN_LDSB0_AFC0_AG0_AFEM1_AFEM1_ASEM1_CLR0_CADS0_DTLA0_DTLB0_DTVA0_DTVB0_DTVSM0_DPLBn1_EPS0_ELFLR0_EMLLn1_FDSI0_GRPM1_GRVWA16_GRVWB16_GSU0_GSUAMB_GSUC0_GSUWGMRR0_GLS0_ISA950_IU1_K1_LDSTI0_LBSPPA256_LBSPPB1024_LBSPPM0_LPA16_LPB16_LPM0_LRVW16_LWPMn1_MIAV0_MIWT2_8_MO40_MGRIPMn1_NTn1_NTA3_NTB0_NTC5_NTD7_NTM0_NEPBS0_NLCA1_NLCB1_ONLL1_PGR2_PLR1_PKA1_SGROBn1_SIA3_SS1_SU8_SUM1_SUS128_SPO1_SRVW0_SSO0_SVW2_SK3_SKFTR0_SKXCCM4_SGRO0_TIN0_TLDS1_TLDSM1_ULSGRO0_USL1_UIOFGRO0_UPLRP0_USFGRO0_VSn1_VWA2_VWB8_WSGRA0_WSGRB0_WS64_WG128_2_1_WGM8_WGMXCC16_WGMXCCGn1
    SolutionIndex: 4
    SolutionNameMin: Cijk_Alik_Bjlk_S_B_Bias_HA_S_SAV_UserArgs_MT96x160x32_MI16x16x1_CMS_SN_LDSB1_AFC0_AFEM1_AFEM1_ASEM1_CLR1_CADS0_DTLA0_DTLB0_DTVA0_DTVB0_EPS0_FDSI0_GRPM1_GRVWA4_GRVWB4_GSU0_GSUAMB_GSUC0_GSUWGMRR0_GLS0_ISA950_IU1_K1_LDSTI0_LBSPPA128_LBSPPB2560_LBSPPM0_LPA8_LPB16_LPM0_LRVW4_LWPMn1_MIAV1_MIWT3_5_MO40_NTn1_NTA2_NTB6_NTC0_NTD1_NTM0_NEPBS0_NLCA1_NLCB5_ONLL1_PGR2_PLR1_PKA1_SIA3_SS1_SU0_SUM1_SUS0_SPO0_SRVW0_SSO0_SVW1_SK3_SKFTR0_SKXCCM4_TLDS1_ULSGRO0_USL1_UIOFGRO0_USFGRO0_VSn1_VWA1_VWB1_WSGRA0_WSGRB0_WS64_WG32_8_1_WGM48_WGMXCC32_WGMXCCGn1
    SolutionNameMin: Cijk_Alik_Bljk_F8B8BS_BH_Bias_HA_S_SAB_SAV_UserArgs_MT256x256x128_MI32x32x1_SN_LDSB0_AFC0_AG0_AFEM1_AFEM1_ASEM1_CLR1_CADS0_DTLA0_DTLB0_DTVA0_DTVB0_EPS0_ELFLR0_EMLLn1_FDSI0_GRPM1_GRVWA16_GRVWB16_GSU0_GSUAMB_GSUC0_GSUWGMRR0_GLS0_ISA950_IU1_K1_LDSTI0_LBSPPA1024_LBSPPB256_LBSPPM0_LPA16_LPB16_LPM0_LRVW16_LWPMn1_MIAV0_MIWT8_2_MO40_NTn1_NTA3_NTB2_NTC7_NTD4_NTM0_NEPBS12_NLCA1_NLCB1_ONLL1_PGR2_PLR1_PKA1_SIA3_SS1_SU8_SUM1_SUS128_SPO1_SRVW0_SSO0_SVW8_SK3_SKFTR0_SKXCCM0_SGRO0_TLDS1_ULSGRO0_USL1_UIOFGRO0_USFGRO0_VSn1_VWA8_VWB2_WSGRA0_WSGRB0_WS64_WG32_8_1_WGM1_WGMXCC2_WGMXCCGn1
    SolutionIndex: 4
    SolutionNameMin: Cijk_Alik_Bljk_F8B8BS_BH_Bias_HA_S_SAB_SAV_UserArgs_MT256x256x128_MI32x32x1_SN_LDSB0_AFC0_AG0_AFEM1_AFEM1_ASEM1_CLR1_CADS0_DTLA0_DTLB0_DTVA0_DTVB0_DTVSM0_DPLBn1_EPS0_ELFLR0_EMLLn1_FDSI0_GRPM1_GRVWA16_GRVWB16_GSU0_GSUAMB_GSUC0_GSUWGMRR0_GLS0_ISA950_IU1_K1_LDSTI0_LBSPPA1024_LBSPPB256_LBSPPM0_LPA16_LPB16_LPM0_LRVW16_LWPMn1_MIAV0_MIWT8_2_MO40_MGRIPMn1_NTn1_NTA3_NTB2_NTC7_NTD4_NTM0_NEPBS12_NLCA1_NLCB1_ONLL1_PGR2_PLR1_PKA1_SGROBn1_SIA3_SS1_SU8_SUM1_SUS128_SPO1_SRVW0_SSO0_SVW8_SK3_SKFTR0_SKXCCM0_SGRO0_TIN0_TLDS1_TLDSM1_ULSGRO0_USL1_UIOFGRO0_UPLRP0_USFGRO0_VSn1_VWA8_VWB2_WSGRA0_WSGRB0_WS64_WG32_8_1_WGM1_WGMXCC2_WGMXCCGn1
    SolutionIndex: 5
    SolutionNameMin: Cijk_Alik_Bljk_F8B8BS_BH_Bias_HA_S_SAB_SAV_UserArgs_MT256x256x128_MI32x32x1_SN_LDSB0_AFC0_AG0_AFEM1_AFEM1_ASEM1_CLR0_CADS0_DTLA0_DTLB0_DTVA0_DTVB0_DTVSM0_DPLBn1_EPS0_ELFLR0_EMLLn1_FDSI0_GRPM1_GRVWA16_GRVWB16_GSU0_GSUAMB_GSUC0_GSUWGMRR0_GLS0_ISA950_IU1_K1_LDSTI0_LBSPPA512_LBSPPB512_LBSPPM0_LPA16_LPB16_LPM0_LRVW16_LWPMn1_MIAV0_MIWT4_4_MO40_MGRIPMn1_NTn1_NTA2_NTB3_NTC4_NTD5_NTM0_NEPBS16_NLCA1_NLCB1_ONLL1_PGR2_PLR1_PKA1_SGROBn1_SIA3_SS1_SU16_SUM1_SUS128_SPO0_SRVW0_SSO0_SVW4_SK3_SKFTR0_SKXCCM4_SGRO0_TIN0_TLDS1_TLDSM1_ULSGRO0_USL1_UIOFGRO0_UPLRP0_USFGRO0_VSn1_VWA4_VWB4_WSGRA0_WSGRB0_WS64_WG64_4_1_WGM32_WGMXCC16_WGMXCCGn1
    SolutionNameMin: Cijk_Alik_Bljk_F8B8BS_BH_Bias_HA_S_SAB_SAV_UserArgs_MT256x256x128_MI32x32x1_SN_LDSB0_AFC0_AG0_AFEM1_AFEM1_ASEM1_CLR0_CADS0_DTLA0_DTLB0_DTVA0_DTVB0_EPS0_ELFLR0_EMLLn1_FDSI0_GRPM1_GRVWA16_GRVWB16_GSU0_GSUAMB_GSUC0_GSUWGMRR0_GLS0_ISA950_IU1_K1_LDSTI0_LBSPPA512_LBSPPB512_LBSPPM0_LPA16_LPB16_LPM0_LRVW16_LWPMn1_MIAV0_MIWT4_4_MO40_NTn1_NTA2_NTB3_NTC4_NTD5_NTM0_NEPBS16_NLCA1_NLCB1_ONLL1_PGR2_PLR1_PKA1_SIA3_SS1_SU16_SUM1_SUS128_SPO0_SRVW0_SSO0_SVW4_SK3_SKFTR0_SKXCCM4_SGRO0_TLDS1_ULSGRO0_USL1_UIOFGRO0_USFGRO0_VSn1_VWA4_VWB4_WSGRA0_WSGRB0_WS64_WG64_4_1_WGM32_WGMXCC16_WGMXCCGn1
    SolutionIndex: 6
    SolutionNameMin: Cijk_Alik_Bljk_F8B8BS_BH_Bias_HA_S_SAB_SAV_UserArgs_MT256x256x128_MI32x32x1_SN_LDSB0_AFC0_AG0_AFEM1_AFEM1_ASEM1_CLR1_CADS0_DTLA0_DTLB0_DTVA0_DTVB0_DTVSM0_DPLBn1_EPS0_ELFLR0_EMLLn1_FDSI0_GRPM1_GRVWA16_GRVWB16_GSU0_GSUAMB_GSUC0_GSUWGMRR0_GLS0_ISA950_IU1_K1_LDSTI0_LBSPPA1024_LBSPPB256_LBSPPM0_LPA16_LPB16_LPM0_LRVW16_LWPMn1_MIAV0_MIWT8_2_MO40_MGRIPMn1_NTn1_NTA3_NTB3_NTC7_NTD4_NTM0_NEPBS16_NLCA1_NLCB1_ONLL1_PGR2_PLR1_PKA1_SGROBn1_SIA3_SS1_SU0_SUM0_SUS0_SPO0_SRVW0_SSO0_SVW8_SK3_SKFTR0_SKXCCM8_SGRO0_TIN0_TLDS1_TLDSM1_ULSGRO0_USL1_UIOFGRO0_UPLRP0_USFGRO0_VSn1_VWA8_VWB2_WSGRA0_WSGRB0_WS64_WG32_8_1_WGM4_WGMXCC1_WGMXCCGn1
    SolutionIndex: 5
    SolutionNameMin: Cijk_Alik_Bjlk_S_B_Bias_HA_S_SAV_UserArgs_MT64x32x128_MI16x16x1_CMS_SN_LDSB1_AFC0_AFEM1_AFEM1_ASEM1_CLR1_CADS0_DTLA0_DTLB0_DTVA0_DTVB0_EPS0_FDSI0_GRPM1_GRVWA4_GRVWB4_GSU0_GSUAMB_GSUC0_GSUWGMRR0_GLS0_ISA950_IU1_K1_LDSTI0_LBSPPA512_LBSPPB512_LBSPPM0_LPA8_LPB0_LPM0_LRVW4_LWPMn1_MIAV0_MIWT1_2_MO40_NTn1_NTA1_NTB1_NTC3_NTD5_NTM0_NEPBS0_NLCA1_NLCB1_ONLL1_PGR2_PLR1_PKA1_SIA3_SS1_SU0_SUM1_SUS0_SPO1_SRVW0_SSO0_SVW1_SK3_SKFTR0_SKXCCM0_TLDS1_ULSGRO0_USL1_UIOFGRO0_USFGRO0_VSn1_VWA1_VWB2_WSGRA0_WSGRB0_WS64_WG64_4_1_WGM1_WGMXCC32_WGMXCCGn1
    SolutionIndex: 7
    SolutionNameMin: Cijk_Alik_Bljk_F8B8BS_BH_Bias_HA_S_SAB_SAV_UserArgs_MT256x256x128_MI32x32x1_SN_LDSB0_AFC0_AG0_AFEM1_AFEM1_ASEM1_CLR1_CADS0_DTLA0_DTLB0_DTVA0_DTVB0_DTVSM0_DPLBn1_EPS0_ELFLR0_EMLLn1_FDSI0_GRPM1_GRVWA16_GRVWB16_GSU0_GSUAMB_GSUC0_GSUWGMRR0_GLS0_ISA950_IU1_K1_LDSTI0_LBSPPA512_LBSPPB512_LBSPPM0_LPA16_LPB16_LPM0_LRVW16_LWPMn1_MIAV0_MIWT4_4_MO40_MGRIPMn1_NTn1_NTA3_NTB2_NTC2_NTD2_NTM0_NEPBS16_NLCA1_NLCB1_ONLL1_PGR2_PLR1_PKA1_SGROBn1_SIA3_SS1_SU8_SUM1_SUS128_SPO1_SRVW0_SSO0_SVW4_SK3_SKFTR0_SKXCCM0_SGRO0_TIN0_TLDS1_TLDSM1_ULSGRO0_USL1_UIOFGRO0_UPLRP0_USFGRO0_VSn1_VWA4_VWB4_WSGRA0_WSGRB0_WS64_WG64_4_1_WGM24_WGMXCC16_WGMXCCGn1
    SolutionIndex: 6
    SolutionNameMin: Cijk_Alik_Bjlk_S_B_Bias_HA_S_SAV_UserArgs_MT64x256x32_MI16x16x1_CMS_SN_LDSB1_AFC0_AFEM1_AFEM1_ASEM1_CLR1_CADS0_DTLA0_DTLB0_DTVA0_DTVB0_EPS0_FDSI0_GRPM1_GRVWA4_GRVWB4_GSU0_GSUAMB_GSUC0_GSUWGMRR0_GLS0_ISA950_IU1_K1_LDSTI0_LBSPPA128_LBSPPB4096_LBSPPM0_LPA8_LPB0_LPM0_LRVW4_LWPMn1_MIAV0_MIWT1_16_MO40_NTn1_NTA3_NTB0_NTC0_NTD4_NTM0_NEPBS16_NLCA1_NLCB1_ONLL1_PGR2_PLR1_PKA1_SIA3_SS1_SU0_SUM1_SUS0_SPO0_SRVW0_SSO4_SVW1_SK3_SKFTR0_SKXCCM0_TLDS1_ULSGRO0_USL1_UIOFGRO0_USFGRO0_VSn1_VWA1_VWB4_WSGRA0_WSGRB0_WS64_WG64_4_1_WGM6_WGMXCC4_WGMXCCGn1
    SolutionNameMin: Cijk_Alik_Bljk_F8B8BS_BH_Bias_HA_S_SAB_SAV_UserArgs_MT256x256x128_MI32x32x1_SN_LDSB0_AFC0_AG0_AFEM1_AFEM1_ASEM1_CLR1_CADS0_DTLA0_DTLB0_DTVA0_DTVB0_EPS0_ELFLR0_EMLLn1_FDSI0_GRPM1_GRVWA16_GRVWB16_GSU0_GSUAMB_GSUC0_GSUWGMRR0_GLS0_ISA950_IU1_K1_LDSTI0_LBSPPA1024_LBSPPB256_LBSPPM0_LPA16_LPB16_LPM0_LRVW16_LWPMn1_MIAV0_MIWT8_2_MO40_NTn1_NTA3_NTB3_NTC7_NTD4_NTM0_NEPBS16_NLCA1_NLCB1_ONLL1_PGR2_PLR1_PKA1_SIA3_SS1_SU0_SUM1_SUS0_SPO0_SRVW0_SSO0_SVW8_SK3_SKFTR0_SKXCCM8_SGRO0_TLDS1_ULSGRO0_USL1_UIOFGRO0_USFGRO0_VSn1_VWA8_VWB2_WSGRA0_WSGRB0_WS64_WG32_8_1_WGM4_WGMXCC1_WGMXCCGn1
    SolutionIndex: 8
    SolutionNameMin: Cijk_Alik_Bljk_F8B8BS_BH_Bias_HA_S_SAB_SAV_UserArgs_MT256x256x128_MI32x32x1_SN_LDSB0_AFC0_AG0_AFEM1_AFEM1_ASEM1_CLR1_CADS0_DTLA0_DTLB0_DTVA0_DTVB0_DTVSM0_DPLBn1_EPS0_ELFLR0_EMLLn1_FDSI0_GRPM1_GRVWA16_GRVWB16_GSU0_GSUAMB_GSUC0_GSUWGMRR0_GLS0_ISA950_IU1_K1_LDSTI0_LBSPPA1024_LBSPPB256_LBSPPM0_LPA16_LPB16_LPM0_LRVW16_LWPMn1_MIAV0_MIWT8_2_MO40_MGRIPMn1_NTn1_NTA2_NTB2_NTC5_NTD4_NTM0_NEPBS12_NLCA1_NLCB1_ONLL1_PGR2_PLR1_PKA1_SGROBn1_SIA3_SS1_SU16_SUM1_SUS256_SPO1_SRVW0_SSO0_SVW8_SK3_SKFTR0_SKXCCM4_SGRO0_TIN0_TLDS1_TLDSM1_ULSGRO0_USL1_UIOFGRO0_UPLRP0_USFGRO0_VSn1_VWA8_VWB2_WSGRA0_WSGRB0_WS64_WG32_8_1_WGM2_WGMXCC4_WGMXCCGn1
    SolutionIndex: 7
    SolutionNameMin: Cijk_Alik_Bjlk_S_B_Bias_HA_S_SAV_UserArgs_MT64x80x64_MI16x16x1_CMS_SN_LDSB1_AFC0_AFEM1_AFEM1_ASEM1_CLR1_CADS0_DTLA0_DTLB0_DTVA0_DTVB0_EPS0_FDSI0_GRPM1_GRVWA4_GRVWB4_GSU0_GSUAMB_GSUC0_GSUWGMRR0_GLS0_ISA950_IU1_K1_LDSTI0_LBSPPA256_LBSPPB1280_LBSPPM0_LPA8_LPB16_LPM0_LRVW4_LWPMn1_MIAV1_MIWT1_5_MO40_NTn1_NTA3_NTB0_NTC1_NTD1_NTM0_NEPBS10_NLCA1_NLCB5_ONLL1_PGR2_PLR1_PKA1_SIA3_SS0_SU0_SUM1_SUS0_SPO0_SRVW0_SSO4_SVW4_SK3_SKFTR0_SKXCCM0_TLDS1_ULSGRO0_USL1_UIOFGRO0_USFGRO1_VSn1_VWA1_VWB1_WSGRA0_WSGRB0_WS64_WG64_4_1_WGM4_WGMXCC8_WGMXCCGn1
    SolutionNameMin: Cijk_Alik_Bljk_F8B8BS_BH_Bias_HA_S_SAB_SAV_UserArgs_MT256x256x128_MI32x32x1_SN_LDSB0_AFC0_AG0_AFEM1_AFEM1_ASEM1_CLR1_CADS0_DTLA0_DTLB0_DTVA0_DTVB0_EPS0_ELFLR0_EMLLn1_FDSI0_GRPM1_GRVWA16_GRVWB16_GSU0_GSUAMB_GSUC0_GSUWGMRR0_GLS0_ISA950_IU1_K1_LDSTI0_LBSPPA512_LBSPPB512_LBSPPM0_LPA16_LPB16_LPM0_LRVW16_LWPMn1_MIAV0_MIWT4_4_MO40_NTn1_NTA3_NTB2_NTC2_NTD2_NTM0_NEPBS16_NLCA1_NLCB1_ONLL1_PGR2_PLR1_PKA1_SIA3_SS1_SU8_SUM1_SUS128_SPO1_SRVW0_SSO0_SVW4_SK3_SKFTR0_SKXCCM0_SGRO0_TLDS1_ULSGRO0_USL1_UIOFGRO0_USFGRO0_VSn1_VWA4_VWB4_WSGRA0_WSGRB0_WS64_WG64_4_1_WGM24_WGMXCC16_WGMXCCGn1
    SolutionIndex: 8
    SolutionNameMin: Cijk_Alik_Bjlk_S_B_Bias_HA_S_SAV_UserArgs_MT64x64x64_MI32x32x1_CMS_SN_LDSB1_AFC0_AFEM1_AFEM1_ASEM1_CLR1_CADS0_DTLA0_DTLB0_DTVA0_DTVB0_EPS1_FDSI0_GRPM1_GRVWA4_GRVWB4_GSU0_GSUAMB_GSUC0_GSUWGMRR0_GLS0_ISA950_IU1_K1_LDSTI0_LBSPPA256_LBSPPB0_LBSPPM0_LPA4_LPB0_LPM0_LRVW4_LWPMn1_MIAV0_MIWT1_1_MO40_NTn1_NTA2_NTB0_NTC1_NTD0_NTM0_NEPBS16_NLCA1_NLCB1_ONLL1_PGR1_PLR1_PKA1_SIA3_SS1_SU0_SUM1_SUS0_SPO1_SRVW0_SSO0_SVW1_SK3_SKFTR0_SKXCCM8_TLDS1_ULSGRO0_USL1_UIOFGRO0_USFGROn1_VSn1_VWA1_VWB1_WSGRA0_WSGRB0_WS64_WG64_4_1_WGM1_WGMXCC4_WGMXCCGn1
    SolutionIndex: 9
    SolutionNameMin: Cijk_Alik_Bjlk_S_B_Bias_HA_S_SAV_UserArgs_MT64x64x64_MI16x16x1_CMS_SN_LDSB1_AFC0_AFEM1_AFEM1_ASEM1_CLR1_CADS0_DTLA0_DTLB0_DTVA0_DTVB0_EPS0_FDSI0_GRPM1_GRVWA4_GRVWB4_GSU0_GSUAMB_GSUC0_GSUWGMRR0_GLS0_ISA950_IU1_K1_LDSTI0_LBSPPA256_LBSPPB1024_LBSPPM0_LPA8_LPB0_LPM0_LRVW4_LWPMn1_MIAV1_MIWT1_4_MO40_NTn1_NTA0_NTB1_NTC1_NTD0_NTM0_NEPBS0_NLCA1_NLCB1_ONLL1_PGR2_PLR1_PKA1_SIA3_SS1_SU0_SUM1_SUS0_SPO0_SRVW0_SSO0_SVW1_SK3_SKFTR0_SKXCCM0_TLDS1_ULSGRO0_USL1_UIOFGRO0_USFGRO1_VSn1_VWA1_VWB4_WSGRA0_WSGRB0_WS64_WG64_4_1_WGM32_WGMXCC4_WGMXCCGn1
    SolutionIndex: 8
    SolutionNameMin: Cijk_Alik_Bljk_F8B8BS_BH_Bias_HA_S_SAB_SAV_UserArgs_MT256x256x128_MI32x32x1_SN_LDSB0_AFC0_AG0_AFEM1_AFEM1_ASEM1_CLR1_CADS0_DTLA0_DTLB0_DTVA0_DTVB0_EPS0_ELFLR0_EMLLn1_FDSI0_GRPM1_GRVWA16_GRVWB16_GSU0_GSUAMB_GSUC0_GSUWGMRR0_GLS0_ISA950_IU1_K1_LDSTI0_LBSPPA1024_LBSPPB256_LBSPPM0_LPA16_LPB16_LPM0_LRVW16_LWPMn1_MIAV0_MIWT8_2_MO40_NTn1_NTA2_NTB2_NTC5_NTD4_NTM0_NEPBS12_NLCA1_NLCB1_ONLL1_PGR2_PLR1_PKA1_SIA3_SS1_SU16_SUM1_SUS256_SPO1_SRVW0_SSO0_SVW8_SK3_SKFTR0_SKXCCM4_SGRO0_TLDS1_ULSGRO0_USL1_UIOFGRO0_USFGRO0_VSn1_VWA8_VWB2_WSGRA0_WSGRB0_WS64_WG32_8_1_WGM2_WGMXCC4_WGMXCCGn1
    SolutionIndex: 9
    SolutionNameMin: Cijk_Alik_Bljk_F8B8BS_BH_Bias_HA_S_SAB_SAV_UserArgs_MT256x256x128_MI16x16x1_CMS_SN_LDSB0_AFC0_AG0_AFEM1_AFEM1_ASEM1_CLR0_CADS0_DTLA1_DTLB1_DTVA0_DTVB0_DTVSM0_DPLBn1_EPS0_ELFLR0_EMLLn1_FDSI0_GRPM1_GRVWA16_GRVWB16_GSU0_GSUAMB_GSUC0_GSUWGMRR0_GLS0_ISA950_IU1_K1_LDSTI0_LBSPPA1024_LBSPPB1024_LBSPPM0_LPA32_LPB32_LPM0_LRVW16_LWPMn1_MIAV0_MIWT8_8_MO40_MGRIPMn1_NTn1_NTA0_NTB3_NTC6_NTD5_NTM0_NEPBS16_NLCA1_NLCB1_ONLL1_PGR2_PLR0_PKA1_SGROBn1_SIA3_SS1_SU16_SUM1_SUS128_SPO0_SRVW0_SSO0_SVW8_SK3_SKFTR0_SKXCCM8_SGRO0_TIN0_TLDS1_TLDSM1_ULSGRO0_USL1_UIOFGRO0_UPLRP0_USFGROn1_VSn1_VWA8_VWB8_WSGRA0_WSGRB0_WS64_WG32_8_1_WGM32_WGMXCC8_WGMXCCGn1
    SolutionNameMin: Cijk_Alik_Bljk_F8B8BS_BH_Bias_HA_S_SAB_SAV_UserArgs_MT256x256x128_MI16x16x1_CMS_SN_LDSB0_AFC0_AG0_AFEM1_AFEM1_ASEM1_CLR0_CADS0_DTLA1_DTLB1_DTVA0_DTVB0_EPS0_ELFLR0_EMLLn1_FDSI0_GRPM1_GRVWA16_GRVWB16_GSU0_GSUAMB_GSUC0_GSUWGMRR0_GLS0_ISA950_IU1_K1_LDSTI0_LBSPPA1024_LBSPPB1024_LBSPPM0_LPA32_LPB32_LPM0_LRVW16_LWPMn1_MIAV0_MIWT8_8_MO40_NTn1_NTA0_NTB3_NTC6_NTD5_NTM0_NEPBS16_NLCA1_NLCB1_ONLL1_PGR2_PLR0_PKA1_SIA3_SS1_SU16_SUM1_SUS128_SPO0_SRVW0_SSO0_SVW8_SK3_SKFTR0_SKXCCM8_SGRO0_TLDS1_ULSGRO0_USL1_UIOFGRO0_USFGROn1_VSn1_VWA8_VWB8_WSGRA0_WSGRB0_WS64_WG32_8_1_WGM32_WGMXCC8_WGMXCCGn1
    SolutionIndex: 10
    SolutionNameMin: Cijk_Alik_Bljk_F8B8BS_BH_Bias_HA_S_SAB_SAV_UserArgs_MT256x256x128_MI16x16x1_CMS_SN_LDSB0_AFC0_AG0_AFEM1_AFEM1_ASEM1_CLR0_CADS0_DTLA1_DTLB1_DTVA0_DTVB0_DTVSM0_DPLBn1_EPS0_ELFLR0_EMLLn1_FDSI0_GRPM1_GRVWA16_GRVWB16_GSU0_GSUAMB_GSUC0_GSUWGMRR0_GLS0_ISA950_IU1_K1_LDSTI0_LBSPPA1024_LBSPPB1024_LBSPPM0_LPA32_LPB32_LPM0_LRVW16_LWPMn1_MIAV0_MIWT8_8_MO40_MGRIPMn1_NTn1_NTA0_NTB0_NTC4_NTD4_NTM0_NEPBS16_NLCA1_NLCB1_ONLL1_PGR2_PLR0_PKA1_SGROBn1_SIA3_SS1_SU16_SUM1_SUS128_SPO1_SRVW0_SSO1_SVW8_SK3_SKFTR0_SKXCCM4_SGRO0_TIN0_TLDS1_TLDSM1_ULSGRO0_USL1_UIOFGRO0_UPLRP0_USFGRO0_VSn1_VWA8_VWB8_WSGRA0_WSGRB0_WS64_WG32_8_1_WGM32_WGMXCC32_WGMXCCGn1
    SolutionIndex: 11
    SolutionNameMin: Cijk_Alik_Bljk_F8B8BS_BH_Bias_HA_S_SAB_SAV_UserArgs_MT192x256x128_MI16x16x1_SN_LDSB0_AFC0_AG0_AFEM1_AFEM1_ASEM1_CLR0_CADS0_DTLA0_DTLB0_DTVA0_DTVB0_DTVSM0_DPLBn1_EPS0_ELFLR0_EMLLn1_FDSI0_GRPM1_GRVWA16_GRVWB16_GSU0_GSUAMB_GSUC0_GSUWGMRR0_GLS0_ISA950_IU1_K1_LDSTI0_LBSPPA512_LBSPPB512_LBSPPM0_LPA32_LPB32_LPM0_LRVW16_LWPMn1_MIAV0_MIWT12_4_MO40_MGRIPMn1_NTn1_NTA2_NTB0_NTC7_NTD4_NTM0_NEPBS0_NLCA1_NLCB1_ONLL1_PGR2_PLR0_PKA1_SGROBn1_SIA3_SS1_SU0_SUM0_SUS0_SPO0_SRVW0_SSO1_SVW4_SK3_SKFTR0_SKXCCM0_SGRO0_TIN0_TLDS1_TLDSM1_ULSGRO0_USL1_UIOFGRO0_UPLRP0_USFGRO0_VSn1_VWA4_VWB4_WSGRA0_WSGRB0_WS64_WG16_16_1_WGM1_WGMXCC32_WGMXCCGn1
    SolutionIndex: 12
    SolutionNameMin: Cijk_Alik_Bljk_F8B8BS_BH_Bias_HA_S_SAB_SAV_UserArgs_MT256x256x128_MI16x16x1_CMS_SN_LDSB0_AFC0_AG0_AFEM1_AFEM1_ASEM1_CLR0_CADS0_DTLA1_DTLB1_DTVA0_DTVB0_DTVSM0_DPLBn1_EPS0_ELFLR0_EMLLn1_FDSI0_GRPM1_GRVWA16_GRVWB16_GSU0_GSUAMB_GSUC0_GSUWGMRR0_GLS0_ISA950_IU1_K1_LDSTI0_LBSPPA1024_LBSPPB1024_LBSPPM0_LPA32_LPB32_LPM0_LRVW16_LWPMn1_MIAV0_MIWT8_8_MO40_MGRIPMn1_NTn1_NTA0_NTB0_NTC4_NTD2_NTM0_NEPBS0_NLCA1_NLCB1_ONLL1_PGR2_PLR0_PKA1_SGROBn1_SIA3_SS1_SU16_SUM1_SUS128_SPO0_SRVW0_SSO1_SVW8_SK3_SKFTR0_SKXCCM0_SGRO0_TIN0_TLDS1_TLDSM1_ULSGRO0_USL1_UIOFGRO0_UPLRP0_USFGROn1_VSn1_VWA8_VWB8_WSGRA0_WSGRB0_WS64_WG32_8_1_WGM2_WGMXCC1_WGMXCCGn1
    SolutionIndex: 13
    SolutionNameMin: Cijk_Alik_Bljk_F8B8BS_BH_Bias_HA_S_SAB_SAV_UserArgs_MT192x256x128_MI16x16x1_SN_LDSB0_AFC0_AG0_AFEM1_AFEM1_ASEM1_CLR0_CADS0_DTLA0_DTLB0_DTVA0_DTVB0_DTVSM0_DPLBn1_EPS0_ELFLR0_EMLLn1_FDSI0_GRPM1_GRVWA16_GRVWB16_GSU0_GSUAMB_GSUC0_GSUWGMRR0_GLS0_ISA950_IU1_K1_LDSTI0_LBSPPA512_LBSPPB512_LBSPPM0_LPA32_LPB32_LPM0_LRVW16_LWPMn1_MIAV0_MIWT12_4_MO40_MGRIPMn1_NTn1_NTA1_NTB3_NTC7_NTD3_NTM0_NEPBS10_NLCA1_NLCB1_ONLL1_PGR2_PLR0_PKA1_SGROBn1_SIA3_SS1_SU0_SUM0_SUS0_SPO0_SRVW0_SSO0_SVW4_SK3_SKFTR0_SKXCCM0_SGRO0_TIN0_TLDS2_TLDSM1_ULSGRO0_USL1_UIOFGRO0_UPLRP0_USFGRO1_VSn1_VWA4_VWB4_WSGRA0_WSGRB0_WS64_WG16_16_1_WGM48_WGMXCC2_WGMXCCGn1
    SolutionIndex: 14
    SolutionNameMin: Cijk_Alik_Bljk_F8B8BS_BH_Bias_HA_S_SAB_SAV_UserArgs_MT224x256x128_MI16x16x1_SN_LDSB0_AFC0_AG0_AFEM1_AFEM1_ASEM1_CLR0_CADS0_DTLA0_DTLB0_DTVA0_DTVB0_DTVSM0_DPLBn1_EPS0_ELFLR0_EMLLn1_FDSI0_GRPM1_GRVWA16_GRVWB16_GSU0_GSUAMB_GSUC0_GSUWGMRR0_GLS0_ISA950_IU1_K1_LDSTI0_LBSPPA256_LBSPPB512_LBSPPM0_LPA32_LPB32_LPM0_LRVW16_LWPMn1_MIAV0_MIWT14_4_MO40_MGRIPMn1_NTn1_NTA3_NTB2_NTC4_NTD6_NTM0_NEPBS0_NLCA1_NLCB1_ONLL1_PGR2_PLR0_PKA1_SGROBn1_SIA3_SS1_SU0_SUM0_SUS0_SPO0_SRVW0_SSO1_SVW2_SK3_SKFTR0_SKXCCM0_SGRO0_TIN0_TLDS2_TLDSM1_ULSGRO0_USL1_UIOFGRO0_UPLRP0_USFGRO0_VSn1_VWA2_VWB4_WSGRA0_WSGRB0_WS64_WG16_16_1_WGM1_WGMXCC4_WGMXCCGn1
    SolutionIndex: 15
    SolutionNameMin: Cijk_Alik_Bljk_F8B8BS_BH_Bias_HA_S_SAB_SAV_UserArgs_MT256x256x128_MI32x32x1_SN_LDSB0_AFC0_AG1_AFEM1_AFEM1_ASEM1_CLR1_CADS0_DTLA0_DTLB0_DTVA0_DTVB0_DTVSM0_DPLB0_EPS0_ELFLR0_EMLL0_FDSI0_GRPM1_GRVWA4_GRVWB8_GSU0_GSUAMB_GSUC0_GSUWGMRR0_GLS0_ISA950_IU1_K1_LDSTI0_LBSPPA512_LBSPPB512_LBSPPM0_LPA16_LPB16_LPM0_LRVW16_LWPMn1_MIAV0_MIWT4_4_MO40_MGRIPM1_NTn1_NTA0_NTB0_NTC0_NTD4_NTM0_NEPBS0_NLCA1_NLCB1_ONLL0_PGR2_PLR1_PKA1_SGROB0_SIA3_SS1_SU8_SUM0_SUS512_SPO0_SRVW0_SSO4_SVW4_SK3_SKFTR0_SKXCCM2_SGRO0_TIN0_TLDS1_TLDSMn1_ULSGRO0_USL1_UIOFGRO0_UPLRP0_USFGRO0_VSn1_VWA4_VWB4_WSGRA2_WSGRB2_WS64_WG64_4_1_WGM8_WGMXCC4_WGMXCCGn1
    SolutionIndex: 16
    SolutionNameMin: Cijk_Alik_Bljk_F8B8BS_BH_Bias_HA_S_SAB_SAV_UserArgs_MT256x256x128_MI32x32x1_SN_LDSB0_AFC0_AG0_AFEM1_AFEM1_ASEM1_CLR0_CADS0_DTLA0_DTLB0_DTVA0_DTVB0_DTVSM0_DPLB0_EPS0_ELFLR0_EMLLn1_FDSI0_GRPM1_GRVWA4_GRVWB8_GSU0_GSUAMB_GSUC0_GSUWGMRR0_GLS0_ISA950_IU1_K1_LDSTI0_LBSPPA512_LBSPPB512_LBSPPM0_LPA16_LPB16_LPM0_LRVW16_LWPMn1_MIAV0_MIWT4_4_MO40_MGRIPM1_NTn1_NTA0_NTB4_NTC4_NTD4_NTM0_NEPBS0_NLCA1_NLCB1_ONLL0_PGR2_PLR1_PKA1_SGROB0_SIA3_SS1_SU0_SUM0_SUS0_SPO0_SRVW0_SSO1_SVW4_SK3_SKFTR0_SKXCCM4_SGRO0_TIN0_TLDS1_TLDSMn1_ULSGRO0_USL1_UIOFGRO0_UPLRP0_USFGRO0_VSn1_VWA4_VWB4_WSGRA0_WSGRB2_WS64_WG64_4_1_WGM2_WGMXCC1_WGMXCCGn1
    SolutionIndex: 10
    SolutionNameMin: Cijk_Alik_Bjlk_S_B_Bias_HA_S_SAV_UserArgs_MT80x64x64_MI16x16x1_CMS_SN_LDSB1_AFC0_AFEM1_AFEM1_ASEM1_CLR1_CADS0_DTLA0_DTLB0_DTVA0_DTVB0_EPS0_FDSI0_GRPM1_GRVWA4_GRVWB4_GSU0_GSUAMB_GSUC0_GSUWGMRR0_GLS0_ISA950_IU1_K1_LDSTI0_LBSPPA256_LBSPPB1024_LBSPPM0_LPA8_LPB16_LPM0_LRVW4_LWPMn1_MIAV1_MIWT5_1_MO40_NTn1_NTA3_NTB3_NTC1_NTD0_NTM0_NEPBS0_NLCA1_NLCB1_ONLL1_PGR2_PLR1_PKA1_SIA3_SS1_SU0_SUM1_SUS0_SPO0_SRVW0_SSO0_SVW1_SK3_SKFTR0_SKXCCM4_TLDS1_ULSGRO0_USL1_UIOFGRO0_USFGROn1_VSn1_VWA1_VWB1_WSGRA0_WSGRB0_WS64_WG16_16_1_WGM1_WGMXCC8_WGMXCCGn1
    SolutionNameMin: Cijk_Alik_Bljk_F8B8BS_BH_Bias_HA_S_SAB_SAV_UserArgs_MT256x256x128_MI16x16x1_CMS_SN_LDSB0_AFC0_AG0_AFEM1_AFEM1_ASEM1_CLR0_CADS0_DTLA1_DTLB1_DTVA0_DTVB0_EPS0_ELFLR0_EMLLn1_FDSI0_GRPM1_GRVWA16_GRVWB16_GSU0_GSUAMB_GSUC0_GSUWGMRR0_GLS0_ISA950_IU1_K1_LDSTI0_LBSPPA1024_LBSPPB1024_LBSPPM0_LPA32_LPB32_LPM0_LRVW16_LWPMn1_MIAV0_MIWT8_8_MO40_NTn1_NTA0_NTB0_NTC4_NTD4_NTM0_NEPBS16_NLCA1_NLCB1_ONLL1_PGR2_PLR0_PKA1_SIA3_SS1_SU16_SUM1_SUS128_SPO1_SRVW0_SSO1_SVW8_SK3_SKFTR0_SKXCCM4_SGRO0_TLDS1_ULSGRO0_USL1_UIOFGRO0_USFGRO0_VSn1_VWA8_VWB8_WSGRA0_WSGRB0_WS64_WG32_8_1_WGM32_WGMXCC32_WGMXCCGn1
    SolutionIndex: 17
    SolutionNameMin: Cijk_Alik_Bljk_F8B8BS_BH_Bias_HA_S_SAB_SAV_UserArgs_MT256x256x64_MI32x32x1_SN_LDSB0_AFC0_AG0_AFEM1_AFEM1_ASEM1_CLR1_CADS0_DTLA0_DTLB0_DTVA0_DTVB0_DTVSM0_DPLB0_EPS0_ELFLR0_EMLL0_FDSI0_GRPM1_GRVWA8_GRVWB8_GSU0_GSUAMB_GSUC0_GSUWGMRR0_GLS0_ISA950_IU1_K1_LDSTI0_LBSPPA256_LBSPPB256_LBSPPM0_LPA16_LPB16_LPM0_LRVW16_LWPMn1_MIAV0_MIWT4_4_MO40_MGRIPM1_NTn1_NTA0_NTB0_NTC4_NTD4_NTM0_NEPBS0_NLCA1_NLCB1_ONLL0_PGR2_PLR1_PKA1_SGROB0_SIA3_SS1_SU0_SUM0_SUS0_SPO0_SRVW0_SSO1_SVW4_SK3_SKFTR0_SKXCCM8_SGRO0_TIN0_TLDS1_TLDSMn1_ULSGRO1_USL1_UIOFGRO0_UPLRP0_USFGRO1_VSn1_VWA4_VWB4_WSGRA0_WSGRB0_WS64_WG64_4_1_WGM2_WGMXCC1_WGMXCCGn1
    SolutionIndex: 11
    SolutionNameMin: Cijk_Alik_Bjlk_S_B_Bias_HA_S_SAV_UserArgs_MT112x64x64_MI16x16x1_CMS_SN_LDSB1_AFC0_AFEM1_AFEM1_ASEM1_CLR1_CADS0_DTLA0_DTLB0_DTVA0_DTVB0_EPS0_FDSI0_GRPM1_GRVWA4_GRVWB4_GSU0_GSUAMB_GSUC0_GSUWGMRR0_GLS0_ISA950_IU1_K1_LDSTI0_LBSPPA256_LBSPPB1024_LBSPPM0_LPA8_LPB16_LPM0_LRVW4_LWPMn1_MIAV0_MIWT7_1_MO40_NTn1_NTA3_NTB1_NTC0_NTD0_NTM0_NEPBS0_NLCA1_NLCB1_ONLL1_PGR2_PLR1_PKA1_SIA3_SS1_SU0_SUM1_SUS0_SPO0_SRVW0_SSO0_SVW1_SK3_SKFTR0_SKXCCM4_TLDS1_ULSGRO0_USL1_UIOFGRO0_USFGRO1_VSn1_VWA1_VWB1_WSGRA0_WSGRB0_WS64_WG16_16_1_WGM1_WGMXCC16_WGMXCCGn1
    SolutionNameMin: Cijk_Alik_Bljk_F8B8BS_BH_Bias_HA_S_SAB_SAV_UserArgs_MT192x256x128_MI16x16x1_SN_LDSB0_AFC0_AG0_AFEM1_AFEM1_ASEM1_CLR0_CADS0_DTLA0_DTLB0_DTVA0_DTVB0_EPS0_ELFLR0_EMLLn1_FDSI0_GRPM1_GRVWA16_GRVWB16_GSU0_GSUAMB_GSUC0_GSUWGMRR0_GLS0_ISA950_IU1_K1_LDSTI0_LBSPPA512_LBSPPB512_LBSPPM0_LPA32_LPB32_LPM0_LRVW16_LWPMn1_MIAV0_MIWT12_4_MO40_NTn1_NTA2_NTB0_NTC7_NTD4_NTM0_NEPBS0_NLCA1_NLCB1_ONLL1_PGR2_PLR0_PKA1_SIA3_SS1_SU0_SUM1_SUS0_SPO0_SRVW0_SSO1_SVW4_SK3_SKFTR0_SKXCCM0_SGRO0_TLDS1_ULSGRO0_USL1_UIOFGRO0_USFGRO0_VSn1_VWA4_VWB4_WSGRA0_WSGRB0_WS64_WG16_16_1_WGM1_WGMXCC32_WGMXCCGn1
    SolutionIndex: 12
    SolutionNameMin: Cijk_Alik_Bjlk_S_B_Bias_HA_S_SAV_UserArgs_MT176x64x32_MI16x16x1_CMS_SN_LDSB1_AFC0_AFEM1_AFEM1_ASEM1_CLR1_CADS0_DTLA0_DTLB0_DTVA0_DTVB0_EPS1_FDSI0_GRPM1_GRVWA1_GRVWB1_GSU0_GSUAMB_GSUC0_GSUWGMRR0_GLS0_ISA950_IU1_K1_LDSTI0_LBSPPA128_LBSPPB1024_LBSPPM0_LPA8_LPB16_LPM0_LRVW4_LWPMn1_MIAV1_MIWT11_1_MO40_NTn1_NTA2_NTB0_NTC0_NTD4_NTM0_NEPBS0_NLCA1_NLCB1_ONLL1_PGR1_PLR1_PKA1_SIA3_SS1_SU0_SUM1_SUS0_SPO0_SRVW0_SSO0_SVW1_SK3_SKFTR0_SKXCCM4_TLDS1_ULSGRO0_USL1_UIOFGRO0_USFGRO0_VSn1_VWA1_VWB1_WSGRA0_WSGRB0_WS64_WG16_16_1_WGM8_WGMXCC2_WGMXCCGn1
    SolutionNameMin: Cijk_Alik_Bljk_F8B8BS_BH_Bias_HA_S_SAB_SAV_UserArgs_MT256x256x128_MI16x16x1_CMS_SN_LDSB0_AFC0_AG0_AFEM1_AFEM1_ASEM1_CLR0_CADS0_DTLA1_DTLB1_DTVA0_DTVB0_EPS0_ELFLR0_EMLLn1_FDSI0_GRPM1_GRVWA16_GRVWB16_GSU0_GSUAMB_GSUC0_GSUWGMRR0_GLS0_ISA950_IU1_K1_LDSTI0_LBSPPA1024_LBSPPB1024_LBSPPM0_LPA32_LPB32_LPM0_LRVW16_LWPMn1_MIAV0_MIWT8_8_MO40_NTn1_NTA0_NTB0_NTC4_NTD2_NTM0_NEPBS0_NLCA1_NLCB1_ONLL1_PGR2_PLR0_PKA1_SIA3_SS1_SU16_SUM1_SUS128_SPO0_SRVW0_SSO1_SVW8_SK3_SKFTR0_SKXCCM0_SGRO0_TLDS1_ULSGRO0_USL1_UIOFGRO0_USFGROn1_VSn1_VWA8_VWB8_WSGRA0_WSGRB0_WS64_WG32_8_1_WGM2_WGMXCC1_WGMXCCGn1
    SolutionIndex: 13
    SolutionNameMin: Cijk_Alik_Bjlk_S_B_Bias_HA_S_SAV_UserArgs_MT96x128x32_MI16x16x1_CMS_SN_LDSB1_AFC0_AFEM1_AFEM1_ASEM1_CLR1_CADS0_DTLA0_DTLB0_DTVA0_DTVB0_EPS0_FDSI0_GRPM1_GRVWA4_GRVWB4_GSU0_GSUAMB_GSUC0_GSUWGMRR0_GLS0_ISA950_IU1_K1_LDSTI0_LBSPPA128_LBSPPB2048_LBSPPM0_LPA8_LPB0_LPM0_LRVW4_LWPMn1_MIAV0_MIWT3_4_MO40_NTn1_NTA3_NTB3_NTC0_NTD1_NTM0_NEPBS0_NLCA1_NLCB1_ONLL1_PGR2_PLR1_PKA1_SIA3_SS1_SU16_SUM1_SUS128_SPO0_SRVW0_SSO0_SVW1_SK3_SKFTR0_SKXCCM8_TLDS1_ULSGRO0_USL1_UIOFGRO0_USFGRO1_VSn1_VWA1_VWB4_WSGRA0_WSGRB0_WS64_WG32_8_1_WGM4_WGMXCC1_WGMXCCGn1
    SolutionNameMin: Cijk_Alik_Bljk_F8B8BS_BH_Bias_HA_S_SAB_SAV_UserArgs_MT192x256x128_MI16x16x1_SN_LDSB0_AFC0_AG0_AFEM1_AFEM1_ASEM1_CLR0_CADS0_DTLA0_DTLB0_DTVA0_DTVB0_EPS0_ELFLR0_EMLLn1_FDSI0_GRPM1_GRVWA16_GRVWB16_GSU0_GSUAMB_GSUC0_GSUWGMRR0_GLS0_ISA950_IU1_K1_LDSTI0_LBSPPA512_LBSPPB512_LBSPPM0_LPA32_LPB32_LPM0_LRVW16_LWPMn1_MIAV0_MIWT12_4_MO40_NTn1_NTA1_NTB3_NTC7_NTD3_NTM0_NEPBS10_NLCA1_NLCB1_ONLL1_PGR2_PLR0_PKA1_SIA3_SS1_SU0_SUM1_SUS0_SPO0_SRVW0_SSO0_SVW4_SK3_SKFTR0_SKXCCM0_SGRO0_TLDS2_ULSGRO0_USL1_UIOFGRO0_USFGRO1_VSn1_VWA4_VWB4_WSGRA0_WSGRB0_WS64_WG16_16_1_WGM48_WGMXCC2_WGMXCCGn1
    SolutionIndex: 14
    SolutionNameMin: Cijk_Alik_Bjlk_S_B_Bias_HA_S_SAV_UserArgs_MT96x96x32_MI16x16x1_CMS_SN_LDSB1_AFC0_AFEM1_AFEM1_ASEM1_CLR1_CADS0_DTLA0_DTLB0_DTVA0_DTVB0_EPS0_FDSI0_GRPM1_GRVWA4_GRVWB4_GSU0_GSUAMB_GSUC0_GSUWGMRR0_GLS0_ISA950_IU1_K1_LDSTI0_LBSPPA128_LBSPPB1536_LBSPPM0_LPA8_LPB16_LPM0_LRVW4_LWPMn1_MIAV0_MIWT3_3_MO40_NTn1_NTA0_NTB1_NTC0_NTD7_NTM0_NEPBS0_NLCA1_NLCB3_ONLL1_PGR2_PLR1_PKA1_SIA3_SS1_SU0_SUM1_SUS0_SPO0_SRVW0_SSO1_SVW1_SK3_SKFTR0_SKXCCM0_TLDS1_ULSGRO0_USL1_UIOFGRO0_USFGROn1_VSn1_VWA1_VWB1_WSGRA0_WSGRB0_WS64_WG32_8_1_WGM32_WGMXCC4_WGMXCCGn1
    SolutionNameMin: Cijk_Alik_Bljk_F8B8BS_BH_Bias_HA_S_SAB_SAV_UserArgs_MT224x256x128_MI16x16x1_SN_LDSB0_AFC0_AG0_AFEM1_AFEM1_ASEM1_CLR0_CADS0_DTLA0_DTLB0_DTVA0_DTVB0_EPS0_ELFLR0_EMLLn1_FDSI0_GRPM1_GRVWA16_GRVWB16_GSU0_GSUAMB_GSUC0_GSUWGMRR0_GLS0_ISA950_IU1_K1_LDSTI0_LBSPPA256_LBSPPB512_LBSPPM0_LPA32_LPB32_LPM0_LRVW16_LWPMn1_MIAV0_MIWT14_4_MO40_NTn1_NTA3_NTB2_NTC4_NTD6_NTM0_NEPBS0_NLCA1_NLCB1_ONLL1_PGR2_PLR0_PKA1_SIA3_SS1_SU0_SUM1_SUS0_SPO0_SRVW0_SSO1_SVW2_SK3_SKFTR0_SKXCCM0_SGRO0_TLDS2_ULSGRO0_USL1_UIOFGRO0_USFGRO0_VSn1_VWA2_VWB4_WSGRA0_WSGRB0_WS64_WG16_16_1_WGM1_WGMXCC4_WGMXCCGn1
    SolutionIndex: 15
    SolutionNameMin: Cijk_Alik_Bjlk_S_B_Bias_HA_S_SAV_UserArgs_MT64x160x32_MI16x16x1_CMS_SN_LDSB1_AFC0_AFEM1_AFEM1_ASEM1_CLR1_CADS0_DTLA0_DTLB0_DTVA0_DTVB0_EPS0_FDSI0_GRPM1_GRVWA4_GRVWB4_GSU0_GSUAMB_GSUC0_GSUWGMRR0_GLS0_ISA950_IU1_K1_LDSTI0_LBSPPA256_LBSPPB2560_LBSPPM0_LPA8_LPB16_LPM0_LRVW4_LWPMn1_MIAV0_MIWT2_5_MO40_NTn1_NTA1_NTB1_NTC2_NTD6_NTM0_NEPBS0_NLCA1_NLCB5_ONLL1_PGR2_PLR1_PKA1_SIA3_SS1_SU0_SUM1_SUS0_SPO0_SRVW0_SSO1_SVW2_SK3_SKFTR0_SKXCCM0_TLDS1_ULSGRO0_USL1_UIOFGRO0_USFGRO0_VSn1_VWA2_VWB1_WSGRA0_WSGRB0_WS64_WG32_8_1_WGM4_WGMXCC8_WGMXCCGn1
    SolutionNameMin: Cijk_Alik_Bljk_F8B8BS_BH_Bias_HA_S_SAB_SAV_UserArgs_MT192x256x128_MI16x16x1_SN_LDSB0_AFC0_AG0_AFEM1_AFEM1_ASEM1_CLR0_CADS0_DTLA0_DTLB0_DTVA0_DTVB0_EPS0_ELFLR0_EMLLn1_FDSI0_GRPM1_GRVWA16_GRVWB16_GSU0_GSUAMB_GSUC0_GSUWGMRR0_GLS0_ISA950_IU1_K1_LDSTI0_LBSPPA256_LBSPPB1024_LBSPPM0_LPA32_LPB32_LPM0_LRVW16_LWPMn1_MIAV0_MIWT6_8_MO40_NTn1_NTA3_NTB2_NTC1_NTD0_NTM0_NEPBS0_NLCA1_NLCB1_ONLL1_PGR2_PLR0_PKA1_SIA3_SS1_SU8_SUM1_SUS128_SPO0_SRVW0_SSO1_SVW2_SK3_SKFTR0_SKXCCM8_SGRO0_TLDS2_ULSGRO0_USL1_UIOFGRO0_USFGRO1_VSn1_VWA2_VWB8_WSGRA0_WSGRB0_WS64_WG32_8_1_WGM8_WGMXCC1_WGMXCCGn1
    SolutionIndex: 16
    SolutionNameMin: Cijk_Alik_Bjlk_S_B_Bias_HA_S_SAV_UserArgs_MT32x16x64_MI16x16x1_CMS_SN_LDSB0_AFC0_AFEM1_AFEM1_ASEM1_CLR1_CADS0_DTLA0_DTLB0_DTVA0_DTVB0_EPS0_FDSI0_GRPM1_GRVWA4_GRVWB1_GSU0_GSUAMB_GSUC0_GSUWGMRR0_GLS0_ISA950_IU1_K1_LDSTI0_LBSPPA256_LBSPPB256_LBSPPM0_LPA8_LPB16_LPM0_LRVW4_LWPMn1_MIAV0_MIWT1_1_MO40_NTn1_NTA3_NTB0_NTC6_NTD0_NTM0_NEPBS12_NLCA1_NLCB1_ONLL1_PGR2_PLR1_PKA1_SIA3_SS1_SU0_SUM1_SUS0_SPO0_SRVW0_SSO0_SVW1_SK3_SKFTR0_SKXCCM4_TLDS1_ULSGRO0_USL1_UIOFGRO0_USFGRO1_VSn1_VWA1_VWB1_WSGRA0_WSGRB0_WS64_WG32_4_2_WGM1_WGMXCC4_WGMXCCGn1
    SolutionNameMin: Cijk_Alik_Bljk_F8B8BS_BH_Bias_HA_S_SAB_SAV_UserArgs_MT192x256x128_MI16x16x1_SN_LDSB0_AFC0_AG0_AFEM1_AFEM1_ASEM1_CLR0_CADS0_DTLA0_DTLB0_DTVA0_DTVB0_EPS0_ELFLR0_EMLLn1_FDSI0_GRPM1_GRVWA16_GRVWB16_GSU0_GSUAMB_GSUC0_GSUWGMRR0_GLS0_ISA950_IU1_K1_LDSTI0_LBSPPA256_LBSPPB1024_LBSPPM0_LPA32_LPB32_LPM0_LRVW16_LWPMn1_MIAV0_MIWT6_8_MO40_NTn1_NTA0_NTB3_NTC1_NTD5_NTM0_NEPBS0_NLCA1_NLCB1_ONLL1_PGR2_PLR0_PKA1_SIA3_SS1_SU8_SUM1_SUS256_SPO0_SRVW0_SSO1_SVW2_SK3_SKFTR0_SKXCCM8_SGRO0_TLDS1_ULSGRO0_USL1_UIOFGRO0_USFGRO0_VSn1_VWA2_VWB8_WSGRA0_WSGRB0_WS64_WG32_8_1_WGM2_WGMXCC16_WGMXCCGn1
    SolutionIndex: 18
    SolutionNameMin: Cijk_Alik_Bljk_F8B8BS_BH_Bias_HA_S_SAB_SAV_UserArgs_MT64x64x256_MI16x16x1_SN_LDSB0_AFC0_AG1_AFEM1_AFEM1_ASEM1_CLR1_CADS0_DTLA0_DTLB0_DTVA0_DTVB0_DTVSM0_DPLB0_EPS0_ELFLR0_EMLLn1_FDSI0_GRPM1_GRVWA4_GRVWB4_GSU0_GSUAMB_GSUC0_GSUWGMRR0_GLS0_ISA950_IU1_K1_LDSTI0_LBSPPA512_LBSPPB512_LBSPPM0_LPA32_LPB32_LPM0_LRVW16_LWPMn1_MIAV0_MIWT2_2_MO40_MGRIPM1_NTn1_NTA4_NTB0_NTC0_NTD4_NTM0_NEPBS8_NLCA1_NLCB1_ONLL0_PGR2_PLR1_PKA1_SGROB0_SIA3_SS0_SU0_SUM0_SUS0_SPO0_SRVW0_SSO0_SVW8_SK3_SKFTR0_SKXCCM8_SGRO0_TIN1_TLDS1_TLDSMn1_ULSGRO1_USL1_UIOFGRO0_UPLRP0_USFGRO0_VSn1_VWA2_VWB2_WSGRA0_WSGRB0_WS64_WG32_8_1_WGM16_WGMXCC1_WGMXCCGn1
    SolutionIndex: 19
    SolutionNameMin: Cijk_Alik_Bljk_F8B8BS_BH_Bias_HA_S_SAB_SAV_UserArgs_MT128x128x256_MI32x32x1_SN_LDSB0_AFC0_AG1_AFEM1_AFEM1_ASEM1_CLR0_CADS0_DTLA0_DTLB0_DTVA0_DTVB0_DTVSM0_DPLB0_EPS0_ELFLR0_EMLLn1_FDSI0_GRPM1_GRVWA4_GRVWB4_GSU0_GSUAMB_GSUC0_GSUWGMRR0_GLS0_ISA950_IU1_K1_LDSTI0_LBSPPA1024_LBSPPB256_LBSPPM0_LPA16_LPB16_LPM0_LRVW16_LWPMn1_MIAV0_MIWT4_1_MO40_MGRIPM1_NTn1_NTA4_NTB0_NTC4_NTD4_NTM0_NEPBS16_NLCA1_NLCB1_ONLL0_PGR2_PLR1_PKA1_SGROB0_SIA3_SS1_SU0_SUM0_SUS0_SPO0_SRVW0_SSO1_SVW4_SK3_SKFTR0_SKXCCM8_SGRO0_TIN1_TLDS1_TLDSMn1_ULSGRO1_USL1_UIOFGRO0_UPLRP0_USFGRO0_VSn1_VWA4_VWB1_WSGRA0_WSGRB2_WS64_WG32_8_1_WGM32_WGMXCC1_WGMXCCGn1
    SolutionIndex: 20
    SolutionNameMin: Cijk_Alik_Bljk_F8B8BS_BH_Bias_HA_S_SAB_SAV_UserArgs_MT256x208x128_MI16x16x1_SN_LDSB0_AFC0_AG0_AFEM1_AFEM1_ASEM1_CLR0_CADS0_DTLA0_DTLB0_DTVA0_DTVB0_DTVSM0_DPLB0_EPS0_ELFLR0_EMLL0_FDSI0_GRPM1_GRVWA8_GRVWB8_GSU0_GSUAMB_GSUC0_GSUWGMRR0_GLS0_ISA950_IU1_K1_LDSTI0_LBSPPA512_LBSPPB128_LBSPPM0_LPA32_LPB32_LPM0_LRVW16_LWPMn1_MIAV0_MIWT4_13_MO40_MGRIPM1_NTn1_NTA0_NTB4_NTC4_NTD4_NTM0_NEPBS12_NLCA1_NLCB1_ONLL0_PGR2_PLR0_PKA1_SGROB0_SIA3_SS1_SU0_SUM0_SUS0_SPO0_SRVW0_SSO1_SVW4_SK3_SKFTR0_SKXCCM0_SGRO0_TIN1_TLDS1_TLDSMn1_ULSGRO1_USL1_UIOFGRO0_UPLRP0_USFGRO0_VSn1_VWA4_VWB1_WSGRA2_WSGRB2_WS64_WG64_4_1_WGM32_WGMXCC1_WGMXCCGn1
    SolutionIndex: 21
    SolutionNameMin: Cijk_Alik_Bljk_F8B8BS_BH_Bias_HA_S_SAB_SAV_UserArgs_MT256x256x128_MI32x32x1_SN_LDSB0_AFC0_AG1_AFEM1_AFEM1_ASEM1_CLR0_CADS0_DTLA0_DTLB0_DTVA0_DTVB0_DTVSM0_DPLB0_EPS0_ELFLR0_EMLLn1_FDSI0_GRPM1_GRVWA4_GRVWB8_GSU0_GSUAMB_GSUC0_GSUWGMRR0_GLS0_ISA950_IU1_K1_LDSTI0_LBSPPA512_LBSPPB512_LBSPPM0_LPA16_LPB16_LPM0_LRVW16_LWPMn1_MIAV0_MIWT4_4_MO40_MGRIPM1_NTn1_NTA0_NTB4_NTC4_NTD4_NTM0_NEPBS0_NLCA1_NLCB1_ONLL0_PGR2_PLR1_PKA1_SGROB0_SIA3_SS1_SU16_SUM0_SUS512_SPO1_SRVW0_SSO4_SVW4_SK3_SKFTR0_SKXCCM4_SGRO0_TIN0_TLDS2_TLDSMn1_ULSGRO0_USL1_UIOFGRO0_UPLRP0_USFGRO0_VSn1_VWA4_VWB4_WSGRA2_WSGRB2_WS64_WG64_4_1_WGM2_WGMXCC1_WGMXCCGn1
    SolutionIndex: 22
    SolutionNameMin: Cijk_Alik_Bljk_F8B8BS_BH_Bias_HA_S_SAB_SAV_UserArgs_MT256x256x128_MI32x32x1_SN_LDSB0_AFC0_AG1_AFEM1_AFEM1_ASEM1_CLR0_CADS0_DTLA0_DTLB0_DTVA0_DTVB0_DTVSM0_DPLB0_EPS0_ELFLR0_EMLLn1_FDSI0_GRPM1_GRVWA8_GRVWB8_GSU0_GSUAMB_GSUC0_GSUWGMRR0_GLS0_ISA950_IU1_K1_LDSTI0_LBSPPA512_LBSPPB512_LBSPPM0_LPA16_LPB16_LPM0_LRVW16_LWPMn1_MIAV0_MIWT4_4_MO40_MGRIPM1_NTn1_NTA0_NTB0_NTC4_NTD4_NTM0_NEPBS14_NLCA1_NLCB1_ONLL0_PGR2_PLR1_PKA1_SGROB0_SIA3_SS1_SU0_SUM0_SUS0_SPO0_SRVW0_SSO1_SVW4_SK3_SKFTR0_SKXCCM0_SGRO0_TIN0_TLDS2_TLDSMn1_ULSGRO1_USL1_UIOFGRO0_UPLRP0_USFGRO0_VSn1_VWA4_VWB4_WSGRA0_WSGRB0_WS64_WG64_4_1_WGM4_WGMXCC8_WGMXCCGn1
    SolutionIndex: 23
    SolutionNameMin: Cijk_Alik_Bljk_F8B8BS_BH_Bias_HA_S_SAB_SAV_UserArgs_MT256x256x128_MI32x32x1_SN_LDSB0_AFC0_AG1_AFEM1_AFEM1_ASEM1_CLR1_CADS0_DTLA0_DTLB0_DTVA0_DTVB0_DTVSM0_DPLB0_EPS0_ELFLR0_EMLL0_FDSI0_GRPM1_GRVWA4_GRVWB8_GSU0_GSUAMB_GSUC0_GSUWGMRR0_GLS0_ISA950_IU1_K1_LDSTI0_LBSPPA512_LBSPPB512_LBSPPM0_LPA16_LPB16_LPM0_LRVW16_LWPMn1_MIAV0_MIWT4_4_MO40_MGRIPM1_NTn1_NTA0_NTB0_NTC4_NTD4_NTM0_NEPBS16_NLCA1_NLCB1_ONLL0_PGR2_PLR1_PKA1_SGROB0_SIA3_SS1_SU0_SUM0_SUS0_SPO1_SRVW0_SSO1_SVW4_SK3_SKFTR0_SKXCCM4_SGRO0_TIN0_TLDS1_TLDSMn1_ULSGRO0_USL1_UIOFGRO0_UPLRP0_USFGRO0_VSn1_VWA4_VWB4_WSGRA0_WSGRB0_WS64_WG64_4_1_WGM4_WGMXCC2_WGMXCCGn1
    SolutionIndex: 24
    SolutionNameMin: Cijk_Alik_Bljk_F8B8BS_BH_Bias_HA_S_SAB_SAV_UserArgs_MT192x256x128_MI16x16x1_SN_LDSB0_AFC0_AG1_AFEM1_AFEM1_ASEM1_CLR1_CADS0_DTLA0_DTLB0_DTVA0_DTVB0_DTVSM0_DPLB0_EPS0_ELFLR0_EMLL0_FDSI0_GRPM1_GRVWA4_GRVWB4_GSU0_GSUAMB_GSUC0_GSUWGMRR0_GLS0_ISA950_IU1_K1_LDSTI0_LBSPPA512_LBSPPB512_LBSPPM0_LPA32_LPB32_LPM0_LRVW16_LWPMn1_MIAV0_MIWT12_4_MO40_MGRIPM1_NTn1_NTA0_NTB0_NTC4_NTD4_NTM0_NEPBS12_NLCA1_NLCB1_ONLL0_PGR2_PLR1_PKA1_SGROB0_SIA3_SS1_SU16_SUM0_SUS256_SPO0_SRVW0_SSO1_SVW4_SK3_SKFTR0_SKXCCM2_SGRO0_TIN0_TLDS1_TLDSMn1_ULSGRO1_USL1_UIOFGRO0_UPLRP0_USFGRO0_VSn1_VWA4_VWB4_WSGRA0_WSGRB0_WS64_WG16_16_1_WGM4_WGMXCC4_WGMXCCGn1
    SolutionIndex: 25
    SolutionNameMin: Cijk_Alik_Bljk_F8B8BS_BH_Bias_HA_S_SAB_SAV_UserArgs_MT128x192x128_MI16x16x1_SN_LDSB0_AFC0_AG1_AFEM1_AFEM1_ASEM1_CLR0_CADS0_DTLA0_DTLB0_DTVA0_DTVB0_DTVSM0_DPLB0_EPS0_ELFLR0_EMLLn1_FDSI0_GRPM1_GRVWA4_GRVWB4_GSU0_GSUAMB_GSUC0_GSUWGMRR0_GLS0_ISA950_IU1_K1_LDSTI0_LBSPPA1024_LBSPPB128_LBSPPM0_LPA32_LPB32_LPM0_LRVW16_LWPMn1_MIAV0_MIWT8_3_MO40_MGRIPM1_NTn1_NTA4_NTB0_NTC4_NTD4_NTM0_NEPBS0_NLCA1_NLCB1_ONLL0_PGR2_PLR0_PKA1_SGROB0_SIA3_SS1_SU0_SUM0_SUS0_SPO1_SRVW0_SSO0_SVW8_SK3_SKFTR0_SKXCCM4_SGRO0_TIN1_TLDS1_TLDSMn1_ULSGRO1_USL1_UIOFGRO0_UPLRP0_USFGRO0_VSn1_VWA8_VWB1_WSGRA2_WSGRB2_WS64_WG16_16_1_WGM8_WGMXCC2_WGMXCCGn1
    SolutionIndex: 26
    SolutionNameMin: Cijk_Alik_Bljk_F8B8BS_BH_Bias_HA_S_SAB_SAV_UserArgs_MT256x256x128_MI32x32x1_SN_LDSB0_AFC0_AG1_AFEM1_AFEM1_ASEM1_CLR0_CADS0_DTLA0_DTLB0_DTVA0_DTVB0_DTVSM0_DPLB0_EPS0_ELFLR0_EMLLn1_FDSI0_GRPM1_GRVWA8_GRVWB8_GSU0_GSUAMB_GSUC0_GSUWGMRR0_GLS0_ISA950_IU1_K1_LDSTI0_LBSPPA512_LBSPPB512_LBSPPM0_LPA16_LPB16_LPM0_LRVW16_LWPMn1_MIAV0_MIWT4_4_MO40_MGRIPM1_NTn1_NTA0_NTB0_NTC4_NTD4_NTM0_NEPBS14_NLCA1_NLCB1_ONLL0_PGR2_PLR1_PKA1_SGROB0_SIA3_SS1_SU0_SUM0_SUS0_SPO0_SRVW0_SSO1_SVW4_SK3_SKFTR0_SKXCCM8_SGRO0_TIN1_TLDS1_TLDSMn1_ULSGRO0_USL1_UIOFGRO0_UPLRP0_USFGRO0_VSn1_VWA4_VWB4_WSGRA2_WSGRB2_WS64_WG64_4_1_WGM4_WGMXCC1_WGMXCCGn1
    SolutionIndex: 27
    SolutionNameMin: Cijk_Alik_Bljk_F8B8BS_BH_Bias_HA_S_SAB_SAV_UserArgs_MT128x128x128_MI16x16x1_SN_LDSB1_AFC0_AG1_AFEM1_AFEM1_ASEM1_CLR0_CADS0_DTLA0_DTLB0_DTVA0_DTVB0_DTVSM0_DPLB0_EPS0_ELFLR0_EMLLn1_FDSI0_GRPM1_GRVWA4_GRVWB4_GSU0_GSUAMB_GSUC0_GSUWGMRR0_GLS0_ISA950_IU1_K1_LDSTI0_LBSPPA1024_LBSPPB256_LBSPPM0_LPA32_LPB32_LPM0_LRVW16_LWPMn1_MIAV0_MIWT8_2_MO40_MGRIPM1_NTn1_NTA0_NTB0_NTC4_NTD4_NTM0_NEPBS10_NLCA1_NLCB1_ONLL0_PGR2_PLR0_PKA1_SGROB0_SIA3_SS1_SU0_SUM0_SUS0_SPO1_SRVW0_SSO1_SVW8_SK3_SKFTR0_SKXCCM0_SGRO0_TIN1_TLDS1_TLDSMn1_ULSGRO0_USL1_UIOFGRO0_UPLRP0_USFGRO0_VSn1_VWA8_VWB2_WSGRA0_WSGRB0_WS64_WG16_16_1_WGM8_WGMXCC4_WGMXCCGn1
    SolutionIndex: 28
    SolutionNameMin: Cijk_Alik_Bljk_F8B8BS_BH_Bias_HA_S_SAB_SAV_UserArgs_MT128x128x256_MI32x32x1_SN_LDSB0_AFC0_AG1_AFEM1_AFEM1_ASEM1_CLR0_CADS0_DTLA0_DTLB0_DTVA0_DTVB0_DTVSM0_DPLB0_EPS0_ELFLR0_EMLL0_FDSI0_GRPM1_GRVWA4_GRVWB8_GSU0_GSUAMB_GSUC0_GSUWGMRR0_GLS0_ISA950_IU1_K1_LDSTI0_LBSPPA512_LBSPPB512_LBSPPM0_LPA16_LPB16_LPM0_LRVW16_LWPMn1_MIAV0_MIWT2_2_MO40_MGRIPM1_NTn1_NTA0_NTB4_NTC4_NTD4_NTM0_NEPBS0_NLCA1_NLCB1_ONLL0_PGR2_PLR1_PKA1_SGROB0_SIA3_SS1_SU0_SUM0_SUS0_SPO0_SRVW0_SSO4_SVW2_SK3_SKFTR0_SKXCCM2_SGRO0_TIN1_TLDS1_TLDSMn1_ULSGRO0_USL1_UIOFGRO0_UPLRP0_USFGRO0_VSn1_VWA2_VWB2_WSGRA2_WSGRB2_WS64_WG64_4_1_WGM4_WGMXCC1_WGMXCCGn1
    SolutionIndex: 29
    SolutionNameMin: Cijk_Alik_Bljk_F8B8BS_BH_Bias_HA_S_SAB_SAV_UserArgs_MT256x256x128_MI32x32x1_SN_LDSB0_AFC0_AG0_AFEM1_AFEM1_ASEM1_CLR0_CADS0_DTLA0_DTLB0_DTVA0_DTVB0_DTVSM0_DPLB0_EPS0_ELFLR0_EMLLn1_FDSI0_GRPM1_GRVWA4_GRVWB8_GSU0_GSUAMB_GSUC0_GSUWGMRR0_GLS0_ISA950_IU1_K1_LDSTI0_LBSPPA512_LBSPPB512_LBSPPM0_LPA16_LPB16_LPM0_LRVW16_LWPMn1_MIAV0_MIWT4_4_MO40_MGRIPM1_NTn1_NTA0_NTB0_NTC0_NTD0_NTM0_NEPBS16_NLCA1_NLCB1_ONLL0_PGR2_PLR1_PKA1_SGROB0_SIA3_SS1_SU8_SUM0_SUS128_SPO0_SRVW0_SSO1_SVW4_SK3_SKFTR0_SKXCCM2_SGRO0_TIN0_TLDS1_TLDSMn1_ULSGRO0_USL1_UIOFGRO0_UPLRP0_USFGRO0_VSn1_VWA4_VWB4_WSGRA0_WSGRB0_WS64_WG64_4_1_WGM8_WGMXCC4_WGMXCCGn1
    SolutionIndex: 30
    SolutionNameMin: Cijk_Alik_Bljk_F8B8BS_BH_Bias_HA_S_SAB_SAV_UserArgs_MT288x224x128_MI16x16x1_SN_LDSB0_AFC0_AG1_AFEM1_AFEM1_ASEM1_CLR0_CADS0_DTLA0_DTLB0_DTVA0_DTVB0_DTVSM0_DPLB0_EPS0_ELFLR0_EMLL0_FDSI0_GRPM1_GRVWA8_GRVWB8_GSU0_GSUAMB_GSUC0_GSUWGMRR0_GLS0_ISA950_IU1_K1_LDSTI0_LBSPPA128_LBSPPB128_LBSPPM0_LPA32_LPB32_LPM0_LRVW16_LWPMn1_MIAV0_MIWT9_7_MO40_MGRIPM1_NTn1_NTA0_NTB0_NTC0_NTD0_NTM0_NEPBS0_NLCA1_NLCB1_ONLL0_PGR2_PLR0_PKA1_SGROB0_SIA3_SS0_SU0_SUM0_SUS0_SPO1_SRVW0_SSO1_SVW4_SK3_SKFTR0_SKXCCM2_SGRO0_TIN1_TLDS2_TLDSMn1_ULSGRO1_USL1_UIOFGRO0_UPLRP0_USFGRO0_VSn1_VWA1_VWB1_WSGRA0_WSGRB2_WS64_WG32_8_1_WGM32_WGMXCC2_WGMXCCGn1
    SolutionIndex: 17
    SolutionNameMin: Cijk_Alik_Bjlk_S_B_Bias_HA_S_SAV_UserArgs_MT16x16x16_MI16x16x1_CMS_SN_LDSB1_AFC0_AFEM1_AFEM1_ASEM1_CLR1_CADS0_DTLA0_DTLB0_DTVA0_DTVB0_EPS1_FDSI0_GRPM1_GRVWA4_GRVWB1_GSU0_GSUAMB_GSUC0_GSUWGMRR0_GLS0_ISA950_IU1_K1_LDSTI0_LBSPPA64_LBSPPB64_LBSPPM0_LPA0_LPB0_LPM0_LRVW1_LWPMn1_MIAV0_MIWT1_1_MO40_NTn1_NTA4_NTB6_NTC6_NTD7_NTM0_NEPBS12_NLCA1_NLCB1_ONLL1_PGR1_PLR1_PKA1_SIA3_SS0_SU0_SUM1_SUS0_SPO1_SRVW0_SSO0_SVW4_SK3_SKFTR0_SKXCCM4_TLDS0_ULSGRO0_USL1_UIOFGRO0_USFGROn1_VSn1_VWA1_VWB1_WSGRA0_WSGRB0_WS64_WG16_4_1_WGM1_WGMXCC1_WGMXCCGn1
    SolutionIndex: 31
    SolutionNameMin: Cijk_Alik_Bljk_F8B8BS_BH_Bias_HA_S_SAB_SAV_UserArgs_MT256x256x128_MI32x32x1_SN_LDSB0_AFC0_AG1_AFEM1_AFEM1_ASEM1_CLR0_CADS0_DTLA0_DTLB0_DTVA0_DTVB0_DTVSM0_DPLB0_EPS0_ELFLR0_EMLLn1_FDSI0_GRPM1_GRVWA4_GRVWB8_GSU0_GSUAMB_GSUC0_GSUWGMRR0_GLS0_ISA950_IU1_K1_LDSTI0_LBSPPA512_LBSPPB512_LBSPPM0_LPA16_LPB16_LPM0_LRVW16_LWPMn1_MIAV0_MIWT4_4_MO40_MGRIPM1_NTn1_NTA0_NTB0_NTC0_NTD4_NTM0_NEPBS0_NLCA1_NLCB1_ONLL0_PGR2_PLR1_PKA1_SGROB0_SIA3_SS1_SU8_SUM0_SUS128_SPO0_SRVW0_SSO1_SVW4_SK3_SKFTR0_SKXCCM8_SGRO0_TIN0_TLDS1_TLDSMn1_ULSGRO0_USL1_UIOFGRO0_UPLRP0_USFGRO0_VSn1_VWA4_VWB4_WSGRA2_WSGRB2_WS64_WG64_4_1_WGM8_WGMXCC1_WGMXCCGn1
    SolutionIndex: 32
    SolutionNameMin: Cijk_Alik_Bljk_F8B8BS_BH_Bias_HA_S_SAB_SAV_UserArgs_MT320x256x128_MI16x16x1_SN_LDSB0_AFC0_AG1_AFEM1_AFEM1_ASEM1_CLR1_CADS0_DTLA1_DTLB1_DTVA0_DTVB0_DTVSM0_DPLB0_EPS0_ELFLR0_EMLL0_FDSI0_GRPM1_GRVWA16_GRVWB16_GSU0_GSUAMB_GSUC0_GSUWGMRR0_GLS0_ISA950_IU1_K1_LDSTI0_LBSPPA1024_LBSPPB1024_LBSPPM0_LPA32_LPB32_LPM0_LRVW16_LWPMn1_MIAV0_MIWT10_8_MO40_MGRIPM1_NTn1_NTA0_NTB0_NTC0_NTD0_NTM0_NEPBS0_NLCA1_NLCB1_ONLL0_PGR2_PLR1_PKA1_SGROB1_SIA3_SS1_SU8_SUM0_SUS512_SPO0_SRVW0_SSO1_SVW2_SK3_SKFTR0_SKXCCM0_SGRO0_TIN0_TLDS2_TLDSMn1_ULSGRO0_USL1_UIOFGRO0_UPLRP0_USFGRO0_VSn1_VWA2_VWB8_WSGRA0_WSGRB0_WS64_WG32_8_1_WGMn2_WGMXCC2_WGMXCCGn1
    SolutionIndex: 33
    SolutionNameMin: Cijk_Alik_Bljk_F8B8BS_BH_Bias_HA_S_SAB_SAV_UserArgs_MT256x224x128_MI16x16x1_SN_LDSB0_AFC0_AG0_AFEM1_AFEM1_ASEM1_CLR0_CADS0_DTLA0_DTLB0_DTVA0_DTVB0_DTVSM0_DPLB0_EPS0_ELFLR0_EMLL0_FDSI0_GRPM1_GRVWA16_GRVWB16_GSU0_GSUAMB_GSUC0_GSUWGMRR0_GLS0_ISA950_IU1_K1_LDSTI0_LBSPPA1024_LBSPPB128_LBSPPM0_LPA32_LPB32_LPM0_LRVW16_LWPMn1_MIAV0_MIWT8_7_MO40_MGRIPM1_NTn1_NTA0_NTB0_NTC0_NTD0_NTM0_NEPBS0_NLCA1_NLCB1_ONLL0_PGR2_PLR0_PKA1_SGROB0_SIA3_SS1_SU16_SUM0_SUS128_SPO1_SRVW0_SSO1_SVW8_SK3_SKFTR0_SKXCCM8_SGRO0_TIN0_TLDS2_TLDSMn1_ULSGRO1_USL1_UIOFGRO0_UPLRP0_USFGRO0_VSn1_VWA8_VWB1_WSGRA2_WSGRB0_WS64_WG32_8_1_WGM6_WGMXCC1_WGMXCCGn1
    SolutionIndex: 34
    SolutionNameMin: Cijk_Alik_Bljk_F8B8BS_BH_Bias_HA_S_SAB_SAV_UserArgs_MT256x256x128_MI16x16x1_SN_LDSB0_AFC0_AG1_AFEM1_AFEM1_ASEM1_CLR1_CADS0_DTLA1_DTLB1_DTVA0_DTVB0_DTVSM0_DPLB0_EPS0_ELFLR0_EMLL0_FDSI0_GRPM1_GRVWA16_GRVWB16_GSU0_GSUAMB_GSUC0_GSUWGMRR0_GLS0_ISA950_IU1_K1_LDSTI0_LBSPPA1024_LBSPPB1024_LBSPPM0_LPA32_LPB32_LPM0_LRVW16_LWPMn1_MIAV0_MIWT8_8_MO40_MGRIPM1_NTn1_NTA0_NTB0_NTC0_NTD0_NTM0_NEPBS14_NLCA1_NLCB1_ONLL0_PGR2_PLR1_PKA1_SGROB1_SIA3_SS1_SU16_SUM0_SUS128_SPO1_SRVW0_SSO1_SVW8_SK3_SKFTR0_SKXCCM0_SGRO0_TIN0_TLDS1_TLDSMn1_ULSGRO1_USL1_UIOFGRO0_UPLRP0_USFGRO0_VSn1_VWA8_VWB8_WSGRA0_WSGRB0_WS64_WG32_8_1_WGMn4_WGMXCC1_WGMXCCGn1
    SolutionIndex: 35
    SolutionNameMin: Cijk_Alik_Bljk_F8B8BS_BH_Bias_HA_S_SAB_SAV_UserArgs_MT320x256x128_MI16x16x1_SN_LDSB0_AFC0_AG1_AFEM1_AFEM1_ASEM1_CLR1_CADS0_DTLA1_DTLB1_DTVA0_DTVB0_DTVSM0_DPLB0_EPS0_ELFLR0_EMLLn1_FDSI0_GRPM1_GRVWA16_GRVWB16_GSU0_GSUAMB_GSUC0_GSUWGMRR0_GLS0_ISA950_IU1_K1_LDSTI0_LBSPPA1024_LBSPPB1024_LBSPPM0_LPA32_LPB32_LPM0_LRVW16_LWPMn1_MIAV0_MIWT10_8_MO40_MGRIPM1_NTn1_NTA0_NTB0_NTC4_NTD4_NTM0_NEPBS16_NLCA1_NLCB1_ONLL0_PGR2_PLR1_PKA1_SGROB1_SIA3_SS1_SU8_SUM0_SUS128_SPO0_SRVW0_SSO1_SVW2_SK3_SKFTR0_SKXCCM0_SGRO0_TIN0_TLDS1_TLDSMn1_ULSGRO1_USL1_UIOFGRO0_UPLRP0_USFGRO0_VSn1_VWA2_VWB8_WSGRA0_WSGRB0_WS64_WG32_8_1_WGM0_WGMXCC8_WGMXCCGn1
    SolutionIndex: 36
    SolutionNameMin: Cijk_Alik_Bljk_F8B8BS_BH_Bias_HA_S_SAB_SAV_UserArgs_MT256x256x128_MI16x16x1_SN_LDSB0_AFC0_AG1_AFEM1_AFEM1_ASEM1_CLR1_CADS0_DTLA1_DTLB1_DTVA0_DTVB0_DTVSM0_DPLB0_EPS0_ELFLR0_EMLL0_FDSI0_GRPM1_GRVWA16_GRVWB16_GSU0_GSUAMB_GSUC0_GSUWGMRR0_GLS0_ISA950_IU1_K1_LDSTI0_LBSPPA1024_LBSPPB1024_LBSPPM0_LPA32_LPB32_LPM0_LRVW16_LWPMn1_MIAV0_MIWT8_8_MO40_MGRIPM1_NTn1_NTA0_NTB0_NTC0_NTD0_NTM0_NEPBS10_NLCA1_NLCB1_ONLL0_PGR2_PLR1_PKA1_SGROB1_SIA3_SS1_SU0_SUM0_SUS0_SPO0_SRVW0_SSO1_SVW8_SK3_SKFTR0_SKXCCM4_SGRO0_TIN0_TLDS1_TLDSMn1_ULSGRO0_USL1_UIOFGRO0_UPLRP0_USFGRO0_VSn1_VWA8_VWB8_WSGRA0_WSGRB0_WS64_WG32_8_1_WGM16_WGMXCC1_WGMXCCGn1
    SolutionIndex: 37
    SolutionNameMin: Cijk_Alik_Bljk_F8B8BS_BH_Bias_HA_S_SAB_SAV_UserArgs_MT256x192x128_MI32x32x1_SN_LDSB0_AFC0_AG1_AFEM1_AFEM1_ASEM1_CLR0_CADS0_DTLA1_DTLB1_DTVA0_DTVB0_DTVSM0_DPLB0_EPS0_ELFLR0_EMLL0_FDSI0_GRPM1_GRVWA16_GRVWB16_GSU0_GSUAMB_GSUC0_GSUWGMRR0_GLS0_ISA950_IU1_K1_LDSTI0_LBSPPA1024_LBSPPB1024_LBSPPM0_LPA32_LPB32_LPM0_LRVW16_LWPMn1_MIAV0_MIWT4_3_MO40_MGRIPM1_NTn1_NTA0_NTB0_NTC4_NTD4_NTM0_NEPBS0_NLCA1_NLCB1_ONLL0_PGR2_PLR1_PKA1_SGROB1_SIA3_SS1_SU8_SUM0_SUS128_SPO0_SRVW0_SSO1_SVW4_SK3_SKFTR0_SKXCCM8_SGRO0_TIN0_TLDS2_TLDSMn1_ULSGRO1_USL1_UIOFGRO0_UPLRP0_USFGRO0_VSn1_VWA4_VWB1_WSGRA0_WSGRB0_WS64_WG64_4_1_WGM4_WGMXCC1_WGMXCCGn1
    SolutionIndex: 38
    SolutionNameMin: Cijk_Alik_Bljk_F8B8BS_BH_Bias_HA_S_SAB_SAV_UserArgs_MT256x256x128_MI16x16x1_SN_LDSB0_AFC0_AG0_AFEM1_AFEM1_ASEM1_CLR1_CADS0_DTLA1_DTLB1_DTVA0_DTVB0_DTVSM0_DPLB0_EPS0_ELFLR0_EMLLn1_FDSI0_GRPM1_GRVWA16_GRVWB16_GSU0_GSUAMB_GSUC0_GSUWGMRR0_GLS0_ISA950_IU1_K1_LDSTI0_LBSPPA1024_LBSPPB1024_LBSPPM0_LPA32_LPB32_LPM0_LRVW16_LWPMn1_MIAV0_MIWT8_8_MO40_MGRIPM1_NTn1_NTA0_NTB0_NTC0_NTD0_NTM0_NEPBS8_NLCA1_NLCB1_ONLL0_PGR2_PLR1_PKA1_SGROB1_SIA3_SS1_SU0_SUM0_SUS0_SPO0_SRVW0_SSO1_SVW8_SK3_SKFTR0_SKXCCM0_SGRO0_TIN0_TLDS1_TLDSMn1_ULSGRO1_USL1_UIOFGRO0_UPLRP0_USFGRO0_VSn1_VWA8_VWB8_WSGRA0_WSGRB0_WS64_WG32_8_1_WGMn4_WGMXCC1_WGMXCCGn1
- - - [4096, 6144, 1, 32768]
    - [0, 0.0]
  - - [4096, 28672, 1, 32768]
    - [1, 0.0]
  - - [4096, 32768, 1, 4096]
    - [2, 0.0]
  - - [4096, 32768, 1, 6144]
    - [3, 0.0]
  - - [4096, 32768, 1, 28672]
    - [4, 0.0]
  - - [14336, 4096, 1, 32768]
    - [5, 0.0]
  - - [14336, 32768, 1, 4096]
    - [6, 0.0]
  - - [16384, 1024, 1, 16384]
    - [7, 0.0]
  - - [16384, 16384, 1, 1024]
    - [8, 0.0]
  - - [16384, 53248, 1, 16384]
    - [9, 0.0]
  - - [53248, 16384, 1, 16384]
    - [10, 0.0]
  - - [3072, 12288, 1, 32768]
    - [11, 0.0]
  - - [3072, 9216, 1, 16384]
    - [12, 0.0]
  - - [12288, 3072, 1, 32768]
    - [13, 0.0]
  - - [3072, 9216, 1, 32768]
    - [14, 0.0]
  - - [3072, 12288, 1, 16384]
    - [32, 0.0]
  - - [12288, 3072, 1, 16384]
    - [35, 0.0]
  - - [3840, 3840, 1, 17408]
    - [15, 0.0]
  - - [3840, 3840, 1, 4352]
    - [16, 0.0]
  - - [3840, 3840, 1, 256]
    - [17, 0.0]
  - - [3840, 256, 1, 3840]
    - [18, 0.0]
  - - [3840, 1024, 1, 3840]
    - [19, 0.0]
  - - [3840, 3328, 1, 3840]
    - [20, 0.0]
  - - [3840, 3840, 1, 3328]
    - [21, 0.0]
  - - [3840, 3840, 1, 2304]
    - [22, 0.0]
  - - [3840, 3840, 1, 1024]
    - [23, 0.0]
  - - [6144, 2048, 1, 1536]
    - [24, 0.0]
  - - [3840, 1280, 1, 3840]
    - [25, 0.0]
  - - [3840, 3840, 1, 1280]
    - [26, 0.0]
  - - [4096, 2048, 1, 1024]
    - [27, 0.0]
  - - [1024, 4096, 1, 2048]
    - [28, 0.0]
  - - [3840, 3840, 1, 13312]
    - [29, 0.0]
  - - [3840, 3840, 1, 9216]
    - [30, 0.0]
  - - [3840, 3840, 1, 5120]
    - [31, 0.0]
  - - [3072, 9216, 1, 8192]
    - [33, 0.0]
  - - [3072, 8192, 1, 9216]
    - [34, 0.0]
  - - [3072, 16384, 1, 9216]
    - [36, 0.0]
  - - [12288, 3072, 1, 8192]
    - [37, 0.0]
  - - [3072, 8192, 1, 12288]
    - [38, 0.0]
=======
- [2, 3, 0, 1]
- - - [384, 1280, 1, 1562]
    - [0, 54534.7]
  - - [512, 1280, 1, 1562]
    - [1, 80585.2]
  - - [1562, 384, 1, 1280]
    - [2, 0.0]
  - - [64, 3072, 1, 1024]
    - [3, 0.0]
  - - [360, 5120, 1, 5120]
    - [4, 0.0]
  - - [1024, 384, 1, 1024]
    - [5, 0.0]
  - - [1560, 5120, 1, 5120]
    - [6, 0.0]
  - - [1024, 1280, 1, 1562]
    - [7, 0.0]
  - - [1562, 512, 1, 1280]
    - [8, 0.0]
  - - [1562, 640, 1, 1280]
    - [9, 0.0]
  - - [1562, 768, 1, 1280]
    - [10, 0.0]
  - - [1562, 1024, 1, 1280]
    - [11, 0.0]
  - - [1562, 1664, 1, 1280]
    - [12, 0.0]
  - - [1562, 1920, 1, 1280]
    - [13, 0.0]
  - - [1664, 1280, 1, 1562]
    - [14, 0.0]
  - - [1920, 1280, 1, 1562]
    - [15, 0.0]
  - - [77, 64, 20, 77]
    - [16, 0.0]
  - - [3, 1, 14000000, 3]
    - [17, 0.0]
>>>>>>> d9e199e220 (merge b-shi branch)
- null
- null
- DeviceEfficiency
- Equality
