projects/hipblaslt/library/src/amd_detail/rocblaslt/src/Tensile/Logic/asm_full/navi31/StreamK/navi31_Cijk_Alik_Bljk_HHS_BH_Bias_HA_S_SAV_UserArgs.yaml
- {MinimumRequiredVersion: 5.0.0}
- navi31
- gfx1100
- [Device 744a]
    SolutionIndex: 0
    SolutionNameMin: Cijk_Alik_Bljk_HHS_BH_Bias_HA_S_SAV_UserArgs_MT16x16x32_MI16x16x1_SN_LDSB0_AFC1_AFEM1_AFEM1_ASEM1_CLR1_CADS0_DTLA0_DTLB0_DTVA0_DTVB0_EPS0_FDSI0_GRPM1_GRVWA8_GRVWB8_GSU0_GSUAMB_GSUC0_GSUWGMRR0_GLS0_ISA1100_IU1_K1_LBSPPA128_LBSPPB128_LBSPPM0_LPA16_LPB16_LPM0_LRVW16_LWPMn1_MIAV1_MIWT1_1_MO40_NTn1_NTA0_NTB0_NTC0_NTD0_NTM0_NEPBS0_NLCA1_NLCB1_ONLL1_PGR2_PLR1_PKA0_SIA3_SS0_SU32_SUM0_SUS256_SPO0_SRVW0_SSO0_SVW1_SK3_SKFTR0_SKXCCM8_TLDS1_ULSGRO0_USL1_UIOFGRO0_USFGROn1_VSn1_VWA1_VWB1_WSGRA0_WSGRB0_WS32_WG16_2_1_WGM8_WGMXCC1_WGMXCCGn1
    SolutionIndex: 1
    SolutionNameMin: Cijk_Alik_Bljk_HHS_BH_Bias_HA_S_SAV_UserArgs_MT192x64x32_MI16x16x1_SN_LDSB1_AFC1_AFEM1_AFEM1_ASEM1_CLR1_CADS0_DTLA0_DTLB0_DTVA0_DTVB0_EPS0_FDSI0_GRPM1_GRVWA8_GRVWB8_GSU0_GSUAMB_GSUC0_GSUWGMRR0_GLS0_ISA1100_IU1_K1_LBSPPA128_LBSPPB128_LBSPPM0_LPA16_LPB16_LPM0_LRVW16_LWPMn1_MIAV1_MIWT3_4_MO40_NTn1_NTA0_NTB0_NTC0_NTD0_NTM0_NEPBS0_NLCA1_NLCB1_ONLL1_PGR1_PLR1_PKA0_SIA3_SS0_SU32_SUM0_SUS256_SPO0_SRVW0_SSO0_SVW1_SK3_SKFTR0_SKXCCM8_TLDS1_ULSGRO0_USL1_UIOFGRO0_USFGROn1_VSn1_VWA1_VWB1_WSGRA0_WSGRB0_WS32_WG64_2_1_WGM8_WGMXCC1_WGMXCCGn1
    SolutionIndex: 2
    SolutionNameMin: Cijk_Alik_Bljk_HHS_BH_Bias_HA_S_SAV_UserArgs_MT192x64x32_MI16x16x1_SN_LDSB1_AFC1_AFEM1_AFEM1_ASEM1_CLR1_CADS0_DTLA0_DTLB0_DTVA0_DTVB0_EPS0_FDSI0_GRPM1_GRVWA8_GRVWB8_GSU0_GSUAMB_GSUC0_GSUWGMRR0_GLS0_ISA1100_IU1_K1_LBSPPA128_LBSPPB128_LBSPPM0_LPA16_LPB16_LPM0_LRVW16_LWPMn1_MIAV1_MIWT3_4_MO40_NTn1_NTA0_NTB0_NTC0_NTD0_NTM0_NEPBS0_NLCA1_NLCB1_ONLL1_PGR2_PLR1_PKA0_SIA3_SS0_SU32_SUM0_SUS256_SPO0_SRVW0_SSO0_SVW1_SK3_SKFTR0_SKXCCM8_TLDS1_ULSGRO0_USL1_UIOFGRO0_USFGROn1_VSn1_VWA1_VWB1_WSGRA0_WSGRB0_WS32_WG64_2_1_WGM8_WGMXCC1_WGMXCCGn1
    SolutionIndex: 3
    SolutionNameMin: Cijk_Alik_Bljk_HHS_BH_Bias_HA_S_SAV_UserArgs_MT64x192x32_MI16x16x1_SN_LDSB1_AFC1_AFEM1_AFEM1_ASEM1_CLR1_CADS0_DTLA0_DTLB0_DTVA0_DTVB0_EPS0_FDSI0_GRPM1_GRVWA8_GRVWB8_GSU0_GSUAMB_GSUC0_GSUWGMRR0_GLS0_ISA1100_IU1_K1_LBSPPA128_LBSPPB128_LBSPPM0_LPA16_LPB16_LPM0_LRVW16_LWPMn1_MIAV1_MIWT4_3_MO40_NTn1_NTA0_NTB0_NTC0_NTD0_NTM0_NEPBS0_NLCA1_NLCB1_ONLL1_PGR1_PLR1_PKA0_SIA3_SS0_SU32_SUM0_SUS256_SPO0_SRVW0_SSO0_SVW1_SK3_SKFTR0_SKXCCM8_TLDS1_ULSGRO0_USL1_UIOFGRO0_USFGROn1_VSn1_VWA1_VWB1_WSGRA0_WSGRB0_WS32_WG16_8_1_WGM8_WGMXCC1_WGMXCCGn1
    SolutionIndex: 4
    SolutionNameMin: Cijk_Alik_Bljk_HHS_BH_Bias_HA_S_SAV_UserArgs_MT64x192x32_MI16x16x1_SN_LDSB1_AFC1_AFEM1_AFEM1_ASEM1_CLR1_CADS0_DTLA0_DTLB0_DTVA0_DTVB0_EPS0_FDSI0_GRPM1_GRVWA8_GRVWB8_GSU0_GSUAMB_GSUC0_GSUWGMRR0_GLS0_ISA1100_IU1_K1_LBSPPA128_LBSPPB128_LBSPPM0_LPA16_LPB16_LPM0_LRVW16_LWPMn1_MIAV1_MIWT4_3_MO40_NTn1_NTA0_NTB0_NTC0_NTD0_NTM0_NEPBS0_NLCA1_NLCB1_ONLL1_PGR2_PLR1_PKA0_SIA3_SS0_SU32_SUM0_SUS256_SPO0_SRVW0_SSO0_SVW1_SK3_SKFTR0_SKXCCM8_TLDS1_ULSGRO0_USL1_UIOFGRO0_USFGROn1_VSn1_VWA1_VWB1_WSGRA0_WSGRB0_WS32_WG16_8_1_WGM8_WGMXCC1_WGMXCCGn1
    SolutionIndex: 5
    SolutionNameMin: Cijk_Alik_Bljk_HHS_BH_Bias_HA_S_SAV_UserArgs_MT64x128x32_MI16x16x1_SN_LDSB0_AFC1_AFEM1_AFEM1_ASEM1_CLR1_CADS0_DTLA0_DTLB0_DTVA0_DTVB0_EPS0_FDSI0_GRPM1_GRVWA8_GRVWB8_GSU0_GSUAMB_GSUC0_GSUWGMRR0_GLS0_ISA1100_IU1_K1_LBSPPA128_LBSPPB128_LBSPPM0_LPA16_LPB16_LPM0_LRVW16_LWPMn1_MIAV1_MIWT2_4_MO40_NTn1_NTA0_NTB0_NTC0_NTD0_NTM0_NEPBS0_NLCA1_NLCB1_ONLL1_PGR2_PLR1_PKA0_SIA3_SS0_SU32_SUM0_SUS256_SPO0_SRVW0_SSO0_SVW1_SK3_SKFTR0_SKXCCM8_TLDS1_ULSGRO0_USL1_UIOFGRO0_USFGROn1_VSn1_VWA1_VWB1_WSGRA0_WSGRB0_WS32_WG32_4_1_WGM8_WGMXCC1_WGMXCCGn1
    SolutionIndex: 6
    SolutionNameMin: Cijk_Alik_Bljk_HHS_BH_Bias_HA_S_SAV_UserArgs_MT96x128x32_MI16x16x1_SN_LDSB1_AFC1_AFEM1_AFEM1_ASEM1_CLR1_CADS0_DTLA0_DTLB0_DTVA0_DTVB0_EPS0_FDSI0_GRPM1_GRVWA8_GRVWB8_GSU0_GSUAMB_GSUC0_GSUWGMRR0_GLS0_ISA1100_IU1_K1_LBSPPA128_LBSPPB128_LBSPPM0_LPA16_LPB16_LPM0_LRVW16_LWPMn1_MIAV1_MIWT3_4_MO40_NTn1_NTA0_NTB0_NTC0_NTD0_NTM0_NEPBS0_NLCA1_NLCB1_ONLL1_PGR1_PLR1_PKA0_SIA3_SS0_SU32_SUM0_SUS256_SPO0_SRVW0_SSO0_SVW1_SK3_SKFTR0_SKXCCM8_TLDS1_ULSGRO0_USL1_UIOFGRO0_USFGROn1_VSn1_VWA1_VWB1_WSGRA0_WSGRB0_WS32_WG32_4_1_WGM8_WGMXCC1_WGMXCCGn1
    SolutionIndex: 7
    SolutionNameMin: Cijk_Alik_Bljk_HHS_BH_Bias_HA_S_SAV_UserArgs_MT96x128x32_MI16x16x1_SN_LDSB1_AFC1_AFEM1_AFEM1_ASEM1_CLR1_CADS0_DTLA0_DTLB0_DTVA0_DTVB0_EPS0_FDSI0_GRPM1_GRVWA8_GRVWB8_GSU0_GSUAMB_GSUC0_GSUWGMRR0_GLS0_ISA1100_IU1_K1_LBSPPA128_LBSPPB128_LBSPPM0_LPA16_LPB16_LPM0_LRVW16_LWPMn1_MIAV1_MIWT3_4_MO40_NTn1_NTA0_NTB0_NTC0_NTD0_NTM0_NEPBS0_NLCA1_NLCB1_ONLL1_PGR2_PLR1_PKA0_SIA3_SS0_SU32_SUM0_SUS256_SPO0_SRVW0_SSO0_SVW1_SK3_SKFTR0_SKXCCM8_TLDS1_ULSGRO0_USL1_UIOFGRO0_USFGROn1_VSn1_VWA1_VWB1_WSGRA0_WSGRB0_WS32_WG32_4_1_WGM8_WGMXCC1_WGMXCCGn1
    SolutionIndex: 8
    SolutionNameMin: Cijk_Alik_Bljk_HHS_BH_Bias_HA_S_SAV_UserArgs_MT128x96x32_MI16x16x1_SN_LDSB1_AFC1_AFEM1_AFEM1_ASEM1_CLR1_CADS0_DTLA0_DTLB0_DTVA0_DTVB0_EPS0_FDSI0_GRPM1_GRVWA8_GRVWB8_GSU0_GSUAMB_GSUC0_GSUWGMRR0_GLS0_ISA1100_IU1_K1_LBSPPA128_LBSPPB128_LBSPPM0_LPA16_LPB16_LPM0_LRVW16_LWPMn1_MIAV1_MIWT4_3_MO40_NTn1_NTA0_NTB0_NTC0_NTD0_NTM0_NEPBS0_NLCA1_NLCB1_ONLL1_PGR1_PLR1_PKA0_SIA3_SS0_SU32_SUM0_SUS256_SPO0_SRVW0_SSO0_SVW1_SK3_SKFTR0_SKXCCM8_TLDS1_ULSGRO0_USL1_UIOFGRO0_USFGROn1_VSn1_VWA1_VWB1_WSGRA0_WSGRB0_WS32_WG32_4_1_WGM8_WGMXCC1_WGMXCCGn1
    SolutionIndex: 9
    SolutionNameMin: Cijk_Alik_Bljk_HHS_BH_Bias_HA_S_SAV_UserArgs_MT128x96x32_MI16x16x1_SN_LDSB1_AFC1_AFEM1_AFEM1_ASEM1_CLR1_CADS0_DTLA0_DTLB0_DTVA0_DTVB0_EPS0_FDSI0_GRPM1_GRVWA8_GRVWB8_GSU0_GSUAMB_GSUC0_GSUWGMRR0_GLS0_ISA1100_IU1_K1_LBSPPA128_LBSPPB128_LBSPPM0_LPA16_LPB16_LPM0_LRVW16_LWPMn1_MIAV1_MIWT4_3_MO40_NTn1_NTA0_NTB0_NTC0_NTD0_NTM0_NEPBS0_NLCA1_NLCB1_ONLL1_PGR2_PLR1_PKA0_SIA3_SS0_SU32_SUM0_SUS256_SPO0_SRVW0_SSO0_SVW1_SK3_SKFTR0_SKXCCM8_TLDS1_ULSGRO0_USL1_UIOFGRO0_USFGROn1_VSn1_VWA1_VWB1_WSGRA0_WSGRB0_WS32_WG32_4_1_WGM8_WGMXCC1_WGMXCCGn1
    SolutionIndex: 10
    SolutionNameMin: Cijk_Alik_Bljk_HHS_BH_Bias_HA_S_SAV_UserArgs_MT32x16x32_MI16x16x1_SN_LDSB0_AFC1_AFEM1_AFEM1_ASEM1_CLR1_CADS0_DTLA0_DTLB0_DTVA0_DTVB0_EPS0_FDSI0_GRPM1_GRVWA8_GRVWB8_GSU0_GSUAMB_GSUC0_GSUWGMRR0_GLS0_ISA1100_IU1_K1_LBSPPA128_LBSPPB128_LBSPPM0_LPA16_LPB16_LPM0_LRVW16_LWPMn1_MIAV1_MIWT1_1_MO40_NTn1_NTA0_NTB0_NTC0_NTD0_NTM0_NEPBS0_NLCA1_NLCB1_ONLL1_PGR2_PLR1_PKA0_SIA3_SS1_SU32_SUM0_SUS256_SPO0_SRVW0_SSO0_SVW1_SK3_SKFTR0_SKXCCM8_TLDS1_ULSGRO0_USL1_UIOFGRO0_USFGROn1_VSn1_VWA1_VWB1_WSGRA0_WSGRB0_WS32_WG32_2_1_WGM8_WGMXCC1_WGMXCCGn1
    SolutionIndex: 11
    SolutionNameMin: Cijk_Alik_Bljk_HHS_BH_Bias_HA_S_SAV_UserArgs_MT192x64x32_MI16x16x1_SN_LDSB1_AFC1_AFEM1_AFEM1_ASEM1_CLR1_CADS0_DTLA0_DTLB0_DTVA0_DTVB0_EPS0_FDSI0_GRPM1_GRVWA8_GRVWB8_GSU0_GSUAMB_GSUC0_GSUWGMRR0_GLS0_ISA1100_IU1_K1_LBSPPA128_LBSPPB128_LBSPPM0_LPA16_LPB16_LPM0_LRVW16_LWPMn1_MIAV1_MIWT3_4_MO40_NTn1_NTA0_NTB0_NTC0_NTD0_NTM0_NEPBS0_NLCA1_NLCB1_ONLL1_PGR1_PLR1_PKA0_SIA3_SS1_SU32_SUM0_SUS256_SPO0_SRVW0_SSO0_SVW1_SK3_SKFTR0_SKXCCM8_TLDS1_ULSGRO0_USL1_UIOFGRO0_USFGROn1_VSn1_VWA1_VWB1_WSGRA0_WSGRB0_WS32_WG64_2_1_WGM8_WGMXCC1_WGMXCCGn1
    SolutionIndex: 12
    SolutionNameMin: Cijk_Alik_Bljk_HHS_BH_Bias_HA_S_SAV_UserArgs_MT192x64x32_MI16x16x1_SN_LDSB1_AFC1_AFEM1_AFEM1_ASEM1_CLR1_CADS0_DTLA0_DTLB0_DTVA0_DTVB0_EPS0_FDSI0_GRPM1_GRVWA8_GRVWB8_GSU0_GSUAMB_GSUC0_GSUWGMRR0_GLS0_ISA1100_IU1_K1_LBSPPA128_LBSPPB128_LBSPPM0_LPA16_LPB16_LPM0_LRVW16_LWPMn1_MIAV1_MIWT3_4_MO40_NTn1_NTA0_NTB0_NTC0_NTD0_NTM0_NEPBS0_NLCA1_NLCB1_ONLL1_PGR2_PLR1_PKA0_SIA3_SS1_SU32_SUM0_SUS256_SPO0_SRVW0_SSO0_SVW1_SK3_SKFTR0_SKXCCM8_TLDS1_ULSGRO0_USL1_UIOFGRO0_USFGROn1_VSn1_VWA1_VWB1_WSGRA0_WSGRB0_WS32_WG64_2_1_WGM8_WGMXCC1_WGMXCCGn1
    SolutionIndex: 13
    SolutionNameMin: Cijk_Alik_Bljk_HHS_BH_Bias_HA_S_SAV_UserArgs_MT256x16x32_MI16x16x1_SN_LDSB1_AFC1_AFEM1_AFEM1_ASEM1_CLR1_CADS0_DTLA0_DTLB0_DTVA0_DTVB0_EPS0_FDSI0_GRPM1_GRVWA8_GRVWB4_GSU0_GSUAMB_GSUC0_GSUWGMRR0_GLS0_ISA1100_IU1_K1_LBSPPA128_LBSPPB128_LBSPPM0_LPA16_LPB16_LPM0_LRVW16_LWPMn1_MIAV1_MIWT4_1_MO40_NTn1_NTA0_NTB0_NTC0_NTD0_NTM0_NEPBS0_NLCA1_NLCB1_ONLL1_PGR2_PLR1_PKA0_SIA3_SS1_SU32_SUM0_SUS256_SPO0_SRVW0_SSO0_SVW1_SK3_SKFTR0_SKXCCM8_TLDS1_ULSGRO0_USL1_UIOFGRO0_USFGROn1_VSn1_VWA1_VWB1_WSGRA0_WSGRB0_WS32_WG64_2_1_WGM8_WGMXCC1_WGMXCCGn1
    SolutionIndex: 14
    SolutionNameMin: Cijk_Alik_Bljk_HHS_BH_Bias_HA_S_SAV_UserArgs_MT64x192x32_MI16x16x1_SN_LDSB1_AFC1_AFEM1_AFEM1_ASEM1_CLR1_CADS0_DTLA0_DTLB0_DTVA0_DTVB0_EPS0_FDSI0_GRPM1_GRVWA8_GRVWB8_GSU0_GSUAMB_GSUC0_GSUWGMRR0_GLS0_ISA1100_IU1_K1_LBSPPA128_LBSPPB128_LBSPPM0_LPA16_LPB16_LPM0_LRVW16_LWPMn1_MIAV1_MIWT4_3_MO40_NTn1_NTA0_NTB0_NTC0_NTD0_NTM0_NEPBS0_NLCA1_NLCB1_ONLL1_PGR1_PLR1_PKA0_SIA3_SS1_SU32_SUM0_SUS256_SPO0_SRVW0_SSO0_SVW1_SK3_SKFTR0_SKXCCM8_TLDS1_ULSGRO0_USL1_UIOFGRO0_USFGROn1_VSn1_VWA1_VWB1_WSGRA0_WSGRB0_WS32_WG16_8_1_WGM8_WGMXCC1_WGMXCCGn1
    SolutionIndex: 15
    SolutionNameMin: Cijk_Alik_Bljk_HHS_BH_Bias_HA_S_SAV_UserArgs_MT64x192x32_MI16x16x1_SN_LDSB1_AFC1_AFEM1_AFEM1_ASEM1_CLR1_CADS0_DTLA0_DTLB0_DTVA0_DTVB0_EPS0_FDSI0_GRPM1_GRVWA8_GRVWB8_GSU0_GSUAMB_GSUC0_GSUWGMRR0_GLS0_ISA1100_IU1_K1_LBSPPA128_LBSPPB128_LBSPPM0_LPA16_LPB16_LPM0_LRVW16_LWPMn1_MIAV1_MIWT4_3_MO40_NTn1_NTA0_NTB0_NTC0_NTD0_NTM0_NEPBS0_NLCA1_NLCB1_ONLL1_PGR2_PLR1_PKA0_SIA3_SS1_SU32_SUM0_SUS256_SPO0_SRVW0_SSO0_SVW1_SK3_SKFTR0_SKXCCM8_TLDS1_ULSGRO0_USL1_UIOFGRO0_USFGROn1_VSn1_VWA1_VWB1_WSGRA0_WSGRB0_WS32_WG16_8_1_WGM8_WGMXCC1_WGMXCCGn1
    SolutionIndex: 16
    SolutionNameMin: Cijk_Alik_Bljk_HHS_BH_Bias_HA_S_SAV_UserArgs_MT64x160x32_MI16x16x1_SN_LDSB1_AFC1_AFEM1_AFEM1_ASEM1_CLR1_CADS0_DTLA0_DTLB0_DTVA0_DTVB0_EPS0_FDSI0_GRPM1_GRVWA8_GRVWB8_GSU0_GSUAMB_GSUC0_GSUWGMRR0_GLS0_ISA1100_IU1_K1_LBSPPA128_LBSPPB128_LBSPPM0_LPA16_LPB16_LPM0_LRVW16_LWPMn1_MIAV1_MIWT2_5_MO40_NTn1_NTA0_NTB0_NTC0_NTD0_NTM0_NEPBS0_NLCA1_NLCB1_ONLL1_PGR1_PLR1_PKA0_SIA3_SS1_SU32_SUM0_SUS256_SPO0_SRVW0_SSO0_SVW1_SK3_SKFTR0_SKXCCM8_TLDS1_ULSGRO0_USL1_UIOFGRO0_USFGROn1_VSn1_VWA1_VWB1_WSGRA0_WSGRB0_WS32_WG32_4_1_WGM8_WGMXCC1_WGMXCCGn1
    SolutionIndex: 17
    SolutionNameMin: Cijk_Alik_Bljk_HHS_BH_Bias_HA_S_SAV_UserArgs_MT64x96x32_MI16x16x1_SN_LDSB0_AFC1_AFEM1_AFEM1_ASEM1_CLR1_CADS0_DTLA0_DTLB0_DTVA0_DTVB0_EPS0_FDSI0_GRPM1_GRVWA8_GRVWB8_GSU0_GSUAMB_GSUC0_GSUWGMRR0_GLS0_ISA1100_IU1_K1_LBSPPA128_LBSPPB128_LBSPPM0_LPA16_LPB16_LPM0_LRVW16_LWPMn1_MIAV1_MIWT2_3_MO40_NTn1_NTA0_NTB0_NTC0_NTD0_NTM0_NEPBS0_NLCA1_NLCB1_ONLL1_PGR2_PLR1_PKA0_SIA3_SS1_SU32_SUM0_SUS256_SPO0_SRVW0_SSO0_SVW1_SK3_SKFTR0_SKXCCM8_TLDS1_ULSGRO0_USL1_UIOFGRO0_USFGROn1_VSn1_VWA1_VWB1_WSGRA0_WSGRB0_WS32_WG32_4_1_WGM8_WGMXCC1_WGMXCCGn1
    SolutionIndex: 18
    SolutionNameMin: Cijk_Alik_Bljk_HHS_BH_Bias_HA_S_SAV_UserArgs_MT96x128x32_MI16x16x1_SN_LDSB1_AFC1_AFEM1_AFEM1_ASEM1_CLR1_CADS0_DTLA0_DTLB0_DTVA0_DTVB0_EPS0_FDSI0_GRPM1_GRVWA8_GRVWB8_GSU0_GSUAMB_GSUC0_GSUWGMRR0_GLS0_ISA1100_IU1_K1_LBSPPA128_LBSPPB128_LBSPPM0_LPA16_LPB16_LPM0_LRVW16_LWPMn1_MIAV1_MIWT3_4_MO40_NTn1_NTA0_NTB0_NTC0_NTD0_NTM0_NEPBS0_NLCA1_NLCB1_ONLL1_PGR1_PLR1_PKA0_SIA3_SS1_SU32_SUM0_SUS256_SPO0_SRVW0_SSO0_SVW1_SK3_SKFTR0_SKXCCM8_TLDS1_ULSGRO0_USL1_UIOFGRO0_USFGROn1_VSn1_VWA1_VWB1_WSGRA0_WSGRB0_WS32_WG32_4_1_WGM8_WGMXCC1_WGMXCCGn1
    SolutionIndex: 19
    SolutionNameMin: Cijk_Alik_Bljk_HHS_BH_Bias_HA_S_SAV_UserArgs_MT96x128x32_MI16x16x1_SN_LDSB1_AFC1_AFEM1_AFEM1_ASEM1_CLR1_CADS0_DTLA0_DTLB0_DTVA0_DTVB0_EPS0_FDSI0_GRPM1_GRVWA8_GRVWB8_GSU0_GSUAMB_GSUC0_GSUWGMRR0_GLS0_ISA1100_IU1_K1_LBSPPA128_LBSPPB128_LBSPPM0_LPA16_LPB16_LPM0_LRVW16_LWPMn1_MIAV1_MIWT3_4_MO40_NTn1_NTA0_NTB0_NTC0_NTD0_NTM0_NEPBS0_NLCA1_NLCB1_ONLL1_PGR2_PLR1_PKA0_SIA3_SS1_SU32_SUM0_SUS256_SPO0_SRVW0_SSO0_SVW1_SK3_SKFTR0_SKXCCM8_TLDS1_ULSGRO0_USL1_UIOFGRO0_USFGROn1_VSn1_VWA1_VWB1_WSGRA0_WSGRB0_WS32_WG32_4_1_WGM8_WGMXCC1_WGMXCCGn1
    SolutionIndex: 20
    SolutionNameMin: Cijk_Alik_Bljk_HHS_BH_Bias_HA_S_SAV_UserArgs_MT96x96x32_MI16x16x1_SN_LDSB0_AFC1_AFEM1_AFEM1_ASEM1_CLR1_CADS0_DTLA0_DTLB0_DTVA0_DTVB0_EPS0_FDSI0_GRPM1_GRVWA8_GRVWB8_GSU0_GSUAMB_GSUC0_GSUWGMRR0_GLS0_ISA1100_IU1_K1_LBSPPA128_LBSPPB128_LBSPPM0_LPA16_LPB16_LPM0_LRVW16_LWPMn1_MIAV1_MIWT3_3_MO40_NTn1_NTA0_NTB0_NTC0_NTD0_NTM0_NEPBS0_NLCA1_NLCB1_ONLL1_PGR1_PLR1_PKA0_SIA3_SS1_SU32_SUM0_SUS256_SPO0_SRVW0_SSO0_SVW1_SK3_SKFTR0_SKXCCM8_TLDS1_ULSGRO0_USL1_UIOFGRO0_USFGROn1_VSn1_VWA1_VWB1_WSGRA0_WSGRB0_WS32_WG32_4_1_WGM8_WGMXCC1_WGMXCCGn1
    SolutionIndex: 21
    SolutionNameMin: Cijk_Alik_Bljk_HHS_BH_Bias_HA_S_SAV_UserArgs_MT96x96x32_MI16x16x1_SN_LDSB0_AFC1_AFEM1_AFEM1_ASEM1_CLR1_CADS0_DTLA0_DTLB0_DTVA0_DTVB0_EPS0_FDSI0_GRPM1_GRVWA8_GRVWB8_GSU0_GSUAMB_GSUC0_GSUWGMRR0_GLS0_ISA1100_IU1_K1_LBSPPA128_LBSPPB128_LBSPPM0_LPA16_LPB16_LPM0_LRVW16_LWPMn1_MIAV1_MIWT3_3_MO40_NTn1_NTA0_NTB0_NTC0_NTD0_NTM0_NEPBS0_NLCA1_NLCB1_ONLL1_PGR2_PLR1_PKA0_SIA3_SS1_SU32_SUM0_SUS256_SPO0_SRVW0_SSO0_SVW1_SK3_SKFTR0_SKXCCM8_TLDS1_ULSGRO0_USL1_UIOFGRO0_USFGROn1_VSn1_VWA1_VWB1_WSGRA0_WSGRB0_WS32_WG32_4_1_WGM8_WGMXCC1_WGMXCCGn1
    SolutionIndex: 22
    SolutionNameMin: Cijk_Alik_Bljk_HHS_BH_Bias_HA_S_SAV_UserArgs_MT96x32x32_MI16x16x1_SN_LDSB0_AFC1_AFEM1_AFEM1_ASEM1_CLR1_CADS0_DTLA0_DTLB0_DTVA0_DTVB0_EPS0_FDSI0_GRPM1_GRVWA8_GRVWB8_GSU0_GSUAMB_GSUC0_GSUWGMRR0_GLS0_ISA1100_IU1_K1_LBSPPA128_LBSPPB128_LBSPPM0_LPA16_LPB16_LPM0_LRVW16_LWPMn1_MIAV1_MIWT3_1_MO40_NTn1_NTA0_NTB0_NTC0_NTD0_NTM0_NEPBS0_NLCA1_NLCB1_ONLL1_PGR1_PLR1_PKA0_SIA3_SS1_SU32_SUM0_SUS256_SPO0_SRVW0_SSO0_SVW1_SK3_SKFTR0_SKXCCM8_TLDS1_ULSGRO0_USL1_UIOFGRO0_USFGROn1_VSn1_VWA1_VWB1_WSGRA0_WSGRB0_WS32_WG32_4_1_WGM8_WGMXCC1_WGMXCCGn1
    SolutionIndex: 23
    SolutionNameMin: Cijk_Alik_Bljk_HHS_BH_Bias_HA_S_SAV_UserArgs_MT128x96x32_MI16x16x1_SN_LDSB1_AFC1_AFEM1_AFEM1_ASEM1_CLR1_CADS0_DTLA0_DTLB0_DTVA0_DTVB0_EPS0_FDSI0_GRPM1_GRVWA8_GRVWB8_GSU0_GSUAMB_GSUC0_GSUWGMRR0_GLS0_ISA1100_IU1_K1_LBSPPA128_LBSPPB128_LBSPPM0_LPA16_LPB16_LPM0_LRVW16_LWPMn1_MIAV1_MIWT4_3_MO40_NTn1_NTA0_NTB0_NTC0_NTD0_NTM0_NEPBS0_NLCA1_NLCB1_ONLL1_PGR1_PLR1_PKA0_SIA3_SS1_SU32_SUM0_SUS256_SPO0_SRVW0_SSO0_SVW1_SK3_SKFTR0_SKXCCM8_TLDS1_ULSGRO0_USL1_UIOFGRO0_USFGROn1_VSn1_VWA1_VWB1_WSGRA0_WSGRB0_WS32_WG32_4_1_WGM8_WGMXCC1_WGMXCCGn1
    SolutionIndex: 24
    SolutionNameMin: Cijk_Alik_Bljk_HHS_BH_Bias_HA_S_SAV_UserArgs_MT128x96x32_MI16x16x1_SN_LDSB1_AFC1_AFEM1_AFEM1_ASEM1_CLR1_CADS0_DTLA0_DTLB0_DTVA0_DTVB0_EPS0_FDSI0_GRPM1_GRVWA8_GRVWB8_GSU0_GSUAMB_GSUC0_GSUWGMRR0_GLS0_ISA1100_IU1_K1_LBSPPA128_LBSPPB128_LBSPPM0_LPA16_LPB16_LPM0_LRVW16_LWPMn1_MIAV1_MIWT4_3_MO40_NTn1_NTA0_NTB0_NTC0_NTD0_NTM0_NEPBS0_NLCA1_NLCB1_ONLL1_PGR2_PLR1_PKA0_SIA3_SS1_SU32_SUM0_SUS256_SPO0_SRVW0_SSO0_SVW1_SK3_SKFTR0_SKXCCM8_TLDS1_ULSGRO0_USL1_UIOFGRO0_USFGROn1_VSn1_VWA1_VWB1_WSGRA0_WSGRB0_WS32_WG32_4_1_WGM8_WGMXCC1_WGMXCCGn1
    SolutionIndex: 25
    SolutionNameMin: Cijk_Alik_Bljk_HHS_BH_Bias_HA_S_SAV_UserArgs_MT224x32x32_MI16x16x1_SN_LDSB1_AFC1_AFEM1_AFEM1_ASEM1_CLR1_CADS0_DTLA0_DTLB0_DTVA0_DTVB0_EPS0_FDSI0_GRPM1_GRVWA8_GRVWB8_GSU0_GSUAMB_GSUC0_GSUWGMRR0_GLS0_ISA1100_IU1_K1_LBSPPA128_LBSPPB128_LBSPPM0_LPA16_LPB16_LPM0_LRVW16_LWPMn1_MIAV1_MIWT7_1_MO40_NTn1_NTA0_NTB0_NTC0_NTD0_NTM0_NEPBS0_NLCA1_NLCB1_ONLL1_PGR1_PLR1_PKA0_SIA3_SS1_SU32_SUM0_SUS256_SPO0_SRVW0_SSO0_SVW1_SK3_SKFTR0_SKXCCM8_TLDS1_ULSGRO0_USL1_UIOFGRO0_USFGROn1_VSn1_VWA1_VWB1_WSGRA0_WSGRB0_WS32_WG32_4_1_WGM8_WGMXCC1_WGMXCCGn1
    SolutionIndex: 26
    SolutionNameMin: Cijk_Alik_Bljk_HHS_BH_Bias_HA_S_SAV_UserArgs_MT64x16x64_MI16x16x1_SN_LDSB0_AFC1_AFEM1_AFEM1_ASEM1_CLR1_CADS0_DTLA0_DTLB0_DTVA0_DTVB0_EPS0_FDSI0_GRPM1_GRVWA8_GRVWB8_GSU0_GSUAMB_GSUC0_GSUWGMRR0_GLS0_ISA1100_IU1_K1_LBSPPA128_LBSPPB128_LBSPPM0_LPA16_LPB16_LPM0_LRVW16_LWPMn1_MIAV1_MIWT1_1_MO40_NTn1_NTA0_NTB0_NTC0_NTD0_NTM0_NEPBS0_NLCA1_NLCB1_ONLL1_PGR1_PLR1_PKA0_SIA3_SS1_SU32_SUM0_SUS256_SPO0_SRVW0_SSO0_SVW1_SK3_SKFTR0_SKXCCM8_TLDS1_ULSGRO0_USL1_UIOFGRO0_USFGROn1_VSn1_VWA1_VWB1_WSGRA0_WSGRB0_WS32_WG64_2_1_WGM8_WGMXCC1_WGMXCCGn1
    SolutionIndex: 27
    SolutionNameMin: Cijk_Alik_Bljk_HHS_BH_Bias_HA_S_SAV_UserArgs_MT32x16x64_MI16x16x1_SN_LDSB0_AFC1_AFEM1_AFEM1_ASEM1_CLR1_CADS0_DTLA0_DTLB0_DTVA0_DTVB0_EPS0_FDSI0_GRPM1_GRVWA8_GRVWB8_GSU0_GSUAMB_GSUC0_GSUWGMRR0_GLS0_ISA1100_IU1_K1_LBSPPA128_LBSPPB128_LBSPPM0_LPA16_LPB16_LPM0_LRVW16_LWPMn1_MIAV1_MIWT1_1_MO40_NTn1_NTA0_NTB0_NTC0_NTD0_NTM0_NEPBS0_NLCA1_NLCB1_ONLL1_PGR2_PLR1_PKA0_SIA3_SS1_SU32_SUM0_SUS256_SPO0_SRVW0_SSO0_SVW1_SK3_SKFTR0_SKXCCM8_TLDS1_ULSGRO0_USL1_UIOFGRO0_USFGROn1_VSn1_VWA1_VWB1_WSGRA0_WSGRB0_WS32_WG32_2_1_WGM8_WGMXCC1_WGMXCCGn1
    SolutionIndex: 28
    SolutionNameMin: Cijk_Alik_Bljk_HHS_BH_Bias_HA_S_SAV_UserArgs_MT16x16x64_MI16x16x1_SN_LDSB0_AFC1_AFEM1_AFEM1_ASEM1_CLR1_CADS0_DTLA0_DTLB0_DTVA0_DTVB0_EPS0_FDSI0_GRPM1_GRVWA8_GRVWB8_GSU0_GSUAMB_GSUC0_GSUWGMRR0_GLS0_ISA1100_IU1_K1_LBSPPA128_LBSPPB128_LBSPPM0_LPA16_LPB16_LPM0_LRVW16_LWPMn1_MIAV1_MIWT1_1_MO40_NTn1_NTA0_NTB0_NTC0_NTD0_NTM0_NEPBS0_NLCA1_NLCB1_ONLL1_PGR2_PLR1_PKA0_SIA3_SS1_SU32_SUM0_SUS256_SPO0_SRVW0_SSO0_SVW1_SK3_SKFTR0_SKXCCM8_TLDS1_ULSGRO0_USL1_UIOFGRO0_USFGROn1_VSn1_VWA1_VWB1_WSGRA0_WSGRB0_WS32_WG16_2_1_WGM8_WGMXCC1_WGMXCCGn1
    SolutionIndex: 29
    SolutionNameMin: Cijk_Alik_Bljk_HHS_BH_Bias_HA_S_SAV_UserArgs_MT16x16x64_MI16x16x1_SN_LDSB0_AFC1_AFEM1_AFEM1_ASEM1_CLR1_CADS0_DTLA0_DTLB0_DTVA0_DTVB0_EPS0_FDSI0_GRPM1_GRVWA8_GRVWB8_GSU0_GSUAMB_GSUC0_GSUWGMRR0_GLS0_ISA1100_IU1_K1_LBSPPA128_LBSPPB128_LBSPPM0_LPA16_LPB16_LPM0_LRVW16_LWPMn1_MIAV1_MIWT1_1_MO40_NTn1_NTA0_NTB0_NTC0_NTD0_NTM0_NEPBS0_NLCA1_NLCB1_ONLL1_PGR2_PLR1_PKA0_SIA3_SS0_SU32_SUM0_SUS256_SPO0_SRVW0_SSO0_SVW1_SK3_SKFTR0_SKXCCM8_TLDS1_ULSGRO0_USL1_UIOFGRO0_USFGROn1_VSn1_VWA1_VWB1_WSGRA0_WSGRB0_WS32_WG16_2_1_WGM8_WGMXCC1_WGMXCCGn1
    SolutionIndex: 30
    SolutionNameMin: Cijk_Alik_Bljk_HHS_BH_Bias_HA_S_SAV_UserArgs_MT96x64x32_MI16x16x1_SN_LDSB0_AFC1_AFEM1_AFEM1_ASEM1_CLR1_CADS0_DTLA0_DTLB0_DTVA0_DTVB0_EPS0_FDSI0_GRPM1_GRVWA8_GRVWB8_GSU0_GSUAMB_GSUC0_GSUWGMRR0_GLS0_ISA1100_IU1_K1_LBSPPA128_LBSPPB128_LBSPPM0_LPA16_LPB16_LPM0_LRVW16_LWPMn1_MIAV1_MIWT3_2_MO40_NTn1_NTA0_NTB0_NTC0_NTD0_NTM0_NEPBS0_NLCA1_NLCB1_ONLL1_PGR2_PLR1_PKA0_SIA3_SS1_SU32_SUM0_SUS256_SPO0_SRVW0_SSO0_SVW1_SK3_SKFTR0_SKXCCM8_TLDS1_ULSGRO0_USL1_UIOFGRO0_USFGROn1_VSn1_VWA1_VWB1_WSGRA0_WSGRB0_WS32_WG32_4_1_WGM8_WGMXCC1_WGMXCCGn1
    SolutionIndex: 31
    SolutionNameMin: Cijk_Alik_Bljk_HHS_BH_Bias_HA_S_SAV_UserArgs_MT128x64x32_MI16x16x1_SN_LDSB0_AFC1_AFEM1_AFEM1_ASEM1_CLR1_CADS0_DTLA0_DTLB0_DTVA0_DTVB0_EPS0_FDSI0_GRPM1_GRVWA8_GRVWB8_GSU0_GSUAMB_GSUC0_GSUWGMRR0_GLS0_ISA1100_IU1_K1_LBSPPA128_LBSPPB128_LBSPPM0_LPA16_LPB16_LPM0_LRVW16_LWPMn1_MIAV1_MIWT2_4_MO40_NTn1_NTA0_NTB0_NTC0_NTD0_NTM0_NEPBS0_NLCA1_NLCB1_ONLL1_PGR2_PLR1_PKA0_SIA3_SS1_SU32_SUM0_SUS256_SPO0_SRVW0_SSO0_SVW1_SK3_SKFTR0_SKXCCM8_TLDS1_ULSGRO0_USL1_UIOFGRO0_USFGROn1_VSn1_VWA1_VWB1_WSGRA0_WSGRB0_WS32_WG64_2_1_WGM8_WGMXCC1_WGMXCCGn1
    SolutionIndex: 32
    SolutionNameMin: Cijk_Alik_Bljk_HHS_BH_Bias_HA_S_SAV_UserArgs_MT192x48x32_MI16x16x1_SN_LDSB1_AFC1_AFEM1_AFEM1_ASEM1_CLR1_CADS0_DTLA0_DTLB0_DTVA0_DTVB0_EPS0_FDSI0_GRPM1_GRVWA8_GRVWB4_GSU0_GSUAMB_GSUC0_GSUWGMRR0_GLS0_ISA1100_IU1_K1_LBSPPA128_LBSPPB128_LBSPPM0_LPA16_LPB16_LPM0_LRVW16_LWPMn1_MIAV1_MIWT3_3_MO40_NTn1_NTA0_NTB0_NTC0_NTD0_NTM0_NEPBS0_NLCA1_NLCB1_ONLL1_PGR2_PLR1_PKA0_SIA3_SS1_SU32_SUM0_SUS256_SPO0_SRVW0_SSO0_SVW1_SK3_SKFTR0_SKXCCM8_TLDS1_ULSGRO0_USL1_UIOFGRO0_USFGROn1_VSn1_VWA1_VWB1_WSGRA0_WSGRB0_WS32_WG64_2_1_WGM8_WGMXCC1_WGMXCCGn1
    SolutionIndex: 33
    SolutionNameMin: Cijk_Alik_Bljk_HHS_BH_Bias_HA_S_SAV_UserArgs_MT160x64x32_MI16x16x1_SN_LDSB1_AFC1_AFEM1_AFEM1_ASEM1_CLR1_CADS0_DTLA0_DTLB0_DTVA0_DTVB0_EPS0_FDSI0_GRPM1_GRVWA8_GRVWB8_GSU0_GSUAMB_GSUC0_GSUWGMRR0_GLS0_ISA1100_IU1_K1_LBSPPA128_LBSPPB128_LBSPPM0_LPA16_LPB16_LPM0_LRVW16_LWPMn1_MIAV1_MIWT5_2_MO40_NTn1_NTA0_NTB0_NTC0_NTD0_NTM0_NEPBS0_NLCA1_NLCB1_ONLL1_PGR2_PLR1_PKA0_SIA3_SS1_SU32_SUM0_SUS256_SPO0_SRVW0_SSO0_SVW1_SK3_SKFTR0_SKXCCM8_TLDS1_ULSGRO0_USL1_UIOFGRO0_USFGROn1_VSn1_VWA1_VWB1_WSGRA0_WSGRB0_WS32_WG32_4_1_WGM8_WGMXCC1_WGMXCCGn1
    SolutionIndex: 34
    SolutionNameMin: Cijk_Alik_Bljk_HHS_BH_Bias_HA_S_SAV_UserArgs_MT128x16x32_MI16x16x1_SN_LDSB0_AFC1_AFEM1_AFEM1_ASEM1_CLR1_CADS0_DTLA0_DTLB0_DTVA0_DTVB0_EPS0_FDSI0_GRPM1_GRVWA8_GRVWB4_GSU0_GSUAMB_GSUC0_GSUWGMRR0_GLS0_ISA1100_IU1_K1_LBSPPA128_LBSPPB128_LBSPPM0_LPA16_LPB16_LPM0_LRVW16_LWPMn1_MIAV1_MIWT2_1_MO40_NTn1_NTA0_NTB0_NTC0_NTD0_NTM0_NEPBS0_NLCA1_NLCB1_ONLL1_PGR1_PLR1_PKA0_SIA3_SS1_SU32_SUM0_SUS256_SPO0_SRVW0_SSO0_SVW1_SK3_SKFTR0_SKXCCM8_TLDS1_ULSGRO0_USL1_UIOFGRO0_USFGROn1_VSn1_VWA1_VWB1_WSGRA0_WSGRB0_WS32_WG64_2_1_WGM8_WGMXCC1_WGMXCCGn1
    SolutionIndex: 35
    SolutionNameMin: Cijk_Alik_Bljk_HHS_BH_Bias_HA_S_SAV_UserArgs_MT64x16x64_MI16x16x1_SN_LDSB0_AFC1_AFEM1_AFEM1_ASEM1_CLR1_CADS0_DTLA0_DTLB0_DTVA0_DTVB0_EPS0_FDSI0_GRPM1_GRVWA8_GRVWB8_GSU0_GSUAMB_GSUC0_GSUWGMRR0_GLS0_ISA1100_IU1_K1_LBSPPA128_LBSPPB128_LBSPPM0_LPA16_LPB16_LPM0_LRVW16_LWPMn1_MIAV1_MIWT1_1_MO40_NTn1_NTA0_NTB0_NTC0_NTD0_NTM0_NEPBS0_NLCA1_NLCB1_ONLL1_PGR2_PLR1_PKA0_SIA3_SS1_SU32_SUM0_SUS256_SPO0_SRVW0_SSO0_SVW1_SK3_SKFTR0_SKXCCM8_TLDS1_ULSGRO0_USL1_UIOFGRO0_USFGROn1_VSn1_VWA1_VWB1_WSGRA0_WSGRB0_WS32_WG64_2_1_WGM8_WGMXCC1_WGMXCCGn1
    SolutionIndex: 36
    SolutionNameMin: Cijk_Alik_Bljk_HHS_BH_Bias_HA_S_SAV_UserArgs_MT80x128x32_MI16x16x1_SN_LDSB1_AFC1_AFEM1_AFEM1_ASEM1_CLR1_CADS0_DTLA0_DTLB0_DTVA0_DTVB0_EPS0_FDSI0_GRPM1_GRVWA4_GRVWB8_GSU0_GSUAMB_GSUC0_GSUWGMRR0_GLS0_ISA1100_IU1_K1_LBSPPA128_LBSPPB128_LBSPPM0_LPA16_LPB16_LPM0_LRVW16_LWPMn1_MIAV1_MIWT5_2_MO40_NTn1_NTA0_NTB0_NTC0_NTD0_NTM0_NEPBS0_NLCA1_NLCB1_ONLL1_PGR1_PLR1_PKA0_SIA3_SS1_SU32_SUM0_SUS256_SPO0_SRVW0_SSO0_SVW1_SK3_SKFTR0_SKXCCM8_TLDS1_ULSGRO0_USL1_UIOFGRO0_USFGROn1_VSn1_VWA1_VWB1_WSGRA0_WSGRB0_WS32_WG16_8_1_WGM8_WGMXCC1_WGMXCCGn1
    SolutionIndex: 37
    SolutionNameMin: Cijk_Alik_Bljk_HHS_BH_Bias_HA_S_SAV_UserArgs_MT160x64x32_MI16x16x1_SN_LDSB1_AFC1_AFEM1_AFEM1_ASEM1_CLR1_CADS0_DTLA0_DTLB0_DTVA0_DTVB0_EPS0_FDSI0_GRPM1_GRVWA8_GRVWB8_GSU0_GSUAMB_GSUC0_GSUWGMRR0_GLS0_ISA1100_IU1_K1_LBSPPA128_LBSPPB128_LBSPPM0_LPA16_LPB16_LPM0_LRVW16_LWPMn1_MIAV1_MIWT5_2_MO40_NTn1_NTA0_NTB0_NTC0_NTD0_NTM0_NEPBS0_NLCA1_NLCB1_ONLL1_PGR1_PLR1_PKA0_SIA3_SS1_SU32_SUM0_SUS256_SPO0_SRVW0_SSO0_SVW1_SK3_SKFTR0_SKXCCM8_TLDS1_ULSGRO0_USL1_UIOFGRO0_USFGROn1_VSn1_VWA1_VWB1_WSGRA0_WSGRB0_WS32_WG32_4_1_WGM8_WGMXCC1_WGMXCCGn1
    SolutionIndex: 38
    SolutionNameMin: Cijk_Alik_Bljk_HHS_BH_Bias_HA_S_SAV_UserArgs_MT48x192x32_MI16x16x1_SN_LDSB1_AFC1_AFEM1_AFEM1_ASEM1_CLR1_CADS0_DTLA0_DTLB0_DTVA0_DTVB0_EPS0_FDSI0_GRPM1_GRVWA4_GRVWB8_GSU0_GSUAMB_GSUC0_GSUWGMRR0_GLS0_ISA1100_IU1_K1_LBSPPA128_LBSPPB128_LBSPPM0_LPA16_LPB16_LPM0_LRVW16_LWPMn1_MIAV1_MIWT3_3_MO40_NTn1_NTA0_NTB0_NTC0_NTD0_NTM0_NEPBS0_NLCA1_NLCB1_ONLL1_PGR2_PLR1_PKA0_SIA3_SS1_SU32_SUM0_SUS256_SPO0_SRVW0_SSO0_SVW1_SK3_SKFTR0_SKXCCM8_TLDS1_ULSGRO0_USL1_UIOFGRO0_USFGROn1_VSn1_VWA1_VWB1_WSGRA0_WSGRB0_WS32_WG16_8_1_WGM8_WGMXCC1_WGMXCCGn1
    SolutionIndex: 39
    SolutionNameMin: Cijk_Alik_Bljk_HHS_BH_Bias_HA_S_SAV_UserArgs_MT80x128x32_MI16x16x1_SN_LDSB1_AFC1_AFEM1_AFEM1_ASEM1_CLR1_CADS0_DTLA0_DTLB0_DTVA0_DTVB0_EPS0_FDSI0_GRPM1_GRVWA4_GRVWB8_GSU0_GSUAMB_GSUC0_GSUWGMRR0_GLS0_ISA1100_IU1_K1_LBSPPA128_LBSPPB128_LBSPPM0_LPA16_LPB16_LPM0_LRVW16_LWPMn1_MIAV1_MIWT5_2_MO40_NTn1_NTA0_NTB0_NTC0_NTD0_NTM0_NEPBS0_NLCA1_NLCB1_ONLL1_PGR2_PLR1_PKA0_SIA3_SS1_SU32_SUM0_SUS256_SPO0_SRVW0_SSO0_SVW1_SK3_SKFTR0_SKXCCM8_TLDS1_ULSGRO0_USL1_UIOFGRO0_USFGROn1_VSn1_VWA1_VWB1_WSGRA0_WSGRB0_WS32_WG16_8_1_WGM8_WGMXCC1_WGMXCCGn1
    SolutionIndex: 40
    SolutionNameMin: Cijk_Alik_Bljk_HHS_BH_Bias_HA_S_SAV_UserArgs_MT96x32x64_MI16x16x1_SN_LDSB1_AFC1_AFEM1_AFEM1_ASEM1_CLR1_CADS0_DTLA0_DTLB0_DTVA0_DTVB0_EPS0_FDSI0_GRPM1_GRVWA8_GRVWB8_GSU0_GSUAMB_GSUC0_GSUWGMRR0_GLS0_ISA1100_IU1_K1_LBSPPA128_LBSPPB128_LBSPPM0_LPA16_LPB16_LPM0_LRVW16_LWPMn1_MIAV1_MIWT3_1_MO40_NTn1_NTA0_NTB0_NTC0_NTD0_NTM0_NEPBS0_NLCA1_NLCB1_ONLL1_PGR2_PLR1_PKA0_SIA3_SS0_SU32_SUM0_SUS256_SPO0_SRVW0_SSO0_SVW1_SK3_SKFTR0_SKXCCM8_TLDS1_ULSGRO0_USL1_UIOFGRO0_USFGROn1_VSn1_VWA1_VWB1_WSGRA0_WSGRB0_WS32_WG32_4_1_WGM8_WGMXCC1_WGMXCCGn1
    SolutionIndex: 41
    SolutionNameMin: Cijk_Alik_Bljk_HHS_BH_Bias_HA_S_SAV_UserArgs_MT64x16x32_MI16x16x1_SN_LDSB0_AFC1_AFEM1_AFEM1_ASEM1_CLR1_CADS0_DTLA0_DTLB0_DTVA0_DTVB0_EPS0_FDSI0_GRPM1_GRVWA8_GRVWB4_GSU0_GSUAMB_GSUC0_GSUWGMRR0_GLS0_ISA1100_IU1_K1_LBSPPA128_LBSPPB128_LBSPPM0_LPA16_LPB16_LPM0_LRVW16_LWPMn1_MIAV1_MIWT1_1_MO40_NTn1_NTA0_NTB0_NTC0_NTD0_NTM0_NEPBS0_NLCA1_NLCB1_ONLL1_PGR2_PLR1_PKA0_SIA3_SS0_SU32_SUM0_SUS256_SPO0_SRVW0_SSO0_SVW1_SK3_SKFTR0_SKXCCM8_TLDS1_ULSGRO0_USL1_UIOFGRO0_USFGROn1_VSn1_VWA1_VWB1_WSGRA0_WSGRB0_WS32_WG64_2_1_WGM8_WGMXCC1_WGMXCCGn1
    SolutionIndex: 42
    SolutionNameMin: Cijk_Alik_Bljk_HHS_BH_Bias_HA_S_SAV_UserArgs_MT128x32x64_MI16x16x1_SN_LDSB1_AFC1_AFEM1_AFEM1_ASEM1_CLR1_CADS0_DTLA0_DTLB0_DTVA0_DTVB0_EPS0_FDSI0_GRPM1_GRVWA8_GRVWB8_GSU0_GSUAMB_GSUC0_GSUWGMRR0_GLS0_ISA1100_IU1_K1_LBSPPA128_LBSPPB128_LBSPPM0_LPA16_LPB16_LPM0_LRVW16_LWPMn1_MIAV1_MIWT2_2_MO40_NTn1_NTA0_NTB0_NTC0_NTD0_NTM0_NEPBS0_NLCA1_NLCB1_ONLL1_PGR2_PLR1_PKA0_SIA3_SS1_SU32_SUM0_SUS256_SPO0_SRVW0_SSO0_SVW1_SK3_SKFTR0_SKXCCM8_TLDS1_ULSGRO0_USL1_UIOFGRO0_USFGROn1_VSn1_VWA1_VWB1_WSGRA0_WSGRB0_WS32_WG64_2_1_WGM8_WGMXCC1_WGMXCCGn1
    SolutionIndex: 43
    SolutionNameMin: Cijk_Alik_Bljk_HHS_BH_Bias_HA_S_SAV_UserArgs_MT64x128x32_MI16x16x1_SN_LDSB0_AFC1_AFEM1_AFEM1_ASEM1_CLR1_CADS0_DTLA0_DTLB0_DTVA0_DTVB0_EPS0_FDSI0_GRPM1_GRVWA8_GRVWB8_GSU0_GSUAMB_GSUC0_GSUWGMRR0_GLS0_ISA1100_IU1_K1_LBSPPA128_LBSPPB128_LBSPPM0_LPA16_LPB16_LPM0_LRVW16_LWPMn1_MIAV1_MIWT4_2_MO40_NTn1_NTA0_NTB0_NTC0_NTD0_NTM0_NEPBS0_NLCA1_NLCB1_ONLL1_PGR2_PLR1_PKA0_SIA3_SS0_SU32_SUM0_SUS256_SPO0_SRVW0_SSO0_SVW1_SK3_SKFTR0_SKXCCM8_TLDS1_ULSGRO0_USL1_UIOFGRO0_USFGROn1_VSn1_VWA1_VWB1_WSGRA0_WSGRB0_WS32_WG16_8_1_WGM8_WGMXCC1_WGMXCCGn1
    SolutionIndex: 44
    SolutionNameMin: Cijk_Alik_Bljk_HHS_BH_Bias_HA_S_SAV_UserArgs_MT128x64x32_MI16x16x1_SN_LDSB0_AFC1_AFEM1_AFEM1_ASEM1_CLR1_CADS0_DTLA0_DTLB0_DTVA0_DTVB0_EPS0_FDSI0_GRPM1_GRVWA8_GRVWB8_GSU0_GSUAMB_GSUC0_GSUWGMRR0_GLS0_ISA1100_IU1_K1_LBSPPA128_LBSPPB128_LBSPPM0_LPA16_LPB16_LPM0_LRVW16_LWPMn1_MIAV1_MIWT4_2_MO40_NTn1_NTA0_NTB0_NTC0_NTD0_NTM0_NEPBS0_NLCA1_NLCB1_ONLL1_PGR2_PLR1_PKA0_SIA3_SS1_SU32_SUM0_SUS256_SPO0_SRVW0_SSO0_SVW1_SK3_SKFTR0_SKXCCM8_TLDS1_ULSGRO0_USL1_UIOFGRO0_USFGROn1_VSn1_VWA1_VWB1_WSGRA0_WSGRB0_WS32_WG32_4_1_WGM8_WGMXCC1_WGMXCCGn1
    SolutionIndex: 45
    SolutionNameMin: Cijk_Alik_Bljk_HHS_BH_Bias_HA_S_SAV_UserArgs_MT96x96x32_MI16x16x1_SN_LDSB0_AFC1_AFEM1_AFEM1_ASEM1_CLR1_CADS0_DTLA0_DTLB0_DTVA0_DTVB0_EPS0_FDSI0_GRPM1_GRVWA8_GRVWB8_GSU0_GSUAMB_GSUC0_GSUWGMRR0_GLS0_ISA1100_IU1_K1_LBSPPA128_LBSPPB128_LBSPPM0_LPA16_LPB16_LPM0_LRVW16_LWPMn1_MIAV1_MIWT3_3_MO40_NTn1_NTA0_NTB0_NTC0_NTD0_NTM0_NEPBS0_NLCA1_NLCB1_ONLL1_PGR2_PLR1_PKA0_SIA3_SS0_SU32_SUM0_SUS256_SPO0_SRVW0_SSO0_SVW1_SK3_SKFTR0_SKXCCM8_TLDS1_ULSGRO0_USL1_UIOFGRO0_USFGROn1_VSn1_VWA1_VWB1_WSGRA0_WSGRB0_WS32_WG32_4_1_WGM8_WGMXCC1_WGMXCCGn1
    SolutionIndex: 46
    SolutionNameMin: Cijk_Alik_Bljk_HHS_BH_Bias_HA_S_SAV_UserArgs_MT64x128x32_MI16x16x1_SN_LDSB0_AFC1_AFEM1_AFEM1_ASEM1_CLR1_CADS0_DTLA0_DTLB0_DTVA0_DTVB0_EPS0_FDSI0_GRPM1_GRVWA8_GRVWB8_GSU0_GSUAMB_GSUC0_GSUWGMRR0_GLS0_ISA1100_IU1_K1_LBSPPA128_LBSPPB128_LBSPPM0_LPA16_LPB16_LPM0_LRVW16_LWPMn1_MIAV1_MIWT2_4_MO40_NTn1_NTA0_NTB0_NTC0_NTD0_NTM0_NEPBS0_NLCA1_NLCB1_ONLL1_PGR2_PLR1_PKA0_SIA3_SS1_SU32_SUM0_SUS256_SPO0_SRVW0_SSO0_SVW1_SK3_SKFTR0_SKXCCM8_TLDS1_ULSGRO0_USL1_UIOFGRO0_USFGROn1_VSn1_VWA1_VWB1_WSGRA0_WSGRB0_WS32_WG32_4_1_WGM8_WGMXCC1_WGMXCCGn1
    SolutionIndex: 47
    SolutionNameMin: Cijk_Alik_Bljk_HHS_BH_Bias_HA_S_SAV_UserArgs_MT48x192x32_MI16x16x1_SN_LDSB1_AFC1_AFEM1_AFEM1_ASEM1_CLR1_CADS0_DTLA0_DTLB0_DTVA0_DTVB0_EPS0_FDSI0_GRPM1_GRVWA4_GRVWB8_GSU0_GSUAMB_GSUC0_GSUWGMRR0_GLS0_ISA1100_IU1_K1_LBSPPA128_LBSPPB128_LBSPPM0_LPA16_LPB16_LPM0_LRVW16_LWPMn1_MIAV1_MIWT3_3_MO40_NTn1_NTA0_NTB0_NTC0_NTD0_NTM0_NEPBS0_NLCA1_NLCB1_ONLL1_PGR1_PLR1_PKA0_SIA3_SS1_SU32_SUM0_SUS256_SPO0_SRVW0_SSO0_SVW1_SK3_SKFTR0_SKXCCM8_TLDS1_ULSGRO0_USL1_UIOFGRO0_USFGROn1_VSn1_VWA1_VWB1_WSGRA0_WSGRB0_WS32_WG16_8_1_WGM8_WGMXCC1_WGMXCCGn1
    SolutionIndex: 48
    SolutionNameMin: Cijk_Alik_Bljk_HHS_BH_Bias_HA_S_SAV_UserArgs_MT64x160x32_MI16x16x1_SN_LDSB1_AFC1_AFEM1_AFEM1_ASEM1_CLR1_CADS0_DTLA0_DTLB0_DTVA0_DTVB0_EPS0_FDSI0_GRPM1_GRVWA8_GRVWB8_GSU0_GSUAMB_GSUC0_GSUWGMRR0_GLS0_ISA1100_IU1_K1_LBSPPA128_LBSPPB128_LBSPPM0_LPA16_LPB16_LPM0_LRVW16_LWPMn1_MIAV1_MIWT2_5_MO40_NTn1_NTA0_NTB0_NTC0_NTD0_NTM0_NEPBS0_NLCA1_NLCB1_ONLL1_PGR2_PLR1_PKA0_SIA3_SS1_SU32_SUM0_SUS256_SPO0_SRVW0_SSO0_SVW1_SK3_SKFTR0_SKXCCM8_TLDS1_ULSGRO0_USL1_UIOFGRO0_USFGROn1_VSn1_VWA1_VWB1_WSGRA0_WSGRB0_WS32_WG32_4_1_WGM8_WGMXCC1_WGMXCCGn1
- - - [7168, 1, 1, 5120]
    - [0, 0.59]
  - - [7168, 96, 1, 5120]
    - [21, 28.24]
  - - [7168, 192, 1, 5120]
    - [21, 36.65]
  - - [7168, 288, 1, 5120]
    - [24, 44.53]
  - - [7168, 384, 1, 5120]
    - [23, 45.34]
  - - [7168, 480, 1, 5120]
    - [21, 48.74]
  - - [7168, 576, 1, 5120]
    - [23, 48.82]
  - - [7168, 672, 1, 5120]
    - [18, 47.49]
  - - [7168, 768, 1, 5120]
    - [23, 54.04]
  - - [7168, 864, 1, 5120]
    - [24, 48.79]
  - - [7168, 960, 1, 5120]
    - [21, 50.74]
  - - [7168, 1056, 1, 5120]
    - [23, 50.94]
  - - [7168, 1152, 1, 5120]
    - [18, 51.51]
  - - [7168, 1248, 1, 5120]
    - [23, 52.61]
  - - [7168, 1344, 1, 5120]
    - [24, 49.26]
  - - [7168, 1440, 1, 5120]
    - [23, 52.65]
  - - [7168, 1536, 1, 5120]
    - [12, 50.72]
  - - [7168, 1632, 1, 5120]
    - [23, 58.15]
  - - [7168, 1728, 1, 5120]
    - [23, 49.45]
  - - [7168, 1824, 1, 5120]
    - [15, 52.46]
  - - [7168, 1920, 1, 5120]
    - [15, 54.46]
  - - [7168, 2016, 1, 5120]
    - [14, 50.56]
  - - [7168, 2112, 1, 5120]
    - [24, 53.46]
  - - [7168, 2208, 1, 5120]
    - [11, 50.92]
  - - [7168, 2304, 1, 5120]
    - [24, 49.4]
  - - [7168, 2400, 1, 5120]
    - [23, 55.83]
  - - [7168, 2496, 1, 5120]
    - [11, 48.97]
  - - [7168, 2592, 1, 5120]
    - [18, 49.04]
  - - [7168, 2688, 1, 5120]
    - [19, 52.04]
  - - [7168, 2784, 1, 5120]
    - [24, 57.12]
  - - [7168, 2880, 1, 5120]
    - [4, 48.39]
  - - [7168, 2976, 1, 5120]
    - [3, 48.07]
  - - [7168, 3072, 1, 5120]
    - [18, 56.43]
  - - [7168, 3168, 1, 5120]
    - [11, 47.59]
  - - [7168, 3264, 1, 5120]
    - [3, 49.89]
  - - [7168, 3360, 1, 5120]
    - [8, 48.22]
  - - [7168, 3456, 1, 5120]
    - [18, 47.49]
  - - [7168, 3552, 1, 5120]
    - [7, 47.84]
  - - [7168, 3648, 1, 5120]
    - [8, 47.1]
  - - [7168, 3744, 1, 5120]
    - [24, 52.7]
  - - [7168, 3840, 1, 5120]
    - [11, 48.02]
  - - [7168, 3936, 1, 5120]
    - [23, 43.49]
  - - [7168, 4032, 1, 5120]
    - [12, 52.23]
  - - [7168, 4128, 1, 5120]
    - [15, 48.44]
  - - [7168, 4224, 1, 5120]
    - [23, 49.38]
  - - [7168, 4320, 1, 5120]
    - [8, 46.43]
  - - [7168, 4416, 1, 5120]
    - [12, 44.89]
  - - [7168, 4512, 1, 5120]
    - [23, 48.14]
  - - [7168, 4608, 1, 5120]
    - [23, 47.88]
  - - [7168, 4704, 1, 5120]
    - [24, 46.86]
  - - [7168, 4800, 1, 5120]
    - [23, 47.88]
  - - [7168, 4896, 1, 5120]
    - [23, 50.78]
  - - [7168, 4992, 1, 5120]
    - [18, 48.25]
  - - [7168, 5088, 1, 5120]
    - [9, 48.1]
  - - [7168, 5184, 1, 5120]
    - [23, 48.25]
  - - [7168, 5280, 1, 5120]
    - [6, 47.23]
  - - [7168, 5376, 1, 5120]
    - [15, 47.73]
  - - [7168, 5472, 1, 5120]
    - [23, 49.12]
  - - [7168, 5568, 1, 5120]
    - [7, 45.87]
  - - [7168, 5664, 1, 5120]
    - [23, 49.46]
  - - [7168, 5760, 1, 5120]
    - [18, 47.77]
  - - [7168, 5856, 1, 5120]
    - [23, 47.63]
  - - [7168, 5952, 1, 5120]
    - [23, 48.29]
  - - [7168, 6048, 1, 5120]
    - [24, 47.9]
  - - [7168, 6144, 1, 5120]
    - [24, 47.87]
  - - [7168, 6240, 1, 5120]
    - [24, 47.57]
  - - [7168, 6336, 1, 5120]
    - [23, 48.47]
  - - [7168, 6432, 1, 5120]
    - [23, 48.25]
  - - [7168, 6528, 1, 5120]
    - [24, 48.37]
  - - [7168, 6624, 1, 5120]
    - [24, 48.94]
  - - [7168, 6720, 1, 5120]
    - [18, 47.81]
  - - [7168, 6816, 1, 5120]
    - [23, 48.84]
  - - [7168, 6912, 1, 5120]
    - [23, 49.33]
  - - [7168, 7008, 1, 5120]
    - [23, 49.35]
  - - [7168, 7104, 1, 5120]
    - [23, 49.05]
  - - [7168, 7200, 1, 5120]
    - [23, 48.8]
  - - [7168, 7296, 1, 5120]
    - [19, 48.76]
  - - [7168, 7392, 1, 5120]
    - [24, 49.86]
  - - [7168, 7488, 1, 5120]
    - [23, 48.68]
  - - [7168, 7584, 1, 5120]
    - [24, 50.2]
  - - [7168, 7680, 1, 5120]
    - [18, 51.16]
  - - [7168, 7776, 1, 5120]
    - [19, 49.74]
  - - [7168, 7872, 1, 5120]
    - [24, 50.54]
  - - [7168, 7968, 1, 5120]
    - [23, 49.03]
  - - [7168, 8064, 1, 5120]
    - [11, 51.65]
  - - [7168, 8160, 1, 5120]
    - [15, 49.57]
  - - [7168, 8256, 1, 5120]
    - [19, 51.37]
  - - [5120, 1, 1, 5120]
    - [10, 0.51]
  - - [5120, 96, 1, 5120]
    - [17, 24.2]
  - - [5120, 192, 1, 5120]
    - [24, 35.9]
  - - [5120, 288, 1, 5120]
    - [21, 38.55]
  - - [5120, 384, 1, 5120]
    - [23, 44.43]
  - - [5120, 480, 1, 5120]
    - [16, 40.82]
  - - [5120, 576, 1, 5120]
    - [23, 48.72]
  - - [5120, 672, 1, 5120]
    - [21, 48.5]
  - - [5120, 768, 1, 5120]
    - [19, 46.86]
  - - [5120, 864, 1, 5120]
    - [23, 45.12]
  - - [5120, 960, 1, 5120]
    - [21, 47.75]
  - - [5120, 1056, 1, 5120]
    - [23, 52.71]
  - - [5120, 1152, 1, 5120]
    - [24, 51.0]
  - - [5120, 1248, 1, 5120]
    - [23, 48.62]
  - - [5120, 1344, 1, 5120]
    - [21, 50.39]
  - - [5120, 1440, 1, 5120]
    - [23, 49.64]
  - - [5120, 1536, 1, 5120]
    - [18, 53.21]
  - - [5120, 1632, 1, 5120]
    - [20, 50.16]
  - - [5120, 1728, 1, 5120]
    - [23, 51.12]
  - - [5120, 1824, 1, 5120]
    - [23, 52.98]
  - - [5120, 1920, 1, 5120]
    - [19, 50.77]
  - - [5120, 2016, 1, 5120]
    - [23, 52.7]
  - - [5120, 2112, 1, 5120]
    - [18, 56.52]
  - - [5120, 2208, 1, 5120]
    - [24, 59.85]
  - - [5120, 2304, 1, 5120]
    - [23, 52.95]
  - - [5120, 2400, 1, 5120]
    - [23, 50.72]
  - - [5120, 2496, 1, 5120]
    - [14, 52.43]
  - - [5120, 2592, 1, 5120]
    - [18, 55.76]
  - - [5120, 2688, 1, 5120]
    - [24, 56.54]
  - - [5120, 2784, 1, 5120]
    - [19, 53.38]
  - - [5120, 2880, 1, 5120]
    - [18, 54.78]
  - - [5120, 2976, 1, 5120]
    - [23, 52.81]
  - - [5120, 3072, 1, 5120]
    - [9, 52.6]
  - - [5120, 3168, 1, 5120]
    - [24, 57.79]
  - - [5120, 3264, 1, 5120]
    - [18, 55.97]
  - - [5120, 3360, 1, 5120]
    - [23, 58.49]
  - - [5120, 3456, 1, 5120]
    - [24, 54.09]
  - - [5120, 3552, 1, 5120]
    - [20, 51.22]
  - - [5120, 3648, 1, 5120]
    - [15, 53.9]
  - - [5120, 3744, 1, 5120]
    - [6, 54.13]
  - - [5120, 3840, 1, 5120]
    - [15, 59.37]
  - - [5120, 3936, 1, 5120]
    - [19, 55.22]
  - - [5120, 4032, 1, 5120]
    - [2, 51.95]
  - - [5120, 4128, 1, 5120]
    - [23, 58.97]
  - - [5120, 4224, 1, 5120]
    - [24, 53.03]
  - - [5120, 4320, 1, 5120]
    - [7, 48.01]
  - - [5120, 4416, 1, 5120]
    - [19, 55.72]
  - - [5120, 4512, 1, 5120]
    - [24, 48.98]
  - - [5120, 4608, 1, 5120]
    - [15, 50.22]
  - - [5120, 4704, 1, 5120]
    - [19, 54.81]
  - - [5120, 4800, 1, 5120]
    - [9, 51.26]
  - - [5120, 4896, 1, 5120]
    - [18, 54.53]
  - - [5120, 4992, 1, 5120]
    - [2, 50.09]
  - - [5120, 5088, 1, 5120]
    - [19, 51.35]
  - - [5120, 5184, 1, 5120]
    - [24, 50.41]
  - - [5120, 5280, 1, 5120]
    - [18, 48.92]
  - - [5120, 5376, 1, 5120]
    - [18, 54.74]
  - - [5120, 5472, 1, 5120]
    - [9, 50.39]
  - - [5120, 5568, 1, 5120]
    - [6, 52.04]
  - - [5120, 5664, 1, 5120]
    - [23, 51.22]
  - - [5120, 5760, 1, 5120]
    - [24, 49.25]
  - - [5120, 5856, 1, 5120]
    - [23, 47.56]
  - - [5120, 5952, 1, 5120]
    - [14, 52.22]
  - - [5120, 6048, 1, 5120]
    - [9, 48.31]
  - - [5120, 6144, 1, 5120]
    - [18, 50.14]
  - - [5120, 6240, 1, 5120]
    - [23, 52.44]
  - - [5120, 6336, 1, 5120]
    - [23, 47.92]
  - - [5120, 6432, 1, 5120]
    - [23, 50.54]
  - - [5120, 6528, 1, 5120]
    - [18, 50.88]
  - - [5120, 6624, 1, 5120]
    - [6, 46.07]
  - - [5120, 6720, 1, 5120]
    - [23, 48.74]
  - - [5120, 6816, 1, 5120]
    - [23, 48.94]
  - - [5120, 6912, 1, 5120]
    - [23, 48.82]
  - - [5120, 7008, 1, 5120]
    - [15, 48.63]
  - - [5120, 7104, 1, 5120]
    - [18, 48.58]
  - - [5120, 7200, 1, 5120]
    - [23, 47.76]
  - - [5120, 7296, 1, 5120]
    - [18, 48.16]
  - - [5120, 7392, 1, 5120]
    - [23, 48.95]
  - - [5120, 7488, 1, 5120]
    - [23, 50.25]
  - - [5120, 7584, 1, 5120]
    - [23, 49.81]
  - - [5120, 7680, 1, 5120]
    - [23, 48.78]
  - - [5120, 7776, 1, 5120]
    - [18, 49.06]
  - - [5120, 7872, 1, 5120]
    - [23, 49.59]
  - - [5120, 7968, 1, 5120]
    - [23, 48.85]
  - - [5120, 8064, 1, 5120]
    - [15, 49.55]
  - - [5120, 8160, 1, 5120]
    - [23, 50.56]
  - - [5120, 8256, 1, 5120]
    - [18, 48.63]
  - - [5120, 1, 1, 13824]
    - [13, 0.36]
  - - [5120, 96, 1, 13824]
    - [17, 27.3]
  - - [5120, 192, 1, 13824]
    - [24, 42.56]
  - - [5120, 288, 1, 13824]
    - [21, 44.0]
  - - [5120, 384, 1, 13824]
    - [24, 50.34]
  - - [5120, 480, 1, 13824]
    - [24, 46.42]
  - - [5120, 576, 1, 13824]
    - [24, 55.21]
  - - [5120, 672, 1, 13824]
    - [21, 52.9]
  - - [5120, 768, 1, 13824]
    - [15, 53.48]
  - - [5120, 864, 1, 13824]
    - [18, 48.37]
  - - [5120, 960, 1, 13824]
    - [19, 52.35]
  - - [5120, 1056, 1, 13824]
    - [23, 58.19]
  - - [5120, 1152, 1, 13824]
    - [24, 56.54]
  - - [5120, 1248, 1, 13824]
    - [9, 53.72]
  - - [5120, 1344, 1, 13824]
    - [21, 48.94]
  - - [5120, 1440, 1, 13824]
    - [15, 51.86]
  - - [5120, 1536, 1, 13824]
    - [23, 55.32]
  - - [5120, 1632, 1, 13824]
    - [15, 49.52]
  - - [5120, 1728, 1, 13824]
    - [3, 49.91]
  - - [5120, 1824, 1, 13824]
    - [7, 49.57]
  - - [5120, 1920, 1, 13824]
    - [18, 46.73]
  - - [5120, 2016, 1, 13824]
    - [6, 50.88]
  - - [5120, 2112, 1, 13824]
    - [15, 47.18]
  - - [5120, 2208, 1, 13824]
    - [2, 50.69]
  - - [5120, 2304, 1, 13824]
    - [14, 44.78]
  - - [5120, 2400, 1, 13824]
    - [23, 43.64]
  - - [5120, 2496, 1, 13824]
    - [6, 41.6]
  - - [5120, 2592, 1, 13824]
    - [18, 47.95]
  - - [5120, 2688, 1, 13824]
    - [14, 42.67]
  - - [5120, 2784, 1, 13824]
    - [8, 44.64]
  - - [5120, 2880, 1, 13824]
    - [23, 47.08]
  - - [5120, 2976, 1, 13824]
    - [14, 42.12]
  - - [5120, 3072, 1, 13824]
    - [6, 46.56]
  - - [5120, 3168, 1, 13824]
    - [15, 45.48]
  - - [5120, 3264, 1, 13824]
    - [9, 46.21]
  - - [5120, 3360, 1, 13824]
    - [18, 41.85]
  - - [5120, 3456, 1, 13824]
    - [14, 44.75]
  - - [5120, 3552, 1, 13824]
    - [8, 43.95]
  - - [5120, 3648, 1, 13824]
    - [18, 45.95]
  - - [5120, 3744, 1, 13824]
    - [8, 44.74]
  - - [5120, 3840, 1, 13824]
    - [5, 42.09]
  - - [5120, 3936, 1, 13824]
    - [8, 46.62]
  - - [5120, 4032, 1, 13824]
    - [18, 46.83]
  - - [5120, 4128, 1, 13824]
    - [6, 46.02]
  - - [5120, 4224, 1, 13824]
    - [6, 47.34]
  - - [5120, 4320, 1, 13824]
    - [18, 47.1]
  - - [5120, 4416, 1, 13824]
    - [14, 46.94]
  - - [5120, 4512, 1, 13824]
    - [8, 48.05]
  - - [5120, 4608, 1, 13824]
    - [23, 48.59]
  - - [5120, 4704, 1, 13824]
    - [8, 46.72]
  - - [5120, 4800, 1, 13824]
    - [18, 48.92]
  - - [5120, 4896, 1, 13824]
    - [8, 47.53]
  - - [5120, 4992, 1, 13824]
    - [1, 48.69]
  - - [5120, 5088, 1, 13824]
    - [18, 49.06]
  - - [5120, 5184, 1, 13824]
    - [2, 49.83]
  - - [5120, 5280, 1, 13824]
    - [24, 50.69]
  - - [5120, 5376, 1, 13824]
    - [19, 50.58]
  - - [5120, 5472, 1, 13824]
    - [23, 50.68]
  - - [5120, 5568, 1, 13824]
    - [7, 51.29]
  - - [5120, 5664, 1, 13824]
    - [24, 49.59]
  - - [5120, 5760, 1, 13824]
    - [15, 50.97]
  - - [5120, 5856, 1, 13824]
    - [18, 50.54]
  - - [5120, 5952, 1, 13824]
    - [8, 51.95]
  - - [5120, 6048, 1, 13824]
    - [23, 49.11]
  - - [5120, 6144, 1, 13824]
    - [23, 53.28]
  - - [5120, 6240, 1, 13824]
    - [23, 48.8]
  - - [5120, 6336, 1, 13824]
    - [24, 50.11]
  - - [5120, 6432, 1, 13824]
    - [18, 48.62]
  - - [5120, 6528, 1, 13824]
    - [19, 47.83]
  - - [5120, 6624, 1, 13824]
    - [18, 48.46]
  - - [5120, 6720, 1, 13824]
    - [23, 49.15]
  - - [5120, 6816, 1, 13824]
    - [23, 48.63]
  - - [5120, 6912, 1, 13824]
    - [23, 48.78]
  - - [5120, 7008, 1, 13824]
    - [23, 49.02]
  - - [5120, 7104, 1, 13824]
    - [18, 48.36]
  - - [5120, 7200, 1, 13824]
    - [18, 48.6]
  - - [5120, 7296, 1, 13824]
    - [6, 48.23]
  - - [5120, 7392, 1, 13824]
    - [23, 48.54]
  - - [5120, 7488, 1, 13824]
    - [18, 48.47]
  - - [5120, 7584, 1, 13824]
    - [14, 46.39]
  - - [5120, 7680, 1, 13824]
    - [23, 48.23]
  - - [5120, 7776, 1, 13824]
    - [18, 48.59]
  - - [5120, 7872, 1, 13824]
    - [23, 48.13]
  - - [5120, 7968, 1, 13824]
    - [23, 47.88]
  - - [5120, 8064, 1, 13824]
    - [18, 48.65]
  - - [5120, 8160, 1, 13824]
    - [18, 47.87]
  - - [5120, 8256, 1, 13824]
    - [18, 47.94]
  - - [27648, 1, 1, 5120]
    - [25, 0.4]
  - - [27648, 96, 1, 5120]
    - [17, 31.29]
  - - [27648, 192, 1, 5120]
    - [15, 47.74]
  - - [27648, 288, 1, 5120]
    - [21, 46.97]
  - - [27648, 384, 1, 5120]
    - [24, 53.77]
  - - [27648, 480, 1, 5120]
    - [24, 52.35]
  - - [27648, 576, 1, 5120]
    - [24, 49.02]
  - - [27648, 672, 1, 5120]
    - [23, 48.99]
  - - [27648, 768, 1, 5120]
    - [19, 55.18]
  - - [27648, 864, 1, 5120]
    - [12, 45.79]
  - - [27648, 960, 1, 5120]
    - [15, 48.72]
  - - [27648, 1056, 1, 5120]
    - [23, 52.12]
  - - [27648, 1152, 1, 5120]
    - [14, 47.32]
  - - [27648, 1248, 1, 5120]
    - [19, 47.92]
  - - [27648, 1344, 1, 5120]
    - [14, 48.11]
  - - [27648, 1440, 1, 5120]
    - [24, 51.97]
  - - [27648, 1536, 1, 5120]
    - [24, 48.41]
  - - [27648, 1632, 1, 5120]
    - [18, 48.53]
  - - [27648, 1728, 1, 5120]
    - [15, 48.82]
  - - [27648, 1824, 1, 5120]
    - [24, 49.4]
  - - [27648, 1920, 1, 5120]
    - [15, 51.29]
  - - [27648, 2016, 1, 5120]
    - [9, 50.26]
  - - [27648, 2112, 1, 5120]
    - [24, 52.14]
  - - [27648, 2208, 1, 5120]
    - [24, 51.27]
  - - [27648, 2304, 1, 5120]
    - [19, 51.54]
  - - [27648, 2400, 1, 5120]
    - [7, 49.42]
  - - [27648, 2496, 1, 5120]
    - [15, 50.98]
  - - [27648, 2592, 1, 5120]
    - [19, 49.25]
  - - [27648, 2688, 1, 5120]
    - [24, 50.38]
  - - [27648, 2784, 1, 5120]
    - [18, 48.65]
  - - [27648, 2880, 1, 5120]
    - [24, 48.58]
  - - [27648, 2976, 1, 5120]
    - [12, 47.63]
  - - [27648, 3072, 1, 5120]
    - [24, 47.78]
  - - [27648, 3168, 1, 5120]
    - [19, 48.79]
  - - [27648, 3264, 1, 5120]
    - [15, 46.72]
  - - [27648, 3360, 1, 5120]
    - [18, 46.21]
  - - [27648, 3456, 1, 5120]
    - [18, 46.77]
  - - [27648, 3552, 1, 5120]
    - [15, 46.57]
  - - [27648, 3648, 1, 5120]
    - [18, 46.62]
  - - [27648, 3744, 1, 5120]
    - [23, 46.4]
  - - [27648, 3840, 1, 5120]
    - [23, 46.61]
  - - [27648, 3936, 1, 5120]
    - [18, 46.69]
  - - [27648, 4032, 1, 5120]
    - [18, 46.41]
  - - [27648, 4128, 1, 5120]
    - [23, 45.99]
  - - [27648, 4224, 1, 5120]
    - [18, 46.88]
  - - [27648, 4320, 1, 5120]
    - [18, 46.12]
  - - [27648, 4416, 1, 5120]
    - [18, 45.83]
  - - [27648, 4512, 1, 5120]
    - [23, 46.1]
  - - [27648, 4608, 1, 5120]
    - [18, 45.51]
  - - [27648, 4704, 1, 5120]
    - [18, 46.39]
  - - [27648, 4800, 1, 5120]
    - [18, 46.06]
  - - [27648, 4896, 1, 5120]
    - [18, 45.48]
  - - [27648, 4992, 1, 5120]
    - [18, 46.33]
  - - [27648, 5088, 1, 5120]
    - [23, 45.74]
  - - [27648, 5184, 1, 5120]
    - [12, 46.41]
  - - [27648, 5280, 1, 5120]
    - [23, 45.75]
  - - [27648, 5376, 1, 5120]
    - [23, 45.97]
  - - [27648, 5472, 1, 5120]
    - [12, 46.09]
  - - [27648, 5568, 1, 5120]
    - [12, 46.65]
  - - [27648, 5664, 1, 5120]
    - [18, 44.88]
  - - [27648, 5760, 1, 5120]
    - [24, 46.37]
  - - [27648, 5856, 1, 5120]
    - [18, 45.28]
  - - [27648, 5952, 1, 5120]
    - [18, 45.39]
  - - [27648, 6048, 1, 5120]
    - [23, 46.36]
  - - [27648, 6144, 1, 5120]
    - [24, 46.71]
  - - [27648, 6240, 1, 5120]
    - [18, 45.35]
  - - [27648, 6336, 1, 5120]
    - [18, 45.22]
  - - [27648, 6432, 1, 5120]
    - [18, 45.12]
  - - [27648, 6528, 1, 5120]
    - [18, 45.63]
  - - [27648, 6624, 1, 5120]
    - [23, 46.28]
  - - [27648, 6720, 1, 5120]
    - [23, 45.91]
  - - [27648, 6816, 1, 5120]
    - [18, 45.51]
  - - [27648, 6912, 1, 5120]
    - [23, 45.55]
  - - [27648, 7008, 1, 5120]
    - [18, 45.01]
  - - [27648, 7104, 1, 5120]
    - [18, 45.02]
  - - [27648, 7200, 1, 5120]
    - [23, 46.27]
  - - [27648, 7296, 1, 5120]
    - [23, 46.33]
  - - [27648, 7392, 1, 5120]
    - [23, 46.24]
  - - [27648, 7488, 1, 5120]
    - [18, 45.49]
  - - [27648, 7584, 1, 5120]
    - [23, 45.55]
  - - [27648, 7680, 1, 5120]
    - [23, 45.46]
  - - [27648, 7776, 1, 5120]
    - [23, 45.46]
  - - [27648, 7872, 1, 5120]
    - [23, 45.55]
  - - [27648, 7968, 1, 5120]
    - [23, 45.96]
  - - [27648, 8064, 1, 5120]
    - [18, 46.17]
  - - [27648, 8160, 1, 5120]
    - [23, 45.75]
  - - [27648, 8256, 1, 5120]
    - [18, 45.46]
  - - [152064, 1, 1, 5120]
    - [22, 0.43]
  - - [152064, 96, 1, 5120]
    - [21, 35.52]
  - - [152064, 192, 1, 5120]
    - [15, 48.44]
  - - [152064, 288, 1, 5120]
    - [9, 46.24]
  - - [8192, 1, 1, 7168]
    - [26, 0.39]
  - - [8192, 96, 1, 7168]
    - [17, 29.53]
  - - [8192, 192, 1, 7168]
    - [24, 42.97]
  - - [8192, 288, 1, 7168]
    - [24, 47.61]
  - - [8192, 384, 1, 7168]
    - [21, 44.36]
  - - [8192, 480, 1, 7168]
    - [24, 49.07]
  - - [8192, 576, 1, 7168]
    - [15, 49.5]
  - - [8192, 672, 1, 7168]
    - [23, 55.68]
  - - [8192, 768, 1, 7168]
    - [24, 51.16]
  - - [8192, 864, 1, 7168]
    - [24, 50.55]
  - - [8192, 960, 1, 7168]
    - [23, 52.81]
  - - [8192, 1056, 1, 7168]
    - [23, 50.03]
  - - [8192, 1152, 1, 7168]
    - [15, 51.89]
  - - [8192, 1248, 1, 7168]
    - [21, 48.44]
  - - [8192, 1344, 1, 7168]
    - [18, 49.48]
  - - [8192, 1440, 1, 7168]
    - [23, 48.03]
  - - [8192, 1536, 1, 7168]
    - [23, 51.18]
  - - [8192, 1632, 1, 7168]
    - [6, 48.85]
  - - [8192, 1728, 1, 7168]
    - [23, 47.3]
  - - [8192, 1824, 1, 7168]
    - [24, 52.92]
  - - [8192, 1920, 1, 7168]
    - [24, 47.56]
  - - [8192, 2016, 1, 7168]
    - [3, 47.95]
  - - [8192, 2112, 1, 7168]
    - [15, 49.01]
  - - [8192, 2208, 1, 7168]
    - [9, 47.21]
  - - [8192, 2304, 1, 7168]
    - [15, 48.52]
  - - [8192, 2400, 1, 7168]
    - [19, 48.05]
  - - [8192, 2496, 1, 7168]
    - [18, 49.43]
  - - [8192, 2592, 1, 7168]
    - [15, 49.64]
  - - [8192, 2688, 1, 7168]
    - [18, 52.9]
  - - [8192, 2784, 1, 7168]
    - [24, 49.25]
  - - [8192, 2880, 1, 7168]
    - [24, 49.94]
  - - [8192, 2976, 1, 7168]
    - [24, 49.21]
  - - [8192, 3072, 1, 7168]
    - [19, 49.05]
  - - [8192, 3168, 1, 7168]
    - [24, 50.34]
  - - [8192, 3264, 1, 7168]
    - [15, 51.91]
  - - [8192, 3360, 1, 7168]
    - [24, 49.71]
  - - [8192, 3456, 1, 7168]
    - [19, 50.2]
  - - [8192, 3552, 1, 7168]
    - [9, 50.22]
  - - [8192, 3648, 1, 7168]
    - [15, 49.21]
  - - [8192, 3744, 1, 7168]
    - [15, 50.11]
  - - [8192, 3840, 1, 7168]
    - [12, 51.42]
  - - [8192, 3936, 1, 7168]
    - [19, 50.62]
  - - [8192, 4032, 1, 7168]
    - [18, 50.1]
  - - [8192, 4128, 1, 7168]
    - [8, 48.9]
  - - [8192, 4224, 1, 7168]
    - [19, 49.39]
  - - [8192, 4320, 1, 7168]
    - [24, 49.75]
  - - [8192, 4416, 1, 7168]
    - [15, 49.43]
  - - [8192, 4512, 1, 7168]
    - [24, 48.61]
  - - [8192, 4608, 1, 7168]
    - [24, 49.89]
  - - [8192, 4704, 1, 7168]
    - [24, 49.11]
  - - [8192, 4800, 1, 7168]
    - [24, 48.37]
  - - [8192, 4896, 1, 7168]
    - [23, 48.72]
  - - [8192, 4992, 1, 7168]
    - [24, 48.39]
  - - [8192, 5088, 1, 7168]
    - [18, 49.45]
  - - [8192, 5184, 1, 7168]
    - [24, 49.14]
  - - [8192, 5280, 1, 7168]
    - [23, 47.42]
  - - [8192, 5376, 1, 7168]
    - [19, 47.78]
  - - [8192, 5472, 1, 7168]
    - [18, 47.9]
  - - [8192, 5568, 1, 7168]
    - [23, 47.86]
  - - [8192, 5664, 1, 7168]
    - [23, 47.49]
  - - [8192, 5760, 1, 7168]
    - [23, 48.03]
  - - [8192, 5856, 1, 7168]
    - [18, 48.15]
  - - [8192, 5952, 1, 7168]
    - [23, 48.09]
  - - [8192, 6048, 1, 7168]
    - [23, 47.59]
  - - [8192, 6144, 1, 7168]
    - [18, 47.57]
  - - [8192, 6240, 1, 7168]
    - [6, 47.51]
  - - [8192, 6336, 1, 7168]
    - [23, 46.74]
  - - [8192, 6432, 1, 7168]
    - [24, 47.89]
  - - [8192, 6528, 1, 7168]
    - [18, 47.59]
  - - [8192, 6624, 1, 7168]
    - [18, 47.44]
  - - [8192, 6720, 1, 7168]
    - [18, 48.25]
  - - [8192, 6816, 1, 7168]
    - [23, 48.07]
  - - [8192, 6912, 1, 7168]
    - [18, 47.81]
  - - [8192, 7008, 1, 7168]
    - [23, 47.58]
  - - [8192, 7104, 1, 7168]
    - [23, 47.5]
  - - [8192, 7200, 1, 7168]
    - [23, 46.85]
  - - [8192, 7296, 1, 7168]
    - [18, 47.35]
  - - [8192, 7392, 1, 7168]
    - [23, 47.24]
  - - [8192, 7488, 1, 7168]
    - [24, 46.99]
  - - [8192, 7584, 1, 7168]
    - [23, 47.2]
  - - [8192, 7680, 1, 7168]
    - [23, 47.2]
  - - [8192, 7776, 1, 7168]
    - [18, 47.0]
  - - [8192, 7872, 1, 7168]
    - [18, 46.63]
  - - [8192, 7968, 1, 7168]
    - [23, 46.75]
  - - [8192, 8064, 1, 7168]
    - [18, 47.23]
  - - [8192, 8160, 1, 7168]
    - [18, 47.68]
  - - [8192, 8256, 1, 7168]
    - [23, 46.95]
  - - [8192, 1, 1, 2048]
    - [27, 0.38]
  - - [8192, 96, 1, 2048]
    - [21, 24.61]
  - - [8192, 192, 1, 2048]
    - [14, 34.21]
  - - [8192, 288, 1, 2048]
    - [24, 39.92]
  - - [8192, 384, 1, 2048]
    - [20, 39.74]
  - - [8192, 480, 1, 2048]
    - [23, 42.4]
  - - [8192, 576, 1, 2048]
    - [23, 45.64]
  - - [8192, 672, 1, 2048]
    - [23, 49.66]
  - - [8192, 768, 1, 2048]
    - [23, 45.82]
  - - [8192, 864, 1, 2048]
    - [24, 47.04]
  - - [8192, 960, 1, 2048]
    - [24, 49.67]
  - - [8192, 1056, 1, 2048]
    - [12, 49.61]
  - - [8192, 1152, 1, 2048]
    - [23, 48.88]
  - - [8192, 1248, 1, 2048]
    - [23, 51.27]
  - - [8192, 1344, 1, 2048]
    - [18, 54.77]
  - - [8192, 1440, 1, 2048]
    - [24, 49.81]
  - - [8192, 1536, 1, 2048]
    - [14, 48.23]
  - - [8192, 1632, 1, 2048]
    - [18, 52.0]
  - - [8192, 1728, 1, 2048]
    - [23, 49.3]
  - - [8192, 1824, 1, 2048]
    - [23, 53.83]
  - - [8192, 1920, 1, 2048]
    - [18, 49.15]
  - - [8192, 2016, 1, 2048]
    - [15, 54.23]
  - - [8192, 2112, 1, 2048]
    - [11, 54.55]
  - - [8192, 2208, 1, 2048]
    - [23, 49.28]
  - - [8192, 2304, 1, 2048]
    - [23, 50.28]
  - - [8192, 2400, 1, 2048]
    - [24, 51.35]
  - - [8192, 2496, 1, 2048]
    - [19, 52.93]
  - - [8192, 2592, 1, 2048]
    - [18, 50.06]
  - - [8192, 2688, 1, 2048]
    - [14, 55.43]
  - - [8192, 2784, 1, 2048]
    - [18, 54.36]
  - - [8192, 2880, 1, 2048]
    - [20, 50.95]
  - - [8192, 2976, 1, 2048]
    - [23, 53.07]
  - - [8192, 3072, 1, 2048]
    - [18, 50.22]
  - - [8192, 3168, 1, 2048]
    - [15, 53.45]
  - - [8192, 3264, 1, 2048]
    - [14, 54.91]
  - - [8192, 3360, 1, 2048]
    - [11, 50.92]
  - - [8192, 3456, 1, 2048]
    - [23, 50.57]
  - - [8192, 3552, 1, 2048]
    - [24, 53.59]
  - - [8192, 3648, 1, 2048]
    - [18, 49.96]
  - - [8192, 3744, 1, 2048]
    - [15, 54.51]
  - - [8192, 3840, 1, 2048]
    - [14, 54.07]
  - - [8192, 3936, 1, 2048]
    - [19, 56.89]
  - - [8192, 4032, 1, 2048]
    - [19, 53.24]
  - - [8192, 4128, 1, 2048]
    - [19, 48.01]
  - - [8192, 4224, 1, 2048]
    - [18, 48.74]
  - - [8192, 4320, 1, 2048]
    - [15, 54.27]
  - - [8192, 4416, 1, 2048]
    - [15, 54.53]
  - - [8192, 4512, 1, 2048]
    - [12, 50.33]
  - - [8192, 4608, 1, 2048]
    - [14, 48.86]
  - - [8192, 4704, 1, 2048]
    - [20, 50.6]
  - - [8192, 4800, 1, 2048]
    - [21, 49.98]
  - - [8192, 4896, 1, 2048]
    - [23, 50.14]
  - - [8192, 4992, 1, 2048]
    - [18, 56.28]
  - - [8192, 5088, 1, 2048]
    - [19, 53.45]
  - - [8192, 5184, 1, 2048]
    - [19, 53.75]
  - - [8192, 5280, 1, 2048]
    - [23, 49.38]
  - - [8192, 5376, 1, 2048]
    - [23, 49.75]
  - - [8192, 5472, 1, 2048]
    - [18, 49.15]
  - - [8192, 5568, 1, 2048]
    - [12, 52.01]
  - - [8192, 5664, 1, 2048]
    - [12, 52.44]
  - - [8192, 5760, 1, 2048]
    - [23, 49.5]
  - - [8192, 5856, 1, 2048]
    - [24, 48.99]
  - - [8192, 5952, 1, 2048]
    - [23, 49.09]
  - - [8192, 6048, 1, 2048]
    - [23, 49.48]
  - - [8192, 6144, 1, 2048]
    - [18, 49.0]
  - - [8192, 6240, 1, 2048]
    - [18, 56.41]
  - - [8192, 6336, 1, 2048]
    - [19, 56.04]
  - - [8192, 6432, 1, 2048]
    - [23, 49.82]
  - - [8192, 6528, 1, 2048]
    - [21, 51.05]
  - - [8192, 6624, 1, 2048]
    - [23, 49.66]
  - - [8192, 6720, 1, 2048]
    - [23, 50.07]
  - - [8192, 6816, 1, 2048]
    - [12, 55.03]
  - - [8192, 6912, 1, 2048]
    - [23, 50.07]
  - - [8192, 7008, 1, 2048]
    - [24, 49.71]
  - - [8192, 7104, 1, 2048]
    - [23, 50.14]
  - - [8192, 7200, 1, 2048]
    - [23, 49.63]
  - - [8192, 7296, 1, 2048]
    - [24, 49.25]
  - - [8192, 7392, 1, 2048]
    - [19, 55.81]
  - - [8192, 7488, 1, 2048]
    - [19, 56.78]
  - - [8192, 7584, 1, 2048]
    - [23, 49.25]
  - - [8192, 7680, 1, 2048]
    - [18, 49.94]
  - - [8192, 7776, 1, 2048]
    - [23, 49.08]
  - - [8192, 7872, 1, 2048]
    - [23, 49.78]
  - - [8192, 7968, 1, 2048]
    - [12, 49.69]
  - - [8192, 8064, 1, 2048]
    - [23, 49.84]
  - - [8192, 8160, 1, 2048]
    - [18, 49.55]
  - - [8192, 8256, 1, 2048]
    - [23, 50.11]
  - - [32064, 1, 1, 8192]
    - [28, 0.43]
  - - [32064, 96, 1, 8192]
    - [21, 35.05]
  - - [32064, 192, 1, 8192]
    - [4, 47.4]
  - - [32064, 288, 1, 8192]
    - [8, 41.57]
  - - [2560, 1, 1, 8192]
    - [29, 0.44]
  - - [2560, 96, 1, 8192]
    - [24, 21.04]
  - - [2560, 192, 1, 8192]
    - [30, 28.58]
  - - [2560, 288, 1, 8192]
    - [21, 34.88]
  - - [2560, 384, 1, 8192]
    - [23, 41.89]
  - - [2560, 480, 1, 8192]
    - [21, 41.12]
  - - [2560, 576, 1, 8192]
    - [31, 43.41]
  - - [2560, 672, 1, 8192]
    - [21, 49.9]
  - - [2560, 768, 1, 8192]
    - [23, 48.1]
  - - [2560, 864, 1, 8192]
    - [18, 54.86]
  - - [2560, 960, 1, 8192]
    - [23, 44.4]
  - - [2560, 1056, 1, 8192]
    - [23, 49.36]
  - - [2560, 1152, 1, 8192]
    - [24, 52.22]
  - - [2560, 1248, 1, 8192]
    - [20, 47.7]
  - - [2560, 1344, 1, 8192]
    - [21, 50.66]
  - - [2560, 1440, 1, 8192]
    - [23, 48.2]
  - - [2560, 1536, 1, 8192]
    - [23, 50.49]
  - - [2560, 1632, 1, 8192]
    - [32, 45.3]
  - - [2560, 1728, 1, 8192]
    - [24, 45.98]
  - - [2560, 1824, 1, 8192]
    - [33, 47.13]
  - - [2560, 1920, 1, 8192]
    - [24, 49.89]
  - - [2560, 2016, 1, 8192]
    - [8, 50.17]
  - - [2560, 2112, 1, 8192]
    - [14, 55.71]
  - - [2560, 2208, 1, 8192]
    - [24, 58.27]
  - - [2560, 2304, 1, 8192]
    - [14, 52.12]
  - - [2560, 2400, 1, 8192]
    - [24, 50.92]
  - - [2560, 2496, 1, 8192]
    - [23, 50.27]
  - - [2560, 2592, 1, 8192]
    - [21, 45.48]
  - - [2560, 2688, 1, 8192]
    - [20, 52.86]
  - - [2560, 2784, 1, 8192]
    - [24, 49.54]
  - - [2560, 2880, 1, 8192]
    - [21, 49.05]
  - - [2560, 2976, 1, 8192]
    - [18, 53.39]
  - - [2560, 3072, 1, 8192]
    - [15, 53.22]
  - - [2560, 3168, 1, 8192]
    - [23, 48.66]
  - - [2560, 3264, 1, 8192]
    - [9, 50.08]
  - - [2560, 3360, 1, 8192]
    - [6, 50.29]
  - - [2560, 3456, 1, 8192]
    - [9, 52.45]
  - - [2560, 3552, 1, 8192]
    - [11, 47.67]
  - - [2560, 3648, 1, 8192]
    - [23, 51.34]
  - - [2560, 3744, 1, 8192]
    - [23, 47.04]
  - - [2560, 3840, 1, 8192]
    - [18, 51.63]
  - - [2560, 3936, 1, 8192]
    - [23, 49.47]
  - - [2560, 4032, 1, 8192]
    - [19, 49.58]
  - - [2560, 4128, 1, 8192]
    - [15, 48.83]
  - - [2560, 4224, 1, 8192]
    - [9, 49.85]
  - - [2560, 4320, 1, 8192]
    - [8, 46.83]
  - - [2560, 4416, 1, 8192]
    - [8, 47.23]
  - - [2560, 4512, 1, 8192]
    - [18, 48.1]
  - - [2560, 4608, 1, 8192]
    - [23, 49.39]
  - - [2560, 4704, 1, 8192]
    - [24, 47.78]
  - - [2560, 4800, 1, 8192]
    - [24, 50.92]
  - - [2560, 4896, 1, 8192]
    - [7, 43.69]
  - - [2560, 4992, 1, 8192]
    - [1, 44.51]
  - - [2560, 5088, 1, 8192]
    - [2, 49.69]
  - - [2560, 5184, 1, 8192]
    - [23, 50.21]
  - - [2560, 5280, 1, 8192]
    - [23, 48.66]
  - - [2560, 5376, 1, 8192]
    - [15, 44.36]
  - - [2560, 5472, 1, 8192]
    - [23, 51.95]
  - - [2560, 5568, 1, 8192]
    - [6, 47.45]
  - - [2560, 5664, 1, 8192]
    - [9, 47.13]
  - - [2560, 5760, 1, 8192]
    - [24, 49.34]
  - - [2560, 5856, 1, 8192]
    - [19, 48.5]
  - - [2560, 5952, 1, 8192]
    - [18, 48.07]
  - - [2560, 6048, 1, 8192]
    - [24, 48.0]
  - - [2560, 6144, 1, 8192]
    - [24, 48.06]
  - - [2560, 6240, 1, 8192]
    - [23, 49.99]
  - - [2560, 6336, 1, 8192]
    - [18, 48.4]
  - - [2560, 6432, 1, 8192]
    - [18, 47.79]
  - - [2560, 6528, 1, 8192]
    - [19, 48.37]
  - - [2560, 6624, 1, 8192]
    - [9, 47.73]
  - - [2560, 6720, 1, 8192]
    - [9, 45.32]
  - - [2560, 6816, 1, 8192]
    - [18, 48.12]
  - - [2560, 6912, 1, 8192]
    - [23, 49.72]
  - - [2560, 7008, 1, 8192]
    - [19, 48.46]
  - - [2560, 7104, 1, 8192]
    - [23, 49.75]
  - - [2560, 7200, 1, 8192]
    - [18, 48.83]
  - - [2560, 7296, 1, 8192]
    - [18, 49.69]
  - - [2560, 7392, 1, 8192]
    - [23, 49.37]
  - - [2560, 7488, 1, 8192]
    - [8, 49.26]
  - - [2560, 7584, 1, 8192]
    - [23, 50.25]
  - - [2560, 7680, 1, 8192]
    - [11, 46.83]
  - - [2560, 7776, 1, 8192]
    - [14, 48.77]
  - - [2560, 7872, 1, 8192]
    - [23, 51.42]
  - - [2560, 7968, 1, 8192]
    - [23, 50.23]
  - - [2560, 8064, 1, 8192]
    - [23, 50.33]
  - - [2560, 8160, 1, 8192]
    - [18, 49.94]
  - - [2560, 8256, 1, 8192]
    - [12, 49.94]
  - - [14336, 1, 1, 8192]
    - [34, 0.41]
  - - [14336, 96, 1, 8192]
    - [24, 34.88]
  - - [14336, 192, 1, 8192]
    - [15, 44.38]
  - - [14336, 288, 1, 8192]
    - [24, 45.27]
  - - [14336, 384, 1, 8192]
    - [6, 51.05]
  - - [14336, 480, 1, 8192]
    - [21, 51.22]
  - - [14336, 576, 1, 8192]
    - [23, 46.49]
  - - [14336, 672, 1, 8192]
    - [9, 49.64]
  - - [14336, 768, 1, 8192]
    - [18, 49.27]
  - - [14336, 864, 1, 8192]
    - [3, 45.67]
  - - [14336, 960, 1, 8192]
    - [14, 52.13]
  - - [14336, 1056, 1, 8192]
    - [9, 47.9]
  - - [14336, 1152, 1, 8192]
    - [9, 48.67]
  - - [14336, 1248, 1, 8192]
    - [24, 48.38]
  - - [14336, 1344, 1, 8192]
    - [24, 48.58]
  - - [14336, 1440, 1, 8192]
    - [24, 49.81]
  - - [14336, 1536, 1, 8192]
    - [18, 52.77]
  - - [14336, 1632, 1, 8192]
    - [19, 48.88]
  - - [14336, 1728, 1, 8192]
    - [24, 49.71]
  - - [14336, 1824, 1, 8192]
    - [24, 49.37]
  - - [14336, 1920, 1, 8192]
    - [19, 49.73]
  - - [14336, 2016, 1, 8192]
    - [9, 49.51]
  - - [14336, 2112, 1, 8192]
    - [23, 51.57]
  - - [14336, 2208, 1, 8192]
    - [23, 51.67]
  - - [14336, 2304, 1, 8192]
    - [19, 49.41]
  - - [14336, 2400, 1, 8192]
    - [19, 50.71]
  - - [14336, 2496, 1, 8192]
    - [14, 48.35]
  - - [14336, 2592, 1, 8192]
    - [6, 50.02]
  - - [14336, 2688, 1, 8192]
    - [18, 55.32]
  - - [14336, 2784, 1, 8192]
    - [18, 48.57]
  - - [14336, 2880, 1, 8192]
    - [14, 48.72]
  - - [14336, 2976, 1, 8192]
    - [23, 48.65]
  - - [14336, 3072, 1, 8192]
    - [18, 48.61]
  - - [14336, 3168, 1, 8192]
    - [18, 48.07]
  - - [14336, 3264, 1, 8192]
    - [14, 48.34]
  - - [14336, 3360, 1, 8192]
    - [9, 48.8]
  - - [14336, 3456, 1, 8192]
    - [14, 48.55]
  - - [14336, 3552, 1, 8192]
    - [23, 47.56]
  - - [14336, 3648, 1, 8192]
    - [14, 48.13]
  - - [14336, 3744, 1, 8192]
    - [23, 47.61]
  - - [14336, 3840, 1, 8192]
    - [14, 48.07]
  - - [14336, 3936, 1, 8192]
    - [18, 48.17]
  - - [14336, 4032, 1, 8192]
    - [14, 47.9]
  - - [14336, 4128, 1, 8192]
    - [23, 47.8]
  - - [14336, 4224, 1, 8192]
    - [18, 48.36]
  - - [14336, 4320, 1, 8192]
    - [23, 48.09]
  - - [14336, 4416, 1, 8192]
    - [14, 47.71]
  - - [14336, 4512, 1, 8192]
    - [18, 47.01]
  - - [14336, 4608, 1, 8192]
    - [14, 47.98]
  - - [14336, 4704, 1, 8192]
    - [23, 47.63]
  - - [14336, 4800, 1, 8192]
    - [14, 47.57]
  - - [14336, 4896, 1, 8192]
    - [23, 47.34]
  - - [14336, 4992, 1, 8192]
    - [14, 47.27]
  - - [14336, 5088, 1, 8192]
    - [18, 47.51]
  - - [14336, 5184, 1, 8192]
    - [23, 47.29]
  - - [14336, 5280, 1, 8192]
    - [23, 47.4]
  - - [14336, 5376, 1, 8192]
    - [14, 47.45]
  - - [14336, 5472, 1, 8192]
    - [18, 47.5]
  - - [14336, 5568, 1, 8192]
    - [14, 47.42]
  - - [14336, 5664, 1, 8192]
    - [18, 46.95]
  - - [14336, 5760, 1, 8192]
    - [14, 47.18]
  - - [14336, 5856, 1, 8192]
    - [23, 46.85]
  - - [14336, 5952, 1, 8192]
    - [14, 47.32]
  - - [14336, 6048, 1, 8192]
    - [23, 47.23]
  - - [14336, 6144, 1, 8192]
    - [18, 47.1]
  - - [14336, 6240, 1, 8192]
    - [18, 47.07]
  - - [14336, 6336, 1, 8192]
    - [23, 46.67]
  - - [14336, 6432, 1, 8192]
    - [23, 47.03]
  - - [14336, 6528, 1, 8192]
    - [23, 46.95]
  - - [14336, 6624, 1, 8192]
    - [18, 46.92]
  - - [14336, 6720, 1, 8192]
    - [14, 46.97]
  - - [14336, 6816, 1, 8192]
    - [23, 47.21]
  - - [14336, 6912, 1, 8192]
    - [14, 46.8]
  - - [14336, 7008, 1, 8192]
    - [18, 47.15]
  - - [14336, 7104, 1, 8192]
    - [23, 46.61]
  - - [14336, 7200, 1, 8192]
    - [23, 46.84]
  - - [14336, 7296, 1, 8192]
    - [14, 46.76]
  - - [14336, 7392, 1, 8192]
    - [18, 47.06]
  - - [14336, 7488, 1, 8192]
    - [14, 46.76]
  - - [14336, 7584, 1, 8192]
    - [23, 47.01]
  - - [14336, 7680, 1, 8192]
    - [18, 46.54]
  - - [14336, 7776, 1, 8192]
    - [18, 47.0]
  - - [14336, 7872, 1, 8192]
    - [14, 46.62]
  - - [14336, 7968, 1, 8192]
    - [18, 46.69]
  - - [14336, 8064, 1, 8192]
    - [18, 46.45]
  - - [14336, 8160, 1, 8192]
    - [18, 47.0]
  - - [14336, 8256, 1, 8192]
    - [23, 46.73]
  - - [8192, 1, 1, 3584]
    - [0, 0.58]
  - - [8192, 96, 1, 3584]
    - [21, 31.14]
  - - [8192, 192, 1, 3584]
    - [21, 40.54]
  - - [8192, 288, 1, 3584]
    - [24, 47.33]
  - - [8192, 384, 1, 3584]
    - [21, 44.69]
  - - [8192, 480, 1, 3584]
    - [23, 47.81]
  - - [8192, 576, 1, 3584]
    - [24, 51.33]
  - - [8192, 672, 1, 3584]
    - [23, 55.53]
  - - [8192, 768, 1, 3584]
    - [23, 50.48]
  - - [8192, 864, 1, 3584]
    - [23, 52.38]
  - - [8192, 960, 1, 3584]
    - [15, 53.06]
  - - [8192, 1056, 1, 3584]
    - [21, 52.62]
  - - [8192, 1152, 1, 3584]
    - [23, 53.86]
  - - [8192, 1248, 1, 3584]
    - [24, 53.49]
  - - [8192, 1344, 1, 3584]
    - [18, 56.86]
  - - [8192, 1440, 1, 3584]
    - [23, 54.07]
  - - [8192, 1536, 1, 3584]
    - [18, 53.54]
  - - [8192, 1632, 1, 3584]
    - [18, 54.59]
  - - [8192, 1728, 1, 3584]
    - [23, 54.24]
  - - [8192, 1824, 1, 3584]
    - [23, 51.39]
  - - [8192, 1920, 1, 3584]
    - [14, 51.43]
  - - [8192, 2016, 1, 3584]
    - [14, 51.26]
  - - [8192, 2112, 1, 3584]
    - [14, 58.97]
  - - [8192, 2208, 1, 3584]
    - [24, 51.82]
  - - [8192, 2304, 1, 3584]
    - [18, 51.66]
  - - [8192, 2400, 1, 3584]
    - [23, 58.8]
  - - [8192, 2496, 1, 3584]
    - [18, 49.19]
  - - [8192, 2592, 1, 3584]
    - [14, 48.18]
  - - [8192, 2688, 1, 3584]
    - [19, 55.74]
  - - [8192, 2784, 1, 3584]
    - [19, 51.89]
  - - [8192, 2880, 1, 3584]
    - [19, 49.64]
  - - [8192, 2976, 1, 3584]
    - [20, 51.72]
  - - [8192, 3072, 1, 3584]
    - [23, 48.33]
  - - [8192, 3168, 1, 3584]
    - [14, 50.81]
  - - [8192, 3264, 1, 3584]
    - [15, 51.54]
  - - [8192, 3360, 1, 3584]
    - [11, 51.71]
  - - [8192, 3456, 1, 3584]
    - [14, 48.09]
  - - [8192, 3552, 1, 3584]
    - [23, 52.16]
  - - [8192, 3648, 1, 3584]
    - [18, 49.52]
  - - [8192, 3744, 1, 3584]
    - [15, 51.49]
  - - [8192, 3840, 1, 3584]
    - [15, 52.65]
  - - [8192, 3936, 1, 3584]
    - [19, 50.44]
  - - [8192, 4032, 1, 3584]
    - [19, 54.42]
  - - [8192, 4128, 1, 3584]
    - [23, 55.67]
  - - [8192, 4224, 1, 3584]
    - [23, 50.48]
  - - [8192, 4320, 1, 3584]
    - [15, 52.07]
  - - [8192, 4416, 1, 3584]
    - [14, 54.89]
  - - [8192, 4512, 1, 3584]
    - [12, 50.17]
  - - [8192, 4608, 1, 3584]
    - [23, 49.39]
  - - [8192, 4704, 1, 3584]
    - [23, 50.27]
  - - [8192, 4800, 1, 3584]
    - [23, 49.54]
  - - [8192, 4896, 1, 3584]
    - [19, 50.52]
  - - [8192, 4992, 1, 3584]
    - [18, 52.01]
  - - [8192, 5088, 1, 3584]
    - [19, 50.74]
  - - [8192, 5184, 1, 3584]
    - [19, 50.51]
  - - [8192, 5280, 1, 3584]
    - [18, 49.15]
  - - [8192, 5376, 1, 3584]
    - [23, 49.72]
  - - [8192, 5472, 1, 3584]
    - [23, 49.72]
  - - [8192, 5568, 1, 3584]
    - [12, 53.02]
  - - [8192, 5664, 1, 3584]
    - [23, 50.14]
  - - [8192, 5760, 1, 3584]
    - [23, 49.72]
  - - [8192, 5856, 1, 3584]
    - [23, 50.61]
  - - [8192, 5952, 1, 3584]
    - [23, 50.02]
  - - [8192, 6048, 1, 3584]
    - [23, 50.09]
  - - [8192, 6144, 1, 3584]
    - [23, 50.13]
  - - [8192, 6240, 1, 3584]
    - [19, 53.64]
  - - [8192, 6336, 1, 3584]
    - [18, 54.17]
  - - [8192, 6432, 1, 3584]
    - [23, 49.87]
  - - [8192, 6528, 1, 3584]
    - [23, 51.17]
  - - [8192, 6624, 1, 3584]
    - [18, 50.21]
  - - [8192, 6720, 1, 3584]
    - [23, 50.66]
  - - [8192, 6816, 1, 3584]
    - [11, 52.59]
  - - [8192, 6912, 1, 3584]
    - [23, 51.11]
  - - [8192, 7008, 1, 3584]
    - [23, 50.62]
  - - [8192, 7104, 1, 3584]
    - [23, 50.63]
  - - [8192, 7200, 1, 3584]
    - [18, 49.88]
  - - [8192, 7296, 1, 3584]
    - [18, 51.05]
  - - [8192, 7392, 1, 3584]
    - [18, 55.54]
  - - [8192, 7488, 1, 3584]
    - [18, 55.04]
  - - [8192, 7584, 1, 3584]
    - [23, 50.89]
  - - [8192, 7680, 1, 3584]
    - [18, 51.0]
  - - [8192, 7776, 1, 3584]
    - [24, 50.08]
  - - [8192, 7872, 1, 3584]
    - [18, 50.16]
  - - [8192, 7968, 1, 3584]
    - [11, 53.02]
  - - [8192, 8064, 1, 3584]
    - [23, 50.66]
  - - [8192, 8160, 1, 3584]
    - [23, 50.01]
  - - [8192, 8256, 1, 3584]
    - [18, 49.8]
  - - [8192, 1, 1, 1024]
    - [35, 0.25]
  - - [8192, 96, 1, 1024]
    - [17, 16.64]
  - - [8192, 192, 1, 1024]
    - [14, 25.64]
  - - [8192, 288, 1, 1024]
    - [24, 28.84]
  - - [8192, 384, 1, 1024]
    - [20, 32.92]
  - - [8192, 480, 1, 1024]
    - [21, 34.46]
  - - [8192, 576, 1, 1024]
    - [15, 38.36]
  - - [8192, 672, 1, 1024]
    - [23, 42.97]
  - - [8192, 768, 1, 1024]
    - [23, 38.7]
  - - [8192, 864, 1, 1024]
    - [24, 40.12]
  - - [8192, 960, 1, 1024]
    - [23, 44.44]
  - - [8192, 1056, 1, 1024]
    - [21, 44.15]
  - - [8192, 1152, 1, 1024]
    - [21, 43.21]
  - - [8192, 1248, 1, 1024]
    - [18, 46.29]
  - - [8192, 1344, 1, 1024]
    - [18, 48.42]
  - - [8192, 1440, 1, 1024]
    - [19, 44.89]
  - - [8192, 1536, 1, 1024]
    - [18, 48.19]
  - - [8192, 1632, 1, 1024]
    - [19, 49.7]
  - - [8192, 1728, 1, 1024]
    - [24, 44.66]
  - - [8192, 1824, 1, 1024]
    - [24, 51.36]
  - - [8192, 1920, 1, 1024]
    - [21, 47.94]
  - - [8192, 2016, 1, 1024]
    - [15, 50.83]
  - - [8192, 2112, 1, 1024]
    - [15, 53.12]
  - - [8192, 2208, 1, 1024]
    - [12, 48.38]
  - - [8192, 2304, 1, 1024]
    - [23, 45.57]
  - - [8192, 2400, 1, 1024]
    - [23, 52.53]
  - - [8192, 2496, 1, 1024]
    - [18, 51.83]
  - - [8192, 2592, 1, 1024]
    - [19, 50.08]
  - - [8192, 2688, 1, 1024]
    - [24, 52.58]
  - - [8192, 2784, 1, 1024]
    - [19, 54.3]
  - - [8192, 2880, 1, 1024]
    - [20, 46.73]
  - - [8192, 2976, 1, 1024]
    - [24, 54.82]
  - - [8192, 3072, 1, 1024]
    - [21, 46.87]
  - - [8192, 3168, 1, 1024]
    - [15, 53.13]
  - - [8192, 3264, 1, 1024]
    - [12, 54.35]
  - - [8192, 3360, 1, 1024]
    - [12, 51.01]
  - - [8192, 3456, 1, 1024]
    - [36, 46.82]
  - - [8192, 3552, 1, 1024]
    - [24, 54.55]
  - - [8192, 3648, 1, 1024]
    - [18, 51.68]
  - - [8192, 3744, 1, 1024]
    - [19, 54.61]
  - - [8192, 3840, 1, 1024]
    - [18, 54.64]
  - - [8192, 3936, 1, 1024]
    - [18, 55.81]
  - - [8192, 4032, 1, 1024]
    - [19, 49.78]
  - - [8192, 4128, 1, 1024]
    - [24, 55.81]
  - - [8192, 4224, 1, 1024]
    - [37, 47.53]
  - - [8192, 4320, 1, 1024]
    - [15, 53.47]
  - - [8192, 4416, 1, 1024]
    - [15, 53.87]
  - - [8192, 4512, 1, 1024]
    - [12, 51.15]
  - - [8192, 4608, 1, 1024]
    - [23, 46.59]
  - - [8192, 4704, 1, 1024]
    - [20, 49.42]
  - - [8192, 4800, 1, 1024]
    - [21, 49.41]
  - - [8192, 4896, 1, 1024]
    - [19, 52.55]
  - - [8192, 4992, 1, 1024]
    - [18, 54.5]
  - - [8192, 5088, 1, 1024]
    - [12, 54.84]
  - - [8192, 5184, 1, 1024]
    - [19, 55.05]
  - - [8192, 5280, 1, 1024]
    - [33, 46.91]
  - - [8192, 5376, 1, 1024]
    - [38, 47.26]
  - - [8192, 5472, 1, 1024]
    - [23, 46.03]
  - - [8192, 5568, 1, 1024]
    - [12, 52.78]
  - - [8192, 5664, 1, 1024]
    - [12, 53.43]
  - - [8192, 5760, 1, 1024]
    - [23, 45.55]
  - - [8192, 5856, 1, 1024]
    - [33, 45.84]
  - - [8192, 5952, 1, 1024]
    - [23, 46.0]
  - - [8192, 6048, 1, 1024]
    - [23, 46.56]
  - - [8192, 6144, 1, 1024]
    - [19, 45.64]
  - - [8192, 6240, 1, 1024]
    - [18, 54.67]
  - - [8192, 6336, 1, 1024]
    - [19, 55.32]
  - - [8192, 6432, 1, 1024]
    - [24, 45.77]
  - - [8192, 6528, 1, 1024]
    - [21, 49.95]
  - - [8192, 6624, 1, 1024]
    - [39, 48.56]
  - - [8192, 6720, 1, 1024]
    - [39, 48.65]
  - - [8192, 6816, 1, 1024]
    - [12, 54.81]
  - - [8192, 6912, 1, 1024]
    - [39, 47.81]
  - - [8192, 7008, 1, 1024]
    - [38, 47.79]
  - - [8192, 7104, 1, 1024]
    - [38, 48.94]
  - - [8192, 7200, 1, 1024]
    - [24, 46.1]
  - - [8192, 7296, 1, 1024]
    - [23, 45.5]
  - - [8192, 7392, 1, 1024]
    - [12, 52.66]
  - - [8192, 7488, 1, 1024]
    - [19, 55.55]
  - - [8192, 7584, 1, 1024]
    - [23, 45.65]
  - - [8192, 7680, 1, 1024]
    - [23, 46.04]
  - - [8192, 7776, 1, 1024]
    - [23, 45.99]
  - - [8192, 7872, 1, 1024]
    - [23, 45.5]
  - - [8192, 7968, 1, 1024]
    - [12, 53.63]
  - - [8192, 8064, 1, 1024]
    - [24, 45.48]
  - - [8192, 8160, 1, 1024]
    - [23, 45.52]
  - - [8192, 8256, 1, 1024]
    - [37, 48.09]
  - - [7168, 1, 1, 8192]
    - [40, 0.39]
  - - [7168, 96, 1, 8192]
    - [21, 27.66]
  - - [7168, 192, 1, 8192]
    - [24, 39.47]
  - - [7168, 288, 1, 8192]
    - [24, 46.88]
  - - [7168, 384, 1, 8192]
    - [15, 47.59]
  - - [7168, 480, 1, 8192]
    - [21, 51.17]
  - - [7168, 576, 1, 8192]
    - [24, 51.6]
  - - [7168, 672, 1, 8192]
    - [15, 48.82]
  - - [7168, 768, 1, 8192]
    - [19, 57.0]
  - - [7168, 864, 1, 8192]
    - [19, 51.42]
  - - [7168, 960, 1, 8192]
    - [20, 49.53]
  - - [7168, 1056, 1, 8192]
    - [24, 51.03]
  - - [7168, 1152, 1, 8192]
    - [19, 52.34]
  - - [7168, 1248, 1, 8192]
    - [8, 47.66]
  - - [7168, 1344, 1, 8192]
    - [12, 48.75]
  - - [7168, 1440, 1, 8192]
    - [24, 47.94]
  - - [7168, 1536, 1, 8192]
    - [9, 50.48]
  - - [7168, 1632, 1, 8192]
    - [24, 56.1]
  - - [7168, 1728, 1, 8192]
    - [9, 47.96]
  - - [7168, 1824, 1, 8192]
    - [7, 49.14]
  - - [7168, 1920, 1, 8192]
    - [18, 54.45]
  - - [7168, 2016, 1, 8192]
    - [19, 46.95]
  - - [7168, 2112, 1, 8192]
    - [14, 47.28]
  - - [7168, 2208, 1, 8192]
    - [24, 45.74]
  - - [7168, 2304, 1, 8192]
    - [7, 50.44]
  - - [7168, 2400, 1, 8192]
    - [18, 51.49]
  - - [7168, 2496, 1, 8192]
    - [23, 45.71]
  - - [7168, 2592, 1, 8192]
    - [14, 46.35]
  - - [7168, 2688, 1, 8192]
    - [24, 48.26]
  - - [7168, 2784, 1, 8192]
    - [19, 46.23]
  - - [7168, 2880, 1, 8192]
    - [23, 47.11]
  - - [7168, 2976, 1, 8192]
    - [15, 48.63]
  - - [7168, 3072, 1, 8192]
    - [24, 50.68]
  - - [7168, 3168, 1, 8192]
    - [19, 46.62]
  - - [7168, 3264, 1, 8192]
    - [23, 53.38]
  - - [7168, 3360, 1, 8192]
    - [23, 47.63]
  - - [7168, 3456, 1, 8192]
    - [24, 49.03]
  - - [7168, 3552, 1, 8192]
    - [23, 48.03]
  - - [7168, 3648, 1, 8192]
    - [14, 47.98]
  - - [7168, 3744, 1, 8192]
    - [23, 47.7]
  - - [7168, 3840, 1, 8192]
    - [24, 49.29]
  - - [7168, 3936, 1, 8192]
    - [18, 48.66]
  - - [7168, 4032, 1, 8192]
    - [24, 49.2]
  - - [7168, 4128, 1, 8192]
    - [24, 49.73]
  - - [7168, 4224, 1, 8192]
    - [15, 50.44]
  - - [7168, 4320, 1, 8192]
    - [23, 49.27]
  - - [7168, 4416, 1, 8192]
    - [24, 50.0]
  - - [7168, 4512, 1, 8192]
    - [24, 49.97]
  - - [7168, 4608, 1, 8192]
    - [24, 50.95]
  - - [7168, 4704, 1, 8192]
    - [24, 49.25]
  - - [7168, 4800, 1, 8192]
    - [19, 52.55]
  - - [7168, 4896, 1, 8192]
    - [24, 51.18]
  - - [7168, 4992, 1, 8192]
    - [18, 48.92]
  - - [7168, 5088, 1, 8192]
    - [8, 50.56]
  - - [7168, 5184, 1, 8192]
    - [24, 49.27]
  - - [7168, 5280, 1, 8192]
    - [24, 49.16]
  - - [7168, 5376, 1, 8192]
    - [18, 54.57]
  - - [7168, 5472, 1, 8192]
    - [23, 49.6]
  - - [7168, 5568, 1, 8192]
    - [8, 50.6]
  - - [7168, 5664, 1, 8192]
    - [23, 48.73]
  - - [7168, 5760, 1, 8192]
    - [24, 49.07]
  - - [7168, 5856, 1, 8192]
    - [14, 48.22]
  - - [7168, 5952, 1, 8192]
    - [23, 48.53]
  - - [7168, 6048, 1, 8192]
    - [23, 53.05]
  - - [7168, 6144, 1, 8192]
    - [19, 49.28]
  - - [7168, 6240, 1, 8192]
    - [24, 50.52]
  - - [7168, 6336, 1, 8192]
    - [15, 48.34]
  - - [7168, 6432, 1, 8192]
    - [18, 50.47]
  - - [7168, 6528, 1, 8192]
    - [23, 48.27]
  - - [7168, 6624, 1, 8192]
    - [18, 48.04]
  - - [7168, 6720, 1, 8192]
    - [18, 47.46]
  - - [7168, 6816, 1, 8192]
    - [7, 48.45]
  - - [7168, 6912, 1, 8192]
    - [23, 48.44]
  - - [7168, 7008, 1, 8192]
    - [23, 48.24]
  - - [7168, 7104, 1, 8192]
    - [14, 47.58]
  - - [7168, 7200, 1, 8192]
    - [19, 48.0]
  - - [7168, 7296, 1, 8192]
    - [14, 47.85]
  - - [7168, 7392, 1, 8192]
    - [18, 47.39]
  - - [7168, 7488, 1, 8192]
    - [14, 47.99]
  - - [7168, 7584, 1, 8192]
    - [23, 47.45]
  - - [7168, 7680, 1, 8192]
    - [14, 47.86]
  - - [7168, 7776, 1, 8192]
    - [23, 47.79]
  - - [7168, 7872, 1, 8192]
    - [18, 47.44]
  - - [7168, 7968, 1, 8192]
    - [14, 47.23]
  - - [7168, 8064, 1, 8192]
    - [14, 47.59]
  - - [7168, 8160, 1, 8192]
    - [18, 48.0]
  - - [7168, 8256, 1, 8192]
    - [23, 47.91]
  - - [16032, 1, 1, 8192]
    - [41, 0.41]
  - - [16032, 96, 1, 8192]
    - [24, 30.02]
  - - [16032, 192, 1, 8192]
    - [21, 42.71]
  - - [16032, 288, 1, 8192]
    - [21, 44.57]
  - - [1280, 1, 1, 8192]
    - [29, 0.29]
  - - [1280, 96, 1, 8192]
    - [21, 17.56]
  - - [1280, 192, 1, 8192]
    - [33, 21.36]
  - - [1280, 288, 1, 8192]
    - [42, 25.78]
  - - [1280, 384, 1, 8192]
    - [33, 29.53]
  - - [1280, 480, 1, 8192]
    - [43, 30.68]
  - - [1280, 576, 1, 8192]
    - [44, 36.98]
  - - [1280, 672, 1, 8192]
    - [24, 37.35]
  - - [1280, 768, 1, 8192]
    - [24, 42.24]
  - - [1280, 864, 1, 8192]
    - [23, 47.15]
  - - [1280, 960, 1, 8192]
    - [45, 41.05]
  - - [1280, 1056, 1, 8192]
    - [44, 40.55]
  - - [1280, 1152, 1, 8192]
    - [46, 44.23]
  - - [1280, 1248, 1, 8192]
    - [20, 46.09]
  - - [1280, 1344, 1, 8192]
    - [23, 49.71]
  - - [1280, 1440, 1, 8192]
    - [18, 46.2]
  - - [1280, 1536, 1, 8192]
    - [18, 49.31]
  - - [1280, 1632, 1, 8192]
    - [18, 51.61]
  - - [1280, 1728, 1, 8192]
    - [24, 53.67]
  - - [1280, 1824, 1, 8192]
    - [23, 56.56]
  - - [1280, 1920, 1, 8192]
    - [23, 45.1]
  - - [1280, 2016, 1, 8192]
    - [23, 47.44]
  - - [1280, 2112, 1, 8192]
    - [23, 49.33]
  - - [1280, 2208, 1, 8192]
    - [24, 51.12]
  - - [1280, 2304, 1, 8192]
    - [23, 53.53]
  - - [1280, 2400, 1, 8192]
    - [46, 48.27]
  - - [1280, 2496, 1, 8192]
    - [21, 49.08]
  - - [1280, 2592, 1, 8192]
    - [21, 49.6]
  - - [1280, 2688, 1, 8192]
    - [18, 45.53]
  - - [1280, 2784, 1, 8192]
    - [18, 46.98]
  - - [1280, 2880, 1, 8192]
    - [24, 48.47]
  - - [1280, 2976, 1, 8192]
    - [23, 50.2]
  - - [1280, 3072, 1, 8192]
    - [18, 51.8]
  - - [1280, 3168, 1, 8192]
    - [23, 53.43]
  - - [1280, 3264, 1, 8192]
    - [47, 49.37]
  - - [1280, 3360, 1, 8192]
    - [46, 46.03]
  - - [1280, 3456, 1, 8192]
    - [23, 47.81]
  - - [1280, 3552, 1, 8192]
    - [36, 48.64]
  - - [1280, 3648, 1, 8192]
    - [23, 50.24]
  - - [1280, 3744, 1, 8192]
    - [20, 49.83]
  - - [1280, 3840, 1, 8192]
    - [23, 51.03]
  - - [1280, 3936, 1, 8192]
    - [23, 51.97]
  - - [1280, 4032, 1, 8192]
    - [18, 54.95]
  - - [1280, 4128, 1, 8192]
    - [18, 54.8]
  - - [1280, 4224, 1, 8192]
    - [18, 57.86]
  - - [1280, 4320, 1, 8192]
    - [19, 57.46]
  - - [1280, 4416, 1, 8192]
    - [23, 59.61]
  - - [1280, 4512, 1, 8192]
    - [23, 57.55]
  - - [1280, 4608, 1, 8192]
    - [15, 53.81]
  - - [1280, 4704, 1, 8192]
    - [15, 49.66]
  - - [1280, 4800, 1, 8192]
    - [9, 50.51]
  - - [1280, 4896, 1, 8192]
    - [23, 52.29]
  - - [1280, 4992, 1, 8192]
    - [23, 52.05]
  - - [1280, 5088, 1, 8192]
    - [24, 54.76]
  - - [1280, 5184, 1, 8192]
    - [21, 48.67]
  - - [1280, 5280, 1, 8192]
    - [48, 47.5]
  - - [1280, 5376, 1, 8192]
    - [12, 47.97]
  - - [1280, 5472, 1, 8192]
    - [9, 48.18]
  - - [1280, 5568, 1, 8192]
    - [9, 49.91]
  - - [1280, 5664, 1, 8192]
    - [9, 51.56]
  - - [1280, 5760, 1, 8192]
    - [24, 48.71]
  - - [1280, 5856, 1, 8192]
    - [24, 52.62]
  - - [1280, 5952, 1, 8192]
    - [24, 53.12]
  - - [1280, 6048, 1, 8192]
    - [8, 53.24]
  - - [1280, 6144, 1, 8192]
    - [15, 54.51]
  - - [1280, 6240, 1, 8192]
    - [23, 56.44]
  - - [1280, 6336, 1, 8192]
    - [8, 54.12]
  - - [1280, 6432, 1, 8192]
    - [24, 50.2]
  - - [1280, 6528, 1, 8192]
    - [23, 52.23]
  - - [1280, 6624, 1, 8192]
    - [24, 52.35]
  - - [1280, 6720, 1, 8192]
    - [24, 52.41]
  - - [1280, 6816, 1, 8192]
    - [24, 52.81]
  - - [1280, 6912, 1, 8192]
    - [8, 52.86]
  - - [1280, 7008, 1, 8192]
    - [24, 50.77]
  - - [1280, 7104, 1, 8192]
    - [4, 48.73]
  - - [1280, 7200, 1, 8192]
    - [12, 48.68]
  - - [1280, 7296, 1, 8192]
    - [9, 49.24]
  - - [1280, 7392, 1, 8192]
    - [24, 54.07]
  - - [1280, 7488, 1, 8192]
    - [37, 48.59]
  - - [1280, 7584, 1, 8192]
    - [23, 51.66]
  - - [1280, 7680, 1, 8192]
    - [24, 47.92]
  - - [1280, 7776, 1, 8192]
    - [18, 50.8]
  - - [1280, 7872, 1, 8192]
    - [11, 50.06]
  - - [1280, 7968, 1, 8192]
    - [8, 47.02]
  - - [1280, 8064, 1, 8192]
    - [12, 48.79]
  - - [1280, 8160, 1, 8192]
    - [9, 53.53]
  - - [1280, 8256, 1, 8192]
    - [4, 47.43]
- null
- null
- ExperimentalStreamK
- GridBased
