projects/hipblaslt/library/src/amd_detail/rocblaslt/src/Tensile/Logic/asm_full/gfx1151/GridBased/gfx1151_Cijk_Alik_Bljk_HHS_BH_Bias_HAS_SAV_UserArgs.yaml
- {MinimumRequiredVersion: 5.0.0}
- gfx1151
- gfx1151
- [Device 1536]
    SolutionIndex: 0
    SolutionNameMin: Cijk_Alik_Bljk_HHS_BH_Bias_HAS_SAV_UserArgs_MT192x64x32_MI16x16x1_SN_LDSB0_GRVWA8_GRVWB8_GSU1_GSUC0_GSUWGMRR0_K1_LBSPPA128_LBSPPB128_MIWT3_4_NLCA1_NLCB1_PGR2_SS0_SU32_SUM0_SUS256_TLDS1_WG64_2_1_WGM8_WGMXCC1_WGMXCCGn1
    SolutionIndex: 3
    SolutionNameMin: Cijk_Alik_Bljk_HHS_BH_Bias_HAS_SAV_UserArgs_MT128x48x32_MI16x16x1_SN_LDSB0_GRVWA8_GRVWB2_GSU1_GSUC0_GSUWGMRR0_K1_LBSPPA128_LBSPPB128_MIWT2_3_NLCA1_NLCB1_PGR2_SS1_SU32_SUM0_SUS256_TLDS1_WG64_2_1_WGM8_WGMXCC1_WGMXCCGn1
    SolutionIndex: 4
    SolutionNameMin: Cijk_Alik_Bljk_HHS_BH_Bias_HAS_SAV_UserArgs_MT64x192x32_MI16x16x1_SN_LDSB0_GRVWA8_GRVWB2_GSU1_GSUC0_GSUWGMRR0_K1_LBSPPA128_LBSPPB128_MIWT4_3_NLCA1_NLCB1_PGR2_SS1_SU32_SUM0_SUS256_TLDS1_WG16_8_1_WGM8_WGMXCC1_WGMXCCGn1
    SolutionIndex: 5
    SolutionNameMin: Cijk_Alik_Bljk_HHS_BH_Bias_HAS_SAV_UserArgs_MT80x128x32_MI16x16x1_SN_LDSB0_GRVWA2_GRVWB2_GSU1_GSUC0_GSUWGMRR0_K1_LBSPPA128_LBSPPB128_MIWT5_2_NLCA1_NLCB1_PGR2_SS1_SU32_SUM0_SUS256_TLDS1_WG16_8_1_WGM8_WGMXCC1_WGMXCCGn1
    SolutionIndex: 6
    SolutionNameMin: Cijk_Alik_Bljk_HHS_BH_Bias_HAS_SAV_UserArgs_MT96x128x32_MI16x16x1_SN_LDSB0_GRVWA2_GRVWB8_GSU1_GSUC0_GSUWGMRR0_K1_LBSPPA128_LBSPPB128_MIWT3_4_NLCA1_NLCB1_PGR2_SS1_SU32_SUM0_SUS256_TLDS1_WG32_4_1_WGM8_WGMXCC1_WGMXCCGn1
    SolutionIndex: 7
    SolutionNameMin: Cijk_Alik_Bljk_HHS_BH_Bias_HAS_SAV_UserArgs_MT96x128x32_MI16x16x1_SN_LDSB0_GRVWA8_GRVWB8_GSU1_GSUC0_GSUWGMRR0_K1_LBSPPA128_LBSPPB128_MIWT3_4_NLCA1_NLCB1_PGR2_SS1_SU32_SUM0_SUS256_TLDS1_WG32_4_1_WGM8_WGMXCC1_WGMXCCGn1
    SolutionIndex: 8
    SolutionNameMin: Cijk_Alik_Bljk_HHS_BH_Bias_HAS_SAV_UserArgs_MT128x96x32_MI16x16x1_SN_LDSB0_GRVWA8_GRVWB8_GSU1_GSUC0_GSUWGMRR0_K1_LBSPPA128_LBSPPB128_MIWT4_3_NLCA1_NLCB1_PGR2_SS1_SU32_SUM0_SUS256_TLDS1_WG32_4_1_WGM8_WGMXCC1_WGMXCCGn1
    SolutionIndex: 9
    SolutionNameMin: Cijk_Alik_Bljk_HHS_BH_Bias_HAS_SAV_UserArgs_MT128x96x32_MI16x16x1_SN_LDSB0_GRVWA8_GRVWB8_GSU2_GSUC0_GSUWGMRR0_K1_LBSPPA128_LBSPPB128_MIWT4_3_NLCA1_NLCB1_PGR2_SS1_SU32_SUM0_SUS256_TLDS1_WG32_4_1_WGM8_WGMXCC1_WGMXCCGn1
    SolutionIndex: 10
    SolutionNameMin: Cijk_Alik_Bljk_HHS_BH_Bias_HAS_SAV_UserArgs_MT64x192x32_MI16x16x1_SN_LDSB1_GRVWA8_GRVWB8_GSU2_GSUC0_GSUWGMRR0_K1_LBSPPA128_LBSPPB128_MIWT4_3_NLCA1_NLCB1_PGR2_SS1_SU32_SUM0_SUS256_TLDS1_WG16_8_1_WGM8_WGMXCC1_WGMXCCGn1
    SolutionIndex: 11
    SolutionNameMin: Cijk_Alik_Bljk_HHS_BH_Bias_HAS_SAV_UserArgs_MT96x128x32_MI16x16x1_SN_LDSB1_GRVWA8_GRVWB8_GSU2_GSUC0_GSUWGMRR0_K1_LBSPPA128_LBSPPB128_MIWT3_4_NLCA1_NLCB1_PGR2_SS1_SU32_SUM0_SUS256_TLDS1_WG32_4_1_WGM8_WGMXCC1_WGMXCCGn1
    SolutionIndex: 12
    SolutionNameMin: Cijk_Alik_Bljk_HHS_BH_Bias_HAS_SAV_UserArgs_MT96x128x32_MI16x16x1_SN_LDSB1_GRVWA2_GRVWB8_GSU4_GSUC0_GSUWGMRR0_K1_LBSPPA128_LBSPPB128_MIWT3_4_NLCA1_NLCB1_PGR2_SS1_SU32_SUM0_SUS256_TLDS1_WG32_4_1_WGM8_WGMXCC1_WGMXCCGn1
    SolutionIndex: 13
    SolutionNameMin: Cijk_Alik_Bljk_HHS_BH_Bias_HAS_SAV_UserArgs_MT160x64x32_MI16x16x1_SN_LDSB1_GRVWA8_GRVWB8_GSU1_GSUC0_GSUWGMRR0_K1_LBSPPA128_LBSPPB128_MIWT5_2_NLCA1_NLCB1_PGR2_SS1_SU32_SUM0_SUS256_TLDS1_WG32_4_1_WGM8_WGMXCC1_WGMXCCGn1
    SolutionIndex: 14
    SolutionNameMin: Cijk_Alik_Bljk_HHS_BH_Bias_HAS_SAV_UserArgs_MT32x128x64_MI16x16x1_SN_LDSB0_GRVWA8_GRVWB8_GSU1_GSUC0_GSUWGMRR0_K1_LBSPPA128_LBSPPB128_MIWT2_2_NLCA1_NLCB1_PGR2_SS1_SU32_SUM0_SUS256_TLDS1_WG16_8_1_WGM8_WGMXCC1_WGMXCCGn1
    SolutionIndex: 15
    SolutionNameMin: Cijk_Alik_Bljk_HHS_BH_Bias_HAS_SAV_UserArgs_MT64x64x64_MI16x16x1_SN_LDSB0_GRVWA8_GRVWB8_GSU1_GSUC0_GSUWGMRR0_K1_LBSPPA128_LBSPPB128_MIWT2_2_NLCA1_NLCB1_PGR2_SS1_SU32_SUM0_SUS256_TLDS1_WG32_4_1_WGM8_WGMXCC1_WGMXCCGn1
    SolutionIndex: 16
    SolutionNameMin: Cijk_Alik_Bljk_HHS_BH_Bias_HAS_SAV_UserArgs_MT64x64x64_MI16x16x1_SN_LDSB0_GRVWA8_GRVWB8_GSU2_GSUC0_GSUWGMRR0_K1_LBSPPA128_LBSPPB128_MIWT2_2_NLCA1_NLCB1_PGR2_SS1_SU32_SUM0_SUS256_TLDS1_WG32_4_1_WGM8_WGMXCC1_WGMXCCGn1
    SolutionIndex: 17
    SolutionNameMin: Cijk_Alik_Bljk_HHS_BH_Bias_HAS_SAV_UserArgs_MT32x128x64_MI16x16x1_SN_LDSB1_GRVWA8_GRVWB8_GSU1_GSUC0_GSUWGMRR0_K1_LBSPPA128_LBSPPB128_MIWT2_2_NLCA1_NLCB1_PGR2_SS1_SU32_SUM0_SUS256_TLDS1_WG16_8_1_WGM8_WGMXCC1_WGMXCCGn1
    SolutionIndex: 18
    SolutionNameMin: Cijk_Alik_Bljk_HHS_BH_Bias_HAS_SAV_UserArgs_MT32x128x64_MI16x16x1_SN_LDSB1_GRVWA8_GRVWB8_GSU2_GSUC0_GSUWGMRR0_K1_LBSPPA128_LBSPPB128_MIWT2_2_NLCA1_NLCB1_PGR2_SS1_SU32_SUM0_SUS256_TLDS1_WG16_8_1_WGM8_WGMXCC1_WGMXCCGn1
    SolutionIndex: 19
    SolutionNameMin: Cijk_Alik_Bljk_HHS_BH_Bias_AuxH_HAS_SAV_UserArgs_MT32x32x32_MI16x16x1_SN_LDSB0_GRVWA1_GRVWB1_GSU1_LBSPPA128_LBSPPB128_MIWT1_1_SS0_SU32_SUM0_SUS256_TLDS1_WG32_4_1_WGM8
    SolutionIndex: 20
    SolutionNameMin: Cijk_Alik_Bljk_HHS_BH_Bias_AuxH_HAS_SAV_UserArgs_MT32x32x32_MI16x16x1_SN_LDSB0_GRVWA8_GRVWB1_GSU1_LBSPPA128_LBSPPB128_MIWT1_1_SS0_SU32_SUM0_SUS256_TLDS1_WG32_4_1_WGM8
    SolutionIndex: 21
    SolutionNameMin: Cijk_Alik_Bljk_HHS_BH_Bias_AuxH_HAS_SAV_UserArgs_MT64x16x64_MI16x16x1_SN_LDSB0_GRVWA1_GRVWB8_GSU1_LBSPPA128_LBSPPB128_MIWT1_1_SS0_SU32_SUM0_SUS256_TLDS1_WG64_2_1_WGM8
    SolutionIndex: 22
    SolutionNameMin: Cijk_Alik_Bljk_HHS_BH_Bias_AuxH_HAS_SAV_UserArgs_MT32x32x32_MI16x16x1_SN_LDSB0_GRVWA8_GRVWB8_GSU1_LBSPPA128_LBSPPB128_MIWT1_1_SS1_SU32_SUM0_SUS256_TLDS1_WG32_4_1_WGM8
    SolutionIndex: 23
    SolutionNameMin: Cijk_Alik_Bljk_HHS_BH_Bias_AuxH_HAS_SAV_UserArgs_MT64x16x32_MI16x16x1_SN_LDSB0_GRVWA8_GRVWB4_GSU1_LBSPPA2048_LBSPPB512_MIWT1_1_SS1_SU32_SUM0_SUS256_TLDS0_WG64_2_1_WGM8
    SolutionIndex: 24
    SolutionNameMin: Cijk_Alik_Bljk_HHS_BH_Bias_AuxH_HAS_SAV_UserArgs_MT16x64x32_MI16x16x1_SN_LDSB0_GRVWA4_GRVWB8_GSU1_LBSPPA512_LBSPPB2048_MIWT1_1_SS1_SU32_SUM0_SUS256_TLDS0_WG16_8_1_WGM8
    SolutionIndex: 25
    SolutionNameMin: Cijk_Alik_Bljk_HHS_BH_Bias_AuxH_HAS_SAV_UserArgs_MT16x64x64_MI16x16x1_SN_LDSB0_GRVWA8_GRVWB8_GSU1_LBSPPA512_LBSPPB2048_MIWT1_1_SS1_SU32_SUM0_SUS256_TLDS0_WG16_8_1_WGM8
    SolutionIndex: 26
    SolutionNameMin: Cijk_Alik_Bljk_HHS_BH_Bias_AuxH_HAS_SAV_UserArgs_MT32x32x32_MI16x16x1_SN_LDSB0_GRVWA8_GRVWB1_GSU1_LBSPPA128_LBSPPB128_MIWT1_1_SS1_SU32_SUM0_SUS256_TLDS1_WG32_4_1_WGM8
    SolutionIndex: 27
    SolutionNameMin: Cijk_Alik_Bljk_HHS_BH_Bias_AuxH_HAS_SAV_UserArgs_MT16x64x32_MI16x16x1_SN_LDSB0_GRVWA4_GRVWB1_GSU1_LBSPPA128_LBSPPB128_MIWT1_1_SS1_SU32_SUM0_SUS256_TLDS1_WG16_8_1_WGM8
    SolutionIndex: 28
    SolutionNameMin: Cijk_Alik_Bljk_HHS_BH_Bias_AuxH_HAS_SAV_UserArgs_MT32x32x64_MI16x16x1_SN_LDSB0_GRVWA8_GRVWB8_GSU1_LBSPPA1024_LBSPPB1024_MIWT1_1_SS1_SU32_SUM0_SUS256_TLDS0_WG32_4_1_WGM8
    SolutionIndex: 29
    SolutionNameMin: Cijk_Alik_Bljk_HHS_BH_Bias_AuxH_HAS_SAV_UserArgs_MT64x16x32_MI16x16x1_SN_LDSB0_GRVWA1_GRVWB1_GSU1_LBSPPA128_LBSPPB128_MIWT1_1_SS1_SU32_SUM0_SUS256_TLDS1_WG64_2_1_WGM8
    SolutionIndex: 30
    SolutionNameMin: Cijk_Alik_Bljk_HHS_BH_Bias_AuxH_HAS_SAV_UserArgs_MT32x64x32_MI16x16x1_SN_LDSB0_GRVWA1_GRVWB1_GSU1_LBSPPA128_LBSPPB128_MIWT2_1_SS1_SU32_SUM0_SUS256_TLDS1_WG16_8_1_WGM8
    SolutionIndex: 32
    SolutionNameMin: Cijk_Alik_Bljk_HHS_BH_Bias_AuxH_HAS_SAV_UserArgs_MT32x32x32_MI16x16x1_SN_LDSB0_GRVWA1_GRVWB8_GSU1_LBSPPA128_LBSPPB128_MIWT1_1_SS1_SU32_SUM0_SUS256_TLDS1_WG32_4_1_WGM8
    SolutionIndex: 33
    SolutionNameMin: Cijk_Alik_Bljk_HHS_BH_Bias_AuxH_HAS_SAV_UserArgs_MT64x32x32_MI16x16x1_SN_LDSB0_GRVWA1_GRVWB8_GSU1_LBSPPA128_LBSPPB128_MIWT2_1_SS1_SU32_SUM0_SUS256_TLDS1_WG32_4_1_WGM8
    SolutionIndex: 34
    SolutionNameMin: Cijk_Alik_Bljk_HHS_BH_Bias_AuxH_HAS_SAV_UserArgs_MT64x16x64_MI16x16x1_SN_LDSB0_GRVWA8_GRVWB8_GSU1_LBSPPA2048_LBSPPB512_MIWT1_1_SS1_SU32_SUM0_SUS256_TLDS0_WG64_2_1_WGM8
    SolutionIndex: 36
    SolutionNameMin: Cijk_Alik_Bljk_HHS_BH_Bias_AuxH_HAS_SAV_UserArgs_MT32x32x32_MI16x16x1_SN_LDSB0_GRVWA8_GRVWB8_GSU1_LBSPPA1024_LBSPPB1024_MIWT1_1_SS1_SU32_SUM0_SUS256_TLDS0_WG32_4_1_WGM8
    SolutionIndex: 37
    SolutionNameMin: Cijk_Alik_Bljk_HHS_BH_Bias_AuxH_HAS_SAV_UserArgs_MT64x32x32_MI16x16x1_SN_LDSB0_GRVWA1_GRVWB1_GSU1_LBSPPA128_LBSPPB128_MIWT2_1_SS1_SU32_SUM0_SUS256_TLDS1_WG32_4_1_WGM8
    SolutionIndex: 38
    SolutionNameMin: Cijk_Alik_Bljk_HHS_BH_Bias_AuxH_HAS_SAV_UserArgs_MT64x48x32_MI16x16x1_SN_LDSB0_GRVWA1_GRVWB1_GSU1_LBSPPA128_LBSPPB128_MIWT1_3_SS1_SU32_SUM0_SUS256_TLDS1_WG64_2_1_WGM8
    SolutionIndex: 39
    SolutionNameMin: Cijk_Alik_Bljk_HHS_BH_Bias_AuxH_HAS_SAV_UserArgs_MT64x48x32_MI16x16x1_SN_LDSB0_GRVWA1_GRVWB4_GSU1_LBSPPA128_LBSPPB128_MIWT1_3_SS1_SU32_SUM0_SUS256_TLDS1_WG64_2_1_WGM8
    SolutionIndex: 41
    SolutionNameMin: Cijk_Alik_Bljk_HHS_BH_Bias_AuxH_HAS_SAV_UserArgs_MT64x96x32_MI16x16x1_SN_LDSB0_GRVWA1_GRVWB8_GSU1_LBSPPA128_LBSPPB128_MIWT2_3_SS1_SU32_SUM0_SUS256_TLDS1_WG32_4_1_WGM8
    SolutionIndex: 42
    SolutionNameMin: Cijk_Alik_Bljk_HHS_BH_Bias_AuxH_HAS_SAV_UserArgs_MT64x32x64_MI16x16x1_SN_LDSB0_GRVWA8_GRVWB8_GSU1_LBSPPA2048_LBSPPB1024_MIWT2_1_SS1_SU32_SUM0_SUS256_TLDS0_WG32_4_1_WGM8
    SolutionIndex: 43
    SolutionNameMin: Cijk_Alik_Bljk_HHS_BH_Bias_AuxH_HAS_SAV_UserArgs_MT32x64x32_MI16x16x1_SN_LDSB0_GRVWA8_GRVWB8_GSU1_LBSPPA1024_LBSPPB2048_MIWT2_1_SS1_SU32_SUM0_SUS256_TLDS0_WG16_8_1_WGM8
    SolutionIndex: 45
    SolutionNameMin: Cijk_Alik_Bljk_HHS_BH_Bias_AuxH_HAS_SAV_UserArgs_MT64x80x32_MI16x16x1_SN_LDSB0_GRVWA1_GRVWB4_GSU1_LBSPPA128_LBSPPB128_MIWT1_5_SS1_SU32_SUM0_SUS256_TLDS1_WG64_2_1_WGM8
    SolutionIndex: 46
    SolutionNameMin: Cijk_Alik_Bljk_HHS_BH_Bias_AuxH_HAS_SAV_UserArgs_MT64x160x32_MI16x16x1_SN_LDSB1_GRVWA1_GRVWB8_GSU1_LBSPPA128_LBSPPB128_MIWT2_5_SS1_SU32_SUM0_SUS256_TLDS1_WG32_4_1_WGM8
    SolutionIndex: 47
    SolutionNameMin: Cijk_Alik_Bljk_HHS_BH_Bias_AuxH_HAS_SAV_UserArgs_MT32x32x32_MI16x16x1_SN_LDSB0_GRVWA8_GRVWB8_GSU1_LBSPPA128_LBSPPB128_MIWT1_1_SS0_SU32_SUM0_SUS256_TLDS1_WG32_4_1_WGM8
    SolutionIndex: 49
    SolutionNameMin: Cijk_Alik_Bljk_HHS_BH_Bias_AuxH_HAS_SAV_UserArgs_MT64x16x64_MI16x16x1_SN_LDSB0_GRVWA1_GRVWB8_GSU1_LBSPPA128_LBSPPB128_MIWT1_1_SS1_SU32_SUM0_SUS256_TLDS1_WG64_2_1_WGM8
    SolutionIndex: 50
    SolutionNameMin: Cijk_Alik_Bljk_HHS_BH_Bias_AuxH_HAS_SAV_UserArgs_MT16x64x64_MI16x16x1_SN_LDSB0_GRVWA8_GRVWB1_GSU1_LBSPPA128_LBSPPB128_MIWT1_1_SS1_SU32_SUM0_SUS256_TLDS1_WG16_8_1_WGM8
    SolutionIndex: 51
    SolutionNameMin: Cijk_Alik_Bljk_HHS_BH_Bias_AuxH_HAS_SAV_UserArgs_MT32x32x64_MI16x16x1_SN_LDSB0_GRVWA1_GRVWB1_GSU1_LBSPPA128_LBSPPB128_MIWT1_1_SS1_SU32_SUM0_SUS256_TLDS1_WG32_4_1_WGM8
    SolutionIndex: 52
    SolutionNameMin: Cijk_Alik_Bljk_HHS_BH_Bias_AuxH_HAS_SAV_UserArgs_MT32x96x32_MI16x16x1_SN_LDSB0_GRVWA8_GRVWB8_GSU1_LBSPPA128_LBSPPB128_MIWT1_3_SS1_SU32_SUM0_SUS256_TLDS1_WG32_4_1_WGM8
    SolutionIndex: 53
    SolutionNameMin: Cijk_Alik_Bljk_HHS_BH_Bias_AuxH_HAS_SAV_UserArgs_MT16x64x32_MI16x16x1_SN_LDSB0_GRVWA4_GRVWB1_GSU1_LBSPPA128_LBSPPB128_MIWT1_1_SS0_SU32_SUM0_SUS256_TLDS1_WG16_8_1_WGM8
    SolutionIndex: 54
    SolutionNameMin: Cijk_Alik_Bljk_HHS_BH_Bias_AuxH_HAS_SAV_UserArgs_MT96x32x32_MI16x16x1_SN_LDSB0_GRVWA8_GRVWB8_GSU1_LBSPPA128_LBSPPB128_MIWT3_1_SS1_SU32_SUM0_SUS256_TLDS1_WG32_4_1_WGM8
    SolutionIndex: 55
    SolutionNameMin: Cijk_Alik_Bljk_HHS_BH_Bias_AuxH_HAS_SAV_UserArgs_MT32x160x32_MI16x16x1_SN_LDSB0_GRVWA8_GRVWB8_GSU1_LBSPPA128_LBSPPB128_MIWT1_5_SS1_SU32_SUM0_SUS256_TLDS1_WG32_4_1_WGM8
    SolutionIndex: 56
    SolutionNameMin: Cijk_Alik_Bljk_HHS_BH_Bias_AuxH_HAS_SAV_UserArgs_MT32x160x32_MI16x16x1_SN_LDSB0_GRVWA1_GRVWB8_GSU1_LBSPPA128_LBSPPB128_MIWT1_5_SS1_SU32_SUM0_SUS256_TLDS1_WG32_4_1_WGM8
    SolutionIndex: 57
    SolutionNameMin: Cijk_Alik_Bljk_HHS_BH_Bias_AuxH_HAS_SAV_UserArgs_MT32x64x32_MI16x16x1_SN_LDSB0_GRVWA8_GRVWB1_GSU1_LBSPPA128_LBSPPB128_MIWT2_1_SS1_SU32_SUM0_SUS256_TLDS1_WG16_8_1_WGM8
    SolutionIndex: 58
    SolutionNameMin: Cijk_Alik_Bljk_HHS_BH_Bias_AuxH_HAS_SAV_UserArgs_MT64x112x32_MI16x16x1_SN_LDSB0_GRVWA1_GRVWB4_GSU1_LBSPPA128_LBSPPB128_MIWT1_7_SS1_SU32_SUM0_SUS256_TLDS1_WG64_2_1_WGM8
    SolutionIndex: 59
    SolutionNameMin: Cijk_Alik_Bljk_HHS_BH_Bias_AuxH_HAS_SAV_UserArgs_MT160x32x32_MI16x16x1_SN_LDSB0_GRVWA8_GRVWB8_GSU1_LBSPPA128_LBSPPB128_MIWT5_1_SS1_SU32_SUM0_SUS256_TLDS1_WG32_4_1_WGM8
    SolutionIndex: 60
    SolutionNameMin: Cijk_Alik_Bljk_HHS_BH_Bias_AuxH_HAS_SAV_UserArgs_MT96x96x32_MI16x16x1_SN_LDSB0_GRVWA8_GRVWB8_GSU1_LBSPPA128_LBSPPB128_MIWT3_3_SS1_SU32_SUM0_SUS256_TLDS1_WG32_4_1_WGM8
    SolutionIndex: 61
    SolutionNameMin: Cijk_Alik_Bljk_HHS_BH_Bias_AuxH_HAS_SAV_UserArgs_MT48x128x32_MI16x16x1_SN_LDSB0_GRVWA1_GRVWB1_GSU1_LBSPPA128_LBSPPB128_MIWT3_2_SS1_SU32_SUM0_SUS256_TLDS1_WG16_8_1_WGM8
    SolutionIndex: 62
    SolutionNameMin: Cijk_Alik_Bljk_HHS_BH_Bias_AuxH_HAS_SAV_UserArgs_MT80x64x32_MI16x16x1_SN_LDSB0_GRVWA4_GRVWB1_GSU1_LBSPPA128_LBSPPB128_MIWT5_1_SS1_SU32_SUM0_SUS256_TLDS1_WG16_8_1_WGM8
    SolutionIndex: 63
    SolutionNameMin: Cijk_Alik_Bljk_HHS_BH_Bias_AuxH_HAS_SAV_UserArgs_MT112x64x32_MI16x16x1_SN_LDSB0_GRVWA4_GRVWB1_GSU1_LBSPPA128_LBSPPB128_MIWT7_1_SS1_SU32_SUM0_SUS256_TLDS1_WG16_8_1_WGM8
    SolutionIndex: 64
    SolutionNameMin: Cijk_Alik_Bljk_HHS_BH_Bias_AuxH_HAS_SAV_UserArgs_MT96x64x32_MI16x16x1_SN_LDSB0_GRVWA8_GRVWB1_GSU1_LBSPPA128_LBSPPB128_MIWT6_1_SS1_SU32_SUM0_SUS256_TLDS1_WG16_8_1_WGM8
    SolutionIndex: 65
    SolutionNameMin: Cijk_Alik_Bljk_HHS_BH_Bias_AuxH_HAS_SAV_UserArgs_MT96x96x32_MI16x16x1_SN_LDSB0_GRVWA8_GRVWB1_GSU1_LBSPPA128_LBSPPB128_MIWT3_3_SS1_SU32_SUM0_SUS256_TLDS1_WG32_4_1_WGM8
    SolutionIndex: 66
    SolutionNameMin: Cijk_Alik_Bljk_HHS_BH_Bias_AuxH_HAS_SAV_UserArgs_MT32x96x32_MI16x16x1_SN_LDSB0_GRVWA1_GRVWB8_GSU1_LBSPPA128_LBSPPB128_MIWT1_3_SS1_SU32_SUM0_SUS256_TLDS1_WG32_4_1_WGM8
    SolutionIndex: 67
    SolutionNameMin: Cijk_Alik_Bljk_HHS_BH_Bias_AuxH_HAS_SAV_UserArgs_MT96x32x32_MI16x16x1_SN_LDSB0_GRVWA8_GRVWB1_GSU1_LBSPPA128_LBSPPB128_MIWT3_1_SS1_SU32_SUM0_SUS256_TLDS1_WG32_4_1_WGM8
    SolutionIndex: 69
    SolutionNameMin: Cijk_Alik_Bljk_HHS_BH_Bias_AuxH_HAS_SAV_UserArgs_MT224x32x32_MI16x16x1_SN_LDSB1_GRVWA8_GRVWB8_GSU1_LBSPPA128_LBSPPB128_MIWT7_1_SS1_SU32_SUM0_SUS256_TLDS1_WG32_4_1_WGM8
    SolutionIndex: 70
    SolutionNameMin: Cijk_Alik_Bljk_HHS_BH_Bias_AuxH_HAS_SAV_UserArgs_MT32x32x32_MI16x16x1_SN_LDSB0_GRVWA8_GRVWB1_GSU4_LBSPPA128_LBSPPB128_MIWT1_1_SS0_SU32_SUM0_SUS256_TLDS1_WG32_4_1_WGM8
    SolutionIndex: 71
    SolutionNameMin: Cijk_Alik_Bljk_HHS_BH_Bias_AuxH_HAS_SAV_UserArgs_MT32x32x32_MI16x16x1_SN_LDSB0_GRVWA1_GRVWB8_GSU4_LBSPPA128_LBSPPB128_MIWT1_1_SS0_SU32_SUM0_SUS256_TLDS1_WG32_4_1_WGM8
    SolutionIndex: 72
    SolutionNameMin: Cijk_Alik_Bljk_HHS_BH_Bias_AuxH_HAS_SAV_UserArgs_MT96x32x32_MI16x16x1_SN_LDSB0_GRVWA8_GRVWB8_GSU4_LBSPPA128_LBSPPB128_MIWT3_1_SS1_SU32_SUM0_SUS256_TLDS1_WG32_4_1_WGM8
    SolutionIndex: 73
    SolutionNameMin: Cijk_Alik_Bljk_HHS_BH_Bias_AuxH_HAS_SAV_UserArgs_MT32x32x32_MI16x16x1_SN_LDSB0_GRVWA8_GRVWB8_GSU4_LBSPPA128_LBSPPB128_MIWT1_1_SS0_SU32_SUM0_SUS256_TLDS1_WG32_4_1_WGM8
    SolutionIndex: 74
    SolutionNameMin: Cijk_Alik_Bljk_HHS_BH_Bias_AuxH_HAS_SAV_UserArgs_MT32x96x32_MI16x16x1_SN_LDSB0_GRVWA1_GRVWB8_GSU4_LBSPPA128_LBSPPB128_MIWT1_3_SS1_SU32_SUM0_SUS256_TLDS1_WG32_4_1_WGM8
    SolutionIndex: 75
    SolutionNameMin: Cijk_Alik_Bljk_HHS_BH_Bias_AuxH_HAS_SAV_UserArgs_MT64x96x32_MI16x16x1_SN_LDSB0_GRVWA1_GRVWB8_GSU4_LBSPPA128_LBSPPB128_MIWT2_3_SS1_SU32_SUM0_SUS256_TLDS1_WG32_4_1_WGM8
    SolutionIndex: 76
    SolutionNameMin: Cijk_Alik_Bljk_HHS_BH_Bias_AuxH_HAS_SAV_UserArgs_MT96x96x32_MI16x16x1_SN_LDSB0_GRVWA8_GRVWB8_GSU4_LBSPPA128_LBSPPB128_MIWT3_3_SS1_SU32_SUM0_SUS256_TLDS1_WG32_4_1_WGM8
    SolutionIndex: 78
    SolutionNameMin: Cijk_Alik_Bljk_HHS_BH_Bias_AuxH_HAS_SAV_UserArgs_MT64x160x32_MI16x16x1_SN_LDSB1_GRVWA1_GRVWB8_GSU4_LBSPPA128_LBSPPB128_MIWT2_5_SS1_SU32_SUM0_SUS256_TLDS1_WG32_4_1_WGM8
    SolutionIndex: 79
    SolutionNameMin: Cijk_Alik_Bljk_HHS_BH_Bias_AuxH_HAS_SAV_UserArgs_MT96x96x32_MI16x16x1_SN_LDSB0_GRVWA8_GRVWB8_GSU2_LBSPPA128_LBSPPB128_MIWT3_3_SS1_SU32_SUM0_SUS256_TLDS1_WG32_4_1_WGM8
    SolutionIndex: 80
    SolutionNameMin: Cijk_Alik_Bljk_HHS_BH_Bias_AuxH_HAS_SAV_UserArgs_MT64x160x32_MI16x16x1_SN_LDSB1_GRVWA1_GRVWB8_GSU2_LBSPPA128_LBSPPB128_MIWT2_5_SS1_SU32_SUM0_SUS256_TLDS1_WG32_4_1_WGM8
    SolutionIndex: 81
    SolutionNameMin: Cijk_Alik_Bljk_HHS_BH_Bias_AuxH_HAS_SAV_UserArgs_MT64x96x32_MI16x16x1_SN_LDSB0_GRVWA1_GRVWB8_GSU2_LBSPPA128_LBSPPB128_MIWT2_3_SS1_SU32_SUM0_SUS256_TLDS1_WG32_4_1_WGM8
    SolutionIndex: 82
    SolutionNameMin: Cijk_Alik_Bljk_HHS_BH_Bias_AuxH_HAS_SAV_UserArgs_MT32x32x32_MI16x16x1_SN_LDSB0_GRVWA8_GRVWB8_GSU4_LBSPPA128_LBSPPB128_MIWT1_1_SS1_SU32_SUM0_SUS256_TLDS1_WG32_4_1_WGM8
    SolutionIndex: 84
    SolutionNameMin: Cijk_Alik_Bljk_HHS_BH_Bias_AuxH_HAS_SAV_UserArgs_MT32x32x32_MI16x16x1_SN_LDSB0_GRVWA1_GRVWB8_GSU4_LBSPPA128_LBSPPB128_MIWT1_1_SS1_SU32_SUM0_SUS256_TLDS1_WG32_4_1_WGM8
    SolutionIndex: 88
    SolutionNameMin: Cijk_Alik_Bljk_HHS_BH_Bias_AuxH_HAS_SAV_UserArgs_MT64x96x32_MI16x16x1_SN_LDSB0_GRVWA8_GRVWB8_GSU1_LBSPPA2048_LBSPPB3072_MIWT2_3_SS1_SU32_SUM0_SUS256_TLDS0_WG32_4_1_WGM8
    SolutionIndex: 89
    SolutionNameMin: Cijk_Alik_Bljk_HHS_BH_Bias_AuxH_HAS_SAV_UserArgs_MT96x96x32_MI16x16x1_SN_LDSB0_GRVWA1_GRVWB8_GSU1_LBSPPA128_LBSPPB128_MIWT3_3_SS1_SU32_SUM0_SUS256_TLDS1_WG32_4_1_WGM8
    SolutionIndex: 90
    SolutionNameMin: Cijk_Alik_Bljk_HHS_BH_Bias_AuxH_HAS_SAV_UserArgs_MT224x32x32_MI16x16x1_SN_LDSB1_GRVWA8_GRVWB1_GSU1_LBSPPA128_LBSPPB128_MIWT7_1_SS1_SU32_SUM0_SUS256_TLDS1_WG32_4_1_WGM8
    SolutionIndex: 91
    SolutionNameMin: Cijk_Alik_Bljk_HHS_BH_Bias_AuxH_HAS_SAV_UserArgs_MT32x32x32_MI16x16x1_SN_LDSB0_GRVWA1_GRVWB8_GSU1_LBSPPA1024_LBSPPB1024_MIWT1_1_SS0_SU32_SUM0_SUS256_TLDS0_WG32_4_1_WGM8
    SolutionIndex: 95
    SolutionNameMin: Cijk_Alik_Bljk_HHS_BH_Bias_HAS_SAV_UserArgs_MT96x128x32_MI16x16x1_SN_LDSB1_GRVWA1_GRVWB8_GSU1_GSUC0_GSUWGMRR0_K1_LBSPPA128_LBSPPB128_MIWT3_4_NLCA1_NLCB1_PGR1_SS1_SU32_SUM0_SUS256_TLDS1_WG32_4_1_WGM8_WGMXCC1_WGMXCCGn1
    SolutionIndex: 97
    SolutionNameMin: Cijk_Alik_Bljk_HHS_BH_Bias_HAS_SAV_UserArgs_MT64x192x32_MI16x16x1_SN_LDSB0_GRVWA8_GRVWB8_GSU1_GSUC0_GSUWGMRR0_K1_LBSPPA128_LBSPPB128_MIWT4_3_NLCA1_NLCB1_PGR2_SS1_SU32_SUM0_SUS256_TLDS1_WG16_8_1_WGM8_WGMXCC1_WGMXCCGn1
    SolutionIndex: 98
    SolutionNameMin: Cijk_Alik_Bljk_HHS_BH_Bias_HAS_SAV_UserArgs_MT192x64x32_MI16x16x1_SN_LDSB0_GRVWA8_GRVWB8_GSU1_GSUC0_GSUWGMRR0_K1_LBSPPA128_LBSPPB128_MIWT3_4_NLCA1_NLCB1_PGR2_SS1_SU32_SUM0_SUS256_TLDS1_WG64_2_1_WGM8_WGMXCC1_WGMXCCGn1
    SolutionIndex: 101
    SolutionNameMin: Cijk_Alik_Bljk_HHS_BH_Bias_HAS_SAV_UserArgs_MT64x192x32_MI16x16x1_SN_LDSB1_GRVWA2_GRVWB8_GSU1_GSUC0_GSUWGMRR0_K1_LBSPPA128_LBSPPB128_MIWT4_3_NLCA1_NLCB1_PGR1_SS1_SU32_SUM0_SUS256_TLDS1_WG16_8_1_WGM8_WGMXCC1_WGMXCCGn1
    SolutionIndex: 102
    SolutionNameMin: Cijk_Alik_Bljk_HHS_BH_Bias_HAS_SAV_UserArgs_MT32x16x64_MI16x16x1_SN_LDSB1_GRVWA2_GRVWB8_GSU1_GSUC0_GSUWGMRR0_K1_LBSPPA128_LBSPPB128_MIWT1_1_NLCA1_NLCB1_PGR1_SS1_SU32_SUM0_SUS256_TLDS1_WG32_2_1_WGM8_WGMXCC1_WGMXCCGn1
    SolutionIndex: 103
    SolutionNameMin: Cijk_Alik_Bljk_HHS_BH_Bias_HAS_SAV_UserArgs_MT96x128x32_MI16x16x1_SN_LDSB1_GRVWA2_GRVWB8_GSU1_GSUC0_GSUWGMRR0_K1_LBSPPA128_LBSPPB128_MIWT3_4_NLCA1_NLCB1_PGR1_SS1_SU32_SUM0_SUS256_TLDS1_WG32_4_1_WGM8_WGMXCC1_WGMXCCGn1
    SolutionIndex: 104
    SolutionNameMin: Cijk_Alik_Bljk_HHS_BH_Bias_HAS_SAV_UserArgs_MT32x16x32_MI16x16x1_SN_LDSB0_GRVWA1_GRVWB8_GSU1_GSUC0_GSUWGMRR0_K1_LBSPPA1024_LBSPPB512_MIWT1_1_NLCA1_NLCB1_PGR2_SS0_SU32_SUM0_SUS256_TLDS0_WG32_2_1_WGM8_WGMXCC1_WGMXCCGn1
    SolutionIndex: 105
    SolutionNameMin: Cijk_Alik_Bljk_HHS_BH_Bias_HAS_SAV_UserArgs_MT128x96x32_MI16x16x1_SN_LDSB0_GRVWA8_GRVWB1_GSU1_GSUC0_GSUWGMRR0_K1_LBSPPA128_LBSPPB128_MIWT4_3_NLCA1_NLCB1_PGR2_SS1_SU32_SUM0_SUS256_TLDS1_WG32_4_1_WGM8_WGMXCC1_WGMXCCGn1
    SolutionIndex: 109
    SolutionNameMin: Cijk_Alik_Bljk_HHS_BH_Bias_HAS_SAV_UserArgs_MT64x192x32_MI16x16x1_SN_LDSB1_GRVWA2_GRVWB8_GSU1_GSUC0_GSUWGMRR0_K1_LBSPPA128_LBSPPB128_MIWT4_3_NLCA1_NLCB1_PGR2_SS1_SU32_SUM0_SUS256_TLDS1_WG16_8_1_WGM8_WGMXCC1_WGMXCCGn1
    SolutionIndex: 110
    SolutionNameMin: Cijk_Alik_Bljk_HHS_BH_Bias_HAS_SAV_UserArgs_MT64x16x32_MI16x16x1_SN_LDSB0_GRVWA8_GRVWB2_GSU4_GSUC0_GSUWGMRR0_K1_LBSPPA128_LBSPPB128_MIWT1_1_NLCA1_NLCB1_PGR2_SS0_SU32_SUM0_SUS256_TLDS1_WG64_2_1_WGM8_WGMXCC1_WGMXCCGn1
    SolutionIndex: 113
    SolutionNameMin: Cijk_Alik_Bljk_HHS_BH_Bias_HAS_SAV_UserArgs_MT64x16x64_MI16x16x1_SN_LDSB1_GRVWA8_GRVWB2_GSU1_GSUC0_GSUWGMRR0_K1_LBSPPA128_LBSPPB128_MIWT1_1_NLCA1_NLCB1_PGR2_SS1_SU32_SUM0_SUS256_TLDS1_WG64_2_1_WGM8_WGMXCC1_WGMXCCGn1
    SolutionIndex: 114
    SolutionNameMin: Cijk_Alik_Bljk_HHS_BH_Bias_HAS_SAV_UserArgs_MT96x128x32_MI16x16x1_SN_LDSB1_GRVWA8_GRVWB8_GSU1_GSUC0_GSUWGMRR0_K1_LBSPPA128_LBSPPB128_MIWT3_4_NLCA1_NLCB1_PGR1_SS1_SU32_SUM0_SUS256_TLDS1_WG32_4_1_WGM8_WGMXCC1_WGMXCCGn1
    SolutionIndex: 115
    SolutionNameMin: Cijk_Alik_Bljk_HHS_BH_Bias_HAS_SAV_UserArgs_MT32x16x64_MI16x16x1_SN_LDSB0_GRVWA8_GRVWB1_GSU1_GSUC0_GSUWGMRR0_K1_LBSPPA128_LBSPPB128_MIWT1_1_NLCA1_NLCB1_PGR1_SS1_SU32_SUM0_SUS256_TLDS1_WG32_2_1_WGM8_WGMXCC1_WGMXCCGn1
    SolutionIndex: 117
    SolutionNameMin: Cijk_Alik_Bljk_HHS_BH_Bias_HAS_SAV_UserArgs_MT96x128x32_MI16x16x1_SN_LDSB1_GRVWA2_GRVWB2_GSU1_GSUC0_GSUWGMRR0_K1_LBSPPA128_LBSPPB128_MIWT3_4_NLCA1_NLCB1_PGR1_SS1_SU32_SUM0_SUS256_TLDS1_WG32_4_1_WGM8_WGMXCC1_WGMXCCGn1
    SolutionIndex: 118
    SolutionNameMin: Cijk_Alik_Bljk_HHS_BH_Bias_HAS_SAV_UserArgs_MT16x16x64_MI16x16x1_SN_LDSB0_GRVWA2_GRVWB2_GSU1_GSUC0_GSUWGMRR0_K1_LBSPPA128_LBSPPB128_MIWT1_1_NLCA1_NLCB1_PGR1_SS1_SU32_SUM0_SUS256_TLDS1_WG16_2_1_WGM8_WGMXCC1_WGMXCCGn1
- - - [64, 64, 1, 64]
    - [118, 121.927]
  - - [256, 256, 1, 256]
    - [30, 4247.4]
  - - [512, 512, 1, 512]
    - [60, 15516.5]
  - - [1024, 1024, 1, 1024]
    - [114, 32052.0]
  - - [2048, 2048, 1, 2048]
    - [8, 36576.3]
  - - [3072, 3072, 1, 3072]
    - [8, 37601.9]
  - - [4096, 4096, 1, 4096]
    - [7, 27395.7]
  - - [320, 64, 1, 64]
    - [28, 485.452]
  - - [576, 64, 1, 64]
    - [50, 842.606]
  - - [832, 64, 1, 64]
    - [113, 1175.13]
  - - [1088, 64, 1, 64]
    - [113, 1461.13]
  - - [1344, 64, 1, 64]
    - [42, 1643.29]
  - - [1600, 64, 1, 64]
    - [113, 2048.0]
  - - [1856, 64, 1, 64]
    - [3, 2141.46]
  - - [2112, 64, 1, 64]
    - [43, 2544.34]
  - - [2368, 64, 1, 64]
    - [42, 2811.4]
  - - [2624, 64, 1, 64]
    - [30, 2828.4]
  - - [2880, 64, 1, 64]
    - [67, 3574.69]
  - - [3136, 64, 1, 64]
    - [37, 3519.19]
  - - [3392, 64, 1, 64]
    - [30, 3473.41]
  - - [3648, 64, 1, 64]
    - [64, 3984.59]
  - - [3904, 64, 1, 64]
    - [62, 3634.27]
  - - [64, 320, 1, 64]
    - [34, 494.611]
  - - [320, 320, 1, 64]
    - [56, 2080.51]
  - - [576, 320, 1, 64]
    - [67, 3521.34]
  - - [832, 320, 1, 64]
    - [3, 4369.07]
  - - [1088, 320, 1, 64]
    - [46, 5369.21]
  - - [1344, 320, 1, 64]
    - [98, 6553.6]
  - - [1600, 320, 1, 64]
    - [46, 7123.48]
  - - [1856, 320, 1, 64]
    - [46, 7837.29]
  - - [2112, 320, 1, 64]
    - [46, 8009.96]
  - - [2368, 320, 1, 64]
    - [46, 8980.86]
  - - [2624, 320, 1, 64]
    - [46, 9265.43]
  - - [2880, 320, 1, 64]
    - [46, 10169.4]
  - - [3136, 320, 1, 64]
    - [13, 10528.7]
  - - [3392, 320, 1, 64]
    - [46, 9648.36]
  - - [3648, 320, 1, 64]
    - [46, 10096.1]
  - - [3904, 320, 1, 64]
    - [46, 10185.2]
  - - [64, 576, 1, 64]
    - [49, 842.606]
  - - [320, 576, 1, 64]
    - [52, 3469.55]
  - - [576, 576, 1, 64]
    - [41, 5587.81]
  - - [832, 576, 1, 64]
    - [97, 7573.05]
  - - [1088, 576, 1, 64]
    - [109, 8269.7]
  - - [1344, 576, 1, 64]
    - [101, 9175.04]
  - - [1600, 576, 1, 64]
    - [13, 10082.5]
  - - [1856, 576, 1, 64]
    - [109, 10947.1]
  - - [2112, 576, 1, 64]
    - [109, 11707.8]
  - - [2368, 576, 1, 64]
    - [109, 10581.1]
  - - [2624, 576, 1, 64]
    - [109, 10345.6]
  - - [2880, 576, 1, 64]
    - [13, 11234.7]
  - - [3136, 576, 1, 64]
    - [109, 11010.0]
  - - [3392, 576, 1, 64]
    - [109, 11796.5]
  - - [3648, 576, 1, 64]
    - [109, 12337.6]
  - - [3904, 576, 1, 64]
    - [109, 13143.1]
  - - [64, 832, 1, 64]
    - [113, 1239.23]
  - - [320, 832, 1, 64]
    - [3, 4313.76]
  - - [576, 832, 1, 64]
    - [98, 6323.89]
  - - [832, 832, 1, 64]
    - [13, 7982.4]
  - - [1088, 832, 1, 64]
    - [114, 8912.9]
  - - [1344, 832, 1, 64]
    - [114, 10447.5]
  - - [1600, 832, 1, 64]
    - [89, 9111.96]
  - - [1856, 832, 1, 64]
    - [13, 9833.66]
  - - [2112, 832, 1, 64]
    - [46, 10710.5]
  - - [2368, 832, 1, 64]
    - [13, 11951.8]
  - - [2624, 832, 1, 64]
    - [114, 11942.1]
  - - [2880, 832, 1, 64]
    - [114, 11980.8]
  - - [3136, 832, 1, 64]
    - [13, 11636.6]
  - - [3392, 832, 1, 64]
    - [13, 12719.5]
  - - [3648, 832, 1, 64]
    - [13, 12864.2]
  - - [3904, 832, 1, 64]
    - [114, 13283.1]
  - - [64, 1088, 1, 64]
    - [42, 1591.59]
  - - [320, 1088, 1, 64]
    - [13, 5369.21]
  - - [576, 1088, 1, 64]
    - [65, 7496.83]
  - - [832, 1088, 1, 64]
    - [46, 9344.17]
  - - [1088, 1088, 1, 64]
    - [46, 8658.24]
  - - [1344, 1088, 1, 64]
    - [69, 10117.3]
  - - [1600, 1088, 1, 64]
    - [13, 11197.1]
  - - [1856, 1088, 1, 64]
    - [46, 11748.8]
  - - [2112, 1088, 1, 64]
    - [109, 12516.0]
  - - [2368, 1088, 1, 64]
    - [46, 12079.7]
  - - [2624, 1088, 1, 64]
    - [46, 12777.2]
  - - [2880, 1088, 1, 64]
    - [13, 13926.4]
  - - [3136, 1088, 1, 64]
    - [109, 13396.7]
  - - [3392, 1088, 1, 64]
    - [46, 13121.8]
  - - [3648, 1088, 1, 64]
    - [13, 13127.5]
  - - [3904, 1088, 1, 64]
    - [101, 13592.2]
  - - [64, 1344, 1, 64]
    - [52, 2001.83]
  - - [320, 1344, 1, 64]
    - [109, 6327.61]
  - - [576, 1344, 1, 64]
    - [101, 9090.87]
  - - [832, 1344, 1, 64]
    - [109, 11182.1]
  - - [1088, 1344, 1, 64]
    - [109, 10340.9]
  - - [1344, 1344, 1, 64]
    - [13, 11115.9]
  - - [1600, 1344, 1, 64]
    - [101, 12233.4]
  - - [1856, 1344, 1, 64]
    - [101, 12874.7]
  - - [2112, 1344, 1, 64]
    - [13, 12192.3]
  - - [2368, 1344, 1, 64]
    - [101, 13356.5]
  - - [2624, 1344, 1, 64]
    - [101, 13932.5]
  - - [2880, 1344, 1, 64]
    - [109, 14923.3]
  - - [3136, 1344, 1, 64]
    - [13, 13727.5]
  - - [3392, 1344, 1, 64]
    - [101, 14588.3]
  - - [3648, 1344, 1, 64]
    - [109, 15049.7]
  - - [3904, 1344, 1, 64]
    - [101, 14229.1]
  - - [64, 1600, 1, 64]
    - [43, 1771.24]
  - - [320, 1600, 1, 64]
    - [46, 7281.78]
  - - [576, 1600, 1, 64]
    - [46, 9437.18]
  - - [832, 1600, 1, 64]
    - [109, 9260.52]
  - - [1088, 1600, 1, 64]
    - [46, 11310.8]
  - - [1344, 1600, 1, 64]
    - [46, 12684.4]
  - - [1600, 1600, 1, 64]
    - [13, 12136.3]
  - - [1856, 1600, 1, 64]
    - [46, 13431.4]
  - - [2112, 1600, 1, 64]
    - [114, 13474.7]
  - - [2368, 1600, 1, 64]
    - [46, 13107.2]
  - - [2624, 1600, 1, 64]
    - [46, 13886.2]
  - - [2880, 1600, 1, 64]
    - [114, 14386.0]
  - - [3136, 1600, 1, 64]
    - [46, 13871.6]
  - - [3392, 1600, 1, 64]
    - [46, 14323.3]
  - - [3648, 1600, 1, 64]
    - [114, 14423.0]
  - - [3904, 1600, 1, 64]
    - [46, 14643.6]
  - - [64, 1856, 1, 64]
    - [33, 2577.01]
  - - [320, 1856, 1, 64]
    - [13, 7918.93]
  - - [576, 1856, 1, 64]
    - [109, 10288.7]
  - - [832, 1856, 1, 64]
    - [13, 9736.78]
  - - [1088, 1856, 1, 64]
    - [46, 11539.0]
  - - [1344, 1856, 1, 64]
    - [114, 12423.8]
  - - [1600, 1856, 1, 64]
    - [46, 12712.7]
  - - [1856, 1856, 1, 64]
    - [101, 13608.8]
  - - [2112, 1856, 1, 64]
    - [13, 12965.0]
  - - [2368, 1856, 1, 64]
    - [114, 13856.2]
  - - [2624, 1856, 1, 64]
    - [109, 14232.4]
  - - [2880, 1856, 1, 64]
    - [13, 14557.4]
  - - [3136, 1856, 1, 64]
    - [114, 14327.2]
  - - [3392, 1856, 1, 64]
    - [114, 14063.4]
  - - [3648, 1856, 1, 64]
    - [114, 14541.1]
  - - [3904, 1856, 1, 64]
    - [114, 15129.9]
  - - [64, 2112, 1, 64]
    - [52, 2544.34]
  - - [320, 2112, 1, 64]
    - [109, 8918.3]
  - - [576, 2112, 1, 64]
    - [109, 11620.4]
  - - [832, 2112, 1, 64]
    - [46, 10918.4]
  - - [1088, 2112, 1, 64]
    - [101, 12462.9]
  - - [1344, 2112, 1, 64]
    - [13, 12528.7]
  - - [1600, 2112, 1, 64]
    - [101, 13731.4]
  - - [1856, 2112, 1, 64]
    - [109, 14844.5]
  - - [2112, 2112, 1, 64]
    - [101, 13724.8]
  - - [2368, 2112, 1, 64]
    - [101, 15278.2]
  - - [2624, 2112, 1, 64]
    - [101, 14301.6]
  - - [2880, 2112, 1, 64]
    - [101, 15236.2]
  - - [3136, 2112, 1, 64]
    - [109, 14224.4]
  - - [3392, 2112, 1, 64]
    - [101, 15283.0]
  - - [3648, 2112, 1, 64]
    - [109, 15506.1]
  - - [3904, 2112, 1, 64]
    - [101, 14906.7]
  - - [64, 2368, 1, 64]
    - [55, 2694.26]
  - - [320, 2368, 1, 64]
    - [13, 8660.11]
  - - [576, 2368, 1, 64]
    - [89, 9592.74]
  - - [832, 2368, 1, 64]
    - [46, 12066.1]
  - - [1088, 2368, 1, 64]
    - [46, 11611.9]
  - - [1344, 2368, 1, 64]
    - [46, 13444.6]
  - - [1600, 2368, 1, 64]
    - [13, 13323.3]
  - - [1856, 2368, 1, 64]
    - [109, 13856.2]
  - - [2112, 2368, 1, 64]
    - [95, 14417.9]
  - - [2368, 2368, 1, 64]
    - [114, 14184.8]
  - - [2624, 2368, 1, 64]
    - [13, 14052.0]
  - - [2880, 2368, 1, 64]
    - [109, 14500.7]
  - - [3136, 2368, 1, 64]
    - [114, 14208.3]
  - - [3392, 2368, 1, 64]
    - [114, 14460.3]
  - - [3648, 2368, 1, 64]
    - [114, 14664.8]
  - - [3904, 2368, 1, 64]
    - [13, 14699.6]
  - - [64, 2624, 1, 64]
    - [39, 3070.83]
  - - [320, 2624, 1, 64]
    - [13, 9427.99]
  - - [576, 2624, 1, 64]
    - [13, 9577.34]
  - - [832, 2624, 1, 64]
    - [101, 12149.8]
  - - [1088, 2624, 1, 64]
    - [13, 12514.7]
  - - [1344, 2624, 1, 64]
    - [114, 14195.3]
  - - [1600, 2624, 1, 64]
    - [13, 14254.5]
  - - [1856, 2624, 1, 64]
    - [109, 14737.1]
  - - [2112, 2624, 1, 64]
    - [103, 13800.8]
  - - [2368, 2624, 1, 64]
    - [109, 14922.0]
  - - [2624, 2624, 1, 64]
    - [101, 14591.5]
  - - [2880, 2624, 1, 64]
    - [109, 14881.7]
  - - [3136, 2624, 1, 64]
    - [103, 14649.4]
  - - [3392, 2624, 1, 64]
    - [109, 14700.4]
  - - [3648, 2624, 1, 64]
    - [101, 15258.5]
  - - [3904, 2624, 1, 64]
    - [101, 15176.4]
  - - [64, 2880, 1, 64]
    - [4, 3145.73]
  - - [320, 2880, 1, 64]
    - [13, 10082.5]
  - - [576, 2880, 1, 64]
    - [46, 10778.5]
  - - [832, 2880, 1, 64]
    - [101, 13753.7]
  - - [1088, 2880, 1, 64]
    - [46, 13735.6]
  - - [1344, 2880, 1, 64]
    - [101, 14360.9]
  - - [1600, 2880, 1, 64]
    - [101, 14492.0]
  - - [1856, 2880, 1, 64]
    - [46, 14254.1]
  - - [2112, 2880, 1, 64]
    - [114, 14801.7]
  - - [2368, 2880, 1, 64]
    - [101, 14795.6]
  - - [2624, 2880, 1, 64]
    - [101, 15601.8]
  - - [2880, 2880, 1, 64]
    - [101, 14953.3]
  - - [3136, 2880, 1, 64]
    - [109, 14840.2]
  - - [3392, 2880, 1, 64]
    - [109, 15418.3]
  - - [3648, 2880, 1, 64]
    - [109, 15510.9]
  - - [3904, 2880, 1, 64]
    - [101, 15815.1]
  - - [64, 3136, 1, 64]
    - [30, 3095.19]
  - - [320, 3136, 1, 64]
    - [13, 10794.2]
  - - [576, 3136, 1, 64]
    - [46, 11010.0]
  - - [832, 3136, 1, 64]
    - [109, 11718.3]
  - - [1088, 3136, 1, 64]
    - [101, 12732.7]
  - - [1344, 3136, 1, 64]
    - [46, 13692.7]
  - - [1600, 3136, 1, 64]
    - [117, 13931.7]
  - - [1856, 3136, 1, 64]
    - [114, 14522.7]
  - - [2112, 3136, 1, 64]
    - [117, 13807.4]
  - - [2368, 3136, 1, 64]
    - [114, 14945.5]
  - - [2624, 3136, 1, 64]
    - [13, 14291.6]
  - - [2880, 3136, 1, 64]
    - [103, 14343.1]
  - - [3136, 3136, 1, 64]
    - [103, 15057.6]
  - - [3392, 3136, 1, 64]
    - [114, 14848.2]
  - - [3648, 3136, 1, 64]
    - [117, 14896.6]
  - - [3904, 3136, 1, 64]
    - [114, 15393.9]
  - - [64, 3392, 1, 64]
    - [17, 4086.36]
  - - [320, 3392, 1, 64]
    - [109, 10605.8]
  - - [576, 3392, 1, 64]
    - [46, 11908.8]
  - - [832, 3392, 1, 64]
    - [46, 12499.5]
  - - [1088, 3392, 1, 64]
    - [109, 13158.3]
  - - [1344, 3392, 1, 64]
    - [114, 14267.3]
  - - [1600, 3392, 1, 64]
    - [13, 14062.4]
  - - [1856, 3392, 1, 64]
    - [101, 14441.4]
  - - [2112, 3392, 1, 64]
    - [95, 14601.6]
  - - [2368, 3392, 1, 64]
    - [114, 14562.7]
  - - [2624, 3392, 1, 64]
    - [109, 14757.5]
  - - [2880, 3392, 1, 64]
    - [117, 15138.3]
  - - [3136, 3392, 1, 64]
    - [117, 14945.9]
  - - [3392, 3392, 1, 64]
    - [114, 15261.4]
  - - [3648, 3392, 1, 64]
    - [103, 15681.9]
  - - [3904, 3392, 1, 64]
    - [109, 15680.1]
  - - [64, 3648, 1, 64]
    - [41, 4331.07]
  - - [320, 3648, 1, 64]
    - [109, 11406.3]
  - - [576, 3648, 1, 64]
    - [109, 12115.3]
  - - [832, 3648, 1, 64]
    - [46, 13350.4]
  - - [1088, 3648, 1, 64]
    - [109, 13656.9]
  - - [1344, 3648, 1, 64]
    - [101, 15158.8]
  - - [1600, 3648, 1, 64]
    - [101, 14678.0]
  - - [1856, 3648, 1, 64]
    - [101, 14764.0]
  - - [2112, 3648, 1, 64]
    - [109, 14292.5]
  - - [2368, 3648, 1, 64]
    - [101, 15400.0]
  - - [2624, 3648, 1, 64]
    - [101, 15108.0]
  - - [2880, 3648, 1, 64]
    - [109, 15386.7]
  - - [3136, 3648, 1, 64]
    - [109, 15728.6]
  - - [3392, 3648, 1, 64]
    - [109, 16031.1]
  - - [3648, 3648, 1, 64]
    - [101, 15801.6]
  - - [3904, 3648, 1, 64]
    - [101, 16146.6]
  - - [64, 3904, 1, 64]
    - [17, 3593.43]
  - - [320, 3904, 1, 64]
    - [13, 10250.5]
  - - [576, 3904, 1, 64]
    - [117, 12514.5]
  - - [832, 3904, 1, 64]
    - [109, 12952.0]
  - - [1088, 3904, 1, 64]
    - [114, 12883.6]
  - - [1344, 3904, 1, 64]
    - [114, 13790.8]
  - - [1600, 3904, 1, 64]
    - [13, 14458.2]
  - - [1856, 3904, 1, 64]
    - [101, 15105.3]
  - - [2112, 3904, 1, 64]
    - [117, 14417.9]
  - - [2368, 3904, 1, 64]
    - [103, 14903.2]
  - - [2624, 3904, 1, 64]
    - [101, 14816.3]
  - - [2880, 3904, 1, 64]
    - [114, 15508.3]
  - - [3136, 3904, 1, 64]
    - [114, 15608.5]
  - - [3392, 3904, 1, 64]
    - [109, 15579.3]
  - - [3648, 3904, 1, 64]
    - [114, 15769.5]
  - - [3904, 3904, 1, 64]
    - [114, 15720.2]
  - - [64, 64, 1, 256]
    - [102, 349.525]
  - - [320, 64, 1, 256]
    - [22, 2139.95]
  - - [576, 64, 1, 256]
    - [102, 2859.75]
  - - [832, 64, 1, 256]
    - [54, 3894.71]
  - - [1088, 64, 1, 256]
    - [15, 4512.86]
  - - [1344, 64, 1, 256]
    - [54, 5574.71]
  - - [1600, 64, 1, 256]
    - [15, 5890.88]
  - - [1856, 64, 1, 256]
    - [15, 6833.42]
  - - [2112, 64, 1, 256]
    - [15, 8238.81]
  - - [2368, 64, 1, 256]
    - [15, 8718.5]
  - - [2624, 64, 1, 256]
    - [54, 8864.25]
  - - [2880, 64, 1, 256]
    - [13, 8987.79]
  - - [3136, 64, 1, 256]
    - [59, 9257.7]
  - - [3392, 64, 1, 256]
    - [54, 9262.42]
  - - [3648, 64, 1, 256]
    - [54, 10045.2]
  - - [3904, 64, 1, 256]
    - [69, 9546.74]
  - - [64, 320, 1, 256]
    - [118, 2016.49]
  - - [320, 320, 1, 256]
    - [56, 6472.69]
  - - [576, 320, 1, 256]
    - [54, 9830.4]
  - - [832, 320, 1, 256]
    - [17, 11265.7]
  - - [1088, 320, 1, 256]
    - [46, 13712.1]
  - - [1344, 320, 1, 256]
    - [98, 17203.2]
  - - [1600, 320, 1, 256]
    - [13, 17133.6]
  - - [1856, 320, 1, 256]
    - [46, 19368.6]
  - - [2112, 320, 1, 256]
    - [46, 18405.9]
  - - [2368, 320, 1, 256]
    - [46, 19694.1]
  - - [2624, 320, 1, 256]
    - [13, 19630.9]
  - - [2880, 320, 1, 256]
    - [98, 21065.1]
  - - [3136, 320, 1, 256]
    - [13, 22937.6]
  - - [3392, 320, 1, 256]
    - [46, 18524.8]
  - - [3648, 320, 1, 256]
    - [46, 19342.7]
  - - [3904, 320, 1, 256]
    - [46, 19324.2]
  - - [64, 576, 1, 256]
    - [102, 2658.36]
  - - [320, 576, 1, 256]
    - [13, 9437.18]
  - - [576, 576, 1, 256]
    - [60, 15032.7]
  - - [832, 576, 1, 256]
    - [4, 18874.4]
  - - [1088, 576, 1, 256]
    - [101, 20437.2]
  - - [1344, 576, 1, 256]
    - [101, 21309.8]
  - - [1600, 576, 1, 256]
    - [101, 23359.4]
  - - [1856, 576, 1, 256]
    - [109, 24993.5]
  - - [2112, 576, 1, 256]
    - [109, 26731.9]
  - - [2368, 576, 1, 256]
    - [60, 22240.5]
  - - [2624, 576, 1, 256]
    - [109, 20152.3]
  - - [2880, 576, 1, 256]
    - [101, 20817.3]
  - - [3136, 576, 1, 256]
    - [97, 22125.5]
  - - [3392, 576, 1, 256]
    - [13, 24699.8]
  - - [3648, 576, 1, 256]
    - [109, 25493.8]
  - - [3904, 576, 1, 256]
    - [101, 26775.3]
  - - [64, 832, 1, 256]
    - [102, 3734.65]
  - - [320, 832, 1, 256]
    - [17, 11359.6]
  - - [576, 832, 1, 256]
    - [98, 19320.2]
  - - [832, 832, 1, 256]
    - [13, 18082.6]
  - - [1088, 832, 1, 256]
    - [13, 21066.8]
  - - [1344, 832, 1, 256]
    - [114, 23855.1]
  - - [1600, 832, 1, 256]
    - [8, 20653.8]
  - - [1856, 832, 1, 256]
    - [117, 19915.0]
  - - [2112, 832, 1, 256]
    - [114, 22159.6]
  - - [2368, 832, 1, 256]
    - [114, 23903.6]
  - - [2624, 832, 1, 256]
    - [114, 25637.2]
  - - [2880, 832, 1, 256]
    - [98, 23684.1]
  - - [3136, 832, 1, 256]
    - [13, 23152.3]
  - - [3392, 832, 1, 256]
    - [13, 24998.9]
  - - [3648, 832, 1, 256]
    - [114, 25685.8]
  - - [3904, 832, 1, 256]
    - [103, 26355.7]
  - - [64, 1088, 1, 256]
    - [17, 4295.37]
  - - [320, 1088, 1, 256]
    - [41, 14147.5]
  - - [576, 1088, 1, 256]
    - [114, 19213.4]
  - - [832, 1088, 1, 256]
    - [101, 21759.2]
  - - [1088, 1088, 1, 256]
    - [109, 19240.5]
  - - [1344, 1088, 1, 256]
    - [98, 23036.4]
  - - [1600, 1088, 1, 256]
    - [13, 22737.0]
  - - [1856, 1088, 1, 256]
    - [109, 23988.3]
  - - [2112, 1088, 1, 256]
    - [114, 26799.6]
  - - [2368, 1088, 1, 256]
    - [109, 22704.1]
  - - [2624, 1088, 1, 256]
    - [13, 24986.6]
  - - [2880, 1088, 1, 256]
    - [101, 26044.2]
  - - [3136, 1088, 1, 256]
    - [109, 27084.1]
  - - [3392, 1088, 1, 256]
    - [101, 24797.0]
  - - [3648, 1088, 1, 256]
    - [13, 25593.7]
  - - [3904, 1088, 1, 256]
    - [109, 26392.6]
  - - [64, 1344, 1, 256]
    - [32, 4893.35]
  - - [320, 1344, 1, 256]
    - [97, 17338.7]
  - - [576, 1344, 1, 256]
    - [101, 20751.9]
  - - [832, 1344, 1, 256]
    - [109, 25110.6]
  - - [1088, 1344, 1, 256]
    - [97, 23036.4]
  - - [1344, 1344, 1, 256]
    - [101, 22612.3]
  - - [1600, 1344, 1, 256]
    - [109, 25604.8]
  - - [1856, 1344, 1, 256]
    - [109, 25853.6]
  - - [2112, 1344, 1, 256]
    - [60, 24508.0]
  - - [2368, 1344, 1, 256]
    - [101, 26452.7]
  - - [2624, 1344, 1, 256]
    - [109, 28661.1]
  - - [2880, 1344, 1, 256]
    - [109, 28515.2]
  - - [3136, 1344, 1, 256]
    - [13, 25782.2]
  - - [3392, 1344, 1, 256]
    - [109, 28156.0]
  - - [3648, 1344, 1, 256]
    - [109, 29567.6]
  - - [3904, 1344, 1, 256]
    - [101, 26651.3]
  - - [64, 1600, 1, 256]
    - [15, 6393.76]
  - - [320, 1600, 1, 256]
    - [46, 16912.5]
  - - [576, 1600, 1, 256]
    - [114, 22363.0]
  - - [832, 1600, 1, 256]
    - [60, 21101.4]
  - - [1088, 1600, 1, 256]
    - [13, 21845.3]
  - - [1344, 1600, 1, 256]
    - [117, 25137.1]
  - - [1600, 1600, 1, 256]
    - [13, 23035.5]
  - - [1856, 1600, 1, 256]
    - [46, 25172.8]
  - - [2112, 1600, 1, 256]
    - [114, 27419.2]
  - - [2368, 1600, 1, 256]
    - [13, 24998.3]
  - - [2624, 1600, 1, 256]
    - [114, 25319.0]
  - - [2880, 1600, 1, 256]
    - [117, 27691.3]
  - - [3136, 1600, 1, 256]
    - [114, 26002.1]
  - - [3392, 1600, 1, 256]
    - [114, 27083.1]
  - - [3648, 1600, 1, 256]
    - [114, 27594.1]
  - - [3904, 1600, 1, 256]
    - [117, 26695.8]
  - - [64, 1856, 1, 256]
    - [14, 7240.17]
  - - [320, 1856, 1, 256]
    - [13, 18770.8]
  - - [576, 1856, 1, 256]
    - [109, 23193.1]
  - - [832, 1856, 1, 256]
    - [117, 19965.3]
  - - [1088, 1856, 1, 256]
    - [114, 24100.1]
  - - [1344, 1856, 1, 256]
    - [114, 25091.7]
  - - [1600, 1856, 1, 256]
    - [13, 25946.0]
  - - [1856, 1856, 1, 256]
    - [114, 27557.9]
  - - [2112, 1856, 1, 256]
    - [117, 25404.7]
  - - [2368, 1856, 1, 256]
    - [114, 26535.9]
  - - [2624, 1856, 1, 256]
    - [109, 27583.1]
  - - [2880, 1856, 1, 256]
    - [117, 26857.5]
  - - [3136, 1856, 1, 256]
    - [114, 28193.5]
  - - [3392, 1856, 1, 256]
    - [103, 25890.1]
  - - [3648, 1856, 1, 256]
    - [117, 27296.0]
  - - [3904, 1856, 1, 256]
    - [109, 27726.9]
  - - [64, 2112, 1, 256]
    - [15, 7954.71]
  - - [320, 2112, 1, 256]
    - [109, 21492.6]
  - - [576, 2112, 1, 256]
    - [101, 26170.3]
  - - [832, 2112, 1, 256]
    - [101, 21731.4]
  - - [1088, 2112, 1, 256]
    - [101, 27046.0]
  - - [1344, 2112, 1, 256]
    - [60, 24800.8]
  - - [1600, 2112, 1, 256]
    - [109, 27289.4]
  - - [1856, 2112, 1, 256]
    - [109, 28347.1]
  - - [2112, 2112, 1, 256]
    - [109, 27416.5]
  - - [2368, 2112, 1, 256]
    - [109, 28325.5]
  - - [2624, 2112, 1, 256]
    - [109, 27655.4]
  - - [2880, 2112, 1, 256]
    - [109, 29603.3]
  - - [3136, 2112, 1, 256]
    - [109, 27172.2]
  - - [3392, 2112, 1, 256]
    - [109, 29249.8]
  - - [3648, 2112, 1, 256]
    - [109, 27838.7]
  - - [3904, 2112, 1, 256]
    - [101, 28562.7]
  - - [64, 2368, 1, 256]
    - [15, 9348.75]
  - - [320, 2368, 1, 256]
    - [13, 20419.6]
  - - [576, 2368, 1, 256]
    - [98, 21891.9]
  - - [832, 2368, 1, 256]
    - [114, 23734.8]
  - - [1088, 2368, 1, 256]
    - [109, 23347.1]
  - - [1344, 2368, 1, 256]
    - [114, 26495.7]
  - - [1600, 2368, 1, 256]
    - [13, 25095.3]
  - - [1856, 2368, 1, 256]
    - [109, 26949.0]
  - - [2112, 2368, 1, 256]
    - [114, 25606.2]
  - - [2368, 2368, 1, 256]
    - [109, 26983.1]
  - - [2624, 2368, 1, 256]
    - [109, 27098.6]
  - - [2880, 2368, 1, 256]
    - [114, 28273.3]
  - - [3136, 2368, 1, 256]
    - [114, 27080.7]
  - - [3392, 2368, 1, 256]
    - [109, 27900.4]
  - - [3648, 2368, 1, 256]
    - [114, 26756.8]
  - - [3904, 2368, 1, 256]
    - [114, 27892.0]
  - - [64, 2624, 1, 256]
    - [66, 8347.89]
  - - [320, 2624, 1, 256]
    - [101, 20768.9]
  - - [576, 2624, 1, 256]
    - [13, 19944.6]
  - - [832, 2624, 1, 256]
    - [114, 26300.8]
  - - [1088, 2624, 1, 256]
    - [13, 24525.4]
  - - [1344, 2624, 1, 256]
    - [101, 28038.0]
  - - [1600, 2624, 1, 256]
    - [13, 26246.4]
  - - [1856, 2624, 1, 256]
    - [109, 27044.6]
  - - [2112, 2624, 1, 256]
    - [109, 26768.4]
  - - [2368, 2624, 1, 256]
    - [109, 27980.5]
  - - [2624, 2624, 1, 256]
    - [109, 27802.1]
  - - [2880, 2624, 1, 256]
    - [109, 27460.9]
  - - [3136, 2624, 1, 256]
    - [114, 27809.8]
  - - [3392, 2624, 1, 256]
    - [109, 27370.0]
  - - [3648, 2624, 1, 256]
    - [114, 28694.6]
  - - [3904, 2624, 1, 256]
    - [117, 28661.1]
  - - [64, 2880, 1, 256]
    - [52, 9830.4]
  - - [320, 2880, 1, 256]
    - [101, 23475.6]
  - - [576, 2880, 1, 256]
    - [101, 20766.4]
  - - [832, 2880, 1, 256]
    - [101, 28268.1]
  - - [1088, 2880, 1, 256]
    - [101, 25710.3]
  - - [1344, 2880, 1, 256]
    - [109, 27717.6]
  - - [1600, 2880, 1, 256]
    - [109, 27658.8]
  - - [1856, 2880, 1, 256]
    - [109, 27367.8]
  - - [2112, 2880, 1, 256]
    - [101, 28056.5]
  - - [2368, 2880, 1, 256]
    - [109, 28977.2]
  - - [2624, 2880, 1, 256]
    - [109, 29070.2]
  - - [2880, 2880, 1, 256]
    - [103, 28236.3]
  - - [3136, 2880, 1, 256]
    - [109, 27590.8]
  - - [3392, 2880, 1, 256]
    - [109, 28613.9]
  - - [3648, 2880, 1, 256]
    - [117, 28873.8]
  - - [3904, 2880, 1, 256]
    - [109, 29688.9]
  - - [64, 3136, 1, 256]
    - [41, 9514.86]
  - - [320, 3136, 1, 256]
    - [13, 23461.3]
  - - [576, 3136, 1, 256]
    - [13, 22125.5]
  - - [832, 3136, 1, 256]
    - [109, 24784.5]
  - - [1088, 3136, 1, 256]
    - [114, 26917.2]
  - - [1344, 3136, 1, 256]
    - [114, 26062.4]
  - - [1600, 3136, 1, 256]
    - [13, 25613.3]
  - - [1856, 3136, 1, 256]
    - [109, 27516.6]
  - - [2112, 3136, 1, 256]
    - [117, 26534.4]
  - - [2368, 3136, 1, 256]
    - [114, 26870.2]
  - - [2624, 3136, 1, 256]
    - [109, 27322.8]
  - - [2880, 3136, 1, 256]
    - [114, 27492.4]
  - - [3136, 3136, 1, 256]
    - [117, 28888.5]
  - - [3392, 3136, 1, 256]
    - [117, 28801.2]
  - - [3648, 3136, 1, 256]
    - [103, 28868.1]
  - - [3904, 3136, 1, 256]
    - [117, 28846.7]
  - - [64, 3392, 1, 256]
    - [17, 10687.4]
  - - [320, 3392, 1, 256]
    - [109, 23156.1]
  - - [576, 3392, 1, 256]
    - [98, 23372.5]
  - - [832, 3392, 1, 256]
    - [114, 24366.6]
  - - [1088, 3392, 1, 256]
    - [109, 26280.0]
  - - [1344, 3392, 1, 256]
    - [101, 27046.7]
  - - [1600, 3392, 1, 256]
    - [101, 26770.0]
  - - [1856, 3392, 1, 256]
    - [109, 27455.9]
  - - [2112, 3392, 1, 256]
    - [109, 28063.6]
  - - [2368, 3392, 1, 256]
    - [101, 27619.3]
  - - [2624, 3392, 1, 256]
    - [101, 27337.2]
  - - [2880, 3392, 1, 256]
    - [114, 28828.3]
  - - [3136, 3392, 1, 256]
    - [103, 28892.9]
  - - [3392, 3392, 1, 256]
    - [114, 29366.4]
  - - [3648, 3392, 1, 256]
    - [117, 28929.2]
  - - [3904, 3392, 1, 256]
    - [103, 29427.5]
  - - [64, 3648, 1, 256]
    - [17, 11605.6]
  - - [320, 3648, 1, 256]
    - [109, 25651.9]
  - - [576, 3648, 1, 256]
    - [109, 25019.5]
  - - [832, 3648, 1, 256]
    - [101, 25517.1]
  - - [1088, 3648, 1, 256]
    - [109, 26221.2]
  - - [1344, 3648, 1, 256]
    - [109, 29155.5]
  - - [1600, 3648, 1, 256]
    - [109, 28326.5]
  - - [1856, 3648, 1, 256]
    - [109, 27578.3]
  - - [2112, 3648, 1, 256]
    - [109, 27489.5]
  - - [2368, 3648, 1, 256]
    - [109, 28851.2]
  - - [2624, 3648, 1, 256]
    - [109, 27894.4]
  - - [2880, 3648, 1, 256]
    - [117, 28936.0]
  - - [3136, 3648, 1, 256]
    - [114, 28953.8]
  - - [3392, 3648, 1, 256]
    - [109, 29828.1]
  - - [3648, 3648, 1, 256]
    - [117, 29832.1]
  - - [3904, 3648, 1, 256]
    - [114, 29414.3]
  - - [64, 3904, 1, 256]
    - [17, 10234.1]
  - - [320, 3904, 1, 256]
    - [13, 20435.5]
  - - [576, 3904, 1, 256]
    - [114, 26226.3]
  - - [832, 3904, 1, 256]
    - [114, 25985.0]
  - - [1088, 3904, 1, 256]
    - [109, 25982.6]
  - - [1344, 3904, 1, 256]
    - [114, 26493.6]
  - - [1600, 3904, 1, 256]
    - [13, 26965.9]
  - - [1856, 3904, 1, 256]
    - [109, 28362.9]
  - - [2112, 3904, 1, 256]
    - [114, 27718.8]
  - - [2368, 3904, 1, 256]
    - [114, 27859.2]
  - - [2624, 3904, 1, 256]
    - [117, 28153.4]
  - - [2880, 3904, 1, 256]
    - [114, 29296.1]
  - - [3136, 3904, 1, 256]
    - [109, 29360.1]
  - - [3392, 3904, 1, 256]
    - [114, 29530.0]
  - - [3648, 3904, 1, 256]
    - [103, 29378.7]
  - - [3904, 3904, 1, 256]
    - [103, 29369.6]
  - - [64, 64, 1, 512]
    - [19, 590.747]
  - - [320, 64, 1, 512]
    - [118, 3084.05]
  - - [576, 64, 1, 512]
    - [115, 4778.32]
  - - [832, 64, 1, 512]
    - [15, 6196.13]
  - - [1088, 64, 1, 512]
    - [15, 8488.47]
  - - [1344, 64, 1, 512]
    - [15, 7726.35]
  - - [1600, 64, 1, 512]
    - [54, 9198.04]
  - - [1856, 64, 1, 512]
    - [54, 10396.1]
  - - [2112, 64, 1, 512]
    - [15, 10813.4]
  - - [2368, 64, 1, 512]
    - [59, 9405.41]
  - - [2624, 64, 1, 512]
    - [54, 10681.1]
  - - [2880, 64, 1, 512]
    - [59, 10663.5]
  - - [3136, 64, 1, 512]
    - [59, 10704.2]
  - - [3392, 64, 1, 512]
    - [54, 10791.2]
  - - [3648, 64, 1, 512]
    - [63, 10720.9]
  - - [3904, 64, 1, 512]
    - [62, 11172.6]
  - - [64, 320, 1, 512]
    - [118, 3382.5]
  - - [320, 320, 1, 512]
    - [55, 9362.29]
  - - [576, 320, 1, 512]
    - [3, 13016.8]
  - - [832, 320, 1, 512]
    - [60, 15668.4]
  - - [1088, 320, 1, 512]
    - [7, 18097.3]
  - - [1344, 320, 1, 512]
    - [98, 23550.9]
  - - [1600, 320, 1, 512]
    - [13, 22215.6]
  - - [1856, 320, 1, 512]
    - [46, 24038.5]
  - - [2112, 320, 1, 512]
    - [46, 21831.6]
  - - [2368, 320, 1, 512]
    - [13, 24790.6]
  - - [2624, 320, 1, 512]
    - [13, 24637.0]
  - - [2880, 320, 1, 512]
    - [98, 25997.8]
  - - [3136, 320, 1, 512]
    - [13, 28544.6]
  - - [3392, 320, 1, 512]
    - [46, 22637.3]
  - - [3648, 320, 1, 512]
    - [98, 23859.8]
  - - [3904, 320, 1, 512]
    - [98, 24413.4]
  - - [64, 576, 1, 512]
    - [47, 4548.04]
  - - [320, 576, 1, 512]
    - [13, 13016.8]
  - - [576, 576, 1, 512]
    - [60, 20971.5]
  - - [832, 576, 1, 512]
    - [97, 25964.7]
  - - [1088, 576, 1, 512]
    - [109, 25876.1]
  - - [1344, 576, 1, 512]
    - [101, 25326.6]
  - - [1600, 576, 1, 512]
    - [101, 28771.9]
  - - [1856, 576, 1, 512]
    - [101, 29667.0]
  - - [2112, 576, 1, 512]
    - [101, 31457.3]
  - - [2368, 576, 1, 512]
    - [109, 28159.3]
  - - [2624, 576, 1, 512]
    - [97, 24032.6]
  - - [2880, 576, 1, 512]
    - [8, 26254.9]
  - - [3136, 576, 1, 512]
    - [97, 28456.7]
  - - [3392, 576, 1, 512]
    - [97, 28786.8]
  - - [3648, 576, 1, 512]
    - [101, 29155.5]
  - - [3904, 576, 1, 512]
    - [109, 32115.4]
  - - [64, 832, 1, 512]
    - [14, 6126.51]
  - - [320, 832, 1, 512]
    - [60, 15758.9]
  - - [576, 832, 1, 512]
    - [98, 26383.5]
  - - [832, 832, 1, 512]
    - [13, 22792.2]
  - - [1088, 832, 1, 512]
    - [98, 25465.4]
  - - [1344, 832, 1, 512]
    - [114, 30453.3]
  - - [1600, 832, 1, 512]
    - [6, 26264.9]
  - - [1856, 832, 1, 512]
    - [7, 24364.4]
  - - [2112, 832, 1, 512]
    - [98, 26383.5]
  - - [2368, 832, 1, 512]
    - [95, 27374.0]
  - - [2624, 832, 1, 512]
    - [103, 29071.1]
  - - [2880, 832, 1, 512]
    - [98, 28041.9]
  - - [3136, 832, 1, 512]
    - [7, 26637.8]
  - - [3392, 832, 1, 512]
    - [13, 27787.3]
  - - [3648, 832, 1, 512]
    - [114, 29237.8]
  - - [3904, 832, 1, 512]
    - [103, 30209.7]
  - - [64, 1088, 1, 512]
    - [15, 8195.77]
  - - [320, 1088, 1, 512]
    - [13, 18863.3]
  - - [576, 1088, 1, 512]
    - [114, 24873.2]
  - - [832, 1088, 1, 512]
    - [101, 27669.9]
  - - [1088, 1088, 1, 512]
    - [97, 23628.7]
  - - [1344, 1088, 1, 512]
    - [98, 28685.2]
  - - [1600, 1088, 1, 512]
    - [98, 25648.6]
  - - [1856, 1088, 1, 512]
    - [114, 28521.3]
  - - [2112, 1088, 1, 512]
    - [101, 31926.8]
  - - [2368, 1088, 1, 512]
    - [109, 26975.6]
  - - [2624, 1088, 1, 512]
    - [101, 27144.2]
  - - [2880, 1088, 1, 512]
    - [101, 28958.9]
  - - [3136, 1088, 1, 512]
    - [101, 30864.4]
  - - [3392, 1088, 1, 512]
    - [109, 29047.4]
  - - [3648, 1088, 1, 512]
    - [109, 29030.6]
  - - [3904, 1088, 1, 512]
    - [101, 29872.9]
  - - [64, 1344, 1, 512]
    - [15, 7864.32]
  - - [320, 1344, 1, 512]
    - [97, 23677.5]
  - - [576, 1344, 1, 512]
    - [101, 26076.4]
  - - [832, 1344, 1, 512]
    - [101, 31457.3]
  - - [1088, 1344, 1, 512]
    - [97, 29768.7]
  - - [1344, 1344, 1, 512]
    - [97, 28326.0]
  - - [1600, 1344, 1, 512]
    - [114, 30970.6]
  - - [1856, 1344, 1, 512]
    - [109, 29225.8]
  - - [2112, 1344, 1, 512]
    - [60, 29569.2]
  - - [2368, 1344, 1, 512]
    - [114, 29546.5]
  - - [2624, 1344, 1, 512]
    - [109, 31239.6]
  - - [2880, 1344, 1, 512]
    - [109, 33363.8]
  - - [3136, 1344, 1, 512]
    - [114, 30076.2]
  - - [3392, 1344, 1, 512]
    - [101, 31246.7]
  - - [3648, 1344, 1, 512]
    - [101, 33270.9]
  - - [3904, 1344, 1, 512]
    - [109, 31165.3]
  - - [64, 1600, 1, 512]
    - [55, 9986.44]
  - - [320, 1600, 1, 512]
    - [13, 22405.5]
  - - [576, 1600, 1, 512]
    - [114, 29217.3]
  - - [832, 1600, 1, 512]
    - [60, 26728.4]
  - - [1088, 1600, 1, 512]
    - [8, 25392.9]
  - - [1344, 1600, 1, 512]
    - [117, 29282.0]
  - - [1600, 1600, 1, 512]
    - [97, 26346.1]
  - - [1856, 1600, 1, 512]
    - [114, 28552.8]
  - - [2112, 1600, 1, 512]
    - [114, 30649.3]
  - - [2368, 1600, 1, 512]
    - [114, 28053.0]
  - - [2624, 1600, 1, 512]
    - [114, 30001.1]
  - - [2880, 1600, 1, 512]
    - [117, 31947.1]
  - - [3136, 1600, 1, 512]
    - [103, 29511.9]
  - - [3392, 1600, 1, 512]
    - [103, 31116.8]
  - - [3648, 1600, 1, 512]
    - [117, 32571.6]
  - - [3904, 1600, 1, 512]
    - [114, 30648.4]
  - - [64, 1856, 1, 512]
    - [15, 10669.7]
  - - [320, 1856, 1, 512]
    - [13, 25553.5]
  - - [576, 1856, 1, 512]
    - [114, 29427.8]
  - - [832, 1856, 1, 512]
    - [8, 24402.0]
  - - [1088, 1856, 1, 512]
    - [101, 28210.0]
  - - [1344, 1856, 1, 512]
    - [109, 27916.2]
  - - [1600, 1856, 1, 512]
    - [13, 28633.4]
  - - [1856, 1856, 1, 512]
    - [114, 30566.8]
  - - [2112, 1856, 1, 512]
    - [114, 29256.2]
  - - [2368, 1856, 1, 512]
    - [114, 31016.5]
  - - [2624, 1856, 1, 512]
    - [109, 30708.3]
  - - [2880, 1856, 1, 512]
    - [117, 31188.4]
  - - [3136, 1856, 1, 512]
    - [117, 33960.7]
  - - [3392, 1856, 1, 512]
    - [103, 31143.2]
  - - [3648, 1856, 1, 512]
    - [103, 32382.9]
  - - [3904, 1856, 1, 512]
    - [109, 32918.0]
  - - [64, 2112, 1, 512]
    - [15, 11932.1]
  - - [320, 2112, 1, 512]
    - [109, 27354.2]
  - - [576, 2112, 1, 512]
    - [101, 33042.7]
  - - [832, 2112, 1, 512]
    - [97, 27810.8]
  - - [1088, 2112, 1, 512]
    - [101, 31584.0]
  - - [1344, 2112, 1, 512]
    - [60, 29037.5]
  - - [1600, 2112, 1, 512]
    - [101, 31286.6]
  - - [1856, 2112, 1, 512]
    - [109, 30947.9]
  - - [2112, 2112, 1, 512]
    - [109, 30655.0]
  - - [2368, 2112, 1, 512]
    - [109, 31828.7]
  - - [2624, 2112, 1, 512]
    - [109, 30976.5]
  - - [2880, 2112, 1, 512]
    - [101, 33595.2]
  - - [3136, 2112, 1, 512]
    - [109, 31916.2]
  - - [3392, 2112, 1, 512]
    - [101, 33573.6]
  - - [3648, 2112, 1, 512]
    - [117, 32241.5]
  - - [3904, 2112, 1, 512]
    - [101, 33477.9]
  - - [64, 2368, 1, 512]
    - [15, 13264.0]
  - - [320, 2368, 1, 512]
    - [13, 25693.6]
  - - [576, 2368, 1, 512]
    - [7, 27657.5]
  - - [832, 2368, 1, 512]
    - [117, 27636.4]
  - - [1088, 2368, 1, 512]
    - [7, 26838.4]
  - - [1344, 2368, 1, 512]
    - [114, 30259.7]
  - - [1600, 2368, 1, 512]
    - [13, 29083.4]
  - - [1856, 2368, 1, 512]
    - [101, 30143.9]
  - - [2112, 2368, 1, 512]
    - [117, 29032.0]
  - - [2368, 2368, 1, 512]
    - [103, 32404.1]
  - - [2624, 2368, 1, 512]
    - [103, 30560.8]
  - - [2880, 2368, 1, 512]
    - [117, 32740.3]
  - - [3136, 2368, 1, 512]
    - [101, 31319.1]
  - - [3392, 2368, 1, 512]
    - [114, 32887.0]
  - - [3648, 2368, 1, 512]
    - [114, 32248.6]
  - - [3904, 2368, 1, 512]
    - [114, 33438.9]
  - - [64, 2624, 1, 512]
    - [66, 11698.4]
  - - [320, 2624, 1, 512]
    - [109, 25820.8]
  - - [576, 2624, 1, 512]
    - [7, 24684.2]
  - - [832, 2624, 1, 512]
    - [114, 31354.3]
  - - [1088, 2624, 1, 512]
    - [4, 27762.9]
  - - [1344, 2624, 1, 512]
    - [101, 32129.0]
  - - [1600, 2624, 1, 512]
    - [114, 29608.6]
  - - [1856, 2624, 1, 512]
    - [109, 31286.2]
  - - [2112, 2624, 1, 512]
    - [101, 31809.9]
  - - [2368, 2624, 1, 512]
    - [109, 32347.5]
  - - [2624, 2624, 1, 512]
    - [109, 32611.6]
  - - [2880, 2624, 1, 512]
    - [114, 32845.9]
  - - [3136, 2624, 1, 512]
    - [114, 33279.4]
  - - [3392, 2624, 1, 512]
    - [114, 32585.7]
  - - [3648, 2624, 1, 512]
    - [114, 33952.5]
  - - [3904, 2624, 1, 512]
    - [109, 33133.1]
  - - [64, 2880, 1, 512]
    - [17, 12753.0]
  - - [320, 2880, 1, 512]
    - [101, 30541.0]
  - - [576, 2880, 1, 512]
    - [6, 25973.9]
  - - [832, 2880, 1, 512]
    - [101, 32672.0]
  - - [1088, 2880, 1, 512]
    - [109, 29572.7]
  - - [1344, 2880, 1, 512]
    - [109, 31633.0]
  - - [1600, 2880, 1, 512]
    - [109, 32186.8]
  - - [1856, 2880, 1, 512]
    - [117, 31152.9]
  - - [2112, 2880, 1, 512]
    - [109, 33236.6]
  - - [2368, 2880, 1, 512]
    - [114, 32618.0]
  - - [2624, 2880, 1, 512]
    - [109, 33500.0]
  - - [2880, 2880, 1, 512]
    - [114, 34082.9]
  - - [3136, 2880, 1, 512]
    - [109, 32994.8]
  - - [3392, 2880, 1, 512]
    - [101, 34223.1]
  - - [3648, 2880, 1, 512]
    - [114, 33662.0]
  - - [3904, 2880, 1, 512]
    - [109, 34564.3]
  - - [64, 3136, 1, 512]
    - [17, 13793.3]
  - - [320, 3136, 1, 512]
    - [13, 28704.0]
  - - [576, 3136, 1, 512]
    - [98, 27121.5]
  - - [832, 3136, 1, 512]
    - [109, 27346.7]
  - - [1088, 3136, 1, 512]
    - [101, 30249.8]
  - - [1344, 3136, 1, 512]
    - [114, 29581.5]
  - - [1600, 3136, 1, 512]
    - [13, 30205.9]
  - - [1856, 3136, 1, 512]
    - [103, 33111.7]
  - - [2112, 3136, 1, 512]
    - [114, 31707.3]
  - - [2368, 3136, 1, 512]
    - [117, 30974.6]
  - - [2624, 3136, 1, 512]
    - [109, 33122.5]
  - - [2880, 3136, 1, 512]
    - [114, 32877.5]
  - - [3136, 3136, 1, 512]
    - [114, 32030.9]
  - - [3392, 3136, 1, 512]
    - [114, 33526.0]
  - - [3648, 3136, 1, 512]
    - [117, 32832.7]
  - - [3904, 3136, 1, 512]
    - [109, 32470.3]
  - - [64, 3392, 1, 512]
    - [17, 14919.3]
  - - [320, 3392, 1, 512]
    - [109, 28795.1]
  - - [576, 3392, 1, 512]
    - [98, 28020.8]
  - - [832, 3392, 1, 512]
    - [97, 28166.4]
  - - [1088, 3392, 1, 512]
    - [109, 29227.1]
  - - [1344, 3392, 1, 512]
    - [114, 31121.7]
  - - [1600, 3392, 1, 512]
    - [117, 31380.3]
  - - [1856, 3392, 1, 512]
    - [109, 31678.8]
  - - [2112, 3392, 1, 512]
    - [117, 33344.7]
  - - [2368, 3392, 1, 512]
    - [114, 33299.7]
  - - [2624, 3392, 1, 512]
    - [109, 32435.0]
  - - [2880, 3392, 1, 512]
    - [109, 33681.5]
  - - [3136, 3392, 1, 512]
    - [114, 33922.8]
  - - [3392, 3392, 1, 512]
    - [114, 33253.7]
  - - [3648, 3392, 1, 512]
    - [109, 33592.2]
  - - [3904, 3392, 1, 512]
    - [101, 34002.5]
  - - [64, 3648, 1, 512]
    - [17, 16045.3]
  - - [320, 3648, 1, 512]
    - [101, 31707.6]
  - - [576, 3648, 1, 512]
    - [101, 29515.5]
  - - [832, 3648, 1, 512]
    - [101, 29046.5]
  - - [1088, 3648, 1, 512]
    - [109, 29345.0]
  - - [1344, 3648, 1, 512]
    - [101, 32664.8]
  - - [1600, 3648, 1, 512]
    - [117, 32678.4]
  - - [1856, 3648, 1, 512]
    - [117, 32232.4]
  - - [2112, 3648, 1, 512]
    - [109, 32668.7]
  - - [2368, 3648, 1, 512]
    - [109, 34299.3]
  - - [2624, 3648, 1, 512]
    - [101, 33870.4]
  - - [2880, 3648, 1, 512]
    - [114, 34121.1]
  - - [3136, 3648, 1, 512]
    - [114, 33403.7]
  - - [3392, 3648, 1, 512]
    - [109, 34153.6]
  - - [3648, 3648, 1, 512]
    - [114, 34534.4]
  - - [3904, 3648, 1, 512]
    - [101, 34257.9]
  - - [64, 3904, 1, 512]
    - [17, 13829.9]
  - - [320, 3904, 1, 512]
    - [97, 25034.5]
  - - [576, 3904, 1, 512]
    - [114, 31286.3]
  - - [832, 3904, 1, 512]
    - [101, 29910.8]
  - - [1088, 3904, 1, 512]
    - [109, 29408.3]
  - - [1344, 3904, 1, 512]
    - [117, 30967.7]
  - - [1600, 3904, 1, 512]
    - [103, 30885.1]
  - - [1856, 3904, 1, 512]
    - [109, 32903.4]
  - - [2112, 3904, 1, 512]
    - [114, 33962.7]
  - - [2368, 3904, 1, 512]
    - [114, 33368.1]
  - - [2624, 3904, 1, 512]
    - [109, 33122.7]
  - - [2880, 3904, 1, 512]
    - [114, 33596.0]
  - - [3136, 3904, 1, 512]
    - [114, 32724.5]
  - - [3392, 3904, 1, 512]
    - [109, 33581.4]
  - - [3648, 3904, 1, 512]
    - [114, 34444.0]
  - - [3904, 3904, 1, 512]
    - [101, 33114.8]
  - - [64, 64, 1, 1024]
    - [84, 1118.48]
  - - [320, 64, 1, 1024]
    - [118, 4712.7]
  - - [576, 64, 1, 1024]
    - [16, 6990.51]
  - - [832, 64, 1, 1024]
    - [15, 8724.15]
  - - [1088, 64, 1, 1024]
    - [15, 9260.15]
  - - [1344, 64, 1, 1024]
    - [15, 8193.52]
  - - [1600, 64, 1, 1024]
    - [15, 9446.63]
  - - [1856, 64, 1, 1024]
    - [15, 10308.0]
  - - [2112, 64, 1, 1024]
    - [15, 10898.6]
  - - [2368, 64, 1, 1024]
    - [15, 10593.1]
  - - [2624, 64, 1, 1024]
    - [16, 10056.5]
  - - [2880, 64, 1, 1024]
    - [98, 10485.8]
  - - [3136, 64, 1, 1024]
    - [98, 10874.1]
  - - [3392, 64, 1, 1024]
    - [60, 11312.9]
  - - [3648, 64, 1, 1024]
    - [16, 12355.3]
  - - [3904, 64, 1, 1024]
    - [16, 11983.7]
  - - [64, 320, 1, 1024]
    - [102, 4993.22]
  - - [320, 320, 1, 1024]
    - [55, 12633.4]
  - - [576, 320, 1, 1024]
    - [3, 16412.5]
  - - [832, 320, 1, 1024]
    - [60, 18998.6]
  - - [1088, 320, 1, 1024]
    - [98, 21033.4]
  - - [1344, 320, 1, 1024]
    - [98, 25530.5]
  - - [1600, 320, 1, 1024]
    - [109, 22696.5]
  - - [1856, 320, 1, 1024]
    - [109, 24086.1]
  - - [2112, 320, 1, 1024]
    - [109, 23499.5]
  - - [2368, 320, 1, 1024]
    - [98, 24594.2]
  - - [2624, 320, 1, 1024]
    - [98, 26016.1]
  - - [2880, 320, 1, 1024]
    - [98, 27314.6]
  - - [3136, 320, 1, 1024]
    - [109, 23925.6]
  - - [3392, 320, 1, 1024]
    - [8, 24110.4]
  - - [3648, 320, 1, 1024]
    - [6, 25818.1]
  - - [3904, 320, 1, 1024]
    - [98, 26875.3]
  - - [64, 576, 1, 1024]
    - [16, 7401.71]
  - - [320, 576, 1, 1024]
    - [13, 16629.4]
  - - [576, 576, 1, 1024]
    - [60, 24529.9]
  - - [832, 576, 1, 1024]
    - [97, 26172.5]
  - - [1088, 576, 1, 1024]
    - [109, 27249.6]
  - - [1344, 576, 1, 1024]
    - [101, 27477.4]
  - - [1600, 576, 1, 1024]
    - [8, 30840.5]
  - - [1856, 576, 1, 1024]
    - [117, 28999.0]
  - - [2112, 576, 1, 1024]
    - [7, 28802.5]
  - - [2368, 576, 1, 1024]
    - [8, 30231.7]
  - - [2624, 576, 1, 1024]
    - [8, 27105.0]
  - - [2880, 576, 1, 1024]
    - [6, 29363.8]
  - - [3136, 576, 1, 1024]
    - [8, 32224.5]
  - - [3392, 576, 1, 1024]
    - [97, 32010.9]
  - - [3648, 576, 1, 1024]
    - [60, 31853.1]
  - - [3904, 576, 1, 1024]
    - [8, 31478.8]
  - - [64, 832, 1, 1024]
    - [15, 9012.55]
  - - [320, 832, 1, 1024]
    - [60, 19613.7]
  - - [576, 832, 1, 1024]
    - [98, 30961.1]
  - - [832, 832, 1, 1024]
    - [13, 26648.0]
  - - [1088, 832, 1, 1024]
    - [98, 29614.7]
  - - [1344, 832, 1, 1024]
    - [103, 31674.8]
  - - [1600, 832, 1, 1024]
    - [6, 28488.0]
  - - [1856, 832, 1, 1024]
    - [7, 27381.0]
  - - [2112, 832, 1, 1024]
    - [7, 29257.8]
  - - [2368, 832, 1, 1024]
    - [103, 31133.6]
  - - [2624, 832, 1, 1024]
    - [114, 32900.1]
  - - [2880, 832, 1, 1024]
    - [98, 30863.7]
  - - [3136, 832, 1, 1024]
    - [7, 31175.9]
  - - [3392, 832, 1, 1024]
    - [98, 30874.7]
  - - [3648, 832, 1, 1024]
    - [114, 32140.4]
  - - [3904, 832, 1, 1024]
    - [114, 33111.8]
  - - [64, 1088, 1, 1024]
    - [15, 11594.0]
  - - [320, 1088, 1, 1024]
    - [7, 22927.1]
  - - [576, 1088, 1, 1024]
    - [109, 29572.7]
  - - [832, 1088, 1, 1024]
    - [109, 32410.5]
  - - [1088, 1088, 1, 1024]
    - [97, 27455.4]
  - - [1344, 1088, 1, 1024]
    - [98, 29739.2]
  - - [1600, 1088, 1, 1024]
    - [97, 29294.6]
  - - [1856, 1088, 1, 1024]
    - [101, 31425.4]
  - - [2112, 1088, 1, 1024]
    - [109, 34027.5]
  - - [2368, 1088, 1, 1024]
    - [97, 30605.8]
  - - [2624, 1088, 1, 1024]
    - [109, 30579.8]
  - - [2880, 1088, 1, 1024]
    - [109, 32263.9]
  - - [3136, 1088, 1, 1024]
    - [101, 34103.0]
  - - [3392, 1088, 1, 1024]
    - [97, 32039.6]
  - - [3648, 1088, 1, 1024]
    - [109, 31914.3]
  - - [3904, 1088, 1, 1024]
    - [101, 33227.6]
  - - [64, 1344, 1, 1024]
    - [55, 10485.8]
  - - [320, 1344, 1, 1024]
    - [97, 28597.5]
  - - [576, 1344, 1, 1024]
    - [109, 29360.1]
  - - [832, 1344, 1, 1024]
    - [101, 31500.5]
  - - [1088, 1344, 1, 1024]
    - [97, 31723.9]
  - - [1344, 1344, 1, 1024]
    - [8, 32057.0]
  - - [1600, 1344, 1, 1024]
    - [101, 33263.0]
  - - [1856, 1344, 1, 1024]
    - [109, 32580.8]
  - - [2112, 1344, 1, 1024]
    - [97, 33067.7]
  - - [2368, 1344, 1, 1024]
    - [101, 33374.0]
  - - [2624, 1344, 1, 1024]
    - [101, 35969.1]
  - - [2880, 1344, 1, 1024]
    - [97, 33604.2]
  - - [3136, 1344, 1, 1024]
    - [101, 33456.9]
  - - [3392, 1344, 1, 1024]
    - [101, 35432.7]
  - - [3648, 1344, 1, 1024]
    - [101, 36984.0]
  - - [3904, 1344, 1, 1024]
    - [8, 34255.0]
  - - [64, 1600, 1, 1024]
    - [55, 12264.0]
  - - [320, 1600, 1, 1024]
    - [13, 26084.0]
  - - [576, 1600, 1, 1024]
    - [114, 33112.9]
  - - [832, 1600, 1, 1024]
    - [60, 29730.6]
  - - [1088, 1600, 1, 1024]
    - [6, 29246.6]
  - - [1344, 1600, 1, 1024]
    - [103, 32816.8]
  - - [1600, 1600, 1, 1024]
    - [7, 30786.1]
  - - [1856, 1600, 1, 1024]
    - [114, 31333.0]
  - - [2112, 1600, 1, 1024]
    - [114, 34108.4]
  - - [2368, 1600, 1, 1024]
    - [8, 31866.4]
  - - [2624, 1600, 1, 1024]
    - [114, 32471.0]
  - - [2880, 1600, 1, 1024]
    - [117, 34118.5]
  - - [3136, 1600, 1, 1024]
    - [7, 32999.5]
  - - [3392, 1600, 1, 1024]
    - [114, 33539.2]
  - - [3648, 1600, 1, 1024]
    - [114, 34588.4]
  - - [3904, 1600, 1, 1024]
    - [7, 32928.3]
  - - [64, 1856, 1, 1024]
    - [15, 13822.1]
  - - [320, 1856, 1, 1024]
    - [13, 29169.0]
  - - [576, 1856, 1, 1024]
    - [101, 31277.5]
  - - [832, 1856, 1, 1024]
    - [7, 27596.0]
  - - [1088, 1856, 1, 1024]
    - [114, 31071.3]
  - - [1344, 1856, 1, 1024]
    - [7, 31112.4]
  - - [1600, 1856, 1, 1024]
    - [114, 31875.0]
  - - [1856, 1856, 1, 1024]
    - [114, 34330.0]
  - - [2112, 1856, 1, 1024]
    - [7, 32047.5]
  - - [2368, 1856, 1, 1024]
    - [114, 34276.4]
  - - [2624, 1856, 1, 1024]
    - [7, 32060.6]
  - - [2880, 1856, 1, 1024]
    - [114, 33611.1]
  - - [3136, 1856, 1, 1024]
    - [114, 35413.6]
  - - [3392, 1856, 1, 1024]
    - [114, 33778.6]
  - - [3648, 1856, 1, 1024]
    - [114, 35193.8]
  - - [3904, 1856, 1, 1024]
    - [109, 34712.2]
  - - [64, 2112, 1, 1024]
    - [15, 15639.8]
  - - [320, 2112, 1, 1024]
    - [109, 31103.8]
  - - [576, 2112, 1, 1024]
    - [101, 34035.7]
  - - [832, 2112, 1, 1024]
    - [8, 30837.3]
  - - [1088, 2112, 1, 1024]
    - [101, 34577.6]
  - - [1344, 2112, 1, 1024]
    - [97, 33275.9]
  - - [1600, 2112, 1, 1024]
    - [101, 34226.5]
  - - [1856, 2112, 1, 1024]
    - [97, 33603.6]
  - - [2112, 2112, 1, 1024]
    - [101, 34381.6]
  - - [2368, 2112, 1, 1024]
    - [109, 33703.5]
  - - [2624, 2112, 1, 1024]
    - [114, 33559.4]
  - - [2880, 2112, 1, 1024]
    - [101, 34776.9]
  - - [3136, 2112, 1, 1024]
    - [114, 34158.6]
  - - [3392, 2112, 1, 1024]
    - [109, 35158.6]
  - - [3648, 2112, 1, 1024]
    - [114, 34709.6]
  - - [3904, 2112, 1, 1024]
    - [109, 35304.8]
  - - [64, 2368, 1, 1024]
    - [15, 17339.6]
  - - [320, 2368, 1, 1024]
    - [13, 29559.9]
  - - [576, 2368, 1, 1024]
    - [6, 31888.2]
  - - [832, 2368, 1, 1024]
    - [114, 30777.4]
  - - [1088, 2368, 1, 1024]
    - [8, 30605.8]
  - - [1344, 2368, 1, 1024]
    - [114, 33119.7]
  - - [1600, 2368, 1, 1024]
    - [7, 31427.6]
  - - [1856, 2368, 1, 1024]
    - [101, 34030.2]
  - - [2112, 2368, 1, 1024]
    - [7, 32955.2]
  - - [2368, 2368, 1, 1024]
    - [101, 34778.9]
  - - [2624, 2368, 1, 1024]
    - [101, 33104.9]
  - - [2880, 2368, 1, 1024]
    - [101, 34970.0]
  - - [3136, 2368, 1, 1024]
    - [101, 33684.5]
  - - [3392, 2368, 1, 1024]
    - [101, 35330.9]
  - - [3648, 2368, 1, 1024]
    - [109, 33500.4]
  - - [3904, 2368, 1, 1024]
    - [109, 34983.5]
  - - [64, 2624, 1, 1024]
    - [17, 14511.9]
  - - [320, 2624, 1, 1024]
    - [97, 28805.1]
  - - [576, 2624, 1, 1024]
    - [97, 26916.5]
  - - [832, 2624, 1, 1024]
    - [103, 32997.3]
  - - [1088, 2624, 1, 1024]
    - [97, 32554.9]
  - - [1344, 2624, 1, 1024]
    - [101, 35318.3]
  - - [1600, 2624, 1, 1024]
    - [114, 33313.9]
  - - [1856, 2624, 1, 1024]
    - [109, 34405.2]
  - - [2112, 2624, 1, 1024]
    - [114, 34730.1]
  - - [2368, 2624, 1, 1024]
    - [109, 33880.5]
  - - [2624, 2624, 1, 1024]
    - [101, 35261.9]
  - - [2880, 2624, 1, 1024]
    - [101, 34165.5]
  - - [3136, 2624, 1, 1024]
    - [109, 35278.9]
  - - [3392, 2624, 1, 1024]
    - [109, 34148.5]
  - - [3648, 2624, 1, 1024]
    - [101, 34291.0]
  - - [3904, 2624, 1, 1024]
    - [109, 34097.0]
  - - [64, 2880, 1, 1024]
    - [17, 15927.7]
  - - [320, 2880, 1, 1024]
    - [101, 31668.4]
  - - [576, 2880, 1, 1024]
    - [4, 29313.1]
  - - [832, 2880, 1, 1024]
    - [109, 35637.9]
  - - [1088, 2880, 1, 1024]
    - [101, 33010.7]
  - - [1344, 2880, 1, 1024]
    - [109, 33833.7]
  - - [1600, 2880, 1, 1024]
    - [101, 35305.6]
  - - [1856, 2880, 1, 1024]
    - [101, 34082.0]
  - - [2112, 2880, 1, 1024]
    - [101, 36434.9]
  - - [2368, 2880, 1, 1024]
    - [114, 35404.4]
  - - [2624, 2880, 1, 1024]
    - [109, 35801.5]
  - - [2880, 2880, 1, 1024]
    - [114, 36657.2]
  - - [3136, 2880, 1, 1024]
    - [109, 34788.2]
  - - [3392, 2880, 1, 1024]
    - [109, 35254.3]
  - - [3648, 2880, 1, 1024]
    - [114, 35032.2]
  - - [3904, 2880, 1, 1024]
    - [109, 34164.3]
  - - [64, 3136, 1, 1024]
    - [41, 17055.7]
  - - [320, 3136, 1, 1024]
    - [13, 30223.7]
  - - [576, 3136, 1, 1024]
    - [7, 31192.0]
  - - [832, 3136, 1, 1024]
    - [7, 30851.9]
  - - [1088, 3136, 1, 1024]
    - [109, 34186.5]
  - - [1344, 3136, 1, 1024]
    - [114, 33824.0]
  - - [1600, 3136, 1, 1024]
    - [114, 33636.8]
  - - [1856, 3136, 1, 1024]
    - [101, 35131.8]
  - - [2112, 3136, 1, 1024]
    - [114, 34647.2]
  - - [2368, 3136, 1, 1024]
    - [114, 34016.0]
  - - [2624, 3136, 1, 1024]
    - [109, 34819.7]
  - - [2880, 3136, 1, 1024]
    - [109, 34221.8]
  - - [3136, 3136, 1, 1024]
    - [114, 33368.2]
  - - [3392, 3136, 1, 1024]
    - [114, 33843.7]
  - - [3648, 3136, 1, 1024]
    - [114, 33542.4]
  - - [3904, 3136, 1, 1024]
    - [114, 33311.5]
  - - [64, 3392, 1, 1024]
    - [17, 18524.8]
  - - [320, 3392, 1, 1024]
    - [109, 26880.1]
  - - [576, 3392, 1, 1024]
    - [98, 31090.6]
  - - [832, 3392, 1, 1024]
    - [97, 33121.8]
  - - [1088, 3392, 1, 1024]
    - [109, 33019.4]
  - - [1344, 3392, 1, 1024]
    - [101, 34824.8]
  - - [1600, 3392, 1, 1024]
    - [109, 33980.1]
  - - [1856, 3392, 1, 1024]
    - [109, 33541.3]
  - - [2112, 3392, 1, 1024]
    - [101, 35099.7]
  - - [2368, 3392, 1, 1024]
    - [109, 35134.7]
  - - [2624, 3392, 1, 1024]
    - [114, 33869.3]
  - - [2880, 3392, 1, 1024]
    - [109, 34393.7]
  - - [3136, 3392, 1, 1024]
    - [109, 35069.6]
  - - [3392, 3392, 1, 1024]
    - [103, 33667.1]
  - - [3648, 3392, 1, 1024]
    - [7, 33366.7]
  - - [3904, 3392, 1, 1024]
    - [101, 33424.2]
  - - [64, 3648, 1, 1024]
    - [17, 20006.3]
  - - [320, 3648, 1, 1024]
    - [101, 29014.0]
  - - [576, 3648, 1, 1024]
    - [103, 31503.3]
  - - [832, 3648, 1, 1024]
    - [101, 32107.2]
  - - [1088, 3648, 1, 1024]
    - [109, 32384.7]
  - - [1344, 3648, 1, 1024]
    - [101, 36054.4]
  - - [1600, 3648, 1, 1024]
    - [101, 35555.5]
  - - [1856, 3648, 1, 1024]
    - [101, 35131.4]
  - - [2112, 3648, 1, 1024]
    - [114, 34717.2]
  - - [2368, 3648, 1, 1024]
    - [109, 35489.6]
  - - [2624, 3648, 1, 1024]
    - [109, 34679.2]
  - - [2880, 3648, 1, 1024]
    - [103, 34410.3]
  - - [3136, 3648, 1, 1024]
    - [103, 33803.8]
  - - [3392, 3648, 1, 1024]
    - [101, 33437.1]
  - - [3648, 3648, 1, 1024]
    - [114, 33996.0]
  - - [3904, 3648, 1, 1024]
    - [114, 33805.3]
  - - [64, 3904, 1, 1024]
    - [17, 17000.2]
  - - [320, 3904, 1, 1024]
    - [4, 28271.0]
  - - [576, 3904, 1, 1024]
    - [114, 33615.7]
  - - [832, 3904, 1, 1024]
    - [114, 33478.4]
  - - [1088, 3904, 1, 1024]
    - [114, 33457.6]
  - - [1344, 3904, 1, 1024]
    - [7, 33496.9]
  - - [1600, 3904, 1, 1024]
    - [114, 33418.6]
  - - [1856, 3904, 1, 1024]
    - [109, 34826.2]
  - - [2112, 3904, 1, 1024]
    - [114, 36471.4]
  - - [2368, 3904, 1, 1024]
    - [109, 34990.0]
  - - [2624, 3904, 1, 1024]
    - [103, 33997.6]
  - - [2880, 3904, 1, 1024]
    - [103, 33922.7]
  - - [3136, 3904, 1, 1024]
    - [114, 33525.3]
  - - [3392, 3904, 1, 1024]
    - [114, 33465.4]
  - - [3648, 3904, 1, 1024]
    - [114, 34673.3]
  - - [3904, 3904, 1, 1024]
    - [103, 34057.8]
  - - [64, 64, 1, 2048]
    - [110, 1784.81]
  - - [320, 64, 1, 2048]
    - [102, 7489.83]
  - - [576, 64, 1, 2048]
    - [16, 8435.47]
  - - [832, 64, 1, 2048]
    - [15, 10004.8]
  - - [1088, 64, 1, 2048]
    - [15, 11454.3]
  - - [1344, 64, 1, 2048]
    - [16, 10548.5]
  - - [1600, 64, 1, 2048]
    - [15, 12018.1]
  - - [1856, 64, 1, 2048]
    - [15, 13552.6]
  - - [2112, 64, 1, 2048]
    - [16, 14016.4]
  - - [2368, 64, 1, 2048]
    - [15, 16732.0]
  - - [2624, 64, 1, 2048]
    - [16, 14635.4]
  - - [2880, 64, 1, 2048]
    - [16, 14631.3]
  - - [3136, 64, 1, 2048]
    - [13, 16087.7]
  - - [3392, 64, 1, 2048]
    - [16, 16345.4]
  - - [3648, 64, 1, 2048]
    - [16, 17579.1]
  - - [3904, 64, 1, 2048]
    - [16, 16722.4]
  - - [64, 320, 1, 2048]
    - [102, 7489.83]
  - - [320, 320, 1, 2048]
    - [18, 15252.0]
  - - [576, 320, 1, 2048]
    - [9, 19867.8]
  - - [832, 320, 1, 2048]
    - [11, 22210.2]
  - - [1088, 320, 1, 2048]
    - [98, 25062.6]
  - - [1344, 320, 1, 2048]
    - [98, 29606.9]
  - - [1600, 320, 1, 2048]
    - [109, 25731.9]
  - - [1856, 320, 1, 2048]
    - [13, 27519.2]
  - - [2112, 320, 1, 2048]
    - [109, 26041.8]
  - - [2368, 320, 1, 2048]
    - [109, 27811.7]
  - - [2624, 320, 1, 2048]
    - [98, 28805.1]
  - - [2880, 320, 1, 2048]
    - [98, 30790.2]
  - - [3136, 320, 1, 2048]
    - [109, 29297.3]
  - - [3392, 320, 1, 2048]
    - [7, 28032.5]
  - - [3648, 320, 1, 2048]
    - [7, 29847.1]
  - - [3904, 320, 1, 2048]
    - [98, 29924.3]
  - - [64, 576, 1, 2048]
    - [16, 10202.4]
  - - [320, 576, 1, 2048]
    - [10, 20913.4]
  - - [576, 576, 1, 2048]
    - [60, 28077.6]
  - - [832, 576, 1, 2048]
    - [97, 33270.1]
  - - [1088, 576, 1, 2048]
    - [109, 30449.8]
  - - [1344, 576, 1, 2048]
    - [114, 29662.2]
  - - [1600, 576, 1, 2048]
    - [8, 33142.0]
  - - [1856, 576, 1, 2048]
    - [103, 32532.3]
  - - [2112, 576, 1, 2048]
    - [109, 32440.3]
  - - [2368, 576, 1, 2048]
    - [8, 34765.5]
  - - [2624, 576, 1, 2048]
    - [8, 30347.0]
  - - [2880, 576, 1, 2048]
    - [8, 32730.1]
  - - [3136, 576, 1, 2048]
    - [8, 34509.1]
  - - [3392, 576, 1, 2048]
    - [97, 35457.4]
  - - [3648, 576, 1, 2048]
    - [60, 33804.8]
  - - [3904, 576, 1, 2048]
    - [97, 34164.3]
  - - [64, 832, 1, 2048]
    - [15, 11300.7]
  - - [320, 832, 1, 2048]
    - [10, 22862.0]
  - - [576, 832, 1, 2048]
    - [98, 33727.4]
  - - [832, 832, 1, 2048]
    - [114, 27934.5]
  - - [1088, 832, 1, 2048]
    - [98, 32129.7]
  - - [1344, 832, 1, 2048]
    - [114, 35286.4]
  - - [1600, 832, 1, 2048]
    - [7, 33513.2]
  - - [1856, 832, 1, 2048]
    - [7, 31035.4]
  - - [2112, 832, 1, 2048]
    - [7, 34404.5]
  - - [2368, 832, 1, 2048]
    - [114, 33374.0]
  - - [2624, 832, 1, 2048]
    - [114, 35289.1]
  - - [2880, 832, 1, 2048]
    - [98, 34281.1]
  - - [3136, 832, 1, 2048]
    - [7, 33938.0]
  - - [3392, 832, 1, 2048]
    - [98, 33515.5]
  - - [3648, 832, 1, 2048]
    - [114, 33663.5]
  - - [3904, 832, 1, 2048]
    - [114, 35506.6]
  - - [64, 1088, 1, 2048]
    - [15, 15090.6]
  - - [320, 1088, 1, 2048]
    - [7, 25648.6]
  - - [576, 1088, 1, 2048]
    - [109, 30889.5]
  - - [832, 1088, 1, 2048]
    - [109, 34426.8]
  - - [1088, 1088, 1, 2048]
    - [7, 30902.6]
  - - [1344, 1088, 1, 2048]
    - [98, 35252.9]
  - - [1600, 1088, 1, 2048]
    - [7, 33118.1]
  - - [1856, 1088, 1, 2048]
    - [101, 32731.2]
  - - [2112, 1088, 1, 2048]
    - [109, 36283.8]
  - - [2368, 1088, 1, 2048]
    - [7, 33206.0]
  - - [2624, 1088, 1, 2048]
    - [98, 33145.5]
  - - [2880, 1088, 1, 2048]
    - [109, 34116.3]
  - - [3136, 1088, 1, 2048]
    - [109, 36112.2]
  - - [3392, 1088, 1, 2048]
    - [97, 34472.7]
  - - [3648, 1088, 1, 2048]
    - [7, 33582.2]
  - - [3904, 1088, 1, 2048]
    - [109, 34540.3]
  - - [64, 1344, 1, 2048]
    - [75, 13195.6]
  - - [320, 1344, 1, 2048]
    - [97, 32382.5]
  - - [576, 1344, 1, 2048]
    - [101, 30401.7]
  - - [832, 1344, 1, 2048]
    - [109, 35340.9]
  - - [1088, 1344, 1, 2048]
    - [97, 36212.0]
  - - [1344, 1344, 1, 2048]
    - [7, 34752.2]
  - - [1600, 1344, 1, 2048]
    - [101, 35175.9]
  - - [1856, 1344, 1, 2048]
    - [109, 34309.4]
  - - [2112, 1344, 1, 2048]
    - [97, 35382.3]
  - - [2368, 1344, 1, 2048]
    - [8, 34578.0]
  - - [2624, 1344, 1, 2048]
    - [109, 37413.1]
  - - [2880, 1344, 1, 2048]
    - [97, 36222.2]
  - - [3136, 1344, 1, 2048]
    - [97, 35032.0]
  - - [3392, 1344, 1, 2048]
    - [109, 36859.5]
  - - [3648, 1344, 1, 2048]
    - [109, 38449.8]
  - - [3904, 1344, 1, 2048]
    - [97, 35488.1]
  - - [64, 1600, 1, 2048]
    - [102, 17476.3]
  - - [320, 1600, 1, 2048]
    - [109, 26715.3]
  - - [576, 1600, 1, 2048]
    - [7, 33435.6]
  - - [832, 1600, 1, 2048]
    - [7, 33783.1]
  - - [1088, 1600, 1, 2048]
    - [7, 32934.5]
  - - [1344, 1600, 1, 2048]
    - [60, 34245.9]
  - - [1600, 1600, 1, 2048]
    - [7, 33330.5]
  - - [1856, 1600, 1, 2048]
    - [7, 32496.6]
  - - [2112, 1600, 1, 2048]
    - [109, 35165.7]
  - - [2368, 1600, 1, 2048]
    - [7, 32816.5]
  - - [2624, 1600, 1, 2048]
    - [8, 35239.0]
  - - [2880, 1600, 1, 2048]
    - [103, 35272.6]
  - - [3136, 1600, 1, 2048]
    - [8, 34934.7]
  - - [3392, 1600, 1, 2048]
    - [109, 33995.7]
  - - [3648, 1600, 1, 2048]
    - [114, 35656.3]
  - - [3904, 1600, 1, 2048]
    - [7, 34776.7]
  - - [64, 1856, 1, 2048]
    - [81, 16893.7]
  - - [320, 1856, 1, 2048]
    - [46, 28687.5]
  - - [576, 1856, 1, 2048]
    - [109, 33248.7]
  - - [832, 1856, 1, 2048]
    - [7, 30248.7]
  - - [1088, 1856, 1, 2048]
    - [114, 32744.1]
  - - [1344, 1856, 1, 2048]
    - [7, 32487.5]
  - - [1600, 1856, 1, 2048]
    - [7, 33352.0]
  - - [1856, 1856, 1, 2048]
    - [103, 35738.7]
  - - [2112, 1856, 1, 2048]
    - [98, 34565.8]
  - - [2368, 1856, 1, 2048]
    - [109, 35222.0]
  - - [2624, 1856, 1, 2048]
    - [8, 33713.2]
  - - [2880, 1856, 1, 2048]
    - [7, 35087.0]
  - - [3136, 1856, 1, 2048]
    - [114, 36231.6]
  - - [3392, 1856, 1, 2048]
    - [8, 34818.5]
  - - [3648, 1856, 1, 2048]
    - [7, 35029.4]
  - - [3904, 1856, 1, 2048]
    - [7, 35269.0]
  - - [64, 2112, 1, 2048]
    - [15, 18895.8]
  - - [320, 2112, 1, 2048]
    - [109, 28686.4]
  - - [576, 2112, 1, 2048]
    - [101, 35065.7]
  - - [832, 2112, 1, 2048]
    - [7, 33886.2]
  - - [1088, 2112, 1, 2048]
    - [8, 34488.9]
  - - [1344, 2112, 1, 2048]
    - [7, 35609.8]
  - - [1600, 2112, 1, 2048]
    - [109, 35885.9]
  - - [1856, 2112, 1, 2048]
    - [97, 36407.7]
  - - [2112, 2112, 1, 2048]
    - [103, 34873.8]
  - - [2368, 2112, 1, 2048]
    - [8, 35083.0]
  - - [2624, 2112, 1, 2048]
    - [8, 35501.4]
  - - [2880, 2112, 1, 2048]
    - [8, 35698.8]
  - - [3136, 2112, 1, 2048]
    - [8, 36297.5]
  - - [3392, 2112, 1, 2048]
    - [8, 36803.4]
  - - [3648, 2112, 1, 2048]
    - [8, 35959.4]
  - - [3904, 2112, 1, 2048]
    - [8, 35168.7]
  - - [64, 2368, 1, 2048]
    - [15, 19832.5]
  - - [320, 2368, 1, 2048]
    - [109, 29034.5]
  - - [576, 2368, 1, 2048]
    - [7, 34444.0]
  - - [832, 2368, 1, 2048]
    - [60, 31959.8]
  - - [1088, 2368, 1, 2048]
    - [7, 33019.0]
  - - [1344, 2368, 1, 2048]
    - [7, 34495.6]
  - - [1600, 2368, 1, 2048]
    - [7, 32623.3]
  - - [1856, 2368, 1, 2048]
    - [109, 35633.3]
  - - [2112, 2368, 1, 2048]
    - [7, 34313.2]
  - - [2368, 2368, 1, 2048]
    - [8, 35351.7]
  - - [2624, 2368, 1, 2048]
    - [8, 35042.0]
  - - [2880, 2368, 1, 2048]
    - [7, 36118.5]
  - - [3136, 2368, 1, 2048]
    - [7, 35397.5]
  - - [3392, 2368, 1, 2048]
    - [8, 35881.9]
  - - [3648, 2368, 1, 2048]
    - [8, 35525.2]
  - - [3904, 2368, 1, 2048]
    - [8, 33557.4]
  - - [64, 2624, 1, 2048]
    - [81, 18540.9]
  - - [320, 2624, 1, 2048]
    - [97, 30790.8]
  - - [576, 2624, 1, 2048]
    - [7, 31078.3]
  - - [832, 2624, 1, 2048]
    - [109, 35012.7]
  - - [1088, 2624, 1, 2048]
    - [97, 35232.7]
  - - [1344, 2624, 1, 2048]
    - [109, 37105.5]
  - - [1600, 2624, 1, 2048]
    - [7, 34832.2]
  - - [1856, 2624, 1, 2048]
    - [109, 35672.6]
  - - [2112, 2624, 1, 2048]
    - [109, 35429.3]
  - - [2368, 2624, 1, 2048]
    - [8, 35075.8]
  - - [2624, 2624, 1, 2048]
    - [8, 35314.9]
  - - [2880, 2624, 1, 2048]
    - [7, 36640.6]
  - - [3136, 2624, 1, 2048]
    - [8, 36013.9]
  - - [3392, 2624, 1, 2048]
    - [7, 35953.5]
  - - [3648, 2624, 1, 2048]
    - [7, 34228.2]
  - - [3904, 2624, 1, 2048]
    - [8, 34155.3]
  - - [64, 2880, 1, 2048]
    - [81, 19017.0]
  - - [320, 2880, 1, 2048]
    - [97, 33614.2]
  - - [576, 2880, 1, 2048]
    - [7, 32081.1]
  - - [832, 2880, 1, 2048]
    - [109, 37632.9]
  - - [1088, 2880, 1, 2048]
    - [109, 34390.6]
  - - [1344, 2880, 1, 2048]
    - [97, 35708.3]
  - - [1600, 2880, 1, 2048]
    - [109, 36742.0]
  - - [1856, 2880, 1, 2048]
    - [97, 35330.4]
  - - [2112, 2880, 1, 2048]
    - [109, 37036.1]
  - - [2368, 2880, 1, 2048]
    - [103, 35390.9]
  - - [2624, 2880, 1, 2048]
    - [8, 36127.4]
  - - [2880, 2880, 1, 2048]
    - [8, 36081.0]
  - - [3136, 2880, 1, 2048]
    - [7, 36350.4]
  - - [3392, 2880, 1, 2048]
    - [8, 34967.8]
  - - [3648, 2880, 1, 2048]
    - [8, 34629.1]
  - - [3904, 2880, 1, 2048]
    - [8, 34762.6]
  - - [64, 3136, 1, 2048]
    - [80, 21025.2]
  - - [320, 3136, 1, 2048]
    - [46, 28328.2]
  - - [576, 3136, 1, 2048]
    - [7, 34095.6]
  - - [832, 3136, 1, 2048]
    - [7, 33158.8]
  - - [1088, 3136, 1, 2048]
    - [109, 36065.6]
  - - [1344, 3136, 1, 2048]
    - [7, 35595.4]
  - - [1600, 3136, 1, 2048]
    - [7, 33880.8]
  - - [1856, 3136, 1, 2048]
    - [109, 36072.7]
  - - [2112, 3136, 1, 2048]
    - [7, 36596.2]
  - - [2368, 3136, 1, 2048]
    - [7, 35409.9]
  - - [2624, 3136, 1, 2048]
    - [8, 35565.5]
  - - [2880, 3136, 1, 2048]
    - [7, 35958.2]
  - - [3136, 3136, 1, 2048]
    - [8, 34663.2]
  - - [3392, 3136, 1, 2048]
    - [8, 34095.3]
  - - [3648, 3136, 1, 2048]
    - [8, 34321.2]
  - - [3904, 3136, 1, 2048]
    - [8, 34349.7]
  - - [64, 3392, 1, 2048]
    - [10, 20922.2]
  - - [320, 3392, 1, 2048]
    - [97, 28192.5]
  - - [576, 3392, 1, 2048]
    - [98, 34946.4]
  - - [832, 3392, 1, 2048]
    - [97, 34423.8]
  - - [1088, 3392, 1, 2048]
    - [109, 35384.5]
  - - [1344, 3392, 1, 2048]
    - [109, 36048.3]
  - - [1600, 3392, 1, 2048]
    - [109, 34930.6]
  - - [1856, 3392, 1, 2048]
    - [8, 35059.9]
  - - [2112, 3392, 1, 2048]
    - [7, 36428.7]
  - - [2368, 3392, 1, 2048]
    - [7, 35613.9]
  - - [2624, 3392, 1, 2048]
    - [8, 33992.4]
  - - [2880, 3392, 1, 2048]
    - [8, 34381.9]
  - - [3136, 3392, 1, 2048]
    - [8, 33928.1]
  - - [3392, 3392, 1, 2048]
    - [8, 33850.9]
  - - [3648, 3392, 1, 2048]
    - [8, 34018.4]
  - - [3904, 3392, 1, 2048]
    - [8, 34124.4]
  - - [64, 3648, 1, 2048]
    - [97, 22554.3]
  - - [320, 3648, 1, 2048]
    - [97, 30769.0]
  - - [576, 3648, 1, 2048]
    - [109, 34153.6]
  - - [832, 3648, 1, 2048]
    - [109, 33627.0]
  - - [1088, 3648, 1, 2048]
    - [97, 33784.5]
  - - [1344, 3648, 1, 2048]
    - [109, 35861.3]
  - - [1600, 3648, 1, 2048]
    - [109, 36511.2]
  - - [1856, 3648, 1, 2048]
    - [97, 35189.4]
  - - [2112, 3648, 1, 2048]
    - [7, 37218.9]
  - - [2368, 3648, 1, 2048]
    - [8, 35600.3]
  - - [2624, 3648, 1, 2048]
    - [8, 35297.4]
  - - [2880, 3648, 1, 2048]
    - [8, 34825.2]
  - - [3136, 3648, 1, 2048]
    - [8, 34336.3]
  - - [3392, 3648, 1, 2048]
    - [8, 34241.3]
  - - [3648, 3648, 1, 2048]
    - [8, 34745.8]
  - - [3904, 3648, 1, 2048]
    - [8, 34891.1]
  - - [64, 3904, 1, 2048]
    - [80, 20633.3]
  - - [320, 3904, 1, 2048]
    - [97, 31881.9]
  - - [576, 3904, 1, 2048]
    - [109, 35209.1]
  - - [832, 3904, 1, 2048]
    - [7, 35159.4]
  - - [1088, 3904, 1, 2048]
    - [109, 34581.5]
  - - [1344, 3904, 1, 2048]
    - [7, 36451.2]
  - - [1600, 3904, 1, 2048]
    - [8, 35159.1]
  - - [1856, 3904, 1, 2048]
    - [8, 35311.0]
  - - [2112, 3904, 1, 2048]
    - [7, 35231.1]
  - - [2368, 3904, 1, 2048]
    - [8, 35132.8]
  - - [2624, 3904, 1, 2048]
    - [8, 33967.3]
  - - [2880, 3904, 1, 2048]
    - [8, 34078.3]
  - - [3136, 3904, 1, 2048]
    - [8, 33892.3]
  - - [3392, 3904, 1, 2048]
    - [8, 34598.9]
  - - [3648, 3904, 1, 2048]
    - [8, 34366.9]
  - - [3904, 3904, 1, 2048]
    - [8, 34603.4]
  - - [64, 64, 1, 4096]
    - [84, 3078.39]
  - - [320, 64, 1, 4096]
    - [72, 8027.38]
  - - [576, 64, 1, 4096]
    - [16, 11889.4]
  - - [832, 64, 1, 4096]
    - [16, 12322.2]
  - - [1088, 64, 1, 4096]
    - [16, 15542.9]
  - - [1344, 64, 1, 4096]
    - [76, 14264.0]
  - - [1600, 64, 1, 4096]
    - [102, 14716.9]
  - - [1856, 64, 1, 4096]
    - [76, 17660.2]
  - - [2112, 64, 1, 4096]
    - [15, 18516.7]
  - - [2368, 64, 1, 4096]
    - [15, 20121.8]
  - - [2624, 64, 1, 4096]
    - [16, 17592.5]
  - - [2880, 64, 1, 4096]
    - [16, 16870.9]
  - - [3136, 64, 1, 4096]
    - [13, 18047.9]
  - - [3392, 64, 1, 4096]
    - [16, 18979.6]
  - - [3648, 64, 1, 4096]
    - [16, 19737.9]
  - - [3904, 64, 1, 4096]
    - [16, 17599.5]
  - - [64, 320, 1, 4096]
    - [75, 8065.97]
  - - [320, 320, 1, 4096]
    - [78, 20510.0]
  - - [576, 320, 1, 4096]
    - [9, 24512.2]
  - - [832, 320, 1, 4096]
    - [11, 24588.9]
  - - [1088, 320, 1, 4096]
    - [8, 27477.1]
  - - [1344, 320, 1, 4096]
    - [98, 30690.0]
  - - [1600, 320, 1, 4096]
    - [10, 29980.7]
  - - [1856, 320, 1, 4096]
    - [109, 30793.6]
  - - [2112, 320, 1, 4096]
    - [109, 28671.6]
  - - [2368, 320, 1, 4096]
    - [46, 30459.1]
  - - [2624, 320, 1, 4096]
    - [98, 31919.5]
  - - [2880, 320, 1, 4096]
    - [98, 34552.6]
  - - [3136, 320, 1, 4096]
    - [109, 30963.6]
  - - [3392, 320, 1, 4096]
    - [8, 30142.1]
  - - [3648, 320, 1, 4096]
    - [7, 30868.3]
  - - [3904, 320, 1, 4096]
    - [98, 24577.6]
  - - [64, 576, 1, 4096]
    - [16, 13664.7]
  - - [320, 576, 1, 4096]
    - [10, 25505.9]
  - - [576, 576, 1, 4096]
    - [10, 30572.7]
  - - [832, 576, 1, 4096]
    - [97, 34773.0]
  - - [1088, 576, 1, 4096]
    - [114, 32867.0]
  - - [1344, 576, 1, 4096]
    - [114, 32126.6]
  - - [1600, 576, 1, 4096]
    - [8, 36560.5]
  - - [1856, 576, 1, 4096]
    - [114, 33865.8]
  - - [2112, 576, 1, 4096]
    - [109, 35065.7]
  - - [2368, 576, 1, 4096]
    - [8, 35812.9]
  - - [2624, 576, 1, 4096]
    - [8, 32126.6]
  - - [2880, 576, 1, 4096]
    - [97, 33365.0]
  - - [3136, 576, 1, 4096]
    - [8, 34982.3]
  - - [3392, 576, 1, 4096]
    - [97, 35774.4]
  - - [3648, 576, 1, 4096]
    - [97, 30688.9]
  - - [3904, 576, 1, 4096]
    - [97, 29474.2]
  - - [64, 832, 1, 4096]
    - [75, 14255.2]
  - - [320, 832, 1, 4096]
    - [10, 24099.9]
  - - [576, 832, 1, 4096]
    - [98, 34803.8]
  - - [832, 832, 1, 4096]
    - [109, 29972.0]
  - - [1088, 832, 1, 4096]
    - [98, 34684.4]
  - - [1344, 832, 1, 4096]
    - [114, 36656.1]
  - - [1600, 832, 1, 4096]
    - [7, 34674.7]
  - - [1856, 832, 1, 4096]
    - [7, 31265.5]
  - - [2112, 832, 1, 4096]
    - [7, 34628.0]
  - - [2368, 832, 1, 4096]
    - [114, 33401.7]
  - - [2624, 832, 1, 4096]
    - [114, 36174.2]
  - - [2880, 832, 1, 4096]
    - [98, 35171.7]
  - - [3136, 832, 1, 4096]
    - [7, 32228.8]
  - - [3392, 832, 1, 4096]
    - [97, 30173.6]
  - - [3648, 832, 1, 4096]
    - [7, 29362.1]
  - - [3904, 832, 1, 4096]
    - [97, 29660.8]
  - - [64, 1088, 1, 4096]
    - [16, 17444.2]
  - - [320, 1088, 1, 4096]
    - [97, 26705.3]
  - - [576, 1088, 1, 4096]
    - [109, 33423.4]
  - - [832, 1088, 1, 4096]
    - [109, 35841.1]
  - - [1088, 1088, 1, 4096]
    - [97, 31721.4]
  - - [1344, 1088, 1, 4096]
    - [98, 36443.4]
  - - [1600, 1088, 1, 4096]
    - [97, 34157.2]
  - - [1856, 1088, 1, 4096]
    - [109, 33828.9]
  - - [2112, 1088, 1, 4096]
    - [109, 37297.5]
  - - [2368, 1088, 1, 4096]
    - [8, 33389.9]
  - - [2624, 1088, 1, 4096]
    - [98, 34042.9]
  - - [2880, 1088, 1, 4096]
    - [8, 34834.0]
  - - [3136, 1088, 1, 4096]
    - [97, 31289.4]
  - - [3392, 1088, 1, 4096]
    - [97, 31877.4]
  - - [3648, 1088, 1, 4096]
    - [97, 31111.1]
  - - [3904, 1088, 1, 4096]
    - [97, 30506.7]
  - - [64, 1344, 1, 4096]
    - [75, 17398.6]
  - - [320, 1344, 1, 4096]
    - [97, 32412.3]
  - - [576, 1344, 1, 4096]
    - [101, 32224.5]
  - - [832, 1344, 1, 4096]
    - [101, 36350.6]
  - - [1088, 1344, 1, 4096]
    - [97, 37387.4]
  - - [1344, 1344, 1, 4096]
    - [97, 35324.7]
  - - [1600, 1344, 1, 4096]
    - [109, 36120.7]
  - - [1856, 1344, 1, 4096]
    - [109, 35087.0]
  - - [2112, 1344, 1, 4096]
    - [97, 36186.2]
  - - [2368, 1344, 1, 4096]
    - [8, 36185.7]
  - - [2624, 1344, 1, 4096]
    - [8, 35680.3]
  - - [2880, 1344, 1, 4096]
    - [98, 34088.3]
  - - [3136, 1344, 1, 4096]
    - [8, 31534.9]
  - - [3392, 1344, 1, 4096]
    - [97, 30702.1]
  - - [3648, 1344, 1, 4096]
    - [97, 31750.7]
  - - [3904, 1344, 1, 4096]
    - [97, 31445.8]
  - - [64, 1600, 1, 4096]
    - [102, 18808.5]
  - - [320, 1600, 1, 4096]
    - [109, 27324.5]
  - - [576, 1600, 1, 4096]
    - [7, 36037.0]
  - - [832, 1600, 1, 4096]
    - [7, 34741.0]
  - - [1088, 1600, 1, 4096]
    - [97, 33905.5]
  - - [1344, 1600, 1, 4096]
    - [109, 35480.5]
  - - [1600, 1600, 1, 4096]
    - [8, 33527.6]
  - - [1856, 1600, 1, 4096]
    - [8, 34428.2]
  - - [2112, 1600, 1, 4096]
    - [98, 34529.6]
  - - [2368, 1600, 1, 4096]
    - [8, 32851.2]
  - - [2624, 1600, 1, 4096]
    - [8, 33735.5]
  - - [2880, 1600, 1, 4096]
    - [98, 33367.6]
  - - [3136, 1600, 1, 4096]
    - [8, 31910.7]
  - - [3392, 1600, 1, 4096]
    - [98, 28158.6]
  - - [3648, 1600, 1, 4096]
    - [7, 27932.6]
  - - [3904, 1600, 1, 4096]
    - [7, 28043.2]
  - - [64, 1856, 1, 4096]
    - [81, 19899.4]
  - - [320, 1856, 1, 4096]
    - [114, 30427.7]
  - - [576, 1856, 1, 4096]
    - [114, 33072.9]
  - - [832, 1856, 1, 4096]
    - [7, 31304.2]
  - - [1088, 1856, 1, 4096]
    - [114, 33412.1]
  - - [1344, 1856, 1, 4096]
    - [7, 33324.6]
  - - [1600, 1856, 1, 4096]
    - [8, 33480.5]
  - - [1856, 1856, 1, 4096]
    - [109, 34531.7]
  - - [2112, 1856, 1, 4096]
    - [98, 34644.1]
  - - [2368, 1856, 1, 4096]
    - [98, 32403.8]
  - - [2624, 1856, 1, 4096]
    - [98, 32877.0]
  - - [2880, 1856, 1, 4096]
    - [98, 34354.7]
  - - [3136, 1856, 1, 4096]
    - [98, 31068.5]
  - - [3392, 1856, 1, 4096]
    - [7, 28677.2]
  - - [3648, 1856, 1, 4096]
    - [7, 29097.4]
  - - [3904, 1856, 1, 4096]
    - [7, 28588.3]
  - - [64, 2112, 1, 4096]
    - [15, 20243.1]
  - - [320, 2112, 1, 4096]
    - [109, 30073.2]
  - - [576, 2112, 1, 4096]
    - [109, 36318.0]
  - - [832, 2112, 1, 4096]
    - [97, 34347.1]
  - - [1088, 2112, 1, 4096]
    - [8, 36102.9]
  - - [1344, 2112, 1, 4096]
    - [7, 36146.8]
  - - [1600, 2112, 1, 4096]
    - [97, 35367.8]
  - - [1856, 2112, 1, 4096]
    - [97, 33561.4]
  - - [2112, 2112, 1, 4096]
    - [8, 33915.7]
  - - [2368, 2112, 1, 4096]
    - [8, 34321.8]
  - - [2624, 2112, 1, 4096]
    - [98, 33470.3]
  - - [2880, 2112, 1, 4096]
    - [98, 34075.3]
  - - [3136, 2112, 1, 4096]
    - [98, 30401.5]
  - - [3392, 2112, 1, 4096]
    - [97, 27987.4]
  - - [3648, 2112, 1, 4096]
    - [4, 27786.0]
  - - [3904, 2112, 1, 4096]
    - [4, 28202.5]
  - - [64, 2368, 1, 4096]
    - [15, 21819.2]
  - - [320, 2368, 1, 4096]
    - [97, 30929.6]
  - - [576, 2368, 1, 4096]
    - [7, 35539.5]
  - - [832, 2368, 1, 4096]
    - [109, 33257.1]
  - - [1088, 2368, 1, 4096]
    - [8, 35007.0]
  - - [1344, 2368, 1, 4096]
    - [8, 36130.5]
  - - [1600, 2368, 1, 4096]
    - [8, 33478.4]
  - - [1856, 2368, 1, 4096]
    - [8, 33256.9]
  - - [2112, 2368, 1, 4096]
    - [8, 34758.6]
  - - [2368, 2368, 1, 4096]
    - [8, 34465.8]
  - - [2624, 2368, 1, 4096]
    - [98, 34351.5]
  - - [2880, 2368, 1, 4096]
    - [98, 34854.4]
  - - [3136, 2368, 1, 4096]
    - [8, 31691.1]
  - - [3392, 2368, 1, 4096]
    - [7, 28152.2]
  - - [3648, 2368, 1, 4096]
    - [7, 28286.2]
  - - [3904, 2368, 1, 4096]
    - [97, 28466.5]
  - - [64, 2624, 1, 4096]
    - [10, 20844.4]
  - - [320, 2624, 1, 4096]
    - [97, 33246.3]
  - - [576, 2624, 1, 4096]
    - [7, 31361.7]
  - - [832, 2624, 1, 4096]
    - [109, 36321.1]
  - - [1088, 2624, 1, 4096]
    - [97, 36091.7]
  - - [1344, 2624, 1, 4096]
    - [109, 36662.9]
  - - [1600, 2624, 1, 4096]
    - [8, 33259.2]
  - - [1856, 2624, 1, 4096]
    - [8, 32841.8]
  - - [2112, 2624, 1, 4096]
    - [8, 34129.6]
  - - [2368, 2624, 1, 4096]
    - [8, 33835.5]
  - - [2624, 2624, 1, 4096]
    - [98, 33654.5]
  - - [2880, 2624, 1, 4096]
    - [98, 34485.3]
  - - [3136, 2624, 1, 4096]
    - [98, 30267.1]
  - - [3392, 2624, 1, 4096]
    - [7, 28443.1]
  - - [3648, 2624, 1, 4096]
    - [97, 28782.1]
  - - [3904, 2624, 1, 4096]
    - [97, 29054.0]
  - - [64, 2880, 1, 4096]
    - [81, 22671.9]
  - - [320, 2880, 1, 4096]
    - [97, 35612.0]
  - - [576, 2880, 1, 4096]
    - [7, 33161.4]
  - - [832, 2880, 1, 4096]
    - [109, 38970.3]
  - - [1088, 2880, 1, 4096]
    - [8, 34800.9]
  - - [1344, 2880, 1, 4096]
    - [98, 34681.1]
  - - [1600, 2880, 1, 4096]
    - [8, 34295.2]
  - - [1856, 2880, 1, 4096]
    - [8, 33393.2]
  - - [2112, 2880, 1, 4096]
    - [8, 34815.8]
  - - [2368, 2880, 1, 4096]
    - [8, 34726.6]
  - - [2624, 2880, 1, 4096]
    - [98, 34318.9]
  - - [2880, 2880, 1, 4096]
    - [98, 34995.7]
  - - [3136, 2880, 1, 4096]
    - [98, 30635.4]
  - - [3392, 2880, 1, 4096]
    - [97, 29136.9]
  - - [3648, 2880, 1, 4096]
    - [7, 28965.2]
  - - [3904, 2880, 1, 4096]
    - [97, 29330.6]
  - - [64, 3136, 1, 4096]
    - [80, 22899.3]
  - - [320, 3136, 1, 4096]
    - [13, 27820.1]
  - - [576, 3136, 1, 4096]
    - [7, 35545.3]
  - - [832, 3136, 1, 4096]
    - [8, 33282.7]
  - - [1088, 3136, 1, 4096]
    - [8, 33294.6]
  - - [1344, 3136, 1, 4096]
    - [98, 34148.5]
  - - [1600, 3136, 1, 4096]
    - [8, 33645.1]
  - - [1856, 3136, 1, 4096]
    - [8, 33533.2]
  - - [2112, 3136, 1, 4096]
    - [8, 34499.6]
  - - [2368, 3136, 1, 4096]
    - [8, 34714.8]
  - - [2624, 3136, 1, 4096]
    - [0, 33791.6]
  - - [2880, 3136, 1, 4096]
    - [98, 34654.6]
  - - [3136, 3136, 1, 4096]
    - [98, 30521.4]
  - - [3392, 3136, 1, 4096]
    - [7, 28258.5]
  - - [3648, 3136, 1, 4096]
    - [97, 28299.8]
  - - [3904, 3136, 1, 4096]
    - [4, 28329.3]
  - - [64, 3392, 1, 4096]
    - [10, 22397.8]
  - - [320, 3392, 1, 4096]
    - [7, 29249.8]
  - - [576, 3392, 1, 4096]
    - [98, 35854.5]
  - - [832, 3392, 1, 4096]
    - [8, 31613.6]
  - - [1088, 3392, 1, 4096]
    - [98, 33015.8]
  - - [1344, 3392, 1, 4096]
    - [8, 33392.4]
  - - [1600, 3392, 1, 4096]
    - [8, 33850.8]
  - - [1856, 3392, 1, 4096]
    - [8, 33359.1]
  - - [2112, 3392, 1, 4096]
    - [98, 34483.0]
  - - [2368, 3392, 1, 4096]
    - [8, 34173.1]
  - - [2624, 3392, 1, 4096]
    - [98, 34019.4]
  - - [2880, 3392, 1, 4096]
    - [98, 35254.3]
  - - [3136, 3392, 1, 4096]
    - [98, 31085.1]
  - - [3392, 3392, 1, 4096]
    - [7, 28425.8]
  - - [3648, 3392, 1, 4096]
    - [7, 28449.4]
  - - [3904, 3392, 1, 4096]
    - [7, 28281.3]
  - - [64, 3648, 1, 4096]
    - [97, 24583.6]
  - - [320, 3648, 1, 4096]
    - [8, 30611.4]
  - - [576, 3648, 1, 4096]
    - [60, 33001.2]
  - - [832, 3648, 1, 4096]
    - [8, 31758.6]
  - - [1088, 3648, 1, 4096]
    - [8, 32514.2]
  - - [1344, 3648, 1, 4096]
    - [98, 34792.7]
  - - [1600, 3648, 1, 4096]
    - [8, 34117.1]
  - - [1856, 3648, 1, 4096]
    - [8, 34063.4]
  - - [2112, 3648, 1, 4096]
    - [8, 34814.9]
  - - [2368, 3648, 1, 4096]
    - [8, 35128.5]
  - - [2624, 3648, 1, 4096]
    - [98, 34467.4]
  - - [2880, 3648, 1, 4096]
    - [98, 34308.8]
  - - [3136, 3648, 1, 4096]
    - [98, 30942.1]
  - - [3392, 3648, 1, 4096]
    - [7, 28353.1]
  - - [3648, 3648, 1, 4096]
    - [97, 28995.8]
  - - [3904, 3648, 1, 4096]
    - [97, 28686.0]
  - - [64, 3904, 1, 4096]
    - [6, 19219.0]
  - - [320, 3904, 1, 4096]
    - [98, 26769.8]
  - - [576, 3904, 1, 4096]
    - [98, 32154.6]
  - - [832, 3904, 1, 4096]
    - [8, 30908.0]
  - - [1088, 3904, 1, 4096]
    - [8, 31481.0]
  - - [1344, 3904, 1, 4096]
    - [98, 34282.4]
  - - [1600, 3904, 1, 4096]
    - [8, 34011.6]
  - - [1856, 3904, 1, 4096]
    - [8, 33936.2]
  - - [2112, 3904, 1, 4096]
    - [98, 35073.8]
  - - [2368, 3904, 1, 4096]
    - [8, 34306.8]
  - - [2624, 3904, 1, 4096]
    - [98, 34023.8]
  - - [2880, 3904, 1, 4096]
    - [98, 35223.9]
  - - [3136, 3904, 1, 4096]
    - [98, 30451.2]
  - - [3392, 3904, 1, 4096]
    - [97, 29059.4]
  - - [3648, 3904, 1, 4096]
    - [7, 28998.3]
  - - [3904, 3904, 1, 4096]
    - [7, 28873.8]
  - - [192, 64, 1, 64]
    - [32, 320.993]
  - - [448, 64, 1, 64]
    - [115, 692.456]
  - - [704, 64, 1, 64]
    - [113, 1048.58]
  - - [960, 64, 1, 64]
    - [28, 1289.23]
  - - [1216, 64, 1, 64]
    - [42, 1844.72]
  - - [1472, 64, 1, 64]
    - [113, 1884.16]
  - - [1728, 64, 1, 64]
    - [64, 2399.28]
  - - [1984, 64, 1, 64]
    - [102, 2167.06]
  - - [64, 192, 1, 64]
    - [25, 349.525]
  - - [192, 192, 1, 64]
    - [49, 827.823]
  - - [320, 192, 1, 64]
    - [102, 1310.72]
  - - [448, 192, 1, 64]
    - [29, 1693.85]
  - - [576, 192, 1, 64]
    - [33, 2483.47]
  - - [704, 192, 1, 64]
    - [4, 2402.99]
  - - [832, 192, 1, 64]
    - [15, 3407.87]
  - - [960, 192, 1, 64]
    - [3, 3145.73]
  - - [1088, 192, 1, 64]
    - [3, 3766.01]
  - - [1216, 192, 1, 64]
    - [41, 4331.07]
  - - [1344, 192, 1, 64]
    - [89, 4181.03]
  - - [1472, 192, 1, 64]
    - [3, 4698.17]
  - - [1600, 192, 1, 64]
    - [3, 5041.23]
  - - [1728, 192, 1, 64]
    - [3, 5515.24]
  - - [1856, 192, 1, 64]
    - [41, 6001.72]
  - - [1984, 192, 1, 64]
    - [4, 5946.19]
  - - [192, 320, 1, 64]
    - [102, 1355.92]
  - - [448, 320, 1, 64]
    - [90, 2513.71]
  - - [704, 320, 1, 64]
    - [45, 3559.98]
  - - [960, 320, 1, 64]
    - [62, 5106.7]
  - - [1216, 320, 1, 64]
    - [46, 6149.06]
  - - [1472, 320, 1, 64]
    - [46, 6553.6]
  - - [1728, 320, 1, 64]
    - [46, 7372.8]
  - - [1984, 320, 1, 64]
    - [46, 7321.14]
  - - [64, 448, 1, 64]
    - [51, 655.36]
  - - [192, 448, 1, 64]
    - [3, 1619.12]
  - - [320, 448, 1, 64]
    - [15, 3058.35]
  - - [448, 448, 1, 64]
    - [3, 3670.02]
  - - [576, 448, 1, 64]
    - [58, 4463.53]
  - - [704, 448, 1, 64]
    - [3, 4923.19]
  - - [832, 448, 1, 64]
    - [58, 5612.97]
  - - [960, 448, 1, 64]
    - [3, 6255.71]
  - - [1088, 448, 1, 64]
    - [60, 6057.31]
  - - [1216, 448, 1, 64]
    - [46, 6704.84]
  - - [1344, 448, 1, 64]
    - [90, 7070.67]
  - - [1472, 448, 1, 64]
    - [13, 7469.94]
  - - [1600, 448, 1, 64]
    - [13, 8192.0]
  - - [1728, 448, 1, 64]
    - [13, 8692.14]
  - - [1856, 448, 1, 64]
    - [13, 9096.62]
  - - [1984, 448, 1, 64]
    - [13, 9175.04]
  - - [192, 576, 1, 64]
    - [88, 2022.25]
  - - [448, 576, 1, 64]
    - [3, 4234.63]
  - - [704, 576, 1, 64]
    - [4, 6329.82]
  - - [960, 576, 1, 64]
    - [60, 7693.36]
  - - [1216, 576, 1, 64]
    - [109, 9437.18]
  - - [1472, 576, 1, 64]
    - [109, 9437.18]
  - - [1728, 576, 1, 64]
    - [109, 10274.4]
  - - [1984, 576, 1, 64]
    - [109, 11081.5]
  - - [64, 704, 1, 64]
    - [57, 930.188]
  - - [192, 704, 1, 64]
    - [54, 2471.64]
  - - [320, 704, 1, 64]
    - [88, 3650.11]
  - - [448, 704, 1, 64]
    - [3, 5175.66]
  - - [576, 704, 1, 64]
    - [98, 6253.56]
  - - [704, 704, 1, 64]
    - [58, 5984.8]
  - - [832, 704, 1, 64]
    - [103, 6754.34]
  - - [960, 704, 1, 64]
    - [13, 8084.81]
  - - [1088, 704, 1, 64]
    - [13, 8451.88]
  - - [1216, 704, 1, 64]
    - [103, 8908.63]
  - - [1344, 704, 1, 64]
    - [13, 9536.26]
  - - [1472, 704, 1, 64]
    - [114, 9682.11]
  - - [1600, 704, 1, 64]
    - [109, 10012.4]
  - - [1728, 704, 1, 64]
    - [60, 8847.36]
  - - [1856, 704, 1, 64]
    - [89, 9189.44]
  - - [1984, 704, 1, 64]
    - [69, 9409.59]
  - - [192, 832, 1, 64]
    - [3, 2690.43]
  - - [448, 832, 1, 64]
    - [17, 5301.13]
  - - [704, 832, 1, 64]
    - [60, 7072.94]
  - - [960, 832, 1, 64]
    - [13, 9379.46]
  - - [1216, 832, 1, 64]
    - [114, 9664.11]
  - - [1472, 832, 1, 64]
    - [114, 8660.89]
  - - [1728, 832, 1, 64]
    - [98, 9685.53]
  - - [1984, 832, 1, 64]
    - [13, 10207.2]
  - - [64, 960, 1, 64]
    - [28, 1289.23]
  - - [192, 960, 1, 64]
    - [3, 3322.95]
  - - [320, 960, 1, 64]
    - [59, 5173.89]
  - - [448, 960, 1, 64]
    - [4, 6881.28]
  - - [576, 960, 1, 64]
    - [65, 8326.93]
  - - [704, 960, 1, 64]
    - [109, 9011.2]
  - - [832, 960, 1, 64]
    - [46, 9294.2]
  - - [960, 960, 1, 64]
    - [101, 10169.4]
  - - [1088, 960, 1, 64]
    - [109, 10695.5]
  - - [1216, 960, 1, 64]
    - [101, 11494.0]
  - - [1344, 960, 1, 64]
    - [109, 10070.2]
  - - [1472, 960, 1, 64]
    - [89, 9884.12]
  - - [1600, 960, 1, 64]
    - [13, 10186.9]
  - - [1728, 960, 1, 64]
    - [46, 10945.2]
  - - [1856, 960, 1, 64]
    - [46, 11636.0]
  - - [1984, 960, 1, 64]
    - [46, 12251.0]
  - - [192, 1088, 1, 64]
    - [17, 3990.85]
  - - [448, 1088, 1, 64]
    - [13, 6177.25]
  - - [704, 1088, 1, 64]
    - [13, 8451.88]
  - - [960, 1088, 1, 64]
    - [114, 10128.3]
  - - [1216, 1088, 1, 64]
    - [60, 9408.06]
  - - [1472, 1088, 1, 64]
    - [46, 10048.9]
  - - [1728, 1088, 1, 64]
    - [13, 11796.5]
  - - [1984, 1088, 1, 64]
    - [114, 11909.5]
  - - [64, 1216, 1, 64]
    - [30, 1532.53]
  - - [192, 1216, 1, 64]
    - [64, 4093.76]
  - - [320, 1216, 1, 64]
    - [5, 5659.93]
  - - [448, 1216, 1, 64]
    - [58, 6640.98]
  - - [576, 1216, 1, 64]
    - [65, 8225.07]
  - - [704, 1216, 1, 64]
    - [46, 8981.66]
  - - [832, 1216, 1, 64]
    - [114, 9664.11]
  - - [960, 1216, 1, 64]
    - [114, 10986.9]
  - - [1088, 1216, 1, 64]
    - [89, 9104.57]
  - - [1216, 1216, 1, 64]
    - [13, 9558.99]
  - - [1344, 1216, 1, 64]
    - [13, 10459.5]
  - - [1472, 1216, 1, 64]
    - [13, 11176.3]
  - - [1600, 1216, 1, 64]
    - [13, 12577.6]
  - - [1728, 1216, 1, 64]
    - [114, 11693.9]
  - - [1856, 1216, 1, 64]
    - [114, 12505.7]
  - - [1984, 1216, 1, 64]
    - [117, 11831.6]
  - - [192, 1344, 1, 64]
    - [39, 4346.07]
  - - [448, 1344, 1, 64]
    - [101, 8112.67]
  - - [704, 1344, 1, 64]
    - [101, 10351.3]
  - - [960, 1344, 1, 64]
    - [109, 9601.79]
  - - [1216, 1344, 1, 64]
    - [13, 10305.0]
  - - [1472, 1344, 1, 64]
    - [101, 11305.0]
  - - [1728, 1344, 1, 64]
    - [109, 13451.2]
  - - [1984, 1344, 1, 64]
    - [109, 12928.5]
  - - [64, 1472, 1, 64]
    - [102, 1799.79]
  - - [192, 1472, 1, 64]
    - [38, 4637.93]
  - - [320, 1472, 1, 64]
    - [13, 6414.16]
  - - [448, 1472, 1, 64]
    - [69, 7744.07]
  - - [576, 1472, 1, 64]
    - [46, 8969.22]
  - - [704, 1472, 1, 64]
    - [109, 9825.55]
  - - [832, 1472, 1, 64]
    - [109, 8757.66]
  - - [960, 1472, 1, 64]
    - [60, 9884.12]
  - - [1088, 1472, 1, 64]
    - [13, 9808.45]
  - - [1216, 1472, 1, 64]
    - [13, 11231.1]
  - - [1344, 1472, 1, 64]
    - [13, 11458.4]
  - - [1472, 1472, 1, 64]
    - [109, 12218.0]
  - - [1600, 1472, 1, 64]
    - [101, 12720.1]
  - - [1728, 1472, 1, 64]
    - [117, 12522.4]
  - - [1856, 1472, 1, 64]
    - [46, 11854.2]
  - - [1984, 1472, 1, 64]
    - [13, 12419.2]
  - - [192, 1600, 1, 64]
    - [45, 4854.52]
  - - [448, 1600, 1, 64]
    - [46, 8574.8]
  - - [704, 1600, 1, 64]
    - [101, 10524.0]
  - - [960, 1600, 1, 64]
    - [13, 10347.8]
  - - [1216, 1600, 1, 64]
    - [46, 12577.6]
  - - [1472, 1600, 1, 64]
    - [117, 11639.6]
  - - [1728, 1600, 1, 64]
    - [46, 12639.1]
  - - [1984, 1600, 1, 64]
    - [46, 13635.0]
  - - [64, 1728, 1, 64]
    - [52, 2527.82]
  - - [192, 1728, 1, 64]
    - [65, 5817.44]
  - - [320, 1728, 1, 64]
    - [101, 7296.79]
  - - [448, 1728, 1, 64]
    - [101, 9175.04]
  - - [576, 1728, 1, 64]
    - [46, 10192.2]
  - - [704, 1728, 1, 64]
    - [109, 11796.5]
  - - [832, 1728, 1, 64]
    - [101, 10699.1]
  - - [960, 1728, 1, 64]
    - [13, 10833.5]
  - - [1088, 1728, 1, 64]
    - [13, 11514.3]
  - - [1216, 1728, 1, 64]
    - [109, 12451.8]
  - - [1344, 1728, 1, 64]
    - [101, 13451.2]
  - - [1472, 1728, 1, 64]
    - [101, 12920.0]
  - - [1600, 1728, 1, 64]
    - [13, 12776.0]
  - - [1728, 1728, 1, 64]
    - [13, 12912.4]
  - - [1856, 1728, 1, 64]
    - [109, 13459.6]
  - - [1984, 1728, 1, 64]
    - [101, 13544.1]
  - - [192, 1856, 1, 64]
    - [64, 5242.88]
  - - [448, 1856, 1, 64]
    - [109, 8795.91]
  - - [704, 1856, 1, 64]
    - [65, 9040.43]
  - - [960, 1856, 1, 64]
    - [13, 11403.3]
  - - [1216, 1856, 1, 64]
    - [101, 12398.4]
  - - [1472, 1856, 1, 64]
    - [13, 12444.8]
  - - [1728, 1856, 1, 64]
    - [95, 13073.8]
  - - [1984, 1856, 1, 64]
    - [114, 13781.7]
  - - [64, 1984, 1, 64]
    - [52, 2226.43]
  - - [192, 1984, 1, 64]
    - [98, 5736.33]
  - - [320, 1984, 1, 64]
    - [13, 7666.48]
  - - [448, 1984, 1, 64]
    - [109, 9175.04]
  - - [576, 1984, 1, 64]
    - [114, 10677.1]
  - - [704, 1984, 1, 64]
    - [46, 8721.08]
  - - [832, 1984, 1, 64]
    - [46, 10207.2]
  - - [960, 1984, 1, 64]
    - [13, 12009.6]
  - - [1088, 1984, 1, 64]
    - [117, 11807.7]
  - - [1216, 1984, 1, 64]
    - [117, 11831.6]
  - - [1344, 1984, 1, 64]
    - [13, 12018.0]
  - - [1472, 1984, 1, 64]
    - [46, 12419.2]
  - - [1600, 1984, 1, 64]
    - [13, 13963.0]
  - - [1728, 1984, 1, 64]
    - [114, 13799.7]
  - - [1856, 1984, 1, 64]
    - [109, 13277.0]
  - - [1984, 1984, 1, 64]
    - [46, 12886.0]
  - - [192, 64, 1, 256]
    - [118, 1165.08]
  - - [448, 64, 1, 256]
    - [102, 2067.61]
  - - [704, 64, 1, 256]
    - [54, 3392.45]
  - - [960, 64, 1, 256]
    - [19, 3790.03]
  - - [1216, 64, 1, 256]
    - [57, 4859.25]
  - - [1472, 64, 1, 256]
    - [67, 5242.88]
  - - [1728, 64, 1, 256]
    - [67, 6222.32]
  - - [1984, 64, 1, 256]
    - [15, 7648.44]
  - - [64, 192, 1, 256]
    - [102, 1084.73]
  - - [192, 192, 1, 256]
    - [102, 2859.75]
  - - [320, 192, 1, 256]
    - [49, 4309.22]
  - - [448, 192, 1, 256]
    - [3, 5242.88]
  - - [576, 192, 1, 256]
    - [54, 7167.48]
  - - [704, 192, 1, 256]
    - [15, 7208.96]
  - - [832, 192, 1, 256]
    - [15, 8890.1]
  - - [960, 192, 1, 256]
    - [60, 9343.75]
  - - [1088, 192, 1, 256]
    - [41, 10589.6]
  - - [1216, 192, 1, 256]
    - [3, 11605.6]
  - - [1344, 192, 1, 256]
    - [60, 11796.5]
  - - [1472, 192, 1, 256]
    - [41, 12058.6]
  - - [1600, 192, 1, 256]
    - [41, 13107.2]
  - - [1728, 192, 1, 256]
    - [60, 15032.7]
  - - [1856, 192, 1, 256]
    - [41, 15078.7]
  - - [1984, 192, 1, 256]
    - [97, 15479.0]
  - - [192, 320, 1, 256]
    - [113, 4369.07]
  - - [448, 320, 1, 256]
    - [15, 8534.92]
  - - [704, 320, 1, 256]
    - [54, 9774.86]
  - - [960, 320, 1, 256]
    - [3, 12892.3]
  - - [1216, 320, 1, 256]
    - [46, 14230.7]
  - - [1472, 320, 1, 256]
    - [98, 16186.1]
  - - [1728, 320, 1, 256]
    - [46, 18148.4]
  - - [1984, 320, 1, 256]
    - [46, 17959.0]
  - - [64, 448, 1, 256]
    - [28, 2127.55]
  - - [192, 448, 1, 256]
    - [17, 5181.2]
  - - [320, 448, 1, 256]
    - [17, 7808.54]
  - - [448, 448, 1, 256]
    - [3, 9976.74]
  - - [576, 448, 1, 256]
    - [17, 10829.6]
  - - [704, 448, 1, 256]
    - [3, 13236.1]
  - - [832, 448, 1, 256]
    - [7, 13534.8]
  - - [960, 448, 1, 256]
    - [98, 17203.2]
  - - [1088, 448, 1, 256]
    - [60, 16749.1]
  - - [1216, 448, 1, 256]
    - [46, 16904.3]
  - - [1344, 448, 1, 256]
    - [60, 17417.0]
  - - [1472, 448, 1, 256]
    - [60, 18450.4]
  - - [1600, 448, 1, 256]
    - [13, 19015.6]
  - - [1728, 448, 1, 256]
    - [13, 19621.9]
  - - [1856, 448, 1, 256]
    - [13, 19528.5]
  - - [1984, 448, 1, 256]
    - [13, 20591.9]
  - - [192, 576, 1, 256]
    - [17, 6584.08]
  - - [448, 576, 1, 256]
    - [41, 11102.6]
  - - [704, 576, 1, 256]
    - [97, 16477.6]
  - - [960, 576, 1, 256]
    - [60, 20817.3]
  - - [1216, 576, 1, 256]
    - [109, 22697.0]
  - - [1472, 576, 1, 256]
    - [101, 22609.9]
  - - [1728, 576, 1, 256]
    - [101, 23925.3]
  - - [1984, 576, 1, 256]
    - [101, 25550.5]
  - - [64, 704, 1, 256]
    - [118, 3443.09]
  - - [192, 704, 1, 256]
    - [17, 7954.71]
  - - [320, 704, 1, 256]
    - [17, 11198.4]
  - - [448, 704, 1, 256]
    - [60, 12918.5]
  - - [576, 704, 1, 256]
    - [98, 16477.6]
  - - [704, 704, 1, 256]
    - [13, 15567.8]
  - - [832, 704, 1, 256]
    - [60, 17334.8]
  - - [960, 704, 1, 256]
    - [103, 19886.8]
  - - [1088, 704, 1, 256]
    - [13, 19706.9]
  - - [1216, 704, 1, 256]
    - [114, 21072.3]
  - - [1344, 704, 1, 256]
    - [98, 21247.5]
  - - [1472, 704, 1, 256]
    - [117, 22387.3]
  - - [1600, 704, 1, 256]
    - [101, 23930.2]
  - - [1728, 704, 1, 256]
    - [114, 19836.1]
  - - [1856, 704, 1, 256]
    - [60, 21305.5]
  - - [1984, 704, 1, 256]
    - [3, 19380.2]
  - - [192, 832, 1, 256]
    - [15, 8345.81]
  - - [448, 832, 1, 256]
    - [17, 14457.6]
  - - [704, 832, 1, 256]
    - [114, 17745.1]
  - - [960, 832, 1, 256]
    - [13, 21079.6]
  - - [1216, 832, 1, 256]
    - [117, 22231.6]
  - - [1472, 832, 1, 256]
    - [8, 19234.6]
  - - [1728, 832, 1, 256]
    - [98, 22931.5]
  - - [1984, 832, 1, 256]
    - [114, 21288.5]
  - - [64, 960, 1, 256]
    - [52, 3981.93]
  - - [192, 960, 1, 256]
    - [54, 10147.5]
  - - [320, 960, 1, 256]
    - [17, 12998.9]
  - - [448, 960, 1, 256]
    - [97, 17476.3]
  - - [576, 960, 1, 256]
    - [60, 20665.4]
  - - [704, 960, 1, 256]
    - [101, 21900.6]
  - - [832, 960, 1, 256]
    - [101, 21752.4]
  - - [960, 960, 1, 256]
    - [101, 23593.0]
  - - [1088, 960, 1, 256]
    - [101, 24530.9]
  - - [1216, 960, 1, 256]
    - [101, 25986.4]
  - - [1344, 960, 1, 256]
    - [109, 21874.3]
  - - [1472, 960, 1, 256]
    - [60, 22399.9]
  - - [1600, 960, 1, 256]
    - [46, 19514.4]
  - - [1728, 960, 1, 256]
    - [101, 21023.4]
  - - [1856, 960, 1, 256]
    - [13, 22525.0]
  - - [1984, 960, 1, 256]
    - [13, 24019.1]
  - - [192, 1088, 1, 256]
    - [17, 10384.0]
  - - [448, 1088, 1, 256]
    - [60, 16976.9]
  - - [704, 1088, 1, 256]
    - [46, 19414.2]
  - - [960, 1088, 1, 256]
    - [101, 22659.9]
  - - [1216, 1088, 1, 256]
    - [109, 20842.5]
  - - [1472, 1088, 1, 256]
    - [13, 20706.7]
  - - [1728, 1088, 1, 256]
    - [13, 23307.3]
  - - [1984, 1088, 1, 256]
    - [114, 25175.4]
  - - [64, 1216, 1, 256]
    - [14, 5174.79]
  - - [192, 1216, 1, 256]
    - [17, 11719.4]
  - - [320, 1216, 1, 256]
    - [13, 15564.8]
  - - [448, 1216, 1, 256]
    - [13, 16904.3]
  - - [576, 1216, 1, 256]
    - [114, 21094.9]
  - - [704, 1216, 1, 256]
    - [101, 21380.7]
  - - [832, 1216, 1, 256]
    - [101, 22521.6]
  - - [960, 1216, 1, 256]
    - [117, 24800.3]
  - - [1088, 1216, 1, 256]
    - [60, 20842.5]
  - - [1216, 1216, 1, 256]
    - [13, 19870.7]
  - - [1344, 1216, 1, 256]
    - [109, 21183.9]
  - - [1472, 1216, 1, 256]
    - [109, 22572.8]
  - - [1600, 1216, 1, 256]
    - [13, 24119.8]
  - - [1728, 1216, 1, 256]
    - [109, 25136.4]
  - - [1856, 1216, 1, 256]
    - [114, 26143.2]
  - - [1984, 1216, 1, 256]
    - [114, 23800.0]
  - - [192, 1344, 1, 256]
    - [60, 11692.1]
  - - [448, 1344, 1, 256]
    - [101, 19511.5]
  - - [704, 1344, 1, 256]
    - [101, 24101.6]
  - - [960, 1344, 1, 256]
    - [109, 21874.3]
  - - [1216, 1344, 1, 256]
    - [13, 20815.0]
  - - [1472, 1344, 1, 256]
    - [109, 24232.6]
  - - [1728, 1344, 1, 256]
    - [109, 27847.4]
  - - [1984, 1344, 1, 256]
    - [109, 25856.9]
  - - [64, 1472, 1, 256]
    - [15, 5419.61]
  - - [192, 1472, 1, 256]
    - [17, 11959.0]
  - - [320, 1472, 1, 256]
    - [97, 16865.2]
  - - [448, 1472, 1, 256]
    - [103, 19404.7]
  - - [576, 1472, 1, 256]
    - [114, 21176.1]
  - - [704, 1472, 1, 256]
    - [114, 22771.7]
  - - [832, 1472, 1, 256]
    - [109, 19595.3]
  - - [960, 1472, 1, 256]
    - [60, 22399.9]
  - - [1088, 1472, 1, 256]
    - [13, 19854.4]
  - - [1216, 1472, 1, 256]
    - [13, 22517.3]
  - - [1344, 1472, 1, 256]
    - [114, 23946.2]
  - - [1472, 1472, 1, 256]
    - [114, 25270.9]
  - - [1600, 1472, 1, 256]
    - [109, 27159.1]
  - - [1728, 1472, 1, 256]
    - [114, 25337.2]
  - - [1856, 1472, 1, 256]
    - [13, 23708.5]
  - - [1984, 1472, 1, 256]
    - [13, 24797.2]
  - - [192, 1600, 1, 256]
    - [60, 12998.9]
  - - [448, 1600, 1, 256]
    - [46, 18820.6]
  - - [704, 1600, 1, 256]
    - [101, 24334.0]
  - - [960, 1600, 1, 256]
    - [13, 20373.9]
  - - [1216, 1600, 1, 256]
    - [13, 24657.1]
  - - [1472, 1600, 1, 256]
    - [109, 22881.6]
  - - [1728, 1600, 1, 256]
    - [46, 23831.3]
  - - [1984, 1600, 1, 256]
    - [114, 26470.6]
  - - [64, 1728, 1, 256]
    - [17, 6584.08]
  - - [192, 1728, 1, 256]
    - [60, 15032.7]
  - - [320, 1728, 1, 256]
    - [13, 18148.4]
  - - [448, 1728, 1, 256]
    - [101, 21309.8]
  - - [576, 1728, 1, 256]
    - [101, 23376.5]
  - - [704, 1728, 1, 256]
    - [101, 26504.4]
  - - [832, 1728, 1, 256]
    - [109, 23593.0]
  - - [960, 1728, 1, 256]
    - [13, 20971.5]
  - - [1088, 1728, 1, 256]
    - [13, 22756.3]
  - - [1216, 1728, 1, 256]
    - [109, 25615.2]
  - - [1344, 1728, 1, 256]
    - [109, 27717.6]
  - - [1472, 1728, 1, 256]
    - [109, 26256.7]
  - - [1600, 1728, 1, 256]
    - [13, 24747.9]
  - - [1728, 1728, 1, 256]
    - [13, 25145.1]
  - - [1856, 1728, 1, 256]
    - [101, 26023.3]
  - - [1984, 1728, 1, 256]
    - [101, 27556.0]
  - - [192, 1856, 1, 256]
    - [60, 14833.5]
  - - [448, 1856, 1, 256]
    - [114, 20766.9]
  - - [704, 1856, 1, 256]
    - [60, 21170.6]
  - - [960, 1856, 1, 256]
    - [13, 23331.5]
  - - [1216, 1856, 1, 256]
    - [114, 26025.5]
  - - [1472, 1856, 1, 256]
    - [13, 24117.2]
  - - [1728, 1856, 1, 256]
    - [114, 25941.1]
  - - [1984, 1856, 1, 256]
    - [114, 25004.5]
  - - [64, 1984, 1, 256]
    - [14, 7559.5]
  - - [192, 1984, 1, 256]
    - [98, 15479.0]
  - - [320, 1984, 1, 256]
    - [101, 18898.8]
  - - [448, 1984, 1, 256]
    - [114, 21365.4]
  - - [576, 1984, 1, 256]
    - [101, 24481.4]
  - - [704, 1984, 1, 256]
    - [41, 18671.8]
  - - [832, 1984, 1, 256]
    - [114, 20919.6]
  - - [960, 1984, 1, 256]
    - [13, 24197.9]
  - - [1088, 1984, 1, 256]
    - [114, 25175.4]
  - - [1216, 1984, 1, 256]
    - [114, 23708.7]
  - - [1344, 1984, 1, 256]
    - [117, 23538.7]
  - - [1472, 1984, 1, 256]
    - [103, 24234.5]
  - - [1600, 1984, 1, 256]
    - [13, 26341.9]
  - - [1728, 1984, 1, 256]
    - [114, 27862.2]
  - - [1856, 1984, 1, 256]
    - [109, 25862.0]
  - - [1984, 1984, 1, 256]
    - [117, 24911.8]
  - - [192, 64, 1, 512]
    - [118, 1850.43]
  - - [448, 64, 1, 512]
    - [118, 4077.8]
  - - [704, 64, 1, 512]
    - [102, 5183.97]
  - - [960, 64, 1, 512]
    - [15, 7149.38]
  - - [1216, 64, 1, 512]
    - [15, 8477.85]
  - - [1472, 64, 1, 512]
    - [15, 8388.61]
  - - [1728, 64, 1, 512]
    - [54, 9679.16]
  - - [1984, 64, 1, 512]
    - [15, 10401.9]
  - - [64, 192, 1, 512]
    - [102, 1878.05]
  - - [192, 192, 1, 512]
    - [118, 4603.5]
  - - [320, 192, 1, 512]
    - [15, 7315.65]
  - - [448, 192, 1, 512]
    - [3, 8007.31]
  - - [576, 192, 1, 512]
    - [3, 10389.6]
  - - [704, 192, 1, 512]
    - [15, 12141.4]
  - - [832, 192, 1, 512]
    - [15, 14224.2]
  - - [960, 192, 1, 512]
    - [60, 13981.0]
  - - [1088, 192, 1, 512]
    - [41, 14453.3]
  - - [1216, 192, 1, 512]
    - [3, 16375.0]
  - - [1344, 192, 1, 512]
    - [60, 16112.3]
  - - [1472, 192, 1, 512]
    - [60, 16826.0]
  - - [1600, 192, 1, 512]
    - [60, 17672.6]
  - - [1728, 192, 1, 512]
    - [60, 19303.3]
  - - [1856, 192, 1, 512]
    - [60, 19513.6]
  - - [1984, 192, 1, 512]
    - [13, 18486.7]
  - - [192, 320, 1, 512]
    - [17, 6913.69]
  - - [448, 320, 1, 512]
    - [15, 12877.2]
  - - [704, 320, 1, 512]
    - [98, 13981.0]
  - - [960, 320, 1, 512]
    - [60, 17672.6]
  - - [1216, 320, 1, 512]
    - [7, 20124.2]
  - - [1472, 320, 1, 512]
    - [98, 22752.1]
  - - [1728, 320, 1, 512]
    - [13, 22649.2]
  - - [1984, 320, 1, 512]
    - [46, 20971.5]
  - - [64, 448, 1, 512]
    - [118, 4077.8]
  - - [192, 448, 1, 512]
    - [3, 8080.77]
  - - [320, 448, 1, 512]
    - [15, 12877.2]
  - - [448, 448, 1, 512]
    - [17, 13793.3]
  - - [576, 448, 1, 512]
    - [60, 15186.3]
  - - [704, 448, 1, 512]
    - [60, 18246.4]
  - - [832, 448, 1, 512]
    - [7, 19374.7]
  - - [960, 448, 1, 512]
    - [98, 23934.9]
  - - [1088, 448, 1, 512]
    - [60, 22483.0]
  - - [1216, 448, 1, 512]
    - [13, 22493.6]
  - - [1344, 448, 1, 512]
    - [117, 23443.4]
  - - [1472, 448, 1, 512]
    - [60, 23529.0]
  - - [1600, 448, 1, 512]
    - [13, 23831.3]
  - - [1728, 448, 1, 512]
    - [13, 25326.6]
  - - [1856, 448, 1, 512]
    - [114, 25723.4]
  - - [1984, 448, 1, 512]
    - [13, 25710.8]
  - - [192, 576, 1, 512]
    - [15, 10021.8]
  - - [448, 576, 1, 512]
    - [60, 15362.9]
  - - [704, 576, 1, 512]
    - [97, 22205.1]
  - - [960, 576, 1, 512]
    - [60, 25855.3]
  - - [1216, 576, 1, 512]
    - [109, 28461.3]
  - - [1472, 576, 1, 512]
    - [101, 27388.7]
  - - [1728, 576, 1, 512]
    - [101, 28000.4]
  - - [1984, 576, 1, 512]
    - [109, 30876.3]
  - - [64, 704, 1, 512]
    - [14, 5183.97]
  - - [192, 704, 1, 512]
    - [15, 12141.4]
  - - [320, 704, 1, 512]
    - [17, 15482.3]
  - - [448, 704, 1, 512]
    - [60, 18561.0]
  - - [576, 704, 1, 512]
    - [98, 22567.2]
  - - [704, 704, 1, 512]
    - [13, 20799.6]
  - - [832, 704, 1, 512]
    - [101, 22980.3]
  - - [960, 704, 1, 512]
    - [101, 26617.7]
  - - [1088, 704, 1, 512]
    - [13, 25138.9]
  - - [1216, 704, 1, 512]
    - [101, 27055.8]
  - - [1344, 704, 1, 512]
    - [98, 27603.5]
  - - [1472, 704, 1, 512]
    - [117, 27706.5]
  - - [1600, 704, 1, 512]
    - [101, 30273.8]
  - - [1728, 704, 1, 512]
    - [6, 25014.2]
  - - [1856, 704, 1, 512]
    - [60, 25829.8]
  - - [1984, 704, 1, 512]
    - [117, 22811.1]
  - - [192, 832, 1, 512]
    - [15, 14348.9]
  - - [448, 832, 1, 512]
    - [7, 19573.4]
  - - [704, 832, 1, 512]
    - [114, 23247.5]
  - - [960, 832, 1, 512]
    - [13, 27631.4]
  - - [1216, 832, 1, 512]
    - [114, 28383.4]
  - - [1472, 832, 1, 512]
    - [7, 24932.3]
  - - [1728, 832, 1, 512]
    - [98, 28420.9]
  - - [1984, 832, 1, 512]
    - [117, 24712.1]
  - - [64, 960, 1, 512]
    - [14, 6765.01]
  - - [192, 960, 1, 512]
    - [60, 15099.5]
  - - [320, 960, 1, 512]
    - [60, 17975.6]
  - - [448, 960, 1, 512]
    - [97, 23677.5]
  - - [576, 960, 1, 512]
    - [60, 25973.9]
  - - [704, 960, 1, 512]
    - [109, 27462.7]
  - - [832, 960, 1, 512]
    - [101, 27172.4]
  - - [960, 960, 1, 512]
    - [101, 29864.5]
  - - [1088, 960, 1, 512]
    - [109, 29792.4]
  - - [1216, 960, 1, 512]
    - [101, 32395.0]
  - - [1344, 960, 1, 512]
    - [109, 27073.9]
  - - [1472, 960, 1, 512]
    - [97, 28768.1]
  - - [1600, 960, 1, 512]
    - [97, 24385.5]
  - - [1728, 960, 1, 512]
    - [97, 26295.6]
  - - [1856, 960, 1, 512]
    - [4, 26596.5]
  - - [1984, 960, 1, 512]
    - [101, 27902.0]
  - - [192, 1088, 1, 512]
    - [17, 14551.7]
  - - [448, 1088, 1, 512]
    - [60, 22687.4]
  - - [704, 1088, 1, 512]
    - [114, 24899.5]
  - - [960, 1088, 1, 512]
    - [114, 28674.2]
  - - [1216, 1088, 1, 512]
    - [97, 26255.0]
  - - [1472, 1088, 1, 512]
    - [8, 24810.5]
  - - [1728, 1088, 1, 512]
    - [98, 28063.9]
  - - [1984, 1088, 1, 512]
    - [101, 29550.8]
  - - [64, 1216, 1, 512]
    - [17, 8662.15]
  - - [192, 1216, 1, 512]
    - [17, 16153.7]
  - - [320, 1216, 1, 512]
    - [13, 21538.3]
  - - [448, 1216, 1, 512]
    - [13, 22493.6]
  - - [576, 1216, 1, 512]
    - [117, 28016.6]
  - - [704, 1216, 1, 512]
    - [114, 27055.8]
  - - [832, 1216, 1, 512]
    - [114, 27626.5]
  - - [960, 1216, 1, 512]
    - [103, 31374.7]
  - - [1088, 1216, 1, 512]
    - [60, 26460.2]
  - - [1216, 1216, 1, 512]
    - [8, 23548.1]
  - - [1344, 1216, 1, 512]
    - [7, 25511.1]
  - - [1472, 1216, 1, 512]
    - [7, 26525.5]
  - - [1600, 1216, 1, 512]
    - [13, 29127.1]
  - - [1728, 1216, 1, 512]
    - [101, 29394.5]
  - - [1856, 1216, 1, 512]
    - [103, 30249.5]
  - - [1984, 1216, 1, 512]
    - [109, 26032.1]
  - - [192, 1344, 1, 512]
    - [60, 16311.2]
  - - [448, 1344, 1, 512]
    - [109, 25373.0]
  - - [704, 1344, 1, 512]
    - [101, 30954.8]
  - - [960, 1344, 1, 512]
    - [97, 26637.2]
  - - [1216, 1344, 1, 512]
    - [97, 25786.2]
  - - [1472, 1344, 1, 512]
    - [101, 29233.0]
  - - [1728, 1344, 1, 512]
    - [101, 32533.1]
  - - [1984, 1344, 1, 512]
    - [109, 30714.2]
  - - [64, 1472, 1, 512]
    - [15, 8613.3]
  - - [192, 1472, 1, 512]
    - [60, 16924.4]
  - - [320, 1472, 1, 512]
    - [97, 23878.5]
  - - [448, 1472, 1, 512]
    - [109, 26072.7]
  - - [576, 1472, 1, 512]
    - [114, 27475.3]
  - - [704, 1472, 1, 512]
    - [101, 28373.2]
  - - [832, 1472, 1, 512]
    - [7, 24932.3]
  - - [960, 1472, 1, 512]
    - [7, 28152.4]
  - - [1088, 1472, 1, 512]
    - [8, 24810.5]
  - - [1216, 1472, 1, 512]
    - [97, 26875.5]
  - - [1344, 1472, 1, 512]
    - [101, 28175.9]
  - - [1472, 1472, 1, 512]
    - [109, 30269.9]
  - - [1600, 1472, 1, 512]
    - [101, 32285.5]
  - - [1728, 1472, 1, 512]
    - [109, 28189.0]
  - - [1856, 1472, 1, 512]
    - [60, 27864.5]
  - - [1984, 1472, 1, 512]
    - [103, 28239.3]
  - - [192, 1600, 1, 512]
    - [60, 18289.1]
  - - [448, 1600, 1, 512]
    - [13, 24144.8]
  - - [704, 1600, 1, 512]
    - [101, 30676.4]
  - - [960, 1600, 1, 512]
    - [98, 24847.8]
  - - [1216, 1600, 1, 512]
    - [114, 27180.0]
  - - [1472, 1600, 1, 512]
    - [109, 27220.4]
  - - [1728, 1600, 1, 512]
    - [7, 28226.9]
  - - [1984, 1600, 1, 512]
    - [114, 29604.6]
  - - [64, 1728, 1, 512]
    - [15, 9933.88]
  - - [192, 1728, 1, 512]
    - [60, 20343.6]
  - - [320, 1728, 1, 512]
    - [13, 23593.0]
  - - [448, 1728, 1, 512]
    - [109, 25489.5]
  - - [576, 1728, 1, 512]
    - [114, 28390.4]
  - - [704, 1728, 1, 512]
    - [101, 33577.0]
  - - [832, 1728, 1, 512]
    - [97, 28980.3]
  - - [960, 1728, 1, 512]
    - [97, 26377.2]
  - - [1088, 1728, 1, 512]
    - [97, 27153.5]
  - - [1216, 1728, 1, 512]
    - [101, 29678.3]
  - - [1344, 1728, 1, 512]
    - [101, 31793.7]
  - - [1472, 1728, 1, 512]
    - [109, 29497.9]
  - - [1600, 1728, 1, 512]
    - [13, 28086.9]
  - - [1728, 1728, 1, 512]
    - [114, 28710.3]
  - - [1856, 1728, 1, 512]
    - [109, 30157.4]
  - - [1984, 1728, 1, 512]
    - [114, 31598.9]
  - - [192, 1856, 1, 512]
    - [60, 20971.5]
  - - [448, 1856, 1, 512]
    - [101, 26360.5]
  - - [704, 1856, 1, 512]
    - [60, 26390.2]
  - - [960, 1856, 1, 512]
    - [6, 26139.3]
  - - [1216, 1856, 1, 512]
    - [101, 31315.2]
  - - [1472, 1856, 1, 512]
    - [13, 27726.5]
  - - [1728, 1856, 1, 512]
    - [114, 30240.7]
  - - [1984, 1856, 1, 512]
    - [109, 31034.4]
  - - [64, 1984, 1, 512]
    - [15, 11208.9]
  - - [192, 1984, 1, 512]
    - [98, 21432.4]
  - - [320, 1984, 1, 512]
    - [109, 25101.0]
  - - [448, 1984, 1, 512]
    - [114, 28266.0]
  - - [576, 1984, 1, 512]
    - [101, 31289.1]
  - - [704, 1984, 1, 512]
    - [98, 22920.8]
  - - [832, 1984, 1, 512]
    - [7, 26004.7]
  - - [960, 1984, 1, 512]
    - [7, 28597.5]
  - - [1088, 1984, 1, 512]
    - [101, 29354.6]
  - - [1216, 1984, 1, 512]
    - [117, 27177.6]
  - - [1344, 1984, 1, 512]
    - [6, 27720.7]
  - - [1472, 1984, 1, 512]
    - [114, 27486.6]
  - - [1600, 1984, 1, 512]
    - [114, 29685.7]
  - - [1728, 1984, 1, 512]
    - [114, 32089.9]
  - - [1856, 1984, 1, 512]
    - [109, 29184.8]
  - - [1984, 1984, 1, 512]
    - [114, 28894.1]
  - - [192, 64, 1, 1024]
    - [102, 3145.73]
  - - [448, 64, 1, 1024]
    - [118, 6181.08]
  - - [704, 64, 1, 1024]
    - [15, 7502.01]
  - - [960, 64, 1, 1024]
    - [15, 9679.16]
  - - [1216, 64, 1, 1024]
    - [15, 9055.88]
  - - [1472, 64, 1, 1024]
    - [15, 8730.23]
  - - [1728, 64, 1, 1024]
    - [15, 10021.8]
  - - [1984, 64, 1, 1024]
    - [15, 10528.2]
  - - [64, 192, 1, 1024]
    - [47, 3145.73]
  - - [192, 192, 1, 1024]
    - [16, 7329.85]
  - - [320, 192, 1, 1024]
    - [15, 10485.8]
  - - [448, 192, 1, 1024]
    - [79, 10676.4]
  - - [576, 192, 1, 1024]
    - [3, 13481.7]
  - - [704, 192, 1, 1024]
    - [15, 15639.8]
  - - [832, 192, 1, 1024]
    - [15, 17975.6]
  - - [960, 192, 1, 1024]
    - [3, 15470.8]
  - - [1088, 192, 1, 1024]
    - [3, 16266.9]
  - - [1216, 192, 1, 1024]
    - [3, 16777.2]
  - - [1344, 192, 1, 1024]
    - [89, 16412.5]
  - - [1472, 192, 1, 1024]
    - [60, 18087.9]
  - - [1600, 192, 1, 1024]
    - [15, 18724.6]
  - - [1728, 192, 1, 1024]
    - [60, 20222.5]
  - - [1856, 192, 1, 1024]
    - [60, 20104.9]
  - - [1984, 192, 1, 1024]
    - [98, 19358.3]
  - - [192, 320, 1, 1024]
    - [15, 10399.1]
  - - [448, 320, 1, 1024]
    - [15, 16777.2]
  - - [704, 320, 1, 1024]
    - [98, 18164.3]
  - - [960, 320, 1, 1024]
    - [60, 20971.5]
  - - [1216, 320, 1, 1024]
    - [98, 23647.4]
  - - [1472, 320, 1, 1024]
    - [98, 26214.4]
  - - [1728, 320, 1, 1024]
    - [114, 23349.7]
  - - [1984, 320, 1, 1024]
    - [109, 22691.7]
  - - [64, 448, 1, 1024]
    - [102, 5872.03]
  - - [192, 448, 1, 1024]
    - [79, 10941.7]
  - - [320, 448, 1, 1024]
    - [15, 16777.2]
  - - [448, 448, 1, 1024]
    - [3, 17794.0]
  - - [576, 448, 1, 1024]
    - [60, 19010.2]
  - - [704, 448, 1, 1024]
    - [60, 22664.0]
  - - [832, 448, 1, 1024]
    - [98, 23706.9]
  - - [960, 448, 1, 1024]
    - [98, 26772.2]
  - - [1088, 448, 1, 1024]
    - [60, 24709.0]
  - - [1216, 448, 1, 1024]
    - [13, 26375.5]
  - - [1344, 448, 1, 1024]
    - [60, 26015.3]
  - - [1472, 448, 1, 1024]
    - [60, 26173.8]
  - - [1600, 448, 1, 1024]
    - [13, 26985.4]
  - - [1728, 448, 1, 1024]
    - [103, 27194.6]
  - - [1856, 448, 1, 1024]
    - [98, 27289.9]
  - - [1984, 448, 1, 1024]
    - [8, 29598.8]
  - - [192, 576, 1, 1024]
    - [41, 13245.2]
  - - [448, 576, 1, 1024]
    - [60, 18874.4]
  - - [704, 576, 1, 1024]
    - [7, 25791.1]
  - - [960, 576, 1, 1024]
    - [60, 28889.3]
  - - [1216, 576, 1, 1024]
    - [60, 29760.4]
  - - [1472, 576, 1, 1024]
    - [109, 29733.6]
  - - [1728, 576, 1, 1024]
    - [117, 28390.4]
  - - [1984, 576, 1, 1024]
    - [7, 27469.7]
  - - [64, 704, 1, 1024]
    - [15, 7626.01]
  - - [192, 704, 1, 1024]
    - [15, 15639.8]
  - - [320, 704, 1, 1024]
    - [17, 19144.1]
  - - [448, 704, 1, 1024]
    - [60, 22986.6]
  - - [576, 704, 1, 1024]
    - [8, 26963.4]
  - - [704, 704, 1, 1024]
    - [13, 24517.4]
  - - [832, 704, 1, 1024]
    - [109, 26776.1]
  - - [960, 704, 1, 1024]
    - [60, 28896.0]
  - - [1088, 704, 1, 1024]
    - [109, 27520.5]
  - - [1216, 704, 1, 1024]
    - [7, 29867.4]
  - - [1344, 704, 1, 1024]
    - [103, 29360.1]
  - - [1472, 704, 1, 1024]
    - [109, 30536.9]
  - - [1600, 704, 1, 1024]
    - [109, 32173.9]
  - - [1728, 704, 1, 1024]
    - [7, 29379.9]
  - - [1856, 704, 1, 1024]
    - [8, 29568.7]
  - - [1984, 704, 1, 1024]
    - [7, 26267.4]
  - - [192, 832, 1, 1024]
    - [15, 18483.4]
  - - [448, 832, 1, 1024]
    - [6, 24233.8]
  - - [704, 832, 1, 1024]
    - [109, 27576.3]
  - - [960, 832, 1, 1024]
    - [13, 30575.3]
  - - [1216, 832, 1, 1024]
    - [117, 29389.9]
  - - [1472, 832, 1, 1024]
    - [6, 28763.7]
  - - [1728, 832, 1, 1024]
    - [98, 29562.3]
  - - [1984, 832, 1, 1024]
    - [7, 29043.0]
  - - [64, 960, 1, 1024]
    - [15, 10313.9]
  - - [192, 960, 1, 1024]
    - [60, 19660.8]
  - - [320, 960, 1, 1024]
    - [60, 22961.5]
  - - [448, 960, 1, 1024]
    - [97, 28878.8]
  - - [576, 960, 1, 1024]
    - [60, 30199.0]
  - - [704, 960, 1, 1024]
    - [109, 32039.8]
  - - [832, 960, 1, 1024]
    - [109, 30404.8]
  - - [960, 960, 1, 1024]
    - [109, 33288.1]
  - - [1088, 960, 1, 1024]
    - [109, 32758.0]
  - - [1216, 960, 1, 1024]
    - [109, 35106.5]
  - - [1344, 960, 1, 1024]
    - [97, 30233.5]
  - - [1472, 960, 1, 1024]
    - [97, 32738.3]
  - - [1600, 960, 1, 1024]
    - [7, 28137.1]
  - - [1728, 960, 1, 1024]
    - [97, 29313.1]
  - - [1856, 960, 1, 1024]
    - [7, 32321.0]
  - - [1984, 960, 1, 1024]
    - [97, 32945.1]
  - - [192, 1088, 1, 1024]
    - [98, 18051.4]
  - - [448, 1088, 1, 1024]
    - [60, 27274.4]
  - - [704, 1088, 1, 1024]
    - [103, 28730.2]
  - - [960, 1088, 1, 1024]
    - [103, 31550.1]
  - - [1216, 1088, 1, 1024]
    - [97, 29355.6]
  - - [1472, 1088, 1, 1024]
    - [8, 28251.0]
  - - [1728, 1088, 1, 1024]
    - [114, 30034.1]
  - - [1984, 1088, 1, 1024]
    - [109, 32892.8]
  - - [64, 1216, 1, 1024]
    - [15, 12958.0]
  - - [192, 1216, 1, 1024]
    - [98, 19922.9]
  - - [320, 1216, 1, 1024]
    - [7, 25379.5]
  - - [448, 1216, 1, 1024]
    - [13, 27014.2]
  - - [576, 1216, 1, 1024]
    - [60, 30716.3]
  - - [704, 1216, 1, 1024]
    - [101, 30280.1]
  - - [832, 1216, 1, 1024]
    - [103, 29985.3]
  - - [960, 1216, 1, 1024]
    - [114, 31333.6]
  - - [1088, 1216, 1, 1024]
    - [7, 29166.0]
  - - [1216, 1216, 1, 1024]
    - [7, 26942.1]
  - - [1344, 1216, 1, 1024]
    - [7, 28582.9]
  - - [1472, 1216, 1, 1024]
    - [8, 30574.0]
  - - [1600, 1216, 1, 1024]
    - [101, 30486.5]
  - - [1728, 1216, 1, 1024]
    - [101, 32234.9]
  - - [1856, 1216, 1, 1024]
    - [103, 32322.5]
  - - [1984, 1216, 1, 1024]
    - [8, 29675.0]
  - - [192, 1344, 1, 1024]
    - [60, 19793.3]
  - - [448, 1344, 1, 1024]
    - [109, 28677.3]
  - - [704, 1344, 1, 1024]
    - [101, 33124.2]
  - - [960, 1344, 1, 1024]
    - [97, 29925.4]
  - - [1216, 1344, 1, 1024]
    - [7, 29884.4]
  - - [1472, 1344, 1, 1024]
    - [101, 31119.0]
  - - [1728, 1344, 1, 1024]
    - [101, 34896.1]
  - - [1984, 1344, 1, 1024]
    - [8, 31731.5]
  - - [64, 1472, 1, 1024]
    - [55, 11282.9]
  - - [192, 1472, 1, 1024]
    - [60, 20895.8]
  - - [320, 1472, 1, 1024]
    - [97, 29866.6]
  - - [448, 1472, 1, 1024]
    - [109, 30976.3]
  - - [576, 1472, 1, 1024]
    - [103, 32037.7]
  - - [704, 1472, 1, 1024]
    - [109, 30275.6]
  - - [832, 1472, 1, 1024]
    - [7, 28896.2]
  - - [960, 1472, 1, 1024]
    - [97, 31219.7]
  - - [1088, 1472, 1, 1024]
    - [4, 27129.4]
  - - [1216, 1472, 1, 1024]
    - [97, 31225.1]
  - - [1344, 1472, 1, 1024]
    - [114, 31408.5]
  - - [1472, 1472, 1, 1024]
    - [101, 33440.6]
  - - [1600, 1472, 1, 1024]
    - [101, 34876.7]
  - - [1728, 1472, 1, 1024]
    - [109, 31744.8]
  - - [1856, 1472, 1, 1024]
    - [97, 31899.7]
  - - [1984, 1472, 1, 1024]
    - [101, 31462.8]
  - - [192, 1600, 1, 1024]
    - [60, 22389.5]
  - - [448, 1600, 1, 1024]
    - [13, 27286.4]
  - - [704, 1600, 1, 1024]
    - [101, 31731.3]
  - - [960, 1600, 1, 1024]
    - [7, 28288.9]
  - - [1216, 1600, 1, 1024]
    - [103, 30650.7]
  - - [1472, 1600, 1, 1024]
    - [98, 30470.3]
  - - [1728, 1600, 1, 1024]
    - [7, 32939.6]
  - - [1984, 1600, 1, 1024]
    - [114, 32934.0]
  - - [64, 1728, 1, 1024]
    - [41, 12868.9]
  - - [192, 1728, 1, 1024]
    - [60, 24980.8]
  - - [320, 1728, 1, 1024]
    - [13, 28100.8]
  - - [448, 1728, 1, 1024]
    - [109, 28826.3]
  - - [576, 1728, 1, 1024]
    - [109, 30154.3]
  - - [704, 1728, 1, 1024]
    - [109, 34035.7]
  - - [832, 1728, 1, 1024]
    - [97, 31900.3]
  - - [960, 1728, 1, 1024]
    - [7, 29313.1]
  - - [1088, 1728, 1, 1024]
    - [97, 32220.7]
  - - [1216, 1728, 1, 1024]
    - [101, 32478.2]
  - - [1344, 1728, 1, 1024]
    - [109, 34743.2]
  - - [1472, 1728, 1, 1024]
    - [109, 32701.4]
  - - [1600, 1728, 1, 1024]
    - [7, 32467.4]
  - - [1728, 1728, 1, 1024]
    - [114, 32017.3]
  - - [1856, 1728, 1, 1024]
    - [101, 32923.7]
  - - [1984, 1728, 1, 1024]
    - [114, 34604.6]
  - - [192, 1856, 1, 1024]
    - [60, 25428.9]
  - - [448, 1856, 1, 1024]
    - [114, 30086.4]
  - - [704, 1856, 1, 1024]
    - [7, 28960.7]
  - - [960, 1856, 1, 1024]
    - [7, 31108.6]
  - - [1216, 1856, 1, 1024]
    - [101, 33566.6]
  - - [1472, 1856, 1, 1024]
    - [7, 31522.3]
  - - [1728, 1856, 1, 1024]
    - [114, 33392.4]
  - - [1984, 1856, 1, 1024]
    - [7, 32917.3]
  - - [64, 1984, 1, 1024]
    - [15, 14691.9]
  - - [192, 1984, 1, 1024]
    - [7, 25747.2]
  - - [320, 1984, 1, 1024]
    - [109, 29088.0]
  - - [448, 1984, 1, 1024]
    - [114, 31657.9]
  - - [576, 1984, 1, 1024]
    - [103, 33530.4]
  - - [704, 1984, 1, 1024]
    - [97, 25770.4]
  - - [832, 1984, 1, 1024]
    - [7, 29244.0]
  - - [960, 1984, 1, 1024]
    - [6, 31973.0]
  - - [1088, 1984, 1, 1024]
    - [114, 32722.4]
  - - [1216, 1984, 1, 1024]
    - [109, 29944.8]
  - - [1344, 1984, 1, 1024]
    - [7, 31935.6]
  - - [1472, 1984, 1, 1024]
    - [114, 31216.5]
  - - [1600, 1984, 1, 1024]
    - [114, 32884.0]
  - - [1728, 1984, 1, 1024]
    - [114, 34384.3]
  - - [1856, 1984, 1, 1024]
    - [8, 32632.4]
  - - [1984, 1984, 1, 1024]
    - [114, 31813.2]
  - - [192, 64, 1, 2048]
    - [118, 4376.67]
  - - [448, 64, 1, 2048]
    - [118, 7935.17]
  - - [704, 64, 1, 2048]
    - [15, 8583.69]
  - - [960, 64, 1, 2048]
    - [15, 10708.9]
  - - [1216, 64, 1, 2048]
    - [16, 12213.3]
  - - [1472, 64, 1, 2048]
    - [15, 11152.5]
  - - [1728, 64, 1, 2048]
    - [15, 12905.6]
  - - [1984, 64, 1, 2048]
    - [15, 13759.1]
  - - [64, 192, 1, 2048]
    - [118, 4415.06]
  - - [192, 192, 1, 2048]
    - [16, 10633.4]
  - - [320, 192, 1, 2048]
    - [115, 13603.1]
  - - [448, 192, 1, 2048]
    - [76, 14264.0]
  - - [576, 192, 1, 2048]
    - [76, 15950.2]
  - - [704, 192, 1, 2048]
    - [15, 17917.4]
  - - [832, 192, 1, 2048]
    - [15, 20194.8]
  - - [960, 192, 1, 2048]
    - [76, 19065.0]
  - - [1088, 192, 1, 2048]
    - [3, 19358.3]
  - - [1216, 192, 1, 2048]
    - [10, 21441.7]
  - - [1344, 192, 1, 2048]
    - [79, 22066.1]
  - - [1472, 192, 1, 2048]
    - [10, 22008.1]
  - - [1600, 192, 1, 2048]
    - [60, 23563.5]
  - - [1728, 192, 1, 2048]
    - [10, 23967.5]
  - - [1856, 192, 1, 2048]
    - [79, 24781.3]
  - - [1984, 192, 1, 2048]
    - [98, 24265.6]
  - - [192, 320, 1, 2048]
    - [15, 13457.7]
  - - [448, 320, 1, 2048]
    - [15, 19573.4]
  - - [704, 320, 1, 2048]
    - [98, 21559.5]
  - - [960, 320, 1, 2048]
    - [60, 23563.5]
  - - [1216, 320, 1, 2048]
    - [98, 27962.0]
  - - [1472, 320, 1, 2048]
    - [98, 29637.2]
  - - [1728, 320, 1, 2048]
    - [13, 27092.4]
  - - [1984, 320, 1, 2048]
    - [109, 24463.5]
  - - [64, 448, 1, 2048]
    - [16, 8155.59]
  - - [192, 448, 1, 2048]
    - [79, 14992.4]
  - - [320, 448, 1, 2048]
    - [15, 19905.2]
  - - [448, 448, 1, 2048]
    - [11, 20918.2]
  - - [576, 448, 1, 2048]
    - [10, 22112.2]
  - - [704, 448, 1, 2048]
    - [60, 25992.9]
  - - [832, 448, 1, 2048]
    - [8, 28325.2]
  - - [960, 448, 1, 2048]
    - [8, 31570.0]
  - - [1088, 448, 1, 2048]
    - [60, 26979.6]
  - - [1216, 448, 1, 2048]
    - [13, 28032.3]
  - - [1344, 448, 1, 2048]
    - [114, 29083.1]
  - - [1472, 448, 1, 2048]
    - [60, 30940.8]
  - - [1600, 448, 1, 2048]
    - [8, 28042.1]
  - - [1728, 448, 1, 2048]
    - [8, 29801.6]
  - - [1856, 448, 1, 2048]
    - [7, 30655.0]
  - - [1984, 448, 1, 2048]
    - [8, 32275.3]
  - - [192, 576, 1, 2048]
    - [76, 16006.5]
  - - [448, 576, 1, 2048]
    - [10, 22779.4]
  - - [704, 576, 1, 2048]
    - [8, 30987.8]
  - - [960, 576, 1, 2048]
    - [60, 31111.6]
  - - [1216, 576, 1, 2048]
    - [60, 31149.9]
  - - [1472, 576, 1, 2048]
    - [8, 32156.3]
  - - [1728, 576, 1, 2048]
    - [117, 31677.3]
  - - [1984, 576, 1, 2048]
    - [109, 31351.9]
  - - [64, 704, 1, 2048]
    - [15, 9611.95]
  - - [192, 704, 1, 2048]
    - [15, 18578.8]
  - - [320, 704, 1, 2048]
    - [10, 24476.0]
  - - [448, 704, 1, 2048]
    - [60, 26418.1]
  - - [576, 704, 1, 2048]
    - [7, 30035.2]
  - - [704, 704, 1, 2048]
    - [109, 25860.4]
  - - [832, 704, 1, 2048]
    - [109, 29222.2]
  - - [960, 704, 1, 2048]
    - [109, 31929.0]
  - - [1088, 704, 1, 2048]
    - [8, 29266.2]
  - - [1216, 704, 1, 2048]
    - [109, 32862.6]
  - - [1344, 704, 1, 2048]
    - [98, 32815.7]
  - - [1472, 704, 1, 2048]
    - [109, 33343.6]
  - - [1600, 704, 1, 2048]
    - [109, 35354.3]
  - - [1728, 704, 1, 2048]
    - [7, 31920.8]
  - - [1856, 704, 1, 2048]
    - [7, 33303.9]
  - - [1984, 704, 1, 2048]
    - [7, 29174.0]
  - - [192, 832, 1, 2048]
    - [15, 21737.9]
  - - [448, 832, 1, 2048]
    - [7, 29025.2]
  - - [704, 832, 1, 2048]
    - [109, 28835.8]
  - - [960, 832, 1, 2048]
    - [109, 31039.4]
  - - [1216, 832, 1, 2048]
    - [109, 32552.8]
  - - [1472, 832, 1, 2048]
    - [7, 31890.6]
  - - [1728, 832, 1, 2048]
    - [98, 34824.4]
  - - [1984, 832, 1, 2048]
    - [7, 32505.9]
  - - [64, 960, 1, 2048]
    - [15, 13039.3]
  - - [192, 960, 1, 2048]
    - [79, 21509.3]
  - - [320, 960, 1, 2048]
    - [60, 25523.1]
  - - [448, 960, 1, 2048]
    - [97, 32146.1]
  - - [576, 960, 1, 2048]
    - [60, 32126.6]
  - - [704, 960, 1, 2048]
    - [109, 33800.3]
  - - [832, 960, 1, 2048]
    - [109, 31609.2]
  - - [960, 960, 1, 2048]
    - [117, 34663.7]
  - - [1088, 960, 1, 2048]
    - [109, 34198.2]
  - - [1216, 960, 1, 2048]
    - [109, 36951.4]
  - - [1344, 960, 1, 2048]
    - [7, 33511.9]
  - - [1472, 960, 1, 2048]
    - [97, 35164.9]
  - - [1600, 960, 1, 2048]
    - [8, 30496.6]
  - - [1728, 960, 1, 2048]
    - [7, 32588.8]
  - - [1856, 960, 1, 2048]
    - [7, 33523.6]
  - - [1984, 960, 1, 2048]
    - [97, 35189.0]
  - - [192, 1088, 1, 2048]
    - [10, 22635.9]
  - - [448, 1088, 1, 2048]
    - [60, 27962.0]
  - - [704, 1088, 1, 2048]
    - [46, 29907.9]
  - - [960, 1088, 1, 2048]
    - [109, 33580.8]
  - - [1216, 1088, 1, 2048]
    - [7, 33327.4]
  - - [1472, 1088, 1, 2048]
    - [7, 30739.9]
  - - [1728, 1088, 1, 2048]
    - [98, 33804.8]
  - - [1984, 1088, 1, 2048]
    - [101, 34363.0]
  - - [64, 1216, 1, 2048]
    - [15, 16516.4]
  - - [192, 1216, 1, 2048]
    - [11, 23670.8]
  - - [320, 1216, 1, 2048]
    - [97, 28821.6]
  - - [448, 1216, 1, 2048]
    - [109, 27311.7]
  - - [576, 1216, 1, 2048]
    - [60, 32198.7]
  - - [704, 1216, 1, 2048]
    - [109, 32022.3]
  - - [832, 1216, 1, 2048]
    - [101, 32324.3]
  - - [960, 1216, 1, 2048]
    - [103, 32593.8]
  - - [1088, 1216, 1, 2048]
    - [7, 33307.0]
  - - [1216, 1216, 1, 2048]
    - [7, 29674.5]
  - - [1344, 1216, 1, 2048]
    - [7, 32385.6]
  - - [1472, 1216, 1, 2048]
    - [8, 34196.1]
  - - [1600, 1216, 1, 2048]
    - [60, 31876.7]
  - - [1728, 1216, 1, 2048]
    - [101, 33938.1]
  - - [1856, 1216, 1, 2048]
    - [7, 34429.2]
  - - [1984, 1216, 1, 2048]
    - [7, 31682.5]
  - - [192, 1344, 1, 2048]
    - [60, 22536.6]
  - - [448, 1344, 1, 2048]
    - [109, 31139.5]
  - - [704, 1344, 1, 2048]
    - [109, 35719.2]
  - - [960, 1344, 1, 2048]
    - [7, 33427.1]
  - - [1216, 1344, 1, 2048]
    - [7, 31907.1]
  - - [1472, 1344, 1, 2048]
    - [101, 32635.5]
  - - [1728, 1344, 1, 2048]
    - [101, 37466.3]
  - - [1984, 1344, 1, 2048]
    - [7, 34552.3]
  - - [64, 1472, 1, 2048]
    - [81, 14291.7]
  - - [192, 1472, 1, 2048]
    - [60, 24218.2]
  - - [320, 1472, 1, 2048]
    - [97, 33150.9]
  - - [448, 1472, 1, 2048]
    - [109, 33347.3]
  - - [576, 1472, 1, 2048]
    - [109, 31978.7]
  - - [704, 1472, 1, 2048]
    - [109, 33768.0]
  - - [832, 1472, 1, 2048]
    - [7, 31709.2]
  - - [960, 1472, 1, 2048]
    - [7, 35729.3]
  - - [1088, 1472, 1, 2048]
    - [7, 31583.5]
  - - [1216, 1472, 1, 2048]
    - [7, 33880.1]
  - - [1344, 1472, 1, 2048]
    - [101, 32609.2]
  - - [1472, 1472, 1, 2048]
    - [101, 35121.3]
  - - [1600, 1472, 1, 2048]
    - [101, 37232.3]
  - - [1728, 1472, 1, 2048]
    - [7, 32980.9]
  - - [1856, 1472, 1, 2048]
    - [7, 34527.6]
  - - [1984, 1472, 1, 2048]
    - [7, 32612.2]
  - - [192, 1600, 1, 2048]
    - [60, 25420.0]
  - - [448, 1600, 1, 2048]
    - [109, 29040.7]
  - - [704, 1600, 1, 2048]
    - [109, 35138.9]
  - - [960, 1600, 1, 2048]
    - [7, 30511.4]
  - - [1216, 1600, 1, 2048]
    - [114, 32263.9]
  - - [1472, 1600, 1, 2048]
    - [98, 33742.2]
  - - [1728, 1600, 1, 2048]
    - [7, 35235.3]
  - - [1984, 1600, 1, 2048]
    - [7, 34636.0]
  - - [64, 1728, 1, 2048]
    - [81, 16353.2]
  - - [192, 1728, 1, 2048]
    - [60, 28252.7]
  - - [320, 1728, 1, 2048]
    - [109, 27927.5]
  - - [448, 1728, 1, 2048]
    - [109, 29829.7]
  - - [576, 1728, 1, 2048]
    - [109, 31652.7]
  - - [704, 1728, 1, 2048]
    - [109, 37185.3]
  - - [832, 1728, 1, 2048]
    - [97, 35538.9]
  - - [960, 1728, 1, 2048]
    - [7, 32096.2]
  - - [1088, 1728, 1, 2048]
    - [97, 32383.3]
  - - [1216, 1728, 1, 2048]
    - [60, 33725.4]
  - - [1344, 1728, 1, 2048]
    - [109, 36019.2]
  - - [1472, 1728, 1, 2048]
    - [109, 33739.2]
  - - [1600, 1728, 1, 2048]
    - [7, 35017.4]
  - - [1728, 1728, 1, 2048]
    - [7, 33371.3]
  - - [1856, 1728, 1, 2048]
    - [109, 34588.1]
  - - [1984, 1728, 1, 2048]
    - [97, 35988.0]
  - - [192, 1856, 1, 2048]
    - [60, 30033.3]
  - - [448, 1856, 1, 2048]
    - [7, 31217.0]
  - - [704, 1856, 1, 2048]
    - [7, 33077.5]
  - - [960, 1856, 1, 2048]
    - [7, 34852.4]
  - - [1216, 1856, 1, 2048]
    - [114, 35733.5]
  - - [1472, 1856, 1, 2048]
    - [7, 34410.8]
  - - [1728, 1856, 1, 2048]
    - [7, 35068.2]
  - - [1984, 1856, 1, 2048]
    - [7, 34617.2]
  - - [64, 1984, 1, 2048]
    - [15, 17750.6]
  - - [192, 1984, 1, 2048]
    - [6, 29328.6]
  - - [320, 1984, 1, 2048]
    - [109, 28235.3]
  - - [448, 1984, 1, 2048]
    - [6, 32739.7]
  - - [576, 1984, 1, 2048]
    - [101, 33602.6]
  - - [704, 1984, 1, 2048]
    - [97, 28720.0]
  - - [832, 1984, 1, 2048]
    - [7, 32013.3]
  - - [960, 1984, 1, 2048]
    - [7, 35984.3]
  - - [1088, 1984, 1, 2048]
    - [103, 34045.4]
  - - [1216, 1984, 1, 2048]
    - [109, 31866.4]
  - - [1344, 1984, 1, 2048]
    - [7, 34486.8]
  - - [1472, 1984, 1, 2048]
    - [114, 32173.6]
  - - [1600, 1984, 1, 2048]
    - [7, 34507.3]
  - - [1728, 1984, 1, 2048]
    - [114, 36210.8]
  - - [1856, 1984, 1, 2048]
    - [7, 34310.1]
  - - [1984, 1984, 1, 2048]
    - [8, 33985.9]
  - - [192, 64, 1, 4096]
    - [72, 6494.41]
  - - [448, 64, 1, 4096]
    - [16, 9786.71]
  - - [704, 64, 1, 4096]
    - [76, 11151.0]
  - - [960, 64, 1, 4096]
    - [16, 13315.3]
  - - [1216, 64, 1, 4096]
    - [16, 16645.8]
  - - [1472, 64, 1, 4096]
    - [76, 13683.5]
  - - [1728, 64, 1, 4096]
    - [15, 15728.6]
  - - [1984, 64, 1, 4096]
    - [15, 17221.6]
  - - [64, 192, 1, 4096]
    - [74, 6213.78]
  - - [192, 192, 1, 4096]
    - [16, 13981.0]
  - - [320, 192, 1, 4096]
    - [75, 17178.0]
  - - [448, 192, 1, 4096]
    - [76, 19905.2]
  - - [576, 192, 1, 4096]
    - [76, 21778.1]
  - - [704, 192, 1, 4096]
    - [76, 21840.2]
  - - [832, 192, 1, 4096]
    - [76, 23836.5]
  - - [960, 192, 1, 4096]
    - [76, 25334.7]
  - - [1088, 192, 1, 4096]
    - [10, 24034.8]
  - - [1216, 192, 1, 4096]
    - [10, 27014.2]
  - - [1344, 192, 1, 4096]
    - [79, 25469.0]
  - - [1472, 192, 1, 4096]
    - [10, 24474.2]
  - - [1600, 192, 1, 4096]
    - [10, 26687.0]
  - - [1728, 192, 1, 4096]
    - [10, 27124.8]
  - - [1856, 192, 1, 4096]
    - [10, 29339.1]
  - - [1984, 192, 1, 4096]
    - [8, 27837.3]
  - - [192, 320, 1, 4096]
    - [76, 15679.6]
  - - [448, 320, 1, 4096]
    - [78, 23209.6]
  - - [704, 320, 1, 4096]
    - [98, 23097.5]
  - - [960, 320, 1, 4096]
    - [10, 27563.9]
  - - [1216, 320, 1, 4096]
    - [8, 28952.5]
  - - [1472, 320, 1, 4096]
    - [98, 32840.5]
  - - [1728, 320, 1, 4096]
    - [109, 29606.9]
  - - [1984, 320, 1, 4096]
    - [109, 27431.1]
  - - [64, 448, 1, 4096]
    - [16, 10874.1]
  - - [192, 448, 1, 4096]
    - [79, 18740.5]
  - - [320, 448, 1, 4096]
    - [78, 21910.5]
  - - [448, 448, 1, 4096]
    - [9, 26647.8]
  - - [576, 448, 1, 4096]
    - [79, 26260.0]
  - - [704, 448, 1, 4096]
    - [60, 27225.4]
  - - [832, 448, 1, 4096]
    - [7, 30083.3]
  - - [960, 448, 1, 4096]
    - [8, 32958.0]
  - - [1088, 448, 1, 4096]
    - [60, 29643.5]
  - - [1216, 448, 1, 4096]
    - [114, 29554.6]
  - - [1344, 448, 1, 4096]
    - [114, 31178.9]
  - - [1472, 448, 1, 4096]
    - [60, 32271.6]
  - - [1600, 448, 1, 4096]
    - [8, 30190.4]
  - - [1728, 448, 1, 4096]
    - [7, 31772.5]
  - - [1856, 448, 1, 4096]
    - [7, 32779.4]
  - - [1984, 448, 1, 4096]
    - [8, 34656.4]
  - - [192, 576, 1, 4096]
    - [76, 21069.1]
  - - [448, 576, 1, 4096]
    - [79, 25937.8]
  - - [704, 576, 1, 4096]
    - [7, 31074.7]
  - - [960, 576, 1, 4096]
    - [60, 32801.2]
  - - [1216, 576, 1, 4096]
    - [109, 35179.7]
  - - [1472, 576, 1, 4096]
    - [114, 34368.0]
  - - [1728, 576, 1, 4096]
    - [103, 32811.8]
  - - [1984, 576, 1, 4096]
    - [109, 33446.5]
  - - [64, 704, 1, 4096]
    - [75, 12905.6]
  - - [192, 704, 1, 4096]
    - [78, 21459.2]
  - - [320, 704, 1, 4096]
    - [10, 29386.8]
  - - [448, 704, 1, 4096]
    - [10, 29260.4]
  - - [576, 704, 1, 4096]
    - [6, 31727.7]
  - - [704, 704, 1, 4096]
    - [10, 28979.9]
  - - [832, 704, 1, 4096]
    - [109, 32377.1]
  - - [960, 704, 1, 4096]
    - [109, 35997.9]
  - - [1088, 704, 1, 4096]
    - [109, 31357.7]
  - - [1216, 704, 1, 4096]
    - [7, 34076.2]
  - - [1344, 704, 1, 4096]
    - [98, 35951.2]
  - - [1472, 704, 1, 4096]
    - [114, 33422.3]
  - - [1600, 704, 1, 4096]
    - [109, 36544.4]
  - - [1728, 704, 1, 4096]
    - [7, 33075.6]
  - - [1856, 704, 1, 4096]
    - [7, 34230.5]
  - - [1984, 704, 1, 4096]
    - [98, 30015.9]
  - - [192, 832, 1, 4096]
    - [15, 24099.9]
  - - [448, 832, 1, 4096]
    - [8, 29191.7]
  - - [704, 832, 1, 4096]
    - [109, 32074.1]
  - - [960, 832, 1, 4096]
    - [114, 33112.9]
  - - [1216, 832, 1, 4096]
    - [114, 34304.4]
  - - [1472, 832, 1, 4096]
    - [7, 32765.4]
  - - [1728, 832, 1, 4096]
    - [98, 36094.4]
  - - [1984, 832, 1, 4096]
    - [7, 33038.0]
  - - [64, 960, 1, 4096]
    - [75, 15630.9]
  - - [192, 960, 1, 4096]
    - [76, 24957.8]
  - - [320, 960, 1, 4096]
    - [10, 28468.1]
  - - [448, 960, 1, 4096]
    - [6, 33650.6]
  - - [576, 960, 1, 4096]
    - [60, 30899.4]
  - - [704, 960, 1, 4096]
    - [109, 36568.6]
  - - [832, 960, 1, 4096]
    - [109, 32731.9]
  - - [960, 960, 1, 4096]
    - [7, 36437.0]
  - - [1088, 960, 1, 4096]
    - [114, 33859.8]
  - - [1216, 960, 1, 4096]
    - [109, 37993.7]
  - - [1344, 960, 1, 4096]
    - [7, 34239.2]
  - - [1472, 960, 1, 4096]
    - [97, 36843.7]
  - - [1600, 960, 1, 4096]
    - [8, 32222.6]
  - - [1728, 960, 1, 4096]
    - [97, 33324.0]
  - - [1856, 960, 1, 4096]
    - [97, 35061.7]
  - - [1984, 960, 1, 4096]
    - [97, 37398.9]
  - - [192, 1088, 1, 4096]
    - [10, 26408.6]
  - - [448, 1088, 1, 4096]
    - [10, 29490.2]
  - - [704, 1088, 1, 4096]
    - [109, 31232.8]
  - - [960, 1088, 1, 4096]
    - [109, 34446.0]
  - - [1216, 1088, 1, 4096]
    - [97, 34538.2]
  - - [1472, 1088, 1, 4096]
    - [97, 32354.6]
  - - [1728, 1088, 1, 4096]
    - [98, 35003.4]
  - - [1984, 1088, 1, 4096]
    - [109, 35694.8]
  - - [64, 1216, 1, 4096]
    - [15, 18862.0]
  - - [192, 1216, 1, 4096]
    - [11, 26128.5]
  - - [320, 1216, 1, 4096]
    - [97, 29597.7]
  - - [448, 1216, 1, 4096]
    - [10, 31120.9]
  - - [576, 1216, 1, 4096]
    - [60, 33771.7]
  - - [704, 1216, 1, 4096]
    - [109, 33715.8]
  - - [832, 1216, 1, 4096]
    - [101, 33244.9]
  - - [960, 1216, 1, 4096]
    - [114, 34927.0]
  - - [1088, 1216, 1, 4096]
    - [97, 34428.5]
  - - [1216, 1216, 1, 4096]
    - [8, 30674.0]
  - - [1344, 1216, 1, 4096]
    - [7, 32702.0]
  - - [1472, 1216, 1, 4096]
    - [7, 34689.6]
  - - [1600, 1216, 1, 4096]
    - [109, 32514.0]
  - - [1728, 1216, 1, 4096]
    - [109, 34795.7]
  - - [1856, 1216, 1, 4096]
    - [8, 34681.1]
  - - [1984, 1216, 1, 4096]
    - [7, 32162.0]
  - - [192, 1344, 1, 4096]
    - [11, 24495.1]
  - - [448, 1344, 1, 4096]
    - [109, 32883.3]
  - - [704, 1344, 1, 4096]
    - [109, 37663.1]
  - - [960, 1344, 1, 4096]
    - [97, 34051.7]
  - - [1216, 1344, 1, 4096]
    - [8, 33453.8]
  - - [1472, 1344, 1, 4096]
    - [109, 33333.6]
  - - [1728, 1344, 1, 4096]
    - [109, 38319.0]
  - - [1984, 1344, 1, 4096]
    - [109, 35169.8]
  - - [64, 1472, 1, 4096]
    - [78, 17381.8]
  - - [192, 1472, 1, 4096]
    - [10, 26131.6]
  - - [320, 1472, 1, 4096]
    - [97, 34607.7]
  - - [448, 1472, 1, 4096]
    - [109, 35682.1]
  - - [576, 1472, 1, 4096]
    - [7, 34047.9]
  - - [704, 1472, 1, 4096]
    - [101, 33594.3]
  - - [832, 1472, 1, 4096]
    - [7, 32605.7]
  - - [960, 1472, 1, 4096]
    - [7, 36541.3]
  - - [1088, 1472, 1, 4096]
    - [97, 32164.2]
  - - [1216, 1472, 1, 4096]
    - [97, 35012.6]
  - - [1344, 1472, 1, 4096]
    - [109, 33512.8]
  - - [1472, 1472, 1, 4096]
    - [109, 36195.5]
  - - [1600, 1472, 1, 4096]
    - [109, 38595.3]
  - - [1728, 1472, 1, 4096]
    - [7, 33570.6]
  - - [1856, 1472, 1, 4096]
    - [97, 34833.9]
  - - [1984, 1472, 1, 4096]
    - [7, 33863.1]
  - - [192, 1600, 1, 4096]
    - [80, 27002.0]
  - - [448, 1600, 1, 4096]
    - [109, 29959.3]
  - - [704, 1600, 1, 4096]
    - [101, 36762.8]
  - - [960, 1600, 1, 4096]
    - [7, 31847.4]
  - - [1216, 1600, 1, 4096]
    - [103, 32520.6]
  - - [1472, 1600, 1, 4096]
    - [98, 34440.9]
  - - [1728, 1600, 1, 4096]
    - [7, 35169.6]
  - - [1984, 1600, 1, 4096]
    - [7, 35255.8]
  - - [64, 1728, 1, 4096]
    - [81, 19652.3]
  - - [192, 1728, 1, 4096]
    - [60, 29224.8]
  - - [320, 1728, 1, 4096]
    - [109, 28889.3]
  - - [448, 1728, 1, 4096]
    - [7, 31441.7]
  - - [576, 1728, 1, 4096]
    - [109, 32680.3]
  - - [704, 1728, 1, 4096]
    - [109, 38477.5]
  - - [832, 1728, 1, 4096]
    - [97, 37106.5]
  - - [960, 1728, 1, 4096]
    - [97, 33381.3]
  - - [1088, 1728, 1, 4096]
    - [97, 36591.8]
  - - [1216, 1728, 1, 4096]
    - [109, 34809.8]
  - - [1344, 1728, 1, 4096]
    - [109, 37021.5]
  - - [1472, 1728, 1, 4096]
    - [8, 34238.1]
  - - [1600, 1728, 1, 4096]
    - [97, 35461.5]
  - - [1728, 1728, 1, 4096]
    - [7, 34736.1]
  - - [1856, 1728, 1, 4096]
    - [7, 34771.2]
  - - [1984, 1728, 1, 4096]
    - [109, 34506.8]
  - - [192, 1856, 1, 4096]
    - [60, 30472.2]
  - - [448, 1856, 1, 4096]
    - [7, 33146.2]
  - - [704, 1856, 1, 4096]
    - [7, 33798.1]
  - - [960, 1856, 1, 4096]
    - [7, 35137.6]
  - - [1216, 1856, 1, 4096]
    - [103, 36103.3]
  - - [1472, 1856, 1, 4096]
    - [97, 35002.8]
  - - [1728, 1856, 1, 4096]
    - [7, 35223.4]
  - - [1984, 1856, 1, 4096]
    - [7, 35580.8]
  - - [64, 1984, 1, 4096]
    - [15, 19370.3]
  - - [192, 1984, 1, 4096]
    - [7, 30714.2]
  - - [320, 1984, 1, 4096]
    - [109, 31013.3]
  - - [448, 1984, 1, 4096]
    - [109, 35090.7]
  - - [576, 1984, 1, 4096]
    - [109, 34380.0]
  - - [704, 1984, 1, 4096]
    - [97, 30610.1]
  - - [832, 1984, 1, 4096]
    - [97, 32829.4]
  - - [960, 1984, 1, 4096]
    - [7, 36302.5]
  - - [1088, 1984, 1, 4096]
    - [114, 34864.3]
  - - [1216, 1984, 1, 4096]
    - [8, 33249.6]
  - - [1344, 1984, 1, 4096]
    - [7, 34302.7]
  - - [1472, 1984, 1, 4096]
    - [8, 32858.5]
  - - [1600, 1984, 1, 4096]
    - [7, 34457.0]
  - - [1728, 1984, 1, 4096]
    - [98, 35344.9]
  - - [1856, 1984, 1, 4096]
    - [7, 35480.4]
  - - [1984, 1984, 1, 4096]
    - [7, 32806.8]
  - - [128, 64, 1, 64]
    - [118, 227.951]
  - - [256, 64, 1, 64]
    - [113, 455.903]
  - - [384, 64, 1, 64]
    - [34, 551.882]
  - - [512, 64, 1, 64]
    - [115, 855.98]
  - - [640, 64, 1, 64]
    - [118, 1139.76]
  - - [768, 64, 1, 64]
    - [49, 1014.75]
  - - [896, 64, 1, 64]
    - [115, 1287.72]
  - - [1024, 64, 1, 64]
    - [33, 1613.19]
  - - [64, 128, 1, 64]
    - [28, 177.725]
  - - [128, 128, 1, 64]
    - [27, 466.034]
  - - [192, 128, 1, 64]
    - [102, 561.737]
  - - [256, 128, 1, 64]
    - [49, 748.983]
  - - [320, 128, 1, 64]
    - [113, 1092.27]
  - - [384, 128, 1, 64]
    - [49, 1187.07]
  - - [448, 128, 1, 64]
    - [28, 1223.34]
  - - [512, 128, 1, 64]
    - [50, 1290.56]
  - - [576, 128, 1, 64]
    - [57, 1429.88]
  - - [640, 128, 1, 64]
    - [113, 1718.98]
  - - [704, 128, 1, 64]
    - [3, 1721.54]
  - - [768, 128, 1, 64]
    - [39, 1772.24]
  - - [832, 128, 1, 64]
    - [42, 2097.15]
  - - [896, 128, 1, 64]
    - [57, 2127.55]
  - - [960, 128, 1, 64]
    - [5, 2347.56]
  - - [1024, 128, 1, 64]
    - [3, 2431.48]
  - - [128, 192, 1, 64]
    - [36, 669.304]
  - - [256, 192, 1, 64]
    - [115, 1103.76]
  - - [384, 192, 1, 64]
    - [3, 1685.21]
  - - [512, 192, 1, 64]
    - [3, 2207.53]
  - - [640, 192, 1, 64]
    - [3, 2578.47]
  - - [768, 192, 1, 64]
    - [3, 3044.25]
  - - [896, 192, 1, 64]
    - [3, 3286.58]
  - - [1024, 192, 1, 64]
    - [3, 3700.86]
  - - [64, 256, 1, 64]
    - [50, 395.689]
  - - [128, 256, 1, 64]
    - [32, 838.861]
  - - [192, 256, 1, 64]
    - [113, 1031.39]
  - - [256, 256, 1, 64]
    - [102, 1331.53]
  - - [320, 256, 1, 64]
    - [113, 1718.98]
  - - [384, 256, 1, 64]
    - [3, 1966.08]
  - - [448, 256, 1, 64]
    - [3, 2097.15]
  - - [512, 256, 1, 64]
    - [14, 2581.11]
  - - [576, 256, 1, 64]
    - [14, 3094.16]
  - - [640, 256, 1, 64]
    - [42, 2912.71]
  - - [704, 256, 1, 64]
    - [3, 3075.82]
  - - [768, 256, 1, 64]
    - [3, 3355.44]
  - - [832, 256, 1, 64]
    - [3, 3540.65]
  - - [896, 256, 1, 64]
    - [3, 3813.0]
  - - [960, 256, 1, 64]
    - [61, 3836.25]
  - - [1024, 256, 1, 64]
    - [3, 4301.85]
  - - [128, 320, 1, 64]
    - [113, 1028.02]
  - - [256, 320, 1, 64]
    - [33, 1941.81]
  - - [384, 320, 1, 64]
    - [3, 2246.95]
  - - [512, 320, 1, 64]
    - [3, 3039.35]
  - - [640, 320, 1, 64]
    - [3, 3799.19]
  - - [768, 320, 1, 64]
    - [64, 4194.3]
  - - [896, 320, 1, 64]
    - [45, 4766.25]
  - - [1024, 320, 1, 64]
    - [3, 5377.31]
  - - [64, 384, 1, 64]
    - [28, 616.809]
  - - [128, 384, 1, 64]
    - [51, 1143.9]
  - - [192, 384, 1, 64]
    - [115, 1627.1]
  - - [256, 384, 1, 64]
    - [3, 2062.77]
  - - [320, 384, 1, 64]
    - [42, 2578.47]
  - - [384, 384, 1, 64]
    - [3, 2817.07]
  - - [448, 384, 1, 64]
    - [39, 3286.58]
  - - [512, 384, 1, 64]
    - [4, 3495.25]
  - - [576, 384, 1, 64]
    - [4, 3878.29]
  - - [640, 384, 1, 64]
    - [3, 4695.12]
  - - [704, 384, 1, 64]
    - [3, 4436.28]
  - - [768, 384, 1, 64]
    - [3, 5033.16]
  - - [832, 384, 1, 64]
    - [3, 5242.88]
  - - [896, 384, 1, 64]
    - [3, 5872.03]
  - - [960, 384, 1, 64]
    - [5, 5825.42]
  - - [1024, 384, 1, 64]
    - [4, 6213.78]
  - - [128, 448, 1, 64]
    - [28, 1223.34]
  - - [256, 448, 1, 64]
    - [3, 2293.76]
  - - [384, 448, 1, 64]
    - [3, 2975.69]
  - - [512, 448, 1, 64]
    - [3, 4255.09]
  - - [640, 448, 1, 64]
    - [3, 4530.88]
  - - [768, 448, 1, 64]
    - [64, 5181.2]
  - - [896, 448, 1, 64]
    - [3, 5974.44]
  - - [1024, 448, 1, 64]
    - [3, 6672.76]
  - - [64, 512, 1, 64]
    - [49, 748.983]
  - - [128, 512, 1, 64]
    - [3, 1310.72]
  - - [192, 512, 1, 64]
    - [67, 1823.61]
  - - [256, 512, 1, 64]
    - [42, 2362.99]
  - - [320, 512, 1, 64]
    - [42, 2872.81]
  - - [384, 512, 1, 64]
    - [3, 3595.12]
  - - [448, 512, 1, 64]
    - [3, 3716.47]
  - - [512, 512, 1, 64]
    - [3, 4142.52]
  - - [576, 512, 1, 64]
    - [3, 4548.04]
  - - [640, 512, 1, 64]
    - [3, 5115.0]
  - - [704, 512, 1, 64]
    - [3, 5242.88]
  - - [768, 512, 1, 64]
    - [7, 6064.05]
  - - [832, 512, 1, 64]
    - [7, 5863.01]
  - - [896, 512, 1, 64]
    - [3, 6749.45]
  - - [960, 512, 1, 64]
    - [114, 7864.32]
  - - [1024, 512, 1, 64]
    - [13, 6331.02]
  - - [128, 576, 1, 64]
    - [42, 1685.21]
  - - [256, 576, 1, 64]
    - [41, 2949.12]
  - - [384, 576, 1, 64]
    - [3, 4163.46]
  - - [512, 576, 1, 64]
    - [3, 5033.16]
  - - [640, 576, 1, 64]
    - [3, 6208.67]
  - - [768, 576, 1, 64]
    - [8, 7077.89]
  - - [896, 576, 1, 64]
    - [65, 7103.26]
  - - [1024, 576, 1, 64]
    - [109, 7259.37]
  - - [64, 640, 1, 64]
    - [42, 936.229]
  - - [128, 640, 1, 64]
    - [56, 1638.4]
  - - [192, 640, 1, 64]
    - [64, 2279.51]
  - - [256, 640, 1, 64]
    - [3, 3039.35]
  - - [320, 640, 1, 64]
    - [5, 3799.19]
  - - [384, 640, 1, 64]
    - [6, 3883.61]
  - - [448, 640, 1, 64]
    - [55, 4828.97]
  - - [512, 640, 1, 64]
    - [3, 5178.15]
  - - [576, 640, 1, 64]
    - [17, 5825.42]
  - - [640, 640, 1, 64]
    - [46, 6553.6]
  - - [704, 640, 1, 64]
    - [7, 6201.26]
  - - [768, 640, 1, 64]
    - [7, 7231.56]
  - - [832, 640, 1, 64]
    - [46, 7408.42]
  - - [896, 640, 1, 64]
    - [46, 8065.97]
  - - [960, 640, 1, 64]
    - [13, 8836.31]
  - - [1024, 640, 1, 64]
    - [46, 7913.78]
  - - [128, 704, 1, 64]
    - [3, 1830.85]
  - - [256, 704, 1, 64]
    - [3, 3392.45]
  - - [384, 704, 1, 64]
    - [37, 3932.16]
  - - [512, 704, 1, 64]
    - [3, 5626.51]
  - - [640, 704, 1, 64]
    - [13, 6337.55]
  - - [768, 704, 1, 64]
    - [13, 6784.9]
  - - [896, 704, 1, 64]
    - [60, 7545.83]
  - - [1024, 704, 1, 64]
    - [13, 7886.73]
  - - [64, 768, 1, 64]
    - [42, 1048.58]
  - - [128, 768, 1, 64]
    - [3, 2246.95]
  - - [192, 768, 1, 64]
    - [39, 2859.75]
  - - [256, 768, 1, 64]
    - [3, 3756.09]
  - - [320, 768, 1, 64]
    - [41, 4559.03]
  - - [384, 768, 1, 64]
    - [3, 5242.88]
  - - [448, 768, 1, 64]
    - [4, 5505.02]
  - - [512, 768, 1, 64]
    - [3, 6371.09]
  - - [576, 768, 1, 64]
    - [4, 6990.51]
  - - [640, 768, 1, 64]
    - [8, 7864.32]
  - - [704, 768, 1, 64]
    - [101, 7362.34]
  - - [768, 768, 1, 64]
    - [114, 8118.01]
  - - [832, 768, 1, 64]
    - [101, 8261.51]
  - - [896, 768, 1, 64]
    - [109, 9271.62]
  - - [960, 768, 1, 64]
    - [114, 9729.06]
  - - [1024, 768, 1, 64]
    - [101, 9320.68]
  - - [128, 832, 1, 64]
    - [3, 2097.15]
  - - [256, 832, 1, 64]
    - [3, 3951.16]
  - - [384, 832, 1, 64]
    - [3, 5048.7]
  - - [512, 832, 1, 64]
    - [3, 6267.35]
  - - [640, 832, 1, 64]
    - [13, 7328.76]
  - - [768, 832, 1, 64]
    - [117, 7715.94]
  - - [896, 832, 1, 64]
    - [13, 8297.43]
  - - [1024, 832, 1, 64]
    - [13, 8794.51]
  - - [64, 896, 1, 64]
    - [102, 1439.22]
  - - [128, 896, 1, 64]
    - [33, 2488.15]
  - - [192, 896, 1, 64]
    - [52, 3058.35]
  - - [256, 896, 1, 64]
    - [3, 4135.23]
  - - [320, 896, 1, 64]
    - [3, 4645.59]
  - - [384, 896, 1, 64]
    - [3, 5646.18]
  - - [448, 896, 1, 64]
    - [17, 6044.73]
  - - [512, 896, 1, 64]
    - [3, 6672.76]
  - - [576, 896, 1, 64]
    - [117, 7027.69]
  - - [640, 896, 1, 64]
    - [13, 7726.35]
  - - [704, 896, 1, 64]
    - [89, 7475.96]
  - - [768, 896, 1, 64]
    - [117, 8808.04]
  - - [832, 896, 1, 64]
    - [46, 8155.59]
  - - [896, 896, 1, 64]
    - [114, 8563.37]
  - - [960, 896, 1, 64]
    - [103, 10101.0]
  - - [1024, 896, 1, 64]
    - [13, 9247.28]
  - - [128, 960, 1, 64]
    - [3, 2578.47]
  - - [256, 960, 1, 64]
    - [8, 4369.07]
  - - [384, 960, 1, 64]
    - [65, 6463.82]
  - - [512, 960, 1, 64]
    - [97, 7489.83]
  - - [640, 960, 1, 64]
    - [13, 8024.82]
  - - [768, 960, 1, 64]
    - [109, 9252.14]
  - - [896, 960, 1, 64]
    - [101, 10101.0]
  - - [1024, 960, 1, 64]
    - [46, 10313.9]
  - - [64, 1024, 1, 64]
    - [28, 1290.56]
  - - [128, 1024, 1, 64]
    - [15, 2995.93]
  - - [192, 1024, 1, 64]
    - [7, 3268.29]
  - - [256, 1024, 1, 64]
    - [3, 4357.72]
  - - [320, 1024, 1, 64]
    - [17, 5178.15]
  - - [384, 1024, 1, 64]
    - [7, 6138.01]
  - - [448, 1024, 1, 64]
    - [41, 6246.84]
  - - [512, 1024, 1, 64]
    - [114, 6213.78]
  - - [576, 1024, 1, 64]
    - [103, 8031.65]
  - - [640, 1024, 1, 64]
    - [13, 7989.15]
  - - [704, 1024, 1, 64]
    - [13, 8094.27]
  - - [768, 1024, 1, 64]
    - [103, 9407.78]
  - - [832, 1024, 1, 64]
    - [103, 9012.55]
  - - [896, 1024, 1, 64]
    - [114, 9548.01]
  - - [960, 1024, 1, 64]
    - [13, 10573.9]
  - - [1024, 1024, 1, 64]
    - [103, 9796.91]
  - - [128, 64, 1, 256]
    - [25, 676.501]
  - - [256, 64, 1, 256]
    - [47, 1525.2]
  - - [384, 64, 1, 256]
    - [28, 1850.43]
  - - [512, 64, 1, 256]
    - [28, 2431.48]
  - - [640, 64, 1, 256]
    - [29, 3177.5]
  - - [768, 64, 1, 256]
    - [3, 2995.93]
  - - [896, 64, 1, 256]
    - [42, 4021.94]
  - - [1024, 64, 1, 256]
    - [15, 4092.0]
  - - [64, 128, 1, 256]
    - [118, 710.899]
  - - [128, 128, 1, 256]
    - [22, 1353.0]
  - - [192, 128, 1, 256]
    - [102, 2029.5]
  - - [256, 128, 1, 256]
    - [115, 2796.2]
  - - [320, 128, 1, 256]
    - [102, 3382.5]
  - - [384, 128, 1, 256]
    - [49, 3145.73]
  - - [448, 128, 1, 256]
    - [54, 4194.3]
  - - [512, 128, 1, 256]
    - [14, 5162.22]
  - - [576, 128, 1, 256]
    - [15, 4493.9]
  - - [640, 128, 1, 256]
    - [42, 4934.48]
  - - [704, 128, 1, 256]
    - [15, 5303.14]
  - - [768, 128, 1, 256]
    - [3, 5719.51]
  - - [832, 128, 1, 256]
    - [15, 6569.39]
  - - [896, 128, 1, 256]
    - [17, 6672.76]
  - - [960, 128, 1, 256]
    - [17, 7672.51]
  - - [1024, 128, 1, 256]
    - [14, 8494.79]
  - - [128, 192, 1, 256]
    - [118, 2132.7]
  - - [256, 192, 1, 256]
    - [66, 3595.12]
  - - [384, 192, 1, 256]
    - [3, 4902.43]
  - - [512, 192, 1, 256]
    - [3, 6622.59]
  - - [640, 192, 1, 256]
    - [3, 8065.97]
  - - [768, 192, 1, 256]
    - [15, 8206.25]
  - - [896, 192, 1, 256]
    - [54, 8635.33]
  - - [1024, 192, 1, 256]
    - [3, 9868.95]
  - - [64, 256, 1, 256]
    - [118, 1553.45]
  - - [128, 256, 1, 256]
    - [102, 2581.11]
  - - [192, 256, 1, 256]
    - [30, 3069.0]
  - - [320, 256, 1, 256]
    - [3, 4993.22]
  - - [384, 256, 1, 256]
    - [17, 6291.46]
  - - [448, 256, 1, 256]
    - [15, 6827.94]
  - - [512, 256, 1, 256]
    - [15, 8085.41]
  - - [576, 256, 1, 256]
    - [17, 8206.25]
  - - [640, 256, 1, 256]
    - [14, 9986.44]
  - - [704, 256, 1, 256]
    - [17, 9415.78]
  - - [768, 256, 1, 256]
    - [17, 10271.8]
  - - [832, 256, 1, 256]
    - [17, 11127.7]
  - - [896, 256, 1, 256]
    - [17, 11983.7]
  - - [960, 256, 1, 256]
    - [17, 12839.7]
  - - [1024, 256, 1, 256]
    - [17, 11773.5]
  - - [128, 320, 1, 256]
    - [113, 2995.93]
  - - [256, 320, 1, 256]
    - [43, 5053.38]
  - - [384, 320, 1, 256]
    - [54, 8065.97]
  - - [512, 320, 1, 256]
    - [15, 9020.01]
  - - [640, 320, 1, 256]
    - [13, 10381.9]
  - - [768, 320, 1, 256]
    - [98, 11759.7]
  - - [896, 320, 1, 256]
    - [55, 11935.0]
  - - [1024, 320, 1, 256]
    - [3, 13421.8]
  - - [64, 384, 1, 256]
    - [118, 2207.53]
  - - [128, 384, 1, 256]
    - [53, 3145.73]
  - - [192, 384, 1, 256]
    - [14, 5171.06]
  - - [256, 384, 1, 256]
    - [3, 6213.78]
  - - [320, 384, 1, 256]
    - [14, 8065.97]
  - - [384, 384, 1, 256]
    - [15, 8677.87]
  - - [448, 384, 1, 256]
    - [17, 9080.45]
  - - [512, 384, 1, 256]
    - [3, 10596.1]
  - - [576, 384, 1, 256]
    - [17, 11555.7]
  - - [640, 384, 1, 256]
    - [17, 12839.7]
  - - [704, 384, 1, 256]
    - [17, 11932.1]
  - - [768, 384, 1, 256]
    - [60, 13481.7]
  - - [832, 384, 1, 256]
    - [17, 13862.5]
  - - [896, 384, 1, 256]
    - [3, 15318.3]
  - - [960, 384, 1, 256]
    - [60, 16556.5]
  - - [1024, 384, 1, 256]
    - [8, 16106.1]
  - - [128, 448, 1, 256]
    - [47, 3495.25]
  - - [256, 448, 1, 256]
    - [3, 6908.27]
  - - [384, 448, 1, 256]
    - [54, 9271.62]
  - - [512, 448, 1, 256]
    - [3, 10774.4]
  - - [640, 448, 1, 256]
    - [13, 12132.3]
  - - [768, 448, 1, 256]
    - [3, 14092.9]
  - - [896, 448, 1, 256]
    - [7, 14576.0]
  - - [1024, 448, 1, 256]
    - [8, 16540.9]
  - - [64, 512, 1, 256]
    - [25, 2362.99]
  - - [128, 512, 1, 256]
    - [17, 4042.7]
  - - [192, 512, 1, 256]
    - [67, 5991.86]
  - - [256, 512, 1, 256]
    - [14, 7456.54]
  - - [320, 512, 1, 256]
    - [14, 10356.3]
  - - [384, 512, 1, 256]
    - [17, 10377.7]
  - - [448, 512, 1, 256]
    - [17, 11983.7]
  - - [512, 512, 1, 256]
    - [17, 11471.6]
  - - [576, 512, 1, 256]
    - [17, 13016.8]
  - - [640, 512, 1, 256]
    - [17, 14218.0]
  - - [704, 512, 1, 256]
    - [17, 14306.2]
  - - [768, 512, 1, 256]
    - [7, 16106.1]
  - - [832, 512, 1, 256]
    - [7, 15690.9]
  - - [896, 512, 1, 256]
    - [7, 16897.9]
  - - [960, 512, 1, 256]
    - [7, 20627.7]
  - - [1024, 512, 1, 256]
    - [13, 16170.8]
  - - [128, 576, 1, 256]
    - [66, 4778.32]
  - - [256, 576, 1, 256]
    - [14, 8118.01]
  - - [384, 576, 1, 256]
    - [3, 10994.8]
  - - [512, 576, 1, 256]
    - [3, 13245.2]
  - - [640, 576, 1, 256]
    - [3, 16412.5]
  - - [768, 576, 1, 256]
    - [97, 17694.7]
  - - [896, 576, 1, 256]
    - [60, 18098.7]
  - - [1024, 576, 1, 256]
    - [101, 19609.7]
  - - [64, 640, 1, 256]
    - [26, 2621.44]
  - - [128, 640, 1, 256]
    - [22, 4993.22]
  - - [192, 640, 1, 256]
    - [14, 7149.38]
  - - [256, 640, 1, 256]
    - [14, 10356.3]
  - - [320, 640, 1, 256]
    - [17, 10699.8]
  - - [384, 640, 1, 256]
    - [17, 12710.0]
  - - [448, 640, 1, 256]
    - [17, 12440.7]
  - - [512, 640, 1, 256]
    - [17, 14463.1]
  - - [576, 640, 1, 256]
    - [7, 15221.3]
  - - [640, 640, 1, 256]
    - [5, 16384.0]
  - - [704, 640, 1, 256]
    - [7, 16477.6]
  - - [768, 640, 1, 256]
    - [7, 20132.7]
  - - [832, 640, 1, 256]
    - [46, 17936.2]
  - - [896, 640, 1, 256]
    - [46, 19065.0]
  - - [960, 640, 1, 256]
    - [46, 20036.5]
  - - [1024, 640, 1, 256]
    - [114, 19622.5]
  - - [128, 704, 1, 256]
    - [3, 5558.72]
  - - [256, 704, 1, 256]
    - [3, 9136.11]
  - - [384, 704, 1, 256]
    - [17, 11534.3]
  - - [512, 704, 1, 256]
    - [3, 15508.4]
  - - [640, 704, 1, 256]
    - [8, 16838.4]
  - - [768, 704, 1, 256]
    - [13, 16576.3]
  - - [896, 704, 1, 256]
    - [103, 18776.8]
  - - [1024, 704, 1, 256]
    - [13, 18641.4]
  - - [64, 768, 1, 256]
    - [102, 3495.25]
  - - [128, 768, 1, 256]
    - [3, 6536.58]
  - - [192, 768, 1, 256]
    - [17, 9096.08]
  - - [256, 768, 1, 256]
    - [17, 10271.8]
  - - [320, 768, 1, 256]
    - [17, 12710.0]
  - - [384, 768, 1, 256]
    - [60, 13481.7]
  - - [448, 768, 1, 256]
    - [41, 14558.7]
  - - [512, 768, 1, 256]
    - [8, 15852.5]
  - - [576, 768, 1, 256]
    - [7, 18265.5]
  - - [640, 768, 1, 256]
    - [97, 19972.9]
  - - [704, 768, 1, 256]
    - [101, 17859.6]
  - - [768, 768, 1, 256]
    - [114, 19737.9]
  - - [832, 768, 1, 256]
    - [101, 20971.5]
  - - [896, 768, 1, 256]
    - [109, 22298.8]
  - - [960, 768, 1, 256]
    - [114, 23891.6]
  - - [1024, 768, 1, 256]
    - [101, 21648.0]
  - - [128, 832, 1, 256]
    - [3, 6649.51]
  - - [256, 832, 1, 256]
    - [17, 10691.4]
  - - [384, 832, 1, 256]
    - [3, 13518.8]
  - - [512, 832, 1, 256]
    - [8, 15920.0]
  - - [640, 832, 1, 256]
    - [13, 17255.0]
  - - [768, 832, 1, 256]
    - [114, 18910.7]
  - - [896, 832, 1, 256]
    - [13, 19573.4]
  - - [1024, 832, 1, 256]
    - [114, 20673.3]
  - - [64, 896, 1, 256]
    - [14, 3863.17]
  - - [128, 896, 1, 256]
    - [3, 7161.01]
  - - [192, 896, 1, 256]
    - [54, 8720.83]
  - - [256, 896, 1, 256]
    - [17, 11983.7]
  - - [320, 896, 1, 256]
    - [17, 12440.7]
  - - [384, 896, 1, 256]
    - [3, 14558.7]
  - - [448, 896, 1, 256]
    - [17, 15809.3]
  - - [512, 896, 1, 256]
    - [8, 16777.2]
  - - [576, 896, 1, 256]
    - [60, 17734.3]
  - - [640, 896, 1, 256]
    - [13, 18700.7]
  - - [704, 896, 1, 256]
    - [117, 18886.6]
  - - [768, 896, 1, 256]
    - [114, 21748.2]
  - - [832, 896, 1, 256]
    - [114, 19374.7]
  - - [896, 896, 1, 256]
    - [114, 20759.7]
  - - [960, 896, 1, 256]
    - [114, 22818.8]
  - - [1024, 896, 1, 256]
    - [114, 22476.7]
  - - [128, 960, 1, 256]
    - [3, 7672.51]
  - - [256, 960, 1, 256]
    - [8, 12336.2]
  - - [384, 960, 1, 256]
    - [60, 16556.5]
  - - [512, 960, 1, 256]
    - [8, 19660.8]
  - - [640, 960, 1, 256]
    - [46, 20036.5]
  - - [768, 960, 1, 256]
    - [101, 22336.5]
  - - [896, 960, 1, 256]
    - [109, 22469.5]
  - - [1024, 960, 1, 256]
    - [109, 23301.7]
  - - [64, 1024, 1, 256]
    - [43, 4473.92]
  - - [128, 1024, 1, 256]
    - [14, 8388.61]
  - - [192, 1024, 1, 256]
    - [17, 10485.8]
  - - [256, 1024, 1, 256]
    - [17, 11570.5]
  - - [320, 1024, 1, 256]
    - [17, 14098.5]
  - - [384, 1024, 1, 256]
    - [7, 16106.1]
  - - [448, 1024, 1, 256]
    - [7, 16540.9]
  - - [512, 1024, 1, 256]
    - [46, 16268.8]
  - - [576, 1024, 1, 256]
    - [114, 19358.3]
  - - [640, 1024, 1, 256]
    - [114, 19972.9]
  - - [704, 1024, 1, 256]
    - [114, 18831.6]
  - - [768, 1024, 1, 256]
    - [114, 22123.8]
  - - [832, 1024, 1, 256]
    - [101, 21072.8]
  - - [896, 1024, 1, 256]
    - [114, 22476.7]
  - - [960, 1024, 1, 256]
    - [117, 24916.7]
  - - [1024, 1024, 1, 256]
    - [114, 23342.2]
  - - [128, 64, 1, 512]
    - [47, 1375.18]
  - - [256, 64, 1, 512]
    - [118, 2796.2]
  - - [384, 64, 1, 512]
    - [118, 3700.86]
  - - [512, 64, 1, 512]
    - [118, 4473.92]
  - - [640, 64, 1, 512]
    - [118, 5991.86]
  - - [768, 64, 1, 512]
    - [15, 5470.83]
  - - [896, 64, 1, 512]
    - [15, 6452.78]
  - - [1024, 64, 1, 512]
    - [15, 7456.54]
  - - [64, 128, 1, 512]
    - [115, 1103.76]
  - - [128, 128, 1, 512]
    - [118, 2467.24]
  - - [192, 128, 1, 512]
    - [115, 3544.48]
  - - [256, 128, 1, 512]
    - [102, 3856.83]
  - - [320, 128, 1, 512]
    - [102, 5377.31]
  - - [384, 128, 1, 512]
    - [102, 5470.83]
  - - [448, 128, 1, 512]
    - [14, 6827.94]
  - - [512, 128, 1, 512]
    - [17, 7456.54]
  - - [576, 128, 1, 512]
    - [14, 8882.06]
  - - [640, 128, 1, 512]
    - [14, 9868.95]
  - - [704, 128, 1, 512]
    - [3, 8165.9]
  - - [768, 128, 1, 512]
    - [3, 9068.77]
  - - [832, 128, 1, 512]
    - [17, 9650.61]
  - - [896, 128, 1, 512]
    - [17, 10301.8]
  - - [960, 128, 1, 512]
    - [54, 11336.0]
  - - [1024, 128, 1, 512]
    - [15, 11671.1]
  - - [128, 192, 1, 512]
    - [118, 3700.86]
  - - [256, 192, 1, 512]
    - [15, 5921.37]
  - - [384, 192, 1, 512]
    - [15, 8882.06]
  - - [512, 192, 1, 512]
    - [3, 9151.21]
  - - [640, 192, 1, 512]
    - [3, 11650.8]
  - - [768, 192, 1, 512]
    - [15, 13130.0]
  - - [896, 192, 1, 512]
    - [60, 12858.5]
  - - [1024, 192, 1, 512]
    - [3, 14177.9]
  - - [64, 256, 1, 512]
    - [113, 2504.06]
  - - [128, 256, 1, 512]
    - [14, 3994.58]
  - - [192, 256, 1, 512]
    - [14, 5655.24]
  - - [256, 256, 1, 512]
    - [14, 7064.09]
  - - [320, 256, 1, 512]
    - [14, 9868.95]
  - - [384, 256, 1, 512]
    - [15, 8987.79]
  - - [448, 256, 1, 512]
    - [14, 10580.2]
  - - [512, 256, 1, 512]
    - [15, 11877.7]
  - - [576, 256, 1, 512]
    - [17, 13245.2]
  - - [640, 256, 1, 512]
    - [17, 14716.9]
  - - [704, 256, 1, 512]
    - [17, 12905.6]
  - - [768, 256, 1, 512]
    - [17, 13884.6]
  - - [832, 256, 1, 512]
    - [17, 15041.6]
  - - [896, 256, 1, 512]
    - [17, 16198.7]
  - - [960, 256, 1, 512]
    - [17, 17355.7]
  - - [1024, 256, 1, 512]
    - [60, 15516.5]
  - - [128, 320, 1, 512]
    - [15, 4934.48]
  - - [256, 320, 1, 512]
    - [15, 9754.2]
  - - [384, 320, 1, 512]
    - [54, 11439.0]
  - - [512, 320, 1, 512]
    - [15, 14716.9]
  - - [640, 320, 1, 512]
    - [3, 14665.4]
  - - [768, 320, 1, 512]
    - [98, 17003.9]
  - - [896, 320, 1, 512]
    - [60, 16777.2]
  - - [1024, 320, 1, 512]
    - [3, 18236.1]
  - - [64, 384, 1, 512]
    - [102, 3447.37]
  - - [128, 384, 1, 512]
    - [14, 5470.83]
  - - [192, 384, 1, 512]
    - [17, 8579.26]
  - - [256, 384, 1, 512]
    - [3, 9151.21]
  - - [320, 384, 1, 512]
    - [52, 11234.7]
  - - [384, 384, 1, 512]
    - [17, 13603.1]
  - - [448, 384, 1, 512]
    - [60, 13146.3]
  - - [512, 384, 1, 512]
    - [3, 14177.9]
  - - [576, 384, 1, 512]
    - [17, 15728.6]
  - - [640, 384, 1, 512]
    - [3, 17598.5]
  - - [704, 384, 1, 512]
    - [17, 15909.4]
  - - [768, 384, 1, 512]
    - [60, 18527.0]
  - - [832, 384, 1, 512]
    - [60, 19020.7]
  - - [896, 384, 1, 512]
    - [60, 20248.4]
  - - [960, 384, 1, 512]
    - [60, 22878.0]
  - - [1024, 384, 1, 512]
    - [8, 22123.8]
  - - [128, 448, 1, 512]
    - [15, 6597.78]
  - - [256, 448, 1, 512]
    - [15, 10393.0]
  - - [384, 448, 1, 512]
    - [60, 13146.3]
  - - [512, 448, 1, 512]
    - [3, 16087.7]
  - - [640, 448, 1, 512]
    - [60, 16681.9]
  - - [768, 448, 1, 512]
    - [3, 19358.3]
  - - [896, 448, 1, 512]
    - [7, 21079.1]
  - - [1024, 448, 1, 512]
    - [8, 23488.1]
  - - [64, 512, 1, 512]
    - [102, 4473.92]
  - - [128, 512, 1, 512]
    - [14, 7456.54]
  - - [192, 512, 1, 512]
    - [54, 9151.21]
  - - [256, 512, 1, 512]
    - [17, 11983.7]
  - - [320, 512, 1, 512]
    - [17, 14847.1]
  - - [384, 512, 1, 512]
    - [3, 14078.8]
  - - [448, 512, 1, 512]
    - [17, 16311.2]
  - - [576, 512, 1, 512]
    - [60, 17355.7]
  - - [640, 512, 1, 512]
    - [17, 19065.0]
  - - [704, 512, 1, 512]
    - [7, 19124.3]
  - - [768, 512, 1, 512]
    - [7, 22002.9]
  - - [832, 512, 1, 512]
    - [7, 22255.5]
  - - [896, 512, 1, 512]
    - [7, 23845.8]
  - - [960, 512, 1, 512]
    - [7, 27060.0]
  - - [1024, 512, 1, 512]
    - [13, 21824.0]
  - - [128, 576, 1, 512]
    - [14, 8206.25]
  - - [256, 576, 1, 512]
    - [15, 13245.2]
  - - [384, 576, 1, 512]
    - [3, 16412.5]
  - - [512, 576, 1, 512]
    - [60, 17869.2]
  - - [640, 576, 1, 512]
    - [3, 21570.7]
  - - [768, 576, 1, 512]
    - [97, 24618.7]
  - - [896, 576, 1, 512]
    - [60, 24242.3]
  - - [1024, 576, 1, 512]
    - [109, 24753.3]
  - - [64, 640, 1, 512]
    - [113, 5242.88]
  - - [128, 640, 1, 512]
    - [14, 8830.11]
  - - [192, 640, 1, 512]
    - [54, 11439.0]
  - - [256, 640, 1, 512]
    - [15, 14716.9]
  - - [320, 640, 1, 512]
    - [13, 14979.7]
  - - [384, 640, 1, 512]
    - [17, 17236.9]
  - - [448, 640, 1, 512]
    - [60, 16971.2]
  - - [512, 640, 1, 512]
    - [17, 18850.8]
  - - [576, 640, 1, 512]
    - [7, 20855.7]
  - - [640, 640, 1, 512]
    - [8, 21845.3]
  - - [704, 640, 1, 512]
    - [7, 23905.4]
  - - [768, 640, 1, 512]
    - [6, 27654.8]
  - - [832, 640, 1, 512]
    - [46, 22165.0]
  - - [896, 640, 1, 512]
    - [46, 23677.5]
  - - [960, 640, 1, 512]
    - [114, 25890.8]
  - - [1024, 640, 1, 512]
    - [114, 25811.1]
  - - [128, 704, 1, 512]
    - [3, 8465.57]
  - - [256, 704, 1, 512]
    - [3, 12905.6]
  - - [384, 704, 1, 512]
    - [60, 16188.5]
  - - [512, 704, 1, 512]
    - [3, 20280.2]
  - - [640, 704, 1, 512]
    - [8, 23184.6]
  - - [768, 704, 1, 512]
    - [13, 22234.9]
  - - [896, 704, 1, 512]
    - [101, 24939.1]
  - - [1024, 704, 1, 512]
    - [13, 23736.3]
  - - [64, 768, 1, 512]
    - [14, 5655.24]
  - - [128, 768, 1, 512]
    - [3, 9496.54]
  - - [192, 768, 1, 512]
    - [15, 13245.2]
  - - [256, 768, 1, 512]
    - [3, 14177.9]
  - - [320, 768, 1, 512]
    - [17, 17236.9]
  - - [384, 768, 1, 512]
    - [60, 18527.0]
  - - [448, 768, 1, 512]
    - [60, 20132.7]
  - - [512, 768, 1, 512]
    - [8, 22123.8]
  - - [576, 768, 1, 512]
    - [7, 25165.8]
  - - [640, 768, 1, 512]
    - [8, 27503.6]
  - - [704, 768, 1, 512]
    - [101, 22973.0]
  - - [768, 768, 1, 512]
    - [109, 24957.8]
  - - [832, 768, 1, 512]
    - [109, 26706.6]
  - - [896, 768, 1, 512]
    - [101, 28528.1]
  - - [960, 768, 1, 512]
    - [109, 29840.9]
  - - [1024, 768, 1, 512]
    - [101, 26490.3]
  - - [128, 832, 1, 512]
    - [3, 9650.61]
  - - [256, 832, 1, 512]
    - [3, 14837.0]
  - - [384, 832, 1, 512]
    - [60, 18910.7]
  - - [512, 832, 1, 512]
    - [8, 22030.7]
  - - [640, 832, 1, 512]
    - [13, 23202.5]
  - - [768, 832, 1, 512]
    - [114, 25263.0]
  - - [896, 832, 1, 512]
    - [13, 25193.5]
  - - [1024, 832, 1, 512]
    - [114, 26843.5]
  - - [64, 896, 1, 512]
    - [17, 6314.01]
  - - [128, 896, 1, 512]
    - [3, 10676.4]
  - - [192, 896, 1, 512]
    - [60, 12582.9]
  - - [256, 896, 1, 512]
    - [17, 16311.2]
  - - [320, 896, 1, 512]
    - [60, 16971.2]
  - - [384, 896, 1, 512]
    - [60, 20603.6]
  - - [448, 896, 1, 512]
    - [7, 21297.5]
  - - [512, 896, 1, 512]
    - [8, 24340.0]
  - - [576, 896, 1, 512]
    - [60, 22878.0]
  - - [640, 896, 1, 512]
    - [13, 24776.5]
  - - [704, 896, 1, 512]
    - [114, 25231.4]
  - - [768, 896, 1, 512]
    - [114, 28528.1]
  - - [832, 896, 1, 512]
    - [114, 24704.3]
  - - [896, 896, 1, 512]
    - [114, 26778.0]
  - - [960, 896, 1, 512]
    - [114, 28973.8]
  - - [1024, 896, 1, 512]
    - [114, 29544.8]
  - - [128, 960, 1, 512]
    - [3, 12336.2]
  - - [256, 960, 1, 512]
    - [3, 17975.6]
  - - [384, 960, 1, 512]
    - [60, 22604.0]
  - - [512, 960, 1, 512]
    - [8, 28118.2]
  - - [640, 960, 1, 512]
    - [13, 26214.4]
  - - [768, 960, 1, 512]
    - [109, 28382.5]
  - - [896, 960, 1, 512]
    - [101, 28413.0]
  - - [1024, 960, 1, 512]
    - [109, 31165.1]
  - - [64, 1024, 1, 512]
    - [15, 7139.24]
  - - [128, 1024, 1, 512]
    - [17, 11877.7]
  - - [192, 1024, 1, 512]
    - [17, 13789.5]
  - - [256, 1024, 1, 512]
    - [17, 15252.0]
  - - [320, 1024, 1, 512]
    - [17, 18745.5]
  - - [384, 1024, 1, 512]
    - [7, 22246.0]
  - - [448, 1024, 1, 512]
    - [7, 23488.1]
  - - [512, 1024, 1, 512]
    - [46, 21304.4]
  - - [576, 1024, 1, 512]
    - [114, 24552.0]
  - - [640, 1024, 1, 512]
    - [114, 26317.2]
  - - [704, 1024, 1, 512]
    - [114, 24203.2]
  - - [768, 1024, 1, 512]
    - [114, 27206.3]
  - - [832, 1024, 1, 512]
    - [114, 27608.1]
  - - [896, 1024, 1, 512]
    - [114, 29268.7]
  - - [960, 1024, 1, 512]
    - [114, 32682.9]
  - - [1024, 1024, 1, 512]
    - [117, 28864.0]
  - - [128, 64, 1, 1024]
    - [102, 2267.19]
  - - [256, 64, 1, 1024]
    - [118, 3901.68]
  - - [384, 64, 1, 1024]
    - [118, 5242.88]
  - - [512, 64, 1, 1024]
    - [118, 6452.78]
  - - [640, 64, 1, 1024]
    - [118, 8559.8]
  - - [768, 64, 1, 1024]
    - [15, 8118.01]
  - - [896, 64, 1, 1024]
    - [15, 9247.28]
  - - [1024, 64, 1, 1024]
    - [15, 9586.98]
  - - [64, 128, 1, 1024]
    - [102, 2298.25]
  - - [128, 128, 1, 1024]
    - [118, 4142.52]
  - - [192, 128, 1, 1024]
    - [118, 5530.95]
  - - [256, 128, 1, 1024]
    - [102, 6515.42]
  - - [320, 128, 1, 1024]
    - [102, 9425.4]
  - - [384, 128, 1, 1024]
    - [15, 8319.28]
  - - [448, 128, 1, 1024]
    - [15, 9952.59]
  - - [512, 128, 1, 1024]
    - [15, 10912.0]
  - - [576, 128, 1, 1024]
    - [15, 12177.0]
  - - [640, 128, 1, 1024]
    - [15, 13421.8]
  - - [704, 128, 1, 1024]
    - [3, 10920.1]
  - - [768, 128, 1, 1024]
    - [3, 11983.7]
  - - [832, 128, 1, 1024]
    - [14, 12322.2]
  - - [896, 128, 1, 1024]
    - [15, 13121.8]
  - - [960, 128, 1, 1024]
    - [15, 13603.1]
  - - [1024, 128, 1, 1024]
    - [15, 14128.2]
  - - [128, 192, 1, 1024]
    - [102, 5470.83]
  - - [256, 192, 1, 1024]
    - [15, 8319.28]
  - - [384, 192, 1, 1024]
    - [15, 12276.0]
  - - [512, 192, 1, 1024]
    - [3, 12742.2]
  - - [640, 192, 1, 1024]
    - [3, 15927.7]
  - - [768, 192, 1, 1024]
    - [15, 16965.7]
  - - [896, 192, 1, 1024]
    - [3, 15121.1]
  - - [1024, 192, 1, 1024]
    - [3, 16042.0]
  - - [64, 256, 1, 1024]
    - [118, 3947.58]
  - - [128, 256, 1, 1024]
    - [118, 6391.32]
  - - [192, 256, 1, 1024]
    - [15, 8319.28]
  - - [256, 256, 1, 1024]
    - [15, 11184.8]
  - - [320, 256, 1, 1024]
    - [15, 13865.5]
  - - [384, 256, 1, 1024]
    - [3, 12351.3]
  - - [448, 256, 1, 1024]
    - [15, 13576.9]
  - - [512, 256, 1, 1024]
    - [15, 15427.3]
  - - [576, 256, 1, 1024]
    - [15, 17061.6]
  - - [640, 256, 1, 1024]
    - [15, 19065.0]
  - - [704, 256, 1, 1024]
    - [3, 15978.3]
  - - [768, 256, 1, 1024]
    - [3, 17281.3]
  - - [832, 256, 1, 1024]
    - [17, 17732.0]
  - - [896, 256, 1, 1024]
    - [17, 18641.4]
  - - [960, 256, 1, 1024]
    - [17, 19210.6]
  - - [1024, 256, 1, 1024]
    - [3, 17318.4]
  - - [128, 320, 1, 1024]
    - [22, 7423.55]
  - - [256, 320, 1, 1024]
    - [15, 13865.5]
  - - [384, 320, 1, 1024]
    - [15, 14380.5]
  - - [512, 320, 1, 1024]
    - [15, 19065.0]
  - - [640, 320, 1, 1024]
    - [13, 18558.9]
  - - [768, 320, 1, 1024]
    - [98, 19972.9]
  - - [896, 320, 1, 1024]
    - [60, 20389.0]
  - - [1024, 320, 1, 1024]
    - [3, 20971.5]
  - - [64, 384, 1, 1024]
    - [118, 5242.88]
  - - [128, 384, 1, 1024]
    - [15, 8319.28]
  - - [192, 384, 1, 1024]
    - [15, 12478.9]
  - - [256, 384, 1, 1024]
    - [3, 12582.9]
  - - [320, 384, 1, 1024]
    - [41, 14631.3]
  - - [384, 384, 1, 1024]
    - [17, 17256.6]
  - - [448, 384, 1, 1024]
    - [60, 17528.4]
  - - [512, 384, 1, 1024]
    - [3, 18137.5]
  - - [576, 384, 1, 1024]
    - [3, 19609.7]
  - - [640, 384, 1, 1024]
    - [3, 22270.6]
  - - [704, 384, 1, 1024]
    - [60, 19426.3]
  - - [768, 384, 1, 1024]
    - [60, 22123.8]
  - - [832, 384, 1, 1024]
    - [3, 21737.9]
  - - [896, 384, 1, 1024]
    - [60, 23645.7]
  - - [960, 384, 1, 1024]
    - [60, 24512.2]
  - - [1024, 384, 1, 1024]
    - [8, 24256.2]
  - - [128, 448, 1, 1024]
    - [15, 9786.71]
  - - [256, 448, 1, 1024]
    - [3, 14588.9]
  - - [384, 448, 1, 1024]
    - [60, 17441.7]
  - - [512, 448, 1, 1024]
    - [3, 20161.5]
  - - [640, 448, 1, 1024]
    - [60, 20971.5]
  - - [768, 448, 1, 1024]
    - [60, 24131.6]
  - - [896, 448, 1, 1024]
    - [98, 25294.9]
  - - [1024, 448, 1, 1024]
    - [8, 26465.5]
  - - [64, 512, 1, 1024]
    - [118, 6391.32]
  - - [128, 512, 1, 1024]
    - [15, 11184.8]
  - - [192, 512, 1, 1024]
    - [11, 11705.0]
  - - [256, 512, 1, 1024]
    - [14, 15698.0]
  - - [320, 512, 1, 1024]
    - [15, 19065.0]
  - - [384, 512, 1, 1024]
    - [3, 17583.1]
  - - [448, 512, 1, 1024]
    - [17, 19905.2]
  - - [512, 512, 1, 1024]
    - [60, 19311.9]
  - - [576, 512, 1, 1024]
    - [60, 21883.3]
  - - [640, 512, 1, 1024]
    - [3, 22369.6]
  - - [704, 512, 1, 1024]
    - [7, 23812.8]
  - - [768, 512, 1, 1024]
    - [7, 26061.7]
  - - [832, 512, 1, 1024]
    - [7, 26598.0]
  - - [896, 512, 1, 1024]
    - [98, 27552.0]
  - - [960, 512, 1, 1024]
    - [7, 28679.0]
  - - [1024, 512, 1, 1024]
    - [13, 25626.3]
  - - [128, 576, 1, 1024]
    - [15, 12905.6]
  - - [256, 576, 1, 1024]
    - [15, 17158.5]
  - - [384, 576, 1, 1024]
    - [3, 20222.5]
  - - [512, 576, 1, 1024]
    - [60, 21648.0]
  - - [640, 576, 1, 1024]
    - [8, 26123.7]
  - - [768, 576, 1, 1024]
    - [8, 28135.7]
  - - [896, 576, 1, 1024]
    - [60, 27525.1]
  - - [1024, 576, 1, 1024]
    - [109, 26260.0]
  - - [64, 640, 1, 1024]
    - [102, 9425.4]
  - - [128, 640, 1, 1024]
    - [15, 13865.5]
  - - [192, 640, 1, 1024]
    - [15, 14380.5]
  - - [256, 640, 1, 1024]
    - [15, 18957.3]
  - - [320, 640, 1, 1024]
    - [13, 18724.6]
  - - [384, 640, 1, 1024]
    - [7, 21509.3]
  - - [448, 640, 1, 1024]
    - [60, 21275.5]
  - - [512, 640, 1, 1024]
    - [8, 22519.8]
  - - [576, 640, 1, 1024]
    - [7, 26123.7]
  - - [640, 640, 1, 1024]
    - [7, 27413.8]
  - - [704, 640, 1, 1024]
    - [7, 29108.7]
  - - [768, 640, 1, 1024]
    - [7, 30504.0]
  - - [832, 640, 1, 1024]
    - [13, 25185.2]
  - - [896, 640, 1, 1024]
    - [114, 26997.8]
  - - [960, 640, 1, 1024]
    - [46, 28276.2]
  - - [1024, 640, 1, 1024]
    - [60, 28617.9]
  - - [128, 704, 1, 1024]
    - [3, 11534.3]
  - - [256, 704, 1, 1024]
    - [3, 16259.9]
  - - [384, 704, 1, 1024]
    - [60, 20132.7]
  - - [512, 704, 1, 1024]
    - [3, 24124.1]
  - - [640, 704, 1, 1024]
    - [8, 30254.0]
  - - [768, 704, 1, 1024]
    - [13, 25751.1]
  - - [896, 704, 1, 1024]
    - [109, 28392.2]
  - - [1024, 704, 1, 1024]
    - [13, 26990.8]
  - - [64, 768, 1, 1024]
    - [15, 8319.28]
  - - [128, 768, 1, 1024]
    - [3, 12662.0]
  - - [192, 768, 1, 1024]
    - [15, 17158.5]
  - - [256, 768, 1, 1024]
    - [3, 18056.2]
  - - [320, 768, 1, 1024]
    - [17, 21059.3]
  - - [384, 768, 1, 1024]
    - [60, 22878.0]
  - - [448, 768, 1, 1024]
    - [60, 24899.0]
  - - [512, 768, 1, 1024]
    - [8, 27114.7]
  - - [576, 768, 1, 1024]
    - [7, 29999.0]
  - - [640, 768, 1, 1024]
    - [8, 33443.0]
  - - [704, 768, 1, 1024]
    - [109, 26301.6]
  - - [768, 768, 1, 1024]
    - [13, 28157.6]
  - - [832, 768, 1, 1024]
    - [109, 29407.3]
  - - [896, 768, 1, 1024]
    - [109, 31387.2]
  - - [960, 768, 1, 1024]
    - [109, 32968.3]
  - - [1024, 768, 1, 1024]
    - [109, 29552.5]
  - - [128, 832, 1, 1024]
    - [3, 13218.4]
  - - [256, 832, 1, 1024]
    - [3, 19131.9]
  - - [384, 832, 1, 1024]
    - [60, 23368.3]
  - - [512, 832, 1, 1024]
    - [8, 28792.6]
  - - [640, 832, 1, 1024]
    - [13, 27060.0]
  - - [768, 832, 1, 1024]
    - [114, 30083.3]
  - - [896, 832, 1, 1024]
    - [13, 27360.7]
  - - [1024, 832, 1, 1024]
    - [109, 30557.5]
  - - [64, 896, 1, 1024]
    - [14, 9705.83]
  - - [128, 896, 1, 1024]
    - [3, 14409.9]
  - - [192, 896, 1, 1024]
    - [60, 17103.0]
  - - [256, 896, 1, 1024]
    - [3, 20075.3]
  - - [320, 896, 1, 1024]
    - [60, 20971.5]
  - - [384, 896, 1, 1024]
    - [7, 24899.0]
  - - [448, 896, 1, 1024]
    - [7, 26604.6]
  - - [512, 896, 1, 1024]
    - [8, 30405.3]
  - - [576, 896, 1, 1024]
    - [60, 28036.2]
  - - [640, 896, 1, 1024]
    - [13, 27962.0]
  - - [704, 896, 1, 1024]
    - [114, 29494.2]
  - - [768, 896, 1, 1024]
    - [114, 32397.4]
  - - [832, 896, 1, 1024]
    - [114, 28220.5]
  - - [896, 896, 1, 1024]
    - [114, 30617.6]
  - - [960, 896, 1, 1024]
    - [114, 32622.4]
  - - [1024, 896, 1, 1024]
    - [103, 33198.7]
  - - [128, 960, 1, 1024]
    - [3, 15630.9]
  - - [256, 960, 1, 1024]
    - [3, 22075.3]
  - - [384, 960, 1, 1024]
    - [60, 26867.4]
  - - [512, 960, 1, 1024]
    - [8, 33666.7]
  - - [640, 960, 1, 1024]
    - [13, 28662.7]
  - - [768, 960, 1, 1024]
    - [109, 34239.2]
  - - [896, 960, 1, 1024]
    - [109, 32382.5]
  - - [1024, 960, 1, 1024]
    - [109, 36015.5]
  - - [64, 1024, 1, 1024]
    - [15, 11374.4]
  - - [128, 1024, 1, 1024]
    - [15, 15339.2]
  - - [192, 1024, 1, 1024]
    - [7, 17207.4]
  - - [256, 1024, 1, 1024]
    - [60, 19174.0]
  - - [320, 1024, 1, 1024]
    - [17, 22148.1]
  - - [384, 1024, 1, 1024]
    - [7, 27391.4]
  - - [448, 1024, 1, 1024]
    - [7, 30113.0]
  - - [512, 1024, 1, 1024]
    - [109, 24912.8]
  - - [576, 1024, 1, 1024]
    - [103, 27145.2]
  - - [640, 1024, 1, 1024]
    - [109, 30504.0]
  - - [704, 1024, 1, 1024]
    - [114, 27804.0]
  - - [768, 1024, 1, 1024]
    - [117, 29552.5]
  - - [832, 1024, 1, 1024]
    - [103, 31666.6]
  - - [896, 1024, 1, 1024]
    - [117, 32679.1]
  - - [960, 1024, 1, 1024]
    - [103, 34356.1]
  - - [128, 64, 1, 2048]
    - [102, 3195.66]
  - - [256, 64, 1, 2048]
    - [118, 5639.4]
  - - [384, 64, 1, 2048]
    - [118, 7294.44]
  - - [512, 64, 1, 2048]
    - [118, 7989.15]
  - - [640, 64, 1, 2048]
    - [102, 9986.44]
  - - [768, 64, 1, 2048]
    - [15, 9193.0]
  - - [896, 64, 1, 2048]
    - [15, 10212.2]
  - - [1024, 64, 1, 2048]
    - [15, 11326.4]
  - - [64, 128, 1, 2048]
    - [102, 3135.93]
  - - [128, 128, 1, 2048]
    - [118, 5886.74]
  - - [192, 128, 1, 2048]
    - [118, 7347.69]
  - - [256, 128, 1, 2048]
    - [16, 8888.59]
  - - [320, 128, 1, 2048]
    - [16, 11259.9]
  - - [384, 128, 1, 2048]
    - [15, 10431.4]
  - - [448, 128, 1, 2048]
    - [15, 11685.6]
  - - [512, 128, 1, 2048]
    - [15, 12782.6]
  - - [576, 128, 1, 2048]
    - [15, 14177.9]
  - - [640, 128, 1, 2048]
    - [15, 15114.6]
  - - [704, 128, 1, 2048]
    - [12, 12771.6]
  - - [768, 128, 1, 2048]
    - [18, 13288.9]
  - - [832, 128, 1, 2048]
    - [12, 14540.3]
  - - [896, 128, 1, 2048]
    - [15, 14960.6]
  - - [960, 128, 1, 2048]
    - [15, 16236.0]
  - - [1024, 128, 1, 2048]
    - [15, 16829.8]
  - - [128, 192, 1, 2048]
    - [16, 7294.44]
  - - [256, 192, 1, 2048]
    - [75, 10941.7]
  - - [384, 192, 1, 2048]
    - [15, 15099.5]
  - - [512, 192, 1, 2048]
    - [76, 14749.2]
  - - [640, 192, 1, 2048]
    - [76, 17975.6]
  - - [768, 192, 1, 2048]
    - [15, 19420.6]
  - - [896, 192, 1, 2048]
    - [76, 18302.4]
  - - [1024, 192, 1, 2048]
    - [3, 18815.6]
  - - [64, 256, 1, 2048]
    - [102, 5735.8]
  - - [128, 256, 1, 2048]
    - [16, 9655.95]
  - - [192, 256, 1, 2048]
    - [15, 10882.5]
  - - [256, 256, 1, 2048]
    - [15, 13981.0]
  - - [320, 256, 1, 2048]
    - [15, 17207.4]
  - - [384, 256, 1, 2048]
    - [12, 15667.4]
  - - [448, 256, 1, 2048]
    - [12, 16777.2]
  - - [512, 256, 1, 2048]
    - [15, 18137.5]
  - - [576, 256, 1, 2048]
    - [15, 19933.3]
  - - [640, 256, 1, 2048]
    - [15, 21578.4]
  - - [704, 256, 1, 2048]
    - [9, 19580.8]
  - - [768, 256, 1, 2048]
    - [9, 20971.5]
  - - [832, 256, 1, 2048]
    - [11, 20527.4]
  - - [896, 256, 1, 2048]
    - [12, 21648.0]
  - - [960, 256, 1, 2048]
    - [17, 22419.4]
  - - [1024, 256, 1, 2048]
    - [60, 20809.0]
  - - [128, 320, 1, 2048]
    - [16, 11413.1]
  - - [256, 320, 1, 2048]
    - [15, 17660.2]
  - - [384, 320, 1, 2048]
    - [102, 17911.6]
  - - [512, 320, 1, 2048]
    - [15, 22295.3]
  - - [640, 320, 1, 2048]
    - [9, 20460.0]
  - - [768, 320, 1, 2048]
    - [98, 22621.0]
  - - [896, 320, 1, 2048]
    - [80, 23488.1]
  - - [1024, 320, 1, 2048]
    - [8, 24096.5]
  - - [64, 384, 1, 2048]
    - [16, 7139.24]
  - - [128, 384, 1, 2048]
    - [75, 11247.3]
  - - [192, 384, 1, 2048]
    - [15, 15811.0]
  - - [256, 384, 1, 2048]
    - [3, 15368.4]
  - - [320, 384, 1, 2048]
    - [18, 17911.6]
  - - [384, 384, 1, 2048]
    - [15, 20200.0]
  - - [448, 384, 1, 2048]
    - [79, 20847.4]
  - - [512, 384, 1, 2048]
    - [9, 21706.4]
  - - [576, 384, 1, 2048]
    - [9, 23593.0]
  - - [640, 384, 1, 2048]
    - [3, 24916.7]
  - - [704, 384, 1, 2048]
    - [11, 22830.9]
  - - [768, 384, 1, 2048]
    - [60, 24906.4]
  - - [832, 384, 1, 2048]
    - [11, 25609.1]
  - - [896, 384, 1, 2048]
    - [10, 26894.8]
  - - [960, 384, 1, 2048]
    - [60, 29037.5]
  - - [1024, 384, 1, 2048]
    - [8, 29072.4]
  - - [128, 448, 1, 2048]
    - [15, 12297.4]
  - - [256, 448, 1, 2048]
    - [3, 17020.4]
  - - [384, 448, 1, 2048]
    - [11, 20075.3]
  - - [512, 448, 1, 2048]
    - [3, 22584.7]
  - - [640, 448, 1, 2048]
    - [11, 24569.1]
  - - [768, 448, 1, 2048]
    - [60, 27962.0]
  - - [896, 448, 1, 2048]
    - [8, 30003.1]
  - - [1024, 448, 1, 2048]
    - [8, 32908.0]
  - - [64, 512, 1, 2048]
    - [16, 9193.0]
  - - [128, 512, 1, 2048]
    - [15, 13981.0]
  - - [192, 512, 1, 2048]
    - [12, 15667.4]
  - - [256, 512, 1, 2048]
    - [15, 18323.2]
  - - [320, 512, 1, 2048]
    - [15, 22002.9]
  - - [384, 512, 1, 2048]
    - [11, 22684.7]
  - - [448, 512, 1, 2048]
    - [11, 25256.0]
  - - [512, 512, 1, 2048]
    - [11, 22748.8]
  - - [576, 512, 1, 2048]
    - [60, 24452.6]
  - - [640, 512, 1, 2048]
    - [11, 26683.4]
  - - [704, 512, 1, 2048]
    - [8, 27239.8]
  - - [768, 512, 1, 2048]
    - [7, 29661.4]
  - - [832, 512, 1, 2048]
    - [7, 31666.6]
  - - [896, 512, 1, 2048]
    - [98, 32793.2]
  - - [960, 512, 1, 2048]
    - [7, 34532.9]
  - - [1024, 512, 1, 2048]
    - [11, 28709.7]
  - - [128, 576, 1, 2048]
    - [15, 15728.6]
  - - [256, 576, 1, 2048]
    - [15, 20473.9]
  - - [384, 576, 1, 2048]
    - [10, 24753.3]
  - - [512, 576, 1, 2048]
    - [60, 24957.8]
  - - [640, 576, 1, 2048]
    - [8, 28436.0]
  - - [768, 576, 1, 2048]
    - [8, 33246.6]
  - - [896, 576, 1, 2048]
    - [60, 30860.3]
  - - [1024, 576, 1, 2048]
    - [109, 30123.7]
  - - [64, 640, 1, 2048]
    - [16, 10686.1]
  - - [128, 640, 1, 2048]
    - [15, 17943.5]
  - - [192, 640, 1, 2048]
    - [12, 17476.3]
  - - [256, 640, 1, 2048]
    - [14, 22444.4]
  - - [320, 640, 1, 2048]
    - [80, 21845.3]
  - - [384, 640, 1, 2048]
    - [17, 23741.3]
  - - [448, 640, 1, 2048]
    - [10, 24164.7]
  - - [512, 640, 1, 2048]
    - [8, 25860.8]
  - - [576, 640, 1, 2048]
    - [7, 29548.9]
  - - [640, 640, 1, 2048]
    - [8, 31011.5]
  - - [704, 640, 1, 2048]
    - [7, 33676.9]
  - - [768, 640, 1, 2048]
    - [7, 36340.5]
  - - [832, 640, 1, 2048]
    - [109, 27263.0]
  - - [896, 640, 1, 2048]
    - [114, 28997.7]
  - - [960, 640, 1, 2048]
    - [46, 30802.7]
  - - [1024, 640, 1, 2048]
    - [114, 31730.0]
  - - [128, 704, 1, 2048]
    - [9, 14361.8]
  - - [256, 704, 1, 2048]
    - [10, 20677.8]
  - - [384, 704, 1, 2048]
    - [60, 23020.7]
  - - [512, 704, 1, 2048]
    - [7, 27089.8]
  - - [640, 704, 1, 2048]
    - [8, 34302.9]
  - - [768, 704, 1, 2048]
    - [109, 28501.8]
  - - [896, 704, 1, 2048]
    - [109, 31016.7]
  - - [1024, 704, 1, 2048]
    - [109, 28640.1]
  - - [64, 768, 1, 2048]
    - [15, 10485.8]
  - - [128, 768, 1, 2048]
    - [3, 15486.7]
  - - [192, 768, 1, 2048]
    - [15, 20543.5]
  - - [256, 768, 1, 2048]
    - [10, 21824.0]
  - - [320, 768, 1, 2048]
    - [10, 26078.6]
  - - [384, 768, 1, 2048]
    - [60, 25271.1]
  - - [448, 768, 1, 2048]
    - [60, 27851.5]
  - - [512, 768, 1, 2048]
    - [6, 29498.4]
  - - [576, 768, 1, 2048]
    - [6, 34317.0]
  - - [640, 768, 1, 2048]
    - [8, 37701.6]
  - - [704, 768, 1, 2048]
    - [10, 29371.3]
  - - [768, 768, 1, 2048]
    - [109, 29974.2]
  - - [832, 768, 1, 2048]
    - [109, 33946.1]
  - - [896, 768, 1, 2048]
    - [109, 34711.5]
  - - [960, 768, 1, 2048]
    - [109, 37467.7]
  - - [1024, 768, 1, 2048]
    - [109, 31426.6]
  - - [128, 832, 1, 2048]
    - [3, 16276.4]
  - - [256, 832, 1, 2048]
    - [9, 22086.5]
  - - [384, 832, 1, 2048]
    - [60, 26016.4]
  - - [512, 832, 1, 2048]
    - [8, 32311.7]
  - - [640, 832, 1, 2048]
    - [114, 28106.2]
  - - [768, 832, 1, 2048]
    - [114, 31194.8]
  - - [896, 832, 1, 2048]
    - [109, 28860.6]
  - - [1024, 832, 1, 2048]
    - [109, 32797.6]
  - - [64, 896, 1, 2048]
    - [15, 12170.0]
  - - [128, 896, 1, 2048]
    - [9, 17660.2]
  - - [192, 896, 1, 2048]
    - [60, 20543.5]
  - - [256, 896, 1, 2048]
    - [10, 22369.6]
  - - [320, 896, 1, 2048]
    - [10, 24214.5]
  - - [384, 896, 1, 2048]
    - [60, 27851.5]
  - - [448, 896, 1, 2048]
    - [6, 30223.7]
  - - [512, 896, 1, 2048]
    - [8, 34164.5]
  - - [576, 896, 1, 2048]
    - [60, 29117.5]
  - - [640, 896, 1, 2048]
    - [114, 30703.4]
  - - [704, 896, 1, 2048]
    - [109, 31091.4]
  - - [768, 896, 1, 2048]
    - [109, 33120.7]
  - - [832, 896, 1, 2048]
    - [103, 29848.0]
  - - [896, 896, 1, 2048]
    - [114, 30992.8]
  - - [960, 896, 1, 2048]
    - [114, 34040.7]
  - - [1024, 896, 1, 2048]
    - [109, 35554.4]
  - - [128, 960, 1, 2048]
    - [3, 19210.6]
  - - [256, 960, 1, 2048]
    - [3, 25484.4]
  - - [384, 960, 1, 2048]
    - [60, 29093.4]
  - - [512, 960, 1, 2048]
    - [8, 36538.4]
  - - [640, 960, 1, 2048]
    - [109, 31107.3]
  - - [768, 960, 1, 2048]
    - [109, 35908.4]
  - - [896, 960, 1, 2048]
    - [109, 33586.4]
  - - [1024, 960, 1, 2048]
    - [109, 38202.4]
  - - [64, 1024, 1, 2048]
    - [15, 13981.0]
  - - [128, 1024, 1, 2048]
    - [15, 17895.7]
  - - [192, 1024, 1, 2048]
    - [11, 20284.8]
  - - [256, 1024, 1, 2048]
    - [60, 22184.7]
  - - [320, 1024, 1, 2048]
    - [7, 24947.5]
  - - [384, 1024, 1, 2048]
    - [7, 31518.8]
  - - [448, 1024, 1, 2048]
    - [7, 34732.9]
  - - [512, 1024, 1, 2048]
    - [114, 26743.3]
  - - [576, 1024, 1, 2048]
    - [114, 30350.7]
  - - [640, 1024, 1, 2048]
    - [109, 31543.5]
  - - [704, 1024, 1, 2048]
    - [114, 29557.5]
  - - [768, 1024, 1, 2048]
    - [103, 31767.5]
  - - [832, 1024, 1, 2048]
    - [7, 31810.9]
  - - [896, 1024, 1, 2048]
    - [117, 34926.5]
  - - [960, 1024, 1, 2048]
    - [103, 37491.0]
  - - [1024, 1024, 1, 2048]
    - [114, 33738.9]
  - - [128, 64, 1, 4096]
    - [84, 4827.98]
  - - [256, 64, 1, 4096]
    - [72, 6515.42]
  - - [384, 64, 1, 4096]
    - [72, 9235.16]
  - - [512, 64, 1, 4096]
    - [16, 11001.5]
  - - [640, 64, 1, 4096]
    - [16, 12427.6]
  - - [768, 64, 1, 4096]
    - [16, 11537.3]
  - - [896, 64, 1, 4096]
    - [16, 13085.3]
  - - [1024, 64, 1, 4096]
    - [16, 14393.3]
  - - [64, 128, 1, 4096]
    - [73, 4660.34]
  - - [128, 128, 1, 4096]
    - [75, 6847.84]
  - - [192, 128, 1, 4096]
    - [72, 9820.81]
  - - [256, 128, 1, 4096]
    - [16, 11570.5]
  - - [320, 128, 1, 4096]
    - [16, 14339.5]
  - - [384, 128, 1, 4096]
    - [76, 13288.9]
  - - [448, 128, 1, 4096]
    - [76, 14726.1]
  - - [512, 128, 1, 4096]
    - [16, 16122.2]
  - - [576, 128, 1, 4096]
    - [16, 17355.7]
  - - [640, 128, 1, 4096]
    - [16, 18903.9]
  - - [704, 128, 1, 4096]
    - [12, 17328.6]
  - - [768, 128, 1, 4096]
    - [12, 17935.6]
  - - [832, 128, 1, 4096]
    - [12, 20055.5]
  - - [896, 128, 1, 4096]
    - [18, 19174.0]
  - - [960, 128, 1, 4096]
    - [18, 19508.4]
  - - [1024, 128, 1, 4096]
    - [12, 19451.8]
  - - [128, 192, 1, 4096]
    - [75, 9586.98]
  - - [256, 192, 1, 4096]
    - [75, 14536.2]
  - - [384, 192, 1, 4096]
    - [76, 19483.2]
  - - [512, 192, 1, 4096]
    - [76, 19737.9]
  - - [640, 192, 1, 4096]
    - [76, 23574.5]
  - - [768, 192, 1, 4096]
    - [76, 22578.7]
  - - [896, 192, 1, 4096]
    - [76, 24637.9]
  - - [1024, 192, 1, 4096]
    - [9, 22246.0]
  - - [64, 256, 1, 4096]
    - [102, 6710.89]
  - - [128, 256, 1, 4096]
    - [16, 12543.7]
  - - [192, 256, 1, 4096]
    - [75, 13695.7]
  - - [256, 256, 1, 4096]
    - [16, 16468.4]
  - - [320, 256, 1, 4096]
    - [16, 20336.0]
  - - [384, 256, 1, 4096]
    - [12, 20809.0]
  - - [448, 256, 1, 4096]
    - [12, 22971.2]
  - - [512, 256, 1, 4096]
    - [12, 22748.8]
  - - [576, 256, 1, 4096]
    - [12, 24452.6]
  - - [640, 256, 1, 4096]
    - [12, 25712.2]
  - - [704, 256, 1, 4096]
    - [9, 23774.5]
  - - [768, 256, 1, 4096]
    - [9, 26621.7]
  - - [832, 256, 1, 4096]
    - [11, 25811.1]
  - - [896, 256, 1, 4096]
    - [12, 27272.1]
  - - [960, 256, 1, 4096]
    - [12, 28597.5]
  - - [1024, 256, 1, 4096]
    - [12, 26093.4]
  - - [128, 320, 1, 4096]
    - [16, 14847.1]
  - - [256, 320, 1, 4096]
    - [15, 19622.5]
  - - [384, 320, 1, 4096]
    - [78, 20841.3]
  - - [512, 320, 1, 4096]
    - [15, 24672.4]
  - - [640, 320, 1, 4096]
    - [78, 25497.3]
  - - [768, 320, 1, 4096]
    - [78, 25811.1]
  - - [896, 320, 1, 4096]
    - [10, 26214.4]
  - - [1024, 320, 1, 4096]
    - [8, 26368.9]
  - - [64, 384, 1, 4096]
    - [75, 9868.95]
  - - [128, 384, 1, 4096]
    - [75, 13884.6]
  - - [192, 384, 1, 4096]
    - [76, 18874.4]
  - - [256, 384, 1, 4096]
    - [76, 18684.6]
  - - [320, 384, 1, 4096]
    - [81, 21931.0]
  - - [384, 384, 1, 4096]
    - [79, 23230.0]
  - - [448, 384, 1, 4096]
    - [79, 25256.0]
  - - [512, 384, 1, 4096]
    - [9, 27438.0]
  - - [576, 384, 1, 4096]
    - [9, 30658.9]
  - - [640, 384, 1, 4096]
    - [9, 30183.9]
  - - [704, 384, 1, 4096]
    - [11, 25455.1]
  - - [768, 384, 1, 4096]
    - [60, 26231.5]
  - - [832, 384, 1, 4096]
    - [10, 28264.0]
  - - [896, 384, 1, 4096]
    - [60, 30048.7]
  - - [960, 384, 1, 4096]
    - [11, 32160.8]
  - - [1024, 384, 1, 4096]
    - [7, 30417.6]
  - - [128, 448, 1, 4096]
    - [75, 14960.6]
  - - [256, 448, 1, 4096]
    - [76, 20558.5]
  - - [384, 448, 1, 4096]
    - [79, 24131.6]
  - - [512, 448, 1, 4096]
    - [9, 27471.5]
  - - [640, 448, 1, 4096]
    - [11, 26721.4]
  - - [768, 448, 1, 4096]
    - [60, 28967.9]
  - - [896, 448, 1, 4096]
    - [8, 31377.2]
  - - [1024, 448, 1, 4096]
    - [8, 35188.2]
  - - [64, 512, 1, 4096]
    - [16, 12146.4]
  - - [128, 512, 1, 4096]
    - [16, 16621.4]
  - - [192, 512, 1, 4096]
    - [12, 20284.8]
  - - [256, 512, 1, 4096]
    - [79, 20145.2]
  - - [320, 512, 1, 4096]
    - [14, 24010.3]
  - - [384, 512, 1, 4096]
    - [9, 26710.0]
  - - [448, 512, 1, 4096]
    - [11, 28600.4]
  - - [512, 512, 1, 4096]
    - [12, 25087.4]
  - - [576, 512, 1, 4096]
    - [12, 27929.7]
  - - [640, 512, 1, 4096]
    - [11, 30331.7]
  - - [704, 512, 1, 4096]
    - [7, 28807.7]
  - - [768, 512, 1, 4096]
    - [7, 32020.1]
  - - [832, 512, 1, 4096]
    - [7, 32859.3]
  - - [896, 512, 1, 4096]
    - [7, 33979.2]
  - - [960, 512, 1, 4096]
    - [7, 37525.9]
  - - [1024, 512, 1, 4096]
    - [11, 31304.4]
  - - [128, 576, 1, 4096]
    - [15, 18414.0]
  - - [256, 576, 1, 4096]
    - [12, 22663.4]
  - - [384, 576, 1, 4096]
    - [9, 28806.7]
  - - [512, 576, 1, 4096]
    - [10, 26288.6]
  - - [640, 576, 1, 4096]
    - [10, 32789.3]
  - - [768, 576, 1, 4096]
    - [8, 34155.3]
  - - [896, 576, 1, 4096]
    - [10, 31363.9]
  - - [1024, 576, 1, 4096]
    - [10, 34099.1]
  - - [64, 640, 1, 4096]
    - [16, 15252.0]
  - - [128, 640, 1, 4096]
    - [16, 20336.0]
  - - [192, 640, 1, 4096]
    - [76, 21648.0]
  - - [256, 640, 1, 4096]
    - [15, 24717.8]
  - - [320, 640, 1, 4096]
    - [10, 26757.9]
  - - [384, 640, 1, 4096]
    - [11, 29262.6]
  - - [448, 640, 1, 4096]
    - [10, 26214.4]
  - - [512, 640, 1, 4096]
    - [11, 28557.0]
  - - [576, 640, 1, 4096]
    - [11, 32333.0]
  - - [640, 640, 1, 4096]
    - [8, 31987.1]
  - - [704, 640, 1, 4096]
    - [7, 34463.0]
  - - [768, 640, 1, 4096]
    - [7, 36974.6]
  - - [832, 640, 1, 4096]
    - [11, 30334.3]
  - - [896, 640, 1, 4096]
    - [11, 32109.5]
  - - [960, 640, 1, 4096]
    - [109, 33047.7]
  - - [1024, 640, 1, 4096]
    - [114, 34614.5]
  - - [128, 704, 1, 4096]
    - [78, 17369.4]
  - - [256, 704, 1, 4096]
    - [10, 24524.8]
  - - [384, 704, 1, 4096]
    - [10, 26054.0]
  - - [512, 704, 1, 4096]
    - [97, 28723.6]
  - - [640, 704, 1, 4096]
    - [8, 34527.5]
  - - [768, 704, 1, 4096]
    - [10, 31390.4]
  - - [896, 704, 1, 4096]
    - [109, 33840.1]
  - - [1024, 704, 1, 4096]
    - [109, 30300.6]
  - - [64, 768, 1, 4096]
    - [75, 13245.2]
  - - [128, 768, 1, 4096]
    - [9, 18598.3]
  - - [192, 768, 1, 4096]
    - [79, 23008.8]
  - - [256, 768, 1, 4096]
    - [9, 24816.8]
  - - [320, 768, 1, 4096]
    - [10, 30878.3]
  - - [384, 768, 1, 4096]
    - [10, 27422.5]
  - - [448, 768, 1, 4096]
    - [10, 30242.2]
  - - [512, 768, 1, 4096]
    - [6, 30532.9]
  - - [576, 768, 1, 4096]
    - [7, 34317.0]
  - - [640, 768, 1, 4096]
    - [8, 37772.3]
  - - [704, 768, 1, 4096]
    - [109, 30567.2]
  - - [768, 768, 1, 4096]
    - [10, 34027.0]
  - - [832, 768, 1, 4096]
    - [109, 34302.0]
  - - [896, 768, 1, 4096]
    - [109, 36748.0]
  - - [960, 768, 1, 4096]
    - [109, 39092.5]
  - - [1024, 768, 1, 4096]
    - [109, 32970.6]
  - - [128, 832, 1, 4096]
    - [9, 19344.0]
  - - [256, 832, 1, 4096]
    - [10, 26720.2]
  - - [384, 832, 1, 4096]
    - [11, 29506.7]
  - - [512, 832, 1, 4096]
    - [8, 32674.7]
  - - [640, 832, 1, 4096]
    - [10, 31632.2]
  - - [768, 832, 1, 4096]
    - [114, 33880.2]
  - - [896, 832, 1, 4096]
    - [114, 31625.6]
  - - [1024, 832, 1, 4096]
    - [114, 34966.5]
  - - [64, 896, 1, 4096]
    - [75, 15008.4]
  - - [128, 896, 1, 4096]
    - [9, 21065.6]
  - - [192, 896, 1, 4096]
    - [76, 25576.9]
  - - [256, 896, 1, 4096]
    - [10, 26729.0]
  - - [320, 896, 1, 4096]
    - [10, 25896.5]
  - - [384, 896, 1, 4096]
    - [10, 29117.5]
  - - [448, 896, 1, 4096]
    - [7, 30818.5]
  - - [512, 896, 1, 4096]
    - [8, 34861.7]
  - - [576, 896, 1, 4096]
    - [60, 31041.5]
  - - [640, 896, 1, 4096]
    - [10, 32087.6]
  - - [704, 896, 1, 4096]
    - [114, 33445.8]
  - - [768, 896, 1, 4096]
    - [109, 36205.2]
  - - [832, 896, 1, 4096]
    - [114, 31527.7]
  - - [896, 896, 1, 4096]
    - [114, 33623.1]
  - - [960, 896, 1, 4096]
    - [114, 35805.0]
  - - [1024, 896, 1, 4096]
    - [114, 36700.2]
  - - [128, 960, 1, 4096]
    - [9, 22369.6]
  - - [256, 960, 1, 4096]
    - [10, 27579.0]
  - - [384, 960, 1, 4096]
    - [60, 31133.0]
  - - [512, 960, 1, 4096]
    - [8, 37351.9]
  - - [640, 960, 1, 4096]
    - [109, 34100.0]
  - - [768, 960, 1, 4096]
    - [109, 39424.3]
  - - [896, 960, 1, 4096]
    - [109, 35267.4]
  - - [1024, 960, 1, 4096]
    - [8, 38549.9]
  - - [64, 1024, 1, 4096]
    - [15, 16368.0]
  - - [128, 1024, 1, 4096]
    - [78, 20728.6]
  - - [192, 1024, 1, 4096]
    - [10, 24778.7]
  - - [256, 1024, 1, 4096]
    - [11, 26188.8]
  - - [320, 1024, 1, 4096]
    - [8, 26317.2]
  - - [384, 1024, 1, 4096]
    - [8, 31123.0]
  - - [448, 1024, 1, 4096]
    - [7, 33554.4]
  - - [512, 1024, 1, 4096]
    - [11, 30246.2]
  - - [576, 1024, 1, 4096]
    - [11, 32083.9]
  - - [640, 1024, 1, 4096]
    - [109, 34481.1]
  - - [704, 1024, 1, 4096]
    - [114, 30038.6]
  - - [768, 1024, 1, 4096]
    - [114, 32521.2]
  - - [832, 1024, 1, 4096]
    - [7, 34414.8]
  - - [896, 1024, 1, 4096]
    - [103, 36187.7]
  - - [960, 1024, 1, 4096]
    - [103, 38809.9]
  - - [1024, 1024, 1, 4096]
    - [114, 34414.8]
  - - [1, 1, 1, 1]
    - [53, 0.000408163]
  - - [2, 2, 1, 2]
    - [104, 0.00290909]
  - - [4, 2, 1, 2]
    - [118, 0.00592593]
  - - [6, 2, 1, 2]
    - [28, 0.00857143]
  - - [8, 2, 1, 2]
    - [25, 0.013913]
  - - [10, 2, 1, 2]
    - [51, 0.0150943]
  - - [12, 2, 1, 2]
    - [25, 0.0204255]
  - - [14, 2, 1, 2]
    - [118, 0.0207407]
  - - [16, 2, 1, 2]
    - [115, 0.0232727]
  - - [2, 4, 1, 2]
    - [115, 0.00592593]
  - - [4, 4, 1, 2]
    - [118, 0.012549]
  - - [6, 4, 1, 2]
    - [118, 0.0177778]
  - - [8, 4, 1, 2]
    - [118, 0.0237037]
  - - [10, 4, 1, 2]
    - [118, 0.0307692]
  - - [12, 4, 1, 2]
    - [118, 0.0349091]
  - - [14, 4, 1, 2]
    - [113, 0.0439216]
  - - [16, 4, 1, 2]
    - [26, 0.0568889]
  - - [2, 6, 1, 2]
    - [102, 0.00872727]
  - - [4, 6, 1, 2]
    - [118, 0.0177778]
  - - [6, 6, 1, 2]
    - [32, 0.032]
  - - [8, 6, 1, 2]
    - [51, 0.0355556]
  - - [10, 6, 1, 2]
    - [25, 0.05]
  - - [12, 6, 1, 2]
    - [34, 0.0533333]
  - - [14, 6, 1, 2]
    - [118, 0.0622222]
  - - [16, 6, 1, 2]
    - [50, 0.0698182]
  - - [2, 8, 1, 2]
    - [23, 0.0142222]
  - - [4, 8, 1, 2]
    - [26, 0.0203175]
  - - [6, 8, 1, 2]
    - [36, 0.0417391]
  - - [8, 8, 1, 2]
    - [25, 0.0544681]
  - - [10, 8, 1, 2]
    - [51, 0.0603774]
  - - [12, 8, 1, 2]
    - [25, 0.0853333]
  - - [14, 8, 1, 2]
    - [25, 0.0995556]
  - - [16, 8, 1, 2]
    - [102, 0.0948148]
  - - [2, 10, 1, 2]
    - [115, 0.0148148]
  - - [4, 10, 1, 2]
    - [36, 0.0355556]
  - - [6, 10, 1, 2]
    - [102, 0.0444444]
  - - [8, 10, 1, 2]
    - [51, 0.0571429]
  - - [10, 10, 1, 2]
    - [102, 0.0727273]
  - - [12, 10, 1, 2]
    - [51, 0.0857143]
  - - [14, 10, 1, 2]
    - [49, 0.121739]
  - - [16, 10, 1, 2]
    - [115, 0.118519]
  - - [2, 12, 1, 2]
    - [20, 0.0213333]
  - - [4, 12, 1, 2]
    - [51, 0.0349091]
  - - [6, 12, 1, 2]
    - [24, 0.064]
  - - [8, 12, 1, 2]
    - [51, 0.0698182]
  - - [10, 12, 1, 2]
    - [49, 0.0872727]
  - - [12, 12, 1, 2]
    - [102, 0.104727]
  - - [14, 12, 1, 2]
    - [102, 0.124444]
  - - [16, 12, 1, 2]
    - [50, 0.137143]
  - - [2, 14, 1, 2]
    - [118, 0.0207407]
  - - [4, 14, 1, 2]
    - [32, 0.0486957]
  - - [6, 14, 1, 2]
    - [118, 0.0622222]
  - - [8, 14, 1, 2]
    - [102, 0.0814545]
  - - [10, 14, 1, 2]
    - [23, 0.124444]
  - - [12, 14, 1, 2]
    - [91, 0.137143]
  - - [14, 14, 1, 2]
    - [50, 0.142545]
  - - [16, 14, 1, 2]
    - [115, 0.165926]
  - - [2, 16, 1, 2]
    - [115, 0.0232727]
  - - [4, 16, 1, 2]
    - [104, 0.0512]
  - - [6, 16, 1, 2]
    - [104, 0.0698182]
  - - [8, 16, 1, 2]
    - [36, 0.113778]
  - - [10, 16, 1, 2]
    - [102, 0.116364]
  - - [12, 16, 1, 2]
    - [118, 0.139636]
  - - [14, 16, 1, 2]
    - [118, 0.162909]
  - - [16, 16, 1, 2]
    - [51, 0.193208]
  - - [2, 2, 1, 4]
    - [50, 0.00581818]
  - - [4, 2, 1, 4]
    - [118, 0.0118519]
  - - [6, 2, 1, 4]
    - [118, 0.0177778]
  - - [8, 2, 1, 4]
    - [37, 0.027234]
  - - [10, 2, 1, 4]
    - [102, 0.0296296]
  - - [12, 2, 1, 4]
    - [49, 0.0355556]
  - - [14, 2, 1, 4]
    - [115, 0.0414815]
  - - [16, 2, 1, 4]
    - [115, 0.0474074]
  - - [2, 4, 1, 4]
    - [102, 0.0118519]
  - - [4, 4, 1, 4]
    - [104, 0.0237037]
  - - [6, 4, 1, 4]
    - [115, 0.0362264]
  - - [8, 4, 1, 4]
    - [51, 0.0474074]
  - - [10, 4, 1, 4]
    - [51, 0.0603774]
  - - [12, 4, 1, 4]
    - [49, 0.0711111]
  - - [14, 4, 1, 4]
    - [20, 0.0896]
  - - [16, 4, 1, 4]
    - [27, 0.0948148]
  - - [2, 6, 1, 4]
    - [49, 0.0174545]
  - - [4, 6, 1, 4]
    - [50, 0.0342857]
  - - [6, 6, 1, 4]
    - [115, 0.0533333]
  - - [8, 6, 1, 4]
    - [28, 0.0698182]
  - - [10, 6, 1, 4]
    - [23, 0.109091]
  - - [12, 6, 1, 4]
    - [49, 0.110769]
  - - [14, 6, 1, 4]
    - [49, 0.142979]
  - - [16, 6, 1, 4]
    - [28, 0.142222]
  - - [2, 8, 1, 4]
    - [104, 0.0232727]
  - - [4, 8, 1, 4]
    - [104, 0.0465455]
  - - [6, 8, 1, 4]
    - [20, 0.0853333]
  - - [8, 8, 1, 4]
    - [49, 0.111304]
  - - [10, 8, 1, 4]
    - [102, 0.133333]
  - - [12, 8, 1, 4]
    - [34, 0.144906]
  - - [14, 8, 1, 4]
    - [115, 0.172308]
  - - [16, 8, 1, 4]
    - [49, 0.222609]
  - - [2, 10, 1, 4]
    - [36, 0.0363636]
  - - [4, 10, 1, 4]
    - [49, 0.0592593]
  - - [6, 10, 1, 4]
    - [104, 0.0872727]
  - - [8, 10, 1, 4]
    - [36, 0.142222]
  - - [10, 10, 1, 4]
    - [115, 0.145455]
  - - [12, 10, 1, 4]
    - [51, 0.174545]
  - - [14, 10, 1, 4]
    - [49, 0.203636]
  - - [16, 10, 1, 4]
    - [118, 0.237037]
  - - [2, 12, 1, 4]
    - [50, 0.0349091]
  - - [4, 12, 1, 4]
    - [50, 0.0698182]
  - - [6, 12, 1, 4]
    - [102, 0.106667]
  - - [8, 12, 1, 4]
    - [51, 0.144906]
  - - [10, 12, 1, 4]
    - [118, 0.177778]
  - - [12, 12, 1, 4]
    - [118, 0.213333]
  - - [14, 12, 1, 4]
    - [113, 0.244364]
  - - [16, 12, 1, 4]
    - [20, 0.341333]
  - - [2, 14, 1, 4]
    - [36, 0.0497778]
  - - [4, 14, 1, 4]
    - [34, 0.0814545]
  - - [6, 14, 1, 4]
    - [50, 0.122182]
  - - [8, 14, 1, 4]
    - [113, 0.172308]
  - - [10, 14, 1, 4]
    - [115, 0.219608]
  - - [12, 14, 1, 4]
    - [113, 0.258462]
  - - [14, 14, 1, 4]
    - [51, 0.285091]
  - - [16, 14, 1, 4]
    - [51, 0.338113]
  - - [2, 16, 1, 4]
    - [102, 0.0522449]
  - - [4, 16, 1, 4]
    - [113, 0.0984615]
  - - [6, 16, 1, 4]
    - [118, 0.142222]
  - - [8, 16, 1, 4]
    - [51, 0.186182]
  - - [10, 16, 1, 4]
    - [28, 0.232727]
  - - [12, 16, 1, 4]
    - [102, 0.279273]
  - - [14, 16, 1, 4]
    - [118, 0.325818]
  - - [16, 16, 1, 4]
    - [49, 0.435745]
  - - [2, 2, 1, 6]
    - [115, 0.01]
  - - [4, 2, 1, 6]
    - [25, 0.02]
  - - [6, 2, 1, 6]
    - [20, 0.0327273]
  - - [8, 2, 1, 6]
    - [49, 0.0349091]
  - - [10, 2, 1, 6]
    - [49, 0.0510638]
  - - [12, 2, 1, 6]
    - [28, 0.0523636]
  - - [14, 2, 1, 6]
    - [51, 0.0610909]
  - - [16, 2, 1, 6]
    - [25, 0.0783673]
  - - [2, 4, 1, 6]
    - [115, 0.0177778]
  - - [4, 4, 1, 6]
    - [91, 0.0376471]
  - - [6, 4, 1, 6]
    - [118, 0.0533333]
  - - [8, 4, 1, 6]
    - [28, 0.0698182]
  - - [10, 4, 1, 6]
    - [49, 0.102128]
  - - [12, 4, 1, 6]
    - [102, 0.106667]
  - - [14, 4, 1, 6]
    - [102, 0.122182]
  - - [16, 4, 1, 6]
    - [51, 0.144906]
  - - [2, 6, 1, 6]
    - [43, 0.03]
  - - [4, 6, 1, 6]
    - [49, 0.0533333]
  - - [6, 6, 1, 6]
    - [115, 0.093913]
  - - [8, 6, 1, 6]
    - [113, 0.112941]
  - - [10, 6, 1, 6]
    - [115, 0.130909]
  - - [12, 6, 1, 6]
    - [51, 0.157091]
  - - [14, 6, 1, 6]
    - [118, 0.186667]
  - - [16, 6, 1, 6]
    - [51, 0.209455]
  - - [2, 8, 1, 6]
    - [118, 0.0391837]
  - - [4, 8, 1, 6]
    - [118, 0.08]
  - - [6, 8, 1, 6]
    - [115, 0.106667]
  - - [8, 8, 1, 6]
    - [102, 0.142222]
  - - [10, 8, 1, 6]
    - [118, 0.181132]
  - - [12, 8, 1, 6]
    - [50, 0.205714]
  - - [14, 8, 1, 6]
    - [24, 0.28]
  - - [16, 8, 1, 6]
    - [50, 0.279273]
  - - [2, 10, 1, 6]
    - [102, 0.0461538]
  - - [4, 10, 1, 6]
    - [51, 0.0888889]
  - - [6, 10, 1, 6]
    - [113, 0.135849]
  - - [8, 10, 1, 6]
    - [118, 0.181132]
  - - [10, 10, 1, 6]
    - [118, 0.222222]
  - - [12, 10, 1, 6]
    - [20, 0.32]
  - - [14, 10, 1, 6]
    - [118, 0.311111]
  - - [16, 10, 1, 6]
    - [115, 0.355556]
  - - [2, 12, 1, 6]
    - [50, 0.0523636]
  - - [4, 12, 1, 6]
    - [28, 0.102857]
  - - [6, 12, 1, 6]
    - [50, 0.154286]
  - - [8, 12, 1, 6]
    - [24, 0.250435]
  - - [10, 12, 1, 6]
    - [25, 0.306383]
  - - [12, 12, 1, 6]
    - [113, 0.338824]
  - - [14, 12, 1, 6]
    - [115, 0.366545]
  - - [16, 12, 1, 6]
    - [118, 0.418909]
  - - [2, 14, 1, 6]
    - [27, 0.0646154]
  - - [4, 14, 1, 6]
    - [39, 0.122182]
  - - [6, 14, 1, 6]
    - [113, 0.193846]
  - - [8, 14, 1, 6]
    - [118, 0.258462]
  - - [10, 14, 1, 6]
    - [49, 0.35]
  - - [12, 14, 1, 6]
    - [28, 0.438261]
  - - [14, 14, 1, 6]
    - [104, 0.427636]
  - - [16, 14, 1, 6]
    - [20, 0.584348]
  - - [2, 16, 1, 6]
    - [34, 0.0629508]
  - - [4, 16, 1, 6]
    - [25, 0.142222]
  - - [6, 16, 1, 6]
    - [118, 0.205714]
  - - [8, 16, 1, 6]
    - [34, 0.284444]
  - - [10, 16, 1, 6]
    - [104, 0.349091]
  - - [12, 16, 1, 6]
    - [20, 0.512]
  - - [14, 16, 1, 6]
    - [51, 0.50717]
  - - [16, 16, 1, 6]
    - [104, 0.558545]
  - - [2, 2, 1, 8]
    - [102, 0.0118519]
  - - [4, 2, 1, 8]
    - [25, 0.0278261]
  - - [6, 2, 1, 8]
    - [104, 0.0349091]
  - - [8, 2, 1, 8]
    - [118, 0.0474074]
  - - [10, 2, 1, 8]
    - [23, 0.0695652]
  - - [12, 2, 1, 8]
    - [115, 0.0768]
  - - [14, 2, 1, 8]
    - [104, 0.08]
  - - [16, 2, 1, 8]
    - [102, 0.0948148]
  - - [2, 4, 1, 8]
    - [34, 0.0246154]
  - - [4, 4, 1, 8]
    - [118, 0.0474074]
  - - [6, 4, 1, 8]
    - [102, 0.0711111]
  - - [8, 4, 1, 8]
    - [102, 0.0948148]
  - - [10, 4, 1, 8]
    - [113, 0.123077]
  - - [12, 4, 1, 8]
    - [115, 0.142222]
  - - [14, 4, 1, 8]
    - [102, 0.186667]
  - - [16, 4, 1, 8]
    - [49, 0.20898]
  - - [2, 6, 1, 8]
    - [118, 0.0362264]
  - - [4, 6, 1, 8]
    - [104, 0.0711111]
  - - [6, 6, 1, 8]
    - [49, 0.12]
  - - [8, 6, 1, 8]
    - [51, 0.147692]
  - - [10, 6, 1, 8]
    - [113, 0.218182]
  - - [12, 6, 1, 8]
    - [21, 0.250435]
  - - [14, 6, 1, 8]
    - [49, 0.244364]
  - - [16, 6, 1, 8]
    - [34, 0.289811]
  - - [2, 8, 1, 8]
    - [50, 0.0457143]
  - - [4, 8, 1, 8]
    - [113, 0.0984615]
  - - [6, 8, 1, 8]
    - [115, 0.142222]
  - - [8, 8, 1, 8]
    - [118, 0.2048]
  - - [10, 8, 1, 8]
    - [104, 0.232727]
  - - [12, 8, 1, 8]
    - [49, 0.326809]
  - - [14, 8, 1, 8]
    - [102, 0.398222]
  - - [16, 8, 1, 8]
    - [51, 0.372364]
  - - [2, 10, 1, 8]
    - [51, 0.0592593]
  - - [4, 10, 1, 8]
    - [50, 0.116364]
  - - [6, 10, 1, 8]
    - [51, 0.181132]
  - - [8, 10, 1, 8]
    - [51, 0.237037]
  - - [10, 10, 1, 8]
    - [102, 0.290909]
  - - [12, 10, 1, 8]
    - [113, 0.355556]
  - - [14, 10, 1, 8]
    - [39, 0.4]
  - - [16, 10, 1, 8]
    - [102, 0.465455]
  - - [2, 12, 1, 8]
    - [118, 0.0711111]
  - - [4, 12, 1, 8]
    - [104, 0.139636]
  - - [6, 12, 1, 8]
    - [20, 0.256]
  - - [8, 12, 1, 8]
    - [113, 0.279273]
  - - [10, 12, 1, 8]
    - [49, 0.417391]
  - - [12, 12, 1, 8]
    - [118, 0.426667]
  - - [14, 12, 1, 8]
    - [115, 0.488727]
  - - [16, 12, 1, 8]
    - [49, 0.653617]
  - - [2, 14, 1, 8]
    - [49, 0.0953191]
  - - [4, 14, 1, 8]
    - [50, 0.162909]
  - - [6, 14, 1, 8]
    - [118, 0.248889]
  - - [8, 14, 1, 8]
    - [118, 0.325818]
  - - [10, 14, 1, 8]
    - [23, 0.497778]
  - - [12, 14, 1, 8]
    - [113, 0.56]
  - - [14, 14, 1, 8]
    - [113, 0.570182]
  - - [16, 14, 1, 8]
    - [50, 0.651636]
  - - [2, 16, 1, 8]
    - [104, 0.0930909]
  - - [4, 16, 1, 8]
    - [115, 0.200784]
  - - [6, 16, 1, 8]
    - [118, 0.279273]
  - - [8, 16, 1, 8]
    - [102, 0.365714]
  - - [10, 16, 1, 8]
    - [51, 0.457143]
  - - [12, 16, 1, 8]
    - [50, 0.558545]
  - - [14, 16, 1, 8]
    - [102, 0.651636]
  - - [16, 16, 1, 8]
    - [118, 0.694237]
  - - [2, 2, 1, 10]
    - [104, 0.0145455]
  - - [4, 2, 1, 10]
    - [28, 0.0290909]
  - - [6, 2, 1, 10]
    - [34, 0.045283]
  - - [8, 2, 1, 10]
    - [25, 0.0680851]
  - - [10, 2, 1, 10]
    - [51, 0.0727273]
  - - [12, 2, 1, 10]
    - [49, 0.102128]
  - - [14, 2, 1, 10]
    - [28, 0.101818]
  - - [16, 2, 1, 10]
    - [49, 0.13913]
  - - [2, 4, 1, 10]
    - [104, 0.0290909]
  - - [4, 4, 1, 10]
    - [115, 0.0581818]
  - - [6, 4, 1, 10]
    - [25, 0.104348]
  - - [8, 4, 1, 10]
    - [104, 0.116364]
  - - [10, 4, 1, 10]
    - [102, 0.148148]
  - - [12, 4, 1, 10]
    - [50, 0.174545]
  - - [14, 4, 1, 10]
    - [115, 0.207407]
  - - [16, 4, 1, 10]
    - [20, 0.284444]
  - - [2, 6, 1, 10]
    - [102, 0.0436364]
  - - [4, 6, 1, 10]
    - [49, 0.0872727]
  - - [6, 6, 1, 10]
    - [102, 0.133333]
  - - [8, 6, 1, 10]
    - [104, 0.174545]
  - - [10, 6, 1, 10]
    - [25, 0.26087]
  - - [12, 6, 1, 10]
    - [102, 0.266667]
  - - [14, 6, 1, 10]
    - [49, 0.3]
  - - [16, 6, 1, 10]
    - [113, 0.408511]
  - - [2, 8, 1, 10]
    - [104, 0.0581818]
  - - [4, 8, 1, 10]
    - [113, 0.123077]
  - - [6, 8, 1, 10]
    - [115, 0.177778]
  - - [8, 8, 1, 10]
    - [51, 0.246154]
  - - [10, 8, 1, 10]
    - [115, 0.296296]
  - - [12, 8, 1, 10]
    - [28, 0.342857]
  - - [14, 8, 1, 10]
    - [25, 0.486957]
  - - [16, 8, 1, 10]
    - [20, 0.568889]
  - - [2, 10, 1, 10]
    - [104, 0.0769231]
  - - [4, 10, 1, 10]
    - [102, 0.148148]
  - - [6, 10, 1, 10]
    - [113, 0.235294]
  - - [8, 10, 1, 10]
    - [115, 0.290909]
  - - [10, 10, 1, 10]
    - [20, 0.454545]
  - - [12, 10, 1, 10]
    - [104, 0.436364]
  - - [14, 10, 1, 10]
    - [49, 0.583333]
  - - [16, 10, 1, 10]
    - [118, 0.592593]
  - - [2, 12, 1, 10]
    - [20, 0.102128]
  - - [4, 12, 1, 10]
    - [23, 0.181132]
  - - [6, 12, 1, 10]
    - [25, 0.306383]
  - - [8, 12, 1, 10]
    - [50, 0.349091]
  - - [10, 12, 1, 10]
    - [51, 0.428571]
  - - [12, 12, 1, 10]
    - [102, 0.523636]
  - - [14, 12, 1, 10]
    - [49, 0.714894]
  - - [16, 12, 1, 10]
    - [34, 0.698182]
  - - [2, 14, 1, 10]
    - [25, 0.119149]
  - - [4, 14, 1, 10]
    - [113, 0.211321]
  - - [6, 14, 1, 10]
    - [118, 0.342857]
  - - [8, 14, 1, 10]
    - [49, 0.476596]
  - - [10, 14, 1, 10]
    - [28, 0.509091]
  - - [12, 14, 1, 10]
    - [118, 0.610909]
  - - [14, 14, 1, 10]
    - [104, 0.7]
  - - [16, 14, 1, 10]
    - [118, 0.814545]
  - - [2, 16, 1, 10]
    - [50, 0.116364]
  - - [4, 16, 1, 10]
    - [20, 0.278261]
  - - [6, 16, 1, 10]
    - [28, 0.342857]
  - - [8, 16, 1, 10]
    - [27, 0.492308]
  - - [10, 16, 1, 10]
    - [104, 0.581818]
  - - [12, 16, 1, 10]
    - [49, 0.698182]
  - - [14, 16, 1, 10]
    - [102, 0.814545]
  - - [16, 16, 1, 10]
    - [104, 0.930909]
  - - [2, 2, 1, 12]
    - [113, 0.0171429]
  - - [4, 2, 1, 12]
    - [26, 0.0417391]
  - - [6, 2, 1, 12]
    - [51, 0.0543396]
  - - [8, 2, 1, 12]
    - [51, 0.0698182]
  - - [10, 2, 1, 12]
    - [28, 0.0923077]
  - - [12, 2, 1, 12]
    - [36, 0.125217]
  - - [14, 2, 1, 12]
    - [49, 0.142979]
  - - [16, 2, 1, 12]
    - [118, 0.142222]
  - - [2, 4, 1, 12]
    - [118, 0.0355556]
  - - [4, 4, 1, 12]
    - [113, 0.0783673]
  - - [6, 4, 1, 12]
    - [51, 0.0993103]
  - - [8, 4, 1, 12]
    - [104, 0.139636]
  - - [10, 4, 1, 12]
    - [115, 0.177778]
  - - [12, 4, 1, 12]
    - [115, 0.209455]
  - - [14, 4, 1, 12]
    - [118, 0.28]
  - - [16, 4, 1, 12]
    - [49, 0.32]
  - - [2, 6, 1, 12]
    - [118, 0.06]
  - - [4, 6, 1, 12]
    - [51, 0.108679]
  - - [6, 6, 1, 12]
    - [102, 0.169412]
  - - [8, 6, 1, 12]
    - [104, 0.261818]
  - - [10, 6, 1, 12]
    - [118, 0.266667]
  - - [12, 6, 1, 12]
    - [50, 0.303158]
  - - [14, 6, 1, 12]
    - [104, 0.366545]
  - - [16, 6, 1, 12]
    - [118, 0.426667]
  - - [2, 8, 1, 12]
    - [51, 0.0698182]
  - - [4, 8, 1, 12]
    - [27, 0.147692]
  - - [6, 8, 1, 12]
    - [51, 0.209455]
  - - [8, 8, 1, 12]
    - [49, 0.326809]
  - - [10, 8, 1, 12]
    - [26, 0.436364]
  - - [12, 8, 1, 12]
    - [115, 0.426667]
  - - [14, 8, 1, 12]
    - [50, 0.497778]
  - - [16, 8, 1, 12]
    - [23, 0.698182]
  - - [2, 10, 1, 12]
    - [67, 0.0888889]
  - - [4, 10, 1, 12]
    - [34, 0.177778]
  - - [6, 10, 1, 12]
    - [47, 0.327273]
  - - [8, 10, 1, 12]
    - [118, 0.408511]
  - - [10, 10, 1, 12]
    - [49, 0.436364]
  - - [12, 10, 1, 12]
    - [115, 0.533333]
  - - [14, 10, 1, 12]
    - [25, 0.730435]
  - - [16, 10, 1, 12]
    - [49, 0.834783]
  - - [2, 12, 1, 12]
    - [113, 0.112941]
  - - [4, 12, 1, 12]
    - [49, 0.250435]
  - - [6, 12, 1, 12]
    - [36, 0.384]
  - - [8, 12, 1, 12]
    - [115, 0.426667]
  - - [10, 12, 1, 12]
    - [104, 0.543396]
  - - [12, 12, 1, 12]
    - [102, 0.64]
  - - [14, 12, 1, 12]
    - [49, 0.857872]
  - - [16, 12, 1, 12]
    - [118, 0.837818]
  - - [2, 14, 1, 12]
    - [113, 0.122182]
  - - [4, 14, 1, 12]
    - [118, 0.28]
  - - [6, 14, 1, 12]
    - [113, 0.395294]
  - - [8, 14, 1, 12]
    - [102, 0.48]
  - - [10, 14, 1, 12]
    - [49, 0.610909]
  - - [12, 14, 1, 12]
    - [115, 0.746667]
  - - [14, 14, 1, 12]
    - [104, 0.84]
  - - [16, 14, 1, 12]
    - [49, 0.977455]
  - - [2, 16, 1, 12]
    - [49, 0.139636]
  - - [4, 16, 1, 12]
    - [102, 0.284444]
  - - [6, 16, 1, 12]
    - [104, 0.418909]
  - - [8, 16, 1, 12]
    - [20, 0.682667]
  - - [10, 16, 1, 12]
    - [26, 0.853333]
  - - [12, 16, 1, 12]
    - [104, 0.837818]
  - - [14, 16, 1, 12]
    - [118, 1.01434]
  - - [16, 16, 1, 12]
    - [118, 1.13778]
  - - [2, 2, 1, 14]
    - [113, 0.0219608]
  - - [4, 2, 1, 14]
    - [23, 0.0497778]
  - - [6, 2, 1, 14]
    - [36, 0.0763636]
  - - [8, 2, 1, 14]
    - [102, 0.0814545]
  - - [10, 2, 1, 14]
    - [34, 0.103704]
  - - [12, 2, 1, 14]
    - [25, 0.14]
  - - [14, 2, 1, 14]
    - [115, 0.150769]
  - - [16, 2, 1, 14]
    - [49, 0.186667]
  - - [2, 4, 1, 14]
    - [102, 0.0430769]
  - - [4, 4, 1, 14]
    - [26, 0.101818]
  - - [6, 4, 1, 14]
    - [36, 0.146087]
  - - [8, 4, 1, 14]
    - [49, 0.162909]
  - - [10, 4, 1, 14]
    - [26, 0.254545]
  - - [12, 4, 1, 14]
    - [49, 0.28]
  - - [14, 4, 1, 14]
    - [113, 0.301538]
  - - [16, 4, 1, 14]
    - [47, 0.351373]
  - - [2, 6, 1, 14]
    - [49, 0.07]
  - - [4, 6, 1, 14]
    - [49, 0.131765]
  - - [6, 6, 1, 14]
    - [51, 0.176842]
  - - [8, 6, 1, 14]
    - [115, 0.244364]
  - - [10, 6, 1, 14]
    - [49, 0.373333]
  - - [12, 6, 1, 14]
    - [102, 0.366545]
  - - [14, 6, 1, 14]
    - [25, 0.511304]
  - - [16, 6, 1, 14]
    - [113, 0.50717]
  - - [2, 8, 1, 14]
    - [113, 0.0861538]
  - - [4, 8, 1, 14]
    - [23, 0.199111]
  - - [6, 8, 1, 14]
    - [118, 0.248889]
  - - [8, 8, 1, 14]
    - [51, 0.325818]
  - - [10, 8, 1, 14]
    - [49, 0.476596]
  - - [12, 8, 1, 14]
    - [115, 0.497778]
  - - [14, 8, 1, 14]
    - [118, 0.681739]
  - - [16, 8, 1, 14]
    - [115, 0.651636]
  - - [2, 10, 1, 14]
    - [51, 0.1]
  - - [4, 10, 1, 14]
    - [102, 0.207407]
  - - [6, 10, 1, 14]
    - [118, 0.329412]
  - - [8, 10, 1, 14]
    - [115, 0.414815]
  - - [10, 10, 1, 14]
    - [118, 0.518519]
  - - [12, 10, 1, 14]
    - [115, 0.622222]
  - - [14, 10, 1, 14]
    - [28, 0.712727]
  - - [16, 10, 1, 14]
    - [102, 0.82963]
  - - [2, 12, 1, 14]
    - [20, 0.146087]
  - - [4, 12, 1, 14]
    - [102, 0.248889]
  - - [6, 12, 1, 14]
    - [25, 0.428936]
  - - [8, 12, 1, 14]
    - [115, 0.497778]
  - - [10, 12, 1, 14]
    - [118, 0.622222]
  - - [12, 12, 1, 14]
    - [102, 0.733091]
  - - [14, 12, 1, 14]
    - [118, 0.871111]
  - - [16, 12, 1, 14]
    - [49, 1.1687]
  - - [2, 14, 1, 14]
    - [51, 0.147925]
  - - [4, 14, 1, 14]
    - [115, 0.285091]
  - - [6, 14, 1, 14]
    - [118, 0.435556]
  - - [8, 14, 1, 14]
    - [23, 0.696889]
  - - [10, 14, 1, 14]
    - [49, 0.816667]
  - - [12, 14, 1, 14]
    - [104, 0.855273]
  - - [14, 14, 1, 14]
    - [20, 1.16766]
  - - [16, 14, 1, 14]
    - [102, 1.14036]
  - - [2, 16, 1, 14]
    - [118, 0.162909]
  - - [4, 16, 1, 14]
    - [57, 0.373333]
  - - [6, 16, 1, 14]
    - [102, 0.488727]
  - - [8, 16, 1, 14]
    - [118, 0.663704]
  - - [10, 16, 1, 14]
    - [25, 0.933333]
  - - [12, 16, 1, 14]
    - [113, 1.03385]
  - - [14, 16, 1, 14]
    - [102, 1.16148]
  - - [16, 16, 1, 14]
    - [118, 1.35245]
  - - [2, 2, 1, 16]
    - [26, 0.0290909]
  - - [4, 2, 1, 16]
    - [28, 0.0465455]
  - - [6, 2, 1, 16]
    - [20, 0.0853333]
  - - [8, 2, 1, 16]
    - [49, 0.0930909]
  - - [10, 2, 1, 16]
    - [23, 0.145455]
  - - [12, 2, 1, 16]
    - [25, 0.166957]
  - - [14, 2, 1, 16]
    - [104, 0.162909]
  - - [16, 2, 1, 16]
    - [113, 0.196923]
  - - [2, 4, 1, 16]
    - [23, 0.0556522]
  - - [4, 4, 1, 16]
    - [36, 0.0867797]
  - - [6, 4, 1, 16]
    - [34, 0.144906]
  - - [8, 4, 1, 16]
    - [36, 0.222609]
  - - [10, 4, 1, 16]
    - [49, 0.232727]
  - - [12, 4, 1, 16]
    - [50, 0.284444]
  - - [14, 4, 1, 16]
    - [118, 0.331852]
  - - [16, 4, 1, 16]
    - [51, 0.379259]
  - - [2, 6, 1, 16]
    - [115, 0.0711111]
  - - [4, 6, 1, 16]
    - [102, 0.142222]
  - - [6, 6, 1, 16]
    - [28, 0.209455]
  - - [8, 6, 1, 16]
    - [50, 0.279273]
  - - [10, 6, 1, 16]
    - [49, 0.4]
  - - [12, 6, 1, 16]
    - [51, 0.434717]
  - - [14, 6, 1, 16]
    - [118, 0.488727]
  - - [16, 6, 1, 16]
    - [30, 0.626939]
  - - [2, 8, 1, 16]
    - [115, 0.0948148]
  - - [4, 8, 1, 16]
    - [118, 0.193208]
  - - [6, 8, 1, 16]
    - [25, 0.326809]
  - - [8, 8, 1, 16]
    - [102, 0.372364]
  - - [10, 8, 1, 16]
    - [102, 0.544681]
  - - [12, 8, 1, 16]
    - [104, 0.558545]
  - - [14, 8, 1, 16]
    - [113, 0.702745]
  - - [16, 8, 1, 16]
    - [49, 0.758519]
  - - [2, 10, 1, 16]
    - [102, 0.120755]
  - - [4, 10, 1, 16]
    - [113, 0.237037]
  - - [6, 10, 1, 16]
    - [115, 0.355556]
  - - [8, 10, 1, 16]
    - [113, 0.492308]
  - - [10, 10, 1, 16]
    - [51, 0.581818]
  - - [12, 10, 1, 16]
    - [25, 0.834783]
  - - [14, 10, 1, 16]
    - [113, 0.896]
  - - [16, 10, 1, 16]
    - [43, 1.06667]
  - - [2, 12, 1, 16]
    - [49, 0.139636]
  - - [4, 12, 1, 16]
    - [113, 0.279273]
  - - [6, 12, 1, 16]
    - [102, 0.418909]
  - - [8, 12, 1, 16]
    - [49, 0.64]
  - - [10, 12, 1, 16]
    - [51, 0.724528]
  - - [12, 12, 1, 16]
    - [115, 0.853333]
  - - [14, 12, 1, 16]
    - [115, 0.995556]
  - - [16, 12, 1, 16]
    - [49, 1.13778]
  - - [2, 14, 1, 16]
    - [23, 0.203636]
  - - [4, 14, 1, 16]
    - [104, 0.314386]
  - - [6, 14, 1, 16]
    - [104, 0.488727]
  - - [8, 14, 1, 16]
    - [51, 0.587541]
  - - [10, 14, 1, 16]
    - [50, 0.8]
  - - [12, 14, 1, 16]
    - [49, 1.12]
  - - [14, 14, 1, 16]
    - [102, 1.2298]
  - - [16, 14, 1, 16]
    - [102, 1.30327]
  - - [2, 16, 1, 16]
    - [50, 0.186182]
  - - [4, 16, 1, 16]
    - [104, 0.372364]
  - - [6, 16, 1, 16]
    - [113, 0.602353]
  - - [8, 16, 1, 16]
    - [23, 0.871489]
  - - [10, 16, 1, 16]
    - [66, 0.948148]
  - - [12, 16, 1, 16]
    - [49, 1.11709]
  - - [14, 16, 1, 16]
    - [115, 1.30327]
  - - [16, 16, 1, 16]
    - [43, 1.51704]
  - - [2, 2, 1, 1024]
    - [110, 1.07789]
  - - [4, 2, 1, 1024]
    - [102, 2.10051]
  - - [6, 2, 1, 1024]
    - [70, 3.36658]
  - - [8, 2, 1, 1024]
    - [118, 4.096]
  - - [10, 2, 1, 1024]
    - [70, 5.53514]
  - - [12, 2, 1, 1024]
    - [47, 6.22177]
  - - [14, 2, 1, 1024]
    - [102, 7.74919]
  - - [16, 2, 1, 1024]
    - [70, 9.10222]
  - - [2, 4, 1, 1024]
    - [102, 2.21405]
  - - [4, 4, 1, 1024]
    - [118, 4.096]
  - - [6, 4, 1, 1024]
    - [110, 6.38338]
  - - [8, 4, 1, 1024]
    - [102, 8.51117]
  - - [10, 4, 1, 1024]
    - [102, 10.5026]
  - - [12, 4, 1, 1024]
    - [102, 12.6031]
  - - [14, 4, 1, 1024]
    - [70, 15.4984]
  - - [16, 4, 1, 1024]
    - [118, 16.384]
  - - [2, 6, 1, 1024]
    - [110, 3.19169]
  - - [4, 6, 1, 1024]
    - [102, 6.5536]
  - - [6, 6, 1, 1024]
    - [102, 9.45231]
  - - [8, 6, 1, 1024]
    - [102, 12.6031]
  - - [10, 6, 1, 1024]
    - [102, 16.384]
  - - [12, 6, 1, 1024]
    - [47, 16.7564]
  - - [14, 6, 1, 1024]
    - [70, 23.566]
  - - [16, 6, 1, 1024]
    - [70, 26.9326]
  - - [2, 8, 1, 1024]
    - [118, 4.20103]
  - - [4, 8, 1, 1024]
    - [102, 7.71012]
  - - [6, 8, 1, 1024]
    - [118, 12.9347]
  - - [8, 8, 1, 1024]
    - [70, 17.9551]
  - - [10, 8, 1, 1024]
    - [110, 21.2779]
  - - [12, 8, 1, 1024]
    - [102, 27.6913]
  - - [14, 8, 1, 1024]
    - [102, 29.4072]
  - - [16, 8, 1, 1024]
    - [102, 33.6082]
  - - [2, 10, 1, 1024]
    - [102, 5.46133]
  - - [4, 10, 1, 1024]
    - [118, 10.7789]
  - - [6, 10, 1, 1024]
    - [47, 15.36]
  - - [8, 10, 1, 1024]
    - [102, 21.8453]
  - - [10, 10, 1, 1024]
    - [110, 25.9241]
  - - [12, 10, 1, 1024]
    - [110, 31.5077]
  - - [14, 10, 1, 1024]
    - [118, 38.7459]
  - - [16, 10, 1, 1024]
    - [70, 43.6907]
  - - [2, 12, 1, 1024]
    - [102, 6.30154]
  - - [4, 12, 1, 1024]
    - [102, 13.1072]
  - - [6, 12, 1, 1024]
    - [82, 18.9046]
  - - [8, 12, 1, 1024]
    - [102, 24.8871]
  - - [10, 12, 1, 1024]
    - [115, 29.2571]
  - - [12, 12, 1, 1024]
    - [118, 36.864]
  - - [14, 12, 1, 1024]
    - [110, 44.1108]
  - - [16, 12, 1, 1024]
    - [102, 49.7742]
  - - [2, 14, 1, 1024]
    - [102, 7.25873]
  - - [4, 14, 1, 1024]
    - [70, 15.0905]
  - - [6, 14, 1, 1024]
    - [70, 23.2476]
  - - [8, 14, 1, 1024]
    - [102, 29.4072]
  - - [10, 14, 1, 1024]
    - [102, 36.759]
  - - [12, 14, 1, 1024]
    - [102, 40.0074]
  - - [14, 14, 1, 1024]
    - [102, 53.5211]
  - - [16, 14, 1, 1024]
    - [70, 62.8427]
  - - [2, 16, 1, 1024]
    - [102, 8.62316]
  - - [4, 16, 1, 1024]
    - [70, 17.0223]
  - - [6, 16, 1, 1024]
    - [118, 23.9766]
  - - [8, 16, 1, 1024]
    - [102, 34.4926]
  - - [10, 16, 1, 1024]
    - [102, 44.8877]
  - - [12, 16, 1, 1024]
    - [110, 53.1373]
  - - [14, 16, 1, 1024]
    - [102, 61.1669]
  - - [16, 16, 1, 1024]
    - [110, 69.9051]
  - - [2, 2, 1, 2048]
    - [84, 1.95048]
  - - [4, 2, 1, 2048]
    - [70, 3.94795]
  - - [6, 2, 1, 2048]
    - [110, 5.71535]
  - - [8, 2, 1, 2048]
    - [110, 7.28178]
  - - [10, 2, 1, 2048]
    - [110, 9.0022]
  - - [12, 2, 1, 2048]
    - [84, 11.7029]
  - - [14, 2, 1, 2048]
    - [73, 13.4927]
  - - [16, 2, 1, 2048]
    - [70, 15.6038]
  - - [2, 4, 1, 2048]
    - [110, 3.76644]
  - - [4, 4, 1, 2048]
    - [110, 7.53287]
  - - [6, 4, 1, 2048]
    - [102, 9.10222]
  - - [8, 4, 1, 2048]
    - [110, 14.4035]
  - - [10, 4, 1, 2048]
    - [102, 15.7538]
  - - [12, 4, 1, 2048]
    - [84, 23.4057]
  - - [14, 4, 1, 2048]
    - [118, 20.8524]
  - - [16, 4, 1, 2048]
    - [102, 25.4509]
  - - [2, 6, 1, 2048]
    - [70, 5.92193]
  - - [4, 6, 1, 2048]
    - [110, 11.8439]
  - - [6, 6, 1, 2048]
    - [84, 17.3478]
  - - [8, 6, 1, 2048]
    - [110, 22.5986]
  - - [10, 6, 1, 2048]
    - [70, 29.2571]
  - - [12, 6, 1, 2048]
    - [84, 35.1086]
  - - [14, 6, 1, 2048]
    - [70, 40.96]
  - - [16, 6, 1, 2048]
    - [110, 45.1972]
  - - [2, 8, 1, 2048]
    - [70, 7.8019]
  - - [4, 8, 1, 2048]
    - [102, 12.6031]
  - - [6, 8, 1, 2048]
    - [70, 23.4057]
  - - [8, 8, 1, 2048]
    - [73, 30.8405]
  - - [10, 8, 1, 2048]
    - [110, 33.4367]
  - - [12, 8, 1, 2048]
    - [73, 46.2607]
  - - [14, 8, 1, 2048]
    - [110, 50.4123]
  - - [16, 8, 1, 2048]
    - [110, 60.263]
  - - [2, 10, 1, 2048]
    - [110, 9.0022]
  - - [4, 10, 1, 2048]
    - [110, 18.2044]
  - - [6, 10, 1, 2048]
    - [110, 27.0066]
  - - [8, 10, 1, 2048]
    - [71, 37.6644]
  - - [10, 10, 1, 2048]
    - [70, 48.7619]
  - - [12, 10, 1, 2048]
    - [110, 53.4261]
  - - [14, 10, 1, 2048]
    - [110, 63.0154]
  - - [16, 10, 1, 2048]
    - [70, 77.1012]
  - - [2, 12, 1, 2048]
    - [110, 10.9227]
  - - [4, 12, 1, 2048]
    - [110, 21.6053]
  - - [6, 12, 1, 2048]
    - [73, 33.5127]
  - - [8, 12, 1, 2048]
    - [84, 46.2607]
  - - [10, 12, 1, 2048]
    - [110, 53.4261]
  - - [12, 12, 1, 2048]
    - [110, 64.8158]
  - - [14, 12, 1, 2048]
    - [110, 80.9562]
  - - [16, 12, 1, 2048]
    - [110, 89.3673]
  - - [2, 14, 1, 2048]
    - [110, 13.3358]
  - - [4, 14, 1, 2048]
    - [84, 26.9854]
  - - [6, 14, 1, 2048]
    - [84, 39.5476]
  - - [8, 14, 1, 2048]
    - [84, 55.2713]
  - - [10, 14, 1, 2048]
    - [70, 67.4635]
  - - [12, 14, 1, 2048]
    - [110, 74.7965]
  - - [14, 14, 1, 2048]
    - [110, 78.7075]
  - - [16, 14, 1, 2048]
    - [110, 109.227]
  - - [2, 16, 1, 2048]
    - [73, 15.4202]
  - - [4, 16, 1, 2048]
    - [110, 28.807]
  - - [6, 16, 1, 2048]
    - [70, 46.8114]
  - - [8, 16, 1, 2048]
    - [84, 63.1672]
  - - [10, 16, 1, 2048]
    - [110, 72.0176]
  - - [12, 16, 1, 2048]
    - [84, 93.6229]
  - - [14, 16, 1, 2048]
    - [84, 107.942]
  - - [16, 16, 1, 2048]
    - [110, 113.976]
  - - [2, 2, 1, 4096]
    - [110, 3.24436]
  - - [4, 2, 1, 4096]
    - [110, 6.48871]
  - - [6, 2, 1, 4096]
    - [82, 9.8304]
  - - [8, 2, 1, 4096]
    - [73, 12.6031]
  - - [10, 2, 1, 4096]
    - [110, 16.2218]
  - - [12, 2, 1, 4096]
    - [73, 19.8594]
  - - [14, 2, 1, 4096]
    - [84, 21.8453]
  - - [16, 2, 1, 4096]
    - [73, 25.4509]
  - - [2, 4, 1, 4096]
    - [73, 6.48871]
  - - [4, 4, 1, 4096]
    - [110, 13.1072]
  - - [6, 4, 1, 4096]
    - [73, 20.062]
  - - [8, 4, 1, 4096]
    - [73, 25.2062]
  - - [10, 4, 1, 4096]
    - [82, 32.4436]
  - - [12, 4, 1, 4096]
    - [73, 40.1241]
  - - [14, 4, 1, 4096]
    - [73, 43.6907]
  - - [16, 4, 1, 4096]
    - [82, 52.4288]
  - - [2, 6, 1, 4096]
    - [73, 9.73307]
  - - [4, 6, 1, 4096]
    - [110, 19.6608]
  - - [6, 6, 1, 4096]
    - [110, 29.1992]
  - - [8, 6, 1, 4096]
    - [71, 36.4089]
  - - [10, 6, 1, 4096]
    - [110, 46.3698]
  - - [12, 6, 1, 4096]
    - [110, 55.6438]
  - - [14, 6, 1, 4096]
    - [82, 67.4635]
  - - [16, 6, 1, 4096]
    - [73, 75.6185]
  - - [2, 8, 1, 4096]
    - [110, 12.9774]
  - - [4, 8, 1, 4096]
    - [110, 26.2144]
  - - [6, 8, 1, 4096]
    - [110, 39.3216]
  - - [8, 8, 1, 4096]
    - [84, 49.9322]
  - - [10, 8, 1, 4096]
    - [110, 63.6272]
  - - [12, 8, 1, 4096]
    - [73, 79.4376]
  - - [14, 8, 1, 4096]
    - [82, 90.842]
  - - [16, 8, 1, 4096]
    - [73, 100.825]
  - - [2, 10, 1, 4096]
    - [82, 16.2218]
  - - [4, 10, 1, 4096]
    - [73, 31.5077]
  - - [6, 10, 1, 4096]
    - [71, 45.9364]
  - - [8, 10, 1, 4096]
    - [110, 61.8264]
  - - [10, 10, 1, 4096]
    - [110, 81.1089]
  - - [12, 10, 1, 4096]
    - [84, 92.7396]
  - - [14, 10, 1, 4096]
    - [82, 112.439]
  - - [16, 10, 1, 4096]
    - [110, 118.083]
  - - [2, 12, 1, 4096]
    - [110, 19.8594]
  - - [4, 12, 1, 4096]
    - [84, 37.4491]
  - - [6, 12, 1, 4096]
    - [73, 58.9824]
  - - [8, 12, 1, 4096]
    - [110, 77.8646]
  - - [10, 12, 1, 4096]
    - [82, 97.3307]
  - - [12, 12, 1, 4096]
    - [73, 113.428]
  - - [14, 12, 1, 4096]
    - [73, 131.072]
  - - [16, 12, 1, 4096]
    - [84, 148.383]
  - - [2, 14, 1, 4096]
    - [110, 22.7105]
  - - [4, 14, 1, 4096]
    - [82, 45.421]
  - - [6, 14, 1, 4096]
    - [73, 69.5079]
  - - [8, 14, 1, 4096]
    - [110, 90.842]
  - - [10, 14, 1, 4096]
    - [110, 112.439]
  - - [12, 14, 1, 4096]
    - [73, 129.835]
  - - [14, 14, 1, 4096]
    - [110, 155.887]
  - - [16, 14, 1, 4096]
    - [73, 181.684]
  - - [2, 16, 1, 4096]
    - [82, 26.2144]
  - - [4, 16, 1, 4096]
    - [73, 50.9017]
  - - [6, 16, 1, 4096]
    - [73, 79.4376]
  - - [8, 16, 1, 4096]
    - [73, 100.825]
  - - [10, 16, 1, 4096]
    - [73, 131.072]
  - - [12, 16, 1, 4096]
    - [110, 154.202]
  - - [14, 16, 1, 4096]
    - [73, 165.316]
  - - [16, 16, 1, 4096]
    - [73, 199.729]
  - - [3072, 64, 1, 3072]
    - [16, 16894.5]
  - - [3072, 128, 1, 3072]
    - [7, 26843.5]
  - - [3072, 192, 1, 3072]
    - [109, 30555.5]
  - - [3072, 256, 1, 3072]
    - [6, 30913.9]
  - - [3072, 320, 1, 3072]
    - [98, 33685.4]
  - - [3072, 384, 1, 3072]
    - [109, 36457.5]
  - - [3072, 448, 1, 3072]
    - [8, 35618.0]
  - - [3072, 512, 1, 3072]
    - [7, 33694.8]
  - - [3072, 576, 1, 3072]
    - [8, 35551.5]
  - - [3072, 640, 1, 3072]
    - [7, 38347.9]
  - - [3072, 704, 1, 3072]
    - [109, 35124.4]
  - - [3072, 768, 1, 3072]
    - [109, 37768.4]
  - - [3072, 832, 1, 3072]
    - [7, 33440.1]
  - - [3072, 896, 1, 3072]
    - [7, 36043.1]
  - - [3072, 960, 1, 3072]
    - [97, 37467.7]
  - - [3072, 1024, 1, 3072]
    - [8, 35991.3]
  - - [3072, 1280, 1, 3072]
    - [7, 37150.8]
  - - [3072, 1536, 1, 3072]
    - [8, 36632.6]
  - - [3072, 1792, 1, 3072]
    - [7, 35424.0]
  - - [3072, 2048, 1, 3072]
    - [7, 36737.0]
  - - [3072, 2304, 1, 3072]
    - [8, 36469.8]
  - - [3072, 2560, 1, 3072]
    - [7, 36621.5]
  - - [3072, 2816, 1, 3072]
    - [8, 37131.6]
  - - [3072, 3328, 1, 3072]
    - [8, 37846.5]
  - - [3072, 3584, 1, 3072]
    - [8, 37560.1]
  - - [3072, 3840, 1, 3072]
    - [8, 38226.6]
  - - [3072, 4096, 1, 3072]
    - [8, 37841.1]
  - - [64, 4096, 1, 64]
    - [58, 3856.83]
  - - [320, 4096, 1, 64]
    - [109, 9269.18]
  - - [576, 4096, 1, 64]
    - [114, 13481.7]
  - - [832, 4096, 1, 64]
    - [109, 13421.8]
  - - [1088, 4096, 1, 64]
    - [101, 13549.3]
  - - [1344, 4096, 1, 64]
    - [114, 14351.2]
  - - [1600, 4096, 1, 64]
    - [13, 14290.6]
  - - [1856, 4096, 1, 64]
    - [114, 14289.0]
  - - [2112, 4096, 1, 64]
    - [114, 14983.7]
  - - [2368, 4096, 1, 64]
    - [117, 15308.4]
  - - [2624, 4096, 1, 64]
    - [103, 15018.9]
  - - [2880, 4096, 1, 64]
    - [117, 15894.2]
  - - [3136, 4096, 1, 64]
    - [114, 15555.0]
  - - [3392, 4096, 1, 64]
    - [103, 15850.1]
  - - [3648, 4096, 1, 64]
    - [114, 15978.3]
  - - [3904, 4096, 1, 64]
    - [114, 15891.5]
  - - [64, 4096, 1, 256]
    - [17, 10824.0]
  - - [320, 4096, 1, 256]
    - [109, 20712.6]
  - - [576, 4096, 1, 256]
    - [117, 27705.5]
  - - [832, 4096, 1, 256]
    - [114, 27348.4]
  - - [1088, 4096, 1, 256]
    - [109, 27034.4]
  - - [1344, 4096, 1, 256]
    - [109, 27180.1]
  - - [1600, 4096, 1, 256]
    - [117, 26951.4]
  - - [1856, 4096, 1, 256]
    - [114, 26862.1]
  - - [2112, 4096, 1, 256]
    - [114, 28742.3]
  - - [2368, 4096, 1, 256]
    - [114, 28475.1]
  - - [2624, 4096, 1, 256]
    - [117, 28811.1]
  - - [2880, 4096, 1, 256]
    - [117, 29767.4]
  - - [3136, 4096, 1, 256]
    - [117, 29281.7]
  - - [3392, 4096, 1, 256]
    - [117, 29237.7]
  - - [3648, 4096, 1, 256]
    - [114, 30191.0]
  - - [3904, 4096, 1, 256]
    - [114, 30133.5]
  - - [64, 4096, 1, 512]
    - [17, 14510.0]
  - - [320, 4096, 1, 512]
    - [97, 26011.2]
  - - [576, 4096, 1, 512]
    - [114, 32385.0]
  - - [832, 4096, 1, 512]
    - [101, 30530.7]
  - - [1088, 4096, 1, 512]
    - [109, 30221.2]
  - - [1344, 4096, 1, 512]
    - [114, 32029.2]
  - - [1600, 4096, 1, 512]
    - [117, 32017.6]
  - - [1856, 4096, 1, 512]
    - [114, 31930.4]
  - - [2112, 4096, 1, 512]
    - [114, 33888.2]
  - - [2368, 4096, 1, 512]
    - [114, 34402.9]
  - - [2624, 4096, 1, 512]
    - [114, 33947.7]
  - - [2880, 4096, 1, 512]
    - [114, 34414.8]
  - - [3136, 4096, 1, 512]
    - [114, 33563.0]
  - - [3392, 4096, 1, 512]
    - [114, 33530.7]
  - - [3648, 4096, 1, 512]
    - [114, 33183.3]
  - - [3904, 4096, 1, 512]
    - [114, 33039.9]
  - - [64, 4096, 1, 1024]
    - [17, 17777.2]
  - - [320, 4096, 1, 1024]
    - [4, 29628.6]
  - - [576, 4096, 1, 1024]
    - [103, 35089.6]
  - - [832, 4096, 1, 1024]
    - [114, 34534.0]
  - - [1088, 4096, 1, 1024]
    - [114, 34388.9]
  - - [1344, 4096, 1, 1024]
    - [114, 35013.3]
  - - [1600, 4096, 1, 1024]
    - [101, 34353.1]
  - - [1856, 4096, 1, 1024]
    - [114, 34721.8]
  - - [2112, 4096, 1, 1024]
    - [114, 35504.5]
  - - [2368, 4096, 1, 1024]
    - [103, 35979.4]
  - - [2624, 4096, 1, 1024]
    - [114, 34906.0]
  - - [2880, 4096, 1, 1024]
    - [103, 34892.0]
  - - [3136, 4096, 1, 1024]
    - [114, 34347.4]
  - - [3392, 4096, 1, 1024]
    - [114, 34080.9]
  - - [3648, 4096, 1, 1024]
    - [114, 34333.7]
  - - [3904, 4096, 1, 1024]
    - [103, 33485.8]
  - - [64, 4096, 1, 2048]
    - [80, 20768.7]
  - - [320, 4096, 1, 2048]
    - [97, 33201.7]
  - - [576, 4096, 1, 2048]
    - [7, 35897.8]
  - - [832, 4096, 1, 2048]
    - [109, 36228.0]
  - - [1088, 4096, 1, 2048]
    - [109, 35960.6]
  - - [1344, 4096, 1, 2048]
    - [103, 34807.9]
  - - [1600, 4096, 1, 2048]
    - [7, 34975.3]
  - - [1856, 4096, 1, 2048]
    - [7, 35264.5]
  - - [2112, 4096, 1, 2048]
    - [7, 35419.3]
  - - [2368, 4096, 1, 2048]
    - [7, 34084.1]
  - - [2624, 4096, 1, 2048]
    - [8, 32946.7]
  - - [2880, 4096, 1, 2048]
    - [7, 33765.5]
  - - [3136, 4096, 1, 2048]
    - [8, 33885.1]
  - - [3392, 4096, 1, 2048]
    - [8, 34437.7]
  - - [3648, 4096, 1, 2048]
    - [8, 34322.2]
  - - [3904, 4096, 1, 2048]
    - [8, 34591.1]
  - - [64, 4096, 1, 4096]
    - [7, 20164.2]
  - - [320, 4096, 1, 4096]
    - [98, 25767.7]
  - - [576, 4096, 1, 4096]
    - [98, 33346.0]
  - - [832, 4096, 1, 4096]
    - [60, 32026.3]
  - - [1088, 4096, 1, 4096]
    - [98, 32295.8]
  - - [1344, 4096, 1, 4096]
    - [98, 33958.7]
  - - [1600, 4096, 1, 4096]
    - [8, 34311.4]
  - - [1856, 4096, 1, 4096]
    - [7, 34594.5]
  - - [2112, 4096, 1, 4096]
    - [98, 34808.7]
  - - [2368, 4096, 1, 4096]
    - [8, 34254.6]
  - - [2624, 4096, 1, 4096]
    - [98, 34000.2]
  - - [2880, 4096, 1, 4096]
    - [98, 35417.5]
  - - [3136, 4096, 1, 4096]
    - [98, 30470.5]
  - - [3392, 4096, 1, 4096]
    - [97, 29231.0]
  - - [3648, 4096, 1, 4096]
    - [7, 29172.2]
  - - [3904, 4096, 1, 4096]
    - [7, 29235.1]
  - - [4096, 64, 1, 64]
    - [59, 3728.27]
  - - [4096, 320, 1, 64]
    - [69, 8876.83]
  - - [4096, 576, 1, 64]
    - [101, 12478.9]
  - - [4096, 832, 1, 64]
    - [114, 12534.7]
  - - [4096, 1088, 1, 64]
    - [101, 13327.7]
  - - [4096, 1344, 1, 64]
    - [101, 13629.5]
  - - [4096, 1600, 1, 64]
    - [13, 13751.8]
  - - [4096, 1856, 1, 64]
    - [114, 13609.5]
  - - [4096, 2112, 1, 64]
    - [101, 14214.3]
  - - [4096, 2368, 1, 64]
    - [114, 14140.3]
  - - [4096, 2624, 1, 64]
    - [109, 14588.9]
  - - [4096, 2880, 1, 64]
    - [114, 14818.0]
  - - [4096, 3136, 1, 64]
    - [103, 14524.4]
  - - [4096, 3392, 1, 64]
    - [114, 14919.3]
  - - [4096, 3648, 1, 64]
    - [114, 15276.4]
  - - [4096, 3904, 1, 64]
    - [114, 15471.1]
  - - [4096, 64, 1, 256]
    - [59, 9868.95]
  - - [4096, 320, 1, 256]
    - [98, 19622.5]
  - - [4096, 576, 1, 256]
    - [101, 27023.7]
  - - [4096, 832, 1, 256]
    - [117, 24679.4]
  - - [4096, 1088, 1, 256]
    - [109, 26970.5]
  - - [4096, 1344, 1, 256]
    - [109, 26391.1]
  - - [4096, 1600, 1, 256]
    - [114, 26567.2]
  - - [4096, 1856, 1, 256]
    - [109, 26714.6]
  - - [4096, 2112, 1, 256]
    - [109, 27493.4]
  - - [4096, 2368, 1, 256]
    - [114, 26584.9]
  - - [4096, 2624, 1, 256]
    - [117, 27350.5]
  - - [4096, 2880, 1, 256]
    - [114, 27416.2]
  - - [4096, 3136, 1, 256]
    - [117, 27702.9]
  - - [4096, 3392, 1, 256]
    - [117, 28683.6]
  - - [4096, 3648, 1, 256]
    - [114, 28826.0]
  - - [4096, 3904, 1, 256]
    - [114, 28767.7]
  - - [4096, 64, 1, 512]
    - [63, 11278.8]
  - - [4096, 320, 1, 512]
    - [98, 25040.6]
  - - [4096, 576, 1, 512]
    - [101, 30697.8]
  - - [4096, 832, 1, 512]
    - [114, 29877.2]
  - - [4096, 1088, 1, 512]
    - [109, 30709.3]
  - - [4096, 1344, 1, 512]
    - [114, 30956.3]
  - - [4096, 1600, 1, 512]
    - [114, 30504.0]
  - - [4096, 1856, 1, 512]
    - [117, 30928.2]
  - - [4096, 2112, 1, 512]
    - [109, 32930.7]
  - - [4096, 2368, 1, 512]
    - [114, 32692.9]
  - - [4096, 2624, 1, 512]
    - [114, 33001.1]
  - - [4096, 2880, 1, 512]
    - [114, 33369.0]
  - - [4096, 3136, 1, 512]
    - [114, 32932.7]
  - - [4096, 3392, 1, 512]
    - [114, 33186.6]
  - - [4096, 3648, 1, 512]
    - [114, 29647.0]
  - - [4096, 3904, 1, 512]
    - [98, 27697.2]
  - - [4096, 64, 1, 1024]
    - [16, 12874.6]
  - - [4096, 320, 1, 1024]
    - [98, 26736.6]
  - - [4096, 576, 1, 1024]
    - [8, 32320.0]
  - - [4096, 832, 1, 1024]
    - [114, 31971.2]
  - - [4096, 1088, 1, 1024]
    - [109, 33991.8]
  - - [4096, 1344, 1, 1024]
    - [109, 34092.2]
  - - [4096, 1600, 1, 1024]
    - [8, 33362.6]
  - - [4096, 1856, 1, 1024]
    - [114, 34552.3]
  - - [4096, 2112, 1, 1024]
    - [109, 34793.3]
  - - [4096, 2368, 1, 1024]
    - [109, 33096.0]
  - - [4096, 2624, 1, 1024]
    - [101, 33791.4]
  - - [4096, 2880, 1, 1024]
    - [114, 31634.4]
  - - [4096, 3136, 1, 1024]
    - [114, 29093.9]
  - - [4096, 3392, 1, 1024]
    - [114, 28940.4]
  - - [4096, 3648, 1, 1024]
    - [114, 28645.2]
  - - [4096, 3904, 1, 1024]
    - [114, 28841.1]
  - - [4096, 64, 1, 2048]
    - [16, 16544.6]
  - - [4096, 320, 1, 2048]
    - [98, 31396.0]
  - - [4096, 576, 1, 2048]
    - [8, 36343.3]
  - - [4096, 832, 1, 2048]
    - [114, 34474.3]
  - - [4096, 1088, 1, 2048]
    - [109, 35693.4]
  - - [4096, 1344, 1, 2048]
    - [109, 35199.2]
  - - [4096, 1600, 1, 2048]
    - [8, 33744.2]
  - - [4096, 1856, 1, 2048]
    - [8, 32167.9]
  - - [4096, 2112, 1, 2048]
    - [8, 33130.9]
  - - [4096, 2368, 1, 2048]
    - [98, 31420.8]
  - - [4096, 2624, 1, 2048]
    - [8, 31996.1]
  - - [4096, 2880, 1, 2048]
    - [8, 32107.4]
  - - [4096, 3136, 1, 2048]
    - [8, 32337.6]
  - - [4096, 3392, 1, 2048]
    - [8, 32532.1]
  - - [4096, 3648, 1, 2048]
    - [8, 32506.5]
  - - [4096, 3904, 1, 2048]
    - [8, 32544.1]
  - - [4096, 64, 1, 4096]
    - [15, 16570.1]
  - - [4096, 320, 1, 4096]
    - [15, 23286.5]
  - - [4096, 576, 1, 4096]
    - [97, 26328.0]
  - - [4096, 832, 1, 4096]
    - [97, 28542.4]
  - - [4096, 1088, 1, 4096]
    - [97, 29119.6]
  - - [4096, 1344, 1, 4096]
    - [97, 28794.0]
  - - [4096, 1600, 1, 4096]
    - [7, 25969.7]
  - - [4096, 1856, 1, 4096]
    - [7, 26832.0]
  - - [4096, 2112, 1, 4096]
    - [4, 26006.2]
  - - [4096, 2368, 1, 4096]
    - [97, 26298.0]
  - - [4096, 2624, 1, 4096]
    - [97, 27094.7]
  - - [4096, 2880, 1, 4096]
    - [97, 27510.7]
  - - [4096, 3136, 1, 4096]
    - [97, 26840.8]
  - - [4096, 3392, 1, 4096]
    - [97, 26512.1]
  - - [4096, 3648, 1, 4096]
    - [97, 26822.4]
  - - [4096, 3904, 1, 4096]
    - [7, 27139.4]
  - - [64, 64, 1, 8192]
    - [73, 3924.49]
  - - [64, 128, 1, 8192]
    - [82, 6515.42]
  - - [64, 256, 1, 8192]
    - [75, 8209.04]
  - - [64, 512, 1, 8192]
    - [16, 14668.6]
  - - [64, 1024, 1, 8192]
    - [16, 19139.8]
  - - [64, 2048, 1, 8192]
    - [15, 19976.6]
  - - [64, 4096, 1, 8192]
    - [42, 10586.6]
  - - [64, 8192, 1, 64]
    - [46, 6331.02]
  - - [64, 8192, 1, 128]
    - [46, 10485.8]
  - - [64, 8192, 1, 256]
    - [46, 15252.0]
  - - [64, 8192, 1, 512]
    - [46, 21304.4]
  - - [64, 8192, 1, 1024]
    - [46, 24183.4]
  - - [64, 8192, 1, 2048]
    - [46, 19865.7]
  - - [64, 8192, 1, 4096]
    - [113, 11947.1]
  - - [64, 8192, 1, 8192]
    - [113, 11765.4]
  - - [128, 64, 1, 8192]
    - [82, 6483.95]
  - - [128, 128, 1, 8192]
    - [82, 8494.79]
  - - [128, 256, 1, 8192]
    - [16, 14588.9]
  - - [128, 512, 1, 8192]
    - [16, 19174.0]
  - - [128, 1024, 1, 8192]
    - [78, 23342.2]
  - - [128, 2048, 1, 8192]
    - [0, 21033.1]
  - - [128, 4096, 1, 8192]
    - [98, 16547.7]
  - - [128, 8192, 1, 64]
    - [109, 9586.98]
  - - [128, 8192, 1, 128]
    - [109, 15516.5]
  - - [128, 8192, 1, 256]
    - [101, 22652.8]
  - - [128, 8192, 1, 512]
    - [101, 25687.6]
  - - [128, 8192, 1, 1024]
    - [8, 25780.1]
  - - [128, 8192, 1, 2048]
    - [8, 24627.1]
  - - [128, 8192, 1, 4096]
    - [15, 16189.1]
  - - [128, 8192, 1, 8192]
    - [3, 16332.2]
  - - [256, 64, 1, 8192]
    - [82, 8310.7]
  - - [256, 128, 1, 8192]
    - [16, 14549.3]
  - - [256, 256, 1, 8192]
    - [76, 19004.3]
  - - [256, 512, 1, 8192]
    - [12, 23066.4]
  - - [256, 1024, 1, 8192]
    - [11, 26463.1]
  - - [256, 2048, 1, 8192]
    - [60, 21824.0]
  - - [256, 4096, 1, 8192]
    - [15, 21927.1]
  - - [256, 8192, 1, 64]
    - [101, 11471.6]
  - - [256, 8192, 1, 128]
    - [101, 17602.3]
  - - [256, 8192, 1, 256]
    - [101, 24292.8]
  - - [256, 8192, 1, 512]
    - [114, 28519.0]
  - - [256, 8192, 1, 1024]
    - [8, 30700.3]
  - - [256, 8192, 1, 2048]
    - [8, 28396.5]
  - - [256, 8192, 1, 4096]
    - [105, 23804.7]
  - - [256, 8192, 1, 8192]
    - [15, 23018.5]
  - - [384, 64, 1, 8192]
    - [72, 11773.5]
  - - [384, 128, 1, 8192]
    - [76, 15978.3]
  - - [384, 256, 1, 8192]
    - [12, 25284.3]
  - - [384, 512, 1, 8192]
    - [9, 27391.4]
  - - [384, 1024, 1, 8192]
    - [7, 32260.6]
  - - [384, 2048, 1, 8192]
    - [98, 29916.2]
  - - [384, 4096, 1, 8192]
    - [98, 27371.0]
  - - [384, 8192, 1, 64]
    - [114, 13332.9]
  - - [384, 8192, 1, 128]
    - [114, 19982.8]
  - - [384, 8192, 1, 256]
    - [117, 26490.3]
  - - [384, 8192, 1, 512]
    - [114, 29310.5]
  - - [384, 8192, 1, 1024]
    - [103, 32987.5]
  - - [384, 8192, 1, 2048]
    - [98, 32861.3]
  - - [384, 8192, 1, 4096]
    - [98, 31179.4]
  - - [384, 8192, 1, 8192]
    - [98, 30797.5]
  - - [768, 64, 1, 8192]
    - [76, 14253.2]
  - - [768, 128, 1, 8192]
    - [12, 22813.2]
  - - [768, 256, 1, 8192]
    - [12, 28430.9]
  - - [768, 512, 1, 8192]
    - [7, 32852.9]
  - - [768, 1024, 1, 8192]
    - [8, 33140.2]
  - - [768, 2048, 1, 8192]
    - [98, 30104.9]
  - - [768, 4096, 1, 8192]
    - [98, 33187.1]
  - - [768, 8192, 1, 64]
    - [114, 15883.8]
  - - [768, 8192, 1, 128]
    - [114, 23478.3]
  - - [768, 8192, 1, 256]
    - [114, 28083.9]
  - - [768, 8192, 1, 512]
    - [109, 31877.5]
  - - [768, 8192, 1, 1024]
    - [109, 35108.7]
  - - [768, 8192, 1, 2048]
    - [98, 33101.9]
  - - [768, 8192, 1, 4096]
    - [98, 34206.9]
  - - [768, 8192, 1, 8192]
    - [98, 35144.6]
  - - [1536, 64, 1, 8192]
    - [76, 17097.8]
  - - [1536, 128, 1, 8192]
    - [12, 27183.3]
  - - [1536, 256, 1, 8192]
    - [7, 31909.1]
  - - [1536, 512, 1, 8192]
    - [7, 32244.5]
  - - [1536, 1024, 1, 8192]
    - [97, 29888.4]
  - - [1536, 2048, 1, 8192]
    - [7, 23938.5]
  - - [1536, 4096, 1, 8192]
    - [7, 25024.1]
  - - [1536, 8192, 1, 64]
    - [114, 15652.2]
  - - [1536, 8192, 1, 128]
    - [114, 22764.8]
  - - [1536, 8192, 1, 256]
    - [114, 28557.0]
  - - [1536, 8192, 1, 512]
    - [114, 33916.6]
  - - [1536, 8192, 1, 1024]
    - [114, 33406.5]
  - - [1536, 8192, 1, 2048]
    - [98, 33315.8]
  - - [1536, 8192, 1, 4096]
    - [98, 35099.2]
  - - [1536, 8192, 1, 8192]
    - [7, 25110.3]
  - - [3072, 64, 1, 8192]
    - [16, 8408.31]
  - - [3072, 128, 1, 8192]
    - [18, 15531.5]
  - - [3072, 256, 1, 8192]
    - [18, 22821.3]
  - - [3072, 512, 1, 8192]
    - [17, 25080.1]
  - - [3072, 1024, 1, 8192]
    - [7, 29919.7]
  - - [3072, 2048, 1, 8192]
    - [7, 27578.2]
  - - [3072, 4096, 1, 8192]
    - [7, 27513.5]
  - - [3072, 8192, 1, 64]
    - [13, 12243.4]
  - - [3072, 8192, 1, 128]
    - [13, 19317.7]
  - - [3072, 8192, 1, 256]
    - [117, 26328.0]
  - - [3072, 8192, 1, 512]
    - [114, 30529.3]
  - - [3072, 8192, 1, 1024]
    - [8, 33114.6]
  - - [3072, 8192, 1, 2048]
    - [98, 33434.7]
  - - [3072, 8192, 1, 4096]
    - [98, 30889.8]
  - - [3072, 8192, 1, 8192]
    - [7, 27843.3]
  - - [8192, 64, 1, 64]
    - [13, 6331.02]
  - - [8192, 64, 1, 128]
    - [13, 9868.95]
  - - [8192, 64, 1, 256]
    - [13, 14278.5]
  - - [8192, 64, 1, 512]
    - [13, 14789.8]
  - - [8192, 64, 1, 1024]
    - [16, 16002.1]
  - - [8192, 64, 1, 2048]
    - [15, 14480.7]
  - - [8192, 64, 1, 4096]
    - [118, 8634.84]
  - - [8192, 64, 1, 8192]
    - [50, 9103.36]
  - - [8192, 128, 1, 64]
    - [95, 9518.99]
  - - [8192, 128, 1, 128]
    - [114, 16368.0]
  - - [8192, 128, 1, 256]
    - [114, 21474.8]
  - - [8192, 128, 1, 512]
    - [98, 19346.7]
  - - [8192, 128, 1, 1024]
    - [7, 22369.6]
  - - [8192, 128, 1, 2048]
    - [14, 18829.3]
  - - [8192, 128, 1, 4096]
    - [14, 15635.1]
  - - [8192, 128, 1, 8192]
    - [14, 16457.4]
  - - [8192, 256, 1, 64]
    - [114, 12146.4]
  - - [8192, 256, 1, 128]
    - [114, 18576.8]
  - - [8192, 256, 1, 256]
    - [114, 24683.7]
  - - [8192, 256, 1, 512]
    - [114, 26710.0]
  - - [8192, 256, 1, 1024]
    - [7, 28256.4]
  - - [8192, 256, 1, 2048]
    - [17, 23860.9]
  - - [8192, 256, 1, 4096]
    - [14, 22697.7]
  - - [8192, 256, 1, 8192]
    - [14, 23616.6]
  - - [8192, 512, 1, 64]
    - [13, 13421.8]
  - - [8192, 512, 1, 128]
    - [114, 20145.2]
  - - [8192, 512, 1, 256]
    - [114, 26125.1]
  - - [8192, 512, 1, 512]
    - [13, 29743.5]
  - - [8192, 512, 1, 1024]
    - [7, 32811.1]
  - - [8192, 512, 1, 2048]
    - [4, 24694.4]
  - - [8192, 512, 1, 4096]
    - [17, 25660.7]
  - - [8192, 512, 1, 8192]
    - [14, 25124.1]
  - - [8192, 1024, 1, 64]
    - [114, 14091.1]
  - - [8192, 1024, 1, 128]
    - [114, 21735.7]
  - - [8192, 1024, 1, 256]
    - [114, 27889.4]
  - - [8192, 1024, 1, 512]
    - [114, 32537.6]
  - - [8192, 1024, 1, 1024]
    - [114, 35986.3]
  - - [8192, 1024, 1, 2048]
    - [6, 28542.7]
  - - [8192, 1024, 1, 4096]
    - [7, 29848.2]
  - - [8192, 1024, 1, 8192]
    - [7, 27746.9]
  - - [8192, 2048, 1, 64]
    - [117, 15405.2]
  - - [8192, 2048, 1, 128]
    - [117, 21957.9]
  - - [8192, 2048, 1, 256]
    - [114, 26970.0]
  - - [8192, 2048, 1, 512]
    - [98, 27496.6]
  - - [8192, 2048, 1, 1024]
    - [98, 28883.4]
  - - [8192, 2048, 1, 2048]
    - [6, 28952.8]
  - - [8192, 2048, 1, 4096]
    - [7, 28689.3]
  - - [8192, 2048, 1, 8192]
    - [7, 26883.5]
  - - [8192, 4096, 1, 64]
    - [69, 10389.4]
  - - [8192, 4096, 1, 128]
    - [69, 16189.1]
  - - [8192, 4096, 1, 256]
    - [13, 25975.0]
  - - [8192, 4096, 1, 512]
    - [98, 28210.0]
  - - [8192, 4096, 1, 1024]
    - [114, 28449.4]
  - - [8192, 4096, 1, 2048]
    - [7, 29097.5]
  - - [8192, 4096, 1, 4096]
    - [7, 29035.7]
  - - [8192, 4096, 1, 8192]
    - [7, 26765.9]
  - - [8192, 8192, 1, 64]
    - [69, 10620.6]
  - - [8192, 8192, 1, 128]
    - [69, 16519.1]
  - - [8192, 8192, 1, 256]
    - [13, 26228.8]
  - - [8192, 8192, 1, 512]
    - [98, 28329.8]
  - - [8192, 8192, 1, 1024]
    - [98, 28536.2]
  - - [8192, 8192, 1, 2048]
    - [6, 29032.3]
  - - [8192, 8192, 1, 4096]
    - [97, 29188.0]
  - - [8192, 8192, 1, 8192]
    - [7, 27412.4]
  - - [64, 1, 1, 64]
    - [91, 1.70667]
  - - [64, 16, 1, 64]
    - [15, 23.8313]
  - - [64, 32, 1, 64]
    - [27, 55.7753]
  - - [1, 1, 1, 64]
    - [15, 0.0228571]
  - - [16, 1, 1, 64]
    - [23, 0.386415]
  - - [32, 1, 1, 64]
    - [34, 0.835918]
  - - [64, 1, 1, 1]
    - [17, 0.0232727]
  - - [64, 1, 1, 16]
    - [20, 0.455111]
  - - [64, 1, 1, 32]
    - [20, 0.910222]
  - - [1, 16, 1, 64]
    - [24, 0.4096]
  - - [16, 16, 1, 64]
    - [50, 6.4251]
  - - [32, 16, 1, 64]
    - [27, 13.3747]
  - - [64, 16, 1, 1]
    - [21, 0.455111]
  - - [64, 16, 1, 16]
    - [20, 6.97191]
  - - [64, 16, 1, 32]
    - [20, 14.8945]
  - - [1, 32, 1, 64]
    - [66, 0.718596]
  - - [16, 32, 1, 64]
    - [27, 13.6533]
  - - [32, 32, 1, 64]
    - [113, 24.7306]
  - - [64, 32, 1, 1]
    - [20, 0.910222]
  - - [64, 32, 1, 16]
    - [22, 15.2409]
  - - [64, 32, 1, 32]
    - [23, 31.2076]
  - - [1, 1, 1, 1]
    - [47, 0.000377358]
  - - [1, 1, 1, 16]
    - [19, 0.00615385]
  - - [1, 1, 1, 32]
    - [20, 0.0145455]
  - - [16, 1, 1, 1]
    - [20, 0.0064]
  - - [16, 1, 1, 16]
    - [21, 0.0984615]
  - - [16, 1, 1, 32]
    - [20, 0.217872]
  - - [32, 1, 1, 1]
    - [20, 0.013617]
  - - [32, 1, 1, 16]
    - [26, 0.232727]
  - - [32, 1, 1, 32]
    - [67, 0.393846]
  - - [1, 16, 1, 1]
    - [19, 0.00727273]
  - - [1, 16, 1, 16]
    - [17, 0.0930909]
  - - [1, 16, 1, 32]
    - [113, 0.18963]
  - - [16, 16, 1, 1]
    - [20, 0.108936]
  - - [16, 16, 1, 16]
    - [19, 1.51704]
  - - [16, 16, 1, 32]
    - [20, 3.81023]
  - - [32, 16, 1, 1]
    - [20, 0.222609]
  - - [32, 16, 1, 16]
    - [26, 3.72364]
  - - [32, 16, 1, 32]
    - [20, 7.44727]
  - - [1, 32, 1, 1]
    - [20, 0.0145455]
  - - [1, 32, 1, 16]
    - [17, 0.186182]
  - - [1, 32, 1, 32]
    - [20, 0.465455]
  - - [16, 32, 1, 1]
    - [20, 0.227556]
  - - [16, 32, 1, 16]
    - [20, 2.82483]
  - - [16, 32, 1, 32]
    - [20, 7.28178]
  - - [32, 32, 1, 1]
    - [20, 0.476279]
  - - [32, 32, 1, 16]
    - [20, 7.28178]
  - - [32, 32, 1, 32]
    - [26, 15.6038]
  - - [1, 64, 1, 64]
    - [24, 1.67184]
  - - [16, 64, 1, 64]
    - [27, 26.2144]
  - - [32, 64, 1, 64]
    - [43, 49.4611]
  - - [1, 64, 1, 1]
    - [42, 0.025098]
  - - [1, 64, 1, 16]
    - [19, 0.445217]
  - - [1, 64, 1, 32]
    - [20, 0.952558]
  - - [16, 64, 1, 1]
    - [24, 0.476279]
  - - [16, 64, 1, 16]
    - [19, 6.5536]
  - - [16, 64, 1, 32]
    - [22, 15.2409]
  - - [32, 64, 1, 1]
    - [20, 0.910222]
  - - [32, 64, 1, 16]
    - [20, 14.8945]
  - - [32, 64, 1, 32]
    - [20, 23.8313]
  - - [64, 64, 1, 1]
    - [17, 1.48945]
  - - [64, 64, 1, 16]
    - [19, 29.7891]
  - - [64, 64, 1, 32]
    - [19, 58.2542]
  - - [256, 1, 1, 256]
    - [102, 23.4057]
  - - [256, 16, 1, 256]
    - [32, 381.3]
  - - [256, 32, 1, 256]
    - [115, 776.723]
  - - [1, 1, 1, 256]
    - [113, 0.0948148]
  - - [16, 1, 1, 256]
    - [102, 1.54566]
  - - [32, 1, 1, 256]
    - [102, 3.21255]
  - - [256, 1, 1, 1]
    - [20, 0.106667]
  - - [256, 1, 1, 16]
    - [49, 1.6384]
  - - [256, 1, 1, 32]
    - [20, 3.72364]
  - - [1, 16, 1, 256]
    - [32, 1.41241]
  - - [16, 16, 1, 256]
    - [118, 24.7306]
  - - [32, 16, 1, 256]
    - [102, 51.4008]
  - - [256, 16, 1, 1]
    - [23, 1.82044]
  - - [256, 16, 1, 16]
    - [28, 26.7494]
  - - [256, 16, 1, 32]
    - [20, 58.2542]
  - - [1, 32, 1, 256]
    - [22, 3.15077]
  - - [16, 32, 1, 256]
    - [115, 50.4123]
  - - [32, 32, 1, 256]
    - [102, 98.9223]
  - - [256, 32, 1, 1]
    - [23, 3.72364]
  - - [256, 32, 1, 16]
    - [22, 52.4288]
  - - [256, 32, 1, 32]
    - [23, 121.927]
  - - [1, 256, 1, 256]
    - [102, 25.2062]
  - - [16, 256, 1, 256]
    - [118, 403.298]
  - - [32, 256, 1, 256]
    - [102, 806.597]
  - - [1, 256, 1, 1]
    - [20, 0.113778]
  - - [1, 256, 1, 16]
    - [47, 1.78087]
  - - [1, 256, 1, 32]
    - [20, 3.81023]
  - - [16, 256, 1, 1]
    - [20, 1.74298]
  - - [16, 256, 1, 16]
    - [20, 28.4939]
  - - [16, 256, 1, 32]
    - [19, 59.5782]
  - - [32, 256, 1, 1]
    - [23, 3.64089]
  - - [32, 256, 1, 16]
    - [113, 50.4123]
  - - [32, 256, 1, 32]
    - [22, 121.927]
  - - [256, 256, 1, 1]
    - [15, 26.2144]
  - - [256, 256, 1, 16]
    - [14, 419.43]
  - - [256, 256, 1, 32]
    - [17, 822.413]
  - - [512, 1, 1, 512]
    - [22, 84.5626]
  - - [512, 16, 1, 512]
    - [102, 1375.18]
  - - [512, 32, 1, 512]
    - [22, 2621.44]
  - - [1, 1, 1, 512]
    - [102, 0.176552]
  - - [16, 1, 1, 512]
    - [118, 2.6859]
  - - [32, 1, 1, 512]
    - [118, 5.28516]
  - - [512, 1, 1, 1]
    - [19, 0.222609]
  - - [512, 1, 1, 16]
    - [47, 3.15077]
  - - [512, 1, 1, 32]
    - [20, 6.5536]
  - - [1, 16, 1, 512]
    - [22, 2.64258]
  - - [16, 16, 1, 512]
    - [102, 45.1972]
  - - [32, 16, 1, 512]
    - [102, 93.6229]
  - - [512, 16, 1, 1]
    - [22, 3.56174]
  - - [512, 16, 1, 16]
    - [22, 58.2542]
  - - [512, 16, 1, 32]
    - [21, 93.6229]
  - - [1, 32, 1, 512]
    - [115, 5.3718]
  - - [16, 32, 1, 512]
    - [22, 84.5626]
  - - [32, 32, 1, 512]
    - [118, 174.763]
  - - [512, 32, 1, 1]
    - [22, 7.62047]
  - - [512, 32, 1, 16]
    - [22, 106.998]
  - - [512, 32, 1, 32]
    - [22, 249.661]
  - - [1, 512, 1, 512]
    - [118, 88.8624]
  - - [16, 512, 1, 512]
    - [118, 1398.1]
  - - [32, 512, 1, 512]
    - [102, 2796.2]
  - - [1, 512, 1, 1]
    - [20, 0.23814]
  - - [1, 512, 1, 16]
    - [19, 3.72364]
  - - [1, 512, 1, 32]
    - [20, 7.62047]
  - - [16, 512, 1, 1]
    - [20, 3.56174]
  - - [16, 512, 1, 16]
    - [20, 58.2542]
  - - [16, 512, 1, 32]
    - [20, 116.508]
  - - [32, 512, 1, 1]
    - [47, 6.82667]
  - - [32, 512, 1, 16]
    - [20, 113.976]
  - - [32, 512, 1, 32]
    - [22, 249.661]
  - - [512, 512, 1, 1]
    - [17, 81.92]
  - - [512, 512, 1, 16]
    - [62, 1252.03]
  - - [512, 512, 1, 32]
    - [38, 2431.48]
  - - [1024, 1, 1, 1024]
    - [102, 230.456]
  - - [1024, 16, 1, 1024]
    - [102, 3389.34]
  - - [1024, 32, 1, 1024]
    - [118, 5938.84]
  - - [1, 1, 1, 1024]
    - [102, 0.280548]
  - - [16, 1, 1, 1024]
    - [73, 4.48877]
  - - [32, 1, 1, 1024]
    - [102, 9.10222]
  - - [1024, 1, 1, 1]
    - [23, 0.455111]
  - - [1024, 1, 1, 16]
    - [23, 7.44727]
  - - [1024, 1, 1, 32]
    - [47, 12.6031]
  - - [1, 16, 1, 1024]
    - [71, 4.36907]
  - - [16, 16, 1, 1024]
    - [102, 71.8203]
  - - [32, 16, 1, 1024]
    - [102, 137.971]
  - - [1024, 16, 1, 1]
    - [26, 5.5539]
  - - [1024, 16, 1, 16]
    - [23, 119.156]
  - - [1024, 16, 1, 32]
    - [38, 201.649]
  - - [1, 32, 1, 1024]
    - [102, 8.51117]
  - - [16, 32, 1, 1024]
    - [102, 145.636]
  - - [32, 32, 1, 1024]
    - [102, 291.271]
  - - [1024, 32, 1, 1]
    - [23, 14.5636]
  - - [1024, 32, 1, 16]
    - [23, 227.951]
  - - [1024, 32, 1, 32]
    - [23, 476.625]
  - - [1, 1024, 1, 1024]
    - [118, 233.017]
  - - [16, 1024, 1, 1024]
    - [118, 3856.83]
  - - [32, 1024, 1, 1024]
    - [118, 6100.81]
  - - [1, 1024, 1, 1]
    - [20, 0.426667]
  - - [1, 1024, 1, 16]
    - [19, 7.12348]
  - - [1, 1024, 1, 32]
    - [24, 14.8945]
  - - [16, 1024, 1, 1]
    - [20, 6.68735]
  - - [16, 1024, 1, 16]
    - [20, 104.858]
  - - [16, 1024, 1, 32]
    - [47, 209.715]
  - - [32, 1024, 1, 1]
    - [17, 12.3653]
  - - [32, 1024, 1, 16]
    - [17, 205.603]
  - - [32, 1024, 1, 32]
    - [47, 403.298]
  - - [1024, 1024, 1, 1]
    - [95, 180.789]
  - - [1024, 1024, 1, 16]
    - [109, 2867.9]
  - - [1024, 1024, 1, 32]
    - [95, 5546.19]
  - - [2048, 1, 1, 2048]
    - [115, 349.525]
  - - [2048, 16, 1, 2048]
    - [115, 5347.32]
  - - [2048, 32, 1, 2048]
    - [42, 8209.04]
  - - [1, 1, 1, 2048]
    - [71, 0.481882]
  - - [16, 1, 1, 2048]
    - [82, 7.9922]
  - - [32, 1, 1, 2048]
    - [73, 15.4202]
  - - [2048, 1, 1, 1]
    - [20, 0.731429]
  - - [2048, 1, 1, 16]
    - [23, 13.9438]
  - - [2048, 1, 1, 32]
    - [23, 29.1271]
  - - [1, 16, 1, 2048]
    - [110, 7.53287]
  - - [16, 16, 1, 2048]
    - [71, 121.927]
  - - [32, 16, 1, 2048]
    - [73, 249.661]
  - - [2048, 16, 1, 1]
    - [23, 14.247]
  - - [2048, 16, 1, 16]
    - [115, 201.649]
  - - [2048, 16, 1, 32]
    - [23, 476.625]
  - - [1, 32, 1, 2048]
    - [82, 15.0657]
  - - [16, 32, 1, 2048]
    - [73, 246.724]
  - - [32, 32, 1, 2048]
    - [71, 482.104]
  - - [2048, 32, 1, 1]
    - [22, 25.2062]
  - - [2048, 32, 1, 16]
    - [67, 374.491]
  - - [2048, 32, 1, 32]
    - [22, 822.413]
  - - [1, 2048, 1, 2048]
    - [118, 471.27]
  - - [16, 2048, 1, 2048]
    - [118, 8184.01]
  - - [32, 2048, 1, 2048]
    - [14, 13489.2]
  - - [1, 2048, 1, 1]
    - [24, 0.77283]
